"play_id","half","time_remaining_half","secs_remaining","secs_remaining_absolute","description","home_score","away_score","score_diff","win_prob","home","away","home_time_out_remaining","away_time_out_remaining","home_timeout_ind","away_timeout_ind","home_favored_by","game_id","date"
1,1,"20:00",2400,2400,"PLAY",0,0,0,0.923771240571691,"Nevada","San José St",4,4,0,0,21,400991776,2018-02-21
2,1,"20:00",2400,2400,"Jump Ball won by Nevada",0,0,0,0.923771240571691,"Nevada","San José St",4,4,0,0,21,400991776,2018-02-21
3,1,"19:44",2384,2384,"Kendall Stephens missed Three Point Jumper.",0,0,0,0.920122992799509,"Nevada","San José St",4,4,0,0,21,400991776,2018-02-21
4,1,"19:44",2384,2384,"Jaycee Hillsman Defensive Rebound.",0,0,0,0.920122992799509,"Nevada","San José St",4,4,0,0,21,400991776,2018-02-21
5,1,"19:22",2362,2362,"Ryan Welage made Three Point Jumper. Assisted by Keith Fisher III.",0,3,-3,0.899186461856268,"Nevada","San José St",4,4,0,0,21,400991776,2018-02-21
6,1,"18:57",2337,2337,"Jordan Caroline made Jumper. Assisted by Cody Martin.",2,3,-1,0.9057823983023,"Nevada","San José St",4,4,0,0,21,400991776,2018-02-21
7,1,"18:35",2315,2315,"Oumar Barry made Layup. Assisted by Jaycee Hillsman.",2,5,-3,0.874052855483175,"Nevada","San José St",4,4,0,0,21,400991776,2018-02-21
8,1,"18:22",2302,2302,"Jordan Caroline made Three Point Jumper. Assisted by Cody Martin.",5,5,0,0.904836616355494,"Nevada","San José St",4,4,0,0,21,400991776,2018-02-21
9,1,"18:03",2283,2283,"Keith Fisher III missed Jumper.",5,5,0,0.90868773487614,"Nevada","San José St",4,4,0,0,21,400991776,2018-02-21
10,1,"18:03",2283,2283,"Caleb Martin Defensive Rebound.",5,5,0,0.90868773487614,"Nevada","San José St",4,4,0,0,21,400991776,2018-02-21
11,1,"17:52",2272,2272,"Jordan Caroline missed Three Point Jumper.",5,5,0,0.911319709610826,"Nevada","San José St",4,4,0,0,21,400991776,2018-02-21
12,1,"17:52",2272,2272,"Keith Fisher III Defensive Rebound.",5,5,0,0.911319709610826,"Nevada","San José St",4,4,0,0,21,400991776,2018-02-21
13,1,"17:44",2264,2264,"Oumar Barry made Jumper. Assisted by Keith Fisher III.",5,7,-2,0.894554451798833,"Nevada","San José St",4,4,0,0,21,400991776,2018-02-21
14,1,"17:28",2248,2248,"Hallice Cooke missed Three Point Jumper.",5,7,-2,0.880424666604419,"Nevada","San José St",4,4,0,0,21,400991776,2018-02-21
15,1,"17:28",2248,2248,"Oumar Barry Defensive Rebound.",5,7,-2,0.880424666604419,"Nevada","San José St",4,4,0,0,21,400991776,2018-02-21
16,1,"17:14",2234,2234,"Oumar Barry Turnover.",5,7,-2,0.888965780273024,"Nevada","San José St",4,4,0,0,21,400991776,2018-02-21
17,1,"17:14",2234,2234,"Caleb Martin Steal.",5,7,-2,0.888965780273024,"Nevada","San José St",4,4,0,0,21,400991776,2018-02-21
18,1,"17:00",2220,2220,"Hallice Cooke made Three Point Jumper. Assisted by Caleb Martin.",8,7,1,0.918466988233617,"Nevada","San José St",4,4,0,0,21,400991776,2018-02-21
19,1,"16:43",2203,2203,"Jaycee Hillsman missed Three Point Jumper.",8,7,1,0.915794718507042,"Nevada","San José St",4,4,0,0,21,400991776,2018-02-21
20,1,"16:43",2203,2203,"Jordan Caroline Defensive Rebound.",8,7,1,0.915794718507042,"Nevada","San José St",4,4,0,0,21,400991776,2018-02-21
21,1,"16:22",2182,2182,"Hallice Cooke made Three Point Jumper. Assisted by Jordan Caroline.",11,7,4,0.937438760130455,"Nevada","San José St",4,4,0,0,21,400991776,2018-02-21
22,1,"15:54",2154,2154,"Keith Fisher III made Jumper. Assisted by Jalen James.",11,9,2,0.922501828433898,"Nevada","San José St",4,4,0,0,21,400991776,2018-02-21
23,1,"15:42",2142,2142,"Kendall Stephens made Three Point Jumper. Assisted by Hallice Cooke.",14,9,5,0.94289407345271,"Nevada","San José St",4,4,0,0,21,400991776,2018-02-21
24,1,"15:17",2117,2117,"Ryan Welage missed Jumper.",14,9,5,0.949086046113799,"Nevada","San José St",4,4,0,0,21,400991776,2018-02-21
25,1,"15:17",2117,2117,"Jordan Caroline Defensive Rebound.",14,9,5,0.949086046113799,"Nevada","San José St",4,4,0,0,21,400991776,2018-02-21
26,1,"15:10",2110,2110,"Hallice Cooke made Three Point Jumper. Assisted by Cody Martin.",17,9,8,0.96369508582753,"Nevada","San José St",4,4,0,0,21,400991776,2018-02-21
27,1,"15:08",2108,2108,"San José State  Timeout",17,9,8,0.956996299649251,"Nevada","San José St",4,3,0,1,21,400991776,2018-02-21
28,1,"14:58",2098,2098,"Keith Fisher III missed Jumper.",17,9,8,0.959120013501506,"Nevada","San José St",4,3,0,1,21,400991776,2018-02-21
29,1,"14:58",2098,2098,"San José State Offensive Rebound.",17,9,8,0.959120013501506,"Nevada","San José St",4,3,0,1,21,400991776,2018-02-21
30,1,"14:58",2098,2098,"Foul on Cody Martin.",17,9,8,0.959120013501506,"Nevada","San José St",4,3,0,1,21,400991776,2018-02-21
31,1,"14:53",2093,2093,"Jalen James made Three Point Jumper. Assisted by Jaycee Hillsman.",17,12,5,0.941763761922024,"Nevada","San José St",4,3,0,1,21,400991776,2018-02-21
32,1,"14:42",2082,2082,"Cody Martin Turnover.",17,12,5,0.939412075417698,"Nevada","San José St",4,3,0,1,21,400991776,2018-02-21
33,1,"14:42",2082,2082,"Keith Fisher III Steal.",17,12,5,0.939412075417698,"Nevada","San José St",4,3,0,1,21,400991776,2018-02-21
34,1,"14:30",2070,2070,"Jaycee Hillsman missed Jumper.",17,12,5,0.94274275262972,"Nevada","San José St",4,3,0,1,21,400991776,2018-02-21
35,1,"14:30",2070,2070,"Nevada Defensive Rebound.",17,12,5,0.94274275262972,"Nevada","San José St",4,3,0,1,21,400991776,2018-02-21
36,1,"14:07",2047,2047,"Caleb Martin missed Three Point Jumper.",17,12,5,0.936941171036679,"Nevada","San José St",4,3,0,0,21,400991776,2018-02-21
37,1,"14:07",2047,2047,"Jalen James Defensive Rebound.",17,12,5,0.936941171036679,"Nevada","San José St",4,3,0,0,21,400991776,2018-02-21
38,1,"13:49",2029,2029,"Keith Fisher III missed Jumper.",17,12,5,0.94647134873592,"Nevada","San José St",4,3,0,0,21,400991776,2018-02-21
39,1,"13:49",2029,2029,"Kendall Stephens Defensive Rebound.",17,12,5,0.94647134873592,"Nevada","San José St",4,3,0,0,21,400991776,2018-02-21
40,1,"13:33",2013,2013,"Hallice Cooke made Three Point Jumper. Assisted by Kendall Stephens.",20,12,8,0.958661757087764,"Nevada","San José St",4,3,0,0,21,400991776,2018-02-21
41,1,"13:18",1998,1998,"Ashtin Chastain missed Layup.",20,12,8,0.962858233870983,"Nevada","San José St",4,3,0,0,21,400991776,2018-02-21
42,1,"13:18",1998,1998,"Kendall Stephens Block.",20,12,8,0.962858233870983,"Nevada","San José St",4,3,0,0,21,400991776,2018-02-21
43,1,"13:18",1998,1998,"San José State Offensive Rebound.",20,12,8,0.962858233870983,"Nevada","San José St",4,3,0,0,21,400991776,2018-02-21
44,1,"13:04",1984,1984,"Ryan Welage made Jumper.",20,14,6,0.943699570140622,"Nevada","San José St",4,3,0,0,21,400991776,2018-02-21
45,1,"12:48",1968,1968,"Jordan Caroline missed Dunk.",20,14,6,0.94450752523249,"Nevada","San José St",4,3,0,0,21,400991776,2018-02-21
46,1,"12:48",1968,1968,"Ashtin Chastain Defensive Rebound.",20,14,6,0.94450752523249,"Nevada","San José St",4,3,0,0,21,400991776,2018-02-21
47,1,"12:33",1953,1953,"Keith Fisher III missed Jumper.",20,14,6,0.947584935363398,"Nevada","San José St",4,3,0,0,21,400991776,2018-02-21
48,1,"12:33",1953,1953,"Jordan Caroline Defensive Rebound.",20,14,6,0.947584935363398,"Nevada","San José St",4,3,0,0,21,400991776,2018-02-21
49,1,"12:33",1953,1953,"Foul on Keith Fisher III.",20,14,6,0.947584935363398,"Nevada","San José St",4,3,0,0,21,400991776,2018-02-21
50,1,"12:16",1936,1936,"Kendall Stephens made Three Point Jumper. Assisted by Hallice Cooke.",23,14,9,0.963055390139075,"Nevada","San José St",4,3,0,0,21,400991776,2018-02-21
51,1,"12:01",1921,1921,"Ryan Welage missed Three Point Jumper.",23,14,9,0.96681217823035,"Nevada","San José St",4,3,0,0,21,400991776,2018-02-21
52,1,"12:01",1921,1921,"Josh Hall Defensive Rebound.",23,14,9,0.96681217823035,"Nevada","San José St",4,3,0,0,21,400991776,2018-02-21
53,1,"11:51",1911,1911,"Foul on Ashtin Chastain.",23,14,9,0.966962542561355,"Nevada","San José St",4,3,0,0,21,400991776,2018-02-21
54,1,"11:51",1911,1911,"Official TV Timeout",23,14,9,0.966962542561355,"Nevada","San José St",4,3,0,0,21,400991776,2018-02-21
55,1,"11:51",1911,1911,"Jordan Caroline made Free Throw.",24,14,10,0.970842723812571,"Nevada","San José St",4,3,0,0,21,400991776,2018-02-21
56,1,"11:51",1911,1911,"Jordan Caroline made Free Throw.",25,14,11,0.974279307669025,"Nevada","San José St",4,3,0,0,21,400991776,2018-02-21
57,1,"11:44",1904,1904,"Jalen James Turnover.",25,14,11,0.969943908518839,"Nevada","San José St",4,3,0,0,21,400991776,2018-02-21
58,1,"11:44",1904,1904,"Kendall Stephens Steal.",25,14,11,0.969943908518839,"Nevada","San José St",4,3,0,0,21,400991776,2018-02-21
59,1,"11:42",1902,1902,"Kendall Stephens Turnover.",25,14,11,0.969943908518839,"Nevada","San José St",4,3,0,0,21,400991776,2018-02-21
60,1,"11:15",1875,1875,"Jaycee Hillsman made Three Point Jumper. Assisted by Ryan Welage.",25,17,8,0.957617535008843,"Nevada","San José St",4,3,0,0,21,400991776,2018-02-21
61,1,"10:55",1855,1855,"Kendall Stephens missed Three Point Jumper.",25,17,8,0.958593725931928,"Nevada","San José St",4,3,0,0,21,400991776,2018-02-21
62,1,"10:55",1855,1855,"Elijah Foster Offensive Rebound.",25,17,8,0.958593725931928,"Nevada","San José St",4,3,0,0,21,400991776,2018-02-21
63,1,"10:46",1846,1846,"Elijah Foster made Layup.",27,17,10,0.965722342247351,"Nevada","San José St",4,3,0,0,21,400991776,2018-02-21
64,1,"10:36",1836,1836,"Jalen James missed Three Point Jumper.",27,17,10,0.965990071018877,"Nevada","San José St",4,3,0,0,21,400991776,2018-02-21
65,1,"10:36",1836,1836,"Keith Fisher III Offensive Rebound.",27,17,10,0.965990071018877,"Nevada","San José St",4,3,0,0,21,400991776,2018-02-21
66,1,"10:29",1829,1829,"Ryan Welage made Three Point Jumper. Assisted by Keith Fisher III.",27,20,7,0.956056750514463,"Nevada","San José St",4,3,0,0,21,400991776,2018-02-21
67,1,"10:08",1808,1808,"Elijah Foster missed Jumper.",27,20,7,0.953154980544618,"Nevada","San José St",4,3,0,0,21,400991776,2018-02-21
68,1,"10:08",1808,1808,"Jalen James Defensive Rebound.",27,20,7,0.953154980544618,"Nevada","San José St",4,3,0,0,21,400991776,2018-02-21
69,1,"9:55",1795,1795,"Jalen James missed Three Point Jumper.",27,20,7,0.949523000555332,"Nevada","San José St",4,3,0,0,21,400991776,2018-02-21
70,1,"9:55",1795,1795,"Cody Martin Defensive Rebound.",27,20,7,0.949523000555332,"Nevada","San José St",4,3,0,0,21,400991776,2018-02-21
71,1,"9:46",1786,1786,"Cody Martin missed Jumper.",27,20,7,0.948385273157851,"Nevada","San José St",4,3,0,0,21,400991776,2018-02-21
72,1,"9:46",1786,1786,"Ashtin Chastain Defensive Rebound.",27,20,7,0.948385273157851,"Nevada","San José St",4,3,0,0,21,400991776,2018-02-21
73,1,"9:41",1781,1781,"Jalen James Turnover.",27,20,7,0.948385273157851,"Nevada","San José St",4,3,0,0,21,400991776,2018-02-21
74,1,"9:16",1756,1756,"Caleb Martin missed Jumper.",27,20,7,0.956105172240248,"Nevada","San José St",4,3,0,0,21,400991776,2018-02-21
75,1,"9:16",1756,1756,"Ryan Welage Defensive Rebound.",27,20,7,0.956105172240248,"Nevada","San José St",4,3,0,0,21,400991776,2018-02-21
76,1,"8:47",1727,1727,"Jaycee Hillsman missed Three Point Jumper.",27,20,7,0.946982127384377,"Nevada","San José St",4,3,0,0,21,400991776,2018-02-21
77,1,"8:47",1727,1727,"Elijah Foster Defensive Rebound.",27,20,7,0.946982127384377,"Nevada","San José St",4,3,0,0,21,400991776,2018-02-21
78,1,"8:41",1721,1721,"Hallice Cooke missed Three Point Jumper.",27,20,7,0.946982127384377,"Nevada","San José St",4,3,0,0,21,400991776,2018-02-21
79,1,"8:41",1721,1721,"Josh Hall Offensive Rebound.",27,20,7,0.946982127384377,"Nevada","San José St",4,3,0,0,21,400991776,2018-02-21
80,1,"8:41",1721,1721,"Josh Hall made Two Point Tip Shot.",29,20,9,0.959056517490763,"Nevada","San José St",4,3,0,0,21,400991776,2018-02-21
81,1,"8:13",1693,1693,"Ryan Welage made Jumper.",29,22,7,0.953230585254997,"Nevada","San José St",4,3,0,0,21,400991776,2018-02-21
82,1,"8:08",1688,1688,"Foul on Keith Fisher III.",29,22,7,0.959283666824787,"Nevada","San José St",4,3,0,0,21,400991776,2018-02-21
83,1,"8:08",1688,1688,"Caleb Martin made Free Throw.",30,22,8,0.964597006000695,"Nevada","San José St",4,3,0,0,21,400991776,2018-02-21
84,1,"8:08",1688,1688,"Caleb Martin missed Free Throw.",30,22,8,0.964597006000695,"Nevada","San José St",4,3,0,0,21,400991776,2018-02-21
85,1,"8:08",1688,1688,"Caleb Simmons Defensive Rebound.",30,22,8,0.964597006000695,"Nevada","San José St",4,3,0,0,21,400991776,2018-02-21
86,1,"7:38",1658,1658,"Ryan Welage missed Three Point Jumper.",30,22,8,0.955071999943059,"Nevada","San José St",4,3,0,0,21,400991776,2018-02-21
87,1,"7:38",1658,1658,"Ryan Welage Offensive Rebound.",30,22,8,0.955071999943059,"Nevada","San José St",4,3,0,0,21,400991776,2018-02-21
88,1,"7:31",1651,1651,"Ryan Welage missed Three Point Jumper.",30,22,8,0.955071999943059,"Nevada","San José St",4,3,0,0,21,400991776,2018-02-21
89,1,"7:31",1651,1651,"Josh Hall Defensive Rebound.",30,22,8,0.955071999943059,"Nevada","San José St",4,3,0,0,21,400991776,2018-02-21
90,1,"7:30",1650,1650,"Foul on Caleb Simmons.",30,22,8,0.955071999943059,"Nevada","San José St",4,3,0,0,21,400991776,2018-02-21
91,1,"7:30",1650,1650,"Official TV Timeout",30,22,8,0.955071999943059,"Nevada","San José St",4,3,0,0,21,400991776,2018-02-21
92,1,"7:30",1650,1650,"Jordan Caroline made Free Throw.",31,22,9,0.960429305738766,"Nevada","San José St",4,3,0,0,21,400991776,2018-02-21
93,1,"7:30",1650,1650,"Jordan Caroline made Free Throw.",32,22,10,0.965171091434591,"Nevada","San José St",4,3,0,0,21,400991776,2018-02-21
94,1,"7:21",1641,1641,"Oumar Barry made Layup. Assisted by Caleb Simmons.",32,24,8,0.95979546666269,"Nevada","San José St",4,3,0,0,21,400991776,2018-02-21
95,1,"7:21",1641,1641,"Foul on Caleb Martin.",32,24,8,0.95979546666269,"Nevada","San José St",4,3,0,0,21,400991776,2018-02-21
96,1,"7:21",1641,1641,"Oumar Barry missed Free Throw.",32,24,8,0.95979546666269,"Nevada","San José St",4,3,0,0,21,400991776,2018-02-21
97,1,"7:21",1641,1641,"Jordan Caroline Defensive Rebound.",32,24,8,0.95979546666269,"Nevada","San José St",4,3,0,0,21,400991776,2018-02-21
98,1,"7:01",1621,1621,"Caleb Martin missed Three Point Jumper.",32,24,8,0.958850269011249,"Nevada","San José St",4,3,0,0,21,400991776,2018-02-21
99,1,"7:01",1621,1621,"Noah Baumann Defensive Rebound.",32,24,8,0.958850269011249,"Nevada","San José St",4,3,0,0,21,400991776,2018-02-21
100,1,"6:59",1619,1619,"Foul on Cody Martin.",32,24,8,0.953671548914157,"Nevada","San José St",4,3,0,0,21,400991776,2018-02-21
101,1,"6:50",1610,1610,"Jaycee Hillsman missed Jumper.",32,24,8,0.953671548914157,"Nevada","San José St",4,3,0,0,21,400991776,2018-02-21
102,1,"6:50",1610,1610,"Nevada Defensive Rebound.",32,24,8,0.953671548914157,"Nevada","San José St",4,3,0,0,21,400991776,2018-02-21
103,1,"6:38",1598,1598,"Kendall Stephens missed Three Point Jumper.",32,24,8,0.954710126030453,"Nevada","San José St",4,3,0,0,21,400991776,2018-02-21
104,1,"6:38",1598,1598,"Caleb Simmons Defensive Rebound.",32,24,8,0.954710126030453,"Nevada","San José St",4,3,0,0,21,400991776,2018-02-21
105,1,"6:11",1571,1571,"Noah Baumann missed Jumper.",32,24,8,0.963043032271413,"Nevada","San José St",4,3,0,0,21,400991776,2018-02-21
106,1,"6:11",1571,1571,"Kendall Stephens Block.",32,24,8,0.963043032271413,"Nevada","San José St",4,3,0,0,21,400991776,2018-02-21
107,1,"6:11",1571,1571,"Kendall Stephens Defensive Rebound.",32,24,8,0.963043032271413,"Nevada","San José St",4,3,0,0,21,400991776,2018-02-21
108,1,"6:09",1569,1569,"Kendall Stephens made Layup.",34,24,10,0.966587066298382,"Nevada","San José St",4,3,0,0,21,400991776,2018-02-21
109,1,"6:09",1569,1569,"Foul on Ryan Welage.",34,24,10,0.966587066298382,"Nevada","San José St",4,3,0,0,21,400991776,2018-02-21
110,1,"6:09",1569,1569,"Kendall Stephens made Free Throw.",35,24,11,0.970891500798615,"Nevada","San José St",4,3,0,0,21,400991776,2018-02-21
111,1,"5:32",1532,1532,"San José State  Turnover.",35,24,11,0.972256135327012,"Nevada","San José St",4,3,0,0,21,400991776,2018-02-21
112,1,"5:15",1515,1515,"Kendall Stephens missed Three Point Jumper.",35,24,11,0.974874799839053,"Nevada","San José St",4,3,0,0,21,400991776,2018-02-21
113,1,"5:15",1515,1515,"Jaycee Hillsman Defensive Rebound.",35,24,11,0.974874799839053,"Nevada","San José St",4,3,0,0,21,400991776,2018-02-21
114,1,"5:05",1505,1505,"Foul on Caleb Martin.",35,24,11,0.971475111867679,"Nevada","San José St",4,3,0,0,21,400991776,2018-02-21
115,1,"4:37",1477,1477,"Isaiah Nichols Turnover.",35,24,11,0.977892819852219,"Nevada","San José St",4,3,0,0,21,400991776,2018-02-21
116,1,"4:27",1467,1467,"Foul on Jaycee Hillsman.",35,24,11,0.965641663614302,"Nevada","San José St",4,3,0,0,21,400991776,2018-02-21
117,1,"4:24",1464,1464,"Josh Hall made Jumper. Assisted by Hallice Cooke.",37,24,13,0.97378306704735,"Nevada","San José St",4,3,0,0,21,400991776,2018-02-21
118,1,"4:06",1446,1446,"Isaiah Nichols missed Three Point Jumper.",37,24,13,0.981576616681677,"Nevada","San José St",4,3,0,0,21,400991776,2018-02-21
119,1,"4:06",1446,1446,"Kendall Stephens Defensive Rebound.",37,24,13,0.981576616681677,"Nevada","San José St",4,3,0,0,21,400991776,2018-02-21
120,1,"3:53",1433,1433,"Elijah Foster missed Layup.",37,24,13,0.978292047027902,"Nevada","San José St",4,3,0,0,21,400991776,2018-02-21
121,1,"3:53",1433,1433,"Jordan Caroline Offensive Rebound.",37,24,13,0.978292047027902,"Nevada","San José St",4,3,0,0,21,400991776,2018-02-21
122,1,"3:46",1426,1426,"Jordan Caroline Turnover.",37,24,13,0.975817736265221,"Nevada","San José St",4,3,0,0,21,400991776,2018-02-21
123,1,"3:46",1426,1426,"Jaycee Hillsman Steal.",37,24,13,0.975817736265221,"Nevada","San José St",4,3,0,0,21,400991776,2018-02-21
124,1,"3:25",1405,1405,"Isaiah Nichols missed Jumper.",37,24,13,0.982179121886056,"Nevada","San José St",4,3,0,0,21,400991776,2018-02-21
125,1,"3:25",1405,1405,"Josh Hall Block.",37,24,13,0.982179121886056,"Nevada","San José St",4,3,0,0,21,400991776,2018-02-21
126,1,"3:25",1405,1405,"Isaiah Nichols Offensive Rebound.",37,24,13,0.982179121886056,"Nevada","San José St",4,3,0,0,21,400991776,2018-02-21
127,1,"3:25",1405,1405,"Isaiah Nichols missed Jumper.",37,24,13,0.982179121886056,"Nevada","San José St",4,3,0,0,21,400991776,2018-02-21
128,1,"3:25",1405,1405,"Elijah Foster Block.",37,24,13,0.982179121886056,"Nevada","San José St",4,3,0,0,21,400991776,2018-02-21
129,1,"3:25",1405,1405,"Nevada Defensive Rebound.",37,24,13,0.982179121886056,"Nevada","San José St",4,3,0,0,21,400991776,2018-02-21
130,1,"3:25",1405,1405,"Official TV Timeout",37,24,13,0.982179121886056,"Nevada","San José St",4,3,0,0,21,400991776,2018-02-21
131,1,"2:59",1379,1379,"Kendall Stephens missed Three Point Jumper.",37,24,13,0.976936896433108,"Nevada","San José St",4,3,0,0,21,400991776,2018-02-21
132,1,"2:59",1379,1379,"Ashtin Chastain Defensive Rebound.",37,24,13,0.976936896433108,"Nevada","San José St",4,3,0,0,21,400991776,2018-02-21
133,1,"2:43",1363,1363,"Jaycee Hillsman missed Three Point Jumper.",37,24,13,0.979629920350907,"Nevada","San José St",4,3,0,0,21,400991776,2018-02-21
134,1,"2:43",1363,1363,"Josh Hall Defensive Rebound.",37,24,13,0.979629920350907,"Nevada","San José St",4,3,0,0,21,400991776,2018-02-21
135,1,"2:35",1355,1355,"Hallice Cooke Turnover.",37,24,13,0.980721136647279,"Nevada","San José St",4,3,0,0,21,400991776,2018-02-21
136,1,"2:35",1355,1355,"Oumar Barry Steal.",37,24,13,0.980721136647279,"Nevada","San José St",4,3,0,0,21,400991776,2018-02-21
137,1,"2:16",1336,1336,"Ashtin Chastain made Layup. Assisted by Jalen James.",37,26,11,0.970494947946887,"Nevada","San José St",4,3,0,0,21,400991776,2018-02-21
138,1,"1:58",1318,1318,"Hallice Cooke missed Three Point Jumper.",37,26,11,0.973640370180279,"Nevada","San José St",4,3,0,0,21,400991776,2018-02-21
139,1,"1:58",1318,1318,"Ashtin Chastain Defensive Rebound.",37,26,11,0.973640370180279,"Nevada","San José St",4,3,0,0,21,400991776,2018-02-21
140,1,"1:34",1294,1294,"Foul on Hallice Cooke.",37,26,11,0.974097120489252,"Nevada","San José St",4,3,0,0,21,400991776,2018-02-21
141,1,"1:19",1279,1279,"Oumar Barry Turnover.",37,26,11,0.968997884437354,"Nevada","San José St",4,3,0,0,21,400991776,2018-02-21
142,1,"1:19",1279,1279,"Elijah Foster Steal.",37,26,11,0.968997884437354,"Nevada","San José St",4,3,0,0,21,400991776,2018-02-21
143,1,"0:55",1255,1255,"Kendall Stephens made Three Point Jumper. Assisted by Hallice Cooke.",40,26,14,0.978887582270385,"Nevada","San José St",4,3,0,0,21,400991776,2018-02-21
144,1,"0:24",1224,1224,"Jalen James made Three Point Jumper.",40,29,11,0.975067766900162,"Nevada","San José St",4,3,0,0,21,400991776,2018-02-21
145,1,"0:04",1204,1204,"Hallice Cooke missed Three Point Jumper.",40,29,11,0.972242263273741,"Nevada","San José St",4,3,0,0,21,400991776,2018-02-21
146,1,"0:04",1204,1204,"Elijah Foster Offensive Rebound.",40,29,11,0.972242263273741,"Nevada","San José St",4,3,0,0,21,400991776,2018-02-21
147,1,"0:01",1201,1201,"Elijah Foster made Jumper.",42,29,13,0.979659509206007,"Nevada","San José St",4,3,0,0,21,400991776,2018-02-21
148,1,"0:00",1200,1200,"End of 1st half",42,29,13,0.979659509206007,"Nevada","San José St",4,3,0,0,21,400991776,2018-02-21
149,2,"20:00",1200,1200,"PLAY",42,29,13,0.979659509206007,"Nevada","San José St",4,4,0,0,21,400991776,2018-02-21
150,2,"20:00",1200,1200,"Jump Ball won by San José State",42,29,13,0.979659509206007,"Nevada","San José St",4,4,0,0,21,400991776,2018-02-21
151,2,"19:46",1186,1186,"Jalen James Turnover.",42,29,13,0.981396450614104,"Nevada","San José St",4,4,0,0,21,400991776,2018-02-21
152,2,"19:33",1173,1173,"Foul on Keith Fisher III.",42,29,13,0.979055661955932,"Nevada","San José St",4,4,0,0,21,400991776,2018-02-21
153,2,"19:24",1164,1164,"Jordan Caroline missed Jumper.",42,29,13,0.980799984711759,"Nevada","San José St",4,4,0,0,21,400991776,2018-02-21
154,2,"19:24",1164,1164,"Cody Martin Offensive Rebound.",42,29,13,0.980799984711759,"Nevada","San José St",4,4,0,0,21,400991776,2018-02-21
155,2,"19:18",1158,1158,"Kendall Stephens made Three Point Jumper. Assisted by Cody Martin.",45,29,16,0.986637589934457,"Nevada","San José St",4,4,0,0,21,400991776,2018-02-21
156,2,"18:54",1134,1134,"Foul on Caleb Martin.",45,29,16,0.98819135489596,"Nevada","San José St",4,4,0,0,21,400991776,2018-02-21
157,2,"18:47",1127,1127,"Ryan Welage made Three Point Jumper. Assisted by Jalen James.",45,32,13,0.984611717832756,"Nevada","San José St",4,4,0,0,21,400991776,2018-02-21
158,2,"18:28",1108,1108,"Jordan Caroline made Dunk.",47,32,15,0.98604572653541,"Nevada","San José St",4,4,0,0,21,400991776,2018-02-21
159,2,"18:25",1105,1105,"San José State  Timeout",47,32,15,0.98604572653541,"Nevada","San José St",4,3,0,1,21,400991776,2018-02-21
160,2,"17:58",1078,1078,"Jaycee Hillsman missed Three Point Jumper.",47,32,15,0.985207083954284,"Nevada","San José St",4,3,0,1,21,400991776,2018-02-21
161,2,"17:58",1078,1078,"Josh Hall Defensive Rebound.",47,32,15,0.985207083954284,"Nevada","San José St",4,3,0,1,21,400991776,2018-02-21
162,2,"17:43",1063,1063,"Jordan Caroline Turnover.",47,32,15,0.986083380346318,"Nevada","San José St",4,3,0,1,21,400991776,2018-02-21
163,2,"17:43",1063,1063,"Ryan Welage Steal.",47,32,15,0.986083380346318,"Nevada","San José St",4,3,0,1,21,400991776,2018-02-21
164,2,"17:37",1057,1057,"Ryan Welage made Jumper.",47,34,13,0.98317527375782,"Nevada","San José St",4,3,0,1,21,400991776,2018-02-21
165,2,"17:11",1031,1031,"Kendall Stephens missed Three Point Jumper.",47,34,13,0.980857128062342,"Nevada","San José St",4,3,0,0,21,400991776,2018-02-21
166,2,"17:11",1031,1031,"Ryan Welage Defensive Rebound.",47,34,13,0.980857128062342,"Nevada","San José St",4,3,0,0,21,400991776,2018-02-21
167,2,"16:54",1014,1014,"Jalen James made Three Point Jumper. Assisted by Oumar Barry.",47,37,10,0.966637593497637,"Nevada","San José St",4,3,0,0,21,400991776,2018-02-21
168,2,"16:42",1002,1002,"Hallice Cooke made Three Point Jumper. Assisted by Cody Martin.",50,37,13,0.981857457659941,"Nevada","San José St",4,3,0,0,21,400991776,2018-02-21
169,2,"16:22",982,982,"Keith Fisher III missed Layup.",50,37,13,0.984997810583728,"Nevada","San José St",4,3,0,0,21,400991776,2018-02-21
170,2,"16:22",982,982,"Cody Martin Block.",50,37,13,0.984997810583728,"Nevada","San José St",4,3,0,0,21,400991776,2018-02-21
171,2,"16:22",982,982,"Keith Fisher III Offensive Rebound.",50,37,13,0.984997810583728,"Nevada","San José St",4,3,0,0,21,400991776,2018-02-21
172,2,"16:11",971,971,"Keith Fisher III made Layup.",50,39,11,0.975728506752943,"Nevada","San José St",4,3,0,0,21,400991776,2018-02-21
173,2,"16:03",963,963,"Jordan Caroline missed Dunk.",50,39,11,0.972525476945818,"Nevada","San José St",4,3,0,0,21,400991776,2018-02-21
174,2,"16:03",963,963,"Oumar Barry Block.",50,39,11,0.972525476945818,"Nevada","San José St",4,3,0,0,21,400991776,2018-02-21
175,2,"16:03",963,963,"Oumar Barry Defensive Rebound.",50,39,11,0.972525476945818,"Nevada","San José St",4,3,0,0,21,400991776,2018-02-21
176,2,"15:37",937,937,"Oumar Barry missed Three Point Jumper.",50,39,11,0.975788587666141,"Nevada","San José St",4,3,0,0,21,400991776,2018-02-21
177,2,"15:37",937,937,"Jaycee Hillsman Offensive Rebound.",50,39,11,0.975788587666141,"Nevada","San José St",4,3,0,0,21,400991776,2018-02-21
178,2,"15:30",930,930,"Jaycee Hillsman missed Jumper.",50,39,11,0.975788587666141,"Nevada","San José St",4,3,0,0,21,400991776,2018-02-21
179,2,"15:30",930,930,"Cody Martin Block.",50,39,11,0.975788587666141,"Nevada","San José St",4,3,0,0,21,400991776,2018-02-21
180,2,"15:30",930,930,"Jordan Caroline Defensive Rebound.",50,39,11,0.975788587666141,"Nevada","San José St",4,3,0,0,21,400991776,2018-02-21
181,2,"15:23",923,923,"Kendall Stephens made Three Point Jumper. Assisted by Josh Hall.",53,39,14,0.985159124340098,"Nevada","San José St",4,3,0,0,21,400991776,2018-02-21
182,2,"15:07",907,907,"Ryan Welage missed Jumper.",53,39,14,0.9856939613194,"Nevada","San José St",4,3,0,0,21,400991776,2018-02-21
