"play_id","half","time_remaining_half","secs_remaining","secs_remaining_absolute","description","home_score","away_score","score_diff","win_prob","home","away","home_time_out_remaining","away_time_out_remaining","home_timeout_ind","away_timeout_ind","home_favored_by","game_id","date"
1,1,"20:00",2400,2400,"PLAY",0,0,0,0.521616291686997,"Army","Colgate",6,6,0,0,0.2,400991986,2018-01-24
2,1,"19:47",2387,2387,"Jordan Burns missed Three Point Jumper.",0,0,0,0.522975754516008,"Army","Colgate",6,6,0,0,0.2,400991986,2018-01-24
3,1,"19:47",2387,2387,"Dana Batt Offensive Rebound.",0,0,0,0.522975754516008,"Army","Colgate",6,6,0,0,0.2,400991986,2018-01-24
4,1,"19:40",2380,2380,"Dana Batt made Jumper.",0,2,-2,0.506798291990574,"Army","Colgate",6,6,0,0,0.2,400991986,2018-01-24
5,1,"19:15",2355,2355,"Luke Morrison made Three Point Jumper. Assisted by Thomas Funk.",3,2,1,0.562206581636789,"Army","Colgate",6,6,0,0,0.2,400991986,2018-01-24
6,1,"18:46",2326,2326,"Will Rayman missed Three Point Jumper.",3,2,1,0.568126742623815,"Army","Colgate",6,6,0,0,0.2,400991986,2018-01-24
7,1,"18:46",2326,2326,"Jordan Fox Defensive Rebound.",3,2,1,0.568126742623815,"Army","Colgate",6,6,0,0,0.2,400991986,2018-01-24
8,1,"18:27",2307,2307,"Jacob Kessler made Three Point Jumper. Assisted by Thomas Funk.",6,2,4,0.616715029340619,"Army","Colgate",6,6,0,0,0.2,400991986,2018-01-24
9,1,"17:52",2272,2272,"Jordan Burns Turnover.",6,2,4,0.63162321267996,"Army","Colgate",6,6,0,0,0.2,400991986,2018-01-24
10,1,"17:45",2265,2265,"Jordan Fox made Three Point Jumper. Assisted by Thomas Funk.",9,2,7,0.72835427192015,"Army","Colgate",6,6,0,0,0.2,400991986,2018-01-24
11,1,"17:30",2250,2250,"Will Rayman missed Three Point Jumper.",9,2,7,0.690307700783709,"Army","Colgate",6,6,0,0,0.2,400991986,2018-01-24
12,1,"17:30",2250,2250,"Matthew Wilson Defensive Rebound.",9,2,7,0.690307700783709,"Army","Colgate",6,6,0,0,0.2,400991986,2018-01-24
13,1,"17:15",2235,2235,"Thomas Funk made Layup.",11,2,9,0.753911124443158,"Army","Colgate",6,6,0,0,0.2,400991986,2018-01-24
14,1,"16:59",2219,2219,"Will Rayman missed Jumper.",11,2,9,0.790557464582246,"Army","Colgate",6,6,0,0,0.2,400991986,2018-01-24
15,1,"16:59",2219,2219,"Jordan Fox Defensive Rebound.",11,2,9,0.790557464582246,"Army","Colgate",6,6,0,0,0.2,400991986,2018-01-24
16,1,"16:52",2212,2212,"Jacob Kessler made Three Point Jumper. Assisted by Jordan Fox.",14,2,12,0.848245885733429,"Army","Colgate",6,6,0,0,0.2,400991986,2018-01-24
17,1,"16:48",2208,2208,"Colgate  Timeout",14,2,12,0.814216600534378,"Army","Colgate",5,6,1,0,0.2,400991986,2018-01-24
18,1,"16:32",2192,2192,"Jordan Burns Turnover.",14,2,12,0.825486677803269,"Army","Colgate",5,6,1,0,0.2,400991986,2018-01-24
19,1,"16:31",2191,2191,"Jordan Fox Steal.",14,2,12,0.825486677803269,"Army","Colgate",5,6,1,0,0.2,400991986,2018-01-24
20,1,"16:27",2187,2187,"Jordan Fox Turnover.",14,2,12,0.80461710198607,"Army","Colgate",5,6,1,0,0.2,400991986,2018-01-24
21,1,"16:27",2187,2187,"Foul on Jordan Fox.",14,2,12,0.80461710198607,"Army","Colgate",5,6,1,0,0.2,400991986,2018-01-24
22,1,"16:17",2177,2177,"Foul on John Emezie.",14,2,12,0.799956520737379,"Army","Colgate",5,6,1,0,0.2,400991986,2018-01-24
23,1,"16:04",2164,2164,"Jordan Burns missed Three Point Jumper.",14,2,12,0.806787786399213,"Army","Colgate",5,6,1,0,0.2,400991986,2018-01-24
24,1,"16:04",2164,2164,"Colgate Offensive Rebound.",14,2,12,0.806787786399213,"Army","Colgate",5,6,1,0,0.2,400991986,2018-01-24
25,1,"15:47",2147,2147,"Jordan Swopshire made Three Point Jumper. Assisted by Jordan Burns.",14,5,9,0.740049775115714,"Army","Colgate",5,6,0,0,0.2,400991986,2018-01-24
26,1,"15:21",2121,2121,"Tucker Blackwell made Layup.",16,5,11,0.791601332642219,"Army","Colgate",5,6,0,0,0.2,400991986,2018-01-24
27,1,"14:52",2092,2092,"Foul on Alex King.",16,5,11,0.810742894521357,"Army","Colgate",5,6,1,0,0.2,400991986,2018-01-24
28,1,"14:52",2092,2092,"Colgate  Timeout",16,5,11,0.810742894521357,"Army","Colgate",4,6,1,0,0.2,400991986,2018-01-24
29,1,"14:51",2091,2091,"Will Rayman made Three Point Jumper. Assisted by Jordan Burns.",16,8,8,0.747007541229275,"Army","Colgate",4,6,1,0,0.2,400991986,2018-01-24
30,1,"14:27",2067,2067,"Matthew Wilson made Layup. Assisted by Alex King.",18,8,10,0.779325544316093,"Army","Colgate",4,6,1,0,0.2,400991986,2018-01-24
31,1,"14:27",2067,2067,"Foul on Sean O'Brien.",18,8,10,0.779325544316093,"Army","Colgate",4,6,1,0,0.2,400991986,2018-01-24
32,1,"14:27",2067,2067,"Matthew Wilson made Free Throw.",19,8,11,0.799338182503588,"Army","Colgate",4,6,1,0,0.2,400991986,2018-01-24
33,1,"14:09",2049,2049,"Will Rayman Turnover.",19,8,11,0.777784170251313,"Army","Colgate",4,6,1,0,0.2,400991986,2018-01-24
34,1,"13:49",2029,2029,"Matthew Wilson missed Jumper.",19,8,11,0.819607938348095,"Army","Colgate",4,6,0,0,0.2,400991986,2018-01-24
35,1,"13:49",2029,2029,"Malcolm Regisford Defensive Rebound.",19,8,11,0.819607938348095,"Army","Colgate",4,6,0,0,0.2,400991986,2018-01-24
36,1,"13:38",2018,2018,"Jordan Robertson made Jumper.",19,10,9,0.761012101727154,"Army","Colgate",4,6,0,0,0.2,400991986,2018-01-24
37,1,"13:29",2009,2009,"Thomas Funk Turnover.",19,10,9,0.744148173620115,"Army","Colgate",4,6,0,0,0.2,400991986,2018-01-24
38,1,"13:10",1990,1990,"Jordan Robertson missed Three Point Jumper.",19,10,9,0.778566089258223,"Army","Colgate",4,6,0,0,0.2,400991986,2018-01-24
39,1,"13:10",1990,1990,"Malcolm Regisford Offensive Rebound.",19,10,9,0.778566089258223,"Army","Colgate",4,6,0,0,0.2,400991986,2018-01-24
40,1,"13:04",1984,1984,"Francisco Amiel made Three Point Jumper. Assisted by Jordan Burns.",19,13,6,0.690416667124159,"Army","Colgate",4,6,0,0,0.2,400991986,2018-01-24
41,1,"12:47",1967,1967,"Matthew Wilson missed Jumper.",19,13,6,0.672861947652026,"Army","Colgate",4,6,0,0,0.2,400991986,2018-01-24
42,1,"12:47",1967,1967,"Jordan Burns Defensive Rebound.",19,13,6,0.672861947652026,"Army","Colgate",4,6,0,0,0.2,400991986,2018-01-24
43,1,"12:41",1961,1961,"Jordan Robertson made Dunk. Assisted by Jordan Burns.",19,15,4,0.624618392819583,"Army","Colgate",4,6,0,0,0.2,400991986,2018-01-24
44,1,"12:29",1949,1949,"Matthew Wilson made Layup.",21,15,6,0.698787831876103,"Army","Colgate",4,6,0,0,0.2,400991986,2018-01-24
45,1,"12:13",1933,1933,"Will Rayman made Three Point Jumper. Assisted by Malcolm Regisford.",21,18,3,0.608355428170846,"Army","Colgate",4,6,0,0,0.2,400991986,2018-01-24
46,1,"12:01",1921,1921,"Tucker Blackwell made Three Point Jumper. Assisted by Thomas Funk.",24,18,6,0.688676897456647,"Army","Colgate",4,6,0,0,0.2,400991986,2018-01-24
47,1,"11:42",1902,1902,"Jordan Burns missed Jumper.",24,18,6,0.68521625393329,"Army","Colgate",4,6,0,0,0.2,400991986,2018-01-24
48,1,"11:42",1902,1902,"Matthew Wilson Defensive Rebound.",24,18,6,0.68521625393329,"Army","Colgate",4,6,0,0,0.2,400991986,2018-01-24
49,1,"11:32",1892,1892,"Foul on Will Rayman.",24,18,6,0.717748501443003,"Army","Colgate",4,6,0,1,0.2,400991986,2018-01-24
50,1,"11:32",1892,1892,"Army  Timeout",24,18,6,0.717748501443003,"Army","Colgate",4,5,0,1,0.2,400991986,2018-01-24
51,1,"11:10",1870,1870,"Jordan Fox missed Three Point Jumper.",24,18,6,0.69540097448243,"Army","Colgate",4,5,0,1,0.2,400991986,2018-01-24
52,1,"11:10",1870,1870,"Jordan Burns Defensive Rebound.",24,18,6,0.69540097448243,"Army","Colgate",4,5,0,1,0.2,400991986,2018-01-24
53,1,"10:57",1857,1857,"Jordan Burns missed Layup.",24,18,6,0.708693547049609,"Army","Colgate",4,5,0,1,0.2,400991986,2018-01-24
54,1,"10:57",1857,1857,"Lonnie Grayson Defensive Rebound.",24,18,6,0.708693547049609,"Army","Colgate",4,5,0,1,0.2,400991986,2018-01-24
55,1,"10:48",1848,1848,"Alex King missed Three Point Jumper.",24,18,6,0.679953667246327,"Army","Colgate",4,5,0,1,0.2,400991986,2018-01-24
56,1,"10:48",1848,1848,"Malcolm Regisford Defensive Rebound.",24,18,6,0.679953667246327,"Army","Colgate",4,5,0,1,0.2,400991986,2018-01-24
57,1,"10:36",1836,1836,"Malcolm Regisford Turnover.",24,18,6,0.705846937528314,"Army","Colgate",4,5,0,1,0.2,400991986,2018-01-24
58,1,"10:36",1836,1836,"Foul on Malcolm Regisford.",24,18,6,0.705846937528314,"Army","Colgate",4,5,0,1,0.2,400991986,2018-01-24
59,1,"10:23",1823,1823,"Thomas Funk made Layup.",26,18,8,0.756156871870108,"Army","Colgate",4,5,0,0,0.2,400991986,2018-01-24
60,1,"10:11",1811,1811,"Colgate  Timeout",26,18,8,0.773224507311691,"Army","Colgate",3,5,1,0,0.2,400991986,2018-01-24
61,1,"9:56",1796,1796,"Will Rayman missed Three Point Jumper.",26,18,8,0.750572834640141,"Army","Colgate",3,5,1,0,0.2,400991986,2018-01-24
62,1,"9:56",1796,1796,"Matthew Wilson Defensive Rebound.",26,18,8,0.750572834640141,"Army","Colgate",3,5,1,0,0.2,400991986,2018-01-24
63,1,"9:48",1788,1788,"Jordan Fox missed Three Point Jumper.",26,18,8,0.755184273421837,"Army","Colgate",3,5,1,0,0.2,400991986,2018-01-24
64,1,"9:48",1788,1788,"Jordan Robertson Defensive Rebound.",26,18,8,0.755184273421837,"Army","Colgate",3,5,1,0,0.2,400991986,2018-01-24
65,1,"9:40",1780,1780,"Jordan Robertson missed Layup.",26,18,8,0.755184273421837,"Army","Colgate",3,5,1,0,0.2,400991986,2018-01-24
66,1,"9:40",1780,1780,"Army Defensive Rebound.",26,18,8,0.755184273421837,"Army","Colgate",3,5,1,0,0.2,400991986,2018-01-24
67,1,"9:18",1758,1758,"Jordan Fox missed Jumper.",26,18,8,0.74839539557531,"Army","Colgate",3,5,1,0,0.2,400991986,2018-01-24
68,1,"9:18",1758,1758,"Malcolm Regisford Defensive Rebound.",26,18,8,0.74839539557531,"Army","Colgate",3,5,1,0,0.2,400991986,2018-01-24
69,1,"9:04",1744,1744,"Foul on Matthew Wilson.",26,18,8,0.761145982809007,"Army","Colgate",3,5,0,0,0.2,400991986,2018-01-24
70,1,"9:04",1744,1744,"Malcolm Regisford made Free Throw.",26,19,7,0.73743169490832,"Army","Colgate",3,5,0,0,0.2,400991986,2018-01-24
71,1,"9:04",1744,1744,"Malcolm Regisford made Free Throw.",26,20,6,0.712253049787974,"Army","Colgate",3,5,0,0,0.2,400991986,2018-01-24
72,1,"8:52",1732,1732,"Jacob Kessler missed Three Point Jumper.",26,20,6,0.712627054626011,"Army","Colgate",3,5,0,0,0.2,400991986,2018-01-24
73,1,"8:52",1732,1732,"Matthew Wilson Offensive Rebound.",26,20,6,0.712627054626011,"Army","Colgate",3,5,0,0,0.2,400991986,2018-01-24
74,1,"8:47",1727,1727,"Jordan Fox missed Three Point Jumper.",26,20,6,0.724149715165333,"Army","Colgate",3,5,0,0,0.2,400991986,2018-01-24
75,1,"8:47",1727,1727,"Colgate Defensive Rebound.",26,20,6,0.724149715165333,"Army","Colgate",3,5,0,0,0.2,400991986,2018-01-24
76,1,"8:23",1703,1703,"Jordan Robertson missed Jumper.",26,20,6,0.692106175304391,"Army","Colgate",3,5,0,0,0.2,400991986,2018-01-24
77,1,"8:23",1703,1703,"Matthew Wilson Defensive Rebound.",26,20,6,0.692106175304391,"Army","Colgate",3,5,0,0,0.2,400991986,2018-01-24
78,1,"8:08",1688,1688,"Alex King Turnover.",26,20,6,0.72219928249097,"Army","Colgate",3,5,0,0,0.2,400991986,2018-01-24
79,1,"8:06",1686,1686,"Jack Ferguson Steal.",26,20,6,0.72219928249097,"Army","Colgate",3,5,0,0,0.2,400991986,2018-01-24
80,1,"8:00",1680,1680,"Jordan Swopshire made Three Point Jumper. Assisted by Francisco Amiel.",26,23,3,0.626990521071044,"Army","Colgate",3,5,0,0,0.2,400991986,2018-01-24
81,1,"7:41",1661,1661,"Matthew Wilson missed Layup.",26,23,3,0.615956862625579,"Army","Colgate",3,5,0,0,0.2,400991986,2018-01-24
82,1,"7:41",1661,1661,"Malcolm Regisford Block.",26,23,3,0.615956862625579,"Army","Colgate",3,5,0,0,0.2,400991986,2018-01-24
83,1,"7:36",1656,1656,"Matthew Wilson Offensive Rebound.",26,23,3,0.626358760039203,"Army","Colgate",3,5,0,0,0.2,400991986,2018-01-24
84,1,"7:33",1653,1653,"Matthew Wilson made Layup.",28,23,5,0.686059166874802,"Army","Colgate",3,5,0,0,0.2,400991986,2018-01-24
85,1,"7:23",1643,1643,"Jack Ferguson missed Three Point Jumper.",28,23,5,0.693004168809775,"Army","Colgate",3,5,0,0,0.2,400991986,2018-01-24
86,1,"7:23",1643,1643,"Jordan Fox Defensive Rebound.",28,23,5,0.693004168809775,"Army","Colgate",3,5,0,0,0.2,400991986,2018-01-24
87,1,"7:17",1637,1637,"Jacob Kessler missed Three Point Jumper.",28,23,5,0.689379160993937,"Army","Colgate",3,5,0,0,0.2,400991986,2018-01-24
88,1,"7:17",1637,1637,"Jordan Robertson Defensive Rebound.",28,23,5,0.689379160993937,"Army","Colgate",3,5,0,0,0.2,400991986,2018-01-24
89,1,"7:04",1624,1624,"Malcolm Regisford made Layup. Assisted by Francisco Amiel.",28,25,3,0.619307257535448,"Army","Colgate",3,5,0,0,0.2,400991986,2018-01-24
90,1,"6:51",1611,1611,"Tucker Blackwell made Three Point Jumper.",31,25,6,0.705041191771212,"Army","Colgate",3,5,0,0,0.2,400991986,2018-01-24
91,1,"6:23",1583,1583,"Jordan Robertson missed Three Point Jumper.",31,25,6,0.698669824906455,"Army","Colgate",3,5,0,0,0.2,400991986,2018-01-24
92,1,"6:23",1583,1583,"Jordan Fox Defensive Rebound.",31,25,6,0.698669824906455,"Army","Colgate",3,5,0,0,0.2,400991986,2018-01-24
93,1,"6:07",1567,1567,"Foul on Jack Ferguson.",31,25,6,0.70824701874456,"Army","Colgate",3,5,0,1,0.2,400991986,2018-01-24
94,1,"6:07",1567,1567,"Army  Timeout",31,25,6,0.70824701874456,"Army","Colgate",3,4,0,1,0.2,400991986,2018-01-24
95,1,"6:07",1567,1567,"Alex King made Free Throw.",32,25,7,0.736768846430458,"Army","Colgate",3,4,0,1,0.2,400991986,2018-01-24
96,1,"6:07",1567,1567,"Alex King missed Free Throw.",32,25,7,0.736768846430458,"Army","Colgate",3,4,0,1,0.2,400991986,2018-01-24
97,1,"6:07",1567,1567,"Will Rayman Defensive Rebound.",32,25,7,0.736768846430458,"Army","Colgate",3,4,0,1,0.2,400991986,2018-01-24
98,1,"5:43",1543,1543,"Dana Batt made Layup. Assisted by Jordan Burns.",32,27,5,0.688247923251698,"Army","Colgate",3,4,0,1,0.2,400991986,2018-01-24
99,1,"5:30",1530,1530,"Lonnie Grayson missed Three Point Jumper.",32,27,5,0.689277761431541,"Army","Colgate",3,4,0,1,0.2,400991986,2018-01-24
100,1,"5:30",1530,1530,"Babacar Thiombane Offensive Rebound.",32,27,5,0.689277761431541,"Army","Colgate",3,4,0,1,0.2,400991986,2018-01-24
101,1,"5:20",1520,1520,"Thomas Funk missed Three Point Jumper.",32,27,5,0.690707647291608,"Army","Colgate",3,4,0,1,0.2,400991986,2018-01-24
102,1,"5:20",1520,1520,"Jordan Swopshire Defensive Rebound.",32,27,5,0.690707647291608,"Army","Colgate",3,4,0,1,0.2,400991986,2018-01-24
103,1,"5:05",1505,1505,"Jordan Burns missed Three Point Jumper.",32,27,5,0.688909371325651,"Army","Colgate",3,4,0,0,0.2,400991986,2018-01-24
104,1,"5:05",1505,1505,"Will Rayman Offensive Rebound.",32,27,5,0.688909371325651,"Army","Colgate",3,4,0,0,0.2,400991986,2018-01-24
105,1,"5:02",1502,1502,"Foul on Lonnie Grayson.",32,27,5,0.688909371325651,"Army","Colgate",3,4,0,0,0.2,400991986,2018-01-24
106,1,"5:02",1502,1502,"Will Rayman missed Free Throw.",32,27,5,0.688909371325651,"Army","Colgate",3,4,0,0,0.2,400991986,2018-01-24
107,1,"5:02",1502,1502,"Colgate Deadball Team Rebound.",32,27,5,0.688909371325651,"Army","Colgate",3,4,0,0,0.2,400991986,2018-01-24
108,1,"5:02",1502,1502,"Will Rayman missed Free Throw.",32,27,5,0.688909371325651,"Army","Colgate",3,4,0,0,0.2,400991986,2018-01-24
109,1,"5:02",1502,1502,"Thomas Funk Defensive Rebound.",32,27,5,0.688909371325651,"Army","Colgate",3,4,0,0,0.2,400991986,2018-01-24
110,1,"4:29",1469,1469,"Army  Turnover.",32,27,5,0.699738409069744,"Army","Colgate",3,4,0,0,0.2,400991986,2018-01-24
111,1,"4:20",1460,1460,"Dana Batt made Layup. Assisted by Jordan Burns.",32,29,3,0.638120898740325,"Army","Colgate",3,4,0,0,0.2,400991986,2018-01-24
112,1,"3:59",1439,1439,"John Emezie made Three Point Jumper. Assisted by Matthew Wilson.",35,29,6,0.738084221675017,"Army","Colgate",3,4,0,0,0.2,400991986,2018-01-24
113,1,"3:46",1426,1426,"Dana Batt made Layup. Assisted by Jordan Burns.",35,31,4,0.653830188713258,"Army","Colgate",3,4,0,0,0.2,400991986,2018-01-24
114,1,"3:32",1412,1412,"Matthew Wilson made Layup. Assisted by Thomas Funk.",37,31,6,0.732215177586223,"Army","Colgate",3,4,0,0,0.2,400991986,2018-01-24
115,1,"3:09",1389,1389,"Foul on Thomas Funk.",37,31,6,0.736788650047769,"Army","Colgate",3,4,1,0,0.2,400991986,2018-01-24
116,1,"3:09",1389,1389,"Colgate  Timeout",37,31,6,0.736788650047769,"Army","Colgate",2,4,1,0,0.2,400991986,2018-01-24
117,1,"2:56",1376,1376,"Sean O'Brien made Three Point Jumper. Assisted by Jordan Burns.",37,34,3,0.613324371794725,"Army","Colgate",2,4,1,0,0.2,400991986,2018-01-24
118,1,"2:47",1367,1367,"Luke Morrison missed Three Point Jumper.",37,34,3,0.634753568075357,"Army","Colgate",2,4,1,0,0.2,400991986,2018-01-24
119,1,"2:47",1367,1367,"Jordan Swopshire Defensive Rebound.",37,34,3,0.634753568075357,"Army","Colgate",2,4,1,0,0.2,400991986,2018-01-24
120,1,"2:26",1346,1346,"Will Rayman missed Three Point Jumper.",37,34,3,0.632520642784522,"Army","Colgate",2,4,1,0,0.2,400991986,2018-01-24
121,1,"2:26",1346,1346,"Luke Morrison Defensive Rebound.",37,34,3,0.632520642784522,"Army","Colgate",2,4,1,0,0.2,400991986,2018-01-24
122,1,"2:17",1337,1337,"Foul on Dana Batt.",37,34,3,0.622811524855645,"Army","Colgate",2,4,1,0,0.2,400991986,2018-01-24
123,1,"2:17",1337,1337,"Babacar Thiombane missed Free Throw.",37,34,3,0.622811524855645,"Army","Colgate",2,4,1,0,0.2,400991986,2018-01-24
124,1,"2:17",1337,1337,"Army Deadball Team Rebound.",37,34,3,0.622811524855645,"Army","Colgate",2,4,1,0,0.2,400991986,2018-01-24
125,1,"2:17",1337,1337,"Babacar Thiombane missed Free Throw.",37,34,3,0.622811524855645,"Army","Colgate",2,4,1,0,0.2,400991986,2018-01-24
126,1,"2:17",1337,1337,"Jordan Swopshire Defensive Rebound.",37,34,3,0.622811524855645,"Army","Colgate",2,4,1,0,0.2,400991986,2018-01-24
127,1,"2:00",1320,1320,"Jordan Swopshire missed Three Point Jumper.",37,34,3,0.635519156397242,"Army","Colgate",2,4,0,0,0.2,400991986,2018-01-24
128,1,"2:00",1320,1320,"Babacar Thiombane Defensive Rebound.",37,34,3,0.635519156397242,"Army","Colgate",2,4,0,0,0.2,400991986,2018-01-24
129,1,"1:37",1297,1297,"Jordan Fox missed Three Point Jumper.",37,34,3,0.666780137931988,"Army","Colgate",2,4,0,0,0.2,400991986,2018-01-24
130,1,"1:37",1297,1297,"Sean O'Brien Defensive Rebound.",37,34,3,0.666780137931988,"Army","Colgate",2,4,0,0,0.2,400991986,2018-01-24
131,1,"1:32",1292,1292,"Foul on Babacar Thiombane.",37,34,3,0.666780137931988,"Army","Colgate",2,4,0,0,0.2,400991986,2018-01-24
132,1,"1:32",1292,1292,"Sean O'Brien missed Free Throw.",37,34,3,0.666780137931988,"Army","Colgate",2,4,0,0,0.2,400991986,2018-01-24
133,1,"1:32",1292,1292,"Jacob Kessler Defensive Rebound.",37,34,3,0.666780137931988,"Army","Colgate",2,4,0,0,0.2,400991986,2018-01-24
134,1,"1:04",1264,1264,"Matthew Wilson Turnover.",37,34,3,0.651795594372355,"Army","Colgate",2,4,0,0,0.2,400991986,2018-01-24
135,1,"1:03",1263,1263,"Will Rayman Steal.",37,34,3,0.651795594372355,"Army","Colgate",2,4,0,0,0.2,400991986,2018-01-24
136,1,"0:45",1245,1245,"Jordan Burns Turnover.",37,34,3,0.633430933962683,"Army","Colgate",2,4,0,0,0.2,400991986,2018-01-24
137,1,"0:25",1225,1225,"Matthew Wilson Turnover.",37,34,3,0.649985306012203,"Army","Colgate",2,4,0,0,0.2,400991986,2018-01-24
138,1,"0:25",1225,1225,"Foul on Matthew Wilson.",37,34,3,0.649985306012203,"Army","Colgate",2,4,0,0,0.2,400991986,2018-01-24
139,1,"0:02",1202,1202,"Jordan Swopshire missed Layup.",37,34,3,0.636457077629757,"Army","Colgate",2,4,0,0,0.2,400991986,2018-01-24
140,1,"0:02",1202,1202,"Babacar Thiombane Defensive Rebound.",37,34,3,0.636457077629757,"Army","Colgate",2,4,0,0,0.2,400991986,2018-01-24
141,1,"0:00",1200,1200,"End of 1st half",37,34,3,0.636457077629757,"Army","Colgate",2,4,0,0,0.2,400991986,2018-01-24
142,2,"20:00",1200,1200,"PLAY",37,34,3,0.636457077629757,"Army","Colgate",2,4,0,0,0.2,400991986,2018-01-24
143,2,"19:53",1193,1193,"Jordan Fox missed Three Point Jumper.",37,34,3,0.681244307101595,"Army","Colgate",2,4,0,0,0.2,400991986,2018-01-24
144,2,"19:53",1193,1193,"Jordan Swopshire Defensive Rebound.",37,34,3,0.681244307101595,"Army","Colgate",2,4,0,0,0.2,400991986,2018-01-24
145,2,"19:34",1174,1174,"Dana Batt missed Jumper.",37,34,3,0.642834285885996,"Army","Colgate",2,4,0,0,0.2,400991986,2018-01-24
146,2,"19:34",1174,1174,"Matthew Wilson Defensive Rebound.",37,34,3,0.642834285885996,"Army","Colgate",2,4,0,0,0.2,400991986,2018-01-24
147,2,"19:24",1164,1164,"Luke Morrison made Three Point Jumper. Assisted by Matthew Wilson.",40,34,6,0.729074708186726,"Army","Colgate",2,4,0,0,0.2,400991986,2018-01-24
148,2,"19:02",1142,1142,"Jordan Burns made Jumper.",40,36,4,0.687570334374787,"Army","Colgate",2,4,0,0,0.2,400991986,2018-01-24
149,2,"18:48",1128,1128,"Foul on Dana Batt.",40,36,4,0.691357467616213,"Army","Colgate",2,4,0,0,0.2,400991986,2018-01-24
150,2,"18:48",1128,1128,"Matthew Wilson made Free Throw.",41,36,5,0.729628268938349,"Army","Colgate",2,4,0,0,0.2,400991986,2018-01-24
151,2,"18:48",1128,1128,"Matthew Wilson missed Free Throw.",41,36,5,0.729628268938349,"Army","Colgate",2,4,0,0,0.2,400991986,2018-01-24
152,2,"18:48",1128,1128,"Dana Batt Defensive Rebound.",41,36,5,0.729628268938349,"Army","Colgate",2,4,0,0,0.2,400991986,2018-01-24
153,2,"18:33",1113,1113,"Will Rayman missed Three Point Jumper.",41,36,5,0.727948674611481,"Army","Colgate",2,4,0,0,0.2,400991986,2018-01-24
154,2,"18:33",1113,1113,"Jordan Swopshire Offensive Rebound.",41,36,5,0.727948674611481,"Army","Colgate",2,4,0,0,0.2,400991986,2018-01-24
155,2,"18:31",1111,1111,"Foul on Luke Morrison.",41,36,5,0.727948674611481,"Army","Colgate",2,4,0,0,0.2,400991986,2018-01-24
156,2,"18:28",1108,1108,"Foul on Luke Morrison.",41,36,5,0.710918496402071,"Army","Colgate",2,4,0,0,0.2,400991986,2018-01-24
157,2,"18:28",1108,1108,"Jordan Swopshire made Free Throw.",41,37,4,0.676138355063365,"Army","Colgate",2,4,0,0,0.2,400991986,2018-01-24
158,2,"18:28",1108,1108,"Jordan Swopshire missed Free Throw.",41,37,4,0.676138355063365,"Army","Colgate",2,4,0,0,0.2,400991986,2018-01-24
159,2,"18:28",1108,1108,"Thomas Funk Defensive Rebound.",41,37,4,0.676138355063365,"Army","Colgate",2,4,0,0,0.2,400991986,2018-01-24
160,2,"18:03",1083,1083,"Alex King missed Three Point Jumper.",41,37,4,0.684057155691614,"Army","Colgate",2,4,0,0,0.2,400991986,2018-01-24
161,2,"18:03",1083,1083,"Matthew Wilson Offensive Rebound.",41,37,4,0.684057155691614,"Army","Colgate",2,4,0,0,0.2,400991986,2018-01-24
162,2,"17:56",1076,1076,"Matthew Wilson Turnover.",41,37,4,0.693064739659796,"Army","Colgate",2,4,0,0,0.2,400991986,2018-01-24
163,2,"17:55",1075,1075,"Will Rayman Steal.",41,37,4,0.693064739659796,"Army","Colgate",2,4,0,0,0.2,400991986,2018-01-24
164,2,"17:52",1072,1072,"Sean O'Brien Turnover.",41,37,4,0.693064739659796,"Army","Colgate",2,4,0,0,0.2,400991986,2018-01-24
165,2,"17:51",1071,1071,"Jacob Kessler Steal.",41,37,4,0.693064739659796,"Army","Colgate",2,4,0,0,0.2,400991986,2018-01-24
166,2,"17:47",1067,1067,"Thomas Funk Turnover.",41,37,4,0.701890528143634,"Army","Colgate",2,4,0,0,0.2,400991986,2018-01-24
167,2,"17:46",1066,1066,"Jordan Burns Steal.",41,37,4,0.701890528143634,"Army","Colgate",2,4,0,0,0.2,400991986,2018-01-24
168,2,"17:40",1060,1060,"Sean O'Brien Turnover.",41,37,4,0.701890528143634,"Army","Colgate",2,4,0,0,0.2,400991986,2018-01-24
169,2,"17:39",1059,1059,"Matthew Wilson Steal.",41,37,4,0.699298434988891,"Army","Colgate",2,4,0,0,0.2,400991986,2018-01-24
170,2,"17:34",1054,1054,"Foul on Sean O'Brien.",41,37,4,0.699298434988891,"Army","Colgate",2,4,0,0,0.2,400991986,2018-01-24
171,2,"17:34",1054,1054,"Alex King missed Free Throw.",41,37,4,0.699298434988891,"Army","Colgate",2,4,0,0,0.2,400991986,2018-01-24
172,2,"17:34",1054,1054,"Army Deadball Team Rebound.",41,37,4,0.699298434988891,"Army","Colgate",2,4,0,0,0.2,400991986,2018-01-24
173,2,"17:34",1054,1054,"Alex King made Free Throw.",42,37,5,0.735766217372844,"Army","Colgate",2,4,0,0,0.2,400991986,2018-01-24
174,2,"17:06",1026,1026,"Will Rayman missed Jumper.",42,37,5,0.734986964243524,"Army","Colgate",2,4,0,0,0.2,400991986,2018-01-24
175,2,"17:06",1026,1026,"Dana Batt Offensive Rebound.",42,37,5,0.734986964243524,"Army","Colgate",2,4,0,0,0.2,400991986,2018-01-24
176,2,"17:04",1024,1024,"Colgate  Turnover.",42,37,5,0.734986964243524,"Army","Colgate",2,4,0,0,0.2,400991986,2018-01-24
177,2,"16:41",1001,1001,"Tucker Blackwell missed Jumper.",42,37,5,0.722846058772239,"Army","Colgate",2,4,0,0,0.2,400991986,2018-01-24
178,2,"16:41",1001,1001,"Army Offensive Rebound.",42,37,5,0.722846058772239,"Army","Colgate",2,4,0,0,0.2,400991986,2018-01-24
179,2,"16:34",994,994,"Foul on Dana Batt.",42,37,5,0.715335423292152,"Army","Colgate",2,4,0,0,0.2,400991986,2018-01-24
180,2,"16:34",994,994,"Jordan Fox missed Free Throw.",42,37,5,0.715335423292152,"Army","Colgate",2,4,0,0,0.2,400991986,2018-01-24
181,2,"16:34",994,994,"Army Deadball Team Rebound.",42,37,5,0.715335423292152,"Army","Colgate",2,4,0,0,0.2,400991986,2018-01-24
182,2,"16:34",994,994,"Jordan Fox made Free Throw.",43,37,6,0.750248268501145,"Army","Colgate",2,4,0,0,0.2,400991986,2018-01-24
183,2,"16:21",981,981,"Foul on Tucker Blackwell.",43,37,6,0.795786228411718,"Army","Colgate",2,4,0,0,0.2,400991986,2018-01-24
184,2,"16:21",981,981,"Jordan Burns made Free Throw.",43,38,5,0.761397786046625,"Army","Colgate",2,4,0,0,0.2,400991986,2018-01-24
185,2,"16:21",981,981,"Jordan Burns made Free Throw.",43,39,4,0.723232520866767,"Army","Colgate",2,4,0,0,0.2,400991986,2018-01-24
186,2,"15:56",956,956,"John Emezie made Jumper.",45,39,6,0.763818815677687,"Army","Colgate",2,4,0,0,0.2,400991986,2018-01-24
187,2,"15:36",936,936,"Will Rayman made Three Point Jumper. Assisted by Jordan Burns.",45,42,3,0.658660763171728,"Army","Colgate",2,4,0,0,0.2,400991986,2018-01-24
188,2,"15:24",924,924,"Alex King Turnover.",45,42,3,0.639395513392308,"Army","Colgate",2,4,1,0,0.2,400991986,2018-01-24
189,2,"15:24",924,924,"Foul on Alex King.",45,42,3,0.639395513392308,"Army","Colgate",2,4,1,0,0.2,400991986,2018-01-24
190,2,"15:24",924,924,"Colgate  Timeout",45,42,3,0.639395513392308,"Army","Colgate",1,4,1,0,0.2,400991986,2018-01-24
191,2,"15:07",907,907,"Jordan Swopshire missed Three Point Jumper.",45,42,3,0.658815292354435,"Army","Colgate",1,4,1,0,0.2,400991986,2018-01-24
192,2,"15:07",907,907,"Army Defensive Rebound.",45,42,3,0.658815292354435,"Army","Colgate",1,4,1,0,0.2,400991986,2018-01-24
