"play_id","half","time_remaining_half","secs_remaining","secs_remaining_absolute","description","home_score","away_score","score_diff","win_prob","home","away","home_time_out_remaining","away_time_out_remaining","home_timeout_ind","away_timeout_ind","home_favored_by","game_id","date"
190,2,"14:57",897,897,"Trey Porter Offensive Rebound.",44,33,11,0.781940633335937,"UTSA","Old Dominion",4,4,0,0,-8,400919481,2017-03-04
191,2,"14:54",894,894,"Trey Porter made Layup.",44,35,9,0.70856515219637,"UTSA","Old Dominion",4,4,0,0,-8,400919481,2017-03-04
192,2,"14:26",866,866,"Austin Karrer missed Three Point Jumper.",44,35,9,0.673402186712484,"UTSA","Old Dominion",4,4,0,0,-8,400919481,2017-03-04
193,2,"14:26",866,866,"Ahmad Caver Defensive Rebound.",44,35,9,0.673402186712484,"UTSA","Old Dominion",4,4,0,0,-8,400919481,2017-03-04
194,2,"14:10",850,850,"Foul on Nick Allen.",44,35,9,0.735722433972578,"UTSA","Old Dominion",4,4,0,0,-8,400919481,2017-03-04
195,2,"14:10",850,850,"Trey Porter made Free Throw.",44,36,8,0.69396705200243,"UTSA","Old Dominion",4,4,0,0,-8,400919481,2017-03-04
196,2,"14:10",850,850,"Trey Porter made Free Throw.",44,37,7,0.648763953173024,"UTSA","Old Dominion",4,4,0,0,-8,400919481,2017-03-04
197,2,"13:55",835,835,"Jeff Beverly made Jumper.",46,37,9,0.694300653676901,"UTSA","Old Dominion",4,4,0,0,-8,400919481,2017-03-04
198,2,"13:39",819,819,"Ahmad Caver missed Three Point Jumper.",46,37,9,0.665158379830736,"UTSA","Old Dominion",4,4,0,0,-8,400919481,2017-03-04
199,2,"13:39",819,819,"B.J. Stith Offensive Rebound.",46,37,9,0.665158379830736,"UTSA","Old Dominion",4,4,0,0,-8,400919481,2017-03-04
200,2,"13:33",813,813,"B.J. Stith missed Jumper.",46,37,9,0.665158379830736,"UTSA","Old Dominion",4,4,0,0,-8,400919481,2017-03-04
201,2,"13:33",813,813,"Austin Karrer Defensive Rebound.",46,37,9,0.665158379830736,"UTSA","Old Dominion",4,4,0,0,-8,400919481,2017-03-04
202,2,"13:13",793,793,"Foul on Trey Porter.",46,37,9,0.739893879212565,"UTSA","Old Dominion",4,4,0,0,-8,400919481,2017-03-04
203,2,"13:06",786,786,"Foul on B.J. Stith.",46,37,9,0.719069736929991,"UTSA","Old Dominion",4,4,0,0,-8,400919481,2017-03-04
204,2,"12:50",770,770,"Jeff Beverly missed Jumper.",46,37,9,0.730753610685121,"UTSA","Old Dominion",4,4,0,0,-8,400919481,2017-03-04
205,2,"12:50",770,770,"B.J. Stith Block.",46,37,9,0.730753610685121,"UTSA","Old Dominion",4,4,0,0,-8,400919481,2017-03-04
206,2,"12:48",768,768,"Ahmad Caver Defensive Rebound.",46,37,9,0.743852760627999,"UTSA","Old Dominion",4,4,0,0,-8,400919481,2017-03-04
207,2,"12:39",759,759,"Ahmad Caver made Layup.",46,39,7,0.641068112979177,"UTSA","Old Dominion",4,4,0,0,-8,400919481,2017-03-04
208,2,"12:18",738,738,"Jeff Beverly missed Jumper.",46,39,7,0.680201857780759,"UTSA","Old Dominion",4,4,0,0,-8,400919481,2017-03-04
209,2,"12:18",738,738,"B.J. Stith Block.",46,39,7,0.680201857780759,"UTSA","Old Dominion",4,4,0,0,-8,400919481,2017-03-04
210,2,"12:16",736,736,"George Willborn III Offensive Rebound.",46,39,7,0.680201857780759,"UTSA","Old Dominion",4,4,0,0,-8,400919481,2017-03-04
211,2,"12:15",735,735,"George Willborn III missed Layup.",46,39,7,0.680201857780759,"UTSA","Old Dominion",4,4,0,0,-8,400919481,2017-03-04
212,2,"12:15",735,735,"Trey Porter Defensive Rebound.",46,39,7,0.680201857780759,"UTSA","Old Dominion",4,4,0,0,-8,400919481,2017-03-04
213,2,"12:08",728,728,"B.J. Stith missed Three Point Jumper.",46,39,7,0.692390827719109,"UTSA","Old Dominion",4,4,0,0,-8,400919481,2017-03-04
214,2,"12:08",728,728,"Jeff Beverly Defensive Rebound.",46,39,7,0.692390827719109,"UTSA","Old Dominion",4,4,0,0,-8,400919481,2017-03-04
215,2,"11:59",719,719,"Gino Littles made Layup.",48,39,9,0.717456710784095,"UTSA","Old Dominion",4,4,0,0,-8,400919481,2017-03-04
216,2,"11:59",719,719,"Official TV Timeout",48,39,9,0.717456710784095,"UTSA","Old Dominion",4,4,0,0,-8,400919481,2017-03-04
217,2,"11:52",712,712,"Ahmad Caver missed Jumper.",48,39,9,0.717456710784095,"UTSA","Old Dominion",4,4,0,0,-8,400919481,2017-03-04
218,2,"11:52",712,712,"Denzell Taylor Offensive Rebound.",48,39,9,0.717456710784095,"UTSA","Old Dominion",4,4,0,0,-8,400919481,2017-03-04
219,2,"11:42",702,702,"Jordan Baker missed Three Point Jumper.",48,39,9,0.770363317386859,"UTSA","Old Dominion",4,4,0,0,-8,400919481,2017-03-04
220,2,"11:42",702,702,"Byron Frohnen Defensive Rebound.",48,39,9,0.770363317386859,"UTSA","Old Dominion",4,4,0,0,-8,400919481,2017-03-04
221,2,"11:26",686,686,"Lucas O'Brien missed Three Point Jumper.",48,39,9,0.751796788077148,"UTSA","Old Dominion",4,4,0,0,-8,400919481,2017-03-04
222,2,"11:26",686,686,"Old Dominion Defensive Rebound.",48,39,9,0.751796788077148,"UTSA","Old Dominion",4,4,0,0,-8,400919481,2017-03-04
223,2,"11:08",668,668,"Trey Porter missed Jumper.",48,39,9,0.794868411813727,"UTSA","Old Dominion",4,4,0,0,-8,400919481,2017-03-04
224,2,"11:08",668,668,"Trey Porter Offensive Rebound.",48,39,9,0.794868411813727,"UTSA","Old Dominion",4,4,0,0,-8,400919481,2017-03-04
225,2,"11:07",667,667,"Trey Porter made Layup.",48,41,7,0.711383301649557,"UTSA","Old Dominion",4,4,0,0,-8,400919481,2017-03-04
226,2,"11:07",667,667,"Foul on Lucas O'Brien.",48,41,7,0.711383301649557,"UTSA","Old Dominion",4,4,0,0,-8,400919481,2017-03-04
227,2,"11:07",667,667,"Trey Porter missed Free Throw.",48,41,7,0.711383301649557,"UTSA","Old Dominion",4,4,0,0,-8,400919481,2017-03-04
228,2,"11:07",667,667,"Austin Karrer Defensive Rebound.",48,41,7,0.711383301649557,"UTSA","Old Dominion",4,4,0,0,-8,400919481,2017-03-04
229,2,"10:45",645,645,"Foul on Denzell Taylor.",48,41,7,0.715745199405555,"UTSA","Old Dominion",4,4,0,0,-8,400919481,2017-03-04
230,2,"10:31",631,631,"Gino Littles missed Layup.",48,41,7,0.719233536267424,"UTSA","Old Dominion",4,4,0,0,-8,400919481,2017-03-04
231,2,"10:31",631,631,"Brandan Stith Block.",48,41,7,0.719233536267424,"UTSA","Old Dominion",4,4,0,0,-8,400919481,2017-03-04
232,2,"10:30",630,630,"Ahmad Caver Defensive Rebound.",48,41,7,0.719233536267424,"UTSA","Old Dominion",4,4,0,0,-8,400919481,2017-03-04
233,2,"10:16",616,616,"Ahmad Caver Turnover.",48,41,7,0.713237565821611,"UTSA","Old Dominion",4,4,0,0,-8,400919481,2017-03-04
234,2,"10:00",600,600,"Giovanni De Nicolao made Jumper.",50,41,9,0.799829972327584,"UTSA","Old Dominion",4,4,0,0,-8,400919481,2017-03-04
235,2,"9:47",587,587,"B.J. Stith missed Jumper.",50,41,9,0.806842733689456,"UTSA","Old Dominion",4,4,0,0,-8,400919481,2017-03-04
236,2,"9:47",587,587,"Brandan Stith Offensive Rebound.",50,41,9,0.806842733689456,"UTSA","Old Dominion",4,4,0,0,-8,400919481,2017-03-04
237,2,"9:45",585,585,"Foul on Lucas O'Brien.",50,41,9,0.806842733689456,"UTSA","Old Dominion",4,4,0,0,-8,400919481,2017-03-04
238,2,"9:33",573,573,"Zoran Talley made Dunk. Assisted by Ahmad Caver.",50,43,7,0.754011156015392,"UTSA","Old Dominion",4,4,0,0,-8,400919481,2017-03-04
239,2,"9:08",548,548,"Lucas O'Brien missed Three Point Jumper.",50,43,7,0.743987492609583,"UTSA","Old Dominion",4,4,0,0,-8,400919481,2017-03-04
240,2,"9:08",548,548,"Zoran Talley Defensive Rebound.",50,43,7,0.743987492609583,"UTSA","Old Dominion",4,4,0,0,-8,400919481,2017-03-04
241,2,"8:53",533,533,"Ahmad Caver Turnover.",50,43,7,0.788421959288312,"UTSA","Old Dominion",4,4,0,0,-8,400919481,2017-03-04
242,2,"8:53",533,533,"Byron Frohnen Steal.",50,43,7,0.788421959288312,"UTSA","Old Dominion",4,4,0,0,-8,400919481,2017-03-04
243,2,"8:32",512,512,"Austin Karrer missed Three Point Jumper.",50,43,7,0.772775067349755,"UTSA","Old Dominion",4,4,0,0,-8,400919481,2017-03-04
244,2,"8:32",512,512,"Zoran Talley Defensive Rebound.",50,43,7,0.772775067349755,"UTSA","Old Dominion",4,4,0,0,-8,400919481,2017-03-04
245,2,"8:23",503,503,"Foul on Ahmad Caver.",50,43,7,0.785110961077126,"UTSA","Old Dominion",4,4,0,0,-8,400919481,2017-03-04
246,2,"8:23",503,503,"Ahmad Caver Turnover.",50,43,7,0.785110961077126,"UTSA","Old Dominion",4,4,0,0,-8,400919481,2017-03-04
247,2,"7:57",477,477,"Lucas O'Brien missed Three Point Jumper.",50,43,7,0.780612916984964,"UTSA","Old Dominion",4,4,0,0,-8,400919481,2017-03-04
248,2,"7:57",477,477,"Jeff Beverly Offensive Rebound.",50,43,7,0.780612916984964,"UTSA","Old Dominion",4,4,0,0,-8,400919481,2017-03-04
249,2,"7:53",473,473,"Foul on B.J. Stith.",50,43,7,0.780612916984964,"UTSA","Old Dominion",4,4,0,0,-8,400919481,2017-03-04
250,2,"7:53",473,473,"Official TV Timeout",50,43,7,0.780612916984964,"UTSA","Old Dominion",4,4,0,0,-8,400919481,2017-03-04
251,2,"7:53",473,473,"Jeff Beverly made Free Throw.",51,43,8,0.826394983480817,"UTSA","Old Dominion",4,4,0,0,-8,400919481,2017-03-04
252,2,"7:53",473,473,"Jeff Beverly made Free Throw.",52,43,9,0.864284189516756,"UTSA","Old Dominion",4,4,0,0,-8,400919481,2017-03-04
253,2,"7:37",457,457,"Travis Fields missed Jumper.",52,43,9,0.898993609353974,"UTSA","Old Dominion",4,4,0,0,-8,400919481,2017-03-04
254,2,"7:37",457,457,"Byron Frohnen Defensive Rebound.",52,43,9,0.898993609353974,"UTSA","Old Dominion",4,4,0,0,-8,400919481,2017-03-04
255,2,"7:34",454,454,"Foul on Brandan Stith.",52,43,9,0.898993609353974,"UTSA","Old Dominion",4,4,0,0,-8,400919481,2017-03-04
256,2,"7:34",454,454,"Byron Frohnen made Free Throw.",53,43,10,0.924360913565697,"UTSA","Old Dominion",4,4,0,0,-8,400919481,2017-03-04
257,2,"7:34",454,454,"Byron Frohnen made Free Throw.",54,43,11,0.943755916686791,"UTSA","Old Dominion",4,4,0,0,-8,400919481,2017-03-04
258,2,"7:27",447,447,"Zoran Talley missed Jumper.",54,43,11,0.923334597440104,"UTSA","Old Dominion",4,4,0,0,-8,400919481,2017-03-04
259,2,"7:27",447,447,"Brandan Stith Offensive Rebound.",54,43,11,0.923334597440104,"UTSA","Old Dominion",4,4,0,0,-8,400919481,2017-03-04
260,2,"7:24",444,444,"Foul on Jeff Beverly.",54,43,11,0.923334597440104,"UTSA","Old Dominion",4,4,0,0,-8,400919481,2017-03-04
261,2,"7:14",434,434,"Jordan Baker missed Three Point Jumper.",54,43,11,0.937128968968466,"UTSA","Old Dominion",4,4,0,0,-8,400919481,2017-03-04
262,2,"7:14",434,434,"Brandan Stith Offensive Rebound.",54,43,11,0.937128968968466,"UTSA","Old Dominion",4,4,0,0,-8,400919481,2017-03-04
263,2,"7:11",431,431,"Foul on Byron Frohnen.",54,43,11,0.937128968968466,"UTSA","Old Dominion",4,4,0,0,-8,400919481,2017-03-04
264,2,"7:11",431,431,"Brandan Stith missed Free Throw.",54,43,11,0.937128968968466,"UTSA","Old Dominion",4,4,0,0,-8,400919481,2017-03-04
265,2,"7:11",431,431,"Old Dominion Deadball Team Rebound.",54,43,11,0.937128968968466,"UTSA","Old Dominion",4,4,0,0,-8,400919481,2017-03-04
266,2,"7:11",431,431,"Brandan Stith missed Free Throw.",54,43,11,0.937128968968466,"UTSA","Old Dominion",4,4,0,0,-8,400919481,2017-03-04
267,2,"7:11",431,431,"Jeff Beverly Defensive Rebound.",54,43,11,0.937128968968466,"UTSA","Old Dominion",4,4,0,0,-8,400919481,2017-03-04
268,2,"6:54",414,414,"Jeff Beverly made Jumper. Assisted by Byron Frohnen.",56,43,13,0.95956073785652,"UTSA","Old Dominion",4,4,0,0,-8,400919481,2017-03-04
269,2,"6:41",401,401,"Zoran Talley missed Jumper.",56,43,13,0.972477183157516,"UTSA","Old Dominion",4,4,0,0,-8,400919481,2017-03-04
270,2,"6:41",401,401,"Giovanni De Nicolao Defensive Rebound.",56,43,13,0.972477183157516,"UTSA","Old Dominion",4,4,0,0,-8,400919481,2017-03-04
271,2,"6:25",385,385,"Foul on Ahmad Caver.",56,43,13,0.957731716977355,"UTSA","Old Dominion",4,4,0,0,-8,400919481,2017-03-04
272,2,"6:25",385,385,"Byron Frohnen made Free Throw.",57,43,14,0.968261609362652,"UTSA","Old Dominion",4,4,0,0,-8,400919481,2017-03-04
273,2,"6:25",385,385,"Byron Frohnen made Free Throw.",58,43,15,0.97623338689987,"UTSA","Old Dominion",4,4,0,0,-8,400919481,2017-03-04
274,2,"6:02",362,362,"Foul on Byron Frohnen.",58,43,15,0.985946243637048,"UTSA","Old Dominion",4,4,0,0,-8,400919481,2017-03-04
275,2,"6:02",362,362,"B.J. Stith made Free Throw.",58,44,14,0.980694632805285,"UTSA","Old Dominion",4,4,0,0,-8,400919481,2017-03-04
276,2,"6:02",362,362,"B.J. Stith made Free Throw.",58,45,13,0.973533278107419,"UTSA","Old Dominion",4,4,0,0,-8,400919481,2017-03-04
277,2,"5:38",338,338,"Giovanni De Nicolao Turnover.",58,45,13,0.982964164851549,"UTSA","Old Dominion",4,4,0,0,-8,400919481,2017-03-04
278,2,"5:37",337,337,"Ahmad Caver Steal.",58,45,13,0.982964164851549,"UTSA","Old Dominion",4,4,0,0,-8,400919481,2017-03-04
279,2,"5:33",333,333,"Trey Porter made Layup. Assisted by Jordan Baker.",58,47,11,0.965982090365465,"UTSA","Old Dominion",4,4,0,0,-8,400919481,2017-03-04
280,2,"5:10",310,310,"Lucas O'Brien missed Three Point Jumper.",58,47,11,0.971107940061493,"UTSA","Old Dominion",4,4,0,0,-8,400919481,2017-03-04
281,2,"5:10",310,310,"Austin Karrer Offensive Rebound.",58,47,11,0.971107940061493,"UTSA","Old Dominion",4,4,0,0,-8,400919481,2017-03-04
282,2,"4:45",285,285,"Foul on Ahmad Caver.",58,47,11,0.960551024425068,"UTSA","Old Dominion",4,4,0,0,-8,400919481,2017-03-04
283,2,"4:45",285,285,"Giovanni De Nicolao made Free Throw.",59,47,12,0.971949432633399,"UTSA","Old Dominion",4,4,0,0,-8,400919481,2017-03-04
284,2,"4:45",285,285,"Giovanni De Nicolao made Free Throw.",60,47,13,0.980122532950547,"UTSA","Old Dominion",4,4,0,0,-8,400919481,2017-03-04
285,2,"4:34",274,274,"B.J. Stith made Jumper. Assisted by Zoran Talley.",60,49,11,0.971632776408788,"UTSA","Old Dominion",4,4,0,0,-8,400919481,2017-03-04
286,2,"4:32",272,272,"Old Dominion  Timeout",60,49,11,0.971632776408788,"UTSA","Old Dominion",3,4,1,0,-8,400919481,2017-03-04
287,2,"4:08",248,248,"Gino Littles made Three Point Jumper. Assisted by Byron Frohnen.",63,49,14,0.993924583839472,"UTSA","Old Dominion",3,4,1,0,-8,400919481,2017-03-04
288,2,"3:55",235,235,"B.J. Stith missed Three Point Jumper.",63,49,14,0.994761300890075,"UTSA","Old Dominion",3,4,1,0,-8,400919481,2017-03-04
289,2,"3:55",235,235,"Lucas O'Brien Defensive Rebound.",63,49,14,0.994761300890075,"UTSA","Old Dominion",3,4,1,0,-8,400919481,2017-03-04
290,2,"3:53",233,233,"Foul on Trey Porter.",63,49,14,0.994761300890075,"UTSA","Old Dominion",3,4,1,0,-8,400919481,2017-03-04
291,2,"3:53",233,233,"Official TV Timeout",63,49,14,0.994761300890075,"UTSA","Old Dominion",3,4,1,0,-8,400919481,2017-03-04
292,2,"3:53",233,233,"Lucas O'Brien made Free Throw.",64,49,15,0.996502599136027,"UTSA","Old Dominion",3,4,1,0,-8,400919481,2017-03-04
293,2,"3:53",233,233,"Lucas O'Brien made Free Throw.",65,49,16,0.997666462661705,"UTSA","Old Dominion",3,4,1,0,-8,400919481,2017-03-04
294,2,"3:45",225,225,"Ahmad Caver made Jumper.",65,51,14,0.995013888409803,"UTSA","Old Dominion",3,4,1,0,-8,400919481,2017-03-04
295,2,"3:16",196,196,"Lucas O'Brien made Three Point Jumper. Assisted by Giovanni De Nicolao.",68,51,17,0.999474531535864,"UTSA","Old Dominion",3,4,0,0,-8,400919481,2017-03-04
296,2,"3:00",180,180,"Foul on Lucas O'Brien.",68,51,17,0.999533813874555,"UTSA","Old Dominion",3,4,0,0,-8,400919481,2017-03-04
297,2,"3:00",180,180,"Brandan Stith made Free Throw.",68,52,16,0.999242520747491,"UTSA","Old Dominion",3,4,0,0,-8,400919481,2017-03-04
298,2,"3:00",180,180,"Brandan Stith made Free Throw.",68,53,15,0.998769439237216,"UTSA","Old Dominion",3,4,0,0,-8,400919481,2017-03-04
299,2,"2:36",156,156,"Gino Littles made Three Point Jumper. Assisted by Byron Frohnen.",71,53,18,0.999914276571548,"UTSA","Old Dominion",3,4,0,0,-8,400919481,2017-03-04
300,2,"2:34",154,154,"UT San Antonio  Timeout",71,53,18,0.999914276571548,"UTSA","Old Dominion",3,3,0,1,-8,400919481,2017-03-04
301,2,"2:16",136,136,"Zoran Talley made Layup.",71,55,16,0.999816128764818,"UTSA","Old Dominion",3,3,0,1,-8,400919481,2017-03-04
302,2,"1:50",110,110,"Jeff Beverly missed Three Point Jumper.",71,55,16,0.999908254670694,"UTSA","Old Dominion",3,3,0,1,-8,400919481,2017-03-04
303,2,"1:50",110,110,"Stephen Vassor Defensive Rebound.",71,55,16,0.999908254670694,"UTSA","Old Dominion",3,3,0,1,-8,400919481,2017-03-04
304,2,"1:39",99,99,"Travis Fields missed Three Point Jumper.",71,55,16,0.999941535773167,"UTSA","Old Dominion",3,3,0,1,-8,400919481,2017-03-04
305,2,"1:39",99,99,"Byron Frohnen Defensive Rebound.",71,55,16,0.999941535773167,"UTSA","Old Dominion",3,3,0,1,-8,400919481,2017-03-04
306,2,"1:17",77,77,"Jeff Beverly made Dunk. Assisted by Giovanni De Nicolao.",73,55,18,0.999996905416629,"UTSA","Old Dominion",3,3,0,0,-8,400919481,2017-03-04
307,2,"1:00",60,60,"Keith Pinckney missed Jumper.",73,55,18,0.999997741303566,"UTSA","Old Dominion",3,3,0,0,-8,400919481,2017-03-04
308,2,"1:00",60,60,"Nick Allen Defensive Rebound.",73,55,18,0.999997741303566,"UTSA","Old Dominion",3,3,0,0,-8,400919481,2017-03-04
309,2,"0:54",54,54,"UT San Antonio  Timeout",73,55,18,0.999998133146969,"UTSA","Old Dominion",3,2,0,1,-8,400919481,2017-03-04
310,2,"0:32",32,32,"James Ringholt missed Three Point Jumper.",73,55,18,0.999999998256945,"UTSA","Old Dominion",3,2,0,1,-8,400919481,2017-03-04
311,2,"0:32",32,32,"Bola Alade Offensive Rebound.",73,55,18,0.999999998256945,"UTSA","Old Dominion",3,2,0,1,-8,400919481,2017-03-04
312,2,"0:26",26,26,"Bola Alade missed Layup.",73,55,18,0.999999999501652,"UTSA","Old Dominion",3,2,0,1,-8,400919481,2017-03-04
313,2,"0:26",26,26,"Alassane Kah Defensive Rebound.",73,55,18,0.999999999501652,"UTSA","Old Dominion",3,2,0,1,-8,400919481,2017-03-04
314,2,"0:09",9,9,"Travis Fields missed Three Point Jumper.",73,55,18,0.999999999999898,"UTSA","Old Dominion",3,2,0,1,-8,400919481,2017-03-04
315,2,"0:09",9,9,"George Willborn III Defensive Rebound.",73,55,18,0.999999999999898,"UTSA","Old Dominion",3,2,0,1,-8,400919481,2017-03-04
316,2,"0:00",0,0,"End of Game",72,55,17,1,"UTSA","Old Dominion",3,2,0,1,-8,400919481,2017-03-04
