"play_id","half","time_remaining_half","secs_remaining","secs_remaining_absolute","description","home_score","away_score","score_diff","win_prob","home","away","home_time_out_remaining","away_time_out_remaining","home_timeout_ind","away_timeout_ind","home_favored_by","game_id","date"
1,1,"20:00",2400,2400,"PLAY",0,0,0,0.453134151146085,"Hofstra","Charleston",4,4,0,0,-1,400919577,2017-02-16
2,1,"19:34",2374,2374,"Foul on Rokas Gustys.",0,0,0,0.470947828458052,"Hofstra","Charleston",4,4,0,0,-1,400919577,2017-02-16
3,1,"19:34",2374,2374,"Joe Chealey made Free Throw.",0,1,-1,0.447330250708034,"Hofstra","Charleston",4,4,0,0,-1,400919577,2017-02-16
4,1,"19:34",2374,2374,"Joe Chealey made Free Throw.",0,2,-2,0.423947971631072,"Hofstra","Charleston",4,4,0,0,-1,400919577,2017-02-16
5,1,"19:15",2355,2355,"Brian Bernardi made Three Point Jumper.",3,2,1,0.497878116832137,"Hofstra","Charleston",4,4,0,0,-1,400919577,2017-02-16
6,1,"18:44",2324,2324,"Jarrell Brantley made Layup. Assisted by Nick Harris.",3,4,-1,0.452278965610286,"Hofstra","Charleston",4,4,0,0,-1,400919577,2017-02-16
7,1,"18:23",2303,2303,"Brian Bernardi missed Three Point Jumper.",3,4,-1,0.432942875320214,"Hofstra","Charleston",4,4,0,0,-1,400919577,2017-02-16
8,1,"18:23",2303,2303,"Charleston Defensive Rebound.",3,4,-1,0.432942875320214,"Hofstra","Charleston",4,4,0,0,-1,400919577,2017-02-16
9,1,"18:03",2283,2283,"Grant Riller made Jumper.",3,6,-3,0.380459297610109,"Hofstra","Charleston",4,4,0,0,-1,400919577,2017-02-16
10,1,"17:42",2262,2262,"Justin Wright-Foreman made Three Point Jumper. Assisted by Deron Powers.",6,6,0,0.46606969719436,"Hofstra","Charleston",4,4,0,0,-1,400919577,2017-02-16
11,1,"17:17",2237,2237,"Jarrell Brantley made Layup. Assisted by Grant Riller.",6,8,-2,0.410588437521184,"Hofstra","Charleston",4,4,0,0,-1,400919577,2017-02-16
12,1,"17:01",2221,2221,"Justin Wright-Foreman missed Three Point Jumper.",6,8,-2,0.416224092196111,"Hofstra","Charleston",4,4,0,0,-1,400919577,2017-02-16
13,1,"17:01",2221,2221,"Jarrell Brantley Defensive Rebound.",6,8,-2,0.416224092196111,"Hofstra","Charleston",4,4,0,0,-1,400919577,2017-02-16
14,1,"16:33",2193,2193,"Grant Riller missed Jumper.",6,8,-2,0.419112843717311,"Hofstra","Charleston",4,4,0,0,-1,400919577,2017-02-16
15,1,"16:33",2193,2193,"Deron Powers Defensive Rebound.",6,8,-2,0.419112843717311,"Hofstra","Charleston",4,4,0,0,-1,400919577,2017-02-16
16,1,"16:24",2184,2184,"Rokas Gustys made Layup. Assisted by Eli Pemberton.",8,8,0,0.466757581476667,"Hofstra","Charleston",4,4,0,0,-1,400919577,2017-02-16
17,1,"15:55",2155,2155,"Cameron Johnson made Layup. Assisted by Jarrell Brantley.",8,10,-2,0.394597849815215,"Hofstra","Charleston",4,4,0,0,-1,400919577,2017-02-16
18,1,"15:28",2128,2128,"Justin Wright-Foreman made Jumper.",10,10,0,0.457096729375071,"Hofstra","Charleston",4,4,0,0,-1,400919577,2017-02-16
19,1,"15:09",2109,2109,"Nick Harris Turnover.",10,10,0,0.460603783314013,"Hofstra","Charleston",4,4,0,0,-1,400919577,2017-02-16
20,1,"15:09",2109,2109,"Foul on Nick Harris.",10,10,0,0.460603783314013,"Hofstra","Charleston",4,4,0,0,-1,400919577,2017-02-16
21,1,"15:09",2109,2109,"Official TV Timeout",10,10,0,0.460603783314013,"Hofstra","Charleston",4,4,0,0,-1,400919577,2017-02-16
22,1,"14:54",2094,2094,"Eli Pemberton missed Jumper.",10,10,0,0.463586953508108,"Hofstra","Charleston",4,4,0,0,-1,400919577,2017-02-16
23,1,"14:54",2094,2094,"Jaylen McManus Defensive Rebound.",10,10,0,0.463586953508108,"Hofstra","Charleston",4,4,0,0,-1,400919577,2017-02-16
24,1,"14:37",2077,2077,"Chevez Goodwin made Layup.",10,12,-2,0.401389944641532,"Hofstra","Charleston",4,4,0,0,-1,400919577,2017-02-16
25,1,"14:14",2054,2054,"Deron Powers Turnover.",10,12,-2,0.390681287814845,"Hofstra","Charleston",4,4,0,0,-1,400919577,2017-02-16
26,1,"14:12",2052,2052,"Chevez Goodwin Steal.",10,12,-2,0.390681287814845,"Hofstra","Charleston",4,4,0,0,-1,400919577,2017-02-16
27,1,"14:10",2050,2050,"Joe Chealey missed Layup.",10,12,-2,0.390681287814845,"Hofstra","Charleston",4,4,0,0,-1,400919577,2017-02-16
28,1,"14:10",2050,2050,"Rokas Gustys Defensive Rebound.",10,12,-2,0.390681287814845,"Hofstra","Charleston",4,4,0,0,-1,400919577,2017-02-16
29,1,"13:50",2030,2030,"Foul on Marquise Pointer.",10,12,-2,0.413284025370716,"Hofstra","Charleston",4,4,0,0,-1,400919577,2017-02-16
30,1,"13:41",2021,2021,"Justin Wright-Foreman missed Three Point Jumper.",10,12,-2,0.390362648511882,"Hofstra","Charleston",4,4,0,0,-1,400919577,2017-02-16
31,1,"13:41",2021,2021,"Marquise Pointer Defensive Rebound.",10,12,-2,0.390362648511882,"Hofstra","Charleston",4,4,0,0,-1,400919577,2017-02-16
32,1,"13:06",1986,1986,"Jaylen McManus missed Three Point Jumper.",10,12,-2,0.395204748525643,"Hofstra","Charleston",4,4,0,0,-1,400919577,2017-02-16
33,1,"13:06",1986,1986,"Eli Pemberton Defensive Rebound.",10,12,-2,0.395204748525643,"Hofstra","Charleston",4,4,0,0,-1,400919577,2017-02-16
34,1,"12:58",1978,1978,"Brian Bernardi made Three Point Jumper. Assisted by Eli Pemberton.",13,12,1,0.493466431885546,"Hofstra","Charleston",4,4,0,0,-1,400919577,2017-02-16
35,1,"12:34",1954,1954,"Chevez Goodwin made Jumper. Assisted by Grant Riller.",13,14,-1,0.444714781823819,"Hofstra","Charleston",4,4,0,0,-1,400919577,2017-02-16
36,1,"12:13",1933,1933,"Brian Bernardi made Three Point Jumper. Assisted by Deron Powers.",16,14,2,0.519508818653898,"Hofstra","Charleston",4,4,0,0,-1,400919577,2017-02-16
37,1,"11:50",1910,1910,"Grant Riller missed Jumper.",16,14,2,0.547887770926862,"Hofstra","Charleston",4,4,0,0,-1,400919577,2017-02-16
38,1,"11:50",1910,1910,"Grant Riller Offensive Rebound.",16,14,2,0.547887770926862,"Hofstra","Charleston",4,4,0,0,-1,400919577,2017-02-16
39,1,"11:48",1908,1908,"Foul on Hunter Sabety.",16,14,2,0.517289471409243,"Hofstra","Charleston",4,4,0,0,-1,400919577,2017-02-16
40,1,"11:48",1908,1908,"Official TV Timeout",16,14,2,0.517289471409243,"Hofstra","Charleston",4,4,0,0,-1,400919577,2017-02-16
41,1,"11:48",1908,1908,"Grant Riller made Free Throw.",16,15,1,0.488050598412828,"Hofstra","Charleston",4,4,0,0,-1,400919577,2017-02-16
42,1,"11:48",1908,1908,"Grant Riller made Free Throw.",16,16,0,0.458893269532144,"Hofstra","Charleston",4,4,0,0,-1,400919577,2017-02-16
43,1,"11:36",1896,1896,"Justin Wright-Foreman made Dunk. Assisted by Rokas Gustys.",18,16,2,0.542244487001497,"Hofstra","Charleston",4,4,0,0,-1,400919577,2017-02-16
44,1,"11:04",1864,1864,"Joe Chealey missed Jumper.",18,16,2,0.55217702487792,"Hofstra","Charleston",4,4,0,0,-1,400919577,2017-02-16
45,1,"11:04",1864,1864,"Nick Harris Offensive Rebound.",18,16,2,0.55217702487792,"Hofstra","Charleston",4,4,0,0,-1,400919577,2017-02-16
46,1,"11:00",1860,1860,"Nick Harris made Two Point Tip Shot.",18,18,0,0.485128721755873,"Hofstra","Charleston",4,4,0,0,-1,400919577,2017-02-16
47,1,"10:45",1845,1845,"Justin Wright-Foreman missed Jumper.",18,18,0,0.443301619438676,"Hofstra","Charleston",4,4,0,0,-1,400919577,2017-02-16
48,1,"10:45",1845,1845,"Evan Bailey Defensive Rebound.",18,18,0,0.443301619438676,"Hofstra","Charleston",4,4,0,0,-1,400919577,2017-02-16
49,1,"10:35",1835,1835,"Foul on Deron Powers.",18,18,0,0.472358351781743,"Hofstra","Charleston",4,4,0,0,-1,400919577,2017-02-16
50,1,"10:28",1828,1828,"Grant Riller missed Three Point Jumper.",18,18,0,0.483276900613208,"Hofstra","Charleston",4,4,0,0,-1,400919577,2017-02-16
51,1,"10:28",1828,1828,"Jamall Robinson Defensive Rebound.",18,18,0,0.483276900613208,"Hofstra","Charleston",4,4,0,0,-1,400919577,2017-02-16
52,1,"10:09",1809,1809,"Brian Bernardi missed Jumper.",18,18,0,0.45886479015674,"Hofstra","Charleston",4,4,0,0,-1,400919577,2017-02-16
53,1,"10:09",1809,1809,"Nick Harris Defensive Rebound.",18,18,0,0.45886479015674,"Hofstra","Charleston",4,4,0,0,-1,400919577,2017-02-16
54,1,"9:58",1798,1798,"Cameron Johnson missed Three Point Jumper.",18,18,0,0.459431071722752,"Hofstra","Charleston",4,4,0,0,-1,400919577,2017-02-16
55,1,"9:58",1798,1798,"Rokas Gustys Defensive Rebound.",18,18,0,0.459431071722752,"Hofstra","Charleston",4,4,0,0,-1,400919577,2017-02-16
56,1,"9:25",1765,1765,"Rokas Gustys made Layup.",20,18,2,0.528789035420202,"Hofstra","Charleston",4,4,0,0,-1,400919577,2017-02-16
57,1,"9:04",1744,1744,"Nick Harris made Dunk. Assisted by Joe Chealey.",20,20,0,0.483740197693767,"Hofstra","Charleston",4,4,0,0,-1,400919577,2017-02-16
58,1,"8:46",1726,1726,"Deron Powers Turnover.",20,20,0,0.487172525836472,"Hofstra","Charleston",4,4,0,0,-1,400919577,2017-02-16
59,1,"8:43",1723,1723,"Joe Chealey Steal.",20,20,0,0.487172525836472,"Hofstra","Charleston",4,4,0,0,-1,400919577,2017-02-16
60,1,"8:40",1720,1720,"Cameron Johnson made Jumper. Assisted by Joe Chealey.",20,22,-2,0.42008429082173,"Hofstra","Charleston",4,4,0,0,-1,400919577,2017-02-16
61,1,"8:23",1703,1703,"Jamall Robinson missed Three Point Jumper.",20,22,-2,0.392315348871841,"Hofstra","Charleston",4,4,0,0,-1,400919577,2017-02-16
62,1,"8:23",1703,1703,"Grant Riller Defensive Rebound.",20,22,-2,0.392315348871841,"Hofstra","Charleston",4,4,0,0,-1,400919577,2017-02-16
63,1,"8:15",1695,1695,"Grant Riller Turnover.",20,22,-2,0.409240586429147,"Hofstra","Charleston",4,4,0,0,-1,400919577,2017-02-16
64,1,"8:01",1681,1681,"Eli Pemberton Turnover.",20,22,-2,0.391226978628651,"Hofstra","Charleston",4,4,0,0,-1,400919577,2017-02-16
65,1,"7:46",1666,1666,"Joe Chealey Turnover.",20,22,-2,0.401673299572589,"Hofstra","Charleston",4,4,0,0,-1,400919577,2017-02-16
66,1,"7:44",1664,1664,"Jamall Robinson Steal.",20,22,-2,0.401673299572589,"Hofstra","Charleston",4,4,0,0,-1,400919577,2017-02-16
67,1,"7:41",1661,1661,"Justin Wright-Foreman made Layup. Assisted by Deron Powers.",22,22,0,0.465152218361148,"Hofstra","Charleston",4,4,0,0,-1,400919577,2017-02-16
68,1,"7:41",1661,1661,"Foul on Jarrell Brantley.",22,22,0,0.465152218361148,"Hofstra","Charleston",4,4,0,0,-1,400919577,2017-02-16
69,1,"7:41",1661,1661,"Official TV Timeout",22,22,0,0.465152218361148,"Hofstra","Charleston",4,4,0,0,-1,400919577,2017-02-16
70,1,"7:41",1661,1661,"Justin Wright-Foreman made Free Throw.",23,22,1,0.497455697916621,"Hofstra","Charleston",4,4,0,0,-1,400919577,2017-02-16
71,1,"7:23",1643,1643,"Jarrell Brantley made Jumper. Assisted by Joe Chealey.",23,24,-1,0.439647166915994,"Hofstra","Charleston",4,4,0,0,-1,400919577,2017-02-16
72,1,"6:58",1618,1618,"Justin Wright-Foreman missed Three Point Jumper.",23,24,-1,0.418937404882744,"Hofstra","Charleston",4,4,0,0,-1,400919577,2017-02-16
73,1,"6:58",1618,1618,"Hunter Sabety Offensive Rebound.",23,24,-1,0.418937404882744,"Hofstra","Charleston",4,4,0,0,-1,400919577,2017-02-16
74,1,"6:53",1613,1613,"Hunter Sabety made Layup.",25,24,1,0.488588392722689,"Hofstra","Charleston",4,4,0,0,-1,400919577,2017-02-16
75,1,"6:23",1583,1583,"Joe Chealey missed Three Point Jumper.",25,24,1,0.484713744588544,"Hofstra","Charleston",4,4,0,0,-1,400919577,2017-02-16
76,1,"6:23",1583,1583,"Charleston Deadball Team Rebound.",25,24,1,0.484713744588544,"Hofstra","Charleston",4,4,0,0,-1,400919577,2017-02-16
77,1,"6:21",1581,1581,"Charleston  Turnover.",25,24,1,0.484713744588544,"Hofstra","Charleston",4,4,0,0,-1,400919577,2017-02-16
78,1,"5:57",1557,1557,"Justin Wright-Foreman missed Jumper.",25,24,1,0.496875416979868,"Hofstra","Charleston",4,4,0,0,-1,400919577,2017-02-16
79,1,"5:57",1557,1557,"Jaylen McManus Defensive Rebound.",25,24,1,0.496875416979868,"Hofstra","Charleston",4,4,0,0,-1,400919577,2017-02-16
80,1,"5:50",1550,1550,"Jaylen McManus missed Jumper.",25,24,1,0.496875416979868,"Hofstra","Charleston",4,4,0,0,-1,400919577,2017-02-16
81,1,"5:50",1550,1550,"Brian Bernardi Defensive Rebound.",25,24,1,0.496875416979868,"Hofstra","Charleston",4,4,0,0,-1,400919577,2017-02-16
82,1,"5:38",1538,1538,"Eli Pemberton missed Three Point Jumper.",25,24,1,0.504857434983318,"Hofstra","Charleston",4,4,0,0,-1,400919577,2017-02-16
83,1,"5:38",1538,1538,"Hunter Sabety Offensive Rebound.",25,24,1,0.504857434983318,"Hofstra","Charleston",4,4,0,0,-1,400919577,2017-02-16
84,1,"5:34",1534,1534,"Hunter Sabety made Layup.",27,24,3,0.574074907783295,"Hofstra","Charleston",4,4,0,0,-1,400919577,2017-02-16
85,1,"5:10",1510,1510,"Grant Riller made Jumper.",27,26,1,0.525140603177665,"Hofstra","Charleston",4,4,0,0,-1,400919577,2017-02-16
86,1,"5:10",1510,1510,"Foul on Eli Pemberton.",27,26,1,0.525140603177665,"Hofstra","Charleston",4,4,0,0,-1,400919577,2017-02-16
87,1,"5:10",1510,1510,"Grant Riller missed Free Throw.",27,26,1,0.525140603177665,"Hofstra","Charleston",4,4,0,0,-1,400919577,2017-02-16
88,1,"5:10",1510,1510,"Justin Wright-Foreman Defensive Rebound.",27,26,1,0.525140603177665,"Hofstra","Charleston",4,4,0,0,-1,400919577,2017-02-16
89,1,"4:52",1492,1492,"Jamall Robinson made Jumper. Assisted by Hunter Sabety.",29,26,3,0.5943726457095,"Hofstra","Charleston",4,4,0,0,-1,400919577,2017-02-16
90,1,"4:20",1460,1460,"Cameron Johnson missed Three Point Jumper.",29,26,3,0.593567194135177,"Hofstra","Charleston",4,4,0,0,-1,400919577,2017-02-16
91,1,"4:20",1460,1460,"Charleston Offensive Rebound.",29,26,3,0.593567194135177,"Hofstra","Charleston",4,4,0,0,-1,400919577,2017-02-16
92,1,"4:16",1456,1456,"Foul on Brian Bernardi.",29,26,3,0.565368395142357,"Hofstra","Charleston",4,4,0,0,-1,400919577,2017-02-16
93,1,"4:11",1451,1451,"Marquise Pointer missed Three Point Jumper.",29,26,3,0.565368395142357,"Hofstra","Charleston",4,4,0,0,-1,400919577,2017-02-16
94,1,"4:11",1451,1451,"Hofstra Defensive Rebound.",29,26,3,0.565368395142357,"Hofstra","Charleston",4,4,0,0,-1,400919577,2017-02-16
95,1,"3:54",1434,1434,"Rokas Gustys made Layup. Assisted by Eli Pemberton.",31,26,5,0.665944167528562,"Hofstra","Charleston",4,4,0,0,-1,400919577,2017-02-16
96,1,"3:35",1415,1415,"Marquise Pointer made Jumper.",31,28,3,0.585176797710767,"Hofstra","Charleston",4,4,0,0,-1,400919577,2017-02-16
97,1,"3:05",1385,1385,"Deron Powers missed Three Point Jumper.",31,28,3,0.592680234856946,"Hofstra","Charleston",4,4,0,0,-1,400919577,2017-02-16
98,1,"3:05",1385,1385,"Jarrell Brantley Defensive Rebound.",31,28,3,0.592680234856946,"Hofstra","Charleston",4,4,0,0,-1,400919577,2017-02-16
99,1,"2:53",1373,1373,"Jarrell Brantley made Jumper.",31,30,1,0.490672778915511,"Hofstra","Charleston",4,4,0,0,-1,400919577,2017-02-16
100,1,"2:39",1359,1359,"Deron Powers Turnover.",31,30,1,0.524908723328341,"Hofstra","Charleston",4,4,0,0,-1,400919577,2017-02-16
101,1,"2:36",1356,1356,"Jarrell Brantley Steal.",31,30,1,0.524908723328341,"Hofstra","Charleston",4,4,0,0,-1,400919577,2017-02-16
102,1,"2:34",1354,1354,"Jarrell Brantley made Layup.",31,32,-1,0.447880000102395,"Hofstra","Charleston",4,4,0,0,-1,400919577,2017-02-16
103,1,"2:13",1333,1333,"Rokas Gustys missed Layup.",31,32,-1,0.420683456092387,"Hofstra","Charleston",4,4,0,0,-1,400919577,2017-02-16
104,1,"2:13",1333,1333,"Nick Harris Block.",31,32,-1,0.420683456092387,"Hofstra","Charleston",4,4,0,0,-1,400919577,2017-02-16
105,1,"2:11",1331,1331,"Cameron Johnson Defensive Rebound.",31,32,-1,0.420683456092387,"Hofstra","Charleston",4,4,0,0,-1,400919577,2017-02-16
106,1,"2:05",1325,1325,"Joe Chealey made Three Point Jumper. Assisted by Jarrell Brantley.",31,35,-4,0.320865920677924,"Hofstra","Charleston",4,4,0,0,-1,400919577,2017-02-16
107,1,"2:02",1322,1322,"Hofstra  Timeout",31,35,-4,0.320865920677924,"Hofstra","Charleston",3,4,1,0,-1,400919577,2017-02-16
108,1,"2:02",1322,1322,"Official TV Timeout",31,35,-4,0.320865920677924,"Hofstra","Charleston",3,4,1,0,-1,400919577,2017-02-16
109,1,"1:47",1307,1307,"Justin Wright-Foreman missed Three Point Jumper.",31,35,-4,0.340916173817709,"Hofstra","Charleston",3,4,1,0,-1,400919577,2017-02-16
110,1,"1:47",1307,1307,"Nick Harris Defensive Rebound.",31,35,-4,0.340916173817709,"Hofstra","Charleston",3,4,1,0,-1,400919577,2017-02-16
111,1,"1:31",1291,1291,"Marquise Pointer missed Jumper.",31,35,-4,0.340720921120405,"Hofstra","Charleston",3,4,1,0,-1,400919577,2017-02-16
112,1,"1:31",1291,1291,"Rokas Gustys Defensive Rebound.",31,35,-4,0.340720921120405,"Hofstra","Charleston",3,4,1,0,-1,400919577,2017-02-16
113,1,"1:19",1279,1279,"Brian Bernardi made Three Point Jumper. Assisted by Deron Powers.",34,35,-1,0.41724863229332,"Hofstra","Charleston",3,4,1,0,-1,400919577,2017-02-16
114,1,"0:57",1257,1257,"Marquise Pointer made Three Point Jumper. Assisted by Joe Chealey.",34,38,-4,0.330983005800027,"Hofstra","Charleston",3,4,0,0,-1,400919577,2017-02-16
115,1,"0:32",1232,1232,"Brian Bernardi missed Three Point Jumper.",34,38,-4,0.315869576680197,"Hofstra","Charleston",3,4,0,0,-1,400919577,2017-02-16
116,1,"0:32",1232,1232,"Marquise Pointer Defensive Rebound.",34,38,-4,0.315869576680197,"Hofstra","Charleston",3,4,0,0,-1,400919577,2017-02-16
117,1,"0:01",1201,1201,"Jarrell Brantley missed Layup.",34,38,-4,0.320592748731623,"Hofstra","Charleston",3,4,0,0,-1,400919577,2017-02-16
118,1,"0:01",1201,1201,"Rokas Gustys Block.",34,38,-4,0.320592748731623,"Hofstra","Charleston",3,4,0,0,-1,400919577,2017-02-16
119,1,"0:01",1201,1201,"Nick Harris Offensive Rebound.",34,38,-4,0.320592748731623,"Hofstra","Charleston",3,4,0,0,-1,400919577,2017-02-16
120,1,"0:00",1200,1200,"Nick Harris made Layup.",34,40,-6,0.255488624487435,"Hofstra","Charleston",3,4,0,0,-1,400919577,2017-02-16
121,1,"0:00",1200,1200,"End of 1st half",34,38,-4,0.320592748731623,"Hofstra","Charleston",3,4,0,0,-1,400919577,2017-02-16
122,2,"20:00",1200,1200,"PLAY",34,38,-4,0.320592748731623,"Hofstra","Charleston",4,4,0,0,-1,400919577,2017-02-16
123,2,"19:46",1186,1186,"Justin Wright-Foreman made Three Point Jumper.",37,40,-3,0.350920777196309,"Hofstra","Charleston",4,4,0,0,-1,400919577,2017-02-16
124,2,"19:18",1158,1158,"Grant Riller made Jumper. Assisted by Jarrell Brantley.",37,42,-5,0.291993875909494,"Hofstra","Charleston",4,4,0,0,-1,400919577,2017-02-16
125,2,"18:57",1137,1137,"Brian Bernardi made Three Point Jumper. Assisted by Eli Pemberton.",40,42,-2,0.397864942234446,"Hofstra","Charleston",4,4,0,0,-1,400919577,2017-02-16
126,2,"18:35",1115,1115,"Grant Riller missed Jumper.",40,42,-2,0.400468250066829,"Hofstra","Charleston",4,4,0,0,-1,400919577,2017-02-16
127,2,"18:35",1115,1115,"Justin Wright-Foreman Block.",40,42,-2,0.400468250066829,"Hofstra","Charleston",4,4,0,0,-1,400919577,2017-02-16
128,2,"18:32",1112,1112,"Rokas Gustys Defensive Rebound.",40,42,-2,0.400468250066829,"Hofstra","Charleston",4,4,0,0,-1,400919577,2017-02-16
129,2,"18:24",1104,1104,"Brian Bernardi missed Three Point Jumper.",40,42,-2,0.391109919512709,"Hofstra","Charleston",4,4,0,0,-1,400919577,2017-02-16
130,2,"18:24",1104,1104,"Jarrell Brantley Defensive Rebound.",40,42,-2,0.391109919512709,"Hofstra","Charleston",4,4,0,0,-1,400919577,2017-02-16
131,2,"18:19",1099,1099,"Jarrell Brantley Turnover.",40,42,-2,0.397867453252596,"Hofstra","Charleston",4,4,0,0,-1,400919577,2017-02-16
132,2,"18:17",1097,1097,"Justin Wright-Foreman Steal.",40,42,-2,0.397867453252596,"Hofstra","Charleston",4,4,0,0,-1,400919577,2017-02-16
133,2,"18:17",1097,1097,"Justin Wright-Foreman missed Layup.",40,42,-2,0.397867453252596,"Hofstra","Charleston",4,4,0,0,-1,400919577,2017-02-16
134,2,"18:17",1097,1097,"Joe Chealey Defensive Rebound.",40,42,-2,0.397867453252596,"Hofstra","Charleston",4,4,0,0,-1,400919577,2017-02-16
135,2,"18:09",1089,1089,"Foul on Rokas Gustys.",40,42,-2,0.38014563065874,"Hofstra","Charleston",4,4,0,0,-1,400919577,2017-02-16
136,2,"18:09",1089,1089,"Joe Chealey made Free Throw.",40,43,-3,0.339397859009715,"Hofstra","Charleston",4,4,0,0,-1,400919577,2017-02-16
137,2,"18:09",1089,1089,"Joe Chealey missed Free Throw.",40,43,-3,0.339397859009715,"Hofstra","Charleston",4,4,0,0,-1,400919577,2017-02-16
138,2,"18:09",1089,1089,"Rokas Gustys Defensive Rebound.",40,43,-3,0.339397859009715,"Hofstra","Charleston",4,4,0,0,-1,400919577,2017-02-16
139,2,"17:56",1076,1076,"Eli Pemberton missed Three Point Jumper.",40,43,-3,0.368413038092713,"Hofstra","Charleston",4,4,0,0,-1,400919577,2017-02-16
140,2,"17:56",1076,1076,"Grant Riller Defensive Rebound.",40,43,-3,0.368413038092713,"Hofstra","Charleston",4,4,0,0,-1,400919577,2017-02-16
141,2,"17:37",1057,1057,"Foul on Justin Wright-Foreman.",40,43,-3,0.354434379367399,"Hofstra","Charleston",4,4,0,0,-1,400919577,2017-02-16
142,2,"17:25",1045,1045,"Foul on Justin Wright-Foreman.",40,43,-3,0.365008728840464,"Hofstra","Charleston",4,4,0,0,-1,400919577,2017-02-16
143,2,"17:25",1045,1045,"Jarrell Brantley missed Free Throw.",40,43,-3,0.365008728840464,"Hofstra","Charleston",4,4,0,0,-1,400919577,2017-02-16
144,2,"17:25",1045,1045,"Charleston Deadball Team Rebound.",40,43,-3,0.365008728840464,"Hofstra","Charleston",4,4,0,0,-1,400919577,2017-02-16
145,2,"17:25",1045,1045,"Jarrell Brantley made Free Throw.",40,44,-4,0.325440694901796,"Hofstra","Charleston",4,4,0,0,-1,400919577,2017-02-16
146,2,"17:10",1030,1030,"Eli Pemberton missed Jumper.",40,44,-4,0.307014206220456,"Hofstra","Charleston",4,4,0,0,-1,400919577,2017-02-16
147,2,"17:10",1030,1030,"Rokas Gustys Offensive Rebound.",40,44,-4,0.307014206220456,"Hofstra","Charleston",4,4,0,0,-1,400919577,2017-02-16
148,2,"17:05",1025,1025,"Rokas Gustys Turnover.",40,44,-4,0.315510779037666,"Hofstra","Charleston",4,4,0,0,-1,400919577,2017-02-16
149,2,"17:03",1023,1023,"Cameron Johnson Steal.",40,44,-4,0.315510779037666,"Hofstra","Charleston",4,4,0,0,-1,400919577,2017-02-16
150,2,"16:58",1018,1018,"Cameron Johnson made Three Point Jumper. Assisted by Joe Chealey.",40,47,-7,0.187189283652101,"Hofstra","Charleston",4,4,0,0,-1,400919577,2017-02-16
151,2,"16:42",1002,1002,"Foul on Nick Harris.",40,47,-7,0.189750985070979,"Hofstra","Charleston",4,4,0,0,-1,400919577,2017-02-16
152,2,"16:42",1002,1002,"Eli Pemberton made Free Throw.",41,47,-6,0.220040038009084,"Hofstra","Charleston",4,4,0,0,-1,400919577,2017-02-16
153,2,"16:42",1002,1002,"Eli Pemberton missed Free Throw.",41,47,-6,0.220040038009084,"Hofstra","Charleston",4,4,0,0,-1,400919577,2017-02-16
154,2,"16:42",1002,1002,"Jarrell Brantley Defensive Rebound.",41,47,-6,0.220040038009084,"Hofstra","Charleston",4,4,0,0,-1,400919577,2017-02-16
155,2,"16:17",977,977,"Jarrell Brantley Turnover.",41,47,-6,0.243338056340533,"Hofstra","Charleston",4,4,0,0,-1,400919577,2017-02-16
156,2,"15:58",958,958,"Rokas Gustys Turnover.",41,47,-6,0.211903604271742,"Hofstra","Charleston",4,4,0,0,-1,400919577,2017-02-16
157,2,"15:56",956,956,"Jarrell Brantley Steal.",41,47,-6,0.211903604271742,"Hofstra","Charleston",4,4,0,0,-1,400919577,2017-02-16
158,2,"15:48",948,948,"Joe Chealey made Layup.",41,49,-8,0.173980477630072,"Hofstra","Charleston",4,4,0,0,-1,400919577,2017-02-16
159,2,"15:26",926,926,"Rokas Gustys made Dunk. Assisted by Deron Powers.",43,49,-6,0.207691246122768,"Hofstra","Charleston",4,4,0,0,-1,400919577,2017-02-16
160,2,"15:02",902,902,"Grant Riller missed Jumper.",43,49,-6,0.225925941550224,"Hofstra","Charleston",4,4,0,0,-1,400919577,2017-02-16
161,2,"15:02",902,902,"Chevez Goodwin Offensive Rebound.",43,49,-6,0.225925941550224,"Hofstra","Charleston",4,4,0,0,-1,400919577,2017-02-16
162,2,"14:59",899,899,"Chevez Goodwin missed Jumper.",43,49,-6,0.230935781666655,"Hofstra","Charleston",4,4,0,0,-1,400919577,2017-02-16
163,2,"14:59",899,899,"Joe Chealey Offensive Rebound.",43,49,-6,0.230935781666655,"Hofstra","Charleston",4,4,0,0,-1,400919577,2017-02-16
164,2,"14:59",899,899,"Foul on Eli Pemberton.",43,49,-6,0.230935781666655,"Hofstra","Charleston",4,4,0,0,-1,400919577,2017-02-16
165,2,"14:59",899,899,"Official TV Timeout",43,49,-6,0.230935781666655,"Hofstra","Charleston",4,4,0,0,-1,400919577,2017-02-16
166,2,"14:48",888,888,"Jarrell Brantley made Layup.",43,51,-8,0.182340157976204,"Hofstra","Charleston",4,4,0,0,-1,400919577,2017-02-16
167,2,"14:32",872,872,"Justin Wright-Foreman missed Three Point Jumper.",43,51,-8,0.166558057101182,"Hofstra","Charleston",4,4,0,0,-1,400919577,2017-02-16
168,2,"14:32",872,872,"Joe Chealey Defensive Rebound.",43,51,-8,0.166558057101182,"Hofstra","Charleston",4,4,0,0,-1,400919577,2017-02-16
169,2,"14:24",864,864,"Joe Chealey Turnover.",43,51,-8,0.157897913825757,"Hofstra","Charleston",4,4,0,0,-1,400919577,2017-02-16
170,2,"14:05",845,845,"Brian Bernardi missed Three Point Jumper.",43,51,-8,0.143695885045908,"Hofstra","Charleston",4,4,0,0,-1,400919577,2017-02-16
171,2,"14:05",845,845,"Hofstra Offensive Rebound.",43,51,-8,0.143695885045908,"Hofstra","Charleston",4,4,0,0,-1,400919577,2017-02-16
172,2,"14:00",840,840,"Foul on Joe Chealey.",43,51,-8,0.143695885045908,"Hofstra","Charleston",4,4,0,0,-1,400919577,2017-02-16
173,2,"13:48",828,828,"Justin Wright-Foreman made Three Point Jumper.",46,51,-5,0.260809882119809,"Hofstra","Charleston",4,4,0,0,-1,400919577,2017-02-16
174,2,"13:16",796,796,"Nick Harris missed Jumper.",46,51,-5,0.229770290178563,"Hofstra","Charleston",4,4,0,0,-1,400919577,2017-02-16
175,2,"13:16",796,796,"Jaylen McManus Offensive Rebound.",46,51,-5,0.229770290178563,"Hofstra","Charleston",4,4,0,0,-1,400919577,2017-02-16
176,2,"13:11",791,791,"Jaylen McManus missed Layup.",46,51,-5,0.229770290178563,"Hofstra","Charleston",4,4,0,0,-1,400919577,2017-02-16
177,2,"13:11",791,791,"Hunter Sabety Block.",46,51,-5,0.229770290178563,"Hofstra","Charleston",4,4,0,0,-1,400919577,2017-02-16
178,2,"13:10",790,790,"Jaylen McManus Offensive Rebound.",46,51,-5,0.229770290178563,"Hofstra","Charleston",4,4,0,0,-1,400919577,2017-02-16
179,2,"13:06",786,786,"Joe Chealey made Three Point Jumper. Assisted by Jaylen McManus.",46,54,-8,0.148688330132197,"Hofstra","Charleston",4,4,0,0,-1,400919577,2017-02-16
180,2,"12:44",764,764,"Justin Wright-Foreman made Three Point Jumper. Assisted by Deron Powers.",49,54,-5,0.249448342593858,"Hofstra","Charleston",4,4,0,0,-1,400919577,2017-02-16
181,2,"12:18",738,738,"Joe Chealey made Jumper.",49,56,-7,0.180977537780621,"Hofstra","Charleston",4,4,0,0,-1,400919577,2017-02-16
182,2,"11:53",713,713,"Eli Pemberton Turnover.",49,56,-7,0.151116380300044,"Hofstra","Charleston",4,4,0,0,-1,400919577,2017-02-16
183,2,"11:51",711,711,"Jarrell Brantley Steal.",49,56,-7,0.151116380300044,"Hofstra","Charleston",4,4,0,0,-1,400919577,2017-02-16
