"play_id","half","time_remaining_half","secs_remaining","secs_remaining_absolute","description","home_score","away_score","score_diff","win_prob","home","away","home_time_out_remaining","away_time_out_remaining","home_timeout_ind","away_timeout_ind","home_favored_by","game_id","date"
1,1,"20:00",2400,2400,"PLAY",0,0,0,0.791391452080446,"Charleston","Elon",4,4,0,0,6.2,400919574,2017-02-04
2,1,"19:37",2377,2377,"Joe Chealey missed Three Point Jumper.",0,0,0,0.786548075806206,"Charleston","Elon",4,4,0,0,6.2,400919574,2017-02-04
3,1,"19:37",2377,2377,"Dmitri Thompson Defensive Rebound.",0,0,0,0.786548075806206,"Charleston","Elon",4,4,0,0,6.2,400919574,2017-02-04
4,1,"19:26",2366,2366,"Brian Dawkins missed Three Point Jumper.",0,0,0,0.772715174671659,"Charleston","Elon",4,4,0,0,6.2,400919574,2017-02-04
5,1,"19:26",2366,2366,"Jarrell Brantley Defensive Rebound.",0,0,0,0.772715174671659,"Charleston","Elon",4,4,0,0,6.2,400919574,2017-02-04
6,1,"19:00",2340,2340,"Foul on Brian Dawkins.",0,0,0,0.775491544324429,"Charleston","Elon",4,4,0,0,6.2,400919574,2017-02-04
7,1,"19:00",2340,2340,"Jarrell Brantley missed Free Throw.",0,0,0,0.775491544324429,"Charleston","Elon",4,4,0,0,6.2,400919574,2017-02-04
8,1,"19:00",2340,2340,"Charleston Deadball Team Rebound.",0,0,0,0.775491544324429,"Charleston","Elon",4,4,0,0,6.2,400919574,2017-02-04
9,1,"19:00",2340,2340,"Jarrell Brantley made Free Throw.",1,0,1,0.790736132392761,"Charleston","Elon",4,4,0,0,6.2,400919574,2017-02-04
10,1,"18:39",2319,2319,"Tyler Seibring missed Three Point Jumper.",1,0,1,0.783612153055818,"Charleston","Elon",4,4,0,0,6.2,400919574,2017-02-04
11,1,"18:39",2319,2319,"Jarrell Brantley Defensive Rebound.",1,0,1,0.783612153055818,"Charleston","Elon",4,4,0,0,6.2,400919574,2017-02-04
12,1,"18:26",2306,2306,"Grant Riller made Three Point Jumper.",4,0,4,0.832226982323755,"Charleston","Elon",4,4,0,0,6.2,400919574,2017-02-04
13,1,"18:01",2281,2281,"Steven Santa Ana missed Three Point Jumper.",4,0,4,0.838544700015589,"Charleston","Elon",4,4,0,0,6.2,400919574,2017-02-04
14,1,"18:01",2281,2281,"Brian Dawkins Offensive Rebound.",4,0,4,0.838544700015589,"Charleston","Elon",4,4,0,0,6.2,400919574,2017-02-04
15,1,"17:57",2277,2277,"Brian Dawkins made Layup.",4,2,2,0.813607143902939,"Charleston","Elon",4,4,0,0,6.2,400919574,2017-02-04
16,1,"17:36",2256,2256,"Joe Chealey made Three Point Jumper. Assisted by Cameron Johnson.",7,2,5,0.846830595672205,"Charleston","Elon",4,4,0,0,6.2,400919574,2017-02-04
17,1,"17:06",2226,2226,"Tyler Seibring missed Three Point Jumper.",7,2,5,0.854318882751147,"Charleston","Elon",4,4,0,0,6.2,400919574,2017-02-04
18,1,"17:06",2226,2226,"Grant Riller Defensive Rebound.",7,2,5,0.854318882751147,"Charleston","Elon",4,4,0,0,6.2,400919574,2017-02-04
19,1,"16:58",2218,2218,"Cameron Johnson made Three Point Jumper. Assisted by Joe Chealey.",10,2,8,0.907391853562322,"Charleston","Elon",4,4,0,0,6.2,400919574,2017-02-04
20,1,"16:43",2203,2203,"Tyler Seibring missed Jumper.",10,2,8,0.894732516188124,"Charleston","Elon",4,4,0,0,6.2,400919574,2017-02-04
21,1,"16:43",2203,2203,"Nick Harris Defensive Rebound.",10,2,8,0.894732516188124,"Charleston","Elon",4,4,0,0,6.2,400919574,2017-02-04
22,1,"16:33",2193,2193,"Joe Chealey missed Three Point Jumper.",10,2,8,0.902408559342225,"Charleston","Elon",4,4,0,0,6.2,400919574,2017-02-04
23,1,"16:33",2193,2193,"Tyler Seibring Defensive Rebound.",10,2,8,0.902408559342225,"Charleston","Elon",4,4,0,0,6.2,400919574,2017-02-04
24,1,"16:24",2184,2184,"Steven Santa Ana missed Three Point Jumper.",10,2,8,0.890855663922418,"Charleston","Elon",4,4,0,0,6.2,400919574,2017-02-04
25,1,"16:24",2184,2184,"Jarrell Brantley Defensive Rebound.",10,2,8,0.890855663922418,"Charleston","Elon",4,4,0,0,6.2,400919574,2017-02-04
26,1,"15:57",2157,2157,"Cameron Johnson missed Three Point Jumper.",10,2,8,0.895018126554916,"Charleston","Elon",4,4,0,0,6.2,400919574,2017-02-04
27,1,"15:57",2157,2157,"Dainan Swoope Defensive Rebound.",10,2,8,0.895018126554916,"Charleston","Elon",4,4,0,0,6.2,400919574,2017-02-04
28,1,"15:42",2142,2142,"Brian Dawkins missed Three Point Jumper.",10,2,8,0.887436496437344,"Charleston","Elon",4,4,0,0,6.2,400919574,2017-02-04
29,1,"15:42",2142,2142,"Cameron Johnson Defensive Rebound.",10,2,8,0.887436496437344,"Charleston","Elon",4,4,0,0,6.2,400919574,2017-02-04
30,1,"15:29",2129,2129,"Nick Harris missed Layup.",10,2,8,0.891631317613676,"Charleston","Elon",4,4,0,0,6.2,400919574,2017-02-04
31,1,"15:29",2129,2129,"Tyler Seibring Block.",10,2,8,0.891631317613676,"Charleston","Elon",4,4,0,0,6.2,400919574,2017-02-04
32,1,"15:28",2128,2128,"Tyler Seibring Defensive Rebound.",10,2,8,0.891631317613676,"Charleston","Elon",4,4,0,0,6.2,400919574,2017-02-04
33,1,"15:24",2124,2124,"Dainan Swoope made Three Point Jumper.",10,5,5,0.853669186116492,"Charleston","Elon",4,4,0,0,6.2,400919574,2017-02-04
34,1,"14:49",2089,2089,"Jarrell Brantley missed Jumper.",10,5,5,0.851563417885445,"Charleston","Elon",4,4,0,0,6.2,400919574,2017-02-04
35,1,"14:49",2089,2089,"Steven Santa Ana Defensive Rebound.",10,5,5,0.851563417885445,"Charleston","Elon",4,4,0,0,6.2,400919574,2017-02-04
36,1,"14:29",2069,2069,"Brian Dawkins made Three Point Jumper. Assisted by Steven Santa Ana.",10,8,2,0.802123722162123,"Charleston","Elon",4,4,0,0,6.2,400919574,2017-02-04
37,1,"14:03",2043,2043,"Cameron Johnson missed Three Point Jumper.",10,8,2,0.794440543047979,"Charleston","Elon",4,4,0,0,6.2,400919574,2017-02-04
38,1,"14:03",2043,2043,"Tyler Seibring Defensive Rebound.",10,8,2,0.794440543047979,"Charleston","Elon",4,4,0,0,6.2,400919574,2017-02-04
39,1,"13:47",2027,2027,"Foul on Grant Riller.",10,8,2,0.808453420350348,"Charleston","Elon",4,4,0,0,6.2,400919574,2017-02-04
40,1,"13:47",2027,2027,"Official TV Timeout",10,8,2,0.808453420350348,"Charleston","Elon",4,4,0,0,6.2,400919574,2017-02-04
41,1,"13:40",2020,2020,"Dainan Swoope made Three Point Jumper. Assisted by Luke Eddy.",10,11,-1,0.739691815877134,"Charleston","Elon",4,4,0,0,6.2,400919574,2017-02-04
42,1,"13:33",2013,2013,"Jarrell Brantley missed Three Point Jumper.",10,11,-1,0.7483822567554,"Charleston","Elon",4,4,0,0,6.2,400919574,2017-02-04
43,1,"13:33",2013,2013,"Joe Chealey Offensive Rebound.",10,11,-1,0.7483822567554,"Charleston","Elon",4,4,0,0,6.2,400919574,2017-02-04
44,1,"13:09",1989,1989,"Cameron Johnson missed Jumper.",10,11,-1,0.725806428190153,"Charleston","Elon",4,4,0,0,6.2,400919574,2017-02-04
45,1,"13:09",1989,1989,"Luke Eddy Defensive Rebound.",10,11,-1,0.725806428190153,"Charleston","Elon",4,4,0,0,6.2,400919574,2017-02-04
46,1,"12:53",1973,1973,"Dainan Swoope missed Jumper.",10,11,-1,0.748925818808861,"Charleston","Elon",4,4,0,0,6.2,400919574,2017-02-04
47,1,"12:53",1973,1973,"Jarrell Brantley Defensive Rebound.",10,11,-1,0.748925818808861,"Charleston","Elon",4,4,0,0,6.2,400919574,2017-02-04
48,1,"12:41",1961,1961,"Jarrell Brantley Turnover.",10,11,-1,0.745244160574454,"Charleston","Elon",4,4,0,0,6.2,400919574,2017-02-04
49,1,"12:23",1943,1943,"Karolis Kundrotas missed Jumper.",10,11,-1,0.737132175913297,"Charleston","Elon",4,4,0,0,6.2,400919574,2017-02-04
50,1,"12:23",1943,1943,"Jarrell Brantley Defensive Rebound.",10,11,-1,0.737132175913297,"Charleston","Elon",4,4,0,0,6.2,400919574,2017-02-04
51,1,"12:14",1934,1934,"Grant Riller missed Jumper.",10,11,-1,0.727629008157119,"Charleston","Elon",4,4,0,0,6.2,400919574,2017-02-04
52,1,"12:14",1934,1934,"Dainan Swoope Block.",10,11,-1,0.727629008157119,"Charleston","Elon",4,4,0,0,6.2,400919574,2017-02-04
53,1,"12:10",1930,1930,"Charleston Offensive Rebound.",10,11,-1,0.727629008157119,"Charleston","Elon",4,4,0,0,6.2,400919574,2017-02-04
54,1,"12:08",1928,1928,"Chevez Goodwin missed Jumper.",10,11,-1,0.741053373371678,"Charleston","Elon",4,4,0,0,6.2,400919574,2017-02-04
55,1,"12:08",1928,1928,"Dmitri Thompson Defensive Rebound.",10,11,-1,0.741053373371678,"Charleston","Elon",4,4,0,0,6.2,400919574,2017-02-04
56,1,"11:55",1915,1915,"Karolis Kundrotas missed Layup.",10,11,-1,0.750125779462231,"Charleston","Elon",4,4,0,0,6.2,400919574,2017-02-04
57,1,"11:55",1915,1915,"Chevez Goodwin Defensive Rebound.",10,11,-1,0.750125779462231,"Charleston","Elon",4,4,0,0,6.2,400919574,2017-02-04
58,1,"11:52",1912,1912,"Chevez Goodwin Turnover.",10,11,-1,0.750125779462231,"Charleston","Elon",4,4,0,0,6.2,400919574,2017-02-04
59,1,"11:51",1911,1911,"Luke Eddy Steal.",10,11,-1,0.750125779462231,"Charleston","Elon",4,4,0,0,6.2,400919574,2017-02-04
60,1,"11:09",1869,1869,"Steven Santa Ana Turnover.",10,11,-1,0.73621103084173,"Charleston","Elon",4,4,0,0,6.2,400919574,2017-02-04
61,1,"11:09",1869,1869,"Official TV Timeout",10,11,-1,0.73621103084173,"Charleston","Elon",4,4,0,0,6.2,400919574,2017-02-04
62,1,"11:00",1860,1860,"Joe Chealey made Layup.",12,11,1,0.785049790494053,"Charleston","Elon",4,4,0,0,6.2,400919574,2017-02-04
63,1,"10:41",1841,1841,"Steven Santa Ana made Layup.",12,13,-1,0.724783386064041,"Charleston","Elon",4,4,0,0,6.2,400919574,2017-02-04
64,1,"10:28",1828,1828,"Joe Chealey missed Jumper.",12,13,-1,0.753896600329443,"Charleston","Elon",4,4,0,0,6.2,400919574,2017-02-04
65,1,"10:28",1828,1828,"Brian Dawkins Defensive Rebound.",12,13,-1,0.753896600329443,"Charleston","Elon",4,4,0,0,6.2,400919574,2017-02-04
66,1,"10:12",1812,1812,"Christian Hairston missed Jumper.",12,13,-1,0.732430718137052,"Charleston","Elon",4,4,0,0,6.2,400919574,2017-02-04
67,1,"10:12",1812,1812,"Grant Riller Block.",12,13,-1,0.732430718137052,"Charleston","Elon",4,4,0,0,6.2,400919574,2017-02-04
68,1,"10:11",1811,1811,"Nick Harris Defensive Rebound.",12,13,-1,0.732430718137052,"Charleston","Elon",4,4,0,0,6.2,400919574,2017-02-04
69,1,"10:02",1802,1802,"Grant Riller made Layup.",14,13,1,0.778230854201962,"Charleston","Elon",4,4,0,0,6.2,400919574,2017-02-04
70,1,"9:33",1773,1773,"Dmitri Thompson missed Three Point Jumper.",14,13,1,0.766907064531887,"Charleston","Elon",4,4,0,0,6.2,400919574,2017-02-04
71,1,"9:33",1773,1773,"Joe Chealey Defensive Rebound.",14,13,1,0.766907064531887,"Charleston","Elon",4,4,0,0,6.2,400919574,2017-02-04
72,1,"9:30",1770,1770,"Foul on Christian Hairston.",14,13,1,0.766907064531887,"Charleston","Elon",4,4,0,0,6.2,400919574,2017-02-04
73,1,"9:21",1761,1761,"Marquise Pointer missed Jumper.",14,13,1,0.787316273490633,"Charleston","Elon",4,4,0,0,6.2,400919574,2017-02-04
74,1,"9:21",1761,1761,"Luke Eddy Defensive Rebound.",14,13,1,0.787316273490633,"Charleston","Elon",4,4,0,0,6.2,400919574,2017-02-04
75,1,"9:10",1750,1750,"Luke Eddy missed Jumper.",14,13,1,0.770749472602384,"Charleston","Elon",4,4,0,0,6.2,400919574,2017-02-04
76,1,"9:10",1750,1750,"Joe Chealey Defensive Rebound.",14,13,1,0.770749472602384,"Charleston","Elon",4,4,0,0,6.2,400919574,2017-02-04
77,1,"8:58",1738,1738,"Evan Bailey missed Jumper.",14,13,1,0.778346266501266,"Charleston","Elon",4,4,0,0,6.2,400919574,2017-02-04
78,1,"8:58",1738,1738,"Luke Eddy Defensive Rebound.",14,13,1,0.778346266501266,"Charleston","Elon",4,4,0,0,6.2,400919574,2017-02-04
79,1,"8:38",1718,1718,"Foul on Evan Bailey.",14,13,1,0.785080403276162,"Charleston","Elon",4,4,0,0,6.2,400919574,2017-02-04
80,1,"8:38",1718,1718,"Tyler Seibring made Free Throw.",14,14,0,0.761703630695794,"Charleston","Elon",4,4,0,0,6.2,400919574,2017-02-04
81,1,"8:38",1718,1718,"Tyler Seibring made Free Throw.",14,15,-1,0.736637139494957,"Charleston","Elon",4,4,0,0,6.2,400919574,2017-02-04
82,1,"8:18",1698,1698,"Jaylen McManus missed Three Point Jumper.",14,15,-1,0.724124263975659,"Charleston","Elon",4,4,0,0,6.2,400919574,2017-02-04
83,1,"8:18",1698,1698,"Tyler Seibring Defensive Rebound.",14,15,-1,0.724124263975659,"Charleston","Elon",4,4,0,0,6.2,400919574,2017-02-04
84,1,"8:00",1680,1680,"Dmitri Thompson Turnover.",14,15,-1,0.731808485380929,"Charleston","Elon",4,4,0,0,6.2,400919574,2017-02-04
85,1,"7:59",1679,1679,"Nick Harris Steal.",14,15,-1,0.72747671204138,"Charleston","Elon",4,4,0,0,6.2,400919574,2017-02-04
86,1,"7:56",1676,1676,"Marquise Pointer missed Three Point Jumper.",14,15,-1,0.72747671204138,"Charleston","Elon",4,4,0,0,6.2,400919574,2017-02-04
87,1,"7:56",1676,1676,"Steven Santa Ana Defensive Rebound.",14,15,-1,0.72747671204138,"Charleston","Elon",4,4,0,0,6.2,400919574,2017-02-04
88,1,"7:35",1655,1655,"Brian Dawkins made Jumper.",14,17,-3,0.666669346465886,"Charleston","Elon",4,4,0,0,6.2,400919574,2017-02-04
89,1,"7:16",1636,1636,"Grant Riller missed Jumper.",14,17,-3,0.673111250345262,"Charleston","Elon",4,4,0,0,6.2,400919574,2017-02-04
90,1,"7:16",1636,1636,"Dmitri Thompson Defensive Rebound.",14,17,-3,0.673111250345262,"Charleston","Elon",4,4,0,0,6.2,400919574,2017-02-04
91,1,"7:00",1620,1620,"Brian Dawkins missed Three Point Jumper.",14,17,-3,0.656918021028501,"Charleston","Elon",4,4,0,0,6.2,400919574,2017-02-04
92,1,"7:00",1620,1620,"Tyler Seibring Offensive Rebound.",14,17,-3,0.656918021028501,"Charleston","Elon",4,4,0,0,6.2,400919574,2017-02-04
93,1,"6:49",1609,1609,"Steven Santa Ana missed Jumper.",14,17,-3,0.666928679055856,"Charleston","Elon",4,4,0,0,6.2,400919574,2017-02-04
94,1,"6:49",1609,1609,"Nick Harris Block.",14,17,-3,0.666928679055856,"Charleston","Elon",4,4,0,0,6.2,400919574,2017-02-04
95,1,"6:48",1608,1608,"Grant Riller Defensive Rebound.",14,17,-3,0.666928679055856,"Charleston","Elon",4,4,0,0,6.2,400919574,2017-02-04
96,1,"6:44",1604,1604,"Grant Riller made Layup.",16,17,-1,0.72253309351841,"Charleston","Elon",4,4,0,0,6.2,400919574,2017-02-04
97,1,"6:14",1574,1574,"Brian Dawkins missed Layup.",16,17,-1,0.719419164900138,"Charleston","Elon",4,4,0,0,6.2,400919574,2017-02-04
98,1,"6:14",1574,1574,"Brian Dawkins Offensive Rebound.",16,17,-1,0.719419164900138,"Charleston","Elon",4,4,0,0,6.2,400919574,2017-02-04
99,1,"6:11",1571,1571,"Foul on Jarrell Brantley.",16,17,-1,0.719419164900138,"Charleston","Elon",4,4,0,0,6.2,400919574,2017-02-04
100,1,"6:11",1571,1571,"Official TV Timeout",16,17,-1,0.719419164900138,"Charleston","Elon",4,4,0,0,6.2,400919574,2017-02-04
101,1,"6:11",1571,1571,"Brian Dawkins made Free Throw.",16,18,-2,0.687067678673963,"Charleston","Elon",4,4,0,0,6.2,400919574,2017-02-04
102,1,"6:11",1571,1571,"Brian Dawkins made Free Throw.",16,19,-3,0.652786308372327,"Charleston","Elon",4,4,0,0,6.2,400919574,2017-02-04
103,1,"5:46",1546,1546,"Foul on Jack Anton.",16,19,-3,0.664264412674113,"Charleston","Elon",4,4,0,0,6.2,400919574,2017-02-04
104,1,"5:46",1546,1546,"Joe Chealey made Free Throw.",17,19,-2,0.694510307848971,"Charleston","Elon",4,4,0,0,6.2,400919574,2017-02-04
105,1,"5:46",1546,1546,"Joe Chealey made Free Throw.",18,19,-1,0.723166963671188,"Charleston","Elon",4,4,0,0,6.2,400919574,2017-02-04
106,1,"5:31",1531,1531,"Dmitri Thompson missed Three Point Jumper.",18,19,-1,0.72211498428794,"Charleston","Elon",4,4,0,0,6.2,400919574,2017-02-04
107,1,"5:31",1531,1531,"Jarrell Brantley Defensive Rebound.",18,19,-1,0.72211498428794,"Charleston","Elon",4,4,0,0,6.2,400919574,2017-02-04
108,1,"5:16",1516,1516,"Jarrell Brantley made Jumper. Assisted by Grant Riller.",20,19,1,0.777922537314383,"Charleston","Elon",4,4,0,0,6.2,400919574,2017-02-04
109,1,"5:01",1501,1501,"Tyler Seibring missed Three Point Jumper.",20,19,1,0.768079624078029,"Charleston","Elon",4,4,0,0,6.2,400919574,2017-02-04
110,1,"5:01",1501,1501,"Nick Harris Defensive Rebound.",20,19,1,0.768079624078029,"Charleston","Elon",4,4,0,0,6.2,400919574,2017-02-04
111,1,"4:41",1481,1481,"Jarrell Brantley missed Jumper.",20,19,1,0.763353240035397,"Charleston","Elon",4,4,0,0,6.2,400919574,2017-02-04
112,1,"4:41",1481,1481,"Dainan Swoope Defensive Rebound.",20,19,1,0.763353240035397,"Charleston","Elon",4,4,0,0,6.2,400919574,2017-02-04
113,1,"4:17",1457,1457,"Foul on Cameron Johnson.",20,19,1,0.761134812274752,"Charleston","Elon",4,4,0,0,6.2,400919574,2017-02-04
114,1,"4:08",1448,1448,"Brian Dawkins missed Jumper.",20,19,1,0.781727493040257,"Charleston","Elon",4,4,0,0,6.2,400919574,2017-02-04
115,1,"4:08",1448,1448,"Jarrell Brantley Defensive Rebound.",20,19,1,0.781727493040257,"Charleston","Elon",4,4,0,0,6.2,400919574,2017-02-04
116,1,"3:56",1436,1436,"Grant Riller missed Three Point Jumper.",20,19,1,0.765906533821636,"Charleston","Elon",4,4,0,0,6.2,400919574,2017-02-04
117,1,"3:56",1436,1436,"Brian Dawkins Defensive Rebound.",20,19,1,0.765906533821636,"Charleston","Elon",4,4,0,0,6.2,400919574,2017-02-04
118,1,"3:42",1422,1422,"Brian Dawkins made Three Point Jumper. Assisted by Luke Eddy.",20,22,-2,0.663333302007119,"Charleston","Elon",4,4,0,0,6.2,400919574,2017-02-04
119,1,"3:18",1398,1398,"Cameron Johnson missed Three Point Jumper.",20,22,-2,0.678489463434559,"Charleston","Elon",4,4,0,0,6.2,400919574,2017-02-04
120,1,"3:18",1398,1398,"Tyler Seibring Defensive Rebound.",20,22,-2,0.678489463434559,"Charleston","Elon",4,4,0,0,6.2,400919574,2017-02-04
121,1,"2:47",1367,1367,"Brian Dawkins made Layup. Assisted by Luke Eddy.",20,24,-4,0.599096232342043,"Charleston","Elon",4,4,0,0,6.2,400919574,2017-02-04
122,1,"2:23",1343,1343,"Grant Riller missed Three Point Jumper.",20,24,-4,0.578690887890383,"Charleston","Elon",4,4,0,0,6.2,400919574,2017-02-04
123,1,"2:23",1343,1343,"Tyler Seibring Defensive Rebound.",20,24,-4,0.578690887890383,"Charleston","Elon",4,4,0,0,6.2,400919574,2017-02-04
124,1,"1:58",1318,1318,"Dainan Swoope missed Three Point Jumper.",20,24,-4,0.603290458843533,"Charleston","Elon",4,4,0,0,6.2,400919574,2017-02-04
125,1,"1:58",1318,1318,"Tyler Seibring Offensive Rebound.",20,24,-4,0.603290458843533,"Charleston","Elon",4,4,0,0,6.2,400919574,2017-02-04
126,1,"1:49",1309,1309,"Elon  Turnover.",20,24,-4,0.59268443261926,"Charleston","Elon",4,4,0,0,6.2,400919574,2017-02-04
127,1,"1:49",1309,1309,"Official TV Timeout",20,24,-4,0.59268443261926,"Charleston","Elon",4,4,0,0,6.2,400919574,2017-02-04
128,1,"1:33",1293,1293,"Joe Chealey missed Three Point Jumper.",20,24,-4,0.585873455708444,"Charleston","Elon",4,4,0,0,6.2,400919574,2017-02-04
129,1,"1:33",1293,1293,"Dmitri Thompson Defensive Rebound.",20,24,-4,0.585873455708444,"Charleston","Elon",4,4,0,0,6.2,400919574,2017-02-04
130,1,"1:16",1276,1276,"Tyler Seibring made Jumper.",20,26,-6,0.509636324821938,"Charleston","Elon",4,4,0,0,6.2,400919574,2017-02-04
131,1,"0:56",1256,1256,"Jarrell Brantley made Jumper.",22,26,-4,0.580385196380862,"Charleston","Elon",4,4,0,0,6.2,400919574,2017-02-04
132,1,"0:31",1231,1231,"Brian Dawkins made Layup. Assisted by Dainan Swoope.",22,28,-6,0.489590981513122,"Charleston","Elon",4,4,0,0,6.2,400919574,2017-02-04
133,1,"0:04",1204,1204,"Charleston  Timeout",22,28,-6,0.504584715827304,"Charleston","Elon",3,4,1,0,6.2,400919574,2017-02-04
134,1,"0:04",1204,1204,"Foul on Luke Eddy.",22,28,-6,0.504584715827304,"Charleston","Elon",3,4,1,0,6.2,400919574,2017-02-04
135,1,"0:01",1201,1201,"Jarrell Brantley missed Three Point Jumper.",22,28,-6,0.504584715827304,"Charleston","Elon",3,4,1,0,6.2,400919574,2017-02-04
136,1,"0:01",1201,1201,"Dmitri Thompson Defensive Rebound.",22,28,-6,0.504584715827304,"Charleston","Elon",3,4,1,0,6.2,400919574,2017-02-04
137,1,"0:00",1200,1200,"End of 1st half",22,28,-6,0.504584715827304,"Charleston","Elon",3,4,1,0,6.2,400919574,2017-02-04
138,2,"20:00",1200,1200,"PLAY",22,28,-6,0.504584715827304,"Charleston","Elon",4,4,0,0,6.2,400919574,2017-02-04
139,2,"19:49",1189,1189,"Tyler Seibring missed Layup.",22,28,-6,0.495980430162881,"Charleston","Elon",4,4,0,0,6.2,400919574,2017-02-04
140,2,"19:49",1189,1189,"Jarrell Brantley Defensive Rebound.",22,28,-6,0.495980430162881,"Charleston","Elon",4,4,0,0,6.2,400919574,2017-02-04
141,2,"19:29",1169,1169,"Nick Harris made Jumper.",24,28,-4,0.566555897563513,"Charleston","Elon",4,4,0,0,6.2,400919574,2017-02-04
142,2,"19:15",1155,1155,"Foul on Nick Harris.",24,28,-4,0.572370912628861,"Charleston","Elon",4,4,0,0,6.2,400919574,2017-02-04
143,2,"19:15",1155,1155,"Dainan Swoope missed Free Throw.",24,28,-4,0.572370912628861,"Charleston","Elon",4,4,0,0,6.2,400919574,2017-02-04
144,2,"19:15",1155,1155,"Elon Deadball Team Rebound.",24,28,-4,0.572370912628861,"Charleston","Elon",4,4,0,0,6.2,400919574,2017-02-04
145,2,"19:15",1155,1155,"Dainan Swoope missed Free Throw.",24,28,-4,0.572370912628861,"Charleston","Elon",4,4,0,0,6.2,400919574,2017-02-04
146,2,"19:15",1155,1155,"Jarrell Brantley Defensive Rebound.",24,28,-4,0.572370912628861,"Charleston","Elon",4,4,0,0,6.2,400919574,2017-02-04
147,2,"18:57",1137,1137,"Grant Riller missed Layup.",24,28,-4,0.585133015284557,"Charleston","Elon",4,4,0,0,6.2,400919574,2017-02-04
148,2,"18:57",1137,1137,"Dmitri Thompson Defensive Rebound.",24,28,-4,0.585133015284557,"Charleston","Elon",4,4,0,0,6.2,400919574,2017-02-04
149,2,"18:45",1125,1125,"Steven Santa Ana missed Three Point Jumper.",24,28,-4,0.545864833279687,"Charleston","Elon",4,4,0,0,6.2,400919574,2017-02-04
150,2,"18:45",1125,1125,"Joe Chealey Defensive Rebound.",24,28,-4,0.545864833279687,"Charleston","Elon",4,4,0,0,6.2,400919574,2017-02-04
151,2,"18:36",1116,1116,"Joe Chealey missed Jumper.",24,28,-4,0.557585890438924,"Charleston","Elon",4,4,0,0,6.2,400919574,2017-02-04
152,2,"18:36",1116,1116,"Steven Santa Ana Defensive Rebound.",24,28,-4,0.557585890438924,"Charleston","Elon",4,4,0,0,6.2,400919574,2017-02-04
153,2,"18:25",1105,1105,"Dainan Swoope Turnover.",24,28,-4,0.578506593170024,"Charleston","Elon",4,4,0,0,6.2,400919574,2017-02-04
154,2,"18:25",1105,1105,"Foul on Dainan Swoope.",24,28,-4,0.578506593170024,"Charleston","Elon",4,4,0,0,6.2,400919574,2017-02-04
155,2,"18:00",1080,1080,"Jarrell Brantley made Jumper.",26,28,-2,0.648966394652549,"Charleston","Elon",4,4,0,0,6.2,400919574,2017-02-04
156,2,"17:47",1067,1067,"Brian Dawkins missed Jumper.",26,28,-2,0.646204953425411,"Charleston","Elon",4,4,0,0,6.2,400919574,2017-02-04
157,2,"17:47",1067,1067,"Cameron Johnson Defensive Rebound.",26,28,-2,0.646204953425411,"Charleston","Elon",4,4,0,0,6.2,400919574,2017-02-04
158,2,"17:37",1057,1057,"Nick Harris made Layup. Assisted by Cameron Johnson.",28,28,0,0.721791715830111,"Charleston","Elon",4,4,0,0,6.2,400919574,2017-02-04
159,2,"17:37",1057,1057,"Foul on Brian Dawkins.",28,28,0,0.721791715830111,"Charleston","Elon",4,4,0,0,6.2,400919574,2017-02-04
160,2,"17:37",1057,1057,"Nick Harris made Free Throw.",29,28,1,0.756481549763137,"Charleston","Elon",4,4,0,0,6.2,400919574,2017-02-04
161,2,"17:24",1044,1044,"Foul on Cameron Johnson.",29,28,1,0.763119023854835,"Charleston","Elon",4,4,0,0,6.2,400919574,2017-02-04
162,2,"17:14",1034,1034,"Tyler Seibring missed Three Point Jumper.",29,28,1,0.747225755806883,"Charleston","Elon",4,4,0,0,6.2,400919574,2017-02-04
163,2,"17:14",1034,1034,"Joe Chealey Defensive Rebound.",29,28,1,0.747225755806883,"Charleston","Elon",4,4,0,0,6.2,400919574,2017-02-04
164,2,"17:05",1025,1025,"Joe Chealey Turnover.",29,28,1,0.754418215479623,"Charleston","Elon",4,4,0,0,6.2,400919574,2017-02-04
165,2,"17:04",1024,1024,"Dainan Swoope Steal.",29,28,1,0.754418215479623,"Charleston","Elon",4,4,0,0,6.2,400919574,2017-02-04
166,2,"17:02",1022,1022,"Foul on Joe Chealey.",29,28,1,0.754418215479623,"Charleston","Elon",4,4,0,0,6.2,400919574,2017-02-04
167,2,"16:45",1005,1005,"Dmitri Thompson Turnover.",29,28,1,0.733548819345662,"Charleston","Elon",4,4,0,0,6.2,400919574,2017-02-04
168,2,"16:44",1004,1004,"Grant Riller Steal.",29,28,1,0.733548819345662,"Charleston","Elon",4,4,0,0,6.2,400919574,2017-02-04
169,2,"16:41",1001,1001,"Grant Riller Turnover.",29,28,1,0.733548819345662,"Charleston","Elon",4,4,0,0,6.2,400919574,2017-02-04
170,2,"16:26",986,986,"Steven Santa Ana missed Three Point Jumper.",29,28,1,0.750118516219373,"Charleston","Elon",4,4,0,0,6.2,400919574,2017-02-04
171,2,"16:26",986,986,"Brian Dawkins Offensive Rebound.",29,28,1,0.750118516219373,"Charleston","Elon",4,4,0,0,6.2,400919574,2017-02-04
172,2,"16:22",982,982,"Dainan Swoope made Three Point Jumper. Assisted by Brian Dawkins.",29,31,-2,0.622419186063891,"Charleston","Elon",4,4,0,0,6.2,400919574,2017-02-04
173,2,"16:02",962,962,"Cameron Johnson missed Three Point Jumper.",29,31,-2,0.610456559335796,"Charleston","Elon",4,4,0,0,6.2,400919574,2017-02-04
174,2,"16:02",962,962,"Dmitri Thompson Defensive Rebound.",29,31,-2,0.610456559335796,"Charleston","Elon",4,4,0,0,6.2,400919574,2017-02-04
175,2,"15:43",943,943,"Brian Dawkins missed Three Point Jumper.",29,31,-2,0.643892812892636,"Charleston","Elon",4,4,0,0,6.2,400919574,2017-02-04
176,2,"15:43",943,943,"Cameron Johnson Defensive Rebound.",29,31,-2,0.643892812892636,"Charleston","Elon",4,4,0,0,6.2,400919574,2017-02-04
177,2,"15:29",929,929,"Jarrell Brantley missed Jumper.",29,31,-2,0.593655886237918,"Charleston","Elon",4,4,0,0,6.2,400919574,2017-02-04
178,2,"15:29",929,929,"Tyler Seibring Defensive Rebound.",29,31,-2,0.593655886237918,"Charleston","Elon",4,4,0,0,6.2,400919574,2017-02-04
179,2,"15:20",920,920,"Brian Dawkins made Three Point Jumper. Assisted by Dainan Swoope.",29,34,-5,0.449838096562692,"Charleston","Elon",4,4,0,0,6.2,400919574,2017-02-04
180,2,"15:01",901,901,"Cameron Johnson made Layup.",31,34,-3,0.567393897144808,"Charleston","Elon",4,4,0,0,6.2,400919574,2017-02-04
181,2,"14:44",884,884,"Foul on Jarrell Brantley.",31,34,-3,0.574658764803066,"Charleston","Elon",4,4,0,0,6.2,400919574,2017-02-04
182,2,"14:44",884,884,"Official TV Timeout",31,34,-3,0.574658764803066,"Charleston","Elon",4,4,0,0,6.2,400919574,2017-02-04
183,2,"14:44",884,884,"Tyler Seibring made Free Throw.",31,35,-4,0.531714936322808,"Charleston","Elon",4,4,0,0,6.2,400919574,2017-02-04
184,2,"14:44",884,884,"Tyler Seibring missed Free Throw.",31,35,-4,0.531714936322808,"Charleston","Elon",4,4,0,0,6.2,400919574,2017-02-04
185,2,"14:44",884,884,"Cameron Johnson Defensive Rebound.",31,35,-4,0.531714936322808,"Charleston","Elon",4,4,0,0,6.2,400919574,2017-02-04
186,2,"14:28",868,868,"Marquise Pointer Turnover.",31,35,-4,0.515726514030266,"Charleston","Elon",4,4,0,0,6.2,400919574,2017-02-04
187,2,"14:18",858,858,"Tyler Seibring missed Layup.",31,35,-4,0.519521085313099,"Charleston","Elon",4,4,0,0,6.2,400919574,2017-02-04
