"play_id","half","time_remaining_half","secs_remaining","secs_remaining_absolute","description","home_score","away_score","score_diff","win_prob","home","away","home_time_out_remaining","away_time_out_remaining","home_timeout_ind","away_timeout_ind","home_favored_by","game_id","date"
204,2,"12:42",762,762,"Omega Harris missed Three Point Jumper.",42,38,4,0.781548054328509,"UTSA","UTEP",4,4,0,0,2,400919522,2017-01-01
205,2,"12:42",762,762,"Nick Billingsley Defensive Rebound.",42,38,4,0.781548054328509,"UTSA","UTEP",4,4,0,0,2,400919522,2017-01-01
206,2,"12:14",734,734,"Foul on Nick Billingsley.",42,38,4,0.766734535485303,"UTSA","UTEP",4,4,0,0,2,400919522,2017-01-01
207,2,"12:14",734,734,"Nick Billingsley Turnover.",42,38,4,0.766734535485303,"UTSA","UTEP",4,4,0,0,2,400919522,2017-01-01
208,2,"12:04",724,724,"Omega Harris Turnover.",42,38,4,0.782367706040347,"UTSA","UTEP",4,4,0,0,2,400919522,2017-01-01
209,2,"11:52",712,712,"Lucas O'Brien made Jumper. Assisted by Austin Karrer.",44,38,6,0.824774549379049,"UTSA","UTEP",4,4,0,0,2,400919522,2017-01-01
210,2,"11:34",694,694,"Kelvin Jones made Dunk. Assisted by Paul Thomas.",44,40,4,0.784654135155195,"UTSA","UTEP",4,4,0,0,2,400919522,2017-01-01
211,2,"11:19",679,679,"Foul on Kelvin Jones.",44,40,4,0.77132083690348,"UTSA","UTEP",4,4,0,0,2,400919522,2017-01-01
212,2,"11:19",679,679,"Official TV Timeout",44,40,4,0.77132083690348,"UTSA","UTEP",4,4,0,0,2,400919522,2017-01-01
213,2,"11:04",664,664,"Gino Littles made Three Point Jumper. Assisted by Nick Billingsley.",47,40,7,0.876964436709457,"UTSA","UTEP",4,4,0,0,2,400919522,2017-01-01
214,2,"10:37",637,637,"Omega Harris missed Layup.",47,40,7,0.873103592575855,"UTSA","UTEP",4,4,0,0,2,400919522,2017-01-01
215,2,"10:37",637,637,"Lucas O'Brien Defensive Rebound.",47,40,7,0.873103592575855,"UTSA","UTEP",4,4,0,0,2,400919522,2017-01-01
216,2,"10:24",624,624,"Byron Frohnen missed Jumper.",47,40,7,0.889291070149588,"UTSA","UTEP",4,4,0,0,2,400919522,2017-01-01
217,2,"10:24",624,624,"Kelvin Jones Defensive Rebound.",47,40,7,0.889291070149588,"UTSA","UTEP",4,4,0,0,2,400919522,2017-01-01
218,2,"10:16",616,616,"Foul on Dominic Artis.",47,40,7,0.881928180205595,"UTSA","UTEP",4,4,0,0,2,400919522,2017-01-01
219,2,"10:16",616,616,"Dominic Artis Turnover.",47,40,7,0.881928180205595,"UTSA","UTEP",4,4,0,0,2,400919522,2017-01-01
220,2,"9:52",592,592,"Lucas O'Brien missed Three Point Jumper.",47,40,7,0.879044066474058,"UTSA","UTEP",4,4,0,0,2,400919522,2017-01-01
221,2,"9:52",592,592,"Omega Harris Defensive Rebound.",47,40,7,0.879044066474058,"UTSA","UTEP",4,4,0,0,2,400919522,2017-01-01
222,2,"9:27",567,567,"Omega Harris missed Jumper.",47,40,7,0.897277646153807,"UTSA","UTEP",4,4,0,0,2,400919522,2017-01-01
223,2,"9:27",567,567,"Lucas O'Brien Defensive Rebound.",47,40,7,0.897277646153807,"UTSA","UTEP",4,4,0,0,2,400919522,2017-01-01
224,2,"8:55",535,535,"Gino Littles missed Jumper.",47,40,7,0.914728785379791,"UTSA","UTEP",4,4,0,0,2,400919522,2017-01-01
225,2,"8:55",535,535,"Lucas O'Brien Offensive Rebound.",47,40,7,0.914728785379791,"UTSA","UTEP",4,4,0,0,2,400919522,2017-01-01
226,2,"8:51",531,531,"Lucas O'Brien made Two Point Tip Shot.",49,40,9,0.949574430514386,"UTSA","UTEP",4,4,0,0,2,400919522,2017-01-01
227,2,"8:32",512,512,"Foul on Dominic Artis.",49,40,9,0.93719065468555,"UTSA","UTEP",4,4,1,0,2,400919522,2017-01-01
228,2,"8:32",512,512,"Dominic Artis Turnover.",49,40,9,0.93719065468555,"UTSA","UTEP",4,4,1,0,2,400919522,2017-01-01
229,2,"8:32",512,512,"UTEP  Timeout",49,40,9,0.93719065468555,"UTSA","UTEP",3,4,1,0,2,400919522,2017-01-01
230,2,"8:19",499,499,"Jeff Beverly missed Three Point Jumper.",49,40,9,0.944240261089448,"UTSA","UTEP",3,4,1,0,2,400919522,2017-01-01
231,2,"8:19",499,499,"UTEP Defensive Rebound.",49,40,9,0.944240261089448,"UTSA","UTEP",3,4,1,0,2,400919522,2017-01-01
232,2,"7:53",473,473,"Dominic Artis Turnover.",49,40,9,0.947974024912241,"UTSA","UTEP",3,4,1,0,2,400919522,2017-01-01
233,2,"7:53",473,473,"Official TV Timeout",49,40,9,0.947974024912241,"UTSA","UTEP",3,4,1,0,2,400919522,2017-01-01
234,2,"7:42",462,462,"Jeff Beverly missed Three Point Jumper.",49,40,9,0.942799674759582,"UTSA","UTEP",3,4,1,0,2,400919522,2017-01-01
235,2,"7:42",462,462,"Omega Harris Defensive Rebound.",49,40,9,0.942799674759582,"UTSA","UTEP",3,4,1,0,2,400919522,2017-01-01
236,2,"7:20",440,440,"Deon Barrett missed Layup.",49,40,9,0.940618750572862,"UTSA","UTEP",3,4,0,0,2,400919522,2017-01-01
237,2,"7:20",440,440,"Jeff Beverly Defensive Rebound.",49,40,9,0.940618750572862,"UTSA","UTEP",3,4,0,0,2,400919522,2017-01-01
238,2,"7:03",423,423,"Nick Billingsley missed Layup.",49,40,9,0.94744526098245,"UTSA","UTEP",3,4,0,0,2,400919522,2017-01-01
239,2,"7:03",423,423,"Dominic Artis Block.",49,40,9,0.94744526098245,"UTSA","UTEP",3,4,0,0,2,400919522,2017-01-01
240,2,"7:00",420,420,"Dominic Artis Defensive Rebound.",49,40,9,0.94744526098245,"UTSA","UTEP",3,4,0,0,2,400919522,2017-01-01
241,2,"6:57",417,417,"Omega Harris made Layup. Assisted by Dominic Artis.",49,42,7,0.914480556804708,"UTSA","UTEP",3,4,0,0,2,400919522,2017-01-01
242,2,"6:41",401,401,"Foul on Dominic Artis.",49,42,7,0.926304012104546,"UTSA","UTEP",3,4,0,0,2,400919522,2017-01-01
243,2,"6:41",401,401,"Giovanni De Nicolao made Free Throw.",50,42,8,0.945886966901282,"UTSA","UTEP",3,4,0,0,2,400919522,2017-01-01
244,2,"6:41",401,401,"Giovanni De Nicolao missed Free Throw.",50,42,8,0.945886966901282,"UTSA","UTEP",3,4,0,0,2,400919522,2017-01-01
245,2,"6:41",401,401,"UTEP Defensive Rebound.",50,42,8,0.945886966901282,"UTSA","UTEP",3,4,0,0,2,400919522,2017-01-01
246,2,"6:26",386,386,"Dominic Artis missed Three Point Jumper.",50,42,8,0.93512606472169,"UTSA","UTEP",3,4,0,0,2,400919522,2017-01-01
247,2,"6:26",386,386,"Nick Billingsley Defensive Rebound.",50,42,8,0.93512606472169,"UTSA","UTEP",3,4,0,0,2,400919522,2017-01-01
248,2,"5:59",359,359,"Giovanni De Nicolao missed Three Point Jumper.",50,42,8,0.944564967724531,"UTSA","UTEP",3,4,0,0,2,400919522,2017-01-01
249,2,"5:59",359,359,"Lucas O'Brien Offensive Rebound.",50,42,8,0.944564967724531,"UTSA","UTEP",3,4,0,0,2,400919522,2017-01-01
250,2,"5:48",348,348,"Nick Billingsley missed Jumper.",50,42,8,0.942839407535925,"UTSA","UTEP",3,4,0,0,2,400919522,2017-01-01
251,2,"5:48",348,348,"Dominic Artis Defensive Rebound.",50,42,8,0.942839407535925,"UTSA","UTEP",3,4,0,0,2,400919522,2017-01-01
252,2,"5:42",342,342,"Matt Willms missed Dunk.",50,42,8,0.942839407535925,"UTSA","UTEP",3,4,0,0,2,400919522,2017-01-01
253,2,"5:42",342,342,"Paul Thomas Offensive Rebound.",50,42,8,0.942839407535925,"UTSA","UTEP",3,4,0,0,2,400919522,2017-01-01
254,2,"5:29",329,329,"Dominic Artis made Three Point Jumper. Assisted by Deon Barrett.",50,45,5,0.856270003392293,"UTSA","UTEP",3,4,0,0,2,400919522,2017-01-01
255,2,"5:08",308,308,"Jeff Beverly missed Jumper.",50,45,5,0.874940945494424,"UTSA","UTEP",3,4,0,0,2,400919522,2017-01-01
256,2,"5:08",308,308,"Matt Willms Defensive Rebound.",50,45,5,0.874940945494424,"UTSA","UTEP",3,4,0,0,2,400919522,2017-01-01
257,2,"4:38",278,278,"Dominic Artis missed Jumper.",50,45,5,0.891750958837665,"UTSA","UTEP",3,4,0,0,2,400919522,2017-01-01
258,2,"4:38",278,278,"Giovanni De Nicolao Defensive Rebound.",50,45,5,0.891750958837665,"UTSA","UTEP",3,4,0,0,2,400919522,2017-01-01
259,2,"4:27",267,267,"UT San Antonio  Timeout",50,45,5,0.8931392850286,"UTSA","UTEP",3,3,0,1,2,400919522,2017-01-01
260,2,"4:11",251,251,"Lucas O'Brien made Three Point Jumper. Assisted by Giovanni De Nicolao.",53,45,8,0.974602273724917,"UTSA","UTEP",3,3,0,1,2,400919522,2017-01-01
261,2,"3:53",233,233,"Official TV Timeout",53,45,8,0.970884261929222,"UTSA","UTEP",3,3,0,1,2,400919522,2017-01-01
262,2,"3:42",222,222,"Omega Harris missed Jumper.",53,45,8,0.97554528773271,"UTSA","UTEP",3,3,0,1,2,400919522,2017-01-01
263,2,"3:42",222,222,"Byron Frohnen Defensive Rebound.",53,45,8,0.97554528773271,"UTSA","UTEP",3,3,0,1,2,400919522,2017-01-01
264,2,"3:10",190,190,"Lucas O'Brien made Layup. Assisted by Gino Littles.",55,45,10,0.992197102326474,"UTSA","UTEP",3,3,0,0,2,400919522,2017-01-01
265,2,"2:53",173,173,"Dominic Artis Turnover.",55,45,10,0.994604272771165,"UTSA","UTEP",3,3,0,0,2,400919522,2017-01-01
266,2,"2:52",172,172,"Gino Littles Steal.",55,45,10,0.994604272771165,"UTSA","UTEP",3,3,0,0,2,400919522,2017-01-01
267,2,"2:51",171,171,"Foul on Deon Barrett.",55,45,10,0.994604272771165,"UTSA","UTEP",3,3,0,0,2,400919522,2017-01-01
268,2,"2:51",171,171,"Gino Littles made Free Throw.",56,45,11,0.996694515448502,"UTSA","UTEP",3,3,0,0,2,400919522,2017-01-01
269,2,"2:51",171,171,"Gino Littles made Free Throw.",57,45,12,0.997976669402222,"UTSA","UTEP",3,3,0,0,2,400919522,2017-01-01
270,2,"2:37",157,157,"Dominic Artis made Jumper.",57,47,10,0.996476578547603,"UTSA","UTEP",3,3,0,0,2,400919522,2017-01-01
271,2,"2:11",131,131,"Foul on Paul Thomas.",57,47,10,0.997074238188527,"UTSA","UTEP",3,3,0,0,2,400919522,2017-01-01
272,2,"2:11",131,131,"Byron Frohnen missed Free Throw.",57,47,10,0.997074238188527,"UTSA","UTEP",3,3,0,0,2,400919522,2017-01-01
273,2,"2:11",131,131,"Matt Willms Defensive Rebound.",57,47,10,0.997074238188527,"UTSA","UTEP",3,3,0,0,2,400919522,2017-01-01
274,2,"2:00",120,120,"Foul on Lucas O'Brien.",57,47,10,0.996891606389064,"UTSA","UTEP",3,3,0,0,2,400919522,2017-01-01
275,2,"2:00",120,120,"Matt Willms missed Free Throw.",57,47,10,0.996891606389064,"UTSA","UTEP",3,3,0,0,2,400919522,2017-01-01
276,2,"2:00",120,120,"UTEP Deadball Team Rebound.",57,47,10,0.996891606389064,"UTSA","UTEP",3,3,0,0,2,400919522,2017-01-01
277,2,"2:00",120,120,"Matt Willms missed Free Throw.",57,47,10,0.996891606389064,"UTSA","UTEP",3,3,0,0,2,400919522,2017-01-01
278,2,"2:00",120,120,"Byron Frohnen Defensive Rebound.",57,47,10,0.996891606389064,"UTSA","UTEP",3,3,0,0,2,400919522,2017-01-01
279,2,"1:49",109,109,"UT San Antonio  Timeout",57,47,10,0.99805561165483,"UTSA","UTEP",3,2,0,1,2,400919522,2017-01-01
280,2,"1:48",108,108,"Foul on Paul Thomas.",57,47,10,0.99805561165483,"UTSA","UTEP",3,2,0,1,2,400919522,2017-01-01
281,2,"1:48",108,108,"Byron Frohnen made Free Throw.",58,47,11,0.998952107541638,"UTSA","UTEP",3,2,0,1,2,400919522,2017-01-01
282,2,"1:48",108,108,"Byron Frohnen made Free Throw.",59,47,12,0.999435491359127,"UTSA","UTEP",3,2,0,1,2,400919522,2017-01-01
283,2,"1:37",97,97,"Dominic Artis made Layup.",59,49,10,0.998408511021938,"UTSA","UTEP",3,2,0,1,2,400919522,2017-01-01
284,2,"1:32",92,92,"Foul on Paul Thomas.",59,49,10,0.998408511021938,"UTSA","UTEP",3,2,0,1,2,400919522,2017-01-01
285,2,"1:32",92,92,"Byron Frohnen missed Free Throw.",59,49,10,0.998408511021938,"UTSA","UTEP",3,2,0,1,2,400919522,2017-01-01
286,2,"1:32",92,92,"UT San Antonio Deadball Team Rebound.",59,49,10,0.998408511021938,"UTSA","UTEP",3,2,0,1,2,400919522,2017-01-01
287,2,"1:32",92,92,"Byron Frohnen missed Free Throw.",59,49,10,0.998408511021938,"UTSA","UTEP",3,2,0,1,2,400919522,2017-01-01
288,2,"1:32",92,92,"Paul Thomas Defensive Rebound.",59,49,10,0.998408511021938,"UTSA","UTEP",3,2,0,1,2,400919522,2017-01-01
289,2,"1:16",76,76,"Foul on Lucas O'Brien.",59,49,10,0.99939693035818,"UTSA","UTEP",3,2,0,1,2,400919522,2017-01-01
290,2,"1:16",76,76,"Dominic Artis made Free Throw.",59,50,9,0.998743131635398,"UTSA","UTEP",3,2,0,1,2,400919522,2017-01-01
291,2,"1:16",76,76,"Dominic Artis missed Free Throw.",59,50,9,0.998743131635398,"UTSA","UTEP",3,2,0,1,2,400919522,2017-01-01
292,2,"1:16",76,76,"Giovanni De Nicolao Defensive Rebound.",59,50,9,0.998743131635398,"UTSA","UTEP",3,2,0,1,2,400919522,2017-01-01
293,2,"0:54",54,54,"Foul on Omega Harris.",59,50,9,0.999084768848419,"UTSA","UTEP",3,2,0,1,2,400919522,2017-01-01
294,2,"0:54",54,54,"Nick Billingsley made Free Throw.",60,50,10,0.999571518392662,"UTSA","UTEP",3,2,0,1,2,400919522,2017-01-01
295,2,"0:54",54,54,"Nick Billingsley made Free Throw.",61,50,11,0.999799450741131,"UTSA","UTEP",3,2,0,1,2,400919522,2017-01-01
296,2,"0:46",46,46,"Trey Touchet missed Three Point Jumper.",61,50,11,0.999990717810548,"UTSA","UTEP",3,2,0,0,2,400919522,2017-01-01
297,2,"0:46",46,46,"Jeff Beverly Defensive Rebound.",61,50,11,0.999990717810548,"UTSA","UTEP",3,2,0,0,2,400919522,2017-01-01
298,2,"0:41",41,41,"Foul on Trey Touchet.",61,50,11,0.999980175415347,"UTSA","UTEP",3,2,0,0,2,400919522,2017-01-01
299,2,"0:41",41,41,"Gino Littles made Free Throw.",62,50,12,0.999992712995252,"UTSA","UTEP",3,2,0,0,2,400919522,2017-01-01
300,2,"0:41",41,41,"Gino Littles made Free Throw.",63,50,13,0.999997321506701,"UTSA","UTEP",3,2,0,0,2,400919522,2017-01-01
301,2,"0:34",34,34,"Dominic Artis made Layup.",63,52,11,0.999881990418203,"UTSA","UTEP",3,2,0,0,2,400919522,2017-01-01
302,2,"0:34",34,34,"Foul on Byron Frohnen.",63,52,11,0.999881990418203,"UTSA","UTEP",3,2,0,0,2,400919522,2017-01-01
303,2,"0:34",34,34,"Dominic Artis made Free Throw.",63,53,10,0.999730039173468,"UTSA","UTEP",3,2,0,0,2,400919522,2017-01-01
304,2,"0:31",31,31,"Foul on Trey Touchet.",63,53,10,0.999929901269589,"UTSA","UTEP",3,2,0,0,2,400919522,2017-01-01
305,2,"0:31",31,31,"Nick Billingsley made Free Throw.",64,53,11,0.999973196757201,"UTSA","UTEP",3,2,0,0,2,400919522,2017-01-01
306,2,"0:31",31,31,"Nick Billingsley made Free Throw.",65,53,12,0.99998975167441,"UTSA","UTEP",3,2,0,0,2,400919522,2017-01-01
307,2,"0:26",26,26,"Foul on Giovanni De Nicolao.",65,53,12,0.999999650575568,"UTSA","UTEP",3,2,0,0,2,400919522,2017-01-01
308,2,"0:26",26,26,"Dominic Artis made Free Throw.",65,54,11,0.999998780672695,"UTSA","UTEP",3,2,0,0,2,400919522,2017-01-01
309,2,"0:26",26,26,"Dominic Artis made Free Throw.",65,55,10,0.999995745129075,"UTSA","UTEP",3,2,0,0,2,400919522,2017-01-01
310,2,"0:24",24,24,"Foul on Omega Harris.",65,55,10,0.999912322765987,"UTSA","UTEP",3,2,0,0,2,400919522,2017-01-01
311,2,"0:24",24,24,"Gino Littles made Free Throw.",66,55,11,0.999964562033773,"UTSA","UTEP",3,2,0,0,2,400919522,2017-01-01
312,2,"0:24",24,24,"Gino Littles made Free Throw.",67,55,12,0.999985676893505,"UTSA","UTEP",3,2,0,0,2,400919522,2017-01-01
313,2,"0:18",18,18,"Dominic Artis missed Jumper.",67,55,12,0.999997333636509,"UTSA","UTEP",3,2,0,0,2,400919522,2017-01-01
314,2,"0:18",18,18,"Byron Frohnen Defensive Rebound.",67,55,12,0.999997333636509,"UTSA","UTEP",3,2,0,0,2,400919522,2017-01-01
315,2,"0:00",0,0,"End of Game",67,55,12,1,"UTSA","UTEP",3,2,0,0,2,400919522,2017-01-01
