"play_id","half","time_remaining_half","secs_remaining","secs_remaining_absolute","description","home_score","away_score","score_diff","win_prob","home","away","home_time_out_remaining","away_time_out_remaining","home_timeout_ind","away_timeout_ind","home_favored_by","game_id","date"
1,1,"20:00",2400,2400,"PLAY",0,0,0,0.177218402585967,"UTSA","Old Dominion",4,4,0,0,-8,400919481,2017-03-04
2,1,"19:36",2376,2376,"Brandan Stith missed Jumper.",0,0,0,0.201910797608001,"UTSA","Old Dominion",4,4,0,0,-8,400919481,2017-03-04
3,1,"19:36",2376,2376,"Gino Littles Defensive Rebound.",0,0,0,0.201910797608001,"UTSA","Old Dominion",4,4,0,0,-8,400919481,2017-03-04
4,1,"19:13",2353,2353,"Lucas O'Brien Turnover.",0,0,0,0.203330704416685,"UTSA","Old Dominion",4,4,0,0,-8,400919481,2017-03-04
5,1,"18:54",2334,2334,"B.J. Stith missed Three Point Jumper.",0,0,0,0.197418512160026,"UTSA","Old Dominion",4,4,0,0,-8,400919481,2017-03-04
6,1,"18:54",2334,2334,"Gino Littles Defensive Rebound.",0,0,0,0.197418512160026,"UTSA","Old Dominion",4,4,0,0,-8,400919481,2017-03-04
7,1,"18:36",2316,2316,"Jeff Beverly missed Three Point Jumper.",0,0,0,0.199666162674632,"UTSA","Old Dominion",4,4,0,0,-8,400919481,2017-03-04
8,1,"18:36",2316,2316,"Brandan Stith Defensive Rebound.",0,0,0,0.199666162674632,"UTSA","Old Dominion",4,4,0,0,-8,400919481,2017-03-04
9,1,"18:23",2303,2303,"Ahmad Caver made Three Point Jumper. Assisted by Jordan Baker.",0,3,-3,0.156370854664936,"UTSA","Old Dominion",4,4,0,0,-8,400919481,2017-03-04
10,1,"18:05",2285,2285,"Giovanni De Nicolao missed Three Point Jumper.",0,3,-3,0.150785853737972,"UTSA","Old Dominion",4,4,0,0,-8,400919481,2017-03-04
11,1,"18:05",2285,2285,"Lucas O'Brien Offensive Rebound.",0,3,-3,0.150785853737972,"UTSA","Old Dominion",4,4,0,0,-8,400919481,2017-03-04
12,1,"18:01",2281,2281,"Gino Littles made Three Point Jumper. Assisted by Lucas O'Brien.",3,3,0,0.19561497466482,"UTSA","Old Dominion",4,4,0,0,-8,400919481,2017-03-04
13,1,"17:42",2262,2262,"Ahmad Caver missed Layup.",3,3,0,0.197500790977321,"UTSA","Old Dominion",4,4,0,0,-8,400919481,2017-03-04
14,1,"17:42",2262,2262,"B.J. Stith Offensive Rebound.",3,3,0,0.197500790977321,"UTSA","Old Dominion",4,4,0,0,-8,400919481,2017-03-04
15,1,"17:38",2258,2258,"B.J. Stith made Jumper.",3,5,-2,0.182465871085283,"UTSA","Old Dominion",4,4,0,0,-8,400919481,2017-03-04
16,1,"17:23",2243,2243,"Jeff Beverly missed Jumper.",3,5,-2,0.197477898185007,"UTSA","Old Dominion",4,4,0,0,-8,400919481,2017-03-04
17,1,"17:23",2243,2243,"Byron Frohnen Offensive Rebound.",3,5,-2,0.197477898185007,"UTSA","Old Dominion",4,4,0,0,-8,400919481,2017-03-04
18,1,"17:20",2240,2240,"Lucas O'Brien made Three Point Jumper. Assisted by Byron Frohnen.",6,5,1,0.246035289808788,"UTSA","Old Dominion",4,4,0,0,-8,400919481,2017-03-04
19,1,"17:02",2222,2222,"B.J. Stith made Jumper. Assisted by Jordan Baker.",6,7,-1,0.187250926373198,"UTSA","Old Dominion",4,4,0,0,-8,400919481,2017-03-04
20,1,"16:46",2206,2206,"Giovanni De Nicolao made Layup.",8,7,1,0.228386037399731,"UTSA","Old Dominion",4,4,0,0,-8,400919481,2017-03-04
21,1,"16:45",2205,2205,"Old Dominion  Timeout",8,7,1,0.228386037399731,"UTSA","Old Dominion",3,4,1,0,-8,400919481,2017-03-04
22,1,"16:38",2198,2198,"Foul on Giovanni De Nicolao.",8,7,1,0.230636196663756,"UTSA","Old Dominion",3,4,1,0,-8,400919481,2017-03-04
23,1,"16:28",2188,2188,"Denzell Taylor Turnover.",8,7,1,0.225661077792323,"UTSA","Old Dominion",3,4,1,0,-8,400919481,2017-03-04
24,1,"16:06",2166,2166,"Jeff Beverly made Jumper.",10,7,3,0.268547713518112,"UTSA","Old Dominion",3,4,1,0,-8,400919481,2017-03-04
25,1,"15:39",2139,2139,"B.J. Stith missed Jumper.",10,7,3,0.26737075201402,"UTSA","Old Dominion",3,4,0,0,-8,400919481,2017-03-04
26,1,"15:39",2139,2139,"Gino Littles Defensive Rebound.",10,7,3,0.26737075201402,"UTSA","Old Dominion",3,4,0,0,-8,400919481,2017-03-04
27,1,"15:21",2121,2121,"Lucas O'Brien made Three Point Jumper. Assisted by Gino Littles.",13,7,6,0.333788034292964,"UTSA","Old Dominion",3,4,0,0,-8,400919481,2017-03-04
28,1,"14:58",2098,2098,"B.J. Stith made Jumper. Assisted by Ahmad Caver.",13,9,4,0.308038259641597,"UTSA","Old Dominion",3,4,0,0,-8,400919481,2017-03-04
29,1,"14:41",2081,2081,"Lucas O'Brien missed Three Point Jumper.",13,9,4,0.306018858165543,"UTSA","Old Dominion",3,4,0,0,-8,400919481,2017-03-04
30,1,"14:41",2081,2081,"Jeff Beverly Offensive Rebound.",13,9,4,0.306018858165543,"UTSA","Old Dominion",3,4,0,0,-8,400919481,2017-03-04
31,1,"14:25",2065,2065,"Gino Littles Turnover.",13,9,4,0.29043044075763,"UTSA","Old Dominion",3,4,0,0,-8,400919481,2017-03-04
32,1,"14:24",2064,2064,"Ahmad Caver Steal.",13,9,4,0.29043044075763,"UTSA","Old Dominion",3,4,0,0,-8,400919481,2017-03-04
33,1,"14:18",2058,2058,"Foul on Gino Littles.",13,9,4,0.266694697667495,"UTSA","Old Dominion",3,4,0,0,-8,400919481,2017-03-04
34,1,"14:18",2058,2058,"Official TV Timeout",13,9,4,0.266694697667495,"UTSA","Old Dominion",3,4,0,0,-8,400919481,2017-03-04
35,1,"14:04",2044,2044,"B.J. Stith made Three Point Jumper. Assisted by Ahmad Caver.",13,12,1,0.219598944312709,"UTSA","Old Dominion",3,4,0,0,-8,400919481,2017-03-04
36,1,"13:43",2023,2023,"Jeff Beverly made Jumper.",15,12,3,0.271051396398667,"UTSA","Old Dominion",3,4,0,0,-8,400919481,2017-03-04
37,1,"13:20",2000,2000,"Aaron Carver made Jumper. Assisted by Ahmad Caver.",15,14,1,0.226872572496245,"UTSA","Old Dominion",3,4,0,0,-8,400919481,2017-03-04
38,1,"12:55",1975,1975,"Jeff Beverly made Jumper.",17,14,3,0.271302764969021,"UTSA","Old Dominion",3,4,0,0,-8,400919481,2017-03-04
39,1,"12:26",1946,1946,"B.J. Stith Turnover.",17,14,3,0.282072220182484,"UTSA","Old Dominion",3,4,0,0,-8,400919481,2017-03-04
40,1,"12:24",1944,1944,"Giovanni De Nicolao Steal.",17,14,3,0.282072220182484,"UTSA","Old Dominion",3,4,0,0,-8,400919481,2017-03-04
41,1,"12:11",1931,1931,"Foul on Jeff Beverly.",17,14,3,0.281507877973058,"UTSA","Old Dominion",3,4,0,0,-8,400919481,2017-03-04
42,1,"12:11",1931,1931,"Jeff Beverly Turnover.",17,14,3,0.281507877973058,"UTSA","Old Dominion",3,4,0,0,-8,400919481,2017-03-04
43,1,"11:58",1918,1918,"Zoran Talley missed Jumper.",17,14,3,0.304735986391575,"UTSA","Old Dominion",3,4,0,0,-8,400919481,2017-03-04
44,1,"11:58",1918,1918,"Lucas O'Brien Defensive Rebound.",17,14,3,0.304735986391575,"UTSA","Old Dominion",3,4,0,0,-8,400919481,2017-03-04
45,1,"11:42",1902,1902,"Foul on Zoran Talley.",17,14,3,0.269917062723024,"UTSA","Old Dominion",3,4,0,0,-8,400919481,2017-03-04
46,1,"11:42",1902,1902,"Official TV Timeout",17,14,3,0.269917062723024,"UTSA","Old Dominion",3,4,0,0,-8,400919481,2017-03-04
47,1,"11:40",1900,1900,"Lucas O'Brien missed Jumper.",17,14,3,0.269917062723024,"UTSA","Old Dominion",3,4,0,0,-8,400919481,2017-03-04
48,1,"11:40",1900,1900,"Lucas O'Brien Offensive Rebound.",17,14,3,0.269917062723024,"UTSA","Old Dominion",3,4,0,0,-8,400919481,2017-03-04
49,1,"11:26",1886,1886,"George Willborn III Turnover.",17,14,3,0.268248482440954,"UTSA","Old Dominion",3,4,0,0,-8,400919481,2017-03-04
50,1,"11:25",1885,1885,"Denzell Taylor Steal.",17,14,3,0.268248482440954,"UTSA","Old Dominion",3,4,0,0,-8,400919481,2017-03-04
51,1,"11:23",1883,1883,"Foul on Nick Allen.",17,14,3,0.268248482440954,"UTSA","Old Dominion",3,4,0,0,-8,400919481,2017-03-04
52,1,"11:22",1882,1882,"Trey Porter made Jumper. Assisted by Ahmad Caver.",17,16,1,0.222535665872182,"UTSA","Old Dominion",3,4,0,0,-8,400919481,2017-03-04
53,1,"11:03",1863,1863,"George Willborn III missed Jumper.",17,16,1,0.267811825703201,"UTSA","Old Dominion",3,4,0,0,-8,400919481,2017-03-04
54,1,"11:03",1863,1863,"Old Dominion Defensive Rebound.",17,16,1,0.267811825703201,"UTSA","Old Dominion",3,4,0,0,-8,400919481,2017-03-04
55,1,"10:45",1845,1845,"Foul on Lucas O'Brien.",17,16,1,0.218770238918247,"UTSA","Old Dominion",3,4,0,0,-8,400919481,2017-03-04
56,1,"10:34",1834,1834,"Denzell Taylor missed Layup.",17,16,1,0.25314483096012,"UTSA","Old Dominion",3,4,0,0,-8,400919481,2017-03-04
57,1,"10:34",1834,1834,"Lucas O'Brien Block.",17,16,1,0.25314483096012,"UTSA","Old Dominion",3,4,0,0,-8,400919481,2017-03-04
58,1,"10:33",1833,1833,"Lucas O'Brien Defensive Rebound.",17,16,1,0.25314483096012,"UTSA","Old Dominion",3,4,0,0,-8,400919481,2017-03-04
59,1,"10:33",1833,1833,"Foul on Denzell Taylor.",17,16,1,0.25314483096012,"UTSA","Old Dominion",3,4,0,0,-8,400919481,2017-03-04
60,1,"10:23",1823,1823,"Lucas O'Brien made Three Point Jumper. Assisted by Giovanni De Nicolao.",20,16,4,0.322398474607231,"UTSA","Old Dominion",3,4,0,0,-8,400919481,2017-03-04
61,1,"10:09",1809,1809,"Jordan Baker made Three Point Jumper. Assisted by Denzell Taylor.",20,19,1,0.235001998213864,"UTSA","Old Dominion",3,4,0,0,-8,400919481,2017-03-04
62,1,"9:39",1779,1779,"George Willborn III missed Jumper.",20,19,1,0.230730516659325,"UTSA","Old Dominion",3,4,0,0,-8,400919481,2017-03-04
63,1,"9:39",1779,1779,"UT San Antonio Offensive Rebound.",20,19,1,0.230730516659325,"UTSA","Old Dominion",3,4,0,0,-8,400919481,2017-03-04
64,1,"9:34",1774,1774,"Gino Littles missed Three Point Jumper.",20,19,1,0.230730516659325,"UTSA","Old Dominion",3,4,0,0,-8,400919481,2017-03-04
65,1,"9:34",1774,1774,"Trey Porter Defensive Rebound.",20,19,1,0.230730516659325,"UTSA","Old Dominion",3,4,0,0,-8,400919481,2017-03-04
66,1,"9:20",1760,1760,"Ahmad Caver missed Jumper.",20,19,1,0.233875687503349,"UTSA","Old Dominion",3,4,0,0,-8,400919481,2017-03-04
67,1,"9:20",1760,1760,"Nick Allen Defensive Rebound.",20,19,1,0.233875687503349,"UTSA","Old Dominion",3,4,0,0,-8,400919481,2017-03-04
68,1,"9:05",1745,1745,"Nick Allen missed Three Point Jumper.",20,19,1,0.271551000579536,"UTSA","Old Dominion",3,4,0,0,-8,400919481,2017-03-04
69,1,"9:05",1745,1745,"Jordan Baker Defensive Rebound.",20,19,1,0.271551000579536,"UTSA","Old Dominion",3,4,0,0,-8,400919481,2017-03-04
70,1,"8:48",1728,1728,"Trey Porter missed Jumper.",20,19,1,0.286447569793469,"UTSA","Old Dominion",3,4,0,0,-8,400919481,2017-03-04
71,1,"8:48",1728,1728,"Trey Porter Offensive Rebound.",20,19,1,0.286447569793469,"UTSA","Old Dominion",3,4,0,0,-8,400919481,2017-03-04
72,1,"8:27",1707,1707,"Zoran Talley missed Jumper.",20,19,1,0.238020899942043,"UTSA","Old Dominion",3,4,0,0,-8,400919481,2017-03-04
73,1,"8:27",1707,1707,"Denzell Taylor Offensive Rebound.",20,19,1,0.238020899942043,"UTSA","Old Dominion",3,4,0,0,-8,400919481,2017-03-04
74,1,"8:24",1704,1704,"Denzell Taylor missed Two Point Tip Shot.",20,19,1,0.238020899942043,"UTSA","Old Dominion",3,4,0,0,-8,400919481,2017-03-04
75,1,"8:24",1704,1704,"Gino Littles Defensive Rebound.",20,19,1,0.238020899942043,"UTSA","Old Dominion",3,4,0,0,-8,400919481,2017-03-04
76,1,"8:15",1695,1695,"Gino Littles made Jumper.",22,19,3,0.330277592381016,"UTSA","Old Dominion",3,4,0,0,-8,400919481,2017-03-04
77,1,"7:51",1671,1671,"Zoran Talley missed Jumper.",22,19,3,0.306937157918991,"UTSA","Old Dominion",3,4,0,0,-8,400919481,2017-03-04
78,1,"7:51",1671,1671,"Byron Frohnen Defensive Rebound.",22,19,3,0.306937157918991,"UTSA","Old Dominion",3,4,0,0,-8,400919481,2017-03-04
79,1,"7:48",1668,1668,"Foul on Zoran Talley.",22,19,3,0.299598596270582,"UTSA","Old Dominion",3,4,0,0,-8,400919481,2017-03-04
80,1,"7:48",1668,1668,"Official TV Timeout",22,19,3,0.299598596270582,"UTSA","Old Dominion",3,4,0,0,-8,400919481,2017-03-04
81,1,"7:26",1646,1646,"Jeff Beverly missed Three Point Jumper.",22,19,3,0.316189649115145,"UTSA","Old Dominion",3,4,0,0,-8,400919481,2017-03-04
82,1,"7:26",1646,1646,"Ahmad Caver Defensive Rebound.",22,19,3,0.316189649115145,"UTSA","Old Dominion",3,4,0,0,-8,400919481,2017-03-04
83,1,"7:02",1622,1622,"B.J. Stith missed Jumper.",22,19,3,0.30371934383926,"UTSA","Old Dominion",3,4,0,0,-8,400919481,2017-03-04
84,1,"7:02",1622,1622,"Old Dominion Offensive Rebound.",22,19,3,0.30371934383926,"UTSA","Old Dominion",3,4,0,0,-8,400919481,2017-03-04
85,1,"6:57",1617,1617,"B.J. Stith missed Three Point Jumper.",22,19,3,0.307615979731116,"UTSA","Old Dominion",3,4,0,0,-8,400919481,2017-03-04
86,1,"6:57",1617,1617,"Ahmad Caver Offensive Rebound.",22,19,3,0.307615979731116,"UTSA","Old Dominion",3,4,0,0,-8,400919481,2017-03-04
87,1,"6:54",1614,1614,"Ahmad Caver missed Two Point Tip Shot.",22,19,3,0.307615979731116,"UTSA","Old Dominion",3,4,0,0,-8,400919481,2017-03-04
88,1,"6:54",1614,1614,"Lucas O'Brien Defensive Rebound.",22,19,3,0.307615979731116,"UTSA","Old Dominion",3,4,0,0,-8,400919481,2017-03-04
89,1,"6:52",1612,1612,"UT San Antonio  Timeout",22,19,3,0.307615979731116,"UTSA","Old Dominion",3,3,0,1,-8,400919481,2017-03-04
90,1,"6:42",1602,1602,"Byron Frohnen made Layup. Assisted by Gino Littles.",24,19,5,0.344956039135638,"UTSA","Old Dominion",3,3,0,1,-8,400919481,2017-03-04
91,1,"6:42",1602,1602,"Foul on Randy Haynes.",24,19,5,0.344956039135638,"UTSA","Old Dominion",3,3,0,1,-8,400919481,2017-03-04
92,1,"6:42",1602,1602,"Byron Frohnen made Free Throw.",25,19,6,0.375212790474858,"UTSA","Old Dominion",3,3,0,1,-8,400919481,2017-03-04
93,1,"6:13",1573,1573,"Ahmad Caver missed Three Point Jumper.",25,19,6,0.437547377337336,"UTSA","Old Dominion",3,3,0,1,-8,400919481,2017-03-04
94,1,"6:13",1573,1573,"Brandan Stith Offensive Rebound.",25,19,6,0.437547377337336,"UTSA","Old Dominion",3,3,0,1,-8,400919481,2017-03-04
95,1,"6:12",1572,1572,"Brandan Stith made Dunk.",25,21,4,0.363224790161644,"UTSA","Old Dominion",3,3,0,1,-8,400919481,2017-03-04
96,1,"5:53",1553,1553,"Jeff Beverly made Jumper.",27,21,6,0.418453138816948,"UTSA","Old Dominion",3,3,0,1,-8,400919481,2017-03-04
97,1,"5:23",1523,1523,"Randy Haynes made Jumper.",27,23,4,0.358314159033509,"UTSA","Old Dominion",3,3,0,0,-8,400919481,2017-03-04
98,1,"5:03",1503,1503,"Lucas O'Brien missed Three Point Jumper.",27,23,4,0.351533185144363,"UTSA","Old Dominion",3,3,0,0,-8,400919481,2017-03-04
99,1,"5:03",1503,1503,"Gino Littles Offensive Rebound.",27,23,4,0.351533185144363,"UTSA","Old Dominion",3,3,0,0,-8,400919481,2017-03-04
100,1,"4:51",1491,1491,"Gino Littles missed Three Point Jumper.",27,23,4,0.377162893077709,"UTSA","Old Dominion",3,3,0,0,-8,400919481,2017-03-04
101,1,"4:51",1491,1491,"Denzell Taylor Defensive Rebound.",27,23,4,0.377162893077709,"UTSA","Old Dominion",3,3,0,0,-8,400919481,2017-03-04
102,1,"4:35",1475,1475,"Ahmad Caver Turnover.",27,23,4,0.333362008062086,"UTSA","Old Dominion",3,3,0,0,-8,400919481,2017-03-04
103,1,"4:35",1475,1475,"Austin Karrer Steal.",27,23,4,0.333362008062086,"UTSA","Old Dominion",3,3,0,0,-8,400919481,2017-03-04
104,1,"4:19",1459,1459,"Byron Frohnen missed Jumper.",27,23,4,0.344308934697934,"UTSA","Old Dominion",3,3,0,0,-8,400919481,2017-03-04
105,1,"4:19",1459,1459,"Jordan Baker Defensive Rebound.",27,23,4,0.344308934697934,"UTSA","Old Dominion",3,3,0,0,-8,400919481,2017-03-04
106,1,"4:09",1449,1449,"Brandan Stith made Layup. Assisted by Ahmad Caver.",27,25,2,0.325151153534399,"UTSA","Old Dominion",3,3,0,0,-8,400919481,2017-03-04
107,1,"3:50",1430,1430,"Foul on Lucas O'Brien.",27,25,2,0.326432919761358,"UTSA","Old Dominion",3,3,0,0,-8,400919481,2017-03-04
108,1,"3:50",1430,1430,"Lucas O'Brien Turnover.",27,25,2,0.326432919761358,"UTSA","Old Dominion",3,3,0,0,-8,400919481,2017-03-04
109,1,"3:50",1430,1430,"Official TV Timeout",27,25,2,0.326432919761358,"UTSA","Old Dominion",3,3,0,0,-8,400919481,2017-03-04
110,1,"3:39",1419,1419,"B.J. Stith missed Jumper.",27,25,2,0.315217708787095,"UTSA","Old Dominion",3,3,0,0,-8,400919481,2017-03-04
111,1,"3:39",1419,1419,"Brandan Stith Offensive Rebound.",27,25,2,0.315217708787095,"UTSA","Old Dominion",3,3,0,0,-8,400919481,2017-03-04
112,1,"3:31",1411,1411,"Foul on Nick Allen.",27,25,2,0.315217708787095,"UTSA","Old Dominion",3,3,0,0,-8,400919481,2017-03-04
113,1,"3:31",1411,1411,"Brandan Stith made Free Throw.",27,26,1,0.282739326812713,"UTSA","Old Dominion",3,3,0,0,-8,400919481,2017-03-04
114,1,"3:31",1411,1411,"Brandan Stith missed Free Throw.",27,26,1,0.282739326812713,"UTSA","Old Dominion",3,3,0,0,-8,400919481,2017-03-04
115,1,"3:31",1411,1411,"Nick Allen Defensive Rebound.",27,26,1,0.282739326812713,"UTSA","Old Dominion",3,3,0,0,-8,400919481,2017-03-04
116,1,"3:30",1410,1410,"Foul on B.J. Stith.",27,26,1,0.282739326812713,"UTSA","Old Dominion",3,3,0,0,-8,400919481,2017-03-04
117,1,"3:06",1386,1386,"Foul on Brandan Stith.",27,26,1,0.28200962084045,"UTSA","Old Dominion",3,3,0,0,-8,400919481,2017-03-04
118,1,"3:00",1380,1380,"Giovanni De Nicolao missed Layup.",27,26,1,0.28200962084045,"UTSA","Old Dominion",3,3,0,0,-8,400919481,2017-03-04
119,1,"3:00",1380,1380,"Jeff Beverly Offensive Rebound.",27,26,1,0.28200962084045,"UTSA","Old Dominion",3,3,0,0,-8,400919481,2017-03-04
120,1,"3:00",1380,1380,"Foul on Denzell Taylor.",27,26,1,0.28200962084045,"UTSA","Old Dominion",3,3,0,0,-8,400919481,2017-03-04
121,1,"3:00",1380,1380,"Jeff Beverly made Free Throw.",28,26,2,0.313228905741112,"UTSA","Old Dominion",3,3,0,0,-8,400919481,2017-03-04
122,1,"3:00",1380,1380,"Jeff Beverly made Free Throw.",29,26,3,0.3462376322803,"UTSA","Old Dominion",3,3,0,0,-8,400919481,2017-03-04
123,1,"2:45",1365,1365,"Ahmad Caver missed Jumper.",29,26,3,0.343150343358927,"UTSA","Old Dominion",3,3,0,0,-8,400919481,2017-03-04
124,1,"2:45",1365,1365,"Giovanni De Nicolao Defensive Rebound.",29,26,3,0.343150343358927,"UTSA","Old Dominion",3,3,0,0,-8,400919481,2017-03-04
125,1,"2:34",1354,1354,"Foul on Jordan Baker.",29,26,3,0.358105852661558,"UTSA","Old Dominion",3,3,0,0,-8,400919481,2017-03-04
126,1,"2:34",1354,1354,"Byron Frohnen made Free Throw.",30,26,4,0.394337434496593,"UTSA","Old Dominion",3,3,0,0,-8,400919481,2017-03-04
127,1,"2:34",1354,1354,"Byron Frohnen made Free Throw.",31,26,5,0.43176900673495,"UTSA","Old Dominion",3,3,0,0,-8,400919481,2017-03-04
128,1,"2:23",1343,1343,"Jordan Baker made Three Point Jumper. Assisted by Ahmad Caver.",31,29,2,0.318762671074683,"UTSA","Old Dominion",3,3,0,0,-8,400919481,2017-03-04
129,1,"2:02",1322,1322,"George Willborn III Turnover.",31,29,2,0.310437553376724,"UTSA","Old Dominion",3,3,0,0,-8,400919481,2017-03-04
130,1,"2:02",1322,1322,"Jordan Baker Steal.",31,29,2,0.310437553376724,"UTSA","Old Dominion",3,3,0,0,-8,400919481,2017-03-04
131,1,"1:45",1305,1305,"B.J. Stith missed Jumper.",31,29,2,0.333483251355502,"UTSA","Old Dominion",3,3,0,0,-8,400919481,2017-03-04
132,1,"1:45",1305,1305,"Old Dominion Deadball Team Rebound.",31,29,2,0.333483251355502,"UTSA","Old Dominion",3,3,0,0,-8,400919481,2017-03-04
133,1,"1:42",1302,1302,"Foul on Nick Allen.",31,29,2,0.333483251355502,"UTSA","Old Dominion",3,3,0,0,-8,400919481,2017-03-04
134,1,"1:42",1302,1302,"Trey Porter made Free Throw.",31,30,1,0.301621373768416,"UTSA","Old Dominion",3,3,0,0,-8,400919481,2017-03-04
135,1,"1:42",1302,1302,"Trey Porter made Free Throw.",31,31,0,0.271563358891676,"UTSA","Old Dominion",3,3,0,0,-8,400919481,2017-03-04
136,1,"1:23",1283,1283,"George Willborn III made Layup. Assisted by Jeff Beverly.",33,31,2,0.297662675990493,"UTSA","Old Dominion",3,3,0,0,-8,400919481,2017-03-04
137,1,"1:01",1261,1261,"Trey Porter missed Jumper.",33,31,2,0.324546577602208,"UTSA","Old Dominion",3,3,0,0,-8,400919481,2017-03-04
138,1,"1:01",1261,1261,"Jeff Beverly Defensive Rebound.",33,31,2,0.324546577602208,"UTSA","Old Dominion",3,3,0,0,-8,400919481,2017-03-04
139,1,"0:43",1243,1243,"Byron Frohnen missed Jumper.",33,31,2,0.308818301232642,"UTSA","Old Dominion",3,3,0,0,-8,400919481,2017-03-04
140,1,"0:43",1243,1243,"B.J. Stith Defensive Rebound.",33,31,2,0.308818301232642,"UTSA","Old Dominion",3,3,0,0,-8,400919481,2017-03-04
141,1,"0:31",1231,1231,"Ahmad Caver missed Layup.",33,31,2,0.323119600741483,"UTSA","Old Dominion",3,3,0,0,-8,400919481,2017-03-04
142,1,"0:31",1231,1231,"Aaron Carver Offensive Rebound.",33,31,2,0.323119600741483,"UTSA","Old Dominion",3,3,0,0,-8,400919481,2017-03-04
143,1,"0:30",1230,1230,"Foul on Trey Porter.",33,31,2,0.323119600741483,"UTSA","Old Dominion",3,3,0,0,-8,400919481,2017-03-04
144,1,"0:30",1230,1230,"Byron Frohnen made Free Throw.",34,31,3,0.359285953138877,"UTSA","Old Dominion",3,3,0,0,-8,400919481,2017-03-04
145,1,"0:30",1230,1230,"Byron Frohnen made Free Throw.",35,31,4,0.397125367723456,"UTSA","Old Dominion",3,3,0,0,-8,400919481,2017-03-04
146,1,"0:09",1209,1209,"Ahmad Caver missed Layup.",35,31,4,0.391629019082511,"UTSA","Old Dominion",3,3,0,0,-8,400919481,2017-03-04
147,1,"0:09",1209,1209,"Austin Karrer Defensive Rebound.",35,31,4,0.391629019082511,"UTSA","Old Dominion",3,3,0,0,-8,400919481,2017-03-04
148,1,"0:04",1204,1204,"Austin Karrer Turnover.",35,31,4,0.391629019082511,"UTSA","Old Dominion",3,3,0,0,-8,400919481,2017-03-04
149,1,"0:04",1204,1204,"B.J. Stith Steal.",35,31,4,0.391629019082511,"UTSA","Old Dominion",3,3,0,0,-8,400919481,2017-03-04
150,1,"0:04",1204,1204,"Foul on Austin Karrer.",35,31,4,0.391629019082511,"UTSA","Old Dominion",3,3,0,0,-8,400919481,2017-03-04
151,1,"0:00",1200,1200,"Ahmad Caver missed Layup.",35,31,4,0.391629019082511,"UTSA","Old Dominion",3,3,0,0,-8,400919481,2017-03-04
152,1,"0:00",1200,1200,"Old Dominion Deadball Team Rebound.",35,31,4,0.391629019082511,"UTSA","Old Dominion",3,3,0,0,-8,400919481,2017-03-04
153,1,"0:00",1200,1200,"End of 1st half",35,31,4,0.391629019082511,"UTSA","Old Dominion",3,3,0,0,-8,400919481,2017-03-04
154,2,"20:00",1200,1200,"PLAY",35,31,4,0.391629019082511,"UTSA","Old Dominion",4,4,0,0,-8,400919481,2017-03-04
155,2,"19:34",1174,1174,"Jeff Beverly missed Jumper.",35,31,4,0.417513056039651,"UTSA","Old Dominion",4,4,0,0,-8,400919481,2017-03-04
156,2,"19:34",1174,1174,"Brandan Stith Defensive Rebound.",35,31,4,0.417513056039651,"UTSA","Old Dominion",4,4,0,0,-8,400919481,2017-03-04
157,2,"19:20",1160,1160,"Jordan Baker missed Three Point Jumper.",35,31,4,0.367038774306852,"UTSA","Old Dominion",4,4,0,0,-8,400919481,2017-03-04
158,2,"19:20",1160,1160,"Jeff Beverly Defensive Rebound.",35,31,4,0.367038774306852,"UTSA","Old Dominion",4,4,0,0,-8,400919481,2017-03-04
159,2,"19:11",1151,1151,"Foul on Denzell Taylor.",35,31,4,0.418425787450044,"UTSA","Old Dominion",4,4,0,0,-8,400919481,2017-03-04
160,2,"19:11",1151,1151,"Jeff Beverly made Free Throw.",36,31,5,0.458226591754398,"UTSA","Old Dominion",4,4,0,0,-8,400919481,2017-03-04
161,2,"19:11",1151,1151,"Jeff Beverly made Free Throw.",37,31,6,0.498567742207493,"UTSA","Old Dominion",4,4,0,0,-8,400919481,2017-03-04
162,2,"19:00",1140,1140,"Brandan Stith made Layup.",37,33,4,0.434743891755757,"UTSA","Old Dominion",4,4,0,0,-8,400919481,2017-03-04
163,2,"18:34",1114,1114,"Jeff Beverly made Jumper. Assisted by Giovanni De Nicolao.",39,33,6,0.527873706953645,"UTSA","Old Dominion",4,4,0,0,-8,400919481,2017-03-04
164,2,"18:07",1087,1087,"Brandan Stith missed Jumper.",39,33,6,0.48757042080803,"UTSA","Old Dominion",4,4,0,0,-8,400919481,2017-03-04
165,2,"18:07",1087,1087,"Byron Frohnen Defensive Rebound.",39,33,6,0.48757042080803,"UTSA","Old Dominion",4,4,0,0,-8,400919481,2017-03-04
166,2,"17:47",1067,1067,"Lucas O'Brien made Three Point Jumper. Assisted by Giovanni De Nicolao.",42,33,9,0.668858712437805,"UTSA","Old Dominion",4,4,0,0,-8,400919481,2017-03-04
167,2,"17:23",1043,1043,"Brandan Stith missed Layup.",42,33,9,0.655388351786951,"UTSA","Old Dominion",4,4,0,0,-8,400919481,2017-03-04
168,2,"17:23",1043,1043,"Lucas O'Brien Defensive Rebound.",42,33,9,0.655388351786951,"UTSA","Old Dominion",4,4,0,0,-8,400919481,2017-03-04
169,2,"17:07",1027,1027,"Giovanni De Nicolao missed Layup.",42,33,9,0.661796369362781,"UTSA","Old Dominion",4,4,0,0,-8,400919481,2017-03-04
170,2,"17:07",1027,1027,"Aaron Carver Defensive Rebound.",42,33,9,0.661796369362781,"UTSA","Old Dominion",4,4,0,0,-8,400919481,2017-03-04
171,2,"16:58",1018,1018,"Ahmad Caver missed Layup.",42,33,9,0.642331548913928,"UTSA","Old Dominion",4,4,0,0,-8,400919481,2017-03-04
172,2,"16:58",1018,1018,"Lucas O'Brien Defensive Rebound.",42,33,9,0.642331548913928,"UTSA","Old Dominion",4,4,0,0,-8,400919481,2017-03-04
173,2,"16:42",1002,1002,"Jeff Beverly missed Jumper.",42,33,9,0.660217471148074,"UTSA","Old Dominion",4,4,0,0,-8,400919481,2017-03-04
174,2,"16:42",1002,1002,"Brandan Stith Block.",42,33,9,0.660217471148074,"UTSA","Old Dominion",4,4,0,0,-8,400919481,2017-03-04
175,2,"16:41",1001,1001,"Brandan Stith Defensive Rebound.",42,33,9,0.660217471148074,"UTSA","Old Dominion",4,4,0,0,-8,400919481,2017-03-04
176,2,"16:36",996,996,"Foul on Brandan Stith.",42,33,9,0.637111711502803,"UTSA","Old Dominion",4,4,0,0,-8,400919481,2017-03-04
177,2,"16:36",996,996,"Brandan Stith Turnover.",42,33,9,0.637111711502803,"UTSA","Old Dominion",4,4,0,0,-8,400919481,2017-03-04
178,2,"16:19",979,979,"Jeff Beverly made Jumper. Assisted by Giovanni De Nicolao.",44,33,11,0.737537522965415,"UTSA","Old Dominion",4,4,0,0,-8,400919481,2017-03-04
179,2,"16:00",960,960,"B.J. Stith missed Jumper.",44,33,11,0.75370766760817,"UTSA","Old Dominion",4,4,0,0,-8,400919481,2017-03-04
180,2,"16:00",960,960,"Jeff Beverly Defensive Rebound.",44,33,11,0.75370766760817,"UTSA","Old Dominion",4,4,0,0,-8,400919481,2017-03-04
181,2,"15:42",942,942,"Giovanni De Nicolao missed Jumper.",44,33,11,0.768701634221378,"UTSA","Old Dominion",4,4,0,0,-8,400919481,2017-03-04
182,2,"15:42",942,942,"Ahmad Caver Block.",44,33,11,0.768701634221378,"UTSA","Old Dominion",4,4,0,0,-8,400919481,2017-03-04
183,2,"15:39",939,939,"Trey Porter Defensive Rebound.",44,33,11,0.763656690365167,"UTSA","Old Dominion",4,4,0,0,-8,400919481,2017-03-04
184,2,"15:36",936,936,"Foul on Giovanni De Nicolao.",44,33,11,0.763656690365167,"UTSA","Old Dominion",4,4,0,0,-8,400919481,2017-03-04
185,2,"15:36",936,936,"Official TV Timeout",44,33,11,0.763656690365167,"UTSA","Old Dominion",4,4,0,0,-8,400919481,2017-03-04
186,2,"15:23",923,923,"Ahmad Caver Turnover.",44,33,11,0.752890291792646,"UTSA","Old Dominion",4,4,0,0,-8,400919481,2017-03-04
187,2,"15:21",921,921,"Jeff Beverly Steal.",44,33,11,0.752890291792646,"UTSA","Old Dominion",4,4,0,0,-8,400919481,2017-03-04
188,2,"15:09",909,909,"Nick Allen Turnover.",44,33,11,0.76826193482381,"UTSA","Old Dominion",4,4,0,0,-8,400919481,2017-03-04
189,2,"14:57",897,897,"Zoran Talley missed Jumper.",44,33,11,0.781940633335937,"UTSA","Old Dominion",4,4,0,0,-8,400919481,2017-03-04
