"play_id","half","time_remaining_half","secs_remaining","secs_remaining_absolute","description","home_score","away_score","score_diff","win_prob","home","away","home_time_out_remaining","away_time_out_remaining","home_timeout_ind","away_timeout_ind","home_favored_by","game_id","date"
1,1,"20:00",2400,2400,"PLAY",0,0,0,0.821691623735064,"Jacksonville","Stetson",6,6,0,0,7.4,400918799,2017-01-25
2,1,"19:42",2382,2382,"Cody Helgeland Turnover.",0,0,0,0.81752825172891,"Jacksonville","Stetson",6,6,0,0,7.4,400918799,2017-01-25
3,1,"19:28",2368,2368,"Larry Dennis made Layup. Assisted by Divine Myles.",0,2,-2,0.791674713719441,"Jacksonville","Stetson",6,6,0,0,7.4,400918799,2017-01-25
4,1,"19:18",2358,2358,"Antwon Clayton missed Jumper.",0,2,-2,0.793133577299769,"Jacksonville","Stetson",6,6,0,0,7.4,400918799,2017-01-25
5,1,"19:18",2358,2358,"Darien Fernandez Offensive Rebound.",0,2,-2,0.793133577299769,"Jacksonville","Stetson",6,6,0,0,7.4,400918799,2017-01-25
6,1,"18:58",2338,2338,"Tanner Rubio made Three Point Jumper. Assisted by Darien Fernandez.",3,2,1,0.824763319382541,"Jacksonville","Stetson",6,6,0,0,7.4,400918799,2017-01-25
7,1,"18:42",2322,2322,"Luke Doyle made Three Point Jumper. Assisted by Angel Rivera.",3,5,-2,0.779277144895325,"Jacksonville","Stetson",6,6,0,0,7.4,400918799,2017-01-25
8,1,"18:29",2309,2309,"Tanner Rubio made Three Point Jumper.",6,5,1,0.814360020911524,"Jacksonville","Stetson",6,6,0,0,7.4,400918799,2017-01-25
9,1,"18:09",2289,2289,"Foul on J.R. Holder.",6,5,1,0.819367543845483,"Jacksonville","Stetson",6,6,0,0,7.4,400918799,2017-01-25
10,1,"18:02",2282,2282,"Derick Newton Turnover.",6,5,1,0.819367543845483,"Jacksonville","Stetson",6,6,0,0,7.4,400918799,2017-01-25
11,1,"18:01",2281,2281,"Tanner Rubio Steal.",6,5,1,0.819367543845483,"Jacksonville","Stetson",6,6,0,0,7.4,400918799,2017-01-25
12,1,"17:55",2275,2275,"Antwon Clayton missed Layup.",6,5,1,0.824655246039022,"Jacksonville","Stetson",6,6,0,0,7.4,400918799,2017-01-25
13,1,"17:55",2275,2275,"J.R. Holder Offensive Rebound.",6,5,1,0.824655246039022,"Jacksonville","Stetson",6,6,0,0,7.4,400918799,2017-01-25
14,1,"17:50",2270,2270,"Darien Fernandez made Three Point Jumper. Assisted by Tanner Rubio.",9,5,4,0.865139899622221,"Jacksonville","Stetson",6,6,0,0,7.4,400918799,2017-01-25
15,1,"17:34",2254,2254,"Derick Newton missed Three Point Jumper.",9,5,4,0.856347638285659,"Jacksonville","Stetson",6,6,0,0,7.4,400918799,2017-01-25
16,1,"17:34",2254,2254,"J.R. Holder Defensive Rebound.",9,5,4,0.856347638285659,"Jacksonville","Stetson",6,6,0,0,7.4,400918799,2017-01-25
17,1,"17:25",2245,2245,"Darien Fernandez made Three Point Jumper. Assisted by Tanner Rubio.",12,5,7,0.883691654079859,"Jacksonville","Stetson",6,6,0,0,7.4,400918799,2017-01-25
18,1,"17:12",2232,2232,"Angel Rivera missed Layup.",12,5,7,0.90092796846947,"Jacksonville","Stetson",6,6,0,0,7.4,400918799,2017-01-25
19,1,"17:12",2232,2232,"Jacksonville Defensive Rebound.",12,5,7,0.90092796846947,"Jacksonville","Stetson",6,6,0,0,7.4,400918799,2017-01-25
20,1,"16:58",2218,2218,"Tanner Rubio missed Three Point Jumper.",12,5,7,0.910565754299719,"Jacksonville","Stetson",6,6,0,0,7.4,400918799,2017-01-25
21,1,"16:58",2218,2218,"Derick Newton Defensive Rebound.",12,5,7,0.910565754299719,"Jacksonville","Stetson",6,6,0,0,7.4,400918799,2017-01-25
22,1,"16:33",2193,2193,"Luke Doyle missed Layup.",12,5,7,0.907633387529219,"Jacksonville","Stetson",6,6,0,0,7.4,400918799,2017-01-25
23,1,"16:33",2193,2193,"Larry Dennis Offensive Rebound.",12,5,7,0.907633387529219,"Jacksonville","Stetson",6,6,0,0,7.4,400918799,2017-01-25
24,1,"16:29",2189,2189,"Larry Dennis made Two Point Tip Shot.",12,7,5,0.875269798286545,"Jacksonville","Stetson",6,6,0,0,7.4,400918799,2017-01-25
25,1,"16:14",2174,2174,"Cody Helgeland missed Three Point Jumper.",12,7,5,0.872197911993669,"Jacksonville","Stetson",6,6,0,0,7.4,400918799,2017-01-25
26,1,"16:14",2174,2174,"Angel Rivera Defensive Rebound.",12,7,5,0.872197911993669,"Jacksonville","Stetson",6,6,0,0,7.4,400918799,2017-01-25
27,1,"15:48",2148,2148,"Derick Newton missed Three Point Jumper.",12,7,5,0.873865891653677,"Jacksonville","Stetson",6,6,0,0,7.4,400918799,2017-01-25
28,1,"15:48",2148,2148,"J.R. Holder Defensive Rebound.",12,7,5,0.873865891653677,"Jacksonville","Stetson",6,6,0,0,7.4,400918799,2017-01-25
29,1,"15:31",2131,2131,"Cody Helgeland made Three Point Jumper. Assisted by Tanner Rubio.",15,7,8,0.91357887458698,"Jacksonville","Stetson",6,6,0,0,7.4,400918799,2017-01-25
30,1,"15:13",2113,2113,"Derick Newton made Jumper.",15,9,6,0.894110209681671,"Jacksonville","Stetson",6,6,0,0,7.4,400918799,2017-01-25
31,1,"14:43",2083,2083,"Darien Fernandez made Three Point Jumper. Assisted by Cody Helgeland.",18,9,9,0.913186154810182,"Jacksonville","Stetson",6,6,0,0,7.4,400918799,2017-01-25
32,1,"14:25",2065,2065,"Foul on Tanner Rubio.",18,9,9,0.917918090398276,"Jacksonville","Stetson",6,6,1,0,7.4,400918799,2017-01-25
33,1,"14:25",2065,2065,"Stetson  Timeout",18,9,9,0.917918090398276,"Jacksonville","Stetson",5,6,1,0,7.4,400918799,2017-01-25
34,1,"14:25",2065,2065,"Angel Rivera missed Free Throw.",18,9,9,0.917918090398276,"Jacksonville","Stetson",5,6,1,0,7.4,400918799,2017-01-25
35,1,"14:25",2065,2065,"Stetson Deadball Team Rebound.",18,9,9,0.917918090398276,"Jacksonville","Stetson",5,6,1,0,7.4,400918799,2017-01-25
36,1,"14:25",2065,2065,"Angel Rivera made Free Throw.",18,10,8,0.908376211624637,"Jacksonville","Stetson",5,6,1,0,7.4,400918799,2017-01-25
37,1,"14:10",2050,2050,"J.R. Holder Turnover.",18,10,8,0.91249535188016,"Jacksonville","Stetson",5,6,1,0,7.4,400918799,2017-01-25
38,1,"13:54",2034,2034,"Leo Goodman Turnover.",18,10,8,0.912312845572053,"Jacksonville","Stetson",5,6,1,0,7.4,400918799,2017-01-25
39,1,"13:52",2032,2032,"Cody Helgeland Steal.",18,10,8,0.912312845572053,"Jacksonville","Stetson",5,6,1,0,7.4,400918799,2017-01-25
40,1,"13:48",2028,2028,"Cody Helgeland made Three Point Jumper. Assisted by J.R. Holder.",21,10,11,0.942704667299093,"Jacksonville","Stetson",5,6,1,0,7.4,400918799,2017-01-25
41,1,"13:30",2010,2010,"Brian Pegg Turnover.",21,10,11,0.933824947353364,"Jacksonville","Stetson",5,6,1,0,7.4,400918799,2017-01-25
42,1,"13:30",2010,2010,"Foul on Brian Pegg.",21,10,11,0.933824947353364,"Jacksonville","Stetson",5,6,1,0,7.4,400918799,2017-01-25
43,1,"13:18",1998,1998,"Cody Helgeland made Three Point Jumper. Assisted by Tanner Rubio.",24,10,14,0.960060564291773,"Jacksonville","Stetson",5,6,0,0,7.4,400918799,2017-01-25
44,1,"13:14",1994,1994,"Stetson  Timeout",24,10,14,0.960060564291773,"Jacksonville","Stetson",4,6,1,0,7.4,400918799,2017-01-25
45,1,"12:55",1975,1975,"Leo Goodman missed Three Point Jumper.",24,10,14,0.959959902153042,"Jacksonville","Stetson",4,6,1,0,7.4,400918799,2017-01-25
46,1,"12:55",1975,1975,"Demontrez Austin Defensive Rebound.",24,10,14,0.959959902153042,"Jacksonville","Stetson",4,6,1,0,7.4,400918799,2017-01-25
47,1,"12:43",1963,1963,"Tanner Rubio missed Layup.",24,10,14,0.94447527763463,"Jacksonville","Stetson",4,6,1,0,7.4,400918799,2017-01-25
48,1,"12:43",1963,1963,"Jacksonville Offensive Rebound.",24,10,14,0.94447527763463,"Jacksonville","Stetson",4,6,1,0,7.4,400918799,2017-01-25
49,1,"12:42",1962,1962,"Foul on Brian Pegg.",24,10,14,0.94447527763463,"Jacksonville","Stetson",4,6,1,0,7.4,400918799,2017-01-25
50,1,"12:37",1957,1957,"Cody Helgeland missed Three Point Jumper.",24,10,14,0.956362701244243,"Jacksonville","Stetson",4,6,1,0,7.4,400918799,2017-01-25
51,1,"12:37",1957,1957,"Clay Verk Defensive Rebound.",24,10,14,0.956362701244243,"Jacksonville","Stetson",4,6,1,0,7.4,400918799,2017-01-25
52,1,"12:28",1948,1948,"Divine Myles missed Layup.",24,10,14,0.956620058165233,"Jacksonville","Stetson",4,6,1,0,7.4,400918799,2017-01-25
53,1,"12:28",1948,1948,"J.R. Holder Block.",24,10,14,0.956620058165233,"Jacksonville","Stetson",4,6,1,0,7.4,400918799,2017-01-25
54,1,"12:24",1944,1944,"Cody Helgeland Defensive Rebound.",24,10,14,0.956620058165233,"Jacksonville","Stetson",4,6,1,0,7.4,400918799,2017-01-25
55,1,"12:19",1939,1939,"J.R. Holder missed Layup.",24,10,14,0.956286030315632,"Jacksonville","Stetson",4,6,1,0,7.4,400918799,2017-01-25
56,1,"12:19",1939,1939,"Demontrez Austin Offensive Rebound.",24,10,14,0.956286030315632,"Jacksonville","Stetson",4,6,1,0,7.4,400918799,2017-01-25
57,1,"12:09",1929,1929,"Cody Helgeland missed Layup.",24,10,14,0.957636697149748,"Jacksonville","Stetson",4,6,0,0,7.4,400918799,2017-01-25
58,1,"12:09",1929,1929,"B.J. Glasford Defensive Rebound.",24,10,14,0.957636697149748,"Jacksonville","Stetson",4,6,0,0,7.4,400918799,2017-01-25
59,1,"11:58",1918,1918,"Angel Rivera missed Layup.",24,10,14,0.9607914179934,"Jacksonville","Stetson",4,6,0,0,7.4,400918799,2017-01-25
60,1,"11:58",1918,1918,"Darien Fernandez Defensive Rebound.",24,10,14,0.9607914179934,"Jacksonville","Stetson",4,6,0,0,7.4,400918799,2017-01-25
61,1,"11:48",1908,1908,"J.R. Holder made Three Point Jumper. Assisted by Tanner Rubio.",27,10,17,0.965391388073939,"Jacksonville","Stetson",4,6,0,0,7.4,400918799,2017-01-25
62,1,"11:35",1895,1895,"B.J. Glasford missed Three Point Jumper.",27,10,17,0.973406897952544,"Jacksonville","Stetson",4,6,0,0,7.4,400918799,2017-01-25
63,1,"11:35",1895,1895,"Darien Fernandez Defensive Rebound.",27,10,17,0.973406897952544,"Jacksonville","Stetson",4,6,0,0,7.4,400918799,2017-01-25
64,1,"11:24",1884,1884,"Foul on Divine Myles.",27,10,17,0.968521501088517,"Jacksonville","Stetson",4,6,0,1,7.4,400918799,2017-01-25
65,1,"11:24",1884,1884,"Jacksonville  Timeout",27,10,17,0.968521501088517,"Jacksonville","Stetson",4,5,0,1,7.4,400918799,2017-01-25
66,1,"11:24",1884,1884,"Darien Fernandez made Free Throw.",28,10,18,0.972082243669652,"Jacksonville","Stetson",4,5,0,1,7.4,400918799,2017-01-25
67,1,"11:24",1884,1884,"Darien Fernandez made Free Throw.",29,10,19,0.975250499533126,"Jacksonville","Stetson",4,5,0,1,7.4,400918799,2017-01-25
68,1,"11:12",1872,1872,"Foul on Darius Dawkins.",29,10,19,0.97497765295054,"Jacksonville","Stetson",4,5,0,1,7.4,400918799,2017-01-25
69,1,"11:12",1872,1872,"Divine Myles missed Free Throw.",29,10,19,0.97497765295054,"Jacksonville","Stetson",4,5,0,1,7.4,400918799,2017-01-25
70,1,"11:12",1872,1872,"Stetson Deadball Team Rebound.",29,10,19,0.97497765295054,"Jacksonville","Stetson",4,5,0,1,7.4,400918799,2017-01-25
71,1,"11:12",1872,1872,"Divine Myles made Free Throw.",29,11,18,0.971763686751526,"Jacksonville","Stetson",4,5,0,1,7.4,400918799,2017-01-25
72,1,"10:49",1849,1849,"Tanner Rubio missed Three Point Jumper.",29,11,18,0.970412333284841,"Jacksonville","Stetson",4,5,0,1,7.4,400918799,2017-01-25
73,1,"10:49",1849,1849,"Divine Myles Defensive Rebound.",29,11,18,0.970412333284841,"Jacksonville","Stetson",4,5,0,1,7.4,400918799,2017-01-25
74,1,"10:37",1837,1837,"Foul on Darius Dawkins.",29,11,18,0.972737226156015,"Jacksonville","Stetson",4,5,0,1,7.4,400918799,2017-01-25
75,1,"10:37",1837,1837,"Clay Verk made Free Throw.",29,12,17,0.969158306975896,"Jacksonville","Stetson",4,5,0,1,7.4,400918799,2017-01-25
76,1,"10:37",1837,1837,"Clay Verk missed Free Throw.",29,12,17,0.969158306975896,"Jacksonville","Stetson",4,5,0,1,7.4,400918799,2017-01-25
77,1,"10:37",1837,1837,"Antwon Clayton Defensive Rebound.",29,12,17,0.969158306975896,"Jacksonville","Stetson",4,5,0,1,7.4,400918799,2017-01-25
78,1,"10:10",1810,1810,"J.R. Holder made Layup.",31,12,19,0.981260979260721,"Jacksonville","Stetson",4,5,0,0,7.4,400918799,2017-01-25
79,1,"9:51",1791,1791,"Derick Newton missed Jumper.",31,12,19,0.976041649805317,"Jacksonville","Stetson",4,5,0,0,7.4,400918799,2017-01-25
80,1,"9:51",1791,1791,"J.R. Holder Defensive Rebound.",31,12,19,0.976041649805317,"Jacksonville","Stetson",4,5,0,0,7.4,400918799,2017-01-25
81,1,"9:44",1784,1784,"J.R. Holder missed Layup.",31,12,19,0.978086296524288,"Jacksonville","Stetson",4,5,0,0,7.4,400918799,2017-01-25
82,1,"9:44",1784,1784,"J.R. Holder Offensive Rebound.",31,12,19,0.978086296524288,"Jacksonville","Stetson",4,5,0,0,7.4,400918799,2017-01-25
83,1,"9:41",1781,1781,"J.R. Holder made Layup.",33,12,21,0.983292876349389,"Jacksonville","Stetson",4,5,0,0,7.4,400918799,2017-01-25
84,1,"9:31",1771,1771,"Foul on Darien Fernandez.",33,12,21,0.978150767194712,"Jacksonville","Stetson",4,5,0,0,7.4,400918799,2017-01-25
85,1,"9:19",1759,1759,"Derick Newton missed Jumper.",33,12,21,0.98503864031871,"Jacksonville","Stetson",4,5,0,0,7.4,400918799,2017-01-25
86,1,"9:19",1759,1759,"Clay Verk Offensive Rebound.",33,12,21,0.98503864031871,"Jacksonville","Stetson",4,5,0,0,7.4,400918799,2017-01-25
87,1,"9:16",1756,1756,"Clay Verk made Layup.",33,14,19,0.980294543257376,"Jacksonville","Stetson",4,5,0,0,7.4,400918799,2017-01-25
88,1,"8:56",1736,1736,"Tanner Rubio made Layup.",35,14,21,0.984536431789603,"Jacksonville","Stetson",4,5,0,0,7.4,400918799,2017-01-25
89,1,"8:41",1721,1721,"Clay Verk Turnover.",35,14,21,0.983125833277805,"Jacksonville","Stetson",4,5,0,0,7.4,400918799,2017-01-25
90,1,"8:41",1721,1721,"Foul on Clay Verk.",35,14,21,0.983125833277805,"Jacksonville","Stetson",4,5,0,0,7.4,400918799,2017-01-25
91,1,"8:26",1706,1706,"Tanner Rubio missed Layup.",35,14,21,0.980390335490692,"Jacksonville","Stetson",4,5,0,0,7.4,400918799,2017-01-25
92,1,"8:26",1706,1706,"Clay Verk Defensive Rebound.",35,14,21,0.980390335490692,"Jacksonville","Stetson",4,5,0,0,7.4,400918799,2017-01-25
93,1,"8:17",1697,1697,"Derick Newton made Jumper. Assisted by Luke Doyle.",35,16,19,0.981496826505291,"Jacksonville","Stetson",4,5,0,0,7.4,400918799,2017-01-25
94,1,"8:06",1686,1686,"Darien Fernandez made Three Point Jumper. Assisted by J.R. Holder.",38,16,22,0.989156774735714,"Jacksonville","Stetson",4,5,0,0,7.4,400918799,2017-01-25
95,1,"7:51",1671,1671,"Luke Doyle made Three Point Jumper. Assisted by Derick Newton.",38,19,19,0.980402430262711,"Jacksonville","Stetson",4,5,0,0,7.4,400918799,2017-01-25
96,1,"7:30",1650,1650,"Antwon Clayton made Layup. Assisted by Cody Helgeland.",40,19,21,0.982473798810207,"Jacksonville","Stetson",4,5,0,0,7.4,400918799,2017-01-25
97,1,"7:14",1634,1634,"Luke Doyle Turnover.",40,19,21,0.982581910052373,"Jacksonville","Stetson",4,5,0,1,7.4,400918799,2017-01-25
98,1,"7:14",1634,1634,"Jacksonville  Timeout",40,19,21,0.982581910052373,"Jacksonville","Stetson",4,4,0,1,7.4,400918799,2017-01-25
99,1,"7:01",1621,1621,"Tanner Rubio Turnover.",40,19,21,0.985271593861027,"Jacksonville","Stetson",4,4,0,1,7.4,400918799,2017-01-25
100,1,"7:00",1620,1620,"Derick Newton Steal.",40,19,21,0.985271593861027,"Jacksonville","Stetson",4,4,0,1,7.4,400918799,2017-01-25
101,1,"6:57",1617,1617,"Foul on Cody Helgeland.",40,19,21,0.983741448448804,"Jacksonville","Stetson",4,4,0,1,7.4,400918799,2017-01-25
102,1,"6:57",1617,1617,"Derick Newton made Free Throw.",40,20,20,0.981330218822256,"Jacksonville","Stetson",4,4,0,1,7.4,400918799,2017-01-25
103,1,"6:57",1617,1617,"Derick Newton missed Free Throw.",40,20,20,0.981330218822256,"Jacksonville","Stetson",4,4,0,1,7.4,400918799,2017-01-25
104,1,"6:57",1617,1617,"Antwon Clayton Defensive Rebound.",40,20,20,0.981330218822256,"Jacksonville","Stetson",4,4,0,1,7.4,400918799,2017-01-25
105,1,"6:43",1603,1603,"Tanner Rubio made Three Point Jumper. Assisted by J.R. Holder.",43,20,23,0.986234252115297,"Jacksonville","Stetson",4,4,0,1,7.4,400918799,2017-01-25
106,1,"6:30",1590,1590,"Foul on Antwon Clayton.",43,20,23,0.987215559863025,"Jacksonville","Stetson",4,4,0,1,7.4,400918799,2017-01-25
107,1,"6:30",1590,1590,"B.J. Glasford missed Free Throw.",43,20,23,0.987215559863025,"Jacksonville","Stetson",4,4,0,1,7.4,400918799,2017-01-25
108,1,"6:30",1590,1590,"Stetson Deadball Team Rebound.",43,20,23,0.987215559863025,"Jacksonville","Stetson",4,4,0,1,7.4,400918799,2017-01-25
109,1,"6:30",1590,1590,"B.J. Glasford made Free Throw.",43,21,22,0.985394071787626,"Jacksonville","Stetson",4,4,0,1,7.4,400918799,2017-01-25
110,1,"6:13",1573,1573,"J.R. Holder made Layup.",45,21,24,0.993135509500945,"Jacksonville","Stetson",4,4,0,0,7.4,400918799,2017-01-25
111,1,"6:00",1560,1560,"Foul on Antwon Clayton.",45,21,24,0.989964705827287,"Jacksonville","Stetson",4,4,0,0,7.4,400918799,2017-01-25
112,1,"6:00",1560,1560,"Derick Newton made Free Throw.",45,22,23,0.988447170255504,"Jacksonville","Stetson",4,4,0,0,7.4,400918799,2017-01-25
113,1,"6:00",1560,1560,"Derick Newton made Free Throw.",45,23,22,0.986703235491461,"Jacksonville","Stetson",4,4,0,0,7.4,400918799,2017-01-25
114,1,"5:42",1542,1542,"J.R. Holder missed Three Point Jumper.",45,23,22,0.986771018168127,"Jacksonville","Stetson",4,4,0,0,7.4,400918799,2017-01-25
115,1,"5:42",1542,1542,"B.J. Glasford Defensive Rebound.",45,23,22,0.986771018168127,"Jacksonville","Stetson",4,4,0,0,7.4,400918799,2017-01-25
116,1,"5:31",1531,1531,"Leo Goodman made Three Point Jumper. Assisted by Derick Newton.",45,26,19,0.980177889901984,"Jacksonville","Stetson",4,4,0,0,7.4,400918799,2017-01-25
117,1,"5:12",1512,1512,"Tanner Rubio made Layup.",47,26,21,0.98846044633629,"Jacksonville","Stetson",4,4,0,0,7.4,400918799,2017-01-25
118,1,"5:12",1512,1512,"Foul on Derick Newton.",47,26,21,0.98846044633629,"Jacksonville","Stetson",4,4,0,0,7.4,400918799,2017-01-25
119,1,"5:12",1512,1512,"Tanner Rubio made Free Throw.",48,26,22,0.990076098459607,"Jacksonville","Stetson",4,4,0,0,7.4,400918799,2017-01-25
120,1,"5:04",1504,1504,"Divine Myles missed Jumper.",48,26,22,0.987146859524366,"Jacksonville","Stetson",4,4,0,0,7.4,400918799,2017-01-25
121,1,"5:04",1504,1504,"Demontrez Austin Defensive Rebound.",48,26,22,0.987146859524366,"Jacksonville","Stetson",4,4,0,0,7.4,400918799,2017-01-25
122,1,"4:56",1496,1496,"Darien Fernandez made Three Point Jumper. Assisted by Tanner Rubio.",51,26,25,0.991458831213294,"Jacksonville","Stetson",4,4,0,0,7.4,400918799,2017-01-25
123,1,"4:34",1474,1474,"B.J. Glasford made Three Point Jumper.",51,29,22,0.990548017755935,"Jacksonville","Stetson",4,4,0,0,7.4,400918799,2017-01-25
124,1,"4:17",1457,1457,"Tanner Rubio made Three Point Jumper.",54,29,25,0.992229446477985,"Jacksonville","Stetson",4,4,0,0,7.4,400918799,2017-01-25
125,1,"4:00",1440,1440,"Luke Doyle made Layup.",54,31,23,0.991589619924713,"Jacksonville","Stetson",4,4,0,0,7.4,400918799,2017-01-25
126,1,"3:50",1430,1430,"Tanner Rubio made Three Point Jumper. Assisted by Cody Helgeland.",57,31,26,0.993647782360875,"Jacksonville","Stetson",4,4,0,0,7.4,400918799,2017-01-25
127,1,"3:40",1420,1420,"Divine Myles Turnover.",57,31,26,0.992408230740374,"Jacksonville","Stetson",4,4,0,1,7.4,400918799,2017-01-25
128,1,"3:40",1420,1420,"Foul on Divine Myles.",57,31,26,0.992408230740374,"Jacksonville","Stetson",4,4,0,1,7.4,400918799,2017-01-25
129,1,"3:40",1420,1420,"Jacksonville  Timeout",57,31,26,0.992408230740374,"Jacksonville","Stetson",4,3,0,1,7.4,400918799,2017-01-25
130,1,"3:22",1402,1402,"Tanner Rubio missed Three Point Jumper.",57,31,26,0.994946085174528,"Jacksonville","Stetson",4,3,0,1,7.4,400918799,2017-01-25
131,1,"3:22",1402,1402,"B.J. Glasford Defensive Rebound.",57,31,26,0.994946085174528,"Jacksonville","Stetson",4,3,0,1,7.4,400918799,2017-01-25
132,1,"3:00",1380,1380,"Leo Goodman missed Three Point Jumper.",57,31,26,0.993937344609483,"Jacksonville","Stetson",4,3,0,1,7.4,400918799,2017-01-25
133,1,"3:00",1380,1380,"Derick Newton Offensive Rebound.",57,31,26,0.993937344609483,"Jacksonville","Stetson",4,3,0,1,7.4,400918799,2017-01-25
134,1,"3:00",1380,1380,"Foul on Demontrez Austin.",57,31,26,0.993937344609483,"Jacksonville","Stetson",4,3,0,1,7.4,400918799,2017-01-25
135,1,"3:00",1380,1380,"Derick Newton made Free Throw.",57,32,25,0.992966958214617,"Jacksonville","Stetson",4,3,0,1,7.4,400918799,2017-01-25
136,1,"3:00",1380,1380,"Derick Newton made Free Throw.",57,33,24,0.991842526874366,"Jacksonville","Stetson",4,3,0,1,7.4,400918799,2017-01-25
137,1,"2:38",1358,1358,"Darien Fernandez missed Layup.",57,33,24,0.992728176517102,"Jacksonville","Stetson",4,3,0,0,7.4,400918799,2017-01-25
138,1,"2:38",1358,1358,"Derick Newton Defensive Rebound.",57,33,24,0.992728176517102,"Jacksonville","Stetson",4,3,0,0,7.4,400918799,2017-01-25
139,1,"2:35",1355,1355,"Foul on Darien Fernandez.",57,33,24,0.992728176517102,"Jacksonville","Stetson",4,3,0,0,7.4,400918799,2017-01-25
140,1,"2:29",1349,1349,"Derick Newton made Free Throw.",57,34,23,0.991154629732236,"Jacksonville","Stetson",4,3,0,0,7.4,400918799,2017-01-25
141,1,"2:29",1349,1349,"Derick Newton made Free Throw.",57,35,22,0.989656907420286,"Jacksonville","Stetson",4,3,0,0,7.4,400918799,2017-01-25
142,1,"2:10",1330,1330,"J.R. Holder Turnover.",57,35,22,0.989046425223704,"Jacksonville","Stetson",4,3,0,0,7.4,400918799,2017-01-25
143,1,"1:59",1319,1319,"Divine Myles made Jumper.",57,37,20,0.987145291312408,"Jacksonville","Stetson",4,3,0,0,7.4,400918799,2017-01-25
144,1,"1:29",1289,1289,"J.R. Holder missed Layup.",57,37,20,0.984876333431501,"Jacksonville","Stetson",4,3,0,0,7.4,400918799,2017-01-25
145,1,"1:29",1289,1289,"Derick Newton Defensive Rebound.",57,37,20,0.984876333431501,"Jacksonville","Stetson",4,3,0,0,7.4,400918799,2017-01-25
146,1,"1:17",1277,1277,"B.J. Glasford made Three Point Jumper.",57,40,17,0.974125421573079,"Jacksonville","Stetson",4,3,0,0,7.4,400918799,2017-01-25
147,1,"0:50",1250,1250,"Cody Helgeland missed Three Point Jumper.",57,40,17,0.97436230482104,"Jacksonville","Stetson",4,3,0,0,7.4,400918799,2017-01-25
148,1,"0:50",1250,1250,"Divine Myles Defensive Rebound.",57,40,17,0.97436230482104,"Jacksonville","Stetson",4,3,0,0,7.4,400918799,2017-01-25
149,1,"0:41",1241,1241,"Divine Myles made Layup.",57,42,15,0.969808727762255,"Jacksonville","Stetson",4,3,0,0,7.4,400918799,2017-01-25
150,1,"0:33",1233,1233,"Jacksonville  Timeout",57,42,15,0.969943912387731,"Jacksonville","Stetson",4,2,0,1,7.4,400918799,2017-01-25
151,1,"0:19",1219,1219,"J.R. Holder missed Layup.",57,42,15,0.971711447982212,"Jacksonville","Stetson",4,2,0,1,7.4,400918799,2017-01-25
152,1,"0:19",1219,1219,"J.R. Holder Offensive Rebound.",57,42,15,0.971711447982212,"Jacksonville","Stetson",4,2,0,1,7.4,400918799,2017-01-25
153,1,"0:14",1214,1214,"Andris Misters missed Three Point Jumper.",57,42,15,0.971711447982212,"Jacksonville","Stetson",4,2,0,1,7.4,400918799,2017-01-25
154,1,"0:14",1214,1214,"J.R. Holder Offensive Rebound.",57,42,15,0.971711447982212,"Jacksonville","Stetson",4,2,0,1,7.4,400918799,2017-01-25
155,1,"0:01",1201,1201,"J.R. Holder made Layup.",59,42,17,0.978546877654685,"Jacksonville","Stetson",4,2,0,1,7.4,400918799,2017-01-25
156,1,"0:00",1200,1200,"End of 1st half",59,42,17,0.978546877654685,"Jacksonville","Stetson",4,2,0,1,7.4,400918799,2017-01-25
157,2,"20:00",1200,1200,"PLAY",59,42,17,0.978546877654685,"Jacksonville","Stetson",4,2,0,0,7.4,400918799,2017-01-25
158,2,"19:47",1187,1187,"Derick Newton missed Jumper.",59,42,17,0.980763855651178,"Jacksonville","Stetson",4,2,0,0,7.4,400918799,2017-01-25
159,2,"19:47",1187,1187,"J.R. Holder Defensive Rebound.",59,42,17,0.980763855651178,"Jacksonville","Stetson",4,2,0,0,7.4,400918799,2017-01-25
160,2,"19:30",1170,1170,"Darien Fernandez missed Three Point Jumper.",59,42,17,0.979285271995036,"Jacksonville","Stetson",4,2,0,0,7.4,400918799,2017-01-25
161,2,"19:30",1170,1170,"Angel Rivera Defensive Rebound.",59,42,17,0.979285271995036,"Jacksonville","Stetson",4,2,0,0,7.4,400918799,2017-01-25
162,2,"19:20",1160,1160,"Divine Myles missed Three Point Jumper.",59,42,17,0.979656317462848,"Jacksonville","Stetson",4,2,0,0,7.4,400918799,2017-01-25
163,2,"19:20",1160,1160,"Stetson Offensive Rebound.",59,42,17,0.979656317462848,"Jacksonville","Stetson",4,2,0,0,7.4,400918799,2017-01-25
164,2,"19:11",1151,1151,"Derick Newton missed Layup.",59,42,17,0.978505426990594,"Jacksonville","Stetson",4,2,0,0,7.4,400918799,2017-01-25
165,2,"19:11",1151,1151,"Divine Myles Offensive Rebound.",59,42,17,0.978505426990594,"Jacksonville","Stetson",4,2,0,0,7.4,400918799,2017-01-25
166,2,"19:03",1143,1143,"B.J. Glasford missed Layup.",59,42,17,0.981327199168554,"Jacksonville","Stetson",4,2,0,0,7.4,400918799,2017-01-25
167,2,"19:03",1143,1143,"Cody Helgeland Defensive Rebound.",59,42,17,0.981327199168554,"Jacksonville","Stetson",4,2,0,0,7.4,400918799,2017-01-25
168,2,"18:52",1132,1132,"J.R. Holder made Layup.",61,42,19,0.985608146642879,"Jacksonville","Stetson",4,2,0,0,7.4,400918799,2017-01-25
169,2,"18:40",1120,1120,"Derick Newton Turnover.",61,42,19,0.990081738200453,"Jacksonville","Stetson",4,2,0,0,7.4,400918799,2017-01-25
170,2,"18:40",1120,1120,"Foul on Derick Newton.",61,42,19,0.990081738200453,"Jacksonville","Stetson",4,2,0,0,7.4,400918799,2017-01-25
171,2,"18:27",1107,1107,"Foul on Angel Rivera.",61,42,19,0.985546588168741,"Jacksonville","Stetson",4,2,0,0,7.4,400918799,2017-01-25
172,2,"18:23",1103,1103,"J.R. Holder made Layup.",63,42,21,0.989541239686533,"Jacksonville","Stetson",4,2,0,0,7.4,400918799,2017-01-25
173,2,"18:10",1090,1090,"Angel Rivera Turnover.",63,42,21,0.991240016788864,"Jacksonville","Stetson",4,2,0,0,7.4,400918799,2017-01-25
174,2,"18:08",1088,1088,"Antwon Clayton Steal.",63,42,21,0.992058649251378,"Jacksonville","Stetson",4,2,0,0,7.4,400918799,2017-01-25
175,2,"18:06",1086,1086,"Tanner Rubio Turnover.",63,42,21,0.992058649251378,"Jacksonville","Stetson",4,2,0,0,7.4,400918799,2017-01-25
176,2,"18:04",1084,1084,"Luke Doyle Steal.",63,42,21,0.992058649251378,"Jacksonville","Stetson",4,2,0,0,7.4,400918799,2017-01-25
177,2,"18:03",1083,1083,"Luke Doyle missed Three Point Jumper.",63,42,21,0.992058649251378,"Jacksonville","Stetson",4,2,0,0,7.4,400918799,2017-01-25
178,2,"18:03",1083,1083,"Antwon Clayton Defensive Rebound.",63,42,21,0.992058649251378,"Jacksonville","Stetson",4,2,0,0,7.4,400918799,2017-01-25
179,2,"17:54",1074,1074,"J.R. Holder missed Dunk.",63,42,21,0.98999145251579,"Jacksonville","Stetson",4,2,0,0,7.4,400918799,2017-01-25
180,2,"17:54",1074,1074,"Luke Doyle Defensive Rebound.",63,42,21,0.98999145251579,"Jacksonville","Stetson",4,2,0,0,7.4,400918799,2017-01-25
181,2,"17:44",1064,1064,"B.J. Glasford Turnover.",63,42,21,0.990895481647261,"Jacksonville","Stetson",4,2,0,0,7.4,400918799,2017-01-25
