"play_id","half","time_remaining_half","secs_remaining","secs_remaining_absolute","description","home_score","away_score","score_diff","win_prob","home","away","home_time_out_remaining","away_time_out_remaining","home_timeout_ind","away_timeout_ind","home_favored_by","game_id","date"
1,1,"20:00",2400,2400,"PLAY",0,0,0,0.812374559801713,"Louisiana Tech","Southern Miss",4,4,0,0,7,400992631,2018-01-27
2,1,"19:51",2391,2391,"Anthony Duruji missed Three Point Jumper.",0,0,0,0.812374559801713,"Louisiana Tech","Southern Miss",4,4,0,0,7,400992631,2018-01-27
3,1,"19:51",2391,2391,"Dominic Magee Defensive Rebound.",0,0,0,0.812374559801713,"Louisiana Tech","Southern Miss",4,4,0,0,7,400992631,2018-01-27
4,1,"19:28",2368,2368,"Eddie Davis III Turnover.",0,0,0,0.79329869872945,"Louisiana Tech","Southern Miss",4,4,0,0,7,400992631,2018-01-27
5,1,"19:18",2358,2358,"Derric Jean made Three Point Jumper. Assisted by Anthony Duruji.",3,0,3,0.848782066711313,"Louisiana Tech","Southern Miss",4,4,0,0,7,400992631,2018-01-27
6,1,"18:56",2336,2336,"Dominic Magee made Three Point Jumper. Assisted by Tyree Griffin.",3,3,0,0.801696002615684,"Louisiana Tech","Southern Miss",4,4,0,0,7,400992631,2018-01-27
7,1,"18:38",2318,2318,"Derric Jean missed Three Point Jumper.",3,3,0,0.787071641358534,"Louisiana Tech","Southern Miss",4,4,0,0,7,400992631,2018-01-27
8,1,"18:38",2318,2318,"Dominic Magee Defensive Rebound.",3,3,0,0.787071641358534,"Louisiana Tech","Southern Miss",4,4,0,0,7,400992631,2018-01-27
9,1,"18:34",2314,2314,"Dominic Magee Turnover.",3,3,0,0.787071641358534,"Louisiana Tech","Southern Miss",4,4,0,0,7,400992631,2018-01-27
10,1,"18:33",2313,2313,"Oliver Powell Steal.",3,3,0,0.787071641358534,"Louisiana Tech","Southern Miss",4,4,0,0,7,400992631,2018-01-27
11,1,"18:29",2309,2309,"Anthony Duruji made Three Point Jumper. Assisted by Derric Jean.",6,3,3,0.834979236988955,"Louisiana Tech","Southern Miss",4,4,0,0,7,400992631,2018-01-27
12,1,"18:03",2283,2283,"Tyree Griffin missed Three Point Jumper.",6,3,3,0.840819353506805,"Louisiana Tech","Southern Miss",4,4,0,0,7,400992631,2018-01-27
13,1,"18:03",2283,2283,"Anthony Duruji Defensive Rebound.",6,3,3,0.840819353506805,"Louisiana Tech","Southern Miss",4,4,0,0,7,400992631,2018-01-27
14,1,"17:46",2266,2266,"Jacobi Boykins made Three Point Jumper. Assisted by Anthony Duruji.",9,3,6,0.896476662130543,"Louisiana Tech","Southern Miss",4,4,0,0,7,400992631,2018-01-27
15,1,"17:33",2253,2253,"Foul on Anthony Duruji.",9,3,6,0.872498470497089,"Louisiana Tech","Southern Miss",4,4,0,0,7,400992631,2018-01-27
16,1,"17:33",2253,2253,"Dominic Magee missed Free Throw.",9,3,6,0.872498470497089,"Louisiana Tech","Southern Miss",4,4,0,0,7,400992631,2018-01-27
17,1,"17:33",2253,2253,"Southern Miss Deadball Team Rebound.",9,3,6,0.872498470497089,"Louisiana Tech","Southern Miss",4,4,0,0,7,400992631,2018-01-27
18,1,"17:33",2253,2253,"Dominic Magee made Free Throw.",9,4,5,0.861370838151568,"Louisiana Tech","Southern Miss",4,4,0,0,7,400992631,2018-01-27
19,1,"17:23",2243,2243,"Amorie Archibald missed Three Point Jumper.",9,4,5,0.856573696668613,"Louisiana Tech","Southern Miss",4,4,0,0,7,400992631,2018-01-27
20,1,"17:23",2243,2243,"Cortez Edwards Defensive Rebound.",9,4,5,0.856573696668613,"Louisiana Tech","Southern Miss",4,4,0,0,7,400992631,2018-01-27
21,1,"17:03",2223,2223,"Eddie Davis III missed Jumper.",9,4,5,0.868727157247929,"Louisiana Tech","Southern Miss",4,4,0,0,7,400992631,2018-01-27
22,1,"17:03",2223,2223,"Anthony Duruji Defensive Rebound.",9,4,5,0.868727157247929,"Louisiana Tech","Southern Miss",4,4,0,0,7,400992631,2018-01-27
23,1,"16:57",2217,2217,"Foul on Anthony Duruji.",9,4,5,0.881277115918969,"Louisiana Tech","Southern Miss",4,4,0,0,7,400992631,2018-01-27
24,1,"16:57",2217,2217,"Anthony Duruji Turnover.",9,4,5,0.881277115918969,"Louisiana Tech","Southern Miss",4,4,0,0,7,400992631,2018-01-27
25,1,"16:37",2197,2197,"Tyree Griffin made Jumper.",9,6,3,0.853521591268288,"Louisiana Tech","Southern Miss",4,4,0,0,7,400992631,2018-01-27
26,1,"16:18",2178,2178,"Oliver Powell missed Jumper.",9,6,3,0.838520514855787,"Louisiana Tech","Southern Miss",4,4,0,0,7,400992631,2018-01-27
27,1,"16:18",2178,2178,"Cortez Edwards Defensive Rebound.",9,6,3,0.838520514855787,"Louisiana Tech","Southern Miss",4,4,0,0,7,400992631,2018-01-27
28,1,"15:51",2151,2151,"Tyree Griffin missed Three Point Jumper.",9,6,3,0.840939770748689,"Louisiana Tech","Southern Miss",4,4,0,0,7,400992631,2018-01-27
29,1,"15:51",2151,2151,"Jacobi Boykins Defensive Rebound.",9,6,3,0.840939770748689,"Louisiana Tech","Southern Miss",4,4,0,0,7,400992631,2018-01-27
30,1,"15:34",2134,2134,"Jacobi Boykins made Three Point Jumper. Assisted by Amorie Archibald.",12,6,6,0.886938003398399,"Louisiana Tech","Southern Miss",4,4,0,0,7,400992631,2018-01-27
31,1,"15:12",2112,2112,"Dominic Magee made Three Point Jumper.",12,9,3,0.848298380023824,"Louisiana Tech","Southern Miss",4,4,0,0,7,400992631,2018-01-27
32,1,"14:54",2094,2094,"Jacobi Boykins made Three Point Jumper.",15,9,6,0.883034235957793,"Louisiana Tech","Southern Miss",4,4,0,0,7,400992631,2018-01-27
33,1,"14:36",2076,2076,"Eddie Davis III missed Jumper.",15,9,6,0.877403413241835,"Louisiana Tech","Southern Miss",4,4,0,0,7,400992631,2018-01-27
34,1,"14:36",2076,2076,"Jacobi Boykins Defensive Rebound.",15,9,6,0.877403413241835,"Louisiana Tech","Southern Miss",4,4,0,0,7,400992631,2018-01-27
35,1,"14:30",2070,2070,"Foul on Tyree Griffin.",15,9,6,0.877403413241835,"Louisiana Tech","Southern Miss",4,4,0,0,7,400992631,2018-01-27
36,1,"14:30",2070,2070,"Official TV Timeout",15,9,6,0.877403413241835,"Louisiana Tech","Southern Miss",4,4,0,0,7,400992631,2018-01-27
37,1,"14:13",2053,2053,"Jy'lan Washington missed Three Point Jumper.",15,9,6,0.886090833609446,"Louisiana Tech","Southern Miss",4,4,0,0,7,400992631,2018-01-27
38,1,"14:13",2053,2053,"Cortez Edwards Defensive Rebound.",15,9,6,0.886090833609446,"Louisiana Tech","Southern Miss",4,4,0,0,7,400992631,2018-01-27
39,1,"14:06",2046,2046,"Cortez Edwards missed Layup.",15,9,6,0.870828632143754,"Louisiana Tech","Southern Miss",4,4,0,0,7,400992631,2018-01-27
40,1,"14:06",2046,2046,"Jy'lan Washington Block.",15,9,6,0.870828632143754,"Louisiana Tech","Southern Miss",4,4,0,0,7,400992631,2018-01-27
41,1,"14:04",2044,2044,"Oliver Powell Defensive Rebound.",15,9,6,0.870828632143754,"Louisiana Tech","Southern Miss",4,4,0,0,7,400992631,2018-01-27
42,1,"14:00",2040,2040,"Jy'lan Washington made Layup. Assisted by Amorie Archibald.",17,9,8,0.893660137525305,"Louisiana Tech","Southern Miss",4,4,0,0,7,400992631,2018-01-27
43,1,"13:30",2010,2010,"Tim Rowe missed Three Point Jumper.",17,9,8,0.904285930707551,"Louisiana Tech","Southern Miss",4,4,0,0,7,400992631,2018-01-27
44,1,"13:30",2010,2010,"Jy'lan Washington Defensive Rebound.",17,9,8,0.904285930707551,"Louisiana Tech","Southern Miss",4,4,0,0,7,400992631,2018-01-27
45,1,"13:20",2000,2000,"Jy'lan Washington missed Three Point Jumper.",17,9,8,0.896314661482,"Louisiana Tech","Southern Miss",4,4,0,0,7,400992631,2018-01-27
46,1,"13:20",2000,2000,"Cortez Edwards Defensive Rebound.",17,9,8,0.896314661482,"Louisiana Tech","Southern Miss",4,4,0,0,7,400992631,2018-01-27
47,1,"12:57",1977,1977,"Foul on Oliver Powell.",17,9,8,0.913515044972268,"Louisiana Tech","Southern Miss",4,4,0,0,7,400992631,2018-01-27
48,1,"12:57",1977,1977,"Tim Rowe missed Free Throw.",17,9,8,0.913515044972268,"Louisiana Tech","Southern Miss",4,4,0,0,7,400992631,2018-01-27
49,1,"12:57",1977,1977,"Southern Miss Deadball Team Rebound.",17,9,8,0.913515044972268,"Louisiana Tech","Southern Miss",4,4,0,0,7,400992631,2018-01-27
50,1,"12:57",1977,1977,"Tim Rowe made Free Throw.",17,10,7,0.902919745721381,"Louisiana Tech","Southern Miss",4,4,0,0,7,400992631,2018-01-27
51,1,"12:42",1962,1962,"Jacobi Boykins made Three Point Jumper.",20,10,10,0.913344988583149,"Louisiana Tech","Southern Miss",4,4,0,0,7,400992631,2018-01-27
52,1,"12:12",1932,1932,"LaDavius Draine missed Three Point Jumper.",20,10,10,0.925239594030509,"Louisiana Tech","Southern Miss",4,4,0,0,7,400992631,2018-01-27
53,1,"12:12",1932,1932,"Jacobi Boykins Defensive Rebound.",20,10,10,0.925239594030509,"Louisiana Tech","Southern Miss",4,4,0,0,7,400992631,2018-01-27
54,1,"11:58",1918,1918,"Derric Jean missed Layup.",20,10,10,0.932772113696142,"Louisiana Tech","Southern Miss",4,4,0,0,7,400992631,2018-01-27
55,1,"11:58",1918,1918,"Jy'lan Washington Offensive Rebound.",20,10,10,0.932772113696142,"Louisiana Tech","Southern Miss",4,4,0,0,7,400992631,2018-01-27
56,1,"11:55",1915,1915,"Jy'lan Washington made Jumper.",22,10,12,0.947247898722142,"Louisiana Tech","Southern Miss",4,4,0,0,7,400992631,2018-01-27
57,1,"11:46",1906,1906,"Foul on JaColby Pemberton.",22,10,12,0.936363538509652,"Louisiana Tech","Southern Miss",4,4,0,0,7,400992631,2018-01-27
58,1,"11:46",1906,1906,"Official TV Timeout",22,10,12,0.936363538509652,"Louisiana Tech","Southern Miss",4,4,0,0,7,400992631,2018-01-27
59,1,"11:25",1885,1885,"Anfernee Hampton made Three Point Jumper. Assisted by Cortez Edwards.",22,13,9,0.915434097102525,"Louisiana Tech","Southern Miss",4,4,0,0,7,400992631,2018-01-27
60,1,"11:06",1866,1866,"Foul on D'Angelo Richardson.",22,13,9,0.922532451995556,"Louisiana Tech","Southern Miss",4,4,0,0,7,400992631,2018-01-27
61,1,"11:06",1866,1866,"JaColby Pemberton made Free Throw.",23,13,10,0.931613979142312,"Louisiana Tech","Southern Miss",4,4,0,0,7,400992631,2018-01-27
62,1,"11:06",1866,1866,"JaColby Pemberton missed Free Throw.",23,13,10,0.931613979142312,"Louisiana Tech","Southern Miss",4,4,0,0,7,400992631,2018-01-27
63,1,"11:06",1866,1866,"Dominic Magee Defensive Rebound.",23,13,10,0.931613979142312,"Louisiana Tech","Southern Miss",4,4,0,0,7,400992631,2018-01-27
64,1,"10:50",1850,1850,"Dominic Magee missed Three Point Jumper.",23,13,10,0.927205553714026,"Louisiana Tech","Southern Miss",4,4,0,0,7,400992631,2018-01-27
65,1,"10:50",1850,1850,"JaColby Pemberton Defensive Rebound.",23,13,10,0.927205553714026,"Louisiana Tech","Southern Miss",4,4,0,0,7,400992631,2018-01-27
66,1,"10:24",1824,1824,"JaColby Pemberton Turnover.",23,13,10,0.928037639018998,"Louisiana Tech","Southern Miss",4,4,0,0,7,400992631,2018-01-27
67,1,"10:21",1821,1821,"Tyree Griffin Steal.",23,13,10,0.928037639018998,"Louisiana Tech","Southern Miss",4,4,0,0,7,400992631,2018-01-27
68,1,"10:20",1820,1820,"Foul on Jacobi Boykins.",23,13,10,0.928037639018998,"Louisiana Tech","Southern Miss",4,4,0,0,7,400992631,2018-01-27
69,1,"10:20",1820,1820,"Tyree Griffin made Free Throw.",23,14,9,0.919574192778536,"Louisiana Tech","Southern Miss",4,4,0,0,7,400992631,2018-01-27
70,1,"10:20",1820,1820,"Tyree Griffin missed Free Throw.",23,14,9,0.919574192778536,"Louisiana Tech","Southern Miss",4,4,0,0,7,400992631,2018-01-27
71,1,"10:20",1820,1820,"JaColby Pemberton Defensive Rebound.",23,14,9,0.919574192778536,"Louisiana Tech","Southern Miss",4,4,0,0,7,400992631,2018-01-27
72,1,"10:07",1807,1807,"JaColby Pemberton made Layup.",25,14,11,0.934217946182644,"Louisiana Tech","Southern Miss",4,4,0,0,7,400992631,2018-01-27
73,1,"10:07",1807,1807,"Foul on Dominic Magee.",25,14,11,0.934217946182644,"Louisiana Tech","Southern Miss",4,4,0,0,7,400992631,2018-01-27
74,1,"10:07",1807,1807,"JaColby Pemberton made Free Throw.",26,14,12,0.941691910902844,"Louisiana Tech","Southern Miss",4,4,0,0,7,400992631,2018-01-27
75,1,"9:56",1796,1796,"Kevin Holland Turnover.",26,14,12,0.93968179198799,"Louisiana Tech","Southern Miss",4,4,0,0,7,400992631,2018-01-27
76,1,"9:38",1778,1778,"Derric Jean missed Three Point Jumper.",26,14,12,0.933873948124877,"Louisiana Tech","Southern Miss",4,4,0,0,7,400992631,2018-01-27
77,1,"9:38",1778,1778,"D'Angelo Richardson Defensive Rebound.",26,14,12,0.933873948124877,"Louisiana Tech","Southern Miss",4,4,0,0,7,400992631,2018-01-27
78,1,"9:23",1763,1763,"Foul on D'Angelo Richardson.",26,14,12,0.945431763965352,"Louisiana Tech","Southern Miss",4,4,0,0,7,400992631,2018-01-27
79,1,"9:23",1763,1763,"D'Angelo Richardson Turnover.",26,14,12,0.945431763965352,"Louisiana Tech","Southern Miss",4,4,0,0,7,400992631,2018-01-27
80,1,"9:12",1752,1752,"Jy'lan Washington made Dunk. Assisted by JaColby Pemberton.",28,14,14,0.95895447135692,"Louisiana Tech","Southern Miss",4,4,0,0,7,400992631,2018-01-27
81,1,"8:39",1719,1719,"Anfernee Hampton missed Three Point Jumper.",28,14,14,0.95867486445784,"Louisiana Tech","Southern Miss",4,4,0,0,7,400992631,2018-01-27
82,1,"8:39",1719,1719,"Exavian Christon Defensive Rebound.",28,14,14,0.95867486445784,"Louisiana Tech","Southern Miss",4,4,0,0,7,400992631,2018-01-27
83,1,"8:33",1713,1713,"Foul on Kevin Holland.",28,14,14,0.95867486445784,"Louisiana Tech","Southern Miss",4,4,0,0,7,400992631,2018-01-27
84,1,"8:33",1713,1713,"Derric Jean made Free Throw.",29,14,15,0.963650940699967,"Louisiana Tech","Southern Miss",4,4,0,0,7,400992631,2018-01-27
85,1,"8:33",1713,1713,"Derric Jean missed Free Throw.",29,14,15,0.963650940699967,"Louisiana Tech","Southern Miss",4,4,0,0,7,400992631,2018-01-27
86,1,"8:33",1713,1713,"Cortez Edwards Defensive Rebound.",29,14,15,0.963650940699967,"Louisiana Tech","Southern Miss",4,4,0,0,7,400992631,2018-01-27
87,1,"8:14",1694,1694,"Cortez Edwards missed Jumper.",29,14,15,0.966156902075341,"Louisiana Tech","Southern Miss",4,4,0,0,7,400992631,2018-01-27
88,1,"8:14",1694,1694,"Kevin Holland Offensive Rebound.",29,14,15,0.966156902075341,"Louisiana Tech","Southern Miss",4,4,0,0,7,400992631,2018-01-27
89,1,"8:09",1689,1689,"D'Angelo Richardson missed Three Point Jumper.",29,14,15,0.96900741780287,"Louisiana Tech","Southern Miss",4,4,0,0,7,400992631,2018-01-27
90,1,"8:09",1689,1689,"Amorie Archibald Defensive Rebound.",29,14,15,0.96900741780287,"Louisiana Tech","Southern Miss",4,4,0,0,7,400992631,2018-01-27
91,1,"7:57",1677,1677,"JaColby Pemberton made Layup. Assisted by Amorie Archibald.",31,14,17,0.97299474228612,"Louisiana Tech","Southern Miss",4,4,1,0,7,400992631,2018-01-27
92,1,"7:57",1677,1677,"Southern Miss  Timeout",31,14,17,0.97299474228612,"Louisiana Tech","Southern Miss",3,4,1,0,7,400992631,2018-01-27
93,1,"7:57",1677,1677,"Official TV Timeout",31,14,17,0.97299474228612,"Louisiana Tech","Southern Miss",3,4,1,0,7,400992631,2018-01-27
94,1,"7:37",1657,1657,"Cortez Edwards missed Three Point Jumper.",31,14,17,0.969157068988482,"Louisiana Tech","Southern Miss",3,4,1,0,7,400992631,2018-01-27
95,1,"7:37",1657,1657,"Oliver Powell Defensive Rebound.",31,14,17,0.969157068988482,"Louisiana Tech","Southern Miss",3,4,1,0,7,400992631,2018-01-27
96,1,"7:14",1634,1634,"Oliver Powell made Jumper. Assisted by Amorie Archibald.",33,14,19,0.976354168922235,"Louisiana Tech","Southern Miss",3,4,1,0,7,400992631,2018-01-27
97,1,"6:54",1614,1614,"Tyree Griffin missed Three Point Jumper.",33,14,19,0.977529239511133,"Louisiana Tech","Southern Miss",3,4,0,0,7,400992631,2018-01-27
98,1,"6:54",1614,1614,"Oliver Powell Defensive Rebound.",33,14,19,0.977529239511133,"Louisiana Tech","Southern Miss",3,4,0,0,7,400992631,2018-01-27
99,1,"6:45",1605,1605,"Foul on D'Angelo Richardson.",33,14,19,0.975740289232955,"Louisiana Tech","Southern Miss",3,4,0,0,7,400992631,2018-01-27
100,1,"6:32",1592,1592,"Foul on Eddie Davis III.",33,14,19,0.977236804189129,"Louisiana Tech","Southern Miss",3,4,0,0,7,400992631,2018-01-27
101,1,"6:32",1592,1592,"Oliver Powell missed Free Throw.",33,14,19,0.977236804189129,"Louisiana Tech","Southern Miss",3,4,0,0,7,400992631,2018-01-27
102,1,"6:32",1592,1592,"Dominic Magee Defensive Rebound.",33,14,19,0.977236804189129,"Louisiana Tech","Southern Miss",3,4,0,0,7,400992631,2018-01-27
103,1,"6:15",1575,1575,"Cortez Edwards missed Layup.",33,14,19,0.984469649056221,"Louisiana Tech","Southern Miss",3,4,0,0,7,400992631,2018-01-27
104,1,"6:15",1575,1575,"Louisiana Tech Defensive Rebound.",33,14,19,0.984469649056221,"Louisiana Tech","Southern Miss",3,4,0,0,7,400992631,2018-01-27
105,1,"6:07",1567,1567,"Derric Jean made Three Point Jumper. Assisted by JaColby Pemberton.",36,14,22,0.986039249543194,"Louisiana Tech","Southern Miss",3,4,0,0,7,400992631,2018-01-27
106,1,"5:35",1535,1535,"Kevin Holland made Jumper.",36,16,20,0.981848801407462,"Louisiana Tech","Southern Miss",3,4,0,0,7,400992631,2018-01-27
107,1,"5:22",1522,1522,"Jacobi Boykins made Three Point Jumper. Assisted by Amorie Archibald.",39,16,23,0.988130375808989,"Louisiana Tech","Southern Miss",3,4,0,0,7,400992631,2018-01-27
108,1,"5:09",1509,1509,"Cortez Edwards missed Layup.",39,16,23,0.98828489563887,"Louisiana Tech","Southern Miss",3,4,0,0,7,400992631,2018-01-27
109,1,"5:09",1509,1509,"JaColby Pemberton Block.",39,16,23,0.98828489563887,"Louisiana Tech","Southern Miss",3,4,0,0,7,400992631,2018-01-27
110,1,"5:05",1505,1505,"Jacobi Boykins Defensive Rebound.",39,16,23,0.98828489563887,"Louisiana Tech","Southern Miss",3,4,0,0,7,400992631,2018-01-27
111,1,"5:00",1500,1500,"Derric Jean Turnover.",39,16,23,0.98828489563887,"Louisiana Tech","Southern Miss",3,4,0,0,7,400992631,2018-01-27
112,1,"4:59",1499,1499,"Kevin Holland Steal.",39,16,23,0.988201663259802,"Louisiana Tech","Southern Miss",3,4,0,0,7,400992631,2018-01-27
113,1,"4:58",1498,1498,"Kevin Holland Turnover.",39,16,23,0.988201663259802,"Louisiana Tech","Southern Miss",3,4,0,0,7,400992631,2018-01-27
114,1,"4:53",1493,1493,"Amorie Archibald Steal.",39,16,23,0.988201663259802,"Louisiana Tech","Southern Miss",3,4,0,0,7,400992631,2018-01-27
115,1,"4:45",1485,1485,"JaColby Pemberton made Layup. Assisted by Amorie Archibald.",41,16,25,0.992443567721728,"Louisiana Tech","Southern Miss",3,4,0,0,7,400992631,2018-01-27
116,1,"4:19",1459,1459,"Tyree Griffin missed Three Point Jumper.",41,16,25,0.991844066354904,"Louisiana Tech","Southern Miss",3,4,0,0,7,400992631,2018-01-27
117,1,"4:19",1459,1459,"Cortez Edwards Offensive Rebound.",41,16,25,0.991844066354904,"Louisiana Tech","Southern Miss",3,4,0,0,7,400992631,2018-01-27
118,1,"4:16",1456,1456,"Cortez Edwards made Jumper.",41,18,23,0.989077519007546,"Louisiana Tech","Southern Miss",3,4,0,0,7,400992631,2018-01-27
119,1,"3:55",1435,1435,"Jacobi Boykins made Three Point Jumper. Assisted by JaColby Pemberton.",44,18,26,0.993359069015066,"Louisiana Tech","Southern Miss",3,4,0,0,7,400992631,2018-01-27
120,1,"3:36",1416,1416,"Cortez Edwards missed Jumper.",44,18,26,0.993909685243875,"Louisiana Tech","Southern Miss",3,4,0,0,7,400992631,2018-01-27
121,1,"3:36",1416,1416,"Southern Miss Offensive Rebound.",44,18,26,0.993909685243875,"Louisiana Tech","Southern Miss",3,4,0,0,7,400992631,2018-01-27
122,1,"3:32",1412,1412,"Official TV Timeout",44,18,26,0.993909685243875,"Louisiana Tech","Southern Miss",3,4,0,0,7,400992631,2018-01-27
123,1,"3:16",1396,1396,"Jacobi Boykins made Layup.",46,18,28,0.9958803564219,"Louisiana Tech","Southern Miss",3,4,0,0,7,400992631,2018-01-27
124,1,"2:56",1376,1376,"Tim Rowe missed Jumper.",46,18,28,0.994086440089676,"Louisiana Tech","Southern Miss",3,4,0,0,7,400992631,2018-01-27
125,1,"2:56",1376,1376,"Oliver Powell Defensive Rebound.",46,18,28,0.994086440089676,"Louisiana Tech","Southern Miss",3,4,0,0,7,400992631,2018-01-27
126,1,"2:42",1362,1362,"Jy'lan Washington made Layup. Assisted by Amorie Archibald.",48,18,30,0.996734389209064,"Louisiana Tech","Southern Miss",3,4,0,0,7,400992631,2018-01-27
127,1,"2:42",1362,1362,"Foul on Anfernee Hampton.",48,18,30,0.996734389209064,"Louisiana Tech","Southern Miss",3,4,0,0,7,400992631,2018-01-27
128,1,"2:42",1362,1362,"Jy'lan Washington made Free Throw.",49,18,31,0.997197976254839,"Louisiana Tech","Southern Miss",3,4,0,0,7,400992631,2018-01-27
129,1,"2:26",1346,1346,"Anfernee Hampton made Three Point Jumper. Assisted by Cortez Edwards.",49,21,28,0.995784103372275,"Louisiana Tech","Southern Miss",3,4,0,0,7,400992631,2018-01-27
130,1,"2:06",1326,1326,"Amorie Archibald Turnover.",49,21,28,0.995983810428509,"Louisiana Tech","Southern Miss",3,4,0,0,7,400992631,2018-01-27
131,1,"1:51",1311,1311,"Foul on Derric Jean.",49,21,28,0.996158522904163,"Louisiana Tech","Southern Miss",3,4,0,0,7,400992631,2018-01-27
132,1,"1:51",1311,1311,"Tyree Griffin made Free Throw.",49,22,27,0.995505495262364,"Louisiana Tech","Southern Miss",3,4,0,0,7,400992631,2018-01-27
133,1,"1:51",1311,1311,"Tyree Griffin made Free Throw.",49,23,26,0.994742042850714,"Louisiana Tech","Southern Miss",3,4,0,0,7,400992631,2018-01-27
134,1,"1:30",1290,1290,"Jy'lan Washington made Three Point Jumper. Assisted by Amorie Archibald.",52,23,29,0.997425866523485,"Louisiana Tech","Southern Miss",3,4,0,0,7,400992631,2018-01-27
135,1,"1:07",1267,1267,"Tim Rowe made Layup. Assisted by Kevin Holland.",52,25,27,0.995702198696155,"Louisiana Tech","Southern Miss",3,4,0,0,7,400992631,2018-01-27
136,1,"1:02",1262,1262,"Louisiana Tech  Timeout",52,25,27,0.995702198696155,"Louisiana Tech","Southern Miss",3,3,0,1,7,400992631,2018-01-27
137,1,"0:40",1240,1240,"Amorie Archibald made Three Point Jumper. Assisted by Oliver Powell.",55,25,30,0.996815114796494,"Louisiana Tech","Southern Miss",3,3,0,1,7,400992631,2018-01-27
138,1,"0:13",1213,1213,"Tyree Griffin made Layup.",55,27,28,0.996449720361623,"Louisiana Tech","Southern Miss",3,3,0,1,7,400992631,2018-01-27
139,1,"0:03",1203,1203,"Derric Jean missed Three Point Jumper.",55,27,28,0.996039350792695,"Louisiana Tech","Southern Miss",3,3,0,1,7,400992631,2018-01-27
140,1,"0:03",1203,1203,"Oliver Powell Offensive Rebound.",55,27,28,0.996039350792695,"Louisiana Tech","Southern Miss",3,3,0,1,7,400992631,2018-01-27
141,1,"0:02",1202,1202,"Oliver Powell made Two Point Tip Shot.",57,27,30,0.997116549371273,"Louisiana Tech","Southern Miss",3,3,0,1,7,400992631,2018-01-27
142,1,"0:00",1200,1200,"End of 1st half",57,27,30,0.997116549371273,"Louisiana Tech","Southern Miss",3,3,0,0,7,400992631,2018-01-27
143,2,"20:00",1200,1200,"PLAY",57,27,30,0.997116549371273,"Louisiana Tech","Southern Miss",4,4,0,0,7,400992631,2018-01-27
144,2,"19:34",1174,1174,"Eddie Davis III made Jumper. Assisted by Tyree Griffin.",57,29,28,0.996404315418819,"Louisiana Tech","Southern Miss",4,4,0,0,7,400992631,2018-01-27
145,2,"19:20",1160,1160,"Anthony Duruji missed Jumper.",57,29,28,0.996465272824875,"Louisiana Tech","Southern Miss",4,4,0,0,7,400992631,2018-01-27
146,2,"19:20",1160,1160,"Tyree Griffin Block.",57,29,28,0.996465272824875,"Louisiana Tech","Southern Miss",4,4,0,0,7,400992631,2018-01-27
147,2,"19:17",1157,1157,"Tyree Griffin Defensive Rebound.",57,29,28,0.996150370020569,"Louisiana Tech","Southern Miss",4,4,0,0,7,400992631,2018-01-27
148,2,"19:15",1155,1155,"Tyree Griffin missed Layup.",57,29,28,0.996150370020569,"Louisiana Tech","Southern Miss",4,4,0,0,7,400992631,2018-01-27
149,2,"19:15",1155,1155,"Kevin Holland Offensive Rebound.",57,29,28,0.996150370020569,"Louisiana Tech","Southern Miss",4,4,0,0,7,400992631,2018-01-27
150,2,"19:00",1140,1140,"Tyree Griffin made Three Point Jumper. Assisted by Kevin Holland.",57,32,25,0.995028851860973,"Louisiana Tech","Southern Miss",4,4,0,0,7,400992631,2018-01-27
151,2,"18:41",1121,1121,"Derric Jean missed Layup.",57,32,25,0.996589963894499,"Louisiana Tech","Southern Miss",4,4,0,0,7,400992631,2018-01-27
152,2,"18:41",1121,1121,"Anthony Duruji Offensive Rebound.",57,32,25,0.996589963894499,"Louisiana Tech","Southern Miss",4,4,0,0,7,400992631,2018-01-27
153,2,"18:27",1107,1107,"Foul on Tyree Griffin.",57,32,25,0.994293009827101,"Louisiana Tech","Southern Miss",4,4,0,0,7,400992631,2018-01-27
154,2,"18:26",1106,1106,"Derric Jean missed Jumper.",57,32,25,0.994293009827101,"Louisiana Tech","Southern Miss",4,4,0,0,7,400992631,2018-01-27
155,2,"18:26",1106,1106,"Eddie Davis III Defensive Rebound.",57,32,25,0.994293009827101,"Louisiana Tech","Southern Miss",4,4,0,0,7,400992631,2018-01-27
156,2,"18:12",1092,1092,"Cortez Edwards made Jumper.",57,34,23,0.993491388355958,"Louisiana Tech","Southern Miss",4,4,0,0,7,400992631,2018-01-27
157,2,"17:52",1072,1072,"Oliver Powell made Dunk. Assisted by Derric Jean.",59,34,25,0.994665829645557,"Louisiana Tech","Southern Miss",4,4,0,0,7,400992631,2018-01-27
158,2,"17:26",1046,1046,"Tyree Griffin Turnover.",59,34,25,0.995778207687603,"Louisiana Tech","Southern Miss",4,4,0,0,7,400992631,2018-01-27
159,2,"17:25",1045,1045,"Amorie Archibald Steal.",59,34,25,0.995778207687603,"Louisiana Tech","Southern Miss",4,4,0,0,7,400992631,2018-01-27
160,2,"17:22",1042,1042,"Amorie Archibald made Dunk.",61,34,27,0.997022364048801,"Louisiana Tech","Southern Miss",4,4,0,0,7,400992631,2018-01-27
161,2,"16:55",1015,1015,"Kevin Holland made Three Point Jumper. Assisted by Dominic Magee.",61,37,24,0.994831701986341,"Louisiana Tech","Southern Miss",4,4,0,0,7,400992631,2018-01-27
162,2,"16:31",991,991,"Oliver Powell made Layup.",63,37,26,0.996248557835785,"Louisiana Tech","Southern Miss",4,4,0,0,7,400992631,2018-01-27
163,2,"16:19",979,979,"Kevin Holland missed Jumper.",63,37,26,0.996704475196931,"Louisiana Tech","Southern Miss",4,4,0,0,7,400992631,2018-01-27
164,2,"16:19",979,979,"Derric Jean Defensive Rebound.",63,37,26,0.996704475196931,"Louisiana Tech","Southern Miss",4,4,0,0,7,400992631,2018-01-27
165,2,"16:13",973,973,"Amorie Archibald missed Three Point Jumper.",63,37,26,0.996704475196931,"Louisiana Tech","Southern Miss",4,4,0,0,7,400992631,2018-01-27
166,2,"16:13",973,973,"Tyree Griffin Defensive Rebound.",63,37,26,0.996704475196931,"Louisiana Tech","Southern Miss",4,4,0,0,7,400992631,2018-01-27
167,2,"15:49",949,949,"Dominic Magee missed Three Point Jumper.",63,37,26,0.997644764448286,"Louisiana Tech","Southern Miss",4,4,0,0,7,400992631,2018-01-27
168,2,"15:49",949,949,"Cortez Edwards Offensive Rebound.",63,37,26,0.997644764448286,"Louisiana Tech","Southern Miss",4,4,0,0,7,400992631,2018-01-27
169,2,"15:45",945,945,"Kevin Holland missed Three Point Jumper.",63,37,26,0.997644764448286,"Louisiana Tech","Southern Miss",4,4,0,0,7,400992631,2018-01-27
170,2,"15:45",945,945,"Southern Miss Offensive Rebound.",63,37,26,0.997644764448286,"Louisiana Tech","Southern Miss",4,4,0,0,7,400992631,2018-01-27
171,2,"15:43",943,943,"Official TV Timeout",63,37,26,0.997644764448286,"Louisiana Tech","Southern Miss",4,4,0,0,7,400992631,2018-01-27
