"play_id","half","time_remaining_half","secs_remaining","secs_remaining_absolute","description","home_score","away_score","score_diff","win_prob","home","away","home_time_out_remaining","away_time_out_remaining","home_timeout_ind","away_timeout_ind","home_favored_by","game_id","date"
1,1,"20:00",2400,2400,"PLAY",0,0,0,0.372091874756716,"Florida","Duke",4,4,0,0,-2.5,401001001,2017-11-26
2,1,"20:00",2400,2400,"Jump Ball won by Duke",0,0,0,0.372091874756716,"Florida","Duke",4,4,0,0,-2.5,401001001,2017-11-26
3,1,"19:46",2386,2386,"Marvin Bagley III missed Jumper.",0,0,0,0.376698414258514,"Florida","Duke",4,4,0,0,-2.5,401001001,2017-11-26
4,1,"19:46",2386,2386,"Egor Koulechov Defensive Rebound.",0,0,0,0.376698414258514,"Florida","Duke",4,4,0,0,-2.5,401001001,2017-11-26
5,1,"19:46",2386,2386,"Jalen Hudson missed Layup.",0,0,0,0.376698414258514,"Florida","Duke",4,4,0,0,-2.5,401001001,2017-11-26
6,1,"19:46",2386,2386,"Gary Trent Jr Block.",0,0,0,0.376698414258514,"Florida","Duke",4,4,0,0,-2.5,401001001,2017-11-26
7,1,"19:46",2386,2386,"Florida Offensive Rebound.",0,0,0,0.376698414258514,"Florida","Duke",4,4,0,0,-2.5,401001001,2017-11-26
8,1,"19:33",2373,2373,"KeVaughn Allen made Three Point Jumper.",3,0,3,0.464061648460092,"Florida","Duke",4,4,0,0,-2.5,401001001,2017-11-26
9,1,"19:33",2373,2373,"Foul on KeVaughn Allen.",3,0,3,0.464061648460092,"Florida","Duke",4,4,0,0,-2.5,401001001,2017-11-26
10,1,"19:08",2348,2348,"Wendell Carter Jr missed Layup.",3,0,3,0.449474299076773,"Florida","Duke",4,4,0,0,-2.5,401001001,2017-11-26
11,1,"19:08",2348,2348,"Marvin Bagley III Offensive Rebound.",3,0,3,0.449474299076773,"Florida","Duke",4,4,0,0,-2.5,401001001,2017-11-26
12,1,"19:08",2348,2348,"Marvin Bagley III missed Two Point Tip Shot.",3,0,3,0.449474299076773,"Florida","Duke",4,4,0,0,-2.5,401001001,2017-11-26
13,1,"19:08",2348,2348,"Jalen Hudson Defensive Rebound.",3,0,3,0.449474299076773,"Florida","Duke",4,4,0,0,-2.5,401001001,2017-11-26
14,1,"18:43",2323,2323,"Chris Chiozza made Layup.",5,0,5,0.53777587172655,"Florida","Duke",4,4,0,0,-2.5,401001001,2017-11-26
15,1,"18:36",2316,2316,"Grayson Allen made Layup.",5,2,3,0.453991948482429,"Florida","Duke",4,4,0,0,-2.5,401001001,2017-11-26
16,1,"18:29",2309,2309,"KeVaughn Allen missed Three Point Jumper.",5,2,3,0.456483399414529,"Florida","Duke",4,4,0,0,-2.5,401001001,2017-11-26
17,1,"18:29",2309,2309,"Duke Defensive Rebound.",5,2,3,0.456483399414529,"Florida","Duke",4,4,0,0,-2.5,401001001,2017-11-26
18,1,"18:15",2295,2295,"Trevon Duval missed Three Point Jumper.",5,2,3,0.464219943026424,"Florida","Duke",4,4,0,0,-2.5,401001001,2017-11-26
19,1,"18:15",2295,2295,"Florida Defensive Rebound.",5,2,3,0.464219943026424,"Florida","Duke",4,4,0,0,-2.5,401001001,2017-11-26
20,1,"18:12",2292,2292,"Foul on Marvin Bagley III.",5,2,3,0.464219943026424,"Florida","Duke",4,4,0,0,-2.5,401001001,2017-11-26
21,1,"17:57",2277,2277,"Foul on Wendell Carter Jr.",5,2,3,0.469410841190165,"Florida","Duke",4,4,0,0,-2.5,401001001,2017-11-26
22,1,"17:41",2261,2261,"Jalen Hudson missed Layup.",5,2,3,0.479869046412912,"Florida","Duke",4,4,0,0,-2.5,401001001,2017-11-26
23,1,"17:41",2261,2261,"Marvin Bagley III Defensive Rebound.",5,2,3,0.479869046412912,"Florida","Duke",4,4,0,0,-2.5,401001001,2017-11-26
24,1,"17:32",2252,2252,"Foul on Wendell Carter Jr.",5,2,3,0.469252517633801,"Florida","Duke",4,4,0,0,-2.5,401001001,2017-11-26
25,1,"17:32",2252,2252,"Wendell Carter Jr Turnover.",5,2,3,0.469252517633801,"Florida","Duke",4,4,0,0,-2.5,401001001,2017-11-26
26,1,"17:16",2236,2236,"Keith Stone missed Dunk.",5,2,3,0.473275054315057,"Florida","Duke",4,4,0,0,-2.5,401001001,2017-11-26
27,1,"17:16",2236,2236,"Marvin Bagley III Defensive Rebound.",5,2,3,0.473275054315057,"Florida","Duke",4,4,0,0,-2.5,401001001,2017-11-26
28,1,"17:05",2225,2225,"Gary Trent Jr missed Jumper.",5,2,3,0.466705887779505,"Florida","Duke",4,4,0,0,-2.5,401001001,2017-11-26
29,1,"17:05",2225,2225,"Jalen Hudson Defensive Rebound.",5,2,3,0.466705887779505,"Florida","Duke",4,4,0,0,-2.5,401001001,2017-11-26
30,1,"16:55",2215,2215,"Jalen Hudson made Three Point Jumper.",8,2,6,0.599922204023071,"Florida","Duke",4,4,0,0,-2.5,401001001,2017-11-26
31,1,"16:43",2203,2203,"Gary Trent Jr missed Three Point Jumper.",8,2,6,0.563012557021428,"Florida","Duke",4,4,0,0,-2.5,401001001,2017-11-26
32,1,"16:43",2203,2203,"Marvin Bagley III Offensive Rebound.",8,2,6,0.563012557021428,"Florida","Duke",4,4,0,0,-2.5,401001001,2017-11-26
33,1,"16:40",2200,2200,"Foul on Egor Koulechov.",8,2,6,0.563012557021428,"Florida","Duke",4,4,0,0,-2.5,401001001,2017-11-26
34,1,"16:40",2200,2200,"Marvin Bagley III made Free Throw.",8,3,5,0.535002854024467,"Florida","Duke",4,4,0,0,-2.5,401001001,2017-11-26
35,1,"16:40",2200,2200,"Marvin Bagley III made Free Throw.",8,4,4,0.506770625039503,"Florida","Duke",4,4,0,0,-2.5,401001001,2017-11-26
36,1,"16:22",2182,2182,"Jalen Hudson made Layup.",10,4,6,0.554123796401437,"Florida","Duke",4,4,0,0,-2.5,401001001,2017-11-26
37,1,"16:06",2166,2166,"Trevon Duval missed Jumper.",10,4,6,0.556231940632441,"Florida","Duke",4,4,0,0,-2.5,401001001,2017-11-26
38,1,"16:06",2166,2166,"Egor Koulechov Defensive Rebound.",10,4,6,0.556231940632441,"Florida","Duke",4,4,0,0,-2.5,401001001,2017-11-26
39,1,"15:58",2158,2158,"Egor Koulechov made Layup. Assisted by Chris Chiozza.",12,4,8,0.613842748295369,"Florida","Duke",4,4,0,0,-2.5,401001001,2017-11-26
40,1,"15:58",2158,2158,"Official TV Timeout",12,4,8,0.613842748295369,"Florida","Duke",4,4,0,0,-2.5,401001001,2017-11-26
41,1,"15:58",2158,2158,"Foul on Javin DeLaurier.",12,4,8,0.613842748295369,"Florida","Duke",4,4,0,0,-2.5,401001001,2017-11-26
42,1,"15:58",2158,2158,"Official TV Timeout",12,4,8,0.613842748295369,"Florida","Duke",4,4,0,0,-2.5,401001001,2017-11-26
43,1,"15:58",2158,2158,"Egor Koulechov made Free Throw.",13,4,9,0.641751300802679,"Florida","Duke",4,4,0,0,-2.5,401001001,2017-11-26
44,1,"15:44",2144,2144,"Trevon Duval missed Three Point Jumper.",13,4,9,0.622111171841626,"Florida","Duke",4,4,0,0,-2.5,401001001,2017-11-26
45,1,"15:44",2144,2144,"Chris Chiozza Defensive Rebound.",13,4,9,0.622111171841626,"Florida","Duke",4,4,0,0,-2.5,401001001,2017-11-26
46,1,"15:25",2125,2125,"Egor Koulechov missed Jumper.",13,4,9,0.63627131242061,"Florida","Duke",4,4,0,0,-2.5,401001001,2017-11-26
47,1,"15:25",2125,2125,"Egor Koulechov Offensive Rebound.",13,4,9,0.63627131242061,"Florida","Duke",4,4,0,0,-2.5,401001001,2017-11-26
48,1,"15:20",2120,2120,"Egor Koulechov made Three Point Jumper.",16,4,12,0.711577226178246,"Florida","Duke",4,4,0,0,-2.5,401001001,2017-11-26
49,1,"15:06",2106,2106,"Marvin Bagley III missed Jumper.",16,4,12,0.70923785713344,"Florida","Duke",4,4,0,0,-2.5,401001001,2017-11-26
50,1,"15:06",2106,2106,"Jalen Hudson Defensive Rebound.",16,4,12,0.70923785713344,"Florida","Duke",4,4,0,0,-2.5,401001001,2017-11-26
51,1,"14:57",2097,2097,"KeVaughn Allen made Jumper. Assisted by Jalen Hudson.",18,4,14,0.786198906347533,"Florida","Duke",4,4,0,0,-2.5,401001001,2017-11-26
52,1,"14:47",2087,2087,"Duke  Timeout",18,4,14,0.758951220001585,"Florida","Duke",3,4,1,0,-2.5,401001001,2017-11-26
53,1,"14:30",2070,2070,"Marvin Bagley III missed Jumper.",18,4,14,0.732659031540224,"Florida","Duke",3,4,1,0,-2.5,401001001,2017-11-26
54,1,"14:30",2070,2070,"Javin DeLaurier Offensive Rebound.",18,4,14,0.732659031540224,"Florida","Duke",3,4,1,0,-2.5,401001001,2017-11-26
55,1,"14:30",2070,2070,"Javin DeLaurier missed Two Point Tip Shot.",18,4,14,0.732659031540224,"Florida","Duke",3,4,1,0,-2.5,401001001,2017-11-26
56,1,"14:30",2070,2070,"Javin DeLaurier Offensive Rebound.",18,4,14,0.732659031540224,"Florida","Duke",3,4,1,0,-2.5,401001001,2017-11-26
57,1,"14:30",2070,2070,"Javin DeLaurier made Two Point Tip Shot.",18,6,12,0.688666340636687,"Florida","Duke",3,4,1,0,-2.5,401001001,2017-11-26
58,1,"14:15",2055,2055,"Jalen Hudson missed Three Point Jumper.",18,6,12,0.706772295020053,"Florida","Duke",3,4,1,0,-2.5,401001001,2017-11-26
59,1,"14:15",2055,2055,"Marques Bolden Defensive Rebound.",18,6,12,0.706772295020053,"Florida","Duke",3,4,1,0,-2.5,401001001,2017-11-26
60,1,"14:10",2050,2050,"Grayson Allen Turnover.",18,6,12,0.706772295020053,"Florida","Duke",3,4,1,0,-2.5,401001001,2017-11-26
61,1,"14:10",2050,2050,"Kevarrius Hayes Steal.",18,6,12,0.706772295020053,"Florida","Duke",3,4,1,0,-2.5,401001001,2017-11-26
62,1,"14:04",2044,2044,"KeVaughn Allen made Three Point Jumper. Assisted by Chris Chiozza.",21,6,15,0.761347687916709,"Florida","Duke",3,4,1,0,-2.5,401001001,2017-11-26
63,1,"13:50",2030,2030,"Marvin Bagley III made Dunk. Assisted by Grayson Allen.",21,8,13,0.732466131165719,"Florida","Duke",3,4,1,0,-2.5,401001001,2017-11-26
64,1,"13:21",2001,2001,"Kevarrius Hayes missed Jumper.",21,8,13,0.72682669317745,"Florida","Duke",3,4,0,0,-2.5,401001001,2017-11-26
65,1,"13:21",2001,2001,"Javin DeLaurier Defensive Rebound.",21,8,13,0.72682669317745,"Florida","Duke",3,4,0,0,-2.5,401001001,2017-11-26
66,1,"13:10",1990,1990,"Marques Bolden made Jumper. Assisted by Grayson Allen.",21,10,11,0.726744464235977,"Florida","Duke",3,4,0,0,-2.5,401001001,2017-11-26
67,1,"12:47",1967,1967,"KeVaughn Allen made Three Point Jumper. Assisted by Jalen Hudson.",24,10,14,0.737673039059333,"Florida","Duke",3,4,0,0,-2.5,401001001,2017-11-26
68,1,"12:28",1948,1948,"Alex O'Connell made Three Point Jumper. Assisted by Marques Bolden.",24,13,11,0.720704748822972,"Florida","Duke",3,4,0,0,-2.5,401001001,2017-11-26
69,1,"12:20",1940,1940,"Jalen Hudson missed Three Point Jumper.",24,13,11,0.720704748822972,"Florida","Duke",3,4,0,0,-2.5,401001001,2017-11-26
70,1,"12:20",1940,1940,"Javin DeLaurier Defensive Rebound.",24,13,11,0.720704748822972,"Florida","Duke",3,4,0,0,-2.5,401001001,2017-11-26
71,1,"11:59",1919,1919,"Marques Bolden missed Layup.",24,13,11,0.744118610132186,"Florida","Duke",3,4,0,0,-2.5,401001001,2017-11-26
72,1,"11:59",1919,1919,"Marvin Bagley III Offensive Rebound.",24,13,11,0.744118610132186,"Florida","Duke",3,4,0,0,-2.5,401001001,2017-11-26
73,1,"11:59",1919,1919,"Marvin Bagley III made Two Point Tip Shot.",24,15,9,0.692024683520403,"Florida","Duke",3,4,0,0,-2.5,401001001,2017-11-26
74,1,"11:29",1889,1889,"Egor Koulechov missed Jumper.",24,15,9,0.652525835921098,"Florida","Duke",3,4,0,0,-2.5,401001001,2017-11-26
75,1,"11:29",1889,1889,"Marques Bolden Defensive Rebound.",24,15,9,0.652525835921098,"Florida","Duke",3,4,0,0,-2.5,401001001,2017-11-26
76,1,"11:14",1874,1874,"Javin DeLaurier missed Three Point Jumper.",24,15,9,0.663823366336812,"Florida","Duke",3,4,0,0,-2.5,401001001,2017-11-26
77,1,"11:14",1874,1874,"Chris Chiozza Defensive Rebound.",24,15,9,0.663823366336812,"Florida","Duke",3,4,0,0,-2.5,401001001,2017-11-26
78,1,"11:05",1865,1865,"Foul on Alex O'Connell.",24,15,9,0.707229227126994,"Florida","Duke",3,4,0,0,-2.5,401001001,2017-11-26
79,1,"11:05",1865,1865,"Official TV Timeout",24,15,9,0.707229227126994,"Florida","Duke",3,4,0,0,-2.5,401001001,2017-11-26
80,1,"11:05",1865,1865,"Chris Chiozza made Free Throw.",25,15,10,0.734280829034284,"Florida","Duke",3,4,0,0,-2.5,401001001,2017-11-26
81,1,"11:05",1865,1865,"Chris Chiozza made Free Throw.",26,15,11,0.759682246067966,"Florida","Duke",3,4,0,0,-2.5,401001001,2017-11-26
82,1,"10:55",1855,1855,"Foul on Gorjok Gak.",26,15,11,0.735621632301829,"Florida","Duke",3,4,0,0,-2.5,401001001,2017-11-26
83,1,"10:55",1855,1855,"Marvin Bagley III made Free Throw.",26,16,10,0.709992203384602,"Florida","Duke",3,4,0,0,-2.5,401001001,2017-11-26
84,1,"10:55",1855,1855,"Marvin Bagley III made Free Throw.",26,17,9,0.682949045194616,"Florida","Duke",3,4,0,0,-2.5,401001001,2017-11-26
85,1,"10:42",1842,1842,"Jalen Hudson missed Jumper.",26,17,9,0.644759531694496,"Florida","Duke",3,4,0,0,-2.5,401001001,2017-11-26
86,1,"10:42",1842,1842,"Deaundrae Ballard Offensive Rebound.",26,17,9,0.644759531694496,"Florida","Duke",3,4,0,0,-2.5,401001001,2017-11-26
87,1,"10:26",1826,1826,"Deaundrae Ballard made Jumper. Assisted by Chris Chiozza.",28,17,11,0.724923228799357,"Florida","Duke",3,4,0,0,-2.5,401001001,2017-11-26
88,1,"10:07",1807,1807,"Grayson Allen missed Three Point Jumper.",28,17,11,0.724075508289271,"Florida","Duke",3,4,0,0,-2.5,401001001,2017-11-26
89,1,"10:07",1807,1807,"Keith Stone Defensive Rebound.",28,17,11,0.724075508289271,"Florida","Duke",3,4,0,0,-2.5,401001001,2017-11-26
90,1,"9:51",1791,1791,"Keith Stone Turnover.",28,17,11,0.730048698938908,"Florida","Duke",3,4,0,0,-2.5,401001001,2017-11-26
91,1,"9:45",1785,1785,"Marvin Bagley III made Layup.",28,19,9,0.685224540208754,"Florida","Duke",3,4,0,0,-2.5,401001001,2017-11-26
92,1,"9:30",1770,1770,"Gorjok Gak made Dunk. Assisted by Chris Chiozza.",30,19,11,0.703680498382337,"Florida","Duke",3,4,0,0,-2.5,401001001,2017-11-26
93,1,"9:07",1747,1747,"Marvin Bagley III made Three Point Jumper. Assisted by Grayson Allen.",30,22,8,0.664775809275896,"Florida","Duke",3,4,0,0,-2.5,401001001,2017-11-26
94,1,"8:39",1719,1719,"Deaundrae Ballard made Jumper. Assisted by Chris Chiozza.",32,22,10,0.712004068233127,"Florida","Duke",3,4,0,0,-2.5,401001001,2017-11-26
95,1,"8:26",1706,1706,"Foul on Deaundrae Ballard.",32,22,10,0.693986607627869,"Florida","Duke",3,4,0,0,-2.5,401001001,2017-11-26
96,1,"8:17",1697,1697,"Trevon Duval made Layup. Assisted by Grayson Allen.",32,24,8,0.689508688875679,"Florida","Duke",3,4,0,0,-2.5,401001001,2017-11-26
97,1,"8:06",1686,1686,"Keith Stone missed Jumper.",32,24,8,0.673665061805754,"Florida","Duke",3,4,0,0,-2.5,401001001,2017-11-26
98,1,"8:06",1686,1686,"Grayson Allen Defensive Rebound.",32,24,8,0.673665061805754,"Florida","Duke",3,4,0,0,-2.5,401001001,2017-11-26
99,1,"7:54",1674,1674,"Wendell Carter Jr missed Layup.",32,24,8,0.669879296616478,"Florida","Duke",3,4,0,0,-2.5,401001001,2017-11-26
100,1,"7:54",1674,1674,"Gorjok Gak Block.",32,24,8,0.669879296616478,"Florida","Duke",3,4,0,0,-2.5,401001001,2017-11-26
101,1,"7:54",1674,1674,"Jalen Hudson Defensive Rebound.",32,24,8,0.669879296616478,"Florida","Duke",3,4,0,0,-2.5,401001001,2017-11-26
102,1,"7:44",1664,1664,"Foul on Javin DeLaurier.",32,24,8,0.650836388478224,"Florida","Duke",3,4,0,0,-2.5,401001001,2017-11-26
103,1,"7:44",1664,1664,"Official TV Timeout",32,24,8,0.650836388478224,"Florida","Duke",3,4,0,0,-2.5,401001001,2017-11-26
104,1,"7:44",1664,1664,"Gorjok Gak made Free Throw.",33,24,9,0.679648704283941,"Florida","Duke",3,4,0,0,-2.5,401001001,2017-11-26
105,1,"7:44",1664,1664,"Gorjok Gak missed Free Throw.",33,24,9,0.679648704283941,"Florida","Duke",3,4,0,0,-2.5,401001001,2017-11-26
106,1,"7:44",1664,1664,"Wendell Carter Jr Defensive Rebound.",33,24,9,0.679648704283941,"Florida","Duke",3,4,0,0,-2.5,401001001,2017-11-26
107,1,"7:30",1650,1650,"Gary Trent Jr made Three Point Jumper. Assisted by Marvin Bagley III.",33,27,6,0.608018345786476,"Florida","Duke",3,4,0,0,-2.5,401001001,2017-11-26
108,1,"7:09",1629,1629,"Egor Koulechov Turnover.",33,27,6,0.602569857322498,"Florida","Duke",3,4,0,0,-2.5,401001001,2017-11-26
109,1,"7:09",1629,1629,"Grayson Allen Steal.",33,27,6,0.602569857322498,"Florida","Duke",3,4,0,0,-2.5,401001001,2017-11-26
110,1,"6:57",1617,1617,"Foul on Keith Stone.",33,27,6,0.598088096437559,"Florida","Duke",3,4,0,0,-2.5,401001001,2017-11-26
111,1,"6:57",1617,1617,"Marvin Bagley III missed Free Throw.",33,27,6,0.598088096437559,"Florida","Duke",3,4,0,0,-2.5,401001001,2017-11-26
112,1,"6:57",1617,1617,"Duke Deadball Team Rebound.",33,27,6,0.598088096437559,"Florida","Duke",3,4,0,0,-2.5,401001001,2017-11-26
113,1,"6:57",1617,1617,"Marvin Bagley III made Free Throw.",33,28,5,0.563840605161263,"Florida","Duke",3,4,0,0,-2.5,401001001,2017-11-26
114,1,"6:42",1602,1602,"Keith Stone missed Jumper.",33,28,5,0.550004480028941,"Florida","Duke",3,4,0,0,-2.5,401001001,2017-11-26
115,1,"6:42",1602,1602,"Marvin Bagley III Defensive Rebound.",33,28,5,0.550004480028941,"Florida","Duke",3,4,0,0,-2.5,401001001,2017-11-26
116,1,"6:33",1593,1593,"Gary Trent Jr made Three Point Jumper. Assisted by Trevon Duval.",33,31,2,0.49193345710748,"Florida","Duke",3,4,0,0,-2.5,401001001,2017-11-26
117,1,"6:29",1589,1589,"Florida  Timeout",33,31,2,0.45029720535581,"Florida","Duke",3,3,0,1,-2.5,401001001,2017-11-26
118,1,"6:14",1574,1574,"Gorjok Gak made Jumper. Assisted by Egor Koulechov.",35,31,4,0.560333296102951,"Florida","Duke",3,3,0,1,-2.5,401001001,2017-11-26
119,1,"6:08",1568,1568,"Gary Trent Jr made Three Point Jumper. Assisted by Trevon Duval.",35,34,1,0.423567916148573,"Florida","Duke",3,3,0,1,-2.5,401001001,2017-11-26
120,1,"5:57",1557,1557,"Foul on Wendell Carter Jr.",35,34,1,0.43293020260336,"Florida","Duke",3,3,0,1,-2.5,401001001,2017-11-26
121,1,"5:57",1557,1557,"KeVaughn Allen made Free Throw.",36,34,2,0.46845900162529,"Florida","Duke",3,3,0,1,-2.5,401001001,2017-11-26
122,1,"5:57",1557,1557,"KeVaughn Allen made Free Throw.",37,34,3,0.504310490117597,"Florida","Duke",3,3,0,1,-2.5,401001001,2017-11-26
123,1,"5:49",1549,1549,"Marvin Bagley III missed Jumper.",37,34,3,0.50602022469508,"Florida","Duke",3,3,0,1,-2.5,401001001,2017-11-26
124,1,"5:49",1549,1549,"KeVaughn Allen Defensive Rebound.",37,34,3,0.50602022469508,"Florida","Duke",3,3,0,1,-2.5,401001001,2017-11-26
125,1,"5:40",1540,1540,"Egor Koulechov missed Jumper.",37,34,3,0.50602022469508,"Florida","Duke",3,3,0,1,-2.5,401001001,2017-11-26
126,1,"5:40",1540,1540,"Marques Bolden Defensive Rebound.",37,34,3,0.50602022469508,"Florida","Duke",3,3,0,1,-2.5,401001001,2017-11-26
127,1,"5:26",1526,1526,"Marvin Bagley III made Jumper. Assisted by Trevon Duval.",37,36,1,0.441939019317307,"Florida","Duke",3,3,0,0,-2.5,401001001,2017-11-26
128,1,"5:04",1504,1504,"KeVaughn Allen missed Three Point Jumper.",37,36,1,0.437714493401225,"Florida","Duke",3,3,0,0,-2.5,401001001,2017-11-26
129,1,"5:04",1504,1504,"Marvin Bagley III Defensive Rebound.",37,36,1,0.437714493401225,"Florida","Duke",3,3,0,0,-2.5,401001001,2017-11-26
130,1,"4:51",1491,1491,"Foul on Gorjok Gak.",37,36,1,0.462189567437688,"Florida","Duke",3,3,0,0,-2.5,401001001,2017-11-26
131,1,"4:49",1489,1489,"Grayson Allen made Three Point Jumper. Assisted by Trevon Duval.",37,39,-2,0.325141688127422,"Florida","Duke",3,3,0,0,-2.5,401001001,2017-11-26
132,1,"4:32",1472,1472,"Chris Chiozza Turnover.",37,39,-2,0.320151015657531,"Florida","Duke",3,3,0,0,-2.5,401001001,2017-11-26
133,1,"4:21",1461,1461,"Grayson Allen made Three Point Jumper. Assisted by Gary Trent Jr.",37,42,-5,0.275524686807158,"Florida","Duke",3,3,0,0,-2.5,401001001,2017-11-26
134,1,"3:58",1438,1438,"Kevarrius Hayes missed Jumper.",37,42,-5,0.260811578230945,"Florida","Duke",3,3,0,0,-2.5,401001001,2017-11-26
135,1,"3:58",1438,1438,"Duke Defensive Rebound.",37,42,-5,0.260811578230945,"Florida","Duke",3,3,0,0,-2.5,401001001,2017-11-26
136,1,"3:53",1433,1433,"Official TV Timeout",37,42,-5,0.260811578230945,"Florida","Duke",3,3,0,0,-2.5,401001001,2017-11-26
137,1,"3:48",1428,1428,"Gary Trent Jr made Jumper.",37,44,-7,0.19755339844368,"Florida","Duke",3,3,0,0,-2.5,401001001,2017-11-26
138,1,"3:35",1415,1415,"Jalen Hudson missed Jumper.",37,44,-7,0.190498529251166,"Florida","Duke",3,3,0,0,-2.5,401001001,2017-11-26
139,1,"3:35",1415,1415,"Gary Trent Jr Block.",37,44,-7,0.190498529251166,"Florida","Duke",3,3,0,0,-2.5,401001001,2017-11-26
140,1,"3:35",1415,1415,"Gary Trent Jr Defensive Rebound.",37,44,-7,0.190498529251166,"Florida","Duke",3,3,0,0,-2.5,401001001,2017-11-26
141,1,"3:26",1406,1406,"Gary Trent Jr Turnover.",37,44,-7,0.196851193000189,"Florida","Duke",3,3,0,0,-2.5,401001001,2017-11-26
142,1,"3:26",1406,1406,"Chris Chiozza Steal.",37,44,-7,0.196851193000189,"Florida","Duke",3,3,0,0,-2.5,401001001,2017-11-26
143,1,"3:23",1403,1403,"Jalen Hudson missed Three Point Jumper.",37,44,-7,0.196851193000189,"Florida","Duke",3,3,0,0,-2.5,401001001,2017-11-26
144,1,"3:23",1403,1403,"Florida Offensive Rebound.",37,44,-7,0.196851193000189,"Florida","Duke",3,3,0,0,-2.5,401001001,2017-11-26
145,1,"3:15",1395,1395,"Foul on Marques Bolden.",37,44,-7,0.175930233769325,"Florida","Duke",3,3,0,0,-2.5,401001001,2017-11-26
146,1,"3:15",1395,1395,"Egor Koulechov made Free Throw.",38,44,-6,0.19944956339372,"Florida","Duke",3,3,0,0,-2.5,401001001,2017-11-26
147,1,"3:15",1395,1395,"Egor Koulechov made Free Throw.",39,44,-5,0.225253644151394,"Florida","Duke",3,3,0,0,-2.5,401001001,2017-11-26
148,1,"2:58",1378,1378,"Marvin Bagley III missed Jumper.",39,44,-5,0.238709192909905,"Florida","Duke",3,3,0,0,-2.5,401001001,2017-11-26
149,1,"2:58",1378,1378,"Marvin Bagley III Offensive Rebound.",39,44,-5,0.238709192909905,"Florida","Duke",3,3,0,0,-2.5,401001001,2017-11-26
150,1,"2:54",1374,1374,"Marvin Bagley III made Layup.",39,46,-7,0.190235619678261,"Florida","Duke",3,3,0,0,-2.5,401001001,2017-11-26
151,1,"2:42",1362,1362,"Kevarrius Hayes made Layup. Assisted by Chris Chiozza.",41,46,-5,0.24456689000679,"Florida","Duke",3,3,0,0,-2.5,401001001,2017-11-26
152,1,"2:27",1347,1347,"Grayson Allen missed Three Point Jumper.",41,46,-5,0.240345784003115,"Florida","Duke",3,3,0,0,-2.5,401001001,2017-11-26
153,1,"2:27",1347,1347,"Egor Koulechov Defensive Rebound.",41,46,-5,0.240345784003115,"Florida","Duke",3,3,0,0,-2.5,401001001,2017-11-26
154,1,"2:08",1328,1328,"Chris Chiozza made Three Point Jumper.",44,46,-2,0.335838967116825,"Florida","Duke",3,3,0,0,-2.5,401001001,2017-11-26
155,1,"1:50",1310,1310,"Marvin Bagley III missed Three Point Jumper.",44,46,-2,0.357863336815147,"Florida","Duke",3,3,0,0,-2.5,401001001,2017-11-26
156,1,"1:50",1310,1310,"Kevarrius Hayes Defensive Rebound.",44,46,-2,0.357863336815147,"Florida","Duke",3,3,0,0,-2.5,401001001,2017-11-26
157,1,"1:37",1297,1297,"Foul on Grayson Allen.",44,46,-2,0.36653243703841,"Florida","Duke",3,3,0,0,-2.5,401001001,2017-11-26
158,1,"1:37",1297,1297,"KeVaughn Allen made Free Throw.",45,46,-1,0.406201599506657,"Florida","Duke",3,3,0,0,-2.5,401001001,2017-11-26
159,1,"1:37",1297,1297,"KeVaughn Allen made Free Throw.",46,46,0,0.447133639387254,"Florida","Duke",3,3,0,0,-2.5,401001001,2017-11-26
160,1,"1:25",1285,1285,"Grayson Allen Turnover.",46,46,0,0.404826520827198,"Florida","Duke",3,3,0,0,-2.5,401001001,2017-11-26
161,1,"1:25",1285,1285,"Jalen Hudson Steal.",46,46,0,0.404826520827198,"Florida","Duke",3,3,0,0,-2.5,401001001,2017-11-26
162,1,"1:20",1280,1280,"Egor Koulechov missed Three Point Jumper.",46,46,0,0.404826520827198,"Florida","Duke",3,3,0,0,-2.5,401001001,2017-11-26
163,1,"1:20",1280,1280,"Chris Chiozza Offensive Rebound.",46,46,0,0.404826520827198,"Florida","Duke",3,3,0,0,-2.5,401001001,2017-11-26
164,1,"1:15",1275,1275,"Chris Chiozza made Layup.",48,46,2,0.467107149816299,"Florida","Duke",3,3,0,0,-2.5,401001001,2017-11-26
165,1,"0:57",1257,1257,"Grayson Allen made Three Point Jumper. Assisted by Marques Bolden.",48,49,-1,0.383260832675455,"Florida","Duke",3,3,0,0,-2.5,401001001,2017-11-26
166,1,"0:44",1244,1244,"Chris Chiozza made Layup.",50,49,1,0.446936177711195,"Florida","Duke",3,3,0,0,-2.5,401001001,2017-11-26
167,1,"0:36",1236,1236,"Gary Trent Jr missed Three Point Jumper.",50,49,1,0.450200913831948,"Florida","Duke",3,3,0,0,-2.5,401001001,2017-11-26
168,1,"0:36",1236,1236,"Jalen Hudson Block.",50,49,1,0.450200913831948,"Florida","Duke",3,3,0,0,-2.5,401001001,2017-11-26
169,1,"0:36",1236,1236,"Kevarrius Hayes Defensive Rebound.",50,49,1,0.450200913831948,"Florida","Duke",3,3,0,0,-2.5,401001001,2017-11-26
170,1,"0:07",1207,1207,"Jalen Hudson made Three Point Jumper.",53,49,4,0.570338611814651,"Florida","Duke",3,3,0,0,-2.5,401001001,2017-11-26
171,1,"0:01",1201,1201,"Trevon Duval missed Three Point Jumper.",53,49,4,0.570338611814651,"Florida","Duke",3,3,0,0,-2.5,401001001,2017-11-26
172,1,"0:01",1201,1201,"Duke Deadball Team Rebound.",53,49,4,0.570338611814651,"Florida","Duke",3,3,0,0,-2.5,401001001,2017-11-26
173,1,"0:00",1200,1200,"End of 1st half",53,49,4,0.570338611814651,"Florida","Duke",3,3,0,0,-2.5,401001001,2017-11-26
174,2,"20:00",1200,1200,"PLAY",53,49,4,0.570338611814651,"Florida","Duke",4,4,0,0,-2.5,401001001,2017-11-26
175,2,"20:00",1200,1200,"Jump Ball won by Florida",53,49,4,0.570338611814651,"Florida","Duke",4,4,0,0,-2.5,401001001,2017-11-26
176,2,"19:43",1183,1183,"Keith Stone Turnover.",53,49,4,0.57503211694348,"Florida","Duke",4,4,0,0,-2.5,401001001,2017-11-26
177,2,"19:43",1183,1183,"Trevon Duval Steal.",53,49,4,0.57503211694348,"Florida","Duke",4,4,0,0,-2.5,401001001,2017-11-26
178,2,"19:36",1176,1176,"Grayson Allen missed Three Point Jumper.",53,49,4,0.585215363954353,"Florida","Duke",4,4,0,0,-2.5,401001001,2017-11-26
179,2,"19:36",1176,1176,"Egor Koulechov Defensive Rebound.",53,49,4,0.585215363954353,"Florida","Duke",4,4,0,0,-2.5,401001001,2017-11-26
180,2,"19:27",1167,1167,"KeVaughn Allen missed Jumper.",53,49,4,0.551590693740903,"Florida","Duke",4,4,0,0,-2.5,401001001,2017-11-26
181,2,"19:27",1167,1167,"KeVaughn Allen Offensive Rebound.",53,49,4,0.551590693740903,"Florida","Duke",4,4,0,0,-2.5,401001001,2017-11-26
182,2,"19:23",1163,1163,"KeVaughn Allen missed Jumper.",53,49,4,0.551590693740903,"Florida","Duke",4,4,0,0,-2.5,401001001,2017-11-26
183,2,"19:23",1163,1163,"Wendell Carter Jr Defensive Rebound.",53,49,4,0.551590693740903,"Florida","Duke",4,4,0,0,-2.5,401001001,2017-11-26
184,2,"19:06",1146,1146,"Foul on Jalen Hudson.",53,49,4,0.597128827356073,"Florida","Duke",4,4,0,0,-2.5,401001001,2017-11-26
185,2,"19:01",1141,1141,"Foul on Egor Koulechov.",53,49,4,0.597128827356073,"Florida","Duke",4,4,0,0,-2.5,401001001,2017-11-26
186,2,"18:55",1135,1135,"Gary Trent Jr missed Jumper.",53,49,4,0.580185538295365,"Florida","Duke",4,4,0,0,-2.5,401001001,2017-11-26
187,2,"18:55",1135,1135,"Chris Chiozza Defensive Rebound.",53,49,4,0.580185538295365,"Florida","Duke",4,4,0,0,-2.5,401001001,2017-11-26
188,2,"18:47",1127,1127,"KeVaughn Allen missed Three Point Jumper.",53,49,4,0.594392313956368,"Florida","Duke",4,4,0,0,-2.5,401001001,2017-11-26
189,2,"18:47",1127,1127,"Jalen Hudson Offensive Rebound.",53,49,4,0.594392313956368,"Florida","Duke",4,4,0,0,-2.5,401001001,2017-11-26
