"play_id","half","time_remaining_half","secs_remaining","secs_remaining_absolute","description","home_score","away_score","score_diff","win_prob","home","away","home_time_out_remaining","away_time_out_remaining","home_timeout_ind","away_timeout_ind","home_favored_by","game_id","date"
1,1,"20:00",2400,2400,"PLAY",0,0,0,0.92852875192763,"Davidson","VMI",6,6,0,0,26,400988702,2017-12-05
2,1,"19:49",2389,2389,"KiShawn Pritchett Turnover.",0,0,0,0.924977216913482,"Davidson","VMI",6,6,0,0,26,400988702,2017-12-05
3,1,"19:47",2387,2387,"Bubba Parham Steal.",0,0,0,0.924977216913482,"Davidson","VMI",6,6,0,0,26,400988702,2017-12-05
4,1,"19:42",2382,2382,"Garrett Gilkeson missed Three Point Jumper.",0,0,0,0.924977216913482,"Davidson","VMI",6,6,0,0,26,400988702,2017-12-05
5,1,"19:42",2382,2382,"Kellan Grady Defensive Rebound.",0,0,0,0.924977216913482,"Davidson","VMI",6,6,0,0,26,400988702,2017-12-05
6,1,"19:27",2367,2367,"KiShawn Pritchett missed Three Point Jumper.",0,0,0,0.913139953902365,"Davidson","VMI",6,6,0,0,26,400988702,2017-12-05
7,1,"19:27",2367,2367,"Garrett Gilkeson Defensive Rebound.",0,0,0,0.913139953902365,"Davidson","VMI",6,6,0,0,26,400988702,2017-12-05
8,1,"19:07",2347,2347,"Garrett Gilkeson made Layup. Assisted by Tyler Creammer.",0,2,-2,0.899794646502259,"Davidson","VMI",6,6,0,0,26,400988702,2017-12-05
9,1,"18:47",2327,2327,"Peyton Aldridge missed Jumper.",0,2,-2,0.900635501763404,"Davidson","VMI",6,6,0,0,26,400988702,2017-12-05
10,1,"18:47",2327,2327,"Will Miller Defensive Rebound.",0,2,-2,0.900635501763404,"Davidson","VMI",6,6,0,0,26,400988702,2017-12-05
11,1,"18:26",2306,2306,"Keith Smith missed Jumper.",0,2,-2,0.892444556538963,"Davidson","VMI",6,6,0,0,26,400988702,2017-12-05
12,1,"18:26",2306,2306,"Davidson Defensive Rebound.",0,2,-2,0.892444556538963,"Davidson","VMI",6,6,0,0,26,400988702,2017-12-05
13,1,"18:11",2291,2291,"Oskar Michelsen missed Layup.",0,2,-2,0.90170992087763,"Davidson","VMI",6,6,0,0,26,400988702,2017-12-05
14,1,"18:11",2291,2291,"Tyler Creammer Block.",0,2,-2,0.90170992087763,"Davidson","VMI",6,6,0,0,26,400988702,2017-12-05
15,1,"18:09",2289,2289,"Tyler Creammer Defensive Rebound.",0,2,-2,0.895866628362465,"Davidson","VMI",6,6,0,0,26,400988702,2017-12-05
16,1,"17:59",2279,2279,"Garrett Gilkeson missed Three Point Jumper.",0,2,-2,0.89903901145695,"Davidson","VMI",6,6,0,0,26,400988702,2017-12-05
17,1,"17:59",2279,2279,"Peyton Aldridge Defensive Rebound.",0,2,-2,0.89903901145695,"Davidson","VMI",6,6,0,0,26,400988702,2017-12-05
18,1,"17:32",2252,2252,"Peyton Aldridge missed Jumper.",0,2,-2,0.893005060702789,"Davidson","VMI",6,6,0,0,26,400988702,2017-12-05
19,1,"17:32",2252,2252,"Tyler Creammer Defensive Rebound.",0,2,-2,0.893005060702789,"Davidson","VMI",6,6,0,0,26,400988702,2017-12-05
20,1,"17:22",2242,2242,"Tyler Creammer Turnover.",0,2,-2,0.886465562429505,"Davidson","VMI",6,6,0,0,26,400988702,2017-12-05
21,1,"17:22",2242,2242,"Foul on Tyler Creammer.",0,2,-2,0.886465562429505,"Davidson","VMI",6,6,0,0,26,400988702,2017-12-05
22,1,"17:03",2223,2223,"Jon Axel Gudmundsson Turnover.",0,2,-2,0.898297095408371,"Davidson","VMI",6,6,0,0,26,400988702,2017-12-05
23,1,"17:01",2221,2221,"Keith Smith Steal.",0,2,-2,0.898297095408371,"Davidson","VMI",6,6,0,0,26,400988702,2017-12-05
24,1,"17:00",2220,2220,"Garrett Gilkeson made Dunk. Assisted by Keith Smith.",0,4,-4,0.878025093270261,"Davidson","VMI",6,6,0,0,26,400988702,2017-12-05
25,1,"16:47",2207,2207,"Peyton Aldridge made Layup. Assisted by Kellan Grady.",2,4,-2,0.891802754579942,"Davidson","VMI",6,6,0,0,26,400988702,2017-12-05
26,1,"16:47",2207,2207,"Foul on Will Miller.",2,4,-2,0.891802754579942,"Davidson","VMI",6,6,0,0,26,400988702,2017-12-05
27,1,"16:47",2207,2207,"Peyton Aldridge made Free Throw.",3,4,-1,0.902247114788845,"Davidson","VMI",6,6,0,0,26,400988702,2017-12-05
28,1,"16:21",2181,2181,"Will Miller missed Three Point Jumper.",3,4,-1,0.9026272563953,"Davidson","VMI",6,6,0,0,26,400988702,2017-12-05
29,1,"16:21",2181,2181,"Kellan Grady Defensive Rebound.",3,4,-1,0.9026272563953,"Davidson","VMI",6,6,0,0,26,400988702,2017-12-05
30,1,"16:08",2168,2168,"Foul on Keith Smith.",3,4,-1,0.898974426626083,"Davidson","VMI",6,6,0,0,26,400988702,2017-12-05
31,1,"15:58",2158,2158,"Kellan Grady missed Three Point Jumper.",3,4,-1,0.898561561134254,"Davidson","VMI",6,6,0,0,26,400988702,2017-12-05
32,1,"15:58",2158,2158,"Jordan Ratliffe Defensive Rebound.",3,4,-1,0.898561561134254,"Davidson","VMI",6,6,0,0,26,400988702,2017-12-05
33,1,"15:44",2144,2144,"Fred Iruafemi made Jumper.",3,6,-3,0.886551634303517,"Davidson","VMI",6,6,0,0,26,400988702,2017-12-05
34,1,"15:15",2115,2115,"Rusty Reigel made Three Point Jumper. Assisted by Peyton Aldridge.",6,6,0,0.916959363620082,"Davidson","VMI",6,6,0,0,26,400988702,2017-12-05
35,1,"14:51",2091,2091,"Bubba Parham made Jumper.",6,8,-2,0.878129092422365,"Davidson","VMI",6,6,0,0,26,400988702,2017-12-05
36,1,"14:34",2074,2074,"Will Magarity made Three Point Jumper. Assisted by Peyton Aldridge.",9,8,1,0.919552420228705,"Davidson","VMI",6,6,0,0,26,400988702,2017-12-05
37,1,"14:14",2054,2054,"Jordan Ratliffe Turnover.",9,8,1,0.924236285735549,"Davidson","VMI",6,6,0,0,26,400988702,2017-12-05
38,1,"14:13",2053,2053,"Jon Axel Gudmundsson Steal.",9,8,1,0.924236285735549,"Davidson","VMI",6,6,0,0,26,400988702,2017-12-05
39,1,"14:11",2051,2051,"Kellan Grady made Dunk. Assisted by Jon Axel Gudmundsson.",11,8,3,0.939098516911556,"Davidson","VMI",6,6,0,0,26,400988702,2017-12-05
40,1,"13:53",2033,2033,"Jordan Ratliffe Turnover.",11,8,3,0.939460713435025,"Davidson","VMI",6,6,1,0,26,400988702,2017-12-05
41,1,"13:53",2033,2033,"Davidson  Timeout",11,8,3,0.939460713435025,"Davidson","VMI",5,6,1,0,26,400988702,2017-12-05
42,1,"13:29",2009,2009,"Dusan Kovacevic missed Layup.",11,8,3,0.928312835295838,"Davidson","VMI",5,6,1,0,26,400988702,2017-12-05
43,1,"13:29",2009,2009,"Bubba Parham Defensive Rebound.",11,8,3,0.928312835295838,"Davidson","VMI",5,6,1,0,26,400988702,2017-12-05
44,1,"13:17",1997,1997,"Bubba Parham missed Jumper.",11,8,3,0.935095431760835,"Davidson","VMI",5,6,1,0,26,400988702,2017-12-05
45,1,"13:17",1997,1997,"Kellan Grady Defensive Rebound.",11,8,3,0.935095431760835,"Davidson","VMI",5,6,1,0,26,400988702,2017-12-05
46,1,"12:58",1978,1978,"Rusty Reigel Turnover.",11,8,3,0.937799073109525,"Davidson","VMI",5,6,1,0,26,400988702,2017-12-05
47,1,"12:43",1963,1963,"Jordan Ratliffe missed Three Point Jumper.",11,8,3,0.929401667975436,"Davidson","VMI",5,6,0,0,26,400988702,2017-12-05
48,1,"12:43",1963,1963,"Jon Axel Gudmundsson Defensive Rebound.",11,8,3,0.929401667975436,"Davidson","VMI",5,6,0,0,26,400988702,2017-12-05
49,1,"12:25",1945,1945,"Carter Collins missed Three Point Jumper.",11,8,3,0.930639341505006,"Davidson","VMI",5,6,0,0,26,400988702,2017-12-05
50,1,"12:25",1945,1945,"Jordan Ratliffe Defensive Rebound.",11,8,3,0.930639341505006,"Davidson","VMI",5,6,0,0,26,400988702,2017-12-05
51,1,"11:54",1914,1914,"Tyler Creammer missed Jumper.",11,8,3,0.934749537985239,"Davidson","VMI",5,6,0,0,26,400988702,2017-12-05
52,1,"11:54",1914,1914,"Carter Collins Defensive Rebound.",11,8,3,0.934749537985239,"Davidson","VMI",5,6,0,0,26,400988702,2017-12-05
53,1,"11:44",1904,1904,"Carter Collins Turnover.",11,8,3,0.93081259995272,"Davidson","VMI",5,6,0,0,26,400988702,2017-12-05
54,1,"11:43",1903,1903,"Jordan Ratliffe Steal.",11,8,3,0.93081259995272,"Davidson","VMI",5,6,0,0,26,400988702,2017-12-05
55,1,"11:40",1900,1900,"Jordan Ratliffe made Layup.",11,10,1,0.914139150331853,"Davidson","VMI",5,6,0,0,26,400988702,2017-12-05
56,1,"11:20",1880,1880,"Carter Collins Turnover.",11,10,1,0.913725133158473,"Davidson","VMI",5,6,0,1,26,400988702,2017-12-05
57,1,"11:20",1880,1880,"VMI  Timeout",11,10,1,0.913725133158473,"Davidson","VMI",5,5,0,1,26,400988702,2017-12-05
58,1,"11:01",1861,1861,"Bubba Parham Turnover.",11,10,1,0.907440078696605,"Davidson","VMI",5,5,0,1,26,400988702,2017-12-05
59,1,"10:59",1859,1859,"Jon Axel Gudmundsson Steal.",11,10,1,0.909192557084754,"Davidson","VMI",5,5,0,1,26,400988702,2017-12-05
60,1,"10:42",1842,1842,"Oskar Michelsen missed Layup.",11,10,1,0.907546475017208,"Davidson","VMI",5,5,0,1,26,400988702,2017-12-05
61,1,"10:42",1842,1842,"Keith Smith Defensive Rebound.",11,10,1,0.907546475017208,"Davidson","VMI",5,5,0,1,26,400988702,2017-12-05
62,1,"10:21",1821,1821,"Jordan Ratliffe missed Layup.",11,10,1,0.918156893514345,"Davidson","VMI",5,5,0,1,26,400988702,2017-12-05
63,1,"10:21",1821,1821,"Jon Axel Gudmundsson Defensive Rebound.",11,10,1,0.918156893514345,"Davidson","VMI",5,5,0,1,26,400988702,2017-12-05
64,1,"10:04",1804,1804,"KiShawn Pritchett missed Three Point Jumper.",11,10,1,0.908923689103942,"Davidson","VMI",5,5,0,0,26,400988702,2017-12-05
65,1,"10:04",1804,1804,"Peyton Aldridge Offensive Rebound.",11,10,1,0.908923689103942,"Davidson","VMI",5,5,0,0,26,400988702,2017-12-05
66,1,"10:00",1800,1800,"Kellan Grady made Three Point Jumper. Assisted by Peyton Aldridge.",14,10,4,0.9362126237224,"Davidson","VMI",5,5,0,0,26,400988702,2017-12-05
67,1,"9:36",1776,1776,"Bubba Parham made Three Point Jumper. Assisted by Jordan Ratliffe.",14,13,1,0.901916840136971,"Davidson","VMI",5,5,0,0,26,400988702,2017-12-05
68,1,"9:29",1769,1769,"Peyton Aldridge missed Layup.",14,13,1,0.915260329670265,"Davidson","VMI",5,5,0,0,26,400988702,2017-12-05
69,1,"9:29",1769,1769,"Austin Vereen Defensive Rebound.",14,13,1,0.915260329670265,"Davidson","VMI",5,5,0,0,26,400988702,2017-12-05
70,1,"9:22",1762,1762,"Bubba Parham Turnover.",14,13,1,0.915260329670265,"Davidson","VMI",5,5,0,0,26,400988702,2017-12-05
71,1,"9:08",1748,1748,"Will Magarity made Three Point Jumper. Assisted by Peyton Aldridge.",17,13,4,0.929636723136362,"Davidson","VMI",5,5,0,0,26,400988702,2017-12-05
72,1,"8:41",1721,1721,"Garrett Gilkeson made Three Point Jumper. Assisted by Keith Smith.",17,16,1,0.892910239562633,"Davidson","VMI",5,5,0,0,26,400988702,2017-12-05
73,1,"8:31",1711,1711,"Peyton Aldridge made Jumper. Assisted by Jon Axel Gudmundsson.",19,16,3,0.932000226544181,"Davidson","VMI",5,5,0,0,26,400988702,2017-12-05
74,1,"8:09",1689,1689,"Keith Smith Turnover.",19,16,3,0.933243633768602,"Davidson","VMI",5,5,0,0,26,400988702,2017-12-05
75,1,"8:09",1689,1689,"Will Magarity Steal.",19,16,3,0.933243633768602,"Davidson","VMI",5,5,0,0,26,400988702,2017-12-05
76,1,"7:52",1672,1672,"Will Magarity made Layup. Assisted by Peyton Aldridge.",21,16,5,0.943849132506832,"Davidson","VMI",5,5,0,0,26,400988702,2017-12-05
77,1,"7:27",1647,1647,"Sarju Patel made Jumper. Assisted by Keith Smith.",21,18,3,0.926390619053316,"Davidson","VMI",5,5,0,0,26,400988702,2017-12-05
78,1,"7:16",1636,1636,"Kellan Grady missed Three Point Jumper.",21,18,3,0.922515186146422,"Davidson","VMI",5,5,0,0,26,400988702,2017-12-05
79,1,"7:16",1636,1636,"KiShawn Pritchett Offensive Rebound.",21,18,3,0.922515186146422,"Davidson","VMI",5,5,0,0,26,400988702,2017-12-05
80,1,"7:12",1632,1632,"Jon Axel Gudmundsson made Three Point Jumper. Assisted by KiShawn Pritchett.",24,18,6,0.946432314840519,"Davidson","VMI",5,5,0,0,26,400988702,2017-12-05
81,1,"6:43",1603,1603,"Sarju Patel made Three Point Jumper. Assisted by Keith Smith.",24,21,3,0.924605560318792,"Davidson","VMI",5,5,0,0,26,400988702,2017-12-05
82,1,"6:32",1592,1592,"Jon Axel Gudmundsson missed Three Point Jumper.",24,21,3,0.918746771631342,"Davidson","VMI",5,5,0,0,26,400988702,2017-12-05
83,1,"6:32",1592,1592,"Tyler Creammer Defensive Rebound.",24,21,3,0.918746771631342,"Davidson","VMI",5,5,0,0,26,400988702,2017-12-05
84,1,"6:23",1583,1583,"Sarju Patel Turnover.",24,21,3,0.921182004565106,"Davidson","VMI",5,5,1,0,26,400988702,2017-12-05
85,1,"6:23",1583,1583,"Davidson  Timeout",24,21,3,0.921182004565106,"Davidson","VMI",4,5,1,0,26,400988702,2017-12-05
86,1,"6:04",1564,1564,"Peyton Aldridge made Three Point Jumper. Assisted by Kellan Grady.",27,21,6,0.945346920921235,"Davidson","VMI",4,5,1,0,26,400988702,2017-12-05
87,1,"5:51",1551,1551,"Austin Vereen missed Three Point Jumper.",27,21,6,0.943678100253479,"Davidson","VMI",4,5,1,0,26,400988702,2017-12-05
88,1,"5:51",1551,1551,"Peyton Aldridge Defensive Rebound.",27,21,6,0.943678100253479,"Davidson","VMI",4,5,1,0,26,400988702,2017-12-05
89,1,"5:34",1534,1534,"Peyton Aldridge Turnover.",27,21,6,0.948558147985576,"Davidson","VMI",4,5,1,0,26,400988702,2017-12-05
90,1,"5:33",1533,1533,"Garrett Gilkeson Steal.",27,21,6,0.948558147985576,"Davidson","VMI",4,5,1,0,26,400988702,2017-12-05
91,1,"5:26",1526,1526,"Greg Parham missed Three Point Jumper.",27,21,6,0.945112713375149,"Davidson","VMI",4,5,1,0,26,400988702,2017-12-05
92,1,"5:26",1526,1526,"KiShawn Pritchett Defensive Rebound.",27,21,6,0.945112713375149,"Davidson","VMI",4,5,1,0,26,400988702,2017-12-05
93,1,"5:20",1520,1520,"Kellan Grady made Layup. Assisted by KiShawn Pritchett.",29,21,8,0.958135643115136,"Davidson","VMI",4,5,0,0,26,400988702,2017-12-05
94,1,"5:03",1503,1503,"Greg Parham missed Jumper.",29,21,8,0.959100244641698,"Davidson","VMI",4,5,0,0,26,400988702,2017-12-05
95,1,"5:03",1503,1503,"Greg Parham Offensive Rebound.",29,21,8,0.959100244641698,"Davidson","VMI",4,5,0,0,26,400988702,2017-12-05
96,1,"4:57",1497,1497,"Austin Vereen made Three Point Jumper. Assisted by Garrett Gilkeson.",29,24,5,0.939986634460685,"Davidson","VMI",4,5,0,0,26,400988702,2017-12-05
97,1,"4:38",1478,1478,"Dusan Kovacevic missed Layup.",29,24,5,0.949374878611473,"Davidson","VMI",4,5,0,0,26,400988702,2017-12-05
98,1,"4:38",1478,1478,"Fred Iruafemi Defensive Rebound.",29,24,5,0.949374878611473,"Davidson","VMI",4,5,0,0,26,400988702,2017-12-05
99,1,"4:08",1448,1448,"Austin Vereen missed Jumper.",29,24,5,0.94324195195156,"Davidson","VMI",4,5,0,0,26,400988702,2017-12-05
100,1,"4:08",1448,1448,"Austin Vereen Offensive Rebound.",29,24,5,0.94324195195156,"Davidson","VMI",4,5,0,0,26,400988702,2017-12-05
101,1,"4:07",1447,1447,"Foul on Kellan Grady.",29,24,5,0.94324195195156,"Davidson","VMI",4,5,0,0,26,400988702,2017-12-05
102,1,"4:00",1440,1440,"Sarju Patel missed Jumper.",29,24,5,0.94324195195156,"Davidson","VMI",4,5,0,0,26,400988702,2017-12-05
103,1,"4:00",1440,1440,"Jon Axel Gudmundsson Defensive Rebound.",29,24,5,0.94324195195156,"Davidson","VMI",4,5,0,0,26,400988702,2017-12-05
104,1,"3:51",1431,1431,"Foul on Sarju Patel.",29,24,5,0.934943128049373,"Davidson","VMI",4,5,1,0,26,400988702,2017-12-05
105,1,"3:51",1431,1431,"Davidson  Timeout",29,24,5,0.934943128049373,"Davidson","VMI",3,5,1,0,26,400988702,2017-12-05
106,1,"3:51",1431,1431,"Jon Axel Gudmundsson made Free Throw.",30,24,6,0.943445256541915,"Davidson","VMI",3,5,1,0,26,400988702,2017-12-05
107,1,"3:51",1431,1431,"Jon Axel Gudmundsson made Free Throw.",31,24,7,0.95089462075714,"Davidson","VMI",3,5,1,0,26,400988702,2017-12-05
108,1,"3:39",1419,1419,"Keith Smith missed Layup.",31,24,7,0.949566923926282,"Davidson","VMI",3,5,1,0,26,400988702,2017-12-05
109,1,"3:39",1419,1419,"Will Magarity Block.",31,24,7,0.949566923926282,"Davidson","VMI",3,5,1,0,26,400988702,2017-12-05
110,1,"3:38",1418,1418,"KiShawn Pritchett Defensive Rebound.",31,24,7,0.949566923926282,"Davidson","VMI",3,5,1,0,26,400988702,2017-12-05
111,1,"3:18",1398,1398,"Rusty Reigel missed Three Point Jumper.",31,24,7,0.958661892098507,"Davidson","VMI",3,5,1,0,26,400988702,2017-12-05
112,1,"3:18",1398,1398,"VMI Defensive Rebound.",31,24,7,0.958661892098507,"Davidson","VMI",3,5,1,0,26,400988702,2017-12-05
113,1,"2:47",1367,1367,"Keith Smith missed Jumper.",31,24,7,0.952720964278189,"Davidson","VMI",3,5,0,0,26,400988702,2017-12-05
114,1,"2:47",1367,1367,"Davidson Defensive Rebound.",31,24,7,0.952720964278189,"Davidson","VMI",3,5,0,0,26,400988702,2017-12-05
115,1,"2:28",1348,1348,"Kellan Grady missed Three Point Jumper.",31,24,7,0.948993225335028,"Davidson","VMI",3,5,0,0,26,400988702,2017-12-05
116,1,"2:28",1348,1348,"Fred Iruafemi Defensive Rebound.",31,24,7,0.948993225335028,"Davidson","VMI",3,5,0,0,26,400988702,2017-12-05
117,1,"2:07",1327,1327,"Garrett Gilkeson missed Three Point Jumper.",31,24,7,0.953214949913903,"Davidson","VMI",3,5,0,0,26,400988702,2017-12-05
118,1,"2:07",1327,1327,"Jon Axel Gudmundsson Defensive Rebound.",31,24,7,0.953214949913903,"Davidson","VMI",3,5,0,0,26,400988702,2017-12-05
119,1,"2:01",1321,1321,"Foul on Bubba Parham.",31,24,7,0.953214949913903,"Davidson","VMI",3,5,0,0,26,400988702,2017-12-05
120,1,"2:01",1321,1321,"Jon Axel Gudmundsson made Free Throw.",32,24,8,0.959762326737735,"Davidson","VMI",3,5,0,0,26,400988702,2017-12-05
121,1,"2:01",1321,1321,"Jon Axel Gudmundsson made Free Throw.",33,24,9,0.965426658549059,"Davidson","VMI",3,5,0,0,26,400988702,2017-12-05
122,1,"1:40",1300,1300,"Fred Iruafemi missed Jumper.",33,24,9,0.957890563930057,"Davidson","VMI",3,5,0,0,26,400988702,2017-12-05
123,1,"1:40",1300,1300,"KiShawn Pritchett Defensive Rebound.",33,24,9,0.957890563930057,"Davidson","VMI",3,5,0,0,26,400988702,2017-12-05
124,1,"1:30",1290,1290,"Foul on Fred Iruafemi.",33,24,9,0.965721289003845,"Davidson","VMI",3,5,0,0,26,400988702,2017-12-05
125,1,"1:30",1290,1290,"Peyton Aldridge made Free Throw.",34,24,10,0.97085184537359,"Davidson","VMI",3,5,0,0,26,400988702,2017-12-05
126,1,"1:30",1290,1290,"Peyton Aldridge missed Free Throw.",34,24,10,0.97085184537359,"Davidson","VMI",3,5,0,0,26,400988702,2017-12-05
127,1,"1:30",1290,1290,"Myles Lewis Defensive Rebound.",34,24,10,0.97085184537359,"Davidson","VMI",3,5,0,0,26,400988702,2017-12-05
128,1,"1:09",1269,1269,"Myles Lewis missed Layup.",34,24,10,0.972621156902431,"Davidson","VMI",3,5,0,0,26,400988702,2017-12-05
129,1,"1:09",1269,1269,"Fred Iruafemi Offensive Rebound.",34,24,10,0.972621156902431,"Davidson","VMI",3,5,0,0,26,400988702,2017-12-05
130,1,"1:03",1263,1263,"Jordan Ratliffe made Three Point Jumper. Assisted by Fred Iruafemi.",34,27,7,0.956712772719302,"Davidson","VMI",3,5,0,0,26,400988702,2017-12-05
131,1,"0:57",1257,1257,"Davidson  Timeout",34,27,7,0.9439028724502,"Davidson","VMI",2,5,1,0,26,400988702,2017-12-05
132,1,"0:34",1234,1234,"Kellan Grady missed Three Point Jumper.",34,27,7,0.948025402983347,"Davidson","VMI",2,5,1,0,26,400988702,2017-12-05
133,1,"0:34",1234,1234,"Austin Vereen Defensive Rebound.",34,27,7,0.948025402983347,"Davidson","VMI",2,5,1,0,26,400988702,2017-12-05
134,1,"0:29",1229,1229,"VMI  Timeout",34,27,7,0.954362103671412,"Davidson","VMI",2,4,1,1,26,400988702,2017-12-05
135,1,"0:14",1214,1214,"Foul on Peyton Aldridge.",34,27,7,0.949521874327469,"Davidson","VMI",2,4,1,1,26,400988702,2017-12-05
136,1,"0:07",1207,1207,"Bubba Parham missed Layup.",34,27,7,0.951146584480095,"Davidson","VMI",2,4,1,1,26,400988702,2017-12-05
137,1,"0:07",1207,1207,"Kellan Grady Defensive Rebound.",34,27,7,0.951146584480095,"Davidson","VMI",2,4,1,1,26,400988702,2017-12-05
138,1,"0:00",1200,1200,"End of 1st half",34,27,7,0.951146584480095,"Davidson","VMI",2,4,1,1,26,400988702,2017-12-05
139,2,"20:00",1200,1200,"PLAY",34,27,7,0.951146584480095,"Davidson","VMI",2,4,0,0,26,400988702,2017-12-05
140,2,"19:30",1170,1170,"Bubba Parham made Three Point Jumper.",34,30,4,0.917605227371949,"Davidson","VMI",2,4,0,0,26,400988702,2017-12-05
141,2,"19:14",1154,1154,"Foul on Garrett Gilkeson.",34,30,4,0.91737787999161,"Davidson","VMI",2,4,0,0,26,400988702,2017-12-05
142,2,"19:11",1151,1151,"Peyton Aldridge made Layup. Assisted by Oskar Michelsen.",36,30,6,0.93881704740068,"Davidson","VMI",2,4,0,0,26,400988702,2017-12-05
143,2,"18:55",1135,1135,"Bubba Parham made Jumper.",36,32,4,0.9257489250659,"Davidson","VMI",2,4,0,0,26,400988702,2017-12-05
144,2,"18:31",1111,1111,"Kellan Grady missed Layup.",36,32,4,0.917488941962041,"Davidson","VMI",2,4,0,0,26,400988702,2017-12-05
145,2,"18:31",1111,1111,"Oskar Michelsen Offensive Rebound.",36,32,4,0.917488941962041,"Davidson","VMI",2,4,0,0,26,400988702,2017-12-05
146,2,"18:31",1111,1111,"Oskar Michelsen made Layup.",38,32,6,0.940174866652767,"Davidson","VMI",2,4,0,0,26,400988702,2017-12-05
147,2,"18:31",1111,1111,"Foul on Will Miller.",38,32,6,0.940174866652767,"Davidson","VMI",2,4,0,0,26,400988702,2017-12-05
148,2,"18:31",1111,1111,"Oskar Michelsen missed Free Throw.",38,32,6,0.940174866652767,"Davidson","VMI",2,4,0,0,26,400988702,2017-12-05
149,2,"18:31",1111,1111,"Bubba Parham Defensive Rebound.",38,32,6,0.940174866652767,"Davidson","VMI",2,4,0,0,26,400988702,2017-12-05
150,2,"18:10",1090,1090,"Will Miller Turnover.",38,32,6,0.946923448281043,"Davidson","VMI",2,4,0,0,26,400988702,2017-12-05
151,2,"18:10",1090,1090,"Foul on Will Miller.",38,32,6,0.946923448281043,"Davidson","VMI",2,4,0,0,26,400988702,2017-12-05
152,2,"17:49",1069,1069,"Peyton Aldridge made Three Point Jumper. Assisted by KiShawn Pritchett.",41,32,9,0.963374614759555,"Davidson","VMI",2,4,0,0,26,400988702,2017-12-05
153,2,"17:24",1044,1044,"Tyler Creammer Turnover.",41,32,9,0.96767148434581,"Davidson","VMI",2,4,0,0,26,400988702,2017-12-05
154,2,"17:10",1030,1030,"Foul on Austin Vereen.",41,32,9,0.964357303241508,"Davidson","VMI",2,4,0,0,26,400988702,2017-12-05
155,2,"17:10",1030,1030,"Jon Axel Gudmundsson missed Free Throw.",41,32,9,0.964357303241508,"Davidson","VMI",2,4,0,0,26,400988702,2017-12-05
156,2,"17:10",1030,1030,"Davidson Deadball Team Rebound.",41,32,9,0.964357303241508,"Davidson","VMI",2,4,0,0,26,400988702,2017-12-05
157,2,"17:10",1030,1030,"Jon Axel Gudmundsson made Free Throw.",42,32,10,0.969806121654688,"Davidson","VMI",2,4,0,0,26,400988702,2017-12-05
158,2,"16:59",1019,1019,"Bubba Parham missed Jumper.",42,32,10,0.968054398522437,"Davidson","VMI",2,4,0,0,26,400988702,2017-12-05
159,2,"16:59",1019,1019,"KiShawn Pritchett Defensive Rebound.",42,32,10,0.968054398522437,"Davidson","VMI",2,4,0,0,26,400988702,2017-12-05
160,2,"16:49",1009,1009,"KiShawn Pritchett Turnover.",42,32,10,0.970031466573472,"Davidson","VMI",2,4,0,0,26,400988702,2017-12-05
161,2,"16:49",1009,1009,"Keith Smith Steal.",42,32,10,0.970031466573472,"Davidson","VMI",2,4,0,0,26,400988702,2017-12-05
162,2,"16:49",1009,1009,"Foul on Kellan Grady.",42,32,10,0.970031466573472,"Davidson","VMI",2,4,0,0,26,400988702,2017-12-05
163,2,"16:32",992,992,"Austin Vereen missed Layup.",42,32,10,0.969308024286488,"Davidson","VMI",2,4,0,0,26,400988702,2017-12-05
164,2,"16:32",992,992,"Kellan Grady Defensive Rebound.",42,32,10,0.969308024286488,"Davidson","VMI",2,4,0,0,26,400988702,2017-12-05
165,2,"16:00",960,960,"Peyton Aldridge missed Three Point Jumper.",42,32,10,0.968427156786764,"Davidson","VMI",2,4,0,0,26,400988702,2017-12-05
166,2,"16:00",960,960,"Tyler Creammer Defensive Rebound.",42,32,10,0.968427156786764,"Davidson","VMI",2,4,0,0,26,400988702,2017-12-05
167,2,"15:48",948,948,"Sarju Patel missed Jumper.",42,32,10,0.975924011698198,"Davidson","VMI",2,4,0,0,26,400988702,2017-12-05
168,2,"15:48",948,948,"Peyton Aldridge Defensive Rebound.",42,32,10,0.975924011698198,"Davidson","VMI",2,4,0,0,26,400988702,2017-12-05
169,2,"15:30",930,930,"Will Magarity missed Three Point Jumper.",42,32,10,0.972039606961377,"Davidson","VMI",2,4,0,0,26,400988702,2017-12-05
170,2,"15:30",930,930,"Rusty Reigel Offensive Rebound.",42,32,10,0.972039606961377,"Davidson","VMI",2,4,0,0,26,400988702,2017-12-05
171,2,"15:26",926,926,"Jon Axel Gudmundsson missed Three Point Jumper.",42,32,10,0.969666460985932,"Davidson","VMI",2,4,0,0,26,400988702,2017-12-05
172,2,"15:26",926,926,"Austin Vereen Defensive Rebound.",42,32,10,0.969666460985932,"Davidson","VMI",2,4,0,0,26,400988702,2017-12-05
173,2,"15:10",910,910,"Bubba Parham missed Jumper.",42,32,10,0.976551020247263,"Davidson","VMI",2,4,0,0,26,400988702,2017-12-05
174,2,"15:10",910,910,"Peyton Aldridge Defensive Rebound.",42,32,10,0.976551020247263,"Davidson","VMI",2,4,0,0,26,400988702,2017-12-05
175,2,"15:03",903,903,"Jon Axel Gudmundsson made Layup.",44,32,12,0.980013294447833,"Davidson","VMI",2,4,0,0,26,400988702,2017-12-05
176,2,"14:48",888,888,"Foul on Kellan Grady.",44,32,12,0.974985375018427,"Davidson","VMI",2,4,0,1,26,400988702,2017-12-05
177,2,"14:48",888,888,"VMI  Timeout",44,32,12,0.974985375018427,"Davidson","VMI",2,3,0,1,26,400988702,2017-12-05
178,2,"14:48",888,888,"Keith Smith missed Free Throw.",44,32,12,0.974985375018427,"Davidson","VMI",2,3,0,1,26,400988702,2017-12-05
179,2,"14:48",888,888,"VMI Deadball Team Rebound.",44,32,12,0.974985375018427,"Davidson","VMI",2,3,0,1,26,400988702,2017-12-05
180,2,"14:48",888,888,"Keith Smith made Free Throw.",44,33,11,0.970376249173376,"Davidson","VMI",2,3,0,1,26,400988702,2017-12-05
181,2,"14:19",859,859,"Peyton Aldridge missed Three Point Jumper.",44,33,11,0.980030589313322,"Davidson","VMI",2,3,0,1,26,400988702,2017-12-05
182,2,"14:19",859,859,"Tyler Creammer Defensive Rebound.",44,33,11,0.980030589313322,"Davidson","VMI",2,3,0,1,26,400988702,2017-12-05
183,2,"14:07",847,847,"Austin Vereen missed Three Point Jumper.",44,33,11,0.979884786935707,"Davidson","VMI",2,3,0,1,26,400988702,2017-12-05
184,2,"14:07",847,847,"Kellan Grady Defensive Rebound.",44,33,11,0.979884786935707,"Davidson","VMI",2,3,0,1,26,400988702,2017-12-05
185,2,"13:59",839,839,"Kellan Grady missed Layup.",44,33,11,0.982635538302841,"Davidson","VMI",2,3,0,1,26,400988702,2017-12-05
186,2,"13:59",839,839,"Peyton Aldridge Offensive Rebound.",44,33,11,0.982635538302841,"Davidson","VMI",2,3,0,1,26,400988702,2017-12-05
187,2,"13:57",837,837,"Peyton Aldridge made Layup.",46,33,13,0.988437013568184,"Davidson","VMI",2,3,0,1,26,400988702,2017-12-05
188,2,"13:37",817,817,"Tyler Creammer made Jumper.",46,35,11,0.978524785774883,"Davidson","VMI",2,3,0,0,26,400988702,2017-12-05
189,2,"13:16",796,796,"Jon Axel Gudmundsson missed Three Point Jumper.",46,35,11,0.981751135146552,"Davidson","VMI",2,3,0,0,26,400988702,2017-12-05
190,2,"13:16",796,796,"VMI Defensive Rebound.",46,35,11,0.981751135146552,"Davidson","VMI",2,3,0,0,26,400988702,2017-12-05
191,2,"12:41",761,761,"VMI  Turnover.",46,35,11,0.983691966629512,"Davidson","VMI",2,3,0,0,26,400988702,2017-12-05
192,2,"12:25",745,745,"Jon Axel Gudmundsson made Three Point Jumper. Assisted by Peyton Aldridge.",49,35,14,0.990626015021392,"Davidson","VMI",2,3,0,0,26,400988702,2017-12-05
