"play_id","half","time_remaining_half","secs_remaining","secs_remaining_absolute","description","home_score","away_score","score_diff","win_prob","home","away","home_time_out_remaining","away_time_out_remaining","home_timeout_ind","away_timeout_ind","home_favored_by","game_id","date"
1,1,"20:00",2400,2400,"PLAY",0,0,0,0.670974856387565,"Texas","Oklahoma",4,4,0,0,3,400989223,2018-02-03
2,1,"20:00",2400,2400,"Jump Ball won by Texas",0,0,0,0.670974856387565,"Texas","Oklahoma",4,4,0,0,3,400989223,2018-02-03
3,1,"19:46",2386,2386,"Jase Febres missed Three Point Jumper.",0,0,0,0.66895160869708,"Texas","Oklahoma",4,4,0,0,3,400989223,2018-02-03
4,1,"19:46",2386,2386,"Brady Manek Defensive Rebound.",0,0,0,0.66895160869708,"Texas","Oklahoma",4,4,0,0,3,400989223,2018-02-03
5,1,"19:18",2358,2358,"Rashard Odomes missed Jumper.",0,0,0,0.679594260316177,"Texas","Oklahoma",4,4,0,0,3,400989223,2018-02-03
6,1,"19:18",2358,2358,"Kerwin Roach II Defensive Rebound.",0,0,0,0.679594260316177,"Texas","Oklahoma",4,4,0,0,3,400989223,2018-02-03
7,1,"19:14",2354,2354,"Kerwin Roach II Turnover.",0,0,0,0.679594260316177,"Texas","Oklahoma",4,4,0,0,3,400989223,2018-02-03
8,1,"19:14",2354,2354,"Khadeem Lattin Steal.",0,0,0,0.679594260316177,"Texas","Oklahoma",4,4,0,0,3,400989223,2018-02-03
9,1,"19:09",2349,2349,"Brady Manek made Dunk. Assisted by Trae Young.",0,2,-2,0.61956669216188,"Texas","Oklahoma",4,4,0,0,3,400989223,2018-02-03
10,1,"18:53",2333,2333,"Kerwin Roach II made Three Point Jumper. Assisted by Matt Coleman.",3,2,1,0.687491465040325,"Texas","Oklahoma",4,4,0,0,3,400989223,2018-02-03
11,1,"18:40",2320,2320,"Khadeem Lattin missed Jumper.",3,2,1,0.699253543523718,"Texas","Oklahoma",4,4,0,0,3,400989223,2018-02-03
12,1,"18:40",2320,2320,"Christian James Offensive Rebound.",3,2,1,0.699253543523718,"Texas","Oklahoma",4,4,0,0,3,400989223,2018-02-03
13,1,"18:32",2312,2312,"Brady Manek missed Three Point Jumper.",3,2,1,0.674632478773621,"Texas","Oklahoma",4,4,0,0,3,400989223,2018-02-03
14,1,"18:32",2312,2312,"Rashard Odomes Offensive Rebound.",3,2,1,0.674632478773621,"Texas","Oklahoma",4,4,0,0,3,400989223,2018-02-03
15,1,"18:25",2305,2305,"Trae Young made Three Point Jumper.",3,5,-2,0.609182505775818,"Texas","Oklahoma",4,4,0,0,3,400989223,2018-02-03
16,1,"18:02",2282,2282,"Matt Coleman made Three Point Jumper. Assisted by Jase Febres.",6,5,1,0.681619251943131,"Texas","Oklahoma",4,4,0,0,3,400989223,2018-02-03
17,1,"17:46",2266,2266,"Christian James missed Jumper.",6,5,1,0.697166918122197,"Texas","Oklahoma",4,4,0,0,3,400989223,2018-02-03
18,1,"17:46",2266,2266,"Jase Febres Defensive Rebound.",6,5,1,0.697166918122197,"Texas","Oklahoma",4,4,0,0,3,400989223,2018-02-03
19,1,"17:36",2256,2256,"Foul on Khadeem Lattin.",6,5,1,0.684724035172025,"Texas","Oklahoma",4,4,0,0,3,400989223,2018-02-03
20,1,"17:36",2256,2256,"Mohamed Bamba made Free Throw.",7,5,2,0.705177787061054,"Texas","Oklahoma",4,4,0,0,3,400989223,2018-02-03
21,1,"17:36",2256,2256,"Mohamed Bamba made Free Throw.",8,5,3,0.724837834075943,"Texas","Oklahoma",4,4,0,0,3,400989223,2018-02-03
22,1,"17:17",2237,2237,"Khadeem Lattin missed Jumper.",8,5,3,0.73455044760074,"Texas","Oklahoma",4,4,0,0,3,400989223,2018-02-03
23,1,"17:17",2237,2237,"Eric Davis Jr. Defensive Rebound.",8,5,3,0.73455044760074,"Texas","Oklahoma",4,4,0,0,3,400989223,2018-02-03
24,1,"17:05",2225,2225,"Foul on Kerwin Roach II.",8,5,3,0.730408276482647,"Texas","Oklahoma",4,4,0,0,3,400989223,2018-02-03
25,1,"17:05",2225,2225,"Kerwin Roach II Turnover.",8,5,3,0.730408276482647,"Texas","Oklahoma",4,4,0,0,3,400989223,2018-02-03
26,1,"16:50",2210,2210,"Trae Young made Jumper.",8,7,1,0.695512110637509,"Texas","Oklahoma",4,4,0,0,3,400989223,2018-02-03
27,1,"16:33",2193,2193,"Dylan Osetkowski missed Jumper.",8,7,1,0.699212528524584,"Texas","Oklahoma",4,4,0,0,3,400989223,2018-02-03
28,1,"16:33",2193,2193,"Khadeem Lattin Block.",8,7,1,0.699212528524584,"Texas","Oklahoma",4,4,0,0,3,400989223,2018-02-03
29,1,"16:33",2193,2193,"Khadeem Lattin Defensive Rebound.",8,7,1,0.699212528524584,"Texas","Oklahoma",4,4,0,0,3,400989223,2018-02-03
30,1,"16:26",2186,2186,"Rashard Odomes made Dunk. Assisted by Trae Young.",8,9,-1,0.637847088403166,"Texas","Oklahoma",4,4,0,0,3,400989223,2018-02-03
31,1,"16:10",2170,2170,"Mohamed Bamba missed Three Point Jumper.",8,9,-1,0.63094652451124,"Texas","Oklahoma",4,4,0,0,3,400989223,2018-02-03
32,1,"16:10",2170,2170,"Dylan Osetkowski Offensive Rebound.",8,9,-1,0.63094652451124,"Texas","Oklahoma",4,4,0,0,3,400989223,2018-02-03
33,1,"16:08",2168,2168,"Foul on Khadeem Lattin.",8,9,-1,0.633255110173857,"Texas","Oklahoma",4,4,0,0,3,400989223,2018-02-03
34,1,"15:56",2156,2156,"Matt Coleman made Jumper.",10,9,1,0.678121457777108,"Texas","Oklahoma",4,4,0,0,3,400989223,2018-02-03
35,1,"15:38",2138,2138,"Trae Young missed Three Point Jumper.",10,9,1,0.684804983105743,"Texas","Oklahoma",4,4,0,0,3,400989223,2018-02-03
36,1,"15:38",2138,2138,"Mohamed Bamba Defensive Rebound.",10,9,1,0.684804983105743,"Texas","Oklahoma",4,4,0,0,3,400989223,2018-02-03
37,1,"15:31",2131,2131,"Matt Coleman missed Three Point Jumper.",10,9,1,0.684804983105743,"Texas","Oklahoma",4,4,0,0,3,400989223,2018-02-03
38,1,"15:31",2131,2131,"Rashard Odomes Defensive Rebound.",10,9,1,0.684804983105743,"Texas","Oklahoma",4,4,0,0,3,400989223,2018-02-03
39,1,"15:18",2118,2118,"Christian James made Three Point Jumper. Assisted by Trae Young.",10,12,-2,0.604388317998401,"Texas","Oklahoma",4,4,0,0,3,400989223,2018-02-03
40,1,"14:49",2089,2089,"Eric Davis Jr. missed Three Point Jumper.",10,12,-2,0.609683285349779,"Texas","Oklahoma",4,4,0,0,3,400989223,2018-02-03
41,1,"14:49",2089,2089,"Mohamed Bamba Offensive Rebound.",10,12,-2,0.609683285349779,"Texas","Oklahoma",4,4,0,0,3,400989223,2018-02-03
42,1,"14:44",2084,2084,"Mohamed Bamba made Layup.",12,12,0,0.660573014392563,"Texas","Oklahoma",4,4,0,0,3,400989223,2018-02-03
43,1,"14:33",2073,2073,"Trae Young missed Three Point Jumper.",12,12,0,0.654165564524546,"Texas","Oklahoma",4,4,0,0,3,400989223,2018-02-03
44,1,"14:33",2073,2073,"Jase Febres Defensive Rebound.",12,12,0,0.654165564524546,"Texas","Oklahoma",4,4,0,0,3,400989223,2018-02-03
45,1,"14:05",2045,2045,"Eric Davis Jr. missed Three Point Jumper.",12,12,0,0.643010170350403,"Texas","Oklahoma",4,4,0,0,3,400989223,2018-02-03
46,1,"14:05",2045,2045,"Christian James Defensive Rebound.",12,12,0,0.643010170350403,"Texas","Oklahoma",4,4,0,0,3,400989223,2018-02-03
47,1,"13:58",2038,2038,"Jamuni McNeace made Dunk. Assisted by Trae Young.",12,14,-2,0.617680594352554,"Texas","Oklahoma",4,4,0,0,3,400989223,2018-02-03
48,1,"13:38",2018,2018,"Dylan Osetkowski missed Jumper.",12,14,-2,0.606545804785622,"Texas","Oklahoma",4,4,0,0,3,400989223,2018-02-03
49,1,"13:38",2018,2018,"Jamuni McNeace Defensive Rebound.",12,14,-2,0.606545804785622,"Texas","Oklahoma",4,4,0,0,3,400989223,2018-02-03
50,1,"13:30",2010,2010,"Christian James missed Three Point Jumper.",12,14,-2,0.606545804785622,"Texas","Oklahoma",4,4,0,0,3,400989223,2018-02-03
51,1,"13:30",2010,2010,"Jamuni McNeace Offensive Rebound.",12,14,-2,0.606545804785622,"Texas","Oklahoma",4,4,0,0,3,400989223,2018-02-03
52,1,"13:22",2002,2002,"Jamuni McNeace made Jumper.",12,16,-4,0.544315464247575,"Texas","Oklahoma",4,4,0,0,3,400989223,2018-02-03
53,1,"13:05",1985,1985,"Dylan Osetkowski missed Jumper.",12,16,-4,0.51984848156113,"Texas","Oklahoma",4,4,0,0,3,400989223,2018-02-03
54,1,"13:05",1985,1985,"Jamuni McNeace Defensive Rebound.",12,16,-4,0.51984848156113,"Texas","Oklahoma",4,4,0,0,3,400989223,2018-02-03
55,1,"12:48",1968,1968,"Jamuni McNeace Turnover.",12,16,-4,0.552494777408677,"Texas","Oklahoma",4,4,0,0,3,400989223,2018-02-03
56,1,"12:48",1968,1968,"Official TV Timeout",12,16,-4,0.552494777408677,"Texas","Oklahoma",4,4,0,0,3,400989223,2018-02-03
57,1,"12:25",1945,1945,"Jericho Sims missed Jumper.",12,16,-4,0.529355989092138,"Texas","Oklahoma",4,4,0,0,3,400989223,2018-02-03
58,1,"12:25",1945,1945,"Dylan Osetkowski Offensive Rebound.",12,16,-4,0.529355989092138,"Texas","Oklahoma",4,4,0,0,3,400989223,2018-02-03
59,1,"12:25",1945,1945,"Dylan Osetkowski made Two Point Tip Shot.",14,16,-2,0.591506030000211,"Texas","Oklahoma",4,4,0,0,3,400989223,2018-02-03
60,1,"12:10",1930,1930,"Kameron McGusty missed Jumper.",14,16,-2,0.580851974489716,"Texas","Oklahoma",4,4,0,0,3,400989223,2018-02-03
61,1,"12:10",1930,1930,"Christian James Offensive Rebound.",14,16,-2,0.580851974489716,"Texas","Oklahoma",4,4,0,0,3,400989223,2018-02-03
62,1,"12:06",1926,1926,"Christian James made Layup.",14,18,-4,0.526614056487391,"Texas","Oklahoma",4,4,0,0,3,400989223,2018-02-03
63,1,"11:37",1897,1897,"Eric Davis Jr. made Three Point Jumper. Assisted by Kerwin Roach II.",17,18,-1,0.624547710603537,"Texas","Oklahoma",4,4,0,0,3,400989223,2018-02-03
64,1,"11:25",1885,1885,"Jamuni McNeace made Dunk. Assisted by Trae Young.",17,20,-3,0.5582738459867,"Texas","Oklahoma",4,4,0,0,3,400989223,2018-02-03
65,1,"11:00",1860,1860,"Jericho Sims Turnover.",17,20,-3,0.564505514971275,"Texas","Oklahoma",4,4,0,0,3,400989223,2018-02-03
66,1,"10:58",1858,1858,"Official TV Timeout",17,20,-3,0.563733522918107,"Texas","Oklahoma",4,4,0,0,3,400989223,2018-02-03
67,1,"10:30",1830,1830,"Jamuni McNeace made Jumper.",17,22,-5,0.497077342113799,"Texas","Oklahoma",4,4,0,0,3,400989223,2018-02-03
68,1,"10:22",1822,1822,"Matt Coleman missed Layup.",17,22,-5,0.526201928519999,"Texas","Oklahoma",4,4,0,0,3,400989223,2018-02-03
69,1,"10:22",1822,1822,"Kristian Doolittle Defensive Rebound.",17,22,-5,0.526201928519999,"Texas","Oklahoma",4,4,0,0,3,400989223,2018-02-03
70,1,"10:15",1815,1815,"Jamuni McNeace made Dunk. Assisted by Trae Young.",17,24,-7,0.414461902384763,"Texas","Oklahoma",4,4,0,0,3,400989223,2018-02-03
71,1,"10:12",1812,1812,"Texas  Timeout",17,24,-7,0.414461902384763,"Texas","Oklahoma",3,4,1,0,3,400989223,2018-02-03
72,1,"9:44",1784,1784,"Mohamed Bamba missed Jumper.",17,24,-7,0.389822541797013,"Texas","Oklahoma",3,4,1,0,3,400989223,2018-02-03
73,1,"9:44",1784,1784,"Texas Offensive Rebound.",17,24,-7,0.389822541797013,"Texas","Oklahoma",3,4,1,0,3,400989223,2018-02-03
74,1,"9:42",1782,1782,"Foul on Kristian Doolittle.",17,24,-7,0.389822541797013,"Texas","Oklahoma",3,4,1,0,3,400989223,2018-02-03
75,1,"9:27",1767,1767,"Matt Coleman missed Three Point Jumper.",17,24,-7,0.432914989501929,"Texas","Oklahoma",3,4,1,0,3,400989223,2018-02-03
76,1,"9:27",1767,1767,"Jamuni McNeace Defensive Rebound.",17,24,-7,0.432914989501929,"Texas","Oklahoma",3,4,1,0,3,400989223,2018-02-03
77,1,"9:10",1750,1750,"Kameron McGusty Turnover.",17,24,-7,0.387513142179581,"Texas","Oklahoma",3,4,0,0,3,400989223,2018-02-03
78,1,"8:51",1731,1731,"Mohamed Bamba Turnover.",17,24,-7,0.412801019425552,"Texas","Oklahoma",3,4,0,0,3,400989223,2018-02-03
79,1,"8:51",1731,1731,"Jamuni McNeace Steal.",17,24,-7,0.412801019425552,"Texas","Oklahoma",3,4,0,0,3,400989223,2018-02-03
80,1,"8:48",1728,1728,"Rashard Odomes made Dunk. Assisted by Trae Young.",17,26,-9,0.353226059878204,"Texas","Oklahoma",3,4,0,0,3,400989223,2018-02-03
81,1,"8:41",1721,1721,"Kerwin Roach II made Three Point Jumper.",20,26,-6,0.450604330053976,"Texas","Oklahoma",3,4,0,0,3,400989223,2018-02-03
82,1,"8:24",1704,1704,"Jamuni McNeace missed Jumper.",20,26,-6,0.448430204126396,"Texas","Oklahoma",3,4,0,0,3,400989223,2018-02-03
83,1,"8:24",1704,1704,"Jamuni McNeace Offensive Rebound.",20,26,-6,0.448430204126396,"Texas","Oklahoma",3,4,0,0,3,400989223,2018-02-03
84,1,"8:12",1692,1692,"Jamuni McNeace made Jumper.",20,28,-8,0.373038017206668,"Texas","Oklahoma",3,4,0,0,3,400989223,2018-02-03
85,1,"8:07",1687,1687,"Mohamed Bamba made Layup. Assisted by Kerwin Roach II.",22,28,-6,0.436927968015333,"Texas","Oklahoma",3,4,0,0,3,400989223,2018-02-03
86,1,"8:07",1687,1687,"Foul on Jamuni McNeace.",22,28,-6,0.436927968015333,"Texas","Oklahoma",3,4,0,0,3,400989223,2018-02-03
87,1,"8:07",1687,1687,"Mohamed Bamba missed Free Throw.",22,28,-6,0.436927968015333,"Texas","Oklahoma",3,4,0,0,3,400989223,2018-02-03
88,1,"8:07",1687,1687,"Kristian Doolittle Defensive Rebound.",22,28,-6,0.436927968015333,"Texas","Oklahoma",3,4,0,0,3,400989223,2018-02-03
89,1,"7:56",1676,1676,"Trae Young missed Jumper.",22,28,-6,0.445317709277936,"Texas","Oklahoma",3,4,0,0,3,400989223,2018-02-03
90,1,"7:56",1676,1676,"Mohamed Bamba Defensive Rebound.",22,28,-6,0.445317709277936,"Texas","Oklahoma",3,4,0,0,3,400989223,2018-02-03
91,1,"7:42",1662,1662,"Official TV Timeout",22,28,-6,0.454539316511902,"Texas","Oklahoma",3,4,0,0,3,400989223,2018-02-03
92,1,"7:32",1652,1652,"Dylan Osetkowski missed Jumper.",22,28,-6,0.453033688116674,"Texas","Oklahoma",3,4,0,0,3,400989223,2018-02-03
93,1,"7:32",1652,1652,"Kristian Doolittle Defensive Rebound.",22,28,-6,0.453033688116674,"Texas","Oklahoma",3,4,0,0,3,400989223,2018-02-03
94,1,"7:22",1642,1642,"Ty Lazenby made Layup. Assisted by Trae Young.",22,30,-8,0.379516210329129,"Texas","Oklahoma",3,4,0,0,3,400989223,2018-02-03
95,1,"7:14",1634,1634,"Dylan Osetkowski missed Three Point Jumper.",22,30,-8,0.395955638542324,"Texas","Oklahoma",3,4,0,0,3,400989223,2018-02-03
96,1,"7:14",1634,1634,"Jericho Sims Offensive Rebound.",22,30,-8,0.395955638542324,"Texas","Oklahoma",3,4,0,0,3,400989223,2018-02-03
97,1,"7:04",1624,1624,"Jericho Sims Turnover.",22,30,-8,0.363171241939174,"Texas","Oklahoma",3,4,0,0,3,400989223,2018-02-03
98,1,"7:04",1624,1624,"Trae Young Steal.",22,30,-8,0.363171241939174,"Texas","Oklahoma",3,4,0,0,3,400989223,2018-02-03
99,1,"7:02",1622,1622,"Brady Manek missed Three Point Jumper.",22,30,-8,0.363171241939174,"Texas","Oklahoma",3,4,0,0,3,400989223,2018-02-03
100,1,"7:02",1622,1622,"Mohamed Bamba Defensive Rebound.",22,30,-8,0.363171241939174,"Texas","Oklahoma",3,4,0,0,3,400989223,2018-02-03
101,1,"7:02",1622,1622,"Foul on Kristian Doolittle.",22,30,-8,0.363171241939174,"Texas","Oklahoma",3,4,0,0,3,400989223,2018-02-03
102,1,"6:43",1603,1603,"Dylan Osetkowski made Jumper.",24,30,-6,0.446160976899351,"Texas","Oklahoma",3,4,0,0,3,400989223,2018-02-03
103,1,"6:40",1600,1600,"Flagrant Foul on Dylan Osetkowski.",24,30,-6,0.446160976899351,"Texas","Oklahoma",3,4,0,0,3,400989223,2018-02-03
104,1,"6:40",1600,1600,"Jamuni McNeace missed Free Throw.",24,30,-6,0.446160976899351,"Texas","Oklahoma",3,4,0,0,3,400989223,2018-02-03
105,1,"6:40",1600,1600,"Oklahoma Deadball Team Rebound.",24,30,-6,0.446160976899351,"Texas","Oklahoma",3,4,0,0,3,400989223,2018-02-03
106,1,"6:40",1600,1600,"Jamuni McNeace missed Free Throw.",24,30,-6,0.446160976899351,"Texas","Oklahoma",3,4,0,0,3,400989223,2018-02-03
107,1,"6:40",1600,1600,"Oklahoma Deadball Team Rebound.",24,30,-6,0.446160976899351,"Texas","Oklahoma",3,4,0,0,3,400989223,2018-02-03
108,1,"6:33",1593,1593,"Brady Manek missed Three Point Jumper.",24,30,-6,0.454390850151556,"Texas","Oklahoma",3,4,0,0,3,400989223,2018-02-03
109,1,"6:33",1593,1593,"Kerwin Roach II Defensive Rebound.",24,30,-6,0.454390850151556,"Texas","Oklahoma",3,4,0,0,3,400989223,2018-02-03
110,1,"6:20",1580,1580,"Kerwin Roach II Turnover.",24,30,-6,0.431829432890935,"Texas","Oklahoma",3,4,0,0,3,400989223,2018-02-03
111,1,"6:17",1577,1577,"Trae Young missed Three Point Jumper.",24,30,-6,0.41892901267429,"Texas","Oklahoma",3,4,0,0,3,400989223,2018-02-03
112,1,"6:17",1577,1577,"Brady Manek Offensive Rebound.",24,30,-6,0.41892901267429,"Texas","Oklahoma",3,4,0,0,3,400989223,2018-02-03
113,1,"6:17",1577,1577,"Brady Manek made Dunk.",24,32,-8,0.345824478536256,"Texas","Oklahoma",3,4,0,0,3,400989223,2018-02-03
114,1,"6:09",1569,1569,"Foul on Rashard Odomes.",24,32,-8,0.352075036445972,"Texas","Oklahoma",3,4,0,0,3,400989223,2018-02-03
115,1,"5:54",1554,1554,"Eric Davis Jr. made Three Point Jumper. Assisted by Kerwin Roach II.",27,32,-5,0.454520800063915,"Texas","Oklahoma",3,4,0,0,3,400989223,2018-02-03
116,1,"5:34",1534,1534,"Jamuni McNeace Turnover.",27,32,-5,0.475335667091826,"Texas","Oklahoma",3,4,0,0,3,400989223,2018-02-03
117,1,"5:14",1514,1514,"Foul on Trae Young.",27,32,-5,0.46714009579211,"Texas","Oklahoma",3,4,0,0,3,400989223,2018-02-03
118,1,"5:14",1514,1514,"Jericho Sims made Free Throw.",28,32,-4,0.50520938045711,"Texas","Oklahoma",3,4,0,0,3,400989223,2018-02-03
119,1,"5:14",1514,1514,"Jericho Sims missed Free Throw.",28,32,-4,0.50520938045711,"Texas","Oklahoma",3,4,0,0,3,400989223,2018-02-03
120,1,"5:14",1514,1514,"Brady Manek Defensive Rebound.",28,32,-4,0.50520938045711,"Texas","Oklahoma",3,4,0,0,3,400989223,2018-02-03
121,1,"5:03",1503,1503,"Trae Young missed Three Point Jumper.",28,32,-4,0.500250753399839,"Texas","Oklahoma",3,4,0,0,3,400989223,2018-02-03
122,1,"5:03",1503,1503,"Oklahoma Offensive Rebound.",28,32,-4,0.500250753399839,"Texas","Oklahoma",3,4,0,0,3,400989223,2018-02-03
123,1,"4:56",1496,1496,"Christian James missed Three Point Jumper.",28,32,-4,0.522358639909982,"Texas","Oklahoma",3,4,0,0,3,400989223,2018-02-03
124,1,"4:56",1496,1496,"Matt Coleman Defensive Rebound.",28,32,-4,0.522358639909982,"Texas","Oklahoma",3,4,0,0,3,400989223,2018-02-03
125,1,"4:47",1487,1487,"Matt Coleman Turnover.",28,32,-4,0.483839992437757,"Texas","Oklahoma",3,4,0,0,3,400989223,2018-02-03
126,1,"4:44",1484,1484,"Rashard Odomes made Layup. Assisted by Trae Young.",28,34,-6,0.409764541399469,"Texas","Oklahoma",3,4,0,0,3,400989223,2018-02-03
127,1,"4:27",1467,1467,"Eric Davis Jr. missed Three Point Jumper.",28,34,-6,0.435930191026965,"Texas","Oklahoma",3,4,0,0,3,400989223,2018-02-03
128,1,"4:27",1467,1467,"Rashard Odomes Defensive Rebound.",28,34,-6,0.435930191026965,"Texas","Oklahoma",3,4,0,0,3,400989223,2018-02-03
129,1,"4:17",1457,1457,"Brady Manek Turnover.",28,34,-6,0.411200785126387,"Texas","Oklahoma",3,4,0,0,3,400989223,2018-02-03
130,1,"4:03",1443,1443,"Mohamed Bamba missed Jumper.",28,34,-6,0.436244109489724,"Texas","Oklahoma",3,4,0,0,3,400989223,2018-02-03
131,1,"4:03",1443,1443,"Christian James Defensive Rebound.",28,34,-6,0.436244109489724,"Texas","Oklahoma",3,4,0,0,3,400989223,2018-02-03
132,1,"3:53",1433,1433,"Trae Young missed Jumper.",28,34,-6,0.424605159403257,"Texas","Oklahoma",3,4,0,0,3,400989223,2018-02-03
133,1,"3:53",1433,1433,"Dylan Osetkowski Defensive Rebound.",28,34,-6,0.424605159403257,"Texas","Oklahoma",3,4,0,0,3,400989223,2018-02-03
134,1,"3:21",1401,1401,"Eric Davis Jr. Turnover.",28,34,-6,0.424852600364455,"Texas","Oklahoma",3,4,0,0,3,400989223,2018-02-03
135,1,"3:21",1401,1401,"Official TV Timeout",28,34,-6,0.424852600364455,"Texas","Oklahoma",3,4,0,0,3,400989223,2018-02-03
136,1,"3:11",1391,1391,"Foul on Matt Coleman.",28,34,-6,0.406440840387111,"Texas","Oklahoma",3,4,0,0,3,400989223,2018-02-03
137,1,"3:05",1385,1385,"Trae Young missed Three Point Jumper.",28,34,-6,0.426931857463233,"Texas","Oklahoma",3,4,0,0,3,400989223,2018-02-03
138,1,"3:05",1385,1385,"Mohamed Bamba Defensive Rebound.",28,34,-6,0.426931857463233,"Texas","Oklahoma",3,4,0,0,3,400989223,2018-02-03
139,1,"2:44",1364,1364,"Dylan Osetkowski made Three Point Jumper. Assisted by Matt Coleman.",31,34,-3,0.52379144824383,"Texas","Oklahoma",3,4,0,0,3,400989223,2018-02-03
140,1,"2:27",1347,1347,"Trae Young Turnover.",31,34,-3,0.509315557775638,"Texas","Oklahoma",3,4,0,0,3,400989223,2018-02-03
141,1,"2:27",1347,1347,"Kerwin Roach II Steal.",31,34,-3,0.509315557775638,"Texas","Oklahoma",3,4,0,0,3,400989223,2018-02-03
142,1,"2:24",1344,1344,"Kerwin Roach II made Dunk.",33,34,-1,0.58737892348757,"Texas","Oklahoma",3,4,0,0,3,400989223,2018-02-03
143,1,"2:07",1327,1327,"Christian James Turnover.",33,34,-1,0.595659370262954,"Texas","Oklahoma",3,4,0,0,3,400989223,2018-02-03
144,1,"1:44",1304,1304,"Matt Coleman Turnover.",33,34,-1,0.597345269953131,"Texas","Oklahoma",3,4,0,0,3,400989223,2018-02-03
145,1,"1:29",1289,1289,"Rashard Odomes made Layup.",33,36,-3,0.527155442913412,"Texas","Oklahoma",3,4,0,0,3,400989223,2018-02-03
146,1,"1:02",1262,1262,"Mohamed Bamba missed Jumper.",33,36,-3,0.535361209522499,"Texas","Oklahoma",3,4,0,0,3,400989223,2018-02-03
147,1,"1:02",1262,1262,"Oklahoma Defensive Rebound.",33,36,-3,0.535361209522499,"Texas","Oklahoma",3,4,0,0,3,400989223,2018-02-03
148,1,"0:52",1252,1252,"Rashard Odomes made Layup.",33,38,-5,0.438649259179097,"Texas","Oklahoma",3,4,0,0,3,400989223,2018-02-03
149,1,"0:28",1228,1228,"Foul on Brady Manek.",33,38,-5,0.428017166095358,"Texas","Oklahoma",3,4,0,0,3,400989223,2018-02-03
150,1,"0:28",1228,1228,"Dylan Osetkowski made Free Throw.",34,38,-4,0.469742999524661,"Texas","Oklahoma",3,4,0,0,3,400989223,2018-02-03
151,1,"0:28",1228,1228,"Dylan Osetkowski made Free Throw.",35,38,-3,0.511896144017701,"Texas","Oklahoma",3,4,0,0,3,400989223,2018-02-03
152,1,"0:25",1225,1225,"Jamuni McNeace made Dunk. Assisted by Rashard Odomes.",35,40,-5,0.428017166095358,"Texas","Oklahoma",3,4,0,0,3,400989223,2018-02-03
153,1,"0:02",1202,1202,"Dylan Osetkowski missed Three Point Jumper.",35,40,-5,0.433818790632646,"Texas","Oklahoma",3,4,0,0,3,400989223,2018-02-03
154,1,"0:02",1202,1202,"Rashard Odomes Defensive Rebound.",35,40,-5,0.433818790632646,"Texas","Oklahoma",3,4,0,0,3,400989223,2018-02-03
155,1,"0:00",1200,1200,"End of 1st half",35,40,-5,0.433818790632646,"Texas","Oklahoma",3,4,0,0,3,400989223,2018-02-03
156,2,"20:00",1200,1200,"PLAY",35,40,-5,0.433818790632646,"Texas","Oklahoma",4,4,0,0,3,400989223,2018-02-03
157,2,"20:00",1200,1200,"Jump Ball won by Oklahoma",35,40,-5,0.433818790632646,"Texas","Oklahoma",4,4,0,0,3,400989223,2018-02-03
158,2,"19:40",1180,1180,"Mohamed Bamba made Jumper.",37,40,-3,0.508387710506589,"Texas","Oklahoma",4,4,0,0,3,400989223,2018-02-03
159,2,"19:24",1164,1164,"Trae Young made Three Point Jumper. Assisted by Christian James.",37,43,-6,0.372111932736172,"Texas","Oklahoma",4,4,0,0,3,400989223,2018-02-03
160,2,"18:58",1138,1138,"Jase Febres made Three Point Jumper. Assisted by Kerwin Roach II.",40,43,-3,0.516106926510035,"Texas","Oklahoma",4,4,0,0,3,400989223,2018-02-03
161,2,"18:41",1121,1121,"Foul on Kerwin Roach II.",40,43,-3,0.484577737078856,"Texas","Oklahoma",4,4,0,0,3,400989223,2018-02-03
162,2,"18:39",1119,1119,"Christian James missed Three Point Jumper.",40,43,-3,0.501036634374426,"Texas","Oklahoma",4,4,0,0,3,400989223,2018-02-03
163,2,"18:39",1119,1119,"Mohamed Bamba Defensive Rebound.",40,43,-3,0.501036634374426,"Texas","Oklahoma",4,4,0,0,3,400989223,2018-02-03
164,2,"18:24",1104,1104,"Jase Febres missed Three Point Jumper.",40,43,-3,0.509241077961254,"Texas","Oklahoma",4,4,0,0,3,400989223,2018-02-03
165,2,"18:24",1104,1104,"Trae Young Defensive Rebound.",40,43,-3,0.509241077961254,"Texas","Oklahoma",4,4,0,0,3,400989223,2018-02-03
166,2,"18:11",1091,1091,"Trae Young made Layup.",40,45,-5,0.425775876447799,"Texas","Oklahoma",4,4,0,0,3,400989223,2018-02-03
167,2,"17:45",1065,1065,"Kerwin Roach II missed Three Point Jumper.",40,45,-5,0.424704838373027,"Texas","Oklahoma",4,4,0,0,3,400989223,2018-02-03
168,2,"17:45",1065,1065,"Trae Young Defensive Rebound.",40,45,-5,0.424704838373027,"Texas","Oklahoma",4,4,0,0,3,400989223,2018-02-03
169,2,"17:32",1052,1052,"Foul on Matt Coleman.",40,45,-5,0.410864884125398,"Texas","Oklahoma",4,4,0,0,3,400989223,2018-02-03
170,2,"17:28",1048,1048,"Khadeem Lattin made Dunk. Assisted by Trae Young.",40,47,-7,0.343220856967382,"Texas","Oklahoma",4,4,0,0,3,400989223,2018-02-03
171,2,"17:12",1032,1032,"Kerwin Roach II Turnover.",40,47,-7,0.328958399723653,"Texas","Oklahoma",4,4,0,0,3,400989223,2018-02-03
172,2,"17:12",1032,1032,"Khadeem Lattin Steal.",40,47,-7,0.328958399723653,"Texas","Oklahoma",4,4,0,0,3,400989223,2018-02-03
173,2,"17:07",1027,1027,"Trae Young missed Three Point Jumper.",40,47,-7,0.327288302152636,"Texas","Oklahoma",4,4,0,0,3,400989223,2018-02-03
174,2,"17:07",1027,1027,"Rashard Odomes Offensive Rebound.",40,47,-7,0.327288302152636,"Texas","Oklahoma",4,4,0,0,3,400989223,2018-02-03
175,2,"17:06",1026,1026,"Foul on Mohamed Bamba.",40,47,-7,0.327288302152636,"Texas","Oklahoma",4,4,0,0,3,400989223,2018-02-03
176,2,"17:06",1026,1026,"Christian James missed Free Throw.",40,47,-7,0.327288302152636,"Texas","Oklahoma",4,4,0,0,3,400989223,2018-02-03
177,2,"17:06",1026,1026,"Oklahoma Deadball Team Rebound.",40,47,-7,0.327288302152636,"Texas","Oklahoma",4,4,0,0,3,400989223,2018-02-03
178,2,"17:06",1026,1026,"Christian James made Free Throw.",40,48,-8,0.28908788136589,"Texas","Oklahoma",4,4,0,0,3,400989223,2018-02-03
179,2,"16:47",1007,1007,"Dylan Osetkowski missed Jumper.",40,48,-8,0.2571602844405,"Texas","Oklahoma",4,4,0,0,3,400989223,2018-02-03
180,2,"16:47",1007,1007,"Khadeem Lattin Defensive Rebound.",40,48,-8,0.2571602844405,"Texas","Oklahoma",4,4,0,0,3,400989223,2018-02-03
181,2,"16:30",990,990,"Trae Young made Jumper.",40,50,-10,0.207187514687414,"Texas","Oklahoma",4,4,0,0,3,400989223,2018-02-03
182,2,"16:18",978,978,"Texas  Timeout",40,50,-10,0.221110817275078,"Texas","Oklahoma",3,4,1,0,3,400989223,2018-02-03
183,2,"16:11",971,971,"Foul on Khadeem Lattin.",40,50,-10,0.221110817275078,"Texas","Oklahoma",3,4,1,0,3,400989223,2018-02-03
184,2,"16:11",971,971,"Mohamed Bamba made Free Throw.",41,50,-9,0.253625037095369,"Texas","Oklahoma",3,4,1,0,3,400989223,2018-02-03
185,2,"16:11",971,971,"Mohamed Bamba missed Free Throw.",41,50,-9,0.253625037095369,"Texas","Oklahoma",3,4,1,0,3,400989223,2018-02-03
186,2,"16:11",971,971,"Brady Manek Defensive Rebound.",41,50,-9,0.253625037095369,"Texas","Oklahoma",3,4,1,0,3,400989223,2018-02-03
187,2,"15:53",953,953,"Foul on Christian James.",41,50,-9,0.22168547262971,"Texas","Oklahoma",3,4,1,0,3,400989223,2018-02-03
188,2,"15:53",953,953,"Christian James Turnover.",41,50,-9,0.22168547262971,"Texas","Oklahoma",3,4,1,0,3,400989223,2018-02-03
189,2,"15:53",953,953,"Official TV Timeout",41,50,-9,0.22168547262971,"Texas","Oklahoma",3,4,1,0,3,400989223,2018-02-03
190,2,"15:45",945,945,"Kerwin Roach II missed Layup.",41,50,-9,0.239057312248814,"Texas","Oklahoma",3,4,1,0,3,400989223,2018-02-03
191,2,"15:45",945,945,"Rashard Odomes Defensive Rebound.",41,50,-9,0.239057312248814,"Texas","Oklahoma",3,4,1,0,3,400989223,2018-02-03
