"play_id","half","time_remaining_half","secs_remaining","secs_remaining_absolute","description","home_score","away_score","score_diff","win_prob","home","away","home_time_out_remaining","away_time_out_remaining","home_timeout_ind","away_timeout_ind","home_favored_by","game_id","date"
1,1,"20:00",2400,2400,"PLAY",0,0,0,0.888091376675671,"TCU","Belmont",4,4,0,0,12,400989245,2017-11-29
2,1,"19:43",2383,2383,"Vladimir Brodziansky Turnover.",0,0,0,0.88396822034469,"TCU","Belmont",4,4,0,0,12,400989245,2017-11-29
3,1,"19:42",2382,2382,"Kevin McClain Steal.",0,0,0,0.88396822034469,"TCU","Belmont",4,4,0,0,12,400989245,2017-11-29
4,1,"19:19",2359,2359,"Dylan Windler Turnover.",0,0,0,0.884104285946633,"TCU","Belmont",4,4,0,0,12,400989245,2017-11-29
5,1,"19:19",2359,2359,"Kenrich Williams Steal.",0,0,0,0.884104285946633,"TCU","Belmont",4,4,0,0,12,400989245,2017-11-29
6,1,"19:04",2344,2344,"Vladimir Brodziansky made Layup. Assisted by Jaylen Fisher.",2,0,2,0.890866946170021,"TCU","Belmont",4,4,0,0,12,400989245,2017-11-29
7,1,"18:48",2328,2328,"Dylan Windler made Layup. Assisted by Austin Luke.",2,2,0,0.877809622176733,"TCU","Belmont",4,4,0,0,12,400989245,2017-11-29
8,1,"18:27",2307,2307,"Jaylen Fisher missed Jumper.",2,2,0,0.866445735529355,"TCU","Belmont",4,4,0,0,12,400989245,2017-11-29
9,1,"18:27",2307,2307,"Dylan Windler Defensive Rebound.",2,2,0,0.866445735529355,"TCU","Belmont",4,4,0,0,12,400989245,2017-11-29
10,1,"18:05",2285,2285,"Dylan Windler missed Three Point Jumper.",2,2,0,0.870774895166681,"TCU","Belmont",4,4,0,0,12,400989245,2017-11-29
11,1,"18:05",2285,2285,"JD Miller Defensive Rebound.",2,2,0,0.870774895166681,"TCU","Belmont",4,4,0,0,12,400989245,2017-11-29
12,1,"18:01",2281,2281,"Foul on Amanze Egekeze.",2,2,0,0.870774895166681,"TCU","Belmont",4,4,0,0,12,400989245,2017-11-29
13,1,"17:53",2273,2273,"Kenrich Williams missed Jumper.",2,2,0,0.874606296808075,"TCU","Belmont",4,4,0,0,12,400989245,2017-11-29
14,1,"17:53",2273,2273,"JD Miller Offensive Rebound.",2,2,0,0.874606296808075,"TCU","Belmont",4,4,0,0,12,400989245,2017-11-29
15,1,"17:47",2267,2267,"JD Miller made Jumper.",4,2,2,0.903276482499867,"TCU","Belmont",4,4,0,0,12,400989245,2017-11-29
16,1,"17:30",2250,2250,"Seth Adelsperger made Dunk. Assisted by Kevin McClain.",4,4,0,0.867541873567835,"TCU","Belmont",4,4,0,0,12,400989245,2017-11-29
17,1,"17:16",2236,2236,"Desmond Bane missed Layup.",4,4,0,0.872001912566629,"TCU","Belmont",4,4,0,0,12,400989245,2017-11-29
18,1,"17:16",2236,2236,"Kenrich Williams Offensive Rebound.",4,4,0,0.872001912566629,"TCU","Belmont",4,4,0,0,12,400989245,2017-11-29
19,1,"17:12",2232,2232,"Kenrich Williams missed Layup.",4,4,0,0.872001912566629,"TCU","Belmont",4,4,0,0,12,400989245,2017-11-29
20,1,"17:12",2232,2232,"Seth Adelsperger Block.",4,4,0,0.872001912566629,"TCU","Belmont",4,4,0,0,12,400989245,2017-11-29
21,1,"17:10",2230,2230,"Kenrich Williams Offensive Rebound.",4,4,0,0.872001912566629,"TCU","Belmont",4,4,0,0,12,400989245,2017-11-29
22,1,"17:10",2230,2230,"Foul on Seth Adelsperger.",4,4,0,0.872001912566629,"TCU","Belmont",4,4,0,0,12,400989245,2017-11-29
23,1,"17:00",2220,2220,"JD Miller made Jumper.",6,4,2,0.894437497962422,"TCU","Belmont",4,4,0,0,12,400989245,2017-11-29
24,1,"16:43",2203,2203,"Dylan Windler missed Layup.",6,4,2,0.892938288082628,"TCU","Belmont",4,4,0,0,12,400989245,2017-11-29
25,1,"16:43",2203,2203,"JD Miller Defensive Rebound.",6,4,2,0.892938288082628,"TCU","Belmont",4,4,0,0,12,400989245,2017-11-29
26,1,"16:35",2195,2195,"Vladimir Brodziansky made Three Point Jumper. Assisted by Jaylen Fisher.",9,4,5,0.927402332592065,"TCU","Belmont",4,4,0,0,12,400989245,2017-11-29
27,1,"16:20",2180,2180,"Seth Adelsperger made Layup. Assisted by Austin Luke.",9,6,3,0.901925398259545,"TCU","Belmont",4,4,0,0,12,400989245,2017-11-29
28,1,"16:07",2167,2167,"Vladimir Brodziansky made Three Point Jumper. Assisted by Jaylen Fisher.",12,6,6,0.925767561132888,"TCU","Belmont",4,4,0,0,12,400989245,2017-11-29
29,1,"15:52",2152,2152,"Amanze Egekeze missed Three Point Jumper.",12,6,6,0.929023360054032,"TCU","Belmont",4,4,0,0,12,400989245,2017-11-29
30,1,"15:52",2152,2152,"Vladimir Brodziansky Defensive Rebound.",12,6,6,0.929023360054032,"TCU","Belmont",4,4,0,0,12,400989245,2017-11-29
31,1,"15:40",2140,2140,"Vladimir Brodziansky made Three Point Jumper. Assisted by Kenrich Williams.",15,6,9,0.944226984545972,"TCU","Belmont",4,4,0,0,12,400989245,2017-11-29
32,1,"15:27",2127,2127,"Kevin McClain missed Three Point Jumper.",15,6,9,0.947009296507546,"TCU","Belmont",4,4,0,0,12,400989245,2017-11-29
33,1,"15:27",2127,2127,"JD Miller Defensive Rebound.",15,6,9,0.947009296507546,"TCU","Belmont",4,4,0,0,12,400989245,2017-11-29
34,1,"15:11",2111,2111,"Official TV Timeout",15,6,9,0.952498104018997,"TCU","Belmont",4,4,0,0,12,400989245,2017-11-29
35,1,"14:56",2096,2096,"Alex Robinson missed Three Point Jumper.",15,6,9,0.94858638934687,"TCU","Belmont",4,4,0,0,12,400989245,2017-11-29
36,1,"14:56",2096,2096,"Kenrich Williams Offensive Rebound.",15,6,9,0.94858638934687,"TCU","Belmont",4,4,0,0,12,400989245,2017-11-29
37,1,"14:41",2081,2081,"Alex Robinson missed Jumper.",15,6,9,0.943666708181225,"TCU","Belmont",4,4,0,0,12,400989245,2017-11-29
38,1,"14:41",2081,2081,"TCU Deadball Team Rebound.",15,6,9,0.943666708181225,"TCU","Belmont",4,4,0,0,12,400989245,2017-11-29
39,1,"14:40",2080,2080,"Foul on Mack Mercer.",15,6,9,0.943666708181225,"TCU","Belmont",4,4,0,0,12,400989245,2017-11-29
40,1,"14:20",2060,2060,"Kouat Noi made Layup. Assisted by Alex Robinson.",17,6,11,0.958326592135543,"TCU","Belmont",4,4,0,0,12,400989245,2017-11-29
41,1,"13:59",2039,2039,"Austin Luke made Three Point Jumper. Assisted by Dylan Windler.",17,9,8,0.944966390419859,"TCU","Belmont",4,4,0,0,12,400989245,2017-11-29
42,1,"13:44",2024,2024,"Alex Robinson missed Jumper.",17,9,8,0.94735937044175,"TCU","Belmont",4,4,0,0,12,400989245,2017-11-29
43,1,"13:44",2024,2024,"Dylan Windler Defensive Rebound.",17,9,8,0.94735937044175,"TCU","Belmont",4,4,0,0,12,400989245,2017-11-29
44,1,"13:24",2004,2004,"Austin Luke Turnover.",17,9,8,0.936076326582333,"TCU","Belmont",4,4,0,0,12,400989245,2017-11-29
45,1,"13:23",2003,2003,"Kouat Noi Steal.",17,9,8,0.936076326582333,"TCU","Belmont",4,4,0,0,12,400989245,2017-11-29
46,1,"13:18",1998,1998,"Kenrich Williams missed Three Point Jumper.",17,9,8,0.946906953948406,"TCU","Belmont",4,4,0,0,12,400989245,2017-11-29
47,1,"13:18",1998,1998,"Ahmed Hamdy-Mohamed Offensive Rebound.",17,9,8,0.946906953948406,"TCU","Belmont",4,4,0,0,12,400989245,2017-11-29
48,1,"13:12",1992,1992,"Ahmed Hamdy-Mohamed Turnover.",17,9,8,0.946906953948406,"TCU","Belmont",4,4,0,0,12,400989245,2017-11-29
49,1,"13:11",1991,1991,"Kevin McClain Steal.",17,9,8,0.946906953948406,"TCU","Belmont",4,4,0,0,12,400989245,2017-11-29
50,1,"13:00",1980,1980,"Amanze Egekeze made Layup. Assisted by Austin Luke.",17,11,6,0.921617874250784,"TCU","Belmont",4,4,0,0,12,400989245,2017-11-29
51,1,"12:35",1955,1955,"Ahmed Hamdy-Mohamed missed Layup.",17,11,6,0.9269679477281,"TCU","Belmont",4,4,0,0,12,400989245,2017-11-29
52,1,"12:35",1955,1955,"Mack Mercer Block.",17,11,6,0.9269679477281,"TCU","Belmont",4,4,0,0,12,400989245,2017-11-29
53,1,"12:34",1954,1954,"Kevin McClain Defensive Rebound.",17,11,6,0.9269679477281,"TCU","Belmont",4,4,0,0,12,400989245,2017-11-29
54,1,"12:24",1944,1944,"Kevin McClain missed Three Point Jumper.",17,11,6,0.92763980830578,"TCU","Belmont",4,4,0,0,12,400989245,2017-11-29
55,1,"12:24",1944,1944,"Ahmed Hamdy-Mohamed Defensive Rebound.",17,11,6,0.92763980830578,"TCU","Belmont",4,4,0,0,12,400989245,2017-11-29
56,1,"12:14",1934,1934,"Alex Robinson Turnover.",17,11,6,0.925092965793683,"TCU","Belmont",4,4,0,0,12,400989245,2017-11-29
57,1,"12:13",1933,1933,"Caleb Hollander missed Three Point Jumper.",17,11,6,0.925092965793683,"TCU","Belmont",4,4,0,0,12,400989245,2017-11-29
58,1,"12:13",1933,1933,"Kenrich Williams Defensive Rebound.",17,11,6,0.925092965793683,"TCU","Belmont",4,4,0,0,12,400989245,2017-11-29
59,1,"11:54",1914,1914,"Foul on Dylan Windler.",17,11,6,0.932744234506955,"TCU","Belmont",4,4,0,0,12,400989245,2017-11-29
60,1,"11:54",1914,1914,"Official TV Timeout",17,11,6,0.932744234506955,"TCU","Belmont",4,4,0,0,12,400989245,2017-11-29
61,1,"11:54",1914,1914,"Ahmed Hamdy-Mohamed made Free Throw.",18,11,7,0.940395558733154,"TCU","Belmont",4,4,0,0,12,400989245,2017-11-29
62,1,"11:54",1914,1914,"Ahmed Hamdy-Mohamed made Free Throw.",19,11,8,0.947225682953838,"TCU","Belmont",4,4,0,0,12,400989245,2017-11-29
63,1,"11:34",1894,1894,"Dylan Windler made Layup.",19,13,6,0.928913255265707,"TCU","Belmont",4,4,0,0,12,400989245,2017-11-29
64,1,"11:34",1894,1894,"Foul on Kenrich Williams.",19,13,6,0.928913255265707,"TCU","Belmont",4,4,0,0,12,400989245,2017-11-29
65,1,"11:34",1894,1894,"Dylan Windler made Free Throw.",19,14,5,0.919511433459673,"TCU","Belmont",4,4,0,0,12,400989245,2017-11-29
66,1,"11:27",1887,1887,"JD Miller missed Layup.",19,14,5,0.918390626932944,"TCU","Belmont",4,4,0,0,12,400989245,2017-11-29
67,1,"11:27",1887,1887,"Belmont Defensive Rebound.",19,14,5,0.918390626932944,"TCU","Belmont",4,4,0,0,12,400989245,2017-11-29
68,1,"11:02",1862,1862,"Amanze Egekeze Turnover.",19,14,5,0.918738161284798,"TCU","Belmont",4,4,0,0,12,400989245,2017-11-29
69,1,"11:01",1861,1861,"Kenrich Williams Steal.",19,14,5,0.918738161284798,"TCU","Belmont",4,4,0,0,12,400989245,2017-11-29
70,1,"10:43",1843,1843,"Kenrich Williams made Three Point Jumper. Assisted by Alex Robinson.",22,14,8,0.93839211456276,"TCU","Belmont",4,4,0,0,12,400989245,2017-11-29
71,1,"10:24",1824,1824,"Nick Hopkins Turnover.",22,14,8,0.944624273688727,"TCU","Belmont",4,4,0,0,12,400989245,2017-11-29
72,1,"10:23",1823,1823,"JD Miller Steal.",22,14,8,0.944624273688727,"TCU","Belmont",4,4,0,0,12,400989245,2017-11-29
73,1,"10:15",1815,1815,"Jaylen Fisher Turnover.",22,14,8,0.946618852670552,"TCU","Belmont",4,4,0,0,12,400989245,2017-11-29
74,1,"10:14",1814,1814,"Nick Hopkins Steal.",22,14,8,0.946618852670552,"TCU","Belmont",4,4,0,0,12,400989245,2017-11-29
75,1,"10:09",1809,1809,"Nick Hopkins missed Three Point Jumper.",22,14,8,0.941699153343122,"TCU","Belmont",4,4,0,0,12,400989245,2017-11-29
76,1,"10:09",1809,1809,"Ahmed Hamdy-Mohamed Defensive Rebound.",22,14,8,0.941699153343122,"TCU","Belmont",4,4,0,0,12,400989245,2017-11-29
77,1,"9:59",1799,1799,"Alex Robinson made Three Point Jumper.",25,14,11,0.957289803894543,"TCU","Belmont",4,4,0,0,12,400989245,2017-11-29
78,1,"9:58",1798,1798,"Foul on Burton Sampson.",25,14,11,0.957289803894543,"TCU","Belmont",4,4,0,0,12,400989245,2017-11-29
79,1,"9:58",1798,1798,"Alex Robinson made Free Throw.",26,14,12,0.962302534322295,"TCU","Belmont",4,4,0,0,12,400989245,2017-11-29
80,1,"9:38",1778,1778,"Dylan Windler Turnover.",26,14,12,0.959052123404602,"TCU","Belmont",4,4,0,0,12,400989245,2017-11-29
81,1,"9:21",1761,1761,"JD Miller made Layup.",28,14,14,0.974392733982435,"TCU","Belmont",4,4,0,0,12,400989245,2017-11-29
82,1,"9:00",1740,1740,"Seth Adelsperger missed Layup.",28,14,14,0.969551718170954,"TCU","Belmont",4,4,0,0,12,400989245,2017-11-29
83,1,"9:00",1740,1740,"Vladimir Brodziansky Defensive Rebound.",28,14,14,0.969551718170954,"TCU","Belmont",4,4,0,0,12,400989245,2017-11-29
84,1,"8:37",1717,1717,"JD Miller missed Three Point Jumper.",28,14,14,0.974998913219459,"TCU","Belmont",4,4,0,0,12,400989245,2017-11-29
85,1,"8:37",1717,1717,"Vladimir Brodziansky Offensive Rebound.",28,14,14,0.974998913219459,"TCU","Belmont",4,4,0,0,12,400989245,2017-11-29
86,1,"8:32",1712,1712,"Vladimir Brodziansky made Layup.",30,14,16,0.980743769563589,"TCU","Belmont",4,4,0,0,12,400989245,2017-11-29
87,1,"8:32",1712,1712,"Foul on Seth Adelsperger.",30,14,16,0.980743769563589,"TCU","Belmont",4,4,0,0,12,400989245,2017-11-29
88,1,"8:32",1712,1712,"Vladimir Brodziansky made Free Throw.",31,14,17,0.983109286503319,"TCU","Belmont",4,4,0,0,12,400989245,2017-11-29
89,1,"8:08",1688,1688,"Kevin McClain missed Three Point Jumper.",31,14,17,0.985953135666751,"TCU","Belmont",4,4,0,0,12,400989245,2017-11-29
90,1,"8:08",1688,1688,"JD Miller Defensive Rebound.",31,14,17,0.985953135666751,"TCU","Belmont",4,4,0,0,12,400989245,2017-11-29
91,1,"7:55",1675,1675,"JD Miller missed Layup.",31,14,17,0.983386891516682,"TCU","Belmont",4,4,0,0,12,400989245,2017-11-29
92,1,"7:55",1675,1675,"Amanze Egekeze Defensive Rebound.",31,14,17,0.983386891516682,"TCU","Belmont",4,4,0,0,12,400989245,2017-11-29
93,1,"7:41",1661,1661,"Michael Benkert missed Three Point Jumper.",31,14,17,0.980199792488729,"TCU","Belmont",4,4,0,0,12,400989245,2017-11-29
94,1,"7:41",1661,1661,"Desmond Bane Defensive Rebound.",31,14,17,0.980199792488729,"TCU","Belmont",4,4,0,0,12,400989245,2017-11-29
95,1,"7:34",1654,1654,"Jaylen Fisher made Layup. Assisted by Desmond Bane.",33,14,19,0.985005312383559,"TCU","Belmont",4,4,0,0,12,400989245,2017-11-29
96,1,"7:33",1653,1653,"Foul on Burton Sampson.",33,14,19,0.985005312383559,"TCU","Belmont",4,4,0,0,12,400989245,2017-11-29
97,1,"7:33",1653,1653,"Official TV Timeout",33,14,19,0.985005312383559,"TCU","Belmont",4,4,0,0,12,400989245,2017-11-29
98,1,"7:33",1653,1653,"Jaylen Fisher made Free Throw.",34,14,20,0.98684248179589,"TCU","Belmont",4,4,0,0,12,400989245,2017-11-29
99,1,"7:09",1629,1629,"Tyler Hadden made Layup. Assisted by Michael Benkert.",34,16,18,0.985511585401688,"TCU","Belmont",4,4,0,0,12,400989245,2017-11-29
100,1,"6:39",1599,1599,"Jaylen Fisher made Layup.",36,16,20,0.987262813303339,"TCU","Belmont",4,4,0,0,12,400989245,2017-11-29
101,1,"6:27",1587,1587,"Amanze Egekeze missed Three Point Jumper.",36,16,20,0.987389326098901,"TCU","Belmont",4,4,0,0,12,400989245,2017-11-29
102,1,"6:27",1587,1587,"Michael Benkert Offensive Rebound.",36,16,20,0.987389326098901,"TCU","Belmont",4,4,0,0,12,400989245,2017-11-29
103,1,"6:08",1568,1568,"Kevin McClain Turnover.",36,16,20,0.988489244392269,"TCU","Belmont",4,4,0,0,12,400989245,2017-11-29
104,1,"6:05",1565,1565,"Shawn Olden Steal.",36,16,20,0.988489244392269,"TCU","Belmont",4,4,0,0,12,400989245,2017-11-29
105,1,"5:51",1551,1551,"Vladimir Brodziansky Turnover.",36,16,20,0.9884592439991,"TCU","Belmont",4,4,0,0,12,400989245,2017-11-29
106,1,"5:38",1538,1538,"Dylan Windler made Layup.",36,18,18,0.985158204308082,"TCU","Belmont",4,4,0,0,12,400989245,2017-11-29
107,1,"5:21",1521,1521,"JD Miller made Three Point Jumper. Assisted by Kenrich Williams.",39,18,21,0.990067640815219,"TCU","Belmont",4,4,0,0,12,400989245,2017-11-29
108,1,"5:07",1507,1507,"Tyler Hadden missed Layup.",39,18,21,0.990268983105038,"TCU","Belmont",4,4,0,0,12,400989245,2017-11-29
109,1,"5:07",1507,1507,"Kenrich Williams Defensive Rebound.",39,18,21,0.990268983105038,"TCU","Belmont",4,4,0,0,12,400989245,2017-11-29
110,1,"4:57",1497,1497,"Vladimir Brodziansky missed Jumper.",39,18,21,0.990136916389217,"TCU","Belmont",4,4,0,0,12,400989245,2017-11-29
111,1,"4:57",1497,1497,"Dylan Windler Defensive Rebound.",39,18,21,0.990136916389217,"TCU","Belmont",4,4,0,0,12,400989245,2017-11-29
112,1,"4:47",1487,1487,"Foul on Kenrich Williams.",39,18,21,0.991428727846212,"TCU","Belmont",4,4,0,0,12,400989245,2017-11-29
113,1,"4:33",1473,1473,"Mack Mercer missed Jumper.",39,18,21,0.993032160952372,"TCU","Belmont",4,4,0,0,12,400989245,2017-11-29
114,1,"4:33",1473,1473,"Desmond Bane Defensive Rebound.",39,18,21,0.993032160952372,"TCU","Belmont",4,4,0,0,12,400989245,2017-11-29
115,1,"4:21",1461,1461,"Ahmed Hamdy-Mohamed missed Layup.",39,18,21,0.988335550371875,"TCU","Belmont",4,4,0,0,12,400989245,2017-11-29
116,1,"4:21",1461,1461,"Mack Mercer Block.",39,18,21,0.988335550371875,"TCU","Belmont",4,4,0,0,12,400989245,2017-11-29
117,1,"4:20",1460,1460,"Caleb Hollander Defensive Rebound.",39,18,21,0.988335550371875,"TCU","Belmont",4,4,0,0,12,400989245,2017-11-29
118,1,"4:06",1446,1446,"Nick Hopkins made Layup. Assisted by Mack Mercer.",39,20,19,0.989749021988461,"TCU","Belmont",4,4,0,0,12,400989245,2017-11-29
119,1,"3:50",1430,1430,"Alex Robinson missed Layup.",39,20,19,0.987858830124434,"TCU","Belmont",4,4,0,0,12,400989245,2017-11-29
120,1,"3:50",1430,1430,"Caleb Hollander Defensive Rebound.",39,20,19,0.987858830124434,"TCU","Belmont",4,4,0,0,12,400989245,2017-11-29
121,1,"3:49",1429,1429,"Foul on Ahmed Hamdy-Mohamed.",39,20,19,0.98603164321312,"TCU","Belmont",4,4,0,0,12,400989245,2017-11-29
122,1,"3:49",1429,1429,"Official TV Timeout",39,20,19,0.98603164321312,"TCU","Belmont",4,4,0,0,12,400989245,2017-11-29
123,1,"3:39",1419,1419,"Dylan Windler made Layup.",39,22,17,0.984220507221262,"TCU","Belmont",4,4,0,0,12,400989245,2017-11-29
124,1,"3:20",1400,1400,"Foul on Mack Mercer.",39,22,17,0.986673525664993,"TCU","Belmont",4,4,0,0,12,400989245,2017-11-29
125,1,"3:20",1400,1400,"Kouat Noi missed Free Throw.",39,22,17,0.986673525664993,"TCU","Belmont",4,4,0,0,12,400989245,2017-11-29
126,1,"3:20",1400,1400,"Mack Mercer Defensive Rebound.",39,22,17,0.986673525664993,"TCU","Belmont",4,4,0,0,12,400989245,2017-11-29
127,1,"3:02",1382,1382,"Mack Mercer made Three Point Jumper. Assisted by Nick Hopkins.",39,25,14,0.976197792344802,"TCU","Belmont",4,4,0,0,12,400989245,2017-11-29
128,1,"2:46",1366,1366,"Vladimir Brodziansky made Three Point Jumper. Assisted by Jaylen Fisher.",42,25,17,0.984837490942013,"TCU","Belmont",4,4,0,0,12,400989245,2017-11-29
129,1,"2:28",1348,1348,"Nick Hopkins missed Three Point Jumper.",42,25,17,0.984555666363712,"TCU","Belmont",4,4,0,0,12,400989245,2017-11-29
130,1,"2:28",1348,1348,"JD Miller Defensive Rebound.",42,25,17,0.984555666363712,"TCU","Belmont",4,4,0,0,12,400989245,2017-11-29
131,1,"2:13",1333,1333,"JD Miller missed Layup.",42,25,17,0.98400810381026,"TCU","Belmont",4,4,0,0,12,400989245,2017-11-29
132,1,"2:13",1333,1333,"Belmont Defensive Rebound.",42,25,17,0.98400810381026,"TCU","Belmont",4,4,0,0,12,400989245,2017-11-29
133,1,"2:00",1320,1320,"Mack Mercer made Layup. Assisted by Amanze Egekeze.",42,27,15,0.980381931726243,"TCU","Belmont",4,4,0,0,12,400989245,2017-11-29
134,1,"2:00",1320,1320,"Foul on Vladimir Brodziansky.",42,27,15,0.980381931726243,"TCU","Belmont",4,4,0,0,12,400989245,2017-11-29
135,1,"2:00",1320,1320,"Mack Mercer missed Free Throw.",42,27,15,0.980381931726243,"TCU","Belmont",4,4,0,0,12,400989245,2017-11-29
136,1,"2:00",1320,1320,"Vladimir Brodziansky Defensive Rebound.",42,27,15,0.980381931726243,"TCU","Belmont",4,4,0,0,12,400989245,2017-11-29
137,1,"1:28",1288,1288,"JD Miller missed Three Point Jumper.",42,27,15,0.979005357820031,"TCU","Belmont",4,4,0,0,12,400989245,2017-11-29
138,1,"1:28",1288,1288,"Vladimir Brodziansky Offensive Rebound.",42,27,15,0.979005357820031,"TCU","Belmont",4,4,0,0,12,400989245,2017-11-29
139,1,"1:25",1285,1285,"JD Miller Turnover.",42,27,15,0.979005357820031,"TCU","Belmont",4,4,0,0,12,400989245,2017-11-29
140,1,"1:05",1265,1265,"Dylan Windler missed Three Point Jumper.",42,27,15,0.98194229660341,"TCU","Belmont",4,4,0,0,12,400989245,2017-11-29
141,1,"1:05",1265,1265,"Alex Robinson Defensive Rebound.",42,27,15,0.98194229660341,"TCU","Belmont",4,4,0,0,12,400989245,2017-11-29
142,1,"0:46",1246,1246,"Jaylen Fisher missed Layup.",42,27,15,0.979587189115944,"TCU","Belmont",4,4,0,0,12,400989245,2017-11-29
143,1,"0:46",1246,1246,"Nick Hopkins Defensive Rebound.",42,27,15,0.979587189115944,"TCU","Belmont",4,4,0,0,12,400989245,2017-11-29
144,1,"0:39",1239,1239,"Kevin McClain made Layup. Assisted by Nick Hopkins.",42,29,13,0.971486186439773,"TCU","Belmont",4,4,0,0,12,400989245,2017-11-29
145,1,"0:37",1237,1237,"TCU  Timeout",42,29,13,0.971486186439773,"TCU","Belmont",3,4,1,0,12,400989245,2017-11-29
146,1,"0:12",1212,1212,"Jaylen Fisher missed Layup.",42,29,13,0.972954615454352,"TCU","Belmont",3,4,1,0,12,400989245,2017-11-29
147,1,"0:12",1212,1212,"Mack Mercer Defensive Rebound.",42,29,13,0.972954615454352,"TCU","Belmont",3,4,1,0,12,400989245,2017-11-29
148,1,"0:02",1202,1202,"Amanze Egekeze made Layup. Assisted by Nick Hopkins.",42,31,11,0.962794089018925,"TCU","Belmont",3,4,1,0,12,400989245,2017-11-29
149,1,"0:00",1200,1200,"End of 1st half",42,31,11,0.962794089018925,"TCU","Belmont",3,4,1,0,12,400989245,2017-11-29
150,2,"20:00",1200,1200,"PLAY",42,31,11,0.962794089018925,"TCU","Belmont",4,4,0,0,12,400989245,2017-11-29
151,2,"19:40",1180,1180,"Dylan Windler made Layup.",42,33,9,0.952510479201535,"TCU","Belmont",4,4,0,0,12,400989245,2017-11-29
152,2,"19:27",1167,1167,"Jaylen Fisher missed Layup.",42,33,9,0.950707855853142,"TCU","Belmont",4,4,0,0,12,400989245,2017-11-29
153,2,"19:27",1167,1167,"Kenrich Williams Offensive Rebound.",42,33,9,0.950707855853142,"TCU","Belmont",4,4,0,0,12,400989245,2017-11-29
154,2,"19:23",1163,1163,"Kenrich Williams made Layup.",44,33,11,0.964055181623775,"TCU","Belmont",4,4,0,0,12,400989245,2017-11-29
155,2,"19:02",1142,1142,"Austin Luke Turnover.",44,33,11,0.963767932038957,"TCU","Belmont",4,4,0,0,12,400989245,2017-11-29
156,2,"19:01",1141,1141,"Jaylen Fisher Steal.",44,33,11,0.963767932038957,"TCU","Belmont",4,4,0,0,12,400989245,2017-11-29
157,2,"18:58",1138,1138,"JD Miller made Dunk. Assisted by Vladimir Brodziansky.",46,33,13,0.974346584138976,"TCU","Belmont",4,4,0,0,12,400989245,2017-11-29
158,2,"18:40",1120,1120,"Dylan Windler missed Layup.",46,33,13,0.979448530839875,"TCU","Belmont",4,4,0,0,12,400989245,2017-11-29
159,2,"18:40",1120,1120,"Desmond Bane Defensive Rebound.",46,33,13,0.979448530839875,"TCU","Belmont",4,4,0,0,12,400989245,2017-11-29
160,2,"18:26",1106,1106,"Jaylen Fisher Turnover.",46,33,13,0.974117315027127,"TCU","Belmont",4,4,0,0,12,400989245,2017-11-29
161,2,"18:22",1102,1102,"Kevin McClain made Layup. Assisted by Dylan Windler.",46,35,11,0.964443282384447,"TCU","Belmont",4,4,0,0,12,400989245,2017-11-29
162,2,"17:58",1078,1078,"Jaylen Fisher made Layup.",48,35,13,0.973211466185524,"TCU","Belmont",4,4,0,0,12,400989245,2017-11-29
163,2,"17:29",1049,1049,"Dylan Windler Turnover.",48,35,13,0.9774303013349,"TCU","Belmont",4,4,0,0,12,400989245,2017-11-29
164,2,"17:28",1048,1048,"JD Miller Steal.",48,35,13,0.9774303013349,"TCU","Belmont",4,4,0,0,12,400989245,2017-11-29
165,2,"17:19",1039,1039,"Vladimir Brodziansky missed Three Point Jumper.",48,35,13,0.974593694945241,"TCU","Belmont",4,4,0,0,12,400989245,2017-11-29
166,2,"17:19",1039,1039,"Kevin McClain Defensive Rebound.",48,35,13,0.974593694945241,"TCU","Belmont",4,4,0,0,12,400989245,2017-11-29
167,2,"16:54",1014,1014,"Amanze Egekeze missed Three Point Jumper.",48,35,13,0.974454873077865,"TCU","Belmont",4,4,0,0,12,400989245,2017-11-29
168,2,"16:54",1014,1014,"JD Miller Defensive Rebound.",48,35,13,0.974454873077865,"TCU","Belmont",4,4,0,0,12,400989245,2017-11-29
169,2,"16:48",1008,1008,"Desmond Bane made Layup. Assisted by Jaylen Fisher.",50,35,15,0.983574177236293,"TCU","Belmont",4,4,0,0,12,400989245,2017-11-29
170,2,"16:44",1004,1004,"Belmont  Timeout",50,35,15,0.983574177236293,"TCU","Belmont",4,3,0,1,12,400989245,2017-11-29
171,2,"16:30",990,990,"Amanze Egekeze Turnover.",50,35,15,0.982347748816418,"TCU","Belmont",4,3,0,1,12,400989245,2017-11-29
172,2,"16:16",976,976,"Kenrich Williams made Layup. Assisted by Jaylen Fisher.",52,35,17,0.988941041239242,"TCU","Belmont",4,3,0,1,12,400989245,2017-11-29
173,2,"16:01",961,961,"Seth Adelsperger made Layup. Assisted by Austin Luke.",52,37,15,0.982902718338367,"TCU","Belmont",4,3,0,1,12,400989245,2017-11-29
174,2,"15:37",937,937,"Vladimir Brodziansky made Three Point Jumper. Assisted by Jaylen Fisher.",55,37,18,0.991599506286293,"TCU","Belmont",4,3,0,0,12,400989245,2017-11-29
175,2,"15:06",906,906,"Amanze Egekeze made Three Point Jumper. Assisted by Austin Luke.",55,40,15,0.984716142241392,"TCU","Belmont",4,3,0,0,12,400989245,2017-11-29
176,2,"14:40",880,880,"Kouat Noi missed Three Point Jumper.",55,40,15,0.979816474742288,"TCU","Belmont",4,3,0,0,12,400989245,2017-11-29
177,2,"14:40",880,880,"Amanze Egekeze Defensive Rebound.",55,40,15,0.979816474742288,"TCU","Belmont",4,3,0,0,12,400989245,2017-11-29
178,2,"14:28",868,868,"Amanze Egekeze made Three Point Jumper. Assisted by Austin Luke.",55,43,12,0.973382606582071,"TCU","Belmont",4,3,0,0,12,400989245,2017-11-29
179,2,"13:58",838,838,"Official TV Timeout",55,43,12,0.980257598551346,"TCU","Belmont",4,3,0,0,12,400989245,2017-11-29
180,2,"13:52",832,832,"Kouat Noi made Layup. Assisted by Alex Robinson.",57,43,14,0.986842907023256,"TCU","Belmont",4,3,0,0,12,400989245,2017-11-29
181,2,"13:31",811,811,"Austin Luke made Three Point Jumper. Assisted by Dylan Windler.",57,46,11,0.970391545997974,"TCU","Belmont",4,3,0,0,12,400989245,2017-11-29
182,2,"13:12",792,792,"Desmond Bane made Jumper. Assisted by Alex Robinson.",59,46,13,0.984080231995031,"TCU","Belmont",4,3,0,0,12,400989245,2017-11-29
183,2,"12:55",775,775,"Amanze Egekeze missed Three Point Jumper.",59,46,13,0.982331615008732,"TCU","Belmont",4,3,0,0,12,400989245,2017-11-29
184,2,"12:55",775,775,"Ahmed Hamdy-Mohamed Defensive Rebound.",59,46,13,0.982331615008732,"TCU","Belmont",4,3,0,0,12,400989245,2017-11-29
185,2,"12:42",762,762,"Foul on Dylan Windler.",59,46,13,0.985494950992902,"TCU","Belmont",4,3,0,0,12,400989245,2017-11-29
186,2,"12:42",762,762,"Kouat Noi made Free Throw.",60,46,14,0.988278655796365,"TCU","Belmont",4,3,0,0,12,400989245,2017-11-29
187,2,"12:42",762,762,"Kouat Noi missed Free Throw.",60,46,14,0.988278655796365,"TCU","Belmont",4,3,0,0,12,400989245,2017-11-29
188,2,"12:42",762,762,"Amanze Egekeze Defensive Rebound.",60,46,14,0.988278655796365,"TCU","Belmont",4,3,0,0,12,400989245,2017-11-29
189,2,"12:20",740,740,"Amanze Egekeze Turnover.",60,46,14,0.987403139678611,"TCU","Belmont",4,3,0,0,12,400989245,2017-11-29
190,2,"12:19",739,739,"Kouat Noi Steal.",60,46,14,0.984479599330295,"TCU","Belmont",4,3,0,0,12,400989245,2017-11-29
191,2,"12:07",727,727,"Kouat Noi made Three Point Jumper. Assisted by Desmond Bane.",63,46,17,0.993421016031379,"TCU","Belmont",4,3,0,0,12,400989245,2017-11-29
192,2,"11:51",711,711,"Nick Hopkins made Three Point Jumper. Assisted by Amanze Egekeze.",63,49,14,0.986488074676544,"TCU","Belmont",4,3,0,0,12,400989245,2017-11-29
