"play_id","half","time_remaining_half","secs_remaining","secs_remaining_absolute","description","home_score","away_score","score_diff","win_prob","home","away","home_time_out_remaining","away_time_out_remaining","home_timeout_ind","away_timeout_ind","home_favored_by","game_id","date"
1,1,"20:00",2400,2400,"PLAY",0,0,0,0.888091376675671,"Kansas","Texas",4,4,0,0,12,400989192,2018-02-26
2,1,"20:00",2400,2400,"Jump Ball won by Kansas",0,0,0,0.888091376675671,"Kansas","Texas",4,4,0,0,12,400989192,2018-02-26
3,1,"19:47",2387,2387,"Sviatoslav Mykhailiuk made Jumper. Assisted by Devonte' Graham.",2,0,2,0.890448444193969,"Kansas","Texas",4,4,0,0,12,400989192,2018-02-26
4,1,"19:24",2364,2364,"Foul on Sviatoslav Mykhailiuk.",2,0,2,0.877352878645918,"Kansas","Texas",4,4,0,0,12,400989192,2018-02-26
5,1,"19:13",2353,2353,"Kerwin Roach II made Three Point Jumper.",2,3,-1,0.874780814598471,"Kansas","Texas",4,4,0,0,12,400989192,2018-02-26
6,1,"18:50",2330,2330,"Foul on Dylan Osetkowski.",2,3,-1,0.866257793731335,"Kansas","Texas",4,4,0,0,12,400989192,2018-02-26
7,1,"18:46",2326,2326,"Udoka Azubuike made Dunk. Assisted by Clay Young.",4,3,1,0.88892619489768,"Kansas","Texas",4,4,0,0,12,400989192,2018-02-26
8,1,"18:34",2314,2314,"Matt Coleman Turnover.",4,3,1,0.875432075373347,"Kansas","Texas",4,4,0,0,12,400989192,2018-02-26
9,1,"18:14",2294,2294,"Devonte' Graham missed Jumper.",4,3,1,0.886382804056414,"Kansas","Texas",4,4,0,0,12,400989192,2018-02-26
10,1,"18:14",2294,2294,"Jericho Sims Defensive Rebound.",4,3,1,0.886382804056414,"Kansas","Texas",4,4,0,0,12,400989192,2018-02-26
11,1,"18:00",2280,2280,"Jase Febres missed Three Point Jumper.",4,3,1,0.882120729153853,"Kansas","Texas",4,4,0,0,12,400989192,2018-02-26
12,1,"18:00",2280,2280,"Udoka Azubuike Defensive Rebound.",4,3,1,0.882120729153853,"Kansas","Texas",4,4,0,0,12,400989192,2018-02-26
13,1,"17:51",2271,2271,"Sviatoslav Mykhailiuk made Jumper.",6,3,3,0.90488811308719,"Kansas","Texas",4,4,0,0,12,400989192,2018-02-26
14,1,"17:34",2254,2254,"Jericho Sims made Dunk. Assisted by Kerwin Roach II.",6,5,1,0.878244180075527,"Kansas","Texas",4,4,0,0,12,400989192,2018-02-26
15,1,"17:25",2245,2245,"Devonte' Graham made Layup.",8,5,3,0.89186079727174,"Kansas","Texas",4,4,0,0,12,400989192,2018-02-26
16,1,"17:14",2234,2234,"Foul on Udoka Azubuike.",8,5,3,0.905043962992995,"Kansas","Texas",4,4,0,0,12,400989192,2018-02-26
17,1,"17:11",2231,2231,"Dylan Osetkowski made Three Point Jumper.",8,8,0,0.872001912566629,"Kansas","Texas",4,4,0,0,12,400989192,2018-02-26
18,1,"16:43",2203,2203,"Malik Newman missed Layup.",8,8,0,0.869301712403729,"Kansas","Texas",4,4,0,0,12,400989192,2018-02-26
19,1,"16:43",2203,2203,"Jacob Young Defensive Rebound.",8,8,0,0.869301712403729,"Kansas","Texas",4,4,0,0,12,400989192,2018-02-26
20,1,"16:18",2178,2178,"Dylan Osetkowski missed Three Point Jumper.",8,8,0,0.865960367233635,"Kansas","Texas",4,4,0,0,12,400989192,2018-02-26
21,1,"16:18",2178,2178,"Udoka Azubuike Defensive Rebound.",8,8,0,0.865960367233635,"Kansas","Texas",4,4,0,0,12,400989192,2018-02-26
22,1,"16:01",2161,2161,"Udoka Azubuike Turnover.",8,8,0,0.865294896977422,"Kansas","Texas",4,4,0,0,12,400989192,2018-02-26
23,1,"15:45",2145,2145,"Matt Coleman missed Three Point Jumper.",8,8,0,0.871826363728107,"Kansas","Texas",4,4,0,0,12,400989192,2018-02-26
24,1,"15:45",2145,2145,"Lagerald Vick Defensive Rebound.",8,8,0,0.871826363728107,"Kansas","Texas",4,4,0,0,12,400989192,2018-02-26
25,1,"15:34",2134,2134,"Foul on Matt Coleman.",8,8,0,0.867562975715316,"Kansas","Texas",4,4,0,0,12,400989192,2018-02-26
26,1,"15:34",2134,2134,"Official TV Timeout",8,8,0,0.867562975715316,"Kansas","Texas",4,4,0,0,12,400989192,2018-02-26
27,1,"15:16",2116,2116,"Devonte' Graham made Three Point Jumper. Assisted by Lagerald Vick.",11,8,3,0.908162256140642,"Kansas","Texas",4,4,0,0,12,400989192,2018-02-26
28,1,"14:54",2094,2094,"Dylan Osetkowski missed Three Point Jumper.",11,8,3,0.897597630215269,"Kansas","Texas",4,4,0,0,12,400989192,2018-02-26
29,1,"14:54",2094,2094,"Jericho Sims Offensive Rebound.",11,8,3,0.897597630215269,"Kansas","Texas",4,4,0,0,12,400989192,2018-02-26
30,1,"14:49",2089,2089,"Jericho Sims made Layup.",11,10,1,0.874244069017799,"Kansas","Texas",4,4,0,0,12,400989192,2018-02-26
31,1,"14:32",2072,2072,"Lagerald Vick missed Three Point Jumper.",11,10,1,0.879313736795245,"Kansas","Texas",4,4,0,0,12,400989192,2018-02-26
32,1,"14:32",2072,2072,"Jacob Young Defensive Rebound.",11,10,1,0.879313736795245,"Kansas","Texas",4,4,0,0,12,400989192,2018-02-26
33,1,"14:21",2061,2061,"Kerwin Roach II made Three Point Jumper. Assisted by Jacob Young.",11,13,-2,0.827759178772205,"Kansas","Texas",4,4,0,0,12,400989192,2018-02-26
34,1,"13:56",2036,2036,"Malik Newman made Layup.",13,13,0,0.875921849029783,"Kansas","Texas",4,4,0,0,12,400989192,2018-02-26
35,1,"13:37",2017,2017,"Jericho Sims missed Jumper.",13,13,0,0.864074549308496,"Kansas","Texas",4,4,0,0,12,400989192,2018-02-26
36,1,"13:37",2017,2017,"Mitch Lightfoot Defensive Rebound.",13,13,0,0.864074549308496,"Kansas","Texas",4,4,0,0,12,400989192,2018-02-26
37,1,"13:30",2010,2010,"Devonte' Graham made Three Point Jumper. Assisted by Lagerald Vick.",16,13,3,0.899923045593176,"Kansas","Texas",4,4,0,0,12,400989192,2018-02-26
38,1,"12:57",1977,1977,"Foul on Mitch Lightfoot.",16,13,3,0.906205174627164,"Kansas","Texas",4,4,0,0,12,400989192,2018-02-26
39,1,"12:52",1972,1972,"Kerwin Roach II missed Jumper.",16,13,3,0.906205174627164,"Kansas","Texas",4,4,0,0,12,400989192,2018-02-26
40,1,"12:52",1972,1972,"Mitch Lightfoot Defensive Rebound.",16,13,3,0.906205174627164,"Kansas","Texas",4,4,0,0,12,400989192,2018-02-26
41,1,"12:31",1951,1951,"Foul on James Banks III.",16,13,3,0.897144553482777,"Kansas","Texas",4,4,0,0,12,400989192,2018-02-26
42,1,"12:25",1945,1945,"Devonte' Graham missed Jumper.",16,13,3,0.897709880898158,"Kansas","Texas",4,4,0,0,12,400989192,2018-02-26
43,1,"12:25",1945,1945,"Lagerald Vick Offensive Rebound.",16,13,3,0.897709880898158,"Kansas","Texas",4,4,0,0,12,400989192,2018-02-26
44,1,"12:21",1941,1941,"Sviatoslav Mykhailiuk made Three Point Jumper. Assisted by Devonte' Graham.",19,13,6,0.92763980830578,"Kansas","Texas",4,4,0,0,12,400989192,2018-02-26
45,1,"12:02",1922,1922,"Jacob Young missed Layup.",19,13,6,0.931327926267775,"Kansas","Texas",4,4,0,0,12,400989192,2018-02-26
46,1,"12:02",1922,1922,"Mitch Lightfoot Block.",19,13,6,0.931327926267775,"Kansas","Texas",4,4,0,0,12,400989192,2018-02-26
47,1,"12:02",1922,1922,"Texas Offensive Rebound.",19,13,6,0.931327926267775,"Kansas","Texas",4,4,0,0,12,400989192,2018-02-26
48,1,"11:59",1919,1919,"Official TV Timeout",19,13,6,0.932744234506955,"Kansas","Texas",4,4,0,0,12,400989192,2018-02-26
49,1,"11:57",1917,1917,"Dylan Osetkowski missed Jumper.",19,13,6,0.932744234506955,"Kansas","Texas",4,4,0,0,12,400989192,2018-02-26
50,1,"11:57",1917,1917,"Dylan Osetkowski Offensive Rebound.",19,13,6,0.932744234506955,"Kansas","Texas",4,4,0,0,12,400989192,2018-02-26
51,1,"11:51",1911,1911,"Dylan Osetkowski missed Layup.",19,13,6,0.932744234506955,"Kansas","Texas",4,4,0,0,12,400989192,2018-02-26
52,1,"11:51",1911,1911,"Udoka Azubuike Block.",19,13,6,0.932744234506955,"Kansas","Texas",4,4,0,0,12,400989192,2018-02-26
53,1,"11:51",1911,1911,"Texas Offensive Rebound.",19,13,6,0.932744234506955,"Kansas","Texas",4,4,0,0,12,400989192,2018-02-26
54,1,"11:43",1903,1903,"Texas  Turnover.",19,13,6,0.925398218119573,"Kansas","Texas",4,4,0,0,12,400989192,2018-02-26
55,1,"11:35",1895,1895,"Udoka Azubuike made Jumper.",21,13,8,0.944741477888223,"Kansas","Texas",4,4,0,0,12,400989192,2018-02-26
56,1,"11:20",1880,1880,"Jase Febres missed Three Point Jumper.",21,13,8,0.942231827147032,"Kansas","Texas",4,4,0,0,12,400989192,2018-02-26
57,1,"11:20",1880,1880,"Lagerald Vick Defensive Rebound.",21,13,8,0.942231827147032,"Kansas","Texas",4,4,0,0,12,400989192,2018-02-26
58,1,"11:14",1874,1874,"Malik Newman missed Three Point Jumper.",21,13,8,0.940386785618353,"Kansas","Texas",4,4,0,0,12,400989192,2018-02-26
59,1,"11:14",1874,1874,"Dylan Osetkowski Defensive Rebound.",21,13,8,0.940386785618353,"Kansas","Texas",4,4,0,0,12,400989192,2018-02-26
60,1,"10:47",1847,1847,"Matt Coleman missed Jumper.",21,13,8,0.93839211456276,"Kansas","Texas",4,4,0,0,12,400989192,2018-02-26
61,1,"10:47",1847,1847,"Udoka Azubuike Defensive Rebound.",21,13,8,0.93839211456276,"Kansas","Texas",4,4,0,0,12,400989192,2018-02-26
62,1,"10:34",1834,1834,"Foul on Matt Coleman.",21,13,8,0.939763687235359,"Kansas","Texas",4,4,0,0,12,400989192,2018-02-26
63,1,"10:21",1821,1821,"Udoka Azubuike made Dunk. Assisted by Devonte' Graham.",23,13,10,0.955948844504977,"Kansas","Texas",4,4,0,0,12,400989192,2018-02-26
64,1,"10:08",1808,1808,"Kerwin Roach II Turnover.",23,13,10,0.954314769657189,"Kansas","Texas",4,4,0,0,12,400989192,2018-02-26
65,1,"10:08",1808,1808,"Marcus Garrett Steal.",23,13,10,0.954314769657189,"Kansas","Texas",4,4,0,0,12,400989192,2018-02-26
66,1,"10:03",1803,1803,"Malik Newman made Layup. Assisted by Devonte' Graham.",25,13,12,0.964303993597596,"Kansas","Texas",4,4,0,0,12,400989192,2018-02-26
67,1,"10:00",1800,1800,"Texas  Timeout",25,13,12,0.964303993597596,"Kansas","Texas",3,4,1,0,12,400989192,2018-02-26
68,1,"9:45",1785,1785,"Jericho Sims missed Jumper.",25,13,12,0.963187674535915,"Kansas","Texas",3,4,1,0,12,400989192,2018-02-26
69,1,"9:45",1785,1785,"Udoka Azubuike Block.",25,13,12,0.963187674535915,"Kansas","Texas",3,4,1,0,12,400989192,2018-02-26
70,1,"9:45",1785,1785,"Marcus Garrett Defensive Rebound.",25,13,12,0.963187674535915,"Kansas","Texas",3,4,1,0,12,400989192,2018-02-26
71,1,"9:40",1780,1780,"Foul on Jericho Sims.",25,13,12,0.963187674535915,"Kansas","Texas",3,4,1,0,12,400989192,2018-02-26
72,1,"9:30",1770,1770,"Sviatoslav Mykhailiuk made Jumper.",27,13,14,0.967656420432795,"Kansas","Texas",3,4,1,0,12,400989192,2018-02-26
73,1,"9:03",1743,1743,"Jericho Sims made Dunk. Assisted by Matt Coleman.",27,15,12,0.961141076082326,"Kansas","Texas",3,4,1,0,12,400989192,2018-02-26
74,1,"8:39",1719,1719,"Devonte' Graham Turnover.",27,15,12,0.967596777088443,"Kansas","Texas",3,4,0,0,12,400989192,2018-02-26
75,1,"8:39",1719,1719,"Dylan Osetkowski Steal.",27,15,12,0.967596777088443,"Kansas","Texas",3,4,0,0,12,400989192,2018-02-26
76,1,"8:34",1714,1714,"Jacob Young missed Three Point Jumper.",27,15,12,0.967596777088443,"Kansas","Texas",3,4,0,0,12,400989192,2018-02-26
77,1,"8:34",1714,1714,"Malik Newman Defensive Rebound.",27,15,12,0.967596777088443,"Kansas","Texas",3,4,0,0,12,400989192,2018-02-26
78,1,"8:25",1705,1705,"Malik Newman missed Layup.",27,15,12,0.961211825400591,"Kansas","Texas",3,4,0,0,12,400989192,2018-02-26
79,1,"8:25",1705,1705,"Jericho Sims Block.",27,15,12,0.961211825400591,"Kansas","Texas",3,4,0,0,12,400989192,2018-02-26
80,1,"8:25",1705,1705,"Matt Coleman Defensive Rebound.",27,15,12,0.961211825400591,"Kansas","Texas",3,4,0,0,12,400989192,2018-02-26
81,1,"8:17",1697,1697,"Dylan Osetkowski missed Three Point Jumper.",27,15,12,0.967615966041904,"Kansas","Texas",3,4,0,0,12,400989192,2018-02-26
82,1,"8:17",1697,1697,"Jacob Young Offensive Rebound.",27,15,12,0.967615966041904,"Kansas","Texas",3,4,0,0,12,400989192,2018-02-26
83,1,"7:59",1679,1679,"Kerwin Roach II made Layup. Assisted by Jericho Sims.",27,17,10,0.957338172371124,"Kansas","Texas",3,4,0,0,12,400989192,2018-02-26
84,1,"7:52",1672,1672,"Malik Newman missed Three Point Jumper.",27,17,10,0.957338172371124,"Kansas","Texas",3,4,0,0,12,400989192,2018-02-26
85,1,"7:52",1672,1672,"Sviatoslav Mykhailiuk Offensive Rebound.",27,17,10,0.957338172371124,"Kansas","Texas",3,4,0,0,12,400989192,2018-02-26
86,1,"7:46",1666,1666,"Sviatoslav Mykhailiuk missed Three Point Jumper.",27,17,10,0.952392308146874,"Kansas","Texas",3,4,0,0,12,400989192,2018-02-26
87,1,"7:46",1666,1666,"Jericho Sims Defensive Rebound.",27,17,10,0.952392308146874,"Kansas","Texas",3,4,0,0,12,400989192,2018-02-26
88,1,"7:37",1657,1657,"Jacob Young missed Layup.",27,17,10,0.952204873735325,"Kansas","Texas",3,4,0,0,12,400989192,2018-02-26
89,1,"7:37",1657,1657,"Kerwin Roach II Offensive Rebound.",27,17,10,0.952204873735325,"Kansas","Texas",3,4,0,0,12,400989192,2018-02-26
90,1,"7:37",1657,1657,"Kerwin Roach II made Two Point Tip Shot.",27,19,8,0.938585294602732,"Kansas","Texas",3,4,0,0,12,400989192,2018-02-26
91,1,"7:16",1636,1636,"Udoka Azubuike made Dunk. Assisted by Marcus Garrett.",29,19,10,0.95309290278486,"Kansas","Texas",3,4,0,0,12,400989192,2018-02-26
92,1,"6:55",1615,1615,"Foul on Udoka Azubuike.",29,19,10,0.951525583593579,"Kansas","Texas",3,4,0,0,12,400989192,2018-02-26
93,1,"6:55",1615,1615,"Official TV Timeout",29,19,10,0.951525583593579,"Kansas","Texas",3,4,0,0,12,400989192,2018-02-26
94,1,"6:48",1608,1608,"Kerwin Roach II missed Three Point Jumper.",29,19,10,0.953297483010445,"Kansas","Texas",3,4,0,0,12,400989192,2018-02-26
95,1,"6:48",1608,1608,"Devonte' Graham Defensive Rebound.",29,19,10,0.953297483010445,"Kansas","Texas",3,4,0,0,12,400989192,2018-02-26
96,1,"6:36",1596,1596,"Lagerald Vick Turnover.",29,19,10,0.952572137240801,"Kansas","Texas",3,4,0,0,12,400989192,2018-02-26
97,1,"6:36",1596,1596,"Jacob Young Steal.",29,19,10,0.952572137240801,"Kansas","Texas",3,4,0,0,12,400989192,2018-02-26
98,1,"6:32",1592,1592,"Jacob Young made Layup.",29,21,8,0.938766080560828,"Kansas","Texas",3,4,0,0,12,400989192,2018-02-26
99,1,"6:14",1574,1574,"Marcus Garrett missed Layup.",29,21,8,0.94902382451339,"Kansas","Texas",3,4,0,0,12,400989192,2018-02-26
100,1,"6:14",1574,1574,"Silvio De Sousa Offensive Rebound.",29,21,8,0.94902382451339,"Kansas","Texas",3,4,0,0,12,400989192,2018-02-26
101,1,"6:14",1574,1574,"Silvio De Sousa missed Two Point Tip Shot.",29,21,8,0.94902382451339,"Kansas","Texas",3,4,0,0,12,400989192,2018-02-26
102,1,"6:14",1574,1574,"Marcus Garrett Offensive Rebound.",29,21,8,0.94902382451339,"Kansas","Texas",3,4,0,0,12,400989192,2018-02-26
103,1,"6:09",1569,1569,"Sviatoslav Mykhailiuk missed Three Point Jumper.",29,21,8,0.939608868890945,"Kansas","Texas",3,4,0,0,12,400989192,2018-02-26
104,1,"6:09",1569,1569,"Kerwin Roach II Defensive Rebound.",29,21,8,0.939608868890945,"Kansas","Texas",3,4,0,0,12,400989192,2018-02-26
105,1,"5:46",1546,1546,"Kerwin Roach II made Layup.",29,23,6,0.925933807023504,"Kansas","Texas",3,4,0,0,12,400989192,2018-02-26
106,1,"5:25",1525,1525,"Lagerald Vick made Jumper. Assisted by Sviatoslav Mykhailiuk.",31,23,8,0.940055312975875,"Kansas","Texas",3,4,0,0,12,400989192,2018-02-26
107,1,"5:07",1507,1507,"Kerwin Roach II Turnover.",31,23,8,0.941057968134006,"Kansas","Texas",3,4,0,0,12,400989192,2018-02-26
108,1,"4:59",1499,1499,"Sviatoslav Mykhailiuk made Layup.",33,23,10,0.955828002710847,"Kansas","Texas",3,4,0,0,12,400989192,2018-02-26
109,1,"4:47",1487,1487,"Jericho Sims missed Layup.",33,23,10,0.95686020204784,"Kansas","Texas",3,4,0,0,12,400989192,2018-02-26
110,1,"4:47",1487,1487,"Devonte' Graham Defensive Rebound.",33,23,10,0.95686020204784,"Kansas","Texas",3,4,0,0,12,400989192,2018-02-26
111,1,"4:41",1481,1481,"Malik Newman made Dunk. Assisted by Devonte' Graham.",35,23,12,0.967688518528637,"Kansas","Texas",3,4,0,0,12,400989192,2018-02-26
112,1,"4:22",1462,1462,"Texas  Timeout",35,23,12,0.960255174784628,"Kansas","Texas",2,4,1,0,12,400989192,2018-02-26
113,1,"4:08",1448,1448,"Dylan Osetkowski missed Three Point Jumper.",35,23,12,0.970826520076813,"Kansas","Texas",2,4,1,0,12,400989192,2018-02-26
114,1,"4:08",1448,1448,"Mitch Lightfoot Defensive Rebound.",35,23,12,0.970826520076813,"Kansas","Texas",2,4,1,0,12,400989192,2018-02-26
115,1,"4:03",1443,1443,"Foul on Jericho Sims.",35,23,12,0.970826520076813,"Kansas","Texas",2,4,1,0,12,400989192,2018-02-26
116,1,"3:53",1433,1433,"Mitch Lightfoot missed Jumper.",35,23,12,0.966274699684069,"Kansas","Texas",2,4,1,0,12,400989192,2018-02-26
117,1,"3:53",1433,1433,"Dylan Osetkowski Defensive Rebound.",35,23,12,0.966274699684069,"Kansas","Texas",2,4,1,0,12,400989192,2018-02-26
118,1,"3:26",1406,1406,"Matt Coleman missed Jumper.",35,23,12,0.971518392860073,"Kansas","Texas",2,4,1,0,12,400989192,2018-02-26
119,1,"3:26",1406,1406,"Devonte' Graham Defensive Rebound.",35,23,12,0.971518392860073,"Kansas","Texas",2,4,1,0,12,400989192,2018-02-26
120,1,"3:17",1397,1397,"Mitch Lightfoot made Dunk. Assisted by Devonte' Graham.",37,23,14,0.978574417387057,"Kansas","Texas",2,4,0,0,12,400989192,2018-02-26
121,1,"3:02",1382,1382,"Matt Coleman made Three Point Jumper. Assisted by Kerwin Roach II.",37,26,11,0.963227605008753,"Kansas","Texas",2,4,0,0,12,400989192,2018-02-26
122,1,"2:53",1373,1373,"Sviatoslav Mykhailiuk made Three Point Jumper. Assisted by Lagerald Vick.",40,26,14,0.972531432495274,"Kansas","Texas",2,4,0,0,12,400989192,2018-02-26
123,1,"2:31",1351,1351,"Kerwin Roach II made Jumper.",40,28,12,0.96961701276416,"Kansas","Texas",2,4,0,0,12,400989192,2018-02-26
124,1,"2:00",1320,1320,"Lagerald Vick made Layup. Assisted by Devonte' Graham.",42,28,14,0.977109706404514,"Kansas","Texas",2,4,0,0,12,400989192,2018-02-26
125,1,"1:39",1299,1299,"Matt Coleman missed Three Point Jumper.",42,28,14,0.979148084495996,"Kansas","Texas",2,4,0,0,12,400989192,2018-02-26
126,1,"1:39",1299,1299,"Dylan Osetkowski Offensive Rebound.",42,28,14,0.979148084495996,"Kansas","Texas",2,4,0,0,12,400989192,2018-02-26
127,1,"1:32",1292,1292,"Dylan Osetkowski made Layup.",42,30,12,0.971094000263588,"Kansas","Texas",2,4,0,0,12,400989192,2018-02-26
128,1,"1:11",1271,1271,"Sviatoslav Mykhailiuk missed Jumper.",42,30,12,0.963732265914581,"Kansas","Texas",2,4,0,0,12,400989192,2018-02-26
129,1,"1:11",1271,1271,"Jase Febres Block.",42,30,12,0.963732265914581,"Kansas","Texas",2,4,0,0,12,400989192,2018-02-26
130,1,"1:11",1271,1271,"Silvio De Sousa Offensive Rebound.",42,30,12,0.963732265914581,"Kansas","Texas",2,4,0,0,12,400989192,2018-02-26
131,1,"1:11",1271,1271,"Silvio De Sousa made Layup.",44,30,14,0.972868745647839,"Kansas","Texas",2,4,0,0,12,400989192,2018-02-26
132,1,"1:11",1271,1271,"Foul on Dylan Osetkowski.",44,30,14,0.972868745647839,"Kansas","Texas",2,4,0,0,12,400989192,2018-02-26
133,1,"1:11",1271,1271,"Silvio De Sousa made Free Throw.",45,30,15,0.976555638345475,"Kansas","Texas",2,4,0,0,12,400989192,2018-02-26
134,1,"0:46",1246,1246,"Matt Coleman missed Jumper.",45,30,15,0.979587189115944,"Kansas","Texas",2,4,0,0,12,400989192,2018-02-26
135,1,"0:46",1246,1246,"Jericho Sims Offensive Rebound.",45,30,15,0.979587189115944,"Kansas","Texas",2,4,0,0,12,400989192,2018-02-26
136,1,"0:33",1233,1233,"Texas  Timeout",45,30,15,0.979172899801992,"Kansas","Texas",1,4,1,0,12,400989192,2018-02-26
137,1,"0:28",1228,1228,"Dylan Osetkowski Turnover.",45,30,15,0.982759009580858,"Kansas","Texas",1,4,1,1,12,400989192,2018-02-26
138,1,"0:28",1228,1228,"Kansas  Timeout",45,30,15,0.982759009580858,"Kansas","Texas",1,3,1,1,12,400989192,2018-02-26
139,1,"0:11",1211,1211,"Devonte' Graham Turnover.",45,30,15,0.980403635159234,"Kansas","Texas",1,3,1,1,12,400989192,2018-02-26
140,1,"0:11",1211,1211,"Kerwin Roach II Steal.",45,30,15,0.980403635159234,"Kansas","Texas",1,3,1,1,12,400989192,2018-02-26
141,1,"0:04",1204,1204,"Jacob Young made Layup.",45,32,13,0.972665033624747,"Kansas","Texas",1,3,1,1,12,400989192,2018-02-26
142,1,"0:00",1200,1200,"End of 1st half",45,32,13,0.972665033624747,"Kansas","Texas",1,3,1,1,12,400989192,2018-02-26
143,2,"20:00",1200,1200,"PLAY",45,32,13,0.972665033624747,"Kansas","Texas",2,4,0,0,12,400989192,2018-02-26
144,2,"20:00",1200,1200,"Jump Ball won by Texas",45,32,13,0.972665033624747,"Kansas","Texas",2,4,0,0,12,400989192,2018-02-26
145,2,"19:48",1188,1188,"Matt Coleman missed Jumper.",45,32,13,0.974931949715962,"Kansas","Texas",2,4,0,0,12,400989192,2018-02-26
146,2,"19:48",1188,1188,"Udoka Azubuike Block.",45,32,13,0.974931949715962,"Kansas","Texas",2,4,0,0,12,400989192,2018-02-26
147,2,"19:48",1188,1188,"Jericho Sims Offensive Rebound.",45,32,13,0.974931949715962,"Kansas","Texas",2,4,0,0,12,400989192,2018-02-26
148,2,"19:36",1176,1176,"Jericho Sims made Layup.",45,34,11,0.962032941617634,"Kansas","Texas",2,4,0,0,12,400989192,2018-02-26
149,2,"19:24",1164,1164,"Sviatoslav Mykhailiuk Turnover.",45,34,11,0.964055181623775,"Kansas","Texas",2,4,0,0,12,400989192,2018-02-26
150,2,"19:24",1164,1164,"Matt Coleman Steal.",45,34,11,0.964055181623775,"Kansas","Texas",2,4,0,0,12,400989192,2018-02-26
151,2,"19:21",1161,1161,"Jericho Sims made Dunk. Assisted by Kerwin Roach II.",45,36,9,0.950707855853142,"Kansas","Texas",2,4,0,0,12,400989192,2018-02-26
152,2,"18:54",1134,1134,"Udoka Azubuike made Layup. Assisted by Malik Newman.",47,36,11,0.964821671717554,"Kansas","Texas",2,4,0,0,12,400989192,2018-02-26
153,2,"18:37",1117,1117,"Matt Coleman made Jumper.",47,38,9,0.950534782216425,"Kansas","Texas",2,4,0,0,12,400989192,2018-02-26
154,2,"18:10",1090,1090,"Udoka Azubuike made Jumper.",49,38,11,0.967521957382061,"Kansas","Texas",2,4,0,0,12,400989192,2018-02-26
155,2,"17:39",1059,1059,"Kerwin Roach II missed Jumper.",49,38,11,0.968505097406226,"Kansas","Texas",2,4,0,0,12,400989192,2018-02-26
156,2,"17:39",1059,1059,"Udoka Azubuike Block.",49,38,11,0.968505097406226,"Kansas","Texas",2,4,0,0,12,400989192,2018-02-26
157,2,"17:39",1059,1059,"Devonte' Graham Defensive Rebound.",49,38,11,0.968505097406226,"Kansas","Texas",2,4,0,0,12,400989192,2018-02-26
158,2,"17:32",1052,1052,"Foul on Matt Coleman.",49,38,11,0.968505097406226,"Kansas","Texas",2,4,0,0,12,400989192,2018-02-26
159,2,"17:27",1047,1047,"Foul on Dylan Osetkowski.",49,38,11,0.96826052516982,"Kansas","Texas",2,4,0,0,12,400989192,2018-02-26
160,2,"17:11",1031,1031,"Devonte' Graham missed Three Point Jumper.",49,38,11,0.964563884212278,"Kansas","Texas",2,4,0,0,12,400989192,2018-02-26
161,2,"17:11",1031,1031,"Jacob Young Defensive Rebound.",49,38,11,0.964563884212278,"Kansas","Texas",2,4,0,0,12,400989192,2018-02-26
162,2,"17:02",1022,1022,"Dylan Osetkowski missed Jumper.",49,38,11,0.967733234633868,"Kansas","Texas",2,4,0,0,12,400989192,2018-02-26
163,2,"17:02",1022,1022,"Lagerald Vick Defensive Rebound.",49,38,11,0.967733234633868,"Kansas","Texas",2,4,0,0,12,400989192,2018-02-26
164,2,"16:53",1013,1013,"Foul on Matt Coleman.",49,38,11,0.963600402560361,"Kansas","Texas",2,4,0,0,12,400989192,2018-02-26
165,2,"16:43",1003,1003,"Lagerald Vick missed Jumper.",49,38,11,0.966024666562518,"Kansas","Texas",2,4,0,0,12,400989192,2018-02-26
166,2,"16:43",1003,1003,"Jericho Sims Defensive Rebound.",49,38,11,0.966024666562518,"Kansas","Texas",2,4,0,0,12,400989192,2018-02-26
167,2,"16:25",985,985,"Jase Febres missed Three Point Jumper.",49,38,11,0.971645960059411,"Kansas","Texas",2,4,0,0,12,400989192,2018-02-26
168,2,"16:25",985,985,"Dylan Osetkowski Offensive Rebound.",49,38,11,0.971645960059411,"Kansas","Texas",2,4,0,0,12,400989192,2018-02-26
169,2,"16:25",985,985,"Dylan Osetkowski made Two Point Tip Shot.",49,40,9,0.958298082829382,"Kansas","Texas",2,4,0,0,12,400989192,2018-02-26
170,2,"16:25",985,985,"Foul on Sviatoslav Mykhailiuk.",49,40,9,0.958298082829382,"Kansas","Texas",2,4,0,0,12,400989192,2018-02-26
171,2,"16:25",985,985,"Dylan Osetkowski made Free Throw.",49,41,8,0.949540477428612,"Kansas","Texas",2,4,0,0,12,400989192,2018-02-26
172,2,"16:03",963,963,"Udoka Azubuike made Dunk. Assisted by Marcus Garrett.",51,41,10,0.957869597765294,"Kansas","Texas",2,4,0,0,12,400989192,2018-02-26
173,2,"15:43",943,943,"Foul on Marcus Garrett.",51,41,10,0.967022143696198,"Kansas","Texas",2,4,0,0,12,400989192,2018-02-26
174,2,"15:43",943,943,"Official TV Timeout",51,41,10,0.967022143696198,"Kansas","Texas",2,4,0,0,12,400989192,2018-02-26
175,2,"15:43",943,943,"Kerwin Roach II made Free Throw.",51,42,9,0.960327365941726,"Kansas","Texas",2,4,0,0,12,400989192,2018-02-26
176,2,"15:43",943,943,"Kerwin Roach II missed Free Throw.",51,42,9,0.960327365941726,"Kansas","Texas",2,4,0,0,12,400989192,2018-02-26
177,2,"15:43",943,943,"Udoka Azubuike Defensive Rebound.",51,42,9,0.960327365941726,"Kansas","Texas",2,4,0,0,12,400989192,2018-02-26
178,2,"15:23",923,923,"Devonte' Graham missed Layup.",51,42,9,0.950983374997551,"Kansas","Texas",2,4,0,0,12,400989192,2018-02-26
179,2,"15:23",923,923,"Kerwin Roach II Defensive Rebound.",51,42,9,0.950983374997551,"Kansas","Texas",2,4,0,0,12,400989192,2018-02-26
180,2,"15:14",914,914,"Jacob Young made Three Point Jumper. Assisted by Kerwin Roach II.",51,45,6,0.931289386054224,"Kansas","Texas",2,4,0,0,12,400989192,2018-02-26
181,2,"14:48",888,888,"Marcus Garrett made Layup. Assisted by Udoka Azubuike.",53,45,8,0.934961017560218,"Kansas","Texas",2,4,0,0,12,400989192,2018-02-26
182,2,"14:16",856,856,"Kerwin Roach II missed Jumper.",53,45,8,0.951769339527737,"Kansas","Texas",2,4,0,0,12,400989192,2018-02-26
183,2,"14:16",856,856,"Udoka Azubuike Defensive Rebound.",53,45,8,0.951769339527737,"Kansas","Texas",2,4,0,0,12,400989192,2018-02-26
184,2,"14:00",840,840,"Malik Newman made Three Point Jumper.",56,45,11,0.973220878726827,"Kansas","Texas",2,4,0,0,12,400989192,2018-02-26
185,2,"13:25",805,805,"Dylan Osetkowski missed Jumper.",56,45,11,0.974140374647391,"Kansas","Texas",2,4,0,0,12,400989192,2018-02-26
186,2,"13:25",805,805,"Sviatoslav Mykhailiuk Defensive Rebound.",56,45,11,0.974140374647391,"Kansas","Texas",2,4,0,0,12,400989192,2018-02-26
187,2,"13:17",797,797,"Lagerald Vick missed Three Point Jumper.",56,45,11,0.975508070564084,"Kansas","Texas",2,4,0,0,12,400989192,2018-02-26
188,2,"13:17",797,797,"Sviatoslav Mykhailiuk Offensive Rebound.",56,45,11,0.975508070564084,"Kansas","Texas",2,4,0,0,12,400989192,2018-02-26
189,2,"13:13",793,793,"Sviatoslav Mykhailiuk missed Jumper.",56,45,11,0.975508070564084,"Kansas","Texas",2,4,0,0,12,400989192,2018-02-26
190,2,"13:13",793,793,"Jacob Young Defensive Rebound.",56,45,11,0.975508070564084,"Kansas","Texas",2,4,0,0,12,400989192,2018-02-26
191,2,"13:09",789,789,"Jacob Young Turnover.",56,45,11,0.972032009293347,"Kansas","Texas",2,4,0,0,12,400989192,2018-02-26
192,2,"13:09",789,789,"Lagerald Vick Steal.",56,45,11,0.972032009293347,"Kansas","Texas",2,4,0,0,12,400989192,2018-02-26
