"play_id","half","time_remaining_half","secs_remaining","secs_remaining_absolute","description","home_score","away_score","score_diff","win_prob","home","away","home_time_out_remaining","away_time_out_remaining","home_timeout_ind","away_timeout_ind","home_favored_by","game_id","date"
193,2,"11:33",693,693,"Kenrich Williams made Jumper.",65,49,16,0.994337489006152,"TCU","Belmont",4,3,0,0,12,400989245,2017-11-29
194,2,"11:17",677,677,"Dylan Windler missed Three Point Jumper.",65,49,16,0.992853112164881,"TCU","Belmont",4,3,0,0,12,400989245,2017-11-29
195,2,"11:17",677,677,"Belmont Deadball Team Rebound.",65,49,16,0.992853112164881,"TCU","Belmont",4,3,0,0,12,400989245,2017-11-29
196,2,"11:14",674,674,"Foul on Kouat Noi.",65,49,16,0.992853112164881,"TCU","Belmont",4,3,0,0,12,400989245,2017-11-29
197,2,"11:14",674,674,"Official TV Timeout",65,49,16,0.992853112164881,"TCU","Belmont",4,3,0,0,12,400989245,2017-11-29
198,2,"11:05",665,665,"Foul on Kouat Noi.",65,49,16,0.992036114487941,"TCU","Belmont",4,3,0,0,12,400989245,2017-11-29
199,2,"11:05",665,665,"Dylan Windler made Free Throw.",65,50,15,0.99003474983693,"TCU","Belmont",4,3,0,0,12,400989245,2017-11-29
200,2,"11:05",665,665,"Dylan Windler made Free Throw.",65,51,14,0.987536750892066,"TCU","Belmont",4,3,0,0,12,400989245,2017-11-29
201,2,"10:40",640,640,"Vladimir Brodziansky missed Jumper.",65,51,14,0.989370916021752,"TCU","Belmont",4,3,0,0,12,400989245,2017-11-29
202,2,"10:40",640,640,"Kevin McClain Defensive Rebound.",65,51,14,0.989370916021752,"TCU","Belmont",4,3,0,0,12,400989245,2017-11-29
203,2,"10:30",630,630,"Nick Hopkins made Layup.",65,53,12,0.979728781902524,"TCU","Belmont",4,3,0,0,12,400989245,2017-11-29
204,2,"10:24",624,624,"TCU  Timeout",65,53,12,0.986661682413347,"TCU","Belmont",3,3,1,0,12,400989245,2017-11-29
205,2,"10:20",620,620,"Foul on Dylan Windler.",65,53,12,0.986661682413347,"TCU","Belmont",3,3,1,0,12,400989245,2017-11-29
206,2,"10:19",619,619,"Kenrich Williams made Layup. Assisted by Jaylen Fisher.",67,53,14,0.990257338762479,"TCU","Belmont",3,3,1,0,12,400989245,2017-11-29
207,2,"9:58",598,598,"Kevin McClain made Three Point Jumper. Assisted by Nick Hopkins.",67,56,11,0.977596835145713,"TCU","Belmont",3,3,1,0,12,400989245,2017-11-29
208,2,"9:47",587,587,"Desmond Bane Turnover.",67,56,11,0.976637773752442,"TCU","Belmont",3,3,1,0,12,400989245,2017-11-29
209,2,"9:47",587,587,"Foul on Desmond Bane.",67,56,11,0.976637773752442,"TCU","Belmont",3,3,1,0,12,400989245,2017-11-29
210,2,"9:35",575,575,"Amanze Egekeze made Layup. Assisted by Dylan Windler.",67,58,9,0.971045320430123,"TCU","Belmont",3,3,1,0,12,400989245,2017-11-29
211,2,"9:02",542,542,"JD Miller missed Layup.",67,58,9,0.968953094353927,"TCU","Belmont",3,3,0,0,12,400989245,2017-11-29
212,2,"9:02",542,542,"JD Miller Offensive Rebound.",67,58,9,0.968953094353927,"TCU","Belmont",3,3,0,0,12,400989245,2017-11-29
213,2,"8:59",539,539,"JD Miller made Layup.",69,58,11,0.986870949146911,"TCU","Belmont",3,3,0,0,12,400989245,2017-11-29
214,2,"8:59",539,539,"Foul on Nick Hopkins.",69,58,11,0.986870949146911,"TCU","Belmont",3,3,0,0,12,400989245,2017-11-29
215,2,"8:59",539,539,"JD Miller missed Free Throw.",69,58,11,0.986870949146911,"TCU","Belmont",3,3,0,0,12,400989245,2017-11-29
216,2,"8:59",539,539,"Amanze Egekeze Defensive Rebound.",69,58,11,0.986870949146911,"TCU","Belmont",3,3,0,0,12,400989245,2017-11-29
217,2,"8:39",519,519,"Amanze Egekeze missed Three Point Jumper.",69,58,11,0.981518696598176,"TCU","Belmont",3,3,0,0,12,400989245,2017-11-29
218,2,"8:39",519,519,"Kenrich Williams Defensive Rebound.",69,58,11,0.981518696598176,"TCU","Belmont",3,3,0,0,12,400989245,2017-11-29
219,2,"8:28",508,508,"Jaylen Fisher missed Layup.",69,58,11,0.983859324929022,"TCU","Belmont",3,3,0,0,12,400989245,2017-11-29
220,2,"8:28",508,508,"Ahmed Hamdy-Mohamed Offensive Rebound.",69,58,11,0.983859324929022,"TCU","Belmont",3,3,0,0,12,400989245,2017-11-29
221,2,"8:25",505,505,"Ahmed Hamdy-Mohamed made Two Point Tip Shot.",71,58,13,0.990546698472566,"TCU","Belmont",3,3,0,0,12,400989245,2017-11-29
222,2,"8:05",485,485,"Nick Hopkins missed Three Point Jumper.",71,58,13,0.990292723950151,"TCU","Belmont",3,3,0,0,12,400989245,2017-11-29
223,2,"8:05",485,485,"Belmont Deadball Team Rebound.",71,58,13,0.990292723950151,"TCU","Belmont",3,3,0,0,12,400989245,2017-11-29
224,2,"8:02",482,482,"Foul on Ahmed Hamdy-Mohamed.",71,58,13,0.990292723950151,"TCU","Belmont",3,3,0,0,12,400989245,2017-11-29
225,2,"8:01",481,481,"Austin Luke Turnover.",71,58,13,0.990292723950151,"TCU","Belmont",3,3,0,0,12,400989245,2017-11-29
226,2,"8:00",480,480,"Kenrich Williams Steal.",71,58,13,0.990292723950151,"TCU","Belmont",3,3,0,0,12,400989245,2017-11-29
227,2,"7:51",471,471,"Foul on Dylan Windler.",71,58,13,0.992486451469841,"TCU","Belmont",3,3,0,0,12,400989245,2017-11-29
228,2,"7:51",471,471,"Official TV Timeout",71,58,13,0.992486451469841,"TCU","Belmont",3,3,0,0,12,400989245,2017-11-29
229,2,"7:51",471,471,"JD Miller missed Free Throw.",71,58,13,0.992486451469841,"TCU","Belmont",3,3,0,0,12,400989245,2017-11-29
230,2,"7:51",471,471,"TCU Deadball Team Rebound.",71,58,13,0.992486451469841,"TCU","Belmont",3,3,0,0,12,400989245,2017-11-29
231,2,"7:51",471,471,"JD Miller made Free Throw.",72,58,14,0.994373100554097,"TCU","Belmont",3,3,0,0,12,400989245,2017-11-29
232,2,"7:39",459,459,"Kevin McClain made Three Point Jumper. Assisted by Amanze Egekeze.",72,61,11,0.988275558854568,"TCU","Belmont",3,3,0,0,12,400989245,2017-11-29
233,2,"7:24",444,444,"Ahmed Hamdy-Mohamed made Layup. Assisted by Kenrich Williams.",74,61,13,0.989097958587823,"TCU","Belmont",3,3,0,0,12,400989245,2017-11-29
234,2,"7:06",426,426,"Kevin McClain made Three Point Jumper. Assisted by Amanze Egekeze.",74,64,10,0.980385008069882,"TCU","Belmont",3,3,0,0,12,400989245,2017-11-29
235,2,"6:37",397,397,"Alex Robinson Turnover.",74,64,10,0.984363968283826,"TCU","Belmont",3,3,0,0,12,400989245,2017-11-29
236,2,"6:23",383,383,"Kevin McClain missed Three Point Jumper.",74,64,10,0.983162651025843,"TCU","Belmont",3,3,0,0,12,400989245,2017-11-29
237,2,"6:23",383,383,"Ahmed Hamdy-Mohamed Defensive Rebound.",74,64,10,0.983162651025843,"TCU","Belmont",3,3,0,0,12,400989245,2017-11-29
238,2,"5:59",359,359,"Alex Robinson missed Layup.",74,64,10,0.986589363126349,"TCU","Belmont",3,3,0,0,12,400989245,2017-11-29
239,2,"5:59",359,359,"Belmont Defensive Rebound.",74,64,10,0.986589363126349,"TCU","Belmont",3,3,0,0,12,400989245,2017-11-29
240,2,"5:29",329,329,"Nick Hopkins missed Three Point Jumper.",74,64,10,0.984573300111933,"TCU","Belmont",3,3,0,0,12,400989245,2017-11-29
241,2,"5:29",329,329,"Kenrich Williams Defensive Rebound.",74,64,10,0.984573300111933,"TCU","Belmont",3,3,0,0,12,400989245,2017-11-29
242,2,"5:21",321,321,"Foul on Nick Hopkins.",74,64,10,0.984573300111933,"TCU","Belmont",3,3,0,0,12,400989245,2017-11-29
243,2,"5:21",321,321,"Alex Robinson missed Free Throw.",74,64,10,0.984573300111933,"TCU","Belmont",3,3,0,0,12,400989245,2017-11-29
244,2,"5:21",321,321,"TCU Deadball Team Rebound.",74,64,10,0.984573300111933,"TCU","Belmont",3,3,0,0,12,400989245,2017-11-29
245,2,"5:21",321,321,"Alex Robinson made Free Throw.",75,64,11,0.988682489395249,"TCU","Belmont",3,3,0,0,12,400989245,2017-11-29
246,2,"5:04",304,304,"Amanze Egekeze missed Three Point Jumper.",75,64,11,0.989796339437096,"TCU","Belmont",3,3,0,0,12,400989245,2017-11-29
247,2,"5:04",304,304,"Kenrich Williams Defensive Rebound.",75,64,11,0.989796339437096,"TCU","Belmont",3,3,0,0,12,400989245,2017-11-29
248,2,"4:54",294,294,"Jaylen Fisher Turnover.",75,64,11,0.991806222892633,"TCU","Belmont",3,3,0,0,12,400989245,2017-11-29
249,2,"4:54",294,294,"Austin Luke Steal.",75,64,11,0.991806222892633,"TCU","Belmont",3,3,0,0,12,400989245,2017-11-29
250,2,"4:47",287,287,"Michael Benkert missed Three Point Jumper.",75,64,11,0.991674791966537,"TCU","Belmont",3,3,0,0,12,400989245,2017-11-29
251,2,"4:47",287,287,"Jaylen Fisher Defensive Rebound.",75,64,11,0.991674791966537,"TCU","Belmont",3,3,0,0,12,400989245,2017-11-29
252,2,"4:26",266,266,"JD Miller made Layup.",77,64,13,0.996832810592832,"TCU","Belmont",3,3,0,0,12,400989245,2017-11-29
253,2,"3:59",239,239,"Michael Benkert missed Three Point Jumper.",77,64,13,0.99770822918226,"TCU","Belmont",3,3,0,0,12,400989245,2017-11-29
254,2,"3:59",239,239,"Alex Robinson Defensive Rebound.",77,64,13,0.99770822918226,"TCU","Belmont",3,3,0,0,12,400989245,2017-11-29
255,2,"3:50",230,230,"Kenrich Williams missed Layup.",77,64,13,0.99770822918226,"TCU","Belmont",3,3,0,0,12,400989245,2017-11-29
256,2,"3:50",230,230,"Seth Adelsperger Block.",77,64,13,0.99770822918226,"TCU","Belmont",3,3,0,0,12,400989245,2017-11-29
257,2,"3:49",229,229,"TCU Offensive Rebound.",77,64,13,0.998538292378642,"TCU","Belmont",3,3,0,0,12,400989245,2017-11-29
258,2,"3:49",229,229,"Official TV Timeout",77,64,13,0.998538292378642,"TCU","Belmont",3,3,0,0,12,400989245,2017-11-29
259,2,"3:35",215,215,"Jaylen Fisher missed Three Point Jumper.",77,64,13,0.998533349118384,"TCU","Belmont",3,3,0,0,12,400989245,2017-11-29
260,2,"3:35",215,215,"Caleb Hollander Defensive Rebound.",77,64,13,0.998533349118384,"TCU","Belmont",3,3,0,0,12,400989245,2017-11-29
261,2,"3:23",203,203,"Caleb Hollander missed Three Point Jumper.",77,64,13,0.998954071921462,"TCU","Belmont",3,3,0,0,12,400989245,2017-11-29
262,2,"3:23",203,203,"Kenrich Williams Defensive Rebound.",77,64,13,0.998954071921462,"TCU","Belmont",3,3,0,0,12,400989245,2017-11-29
263,2,"3:06",186,186,"Jaylen Fisher Turnover.",77,64,13,0.999100821260838,"TCU","Belmont",3,3,0,0,12,400989245,2017-11-29
264,2,"3:05",185,185,"Nick Hopkins Steal.",77,64,13,0.999100821260838,"TCU","Belmont",3,3,0,0,12,400989245,2017-11-29
265,2,"2:59",179,179,"Nick Hopkins made Three Point Jumper. Assisted by Austin Luke.",77,67,10,0.996785812002983,"TCU","Belmont",3,3,0,0,12,400989245,2017-11-29
266,2,"2:38",158,158,"Jaylen Fisher missed Three Point Jumper.",77,67,10,0.997794026446424,"TCU","Belmont",3,3,0,0,12,400989245,2017-11-29
267,2,"2:38",158,158,"Austin Luke Defensive Rebound.",77,67,10,0.997794026446424,"TCU","Belmont",3,3,0,0,12,400989245,2017-11-29
268,2,"2:23",143,143,"Austin Luke Turnover.",77,67,10,0.997568235990234,"TCU","Belmont",3,3,0,0,12,400989245,2017-11-29
269,2,"2:23",143,143,"Vladimir Brodziansky Steal.",77,67,10,0.997568235990234,"TCU","Belmont",3,3,0,0,12,400989245,2017-11-29
270,2,"2:05",125,125,"Kouat Noi missed Three Point Jumper.",77,67,10,0.99816359747971,"TCU","Belmont",3,3,0,0,12,400989245,2017-11-29
271,2,"2:05",125,125,"Austin Luke Defensive Rebound.",77,67,10,0.99816359747971,"TCU","Belmont",3,3,0,0,12,400989245,2017-11-29
272,2,"1:58",118,118,"Nick Hopkins missed Three Point Jumper.",77,67,10,0.998826858153029,"TCU","Belmont",3,3,0,0,12,400989245,2017-11-29
273,2,"1:58",118,118,"Belmont Deadball Team Rebound.",77,67,10,0.998826858153029,"TCU","Belmont",3,3,0,0,12,400989245,2017-11-29
274,2,"1:55",115,115,"Foul on Desmond Bane.",77,67,10,0.998826858153029,"TCU","Belmont",3,3,0,0,12,400989245,2017-11-29
275,2,"1:50",110,110,"Amanze Egekeze made Three Point Jumper. Assisted by Austin Luke.",77,70,7,0.992927085277373,"TCU","Belmont",3,3,0,0,12,400989245,2017-11-29
276,2,"1:21",81,81,"Vladimir Brodziansky made Dunk. Assisted by Alex Robinson.",79,70,9,0.999273808891044,"TCU","Belmont",3,3,0,0,12,400989245,2017-11-29
277,2,"1:20",80,80,"TCU  Timeout",79,70,9,0.999273808891044,"TCU","Belmont",2,3,1,0,12,400989245,2017-11-29
278,2,"1:10",70,70,"Nick Hopkins missed Three Point Jumper.",79,70,9,0.999215342833839,"TCU","Belmont",2,3,1,0,12,400989245,2017-11-29
279,2,"1:10",70,70,"Alex Robinson Defensive Rebound.",79,70,9,0.999215342833839,"TCU","Belmont",2,3,1,0,12,400989245,2017-11-29
280,2,"0:46",46,46,"Alex Robinson missed Three Point Jumper.",79,70,9,0.999932279035658,"TCU","Belmont",2,3,1,0,12,400989245,2017-11-29
281,2,"0:46",46,46,"Dylan Windler Defensive Rebound.",79,70,9,0.999932279035658,"TCU","Belmont",2,3,1,0,12,400989245,2017-11-29
282,2,"0:42",42,42,"Foul on Kenrich Williams.",79,70,9,0.999690250374894,"TCU","Belmont",2,3,1,0,12,400989245,2017-11-29
283,2,"0:28",28,28,"Foul on Kenrich Williams.",79,70,9,0.999984817809986,"TCU","Belmont",2,3,1,1,12,400989245,2017-11-29
284,2,"0:28",28,28,"Kevin McClain made Free Throw.",79,71,8,0.999952213259128,"TCU","Belmont",2,3,1,1,12,400989245,2017-11-29
285,2,"0:28",28,28,"Kevin McClain made Free Throw.",79,72,7,0.999849599253197,"TCU","Belmont",2,3,1,1,12,400989245,2017-11-29
286,2,"0:28",28,28,"Belmont  Timeout",79,72,7,0.999849599253197,"TCU","Belmont",2,2,1,1,12,400989245,2017-11-29
287,2,"0:26",26,26,"Foul on Kevin McClain.",79,72,7,0.999913302086992,"TCU","Belmont",2,2,1,1,12,400989245,2017-11-29
288,2,"0:24",24,24,"Foul on Kevin McClain.",79,72,7,0.998732611423559,"TCU","Belmont",2,2,1,1,12,400989245,2017-11-29
289,2,"0:24",24,24,"Desmond Bane made Free Throw.",80,72,8,0.99948737812815,"TCU","Belmont",2,2,1,1,12,400989245,2017-11-29
290,2,"0:24",24,24,"Desmond Bane made Free Throw.",81,72,9,0.999792752613236,"TCU","Belmont",2,2,1,1,12,400989245,2017-11-29
291,2,"0:22",22,22,"Dylan Windler made Layup.",81,74,7,0.999942543888642,"TCU","Belmont",2,2,1,1,12,400989245,2017-11-29
292,2,"0:21",21,21,"Belmont  Timeout",81,74,7,0.999993413766871,"TCU","Belmont",2,1,1,1,12,400989245,2017-11-29
293,2,"0:21",21,21,"Foul on Austin Luke.",81,74,7,0.999993413766871,"TCU","Belmont",2,1,1,1,12,400989245,2017-11-29
294,2,"0:21",21,21,"Desmond Bane made Free Throw.",82,74,8,0.999998713133872,"TCU","Belmont",2,1,1,1,12,400989245,2017-11-29
295,2,"0:21",21,21,"Desmond Bane made Free Throw.",83,74,9,0.999999748563809,"TCU","Belmont",2,1,1,1,12,400989245,2017-11-29
296,2,"0:16",16,16,"Dylan Windler made Layup.",83,76,7,0.999993821072446,"TCU","Belmont",2,1,0,1,12,400989245,2017-11-29
297,2,"0:13",13,13,"Foul on Nick Hopkins.",83,76,7,0.999988234453302,"TCU","Belmont",2,1,0,1,12,400989245,2017-11-29
298,2,"0:13",13,13,"Desmond Bane made Free Throw.",84,76,8,0.999997175556917,"TCU","Belmont",2,1,0,1,12,400989245,2017-11-29
299,2,"0:13",13,13,"Desmond Bane made Free Throw.",85,76,9,0.999999321967374,"TCU","Belmont",2,1,0,1,12,400989245,2017-11-29
300,2,"0:08",8,8,"Dylan Windler Turnover.",85,76,9,0.999999700596879,"TCU","Belmont",2,1,0,1,12,400989245,2017-11-29
301,2,"0:07",7,7,"Kenrich Williams Steal.",85,76,9,0.999999700596879,"TCU","Belmont",2,1,0,1,12,400989245,2017-11-29
302,2,"0:04",4,4,"Desmond Bane made Dunk. Assisted by Kenrich Williams.",87,76,11,0.999999997039622,"TCU","Belmont",2,1,0,1,12,400989245,2017-11-29
303,2,"0:00",0,0,"End of Game",87,76,11,1,"TCU","Belmont",2,1,0,1,12,400989245,2017-11-29
