"play_id","half","time_remaining_half","secs_remaining","secs_remaining_absolute","description","home_score","away_score","score_diff","win_prob","home","away","home_time_out_remaining","away_time_out_remaining","home_timeout_ind","away_timeout_ind","home_favored_by","game_id","date"
1,1,"20:00",2400,2400,"PLAY",0,0,0,0.5,"Manhattan","Winthrop",4,4,0,0,NA,400916669,2016-11-15
2,1,"20:00",2400,2400,"Jump Ball won by Winthrop",0,0,0,0.510165246282501,"Manhattan","Winthrop",4,4,0,0,NA,400916669,2016-11-15
3,1,"19:40",2380,2380,"Foul on Zavier Turner.",0,0,0,0.511793930844357,"Manhattan","Winthrop",4,4,0,0,NA,400916669,2016-11-15
4,1,"19:29",2369,2369,"Duby Okeke missed Dunk.",0,0,0,0.50956003899291,"Manhattan","Winthrop",4,4,0,0,NA,400916669,2016-11-15
5,1,"19:29",2369,2369,"Ahmed Ismail Block.",0,0,0,0.50956003899291,"Manhattan","Winthrop",4,4,0,0,NA,400916669,2016-11-15
6,1,"19:29",2369,2369,"Keon Johnson Offensive Rebound.",0,0,0,0.50956003899291,"Manhattan","Winthrop",4,4,0,0,NA,400916669,2016-11-15
7,1,"19:23",2363,2363,"Keon Johnson Turnover.",0,0,0,0.50956003899291,"Manhattan","Winthrop",4,4,0,0,NA,400916669,2016-11-15
8,1,"19:06",2346,2346,"Zavier Turner made Jumper.",2,0,2,0.556592009956795,"Manhattan","Winthrop",4,4,0,0,NA,400916669,2016-11-15
9,1,"18:48",2328,2328,"Xavier Cooks made Layup. Assisted by Anders Broman.",2,2,0,0.531092628062381,"Manhattan","Winthrop",4,4,0,0,NA,400916669,2016-11-15
10,1,"18:29",2309,2309,"Foul on Duby Okeke.",2,2,0,0.50903900167792,"Manhattan","Winthrop",4,4,0,0,NA,400916669,2016-11-15
11,1,"18:28",2308,2308,"Zane Waterman Turnover.",2,2,0,0.50903900167792,"Manhattan","Winthrop",4,4,0,0,NA,400916669,2016-11-15
12,1,"18:18",2298,2298,"Foul on Zane Waterman.",2,2,0,0.521029767319393,"Manhattan","Winthrop",4,4,0,0,NA,400916669,2016-11-15
13,1,"18:12",2292,2292,"Xavier Cooks missed Layup.",2,2,0,0.521029767319393,"Manhattan","Winthrop",4,4,0,0,NA,400916669,2016-11-15
14,1,"18:12",2292,2292,"Ahmed Ismail Block.",2,2,0,0.521029767319393,"Manhattan","Winthrop",4,4,0,0,NA,400916669,2016-11-15
15,1,"18:12",2292,2292,"Zavier Turner Defensive Rebound.",2,2,0,0.521029767319393,"Manhattan","Winthrop",4,4,0,0,NA,400916669,2016-11-15
16,1,"18:03",2283,2283,"Calvin Crawford made Three Point Jumper. Assisted by Ahmed Ismail.",5,2,3,0.587116552647273,"Manhattan","Winthrop",4,4,0,0,NA,400916669,2016-11-15
17,1,"17:43",2263,2263,"Xavier Cooks missed Three Point Jumper.",5,2,3,0.610484912586829,"Manhattan","Winthrop",4,4,0,0,NA,400916669,2016-11-15
18,1,"17:43",2263,2263,"Zane Waterman Defensive Rebound.",5,2,3,0.610484912586829,"Manhattan","Winthrop",4,4,0,0,NA,400916669,2016-11-15
19,1,"17:31",2251,2251,"Foul on Xavier Cooks.",5,2,3,0.592669789542667,"Manhattan","Winthrop",4,4,0,0,NA,400916669,2016-11-15
20,1,"17:31",2251,2251,"Ahmed Ismail missed Free Throw.",5,2,3,0.592669789542667,"Manhattan","Winthrop",4,4,0,0,NA,400916669,2016-11-15
21,1,"17:31",2251,2251,"Manhattan Deadball Team Rebound.",5,2,3,0.592669789542667,"Manhattan","Winthrop",4,4,0,0,NA,400916669,2016-11-15
22,1,"17:31",2251,2251,"Ahmed Ismail made Free Throw.",6,2,4,0.615744190833305,"Manhattan","Winthrop",4,4,0,0,NA,400916669,2016-11-15
23,1,"17:22",2242,2242,"Anders Broman missed Three Point Jumper.",6,2,4,0.620444557817355,"Manhattan","Winthrop",4,4,0,0,NA,400916669,2016-11-15
24,1,"17:22",2242,2242,"Xavier Cooks Offensive Rebound.",6,2,4,0.620444557817355,"Manhattan","Winthrop",4,4,0,0,NA,400916669,2016-11-15
25,1,"17:12",2232,2232,"Keon Johnson made Three Point Jumper. Assisted by Xavier Cooks.",6,5,1,0.545473881201166,"Manhattan","Winthrop",4,4,0,0,NA,400916669,2016-11-15
26,1,"17:00",2220,2220,"Calvin Crawford made Three Point Jumper. Assisted by Aaron Walker Jr..",9,5,4,0.618826457923375,"Manhattan","Winthrop",4,4,0,0,NA,400916669,2016-11-15
27,1,"16:48",2208,2208,"Foul on Aaron Walker Jr..",9,5,4,0.629806472033768,"Manhattan","Winthrop",4,4,0,0,NA,400916669,2016-11-15
28,1,"16:45",2205,2205,"Keon Johnson made Three Point Jumper. Assisted by Bjorn Broman.",9,8,1,0.54783244965199,"Manhattan","Winthrop",4,4,0,0,NA,400916669,2016-11-15
29,1,"16:37",2197,2197,"Thomas Capuano missed Three Point Jumper.",9,8,1,0.557566795976686,"Manhattan","Winthrop",4,4,0,0,NA,400916669,2016-11-15
30,1,"16:37",2197,2197,"Tevin Prescott Defensive Rebound.",9,8,1,0.557566795976686,"Manhattan","Winthrop",4,4,0,0,NA,400916669,2016-11-15
31,1,"16:26",2186,2186,"Foul on Zane Waterman.",9,8,1,0.544992909230217,"Manhattan","Winthrop",4,4,0,0,NA,400916669,2016-11-15
32,1,"16:25",2185,2185,"Foul on Aaron Walker Jr..",9,8,1,0.544992909230217,"Manhattan","Winthrop",4,4,0,0,NA,400916669,2016-11-15
33,1,"16:11",2171,2171,"Foul on Thomas Capuano.",9,8,1,0.537394834362527,"Manhattan","Winthrop",4,4,0,0,NA,400916669,2016-11-15
34,1,"16:10",2170,2170,"Keon Johnson missed Three Point Jumper.",9,8,1,0.537394834362527,"Manhattan","Winthrop",4,4,0,0,NA,400916669,2016-11-15
35,1,"16:10",2170,2170,"Aaron Walker Jr. Defensive Rebound.",9,8,1,0.537394834362527,"Manhattan","Winthrop",4,4,0,0,NA,400916669,2016-11-15
36,1,"16:00",2160,2160,"Aaron Walker Jr. made Layup.",11,8,3,0.597127411314518,"Manhattan","Winthrop",4,4,0,0,NA,400916669,2016-11-15
37,1,"15:49",2149,2149,"Tevin Prescott made Layup. Assisted by Joshua Davenport.",11,10,1,0.548469513384562,"Manhattan","Winthrop",4,4,0,0,NA,400916669,2016-11-15
38,1,"15:30",2130,2130,"Samson Usilo Turnover.",11,10,1,0.542478451673532,"Manhattan","Winthrop",4,4,0,0,NA,400916669,2016-11-15
39,1,"15:30",2130,2130,"Official TV Timeout",11,10,1,0.542478451673532,"Manhattan","Winthrop",4,4,0,0,NA,400916669,2016-11-15
40,1,"15:18",2118,2118,"Keon Johnson missed Three Point Jumper.",11,10,1,0.53618909047836,"Manhattan","Winthrop",4,4,0,0,NA,400916669,2016-11-15
41,1,"15:18",2118,2118,"Calvin Crawford Defensive Rebound.",11,10,1,0.53618909047836,"Manhattan","Winthrop",4,4,0,0,NA,400916669,2016-11-15
42,1,"14:57",2097,2097,"Foul on Joshua Davenport.",11,10,1,0.543626546073584,"Manhattan","Winthrop",4,4,0,0,NA,400916669,2016-11-15
43,1,"14:55",2095,2095,"Zavier Turner missed Layup.",11,10,1,0.543626546073584,"Manhattan","Winthrop",4,4,0,0,NA,400916669,2016-11-15
44,1,"14:55",2095,2095,"Tevin Prescott Block.",11,10,1,0.543626546073584,"Manhattan","Winthrop",4,4,0,0,NA,400916669,2016-11-15
45,1,"14:55",2095,2095,"Bjorn Broman Defensive Rebound.",11,10,1,0.543626546073584,"Manhattan","Winthrop",4,4,0,0,NA,400916669,2016-11-15
46,1,"14:51",2091,2091,"Foul on Calvin Crawford.",11,10,1,0.543626546073584,"Manhattan","Winthrop",4,4,0,0,NA,400916669,2016-11-15
47,1,"14:51",2091,2091,"Joshua Davenport made Free Throw.",11,11,0,0.512724272350445,"Manhattan","Winthrop",4,4,0,0,NA,400916669,2016-11-15
48,1,"14:51",2091,2091,"Joshua Davenport made Free Throw.",11,12,-1,0.481724420078486,"Manhattan","Winthrop",4,4,0,0,NA,400916669,2016-11-15
49,1,"14:41",2081,2081,"Foul on Roderick Perkins.",11,12,-1,0.495172584026204,"Manhattan","Winthrop",4,4,0,0,NA,400916669,2016-11-15
50,1,"14:36",2076,2076,"Foul on Tevin Prescott.",11,12,-1,0.479107710724022,"Manhattan","Winthrop",4,4,0,0,NA,400916669,2016-11-15
51,1,"14:36",2076,2076,"Na'Quan Council missed Free Throw.",11,12,-1,0.479107710724022,"Manhattan","Winthrop",4,4,0,0,NA,400916669,2016-11-15
52,1,"14:36",2076,2076,"Manhattan Deadball Team Rebound.",11,12,-1,0.479107710724022,"Manhattan","Winthrop",4,4,0,0,NA,400916669,2016-11-15
53,1,"14:36",2076,2076,"Na'Quan Council made Free Throw.",12,12,0,0.505878250067503,"Manhattan","Winthrop",4,4,0,0,NA,400916669,2016-11-15
54,1,"14:29",2069,2069,"Roderick Perkins made Three Point Jumper. Assisted by Bjorn Broman.",12,15,-3,0.414775958920001,"Manhattan","Winthrop",4,4,0,0,NA,400916669,2016-11-15
55,1,"14:10",2050,2050,"Calvin Crawford made Three Point Jumper. Assisted by Tyler Wilson.",15,15,0,0.501354931557159,"Manhattan","Winthrop",4,4,0,0,NA,400916669,2016-11-15
56,1,"13:56",2036,2036,"Joshua Davenport missed Layup.",15,15,0,0.520635008863721,"Manhattan","Winthrop",4,4,0,0,NA,400916669,2016-11-15
57,1,"13:56",2036,2036,"Ahmed Ismail Block.",15,15,0,0.520635008863721,"Manhattan","Winthrop",4,4,0,0,NA,400916669,2016-11-15
58,1,"13:56",2036,2036,"Winthrop Offensive Rebound.",15,15,0,0.520635008863721,"Manhattan","Winthrop",4,4,0,0,NA,400916669,2016-11-15
59,1,"13:50",2030,2030,"Roderick Perkins missed Three Point Jumper.",15,15,0,0.520635008863721,"Manhattan","Winthrop",4,4,0,0,NA,400916669,2016-11-15
60,1,"13:50",2030,2030,"Zavier Turner Defensive Rebound.",15,15,0,0.520635008863721,"Manhattan","Winthrop",4,4,0,0,NA,400916669,2016-11-15
61,1,"13:39",2019,2019,"Foul on Tevin Prescott.",15,15,0,0.519434891163186,"Manhattan","Winthrop",4,4,0,0,NA,400916669,2016-11-15
62,1,"13:39",2019,2019,"Ahmed Ismail made Free Throw.",16,15,1,0.548196026028419,"Manhattan","Winthrop",4,4,0,0,NA,400916669,2016-11-15
63,1,"13:39",2019,2019,"Ahmed Ismail made Free Throw.",17,15,2,0.576638790176977,"Manhattan","Winthrop",4,4,0,0,NA,400916669,2016-11-15
64,1,"13:29",2009,2009,"Duby Okeke Turnover.",17,15,2,0.563479567195078,"Manhattan","Winthrop",4,4,0,0,NA,400916669,2016-11-15
65,1,"13:20",2000,2000,"Foul on Ahmed Ismail.",17,15,2,0.563479567195078,"Manhattan","Winthrop",4,4,0,0,NA,400916669,2016-11-15
66,1,"13:20",2000,2000,"Ahmed Ismail Turnover.",17,15,2,0.563479567195078,"Manhattan","Winthrop",4,4,0,0,NA,400916669,2016-11-15
67,1,"12:58",1978,1978,"Anders Broman made Jumper. Assisted by Bjorn Broman.",17,17,0,0.513268818772614,"Manhattan","Winthrop",4,4,0,0,NA,400916669,2016-11-15
68,1,"12:31",1951,1951,"Na'Quan Council made Three Point Jumper. Assisted by Tyler Wilson.",20,17,3,0.61519188551271,"Manhattan","Winthrop",4,4,0,0,NA,400916669,2016-11-15
69,1,"12:13",1933,1933,"Xavier Cooks missed Three Point Jumper.",20,17,3,0.599039007318006,"Manhattan","Winthrop",4,4,0,0,NA,400916669,2016-11-15
70,1,"12:13",1933,1933,"Duby Okeke Offensive Rebound.",20,17,3,0.599039007318006,"Manhattan","Winthrop",4,4,0,0,NA,400916669,2016-11-15
71,1,"12:02",1922,1922,"Xavier Cooks made Layup. Assisted by Bjorn Broman.",20,19,1,0.53055559319976,"Manhattan","Winthrop",4,4,0,0,NA,400916669,2016-11-15
72,1,"11:48",1908,1908,"Calvin Crawford missed Three Point Jumper.",20,19,1,0.53809779503911,"Manhattan","Winthrop",4,4,0,0,NA,400916669,2016-11-15
73,1,"11:48",1908,1908,"Bjorn Broman Defensive Rebound.",20,19,1,0.53809779503911,"Manhattan","Winthrop",4,4,0,0,NA,400916669,2016-11-15
74,1,"11:40",1900,1900,"Anders Broman missed Three Point Jumper.",20,19,1,0.53809779503911,"Manhattan","Winthrop",4,4,0,0,NA,400916669,2016-11-15
75,1,"11:40",1900,1900,"Roderick Perkins Offensive Rebound.",20,19,1,0.53809779503911,"Manhattan","Winthrop",4,4,0,0,NA,400916669,2016-11-15
76,1,"11:35",1895,1895,"Xavier Cooks made Layup. Assisted by Roderick Perkins.",20,21,-1,0.488701727958165,"Manhattan","Winthrop",4,4,0,0,NA,400916669,2016-11-15
77,1,"11:19",1879,1879,"Na'Quan Council missed Three Point Jumper.",20,21,-1,0.479408023648101,"Manhattan","Winthrop",4,4,0,0,NA,400916669,2016-11-15
78,1,"11:19",1879,1879,"Na'Quan Council Offensive Rebound.",20,21,-1,0.479408023648101,"Manhattan","Winthrop",4,4,0,0,NA,400916669,2016-11-15
79,1,"11:13",1873,1873,"Foul on Duby Okeke.",20,21,-1,0.479408023648101,"Manhattan","Winthrop",4,4,0,0,NA,400916669,2016-11-15
80,1,"11:13",1873,1873,"Official TV Timeout",20,21,-1,0.479408023648101,"Manhattan","Winthrop",4,4,0,0,NA,400916669,2016-11-15
81,1,"11:13",1873,1873,"Technical Foul on Calvin Crawford.",20,21,-1,0.479408023648101,"Manhattan","Winthrop",4,4,0,0,NA,400916669,2016-11-15
82,1,"11:13",1873,1873,"Technical Foul on Xavier Cooks.",20,21,-1,0.479408023648101,"Manhattan","Winthrop",4,4,0,0,NA,400916669,2016-11-15
83,1,"11:13",1873,1873,"Foul on Calvin Crawford.",20,21,-1,0.479408023648101,"Manhattan","Winthrop",4,4,0,0,NA,400916669,2016-11-15
84,1,"11:13",1873,1873,"Foul on Xavier Cooks.",20,21,-1,0.479408023648101,"Manhattan","Winthrop",4,4,0,0,NA,400916669,2016-11-15
85,1,"11:13",1873,1873,"Calvin Crawford missed Free Throw.",20,21,-1,0.479408023648101,"Manhattan","Winthrop",4,4,0,0,NA,400916669,2016-11-15
86,1,"11:13",1873,1873,"Manhattan Deadball Team Rebound.",20,21,-1,0.479408023648101,"Manhattan","Winthrop",4,4,0,0,NA,400916669,2016-11-15
87,1,"11:13",1873,1873,"Calvin Crawford made Free Throw.",21,21,0,0.510430216882624,"Manhattan","Winthrop",4,4,0,0,NA,400916669,2016-11-15
88,1,"11:03",1863,1863,"Foul on Ahmed Ismail.",21,21,0,0.530944293722426,"Manhattan","Winthrop",4,4,0,0,NA,400916669,2016-11-15
89,1,"11:03",1863,1863,"Joshua Davenport made Free Throw.",21,22,-1,0.497362248636051,"Manhattan","Winthrop",4,4,0,0,NA,400916669,2016-11-15
90,1,"11:03",1863,1863,"Joshua Davenport missed Free Throw.",21,22,-1,0.497362248636051,"Manhattan","Winthrop",4,4,0,0,NA,400916669,2016-11-15
91,1,"11:03",1863,1863,"Zavier Peart Defensive Rebound.",21,22,-1,0.497362248636051,"Manhattan","Winthrop",4,4,0,0,NA,400916669,2016-11-15
92,1,"10:52",1852,1852,"Foul on Josh Ferguson.",21,22,-1,0.488778153607801,"Manhattan","Winthrop",4,4,0,0,NA,400916669,2016-11-15
93,1,"10:52",1852,1852,"Zavier Peart made Free Throw.",22,22,0,0.520761432182538,"Manhattan","Winthrop",4,4,0,0,NA,400916669,2016-11-15
94,1,"10:52",1852,1852,"Tyler Wilson Turnover.",22,22,0,0.520761432182538,"Manhattan","Winthrop",4,4,0,0,NA,400916669,2016-11-15
95,1,"10:46",1846,1846,"Foul on Tyler Wilson.",22,22,0,0.492659180147087,"Manhattan","Winthrop",4,4,0,0,NA,400916669,2016-11-15
96,1,"10:46",1846,1846,"Bjorn Broman made Free Throw.",22,23,-1,0.461769170909315,"Manhattan","Winthrop",4,4,0,0,NA,400916669,2016-11-15
97,1,"10:46",1846,1846,"Bjorn Broman missed Free Throw.",22,23,-1,0.461769170909315,"Manhattan","Winthrop",4,4,0,0,NA,400916669,2016-11-15
98,1,"10:46",1846,1846,"Joshua Davenport Offensive Rebound.",22,23,-1,0.461769170909315,"Manhattan","Winthrop",4,4,0,0,NA,400916669,2016-11-15
99,1,"10:42",1842,1842,"Bjorn Broman missed Three Point Jumper.",22,23,-1,0.461769170909315,"Manhattan","Winthrop",4,4,0,0,NA,400916669,2016-11-15
100,1,"10:42",1842,1842,"Bjorn Broman Offensive Rebound.",22,23,-1,0.461769170909315,"Manhattan","Winthrop",4,4,0,0,NA,400916669,2016-11-15
101,1,"10:36",1836,1836,"Keon Johnson missed Three Point Jumper.",22,23,-1,0.487178312491605,"Manhattan","Winthrop",4,4,0,0,NA,400916669,2016-11-15
102,1,"10:36",1836,1836,"Zane Waterman Defensive Rebound.",22,23,-1,0.487178312491605,"Manhattan","Winthrop",4,4,0,0,NA,400916669,2016-11-15
103,1,"10:26",1826,1826,"Zavier Turner missed Three Point Jumper.",22,23,-1,0.502289308168309,"Manhattan","Winthrop",4,4,0,0,NA,400916669,2016-11-15
104,1,"10:26",1826,1826,"Anders Broman Defensive Rebound.",22,23,-1,0.502289308168309,"Manhattan","Winthrop",4,4,0,0,NA,400916669,2016-11-15
105,1,"10:19",1819,1819,"Foul on Anders Broman.",22,23,-1,0.483299869419507,"Manhattan","Winthrop",4,4,0,0,NA,400916669,2016-11-15
106,1,"10:19",1819,1819,"Anders Broman Turnover.",22,23,-1,0.483299869419507,"Manhattan","Winthrop",4,4,0,0,NA,400916669,2016-11-15
107,1,"10:02",1802,1802,"Na'Quan Council Turnover.",22,23,-1,0.475189839571006,"Manhattan","Winthrop",4,4,0,0,NA,400916669,2016-11-15
108,1,"9:43",1783,1783,"Foul on Na'Quan Council.",22,23,-1,0.461379197255544,"Manhattan","Winthrop",4,4,0,0,NA,400916669,2016-11-15
109,1,"9:43",1783,1783,"Keon Johnson made Free Throw.",22,24,-2,0.427248876748682,"Manhattan","Winthrop",4,4,0,0,NA,400916669,2016-11-15
110,1,"9:43",1783,1783,"Keon Johnson made Free Throw.",22,25,-3,0.393797413254919,"Manhattan","Winthrop",4,4,0,0,NA,400916669,2016-11-15
111,1,"9:34",1774,1774,"Na'Quan Council missed Layup.",22,25,-3,0.406611276888238,"Manhattan","Winthrop",4,4,0,0,NA,400916669,2016-11-15
112,1,"9:34",1774,1774,"Joshua Davenport Defensive Rebound.",22,25,-3,0.406611276888238,"Manhattan","Winthrop",4,4,0,0,NA,400916669,2016-11-15
113,1,"9:25",1765,1765,"Anders Broman made Three Point Jumper. Assisted by Joshua Davenport.",22,28,-6,0.326377506767801,"Manhattan","Winthrop",4,4,0,0,NA,400916669,2016-11-15
114,1,"8:55",1735,1735,"Tyler Wilson made Layup.",24,28,-4,0.377990491401488,"Manhattan","Winthrop",4,4,0,0,NA,400916669,2016-11-15
115,1,"8:38",1718,1718,"Anders Broman missed Jumper.",24,28,-4,0.382224880654171,"Manhattan","Winthrop",4,4,0,0,NA,400916669,2016-11-15
116,1,"8:38",1718,1718,"Thomas Capuano Block.",24,28,-4,0.382224880654171,"Manhattan","Winthrop",4,4,0,0,NA,400916669,2016-11-15
117,1,"8:38",1718,1718,"Zavier Peart Defensive Rebound.",24,28,-4,0.382224880654171,"Manhattan","Winthrop",4,4,0,0,NA,400916669,2016-11-15
118,1,"8:31",1711,1711,"Na'Quan Council missed Layup.",24,28,-4,0.382224880654171,"Manhattan","Winthrop",4,4,0,0,NA,400916669,2016-11-15
119,1,"8:31",1711,1711,"Keon Johnson Defensive Rebound.",24,28,-4,0.382224880654171,"Manhattan","Winthrop",4,4,0,0,NA,400916669,2016-11-15
120,1,"8:27",1707,1707,"Foul on Calvin Crawford.",24,28,-4,0.376427499960758,"Manhattan","Winthrop",4,4,0,0,NA,400916669,2016-11-15
121,1,"8:27",1707,1707,"Keon Johnson made Free Throw.",24,29,-5,0.346958052149891,"Manhattan","Winthrop",4,4,0,0,NA,400916669,2016-11-15
122,1,"8:27",1707,1707,"Keon Johnson made Free Throw.",24,30,-6,0.318616872547038,"Manhattan","Winthrop",4,4,0,0,NA,400916669,2016-11-15
123,1,"8:08",1688,1688,"Foul on Joshua Davenport.",24,30,-6,0.304051030201976,"Manhattan","Winthrop",4,4,0,0,NA,400916669,2016-11-15
124,1,"8:08",1688,1688,"Samson Usilo missed Free Throw.",24,30,-6,0.304051030201976,"Manhattan","Winthrop",4,4,0,0,NA,400916669,2016-11-15
125,1,"8:08",1688,1688,"Manhattan Deadball Team Rebound.",24,30,-6,0.304051030201976,"Manhattan","Winthrop",4,4,0,0,NA,400916669,2016-11-15
126,1,"8:08",1688,1688,"Samson Usilo missed Free Throw.",24,30,-6,0.304051030201976,"Manhattan","Winthrop",4,4,0,0,NA,400916669,2016-11-15
127,1,"8:08",1688,1688,"Joshua Davenport Defensive Rebound.",24,30,-6,0.304051030201976,"Manhattan","Winthrop",4,4,0,0,NA,400916669,2016-11-15
128,1,"7:46",1666,1666,"Joshua Davenport made Jumper.",24,32,-8,0.271152058443945,"Manhattan","Winthrop",4,4,0,0,NA,400916669,2016-11-15
129,1,"7:30",1650,1650,"Zavier Turner Turnover.",24,32,-8,0.273419350537524,"Manhattan","Winthrop",4,4,0,0,NA,400916669,2016-11-15
130,1,"7:30",1650,1650,"Josh Ferguson Steal.",24,32,-8,0.273419350537524,"Manhattan","Winthrop",4,4,0,0,NA,400916669,2016-11-15
131,1,"7:25",1645,1645,"Bjorn Broman Turnover.",24,32,-8,0.262481901042004,"Manhattan","Winthrop",4,4,0,0,NA,400916669,2016-11-15
132,1,"7:25",1645,1645,"Official TV Timeout",24,32,-8,0.262481901042004,"Manhattan","Winthrop",4,4,0,0,NA,400916669,2016-11-15
133,1,"7:15",1635,1635,"Foul on Josh Ferguson.",24,32,-8,0.279037610859689,"Manhattan","Winthrop",4,4,0,0,NA,400916669,2016-11-15
134,1,"7:15",1635,1635,"Tyler Wilson made Free Throw.",25,32,-7,0.306259923520316,"Manhattan","Winthrop",4,4,0,0,NA,400916669,2016-11-15
135,1,"7:15",1635,1635,"Tyler Wilson made Free Throw.",26,32,-6,0.334904326919012,"Manhattan","Winthrop",4,4,0,0,NA,400916669,2016-11-15
136,1,"6:53",1613,1613,"Keon Johnson made Three Point Jumper. Assisted by Adam Pickett.",26,35,-9,0.218345238426406,"Manhattan","Winthrop",4,4,0,0,NA,400916669,2016-11-15
137,1,"6:42",1602,1602,"Foul on Adam Pickett.",26,35,-9,0.236980349773331,"Manhattan","Winthrop",4,4,0,0,NA,400916669,2016-11-15
138,1,"6:42",1602,1602,"Tyler Wilson made Free Throw.",27,35,-8,0.261547857666963,"Manhattan","Winthrop",4,4,0,0,NA,400916669,2016-11-15
139,1,"6:42",1602,1602,"Tyler Wilson made Free Throw.",28,35,-7,0.28770193159944,"Manhattan","Winthrop",4,4,0,0,NA,400916669,2016-11-15
140,1,"6:34",1594,1594,"Anders Broman made Three Point Jumper. Assisted by Roderick Perkins.",28,38,-10,0.226427037670807,"Manhattan","Winthrop",4,4,0,0,NA,400916669,2016-11-15
141,1,"6:08",1568,1568,"Na'Quan Council missed Three Point Jumper.",28,38,-10,0.193542788247333,"Manhattan","Winthrop",4,4,0,0,NA,400916669,2016-11-15
142,1,"6:08",1568,1568,"Zavier Peart Offensive Rebound.",28,38,-10,0.193542788247333,"Manhattan","Winthrop",4,4,0,0,NA,400916669,2016-11-15
143,1,"5:52",1552,1552,"Foul on Josh Ferguson.",28,38,-10,0.195254237083756,"Manhattan","Winthrop",4,4,0,0,NA,400916669,2016-11-15
144,1,"5:52",1552,1552,"Na'Quan Council made Free Throw.",29,38,-9,0.218803990180004,"Manhattan","Winthrop",4,4,0,0,NA,400916669,2016-11-15
145,1,"5:52",1552,1552,"Na'Quan Council made Free Throw.",30,38,-8,0.244331726278295,"Manhattan","Winthrop",4,4,0,0,NA,400916669,2016-11-15
146,1,"5:44",1544,1544,"Roderick Perkins Turnover.",30,38,-8,0.259022726498489,"Manhattan","Winthrop",4,4,0,0,NA,400916669,2016-11-15
147,1,"5:44",1544,1544,"Thomas Capuano Steal.",30,38,-8,0.259022726498489,"Manhattan","Winthrop",4,4,0,0,NA,400916669,2016-11-15
148,1,"5:36",1536,1536,"Tyler Wilson missed Layup.",30,38,-8,0.258497588897326,"Manhattan","Winthrop",4,4,0,0,NA,400916669,2016-11-15
149,1,"5:36",1536,1536,"Josh Ferguson Block.",30,38,-8,0.258497588897326,"Manhattan","Winthrop",4,4,0,0,NA,400916669,2016-11-15
150,1,"5:36",1536,1536,"Adam Pickett Defensive Rebound.",30,38,-8,0.258497588897326,"Manhattan","Winthrop",4,4,0,0,NA,400916669,2016-11-15
151,1,"5:32",1532,1532,"Foul on Ak Ojo.",30,38,-8,0.258497588897326,"Manhattan","Winthrop",4,4,0,0,NA,400916669,2016-11-15
152,1,"5:32",1532,1532,"Adam Pickett made Free Throw.",30,39,-9,0.232664777152785,"Manhattan","Winthrop",4,4,0,0,NA,400916669,2016-11-15
153,1,"5:32",1532,1532,"Adam Pickett made Free Throw.",30,40,-10,0.208686995995708,"Manhattan","Winthrop",4,4,0,0,NA,400916669,2016-11-15
154,1,"5:23",1523,1523,"Zavier Turner made Layup.",32,40,-8,0.253279858261689,"Manhattan","Winthrop",4,4,0,0,NA,400916669,2016-11-15
155,1,"5:09",1509,1509,"Keon Johnson missed Jumper.",32,40,-8,0.251064571556727,"Manhattan","Winthrop",4,4,0,0,NA,400916669,2016-11-15
156,1,"5:09",1509,1509,"Zavier Turner Defensive Rebound.",32,40,-8,0.251064571556727,"Manhattan","Winthrop",4,4,0,0,NA,400916669,2016-11-15
157,1,"4:59",1499,1499,"Thomas Capuano missed Three Point Jumper.",32,40,-8,0.273126733031329,"Manhattan","Winthrop",4,4,0,0,NA,400916669,2016-11-15
158,1,"4:59",1499,1499,"Oliver Ehrnvall Offensive Rebound.",32,40,-8,0.273126733031329,"Manhattan","Winthrop",4,4,0,0,NA,400916669,2016-11-15
159,1,"4:54",1494,1494,"Foul on Ak Ojo.",32,40,-8,0.273126733031329,"Manhattan","Winthrop",4,4,1,0,NA,400916669,2016-11-15
160,1,"4:54",1494,1494,"Ak Ojo Turnover.",32,40,-8,0.273126733031329,"Manhattan","Winthrop",4,4,1,0,NA,400916669,2016-11-15
161,1,"4:54",1494,1494,"Winthrop  Timeout",32,40,-8,0.273126733031329,"Manhattan","Winthrop",3,4,1,0,NA,400916669,2016-11-15
162,1,"4:45",1485,1485,"Roderick Perkins made Three Point Jumper. Assisted by Bjorn Broman.",32,43,-11,0.162361086938865,"Manhattan","Winthrop",3,4,1,0,NA,400916669,2016-11-15
163,1,"4:23",1463,1463,"Foul on Freddy Poole.",32,43,-11,0.195272515769398,"Manhattan","Winthrop",3,4,1,0,NA,400916669,2016-11-15
164,1,"4:23",1463,1463,"Zavier Turner made Free Throw.",33,43,-10,0.218114163049718,"Manhattan","Winthrop",3,4,1,0,NA,400916669,2016-11-15
165,1,"4:23",1463,1463,"Zavier Turner made Free Throw.",34,43,-9,0.242821453486218,"Manhattan","Winthrop",3,4,1,0,NA,400916669,2016-11-15
166,1,"4:13",1453,1453,"Keon Johnson missed Three Point Jumper.",34,43,-9,0.209614761860872,"Manhattan","Winthrop",3,4,1,0,NA,400916669,2016-11-15
167,1,"4:13",1453,1453,"Keon Johnson Offensive Rebound.",34,43,-9,0.209614761860872,"Manhattan","Winthrop",3,4,1,0,NA,400916669,2016-11-15
168,1,"4:03",1443,1443,"Keon Johnson Turnover.",34,43,-9,0.228211913488546,"Manhattan","Winthrop",3,4,1,0,NA,400916669,2016-11-15
169,1,"4:03",1443,1443,"Tyler Wilson Steal.",34,43,-9,0.228211913488546,"Manhattan","Winthrop",3,4,1,0,NA,400916669,2016-11-15
170,1,"3:53",1433,1433,"Thomas Capuano made Jumper.",36,43,-7,0.281862163201435,"Manhattan","Winthrop",3,4,0,0,NA,400916669,2016-11-15
171,1,"3:38",1418,1418,"Foul on Tyler Wilson.",36,43,-7,0.260583066203758,"Manhattan","Winthrop",3,4,0,0,NA,400916669,2016-11-15
172,1,"3:38",1418,1418,"Official TV Timeout",36,43,-7,0.260583066203758,"Manhattan","Winthrop",3,4,0,0,NA,400916669,2016-11-15
173,1,"3:38",1418,1418,"Joshua Davenport made Free Throw.",36,44,-8,0.231828202992001,"Manhattan","Winthrop",3,4,0,0,NA,400916669,2016-11-15
174,1,"3:38",1418,1418,"Joshua Davenport made Free Throw.",36,45,-9,0.205365106639302,"Manhattan","Winthrop",3,4,0,0,NA,400916669,2016-11-15
175,1,"3:28",1408,1408,"Zavier Turner made Three Point Jumper.",39,45,-6,0.306097979247136,"Manhattan","Winthrop",3,4,0,0,NA,400916669,2016-11-15
176,1,"3:06",1386,1386,"Joshua Davenport missed Jumper.",39,45,-6,0.310361255418774,"Manhattan","Winthrop",3,4,0,0,NA,400916669,2016-11-15
177,1,"3:06",1386,1386,"Thomas Capuano Defensive Rebound.",39,45,-6,0.310361255418774,"Manhattan","Winthrop",3,4,0,0,NA,400916669,2016-11-15
178,1,"2:52",1372,1372,"Foul on Keon Johnson.",39,45,-6,0.294641112875799,"Manhattan","Winthrop",3,4,0,0,NA,400916669,2016-11-15
179,1,"2:52",1372,1372,"Zavier Turner made Free Throw.",40,45,-5,0.325503467994329,"Manhattan","Winthrop",3,4,0,0,NA,400916669,2016-11-15
180,1,"2:52",1372,1372,"Zavier Turner made Free Throw.",41,45,-4,0.357957979007014,"Manhattan","Winthrop",3,4,0,0,NA,400916669,2016-11-15
181,1,"2:41",1361,1361,"Anders Broman missed Jumper.",41,45,-4,0.364402515033248,"Manhattan","Winthrop",3,4,0,0,NA,400916669,2016-11-15
182,1,"2:41",1361,1361,"Josh Ferguson Offensive Rebound.",41,45,-4,0.364402515033248,"Manhattan","Winthrop",3,4,0,0,NA,400916669,2016-11-15
183,1,"2:33",1353,1353,"Keon Johnson missed Three Point Jumper.",41,45,-4,0.376541474737791,"Manhattan","Winthrop",3,4,0,0,NA,400916669,2016-11-15
184,1,"2:33",1353,1353,"Zavier Peart Defensive Rebound.",41,45,-4,0.376541474737791,"Manhattan","Winthrop",3,4,0,0,NA,400916669,2016-11-15
185,1,"2:29",1349,1349,"Foul on Josh Ferguson.",41,45,-4,0.355517661130362,"Manhattan","Winthrop",3,4,0,0,NA,400916669,2016-11-15
186,1,"2:29",1349,1349,"Zavier Peart missed Free Throw.",41,45,-4,0.355517661130362,"Manhattan","Winthrop",3,4,0,0,NA,400916669,2016-11-15
