"play_id","half","time_remaining_half","secs_remaining","secs_remaining_absolute","description","home_score","away_score","score_diff","win_prob","home","away","home_time_out_remaining","away_time_out_remaining","home_timeout_ind","away_timeout_ind","home_favored_by","game_id","date"
1,1,"20:00",2400,2400,"PLAY",0,0,0,0.262021652704736,"Arizona State","USC",4,4,0,0,-5,400915692,2017-02-26
2,1,"20:00",2400,2400,"Jump Ball won by USC",0,0,0,0.262021652704736,"Arizona State","USC",4,4,0,0,-5,400915692,2017-02-26
3,1,"19:45",2385,2385,"De'Anthony Melton made Three Point Jumper. Assisted by Jordan McLaughlin.",0,3,-3,0.249546036217458,"Arizona State","USC",4,4,0,0,-5,400915692,2017-02-26
4,1,"19:22",2362,2362,"Obinna Oleka made Three Point Jumper. Assisted by Torian Graham.",3,3,0,0.27915432709268,"Arizona State","USC",4,4,0,0,-5,400915692,2017-02-26
5,1,"18:50",2330,2330,"Bennie Boatwright Turnover.",3,3,0,0.281662488948927,"Arizona State","USC",4,4,0,0,-5,400915692,2017-02-26
6,1,"18:42",2322,2322,"Kodi Justice made Three Point Jumper. Assisted by Shannon Evans II.",6,3,3,0.370395828432956,"Arizona State","USC",4,4,0,0,-5,400915692,2017-02-26
7,1,"18:19",2299,2299,"De'Anthony Melton missed Three Point Jumper.",6,3,3,0.350754113748139,"Arizona State","USC",4,4,0,0,-5,400915692,2017-02-26
8,1,"18:19",2299,2299,"Bennie Boatwright Offensive Rebound.",6,3,3,0.350754113748139,"Arizona State","USC",4,4,0,0,-5,400915692,2017-02-26
9,1,"18:19",2299,2299,"Bennie Boatwright made Two Point Tip Shot.",6,5,1,0.307737381561152,"Arizona State","USC",4,4,0,0,-5,400915692,2017-02-26
10,1,"17:48",2268,2268,"Kodi Justice made Three Point Jumper. Assisted by Shannon Evans II.",9,5,4,0.392109364721475,"Arizona State","USC",4,4,0,0,-5,400915692,2017-02-26
11,1,"17:16",2236,2236,"De'Anthony Melton made Layup. Assisted by Jordan McLaughlin.",9,7,2,0.33511201476751,"Arizona State","USC",4,4,0,0,-5,400915692,2017-02-26
12,1,"17:00",2220,2220,"Torian Graham missed Jumper.",9,7,2,0.330913500538331,"Arizona State","USC",4,4,0,0,-5,400915692,2017-02-26
13,1,"17:00",2220,2220,"Bennie Boatwright Defensive Rebound.",9,7,2,0.330913500538331,"Arizona State","USC",4,4,0,0,-5,400915692,2017-02-26
14,1,"16:40",2200,2200,"Bennie Boatwright missed Three Point Jumper.",9,7,2,0.34134404229571,"Arizona State","USC",4,4,0,0,-5,400915692,2017-02-26
15,1,"16:40",2200,2200,"Kodi Justice Defensive Rebound.",9,7,2,0.34134404229571,"Arizona State","USC",4,4,0,0,-5,400915692,2017-02-26
16,1,"16:10",2170,2170,"Torian Graham Turnover.",9,7,2,0.329960567964755,"Arizona State","USC",4,4,0,0,-5,400915692,2017-02-26
17,1,"15:51",2151,2151,"Chimezie Metu Turnover.",9,7,2,0.328103585207638,"Arizona State","USC",4,4,0,0,-5,400915692,2017-02-26
18,1,"15:51",2151,2151,"Official TV Timeout",9,7,2,0.328103585207638,"Arizona State","USC",4,4,0,0,-5,400915692,2017-02-26
19,1,"15:31",2131,2131,"Kodi Justice made Three Point Jumper. Assisted by Obinna Oleka.",12,7,5,0.421798156897996,"Arizona State","USC",4,4,0,0,-5,400915692,2017-02-26
20,1,"15:06",2106,2106,"Chimezie Metu made Jumper. Assisted by Jordan McLaughlin.",12,9,3,0.361610924392459,"Arizona State","USC",4,4,0,0,-5,400915692,2017-02-26
21,1,"14:48",2088,2088,"Obinna Oleka missed Three Point Jumper.",12,9,3,0.377341749757492,"Arizona State","USC",4,4,0,0,-5,400915692,2017-02-26
22,1,"14:48",2088,2088,"Jonah Mathews Defensive Rebound.",12,9,3,0.377341749757492,"Arizona State","USC",4,4,0,0,-5,400915692,2017-02-26
23,1,"14:41",2081,2081,"Jordan McLaughlin missed Three Point Jumper.",12,9,3,0.377341749757492,"Arizona State","USC",4,4,0,0,-5,400915692,2017-02-26
24,1,"14:41",2081,2081,"Obinna Oleka Defensive Rebound.",12,9,3,0.377341749757492,"Arizona State","USC",4,4,0,0,-5,400915692,2017-02-26
25,1,"14:25",2065,2065,"Obinna Oleka missed Jumper.",12,9,3,0.360718994394594,"Arizona State","USC",4,4,0,0,-5,400915692,2017-02-26
26,1,"14:25",2065,2065,"Elijah Stewart Defensive Rebound.",12,9,3,0.360718994394594,"Arizona State","USC",4,4,0,0,-5,400915692,2017-02-26
27,1,"14:00",2040,2040,"Jonah Mathews made Three Point Jumper. Assisted by Jordan McLaughlin.",12,12,0,0.280716182629292,"Arizona State","USC",4,4,0,0,-5,400915692,2017-02-26
28,1,"13:31",2011,2011,"Andre Adams made Layup. Assisted by Tra Holder.",14,12,2,0.347525077878965,"Arizona State","USC",4,4,0,0,-5,400915692,2017-02-26
29,1,"13:19",1999,1999,"Foul on Andre Adams.",14,12,2,0.344700527576372,"Arizona State","USC",4,4,0,0,-5,400915692,2017-02-26
30,1,"13:09",1989,1989,"Charles Buggs made Three Point Jumper. Assisted by Jonah Mathews.",14,15,-1,0.266862404325168,"Arizona State","USC",4,4,0,0,-5,400915692,2017-02-26
31,1,"12:48",1968,1968,"Torian Graham missed Layup.",14,15,-1,0.267902644786793,"Arizona State","USC",4,4,0,0,-5,400915692,2017-02-26
32,1,"12:48",1968,1968,"Andre Adams Offensive Rebound.",14,15,-1,0.267902644786793,"Arizona State","USC",4,4,0,0,-5,400915692,2017-02-26
33,1,"12:48",1968,1968,"Andre Adams missed Two Point Tip Shot.",14,15,-1,0.267902644786793,"Arizona State","USC",4,4,0,0,-5,400915692,2017-02-26
34,1,"12:48",1968,1968,"Nick Rakocevic Defensive Rebound.",14,15,-1,0.267902644786793,"Arizona State","USC",4,4,0,0,-5,400915692,2017-02-26
35,1,"12:32",1952,1952,"Jonah Mathews made Jumper.",14,17,-3,0.235014367342763,"Arizona State","USC",4,4,0,0,-5,400915692,2017-02-26
36,1,"12:15",1935,1935,"Foul on Nick Rakocevic.",14,17,-3,0.216271658091197,"Arizona State","USC",4,4,0,0,-5,400915692,2017-02-26
37,1,"12:15",1935,1935,"Tra Holder made Free Throw.",15,17,-2,0.238966066789116,"Arizona State","USC",4,4,0,0,-5,400915692,2017-02-26
38,1,"12:15",1935,1935,"Tra Holder made Free Throw.",16,17,-1,0.263242021751223,"Arizona State","USC",4,4,0,0,-5,400915692,2017-02-26
39,1,"12:02",1922,1922,"Nick Rakocevic made Layup. Assisted by De'Anthony Melton.",16,19,-3,0.203507909650051,"Arizona State","USC",4,4,0,0,-5,400915692,2017-02-26
40,1,"11:32",1892,1892,"Shannon Evans II made Layup.",18,19,-1,0.282390647582259,"Arizona State","USC",4,4,0,0,-5,400915692,2017-02-26
41,1,"11:32",1892,1892,"Foul on Charles Buggs.",18,19,-1,0.282390647582259,"Arizona State","USC",4,4,0,0,-5,400915692,2017-02-26
42,1,"11:32",1892,1892,"Official TV Timeout",18,19,-1,0.282390647582259,"Arizona State","USC",4,4,0,0,-5,400915692,2017-02-26
43,1,"11:32",1892,1892,"Shannon Evans II missed Free Throw.",18,19,-1,0.282390647582259,"Arizona State","USC",4,4,0,0,-5,400915692,2017-02-26
44,1,"11:32",1892,1892,"Charles Buggs Defensive Rebound.",18,19,-1,0.282390647582259,"Arizona State","USC",4,4,0,0,-5,400915692,2017-02-26
45,1,"11:22",1882,1882,"Foul on Charles Buggs.",18,19,-1,0.257666724366216,"Arizona State","USC",4,4,0,0,-5,400915692,2017-02-26
46,1,"11:22",1882,1882,"Charles Buggs Turnover.",18,19,-1,0.257666724366216,"Arizona State","USC",4,4,0,0,-5,400915692,2017-02-26
47,1,"11:13",1873,1873,"Torian Graham missed Three Point Jumper.",18,19,-1,0.269770321025751,"Arizona State","USC",4,4,0,0,-5,400915692,2017-02-26
48,1,"11:13",1873,1873,"Ramon Vila Offensive Rebound.",18,19,-1,0.269770321025751,"Arizona State","USC",4,4,0,0,-5,400915692,2017-02-26
49,1,"11:13",1873,1873,"Ramon Vila made Two Point Tip Shot.",20,19,1,0.321365127409938,"Arizona State","USC",4,4,0,0,-5,400915692,2017-02-26
50,1,"10:58",1858,1858,"De'Anthony Melton Turnover.",20,19,1,0.335966506503675,"Arizona State","USC",4,4,0,0,-5,400915692,2017-02-26
51,1,"10:58",1858,1858,"Kodi Justice Steal.",20,19,1,0.335966506503675,"Arizona State","USC",4,4,0,0,-5,400915692,2017-02-26
52,1,"10:51",1851,1851,"Torian Graham missed Layup.",20,19,1,0.335966506503675,"Arizona State","USC",4,4,0,0,-5,400915692,2017-02-26
53,1,"10:51",1851,1851,"De'Anthony Melton Block.",20,19,1,0.335966506503675,"Arizona State","USC",4,4,0,0,-5,400915692,2017-02-26
54,1,"10:51",1851,1851,"Arizona State Offensive Rebound.",20,19,1,0.335966506503675,"Arizona State","USC",4,4,0,0,-5,400915692,2017-02-26
55,1,"10:36",1836,1836,"Obinna Oleka made Three Point Jumper. Assisted by Kodi Justice.",23,19,4,0.427176324479062,"Arizona State","USC",4,4,0,0,-5,400915692,2017-02-26
56,1,"10:13",1813,1813,"Chimezie Metu Turnover.",23,19,4,0.43453532582481,"Arizona State","USC",4,4,0,0,-5,400915692,2017-02-26
57,1,"9:56",1796,1796,"Kodi Justice made Three Point Jumper.",26,19,7,0.514270231342518,"Arizona State","USC",4,4,0,0,-5,400915692,2017-02-26
58,1,"9:40",1780,1780,"Shaqquan Aaron missed Three Point Jumper.",26,19,7,0.523062708001168,"Arizona State","USC",4,4,0,0,-5,400915692,2017-02-26
59,1,"9:40",1780,1780,"Tra Holder Defensive Rebound.",26,19,7,0.523062708001168,"Arizona State","USC",4,4,0,0,-5,400915692,2017-02-26
60,1,"9:26",1766,1766,"Ramon Vila made Layup. Assisted by Kodi Justice.",28,19,9,0.571275013160609,"Arizona State","USC",4,4,0,0,-5,400915692,2017-02-26
61,1,"9:22",1762,1762,"USC  Timeout",28,19,9,0.571275013160609,"Arizona State","USC",3,4,1,0,-5,400915692,2017-02-26
62,1,"9:03",1743,1743,"Foul on Kodi Justice.",28,19,9,0.601689584400758,"Arizona State","USC",3,4,1,0,-5,400915692,2017-02-26
63,1,"9:03",1743,1743,"Chimezie Metu made Free Throw.",28,20,8,0.571065485791099,"Arizona State","USC",3,4,1,0,-5,400915692,2017-02-26
64,1,"9:03",1743,1743,"Chimezie Metu made Free Throw.",28,21,7,0.539887367707204,"Arizona State","USC",3,4,1,0,-5,400915692,2017-02-26
65,1,"8:48",1728,1728,"Obinna Oleka missed Layup.",28,21,7,0.567206242870284,"Arizona State","USC",3,4,1,0,-5,400915692,2017-02-26
66,1,"8:48",1728,1728,"Chimezie Metu Defensive Rebound.",28,21,7,0.567206242870284,"Arizona State","USC",3,4,1,0,-5,400915692,2017-02-26
67,1,"8:42",1722,1722,"Bennie Boatwright made Three Point Jumper. Assisted by Jordan McLaughlin.",28,24,4,0.466003122978975,"Arizona State","USC",3,4,1,0,-5,400915692,2017-02-26
68,1,"8:22",1702,1702,"Obinna Oleka made Three Point Jumper. Assisted by Tra Holder.",31,24,7,0.503517211720745,"Arizona State","USC",3,4,1,0,-5,400915692,2017-02-26
69,1,"8:00",1680,1680,"Elijah Stewart missed Three Point Jumper.",31,24,7,0.535325348622257,"Arizona State","USC",3,4,0,0,-5,400915692,2017-02-26
70,1,"8:00",1680,1680,"Kodi Justice Defensive Rebound.",31,24,7,0.535325348622257,"Arizona State","USC",3,4,0,0,-5,400915692,2017-02-26
71,1,"7:51",1671,1671,"Shannon Evans II Turnover.",31,24,7,0.53726652048098,"Arizona State","USC",3,4,0,0,-5,400915692,2017-02-26
72,1,"7:51",1671,1671,"Chimezie Metu Steal.",31,24,7,0.53726652048098,"Arizona State","USC",3,4,0,0,-5,400915692,2017-02-26
73,1,"7:44",1664,1664,"Chimezie Metu made Layup.",31,26,5,0.454371235336053,"Arizona State","USC",3,4,0,0,-5,400915692,2017-02-26
74,1,"7:24",1644,1644,"Tra Holder missed Three Point Jumper.",31,26,5,0.477510562485996,"Arizona State","USC",3,4,0,0,-5,400915692,2017-02-26
75,1,"7:24",1644,1644,"Chimezie Metu Defensive Rebound.",31,26,5,0.477510562485996,"Arizona State","USC",3,4,0,0,-5,400915692,2017-02-26
76,1,"7:05",1625,1625,"Foul on De'Anthony Melton.",31,26,5,0.46480176048191,"Arizona State","USC",3,4,0,0,-5,400915692,2017-02-26
77,1,"7:05",1625,1625,"De'Anthony Melton Turnover.",31,26,5,0.46480176048191,"Arizona State","USC",3,4,0,0,-5,400915692,2017-02-26
78,1,"7:05",1625,1625,"Official TV Timeout",31,26,5,0.46480176048191,"Arizona State","USC",3,4,0,0,-5,400915692,2017-02-26
79,1,"6:58",1618,1618,"Shannon Evans II made Three Point Jumper. Assisted by Tra Holder.",34,26,8,0.569761682782825,"Arizona State","USC",3,4,0,0,-5,400915692,2017-02-26
80,1,"6:36",1596,1596,"Nick Rakocevic made Layup. Assisted by Chimezie Metu.",34,28,6,0.530605883260131,"Arizona State","USC",3,4,0,0,-5,400915692,2017-02-26
81,1,"6:05",1565,1565,"Shannon Evans II missed Jumper.",34,28,6,0.499422162187362,"Arizona State","USC",3,4,0,0,-5,400915692,2017-02-26
82,1,"6:05",1565,1565,"Andre Adams Offensive Rebound.",34,28,6,0.499422162187362,"Arizona State","USC",3,4,0,0,-5,400915692,2017-02-26
83,1,"6:05",1565,1565,"Andre Adams missed Two Point Tip Shot.",34,28,6,0.499422162187362,"Arizona State","USC",3,4,0,0,-5,400915692,2017-02-26
84,1,"6:05",1565,1565,"Andre Adams Offensive Rebound.",34,28,6,0.499422162187362,"Arizona State","USC",3,4,0,0,-5,400915692,2017-02-26
85,1,"5:49",1549,1549,"Andre Adams made Layup.",36,28,8,0.576187773350978,"Arizona State","USC",3,4,0,0,-5,400915692,2017-02-26
86,1,"5:37",1537,1537,"Elijah Stewart made Three Point Jumper. Assisted by De'Anthony Melton.",36,31,5,0.475259867251924,"Arizona State","USC",3,4,0,0,-5,400915692,2017-02-26
87,1,"5:23",1523,1523,"Torian Graham missed Three Point Jumper.",36,31,5,0.485731953040847,"Arizona State","USC",3,4,0,0,-5,400915692,2017-02-26
88,1,"5:23",1523,1523,"Elijah Stewart Block.",36,31,5,0.485731953040847,"Arizona State","USC",3,4,0,0,-5,400915692,2017-02-26
89,1,"5:23",1523,1523,"Chimezie Metu Defensive Rebound.",36,31,5,0.485731953040847,"Arizona State","USC",3,4,0,0,-5,400915692,2017-02-26
90,1,"5:14",1514,1514,"De'Anthony Melton Turnover.",36,31,5,0.517058723316903,"Arizona State","USC",3,4,0,0,-5,400915692,2017-02-26
91,1,"5:14",1514,1514,"Shannon Evans II Steal.",36,31,5,0.517058723316903,"Arizona State","USC",3,4,0,0,-5,400915692,2017-02-26
92,1,"5:07",1507,1507,"Tra Holder made Three Point Jumper. Assisted by Shannon Evans II.",39,31,8,0.58598959583558,"Arizona State","USC",3,4,0,0,-5,400915692,2017-02-26
93,1,"4:47",1487,1487,"Jordan McLaughlin made Jumper.",39,33,6,0.517626812901562,"Arizona State","USC",3,4,0,0,-5,400915692,2017-02-26
94,1,"4:30",1470,1470,"Arizona State  Timeout",39,33,6,0.508977660109999,"Arizona State","USC",3,3,0,1,-5,400915692,2017-02-26
95,1,"4:12",1452,1452,"Obinna Oleka Turnover.",39,33,6,0.510484478731492,"Arizona State","USC",3,3,0,1,-5,400915692,2017-02-26
96,1,"4:12",1452,1452,"Nick Rakocevic Steal.",39,33,6,0.510484478731492,"Arizona State","USC",3,3,0,1,-5,400915692,2017-02-26
97,1,"3:49",1429,1429,"Bennie Boatwright made Dunk. Assisted by Jonah Mathews.",39,35,4,0.454218400342933,"Arizona State","USC",3,3,0,1,-5,400915692,2017-02-26
98,1,"3:28",1408,1408,"Tra Holder made Jumper.",41,35,6,0.553755245211899,"Arizona State","USC",3,3,0,0,-5,400915692,2017-02-26
99,1,"3:10",1390,1390,"Jordan McLaughlin missed Three Point Jumper.",41,35,6,0.511088520221165,"Arizona State","USC",3,3,0,0,-5,400915692,2017-02-26
100,1,"3:10",1390,1390,"Bennie Boatwright Offensive Rebound.",41,35,6,0.511088520221165,"Arizona State","USC",3,3,0,0,-5,400915692,2017-02-26
101,1,"3:01",1381,1381,"Jonah Mathews missed Three Point Jumper.",41,35,6,0.546779708389729,"Arizona State","USC",3,3,0,0,-5,400915692,2017-02-26
102,1,"3:01",1381,1381,"Bennie Boatwright Offensive Rebound.",41,35,6,0.546779708389729,"Arizona State","USC",3,3,0,0,-5,400915692,2017-02-26
103,1,"2:55",1375,1375,"Elijah Stewart made Three Point Jumper. Assisted by Bennie Boatwright.",41,38,3,0.402133273145505,"Arizona State","USC",3,3,0,0,-5,400915692,2017-02-26
104,1,"2:45",1365,1365,"Kodi Justice Turnover.",41,38,3,0.430732100802156,"Arizona State","USC",3,3,0,0,-5,400915692,2017-02-26
105,1,"2:45",1365,1365,"Jonah Mathews Steal.",41,38,3,0.430732100802156,"Arizona State","USC",3,3,0,0,-5,400915692,2017-02-26
106,1,"2:37",1357,1357,"Elijah Stewart made Dunk. Assisted by Jordan McLaughlin.",41,40,1,0.371814919786308,"Arizona State","USC",3,3,0,0,-5,400915692,2017-02-26
107,1,"2:25",1345,1345,"Kodi Justice missed Three Point Jumper.",41,40,1,0.362469386922948,"Arizona State","USC",3,3,0,0,-5,400915692,2017-02-26
108,1,"2:25",1345,1345,"Andre Adams Offensive Rebound.",41,40,1,0.362469386922948,"Arizona State","USC",3,3,0,0,-5,400915692,2017-02-26
109,1,"2:20",1340,1340,"Foul on Elijah Stewart.",41,40,1,0.362469386922948,"Arizona State","USC",3,3,0,0,-5,400915692,2017-02-26
110,1,"2:20",1340,1340,"Andre Adams made Free Throw.",42,40,2,0.3996975874212,"Arizona State","USC",3,3,0,0,-5,400915692,2017-02-26
111,1,"2:20",1340,1340,"Andre Adams missed Free Throw.",42,40,2,0.3996975874212,"Arizona State","USC",3,3,0,0,-5,400915692,2017-02-26
112,1,"2:20",1340,1340,"Chimezie Metu Defensive Rebound.",42,40,2,0.3996975874212,"Arizona State","USC",3,3,0,0,-5,400915692,2017-02-26
113,1,"2:05",1325,1325,"Jordan McLaughlin missed Layup.",42,40,2,0.39428107242582,"Arizona State","USC",3,3,0,0,-5,400915692,2017-02-26
114,1,"2:05",1325,1325,"Andre Adams Defensive Rebound.",42,40,2,0.39428107242582,"Arizona State","USC",3,3,0,0,-5,400915692,2017-02-26
115,1,"1:55",1315,1315,"Tra Holder made Layup.",44,40,4,0.499329986155216,"Arizona State","USC",3,3,0,0,-5,400915692,2017-02-26
116,1,"1:37",1297,1297,"Foul on Torian Graham.",44,40,4,0.529567355034249,"Arizona State","USC",3,3,0,0,-5,400915692,2017-02-26
117,1,"1:37",1297,1297,"Elijah Stewart made Free Throw.",44,41,3,0.487746473511837,"Arizona State","USC",3,3,0,0,-5,400915692,2017-02-26
118,1,"1:37",1297,1297,"Elijah Stewart made Free Throw.",44,42,2,0.446096444155568,"Arizona State","USC",3,3,0,0,-5,400915692,2017-02-26
119,1,"1:24",1284,1284,"Tra Holder made Three Point Jumper.",47,42,5,0.493123409063157,"Arizona State","USC",3,3,0,0,-5,400915692,2017-02-26
120,1,"1:07",1267,1267,"Jordan McLaughlin Turnover.",47,42,5,0.527962980851163,"Arizona State","USC",3,3,0,0,-5,400915692,2017-02-26
121,1,"1:07",1267,1267,"Obinna Oleka Steal.",47,42,5,0.527962980851163,"Arizona State","USC",3,3,0,0,-5,400915692,2017-02-26
122,1,"1:01",1261,1261,"Tra Holder missed Layup.",47,42,5,0.527962980851163,"Arizona State","USC",3,3,0,0,-5,400915692,2017-02-26
123,1,"1:01",1261,1261,"Chimezie Metu Defensive Rebound.",47,42,5,0.527962980851163,"Arizona State","USC",3,3,0,0,-5,400915692,2017-02-26
124,1,"0:53",1253,1253,"Bennie Boatwright made Three Point Jumper. Assisted by Chimezie Metu.",47,45,2,0.409186552029882,"Arizona State","USC",3,3,0,0,-5,400915692,2017-02-26
125,1,"0:09",1209,1209,"Shannon Evans II missed Three Point Jumper.",47,45,2,0.400938053799346,"Arizona State","USC",3,3,0,0,-5,400915692,2017-02-26
126,1,"0:09",1209,1209,"Chimezie Metu Defensive Rebound.",47,45,2,0.400938053799346,"Arizona State","USC",3,3,0,0,-5,400915692,2017-02-26
127,1,"0:01",1201,1201,"Chimezie Metu made Three Point Jumper.",47,48,-1,0.293320829701072,"Arizona State","USC",3,3,0,0,-5,400915692,2017-02-26
128,1,"0:00",1200,1200,"End of 1st half",47,48,-1,0.293320829701072,"Arizona State","USC",3,3,0,0,-5,400915692,2017-02-26
129,2,"20:00",1200,1200,"PLAY",47,48,-1,0.293320829701072,"Arizona State","USC",4,4,0,0,-5,400915692,2017-02-26
130,2,"20:00",1200,1200,"Jump Ball won by Arizona State",47,48,-1,0.293320829701072,"Arizona State","USC",4,4,0,0,-5,400915692,2017-02-26
131,2,"19:48",1188,1188,"Torian Graham made Layup. Assisted by Tra Holder.",49,48,1,0.362832008796384,"Arizona State","USC",4,4,0,0,-5,400915692,2017-02-26
132,2,"19:23",1163,1163,"De'Anthony Melton missed Three Point Jumper.",49,48,1,0.338918966690745,"Arizona State","USC",4,4,0,0,-5,400915692,2017-02-26
133,2,"19:23",1163,1163,"Shannon Evans II Defensive Rebound.",49,48,1,0.338918966690745,"Arizona State","USC",4,4,0,0,-5,400915692,2017-02-26
134,2,"19:04",1144,1144,"Foul on Chimezie Metu.",49,48,1,0.38813451758728,"Arizona State","USC",4,4,0,0,-5,400915692,2017-02-26
135,2,"18:57",1137,1137,"Kodi Justice made Jumper. Assisted by Tra Holder.",51,48,3,0.449132677608724,"Arizona State","USC",4,4,0,0,-5,400915692,2017-02-26
136,2,"18:40",1120,1120,"Jordan McLaughlin missed Layup.",51,48,3,0.459946578032649,"Arizona State","USC",4,4,0,0,-5,400915692,2017-02-26
137,2,"18:40",1120,1120,"Torian Graham Defensive Rebound.",51,48,3,0.459946578032649,"Arizona State","USC",4,4,0,0,-5,400915692,2017-02-26
138,2,"18:28",1108,1108,"Obinna Oleka missed Jumper.",51,48,3,0.442941511211862,"Arizona State","USC",4,4,0,0,-5,400915692,2017-02-26
139,2,"18:28",1108,1108,"De'Anthony Melton Defensive Rebound.",51,48,3,0.442941511211862,"Arizona State","USC",4,4,0,0,-5,400915692,2017-02-26
140,2,"18:15",1095,1095,"Chimezie Metu missed Jumper.",51,48,3,0.462683843157549,"Arizona State","USC",4,4,0,0,-5,400915692,2017-02-26
141,2,"18:15",1095,1095,"Elijah Stewart Offensive Rebound.",51,48,3,0.462683843157549,"Arizona State","USC",4,4,0,0,-5,400915692,2017-02-26
142,2,"18:15",1095,1095,"Elijah Stewart missed Two Point Tip Shot.",51,48,3,0.462683843157549,"Arizona State","USC",4,4,0,0,-5,400915692,2017-02-26
143,2,"18:15",1095,1095,"Shannon Evans II Defensive Rebound.",51,48,3,0.462683843157549,"Arizona State","USC",4,4,0,0,-5,400915692,2017-02-26
144,2,"18:03",1083,1083,"Torian Graham made Dunk. Assisted by Shannon Evans II.",53,48,5,0.533883264634837,"Arizona State","USC",4,4,0,0,-5,400915692,2017-02-26
145,2,"17:59",1079,1079,"USC  Timeout",53,48,5,0.56691996426758,"Arizona State","USC",3,4,1,0,-5,400915692,2017-02-26
146,2,"17:49",1069,1069,"Bennie Boatwright missed Three Point Jumper.",53,48,5,0.580852598036229,"Arizona State","USC",3,4,1,0,-5,400915692,2017-02-26
147,2,"17:49",1069,1069,"Torian Graham Defensive Rebound.",53,48,5,0.580852598036229,"Arizona State","USC",3,4,1,0,-5,400915692,2017-02-26
148,2,"17:40",1060,1060,"Torian Graham Turnover.",53,48,5,0.580852598036229,"Arizona State","USC",3,4,1,0,-5,400915692,2017-02-26
149,2,"17:40",1060,1060,"Elijah Stewart Steal.",53,48,5,0.580852598036229,"Arizona State","USC",3,4,1,0,-5,400915692,2017-02-26
150,2,"17:31",1051,1051,"Elijah Stewart made Jumper. Assisted by Jordan McLaughlin.",53,50,3,0.479269388110885,"Arizona State","USC",3,4,1,0,-5,400915692,2017-02-26
151,2,"16:54",1014,1014,"Obinna Oleka made Layup. Assisted by Torian Graham.",55,50,5,0.544163776042868,"Arizona State","USC",3,4,0,0,-5,400915692,2017-02-26
152,2,"16:54",1014,1014,"Foul on Bennie Boatwright.",55,50,5,0.544163776042868,"Arizona State","USC",3,4,0,0,-5,400915692,2017-02-26
153,2,"16:54",1014,1014,"Obinna Oleka missed Free Throw.",55,50,5,0.544163776042868,"Arizona State","USC",3,4,0,0,-5,400915692,2017-02-26
154,2,"16:54",1014,1014,"Chimezie Metu Defensive Rebound.",55,50,5,0.544163776042868,"Arizona State","USC",3,4,0,0,-5,400915692,2017-02-26
155,2,"16:39",999,999,"Chimezie Metu missed Layup.",55,50,5,0.544733430516729,"Arizona State","USC",3,4,0,0,-5,400915692,2017-02-26
156,2,"16:39",999,999,"Shannon Evans II Defensive Rebound.",55,50,5,0.544733430516729,"Arizona State","USC",3,4,0,0,-5,400915692,2017-02-26
157,2,"16:26",986,986,"Obinna Oleka made Layup.",57,50,7,0.710074734727752,"Arizona State","USC",3,4,0,0,-5,400915692,2017-02-26
158,2,"15:59",959,959,"Jordan McLaughlin made Layup.",57,52,5,0.548842557972886,"Arizona State","USC",3,4,0,0,-5,400915692,2017-02-26
159,2,"15:47",947,947,"Kodi Justice missed Three Point Jumper.",57,52,5,0.593554900743971,"Arizona State","USC",3,4,0,0,-5,400915692,2017-02-26
160,2,"15:47",947,947,"Tra Holder Offensive Rebound.",57,52,5,0.593554900743971,"Arizona State","USC",3,4,0,0,-5,400915692,2017-02-26
161,2,"15:47",947,947,"Tra Holder missed Two Point Tip Shot.",57,52,5,0.593554900743971,"Arizona State","USC",3,4,0,0,-5,400915692,2017-02-26
162,2,"15:47",947,947,"Chimezie Metu Defensive Rebound.",57,52,5,0.593554900743971,"Arizona State","USC",3,4,0,0,-5,400915692,2017-02-26
163,2,"15:33",933,933,"Elijah Stewart Turnover.",57,52,5,0.583584786727034,"Arizona State","USC",3,4,0,0,-5,400915692,2017-02-26
164,2,"15:33",933,933,"Official TV Timeout",57,52,5,0.583584786727034,"Arizona State","USC",3,4,0,0,-5,400915692,2017-02-26
165,2,"15:20",920,920,"Torian Graham missed Three Point Jumper.",57,52,5,0.565474526420347,"Arizona State","USC",3,4,0,0,-5,400915692,2017-02-26
166,2,"15:20",920,920,"Jordan McLaughlin Defensive Rebound.",57,52,5,0.565474526420347,"Arizona State","USC",3,4,0,0,-5,400915692,2017-02-26
167,2,"14:53",893,893,"Jordan McLaughlin missed Three Point Jumper.",57,52,5,0.60265667794451,"Arizona State","USC",3,4,0,0,-5,400915692,2017-02-26
168,2,"14:53",893,893,"Obinna Oleka Defensive Rebound.",57,52,5,0.60265667794451,"Arizona State","USC",3,4,0,0,-5,400915692,2017-02-26
169,2,"14:23",863,863,"Tra Holder missed Jumper.",57,52,5,0.56858999590862,"Arizona State","USC",3,4,0,0,-5,400915692,2017-02-26
170,2,"14:23",863,863,"Chimezie Metu Defensive Rebound.",57,52,5,0.56858999590862,"Arizona State","USC",3,4,0,0,-5,400915692,2017-02-26
171,2,"14:14",854,854,"Elijah Stewart missed Three Point Jumper.",57,52,5,0.623211403098723,"Arizona State","USC",3,4,0,0,-5,400915692,2017-02-26
172,2,"14:14",854,854,"Obinna Oleka Defensive Rebound.",57,52,5,0.623211403098723,"Arizona State","USC",3,4,0,0,-5,400915692,2017-02-26
173,2,"14:07",847,847,"Shannon Evans II missed Layup.",57,52,5,0.615895121483415,"Arizona State","USC",3,4,0,0,-5,400915692,2017-02-26
174,2,"14:07",847,847,"Shaqquan Aaron Block.",57,52,5,0.615895121483415,"Arizona State","USC",3,4,0,0,-5,400915692,2017-02-26
175,2,"14:07",847,847,"Jordan McLaughlin Defensive Rebound.",57,52,5,0.615895121483415,"Arizona State","USC",3,4,0,0,-5,400915692,2017-02-26
176,2,"13:52",832,832,"Jordan McLaughlin made Layup.",57,54,3,0.481142225023355,"Arizona State","USC",3,4,0,0,-5,400915692,2017-02-26
177,2,"13:42",822,822,"Shannon Evans II made Layup.",59,54,5,0.574060134612444,"Arizona State","USC",3,4,0,0,-5,400915692,2017-02-26
178,2,"13:22",802,802,"Jonah Mathews missed Three Point Jumper.",59,54,5,0.612069527258332,"Arizona State","USC",3,4,0,0,-5,400915692,2017-02-26
179,2,"13:22",802,802,"Torian Graham Defensive Rebound.",59,54,5,0.612069527258332,"Arizona State","USC",3,4,0,0,-5,400915692,2017-02-26
180,2,"12:51",771,771,"Shannon Evans II Turnover.",59,54,5,0.612976866318689,"Arizona State","USC",3,4,0,0,-5,400915692,2017-02-26
181,2,"12:39",759,759,"Bennie Boatwright made Three Point Jumper. Assisted by De'Anthony Melton.",59,57,2,0.451460993561752,"Arizona State","USC",3,4,0,0,-5,400915692,2017-02-26
182,2,"12:18",738,738,"Torian Graham missed Three Point Jumper.",59,57,2,0.488959092842199,"Arizona State","USC",3,4,0,0,-5,400915692,2017-02-26
183,2,"12:18",738,738,"De'Anthony Melton Defensive Rebound.",59,57,2,0.488959092842199,"Arizona State","USC",3,4,0,0,-5,400915692,2017-02-26
