"play_id","half","time_remaining_half","secs_remaining","secs_remaining_absolute","description","home_score","away_score","score_diff","win_prob","home","away","home_time_out_remaining","away_time_out_remaining","home_timeout_ind","away_timeout_ind","home_favored_by","game_id","date"
1,1,"20:00",2400,2400,"PLAY",0,0,0,0.927527390934369,"Duke","Portland State",4,4,0,0,24.5,400986088,2017-11-23
2,1,"20:00",2400,2400,"Jump Ball won by Duke",0,0,0,0.927527390934369,"Duke","Portland State",4,4,0,0,24.5,400986088,2017-11-23
3,1,"19:49",2389,2389,"Marvin Bagley III made Layup. Assisted by Trevon Duval.",2,0,2,0.92838269788323,"Duke","Portland State",4,4,0,0,24.5,400986088,2017-11-23
4,1,"19:49",2389,2389,"Foul on Ryan Edwards.",2,0,2,0.92838269788323,"Duke","Portland State",4,4,0,0,24.5,400986088,2017-11-23
5,1,"19:49",2389,2389,"Marvin Bagley III missed Free Throw.",2,0,2,0.92838269788323,"Duke","Portland State",4,4,0,0,24.5,400986088,2017-11-23
6,1,"19:49",2389,2389,"Traylin Farris Defensive Rebound.",2,0,2,0.92838269788323,"Duke","Portland State",4,4,0,0,24.5,400986088,2017-11-23
7,1,"19:38",2378,2378,"Ryan Edwards made Three Point Jumper. Assisted by Bryce Canda.",2,3,-1,0.912500726865228,"Duke","Portland State",4,4,0,0,24.5,400986088,2017-11-23
8,1,"19:25",2365,2365,"Gary Trent Jr missed Three Point Jumper.",2,3,-1,0.909316748477809,"Duke","Portland State",4,4,0,0,24.5,400986088,2017-11-23
9,1,"19:25",2365,2365,"Ryan Edwards Defensive Rebound.",2,3,-1,0.909316748477809,"Duke","Portland State",4,4,0,0,24.5,400986088,2017-11-23
10,1,"19:12",2352,2352,"Michael Mayhew missed Jumper.",2,3,-1,0.916376834907629,"Duke","Portland State",4,4,0,0,24.5,400986088,2017-11-23
11,1,"19:12",2352,2352,"Marvin Bagley III Defensive Rebound.",2,3,-1,0.916376834907629,"Duke","Portland State",4,4,0,0,24.5,400986088,2017-11-23
12,1,"19:10",2350,2350,"Foul on Traylin Farris.",2,3,-1,0.916376834907629,"Duke","Portland State",4,4,0,0,24.5,400986088,2017-11-23
13,1,"18:46",2326,2326,"Trevon Duval made Layup. Assisted by Grayson Allen.",4,3,1,0.925157423947113,"Duke","Portland State",4,4,0,0,24.5,400986088,2017-11-23
14,1,"18:27",2307,2307,"Traylin Farris missed Jumper.",4,3,1,0.916901065902828,"Duke","Portland State",4,4,0,0,24.5,400986088,2017-11-23
15,1,"18:27",2307,2307,"Marvin Bagley III Defensive Rebound.",4,3,1,0.916901065902828,"Duke","Portland State",4,4,0,0,24.5,400986088,2017-11-23
16,1,"18:18",2298,2298,"Grayson Allen made Dunk.",6,3,3,0.936435515301756,"Duke","Portland State",4,4,0,0,24.5,400986088,2017-11-23
17,1,"18:18",2298,2298,"Foul on Ryan Edwards.",6,3,3,0.936435515301756,"Duke","Portland State",4,4,0,0,24.5,400986088,2017-11-23
18,1,"18:18",2298,2298,"Grayson Allen made Free Throw.",7,3,4,0.941997802566263,"Duke","Portland State",4,4,0,0,24.5,400986088,2017-11-23
19,1,"18:05",2285,2285,"Deontae North made Jumper.",7,5,2,0.928087265744997,"Duke","Portland State",4,4,0,0,24.5,400986088,2017-11-23
20,1,"17:58",2278,2278,"Foul on Brandon Hollins.",7,5,2,0.930006549695944,"Duke","Portland State",4,4,0,0,24.5,400986088,2017-11-23
21,1,"17:53",2273,2273,"Gary Trent Jr made Layup.",9,5,4,0.942337217363148,"Duke","Portland State",4,4,0,0,24.5,400986088,2017-11-23
22,1,"17:36",2256,2256,"Deontae North made Jumper.",9,7,2,0.923762824633973,"Duke","Portland State",4,4,0,0,24.5,400986088,2017-11-23
23,1,"17:20",2240,2240,"Grayson Allen missed Three Point Jumper.",9,7,2,0.918252878273601,"Duke","Portland State",4,4,0,0,24.5,400986088,2017-11-23
24,1,"17:20",2240,2240,"Bryce Canda Defensive Rebound.",9,7,2,0.918252878273601,"Duke","Portland State",4,4,0,0,24.5,400986088,2017-11-23
25,1,"17:11",2231,2231,"Traylin Farris made Layup. Assisted by Deontae North.",9,9,0,0.913233172135978,"Duke","Portland State",4,4,0,0,24.5,400986088,2017-11-23
26,1,"17:04",2224,2224,"Marvin Bagley III made Layup.",11,9,2,0.929163223875907,"Duke","Portland State",4,4,0,0,24.5,400986088,2017-11-23
27,1,"16:55",2215,2215,"Deontae North made Three Point Jumper.",11,12,-1,0.896811856545785,"Duke","Portland State",4,4,0,0,24.5,400986088,2017-11-23
28,1,"16:30",2190,2190,"Trevon Duval missed Jumper.",11,12,-1,0.907565124828017,"Duke","Portland State",4,4,0,0,24.5,400986088,2017-11-23
29,1,"16:30",2190,2190,"Marques Bolden Offensive Rebound.",11,12,-1,0.907565124828017,"Duke","Portland State",4,4,0,0,24.5,400986088,2017-11-23
30,1,"16:30",2190,2190,"Marques Bolden missed Two Point Tip Shot.",11,12,-1,0.907565124828017,"Duke","Portland State",4,4,0,0,24.5,400986088,2017-11-23
31,1,"16:30",2190,2190,"Javin DeLaurier Offensive Rebound.",11,12,-1,0.907565124828017,"Duke","Portland State",4,4,0,0,24.5,400986088,2017-11-23
32,1,"16:22",2182,2182,"Grayson Allen missed Three Point Jumper.",11,12,-1,0.901439037394673,"Duke","Portland State",4,4,0,0,24.5,400986088,2017-11-23
33,1,"16:22",2182,2182,"Portland State Defensive Rebound.",11,12,-1,0.901439037394673,"Duke","Portland State",4,4,0,0,24.5,400986088,2017-11-23
34,1,"16:04",2164,2164,"Holland Woods missed Three Point Jumper.",11,12,-1,0.897762332157863,"Duke","Portland State",4,4,0,0,24.5,400986088,2017-11-23
35,1,"16:04",2164,2164,"Marques Bolden Defensive Rebound.",11,12,-1,0.897762332157863,"Duke","Portland State",4,4,0,0,24.5,400986088,2017-11-23
36,1,"15:59",2159,2159,"Trevon Duval made Layup.",13,12,1,0.917339727735487,"Duke","Portland State",4,4,0,0,24.5,400986088,2017-11-23
37,1,"15:49",2149,2149,"Foul on Trevon Duval.",13,12,1,0.920400531274199,"Duke","Portland State",4,4,0,0,24.5,400986088,2017-11-23
38,1,"15:49",2149,2149,"Official TV Timeout",13,12,1,0.920400531274199,"Duke","Portland State",4,4,0,0,24.5,400986088,2017-11-23
39,1,"15:34",2134,2134,"Bryce Canda missed Three Point Jumper.",13,12,1,0.91919010498769,"Duke","Portland State",4,4,0,0,24.5,400986088,2017-11-23
40,1,"15:34",2134,2134,"Javin DeLaurier Defensive Rebound.",13,12,1,0.91919010498769,"Duke","Portland State",4,4,0,0,24.5,400986088,2017-11-23
41,1,"15:11",2111,2111,"Marvin Bagley III missed Jumper.",13,12,1,0.924522735696363,"Duke","Portland State",4,4,0,0,24.5,400986088,2017-11-23
42,1,"15:11",2111,2111,"Marques Bolden Offensive Rebound.",13,12,1,0.924522735696363,"Duke","Portland State",4,4,0,0,24.5,400986088,2017-11-23
43,1,"15:11",2111,2111,"Marques Bolden made Two Point Tip Shot.",15,12,3,0.93940792873836,"Duke","Portland State",4,4,0,0,24.5,400986088,2017-11-23
44,1,"15:01",2101,2101,"Jamie Orme missed Jumper.",15,12,3,0.930228457755901,"Duke","Portland State",4,4,0,0,24.5,400986088,2017-11-23
45,1,"15:01",2101,2101,"Marques Bolden Block.",15,12,3,0.930228457755901,"Duke","Portland State",4,4,0,0,24.5,400986088,2017-11-23
46,1,"15:01",2101,2101,"Portland State Offensive Rebound.",15,12,3,0.930228457755901,"Duke","Portland State",4,4,0,0,24.5,400986088,2017-11-23
47,1,"14:49",2089,2089,"Traylin Farris made Layup. Assisted by Bryce Canda.",15,14,1,0.912787451435247,"Duke","Portland State",4,4,0,0,24.5,400986088,2017-11-23
48,1,"14:34",2074,2074,"Trevon Duval Turnover.",15,14,1,0.918533308421549,"Duke","Portland State",4,4,0,0,24.5,400986088,2017-11-23
49,1,"14:34",2074,2074,"Deontae North Steal.",15,14,1,0.918533308421549,"Duke","Portland State",4,4,0,0,24.5,400986088,2017-11-23
50,1,"14:29",2069,2069,"Foul on Javin DeLaurier.",15,14,1,0.913190390291786,"Duke","Portland State",4,4,0,0,24.5,400986088,2017-11-23
51,1,"14:29",2069,2069,"Deontae North made Free Throw.",15,15,0,0.903156907683249,"Duke","Portland State",4,4,0,0,24.5,400986088,2017-11-23
52,1,"14:29",2069,2069,"Deontae North made Free Throw.",15,16,-1,0.892100774651314,"Duke","Portland State",4,4,0,0,24.5,400986088,2017-11-23
53,1,"14:15",2055,2055,"Javin DeLaurier missed Jumper.",15,16,-1,0.904900551609174,"Duke","Portland State",4,4,0,0,24.5,400986088,2017-11-23
54,1,"14:15",2055,2055,"Jamie Orme Block.",15,16,-1,0.904900551609174,"Duke","Portland State",4,4,0,0,24.5,400986088,2017-11-23
55,1,"14:15",2055,2055,"Jamie Orme Defensive Rebound.",15,16,-1,0.904900551609174,"Duke","Portland State",4,4,0,0,24.5,400986088,2017-11-23
56,1,"14:06",2046,2046,"Deontae North made Three Point Jumper. Assisted by Jamie Orme.",15,19,-4,0.852532061669074,"Duke","Portland State",4,4,0,0,24.5,400986088,2017-11-23
57,1,"13:54",2034,2034,"Foul on Jamie Orme.",15,19,-4,0.875496734569447,"Duke","Portland State",4,4,0,0,24.5,400986088,2017-11-23
58,1,"13:54",2034,2034,"Grayson Allen missed Free Throw.",15,19,-4,0.875496734569447,"Duke","Portland State",4,4,0,0,24.5,400986088,2017-11-23
59,1,"13:54",2034,2034,"Duke Deadball Team Rebound.",15,19,-4,0.875496734569447,"Duke","Portland State",4,4,0,0,24.5,400986088,2017-11-23
60,1,"13:54",2034,2034,"Grayson Allen made Free Throw.",16,19,-3,0.887110939961723,"Duke","Portland State",4,4,0,0,24.5,400986088,2017-11-23
61,1,"13:33",2013,2013,"Deontae North missed Three Point Jumper.",16,19,-3,0.872106508709033,"Duke","Portland State",4,4,0,0,24.5,400986088,2017-11-23
62,1,"13:33",2013,2013,"Holland Woods Offensive Rebound.",16,19,-3,0.872106508709033,"Duke","Portland State",4,4,0,0,24.5,400986088,2017-11-23
63,1,"13:26",2006,2006,"Michael Mayhew made Layup. Assisted by Holland Woods.",16,21,-5,0.840935688187819,"Duke","Portland State",4,4,0,0,24.5,400986088,2017-11-23
64,1,"13:18",1998,1998,"Trevon Duval made Three Point Jumper. Assisted by Grayson Allen.",19,21,-2,0.881381503515616,"Duke","Portland State",4,4,0,0,24.5,400986088,2017-11-23
65,1,"12:48",1968,1968,"Jamie Orme made Three Point Jumper. Assisted by Holland Woods.",19,24,-5,0.847682324150831,"Duke","Portland State",4,4,0,0,24.5,400986088,2017-11-23
66,1,"12:38",1958,1958,"Trevon Duval Turnover.",19,24,-5,0.82704988361447,"Duke","Portland State",4,4,0,0,24.5,400986088,2017-11-23
67,1,"12:38",1958,1958,"Deontae North Steal.",19,24,-5,0.82704988361447,"Duke","Portland State",4,4,0,0,24.5,400986088,2017-11-23
68,1,"12:30",1950,1950,"Jamie Orme missed Jumper.",19,24,-5,0.82704988361447,"Duke","Portland State",4,4,0,0,24.5,400986088,2017-11-23
69,1,"12:30",1950,1950,"Grayson Allen Defensive Rebound.",19,24,-5,0.82704988361447,"Duke","Portland State",4,4,0,0,24.5,400986088,2017-11-23
70,1,"12:08",1928,1928,"Foul on Traylin Farris.",19,24,-5,0.840049637406728,"Duke","Portland State",4,4,0,0,24.5,400986088,2017-11-23
71,1,"11:59",1919,1919,"Marques Bolden made Layup. Assisted by Wendell Carter Jr.",21,24,-3,0.867109577637328,"Duke","Portland State",4,4,0,0,24.5,400986088,2017-11-23
72,1,"11:40",1900,1900,"Holland Woods made Jumper.",21,26,-5,0.838912312662434,"Duke","Portland State",4,4,0,0,24.5,400986088,2017-11-23
73,1,"11:27",1887,1887,"Trevon Duval Turnover.",21,26,-5,0.832648720168288,"Duke","Portland State",4,4,0,0,24.5,400986088,2017-11-23
74,1,"11:27",1887,1887,"Holland Woods Steal.",21,26,-5,0.832648720168288,"Duke","Portland State",4,4,0,0,24.5,400986088,2017-11-23
75,1,"11:22",1882,1882,"Holland Woods missed Layup.",21,26,-5,0.832648720168288,"Duke","Portland State",4,4,0,0,24.5,400986088,2017-11-23
76,1,"11:22",1882,1882,"Grayson Allen Block.",21,26,-5,0.832648720168288,"Duke","Portland State",4,4,0,0,24.5,400986088,2017-11-23
77,1,"11:22",1882,1882,"Marques Bolden Defensive Rebound.",21,26,-5,0.832648720168288,"Duke","Portland State",4,4,0,0,24.5,400986088,2017-11-23
78,1,"11:21",1881,1881,"Foul on Michael Mayhew.",21,26,-5,0.832648720168288,"Duke","Portland State",4,4,0,0,24.5,400986088,2017-11-23
79,1,"11:21",1881,1881,"Official TV Timeout",21,26,-5,0.832648720168288,"Duke","Portland State",4,4,0,0,24.5,400986088,2017-11-23
80,1,"11:21",1881,1881,"Trevon Duval made Free Throw.",22,26,-4,0.849185663765807,"Duke","Portland State",4,4,0,0,24.5,400986088,2017-11-23
81,1,"11:21",1881,1881,"Trevon Duval missed Free Throw.",22,26,-4,0.849185663765807,"Duke","Portland State",4,4,0,0,24.5,400986088,2017-11-23
82,1,"11:21",1881,1881,"Gary Trent Jr Offensive Rebound.",22,26,-4,0.849185663765807,"Duke","Portland State",4,4,0,0,24.5,400986088,2017-11-23
83,1,"11:02",1862,1862,"Foul on Grayson Allen.",22,26,-4,0.831782285047377,"Duke","Portland State",4,4,0,0,24.5,400986088,2017-11-23
84,1,"11:02",1862,1862,"Grayson Allen Turnover.",22,26,-4,0.831782285047377,"Duke","Portland State",4,4,0,0,24.5,400986088,2017-11-23
85,1,"10:51",1851,1851,"Deontae North missed Layup.",22,26,-4,0.839085706317588,"Duke","Portland State",4,4,0,0,24.5,400986088,2017-11-23
86,1,"10:51",1851,1851,"Marvin Bagley III Defensive Rebound.",22,26,-4,0.839085706317588,"Duke","Portland State",4,4,0,0,24.5,400986088,2017-11-23
87,1,"10:43",1843,1843,"Foul on Michael Mayhew.",22,26,-4,0.839126893832688,"Duke","Portland State",4,4,0,0,24.5,400986088,2017-11-23
88,1,"10:43",1843,1843,"Marvin Bagley III missed Free Throw.",22,26,-4,0.839126893832688,"Duke","Portland State",4,4,0,0,24.5,400986088,2017-11-23
89,1,"10:43",1843,1843,"Bryce Canda Defensive Rebound.",22,26,-4,0.839126893832688,"Duke","Portland State",4,4,0,0,24.5,400986088,2017-11-23
90,1,"10:39",1839,1839,"Brandon Hollins made Layup. Assisted by Deante Strickland.",22,28,-6,0.795515577867001,"Duke","Portland State",4,4,0,0,24.5,400986088,2017-11-23
91,1,"10:24",1824,1824,"Gary Trent Jr missed Jumper.",22,28,-6,0.826670550687445,"Duke","Portland State",4,4,0,0,24.5,400986088,2017-11-23
92,1,"10:24",1824,1824,"Holland Woods Defensive Rebound.",22,28,-6,0.826670550687445,"Duke","Portland State",4,4,0,0,24.5,400986088,2017-11-23
93,1,"10:07",1807,1807,"Deontae North missed Layup.",22,28,-6,0.800242612226243,"Duke","Portland State",4,4,0,0,24.5,400986088,2017-11-23
94,1,"10:07",1807,1807,"Marvin Bagley III Block.",22,28,-6,0.800242612226243,"Duke","Portland State",4,4,0,0,24.5,400986088,2017-11-23
95,1,"10:07",1807,1807,"Marvin Bagley III Defensive Rebound.",22,28,-6,0.800242612226243,"Duke","Portland State",4,4,0,0,24.5,400986088,2017-11-23
96,1,"9:59",1799,1799,"Alex O'Connell made Layup. Assisted by Marvin Bagley III.",24,28,-4,0.824652428451213,"Duke","Portland State",4,4,0,0,24.5,400986088,2017-11-23
97,1,"9:53",1793,1793,"Deante Strickland missed Jumper.",24,28,-4,0.824652428451213,"Duke","Portland State",4,4,0,0,24.5,400986088,2017-11-23
98,1,"9:53",1793,1793,"Trevon Duval Defensive Rebound.",24,28,-4,0.824652428451213,"Duke","Portland State",4,4,0,0,24.5,400986088,2017-11-23
99,1,"9:50",1790,1790,"Marvin Bagley III made Dunk. Assisted by Alex O'Connell.",26,28,-2,0.859159545399752,"Duke","Portland State",4,4,1,0,24.5,400986088,2017-11-23
100,1,"9:50",1790,1790,"Portland State  Timeout",26,28,-2,0.859159545399752,"Duke","Portland State",3,4,1,0,24.5,400986088,2017-11-23
101,1,"9:34",1774,1774,"Deante Strickland missed Layup.",26,28,-2,0.862826233304195,"Duke","Portland State",3,4,1,0,24.5,400986088,2017-11-23
102,1,"9:34",1774,1774,"Marvin Bagley III Defensive Rebound.",26,28,-2,0.862826233304195,"Duke","Portland State",3,4,1,0,24.5,400986088,2017-11-23
103,1,"9:27",1767,1767,"Marvin Bagley III Turnover.",26,28,-2,0.878363522568743,"Duke","Portland State",3,4,1,0,24.5,400986088,2017-11-23
104,1,"9:27",1767,1767,"Jamie Orme Steal.",26,28,-2,0.878363522568743,"Duke","Portland State",3,4,1,0,24.5,400986088,2017-11-23
105,1,"9:20",1760,1760,"Jamie Orme made Dunk. Assisted by Deontae North.",26,30,-4,0.847782976282935,"Duke","Portland State",3,4,1,0,24.5,400986088,2017-11-23
106,1,"8:46",1726,1726,"Trevon Duval missed Jumper.",26,30,-4,0.807206434414822,"Duke","Portland State",3,4,0,0,24.5,400986088,2017-11-23
107,1,"8:46",1726,1726,"Bryce Canda Defensive Rebound.",26,30,-4,0.807206434414822,"Duke","Portland State",3,4,0,0,24.5,400986088,2017-11-23
108,1,"8:37",1717,1717,"Deontae North made Three Point Jumper. Assisted by Bryce Canda.",26,33,-7,0.780773168284064,"Duke","Portland State",3,4,0,0,24.5,400986088,2017-11-23
109,1,"8:15",1695,1695,"Gary Trent Jr missed Jumper.",26,33,-7,0.742589679625376,"Duke","Portland State",3,4,0,0,24.5,400986088,2017-11-23
110,1,"8:15",1695,1695,"Bryce Canda Defensive Rebound.",26,33,-7,0.742589679625376,"Duke","Portland State",3,4,0,0,24.5,400986088,2017-11-23
111,1,"8:09",1689,1689,"Deante Strickland missed Three Point Jumper.",26,33,-7,0.763368059775609,"Duke","Portland State",3,4,0,0,24.5,400986088,2017-11-23
112,1,"8:09",1689,1689,"Marvin Bagley III Defensive Rebound.",26,33,-7,0.763368059775609,"Duke","Portland State",3,4,0,0,24.5,400986088,2017-11-23
113,1,"7:50",1670,1670,"Foul on Jamie Orme.",26,33,-7,0.758935695259054,"Duke","Portland State",3,4,0,0,24.5,400986088,2017-11-23
114,1,"7:50",1670,1670,"Official TV Timeout",26,33,-7,0.758935695259054,"Duke","Portland State",3,4,0,0,24.5,400986088,2017-11-23
115,1,"7:50",1670,1670,"Marvin Bagley III missed Free Throw.",26,33,-7,0.758935695259054,"Duke","Portland State",3,4,0,0,24.5,400986088,2017-11-23
116,1,"7:50",1670,1670,"Duke Deadball Team Rebound.",26,33,-7,0.758935695259054,"Duke","Portland State",3,4,0,0,24.5,400986088,2017-11-23
117,1,"7:50",1670,1670,"Marvin Bagley III made Free Throw.",27,33,-6,0.783370767341983,"Duke","Portland State",3,4,0,0,24.5,400986088,2017-11-23
118,1,"7:30",1650,1650,"Bryce Canda missed Jumper.",27,33,-6,0.776147229219928,"Duke","Portland State",3,4,0,0,24.5,400986088,2017-11-23
119,1,"7:30",1650,1650,"Deontae North Offensive Rebound.",27,33,-6,0.776147229219928,"Duke","Portland State",3,4,0,0,24.5,400986088,2017-11-23
120,1,"7:30",1650,1650,"Foul on Marques Bolden.",27,33,-6,0.776147229219928,"Duke","Portland State",3,4,0,0,24.5,400986088,2017-11-23
121,1,"7:30",1650,1650,"Deontae North made Free Throw.",27,34,-7,0.75227591733338,"Duke","Portland State",3,4,0,0,24.5,400986088,2017-11-23
122,1,"7:30",1650,1650,"Deontae North made Free Throw.",27,35,-8,0.726755191303463,"Duke","Portland State",3,4,0,0,24.5,400986088,2017-11-23
123,1,"7:17",1637,1637,"Marques Bolden made Layup. Assisted by Alex O'Connell.",29,35,-6,0.782631988223674,"Duke","Portland State",3,4,0,0,24.5,400986088,2017-11-23
124,1,"7:05",1625,1625,"Bryce Canda missed Three Point Jumper.",29,35,-6,0.77065379233175,"Duke","Portland State",3,4,0,0,24.5,400986088,2017-11-23
125,1,"7:05",1625,1625,"Marques Bolden Defensive Rebound.",29,35,-6,0.77065379233175,"Duke","Portland State",3,4,0,0,24.5,400986088,2017-11-23
126,1,"6:53",1613,1613,"Grayson Allen missed Three Point Jumper.",29,35,-6,0.749624493152334,"Duke","Portland State",3,4,0,0,24.5,400986088,2017-11-23
127,1,"6:53",1613,1613,"Marques Bolden Offensive Rebound.",29,35,-6,0.749624493152334,"Duke","Portland State",3,4,0,0,24.5,400986088,2017-11-23
128,1,"6:44",1604,1604,"Alex O'Connell missed Three Point Jumper.",29,35,-6,0.787823049622516,"Duke","Portland State",3,4,0,0,24.5,400986088,2017-11-23
129,1,"6:44",1604,1604,"Holland Woods Defensive Rebound.",29,35,-6,0.787823049622516,"Duke","Portland State",3,4,0,0,24.5,400986088,2017-11-23
130,1,"6:21",1581,1581,"Holland Woods missed Jumper.",29,35,-6,0.773141347047024,"Duke","Portland State",3,4,0,0,24.5,400986088,2017-11-23
131,1,"6:21",1581,1581,"Bryce Canda Offensive Rebound.",29,35,-6,0.773141347047024,"Duke","Portland State",3,4,0,0,24.5,400986088,2017-11-23
132,1,"6:21",1581,1581,"Bryce Canda made Two Point Tip Shot.",29,37,-8,0.722118402835292,"Duke","Portland State",3,4,0,0,24.5,400986088,2017-11-23
133,1,"5:57",1557,1557,"Alex O'Connell made Layup. Assisted by Grayson Allen.",31,37,-6,0.747306921769889,"Duke","Portland State",3,4,0,0,24.5,400986088,2017-11-23
134,1,"5:38",1538,1538,"Deante Strickland missed Jumper.",31,37,-6,0.773490247891778,"Duke","Portland State",3,4,0,0,24.5,400986088,2017-11-23
135,1,"5:38",1538,1538,"Marques Bolden Block.",31,37,-6,0.773490247891778,"Duke","Portland State",3,4,0,0,24.5,400986088,2017-11-23
136,1,"5:38",1538,1538,"Marques Bolden Defensive Rebound.",31,37,-6,0.773490247891778,"Duke","Portland State",3,4,0,0,24.5,400986088,2017-11-23
137,1,"5:26",1526,1526,"Alex O'Connell made Three Point Jumper. Assisted by Grayson Allen.",34,37,-3,0.825509362379039,"Duke","Portland State",3,4,0,0,24.5,400986088,2017-11-23
138,1,"5:06",1506,1506,"Foul on Jordan Goldwire.",34,37,-3,0.828626783768187,"Duke","Portland State",3,4,0,0,24.5,400986088,2017-11-23
139,1,"4:53",1493,1493,"Foul on Deontae North.",34,37,-3,0.835328262283579,"Duke","Portland State",3,4,0,0,24.5,400986088,2017-11-23
140,1,"4:53",1493,1493,"Deontae North Turnover.",34,37,-3,0.835328262283579,"Duke","Portland State",3,4,0,0,24.5,400986088,2017-11-23
141,1,"4:39",1479,1479,"Gary Trent Jr missed Three Point Jumper.",34,37,-3,0.844999903580534,"Duke","Portland State",3,4,0,0,24.5,400986088,2017-11-23
142,1,"4:39",1479,1479,"Jamie Orme Defensive Rebound.",34,37,-3,0.844999903580534,"Duke","Portland State",3,4,0,0,24.5,400986088,2017-11-23
143,1,"4:31",1471,1471,"Bryce Canda made Layup.",34,39,-5,0.800627904546103,"Duke","Portland State",3,4,0,0,24.5,400986088,2017-11-23
144,1,"4:15",1455,1455,"Grayson Allen made Three Point Jumper. Assisted by Jordan Goldwire.",37,39,-2,0.841360772542403,"Duke","Portland State",3,4,0,0,24.5,400986088,2017-11-23
145,1,"3:46",1426,1426,"Deontae North made Three Point Jumper. Assisted by Bryce Canda.",37,42,-5,0.756236700443051,"Duke","Portland State",3,4,0,0,24.5,400986088,2017-11-23
146,1,"3:17",1397,1397,"Foul on Jamie Orme.",37,42,-5,0.782166070220376,"Duke","Portland State",3,4,0,0,24.5,400986088,2017-11-23
147,1,"3:17",1397,1397,"Official TV Timeout",37,42,-5,0.782166070220376,"Duke","Portland State",3,4,0,0,24.5,400986088,2017-11-23
148,1,"3:17",1397,1397,"Marvin Bagley III missed Free Throw.",37,42,-5,0.782166070220376,"Duke","Portland State",3,4,0,0,24.5,400986088,2017-11-23
149,1,"3:17",1397,1397,"Duke Deadball Team Rebound.",37,42,-5,0.782166070220376,"Duke","Portland State",3,4,0,0,24.5,400986088,2017-11-23
150,1,"3:17",1397,1397,"Marvin Bagley III made Free Throw.",38,42,-4,0.807331556246591,"Duke","Portland State",3,4,0,0,24.5,400986088,2017-11-23
151,1,"2:53",1373,1373,"Brandon Hollins missed Jumper.",38,42,-4,0.791482816507513,"Duke","Portland State",3,4,0,0,24.5,400986088,2017-11-23
152,1,"2:53",1373,1373,"Marvin Bagley III Block.",38,42,-4,0.791482816507513,"Duke","Portland State",3,4,0,0,24.5,400986088,2017-11-23
153,1,"2:53",1373,1373,"Bryce Canda Offensive Rebound.",38,42,-4,0.791482816507513,"Duke","Portland State",3,4,0,0,24.5,400986088,2017-11-23
154,1,"2:44",1364,1364,"Bryce Canda missed Jumper.",38,42,-4,0.786318478589173,"Duke","Portland State",3,4,0,0,24.5,400986088,2017-11-23
155,1,"2:44",1364,1364,"Marques Bolden Defensive Rebound.",38,42,-4,0.786318478589173,"Duke","Portland State",3,4,0,0,24.5,400986088,2017-11-23
156,1,"2:39",1359,1359,"Foul on Deontae North.",38,42,-4,0.793039248824519,"Duke","Portland State",3,4,0,0,24.5,400986088,2017-11-23
157,1,"2:39",1359,1359,"Marvin Bagley III made Free Throw.",39,42,-3,0.817249455946573,"Duke","Portland State",3,4,0,0,24.5,400986088,2017-11-23
158,1,"2:39",1359,1359,"Marvin Bagley III made Free Throw.",40,42,-2,0.839201802976507,"Duke","Portland State",3,4,0,0,24.5,400986088,2017-11-23
159,1,"2:10",1330,1330,"Deante Strickland missed Three Point Jumper.",40,42,-2,0.819120579837823,"Duke","Portland State",3,4,0,0,24.5,400986088,2017-11-23
160,1,"2:10",1330,1330,"Gary Trent Jr Defensive Rebound.",40,42,-2,0.819120579837823,"Duke","Portland State",3,4,0,0,24.5,400986088,2017-11-23
161,1,"2:08",1328,1328,"Foul on Brandon Hollins.",40,42,-2,0.829878912674033,"Duke","Portland State",3,4,0,0,24.5,400986088,2017-11-23
162,1,"2:08",1328,1328,"Gary Trent Jr made Free Throw.",41,42,-1,0.850988432066168,"Duke","Portland State",3,4,0,0,24.5,400986088,2017-11-23
163,1,"2:08",1328,1328,"Gary Trent Jr made Free Throw.",42,42,0,0.869889245062704,"Duke","Portland State",3,4,0,0,24.5,400986088,2017-11-23
164,1,"1:57",1317,1317,"Deante Strickland missed Jumper.",42,42,0,0.871445159511654,"Duke","Portland State",3,4,0,0,24.5,400986088,2017-11-23
165,1,"1:57",1317,1317,"Brandon Hollins Offensive Rebound.",42,42,0,0.871445159511654,"Duke","Portland State",3,4,0,0,24.5,400986088,2017-11-23
166,1,"1:36",1296,1296,"Holland Woods missed Three Point Jumper.",42,42,0,0.860751232275868,"Duke","Portland State",3,4,0,0,24.5,400986088,2017-11-23
167,1,"1:36",1296,1296,"Duke Defensive Rebound.",42,42,0,0.860751232275868,"Duke","Portland State",3,4,0,0,24.5,400986088,2017-11-23
168,1,"1:26",1286,1286,"Marvin Bagley III missed Jumper.",42,42,0,0.876565764644175,"Duke","Portland State",3,4,0,0,24.5,400986088,2017-11-23
169,1,"1:26",1286,1286,"Bryce Canda Defensive Rebound.",42,42,0,0.876565764644175,"Duke","Portland State",3,4,0,0,24.5,400986088,2017-11-23
170,1,"1:03",1263,1263,"Foul on Marques Bolden.",42,42,0,0.878380980372646,"Duke","Portland State",3,4,0,0,24.5,400986088,2017-11-23
171,1,"1:03",1263,1263,"Michael Mayhew made Free Throw.",42,43,-1,0.86044539789649,"Duke","Portland State",3,4,0,0,24.5,400986088,2017-11-23
172,1,"1:03",1263,1263,"Michael Mayhew made Free Throw.",42,44,-2,0.84034555146628,"Duke","Portland State",3,4,0,0,24.5,400986088,2017-11-23
173,1,"0:54",1254,1254,"Grayson Allen missed Three Point Jumper.",42,44,-2,0.809864475566699,"Duke","Portland State",3,4,0,0,24.5,400986088,2017-11-23
174,1,"0:54",1254,1254,"Portland State Defensive Rebound.",42,44,-2,0.809864475566699,"Duke","Portland State",3,4,0,0,24.5,400986088,2017-11-23
175,1,"0:49",1249,1249,"Foul on Wendell Carter Jr.",42,44,-2,0.830841475821253,"Duke","Portland State",3,4,0,0,24.5,400986088,2017-11-23
176,1,"0:49",1249,1249,"Brendan Rumel made Free Throw.",42,45,-3,0.807952418292693,"Duke","Portland State",3,4,0,0,24.5,400986088,2017-11-23
177,1,"0:49",1249,1249,"Brendan Rumel made Free Throw.",42,46,-4,0.782775964223874,"Duke","Portland State",3,4,0,0,24.5,400986088,2017-11-23
178,1,"0:32",1232,1232,"Wendell Carter Jr made Layup. Assisted by Grayson Allen.",44,46,-2,0.809101217158898,"Duke","Portland State",3,4,0,0,24.5,400986088,2017-11-23
179,1,"0:32",1232,1232,"Foul on Brendan Rumel.",44,46,-2,0.809101217158898,"Duke","Portland State",3,4,0,0,24.5,400986088,2017-11-23
180,1,"0:32",1232,1232,"Wendell Carter Jr made Free Throw.",45,46,-1,0.832742241371947,"Duke","Portland State",3,4,0,0,24.5,400986088,2017-11-23
