"play_id","half","time_remaining_half","secs_remaining","secs_remaining_absolute","description","home_score","away_score","score_diff","win_prob","home","away","home_time_out_remaining","away_time_out_remaining","home_timeout_ind","away_timeout_ind","home_favored_by","game_id","date"
362,2,"2:19",139,139,"Foul on Bryce Canda.",90,75,15,0.999887600646182,"Duke","Portland State",2,3,0,0,24.5,400986088,2017-11-23
363,2,"2:19",139,139,"Technical Foul on Grayson Allen.",90,75,15,0.999887600646182,"Duke","Portland State",2,3,0,0,24.5,400986088,2017-11-23
364,2,"2:19",139,139,"Foul on Grayson Allen.",90,75,15,0.999887600646182,"Duke","Portland State",2,3,0,0,24.5,400986088,2017-11-23
365,2,"2:19",139,139,"Grayson Allen made Free Throw.",91,75,16,0.999935003512521,"Duke","Portland State",2,3,0,0,24.5,400986088,2017-11-23
366,2,"2:19",139,139,"Grayson Allen made Free Throw.",92,75,17,0.999962415629821,"Duke","Portland State",2,3,0,0,24.5,400986088,2017-11-23
367,2,"1:56",116,116,"Deante Strickland missed Jumper.",92,75,17,0.999984775992876,"Duke","Portland State",2,3,0,0,24.5,400986088,2017-11-23
368,2,"1:56",116,116,"Portland State Offensive Rebound.",92,75,17,0.999984775992876,"Duke","Portland State",2,3,0,0,24.5,400986088,2017-11-23
369,2,"1:48",108,108,"Holland Woods made Three Point Jumper. Assisted by Deante Strickland.",92,78,14,0.999917401023694,"Duke","Portland State",2,3,0,0,24.5,400986088,2017-11-23
370,2,"1:17",77,77,"Marvin Bagley III missed Three Point Jumper.",92,78,14,0.999982745285269,"Duke","Portland State",2,3,0,0,24.5,400986088,2017-11-23
371,2,"1:17",77,77,"Alex O'Connell Offensive Rebound.",92,78,14,0.999982745285269,"Duke","Portland State",2,3,0,0,24.5,400986088,2017-11-23
372,2,"1:17",77,77,"Alex O'Connell made Two Point Tip Shot.",94,78,16,0.999996032650264,"Duke","Portland State",2,3,0,0,24.5,400986088,2017-11-23
373,2,"1:04",64,64,"Jamie Orme Turnover.",94,78,16,0.999995041140672,"Duke","Portland State",2,3,0,0,24.5,400986088,2017-11-23
374,2,"1:04",64,64,"Foul on Brandon Hollins.",94,78,16,0.999995041140672,"Duke","Portland State",2,3,0,0,24.5,400986088,2017-11-23
375,2,"1:04",64,64,"Javin DeLaurier made Free Throw.",95,78,17,0.999997639360105,"Duke","Portland State",2,3,0,0,24.5,400986088,2017-11-23
376,2,"1:04",64,64,"Javin DeLaurier missed Free Throw.",95,78,17,0.999997639360105,"Duke","Portland State",2,3,0,0,24.5,400986088,2017-11-23
377,2,"1:03",63,63,"Jamie Orme Defensive Rebound.",95,78,17,0.999997639360105,"Duke","Portland State",2,3,0,0,24.5,400986088,2017-11-23
378,2,"1:03",63,63,"Foul on Marques Bolden.",95,78,17,0.999997639360105,"Duke","Portland State",2,3,0,0,24.5,400986088,2017-11-23
379,2,"1:03",63,63,"Jamie Orme missed Free Throw.",95,78,17,0.999997639360105,"Duke","Portland State",2,3,0,0,24.5,400986088,2017-11-23
380,2,"1:03",63,63,"Marques Bolden Defensive Rebound.",95,78,17,0.999997639360105,"Duke","Portland State",2,3,0,0,24.5,400986088,2017-11-23
381,2,"0:56",56,56,"Foul on Jamie Orme.",95,78,17,0.999999864500062,"Duke","Portland State",2,3,0,0,24.5,400986088,2017-11-23
382,2,"0:56",56,56,"Gary Trent Jr made Free Throw.",96,78,18,0.999999943308384,"Duke","Portland State",2,3,0,0,24.5,400986088,2017-11-23
383,2,"0:56",56,56,"Gary Trent Jr made Free Throw.",97,78,19,0.999999976280881,"Duke","Portland State",2,3,0,0,24.5,400986088,2017-11-23
384,2,"0:50",50,50,"Holland Woods missed Three Point Jumper.",97,78,19,0.999999985754514,"Duke","Portland State",2,3,0,0,24.5,400986088,2017-11-23
385,2,"0:50",50,50,"Javin DeLaurier Defensive Rebound.",97,78,19,0.999999985754514,"Duke","Portland State",2,3,0,0,24.5,400986088,2017-11-23
386,2,"0:40",40,40,"Alex O'Connell missed Three Point Jumper.",97,78,19,0.999999994012669,"Duke","Portland State",2,3,0,0,24.5,400986088,2017-11-23
387,2,"0:40",40,40,"Ryan Edwards Defensive Rebound.",97,78,19,0.999999994012669,"Duke","Portland State",2,3,0,0,24.5,400986088,2017-11-23
388,2,"0:32",32,32,"Devyn Wilson missed Jumper.",97,78,19,0.99999999973637,"Duke","Portland State",2,3,0,0,24.5,400986088,2017-11-23
389,2,"0:32",32,32,"Alex O'Connell Block.",97,78,19,0.99999999973637,"Duke","Portland State",2,3,0,0,24.5,400986088,2017-11-23
390,2,"0:32",32,32,"Justin Robinson Defensive Rebound.",97,78,19,0.99999999973637,"Duke","Portland State",2,3,0,0,24.5,400986088,2017-11-23
391,2,"0:06",6,6,"Marques Bolden made Layup. Assisted by Javin DeLaurier.",99,78,21,0.999999999999999,"Duke","Portland State",2,3,0,0,24.5,400986088,2017-11-23
392,2,"0:04",4,4,"Vonte Carter made Three Point Jumper. Assisted by Holland Woods.",99,81,18,0.999999999999988,"Duke","Portland State",2,3,0,0,24.5,400986088,2017-11-23
393,2,"0:00",0,0,"End of Game",99,81,18,1,"Duke","Portland State",2,3,0,0,24.5,400986088,2017-11-23
