"play_id","half","time_remaining_half","secs_remaining","secs_remaining_absolute","description","home_score","away_score","score_diff","win_prob","home","away","home_time_out_remaining","away_time_out_remaining","home_timeout_ind","away_timeout_ind","home_favored_by","game_id","date"
1,1,"20:00",2400,2400,"PLAY",0,0,0,0.753398478938886,"Furman","Samford",4,4,0,0,5,400945418,2017-03-04
2,1,"19:49",2389,2389,"Alex Thompson made Three Point Jumper. Assisted by Christen Cunningham.",0,3,-3,0.731271853369954,"Furman","Samford",4,4,0,0,5,400945418,2017-03-04
3,1,"19:15",2355,2355,"Kris Acox Turnover.",0,3,-3,0.704486321023817,"Furman","Samford",4,4,0,0,5,400945418,2017-03-04
4,1,"19:14",2354,2354,"Alex Thompson Steal.",0,3,-3,0.704486321023817,"Furman","Samford",4,4,0,0,5,400945418,2017-03-04
5,1,"19:09",2349,2349,"Demetrius Denzel-Dyson made Three Point Jumper. Assisted by Christen Cunningham.",0,6,-6,0.62275441449085,"Furman","Samford",4,4,0,0,5,400945418,2017-03-04
6,1,"18:46",2326,2326,"Devin Sibley made Layup.",2,6,-4,0.661863928656636,"Furman","Samford",4,4,0,0,5,400945418,2017-03-04
7,1,"18:17",2297,2297,"Alex Thompson missed Three Point Jumper.",2,6,-4,0.665202856561194,"Furman","Samford",4,4,0,0,5,400945418,2017-03-04
8,1,"18:17",2297,2297,"Demetrius Denzel-Dyson Offensive Rebound.",2,6,-4,0.665202856561194,"Furman","Samford",4,4,0,0,5,400945418,2017-03-04
9,1,"18:10",2290,2290,"Demetrius Denzel-Dyson missed Three Point Jumper.",2,6,-4,0.665202856561194,"Furman","Samford",4,4,0,0,5,400945418,2017-03-04
10,1,"18:10",2290,2290,"Furman Defensive Rebound.",2,6,-4,0.665202856561194,"Furman","Samford",4,4,0,0,5,400945418,2017-03-04
11,1,"17:50",2270,2270,"John Davis III missed Three Point Jumper.",2,6,-4,0.658030724247258,"Furman","Samford",4,4,0,0,5,400945418,2017-03-04
12,1,"17:50",2270,2270,"Furman Offensive Rebound.",2,6,-4,0.658030724247258,"Furman","Samford",4,4,0,0,5,400945418,2017-03-04
13,1,"17:47",2267,2267,"Foul on Demetrius Denzel-Dyson.",2,6,-4,0.644827939832747,"Furman","Samford",4,4,0,0,5,400945418,2017-03-04
14,1,"17:41",2261,2261,"Andrew Brown made Jumper.",4,6,-2,0.699161075877306,"Furman","Samford",4,4,0,0,5,400945418,2017-03-04
15,1,"17:22",2242,2242,"Christen Cunningham made Layup.",4,8,-4,0.656170329442515,"Furman","Samford",4,4,0,0,5,400945418,2017-03-04
16,1,"16:55",2215,2215,"Daniel Fowler missed Jumper.",4,8,-4,0.627928828888402,"Furman","Samford",4,4,0,0,5,400945418,2017-03-04
17,1,"16:55",2215,2215,"Wyatt Walker Defensive Rebound.",4,8,-4,0.627928828888402,"Furman","Samford",4,4,0,0,5,400945418,2017-03-04
18,1,"16:43",2203,2203,"Wyatt Walker made Layup. Assisted by Christen Cunningham.",4,10,-6,0.589573826410168,"Furman","Samford",4,4,0,0,5,400945418,2017-03-04
19,1,"16:26",2186,2186,"John Davis III made Three Point Jumper. Assisted by Devin Sibley.",7,10,-3,0.670733997329254,"Furman","Samford",4,4,0,0,5,400945418,2017-03-04
20,1,"16:04",2164,2164,"Alex Thompson missed Three Point Jumper.",7,10,-3,0.664407224162538,"Furman","Samford",4,4,0,0,5,400945418,2017-03-04
21,1,"16:04",2164,2164,"John Davis III Defensive Rebound.",7,10,-3,0.664407224162538,"Furman","Samford",4,4,0,0,5,400945418,2017-03-04
22,1,"15:55",2155,2155,"Kris Acox missed Jumper.",7,10,-3,0.653150271058886,"Furman","Samford",4,4,0,0,5,400945418,2017-03-04
23,1,"15:55",2155,2155,"Wyatt Walker Defensive Rebound.",7,10,-3,0.653150271058886,"Furman","Samford",4,4,0,0,5,400945418,2017-03-04
24,1,"15:31",2131,2131,"Wyatt Walker made Jumper.",7,12,-5,0.602030053690494,"Furman","Samford",4,4,0,0,5,400945418,2017-03-04
25,1,"15:27",2127,2127,"Official TV Timeout",7,12,-5,0.604347949835836,"Furman","Samford",4,4,0,0,5,400945418,2017-03-04
26,1,"15:02",2102,2102,"Geoff Beans missed Three Point Jumper.",7,12,-5,0.606202437204265,"Furman","Samford",4,4,0,0,5,400945418,2017-03-04
27,1,"15:02",2102,2102,"Demetrius Denzel-Dyson Defensive Rebound.",7,12,-5,0.606202437204265,"Furman","Samford",4,4,0,0,5,400945418,2017-03-04
28,1,"14:31",2071,2071,"Josh Sharkey missed Three Point Jumper.",7,12,-5,0.615631054758866,"Furman","Samford",4,4,0,0,5,400945418,2017-03-04
29,1,"14:31",2071,2071,"Kris Acox Defensive Rebound.",7,12,-5,0.615631054758866,"Furman","Samford",4,4,0,0,5,400945418,2017-03-04
30,1,"14:10",2050,2050,"Devin Sibley missed Three Point Jumper.",7,12,-5,0.60683108557184,"Furman","Samford",4,4,0,0,5,400945418,2017-03-04
31,1,"14:10",2050,2050,"Samford Deadball Team Rebound.",7,12,-5,0.60683108557184,"Furman","Samford",4,4,0,0,5,400945418,2017-03-04
32,1,"13:41",2021,2021,"Wyatt Walker made Jumper.",7,14,-7,0.514948687869428,"Furman","Samford",4,4,0,0,5,400945418,2017-03-04
33,1,"13:19",1999,1999,"Geoff Beans missed Three Point Jumper.",7,14,-7,0.522755348263466,"Furman","Samford",4,4,0,0,5,400945418,2017-03-04
34,1,"13:19",1999,1999,"Christen Cunningham Defensive Rebound.",7,14,-7,0.522755348263466,"Furman","Samford",4,4,0,0,5,400945418,2017-03-04
35,1,"12:59",1979,1979,"Foul on Geoff Beans.",7,14,-7,0.533454593288987,"Furman","Samford",4,4,0,0,5,400945418,2017-03-04
36,1,"12:49",1969,1969,"Christen Cunningham missed Three Point Jumper.",7,14,-7,0.561568659261908,"Furman","Samford",4,4,0,0,5,400945418,2017-03-04
37,1,"12:49",1969,1969,"Josh Sharkey Offensive Rebound.",7,14,-7,0.561568659261908,"Furman","Samford",4,4,0,0,5,400945418,2017-03-04
38,1,"12:44",1964,1964,"Foul on Jonathan Jean.",7,14,-7,0.561568659261908,"Furman","Samford",4,4,0,0,5,400945418,2017-03-04
39,1,"12:33",1953,1953,"Foul on Jalen Williams.",7,14,-7,0.529442356493566,"Furman","Samford",4,4,0,0,5,400945418,2017-03-04
40,1,"12:33",1953,1953,"Josh Sharkey made Free Throw.",7,15,-8,0.498215786189427,"Furman","Samford",4,4,0,0,5,400945418,2017-03-04
41,1,"12:33",1953,1953,"Josh Sharkey made Free Throw.",7,16,-9,0.467003128137924,"Furman","Samford",4,4,0,0,5,400945418,2017-03-04
42,1,"12:20",1940,1940,"Foul on Josh Sharkey.",7,16,-9,0.458620833735664,"Furman","Samford",4,4,0,0,5,400945418,2017-03-04
43,1,"12:12",1932,1932,"Jonathan Jean Turnover.",7,16,-9,0.44161216797573,"Furman","Samford",4,4,0,0,5,400945418,2017-03-04
44,1,"12:11",1931,1931,"Alex Peters Steal.",7,16,-9,0.44161216797573,"Furman","Samford",4,4,0,0,5,400945418,2017-03-04
45,1,"11:58",1918,1918,"Foul on Jalen Williams.",7,16,-9,0.470930931891836,"Furman","Samford",4,4,0,0,5,400945418,2017-03-04
46,1,"11:57",1917,1917,"Official TV Timeout",7,16,-9,0.470930931891836,"Furman","Samford",4,4,0,0,5,400945418,2017-03-04
47,1,"11:57",1917,1917,"Justin Hopkins made Free Throw.",7,17,-10,0.438968409194459,"Furman","Samford",4,4,0,0,5,400945418,2017-03-04
48,1,"11:57",1917,1917,"Justin Hopkins made Free Throw.",7,18,-11,0.407504334789248,"Furman","Samford",4,4,0,0,5,400945418,2017-03-04
49,1,"11:48",1908,1908,"Devin Sibley missed Jumper.",7,18,-11,0.423672522783981,"Furman","Samford",4,4,0,0,5,400945418,2017-03-04
50,1,"11:48",1908,1908,"Furman Offensive Rebound.",7,18,-11,0.423672522783981,"Furman","Samford",4,4,0,0,5,400945418,2017-03-04
51,1,"11:21",1881,1881,"Daniel Fowler missed Layup.",7,18,-11,0.40143412365615,"Furman","Samford",4,4,0,0,5,400945418,2017-03-04
52,1,"11:21",1881,1881,"Daniel Fowler Offensive Rebound.",7,18,-11,0.40143412365615,"Furman","Samford",4,4,0,0,5,400945418,2017-03-04
53,1,"11:17",1877,1877,"Devin Sibley made Three Point Jumper. Assisted by John Davis III.",10,18,-8,0.490493405974195,"Furman","Samford",4,4,0,0,5,400945418,2017-03-04
54,1,"10:59",1859,1859,"Wyatt Walker missed Layup.",10,18,-8,0.487899642055951,"Furman","Samford",4,4,0,0,5,400945418,2017-03-04
55,1,"10:59",1859,1859,"Wyatt Walker Offensive Rebound.",10,18,-8,0.487899642055951,"Furman","Samford",4,4,0,0,5,400945418,2017-03-04
56,1,"10:55",1855,1855,"Wyatt Walker missed Layup.",10,18,-8,0.487899642055951,"Furman","Samford",4,4,0,0,5,400945418,2017-03-04
57,1,"10:55",1855,1855,"Geoff Beans Defensive Rebound.",10,18,-8,0.487899642055951,"Furman","Samford",4,4,0,0,5,400945418,2017-03-04
58,1,"10:51",1851,1851,"Daniel Fowler Turnover.",10,18,-8,0.487899642055951,"Furman","Samford",4,4,0,0,5,400945418,2017-03-04
59,1,"10:50",1850,1850,"Triston Chambers Steal.",10,18,-8,0.487899642055951,"Furman","Samford",4,4,0,0,5,400945418,2017-03-04
60,1,"10:49",1849,1849,"Triston Chambers missed Three Point Jumper.",10,18,-8,0.478379935544214,"Furman","Samford",4,4,0,0,5,400945418,2017-03-04
61,1,"10:49",1849,1849,"Daniel Fowler Defensive Rebound.",10,18,-8,0.478379935544214,"Furman","Samford",4,4,0,0,5,400945418,2017-03-04
62,1,"10:41",1841,1841,"Devin Sibley missed Three Point Jumper.",10,18,-8,0.478379935544214,"Furman","Samford",4,4,0,0,5,400945418,2017-03-04
63,1,"10:41",1841,1841,"Alex Thompson Defensive Rebound.",10,18,-8,0.478379935544214,"Furman","Samford",4,4,0,0,5,400945418,2017-03-04
64,1,"10:10",1810,1810,"Alex Thompson made Three Point Jumper. Assisted by Christen Cunningham.",10,21,-11,0.361769112403246,"Furman","Samford",4,4,0,0,5,400945418,2017-03-04
65,1,"9:40",1780,1780,"John Davis III missed Three Point Jumper.",10,21,-11,0.336599403161614,"Furman","Samford",4,4,0,0,5,400945418,2017-03-04
66,1,"9:40",1780,1780,"Alex Thompson Defensive Rebound.",10,21,-11,0.336599403161614,"Furman","Samford",4,4,0,0,5,400945418,2017-03-04
67,1,"9:30",1770,1770,"Christen Cunningham made Jumper.",10,23,-13,0.331023957478251,"Furman","Samford",4,4,0,0,5,400945418,2017-03-04
68,1,"9:26",1766,1766,"Furman  Timeout",10,23,-13,0.332375538356583,"Furman","Samford",3,4,1,0,5,400945418,2017-03-04
69,1,"9:14",1754,1754,"John Davis III Turnover.",10,23,-13,0.280734528560593,"Furman","Samford",3,4,1,0,5,400945418,2017-03-04
70,1,"8:52",1732,1732,"Christen Cunningham missed Jumper.",10,23,-13,0.301788808290129,"Furman","Samford",3,4,1,0,5,400945418,2017-03-04
71,1,"8:52",1732,1732,"Kris Acox Defensive Rebound.",10,23,-13,0.301788808290129,"Furman","Samford",3,4,1,0,5,400945418,2017-03-04
72,1,"8:44",1724,1724,"Devin Sibley made Layup. Assisted by John Davis III.",12,23,-11,0.35964874253324,"Furman","Samford",3,4,1,0,5,400945418,2017-03-04
73,1,"8:43",1723,1723,"Foul on Triston Chambers.",12,23,-11,0.35964874253324,"Furman","Samford",3,4,1,0,5,400945418,2017-03-04
74,1,"8:43",1723,1723,"Devin Sibley made Free Throw.",13,23,-10,0.391422693651186,"Furman","Samford",3,4,1,0,5,400945418,2017-03-04
75,1,"8:13",1693,1693,"Josh Sharkey missed Jumper.",13,23,-10,0.380227684451101,"Furman","Samford",3,4,0,0,5,400945418,2017-03-04
76,1,"8:13",1693,1693,"Kris Acox Defensive Rebound.",13,23,-10,0.380227684451101,"Furman","Samford",3,4,0,0,5,400945418,2017-03-04
77,1,"8:06",1686,1686,"Foul on Josh Sharkey.",13,23,-10,0.380013659914558,"Furman","Samford",3,4,0,0,5,400945418,2017-03-04
78,1,"7:59",1679,1679,"Devin Sibley made Jumper. Assisted by Andrew Brown.",15,23,-8,0.458715828347747,"Furman","Samford",3,4,0,0,5,400945418,2017-03-04
79,1,"7:40",1660,1660,"Triston Chambers made Jumper.",15,25,-10,0.40837082346455,"Furman","Samford",3,4,0,0,5,400945418,2017-03-04
80,1,"7:24",1644,1644,"Jordan Lyons missed Three Point Jumper.",15,25,-10,0.390703244949499,"Furman","Samford",3,4,0,0,5,400945418,2017-03-04
81,1,"7:24",1644,1644,"Demetrius Denzel-Dyson Defensive Rebound.",15,25,-10,0.390703244949499,"Furman","Samford",3,4,0,0,5,400945418,2017-03-04
82,1,"7:13",1633,1633,"Christen Cunningham missed Jumper.",15,25,-10,0.408896713325708,"Furman","Samford",3,4,0,0,5,400945418,2017-03-04
83,1,"7:13",1633,1633,"Wyatt Walker Offensive Rebound.",15,25,-10,0.408896713325708,"Furman","Samford",3,4,0,0,5,400945418,2017-03-04
84,1,"7:08",1628,1628,"Wyatt Walker Turnover.",15,25,-10,0.373662443792615,"Furman","Samford",3,4,0,0,5,400945418,2017-03-04
85,1,"7:08",1628,1628,"Devin Sibley Steal.",15,25,-10,0.373662443792615,"Furman","Samford",3,4,0,0,5,400945418,2017-03-04
86,1,"7:02",1622,1622,"Andrew Brown missed Layup.",15,25,-10,0.373662443792615,"Furman","Samford",3,4,0,0,5,400945418,2017-03-04
87,1,"7:02",1622,1622,"Wyatt Walker Defensive Rebound.",15,25,-10,0.373662443792615,"Furman","Samford",3,4,0,0,5,400945418,2017-03-04
88,1,"6:41",1601,1601,"Demetrius Denzel-Dyson Turnover.",15,25,-10,0.400022101374425,"Furman","Samford",3,4,0,0,5,400945418,2017-03-04
89,1,"6:40",1600,1600,"John Davis III Steal.",15,25,-10,0.400022101374425,"Furman","Samford",3,4,0,0,5,400945418,2017-03-04
90,1,"6:35",1595,1595,"Devin Sibley made Layup.",17,25,-8,0.462830420936859,"Furman","Samford",3,4,0,0,5,400945418,2017-03-04
91,1,"6:02",1562,1562,"Wyatt Walker missed Layup.",17,25,-8,0.428106347903872,"Furman","Samford",3,4,0,0,5,400945418,2017-03-04
92,1,"6:02",1562,1562,"Kris Acox Defensive Rebound.",17,25,-8,0.428106347903872,"Furman","Samford",3,4,0,0,5,400945418,2017-03-04
93,1,"5:55",1555,1555,"Devin Sibley made Layup.",19,25,-6,0.4960954732905,"Furman","Samford",3,4,0,0,5,400945418,2017-03-04
94,1,"5:55",1555,1555,"Foul on Triston Chambers.",19,25,-6,0.4960954732905,"Furman","Samford",3,4,0,0,5,400945418,2017-03-04
95,1,"5:54",1554,1554,"Official TV Timeout",19,25,-6,0.4960954732905,"Furman","Samford",3,4,0,0,5,400945418,2017-03-04
96,1,"5:54",1554,1554,"Devin Sibley missed Free Throw.",19,25,-6,0.4960954732905,"Furman","Samford",3,4,0,0,5,400945418,2017-03-04
97,1,"5:54",1554,1554,"Alex Thompson Defensive Rebound.",19,25,-6,0.4960954732905,"Furman","Samford",3,4,0,0,5,400945418,2017-03-04
98,1,"5:38",1538,1538,"Alex Thompson missed Jumper.",19,25,-6,0.521100627932252,"Furman","Samford",3,4,0,0,5,400945418,2017-03-04
99,1,"5:38",1538,1538,"Samford Deadball Team Rebound.",19,25,-6,0.521100627932252,"Furman","Samford",3,4,0,0,5,400945418,2017-03-04
100,1,"5:37",1537,1537,"Foul on Devin Sibley.",19,25,-6,0.521100627932252,"Furman","Samford",3,4,0,0,5,400945418,2017-03-04
101,1,"5:29",1529,1529,"Foul on Jalen Williams.",19,25,-6,0.507171434385551,"Furman","Samford",3,4,0,0,5,400945418,2017-03-04
102,1,"5:29",1529,1529,"Justin Hopkins missed Free Throw.",19,25,-6,0.507171434385551,"Furman","Samford",3,4,0,0,5,400945418,2017-03-04
103,1,"5:29",1529,1529,"Samford Deadball Team Rebound.",19,25,-6,0.507171434385551,"Furman","Samford",3,4,0,0,5,400945418,2017-03-04
104,1,"5:29",1529,1529,"Justin Hopkins missed Free Throw.",19,25,-6,0.507171434385551,"Furman","Samford",3,4,0,0,5,400945418,2017-03-04
105,1,"5:29",1529,1529,"Andrew Brown Defensive Rebound.",19,25,-6,0.507171434385551,"Furman","Samford",3,4,0,0,5,400945418,2017-03-04
106,1,"5:11",1511,1511,"Andrew Brown missed Three Point Jumper.",19,25,-6,0.505560598663463,"Furman","Samford",3,4,0,0,5,400945418,2017-03-04
107,1,"5:11",1511,1511,"Daniel Fowler Offensive Rebound.",19,25,-6,0.505560598663463,"Furman","Samford",3,4,0,0,5,400945418,2017-03-04
108,1,"5:01",1501,1501,"Andrew Brown Turnover.",19,25,-6,0.507824218864602,"Furman","Samford",3,4,0,0,5,400945418,2017-03-04
109,1,"4:59",1499,1499,"Christen Cunningham Steal.",19,25,-6,0.529332769716067,"Furman","Samford",3,4,0,0,5,400945418,2017-03-04
110,1,"4:43",1483,1483,"Christen Cunningham missed Jumper.",19,25,-6,0.487745945789628,"Furman","Samford",3,4,0,0,5,400945418,2017-03-04
111,1,"4:43",1483,1483,"Justin Hopkins Offensive Rebound.",19,25,-6,0.487745945789628,"Furman","Samford",3,4,0,0,5,400945418,2017-03-04
112,1,"4:39",1479,1479,"Justin Hopkins made Layup.",19,27,-8,0.430126547355523,"Furman","Samford",3,4,0,0,5,400945418,2017-03-04
113,1,"4:16",1456,1456,"Andrew Brown made Three Point Jumper. Assisted by Devin Sibley.",22,27,-5,0.526183185006876,"Furman","Samford",3,4,0,0,5,400945418,2017-03-04
114,1,"3:47",1427,1427,"Christen Cunningham made Jumper.",22,29,-7,0.449255267684291,"Furman","Samford",3,4,0,0,5,400945418,2017-03-04
115,1,"3:30",1410,1410,"Devin Sibley missed Three Point Jumper.",22,29,-7,0.432346103138045,"Furman","Samford",3,4,0,0,5,400945418,2017-03-04
116,1,"3:30",1410,1410,"John Davis III Offensive Rebound.",22,29,-7,0.432346103138045,"Furman","Samford",3,4,0,0,5,400945418,2017-03-04
117,1,"3:25",1405,1405,"John Davis III made Three Point Jumper.",25,29,-4,0.57865427602563,"Furman","Samford",3,4,0,0,5,400945418,2017-03-04
118,1,"3:07",1387,1387,"Demetrius Denzel-Dyson Turnover.",25,29,-4,0.576334778263122,"Furman","Samford",3,4,0,0,5,400945418,2017-03-04
119,1,"3:05",1385,1385,"Daniel Fowler Steal.",25,29,-4,0.576334778263122,"Furman","Samford",3,4,0,0,5,400945418,2017-03-04
120,1,"3:04",1384,1384,"Devin Sibley made Layup. Assisted by Daniel Fowler.",27,29,-2,0.647174307108724,"Furman","Samford",3,4,0,0,5,400945418,2017-03-04
121,1,"2:55",1375,1375,"Samford  Turnover.",27,29,-2,0.628854418516219,"Furman","Samford",3,4,0,0,5,400945418,2017-03-04
122,1,"2:55",1375,1375,"Official TV Timeout",27,29,-2,0.628854418516219,"Furman","Samford",3,4,0,0,5,400945418,2017-03-04
123,1,"2:35",1355,1355,"Demetrius Denzel-Dyson missed Three Point Jumper.",27,29,-2,0.645034189540625,"Furman","Samford",3,4,0,0,5,400945418,2017-03-04
124,1,"2:35",1355,1355,"Jonathan Jean Defensive Rebound.",27,29,-2,0.645034189540625,"Furman","Samford",3,4,0,0,5,400945418,2017-03-04
125,1,"2:25",1345,1345,"Daniel Fowler missed Three Point Jumper.",27,29,-2,0.617860265387271,"Furman","Samford",3,4,0,0,5,400945418,2017-03-04
126,1,"2:25",1345,1345,"Alex Thompson Defensive Rebound.",27,29,-2,0.617860265387271,"Furman","Samford",3,4,0,0,5,400945418,2017-03-04
127,1,"2:11",1331,1331,"Alex Thompson missed Layup.",27,29,-2,0.615649233343784,"Furman","Samford",3,4,0,0,5,400945418,2017-03-04
128,1,"2:11",1331,1331,"Wyatt Walker Offensive Rebound.",27,29,-2,0.615649233343784,"Furman","Samford",3,4,0,0,5,400945418,2017-03-04
129,1,"2:07",1327,1327,"Wyatt Walker missed Layup.",27,29,-2,0.629017758716045,"Furman","Samford",3,4,0,0,5,400945418,2017-03-04
130,1,"2:07",1327,1327,"Geoff Beans Block.",27,29,-2,0.629017758716045,"Furman","Samford",3,4,0,0,5,400945418,2017-03-04
131,1,"2:06",1326,1326,"Wyatt Walker Offensive Rebound.",27,29,-2,0.629017758716045,"Furman","Samford",3,4,0,0,5,400945418,2017-03-04
132,1,"2:03",1323,1323,"Justin Hopkins Turnover.",27,29,-2,0.629017758716045,"Furman","Samford",3,4,0,0,5,400945418,2017-03-04
133,1,"2:03",1323,1323,"Foul on Justin Hopkins.",27,29,-2,0.629017758716045,"Furman","Samford",3,4,0,0,5,400945418,2017-03-04
134,1,"1:55",1315,1315,"Daniel Fowler missed Three Point Jumper.",27,29,-2,0.641220421757902,"Furman","Samford",3,4,0,0,5,400945418,2017-03-04
135,1,"1:55",1315,1315,"Christen Cunningham Defensive Rebound.",27,29,-2,0.641220421757902,"Furman","Samford",3,4,0,0,5,400945418,2017-03-04
136,1,"1:29",1289,1289,"Wyatt Walker missed Layup.",27,29,-2,0.638097047151833,"Furman","Samford",3,4,0,0,5,400945418,2017-03-04
137,1,"1:29",1289,1289,"Daniel Fowler Defensive Rebound.",27,29,-2,0.638097047151833,"Furman","Samford",3,4,0,0,5,400945418,2017-03-04
138,1,"1:26",1286,1286,"Daniel Fowler Turnover.",27,29,-2,0.638097047151833,"Furman","Samford",3,4,0,0,5,400945418,2017-03-04
139,1,"1:24",1284,1284,"Alex Thompson missed Three Point Jumper.",27,29,-2,0.638097047151833,"Furman","Samford",3,4,0,0,5,400945418,2017-03-04
140,1,"1:24",1284,1284,"Demetrius Denzel-Dyson Offensive Rebound.",27,29,-2,0.638097047151833,"Furman","Samford",3,4,0,0,5,400945418,2017-03-04
141,1,"1:21",1281,1281,"Foul on Daniel Fowler.",27,29,-2,0.638097047151833,"Furman","Samford",3,4,0,0,5,400945418,2017-03-04
142,1,"1:20",1280,1280,"Demetrius Denzel-Dyson made Free Throw.",27,30,-3,0.60284315742392,"Furman","Samford",3,4,0,0,5,400945418,2017-03-04
143,1,"1:20",1280,1280,"Demetrius Denzel-Dyson made Free Throw.",27,31,-4,0.566488211312729,"Furman","Samford",3,4,0,0,5,400945418,2017-03-04
144,1,"1:02",1262,1262,"Andrew Brown missed Three Point Jumper.",27,31,-4,0.570281636790543,"Furman","Samford",3,4,0,0,5,400945418,2017-03-04
145,1,"1:02",1262,1262,"Alex Thompson Defensive Rebound.",27,31,-4,0.570281636790543,"Furman","Samford",3,4,0,0,5,400945418,2017-03-04
146,1,"0:46",1246,1246,"Foul on Devin Sibley.",27,31,-4,0.555760949629472,"Furman","Samford",3,4,0,0,5,400945418,2017-03-04
147,1,"0:46",1246,1246,"Wyatt Walker missed Free Throw.",27,31,-4,0.555760949629472,"Furman","Samford",3,4,0,0,5,400945418,2017-03-04
148,1,"0:46",1246,1246,"Andrew Brown Defensive Rebound.",27,31,-4,0.555760949629472,"Furman","Samford",3,4,0,0,5,400945418,2017-03-04
149,1,"0:26",1226,1226,"John Davis III missed Layup.",27,31,-4,0.540835147981396,"Furman","Samford",3,4,0,0,5,400945418,2017-03-04
150,1,"0:26",1226,1226,"Justin Hopkins Defensive Rebound.",27,31,-4,0.540835147981396,"Furman","Samford",3,4,0,0,5,400945418,2017-03-04
151,1,"0:00",1200,1200,"End of 1st half",27,31,-4,0.545378808859946,"Furman","Samford",3,4,0,0,5,400945418,2017-03-04
152,2,"20:00",1200,1200,"PLAY",27,31,-4,0.545378808859946,"Furman","Samford",4,4,0,0,5,400945418,2017-03-04
153,2,"19:40",1180,1180,"John Davis III missed Three Point Jumper.",27,31,-4,0.539690626511476,"Furman","Samford",4,4,0,0,5,400945418,2017-03-04
154,2,"19:40",1180,1180,"Alex Thompson Defensive Rebound.",27,31,-4,0.539690626511476,"Furman","Samford",4,4,0,0,5,400945418,2017-03-04
155,2,"19:16",1156,1156,"Triston Chambers missed Three Point Jumper.",27,31,-4,0.536686303160996,"Furman","Samford",4,4,0,0,5,400945418,2017-03-04
156,2,"19:16",1156,1156,"Kris Acox Defensive Rebound.",27,31,-4,0.536686303160996,"Furman","Samford",4,4,0,0,5,400945418,2017-03-04
157,2,"19:08",1148,1148,"Devin Sibley made Three Point Jumper.",30,31,-1,0.644647528749107,"Furman","Samford",4,4,0,0,5,400945418,2017-03-04
158,2,"18:48",1128,1128,"Demetrius Denzel-Dyson made Three Point Jumper. Assisted by Christen Cunningham.",30,34,-4,0.508327368121106,"Furman","Samford",4,4,0,0,5,400945418,2017-03-04
159,2,"18:33",1113,1113,"Foul on Demetrius Denzel-Dyson.",30,34,-4,0.522929914950774,"Furman","Samford",4,4,0,0,5,400945418,2017-03-04
160,2,"18:17",1097,1097,"Daniel Fowler missed Three Point Jumper.",30,34,-4,0.538659668757523,"Furman","Samford",4,4,0,0,5,400945418,2017-03-04
161,2,"18:17",1097,1097,"Josh Sharkey Defensive Rebound.",30,34,-4,0.538659668757523,"Furman","Samford",4,4,0,0,5,400945418,2017-03-04
162,2,"18:05",1085,1085,"Christen Cunningham missed Layup.",30,34,-4,0.525818489741635,"Furman","Samford",4,4,0,0,5,400945418,2017-03-04
163,2,"18:05",1085,1085,"Kris Acox Block.",30,34,-4,0.525818489741635,"Furman","Samford",4,4,0,0,5,400945418,2017-03-04
164,2,"18:04",1084,1084,"Samford Offensive Rebound.",30,34,-4,0.525818489741635,"Furman","Samford",4,4,0,0,5,400945418,2017-03-04
165,2,"17:56",1076,1076,"Alex Thompson missed Three Point Jumper.",30,34,-4,0.53057213387195,"Furman","Samford",4,4,0,0,5,400945418,2017-03-04
166,2,"17:56",1076,1076,"Devin Sibley Defensive Rebound.",30,34,-4,0.53057213387195,"Furman","Samford",4,4,0,0,5,400945418,2017-03-04
167,2,"17:51",1071,1071,"Foul on Demetrius Denzel-Dyson.",30,34,-4,0.53057213387195,"Furman","Samford",4,4,0,0,5,400945418,2017-03-04
168,2,"17:28",1048,1048,"Kris Acox missed Layup.",30,34,-4,0.537019602482276,"Furman","Samford",4,4,0,0,5,400945418,2017-03-04
169,2,"17:28",1048,1048,"Wyatt Walker Block.",30,34,-4,0.537019602482276,"Furman","Samford",4,4,0,0,5,400945418,2017-03-04
170,2,"17:27",1047,1047,"John Davis III Offensive Rebound.",30,34,-4,0.537019602482276,"Furman","Samford",4,4,0,0,5,400945418,2017-03-04
171,2,"17:24",1044,1044,"John Davis III missed Three Point Jumper.",30,34,-4,0.537019602482276,"Furman","Samford",4,4,0,0,5,400945418,2017-03-04
172,2,"17:24",1044,1044,"Kris Acox Offensive Rebound.",30,34,-4,0.537019602482276,"Furman","Samford",4,4,0,0,5,400945418,2017-03-04
173,2,"17:23",1043,1043,"Kris Acox missed Layup.",30,34,-4,0.537019602482276,"Furman","Samford",4,4,0,0,5,400945418,2017-03-04
174,2,"17:19",1039,1039,"Andrew Brown Offensive Rebound.",30,34,-4,0.519520976581781,"Furman","Samford",4,4,0,0,5,400945418,2017-03-04
175,2,"17:17",1037,1037,"Andrew Brown missed Jumper.",30,34,-4,0.519520976581781,"Furman","Samford",4,4,0,0,5,400945418,2017-03-04
176,2,"17:17",1037,1037,"Alex Thompson Defensive Rebound.",30,34,-4,0.519520976581781,"Furman","Samford",4,4,0,0,5,400945418,2017-03-04
177,2,"17:08",1028,1028,"Alex Thompson missed Three Point Jumper.",30,34,-4,0.520806797996893,"Furman","Samford",4,4,0,0,5,400945418,2017-03-04
178,2,"17:08",1028,1028,"Daniel Fowler Defensive Rebound.",30,34,-4,0.520806797996893,"Furman","Samford",4,4,0,0,5,400945418,2017-03-04
179,2,"17:01",1021,1021,"Devin Sibley missed Three Point Jumper.",30,34,-4,0.520806797996893,"Furman","Samford",4,4,0,0,5,400945418,2017-03-04
180,2,"17:01",1021,1021,"Kris Acox Offensive Rebound.",30,34,-4,0.520806797996893,"Furman","Samford",4,4,0,0,5,400945418,2017-03-04
181,2,"16:51",1011,1011,"Kris Acox made Layup. Assisted by Daniel Fowler.",32,34,-2,0.571054858046124,"Furman","Samford",4,4,0,0,5,400945418,2017-03-04
182,2,"16:34",994,994,"Wyatt Walker missed Jumper.",32,34,-2,0.587427433817538,"Furman","Samford",4,4,0,0,5,400945418,2017-03-04
183,2,"16:34",994,994,"Devin Sibley Defensive Rebound.",32,34,-2,0.587427433817538,"Furman","Samford",4,4,0,0,5,400945418,2017-03-04
184,2,"16:22",982,982,"Kris Acox missed Jumper.",32,34,-2,0.591858804335537,"Furman","Samford",4,4,0,0,5,400945418,2017-03-04
185,2,"16:22",982,982,"Christen Cunningham Defensive Rebound.",32,34,-2,0.591858804335537,"Furman","Samford",4,4,0,0,5,400945418,2017-03-04
186,2,"15:50",950,950,"Christen Cunningham missed Jumper.",32,34,-2,0.590516576491873,"Furman","Samford",4,4,0,0,5,400945418,2017-03-04
187,2,"15:50",950,950,"Christen Cunningham Offensive Rebound.",32,34,-2,0.590516576491873,"Furman","Samford",4,4,0,0,5,400945418,2017-03-04
188,2,"15:47",947,947,"Christen Cunningham missed Layup.",32,34,-2,0.610657777677404,"Furman","Samford",4,4,0,0,5,400945418,2017-03-04
189,2,"15:47",947,947,"Kris Acox Defensive Rebound.",32,34,-2,0.610657777677404,"Furman","Samford",4,4,0,0,5,400945418,2017-03-04
190,2,"15:40",940,940,"Andrew Brown made Three Point Jumper. Assisted by John Davis III.",35,34,1,0.736022230566518,"Furman","Samford",4,4,0,0,5,400945418,2017-03-04
191,2,"15:36",936,936,"Samford  Timeout",35,34,1,0.714987390134033,"Furman","Samford",4,3,0,1,5,400945418,2017-03-04
