"play_id","half","time_remaining_half","secs_remaining","secs_remaining_absolute","description","home_score","away_score","score_diff","win_prob","home","away","home_time_out_remaining","away_time_out_remaining","home_timeout_ind","away_timeout_ind","home_favored_by","game_id","date"
181,1,"0:07",1207,1207,"Michael Mayhew made Three Point Jumper. Assisted by Deontae North.",45,49,-4,0.769655462250374,"Duke","Portland State",3,4,0,0,24.5,400986088,2017-11-23
182,1,"0:04",1204,1204,"Duke  Timeout",45,49,-4,0.769655462250374,"Duke","Portland State",3,3,0,1,24.5,400986088,2017-11-23
183,1,"0:01",1201,1201,"Trevon Duval missed Layup.",45,49,-4,0.769655462250374,"Duke","Portland State",3,3,0,1,24.5,400986088,2017-11-23
184,1,"0:01",1201,1201,"Duke Deadball Team Rebound.",45,49,-4,0.769655462250374,"Duke","Portland State",3,3,0,1,24.5,400986088,2017-11-23
185,1,"0:00",1200,1200,"End of 1st half",45,49,-4,0.769655462250374,"Duke","Portland State",3,3,0,1,24.5,400986088,2017-11-23
186,2,"20:00",1200,1200,"PLAY",45,49,-4,0.769655462250374,"Duke","Portland State",4,4,0,0,24.5,400986088,2017-11-23
187,2,"20:00",1200,1200,"Jump Ball won by Portland State",45,49,-4,0.769655462250374,"Duke","Portland State",4,4,0,0,24.5,400986088,2017-11-23
188,2,"19:53",1193,1193,"Traylin Farris made Layup. Assisted by Deante Strickland.",45,51,-6,0.746133618198047,"Duke","Portland State",4,4,0,0,24.5,400986088,2017-11-23
189,2,"19:33",1173,1173,"Foul on Trevon Duval.",45,51,-6,0.680184426711768,"Duke","Portland State",4,4,0,0,24.5,400986088,2017-11-23
190,2,"19:33",1173,1173,"Trevon Duval Turnover.",45,51,-6,0.680184426711768,"Duke","Portland State",4,4,0,0,24.5,400986088,2017-11-23
191,2,"19:10",1150,1150,"Ryan Edwards Turnover.",45,51,-6,0.685612139699358,"Duke","Portland State",4,4,0,0,24.5,400986088,2017-11-23
192,2,"19:10",1150,1150,"Foul on Ryan Edwards.",45,51,-6,0.685612139699358,"Duke","Portland State",4,4,0,0,24.5,400986088,2017-11-23
193,2,"18:48",1128,1128,"Marques Bolden missed Layup.",45,51,-6,0.658722954123939,"Duke","Portland State",4,4,0,0,24.5,400986088,2017-11-23
194,2,"18:48",1128,1128,"Marques Bolden Offensive Rebound.",45,51,-6,0.658722954123939,"Duke","Portland State",4,4,0,0,24.5,400986088,2017-11-23
195,2,"18:39",1119,1119,"Marques Bolden missed Layup.",45,51,-6,0.661365089628443,"Duke","Portland State",4,4,0,0,24.5,400986088,2017-11-23
196,2,"18:39",1119,1119,"Michael Mayhew Defensive Rebound.",45,51,-6,0.661365089628443,"Duke","Portland State",4,4,0,0,24.5,400986088,2017-11-23
197,2,"18:39",1119,1119,"Deante Strickland Turnover.",45,51,-6,0.661365089628443,"Duke","Portland State",4,4,0,0,24.5,400986088,2017-11-23
198,2,"18:08",1088,1088,"Marvin Bagley III missed Layup.",45,51,-6,0.68745574076713,"Duke","Portland State",4,4,0,0,24.5,400986088,2017-11-23
199,2,"18:08",1088,1088,"Marvin Bagley III Offensive Rebound.",45,51,-6,0.68745574076713,"Duke","Portland State",4,4,0,0,24.5,400986088,2017-11-23
200,2,"18:08",1088,1088,"Marvin Bagley III made Two Point Tip Shot.",47,51,-4,0.758110563896183,"Duke","Portland State",4,4,0,0,24.5,400986088,2017-11-23
201,2,"17:38",1058,1058,"Ryan Edwards missed Jumper.",47,51,-4,0.739284072939813,"Duke","Portland State",4,4,0,0,24.5,400986088,2017-11-23
202,2,"17:38",1058,1058,"Marques Bolden Block.",47,51,-4,0.739284072939813,"Duke","Portland State",4,4,0,0,24.5,400986088,2017-11-23
203,2,"17:38",1058,1058,"Portland State Offensive Rebound.",47,51,-4,0.739284072939813,"Duke","Portland State",4,4,0,0,24.5,400986088,2017-11-23
204,2,"17:16",1036,1036,"Michael Mayhew missed Three Point Jumper.",47,51,-4,0.74224197193897,"Duke","Portland State",4,4,0,0,24.5,400986088,2017-11-23
205,2,"17:16",1036,1036,"Deante Strickland Offensive Rebound.",47,51,-4,0.74224197193897,"Duke","Portland State",4,4,0,0,24.5,400986088,2017-11-23
206,2,"17:10",1030,1030,"Deontae North made Layup. Assisted by Michael Mayhew.",47,53,-6,0.67141134165256,"Duke","Portland State",4,4,0,0,24.5,400986088,2017-11-23
207,2,"17:01",1021,1021,"Grayson Allen missed Three Point Jumper.",47,53,-6,0.660665855207844,"Duke","Portland State",4,4,0,0,24.5,400986088,2017-11-23
208,2,"17:01",1021,1021,"Marvin Bagley III Offensive Rebound.",47,53,-6,0.660665855207844,"Duke","Portland State",4,4,0,0,24.5,400986088,2017-11-23
209,2,"17:01",1021,1021,"Marvin Bagley III missed Two Point Tip Shot.",47,53,-6,0.660665855207844,"Duke","Portland State",4,4,0,0,24.5,400986088,2017-11-23
210,2,"17:01",1021,1021,"Marvin Bagley III Offensive Rebound.",47,53,-6,0.660665855207844,"Duke","Portland State",4,4,0,0,24.5,400986088,2017-11-23
211,2,"17:01",1021,1021,"Marvin Bagley III made Two Point Tip Shot.",49,53,-4,0.735935337344444,"Duke","Portland State",4,4,0,0,24.5,400986088,2017-11-23
212,2,"17:01",1021,1021,"Foul on Traylin Farris.",49,53,-4,0.735935337344444,"Duke","Portland State",4,4,0,0,24.5,400986088,2017-11-23
213,2,"17:01",1021,1021,"Marvin Bagley III missed Free Throw.",49,53,-4,0.735935337344444,"Duke","Portland State",4,4,0,0,24.5,400986088,2017-11-23
214,2,"17:01",1021,1021,"Traylin Farris Defensive Rebound.",49,53,-4,0.735935337344444,"Duke","Portland State",4,4,0,0,24.5,400986088,2017-11-23
215,2,"16:45",1005,1005,"Michael Mayhew missed Three Point Jumper.",49,53,-4,0.702834288963424,"Duke","Portland State",4,4,0,0,24.5,400986088,2017-11-23
216,2,"16:45",1005,1005,"Bryce Canda Offensive Rebound.",49,53,-4,0.702834288963424,"Duke","Portland State",4,4,0,0,24.5,400986088,2017-11-23
217,2,"16:45",1005,1005,"Michael Mayhew missed Jumper.",49,53,-4,0.702834288963424,"Duke","Portland State",4,4,0,0,24.5,400986088,2017-11-23
218,2,"16:45",1005,1005,"Deontae North Offensive Rebound.",49,53,-4,0.702834288963424,"Duke","Portland State",4,4,0,0,24.5,400986088,2017-11-23
219,2,"16:33",993,993,"Deontae North missed Jumper.",49,53,-4,0.71984853830725,"Duke","Portland State",4,4,0,0,24.5,400986088,2017-11-23
220,2,"16:33",993,993,"Wendell Carter Jr Block.",49,53,-4,0.71984853830725,"Duke","Portland State",4,4,0,0,24.5,400986088,2017-11-23
221,2,"16:33",993,993,"Wendell Carter Jr Defensive Rebound.",49,53,-4,0.71984853830725,"Duke","Portland State",4,4,0,0,24.5,400986088,2017-11-23
222,2,"16:20",980,980,"Gary Trent Jr made Three Point Jumper. Assisted by Trevon Duval.",52,53,-1,0.805258082397414,"Duke","Portland State",4,4,0,0,24.5,400986088,2017-11-23
223,2,"16:04",964,964,"Deante Strickland missed Three Point Jumper.",52,53,-1,0.797935582573645,"Duke","Portland State",4,4,0,0,24.5,400986088,2017-11-23
224,2,"16:04",964,964,"Duke Defensive Rebound.",52,53,-1,0.797935582573645,"Duke","Portland State",4,4,0,0,24.5,400986088,2017-11-23
225,2,"16:01",961,961,"Foul on Michael Mayhew.",52,53,-1,0.797935582573645,"Duke","Portland State",4,4,0,0,24.5,400986088,2017-11-23
226,2,"15:40",940,940,"Wendell Carter Jr made Layup.",54,53,1,0.877220593341032,"Duke","Portland State",4,4,0,0,24.5,400986088,2017-11-23
227,2,"15:17",917,917,"Deontae North made Jumper. Assisted by Holland Woods.",54,55,-1,0.826954938989978,"Duke","Portland State",4,4,0,0,24.5,400986088,2017-11-23
228,2,"15:14",914,914,"Portland State  Timeout",54,55,-1,0.826954938989978,"Duke","Portland State",3,4,1,0,24.5,400986088,2017-11-23
229,2,"14:46",886,886,"Gary Trent Jr missed Three Point Jumper.",54,55,-1,0.801177269801975,"Duke","Portland State",3,4,1,0,24.5,400986088,2017-11-23
230,2,"14:46",886,886,"Holland Woods Defensive Rebound.",54,55,-1,0.801177269801975,"Duke","Portland State",3,4,1,0,24.5,400986088,2017-11-23
231,2,"14:37",877,877,"Bryce Canda made Three Point Jumper. Assisted by Deontae North.",54,58,-4,0.705342449516223,"Duke","Portland State",3,4,1,0,24.5,400986088,2017-11-23
232,2,"14:36",876,876,"Trevon Duval made Layup.",56,58,-2,0.778701441928012,"Duke","Portland State",3,4,1,0,24.5,400986088,2017-11-23
233,2,"14:36",876,876,"Foul on Brandon Hollins.",56,58,-2,0.778701441928012,"Duke","Portland State",3,4,1,0,24.5,400986088,2017-11-23
234,2,"14:36",876,876,"Official TV Timeout",56,58,-2,0.778701441928012,"Duke","Portland State",3,4,1,0,24.5,400986088,2017-11-23
235,2,"14:36",876,876,"Trevon Duval made Free Throw.",57,58,-1,0.810111937404733,"Duke","Portland State",3,4,1,0,24.5,400986088,2017-11-23
236,2,"14:33",873,873,"Holland Woods Turnover.",57,58,-1,0.810111937404733,"Duke","Portland State",3,4,1,0,24.5,400986088,2017-11-23
237,2,"14:33",873,873,"Trevon Duval Steal.",57,58,-1,0.810111937404733,"Duke","Portland State",3,4,1,0,24.5,400986088,2017-11-23
238,2,"14:31",871,871,"Foul on Holland Woods.",57,58,-1,0.810111937404733,"Duke","Portland State",3,4,1,0,24.5,400986088,2017-11-23
239,2,"14:31",871,871,"Trevon Duval made Free Throw.",58,58,0,0.837991665500769,"Duke","Portland State",3,4,1,0,24.5,400986088,2017-11-23
240,2,"14:31",871,871,"Trevon Duval made Free Throw.",59,58,1,0.862472939015332,"Duke","Portland State",3,4,1,0,24.5,400986088,2017-11-23
241,2,"14:15",855,855,"Traylin Farris missed Jumper.",59,58,1,0.862139614897166,"Duke","Portland State",3,4,1,0,24.5,400986088,2017-11-23
242,2,"14:15",855,855,"Traylin Farris Offensive Rebound.",59,58,1,0.862139614897166,"Duke","Portland State",3,4,1,0,24.5,400986088,2017-11-23
243,2,"14:15",855,855,"Traylin Farris made Two Point Tip Shot.",59,60,-1,0.805797840472288,"Duke","Portland State",3,4,1,0,24.5,400986088,2017-11-23
244,2,"14:03",843,843,"Trevon Duval missed Dunk.",59,60,-1,0.79061271136789,"Duke","Portland State",3,4,0,0,24.5,400986088,2017-11-23
245,2,"14:03",843,843,"Wendell Carter Jr Offensive Rebound.",59,60,-1,0.79061271136789,"Duke","Portland State",3,4,0,0,24.5,400986088,2017-11-23
246,2,"13:53",833,833,"Wendell Carter Jr made Layup. Assisted by Gary Trent Jr.",61,60,1,0.876862236824867,"Duke","Portland State",3,4,0,0,24.5,400986088,2017-11-23
247,2,"13:45",825,825,"Michael Mayhew missed Three Point Jumper.",61,60,1,0.862990918099916,"Duke","Portland State",3,4,0,0,24.5,400986088,2017-11-23
248,2,"13:45",825,825,"Marvin Bagley III Defensive Rebound.",61,60,1,0.862990918099916,"Duke","Portland State",3,4,0,0,24.5,400986088,2017-11-23
249,2,"13:42",822,822,"Foul on Deontae North.",61,60,1,0.862990918099916,"Duke","Portland State",3,4,0,0,24.5,400986088,2017-11-23
250,2,"13:25",805,805,"Gary Trent Jr missed Three Point Jumper.",61,60,1,0.869528048249955,"Duke","Portland State",3,4,0,0,24.5,400986088,2017-11-23
251,2,"13:25",805,805,"Marvin Bagley III Offensive Rebound.",61,60,1,0.869528048249955,"Duke","Portland State",3,4,0,0,24.5,400986088,2017-11-23
252,2,"13:25",805,805,"Marvin Bagley III made Two Point Tip Shot.",63,60,3,0.909150224473709,"Duke","Portland State",3,4,0,0,24.5,400986088,2017-11-23
253,2,"13:15",795,795,"Foul on Gary Trent Jr.",63,60,3,0.901851404021982,"Duke","Portland State",3,4,0,0,24.5,400986088,2017-11-23
254,2,"13:01",781,781,"Deontae North missed Jumper.",63,60,3,0.899334822478406,"Duke","Portland State",3,4,0,0,24.5,400986088,2017-11-23
255,2,"13:01",781,781,"Wendell Carter Jr Defensive Rebound.",63,60,3,0.899334822478406,"Duke","Portland State",3,4,0,0,24.5,400986088,2017-11-23
256,2,"12:58",778,778,"Technical Foul on Deontae North.",63,60,3,0.90073594035428,"Duke","Portland State",3,4,0,0,24.5,400986088,2017-11-23
257,2,"12:58",778,778,"Foul on Deontae North.",63,60,3,0.90073594035428,"Duke","Portland State",3,4,0,0,24.5,400986088,2017-11-23
258,2,"12:58",778,778,"Grayson Allen made Free Throw.",64,60,4,0.918007381543028,"Duke","Portland State",3,4,0,0,24.5,400986088,2017-11-23
259,2,"12:58",778,778,"Grayson Allen made Free Throw.",65,60,5,0.932498885149921,"Duke","Portland State",3,4,0,0,24.5,400986088,2017-11-23
260,2,"12:22",742,742,"Trevon Duval missed Layup.",65,60,5,0.933681339087877,"Duke","Portland State",3,4,0,0,24.5,400986088,2017-11-23
261,2,"12:22",742,742,"Wendell Carter Jr Offensive Rebound.",65,60,5,0.933681339087877,"Duke","Portland State",3,4,0,0,24.5,400986088,2017-11-23
262,2,"12:15",735,735,"Wendell Carter Jr made Dunk. Assisted by Grayson Allen.",67,60,7,0.948546787510076,"Duke","Portland State",3,4,0,0,24.5,400986088,2017-11-23
263,2,"12:03",723,723,"Bryce Canda made Layup. Assisted by Jamie Orme.",67,62,5,0.933516279791382,"Duke","Portland State",3,4,0,0,24.5,400986088,2017-11-23
264,2,"11:55",715,715,"Foul on Trevon Duval.",67,62,5,0.932130383173111,"Duke","Portland State",3,4,0,0,24.5,400986088,2017-11-23
265,2,"11:55",715,715,"Trevon Duval Turnover.",67,62,5,0.932130383173111,"Duke","Portland State",3,4,0,0,24.5,400986088,2017-11-23
266,2,"11:55",715,715,"Official TV Timeout",67,62,5,0.932130383173111,"Duke","Portland State",3,4,0,0,24.5,400986088,2017-11-23
267,2,"11:43",703,703,"Michael Mayhew missed Three Point Jumper.",67,62,5,0.923864580364489,"Duke","Portland State",3,4,0,0,24.5,400986088,2017-11-23
268,2,"11:43",703,703,"Marvin Bagley III Defensive Rebound.",67,62,5,0.923864580364489,"Duke","Portland State",3,4,0,0,24.5,400986088,2017-11-23
269,2,"11:28",688,688,"Wendell Carter Jr made Layup. Assisted by Grayson Allen.",69,62,7,0.9549993134644,"Duke","Portland State",3,4,0,0,24.5,400986088,2017-11-23
270,2,"11:28",688,688,"Foul on Jamie Orme.",69,62,7,0.9549993134644,"Duke","Portland State",3,4,0,0,24.5,400986088,2017-11-23
271,2,"11:28",688,688,"Wendell Carter Jr made Free Throw.",70,62,8,0.963686792207875,"Duke","Portland State",3,4,0,0,24.5,400986088,2017-11-23
272,2,"11:13",673,673,"Bryce Canda missed Three Point Jumper.",70,62,8,0.966286777190395,"Duke","Portland State",3,4,0,0,24.5,400986088,2017-11-23
273,2,"11:13",673,673,"Marvin Bagley III Defensive Rebound.",70,62,8,0.966286777190395,"Duke","Portland State",3,4,0,0,24.5,400986088,2017-11-23
274,2,"11:10",670,670,"Foul on Michael Mayhew.",70,62,8,0.966286777190395,"Duke","Portland State",3,4,0,0,24.5,400986088,2017-11-23
275,2,"11:10",670,670,"Marvin Bagley III missed Free Throw.",70,62,8,0.966286777190395,"Duke","Portland State",3,4,0,0,24.5,400986088,2017-11-23
276,2,"11:10",670,670,"Bryce Canda Defensive Rebound.",70,62,8,0.966286777190395,"Duke","Portland State",3,4,0,0,24.5,400986088,2017-11-23
277,2,"11:07",667,667,"Deante Strickland made Three Point Jumper. Assisted by Bryce Canda.",70,65,5,0.929994126165674,"Duke","Portland State",3,4,0,0,24.5,400986088,2017-11-23
278,2,"10:55",655,655,"Wendell Carter Jr missed Layup.",70,65,5,0.934228293100739,"Duke","Portland State",3,4,0,0,24.5,400986088,2017-11-23
279,2,"10:55",655,655,"Bryce Canda Defensive Rebound.",70,65,5,0.934228293100739,"Duke","Portland State",3,4,0,0,24.5,400986088,2017-11-23
280,2,"10:32",632,632,"Bryce Canda made Layup. Assisted by Deante Strickland.",70,67,3,0.879053876276221,"Duke","Portland State",3,4,0,0,24.5,400986088,2017-11-23
281,2,"10:16",616,616,"Trevon Duval missed Three Point Jumper.",70,67,3,0.892878215363414,"Duke","Portland State",3,4,0,0,24.5,400986088,2017-11-23
282,2,"10:16",616,616,"Duke Offensive Rebound.",70,67,3,0.892878215363414,"Duke","Portland State",3,4,0,0,24.5,400986088,2017-11-23
283,2,"10:08",608,608,"Foul on Traylin Farris.",70,67,3,0.901670793719122,"Duke","Portland State",3,4,0,0,24.5,400986088,2017-11-23
284,2,"10:08",608,608,"Marvin Bagley III made Free Throw.",71,67,4,0.921328700363213,"Duke","Portland State",3,4,0,0,24.5,400986088,2017-11-23
285,2,"10:08",608,608,"Marvin Bagley III made Free Throw.",72,67,5,0.937329764553119,"Duke","Portland State",3,4,0,0,24.5,400986088,2017-11-23
286,2,"10:03",603,603,"Holland Woods missed Three Point Jumper.",72,67,5,0.937329764553119,"Duke","Portland State",3,4,0,0,24.5,400986088,2017-11-23
287,2,"10:03",603,603,"Ryan Edwards Offensive Rebound.",72,67,5,0.937329764553119,"Duke","Portland State",3,4,0,0,24.5,400986088,2017-11-23
288,2,"10:03",603,603,"Ryan Edwards missed Two Point Tip Shot.",72,67,5,0.937329764553119,"Duke","Portland State",3,4,0,0,24.5,400986088,2017-11-23
289,2,"10:03",603,603,"Wendell Carter Jr Block.",72,67,5,0.937329764553119,"Duke","Portland State",3,4,0,0,24.5,400986088,2017-11-23
290,2,"10:03",603,603,"Holland Woods Offensive Rebound.",72,67,5,0.937329764553119,"Duke","Portland State",3,4,0,0,24.5,400986088,2017-11-23
291,2,"10:03",603,603,"Ryan Edwards missed Two Point Tip Shot.",72,67,5,0.937329764553119,"Duke","Portland State",3,4,0,0,24.5,400986088,2017-11-23
292,2,"10:03",603,603,"Ryan Edwards Offensive Rebound.",72,67,5,0.937329764553119,"Duke","Portland State",3,4,0,0,24.5,400986088,2017-11-23
293,2,"9:32",572,572,"Deante Strickland missed Three Point Jumper.",72,67,5,0.939892381443035,"Duke","Portland State",3,4,0,0,24.5,400986088,2017-11-23
294,2,"9:32",572,572,"Wendell Carter Jr Defensive Rebound.",72,67,5,0.939892381443035,"Duke","Portland State",3,4,0,0,24.5,400986088,2017-11-23
295,2,"9:24",564,564,"Marvin Bagley III missed Three Point Jumper.",72,67,5,0.945600766138234,"Duke","Portland State",3,4,0,0,24.5,400986088,2017-11-23
296,2,"9:24",564,564,"Marvin Bagley III Offensive Rebound.",72,67,5,0.945600766138234,"Duke","Portland State",3,4,0,0,24.5,400986088,2017-11-23
297,2,"9:11",551,551,"Foul on Ryan Edwards.",72,67,5,0.934975894183268,"Duke","Portland State",3,4,0,0,24.5,400986088,2017-11-23
298,2,"9:11",551,551,"Gary Trent Jr made Free Throw.",73,67,6,0.949120482782533,"Duke","Portland State",3,4,0,0,24.5,400986088,2017-11-23
299,2,"9:11",551,551,"Gary Trent Jr made Free Throw.",74,67,7,0.960318806075297,"Duke","Portland State",3,4,0,0,24.5,400986088,2017-11-23
300,2,"8:42",522,522,"Bryce Canda made Jumper. Assisted by Holland Woods.",74,69,5,0.929470220388188,"Duke","Portland State",3,4,0,0,24.5,400986088,2017-11-23
301,2,"8:38",518,518,"Technical Foul on Deontae North.",74,69,5,0.928897171874682,"Duke","Portland State",3,4,0,0,24.5,400986088,2017-11-23
302,2,"8:38",518,518,"Foul on Deontae North.",74,69,5,0.928897171874682,"Duke","Portland State",3,4,0,0,24.5,400986088,2017-11-23
303,2,"8:38",518,518,"Grayson Allen made Free Throw.",75,69,6,0.944820961356016,"Duke","Portland State",3,4,0,0,24.5,400986088,2017-11-23
304,2,"8:38",518,518,"Grayson Allen missed Free Throw.",75,69,6,0.944820961356016,"Duke","Portland State",3,4,0,0,24.5,400986088,2017-11-23
305,2,"8:18",498,498,"Wendell Carter Jr made Dunk. Assisted by Grayson Allen.",77,69,8,0.97043150168873,"Duke","Portland State",3,4,0,0,24.5,400986088,2017-11-23
306,2,"7:46",466,466,"Deante Strickland missed Three Point Jumper.",77,69,8,0.972455429578457,"Duke","Portland State",3,4,0,0,24.5,400986088,2017-11-23
307,2,"7:46",466,466,"Wendell Carter Jr Defensive Rebound.",77,69,8,0.972455429578457,"Duke","Portland State",3,4,0,0,24.5,400986088,2017-11-23
308,2,"7:35",455,455,"Grayson Allen Turnover.",77,69,8,0.975803660224242,"Duke","Portland State",3,4,0,0,24.5,400986088,2017-11-23
309,2,"7:35",455,455,"Ryan Edwards Steal.",77,69,8,0.975803660224242,"Duke","Portland State",3,4,0,0,24.5,400986088,2017-11-23
310,2,"7:24",444,444,"Portland State  Timeout",77,69,8,0.965199810628,"Duke","Portland State",2,4,1,0,24.5,400986088,2017-11-23
311,2,"7:24",444,444,"Official TV Timeout",77,69,8,0.965199810628,"Duke","Portland State",2,4,1,0,24.5,400986088,2017-11-23
312,2,"7:22",442,442,"Ryan Edwards Turnover.",77,69,8,0.965199810628,"Duke","Portland State",2,4,1,0,24.5,400986088,2017-11-23
313,2,"7:22",442,442,"Trevon Duval Steal.",77,69,8,0.965199810628,"Duke","Portland State",2,4,1,0,24.5,400986088,2017-11-23
314,2,"7:18",438,438,"Trevon Duval made Dunk.",79,69,10,0.988264870794905,"Duke","Portland State",2,4,1,0,24.5,400986088,2017-11-23
315,2,"6:51",411,411,"Michael Mayhew missed Three Point Jumper.",79,69,10,0.98657496293048,"Duke","Portland State",2,4,1,0,24.5,400986088,2017-11-23
316,2,"6:51",411,411,"Grayson Allen Defensive Rebound.",79,69,10,0.98657496293048,"Duke","Portland State",2,4,1,0,24.5,400986088,2017-11-23
317,2,"6:35",395,395,"Foul on Michael Mayhew.",79,69,10,0.987313283666466,"Duke","Portland State",2,4,1,0,24.5,400986088,2017-11-23
318,2,"6:35",395,395,"Trevon Duval made Free Throw.",80,69,11,0.990683170159296,"Duke","Portland State",2,4,1,0,24.5,400986088,2017-11-23
319,2,"6:35",395,395,"Trevon Duval missed Free Throw.",80,69,11,0.990683170159296,"Duke","Portland State",2,4,1,0,24.5,400986088,2017-11-23
320,2,"6:35",395,395,"Portland State Defensive Rebound.",80,69,11,0.990683170159296,"Duke","Portland State",2,4,1,0,24.5,400986088,2017-11-23
321,2,"6:23",383,383,"Foul on Grayson Allen.",80,69,11,0.990129659022381,"Duke","Portland State",2,4,0,0,24.5,400986088,2017-11-23
322,2,"6:16",376,376,"Bryce Canda missed Three Point Jumper.",80,69,11,0.990124712733321,"Duke","Portland State",2,4,0,0,24.5,400986088,2017-11-23
323,2,"6:16",376,376,"Wendell Carter Jr Defensive Rebound.",80,69,11,0.990124712733321,"Duke","Portland State",2,4,0,0,24.5,400986088,2017-11-23
324,2,"6:02",362,362,"Foul on Brandon Hollins.",80,69,11,0.990732466532399,"Duke","Portland State",2,4,0,0,24.5,400986088,2017-11-23
325,2,"6:02",362,362,"Grayson Allen made Free Throw.",81,69,12,0.993272232444572,"Duke","Portland State",2,4,0,0,24.5,400986088,2017-11-23
326,2,"6:02",362,362,"Grayson Allen made Free Throw.",82,69,13,0.995119404736445,"Duke","Portland State",2,4,0,0,24.5,400986088,2017-11-23
327,2,"5:43",343,343,"Holland Woods made Three Point Jumper.",82,72,10,0.987999559459375,"Duke","Portland State",2,4,0,0,24.5,400986088,2017-11-23
328,2,"5:27",327,327,"Foul on Deante Strickland.",82,72,10,0.987861212111023,"Duke","Portland State",2,4,0,0,24.5,400986088,2017-11-23
329,2,"5:27",327,327,"Trevon Duval made Free Throw.",83,72,11,0.991102519179565,"Duke","Portland State",2,4,0,0,24.5,400986088,2017-11-23
330,2,"5:27",327,327,"Trevon Duval made Free Throw.",84,72,12,0.993484039154085,"Duke","Portland State",2,4,0,0,24.5,400986088,2017-11-23
331,2,"5:00",300,300,"Holland Woods Turnover.",84,72,12,0.993906895340655,"Duke","Portland State",2,4,0,0,24.5,400986088,2017-11-23
332,2,"4:51",291,291,"Marvin Bagley III Turnover.",84,72,12,0.995395917026585,"Duke","Portland State",2,4,0,0,24.5,400986088,2017-11-23
333,2,"4:44",284,284,"Deante Strickland missed Jumper.",84,72,12,0.995242556880877,"Duke","Portland State",2,4,0,0,24.5,400986088,2017-11-23
334,2,"4:44",284,284,"Marvin Bagley III Defensive Rebound.",84,72,12,0.995242556880877,"Duke","Portland State",2,4,0,0,24.5,400986088,2017-11-23
335,2,"4:33",273,273,"Wendell Carter Jr made Layup. Assisted by Grayson Allen.",86,72,14,0.998530118683944,"Duke","Portland State",2,4,0,0,24.5,400986088,2017-11-23
336,2,"4:12",252,252,"Bryce Canda missed Three Point Jumper.",86,72,14,0.998985585938656,"Duke","Portland State",2,4,0,0,24.5,400986088,2017-11-23
337,2,"4:12",252,252,"Wendell Carter Jr Defensive Rebound.",86,72,14,0.998985585938656,"Duke","Portland State",2,4,0,0,24.5,400986088,2017-11-23
338,2,"4:03",243,243,"Marvin Bagley III Turnover.",86,72,14,0.998718454431994,"Duke","Portland State",2,4,0,0,24.5,400986088,2017-11-23
339,2,"4:03",243,243,"Bryce Canda Steal.",86,72,14,0.998718454431994,"Duke","Portland State",2,4,0,0,24.5,400986088,2017-11-23
340,2,"4:02",242,242,"Foul on Wendell Carter Jr.",86,72,14,0.998718454431994,"Duke","Portland State",2,4,0,0,24.5,400986088,2017-11-23
341,2,"4:02",242,242,"Bryce Canda missed Free Throw.",86,72,14,0.998718454431994,"Duke","Portland State",2,4,0,0,24.5,400986088,2017-11-23
342,2,"4:02",242,242,"Portland State Deadball Team Rebound.",86,72,14,0.998718454431994,"Duke","Portland State",2,4,0,0,24.5,400986088,2017-11-23
343,2,"4:02",242,242,"Bryce Canda made Free Throw.",86,73,13,0.99808081117368,"Duke","Portland State",2,4,0,0,24.5,400986088,2017-11-23
344,2,"3:44",224,224,"Trevon Duval made Layup. Assisted by Wendell Carter Jr.",88,73,15,0.999496182122414,"Duke","Portland State",2,4,0,0,24.5,400986088,2017-11-23
345,2,"3:36",216,216,"Foul on Grayson Allen.",88,73,15,0.999495936026649,"Duke","Portland State",2,4,0,0,24.5,400986088,2017-11-23
346,2,"3:36",216,216,"Official TV Timeout",88,73,15,0.999495936026649,"Duke","Portland State",2,4,0,0,24.5,400986088,2017-11-23
347,2,"3:32",212,212,"Foul on Marvin Bagley III.",88,73,15,0.999495936026649,"Duke","Portland State",2,4,0,0,24.5,400986088,2017-11-23
348,2,"3:32",212,212,"Deante Strickland missed Free Throw.",88,73,15,0.999495936026649,"Duke","Portland State",2,4,0,0,24.5,400986088,2017-11-23
349,2,"3:32",212,212,"Duke Defensive Rebound.",88,73,15,0.999495936026649,"Duke","Portland State",2,4,0,0,24.5,400986088,2017-11-23
350,2,"3:31",211,211,"Marvin Bagley III Turnover.",88,73,15,0.999495936026649,"Duke","Portland State",2,4,0,1,24.5,400986088,2017-11-23
351,2,"3:31",211,211,"Duke  Timeout",88,73,15,0.999495936026649,"Duke","Portland State",2,3,0,1,24.5,400986088,2017-11-23
352,2,"3:20",200,200,"Bryce Canda missed Jumper.",88,73,15,0.999655109607965,"Duke","Portland State",2,3,0,1,24.5,400986088,2017-11-23
353,2,"3:20",200,200,"Wendell Carter Jr Defensive Rebound.",88,73,15,0.999655109607965,"Duke","Portland State",2,3,0,1,24.5,400986088,2017-11-23
354,2,"3:07",187,187,"Trevon Duval made Layup.",90,73,17,0.999891242157757,"Duke","Portland State",2,3,0,1,24.5,400986088,2017-11-23
355,2,"3:00",180,180,"Holland Woods missed Three Point Jumper.",90,73,17,0.999891242157757,"Duke","Portland State",2,3,0,1,24.5,400986088,2017-11-23
356,2,"3:00",180,180,"Wendell Carter Jr Defensive Rebound.",90,73,17,0.999891242157757,"Duke","Portland State",2,3,0,1,24.5,400986088,2017-11-23
357,2,"2:52",172,172,"Trevon Duval missed Layup.",90,73,17,0.999912123484693,"Duke","Portland State",2,3,0,1,24.5,400986088,2017-11-23
358,2,"2:52",172,172,"Brandon Hollins Defensive Rebound.",90,73,17,0.999912123484693,"Duke","Portland State",2,3,0,1,24.5,400986088,2017-11-23
359,2,"2:38",158,158,"Brandon Hollins made Layup.",90,75,15,0.999871460947469,"Duke","Portland State",2,3,0,1,24.5,400986088,2017-11-23
360,2,"2:19",139,139,"Foul on Traylin Farris.",90,75,15,0.999887600646182,"Duke","Portland State",2,3,0,0,24.5,400986088,2017-11-23
361,2,"2:19",139,139,"Technical Foul on Bryce Canda.",90,75,15,0.999887600646182,"Duke","Portland State",2,3,0,0,24.5,400986088,2017-11-23
