"play_id","half","time_remaining_half","secs_remaining","secs_remaining_absolute","description","home_score","away_score","score_diff","win_prob","home","away","home_time_out_remaining","away_time_out_remaining","home_timeout_ind","away_timeout_ind","home_favored_by","game_id","date"
1,1,"20:00",2400,2400,"PLAY",0,0,0,0.926208718211139,"Texas Tech","UTSA",4,4,0,0,23,400916167,2016-12-07
2,1,"19:44",2384,2384,"Anthony Livingston missed Three Point Jumper.",0,0,0,0.922608885074135,"Texas Tech","UTSA",4,4,0,0,23,400916167,2016-12-07
3,1,"19:44",2384,2384,"Texas Tech Offensive Rebound.",0,0,0,0.922608885074135,"Texas Tech","UTSA",4,4,0,0,23,400916167,2016-12-07
4,1,"19:28",2368,2368,"Justin Gray missed Jumper.",0,0,0,0.910601439125036,"Texas Tech","UTSA",4,4,0,0,23,400916167,2016-12-07
5,1,"19:28",2368,2368,"Nick Allen Defensive Rebound.",0,0,0,0.910601439125036,"Texas Tech","UTSA",4,4,0,0,23,400916167,2016-12-07
6,1,"19:06",2346,2346,"Giovanni De Nicolao missed Jumper.",0,0,0,0.912356611045671,"Texas Tech","UTSA",4,4,0,0,23,400916167,2016-12-07
7,1,"19:06",2346,2346,"Justin Gray Defensive Rebound.",0,0,0,0.912356611045671,"Texas Tech","UTSA",4,4,0,0,23,400916167,2016-12-07
8,1,"18:51",2331,2331,"Keenan Evans made Layup.",2,0,2,0.92940593423968,"Texas Tech","UTSA",4,4,0,0,23,400916167,2016-12-07
9,1,"18:28",2308,2308,"Giovanni De Nicolao Turnover.",2,0,2,0.922935474606873,"Texas Tech","UTSA",4,4,0,0,23,400916167,2016-12-07
10,1,"18:26",2306,2306,"Keenan Evans Steal.",2,0,2,0.922935474606873,"Texas Tech","UTSA",4,4,0,0,23,400916167,2016-12-07
11,1,"18:24",2304,2304,"Justin Gray made Layup. Assisted by Devon Thomas.",4,0,4,0.935953006216474,"Texas Tech","UTSA",4,4,0,0,23,400916167,2016-12-07
12,1,"17:58",2278,2278,"Giovanni De Nicolao missed Jumper.",4,0,4,0.941361817646924,"Texas Tech","UTSA",4,4,0,0,23,400916167,2016-12-07
13,1,"17:58",2278,2278,"Anthony Livingston Defensive Rebound.",4,0,4,0.941361817646924,"Texas Tech","UTSA",4,4,0,0,23,400916167,2016-12-07
14,1,"17:40",2260,2260,"Niem Stevenson made Three Point Jumper. Assisted by Anthony Livingston.",7,0,7,0.96381687883784,"Texas Tech","UTSA",4,4,0,0,23,400916167,2016-12-07
15,1,"17:17",2237,2237,"Giovanni De Nicolao made Layup. Assisted by Byron Frohnen.",7,2,5,0.947634215314674,"Texas Tech","UTSA",4,4,0,0,23,400916167,2016-12-07
16,1,"17:07",2227,2227,"Keenan Evans made Layup.",9,2,7,0.955535448950602,"Texas Tech","UTSA",4,4,0,0,23,400916167,2016-12-07
17,1,"17:07",2227,2227,"Foul on Byron Frohnen.",9,2,7,0.955535448950602,"Texas Tech","UTSA",4,4,0,0,23,400916167,2016-12-07
18,1,"17:07",2227,2227,"Keenan Evans made Free Throw.",10,2,8,0.959684639375386,"Texas Tech","UTSA",4,4,0,0,23,400916167,2016-12-07
19,1,"16:53",2213,2213,"Nick Billingsley Turnover.",10,2,8,0.96521706064227,"Texas Tech","UTSA",4,4,0,0,23,400916167,2016-12-07
20,1,"16:52",2212,2212,"Justin Gray Steal.",10,2,8,0.96521706064227,"Texas Tech","UTSA",4,4,0,0,23,400916167,2016-12-07
21,1,"16:50",2210,2210,"Justin Gray made Layup.",12,2,10,0.973011175778674,"Texas Tech","UTSA",4,4,0,0,23,400916167,2016-12-07
22,1,"16:48",2208,2208,"UT San Antonio  Timeout",12,2,10,0.968821861579298,"Texas Tech","UTSA",4,3,0,1,23,400916167,2016-12-07
23,1,"16:27",2187,2187,"Nick Allen missed Jumper.",12,2,10,0.967380796660356,"Texas Tech","UTSA",4,3,0,1,23,400916167,2016-12-07
24,1,"16:27",2187,2187,"Niem Stevenson Defensive Rebound.",12,2,10,0.967380796660356,"Texas Tech","UTSA",4,3,0,1,23,400916167,2016-12-07
25,1,"16:17",2177,2177,"Thomas Brandsma made Layup. Assisted by Matthew Temple.",14,2,12,0.97291215047941,"Texas Tech","UTSA",4,3,0,1,23,400916167,2016-12-07
26,1,"16:04",2164,2164,"Nick Billingsley Turnover.",14,2,12,0.973216762857357,"Texas Tech","UTSA",4,3,0,1,23,400916167,2016-12-07
27,1,"16:03",2163,2163,"Keenan Evans Steal.",14,2,12,0.973216762857357,"Texas Tech","UTSA",4,3,0,1,23,400916167,2016-12-07
28,1,"15:57",2157,2157,"Thomas Brandsma missed Three Point Jumper.",14,2,12,0.975953170331917,"Texas Tech","UTSA",4,3,0,1,23,400916167,2016-12-07
29,1,"15:57",2157,2157,"UT San Antonio Defensive Rebound.",14,2,12,0.975953170331917,"Texas Tech","UTSA",4,3,0,1,23,400916167,2016-12-07
30,1,"15:54",2154,2154,"Official TV Timeout",14,2,12,0.975953170331917,"Texas Tech","UTSA",4,3,0,1,23,400916167,2016-12-07
31,1,"15:39",2139,2139,"Foul on Lucas O'Brien.",14,2,12,0.976921072807666,"Texas Tech","UTSA",4,3,0,0,23,400916167,2016-12-07
32,1,"15:39",2139,2139,"Lucas O'Brien Turnover.",14,2,12,0.976921072807666,"Texas Tech","UTSA",4,3,0,0,23,400916167,2016-12-07
33,1,"15:18",2118,2118,"Foul on Shadell Millinghaus.",14,2,12,0.9777553665608,"Texas Tech","UTSA",4,3,0,0,23,400916167,2016-12-07
34,1,"15:18",2118,2118,"Shadell Millinghaus Turnover.",14,2,12,0.9777553665608,"Texas Tech","UTSA",4,3,0,0,23,400916167,2016-12-07
35,1,"15:04",2104,2104,"Byron Frohnen made Jumper.",14,4,10,0.966353879385868,"Texas Tech","UTSA",4,3,0,0,23,400916167,2016-12-07
36,1,"14:47",2087,2087,"Keenan Evans made Layup.",16,4,12,0.971825868459016,"Texas Tech","UTSA",4,3,0,0,23,400916167,2016-12-07
37,1,"14:35",2075,2075,"Byron Frohnen missed Layup.",16,4,12,0.972966191526286,"Texas Tech","UTSA",4,3,0,0,23,400916167,2016-12-07
38,1,"14:35",2075,2075,"Justin Gray Block.",16,4,12,0.972966191526286,"Texas Tech","UTSA",4,3,0,0,23,400916167,2016-12-07
39,1,"14:33",2073,2073,"Nick Allen Offensive Rebound.",16,4,12,0.972966191526286,"Texas Tech","UTSA",4,3,0,0,23,400916167,2016-12-07
40,1,"14:29",2069,2069,"Nick Allen Turnover.",16,4,12,0.974930021566811,"Texas Tech","UTSA",4,3,0,0,23,400916167,2016-12-07
41,1,"14:28",2068,2068,"Niem Stevenson Steal.",16,4,12,0.974930021566811,"Texas Tech","UTSA",4,3,0,0,23,400916167,2016-12-07
42,1,"14:14",2054,2054,"Anthony Livingston made Layup.",18,4,14,0.981870578216079,"Texas Tech","UTSA",4,3,0,0,23,400916167,2016-12-07
43,1,"13:50",2030,2030,"Foul on Justin Gray.",18,4,14,0.980780393354805,"Texas Tech","UTSA",4,3,0,0,23,400916167,2016-12-07
44,1,"13:39",2019,2019,"Lucas O'Brien missed Three Point Jumper.",18,4,14,0.979528511382914,"Texas Tech","UTSA",4,3,0,0,23,400916167,2016-12-07
45,1,"13:39",2019,2019,"Matthew Temple Defensive Rebound.",18,4,14,0.979528511382914,"Texas Tech","UTSA",4,3,0,0,23,400916167,2016-12-07
46,1,"13:20",2000,2000,"Matthew Temple missed Jumper.",18,4,14,0.976909013684507,"Texas Tech","UTSA",4,3,0,0,23,400916167,2016-12-07
47,1,"13:20",2000,2000,"Texas Tech Deadball Team Rebound.",18,4,14,0.976909013684507,"Texas Tech","UTSA",4,3,0,0,23,400916167,2016-12-07
48,1,"13:19",1999,1999,"Foul on George Willborn III.",18,4,14,0.983124818276213,"Texas Tech","UTSA",4,3,0,0,23,400916167,2016-12-07
49,1,"13:17",1997,1997,"Giovanni McLean missed Three Point Jumper.",18,4,14,0.983124818276213,"Texas Tech","UTSA",4,3,0,0,23,400916167,2016-12-07
50,1,"13:17",1997,1997,"Matthew Temple Offensive Rebound.",18,4,14,0.983124818276213,"Texas Tech","UTSA",4,3,0,0,23,400916167,2016-12-07
51,1,"13:15",1995,1995,"Foul on Jeff Beverly.",18,4,14,0.983124818276213,"Texas Tech","UTSA",4,3,0,0,23,400916167,2016-12-07
52,1,"12:55",1975,1975,"Matthew Temple made Three Point Jumper. Assisted by Giovanni McLean.",21,4,17,0.988607457192793,"Texas Tech","UTSA",4,3,0,0,23,400916167,2016-12-07
53,1,"12:38",1958,1958,"Jeff Beverly missed Jumper.",21,4,17,0.986607095884246,"Texas Tech","UTSA",4,3,0,0,23,400916167,2016-12-07
54,1,"12:38",1958,1958,"Giovanni McLean Defensive Rebound.",21,4,17,0.986607095884246,"Texas Tech","UTSA",4,3,0,0,23,400916167,2016-12-07
55,1,"12:29",1949,1949,"Giovanni McLean missed Three Point Jumper.",21,4,17,0.987071823857104,"Texas Tech","UTSA",4,3,0,0,23,400916167,2016-12-07
56,1,"12:29",1949,1949,"Nick Billingsley Defensive Rebound.",21,4,17,0.987071823857104,"Texas Tech","UTSA",4,3,0,0,23,400916167,2016-12-07
57,1,"12:05",1925,1925,"Nick Billingsley missed Three Point Jumper.",21,4,17,0.988007400438431,"Texas Tech","UTSA",4,3,0,0,23,400916167,2016-12-07
58,1,"12:05",1925,1925,"Giovanni McLean Defensive Rebound.",21,4,17,0.988007400438431,"Texas Tech","UTSA",4,3,0,0,23,400916167,2016-12-07
59,1,"12:00",1920,1920,"Giovanni McLean Turnover.",21,4,17,0.988007400438431,"Texas Tech","UTSA",4,3,0,0,23,400916167,2016-12-07
60,1,"11:59",1919,1919,"Giovanni De Nicolao Steal.",21,4,17,0.988317799094486,"Texas Tech","UTSA",4,3,0,0,23,400916167,2016-12-07
61,1,"11:57",1917,1917,"Foul on Giovanni McLean.",21,4,17,0.988317799094486,"Texas Tech","UTSA",4,3,0,0,23,400916167,2016-12-07
62,1,"11:57",1917,1917,"Official TV Timeout",21,4,17,0.988317799094486,"Texas Tech","UTSA",4,3,0,0,23,400916167,2016-12-07
63,1,"11:57",1917,1917,"Giovanni De Nicolao made Free Throw.",21,5,16,0.986731376012778,"Texas Tech","UTSA",4,3,0,0,23,400916167,2016-12-07
64,1,"11:57",1917,1917,"Giovanni De Nicolao made Free Throw.",21,6,15,0.984932803713785,"Texas Tech","UTSA",4,3,0,0,23,400916167,2016-12-07
65,1,"11:28",1888,1888,"Devon Thomas missed Layup.",21,6,15,0.983070317927945,"Texas Tech","UTSA",4,3,0,0,23,400916167,2016-12-07
66,1,"11:28",1888,1888,"Devon Thomas Offensive Rebound.",21,6,15,0.983070317927945,"Texas Tech","UTSA",4,3,0,0,23,400916167,2016-12-07
67,1,"11:15",1875,1875,"Keenan Evans made Layup.",23,6,17,0.986140197374347,"Texas Tech","UTSA",4,3,0,0,23,400916167,2016-12-07
68,1,"10:52",1852,1852,"Jeff Beverly made Three Point Jumper. Assisted by Giovanni De Nicolao.",23,9,14,0.980905952090655,"Texas Tech","UTSA",4,3,0,0,23,400916167,2016-12-07
69,1,"10:27",1827,1827,"Matthew Temple made Three Point Jumper. Assisted by Keenan Evans.",26,9,17,0.986791925758652,"Texas Tech","UTSA",4,3,0,0,23,400916167,2016-12-07
70,1,"10:02",1802,1802,"Giovanni De Nicolao missed Three Point Jumper.",26,9,17,0.986984452724552,"Texas Tech","UTSA",4,3,0,0,23,400916167,2016-12-07
71,1,"10:02",1802,1802,"Devon Thomas Defensive Rebound.",26,9,17,0.986984452724552,"Texas Tech","UTSA",4,3,0,0,23,400916167,2016-12-07
72,1,"9:47",1787,1787,"Justin Gray missed Jumper.",26,9,17,0.98689973334522,"Texas Tech","UTSA",4,3,0,0,23,400916167,2016-12-07
73,1,"9:47",1787,1787,"Austin Karrer Defensive Rebound.",26,9,17,0.98689973334522,"Texas Tech","UTSA",4,3,0,0,23,400916167,2016-12-07
74,1,"9:22",1762,1762,"Jeff Beverly missed Three Point Jumper.",26,9,17,0.988194450766797,"Texas Tech","UTSA",4,3,0,0,23,400916167,2016-12-07
75,1,"9:22",1762,1762,"Justin Gray Defensive Rebound.",26,9,17,0.988194450766797,"Texas Tech","UTSA",4,3,0,0,23,400916167,2016-12-07
76,1,"9:05",1745,1745,"Foul on Nick Allen.",26,9,17,0.985172925820643,"Texas Tech","UTSA",4,3,0,0,23,400916167,2016-12-07
77,1,"8:50",1730,1730,"Matthew Temple missed Jumper.",26,9,17,0.988292606958458,"Texas Tech","UTSA",4,3,0,0,23,400916167,2016-12-07
78,1,"8:50",1730,1730,"Nick Billingsley Defensive Rebound.",26,9,17,0.988292606958458,"Texas Tech","UTSA",4,3,0,0,23,400916167,2016-12-07
79,1,"8:43",1723,1723,"Jeff Beverly Turnover.",26,9,17,0.986131631812543,"Texas Tech","UTSA",4,3,0,0,23,400916167,2016-12-07
80,1,"8:32",1712,1712,"Shadell Millinghaus missed Three Point Jumper.",26,9,17,0.988535993218484,"Texas Tech","UTSA",4,3,0,0,23,400916167,2016-12-07
81,1,"8:32",1712,1712,"Byron Frohnen Defensive Rebound.",26,9,17,0.988535993218484,"Texas Tech","UTSA",4,3,0,0,23,400916167,2016-12-07
82,1,"8:25",1705,1705,"Foul on Justin Gray.",26,9,17,0.985599253827486,"Texas Tech","UTSA",4,3,0,0,23,400916167,2016-12-07
83,1,"8:21",1701,1701,"George Willborn III missed Jumper.",26,9,17,0.985599253827486,"Texas Tech","UTSA",4,3,0,0,23,400916167,2016-12-07
84,1,"8:21",1701,1701,"George Willborn III Offensive Rebound.",26,9,17,0.985599253827486,"Texas Tech","UTSA",4,3,0,0,23,400916167,2016-12-07
85,1,"8:18",1698,1698,"George Willborn III made Layup.",26,11,15,0.984987030847113,"Texas Tech","UTSA",4,3,0,0,23,400916167,2016-12-07
86,1,"8:01",1681,1681,"Niem Stevenson made Layup. Assisted by Anthony Livingston.",28,11,17,0.990464557775746,"Texas Tech","UTSA",4,3,0,0,23,400916167,2016-12-07
87,1,"7:45",1665,1665,"Gino Littles missed Three Point Jumper.",28,11,17,0.986287908725809,"Texas Tech","UTSA",4,3,0,0,23,400916167,2016-12-07
88,1,"7:45",1665,1665,"Thomas Brandsma Defensive Rebound.",28,11,17,0.986287908725809,"Texas Tech","UTSA",4,3,0,0,23,400916167,2016-12-07
89,1,"7:36",1656,1656,"Keenan Evans missed Jumper.",28,11,17,0.986308682856292,"Texas Tech","UTSA",4,3,0,0,23,400916167,2016-12-07
90,1,"7:36",1656,1656,"Nick Billingsley Defensive Rebound.",28,11,17,0.986308682856292,"Texas Tech","UTSA",4,3,0,0,23,400916167,2016-12-07
91,1,"7:18",1638,1638,"Nick Billingsley missed Three Point Jumper.",28,11,17,0.986508218300053,"Texas Tech","UTSA",4,3,0,0,23,400916167,2016-12-07
92,1,"7:18",1638,1638,"Jeff Beverly Offensive Rebound.",28,11,17,0.986508218300053,"Texas Tech","UTSA",4,3,0,0,23,400916167,2016-12-07
93,1,"7:16",1636,1636,"Foul on Keenan Evans.",28,11,17,0.986508218300053,"Texas Tech","UTSA",4,3,0,0,23,400916167,2016-12-07
94,1,"7:16",1636,1636,"Official TV Timeout",28,11,17,0.986508218300053,"Texas Tech","UTSA",4,3,0,0,23,400916167,2016-12-07
95,1,"7:12",1632,1632,"Byron Frohnen made Jumper.",28,13,15,0.98251782209521,"Texas Tech","UTSA",4,3,0,0,23,400916167,2016-12-07
96,1,"6:56",1616,1616,"Thomas Brandsma missed Layup.",28,13,15,0.982656773648213,"Texas Tech","UTSA",4,3,0,0,23,400916167,2016-12-07
97,1,"6:56",1616,1616,"Gino Littles Block.",28,13,15,0.982656773648213,"Texas Tech","UTSA",4,3,0,0,23,400916167,2016-12-07
98,1,"6:53",1613,1613,"Thomas Brandsma Offensive Rebound.",28,13,15,0.982656773648213,"Texas Tech","UTSA",4,3,0,0,23,400916167,2016-12-07
99,1,"6:53",1613,1613,"Foul on Gino Littles.",28,13,15,0.982656773648213,"Texas Tech","UTSA",4,3,0,0,23,400916167,2016-12-07
100,1,"6:45",1605,1605,"Thomas Brandsma missed Layup.",28,13,15,0.982949632416521,"Texas Tech","UTSA",4,3,0,0,23,400916167,2016-12-07
101,1,"6:45",1605,1605,"Giovanni De Nicolao Defensive Rebound.",28,13,15,0.982949632416521,"Texas Tech","UTSA",4,3,0,0,23,400916167,2016-12-07
102,1,"6:28",1588,1588,"George Willborn III missed Jumper.",28,13,15,0.982997041622268,"Texas Tech","UTSA",4,3,0,0,23,400916167,2016-12-07
103,1,"6:28",1588,1588,"UT San Antonio Deadball Team Rebound.",28,13,15,0.982997041622268,"Texas Tech","UTSA",4,3,0,0,23,400916167,2016-12-07
104,1,"6:26",1586,1586,"Foul on Giovanni McLean.",28,13,15,0.982997041622268,"Texas Tech","UTSA",4,3,0,0,23,400916167,2016-12-07
105,1,"6:20",1580,1580,"Jeff Beverly made Layup.",28,15,13,0.977818772520098,"Texas Tech","UTSA",4,3,0,0,23,400916167,2016-12-07
106,1,"5:49",1549,1549,"Giovanni McLean missed Three Point Jumper.",28,15,13,0.97950351322949,"Texas Tech","UTSA",4,3,0,0,23,400916167,2016-12-07
107,1,"5:49",1549,1549,"Byron Frohnen Defensive Rebound.",28,15,13,0.97950351322949,"Texas Tech","UTSA",4,3,0,0,23,400916167,2016-12-07
108,1,"5:38",1538,1538,"George Willborn III Turnover.",28,15,13,0.979441747949701,"Texas Tech","UTSA",4,3,0,0,23,400916167,2016-12-07
109,1,"5:37",1537,1537,"Anthony Livingston Steal.",28,15,13,0.979441747949701,"Texas Tech","UTSA",4,3,0,0,23,400916167,2016-12-07
110,1,"5:34",1534,1534,"Devon Thomas missed Layup.",28,15,13,0.979441747949701,"Texas Tech","UTSA",4,3,0,0,23,400916167,2016-12-07
111,1,"5:34",1534,1534,"Devon Thomas Offensive Rebound.",28,15,13,0.979441747949701,"Texas Tech","UTSA",4,3,0,0,23,400916167,2016-12-07
112,1,"5:24",1524,1524,"Matthew Temple made Jumper.",30,15,15,0.983697467798747,"Texas Tech","UTSA",4,3,0,0,23,400916167,2016-12-07
113,1,"5:04",1504,1504,"Lucas O'Brien made Layup. Assisted by Jeff Beverly.",30,17,13,0.978966768731622,"Texas Tech","UTSA",4,3,0,0,23,400916167,2016-12-07
114,1,"4:44",1484,1484,"Niem Stevenson made Three Point Jumper. Assisted by Devon Thomas.",33,17,16,0.987362221912465,"Texas Tech","UTSA",4,3,0,0,23,400916167,2016-12-07
115,1,"4:19",1459,1459,"Lucas O'Brien missed Jumper.",33,17,16,0.986705166921459,"Texas Tech","UTSA",4,3,0,0,23,400916167,2016-12-07
116,1,"4:19",1459,1459,"Niem Stevenson Defensive Rebound.",33,17,16,0.986705166921459,"Texas Tech","UTSA",4,3,0,0,23,400916167,2016-12-07
117,1,"4:11",1451,1451,"Devon Thomas made Layup. Assisted by Niem Stevenson.",35,17,18,0.99006657079383,"Texas Tech","UTSA",4,3,0,0,23,400916167,2016-12-07
118,1,"3:54",1434,1434,"Giovanni De Nicolao made Layup.",35,19,16,0.986355236870059,"Texas Tech","UTSA",4,3,0,0,23,400916167,2016-12-07
119,1,"3:45",1425,1425,"Texas Tech  Timeout",35,19,16,0.984595147904543,"Texas Tech","UTSA",4,2,0,1,23,400916167,2016-12-07
120,1,"3:29",1409,1409,"Matthew Temple Turnover.",35,19,16,0.989027718723006,"Texas Tech","UTSA",4,2,0,1,23,400916167,2016-12-07
121,1,"3:20",1400,1400,"Foul on Thomas Brandsma.",35,19,16,0.989027718723006,"Texas Tech","UTSA",4,2,0,1,23,400916167,2016-12-07
122,1,"3:20",1400,1400,"Lucas O'Brien made Free Throw.",35,20,15,0.987211691818574,"Texas Tech","UTSA",4,2,0,1,23,400916167,2016-12-07
123,1,"3:20",1400,1400,"Lucas O'Brien made Free Throw.",35,21,14,0.985099621847969,"Texas Tech","UTSA",4,2,0,1,23,400916167,2016-12-07
124,1,"2:53",1373,1373,"Thomas Brandsma Turnover.",35,21,14,0.980495376475142,"Texas Tech","UTSA",4,2,0,1,23,400916167,2016-12-07
125,1,"2:34",1354,1354,"Giovanni De Nicolao missed Three Point Jumper.",35,21,14,0.983851264878873,"Texas Tech","UTSA",4,2,0,0,23,400916167,2016-12-07
126,1,"2:34",1354,1354,"Anthony Livingston Defensive Rebound.",35,21,14,0.983851264878873,"Texas Tech","UTSA",4,2,0,0,23,400916167,2016-12-07
127,1,"2:07",1327,1327,"Keenan Evans missed Three Point Jumper.",35,21,14,0.983570350322611,"Texas Tech","UTSA",4,2,0,0,23,400916167,2016-12-07
128,1,"2:07",1327,1327,"Lucas O'Brien Defensive Rebound.",35,21,14,0.983570350322611,"Texas Tech","UTSA",4,2,0,0,23,400916167,2016-12-07
129,1,"1:45",1305,1305,"Giovanni De Nicolao Turnover.",35,21,14,0.978889004062496,"Texas Tech","UTSA",4,2,0,0,23,400916167,2016-12-07
130,1,"1:31",1291,1291,"Anthony Livingston made Three Point Jumper. Assisted by Devon Thomas.",38,21,17,0.990575761310407,"Texas Tech","UTSA",4,2,0,0,23,400916167,2016-12-07
131,1,"0:59",1259,1259,"Lucas O'Brien missed Three Point Jumper.",38,21,17,0.986807896199249,"Texas Tech","UTSA",4,2,0,0,23,400916167,2016-12-07
132,1,"0:59",1259,1259,"UT San Antonio Deadball Team Rebound.",38,21,17,0.986807896199249,"Texas Tech","UTSA",4,2,0,0,23,400916167,2016-12-07
133,1,"0:56",1256,1256,"Foul on Nick Allen.",38,21,17,0.986807896199249,"Texas Tech","UTSA",4,2,0,0,23,400916167,2016-12-07
134,1,"0:56",1256,1256,"Niem Stevenson made Free Throw.",39,21,18,0.988641625878354,"Texas Tech","UTSA",4,2,0,0,23,400916167,2016-12-07
135,1,"0:56",1256,1256,"Niem Stevenson made Free Throw.",40,21,19,0.990222988743515,"Texas Tech","UTSA",4,2,0,0,23,400916167,2016-12-07
136,1,"0:41",1241,1241,"Byron Frohnen missed Three Point Jumper.",40,21,19,0.992068358278724,"Texas Tech","UTSA",4,2,0,0,23,400916167,2016-12-07
137,1,"0:41",1241,1241,"Devon Thomas Defensive Rebound.",40,21,19,0.992068358278724,"Texas Tech","UTSA",4,2,0,0,23,400916167,2016-12-07
138,1,"0:36",1236,1236,"Shadell Millinghaus made Layup. Assisted by Devon Thomas.",42,21,21,0.994140900445076,"Texas Tech","UTSA",4,2,0,0,23,400916167,2016-12-07
139,1,"0:04",1204,1204,"Bola Alade missed Jumper.",42,21,21,0.994368429055438,"Texas Tech","UTSA",4,2,0,0,23,400916167,2016-12-07
140,1,"0:04",1204,1204,"Keenan Evans Defensive Rebound.",42,21,21,0.994368429055438,"Texas Tech","UTSA",4,2,0,0,23,400916167,2016-12-07
141,1,"0:00",1200,1200,"End of 1st half",42,21,21,0.994368429055438,"Texas Tech","UTSA",4,2,0,0,23,400916167,2016-12-07
142,2,"20:00",1200,1200,"PLAY",42,21,21,0.994368429055438,"Texas Tech","UTSA",4,3,0,0,23,400916167,2016-12-07
143,2,"19:46",1186,1186,"Byron Frohnen made Layup.",42,23,19,0.993201263646859,"Texas Tech","UTSA",4,3,0,0,23,400916167,2016-12-07
144,2,"19:33",1173,1173,"Justin Gray missed Layup.",42,23,19,0.992275361717528,"Texas Tech","UTSA",4,3,0,0,23,400916167,2016-12-07
145,2,"19:33",1173,1173,"Byron Frohnen Defensive Rebound.",42,23,19,0.992275361717528,"Texas Tech","UTSA",4,3,0,0,23,400916167,2016-12-07
146,2,"19:26",1166,1166,"Foul on Byron Frohnen.",42,23,19,0.992957530444473,"Texas Tech","UTSA",4,3,0,0,23,400916167,2016-12-07
147,2,"19:26",1166,1166,"Byron Frohnen Turnover.",42,23,19,0.992957530444473,"Texas Tech","UTSA",4,3,0,0,23,400916167,2016-12-07
148,2,"19:11",1151,1151,"Anthony Livingston made Jumper. Assisted by Keenan Evans.",44,23,21,0.994142068995284,"Texas Tech","UTSA",4,3,0,0,23,400916167,2016-12-07
149,2,"18:47",1127,1127,"Foul on Justin Gray.",44,23,21,0.99657492944854,"Texas Tech","UTSA",4,3,0,0,23,400916167,2016-12-07
150,2,"18:33",1113,1113,"Nick Allen made Three Point Jumper. Assisted by Byron Frohnen.",44,26,18,0.991902125510132,"Texas Tech","UTSA",4,3,0,0,23,400916167,2016-12-07
151,2,"18:02",1082,1082,"Anthony Livingston made Three Point Jumper. Assisted by Keenan Evans.",47,26,21,0.99614473277323,"Texas Tech","UTSA",4,3,0,0,23,400916167,2016-12-07
152,2,"17:42",1062,1062,"Nick Allen missed Three Point Jumper.",47,26,21,0.995117349129948,"Texas Tech","UTSA",4,3,0,0,23,400916167,2016-12-07
153,2,"17:42",1062,1062,"Devon Thomas Defensive Rebound.",47,26,21,0.995117349129948,"Texas Tech","UTSA",4,3,0,0,23,400916167,2016-12-07
154,2,"17:33",1053,1053,"Niem Stevenson Turnover.",47,26,21,0.996058613984241,"Texas Tech","UTSA",4,3,0,0,23,400916167,2016-12-07
155,2,"17:32",1052,1052,"Austin Karrer Steal.",47,26,21,0.996058613984241,"Texas Tech","UTSA",4,3,0,0,23,400916167,2016-12-07
156,2,"17:29",1049,1049,"Austin Karrer Turnover.",47,26,21,0.995839939298124,"Texas Tech","UTSA",4,3,0,0,23,400916167,2016-12-07
157,2,"17:28",1048,1048,"Niem Stevenson Steal.",47,26,21,0.995839939298124,"Texas Tech","UTSA",4,3,0,0,23,400916167,2016-12-07
158,2,"17:27",1047,1047,"Niem Stevenson made Layup.",49,26,23,0.997065957042053,"Texas Tech","UTSA",4,3,0,0,23,400916167,2016-12-07
159,2,"17:11",1031,1031,"Jeff Beverly missed Layup.",49,26,23,0.996584173363578,"Texas Tech","UTSA",4,3,0,0,23,400916167,2016-12-07
160,2,"17:11",1031,1031,"Matthew Temple Block.",49,26,23,0.996584173363578,"Texas Tech","UTSA",4,3,0,0,23,400916167,2016-12-07
161,2,"17:11",1031,1031,"UT San Antonio Offensive Rebound.",49,26,23,0.996584173363578,"Texas Tech","UTSA",4,3,0,0,23,400916167,2016-12-07
162,2,"17:05",1025,1025,"Giovanni De Nicolao missed Jumper.",49,26,23,0.997140975530926,"Texas Tech","UTSA",4,3,0,0,23,400916167,2016-12-07
163,2,"17:05",1025,1025,"Giovanni McLean Defensive Rebound.",49,26,23,0.997140975530926,"Texas Tech","UTSA",4,3,0,0,23,400916167,2016-12-07
164,2,"17:00",1020,1020,"Foul on Nick Allen.",49,26,23,0.997140975530926,"Texas Tech","UTSA",4,3,0,0,23,400916167,2016-12-07
165,2,"16:52",1012,1012,"Devon Thomas made Three Point Jumper.",52,26,26,0.998188065081289,"Texas Tech","UTSA",4,3,0,0,23,400916167,2016-12-07
166,2,"16:38",998,998,"Foul on Shadell Millinghaus.",52,26,26,0.998140802349261,"Texas Tech","UTSA",4,3,0,0,23,400916167,2016-12-07
167,2,"16:35",995,995,"Foul on Devon Thomas.",52,26,26,0.998140802349261,"Texas Tech","UTSA",4,3,0,0,23,400916167,2016-12-07
168,2,"16:35",995,995,"Jeff Beverly made Free Throw.",52,27,25,0.997778286821111,"Texas Tech","UTSA",4,3,0,0,23,400916167,2016-12-07
169,2,"16:35",995,995,"Jeff Beverly made Free Throw.",52,28,24,0.997345274226222,"Texas Tech","UTSA",4,3,0,0,23,400916167,2016-12-07
170,2,"16:19",979,979,"Matthew Temple missed Jumper.",52,28,24,0.997659188758909,"Texas Tech","UTSA",4,3,0,0,23,400916167,2016-12-07
171,2,"16:19",979,979,"Gino Littles Defensive Rebound.",52,28,24,0.997659188758909,"Texas Tech","UTSA",4,3,0,0,23,400916167,2016-12-07
172,2,"16:03",963,963,"Jeff Beverly made Three Point Jumper.",52,31,21,0.995693341963612,"Texas Tech","UTSA",4,3,0,0,23,400916167,2016-12-07
173,2,"15:50",950,950,"Foul on Jeff Beverly.",52,31,21,0.996842891005761,"Texas Tech","UTSA",4,3,0,0,23,400916167,2016-12-07
174,2,"15:50",950,950,"Official TV Timeout",52,31,21,0.996842891005761,"Texas Tech","UTSA",4,3,0,0,23,400916167,2016-12-07
175,2,"15:39",939,939,"Niem Stevenson made Layup. Assisted by Justin Gray.",54,31,23,0.997564209095323,"Texas Tech","UTSA",4,3,0,0,23,400916167,2016-12-07
176,2,"15:24",924,924,"George Willborn III missed Jumper.",54,31,23,0.997422857418965,"Texas Tech","UTSA",4,3,0,0,23,400916167,2016-12-07
177,2,"15:24",924,924,"Anthony Livingston Defensive Rebound.",54,31,23,0.997422857418965,"Texas Tech","UTSA",4,3,0,0,23,400916167,2016-12-07
178,2,"15:23",923,923,"Foul on Jeff Beverly.",54,31,23,0.997422857418965,"Texas Tech","UTSA",4,3,0,0,23,400916167,2016-12-07
179,2,"15:08",908,908,"Foul on George Willborn III.",54,31,23,0.997467464797431,"Texas Tech","UTSA",4,3,0,0,23,400916167,2016-12-07
180,2,"14:57",897,897,"Justin Gray made Jumper.",56,31,25,0.998468753237686,"Texas Tech","UTSA",4,3,0,0,23,400916167,2016-12-07
181,2,"14:38",878,878,"Gino Littles missed Layup.",56,31,25,0.998416852689888,"Texas Tech","UTSA",4,3,0,0,23,400916167,2016-12-07
182,2,"14:38",878,878,"Texas Tech Defensive Rebound.",56,31,25,0.998416852689888,"Texas Tech","UTSA",4,3,0,0,23,400916167,2016-12-07
183,2,"14:17",857,857,"Keenan Evans missed Layup.",56,31,25,0.998823948266816,"Texas Tech","UTSA",4,3,0,0,23,400916167,2016-12-07
184,2,"14:17",857,857,"Matthew Temple Offensive Rebound.",56,31,25,0.998823948266816,"Texas Tech","UTSA",4,3,0,0,23,400916167,2016-12-07
185,2,"14:14",854,854,"Niem Stevenson missed Three Point Jumper.",56,31,25,0.998823948266816,"Texas Tech","UTSA",4,3,0,0,23,400916167,2016-12-07
186,2,"14:14",854,854,"George Willborn III Defensive Rebound.",56,31,25,0.998823948266816,"Texas Tech","UTSA",4,3,0,0,23,400916167,2016-12-07
187,2,"13:57",837,837,"Byron Frohnen Turnover.",56,31,25,0.998993010232021,"Texas Tech","UTSA",4,3,0,0,23,400916167,2016-12-07
188,2,"13:34",814,814,"Keenan Evans made Three Point Jumper. Assisted by Devon Thomas.",59,31,28,0.99920003686066,"Texas Tech","UTSA",4,3,0,0,23,400916167,2016-12-07
189,2,"13:21",801,801,"George Willborn III Turnover.",59,31,28,0.999372071124349,"Texas Tech","UTSA",4,3,0,0,23,400916167,2016-12-07
