"play_id","half","time_remaining_half","secs_remaining","secs_remaining_absolute","description","home_score","away_score","score_diff","win_prob","home","away","home_time_out_remaining","away_time_out_remaining","home_timeout_ind","away_timeout_ind","home_favored_by","game_id","date"
1,1,"20:00",2400,2400,"PLAY",0,0,0,0.670974856387565,"UNLV","Utah",4,4,0,0,3,401001884,2017-11-23
2,1,"20:00",2400,2400,"Jump Ball won by Utah",0,0,0,0.670974856387565,"UNLV","Utah",4,4,0,0,3,401001884,2017-11-23
3,1,"19:37",2377,2377,"Justin Bibbins made Layup.",0,2,-2,0.630502567539081,"UNLV","Utah",4,4,0,0,3,401001884,2017-11-23
4,1,"19:22",2362,2362,"Jordan Johnson missed Layup.",0,2,-2,0.642770241315321,"UNLV","Utah",4,4,0,0,3,401001884,2017-11-23
5,1,"19:22",2362,2362,"Brandon McCoy Offensive Rebound.",0,2,-2,0.642770241315321,"UNLV","Utah",4,4,0,0,3,401001884,2017-11-23
6,1,"19:21",2361,2361,"Brandon McCoy made Layup.",2,2,0,0.658012645056712,"UNLV","Utah",4,4,0,0,3,401001884,2017-11-23
7,1,"19:08",2348,2348,"Sedrick Barefield Turnover.",2,2,0,0.660893555208401,"UNLV","Utah",4,4,0,0,3,401001884,2017-11-23
8,1,"19:08",2348,2348,"Shakur Juiston Steal.",2,2,0,0.660893555208401,"UNLV","Utah",4,4,0,0,3,401001884,2017-11-23
9,1,"18:58",2338,2338,"Shakur Juiston made Dunk.",4,2,2,0.707297560914559,"UNLV","Utah",4,4,0,0,3,401001884,2017-11-23
10,1,"18:36",2316,2316,"Sedrick Barefield missed Jumper.",4,2,2,0.69581200830952,"UNLV","Utah",4,4,0,0,3,401001884,2017-11-23
11,1,"18:36",2316,2316,"Brandon McCoy Defensive Rebound.",4,2,2,0.69581200830952,"UNLV","Utah",4,4,0,0,3,401001884,2017-11-23
12,1,"18:27",2307,2307,"Foul on Justin Bibbins.",4,2,2,0.698873866232261,"UNLV","Utah",4,4,0,0,3,401001884,2017-11-23
13,1,"18:20",2300,2300,"Foul on David Collette.",4,2,2,0.698873866232261,"UNLV","Utah",4,4,0,0,3,401001884,2017-11-23
14,1,"18:11",2291,2291,"Kris Clyburn missed Three Point Jumper.",4,2,2,0.71070027854462,"UNLV","Utah",4,4,0,0,3,401001884,2017-11-23
15,1,"18:11",2291,2291,"Justin Bibbins Defensive Rebound.",4,2,2,0.71070027854462,"UNLV","Utah",4,4,0,0,3,401001884,2017-11-23
16,1,"17:50",2270,2270,"Gabe Bealer missed Jumper.",4,2,2,0.712051527802964,"UNLV","Utah",4,4,0,0,3,401001884,2017-11-23
17,1,"17:50",2270,2270,"Jovan Mooring Defensive Rebound.",4,2,2,0.712051527802964,"UNLV","Utah",4,4,0,0,3,401001884,2017-11-23
18,1,"17:41",2261,2261,"Jovan Mooring missed Three Point Jumper.",4,2,2,0.722582015472805,"UNLV","Utah",4,4,0,0,3,401001884,2017-11-23
19,1,"17:41",2261,2261,"Kris Clyburn Offensive Rebound.",4,2,2,0.722582015472805,"UNLV","Utah",4,4,0,0,3,401001884,2017-11-23
20,1,"17:41",2261,2261,"Kris Clyburn made Two Point Tip Shot.",6,2,4,0.769276526189506,"UNLV","Utah",4,4,0,0,3,401001884,2017-11-23
21,1,"17:17",2237,2237,"David Collette Turnover.",6,2,4,0.755795515700538,"UNLV","Utah",4,4,0,0,3,401001884,2017-11-23
22,1,"17:06",2226,2226,"Brandon McCoy Turnover.",6,2,4,0.750070356956033,"UNLV","Utah",4,4,0,0,3,401001884,2017-11-23
23,1,"17:06",2226,2226,"Justin Bibbins Steal.",6,2,4,0.750070356956033,"UNLV","Utah",4,4,0,0,3,401001884,2017-11-23
24,1,"17:00",2220,2220,"Justin Bibbins missed Jumper.",6,2,4,0.750070356956033,"UNLV","Utah",4,4,0,0,3,401001884,2017-11-23
25,1,"17:00",2220,2220,"Jayce Johnson Offensive Rebound.",6,2,4,0.750070356956033,"UNLV","Utah",4,4,0,0,3,401001884,2017-11-23
26,1,"17:00",2220,2220,"Jayce Johnson missed Two Point Tip Shot.",6,2,4,0.750070356956033,"UNLV","Utah",4,4,0,0,3,401001884,2017-11-23
27,1,"17:00",2220,2220,"Donnie Tillman Offensive Rebound.",6,2,4,0.750070356956033,"UNLV","Utah",4,4,0,0,3,401001884,2017-11-23
28,1,"16:55",2215,2215,"Foul on Shakur Juiston.",6,2,4,0.771823629743358,"UNLV","Utah",4,4,0,0,3,401001884,2017-11-23
29,1,"16:55",2215,2215,"Donnie Tillman made Free Throw.",6,3,3,0.747960401290044,"UNLV","Utah",4,4,0,0,3,401001884,2017-11-23
30,1,"16:55",2215,2215,"Donnie Tillman made Free Throw.",6,4,2,0.722498793078994,"UNLV","Utah",4,4,0,0,3,401001884,2017-11-23
31,1,"16:50",2210,2210,"Jovan Mooring missed Layup.",6,4,2,0.722498793078994,"UNLV","Utah",4,4,0,0,3,401001884,2017-11-23
32,1,"16:50",2210,2210,"Jayce Johnson Defensive Rebound.",6,4,2,0.722498793078994,"UNLV","Utah",4,4,0,0,3,401001884,2017-11-23
33,1,"16:43",2203,2203,"Tyler Rawson missed Three Point Jumper.",6,4,2,0.712174435025092,"UNLV","Utah",4,4,0,0,3,401001884,2017-11-23
34,1,"16:43",2203,2203,"Kris Clyburn Defensive Rebound.",6,4,2,0.712174435025092,"UNLV","Utah",4,4,0,0,3,401001884,2017-11-23
35,1,"16:30",2190,2190,"Brandon McCoy made Layup. Assisted by Shakur Juiston.",8,4,4,0.767256975328626,"UNLV","Utah",4,4,0,0,3,401001884,2017-11-23
36,1,"16:30",2190,2190,"Foul on Sedrick Barefield.",8,4,4,0.767256975328626,"UNLV","Utah",4,4,0,0,3,401001884,2017-11-23
37,1,"16:30",2190,2190,"Brandon McCoy made Free Throw.",9,4,5,0.787401384587819,"UNLV","Utah",4,4,0,0,3,401001884,2017-11-23
38,1,"16:25",2185,2185,"Justin Bibbins made Layup.",9,6,3,0.731087903845323,"UNLV","Utah",4,4,0,0,3,401001884,2017-11-23
39,1,"16:06",2166,2166,"Shakur Juiston missed Layup.",9,6,3,0.728791524420458,"UNLV","Utah",4,4,0,0,3,401001884,2017-11-23
40,1,"16:06",2166,2166,"Tyler Rawson Block.",9,6,3,0.728791524420458,"UNLV","Utah",4,4,0,0,3,401001884,2017-11-23
41,1,"16:06",2166,2166,"Jayce Johnson Defensive Rebound.",9,6,3,0.728791524420458,"UNLV","Utah",4,4,0,0,3,401001884,2017-11-23
42,1,"15:48",2148,2148,"Foul on Kris Clyburn.",9,6,3,0.731189830470135,"UNLV","Utah",4,4,0,0,3,401001884,2017-11-23
43,1,"15:48",2148,2148,"Official TV Timeout",9,6,3,0.731189830470135,"UNLV","Utah",4,4,0,0,3,401001884,2017-11-23
44,1,"15:48",2148,2148,"Tyler Rawson made Free Throw.",9,7,2,0.71081561248558,"UNLV","Utah",4,4,0,0,3,401001884,2017-11-23
45,1,"15:48",2148,2148,"Tyler Rawson made Free Throw.",9,8,1,0.689552802131648,"UNLV","Utah",4,4,0,0,3,401001884,2017-11-23
46,1,"15:41",2141,2141,"Brandon McCoy missed Jumper.",9,8,1,0.689552802131648,"UNLV","Utah",4,4,0,0,3,401001884,2017-11-23
47,1,"15:41",2141,2141,"Donnie Tillman Defensive Rebound.",9,8,1,0.689552802131648,"UNLV","Utah",4,4,0,0,3,401001884,2017-11-23
48,1,"15:32",2132,2132,"Jayce Johnson made Jumper. Assisted by Tyler Rawson.",9,10,-1,0.630375616898272,"UNLV","Utah",4,4,0,0,3,401001884,2017-11-23
49,1,"15:09",2109,2109,"Foul on Amauri Hardy.",9,10,-1,0.627975181068636,"UNLV","Utah",4,4,0,0,3,401001884,2017-11-23
50,1,"15:09",2109,2109,"Amauri Hardy Turnover.",9,10,-1,0.627975181068636,"UNLV","Utah",4,4,0,0,3,401001884,2017-11-23
51,1,"14:55",2095,2095,"Foul on Amauri Hardy.",9,10,-1,0.623674177165955,"UNLV","Utah",4,4,0,0,3,401001884,2017-11-23
52,1,"14:51",2091,2091,"Donnie Tillman missed Three Point Jumper.",9,10,-1,0.623674177165955,"UNLV","Utah",4,4,0,0,3,401001884,2017-11-23
53,1,"14:51",2091,2091,"Sedrick Barefield Offensive Rebound.",9,10,-1,0.623674177165955,"UNLV","Utah",4,4,0,0,3,401001884,2017-11-23
54,1,"14:45",2085,2085,"Justin Bibbins missed Three Point Jumper.",9,10,-1,0.635506815255973,"UNLV","Utah",4,4,0,0,3,401001884,2017-11-23
55,1,"14:45",2085,2085,"Brandon McCoy Defensive Rebound.",9,10,-1,0.635506815255973,"UNLV","Utah",4,4,0,0,3,401001884,2017-11-23
56,1,"14:39",2079,2079,"Jovan Mooring missed Three Point Jumper.",9,10,-1,0.629545709407799,"UNLV","Utah",4,4,0,0,3,401001884,2017-11-23
57,1,"14:39",2079,2079,"Brandon McCoy Offensive Rebound.",9,10,-1,0.629545709407799,"UNLV","Utah",4,4,0,0,3,401001884,2017-11-23
58,1,"14:32",2072,2072,"Jordan Johnson Turnover.",9,10,-1,0.629545709407799,"UNLV","Utah",4,4,0,0,3,401001884,2017-11-23
59,1,"14:18",2058,2058,"David Collette missed Jumper.",9,10,-1,0.627526848613776,"UNLV","Utah",4,4,0,0,3,401001884,2017-11-23
60,1,"14:18",2058,2058,"Tervell Beck Defensive Rebound.",9,10,-1,0.627526848613776,"UNLV","Utah",4,4,0,0,3,401001884,2017-11-23
61,1,"14:18",2058,2058,"Jump Ball won by UNLV",9,10,-1,0.627526848613776,"UNLV","Utah",4,4,0,0,3,401001884,2017-11-23
62,1,"14:02",2042,2042,"Jordan Johnson made Jumper.",11,10,1,0.667886902566068,"UNLV","Utah",4,4,0,0,3,401001884,2017-11-23
63,1,"13:36",2016,2016,"David Collette missed Jumper.",11,10,1,0.685600999044135,"UNLV","Utah",4,4,0,0,3,401001884,2017-11-23
64,1,"13:36",2016,2016,"Brandon McCoy Defensive Rebound.",11,10,1,0.685600999044135,"UNLV","Utah",4,4,0,0,3,401001884,2017-11-23
65,1,"13:24",2004,2004,"Shakur Juiston made Layup.",13,10,3,0.721152417999125,"UNLV","Utah",4,4,0,0,3,401001884,2017-11-23
66,1,"13:07",1987,1987,"Justin Bibbins missed Three Point Jumper.",13,10,3,0.72158687746921,"UNLV","Utah",4,4,0,0,3,401001884,2017-11-23
67,1,"13:07",1987,1987,"Jovan Mooring Defensive Rebound.",13,10,3,0.72158687746921,"UNLV","Utah",4,4,0,0,3,401001884,2017-11-23
68,1,"12:54",1974,1974,"Brandon McCoy missed Jumper.",13,10,3,0.739123410214329,"UNLV","Utah",4,4,0,0,3,401001884,2017-11-23
69,1,"12:54",1974,1974,"Shakur Juiston Offensive Rebound.",13,10,3,0.739123410214329,"UNLV","Utah",4,4,0,0,3,401001884,2017-11-23
70,1,"12:46",1966,1966,"Jovan Mooring missed Three Point Jumper.",13,10,3,0.721641035227981,"UNLV","Utah",4,4,0,0,3,401001884,2017-11-23
71,1,"12:46",1966,1966,"Sedrick Barefield Defensive Rebound.",13,10,3,0.721641035227981,"UNLV","Utah",4,4,0,0,3,401001884,2017-11-23
72,1,"12:37",1957,1957,"David Collette missed Three Point Jumper.",13,10,3,0.737031865742041,"UNLV","Utah",4,4,0,0,3,401001884,2017-11-23
73,1,"12:37",1957,1957,"Brandon McCoy Defensive Rebound.",13,10,3,0.737031865742041,"UNLV","Utah",4,4,0,0,3,401001884,2017-11-23
74,1,"12:24",1944,1944,"Jordan Johnson made Three Point Jumper. Assisted by Jovan Mooring.",16,10,6,0.79910933711518,"UNLV","Utah",4,4,0,0,3,401001884,2017-11-23
75,1,"12:09",1929,1929,"Sedrick Barefield missed Three Point Jumper.",16,10,6,0.796718510368151,"UNLV","Utah",4,4,0,0,3,401001884,2017-11-23
76,1,"12:09",1929,1929,"Donnie Tillman Offensive Rebound.",16,10,6,0.796718510368151,"UNLV","Utah",4,4,0,0,3,401001884,2017-11-23
77,1,"11:58",1918,1918,"Foul on Tervell Beck.",16,10,6,0.813652075078071,"UNLV","Utah",4,4,0,0,3,401001884,2017-11-23
78,1,"11:58",1918,1918,"Official TV Timeout",16,10,6,0.813652075078071,"UNLV","Utah",4,4,0,0,3,401001884,2017-11-23
79,1,"11:45",1905,1905,"Parker Van Dyke Turnover.",16,10,6,0.790303300056293,"UNLV","Utah",4,4,0,0,3,401001884,2017-11-23
80,1,"11:45",1905,1905,"Jovan Mooring Steal.",16,10,6,0.790303300056293,"UNLV","Utah",4,4,0,0,3,401001884,2017-11-23
81,1,"11:35",1895,1895,"Jordan Johnson missed Three Point Jumper.",16,10,6,0.809937833050284,"UNLV","Utah",4,4,0,0,3,401001884,2017-11-23
82,1,"11:35",1895,1895,"Tervell Beck Offensive Rebound.",16,10,6,0.809937833050284,"UNLV","Utah",4,4,0,0,3,401001884,2017-11-23
83,1,"11:29",1889,1889,"Foul on Donnie Tillman.",16,10,6,0.793731000458887,"UNLV","Utah",4,4,0,0,3,401001884,2017-11-23
84,1,"11:29",1889,1889,"Tervell Beck made Free Throw.",17,10,7,0.813251106771468,"UNLV","Utah",4,4,0,0,3,401001884,2017-11-23
85,1,"11:29",1889,1889,"Tervell Beck missed Free Throw.",17,10,7,0.813251106771468,"UNLV","Utah",4,4,0,0,3,401001884,2017-11-23
86,1,"11:29",1889,1889,"Donnie Tillman Defensive Rebound.",17,10,7,0.813251106771468,"UNLV","Utah",4,4,0,0,3,401001884,2017-11-23
87,1,"11:22",1882,1882,"Tyler Rawson made Three Point Jumper. Assisted by Sedrick Barefield.",17,13,4,0.750286404480436,"UNLV","Utah",4,4,0,0,3,401001884,2017-11-23
88,1,"11:06",1866,1866,"Jovan Mooring missed Jumper.",17,13,4,0.768680356485567,"UNLV","Utah",4,4,0,0,3,401001884,2017-11-23
89,1,"11:06",1866,1866,"Jayce Johnson Defensive Rebound.",17,13,4,0.768680356485567,"UNLV","Utah",4,4,0,0,3,401001884,2017-11-23
90,1,"10:49",1849,1849,"Donnie Tillman made Jumper.",17,15,2,0.690258015087602,"UNLV","Utah",4,4,0,0,3,401001884,2017-11-23
91,1,"10:40",1840,1840,"Cheickna Dembele Turnover.",17,15,2,0.690258015087602,"UNLV","Utah",4,4,0,0,3,401001884,2017-11-23
92,1,"10:40",1840,1840,"Sedrick Barefield Steal.",17,15,2,0.690258015087602,"UNLV","Utah",4,4,0,0,3,401001884,2017-11-23
93,1,"10:32",1832,1832,"Foul on Sedrick Barefield.",17,15,2,0.706309737905089,"UNLV","Utah",4,4,0,0,3,401001884,2017-11-23
94,1,"10:32",1832,1832,"Sedrick Barefield Turnover.",17,15,2,0.706309737905089,"UNLV","Utah",4,4,0,0,3,401001884,2017-11-23
95,1,"10:25",1825,1825,"Foul on Shakur Juiston.",17,15,2,0.720587565268939,"UNLV","Utah",4,4,0,0,3,401001884,2017-11-23
96,1,"10:25",1825,1825,"Shakur Juiston Turnover.",17,15,2,0.720587565268939,"UNLV","Utah",4,4,0,0,3,401001884,2017-11-23
97,1,"10:11",1811,1811,"Foul on Brandon McCoy.",17,15,2,0.712958116231545,"UNLV","Utah",4,4,0,0,3,401001884,2017-11-23
98,1,"10:11",1811,1811,"Donnie Tillman made Free Throw.",17,16,1,0.683588335627631,"UNLV","Utah",4,4,0,0,3,401001884,2017-11-23
99,1,"10:11",1811,1811,"Donnie Tillman made Free Throw.",17,17,0,0.652677420622727,"UNLV","Utah",4,4,0,0,3,401001884,2017-11-23
100,1,"9:54",1794,1794,"Jordan Johnson made Layup.",19,17,2,0.696684231352408,"UNLV","Utah",4,4,0,0,3,401001884,2017-11-23
101,1,"9:36",1776,1776,"Donnie Tillman made Dunk. Assisted by Justin Bibbins.",19,19,0,0.63419322970843,"UNLV","Utah",4,4,0,0,3,401001884,2017-11-23
102,1,"9:14",1754,1754,"Kris Clyburn missed Jumper.",19,19,0,0.627873789810325,"UNLV","Utah",4,4,0,0,3,401001884,2017-11-23
103,1,"9:14",1754,1754,"Brandon McCoy Offensive Rebound.",19,19,0,0.627873789810325,"UNLV","Utah",4,4,0,0,3,401001884,2017-11-23
104,1,"9:11",1751,1751,"Foul on Jayce Johnson.",19,19,0,0.627873789810325,"UNLV","Utah",4,4,0,0,3,401001884,2017-11-23
105,1,"9:11",1751,1751,"Brandon McCoy made Free Throw.",20,19,1,0.659986119944867,"UNLV","Utah",4,4,0,0,3,401001884,2017-11-23
106,1,"9:11",1751,1751,"Brandon McCoy made Free Throw.",21,19,2,0.690692464729988,"UNLV","Utah",4,4,0,0,3,401001884,2017-11-23
107,1,"8:56",1736,1736,"David Collette made Layup.",21,21,0,0.646895087936447,"UNLV","Utah",4,4,0,0,3,401001884,2017-11-23
108,1,"8:43",1723,1723,"Foul on Tervell Beck.",21,21,0,0.649100889839975,"UNLV","Utah",4,4,0,0,3,401001884,2017-11-23
109,1,"8:43",1723,1723,"Tervell Beck Turnover.",21,21,0,0.649100889839975,"UNLV","Utah",4,4,0,0,3,401001884,2017-11-23
110,1,"8:32",1712,1712,"Parker Van Dyke missed Jumper.",21,21,0,0.652459652484572,"UNLV","Utah",4,4,0,0,3,401001884,2017-11-23
111,1,"8:32",1712,1712,"UNLV Defensive Rebound.",21,21,0,0.652459652484572,"UNLV","Utah",4,4,0,0,3,401001884,2017-11-23
112,1,"8:15",1695,1695,"Kris Clyburn missed Three Point Jumper.",21,21,0,0.650767204217009,"UNLV","Utah",4,4,0,0,3,401001884,2017-11-23
113,1,"8:15",1695,1695,"Tyler Rawson Defensive Rebound.",21,21,0,0.650767204217009,"UNLV","Utah",4,4,0,0,3,401001884,2017-11-23
114,1,"8:10",1690,1690,"Foul on Cheikh Mbacke Diong.",21,21,0,0.650767204217009,"UNLV","Utah",4,4,0,0,3,401001884,2017-11-23
115,1,"8:09",1689,1689,"Tyler Rawson missed Free Throw.",21,21,0,0.649877276633915,"UNLV","Utah",4,4,0,0,3,401001884,2017-11-23
116,1,"8:09",1689,1689,"Kris Clyburn Defensive Rebound.",21,21,0,0.649877276633915,"UNLV","Utah",4,4,0,0,3,401001884,2017-11-23
117,1,"7:57",1677,1677,"Brandon McCoy made Layup. Assisted by Jovan Mooring.",23,21,2,0.708666505325029,"UNLV","Utah",4,4,0,0,3,401001884,2017-11-23
118,1,"7:57",1677,1677,"Foul on David Collette.",23,21,2,0.708666505325029,"UNLV","Utah",4,4,0,0,3,401001884,2017-11-23
119,1,"7:57",1677,1677,"Brandon McCoy made Free Throw.",24,21,3,0.736427416910418,"UNLV","Utah",4,4,0,0,3,401001884,2017-11-23
120,1,"7:47",1667,1667,"Official TV Timeout",24,21,3,0.727626853739821,"UNLV","Utah",4,4,0,0,3,401001884,2017-11-23
121,1,"7:33",1653,1653,"Foul on Cheikh Mbacke Diong.",24,21,3,0.731976508376747,"UNLV","Utah",4,4,0,0,3,401001884,2017-11-23
122,1,"7:33",1653,1653,"Tyler Rawson missed Free Throw.",24,21,3,0.731976508376747,"UNLV","Utah",4,4,0,0,3,401001884,2017-11-23
123,1,"7:33",1653,1653,"Utah Deadball Team Rebound.",24,21,3,0.731976508376747,"UNLV","Utah",4,4,0,0,3,401001884,2017-11-23
124,1,"7:33",1653,1653,"Tyler Rawson missed Free Throw.",24,21,3,0.731976508376747,"UNLV","Utah",4,4,0,0,3,401001884,2017-11-23
125,1,"7:33",1653,1653,"Donnie Tillman Offensive Rebound.",24,21,3,0.731976508376747,"UNLV","Utah",4,4,0,0,3,401001884,2017-11-23
126,1,"7:17",1637,1637,"Jayce Johnson Turnover.",24,21,3,0.735946112687851,"UNLV","Utah",4,4,0,0,3,401001884,2017-11-23
127,1,"7:05",1625,1625,"Foul on Brandon McCoy.",24,21,3,0.730020689507672,"UNLV","Utah",4,4,0,0,3,401001884,2017-11-23
128,1,"7:05",1625,1625,"Brandon McCoy Turnover.",24,21,3,0.730020689507672,"UNLV","Utah",4,4,0,0,3,401001884,2017-11-23
129,1,"6:52",1612,1612,"Foul on Tervell Beck.",24,21,3,0.718247499800451,"UNLV","Utah",4,4,0,0,3,401001884,2017-11-23
130,1,"6:52",1612,1612,"Tyler Rawson made Free Throw.",24,22,2,0.688913322789711,"UNLV","Utah",4,4,0,0,3,401001884,2017-11-23
131,1,"6:52",1612,1612,"Tyler Rawson made Free Throw.",24,23,1,0.657979382444589,"UNLV","Utah",4,4,0,0,3,401001884,2017-11-23
132,1,"6:42",1602,1602,"Jordan Johnson made Jumper.",26,23,3,0.72434418459402,"UNLV","Utah",4,4,0,0,3,401001884,2017-11-23
133,1,"6:18",1578,1578,"Foul on Donnie Tillman.",26,23,3,0.744417459838885,"UNLV","Utah",4,4,0,0,3,401001884,2017-11-23
134,1,"6:18",1578,1578,"Donnie Tillman Turnover.",26,23,3,0.744417459838885,"UNLV","Utah",4,4,0,0,3,401001884,2017-11-23
135,1,"6:18",1578,1578,"Technical Foul on Utah.",26,23,3,0.744417459838885,"UNLV","Utah",4,4,0,0,3,401001884,2017-11-23
136,1,"6:18",1578,1578,"Jovan Mooring made Free Throw.",27,23,4,0.772800600213096,"UNLV","Utah",4,4,0,0,3,401001884,2017-11-23
137,1,"6:18",1578,1578,"Foul on Utah.",26,23,3,0.744417459838885,"UNLV","Utah",4,4,0,0,3,401001884,2017-11-23
138,1,"6:18",1578,1578,"Jovan Mooring made Free Throw.",28,23,5,0.798883287085531,"UNLV","Utah",4,4,0,0,3,401001884,2017-11-23
139,1,"6:09",1569,1569,"Cheickna Dembele Turnover.",28,23,5,0.775685852721055,"UNLV","Utah",4,4,0,0,3,401001884,2017-11-23
140,1,"6:09",1569,1569,"Justin Bibbins Steal.",28,23,5,0.775685852721055,"UNLV","Utah",4,4,0,0,3,401001884,2017-11-23
141,1,"5:50",1550,1550,"Foul on Cheikh Mbacke Diong.",28,23,5,0.777874095014415,"UNLV","Utah",4,4,0,0,3,401001884,2017-11-23
142,1,"5:50",1550,1550,"Jayce Johnson made Free Throw.",28,24,4,0.752081789863489,"UNLV","Utah",4,4,0,0,3,401001884,2017-11-23
143,1,"5:50",1550,1550,"Jayce Johnson missed Free Throw.",28,24,4,0.752081789863489,"UNLV","Utah",4,4,0,0,3,401001884,2017-11-23
144,1,"5:50",1550,1550,"Cheikh Mbacke Diong Defensive Rebound.",28,24,4,0.752081789863489,"UNLV","Utah",4,4,0,0,3,401001884,2017-11-23
145,1,"5:29",1529,1529,"Jovan Mooring missed Jumper.",28,24,4,0.757924004382767,"UNLV","Utah",4,4,0,0,3,401001884,2017-11-23
146,1,"5:29",1529,1529,"Tyler Rawson Defensive Rebound.",28,24,4,0.757924004382767,"UNLV","Utah",4,4,0,0,3,401001884,2017-11-23
147,1,"5:24",1524,1524,"Justin Bibbins missed Three Point Jumper.",28,24,4,0.757924004382767,"UNLV","Utah",4,4,0,0,3,401001884,2017-11-23
148,1,"5:24",1524,1524,"Cheickna Dembele Defensive Rebound.",28,24,4,0.757924004382767,"UNLV","Utah",4,4,0,0,3,401001884,2017-11-23
149,1,"5:13",1513,1513,"Jovan Mooring made Three Point Jumper. Assisted by Jordan Johnson.",31,24,7,0.845270998232421,"UNLV","Utah",4,4,0,0,3,401001884,2017-11-23
150,1,"4:49",1489,1489,"Tyler Rawson made Three Point Jumper. Assisted by Justin Bibbins.",31,27,4,0.757025893545766,"UNLV","Utah",4,4,0,0,3,401001884,2017-11-23
151,1,"4:24",1464,1464,"Foul on Justin Bibbins.",31,27,4,0.757032536751639,"UNLV","Utah",4,4,0,0,3,401001884,2017-11-23
152,1,"4:24",1464,1464,"Jordan Johnson missed Free Throw.",31,27,4,0.757032536751639,"UNLV","Utah",4,4,0,0,3,401001884,2017-11-23
153,1,"4:24",1464,1464,"UNLV Deadball Team Rebound.",31,27,4,0.757032536751639,"UNLV","Utah",4,4,0,0,3,401001884,2017-11-23
154,1,"4:24",1464,1464,"Jordan Johnson made Free Throw.",32,27,5,0.781750401525722,"UNLV","Utah",4,4,0,0,3,401001884,2017-11-23
155,1,"4:11",1451,1451,"Gabe Bealer made Layup.",32,29,3,0.724703553163448,"UNLV","Utah",4,4,0,0,3,401001884,2017-11-23
156,1,"3:57",1437,1437,"Jovan Mooring made Three Point Jumper.",35,29,6,0.815382019428933,"UNLV","Utah",4,4,0,0,3,401001884,2017-11-23
157,1,"3:34",1414,1414,"Parker Van Dyke missed Three Point Jumper.",35,29,6,0.810649750198775,"UNLV","Utah",4,4,0,0,3,401001884,2017-11-23
158,1,"3:34",1414,1414,"Tyler Rawson Offensive Rebound.",35,29,6,0.810649750198775,"UNLV","Utah",4,4,0,0,3,401001884,2017-11-23
159,1,"3:25",1405,1405,"Justin Bibbins made Jumper. Assisted by Tyler Rawson.",35,31,4,0.77679498530906,"UNLV","Utah",4,4,0,0,3,401001884,2017-11-23
160,1,"3:08",1388,1388,"Foul on Parker Van Dyke.",35,31,4,0.768542878389155,"UNLV","Utah",4,4,0,0,3,401001884,2017-11-23
161,1,"3:08",1388,1388,"Official TV Timeout",35,31,4,0.768542878389155,"UNLV","Utah",4,4,0,0,3,401001884,2017-11-23
162,1,"3:08",1388,1388,"Jovan Mooring made Free Throw.",36,31,5,0.794056034800199,"UNLV","Utah",4,4,0,0,3,401001884,2017-11-23
163,1,"3:08",1388,1388,"Jovan Mooring made Free Throw.",37,31,6,0.817424999850064,"UNLV","Utah",4,4,0,0,3,401001884,2017-11-23
164,1,"2:50",1370,1370,"Jayce Johnson Turnover.",37,31,6,0.797876744794535,"UNLV","Utah",4,4,0,0,3,401001884,2017-11-23
165,1,"2:23",1343,1343,"Cheickna Dembele made Dunk. Assisted by Jordan Johnson.",39,31,8,0.855025454368234,"UNLV","Utah",4,4,0,0,3,401001884,2017-11-23
166,1,"2:13",1333,1333,"Foul on Jordan Johnson.",39,31,8,0.849870483870641,"UNLV","Utah",4,4,0,0,3,401001884,2017-11-23
167,1,"2:13",1333,1333,"Justin Bibbins made Free Throw.",39,32,7,0.828922883154546,"UNLV","Utah",4,4,0,0,3,401001884,2017-11-23
168,1,"2:13",1333,1333,"Justin Bibbins made Free Throw.",39,33,6,0.805720613454775,"UNLV","Utah",4,4,0,0,3,401001884,2017-11-23
169,1,"1:50",1310,1310,"Foul on Jovan Mooring.",39,33,6,0.825589847108224,"UNLV","Utah",4,4,0,0,3,401001884,2017-11-23
170,1,"1:50",1310,1310,"Jovan Mooring Turnover.",39,33,6,0.825589847108224,"UNLV","Utah",4,4,0,0,3,401001884,2017-11-23
171,1,"1:37",1297,1297,"Gabe Bealer missed Layup.",39,33,6,0.833462465623373,"UNLV","Utah",4,4,0,0,3,401001884,2017-11-23
172,1,"1:37",1297,1297,"Cheickna Dembele Block.",39,33,6,0.833462465623373,"UNLV","Utah",4,4,0,0,3,401001884,2017-11-23
173,1,"1:37",1297,1297,"Jordan Johnson Defensive Rebound.",39,33,6,0.833462465623373,"UNLV","Utah",4,4,0,0,3,401001884,2017-11-23
174,1,"1:23",1283,1283,"Kris Clyburn missed Layup.",39,33,6,0.811046635301516,"UNLV","Utah",4,4,0,0,3,401001884,2017-11-23
175,1,"1:23",1283,1283,"Utah Defensive Rebound.",39,33,6,0.811046635301516,"UNLV","Utah",4,4,0,0,3,401001884,2017-11-23
176,1,"1:23",1283,1283,"Jump Ball won by Utah",39,33,6,0.811046635301516,"UNLV","Utah",4,4,0,0,3,401001884,2017-11-23
177,1,"1:07",1267,1267,"Foul on Kolbe Caldwell.",39,33,6,0.827129256717933,"UNLV","Utah",4,4,1,0,3,401001884,2017-11-23
178,1,"1:07",1267,1267,"Kolbe Caldwell Turnover.",39,33,6,0.827129256717933,"UNLV","Utah",4,4,1,0,3,401001884,2017-11-23
179,1,"1:07",1267,1267,"UNLV  Timeout",39,33,6,0.827129256717933,"UNLV","Utah",3,4,1,0,3,401001884,2017-11-23
180,1,"0:52",1252,1252,"Jordan Johnson made Layup.",41,33,8,0.848529020510734,"UNLV","Utah",3,4,1,0,3,401001884,2017-11-23
181,1,"0:24",1224,1224,"Tyler Rawson missed Three Point Jumper.",41,33,8,0.870350274951357,"UNLV","Utah",3,4,1,0,3,401001884,2017-11-23
182,1,"0:24",1224,1224,"UNLV Defensive Rebound.",41,33,8,0.870350274951357,"UNLV","Utah",3,4,1,0,3,401001884,2017-11-23
183,1,"0:04",1204,1204,"Jordan Johnson missed Jumper.",41,33,8,0.858631529636011,"UNLV","Utah",3,4,0,0,3,401001884,2017-11-23
184,1,"0:04",1204,1204,"Kris Clyburn Offensive Rebound.",41,33,8,0.858631529636011,"UNLV","Utah",3,4,0,0,3,401001884,2017-11-23
185,1,"0:01",1201,1201,"Kris Clyburn made Jumper.",43,33,10,0.893068158703722,"UNLV","Utah",3,4,0,0,3,401001884,2017-11-23
186,1,"0:00",1200,1200,"End of 1st half",43,33,10,0.893068158703722,"UNLV","Utah",3,4,0,0,3,401001884,2017-11-23
187,2,"20:00",1200,1200,"PLAY",43,33,10,0.893068158703722,"UNLV","Utah",4,4,0,0,3,401001884,2017-11-23
188,2,"20:00",1200,1200,"Jump Ball won by UNLV",43,33,10,0.893068158703722,"UNLV","Utah",4,4,0,0,3,401001884,2017-11-23
189,2,"19:47",1187,1187,"Jordan Johnson made Jumper.",45,33,12,0.925306683029213,"UNLV","Utah",4,4,0,0,3,401001884,2017-11-23
190,2,"19:31",1171,1171,"Justin Bibbins missed Three Point Jumper.",45,33,12,0.92327210261266,"UNLV","Utah",4,4,0,0,3,401001884,2017-11-23
191,2,"19:31",1171,1171,"Brandon McCoy Defensive Rebound.",45,33,12,0.92327210261266,"UNLV","Utah",4,4,0,0,3,401001884,2017-11-23
192,2,"19:17",1157,1157,"Kris Clyburn missed Jumper.",45,33,12,0.92167108558776,"UNLV","Utah",4,4,0,0,3,401001884,2017-11-23
193,2,"19:17",1157,1157,"Brandon McCoy Offensive Rebound.",45,33,12,0.92167108558776,"UNLV","Utah",4,4,0,0,3,401001884,2017-11-23
194,2,"19:11",1151,1151,"Brandon McCoy missed Jumper.",45,33,12,0.92167108558776,"UNLV","Utah",4,4,0,0,3,401001884,2017-11-23
195,2,"19:11",1151,1151,"UNLV Offensive Rebound.",45,33,12,0.92167108558776,"UNLV","Utah",4,4,0,0,3,401001884,2017-11-23
196,2,"19:02",1142,1142,"Brandon McCoy made Dunk. Assisted by Jordan Johnson.",47,33,14,0.948667653743409,"UNLV","Utah",4,4,0,0,3,401001884,2017-11-23
197,2,"18:37",1117,1117,"David Collette missed Jumper.",47,33,14,0.95000608016882,"UNLV","Utah",4,4,0,0,3,401001884,2017-11-23
198,2,"18:37",1117,1117,"Kris Clyburn Defensive Rebound.",47,33,14,0.95000608016882,"UNLV","Utah",4,4,0,0,3,401001884,2017-11-23
199,2,"18:32",1112,1112,"Jovan Mooring missed Three Point Jumper.",47,33,14,0.95000608016882,"UNLV","Utah",4,4,0,0,3,401001884,2017-11-23
200,2,"18:32",1112,1112,"Donnie Tillman Defensive Rebound.",47,33,14,0.95000608016882,"UNLV","Utah",4,4,0,0,3,401001884,2017-11-23
201,2,"18:21",1101,1101,"Sedrick Barefield missed Jumper.",47,33,14,0.943801254972207,"UNLV","Utah",4,4,0,0,3,401001884,2017-11-23
202,2,"18:21",1101,1101,"Brandon McCoy Defensive Rebound.",47,33,14,0.943801254972207,"UNLV","Utah",4,4,0,0,3,401001884,2017-11-23
203,2,"18:05",1085,1085,"Jordan Johnson made Layup.",49,33,16,0.966142655428003,"UNLV","Utah",4,4,0,0,3,401001884,2017-11-23
