"play_id","half","time_remaining_half","secs_remaining","secs_remaining_absolute","description","home_score","away_score","score_diff","win_prob","home","away","home_time_out_remaining","away_time_out_remaining","home_timeout_ind","away_timeout_ind","home_favored_by","game_id","date"
1,1,"20:00",2400,2700,"PLAY",0,0,0,0.83028833064472,"Lehigh","Siena",4,4,0,0,7.8,400991066,2017-11-17
2,1,"19:42",2382,2682,"Khalil Richard made Jumper.",0,2,-2,0.816579606974386,"Lehigh","Siena",4,4,0,0,7.8,400991066,2017-11-17
3,1,"19:29",2369,2669,"Kyle Leufroy made Jumper. Assisted by Kahron Ross.",2,2,0,0.811066095697883,"Lehigh","Siena",4,4,0,0,7.8,400991066,2017-11-17
4,1,"19:10",2350,2650,"Nico Clareth made Jumper. Assisted by Kadeem Smithen.",2,4,-2,0.802226698227133,"Lehigh","Siena",4,4,0,0,7.8,400991066,2017-11-17
5,1,"18:48",2328,2628,"Lance Tejada Turnover.",2,4,-2,0.788495008106914,"Lehigh","Siena",4,4,0,0,7.8,400991066,2017-11-17
6,1,"18:37",2317,2617,"Nico Clareth made Three Point Jumper. Assisted by Khalil Richard.",2,7,-5,0.7162626550535,"Lehigh","Siena",4,4,0,0,7.8,400991066,2017-11-17
7,1,"18:18",2298,2598,"James Karnik missed Layup.",2,7,-5,0.735609136309287,"Lehigh","Siena",4,4,0,0,7.8,400991066,2017-11-17
8,1,"18:18",2298,2598,"Evan Fisher Defensive Rebound.",2,7,-5,0.735609136309287,"Lehigh","Siena",4,4,0,0,7.8,400991066,2017-11-17
9,1,"18:03",2283,2583,"Kadeem Smithen made Three Point Jumper. Assisted by Khalil Richard.",2,10,-8,0.651037023914948,"Lehigh","Siena",4,4,0,0,7.8,400991066,2017-11-17
10,1,"17:44",2264,2564,"Kyle Leufroy made Three Point Jumper. Assisted by Kahron Ross.",5,10,-5,0.714099906222227,"Lehigh","Siena",4,4,0,0,7.8,400991066,2017-11-17
11,1,"17:23",2243,2543,"Evan Fisher Turnover.",5,10,-5,0.720966967497352,"Lehigh","Siena",4,4,0,0,7.8,400991066,2017-11-17
12,1,"17:15",2235,2535,"Lance Tejada made Jumper.",7,10,-3,0.758177799338573,"Lehigh","Siena",4,4,0,0,7.8,400991066,2017-11-17
13,1,"17:04",2224,2524,"Kadeem Smithen Turnover.",7,10,-3,0.765507014873436,"Lehigh","Siena",4,4,0,0,7.8,400991066,2017-11-17
14,1,"17:04",2224,2524,"Foul on Kadeem Smithen.",7,10,-3,0.765507014873436,"Lehigh","Siena",4,4,0,0,7.8,400991066,2017-11-17
15,1,"16:58",2218,2518,"Lance Tejada made Jumper. Assisted by Kyle Leufroy.",9,10,-1,0.7901156708448,"Lehigh","Siena",4,4,0,0,7.8,400991066,2017-11-17
16,1,"16:44",2204,2504,"Khalil Richard Turnover.",9,10,-1,0.793976020257939,"Lehigh","Siena",4,4,0,0,7.8,400991066,2017-11-17
17,1,"16:43",2203,2503,"James Karnik Steal.",9,10,-1,0.793976020257939,"Lehigh","Siena",4,4,0,0,7.8,400991066,2017-11-17
18,1,"16:40",2200,2500,"Kahron Ross made Layup. Assisted by Lance Tejada.",11,10,1,0.828548366478326,"Lehigh","Siena",4,4,0,0,7.8,400991066,2017-11-17
19,1,"16:18",2178,2478,"Khalil Richard Turnover.",11,10,1,0.823427718462353,"Lehigh","Siena",4,4,0,0,7.8,400991066,2017-11-17
20,1,"16:05",2165,2465,"Kyle Leufroy made Layup.",13,10,3,0.853631461002317,"Lehigh","Siena",4,4,0,0,7.8,400991066,2017-11-17
21,1,"15:59",2159,2459,"Nico Clareth made Three Point Jumper. Assisted by Evan Fisher.",13,13,0,0.804916320392024,"Lehigh","Siena",4,4,0,0,7.8,400991066,2017-11-17
22,1,"15:43",2143,2443,"Foul on Evan Fisher.",13,13,0,0.814982821325811,"Lehigh","Siena",4,4,0,0,7.8,400991066,2017-11-17
23,1,"15:43",2143,2443,"Official TV Timeout",13,13,0,0.814982821325811,"Lehigh","Siena",4,4,0,0,7.8,400991066,2017-11-17
24,1,"15:43",2143,2443,"James Karnik made Free Throw.",14,13,1,0.829775562474209,"Lehigh","Siena",4,4,0,0,7.8,400991066,2017-11-17
25,1,"15:43",2143,2443,"James Karnik made Free Throw.",15,13,2,0.843612529061297,"Lehigh","Siena",4,4,0,0,7.8,400991066,2017-11-17
26,1,"15:31",2131,2431,"Thomas Huerter Jr. made Layup.",15,15,0,0.809011390781185,"Lehigh","Siena",4,4,0,0,7.8,400991066,2017-11-17
27,1,"15:31",2131,2431,"Foul on Lance Tejada.",15,15,0,0.809011390781185,"Lehigh","Siena",4,4,0,0,7.8,400991066,2017-11-17
28,1,"15:31",2131,2431,"Thomas Huerter Jr. missed Free Throw.",15,15,0,0.809011390781185,"Lehigh","Siena",4,4,0,0,7.8,400991066,2017-11-17
29,1,"15:31",2131,2431,"Roman Penn Offensive Rebound.",15,15,0,0.809011390781185,"Lehigh","Siena",4,4,0,0,7.8,400991066,2017-11-17
30,1,"15:31",2131,2431,"Ahsante Shivers missed Layup.",15,15,0,0.809011390781185,"Lehigh","Siena",4,4,0,0,7.8,400991066,2017-11-17
31,1,"15:31",2131,2431,"James Karnik Defensive Rebound.",15,15,0,0.809011390781185,"Lehigh","Siena",4,4,0,0,7.8,400991066,2017-11-17
32,1,"14:47",2087,2387,"Pat Andree missed Jumper.",15,15,0,0.80455036836031,"Lehigh","Siena",4,4,0,0,7.8,400991066,2017-11-17
33,1,"14:47",2087,2387,"Thomas Huerter Jr. Defensive Rebound.",15,15,0,0.80455036836031,"Lehigh","Siena",4,4,0,0,7.8,400991066,2017-11-17
34,1,"14:36",2076,2376,"Foul on James Karnik.",15,15,0,0.807971303934402,"Lehigh","Siena",4,4,0,0,7.8,400991066,2017-11-17
35,1,"14:36",2076,2376,"Prince Oduro made Free Throw.",15,16,-1,0.790799245062885,"Lehigh","Siena",4,4,0,0,7.8,400991066,2017-11-17
36,1,"14:36",2076,2376,"Prince Oduro missed Free Throw.",15,16,-1,0.790799245062885,"Lehigh","Siena",4,4,0,0,7.8,400991066,2017-11-17
37,1,"14:36",2076,2376,"Kyle Leufroy Defensive Rebound.",15,16,-1,0.790799245062885,"Lehigh","Siena",4,4,0,0,7.8,400991066,2017-11-17
38,1,"14:18",2058,2358,"Kyle Leufroy missed Three Point Jumper.",15,16,-1,0.793550750887997,"Lehigh","Siena",4,4,0,0,7.8,400991066,2017-11-17
39,1,"14:18",2058,2358,"Thomas Huerter Jr. Defensive Rebound.",15,16,-1,0.793550750887997,"Lehigh","Siena",4,4,0,0,7.8,400991066,2017-11-17
40,1,"14:06",2046,2346,"Roman Penn missed Three Point Jumper.",15,16,-1,0.77623324562468,"Lehigh","Siena",4,4,0,0,7.8,400991066,2017-11-17
41,1,"14:06",2046,2346,"Prince Oduro Offensive Rebound.",15,16,-1,0.77623324562468,"Lehigh","Siena",4,4,0,0,7.8,400991066,2017-11-17
42,1,"14:00",2040,2340,"Prince Oduro missed Layup.",15,16,-1,0.77623324562468,"Lehigh","Siena",4,4,0,0,7.8,400991066,2017-11-17
43,1,"14:00",2040,2340,"Siena Offensive Rebound.",15,16,-1,0.77623324562468,"Lehigh","Siena",4,4,0,0,7.8,400991066,2017-11-17
44,1,"13:51",2031,2331,"Nico Clareth made Three Point Jumper.",15,19,-4,0.743470734376604,"Lehigh","Siena",4,4,0,0,7.8,400991066,2017-11-17
45,1,"13:34",2014,2314,"Jordan Cohen Turnover.",15,19,-4,0.724140126747611,"Lehigh","Siena",4,4,0,0,7.8,400991066,2017-11-17
46,1,"13:20",2000,2300,"Ahsante Shivers made Layup.",15,21,-6,0.672229683467379,"Lehigh","Siena",4,4,1,0,7.8,400991066,2017-11-17
47,1,"13:20",2000,2300,"Lehigh  Timeout",15,21,-6,0.672229683467379,"Lehigh","Siena",3,4,1,0,7.8,400991066,2017-11-17
48,1,"13:02",1982,2282,"Ed Porter made Layup. Assisted by Kyle Leufroy.",17,21,-4,0.692614414286746,"Lehigh","Siena",3,4,1,0,7.8,400991066,2017-11-17
49,1,"12:47",1967,2267,"Thomas Huerter Jr. Turnover.",17,21,-4,0.726841151806041,"Lehigh","Siena",3,4,1,0,7.8,400991066,2017-11-17
50,1,"12:29",1949,2249,"Lance Tejada made Three Point Jumper. Assisted by Jordan Cohen.",20,21,-1,0.777328091894552,"Lehigh","Siena",3,4,1,0,7.8,400991066,2017-11-17
51,1,"11:57",1917,2217,"Ahsante Shivers missed Jumper.",20,21,-1,0.788450225935462,"Lehigh","Siena",3,4,0,0,7.8,400991066,2017-11-17
52,1,"11:57",1917,2217,"Ed Porter Defensive Rebound.",20,21,-1,0.788450225935462,"Lehigh","Siena",3,4,0,0,7.8,400991066,2017-11-17
53,1,"11:49",1909,2209,"Jordan Cohen made Layup. Assisted by Lance Tejada.",22,21,1,0.818913528281871,"Lehigh","Siena",3,4,0,0,7.8,400991066,2017-11-17
54,1,"11:19",1879,2179,"Khalil Richard made Jumper.",22,23,-1,0.773921675267991,"Lehigh","Siena",3,4,0,0,7.8,400991066,2017-11-17
55,1,"11:02",1862,2162,"Jordan Cohen made Three Point Jumper. Assisted by Kyle Leufroy.",25,23,2,0.836695890311221,"Lehigh","Siena",3,4,0,0,7.8,400991066,2017-11-17
56,1,"10:43",1843,2143,"Ahsante Shivers missed Three Point Jumper.",25,23,2,0.826432765982626,"Lehigh","Siena",3,4,0,0,7.8,400991066,2017-11-17
57,1,"10:43",1843,2143,"Lehigh Defensive Rebound.",25,23,2,0.826432765982626,"Lehigh","Siena",3,4,0,0,7.8,400991066,2017-11-17
58,1,"10:37",1837,2137,"Official TV Timeout",25,23,2,0.830736430265413,"Lehigh","Siena",3,4,0,0,7.8,400991066,2017-11-17
59,1,"10:26",1826,2126,"Caleb Bennett made Layup.",27,23,4,0.8743232590491,"Lehigh","Siena",3,4,0,0,7.8,400991066,2017-11-17
60,1,"9:58",1798,2098,"Foul on Ed Porter.",27,23,4,0.858748453963865,"Lehigh","Siena",3,4,0,0,7.8,400991066,2017-11-17
61,1,"9:58",1798,2098,"Evan Fisher missed Free Throw.",27,23,4,0.858748453963865,"Lehigh","Siena",3,4,0,0,7.8,400991066,2017-11-17
62,1,"9:58",1798,2098,"Siena Deadball Team Rebound.",27,23,4,0.858748453963865,"Lehigh","Siena",3,4,0,0,7.8,400991066,2017-11-17
63,1,"9:58",1798,2098,"Evan Fisher made Free Throw.",27,24,3,0.842223534742338,"Lehigh","Siena",3,4,0,0,7.8,400991066,2017-11-17
64,1,"9:39",1779,2079,"James Karnik missed Layup.",27,24,3,0.838634102482425,"Lehigh","Siena",3,4,0,0,7.8,400991066,2017-11-17
65,1,"9:39",1779,2079,"Kadeem Smithen Defensive Rebound.",27,24,3,0.838634102482425,"Lehigh","Siena",3,4,0,0,7.8,400991066,2017-11-17
66,1,"9:37",1777,2077,"Foul on James Karnik.",27,24,3,0.838634102482425,"Lehigh","Siena",3,4,0,0,7.8,400991066,2017-11-17
67,1,"9:19",1759,2059,"Nico Clareth missed Three Point Jumper.",27,24,3,0.847855031054944,"Lehigh","Siena",3,4,0,0,7.8,400991066,2017-11-17
68,1,"9:19",1759,2059,"Pat Andree Defensive Rebound.",27,24,3,0.847855031054944,"Lehigh","Siena",3,4,0,0,7.8,400991066,2017-11-17
69,1,"9:05",1745,2045,"Ed Porter Turnover.",27,24,3,0.844896248972375,"Lehigh","Siena",3,4,0,0,7.8,400991066,2017-11-17
70,1,"8:51",1731,2031,"Ahsante Shivers made Layup.",27,26,1,0.812537081554272,"Lehigh","Siena",3,4,0,0,7.8,400991066,2017-11-17
71,1,"8:51",1731,2031,"Foul on Marques Wilson.",27,26,1,0.812537081554272,"Lehigh","Siena",3,4,0,0,7.8,400991066,2017-11-17
72,1,"8:51",1731,2031,"Ahsante Shivers missed Free Throw.",27,26,1,0.812537081554272,"Lehigh","Siena",3,4,0,0,7.8,400991066,2017-11-17
73,1,"8:51",1731,2031,"Pat Andree Defensive Rebound.",27,26,1,0.812537081554272,"Lehigh","Siena",3,4,0,0,7.8,400991066,2017-11-17
74,1,"8:25",1705,2005,"Pat Andree missed Jumper.",27,26,1,0.803326128986449,"Lehigh","Siena",3,4,0,0,7.8,400991066,2017-11-17
75,1,"8:25",1705,2005,"Prince Oduro Block.",27,26,1,0.803326128986449,"Lehigh","Siena",3,4,0,0,7.8,400991066,2017-11-17
76,1,"8:25",1705,2005,"Lehigh Offensive Rebound.",27,26,1,0.803326128986449,"Lehigh","Siena",3,4,0,0,7.8,400991066,2017-11-17
77,1,"8:23",1703,2003,"Kyle Leufroy missed Three Point Jumper.",27,26,1,0.803326128986449,"Lehigh","Siena",3,4,0,0,7.8,400991066,2017-11-17
78,1,"8:23",1703,2003,"Ahsante Shivers Defensive Rebound.",27,26,1,0.803326128986449,"Lehigh","Siena",3,4,0,0,7.8,400991066,2017-11-17
79,1,"7:51",1671,1971,"Nico Clareth made Layup. Assisted by Kadeem Smithen.",27,28,-1,0.766788656808387,"Lehigh","Siena",3,4,0,0,7.8,400991066,2017-11-17
80,1,"7:44",1664,1964,"Caleb Bennett missed Three Point Jumper.",27,28,-1,0.764580043231917,"Lehigh","Siena",3,4,0,0,7.8,400991066,2017-11-17
81,1,"7:44",1664,1964,"Ahsante Shivers Defensive Rebound.",27,28,-1,0.764580043231917,"Lehigh","Siena",3,4,0,0,7.8,400991066,2017-11-17
82,1,"7:27",1647,1947,"Prince Oduro made Jumper.",27,30,-3,0.712981410080964,"Lehigh","Siena",3,4,0,0,7.8,400991066,2017-11-17
83,1,"7:27",1647,1947,"Foul on Caleb Bennett.",27,30,-3,0.712981410080964,"Lehigh","Siena",3,4,0,0,7.8,400991066,2017-11-17
84,1,"7:25",1645,1945,"Official TV Timeout",27,30,-3,0.712981410080964,"Lehigh","Siena",3,4,0,0,7.8,400991066,2017-11-17
85,1,"7:25",1645,1945,"Prince Oduro missed Free Throw.",27,30,-3,0.712981410080964,"Lehigh","Siena",3,4,0,0,7.8,400991066,2017-11-17
86,1,"7:25",1645,1945,"Caleb Bennett Defensive Rebound.",27,30,-3,0.712981410080964,"Lehigh","Siena",3,4,0,0,7.8,400991066,2017-11-17
87,1,"7:20",1640,1940,"Marques Wilson made Three Point Jumper. Assisted by Caleb Bennett.",30,30,0,0.790457164418391,"Lehigh","Siena",3,4,0,0,7.8,400991066,2017-11-17
88,1,"6:59",1619,1919,"Nico Clareth missed Three Point Jumper.",30,30,0,0.767396780314897,"Lehigh","Siena",3,4,0,0,7.8,400991066,2017-11-17
89,1,"6:59",1619,1919,"Caleb Bennett Defensive Rebound.",30,30,0,0.767396780314897,"Lehigh","Siena",3,4,0,0,7.8,400991066,2017-11-17
90,1,"6:43",1603,1903,"Kahron Ross missed Jumper.",30,30,0,0.785839208245413,"Lehigh","Siena",3,4,0,0,7.8,400991066,2017-11-17
91,1,"6:43",1603,1903,"Prince Oduro Defensive Rebound.",30,30,0,0.785839208245413,"Lehigh","Siena",3,4,0,0,7.8,400991066,2017-11-17
92,1,"6:03",1563,1863,"Siena  Turnover.",30,30,0,0.772489304101415,"Lehigh","Siena",3,4,0,0,7.8,400991066,2017-11-17
93,1,"5:42",1542,1842,"Ed Porter missed Jumper.",30,30,0,0.786429681486857,"Lehigh","Siena",3,4,0,0,7.8,400991066,2017-11-17
94,1,"5:42",1542,1842,"Caleb Bennett Offensive Rebound.",30,30,0,0.786429681486857,"Lehigh","Siena",3,4,0,0,7.8,400991066,2017-11-17
95,1,"5:34",1534,1834,"Ed Porter missed Layup.",30,30,0,0.78542553330552,"Lehigh","Siena",3,4,0,0,7.8,400991066,2017-11-17
96,1,"5:34",1534,1834,"Prince Oduro Defensive Rebound.",30,30,0,0.78542553330552,"Lehigh","Siena",3,4,0,0,7.8,400991066,2017-11-17
97,1,"5:24",1524,1824,"Prince Oduro made Jumper. Assisted by Nico Clareth.",30,32,-2,0.722895356471106,"Lehigh","Siena",3,4,0,0,7.8,400991066,2017-11-17
98,1,"5:09",1509,1809,"Marques Wilson missed Three Point Jumper.",30,32,-2,0.724805316977465,"Lehigh","Siena",3,4,0,0,7.8,400991066,2017-11-17
99,1,"5:09",1509,1809,"Lehigh Offensive Rebound.",30,32,-2,0.724805316977465,"Lehigh","Siena",3,4,0,0,7.8,400991066,2017-11-17
100,1,"4:54",1494,1794,"Caleb Bennett missed Layup.",30,32,-2,0.737510497631631,"Lehigh","Siena",3,4,0,0,7.8,400991066,2017-11-17
101,1,"4:54",1494,1794,"Prince Oduro Defensive Rebound.",30,32,-2,0.737510497631631,"Lehigh","Siena",3,4,0,0,7.8,400991066,2017-11-17
102,1,"4:47",1487,1787,"Jordan Horn missed Layup.",30,32,-2,0.714942581131988,"Lehigh","Siena",3,4,0,0,7.8,400991066,2017-11-17
103,1,"4:47",1487,1787,"Thomas Huerter Jr. Offensive Rebound.",30,32,-2,0.714942581131988,"Lehigh","Siena",3,4,0,0,7.8,400991066,2017-11-17
104,1,"4:45",1485,1785,"Thomas Huerter Jr. made Layup.",30,34,-4,0.650044614333924,"Lehigh","Siena",3,4,0,0,7.8,400991066,2017-11-17
105,1,"4:30",1470,1770,"Kahron Ross made Jumper.",32,34,-2,0.737776117555058,"Lehigh","Siena",3,4,0,0,7.8,400991066,2017-11-17
106,1,"4:30",1470,1770,"Foul on Roman Penn.",32,34,-2,0.737776117555058,"Lehigh","Siena",3,4,0,0,7.8,400991066,2017-11-17
107,1,"4:30",1470,1770,"Kahron Ross missed Free Throw.",32,34,-2,0.737776117555058,"Lehigh","Siena",3,4,0,0,7.8,400991066,2017-11-17
108,1,"4:30",1470,1770,"Kahron Ross Offensive Rebound.",32,34,-2,0.737776117555058,"Lehigh","Siena",3,4,0,0,7.8,400991066,2017-11-17
109,1,"4:27",1467,1767,"Lance Tejada made Three Point Jumper. Assisted by Kahron Ross.",35,34,1,0.789018964748434,"Lehigh","Siena",3,4,0,0,7.8,400991066,2017-11-17
110,1,"4:25",1465,1765,"Siena  Timeout",35,34,1,0.789018964748434,"Lehigh","Siena",3,3,0,1,7.8,400991066,2017-11-17
111,1,"4:25",1465,1765,"Official TV Timeout",35,34,1,0.789018964748434,"Lehigh","Siena",3,3,0,1,7.8,400991066,2017-11-17
112,1,"4:02",1442,1742,"Thomas Huerter Jr. missed Three Point Jumper.",35,34,1,0.81261705725797,"Lehigh","Siena",3,3,0,1,7.8,400991066,2017-11-17
113,1,"4:02",1442,1742,"Kadeem Smithen Offensive Rebound.",35,34,1,0.81261705725797,"Lehigh","Siena",3,3,0,1,7.8,400991066,2017-11-17
114,1,"3:44",1424,1724,"Khalil Richard missed Jumper.",35,34,1,0.785530611939855,"Lehigh","Siena",3,3,0,1,7.8,400991066,2017-11-17
115,1,"3:44",1424,1724,"Kyle Leufroy Defensive Rebound.",35,34,1,0.785530611939855,"Lehigh","Siena",3,3,0,1,7.8,400991066,2017-11-17
116,1,"3:33",1413,1713,"Pat Andree missed Layup.",35,34,1,0.78676132826661,"Lehigh","Siena",3,3,0,1,7.8,400991066,2017-11-17
117,1,"3:33",1413,1713,"Prince Oduro Block.",35,34,1,0.78676132826661,"Lehigh","Siena",3,3,0,1,7.8,400991066,2017-11-17
118,1,"3:32",1412,1712,"Kadeem Smithen Defensive Rebound.",35,34,1,0.78676132826661,"Lehigh","Siena",3,3,0,1,7.8,400991066,2017-11-17
119,1,"3:26",1406,1706,"Ahsante Shivers made Layup. Assisted by Kadeem Smithen.",35,36,-1,0.758322589464633,"Lehigh","Siena",3,3,0,1,7.8,400991066,2017-11-17
120,1,"2:59",1379,1679,"Pat Andree made Three Point Jumper. Assisted by Jordan Cohen.",38,36,2,0.812256891023201,"Lehigh","Siena",3,3,0,0,7.8,400991066,2017-11-17
121,1,"2:23",1343,1643,"Siena  Turnover.",38,36,2,0.80915332849943,"Lehigh","Siena",3,3,0,0,7.8,400991066,2017-11-17
122,1,"2:10",1330,1630,"Kyle Leufroy missed Three Point Jumper.",38,36,2,0.807681961680991,"Lehigh","Siena",3,3,0,0,7.8,400991066,2017-11-17
123,1,"2:10",1330,1630,"Jordan Cohen Offensive Rebound.",38,36,2,0.807681961680991,"Lehigh","Siena",3,3,0,0,7.8,400991066,2017-11-17
124,1,"2:00",1320,1620,"Caleb Bennett made Dunk. Assisted by Kyle Leufroy.",40,36,4,0.860684707827981,"Lehigh","Siena",3,3,0,0,7.8,400991066,2017-11-17
125,1,"1:38",1298,1598,"Nico Clareth made Three Point Jumper.",40,39,1,0.794528647517351,"Lehigh","Siena",3,3,0,0,7.8,400991066,2017-11-17
126,1,"1:31",1291,1591,"Lance Tejada missed Three Point Jumper.",40,39,1,0.794528647517351,"Lehigh","Siena",3,3,0,0,7.8,400991066,2017-11-17
127,1,"1:31",1291,1591,"Ahsante Shivers Defensive Rebound.",40,39,1,0.794528647517351,"Lehigh","Siena",3,3,0,0,7.8,400991066,2017-11-17
128,1,"1:18",1278,1578,"Foul on Pat Andree.",40,39,1,0.781592085459634,"Lehigh","Siena",3,3,0,0,7.8,400991066,2017-11-17
129,1,"1:18",1278,1578,"Prince Oduro missed Free Throw.",40,39,1,0.781592085459634,"Lehigh","Siena",3,3,0,0,7.8,400991066,2017-11-17
130,1,"1:18",1278,1578,"Siena Deadball Team Rebound.",40,39,1,0.781592085459634,"Lehigh","Siena",3,3,0,0,7.8,400991066,2017-11-17
131,1,"1:18",1278,1578,"Prince Oduro missed Free Throw.",40,39,1,0.781592085459634,"Lehigh","Siena",3,3,0,0,7.8,400991066,2017-11-17
132,1,"1:18",1278,1578,"Kyle Leufroy Defensive Rebound.",40,39,1,0.781592085459634,"Lehigh","Siena",3,3,0,0,7.8,400991066,2017-11-17
133,1,"1:13",1273,1573,"Pat Andree made Three Point Jumper. Assisted by Kahron Ross.",43,39,4,0.848705650123637,"Lehigh","Siena",3,3,0,0,7.8,400991066,2017-11-17
134,1,"0:47",1247,1547,"Khalil Richard missed Three Point Jumper.",43,39,4,0.859416988346226,"Lehigh","Siena",3,3,0,0,7.8,400991066,2017-11-17
135,1,"0:47",1247,1547,"Pat Andree Defensive Rebound.",43,39,4,0.859416988346226,"Lehigh","Siena",3,3,0,0,7.8,400991066,2017-11-17
136,1,"0:37",1237,1537,"Jordan Cohen Turnover.",43,39,4,0.851258312893088,"Lehigh","Siena",3,3,0,0,7.8,400991066,2017-11-17
137,1,"0:24",1224,1524,"Nico Clareth missed Jumper.",43,39,4,0.863621530304956,"Lehigh","Siena",3,3,0,0,7.8,400991066,2017-11-17
138,1,"0:24",1224,1524,"Lehigh Defensive Rebound.",43,39,4,0.863621530304956,"Lehigh","Siena",3,3,0,0,7.8,400991066,2017-11-17
139,1,"0:06",1206,1506,"Kyle Leufroy missed Three Point Jumper.",43,39,4,0.857260230085733,"Lehigh","Siena",3,3,0,0,7.8,400991066,2017-11-17
140,1,"0:06",1206,1506,"Kadeem Smithen Defensive Rebound.",43,39,4,0.857260230085733,"Lehigh","Siena",3,3,0,0,7.8,400991066,2017-11-17
141,1,"0:00",1200,1500,"End of 1st half",43,39,4,0.857260230085733,"Lehigh","Siena",3,3,0,0,7.8,400991066,2017-11-17
142,2,"20:00",1200,1500,"PLAY",43,39,4,0.857260230085733,"Lehigh","Siena",4,4,0,0,7.8,400991066,2017-11-17
143,2,"19:53",1193,1493,"Kadeem Smithen made Layup.",43,41,2,0.835217194691781,"Lehigh","Siena",4,4,0,0,7.8,400991066,2017-11-17
144,2,"19:46",1186,1486,"Pat Andree missed Three Point Jumper.",43,41,2,0.816294100803337,"Lehigh","Siena",4,4,0,0,7.8,400991066,2017-11-17
145,2,"19:46",1186,1486,"Nico Clareth Defensive Rebound.",43,41,2,0.816294100803337,"Lehigh","Siena",4,4,0,0,7.8,400991066,2017-11-17
146,2,"19:31",1171,1471,"Nico Clareth missed Jumper.",43,41,2,0.806529709221071,"Lehigh","Siena",4,4,0,0,7.8,400991066,2017-11-17
147,2,"19:31",1171,1471,"James Karnik Defensive Rebound.",43,41,2,0.806529709221071,"Lehigh","Siena",4,4,0,0,7.8,400991066,2017-11-17
148,2,"19:27",1167,1467,"Foul on Evan Fisher.",43,41,2,0.809377821601812,"Lehigh","Siena",4,4,0,0,7.8,400991066,2017-11-17
149,2,"18:57",1137,1437,"Pat Andree Turnover.",43,41,2,0.817843868417154,"Lehigh","Siena",4,4,0,0,7.8,400991066,2017-11-17
150,2,"18:56",1136,1436,"Khalil Richard Steal.",43,41,2,0.817843868417154,"Lehigh","Siena",4,4,0,0,7.8,400991066,2017-11-17
151,2,"18:52",1132,1432,"Khalil Richard made Layup. Assisted by Thomas Huerter Jr..",43,43,0,0.764269269109237,"Lehigh","Siena",4,4,0,0,7.8,400991066,2017-11-17
152,2,"18:32",1112,1412,"Lance Tejada made Three Point Jumper. Assisted by Kahron Ross.",46,43,3,0.832869826368069,"Lehigh","Siena",4,4,0,0,7.8,400991066,2017-11-17
153,2,"18:19",1099,1399,"Nico Clareth made Layup.",46,45,1,0.792722832340703,"Lehigh","Siena",4,4,0,0,7.8,400991066,2017-11-17
154,2,"18:06",1086,1386,"Foul on Evan Fisher.",46,45,1,0.790859794286233,"Lehigh","Siena",4,4,0,0,7.8,400991066,2017-11-17
155,2,"18:06",1086,1386,"Pat Andree made Free Throw.",47,45,2,0.81864059051407,"Lehigh","Siena",4,4,0,0,7.8,400991066,2017-11-17
156,2,"18:06",1086,1386,"Pat Andree made Free Throw.",48,45,3,0.843461591259151,"Lehigh","Siena",4,4,0,0,7.8,400991066,2017-11-17
157,2,"18:00",1080,1380,"Kadeem Smithen Turnover.",48,45,3,0.843461591259151,"Lehigh","Siena",4,4,0,0,7.8,400991066,2017-11-17
158,2,"17:59",1079,1379,"James Karnik Steal.",48,45,3,0.832132735416321,"Lehigh","Siena",4,4,0,0,7.8,400991066,2017-11-17
159,2,"17:44",1064,1364,"James Karnik missed Layup.",48,45,3,0.83530942706775,"Lehigh","Siena",4,4,0,0,7.8,400991066,2017-11-17
160,2,"17:44",1064,1364,"Roman Penn Defensive Rebound.",48,45,3,0.83530942706775,"Lehigh","Siena",4,4,0,0,7.8,400991066,2017-11-17
161,2,"17:27",1047,1347,"Thomas Huerter Jr. missed Jumper.",48,45,3,0.844385145351824,"Lehigh","Siena",4,4,0,0,7.8,400991066,2017-11-17
162,2,"17:27",1047,1347,"Pat Andree Defensive Rebound.",48,45,3,0.844385145351824,"Lehigh","Siena",4,4,0,0,7.8,400991066,2017-11-17
163,2,"17:20",1040,1340,"Lance Tejada made Three Point Jumper. Assisted by Kahron Ross.",51,45,6,0.90174740153874,"Lehigh","Siena",4,4,0,0,7.8,400991066,2017-11-17
164,2,"17:13",1033,1333,"Nico Clareth made Three Point Jumper. Assisted by Roman Penn.",51,48,3,0.832139212921921,"Lehigh","Siena",4,4,0,0,7.8,400991066,2017-11-17
165,2,"16:50",1010,1310,"Kyle Leufroy made Three Point Jumper. Assisted by Pat Andree.",54,48,6,0.886045987764362,"Lehigh","Siena",4,4,0,0,7.8,400991066,2017-11-17
166,2,"16:40",1000,1300,"Nico Clareth made Jumper. Assisted by Roman Penn.",54,50,4,0.849955489580254,"Lehigh","Siena",4,4,0,0,7.8,400991066,2017-11-17
167,2,"16:21",981,1281,"Kyle Leufroy Turnover.",54,50,4,0.864036308874726,"Lehigh","Siena",4,4,0,0,7.8,400991066,2017-11-17
168,2,"16:07",967,1267,"Nico Clareth missed Three Point Jumper.",54,50,4,0.847731051885144,"Lehigh","Siena",4,4,0,0,7.8,400991066,2017-11-17
169,2,"16:07",967,1267,"Lehigh Defensive Rebound.",54,50,4,0.847731051885144,"Lehigh","Siena",4,4,0,0,7.8,400991066,2017-11-17
170,2,"16:02",962,1262,"Foul on Roman Penn.",54,50,4,0.847731051885144,"Lehigh","Siena",4,4,0,0,7.8,400991066,2017-11-17
171,2,"15:47",947,1247,"Caleb Bennett missed Jumper.",54,50,4,0.871019719001032,"Lehigh","Siena",4,4,0,0,7.8,400991066,2017-11-17
172,2,"15:47",947,1247,"Thomas Huerter Jr. Defensive Rebound.",54,50,4,0.871019719001032,"Lehigh","Siena",4,4,0,0,7.8,400991066,2017-11-17
173,2,"15:21",921,1221,"Prince Oduro made Jumper. Assisted by Thomas Huerter Jr..",54,52,2,0.787652503015704,"Lehigh","Siena",4,4,0,0,7.8,400991066,2017-11-17
174,2,"15:09",909,1209,"Foul on Prince Oduro.",54,52,2,0.79948745062841,"Lehigh","Siena",4,4,0,0,7.8,400991066,2017-11-17
175,2,"15:09",909,1209,"Pat Andree missed Three Point Jumper.",54,52,2,0.79948745062841,"Lehigh","Siena",4,4,0,0,7.8,400991066,2017-11-17
176,2,"15:09",909,1209,"Nico Clareth Defensive Rebound.",54,52,2,0.79948745062841,"Lehigh","Siena",4,4,0,0,7.8,400991066,2017-11-17
177,2,"14:56",896,1196,"Nico Clareth made Three Point Jumper.",54,55,-1,0.701202410758097,"Lehigh","Siena",4,4,0,0,7.8,400991066,2017-11-17
178,2,"14:45",885,1185,"Foul on Nico Clareth.",54,55,-1,0.690922591034175,"Lehigh","Siena",4,4,0,0,7.8,400991066,2017-11-17
179,2,"14:45",885,1185,"Lance Tejada missed Free Throw.",54,55,-1,0.690922591034175,"Lehigh","Siena",4,4,0,0,7.8,400991066,2017-11-17
180,2,"14:45",885,1185,"Lehigh Deadball Team Rebound.",54,55,-1,0.690922591034175,"Lehigh","Siena",4,4,0,0,7.8,400991066,2017-11-17
181,2,"14:45",885,1185,"Lance Tejada made Free Throw.",55,55,0,0.726768862879351,"Lehigh","Siena",4,4,0,0,7.8,400991066,2017-11-17
182,2,"14:31",871,1171,"Jordan Horn missed Three Point Jumper.",55,55,0,0.739180430047185,"Lehigh","Siena",4,4,0,0,7.8,400991066,2017-11-17
183,2,"14:31",871,1171,"Caleb Bennett Defensive Rebound.",55,55,0,0.739180430047185,"Lehigh","Siena",4,4,0,0,7.8,400991066,2017-11-17
184,2,"14:21",861,1161,"Ed Porter missed Jumper.",55,55,0,0.729392235587428,"Lehigh","Siena",4,4,0,0,7.8,400991066,2017-11-17
185,2,"14:21",861,1161,"Siena Defensive Rebound.",55,55,0,0.729392235587428,"Lehigh","Siena",4,4,0,0,7.8,400991066,2017-11-17
186,2,"14:19",859,1159,"Foul on James Karnik.",55,55,0,0.741001919460877,"Lehigh","Siena",4,4,0,0,7.8,400991066,2017-11-17
187,2,"14:09",849,1149,"Foul on Kahron Ross.",55,55,0,0.72500526357499,"Lehigh","Siena",4,4,0,0,7.8,400991066,2017-11-17
188,2,"13:54",834,1134,"Ahsante Shivers made Layup.",55,57,-2,0.665253256549889,"Lehigh","Siena",4,4,0,0,7.8,400991066,2017-11-17
189,2,"13:33",813,1113,"Lance Tejada made Jumper.",57,57,0,0.732818226812068,"Lehigh","Siena",4,4,0,0,7.8,400991066,2017-11-17
190,2,"13:20",800,1100,"Foul on Ed Porter.",57,57,0,0.748183003253388,"Lehigh","Siena",4,4,0,0,7.8,400991066,2017-11-17
191,2,"13:01",781,1081,"Ahsante Shivers missed Jumper.",57,57,0,0.728249884507006,"Lehigh","Siena",4,4,0,0,7.8,400991066,2017-11-17
192,2,"13:01",781,1081,"Prince Oduro Offensive Rebound.",57,57,0,0.728249884507006,"Lehigh","Siena",4,4,0,0,7.8,400991066,2017-11-17
