"play_id","half","time_remaining_half","secs_remaining","secs_remaining_absolute","description","home_score","away_score","score_diff","win_prob","home","away","home_time_out_remaining","away_time_out_remaining","home_timeout_ind","away_timeout_ind","home_favored_by","game_id","date"
1,1,"20:00",2400,2400,"PLAY",0,0,0,0.925790915149174,"Oakland","Chicago State",4,4,0,0,22.6,400917473,2016-11-19
2,1,"19:45",2385,2385,"Stevie Clark missed Three Point Jumper.",0,0,0,0.922182615950636,"Oakland","Chicago State",4,4,0,0,22.6,400917473,2016-11-19
3,1,"19:45",2385,2385,"Glen Burns Defensive Rebound.",0,0,0,0.922182615950636,"Oakland","Chicago State",4,4,0,0,22.6,400917473,2016-11-19
4,1,"19:19",2359,2359,"Deionte Simmons missed Jumper.",0,0,0,0.921145529475653,"Oakland","Chicago State",4,4,0,0,22.6,400917473,2016-11-19
5,1,"19:19",2359,2359,"Brad Brechting Block.",0,0,0,0.921145529475653,"Oakland","Chicago State",4,4,0,0,22.6,400917473,2016-11-19
6,1,"19:16",2356,2356,"Sherron Dorsey-Walker Defensive Rebound.",0,0,0,0.921145529475653,"Oakland","Chicago State",4,4,0,0,22.6,400917473,2016-11-19
7,1,"19:10",2350,2350,"Martez Walker missed Three Point Jumper.",0,0,0,0.921145529475653,"Oakland","Chicago State",4,4,0,0,22.6,400917473,2016-11-19
8,1,"19:10",2350,2350,"Jalen Hayes Offensive Rebound.",0,0,0,0.921145529475653,"Oakland","Chicago State",4,4,0,0,22.6,400917473,2016-11-19
9,1,"19:02",2342,2342,"Martez Walker missed Layup.",0,0,0,0.91190606384157,"Oakland","Chicago State",4,4,0,0,22.6,400917473,2016-11-19
10,1,"19:02",2342,2342,"Brad Brechting Offensive Rebound.",0,0,0,0.91190606384157,"Oakland","Chicago State",4,4,0,0,22.6,400917473,2016-11-19
11,1,"18:57",2337,2337,"Brad Brechting made Layup.",2,0,2,0.929031828989418,"Oakland","Chicago State",4,4,0,0,22.6,400917473,2016-11-19
12,1,"18:41",2321,2321,"Fred Sims Jr. made Jumper. Assisted by Glen Burns.",2,2,0,0.915549822462717,"Oakland","Chicago State",4,4,0,0,22.6,400917473,2016-11-19
13,1,"18:39",2319,2319,"Foul on Brad Brechting.",2,2,0,0.905340557460816,"Oakland","Chicago State",4,4,0,0,22.6,400917473,2016-11-19
14,1,"18:39",2319,2319,"Brad Brechting Turnover.",2,2,0,0.905340557460816,"Oakland","Chicago State",4,4,0,0,22.6,400917473,2016-11-19
15,1,"18:39",2319,2319,"Deionte Simmons missed Layup.",2,2,0,0.905340557460816,"Oakland","Chicago State",4,4,0,0,22.6,400917473,2016-11-19
16,1,"18:39",2319,2319,"Xavier Hill-Mais Block.",2,2,0,0.905340557460816,"Oakland","Chicago State",4,4,0,0,22.6,400917473,2016-11-19
17,1,"18:39",2319,2319,"Stevie Clark Defensive Rebound.",2,2,0,0.905340557460816,"Oakland","Chicago State",4,4,0,0,22.6,400917473,2016-11-19
18,1,"18:27",2307,2307,"Sherron Dorsey-Walker made Layup. Assisted by Stevie Clark.",4,2,2,0.922542964550503,"Oakland","Chicago State",4,4,0,0,22.6,400917473,2016-11-19
19,1,"18:17",2297,2297,"Fred Sims Jr. made Three Point Jumper. Assisted by Clemmye Owens V.",4,5,-1,0.906910118035113,"Oakland","Chicago State",4,4,0,0,22.6,400917473,2016-11-19
20,1,"18:09",2289,2289,"Jalen Hayes made Dunk. Assisted by Sherron Dorsey-Walker.",6,5,1,0.919034382621431,"Oakland","Chicago State",4,4,0,0,22.6,400917473,2016-11-19
21,1,"17:55",2275,2275,"Clemmye Owens V Turnover.",6,5,1,0.921283710904486,"Oakland","Chicago State",4,4,0,0,22.6,400917473,2016-11-19
22,1,"17:43",2263,2263,"Sherron Dorsey-Walker missed Three Point Jumper.",6,5,1,0.926614009209897,"Oakland","Chicago State",4,4,0,0,22.6,400917473,2016-11-19
23,1,"17:43",2263,2263,"Trayvon Palmer Defensive Rebound.",6,5,1,0.926614009209897,"Oakland","Chicago State",4,4,0,0,22.6,400917473,2016-11-19
24,1,"17:37",2257,2257,"Fred Sims Jr. made Jumper.",6,7,-1,0.898667359349382,"Oakland","Chicago State",4,4,0,0,22.6,400917473,2016-11-19
25,1,"17:27",2247,2247,"Martez Walker missed Three Point Jumper.",6,7,-1,0.892355631823625,"Oakland","Chicago State",4,4,0,0,22.6,400917473,2016-11-19
26,1,"17:27",2247,2247,"Glen Burns Defensive Rebound.",6,7,-1,0.892355631823625,"Oakland","Chicago State",4,4,0,0,22.6,400917473,2016-11-19
27,1,"17:10",2230,2230,"Foul on Sherron Dorsey-Walker.",6,7,-1,0.901905572717063,"Oakland","Chicago State",4,4,0,0,22.6,400917473,2016-11-19
28,1,"17:08",2228,2228,"Trayvon Palmer missed Jumper.",6,7,-1,0.904102572538251,"Oakland","Chicago State",4,4,0,0,22.6,400917473,2016-11-19
29,1,"17:08",2228,2228,"Jalen Hayes Defensive Rebound.",6,7,-1,0.904102572538251,"Oakland","Chicago State",4,4,0,0,22.6,400917473,2016-11-19
30,1,"16:52",2212,2212,"Stevie Clark missed Three Point Jumper.",6,7,-1,0.894736352894903,"Oakland","Chicago State",4,4,0,0,22.6,400917473,2016-11-19
31,1,"16:52",2212,2212,"Glen Burns Defensive Rebound.",6,7,-1,0.894736352894903,"Oakland","Chicago State",4,4,0,0,22.6,400917473,2016-11-19
32,1,"16:45",2205,2205,"Clemmye Owens V made Layup. Assisted by Fred Sims Jr..",6,9,-3,0.876519365049623,"Oakland","Chicago State",4,4,0,0,22.6,400917473,2016-11-19
33,1,"16:38",2198,2198,"Martez Walker made Layup. Assisted by Stevie Clark.",8,9,-1,0.90559331023557,"Oakland","Chicago State",4,4,0,0,22.6,400917473,2016-11-19
34,1,"16:32",2192,2192,"Foul on Stevie Clark.",8,9,-1,0.90559331023557,"Oakland","Chicago State",4,4,0,0,22.6,400917473,2016-11-19
35,1,"16:32",2192,2192,"Glen Burns missed Free Throw.",8,9,-1,0.90559331023557,"Oakland","Chicago State",4,4,0,0,22.6,400917473,2016-11-19
36,1,"16:32",2192,2192,"Chicago St Deadball Team Rebound.",8,9,-1,0.90559331023557,"Oakland","Chicago State",4,4,0,0,22.6,400917473,2016-11-19
37,1,"16:32",2192,2192,"Glen Burns missed Free Throw.",8,9,-1,0.90559331023557,"Oakland","Chicago State",4,4,0,0,22.6,400917473,2016-11-19
38,1,"16:32",2192,2192,"Jalen Hayes Defensive Rebound.",8,9,-1,0.90559331023557,"Oakland","Chicago State",4,4,0,0,22.6,400917473,2016-11-19
39,1,"16:24",2184,2184,"Foul on Trayvon Palmer.",8,9,-1,0.89938416782775,"Oakland","Chicago State",4,4,0,0,22.6,400917473,2016-11-19
40,1,"16:24",2184,2184,"Martez Walker missed Free Throw.",8,9,-1,0.89938416782775,"Oakland","Chicago State",4,4,0,0,22.6,400917473,2016-11-19
41,1,"16:24",2184,2184,"Oakland Deadball Team Rebound.",8,9,-1,0.89938416782775,"Oakland","Chicago State",4,4,0,0,22.6,400917473,2016-11-19
42,1,"16:24",2184,2184,"Martez Walker made Free Throw.",9,9,0,0.908788377066139,"Oakland","Chicago State",4,4,0,0,22.6,400917473,2016-11-19
43,1,"16:09",2169,2169,"Fred Sims Jr. missed Jumper.",9,9,0,0.905556894849357,"Oakland","Chicago State",4,4,0,0,22.6,400917473,2016-11-19
44,1,"16:09",2169,2169,"Martez Walker Defensive Rebound.",9,9,0,0.905556894849357,"Oakland","Chicago State",4,4,0,0,22.6,400917473,2016-11-19
45,1,"16:01",2161,2161,"Martez Walker Turnover.",9,9,0,0.905556894849357,"Oakland","Chicago State",4,4,0,0,22.6,400917473,2016-11-19
46,1,"15:59",2159,2159,"Fred Sims Jr. Steal.",9,9,0,0.905863605875478,"Oakland","Chicago State",4,4,0,0,22.6,400917473,2016-11-19
47,1,"15:57",2157,2157,"Deionte Simmons made Layup. Assisted by Fred Sims Jr..",9,11,-2,0.883416128665275,"Oakland","Chicago State",4,4,0,0,22.6,400917473,2016-11-19
48,1,"15:42",2142,2142,"Stevie Clark made Three Point Jumper. Assisted by Sherron Dorsey-Walker.",12,11,1,0.918702749019466,"Oakland","Chicago State",4,4,0,0,22.6,400917473,2016-11-19
49,1,"15:40",2140,2140,"Foul on Xavier Hill-Mais.",12,11,1,0.918702749019466,"Oakland","Chicago State",4,4,0,0,22.6,400917473,2016-11-19
50,1,"15:40",2140,2140,"Official TV Timeout",12,11,1,0.918702749019466,"Oakland","Chicago State",4,4,0,0,22.6,400917473,2016-11-19
51,1,"15:28",2128,2128,"Foul on Deionte Simmons.",12,11,1,0.914625385309124,"Oakland","Chicago State",4,4,0,0,22.6,400917473,2016-11-19
52,1,"15:28",2128,2128,"Deionte Simmons Turnover.",12,11,1,0.914625385309124,"Oakland","Chicago State",4,4,0,0,22.6,400917473,2016-11-19
53,1,"15:13",2113,2113,"Brailen Neely made Three Point Jumper. Assisted by Nick Daniels.",15,11,4,0.944530955915364,"Oakland","Chicago State",4,4,0,0,22.6,400917473,2016-11-19
54,1,"14:41",2081,2081,"Trayvon Palmer missed Three Point Jumper.",15,11,4,0.934384863983872,"Oakland","Chicago State",4,4,0,0,22.6,400917473,2016-11-19
55,1,"14:41",2081,2081,"Brailen Neely Defensive Rebound.",15,11,4,0.934384863983872,"Oakland","Chicago State",4,4,0,0,22.6,400917473,2016-11-19
56,1,"14:13",2053,2053,"Sherron Dorsey-Walker missed Layup.",15,11,4,0.943459876912496,"Oakland","Chicago State",4,4,0,0,22.6,400917473,2016-11-19
57,1,"14:13",2053,2053,"Oakland Offensive Rebound.",15,11,4,0.943459876912496,"Oakland","Chicago State",4,4,0,0,22.6,400917473,2016-11-19
58,1,"14:11",2051,2051,"Oakland  Timeout",15,11,4,0.943459876912496,"Oakland","Chicago State",3,4,1,0,22.6,400917473,2016-11-19
59,1,"14:10",2050,2050,"Sherron Dorsey-Walker missed Three Point Jumper.",15,11,4,0.943459876912496,"Oakland","Chicago State",3,4,1,0,22.6,400917473,2016-11-19
60,1,"14:10",2050,2050,"Deionte Simmons Defensive Rebound.",15,11,4,0.943459876912496,"Oakland","Chicago State",3,4,1,0,22.6,400917473,2016-11-19
61,1,"13:59",2039,2039,"Deionte Simmons missed Jumper.",15,11,4,0.943520889560233,"Oakland","Chicago State",3,4,1,0,22.6,400917473,2016-11-19
62,1,"13:59",2039,2039,"Jalen Hayes Defensive Rebound.",15,11,4,0.943520889560233,"Oakland","Chicago State",3,4,1,0,22.6,400917473,2016-11-19
63,1,"13:41",2021,2021,"Jalen Hayes missed Jumper.",15,11,4,0.940842515964649,"Oakland","Chicago State",3,4,1,0,22.6,400917473,2016-11-19
64,1,"13:41",2021,2021,"Clemmye Owens V Defensive Rebound.",15,11,4,0.940842515964649,"Oakland","Chicago State",3,4,1,0,22.6,400917473,2016-11-19
65,1,"13:19",1999,1999,"Clemmye Owens V missed Three Point Jumper.",15,11,4,0.940570265219503,"Oakland","Chicago State",3,4,1,0,22.6,400917473,2016-11-19
66,1,"13:19",1999,1999,"Sherron Dorsey-Walker Block.",15,11,4,0.940570265219503,"Oakland","Chicago State",3,4,1,0,22.6,400917473,2016-11-19
67,1,"13:16",1996,1996,"Xavier Hill-Mais Defensive Rebound.",15,11,4,0.940570265219503,"Oakland","Chicago State",3,4,1,0,22.6,400917473,2016-11-19
68,1,"13:08",1988,1988,"Jalen Hayes made Dunk. Assisted by Xavier Hill-Mais.",17,11,6,0.944977840888873,"Oakland","Chicago State",3,4,0,0,22.6,400917473,2016-11-19
69,1,"12:41",1961,1961,"Glen Burns missed Three Point Jumper.",17,11,6,0.945827979774535,"Oakland","Chicago State",3,4,0,0,22.6,400917473,2016-11-19
70,1,"12:41",1961,1961,"Jalen Hayes Defensive Rebound.",17,11,6,0.945827979774535,"Oakland","Chicago State",3,4,0,0,22.6,400917473,2016-11-19
71,1,"12:33",1953,1953,"Stevie Clark missed Three Point Jumper.",17,11,6,0.948776882444446,"Oakland","Chicago State",3,4,0,0,22.6,400917473,2016-11-19
72,1,"12:33",1953,1953,"Chicago St Defensive Rebound.",17,11,6,0.948776882444446,"Oakland","Chicago State",3,4,0,0,22.6,400917473,2016-11-19
73,1,"12:18",1938,1938,"Fred Sims Jr. made Jumper.",17,13,4,0.933360708280716,"Oakland","Chicago State",3,4,0,0,22.6,400917473,2016-11-19
74,1,"12:14",1934,1934,"Foul on Fred Sims Jr..",17,13,4,0.933360708280716,"Oakland","Chicago State",3,4,0,0,22.6,400917473,2016-11-19
75,1,"12:00",1920,1920,"Martez Walker missed Layup.",17,13,4,0.940959226790807,"Oakland","Chicago State",3,4,0,0,22.6,400917473,2016-11-19
76,1,"12:00",1920,1920,"Glen Burns Defensive Rebound.",17,13,4,0.940959226790807,"Oakland","Chicago State",3,4,0,0,22.6,400917473,2016-11-19
77,1,"11:31",1891,1891,"Trayvon Palmer missed Three Point Jumper.",17,13,4,0.935497820178206,"Oakland","Chicago State",3,4,0,0,22.6,400917473,2016-11-19
78,1,"11:31",1891,1891,"Stevie Clark Defensive Rebound.",17,13,4,0.935497820178206,"Oakland","Chicago State",3,4,0,0,22.6,400917473,2016-11-19
79,1,"11:25",1885,1885,"Martez Walker made Dunk. Assisted by Stevie Clark.",19,13,6,0.949923891016055,"Oakland","Chicago State",3,4,0,0,22.6,400917473,2016-11-19
80,1,"11:22",1882,1882,"Chicago St  Timeout",19,13,6,0.949923891016055,"Oakland","Chicago State",3,3,0,1,22.6,400917473,2016-11-19
81,1,"11:10",1870,1870,"Brian Greene Jr. missed Jumper.",19,13,6,0.947552764697519,"Oakland","Chicago State",3,3,0,1,22.6,400917473,2016-11-19
82,1,"11:10",1870,1870,"Stevie Clark Defensive Rebound.",19,13,6,0.947552764697519,"Oakland","Chicago State",3,3,0,1,22.6,400917473,2016-11-19
83,1,"10:59",1859,1859,"Xavier Hill-Mais Turnover.",19,13,6,0.948345245829034,"Oakland","Chicago State",3,3,0,1,22.6,400917473,2016-11-19
84,1,"10:49",1849,1849,"Glen Burns missed Jumper.",19,13,6,0.946249171500993,"Oakland","Chicago State",3,3,0,1,22.6,400917473,2016-11-19
85,1,"10:49",1849,1849,"Stevie Clark Defensive Rebound.",19,13,6,0.946249171500993,"Oakland","Chicago State",3,3,0,1,22.6,400917473,2016-11-19
86,1,"10:44",1844,1844,"Foul on Trayvon Palmer.",19,13,6,0.946249171500993,"Oakland","Chicago State",3,3,0,1,22.6,400917473,2016-11-19
87,1,"10:44",1844,1844,"Nick Daniels made Free Throw.",20,13,7,0.952211576996859,"Oakland","Chicago State",3,3,0,1,22.6,400917473,2016-11-19
88,1,"10:44",1844,1844,"Nick Daniels made Free Throw.",21,13,8,0.957542268399695,"Oakland","Chicago State",3,3,0,1,22.6,400917473,2016-11-19
89,1,"10:24",1824,1824,"Foul on Stevie Clark.",21,13,8,0.961772124356208,"Oakland","Chicago State",3,3,0,1,22.6,400917473,2016-11-19
90,1,"10:24",1824,1824,"Patrick Szpir made Free Throw.",21,14,7,0.957092734322438,"Oakland","Chicago State",3,3,0,1,22.6,400917473,2016-11-19
91,1,"10:24",1824,1824,"Patrick Szpir missed Free Throw.",21,14,7,0.957092734322438,"Oakland","Chicago State",3,3,0,1,22.6,400917473,2016-11-19
92,1,"10:24",1824,1824,"Oakland Defensive Rebound.",21,14,7,0.957092734322438,"Oakland","Chicago State",3,3,0,1,22.6,400917473,2016-11-19
93,1,"10:22",1822,1822,"Stevie Clark Turnover.",21,14,7,0.957092734322438,"Oakland","Chicago State",3,3,0,1,22.6,400917473,2016-11-19
94,1,"10:20",1820,1820,"Joshua Batson Steal.",21,14,7,0.957092734322438,"Oakland","Chicago State",3,3,0,0,22.6,400917473,2016-11-19
95,1,"10:13",1813,1813,"Delundre Dixon made Layup.",21,16,5,0.944421357024668,"Oakland","Chicago State",3,3,0,0,22.6,400917473,2016-11-19
96,1,"9:58",1798,1798,"Foul on Patrick Szpir.",21,16,5,0.936906943854556,"Oakland","Chicago State",3,3,0,0,22.6,400917473,2016-11-19
97,1,"9:40",1780,1780,"Foul on Delundre Dixon.",21,16,5,0.934474878285921,"Oakland","Chicago State",3,3,0,0,22.6,400917473,2016-11-19
98,1,"9:40",1780,1780,"Jalen Hayes made Free Throw.",22,16,6,0.942450837953617,"Oakland","Chicago State",3,3,0,0,22.6,400917473,2016-11-19
99,1,"9:40",1780,1780,"Jalen Hayes missed Free Throw.",22,16,6,0.942450837953617,"Oakland","Chicago State",3,3,0,0,22.6,400917473,2016-11-19
100,1,"9:40",1780,1780,"Patrick Szpir Defensive Rebound.",22,16,6,0.942450837953617,"Oakland","Chicago State",3,3,0,0,22.6,400917473,2016-11-19
101,1,"9:20",1760,1760,"Foul on Clemmye Owens V.",22,16,6,0.952285138419195,"Oakland","Chicago State",3,3,0,0,22.6,400917473,2016-11-19
102,1,"9:20",1760,1760,"Clemmye Owens V Turnover.",22,16,6,0.952285138419195,"Oakland","Chicago State",3,3,0,0,22.6,400917473,2016-11-19
103,1,"9:13",1753,1753,"Martez Walker missed Three Point Jumper.",22,16,6,0.951044099241537,"Oakland","Chicago State",3,3,0,0,22.6,400917473,2016-11-19
104,1,"9:13",1753,1753,"Patrick Szpir Defensive Rebound.",22,16,6,0.951044099241537,"Oakland","Chicago State",3,3,0,0,22.6,400917473,2016-11-19
105,1,"8:59",1739,1739,"Clemmye Owens V made Layup.",22,18,4,0.934128521531607,"Oakland","Chicago State",3,3,0,0,22.6,400917473,2016-11-19
106,1,"8:50",1730,1730,"Foul on Brian Greene Jr..",22,18,4,0.934128521531607,"Oakland","Chicago State",3,3,0,0,22.6,400917473,2016-11-19
107,1,"8:50",1730,1730,"Stevie Clark made Free Throw.",23,18,5,0.942064284949975,"Oakland","Chicago State",3,3,0,0,22.6,400917473,2016-11-19
108,1,"8:50",1730,1730,"Stevie Clark made Free Throw.",24,18,6,0.949096098081445,"Oakland","Chicago State",3,3,0,0,22.6,400917473,2016-11-19
109,1,"8:34",1714,1714,"Clemmye Owens V missed Three Point Jumper.",24,18,6,0.951823497834023,"Oakland","Chicago State",3,3,0,0,22.6,400917473,2016-11-19
110,1,"8:34",1714,1714,"Jalen Hayes Defensive Rebound.",24,18,6,0.951823497834023,"Oakland","Chicago State",3,3,0,0,22.6,400917473,2016-11-19
111,1,"8:24",1704,1704,"Martez Walker made Three Point Jumper. Assisted by Sherron Dorsey-Walker.",27,18,9,0.960810467017187,"Oakland","Chicago State",3,3,0,0,22.6,400917473,2016-11-19
112,1,"8:05",1685,1685,"Clemmye Owens V Turnover.",27,18,9,0.969970746377029,"Oakland","Chicago State",3,3,0,0,22.6,400917473,2016-11-19
113,1,"8:03",1683,1683,"Chris Palombizio Steal.",27,18,9,0.969970746377029,"Oakland","Chicago State",3,3,0,0,22.6,400917473,2016-11-19
114,1,"8:01",1681,1681,"Martez Walker Turnover.",27,18,9,0.969970746377029,"Oakland","Chicago State",3,3,0,0,22.6,400917473,2016-11-19
115,1,"7:38",1658,1658,"Brian Greene Jr. made Three Point Jumper. Assisted by Patrick Szpir.",27,21,6,0.94343985154664,"Oakland","Chicago State",3,3,0,0,22.6,400917473,2016-11-19
116,1,"7:11",1631,1631,"Chris Palombizio made Three Point Jumper. Assisted by Jalen Hayes.",30,21,9,0.962119137261816,"Oakland","Chicago State",3,3,0,0,22.6,400917473,2016-11-19
117,1,"7:00",1620,1620,"Delundre Dixon made Three Point Jumper. Assisted by Patrick Szpir.",30,24,6,0.947305450770183,"Oakland","Chicago State",3,3,0,0,22.6,400917473,2016-11-19
118,1,"6:49",1609,1609,"Chris Palombizio missed Three Point Jumper.",30,24,6,0.946191102071849,"Oakland","Chicago State",3,3,0,0,22.6,400917473,2016-11-19
119,1,"6:49",1609,1609,"Brian Greene Jr. Defensive Rebound.",30,24,6,0.946191102071849,"Oakland","Chicago State",3,3,0,0,22.6,400917473,2016-11-19
120,1,"6:39",1599,1599,"Joshua Batson missed Three Point Jumper.",30,24,6,0.942679946745095,"Oakland","Chicago State",3,3,0,0,22.6,400917473,2016-11-19
121,1,"6:39",1599,1599,"Sherron Dorsey-Walker Defensive Rebound.",30,24,6,0.942679946745095,"Oakland","Chicago State",3,3,0,0,22.6,400917473,2016-11-19
122,1,"6:32",1592,1592,"Foul on Joshua Batson.",30,24,6,0.942679946745095,"Oakland","Chicago State",3,3,0,0,22.6,400917473,2016-11-19
123,1,"6:32",1592,1592,"Official TV Timeout",30,24,6,0.942679946745095,"Oakland","Chicago State",3,3,0,0,22.6,400917473,2016-11-19
124,1,"6:32",1592,1592,"Sherron Dorsey-Walker made Free Throw.",31,24,7,0.949555571242453,"Oakland","Chicago State",3,3,0,0,22.6,400917473,2016-11-19
125,1,"6:32",1592,1592,"Sherron Dorsey-Walker made Free Throw.",32,24,8,0.95564526001025,"Oakland","Chicago State",3,3,0,0,22.6,400917473,2016-11-19
126,1,"6:16",1576,1576,"Brian Greene Jr. missed Layup.",32,24,8,0.963855211853081,"Oakland","Chicago State",3,3,0,0,22.6,400917473,2016-11-19
127,1,"6:16",1576,1576,"Jalen Hayes Defensive Rebound.",32,24,8,0.963855211853081,"Oakland","Chicago State",3,3,0,0,22.6,400917473,2016-11-19
128,1,"6:03",1563,1563,"Chris Palombizio missed Three Point Jumper.",32,24,8,0.957021557071858,"Oakland","Chicago State",3,3,0,0,22.6,400917473,2016-11-19
129,1,"6:03",1563,1563,"Martez Walker Offensive Rebound.",32,24,8,0.957021557071858,"Oakland","Chicago State",3,3,0,0,22.6,400917473,2016-11-19
130,1,"5:58",1558,1558,"Martez Walker missed Layup.",32,24,8,0.955837783130979,"Oakland","Chicago State",3,3,0,0,22.6,400917473,2016-11-19
131,1,"5:58",1558,1558,"Patrick Szpir Defensive Rebound.",32,24,8,0.955837783130979,"Oakland","Chicago State",3,3,0,0,22.6,400917473,2016-11-19
132,1,"5:53",1553,1553,"Fred Sims Jr. made Jumper.",32,26,6,0.942000441839893,"Oakland","Chicago State",3,3,0,0,22.6,400917473,2016-11-19
133,1,"5:35",1535,1535,"Sherron Dorsey-Walker missed Three Point Jumper.",32,26,6,0.946955520202674,"Oakland","Chicago State",3,3,0,0,22.6,400917473,2016-11-19
134,1,"5:35",1535,1535,"Chris Palombizio Offensive Rebound.",32,26,6,0.946955520202674,"Oakland","Chicago State",3,3,0,0,22.6,400917473,2016-11-19
135,1,"5:30",1530,1530,"Chris Palombizio missed Jumper.",32,26,6,0.946955520202674,"Oakland","Chicago State",3,3,0,0,22.6,400917473,2016-11-19
136,1,"5:30",1530,1530,"Brian Greene Jr. Block.",32,26,6,0.946955520202674,"Oakland","Chicago State",3,3,0,0,22.6,400917473,2016-11-19
137,1,"5:27",1527,1527,"Brian Greene Jr. Defensive Rebound.",32,26,6,0.943477152782713,"Oakland","Chicago State",3,3,0,0,22.6,400917473,2016-11-19
138,1,"5:21",1521,1521,"Fred Sims Jr. missed Three Point Jumper.",32,26,6,0.943477152782713,"Oakland","Chicago State",3,3,0,0,22.6,400917473,2016-11-19
139,1,"5:21",1521,1521,"Chris Palombizio Defensive Rebound.",32,26,6,0.943477152782713,"Oakland","Chicago State",3,3,0,0,22.6,400917473,2016-11-19
140,1,"5:09",1509,1509,"Chris Palombizio made Jumper. Assisted by Xavier Hill-Mais.",34,26,8,0.957841712416678,"Oakland","Chicago State",3,3,0,0,22.6,400917473,2016-11-19
141,1,"4:49",1489,1489,"Delundre Dixon missed Three Point Jumper.",34,26,8,0.959006176688875,"Oakland","Chicago State",3,3,0,0,22.6,400917473,2016-11-19
142,1,"4:49",1489,1489,"Chris Palombizio Defensive Rebound.",34,26,8,0.959006176688875,"Oakland","Chicago State",3,3,0,0,22.6,400917473,2016-11-19
143,1,"4:38",1478,1478,"Martez Walker made Three Point Jumper. Assisted by Chris Palombizio.",37,26,11,0.978418167925634,"Oakland","Chicago State",3,3,0,0,22.6,400917473,2016-11-19
144,1,"4:23",1463,1463,"Foul on Sherron Dorsey-Walker.",37,26,11,0.966296966922412,"Oakland","Chicago State",3,3,0,0,22.6,400917473,2016-11-19
145,1,"4:09",1449,1449,"Patrick Szpir Turnover.",37,26,11,0.975708648963086,"Oakland","Chicago State",3,3,0,0,22.6,400917473,2016-11-19
146,1,"4:08",1448,1448,"Jalen Hayes Steal.",37,26,11,0.975708648963086,"Oakland","Chicago State",3,3,0,0,22.6,400917473,2016-11-19
147,1,"4:03",1443,1443,"Nick Daniels missed Three Point Jumper.",37,26,11,0.975708648963086,"Oakland","Chicago State",3,3,0,0,22.6,400917473,2016-11-19
148,1,"4:03",1443,1443,"Xavier Hill-Mais Offensive Rebound.",37,26,11,0.975708648963086,"Oakland","Chicago State",3,3,0,0,22.6,400917473,2016-11-19
149,1,"3:58",1438,1438,"Xavier Hill-Mais made Layup.",39,26,13,0.978730218142782,"Oakland","Chicago State",3,3,0,0,22.6,400917473,2016-11-19
150,1,"3:31",1411,1411,"Glen Burns Turnover.",39,26,13,0.978892295395237,"Oakland","Chicago State",3,3,0,0,22.6,400917473,2016-11-19
151,1,"3:31",1411,1411,"Official TV Timeout",39,26,13,0.978892295395237,"Oakland","Chicago State",3,3,0,0,22.6,400917473,2016-11-19
152,1,"3:30",1410,1410,"Foul on Glen Burns.",39,26,13,0.978892295395237,"Oakland","Chicago State",3,3,0,0,22.6,400917473,2016-11-19
153,1,"3:30",1410,1410,"Brailen Neely made Free Throw.",40,26,14,0.981869450857609,"Oakland","Chicago State",3,3,0,0,22.6,400917473,2016-11-19
154,1,"3:30",1410,1410,"Brailen Neely made Free Throw.",41,26,15,0.984433368331221,"Oakland","Chicago State",3,3,0,0,22.6,400917473,2016-11-19
155,1,"3:14",1394,1394,"Brian Greene Jr. missed Layup.",41,26,15,0.987207497012736,"Oakland","Chicago State",3,3,0,0,22.6,400917473,2016-11-19
156,1,"3:14",1394,1394,"Jaevin Cumberland Defensive Rebound.",41,26,15,0.987207497012736,"Oakland","Chicago State",3,3,0,0,22.6,400917473,2016-11-19
157,1,"3:07",1387,1387,"Nick Daniels missed Three Point Jumper.",41,26,15,0.985264949184481,"Oakland","Chicago State",3,3,0,0,22.6,400917473,2016-11-19
158,1,"3:07",1387,1387,"Brian Greene Jr. Defensive Rebound.",41,26,15,0.985264949184481,"Oakland","Chicago State",3,3,0,0,22.6,400917473,2016-11-19
159,1,"3:00",1380,1380,"Foul on Nick Daniels.",41,26,15,0.985264949184481,"Oakland","Chicago State",3,3,0,0,22.6,400917473,2016-11-19
160,1,"3:00",1380,1380,"Brian Greene Jr. missed Free Throw.",41,26,15,0.985264949184481,"Oakland","Chicago State",3,3,0,0,22.6,400917473,2016-11-19
161,1,"3:00",1380,1380,"Chicago St Deadball Team Rebound.",41,26,15,0.985264949184481,"Oakland","Chicago State",3,3,0,0,22.6,400917473,2016-11-19
162,1,"3:00",1380,1380,"Brian Greene Jr. made Free Throw.",41,27,14,0.98293030134696,"Oakland","Chicago State",3,3,0,0,22.6,400917473,2016-11-19
163,1,"2:55",1375,1375,"Foul on Fred Sims Jr..",41,27,14,0.980406020712716,"Oakland","Chicago State",3,3,0,0,22.6,400917473,2016-11-19
164,1,"2:55",1375,1375,"Nick Daniels made Free Throw.",42,27,15,0.982995051876048,"Oakland","Chicago State",3,3,0,0,22.6,400917473,2016-11-19
165,1,"2:55",1375,1375,"Nick Daniels made Free Throw.",43,27,16,0.985247131764219,"Oakland","Chicago State",3,3,0,0,22.6,400917473,2016-11-19
166,1,"2:41",1361,1361,"Foul on Xavier Hill-Mais.",43,27,16,0.987324607970474,"Oakland","Chicago State",3,3,0,0,22.6,400917473,2016-11-19
167,1,"2:41",1361,1361,"Deionte Simmons made Free Throw.",43,28,15,0.9852516589915,"Oakland","Chicago State",3,3,0,0,22.6,400917473,2016-11-19
168,1,"2:41",1361,1361,"Deionte Simmons made Free Throw.",43,29,14,0.982845587646081,"Oakland","Chicago State",3,3,0,0,22.6,400917473,2016-11-19
169,1,"2:35",1355,1355,"Foul on Joshua Batson.",43,29,14,0.983779764444499,"Oakland","Chicago State",3,3,0,0,22.6,400917473,2016-11-19
170,1,"2:35",1355,1355,"Brailen Neely made Free Throw.",44,29,15,0.986069157730275,"Oakland","Chicago State",3,3,0,0,22.6,400917473,2016-11-19
171,1,"2:35",1355,1355,"Brailen Neely missed Free Throw.",44,29,15,0.986069157730275,"Oakland","Chicago State",3,3,0,0,22.6,400917473,2016-11-19
172,1,"2:35",1355,1355,"Deionte Simmons Defensive Rebound.",44,29,15,0.986069157730275,"Oakland","Chicago State",3,3,0,0,22.6,400917473,2016-11-19
173,1,"2:08",1328,1328,"Clemmye Owens V missed Jumper.",44,29,15,0.985869784906808,"Oakland","Chicago State",3,3,0,0,22.6,400917473,2016-11-19
174,1,"2:08",1328,1328,"Jalen Hayes Defensive Rebound.",44,29,15,0.985869784906808,"Oakland","Chicago State",3,3,0,0,22.6,400917473,2016-11-19
175,1,"1:44",1304,1304,"Brailen Neely made Layup.",46,29,17,0.986262969444146,"Oakland","Chicago State",3,3,0,0,22.6,400917473,2016-11-19
176,1,"1:19",1279,1279,"Foul on Isaiah Brock.",46,29,17,0.987415825248914,"Oakland","Chicago State",3,3,0,0,22.6,400917473,2016-11-19
177,1,"1:19",1279,1279,"Brian Greene Jr. made Free Throw.",46,30,16,0.985411306530762,"Oakland","Chicago State",3,3,0,0,22.6,400917473,2016-11-19
178,1,"1:19",1279,1279,"Brian Greene Jr. made Free Throw.",46,31,15,0.983092957508138,"Oakland","Chicago State",3,3,0,0,22.6,400917473,2016-11-19
