"play_id","half","time_remaining_half","secs_remaining","secs_remaining_absolute","description","home_score","away_score","score_diff","win_prob","home","away","home_time_out_remaining","away_time_out_remaining","home_timeout_ind","away_timeout_ind","home_favored_by","game_id","date"
1,1,"20:00",2400,2400,"PLAY",0,0,0,0.859870113896359,"Memphis","Samford",4,4,0,0,9.5,400987993,2017-12-05
2,1,"19:32",2372,2372,"Alex Thompson made Three Point Jumper. Assisted by Christen Cunningham.",0,3,-3,0.812737734115307,"Memphis","Samford",4,4,0,0,9.5,400987993,2017-12-05
3,1,"19:15",2355,2355,"Kyvon Davenport made Layup. Assisted by Kareem Brewton Jr..",2,3,-1,0.845749494694301,"Memphis","Samford",4,4,0,0,9.5,400987993,2017-12-05
4,1,"19:00",2340,2340,"Foul on Alex Thompson.",2,3,-1,0.83106003154599,"Memphis","Samford",4,4,0,0,9.5,400987993,2017-12-05
5,1,"19:00",2340,2340,"Alex Thompson Turnover.",2,3,-1,0.83106003154599,"Memphis","Samford",4,4,0,0,9.5,400987993,2017-12-05
6,1,"18:51",2331,2331,"Kareem Brewton Jr. missed Three Point Jumper.",2,3,-1,0.835943139083828,"Memphis","Samford",4,4,0,0,9.5,400987993,2017-12-05
7,1,"18:51",2331,2331,"Kyvon Davenport Offensive Rebound.",2,3,-1,0.835943139083828,"Memphis","Samford",4,4,0,0,9.5,400987993,2017-12-05
8,1,"18:44",2324,2324,"Kareem Brewton Jr. Turnover.",2,3,-1,0.836159597946211,"Memphis","Samford",4,4,0,0,9.5,400987993,2017-12-05
9,1,"18:30",2310,2310,"Alex Thompson missed Three Point Jumper.",2,3,-1,0.820890184384135,"Memphis","Samford",4,4,0,0,9.5,400987993,2017-12-05
10,1,"18:30",2310,2310,"Kareem Brewton Jr. Defensive Rebound.",2,3,-1,0.820890184384135,"Memphis","Samford",4,4,0,0,9.5,400987993,2017-12-05
11,1,"18:14",2294,2294,"Jeremiah Martin missed Three Point Jumper.",2,3,-1,0.835092891770234,"Memphis","Samford",4,4,0,0,9.5,400987993,2017-12-05
12,1,"18:14",2294,2294,"Jeremiah Martin Offensive Rebound.",2,3,-1,0.835092891770234,"Memphis","Samford",4,4,0,0,9.5,400987993,2017-12-05
13,1,"18:05",2285,2285,"Jeremiah Martin made Three Point Jumper. Assisted by Kareem Brewton Jr..",5,3,2,0.867685323453485,"Memphis","Samford",4,4,0,0,9.5,400987993,2017-12-05
14,1,"17:37",2257,2257,"Christen Cunningham made Jumper.",5,5,0,0.839189212813695,"Memphis","Samford",4,4,0,0,9.5,400987993,2017-12-05
15,1,"17:23",2243,2243,"Mike Parks Jr. missed Layup.",5,5,0,0.833514707071262,"Memphis","Samford",4,4,0,0,9.5,400987993,2017-12-05
16,1,"17:23",2243,2243,"Eric Adams Block.",5,5,0,0.833514707071262,"Memphis","Samford",4,4,0,0,9.5,400987993,2017-12-05
17,1,"17:23",2243,2243,"Eric Adams Defensive Rebound.",5,5,0,0.833514707071262,"Memphis","Samford",4,4,0,0,9.5,400987993,2017-12-05
18,1,"17:07",2227,2227,"Demetrius Denzel-Dyson missed Three Point Jumper.",5,5,0,0.845160762506325,"Memphis","Samford",4,4,0,0,9.5,400987993,2017-12-05
19,1,"17:07",2227,2227,"Jeremiah Martin Defensive Rebound.",5,5,0,0.845160762506325,"Memphis","Samford",4,4,0,0,9.5,400987993,2017-12-05
20,1,"16:52",2212,2212,"Kyvon Davenport missed Three Point Jumper.",5,5,0,0.839376362850321,"Memphis","Samford",4,4,0,0,9.5,400987993,2017-12-05
21,1,"16:52",2212,2212,"Kareem Brewton Jr. Offensive Rebound.",5,5,0,0.839376362850321,"Memphis","Samford",4,4,0,0,9.5,400987993,2017-12-05
22,1,"16:43",2203,2203,"Mike Parks Jr. made Layup. Assisted by Jimario Rivers.",7,5,2,0.86888324714013,"Memphis","Samford",4,4,0,0,9.5,400987993,2017-12-05
23,1,"16:12",2172,2172,"Alex Thompson missed Three Point Jumper.",7,5,2,0.864351234462142,"Memphis","Samford",4,4,0,0,9.5,400987993,2017-12-05
24,1,"16:12",2172,2172,"Justin Coleman Offensive Rebound.",7,5,2,0.864351234462142,"Memphis","Samford",4,4,0,0,9.5,400987993,2017-12-05
25,1,"16:04",2164,2164,"Christen Cunningham made Jumper. Assisted by Justin Coleman.",7,7,0,0.836477787051428,"Memphis","Samford",4,4,0,0,9.5,400987993,2017-12-05
26,1,"15:33",2133,2133,"Kareem Brewton Jr. missed Three Point Jumper.",7,7,0,0.838590998251832,"Memphis","Samford",4,4,0,0,9.5,400987993,2017-12-05
27,1,"15:33",2133,2133,"Jeremiah Martin Offensive Rebound.",7,7,0,0.838590998251832,"Memphis","Samford",4,4,0,0,9.5,400987993,2017-12-05
28,1,"15:30",2130,2130,"Jeremiah Martin missed Jumper.",7,7,0,0.838590998251832,"Memphis","Samford",4,4,0,0,9.5,400987993,2017-12-05
29,1,"15:30",2130,2130,"Mike Parks Jr. Offensive Rebound.",7,7,0,0.838590998251832,"Memphis","Samford",4,4,0,0,9.5,400987993,2017-12-05
30,1,"15:27",2127,2127,"Mike Parks Jr. made Two Point Tip Shot.",9,7,2,0.864191429193598,"Memphis","Samford",4,4,0,0,9.5,400987993,2017-12-05
31,1,"15:26",2126,2126,"Official TV Timeout",9,7,2,0.864191429193598,"Memphis","Samford",4,4,0,0,9.5,400987993,2017-12-05
32,1,"15:05",2105,2105,"Foul on Mike Parks Jr..",9,7,2,0.861811883930976,"Memphis","Samford",4,4,0,0,9.5,400987993,2017-12-05
33,1,"15:00",2100,2100,"Demetrius Denzel-Dyson made Jumper.",9,9,0,0.832891247892114,"Memphis","Samford",4,4,0,0,9.5,400987993,2017-12-05
34,1,"14:40",2080,2080,"Foul on Eric Adams.",9,9,0,0.833260879874417,"Memphis","Samford",4,4,0,0,9.5,400987993,2017-12-05
35,1,"14:29",2069,2069,"Jeremiah Martin missed Three Point Jumper.",9,9,0,0.829701994634658,"Memphis","Samford",4,4,0,0,9.5,400987993,2017-12-05
36,1,"14:29",2069,2069,"Kareem Brewton Jr. Offensive Rebound.",9,9,0,0.829701994634658,"Memphis","Samford",4,4,0,0,9.5,400987993,2017-12-05
37,1,"14:26",2066,2066,"Foul on Alex Peters.",9,9,0,0.829701994634658,"Memphis","Samford",4,4,0,0,9.5,400987993,2017-12-05
38,1,"14:26",2066,2066,"Kareem Brewton Jr. made Free Throw.",10,9,1,0.846048562206332,"Memphis","Samford",4,4,0,0,9.5,400987993,2017-12-05
39,1,"14:26",2066,2066,"Kareem Brewton Jr. missed Free Throw.",10,9,1,0.846048562206332,"Memphis","Samford",4,4,0,0,9.5,400987993,2017-12-05
40,1,"14:26",2066,2066,"Stefan Lakic Defensive Rebound.",10,9,1,0.846048562206332,"Memphis","Samford",4,4,0,0,9.5,400987993,2017-12-05
41,1,"13:58",2038,2038,"Foul on Kyvon Davenport.",10,9,1,0.861573357722438,"Memphis","Samford",4,4,0,0,9.5,400987993,2017-12-05
42,1,"13:58",2038,2038,"Demetrius Denzel-Dyson made Free Throw.",10,10,0,0.84778262595956,"Memphis","Samford",4,4,0,0,9.5,400987993,2017-12-05
43,1,"13:58",2038,2038,"Demetrius Denzel-Dyson made Free Throw.",10,11,-1,0.832884483884698,"Memphis","Samford",4,4,0,0,9.5,400987993,2017-12-05
44,1,"13:45",2025,2025,"Raynere Thornton Turnover.",10,11,-1,0.813619439729629,"Memphis","Samford",4,4,0,0,9.5,400987993,2017-12-05
45,1,"13:44",2024,2024,"Josh Sharkey Steal.",10,11,-1,0.813619439729629,"Memphis","Samford",4,4,0,0,9.5,400987993,2017-12-05
46,1,"13:33",2013,2013,"Foul on Jamal Johnson.",10,11,-1,0.818996159312954,"Memphis","Samford",4,4,0,0,9.5,400987993,2017-12-05
47,1,"13:31",2011,2011,"Christen Cunningham Turnover.",10,11,-1,0.818996159312954,"Memphis","Samford",4,4,0,0,9.5,400987993,2017-12-05
48,1,"13:30",2010,2010,"Jeremiah Martin Steal.",10,11,-1,0.818996159312954,"Memphis","Samford",4,4,0,0,9.5,400987993,2017-12-05
49,1,"13:28",2008,2008,"Jeremiah Martin missed Layup.",10,11,-1,0.812618832757652,"Memphis","Samford",4,4,0,0,9.5,400987993,2017-12-05
50,1,"13:28",2008,2008,"Alex Peters Defensive Rebound.",10,11,-1,0.812618832757652,"Memphis","Samford",4,4,0,0,9.5,400987993,2017-12-05
51,1,"13:20",2000,2000,"Foul on Jeremiah Martin.",10,11,-1,0.812618832757652,"Memphis","Samford",4,4,0,0,9.5,400987993,2017-12-05
52,1,"13:16",1996,1996,"Stefan Lakic made Three Point Jumper. Assisted by Josh Sharkey.",10,14,-4,0.749615629110188,"Memphis","Samford",4,4,0,0,9.5,400987993,2017-12-05
53,1,"13:04",1984,1984,"Foul on Stefan Lakic.",10,14,-4,0.731473784477402,"Memphis","Samford",4,4,0,0,9.5,400987993,2017-12-05
54,1,"12:48",1968,1968,"Jamal Johnson missed Three Point Jumper.",10,14,-4,0.764488682357146,"Memphis","Samford",4,4,0,0,9.5,400987993,2017-12-05
55,1,"12:48",1968,1968,"Josh Sharkey Defensive Rebound.",10,14,-4,0.764488682357146,"Memphis","Samford",4,4,0,0,9.5,400987993,2017-12-05
56,1,"12:44",1964,1964,"Foul on Raynere Thornton.",10,14,-4,0.764488682357146,"Memphis","Samford",4,4,0,0,9.5,400987993,2017-12-05
57,1,"12:16",1936,1936,"Triston Chambers made Jumper.",10,16,-6,0.67812683820353,"Memphis","Samford",4,4,0,0,9.5,400987993,2017-12-05
58,1,"11:45",1905,1905,"Raynere Thornton made Jumper. Assisted by Malik Rhodes.",12,16,-4,0.754481501994035,"Memphis","Samford",4,4,0,0,9.5,400987993,2017-12-05
59,1,"11:35",1895,1895,"Official TV Timeout",12,16,-4,0.733834144406098,"Memphis","Samford",4,4,0,0,9.5,400987993,2017-12-05
60,1,"11:22",1882,1882,"Triston Chambers missed Three Point Jumper.",12,16,-4,0.746635910046907,"Memphis","Samford",4,4,0,0,9.5,400987993,2017-12-05
61,1,"11:22",1882,1882,"Samford Offensive Rebound.",12,16,-4,0.746635910046907,"Memphis","Samford",4,4,0,0,9.5,400987993,2017-12-05
62,1,"11:22",1882,1882,"Samford  Turnover.",12,16,-4,0.746635910046907,"Memphis","Samford",4,4,0,0,9.5,400987993,2017-12-05
63,1,"10:59",1859,1859,"Foul on Alex Peters.",12,16,-4,0.739207954540746,"Memphis","Samford",4,4,0,0,9.5,400987993,2017-12-05
64,1,"10:52",1852,1852,"Jamal Johnson made Three Point Jumper. Assisted by Raynere Thornton.",15,16,-1,0.80624938205829,"Memphis","Samford",4,4,0,0,9.5,400987993,2017-12-05
65,1,"10:33",1833,1833,"Foul on Jamal Johnson.",15,16,-1,0.801298204808976,"Memphis","Samford",4,4,0,0,9.5,400987993,2017-12-05
66,1,"10:31",1831,1831,"Alex Thompson missed Jumper.",15,16,-1,0.801298204808976,"Memphis","Samford",4,4,0,0,9.5,400987993,2017-12-05
67,1,"10:31",1831,1831,"Eric Adams Offensive Rebound.",15,16,-1,0.801298204808976,"Memphis","Samford",4,4,0,0,9.5,400987993,2017-12-05
68,1,"10:27",1827,1827,"Foul on Alex Thompson.",15,16,-1,0.822380231674462,"Memphis","Samford",4,4,0,0,9.5,400987993,2017-12-05
69,1,"10:27",1827,1827,"Technical Foul on Alex Thompson.",15,16,-1,0.822380231674462,"Memphis","Samford",4,4,0,0,9.5,400987993,2017-12-05
70,1,"10:27",1827,1827,"Alex Thompson Turnover.",15,16,-1,0.822380231674462,"Memphis","Samford",4,4,0,0,9.5,400987993,2017-12-05
71,1,"10:27",1827,1827,"Jeremiah Martin made Free Throw.",16,16,0,0.839284116470564,"Memphis","Samford",4,4,0,0,9.5,400987993,2017-12-05
72,1,"10:27",1827,1827,"Jeremiah Martin missed Free Throw.",16,16,0,0.839284116470564,"Memphis","Samford",4,4,0,0,9.5,400987993,2017-12-05
73,1,"10:27",1827,1827,"Memphis Deadball Team Rebound.",16,16,0,0.839284116470564,"Memphis","Samford",4,4,0,0,9.5,400987993,2017-12-05
74,1,"10:16",1816,1816,"Eric Adams made Dunk. Assisted by Justin Coleman.",16,18,-2,0.780223998181547,"Memphis","Samford",4,4,0,0,9.5,400987993,2017-12-05
75,1,"10:03",1803,1803,"Kareem Brewton Jr. made Jumper. Assisted by Jimario Rivers.",18,18,0,0.822752603647645,"Memphis","Samford",4,4,0,0,9.5,400987993,2017-12-05
76,1,"9:33",1773,1773,"Christen Cunningham missed Jumper.",18,18,0,0.813060568531121,"Memphis","Samford",4,4,0,0,9.5,400987993,2017-12-05
77,1,"9:33",1773,1773,"Jeremiah Martin Defensive Rebound.",18,18,0,0.813060568531121,"Memphis","Samford",4,4,0,0,9.5,400987993,2017-12-05
78,1,"9:23",1763,1763,"Foul on Stefan Lakic.",18,18,0,0.831637609519553,"Memphis","Samford",4,4,0,0,9.5,400987993,2017-12-05
79,1,"9:23",1763,1763,"Kareem Brewton Jr. made Free Throw.",19,18,1,0.849045096646051,"Memphis","Samford",4,4,0,0,9.5,400987993,2017-12-05
80,1,"9:23",1763,1763,"Kareem Brewton Jr. made Free Throw.",20,18,2,0.864945054955195,"Memphis","Samford",4,4,0,0,9.5,400987993,2017-12-05
81,1,"9:10",1750,1750,"Foul on Kareem Brewton Jr..",20,18,2,0.855477439967707,"Memphis","Samford",4,4,0,0,9.5,400987993,2017-12-05
82,1,"9:10",1750,1750,"Justin Coleman made Free Throw.",20,19,1,0.837275944188786,"Memphis","Samford",4,4,0,0,9.5,400987993,2017-12-05
83,1,"9:10",1750,1750,"Justin Coleman made Free Throw.",20,20,0,0.817271749754111,"Memphis","Samford",4,4,0,0,9.5,400987993,2017-12-05
84,1,"8:46",1726,1726,"Kyvon Davenport made Dunk. Assisted by Kareem Brewton Jr..",22,20,2,0.845709352481237,"Memphis","Samford",4,4,0,0,9.5,400987993,2017-12-05
85,1,"8:19",1699,1699,"Justin Coleman missed Three Point Jumper.",22,20,2,0.854343013646466,"Memphis","Samford",4,4,0,0,9.5,400987993,2017-12-05
86,1,"8:19",1699,1699,"Mike Parks Jr. Defensive Rebound.",22,20,2,0.854343013646466,"Memphis","Samford",4,4,0,0,9.5,400987993,2017-12-05
87,1,"8:06",1686,1686,"Kareem Brewton Jr. Turnover.",22,20,2,0.864243952608472,"Memphis","Samford",4,4,0,0,9.5,400987993,2017-12-05
88,1,"8:05",1685,1685,"Demetrius Denzel-Dyson Steal.",22,20,2,0.864243952608472,"Memphis","Samford",4,4,0,0,9.5,400987993,2017-12-05
89,1,"8:01",1681,1681,"Kevion Nolan made Three Point Jumper. Assisted by Demetrius Denzel-Dyson.",22,23,-1,0.804541750794828,"Memphis","Samford",4,4,0,0,9.5,400987993,2017-12-05
90,1,"7:42",1662,1662,"Kareem Brewton Jr. missed Three Point Jumper.",22,23,-1,0.796176022340525,"Memphis","Samford",4,4,0,0,9.5,400987993,2017-12-05
91,1,"7:42",1662,1662,"Mike Parks Jr. Offensive Rebound.",22,23,-1,0.796176022340525,"Memphis","Samford",4,4,0,0,9.5,400987993,2017-12-05
92,1,"7:37",1657,1657,"Mike Parks Jr. missed Layup.",22,23,-1,0.791361243299732,"Memphis","Samford",4,4,0,0,9.5,400987993,2017-12-05
93,1,"7:37",1657,1657,"Christen Cunningham Defensive Rebound.",22,23,-1,0.791361243299732,"Memphis","Samford",4,4,0,0,9.5,400987993,2017-12-05
94,1,"7:29",1649,1649,"Christen Cunningham made Layup.",22,25,-3,0.748847608000916,"Memphis","Samford",4,4,0,0,9.5,400987993,2017-12-05
95,1,"7:21",1641,1641,"Jimario Rivers Turnover.",22,25,-3,0.748847608000916,"Memphis","Samford",4,4,0,0,9.5,400987993,2017-12-05
96,1,"7:20",1640,1640,"Christen Cunningham Steal.",22,25,-3,0.748847608000916,"Memphis","Samford",4,4,0,0,9.5,400987993,2017-12-05
97,1,"7:20",1640,1640,"Foul on Kareem Brewton Jr..",22,25,-3,0.748847608000916,"Memphis","Samford",4,4,0,0,9.5,400987993,2017-12-05
98,1,"7:20",1640,1640,"Official TV Timeout",22,25,-3,0.748847608000916,"Memphis","Samford",4,4,0,0,9.5,400987993,2017-12-05
99,1,"7:20",1640,1640,"Christen Cunningham made Free Throw.",22,26,-4,0.721761742588463,"Memphis","Samford",4,4,0,0,9.5,400987993,2017-12-05
100,1,"7:20",1640,1640,"Christen Cunningham made Free Throw.",22,27,-5,0.692952499417364,"Memphis","Samford",4,4,0,0,9.5,400987993,2017-12-05
101,1,"6:51",1611,1611,"Foul on Justin Coleman.",22,27,-5,0.660613649131803,"Memphis","Samford",4,4,0,0,9.5,400987993,2017-12-05
102,1,"6:51",1611,1611,"Kyvon Davenport made Free Throw.",23,27,-4,0.691421071023145,"Memphis","Samford",4,4,0,0,9.5,400987993,2017-12-05
103,1,"6:51",1611,1611,"Kyvon Davenport made Free Throw.",24,27,-3,0.720614677127194,"Memphis","Samford",4,4,0,0,9.5,400987993,2017-12-05
104,1,"6:28",1588,1588,"Demetrius Denzel-Dyson missed Three Point Jumper.",24,27,-3,0.737360786916607,"Memphis","Samford",4,4,0,0,9.5,400987993,2017-12-05
105,1,"6:28",1588,1588,"Jimario Rivers Defensive Rebound.",24,27,-3,0.737360786916607,"Memphis","Samford",4,4,0,0,9.5,400987993,2017-12-05
106,1,"6:10",1570,1570,"Foul on Josh Sharkey.",24,27,-3,0.733663024347772,"Memphis","Samford",4,4,0,0,9.5,400987993,2017-12-05
107,1,"6:10",1570,1570,"Malik Rhodes made Free Throw.",25,27,-2,0.762860017615126,"Memphis","Samford",4,4,0,0,9.5,400987993,2017-12-05
108,1,"6:10",1570,1570,"Malik Rhodes made Free Throw.",26,27,-1,0.789773452350833,"Memphis","Samford",4,4,0,0,9.5,400987993,2017-12-05
109,1,"5:51",1551,1551,"Kevion Nolan made Three Point Jumper. Assisted by Justin Coleman.",26,30,-4,0.691472269613848,"Memphis","Samford",4,4,0,0,9.5,400987993,2017-12-05
110,1,"5:29",1529,1529,"Malik Rhodes Turnover.",26,30,-4,0.700164332805439,"Memphis","Samford",4,4,0,0,9.5,400987993,2017-12-05
111,1,"5:15",1515,1515,"Eric Adams made Layup. Assisted by Josh Sharkey.",26,32,-6,0.634312104359872,"Memphis","Samford",4,4,0,0,9.5,400987993,2017-12-05
112,1,"4:44",1484,1484,"Memphis  Turnover.",26,32,-6,0.621520425986408,"Memphis","Samford",4,4,0,0,9.5,400987993,2017-12-05
113,1,"4:18",1458,1458,"Josh Sharkey Turnover.",26,32,-6,0.623225438345947,"Memphis","Samford",4,4,0,0,9.5,400987993,2017-12-05
114,1,"3:55",1435,1435,"David Nickelberry Turnover.",26,32,-6,0.619334786763383,"Memphis","Samford",4,4,0,0,9.5,400987993,2017-12-05
115,1,"3:53",1433,1433,"Demetrius Denzel-Dyson Steal.",26,32,-6,0.619334786763383,"Memphis","Samford",4,4,0,0,9.5,400987993,2017-12-05
116,1,"3:48",1428,1428,"Alex Peters made Layup. Assisted by Demetrius Denzel-Dyson.",26,34,-8,0.540158215797873,"Memphis","Samford",4,4,0,0,9.5,400987993,2017-12-05
117,1,"3:44",1424,1424,"Official TV Timeout",26,34,-8,0.540158215797873,"Memphis","Samford",4,4,1,0,9.5,400987993,2017-12-05
118,1,"3:44",1424,1424,"Memphis  Timeout",26,34,-8,0.540158215797873,"Memphis","Samford",3,4,1,0,9.5,400987993,2017-12-05
119,1,"3:25",1405,1405,"Jeremiah Martin missed Three Point Jumper.",26,34,-8,0.557824969311132,"Memphis","Samford",3,4,1,0,9.5,400987993,2017-12-05
120,1,"3:25",1405,1405,"Josh Sharkey Defensive Rebound.",26,34,-8,0.557824969311132,"Memphis","Samford",3,4,1,0,9.5,400987993,2017-12-05
121,1,"3:15",1395,1395,"Demetrius Denzel-Dyson made Three Point Jumper.",26,37,-11,0.437915976200299,"Memphis","Samford",3,4,1,0,9.5,400987993,2017-12-05
122,1,"2:58",1378,1378,"Jeremiah Martin made Layup.",28,37,-9,0.512509253527204,"Memphis","Samford",3,4,1,0,9.5,400987993,2017-12-05
123,1,"2:45",1365,1365,"Foul on Raynere Thornton.",28,37,-9,0.497558718310325,"Memphis","Samford",3,4,1,0,9.5,400987993,2017-12-05
124,1,"2:45",1365,1365,"Demetrius Denzel-Dyson made Free Throw.",28,38,-10,0.459256765606428,"Memphis","Samford",3,4,1,0,9.5,400987993,2017-12-05
125,1,"2:45",1365,1365,"Demetrius Denzel-Dyson missed Free Throw.",28,38,-10,0.459256765606428,"Memphis","Samford",3,4,1,0,9.5,400987993,2017-12-05
126,1,"2:45",1365,1365,"Jimario Rivers Defensive Rebound.",28,38,-10,0.459256765606428,"Memphis","Samford",3,4,1,0,9.5,400987993,2017-12-05
127,1,"2:29",1349,1349,"Jeremiah Martin missed Layup.",28,38,-10,0.427795892508714,"Memphis","Samford",3,4,0,0,9.5,400987993,2017-12-05
128,1,"2:29",1349,1349,"Demetrius Denzel-Dyson Block.",28,38,-10,0.427795892508714,"Memphis","Samford",3,4,0,0,9.5,400987993,2017-12-05
129,1,"2:29",1349,1349,"Demetrius Denzel-Dyson Defensive Rebound.",28,38,-10,0.427795892508714,"Memphis","Samford",3,4,0,0,9.5,400987993,2017-12-05
130,1,"2:04",1324,1324,"Demetrius Denzel-Dyson missed Three Point Jumper.",28,38,-10,0.445624744641731,"Memphis","Samford",3,4,0,0,9.5,400987993,2017-12-05
131,1,"2:04",1324,1324,"Kyvon Davenport Defensive Rebound.",28,38,-10,0.445624744641731,"Memphis","Samford",3,4,0,0,9.5,400987993,2017-12-05
132,1,"1:51",1311,1311,"Kyvon Davenport made Dunk. Assisted by Jimario Rivers.",30,38,-8,0.53251750561107,"Memphis","Samford",3,4,0,0,9.5,400987993,2017-12-05
133,1,"1:23",1283,1283,"Demetrius Denzel-Dyson missed Jumper.",30,38,-8,0.550030598015025,"Memphis","Samford",3,4,0,0,9.5,400987993,2017-12-05
134,1,"1:23",1283,1283,"Jimario Rivers Defensive Rebound.",30,38,-8,0.550030598015025,"Memphis","Samford",3,4,0,0,9.5,400987993,2017-12-05
135,1,"1:15",1275,1275,"David Nickelberry missed Three Point Jumper.",30,38,-8,0.523349465716671,"Memphis","Samford",3,4,0,0,9.5,400987993,2017-12-05
136,1,"1:15",1275,1275,"Josh Sharkey Defensive Rebound.",30,38,-8,0.523349465716671,"Memphis","Samford",3,4,0,0,9.5,400987993,2017-12-05
137,1,"0:52",1252,1252,"Christen Cunningham missed Layup.",30,38,-8,0.510809367342618,"Memphis","Samford",3,4,0,0,9.5,400987993,2017-12-05
138,1,"0:52",1252,1252,"David Nickelberry Defensive Rebound.",30,38,-8,0.510809367342618,"Memphis","Samford",3,4,0,0,9.5,400987993,2017-12-05
139,1,"0:45",1245,1245,"Jeremiah Martin missed Jumper.",30,38,-8,0.529876891973219,"Memphis","Samford",3,4,0,0,9.5,400987993,2017-12-05
140,1,"0:45",1245,1245,"Triston Chambers Defensive Rebound.",30,38,-8,0.529876891973219,"Memphis","Samford",3,4,0,0,9.5,400987993,2017-12-05
141,1,"0:39",1239,1239,"Samford  Timeout",30,38,-8,0.49231143118088,"Memphis","Samford",3,3,0,1,9.5,400987993,2017-12-05
142,1,"0:19",1219,1219,"Demetrius Denzel-Dyson made Three Point Jumper. Assisted by Christen Cunningham.",30,41,-11,0.365241645721162,"Memphis","Samford",3,3,0,1,9.5,400987993,2017-12-05
143,1,"0:05",1205,1205,"Malik Rhodes made Layup.",32,41,-9,0.47114593588295,"Memphis","Samford",3,3,0,1,9.5,400987993,2017-12-05
144,1,"0:00",1200,1200,"End of 1st half",32,41,-9,0.47114593588295,"Memphis","Samford",3,3,0,1,9.5,400987993,2017-12-05
145,2,"20:00",1200,1200,"PLAY",32,41,-9,0.47114593588295,"Memphis","Samford",4,4,0,0,9.5,400987993,2017-12-05
146,2,"19:53",1193,1193,"Mike Parks Jr. missed Jumper.",32,41,-9,0.533570122604088,"Memphis","Samford",4,4,0,0,9.5,400987993,2017-12-05
147,2,"19:53",1193,1193,"Christen Cunningham Defensive Rebound.",32,41,-9,0.533570122604088,"Memphis","Samford",4,4,0,0,9.5,400987993,2017-12-05
148,2,"19:37",1177,1177,"Justin Coleman Turnover.",32,41,-9,0.442518147996791,"Memphis","Samford",4,4,0,0,9.5,400987993,2017-12-05
149,2,"19:36",1176,1176,"Jimario Rivers Steal.",32,41,-9,0.442518147996791,"Memphis","Samford",4,4,0,0,9.5,400987993,2017-12-05
150,2,"19:30",1170,1170,"Jimario Rivers Turnover.",32,41,-9,0.442518147996791,"Memphis","Samford",4,4,0,0,9.5,400987993,2017-12-05
151,2,"19:29",1169,1169,"Christen Cunningham Steal.",32,41,-9,0.450374437991546,"Memphis","Samford",4,4,0,0,9.5,400987993,2017-12-05
152,2,"19:26",1166,1166,"Demetrius Denzel-Dyson missed Three Point Jumper.",32,41,-9,0.450374437991546,"Memphis","Samford",4,4,0,0,9.5,400987993,2017-12-05
153,2,"19:26",1166,1166,"Mike Parks Jr. Defensive Rebound.",32,41,-9,0.450374437991546,"Memphis","Samford",4,4,0,0,9.5,400987993,2017-12-05
154,2,"19:12",1152,1152,"Jimario Rivers Turnover.",32,41,-9,0.451092144005294,"Memphis","Samford",4,4,0,0,9.5,400987993,2017-12-05
155,2,"19:08",1148,1148,"Christen Cunningham Steal.",32,41,-9,0.418232785032386,"Memphis","Samford",4,4,0,0,9.5,400987993,2017-12-05
156,2,"18:46",1126,1126,"Eric Adams missed Jumper.",32,41,-9,0.398260828729754,"Memphis","Samford",4,4,0,0,9.5,400987993,2017-12-05
157,2,"18:46",1126,1126,"Kyvon Davenport Defensive Rebound.",32,41,-9,0.398260828729754,"Memphis","Samford",4,4,0,0,9.5,400987993,2017-12-05
158,2,"18:24",1104,1104,"Kareem Brewton Jr. missed Three Point Jumper.",32,41,-9,0.460417929284906,"Memphis","Samford",4,4,0,0,9.5,400987993,2017-12-05
159,2,"18:24",1104,1104,"Jimario Rivers Offensive Rebound.",32,41,-9,0.460417929284906,"Memphis","Samford",4,4,0,0,9.5,400987993,2017-12-05
160,2,"18:14",1094,1094,"Kareem Brewton Jr. Turnover.",32,41,-9,0.446507723067532,"Memphis","Samford",4,4,0,0,9.5,400987993,2017-12-05
161,2,"18:13",1093,1093,"Alex Thompson Steal.",32,41,-9,0.446507723067532,"Memphis","Samford",4,4,0,0,9.5,400987993,2017-12-05
162,2,"18:07",1087,1087,"Alex Thompson missed Layup.",32,41,-9,0.431419627099291,"Memphis","Samford",4,4,0,0,9.5,400987993,2017-12-05
163,2,"18:07",1087,1087,"Jimario Rivers Defensive Rebound.",32,41,-9,0.431419627099291,"Memphis","Samford",4,4,0,0,9.5,400987993,2017-12-05
164,2,"17:59",1079,1079,"Jeremiah Martin Turnover.",32,41,-9,0.431412474842064,"Memphis","Samford",4,4,0,0,9.5,400987993,2017-12-05
165,2,"17:30",1050,1050,"Justin Coleman missed Three Point Jumper.",32,41,-9,0.413957404224792,"Memphis","Samford",4,4,0,0,9.5,400987993,2017-12-05
166,2,"17:30",1050,1050,"Jamal Johnson Defensive Rebound.",32,41,-9,0.413957404224792,"Memphis","Samford",4,4,0,0,9.5,400987993,2017-12-05
167,2,"17:13",1033,1033,"Jamal Johnson missed Three Point Jumper.",32,41,-9,0.424897261108341,"Memphis","Samford",4,4,0,0,9.5,400987993,2017-12-05
168,2,"17:13",1033,1033,"Kyvon Davenport Offensive Rebound.",32,41,-9,0.424897261108341,"Memphis","Samford",4,4,0,0,9.5,400987993,2017-12-05
169,2,"17:11",1031,1031,"Foul on Alex Thompson.",32,41,-9,0.424897261108341,"Memphis","Samford",4,4,0,0,9.5,400987993,2017-12-05
170,2,"17:11",1031,1031,"Kyvon Davenport made Free Throw.",33,41,-8,0.467256446085181,"Memphis","Samford",4,4,0,0,9.5,400987993,2017-12-05
171,2,"17:11",1031,1031,"Kyvon Davenport made Free Throw.",34,41,-7,0.510092989185,"Memphis","Samford",4,4,0,0,9.5,400987993,2017-12-05
172,2,"16:42",1002,1002,"Christen Cunningham missed Three Point Jumper.",34,41,-7,0.457911292850995,"Memphis","Samford",4,4,0,0,9.5,400987993,2017-12-05
173,2,"16:42",1002,1002,"Memphis Deadball Team Rebound.",34,41,-7,0.457911292850995,"Memphis","Samford",4,4,0,0,9.5,400987993,2017-12-05
174,2,"16:34",994,994,"Jimario Rivers missed Jumper.",34,41,-7,0.480526936228105,"Memphis","Samford",4,4,0,0,9.5,400987993,2017-12-05
175,2,"16:34",994,994,"Eric Adams Defensive Rebound.",34,41,-7,0.480526936228105,"Memphis","Samford",4,4,0,0,9.5,400987993,2017-12-05
176,2,"16:27",987,987,"Justin Coleman Turnover.",34,41,-7,0.446574945088045,"Memphis","Samford",4,4,0,0,9.5,400987993,2017-12-05
177,2,"16:26",986,986,"Jeremiah Martin Turnover.",34,41,-7,0.446574945088045,"Memphis","Samford",4,4,0,0,9.5,400987993,2017-12-05
178,2,"16:25",985,985,"Justin Coleman Steal.",34,41,-7,0.446574945088045,"Memphis","Samford",4,4,0,0,9.5,400987993,2017-12-05
179,2,"16:04",964,964,"Justin Coleman made Three Point Jumper. Assisted by Christen Cunningham.",34,44,-10,0.322373894239072,"Memphis","Samford",4,4,0,0,9.5,400987993,2017-12-05
180,2,"15:49",949,949,"Kareem Brewton Jr. missed Three Point Jumper.",34,44,-10,0.348417916254713,"Memphis","Samford",4,4,0,0,9.5,400987993,2017-12-05
181,2,"15:49",949,949,"Kyvon Davenport Offensive Rebound.",34,44,-10,0.348417916254713,"Memphis","Samford",4,4,0,0,9.5,400987993,2017-12-05
182,2,"15:46",946,946,"Kyvon Davenport made Dunk.",36,44,-8,0.439681257416026,"Memphis","Samford",4,4,0,0,9.5,400987993,2017-12-05
183,2,"15:20",920,920,"Christen Cunningham missed Three Point Jumper.",36,44,-8,0.381465661166603,"Memphis","Samford",4,4,0,0,9.5,400987993,2017-12-05
184,2,"15:20",920,920,"Jimario Rivers Defensive Rebound.",36,44,-8,0.381465661166603,"Memphis","Samford",4,4,0,0,9.5,400987993,2017-12-05
185,2,"15:12",912,912,"Jeremiah Martin Turnover.",36,44,-8,0.422493157217105,"Memphis","Samford",4,4,0,0,9.5,400987993,2017-12-05
