"play_id","half","time_remaining_half","secs_remaining","secs_remaining_absolute","description","home_score","away_score","score_diff","win_prob","home","away","home_time_out_remaining","away_time_out_remaining","home_timeout_ind","away_timeout_ind","home_favored_by","game_id","date"
1,1,"20:00",2400,2400,"PLAY",0,0,0,0.177218402585967,"Ole Miss","Baylor",4,4,0,0,-8,400910771,2017-01-28
2,1,"20:00",2400,2400,"Jump Ball won by Ole Miss",0,0,0,0.177218402585967,"Ole Miss","Baylor",4,4,0,0,-8,400910771,2017-01-28
3,1,"19:51",2391,2391,"Sebastian Saiz made Three Point Jumper. Assisted by Terence Davis.",3,0,3,0.213926993332558,"Ole Miss","Baylor",4,4,0,0,-8,400910771,2017-01-28
4,1,"19:29",2369,2369,"Al Freeman missed Three Point Jumper.",3,0,3,0.213078832916017,"Ole Miss","Baylor",4,4,0,0,-8,400910771,2017-01-28
5,1,"19:29",2369,2369,"Sebastian Saiz Defensive Rebound.",3,0,3,0.213078832916017,"Ole Miss","Baylor",4,4,0,0,-8,400910771,2017-01-28
6,1,"19:10",2350,2350,"Sebastian Saiz made Jumper. Assisted by Cullen Neal.",5,0,5,0.283793230579747,"Ole Miss","Baylor",4,4,0,0,-8,400910771,2017-01-28
7,1,"18:43",2323,2323,"Foul on Breein Tyree.",5,0,5,0.31663962658349,"Ole Miss","Baylor",4,4,0,0,-8,400910771,2017-01-28
8,1,"18:40",2320,2320,"Manu Lecomte made Three Point Jumper. Assisted by Ishmail Wainright.",5,3,2,0.251022248693367,"Ole Miss","Baylor",4,4,0,0,-8,400910771,2017-01-28
9,1,"18:21",2301,2301,"Sebastian Saiz made Jumper. Assisted by Terence Davis.",7,3,4,0.271135167118658,"Ole Miss","Baylor",4,4,0,0,-8,400910771,2017-01-28
10,1,"18:21",2301,2301,"Foul on Johnathan Motley.",7,3,4,0.271135167118658,"Ole Miss","Baylor",4,4,0,0,-8,400910771,2017-01-28
11,1,"18:21",2301,2301,"Sebastian Saiz made Free Throw.",8,3,5,0.291242976663995,"Ole Miss","Baylor",4,4,0,0,-8,400910771,2017-01-28
12,1,"18:01",2281,2281,"Foul on Sebastian Saiz.",8,3,5,0.291165954213278,"Ole Miss","Baylor",4,4,0,0,-8,400910771,2017-01-28
13,1,"18:01",2281,2281,"Jo Lual-Acuil Jr. missed Free Throw.",8,3,5,0.291165954213278,"Ole Miss","Baylor",4,4,0,0,-8,400910771,2017-01-28
14,1,"18:01",2281,2281,"Baylor Deadball Team Rebound.",8,3,5,0.291165954213278,"Ole Miss","Baylor",4,4,0,0,-8,400910771,2017-01-28
15,1,"18:01",2281,2281,"Jo Lual-Acuil Jr. made Free Throw.",8,4,4,0.270010682863108,"Ole Miss","Baylor",4,4,0,0,-8,400910771,2017-01-28
16,1,"17:55",2275,2275,"Foul on Ishmail Wainright.",8,4,4,0.279787829744075,"Ole Miss","Baylor",4,4,0,0,-8,400910771,2017-01-28
17,1,"17:51",2271,2271,"Cullen Neal made Three Point Jumper. Assisted by Marcanvis Hymon.",11,4,7,0.346361286650976,"Ole Miss","Baylor",4,4,0,0,-8,400910771,2017-01-28
18,1,"17:25",2245,2245,"Ishmail Wainright Turnover.",11,4,7,0.364624918686947,"Ole Miss","Baylor",4,4,0,0,-8,400910771,2017-01-28
19,1,"17:25",2245,2245,"Terence Davis Steal.",11,4,7,0.364624918686947,"Ole Miss","Baylor",4,4,0,0,-8,400910771,2017-01-28
20,1,"17:17",2237,2237,"Terence Davis missed Three Point Jumper.",11,4,7,0.358835799014861,"Ole Miss","Baylor",4,4,0,0,-8,400910771,2017-01-28
21,1,"17:17",2237,2237,"Terence Davis Offensive Rebound.",11,4,7,0.358835799014861,"Ole Miss","Baylor",4,4,0,0,-8,400910771,2017-01-28
22,1,"17:12",2232,2232,"Terence Davis missed Jumper.",11,4,7,0.358835799014861,"Ole Miss","Baylor",4,4,0,0,-8,400910771,2017-01-28
23,1,"17:12",2232,2232,"Johnathan Motley Defensive Rebound.",11,4,7,0.358835799014861,"Ole Miss","Baylor",4,4,0,0,-8,400910771,2017-01-28
24,1,"16:59",2219,2219,"Jo Lual-Acuil Jr. missed Layup.",11,4,7,0.414712723307621,"Ole Miss","Baylor",4,4,0,0,-8,400910771,2017-01-28
25,1,"16:59",2219,2219,"Johnathan Motley Offensive Rebound.",11,4,7,0.414712723307621,"Ole Miss","Baylor",4,4,0,0,-8,400910771,2017-01-28
26,1,"16:54",2214,2214,"Foul on Marcanvis Hymon.",11,4,7,0.414712723307621,"Ole Miss","Baylor",4,4,0,0,-8,400910771,2017-01-28
27,1,"16:54",2214,2214,"Johnathan Motley made Free Throw.",11,5,6,0.383341273461782,"Ole Miss","Baylor",4,4,0,0,-8,400910771,2017-01-28
28,1,"16:54",2214,2214,"Johnathan Motley missed Free Throw.",11,5,6,0.383341273461782,"Ole Miss","Baylor",4,4,0,0,-8,400910771,2017-01-28
29,1,"16:54",2214,2214,"Marcanvis Hymon Defensive Rebound.",11,5,6,0.383341273461782,"Ole Miss","Baylor",4,4,0,0,-8,400910771,2017-01-28
30,1,"16:39",2199,2199,"Sebastian Saiz missed Layup.",11,5,6,0.349214066896055,"Ole Miss","Baylor",4,4,0,0,-8,400910771,2017-01-28
31,1,"16:39",2199,2199,"Johnathan Motley Defensive Rebound.",11,5,6,0.349214066896055,"Ole Miss","Baylor",4,4,0,0,-8,400910771,2017-01-28
32,1,"16:34",2194,2194,"Ishmail Wainright missed Three Point Jumper.",11,5,6,0.349214066896055,"Ole Miss","Baylor",4,4,0,0,-8,400910771,2017-01-28
33,1,"16:34",2194,2194,"Breein Tyree Defensive Rebound.",11,5,6,0.349214066896055,"Ole Miss","Baylor",4,4,0,0,-8,400910771,2017-01-28
34,1,"16:26",2186,2186,"Breein Tyree made Layup.",13,5,8,0.383842451250196,"Ole Miss","Baylor",4,4,0,0,-8,400910771,2017-01-28
35,1,"16:08",2168,2168,"Johnathan Motley made Jumper.",13,7,6,0.338433337730039,"Ole Miss","Baylor",4,4,0,0,-8,400910771,2017-01-28
36,1,"15:53",2153,2153,"Sebastian Saiz missed Jumper.",13,7,6,0.333806059456871,"Ole Miss","Baylor",4,4,0,0,-8,400910771,2017-01-28
37,1,"15:53",2153,2153,"Johnathan Motley Defensive Rebound.",13,7,6,0.333806059456871,"Ole Miss","Baylor",4,4,0,0,-8,400910771,2017-01-28
38,1,"15:41",2141,2141,"Jo Lual-Acuil Jr. Turnover.",13,7,6,0.328608627617448,"Ole Miss","Baylor",4,4,0,0,-8,400910771,2017-01-28
39,1,"15:37",2137,2137,"Official TV Timeout",13,7,6,0.344154967153426,"Ole Miss","Baylor",4,4,0,0,-8,400910771,2017-01-28
40,1,"15:09",2109,2109,"Justas Furmanavicius missed Jumper.",13,7,6,0.337930824077493,"Ole Miss","Baylor",4,4,0,0,-8,400910771,2017-01-28
41,1,"15:09",2109,2109,"Sebastian Saiz Offensive Rebound.",13,7,6,0.337930824077493,"Ole Miss","Baylor",4,4,0,0,-8,400910771,2017-01-28
42,1,"15:06",2106,2106,"Sebastian Saiz missed Layup.",13,7,6,0.337930824077493,"Ole Miss","Baylor",4,4,0,0,-8,400910771,2017-01-28
43,1,"15:06",2106,2106,"King McClure Defensive Rebound.",13,7,6,0.337930824077493,"Ole Miss","Baylor",4,4,0,0,-8,400910771,2017-01-28
44,1,"14:47",2087,2087,"Manu Lecomte missed Jumper.",13,7,6,0.354588445011249,"Ole Miss","Baylor",4,4,0,0,-8,400910771,2017-01-28
45,1,"14:47",2087,2087,"Justas Furmanavicius Defensive Rebound.",13,7,6,0.354588445011249,"Ole Miss","Baylor",4,4,0,0,-8,400910771,2017-01-28
46,1,"14:33",2073,2073,"Sebastian Saiz missed Three Point Jumper.",13,7,6,0.31571631567691,"Ole Miss","Baylor",4,4,0,0,-8,400910771,2017-01-28
47,1,"14:33",2073,2073,"King McClure Defensive Rebound.",13,7,6,0.31571631567691,"Ole Miss","Baylor",4,4,0,0,-8,400910771,2017-01-28
48,1,"14:05",2045,2045,"Jake Lindsey missed Three Point Jumper.",13,7,6,0.328041849858959,"Ole Miss","Baylor",4,4,0,0,-8,400910771,2017-01-28
49,1,"14:05",2045,2045,"Breein Tyree Defensive Rebound.",13,7,6,0.328041849858959,"Ole Miss","Baylor",4,4,0,0,-8,400910771,2017-01-28
50,1,"13:57",2037,2037,"Foul on Terry Maston.",13,7,6,0.331057880675957,"Ole Miss","Baylor",4,4,0,0,-8,400910771,2017-01-28
51,1,"13:46",2026,2026,"Rasheed Brooks Turnover.",13,7,6,0.355793206482991,"Ole Miss","Baylor",4,4,0,0,-8,400910771,2017-01-28
52,1,"13:46",2026,2026,"Terry Maston Steal.",13,7,6,0.355793206482991,"Ole Miss","Baylor",4,4,0,0,-8,400910771,2017-01-28
53,1,"13:36",2016,2016,"Foul on Terence Davis.",13,7,6,0.353521011345297,"Ole Miss","Baylor",4,4,0,0,-8,400910771,2017-01-28
54,1,"13:36",2016,2016,"King McClure made Free Throw.",13,8,5,0.32756838868499,"Ole Miss","Baylor",4,4,0,0,-8,400910771,2017-01-28
55,1,"13:36",2016,2016,"King McClure made Free Throw.",13,9,4,0.302629121271605,"Ole Miss","Baylor",4,4,0,0,-8,400910771,2017-01-28
56,1,"13:20",2000,2000,"Marcanvis Hymon missed Jumper.",13,9,4,0.290078589158079,"Ole Miss","Baylor",4,4,0,0,-8,400910771,2017-01-28
57,1,"13:20",2000,2000,"Justas Furmanavicius Offensive Rebound.",13,9,4,0.290078589158079,"Ole Miss","Baylor",4,4,0,0,-8,400910771,2017-01-28
58,1,"13:17",1997,1997,"Foul on Jake Lindsey.",13,9,4,0.304822437157296,"Ole Miss","Baylor",4,4,0,0,-8,400910771,2017-01-28
59,1,"13:13",1993,1993,"Terence Davis made Jumper. Assisted by Rasheed Brooks.",15,9,6,0.362420199309684,"Ole Miss","Baylor",4,4,0,0,-8,400910771,2017-01-28
60,1,"12:47",1967,1967,"Foul on Deandre Burnett.",15,9,6,0.331361483697775,"Ole Miss","Baylor",4,4,0,0,-8,400910771,2017-01-28
61,1,"12:28",1948,1948,"Jo Lual-Acuil Jr. made Dunk. Assisted by Manu Lecomte.",15,11,4,0.308340720185877,"Ole Miss","Baylor",4,4,0,0,-8,400910771,2017-01-28
62,1,"12:11",1931,1931,"Rasheed Brooks missed Three Point Jumper.",15,11,4,0.308354482176175,"Ole Miss","Baylor",4,4,0,0,-8,400910771,2017-01-28
63,1,"12:11",1931,1931,"Jake Lindsey Defensive Rebound.",15,11,4,0.308354482176175,"Ole Miss","Baylor",4,4,0,0,-8,400910771,2017-01-28
64,1,"12:01",1921,1921,"Manu Lecomte made Three Point Jumper. Assisted by King McClure.",15,14,1,0.211252160375706,"Ole Miss","Baylor",4,4,0,0,-8,400910771,2017-01-28
65,1,"11:36",1896,1896,"Deandre Burnett made Three Point Jumper. Assisted by Rasheed Brooks.",18,14,4,0.337855095774648,"Ole Miss","Baylor",4,4,0,0,-8,400910771,2017-01-28
66,1,"11:36",1896,1896,"Foul on King McClure.",18,14,4,0.337855095774648,"Ole Miss","Baylor",4,4,0,0,-8,400910771,2017-01-28
67,1,"11:36",1896,1896,"Official TV Timeout",18,14,4,0.337855095774648,"Ole Miss","Baylor",4,4,0,0,-8,400910771,2017-01-28
68,1,"11:36",1896,1896,"Deandre Burnett made Free Throw.",19,14,5,0.368541199505614,"Ole Miss","Baylor",4,4,0,0,-8,400910771,2017-01-28
69,1,"11:19",1879,1879,"King McClure missed Three Point Jumper.",19,14,5,0.337343140984439,"Ole Miss","Baylor",4,4,0,0,-8,400910771,2017-01-28
70,1,"11:19",1879,1879,"Jo Lual-Acuil Jr. Offensive Rebound.",19,14,5,0.337343140984439,"Ole Miss","Baylor",4,4,0,0,-8,400910771,2017-01-28
71,1,"11:14",1874,1874,"Jo Lual-Acuil Jr. Turnover.",19,14,5,0.337343140984439,"Ole Miss","Baylor",4,4,0,0,-8,400910771,2017-01-28
72,1,"10:57",1857,1857,"Foul on King McClure.",19,14,5,0.358048404355868,"Ole Miss","Baylor",4,4,0,0,-8,400910771,2017-01-28
73,1,"10:57",1857,1857,"Foul on Cullen Neal.",19,14,5,0.358048404355868,"Ole Miss","Baylor",4,4,0,0,-8,400910771,2017-01-28
74,1,"10:54",1854,1854,"Terence Davis made Three Point Jumper. Assisted by Deandre Burnett.",22,14,8,0.450195846468409,"Ole Miss","Baylor",4,4,0,0,-8,400910771,2017-01-28
75,1,"10:33",1833,1833,"Al Freeman Turnover.",22,14,8,0.451975862165994,"Ole Miss","Baylor",4,4,0,0,-8,400910771,2017-01-28
76,1,"10:33",1833,1833,"Cullen Neal Steal.",22,14,8,0.451975862165994,"Ole Miss","Baylor",4,4,0,0,-8,400910771,2017-01-28
77,1,"10:25",1825,1825,"Foul on Wendell Mitchell.",22,14,8,0.435030083427956,"Ole Miss","Baylor",4,4,1,0,-8,400910771,2017-01-28
78,1,"10:25",1825,1825,"Cullen Neal made Free Throw.",23,14,9,0.464807328179204,"Ole Miss","Baylor",4,4,1,0,-8,400910771,2017-01-28
79,1,"10:25",1825,1825,"Cullen Neal made Free Throw.",24,14,10,0.494837585839277,"Ole Miss","Baylor",4,4,1,0,-8,400910771,2017-01-28
80,1,"10:25",1825,1825,"Baylor  Timeout",24,14,10,0.494837585839277,"Ole Miss","Baylor",3,4,1,0,-8,400910771,2017-01-28
81,1,"10:15",1815,1815,"Al Freeman missed Three Point Jumper.",24,14,10,0.539499010588908,"Ole Miss","Baylor",3,4,1,0,-8,400910771,2017-01-28
82,1,"10:15",1815,1815,"Terence Davis Defensive Rebound.",24,14,10,0.539499010588908,"Ole Miss","Baylor",3,4,1,0,-8,400910771,2017-01-28
83,1,"10:10",1810,1810,"Foul on Johnathan Motley.",24,14,10,0.539499010588908,"Ole Miss","Baylor",3,4,1,0,-8,400910771,2017-01-28
84,1,"10:10",1810,1810,"Terence Davis made Free Throw.",25,14,11,0.573906746606464,"Ole Miss","Baylor",3,4,1,0,-8,400910771,2017-01-28
85,1,"10:10",1810,1810,"Terence Davis made Free Throw.",26,14,12,0.60761344645722,"Ole Miss","Baylor",3,4,1,0,-8,400910771,2017-01-28
86,1,"9:52",1792,1792,"Nuni Omot made Three Point Jumper. Assisted by Manu Lecomte.",26,17,9,0.477476825426918,"Ole Miss","Baylor",3,4,1,0,-8,400910771,2017-01-28
87,1,"9:26",1766,1766,"Sebastian Saiz missed Jumper.",26,17,9,0.463134592308208,"Ole Miss","Baylor",3,4,1,0,-8,400910771,2017-01-28
88,1,"9:26",1766,1766,"Jo Lual-Acuil Jr. Defensive Rebound.",26,17,9,0.463134592308208,"Ole Miss","Baylor",3,4,1,0,-8,400910771,2017-01-28
89,1,"9:18",1758,1758,"Nuni Omot Turnover.",26,17,9,0.448922480970851,"Ole Miss","Baylor",3,4,0,0,-8,400910771,2017-01-28
90,1,"9:18",1758,1758,"Sebastian Saiz Steal.",26,17,9,0.448922480970851,"Ole Miss","Baylor",3,4,0,0,-8,400910771,2017-01-28
91,1,"9:12",1752,1752,"Terence Davis missed Three Point Jumper.",26,17,9,0.448922480970851,"Ole Miss","Baylor",3,4,0,0,-8,400910771,2017-01-28
92,1,"9:12",1752,1752,"Baylor Defensive Rebound.",26,17,9,0.448922480970851,"Ole Miss","Baylor",3,4,0,0,-8,400910771,2017-01-28
93,1,"8:57",1737,1737,"Al Freeman missed Layup.",26,17,9,0.494056801369328,"Ole Miss","Baylor",3,4,0,0,-8,400910771,2017-01-28
94,1,"8:57",1737,1737,"Marcanvis Hymon Block.",26,17,9,0.494056801369328,"Ole Miss","Baylor",3,4,0,0,-8,400910771,2017-01-28
95,1,"8:57",1737,1737,"Sebastian Saiz Defensive Rebound.",26,17,9,0.494056801369328,"Ole Miss","Baylor",3,4,0,0,-8,400910771,2017-01-28
96,1,"8:55",1735,1735,"Jump Ball won by Ole Miss",26,17,9,0.494056801369328,"Ole Miss","Baylor",3,4,0,0,-8,400910771,2017-01-28
97,1,"8:48",1728,1728,"Deandre Burnett missed Jumper.",26,17,9,0.542825931674102,"Ole Miss","Baylor",3,4,0,0,-8,400910771,2017-01-28
98,1,"8:48",1728,1728,"Jo Lual-Acuil Jr. Defensive Rebound.",26,17,9,0.542825931674102,"Ole Miss","Baylor",3,4,0,0,-8,400910771,2017-01-28
99,1,"8:25",1705,1705,"Foul on Terence Davis.",26,17,9,0.464565159540837,"Ole Miss","Baylor",3,4,0,0,-8,400910771,2017-01-28
100,1,"8:25",1705,1705,"Ishmail Wainright made Free Throw.",26,18,8,0.432986814122292,"Ole Miss","Baylor",3,4,0,0,-8,400910771,2017-01-28
101,1,"8:25",1705,1705,"Ishmail Wainright missed Free Throw.",26,18,8,0.432986814122292,"Ole Miss","Baylor",3,4,0,0,-8,400910771,2017-01-28
102,1,"8:25",1705,1705,"Sebastian Saiz Defensive Rebound.",26,18,8,0.432986814122292,"Ole Miss","Baylor",3,4,0,0,-8,400910771,2017-01-28
103,1,"8:06",1686,1686,"Cullen Neal made Three Point Jumper. Assisted by Breein Tyree.",29,18,11,0.573381417767541,"Ole Miss","Baylor",3,4,0,0,-8,400910771,2017-01-28
104,1,"7:44",1664,1664,"Ishmail Wainright Turnover.",29,18,11,0.546443595604076,"Ole Miss","Baylor",3,4,0,0,-8,400910771,2017-01-28
105,1,"7:44",1664,1664,"Deandre Burnett Steal.",29,18,11,0.546443595604076,"Ole Miss","Baylor",3,4,0,0,-8,400910771,2017-01-28
106,1,"7:34",1654,1654,"Sebastian Saiz made Jumper. Assisted by Cullen Neal.",31,18,13,0.640613021928118,"Ole Miss","Baylor",3,4,0,0,-8,400910771,2017-01-28
107,1,"7:29",1649,1649,"Baylor  Timeout",31,18,13,0.650501571831591,"Ole Miss","Baylor",2,4,1,0,-8,400910771,2017-01-28
108,1,"7:03",1623,1623,"Manu Lecomte missed Three Point Jumper.",31,18,13,0.642267275095389,"Ole Miss","Baylor",2,4,1,0,-8,400910771,2017-01-28
109,1,"7:03",1623,1623,"Nuni Omot Offensive Rebound.",31,18,13,0.642267275095389,"Ole Miss","Baylor",2,4,1,0,-8,400910771,2017-01-28
110,1,"6:58",1618,1618,"Nuni Omot missed Dunk.",31,18,13,0.64476915535774,"Ole Miss","Baylor",2,4,1,0,-8,400910771,2017-01-28
111,1,"6:58",1618,1618,"Justas Furmanavicius Defensive Rebound.",31,18,13,0.64476915535774,"Ole Miss","Baylor",2,4,1,0,-8,400910771,2017-01-28
112,1,"6:33",1593,1593,"Sebastian Saiz made Layup. Assisted by Cullen Neal.",33,18,15,0.723519698295395,"Ole Miss","Baylor",2,4,1,0,-8,400910771,2017-01-28
113,1,"6:20",1580,1580,"Nuni Omot made Three Point Jumper. Assisted by Jake Lindsey.",33,21,12,0.581619279198456,"Ole Miss","Baylor",2,4,0,0,-8,400910771,2017-01-28
114,1,"6:00",1560,1560,"Cullen Neal missed Jumper.",33,21,12,0.611997187348047,"Ole Miss","Baylor",2,4,0,0,-8,400910771,2017-01-28
115,1,"6:00",1560,1560,"Ishmail Wainright Defensive Rebound.",33,21,12,0.611997187348047,"Ole Miss","Baylor",2,4,0,0,-8,400910771,2017-01-28
116,1,"5:39",1539,1539,"Foul on Justas Furmanavicius.",33,21,12,0.617427511014382,"Ole Miss","Baylor",2,4,0,0,-8,400910771,2017-01-28
117,1,"5:39",1539,1539,"Jake Lindsey made Free Throw.",33,22,11,0.583974436105994,"Ole Miss","Baylor",2,4,0,0,-8,400910771,2017-01-28
118,1,"5:39",1539,1539,"Jake Lindsey made Free Throw.",33,23,10,0.549729413056342,"Ole Miss","Baylor",2,4,0,0,-8,400910771,2017-01-28
119,1,"5:22",1522,1522,"Cullen Neal missed Three Point Jumper.",33,23,10,0.567315719787678,"Ole Miss","Baylor",2,4,0,0,-8,400910771,2017-01-28
120,1,"5:22",1522,1522,"Johnathan Motley Defensive Rebound.",33,23,10,0.567315719787678,"Ole Miss","Baylor",2,4,0,0,-8,400910771,2017-01-28
121,1,"5:09",1509,1509,"Foul on Cullen Neal.",33,23,10,0.560344049225352,"Ole Miss","Baylor",2,4,0,0,-8,400910771,2017-01-28
122,1,"5:09",1509,1509,"Ishmail Wainright made Free Throw.",33,24,9,0.524999373394796,"Ole Miss","Baylor",2,4,0,0,-8,400910771,2017-01-28
123,1,"5:09",1509,1509,"Ishmail Wainright made Free Throw.",33,25,8,0.489402440852789,"Ole Miss","Baylor",2,4,0,0,-8,400910771,2017-01-28
124,1,"4:59",1499,1499,"Sebastian Saiz missed Jumper.",33,25,8,0.514099520240482,"Ole Miss","Baylor",2,4,0,0,-8,400910771,2017-01-28
125,1,"4:59",1499,1499,"Nuni Omot Defensive Rebound.",33,25,8,0.514099520240482,"Ole Miss","Baylor",2,4,0,0,-8,400910771,2017-01-28
126,1,"4:45",1485,1485,"Johnathan Motley made Layup.",33,27,6,0.420654118084227,"Ole Miss","Baylor",2,4,0,1,-8,400910771,2017-01-28
127,1,"4:45",1485,1485,"Ole Miss  Timeout",33,27,6,0.420654118084227,"Ole Miss","Baylor",2,3,0,1,-8,400910771,2017-01-28
128,1,"4:35",1475,1475,"Rasheed Brooks made Jumper.",35,27,8,0.479600482779951,"Ole Miss","Baylor",2,3,0,1,-8,400910771,2017-01-28
129,1,"4:08",1448,1448,"Jake Lindsey missed Three Point Jumper.",35,27,8,0.545578597471167,"Ole Miss","Baylor",2,3,0,1,-8,400910771,2017-01-28
130,1,"4:08",1448,1448,"Justas Furmanavicius Block.",35,27,8,0.545578597471167,"Ole Miss","Baylor",2,3,0,1,-8,400910771,2017-01-28
131,1,"4:08",1448,1448,"Ishmail Wainright Offensive Rebound.",35,27,8,0.545578597471167,"Ole Miss","Baylor",2,3,0,1,-8,400910771,2017-01-28
132,1,"3:58",1438,1438,"Baylor  Turnover.",35,27,8,0.542464777480001,"Ole Miss","Baylor",2,3,0,1,-8,400910771,2017-01-28
133,1,"3:57",1437,1437,"Official TV Timeout",35,27,8,0.542464777480001,"Ole Miss","Baylor",2,3,0,1,-8,400910771,2017-01-28
134,1,"3:37",1417,1417,"Sebastian Saiz made Layup. Assisted by Rasheed Brooks.",37,27,10,0.614146307123769,"Ole Miss","Baylor",2,3,0,0,-8,400910771,2017-01-28
135,1,"3:12",1392,1392,"Johnathan Motley missed Layup.",37,27,10,0.562959097521301,"Ole Miss","Baylor",2,3,0,0,-8,400910771,2017-01-28
136,1,"3:12",1392,1392,"Marcanvis Hymon Block.",37,27,10,0.562959097521301,"Ole Miss","Baylor",2,3,0,0,-8,400910771,2017-01-28
137,1,"3:12",1392,1392,"Johnathan Motley Offensive Rebound.",37,27,10,0.562959097521301,"Ole Miss","Baylor",2,3,0,0,-8,400910771,2017-01-28
138,1,"3:09",1389,1389,"Johnathan Motley made Layup.",37,29,8,0.527876654876412,"Ole Miss","Baylor",2,3,0,0,-8,400910771,2017-01-28
139,1,"3:09",1389,1389,"Foul on Marcanvis Hymon.",37,29,8,0.527876654876412,"Ole Miss","Baylor",2,3,0,0,-8,400910771,2017-01-28
140,1,"3:09",1389,1389,"Johnathan Motley missed Free Throw.",37,29,8,0.527876654876412,"Ole Miss","Baylor",2,3,0,0,-8,400910771,2017-01-28
141,1,"3:09",1389,1389,"Justas Furmanavicius Defensive Rebound.",37,29,8,0.527876654876412,"Ole Miss","Baylor",2,3,0,0,-8,400910771,2017-01-28
142,1,"2:48",1368,1368,"Breein Tyree missed Jumper.",37,29,8,0.52960607061538,"Ole Miss","Baylor",2,3,0,0,-8,400910771,2017-01-28
143,1,"2:48",1368,1368,"Sebastian Saiz Offensive Rebound.",37,29,8,0.52960607061538,"Ole Miss","Baylor",2,3,0,0,-8,400910771,2017-01-28
144,1,"2:41",1361,1361,"Sebastian Saiz made Jumper.",39,29,10,0.604847062180481,"Ole Miss","Baylor",2,3,0,0,-8,400910771,2017-01-28
145,1,"2:28",1348,1348,"Ishmail Wainright Turnover.",39,29,10,0.623406338674416,"Ole Miss","Baylor",2,3,0,0,-8,400910771,2017-01-28
146,1,"2:12",1332,1332,"Foul on Johnathan Motley.",39,29,10,0.602014988161841,"Ole Miss","Baylor",2,3,0,0,-8,400910771,2017-01-28
147,1,"2:12",1332,1332,"Justas Furmanavicius made Free Throw.",40,29,11,0.638634156572862,"Ole Miss","Baylor",2,3,0,0,-8,400910771,2017-01-28
148,1,"2:12",1332,1332,"Justas Furmanavicius missed Free Throw.",40,29,11,0.638634156572862,"Ole Miss","Baylor",2,3,0,0,-8,400910771,2017-01-28
149,1,"2:12",1332,1332,"Jo Lual-Acuil Jr. Defensive Rebound.",40,29,11,0.638634156572862,"Ole Miss","Baylor",2,3,0,0,-8,400910771,2017-01-28
150,1,"1:50",1310,1310,"Nuni Omot made Three Point Jumper. Assisted by Manu Lecomte.",40,32,8,0.567780552888875,"Ole Miss","Baylor",2,3,0,0,-8,400910771,2017-01-28
151,1,"1:30",1290,1290,"Deandre Burnett missed Jumper.",40,32,8,0.612371294237469,"Ole Miss","Baylor",2,3,0,0,-8,400910771,2017-01-28
152,1,"1:30",1290,1290,"Manu Lecomte Defensive Rebound.",40,32,8,0.612371294237469,"Ole Miss","Baylor",2,3,0,0,-8,400910771,2017-01-28
153,1,"1:20",1280,1280,"Ishmail Wainright made Three Point Jumper. Assisted by Manu Lecomte.",40,35,5,0.399130965178718,"Ole Miss","Baylor",2,3,0,0,-8,400910771,2017-01-28
154,1,"1:01",1261,1261,"Sebastian Saiz missed Layup.",40,35,5,0.435762803282319,"Ole Miss","Baylor",2,3,0,0,-8,400910771,2017-01-28
155,1,"1:01",1261,1261,"Jo Lual-Acuil Jr. Defensive Rebound.",40,35,5,0.435762803282319,"Ole Miss","Baylor",2,3,0,0,-8,400910771,2017-01-28
156,1,"0:55",1255,1255,"Manu Lecomte Turnover.",40,35,5,0.437690853275706,"Ole Miss","Baylor",2,3,0,0,-8,400910771,2017-01-28
157,1,"0:39",1239,1239,"Justas Furmanavicius made Layup.",42,35,7,0.51638537157219,"Ole Miss","Baylor",2,3,0,0,-8,400910771,2017-01-28
158,1,"0:23",1223,1223,"Nuni Omot missed Three Point Jumper.",42,35,7,0.537690878287782,"Ole Miss","Baylor",2,3,0,0,-8,400910771,2017-01-28
159,1,"0:23",1223,1223,"Baylor Offensive Rebound.",42,35,7,0.537690878287782,"Ole Miss","Baylor",2,3,0,0,-8,400910771,2017-01-28
160,1,"0:03",1203,1203,"Manu Lecomte Turnover.",42,35,7,0.509319385074388,"Ole Miss","Baylor",2,3,0,0,-8,400910771,2017-01-28
161,1,"0:03",1203,1203,"Justas Furmanavicius Steal.",42,35,7,0.509319385074388,"Ole Miss","Baylor",2,3,0,0,-8,400910771,2017-01-28
162,1,"0:00",1200,1200,"End of 1st half",42,35,7,0.509319385074388,"Ole Miss","Baylor",2,3,0,0,-8,400910771,2017-01-28
163,2,"20:00",1200,1200,"PLAY",42,35,7,0.509319385074388,"Ole Miss","Baylor",3,4,0,0,-8,400910771,2017-01-28
164,2,"20:00",1200,1200,"Jump Ball won by Baylor",42,35,7,0.509319385074388,"Ole Miss","Baylor",3,4,0,0,-8,400910771,2017-01-28
165,2,"19:44",1184,1184,"Johnathan Motley missed Jumper.",42,35,7,0.517554936202476,"Ole Miss","Baylor",3,4,0,0,-8,400910771,2017-01-28
166,2,"19:44",1184,1184,"Sebastian Saiz Defensive Rebound.",42,35,7,0.517554936202476,"Ole Miss","Baylor",3,4,0,0,-8,400910771,2017-01-28
167,2,"19:23",1163,1163,"Breein Tyree missed Layup.",42,35,7,0.487412803922947,"Ole Miss","Baylor",3,4,0,0,-8,400910771,2017-01-28
168,2,"19:23",1163,1163,"Sebastian Saiz Offensive Rebound.",42,35,7,0.487412803922947,"Ole Miss","Baylor",3,4,0,0,-8,400910771,2017-01-28
169,2,"19:22",1162,1162,"Foul on Jo Lual-Acuil Jr..",42,35,7,0.487412803922947,"Ole Miss","Baylor",3,4,0,0,-8,400910771,2017-01-28
170,2,"19:22",1162,1162,"Sebastian Saiz made Free Throw.",43,35,8,0.528594097517729,"Ole Miss","Baylor",3,4,0,0,-8,400910771,2017-01-28
171,2,"19:22",1162,1162,"Sebastian Saiz made Free Throw.",44,35,9,0.569389820713138,"Ole Miss","Baylor",3,4,0,0,-8,400910771,2017-01-28
172,2,"19:07",1147,1147,"Manu Lecomte Turnover.",44,35,9,0.64532109547383,"Ole Miss","Baylor",3,4,0,0,-8,400910771,2017-01-28
173,2,"18:58",1138,1138,"Cullen Neal Turnover.",44,35,9,0.602640101535393,"Ole Miss","Baylor",3,4,0,0,-8,400910771,2017-01-28
174,2,"18:41",1121,1121,"Jo Lual-Acuil Jr. made Jumper. Assisted by Ishmail Wainright.",44,37,7,0.558897882609966,"Ole Miss","Baylor",3,4,0,0,-8,400910771,2017-01-28
175,2,"18:41",1121,1121,"Foul on Terence Davis.",44,37,7,0.558897882609966,"Ole Miss","Baylor",3,4,0,0,-8,400910771,2017-01-28
176,2,"18:41",1121,1121,"Jo Lual-Acuil Jr. missed Free Throw.",44,37,7,0.558897882609966,"Ole Miss","Baylor",3,4,0,0,-8,400910771,2017-01-28
177,2,"18:41",1121,1121,"Breein Tyree Defensive Rebound.",44,37,7,0.558897882609966,"Ole Miss","Baylor",3,4,0,0,-8,400910771,2017-01-28
178,2,"18:23",1103,1103,"Marcanvis Hymon missed Jumper.",44,37,7,0.517186661717356,"Ole Miss","Baylor",3,4,0,0,-8,400910771,2017-01-28
179,2,"18:23",1103,1103,"Al Freeman Defensive Rebound.",44,37,7,0.517186661717356,"Ole Miss","Baylor",3,4,0,0,-8,400910771,2017-01-28
180,2,"18:11",1091,1091,"Al Freeman Turnover.",44,37,7,0.546579900603212,"Ole Miss","Baylor",3,4,0,0,-8,400910771,2017-01-28
181,2,"18:11",1091,1091,"Breein Tyree Steal.",44,37,7,0.546579900603212,"Ole Miss","Baylor",3,4,0,0,-8,400910771,2017-01-28
182,2,"18:07",1087,1087,"Foul on Manu Lecomte.",44,37,7,0.531787072227697,"Ole Miss","Baylor",3,4,0,0,-8,400910771,2017-01-28
183,2,"17:52",1072,1072,"Marcanvis Hymon Turnover.",44,37,7,0.571564377282129,"Ole Miss","Baylor",3,4,0,0,-8,400910771,2017-01-28
184,2,"17:48",1068,1068,"Al Freeman missed Three Point Jumper.",44,37,7,0.588601733994246,"Ole Miss","Baylor",3,4,0,0,-8,400910771,2017-01-28
185,2,"17:48",1068,1068,"Jo Lual-Acuil Jr. Offensive Rebound.",44,37,7,0.588601733994246,"Ole Miss","Baylor",3,4,0,0,-8,400910771,2017-01-28
186,2,"17:41",1061,1061,"Jo Lual-Acuil Jr. made Layup.",44,39,5,0.503337032479282,"Ole Miss","Baylor",3,4,0,0,-8,400910771,2017-01-28
187,2,"17:19",1039,1039,"Sebastian Saiz missed Three Point Jumper.",44,39,5,0.452262860977952,"Ole Miss","Baylor",3,4,0,0,-8,400910771,2017-01-28
188,2,"17:19",1039,1039,"Ishmail Wainright Defensive Rebound.",44,39,5,0.452262860977952,"Ole Miss","Baylor",3,4,0,0,-8,400910771,2017-01-28
189,2,"17:01",1021,1021,"Johnathan Motley missed Jumper.",44,39,5,0.488486793777284,"Ole Miss","Baylor",3,4,0,0,-8,400910771,2017-01-28
