"play_id","half","time_remaining_half","secs_remaining","secs_remaining_absolute","description","home_score","away_score","score_diff","win_prob","home","away","home_time_out_remaining","away_time_out_remaining","home_timeout_ind","away_timeout_ind","home_favored_by","game_id","date"
196,2,"16:18",978,978,"George Willborn III made Three Point Jumper. Assisted by Kendell Ramlal.",64,57,7,0.928494395582574,"Tulsa","UTSA",6,4,0,0,10,400987975,2017-11-28
197,2,"15:52",952,952,"Junior Etou made Three Point Jumper. Assisted by DaQuan Jeffries.",67,57,10,0.960480479140203,"Tulsa","UTSA",6,4,0,0,10,400987975,2017-11-28
198,2,"15:34",934,934,"George Willborn III missed Three Point Jumper.",67,57,10,0.957525195591136,"Tulsa","UTSA",6,4,0,0,10,400987975,2017-11-28
199,2,"15:34",934,934,"DaQuan Jeffries Defensive Rebound.",67,57,10,0.957525195591136,"Tulsa","UTSA",6,4,0,0,10,400987975,2017-11-28
200,2,"15:15",915,915,"Foul on Kendell Ramlal.",67,57,10,0.962796603738771,"Tulsa","UTSA",6,4,0,0,10,400987975,2017-11-28
201,2,"15:15",915,915,"Official TV Timeout",67,57,10,0.962796603738771,"Tulsa","UTSA",6,4,0,0,10,400987975,2017-11-28
202,2,"15:15",915,915,"Jaleel Wheeler missed Free Throw.",67,57,10,0.962796603738771,"Tulsa","UTSA",6,4,0,0,10,400987975,2017-11-28
203,2,"15:15",915,915,"Tulsa Deadball Team Rebound.",67,57,10,0.962796603738771,"Tulsa","UTSA",6,4,0,0,10,400987975,2017-11-28
204,2,"15:15",915,915,"Jaleel Wheeler missed Free Throw.",67,57,10,0.962796603738771,"Tulsa","UTSA",6,4,0,0,10,400987975,2017-11-28
205,2,"15:15",915,915,"George Willborn III Defensive Rebound.",67,57,10,0.962796603738771,"Tulsa","UTSA",6,4,0,0,10,400987975,2017-11-28
206,2,"14:54",894,894,"Jhivvan Jackson Turnover.",67,57,10,0.959467164277517,"Tulsa","UTSA",6,4,0,0,10,400987975,2017-11-28
207,2,"14:53",893,893,"Sterling Taplin Steal.",67,57,10,0.959467164277517,"Tulsa","UTSA",6,4,0,0,10,400987975,2017-11-28
208,2,"14:50",890,890,"Sterling Taplin made Layup.",69,57,12,0.972154723397542,"Tulsa","UTSA",6,4,0,0,10,400987975,2017-11-28
209,2,"14:38",878,878,"Foul on George Willborn III.",69,57,12,0.971568834713324,"Tulsa","UTSA",6,4,0,0,10,400987975,2017-11-28
210,2,"14:38",878,878,"George Willborn III Turnover.",69,57,12,0.971568834713324,"Tulsa","UTSA",6,4,0,0,10,400987975,2017-11-28
211,2,"14:20",860,860,"Jaleel Wheeler missed Layup.",69,57,12,0.969891391429252,"Tulsa","UTSA",6,4,0,0,10,400987975,2017-11-28
212,2,"14:20",860,860,"DaQuan Jeffries Offensive Rebound.",69,57,12,0.969891391429252,"Tulsa","UTSA",6,4,0,0,10,400987975,2017-11-28
213,2,"14:18",858,858,"DaQuan Jeffries missed Jumper.",69,57,12,0.975482347142499,"Tulsa","UTSA",6,4,0,0,10,400987975,2017-11-28
214,2,"14:18",858,858,"Martins Igbanu Offensive Rebound.",69,57,12,0.975482347142499,"Tulsa","UTSA",6,4,0,0,10,400987975,2017-11-28
215,2,"14:07",847,847,"Jaleel Wheeler missed Three Point Jumper.",69,57,12,0.975569295890938,"Tulsa","UTSA",6,4,0,0,10,400987975,2017-11-28
216,2,"14:07",847,847,"Giovanni De Nicolao Defensive Rebound.",69,57,12,0.975569295890938,"Tulsa","UTSA",6,4,0,0,10,400987975,2017-11-28
217,2,"13:59",839,839,"Giovanni De Nicolao missed Jumper.",69,57,12,0.977447580153247,"Tulsa","UTSA",6,4,0,0,10,400987975,2017-11-28
218,2,"13:59",839,839,"Jaleel Wheeler Defensive Rebound.",69,57,12,0.977447580153247,"Tulsa","UTSA",6,4,0,0,10,400987975,2017-11-28
219,2,"13:53",833,833,"Foul on Jaleel Wheeler.",69,57,12,0.977447580153247,"Tulsa","UTSA",6,4,0,0,10,400987975,2017-11-28
220,2,"13:53",833,833,"Jaleel Wheeler Turnover.",69,57,12,0.977447580153247,"Tulsa","UTSA",6,4,0,0,10,400987975,2017-11-28
221,2,"13:42",822,822,"Jhivvan Jackson missed Jumper.",69,57,12,0.970059043892384,"Tulsa","UTSA",6,4,0,0,10,400987975,2017-11-28
222,2,"13:42",822,822,"DaQuan Jeffries Defensive Rebound.",69,57,12,0.970059043892384,"Tulsa","UTSA",6,4,0,0,10,400987975,2017-11-28
223,2,"13:30",810,810,"Martins Igbanu Turnover.",69,57,12,0.972154516804091,"Tulsa","UTSA",6,4,0,0,10,400987975,2017-11-28
224,2,"13:20",800,800,"Deon Lyle made Three Point Jumper.",69,60,9,0.956783560790351,"Tulsa","UTSA",6,4,0,0,10,400987975,2017-11-28
225,2,"12:52",772,772,"Martins Igbanu made Jumper.",71,60,11,0.970047354859963,"Tulsa","UTSA",6,4,0,0,10,400987975,2017-11-28
226,2,"12:41",761,761,"Foul on Elijah Joiner.",71,60,11,0.974928966464144,"Tulsa","UTSA",6,4,0,0,10,400987975,2017-11-28
227,2,"12:41",761,761,"Jhivvan Jackson made Free Throw.",71,61,10,0.96907405194738,"Tulsa","UTSA",6,4,0,0,10,400987975,2017-11-28
228,2,"12:41",761,761,"Jhivvan Jackson made Free Throw.",71,62,9,0.961905248514306,"Tulsa","UTSA",6,4,0,0,10,400987975,2017-11-28
229,2,"12:24",744,744,"Corey Henderson Jr. missed Three Point Jumper.",71,62,9,0.957965097330885,"Tulsa","UTSA",6,4,0,0,10,400987975,2017-11-28
230,2,"12:24",744,744,"Jhivvan Jackson Defensive Rebound.",71,62,9,0.957965097330885,"Tulsa","UTSA",6,4,0,0,10,400987975,2017-11-28
231,2,"12:17",737,737,"Jhivvan Jackson missed Three Point Jumper.",71,62,9,0.951740880043944,"Tulsa","UTSA",6,4,0,0,10,400987975,2017-11-28
232,2,"12:17",737,737,"Elijah Joiner Defensive Rebound.",71,62,9,0.951740880043944,"Tulsa","UTSA",6,4,0,0,10,400987975,2017-11-28
233,2,"12:06",726,726,"Elijah Joiner Turnover.",71,62,9,0.958754238657207,"Tulsa","UTSA",6,4,0,0,10,400987975,2017-11-28
234,2,"12:05",725,725,"Austin Karrer Steal.",71,62,9,0.958754238657207,"Tulsa","UTSA",6,4,0,0,10,400987975,2017-11-28
235,2,"12:04",724,724,"Foul on Elijah Joiner.",71,62,9,0.958754238657207,"Tulsa","UTSA",6,4,0,0,10,400987975,2017-11-28
236,2,"12:04",724,724,"Jhivvan Jackson made Free Throw.",71,63,8,0.949117102409854,"Tulsa","UTSA",6,4,0,0,10,400987975,2017-11-28
237,2,"12:04",724,724,"Jhivvan Jackson made Free Throw.",71,64,7,0.937375314743129,"Tulsa","UTSA",6,4,0,0,10,400987975,2017-11-28
238,2,"11:48",708,708,"Sterling Taplin made Jumper.",73,64,9,0.952249912059065,"Tulsa","UTSA",6,4,0,0,10,400987975,2017-11-28
239,2,"11:39",699,699,"Deon Lyle missed Three Point Jumper.",73,64,9,0.966928471802074,"Tulsa","UTSA",6,4,0,0,10,400987975,2017-11-28
240,2,"11:39",699,699,"Sterling Taplin Defensive Rebound.",73,64,9,0.966928471802074,"Tulsa","UTSA",6,4,0,0,10,400987975,2017-11-28
241,2,"11:27",687,687,"Geno Artison missed Three Point Jumper.",73,64,9,0.95711929121538,"Tulsa","UTSA",6,4,0,0,10,400987975,2017-11-28
242,2,"11:27",687,687,"Kendell Ramlal Defensive Rebound.",73,64,9,0.95711929121538,"Tulsa","UTSA",6,4,0,0,10,400987975,2017-11-28
243,2,"11:13",673,673,"Keaton Wallace missed Three Point Jumper.",73,64,9,0.960439625999772,"Tulsa","UTSA",6,4,0,0,10,400987975,2017-11-28
244,2,"11:13",673,673,"Sterling Taplin Defensive Rebound.",73,64,9,0.960439625999772,"Tulsa","UTSA",6,4,0,0,10,400987975,2017-11-28
245,2,"10:53",653,653,"Sterling Taplin made Three Point Jumper. Assisted by Junior Etou.",76,64,12,0.981225070577874,"Tulsa","UTSA",6,4,0,0,10,400987975,2017-11-28
246,2,"10:45",645,645,"UT San Antonio  Timeout",76,64,12,0.981059618575175,"Tulsa","UTSA",6,3,0,1,10,400987975,2017-11-28
247,2,"10:35",635,635,"Nick Allen made Jumper.",76,66,10,0.964721870189322,"Tulsa","UTSA",6,3,0,1,10,400987975,2017-11-28
248,2,"10:18",618,618,"Junior Etou missed Three Point Jumper.",76,66,10,0.970974765269944,"Tulsa","UTSA",6,3,0,1,10,400987975,2017-11-28
249,2,"10:18",618,618,"Austin Karrer Defensive Rebound.",76,66,10,0.970974765269944,"Tulsa","UTSA",6,3,0,1,10,400987975,2017-11-28
250,2,"9:51",591,591,"Austin Karrer missed Three Point Jumper.",76,66,10,0.968662253372213,"Tulsa","UTSA",6,3,0,1,10,400987975,2017-11-28
251,2,"9:51",591,591,"Junior Etou Defensive Rebound.",76,66,10,0.968662253372213,"Tulsa","UTSA",6,3,0,1,10,400987975,2017-11-28
252,2,"9:39",579,579,"Sterling Taplin missed Three Point Jumper.",76,66,10,0.974959477680806,"Tulsa","UTSA",6,3,0,0,10,400987975,2017-11-28
253,2,"9:39",579,579,"Lawson Korita Offensive Rebound.",76,66,10,0.974959477680806,"Tulsa","UTSA",6,3,0,0,10,400987975,2017-11-28
254,2,"9:21",561,561,"Corey Henderson Jr. made Layup.",78,66,12,0.986137784672953,"Tulsa","UTSA",6,3,0,0,10,400987975,2017-11-28
255,2,"9:02",542,542,"Giovanni De Nicolao made Jumper.",78,68,10,0.97359429859366,"Tulsa","UTSA",6,3,0,0,10,400987975,2017-11-28
256,2,"8:43",523,523,"Lawson Korita missed Three Point Jumper.",78,68,10,0.974577142658266,"Tulsa","UTSA",6,3,0,0,10,400987975,2017-11-28
257,2,"8:43",523,523,"Byron Frohnen Defensive Rebound.",78,68,10,0.974577142658266,"Tulsa","UTSA",6,3,0,0,10,400987975,2017-11-28
258,2,"8:38",518,518,"Foul on Geno Artison.",78,68,10,0.973659402998244,"Tulsa","UTSA",6,3,0,0,10,400987975,2017-11-28
259,2,"8:38",518,518,"Official TV Timeout",78,68,10,0.973659402998244,"Tulsa","UTSA",6,3,0,0,10,400987975,2017-11-28
260,2,"8:38",518,518,"Byron Frohnen missed Free Throw.",78,68,10,0.973659402998244,"Tulsa","UTSA",6,3,0,0,10,400987975,2017-11-28
261,2,"8:38",518,518,"DaQuan Jeffries Defensive Rebound.",78,68,10,0.973659402998244,"Tulsa","UTSA",6,3,0,0,10,400987975,2017-11-28
262,2,"8:18",498,498,"DaQuan Jeffries Turnover.",78,68,10,0.976514098251634,"Tulsa","UTSA",6,3,0,0,10,400987975,2017-11-28
263,2,"8:17",497,497,"Keaton Wallace Steal.",78,68,10,0.976514098251634,"Tulsa","UTSA",6,3,0,0,10,400987975,2017-11-28
264,2,"8:16",496,496,"Keaton Wallace missed Layup.",78,68,10,0.976514098251634,"Tulsa","UTSA",6,3,0,0,10,400987975,2017-11-28
265,2,"8:16",496,496,"Curran Scott Defensive Rebound.",78,68,10,0.976514098251634,"Tulsa","UTSA",6,3,0,0,10,400987975,2017-11-28
266,2,"8:15",495,495,"Foul on Austin Karrer.",78,68,10,0.976514098251634,"Tulsa","UTSA",6,3,0,0,10,400987975,2017-11-28
267,2,"8:15",495,495,"Curran Scott made Free Throw.",79,68,11,0.982007200405666,"Tulsa","UTSA",6,3,0,0,10,400987975,2017-11-28
268,2,"8:13",493,493,"Curran Scott made Free Throw.",80,68,12,0.986233636600837,"Tulsa","UTSA",6,3,0,0,10,400987975,2017-11-28
269,2,"7:59",479,479,"Deon Lyle missed Three Point Jumper.",80,68,12,0.988898153741947,"Tulsa","UTSA",6,3,0,0,10,400987975,2017-11-28
270,2,"7:59",479,479,"Martins Igbanu Defensive Rebound.",80,68,12,0.988898153741947,"Tulsa","UTSA",6,3,0,0,10,400987975,2017-11-28
271,2,"7:58",478,478,"Foul on Nick Allen.",80,68,12,0.988898153741947,"Tulsa","UTSA",6,3,0,0,10,400987975,2017-11-28
272,2,"7:58",478,478,"Official TV Timeout",80,68,12,0.988898153741947,"Tulsa","UTSA",6,3,0,0,10,400987975,2017-11-28
273,2,"7:58",478,478,"Martins Igbanu missed Free Throw.",80,68,12,0.988898153741947,"Tulsa","UTSA",6,3,0,0,10,400987975,2017-11-28
274,2,"7:58",478,478,"Deon Lyle Defensive Rebound.",80,68,12,0.988898153741947,"Tulsa","UTSA",6,3,0,0,10,400987975,2017-11-28
275,2,"7:32",452,452,"Foul on DaQuan Jeffries.",80,68,12,0.99064402838646,"Tulsa","UTSA",6,3,0,0,10,400987975,2017-11-28
276,2,"7:32",452,452,"Jhivvan Jackson missed Free Throw.",80,68,12,0.99064402838646,"Tulsa","UTSA",6,3,0,0,10,400987975,2017-11-28
277,2,"7:32",452,452,"UT San Antonio Deadball Team Rebound.",80,68,12,0.99064402838646,"Tulsa","UTSA",6,3,0,0,10,400987975,2017-11-28
278,2,"7:32",452,452,"Jhivvan Jackson made Free Throw.",80,69,11,0.987198428941295,"Tulsa","UTSA",6,3,0,0,10,400987975,2017-11-28
279,2,"7:13",433,433,"Curran Scott missed Three Point Jumper.",80,69,11,0.98790874896847,"Tulsa","UTSA",6,3,0,0,10,400987975,2017-11-28
280,2,"7:13",433,433,"Martins Igbanu Offensive Rebound.",80,69,11,0.98790874896847,"Tulsa","UTSA",6,3,0,0,10,400987975,2017-11-28
281,2,"7:07",427,427,"Martins Igbanu missed Layup.",80,69,11,0.983981085229423,"Tulsa","UTSA",6,3,0,0,10,400987975,2017-11-28
282,2,"7:07",427,427,"Tulsa Offensive Rebound.",80,69,11,0.983981085229423,"Tulsa","UTSA",6,3,0,0,10,400987975,2017-11-28
283,2,"6:49",409,409,"Martins Igbanu made Jumper.",82,69,13,0.994244106253542,"Tulsa","UTSA",6,3,0,0,10,400987975,2017-11-28
284,2,"6:36",396,396,"Deon Lyle missed Three Point Jumper.",82,69,13,0.993244601734719,"Tulsa","UTSA",6,3,0,0,10,400987975,2017-11-28
285,2,"6:36",396,396,"Martins Igbanu Defensive Rebound.",82,69,13,0.993244601734719,"Tulsa","UTSA",6,3,0,0,10,400987975,2017-11-28
286,2,"6:03",363,363,"Jaleel Wheeler missed Jumper.",82,69,13,0.993528503941958,"Tulsa","UTSA",6,3,0,0,10,400987975,2017-11-28
287,2,"6:03",363,363,"Kendell Ramlal Defensive Rebound.",82,69,13,0.993528503941958,"Tulsa","UTSA",6,3,0,0,10,400987975,2017-11-28
288,2,"5:58",358,358,"Foul on Jaleel Wheeler.",82,69,13,0.99462389741116,"Tulsa","UTSA",6,3,0,0,10,400987975,2017-11-28
289,2,"5:58",358,358,"Jhivvan Jackson made Free Throw.",82,70,12,0.992461238510577,"Tulsa","UTSA",6,3,0,0,10,400987975,2017-11-28
290,2,"5:58",358,358,"Jhivvan Jackson made Free Throw.",82,71,11,0.98943783965647,"Tulsa","UTSA",6,3,0,0,10,400987975,2017-11-28
291,2,"5:29",329,329,"Foul on Keaton Wallace.",82,71,11,0.987493427691838,"Tulsa","UTSA",6,3,0,0,10,400987975,2017-11-28
292,2,"5:29",329,329,"Sterling Taplin made Free Throw.",83,71,12,0.990832029382642,"Tulsa","UTSA",6,3,0,0,10,400987975,2017-11-28
293,2,"5:29",329,329,"Sterling Taplin made Free Throw.",84,71,13,0.993285458775672,"Tulsa","UTSA",6,3,0,0,10,400987975,2017-11-28
294,2,"5:21",321,321,"Kendell Ramlal made Jumper. Assisted by Byron Frohnen.",84,73,11,0.987493427691838,"Tulsa","UTSA",6,3,0,0,10,400987975,2017-11-28
295,2,"4:53",293,293,"Foul on Giovanni De Nicolao.",84,73,11,0.990964473389596,"Tulsa","UTSA",6,3,0,0,10,400987975,2017-11-28
296,2,"4:53",293,293,"Sterling Taplin made Free Throw.",85,73,12,0.993570855862823,"Tulsa","UTSA",6,3,0,0,10,400987975,2017-11-28
297,2,"4:53",293,293,"Sterling Taplin made Free Throw.",86,73,13,0.995428870916764,"Tulsa","UTSA",6,3,0,0,10,400987975,2017-11-28
298,2,"4:45",285,285,"Foul on Curran Scott.",86,73,13,0.99549556287565,"Tulsa","UTSA",6,3,0,0,10,400987975,2017-11-28
299,2,"4:45",285,285,"Kendell Ramlal missed Free Throw.",86,73,13,0.99549556287565,"Tulsa","UTSA",6,3,0,0,10,400987975,2017-11-28
300,2,"4:45",285,285,"UT San Antonio Deadball Team Rebound.",86,73,13,0.99549556287565,"Tulsa","UTSA",6,3,0,0,10,400987975,2017-11-28
301,2,"4:45",285,285,"Kendell Ramlal made Free Throw.",86,74,12,0.9936021942,"Tulsa","UTSA",6,3,0,0,10,400987975,2017-11-28
302,2,"4:22",262,262,"Junior Etou Turnover.",86,74,12,0.995020709204789,"Tulsa","UTSA",6,3,0,0,10,400987975,2017-11-28
303,2,"4:20",260,260,"Giovanni De Nicolao Steal.",86,74,12,0.995020709204789,"Tulsa","UTSA",6,3,0,0,10,400987975,2017-11-28
304,2,"4:05",245,245,"Keaton Wallace missed Three Point Jumper.",86,74,12,0.996281936645634,"Tulsa","UTSA",6,3,0,0,10,400987975,2017-11-28
305,2,"4:04",244,244,"Byron Frohnen Offensive Rebound.",86,74,12,0.996281936645634,"Tulsa","UTSA",6,3,0,0,10,400987975,2017-11-28
306,2,"3:57",237,237,"Foul on George Willborn III.",86,74,12,0.996323911771772,"Tulsa","UTSA",6,3,0,0,10,400987975,2017-11-28
307,2,"3:57",237,237,"George Willborn III Turnover.",86,74,12,0.996323911771772,"Tulsa","UTSA",6,3,0,0,10,400987975,2017-11-28
308,2,"3:57",237,237,"Official TV Timeout",86,74,12,0.996323911771772,"Tulsa","UTSA",6,3,0,0,10,400987975,2017-11-28
309,2,"3:57",237,237,"Junior Etou missed Free Throw.",86,74,12,0.996323911771772,"Tulsa","UTSA",6,3,0,0,10,400987975,2017-11-28
310,2,"3:57",237,237,"Tulsa Deadball Team Rebound.",86,74,12,0.996323911771772,"Tulsa","UTSA",6,3,0,0,10,400987975,2017-11-28
311,2,"3:57",237,237,"Junior Etou made Free Throw.",87,74,13,0.997547092429769,"Tulsa","UTSA",6,3,0,0,10,400987975,2017-11-28
312,2,"3:45",225,225,"Giovanni De Nicolao made Three Point Jumper. Assisted by Jhivvan Jackson.",87,77,10,0.994320023571048,"Tulsa","UTSA",6,3,0,0,10,400987975,2017-11-28
313,2,"3:10",190,190,"Sterling Taplin missed Jumper.",87,77,10,0.994689383303835,"Tulsa","UTSA",6,3,0,0,10,400987975,2017-11-28
314,2,"3:10",190,190,"Jhivvan Jackson Defensive Rebound.",87,77,10,0.994689383303835,"Tulsa","UTSA",6,3,0,0,10,400987975,2017-11-28
315,2,"2:53",173,173,"Deon Lyle made Three Point Jumper. Assisted by Byron Frohnen.",87,80,7,0.985152978683043,"Tulsa","UTSA",6,3,0,0,10,400987975,2017-11-28
316,2,"2:26",146,146,"Jaleel Wheeler Turnover.",87,80,7,0.98752567630886,"Tulsa","UTSA",6,3,0,0,10,400987975,2017-11-28
317,2,"2:25",145,145,"Byron Frohnen Steal.",87,80,7,0.98752567630886,"Tulsa","UTSA",6,3,0,0,10,400987975,2017-11-28
318,2,"2:21",141,141,"Jhivvan Jackson made Three Point Jumper. Assisted by Keaton Wallace.",87,83,4,0.943592900152674,"Tulsa","UTSA",6,3,0,1,10,400987975,2017-11-28
319,2,"2:21",141,141,"Tulsa  Timeout",87,83,4,0.943592900152674,"Tulsa","UTSA",6,2,0,1,10,400987975,2017-11-28
320,2,"1:57",117,117,"Foul on Giovanni De Nicolao.",87,83,4,0.956214725582544,"Tulsa","UTSA",6,2,0,1,10,400987975,2017-11-28
321,2,"1:57",117,117,"Junior Etou made Free Throw.",88,83,5,0.975505855298577,"Tulsa","UTSA",6,2,0,1,10,400987975,2017-11-28
322,2,"1:57",117,117,"Junior Etou made Free Throw.",89,83,6,0.986418326646335,"Tulsa","UTSA",6,2,0,1,10,400987975,2017-11-28
323,2,"1:47",107,107,"Deon Lyle missed Three Point Jumper.",89,83,6,0.985564789768708,"Tulsa","UTSA",6,2,0,1,10,400987975,2017-11-28
324,2,"1:47",107,107,"Tulsa Defensive Rebound.",89,83,6,0.985564789768708,"Tulsa","UTSA",6,2,0,1,10,400987975,2017-11-28
325,2,"1:38",98,98,"Foul on Austin Karrer.",89,83,6,0.985846554168749,"Tulsa","UTSA",6,2,0,1,10,400987975,2017-11-28
326,2,"1:38",98,98,"Curran Scott missed Free Throw.",89,83,6,0.985846554168749,"Tulsa","UTSA",6,2,0,1,10,400987975,2017-11-28
327,2,"1:38",98,98,"Tulsa Deadball Team Rebound.",89,83,6,0.985846554168749,"Tulsa","UTSA",6,2,0,1,10,400987975,2017-11-28
328,2,"1:38",98,98,"Curran Scott made Free Throw.",90,83,7,0.99240312318452,"Tulsa","UTSA",6,2,0,1,10,400987975,2017-11-28
329,2,"1:29",89,89,"Jhivvan Jackson Turnover.",90,83,7,0.996779934134836,"Tulsa","UTSA",6,2,0,1,10,400987975,2017-11-28
330,2,"1:10",70,70,"Corey Henderson Jr. missed Three Point Jumper.",90,83,7,0.996388507207538,"Tulsa","UTSA",6,2,0,0,10,400987975,2017-11-28
331,2,"1:10",70,70,"Austin Karrer Defensive Rebound.",90,83,7,0.996388507207538,"Tulsa","UTSA",6,2,0,0,10,400987975,2017-11-28
332,2,"1:10",70,70,"Foul on Junior Etou.",90,83,7,0.996388507207538,"Tulsa","UTSA",6,2,0,0,10,400987975,2017-11-28
333,2,"1:10",70,70,"Austin Karrer made Free Throw.",90,84,6,0.99249770584495,"Tulsa","UTSA",6,2,0,0,10,400987975,2017-11-28
334,2,"1:10",70,70,"Austin Karrer made Free Throw.",90,85,5,0.984480482285436,"Tulsa","UTSA",6,2,0,0,10,400987975,2017-11-28
335,2,"1:06",66,66,"Foul on Jhivvan Jackson.",90,85,5,0.980809538692431,"Tulsa","UTSA",6,2,0,0,10,400987975,2017-11-28
336,2,"1:06",66,66,"Sterling Taplin missed Free Throw.",90,85,5,0.980809538692431,"Tulsa","UTSA",6,2,0,0,10,400987975,2017-11-28
337,2,"1:06",66,66,"Tulsa Deadball Team Rebound.",90,85,5,0.980809538692431,"Tulsa","UTSA",6,2,0,0,10,400987975,2017-11-28
338,2,"1:06",66,66,"Sterling Taplin made Free Throw.",91,85,6,0.990771711621235,"Tulsa","UTSA",6,2,0,0,10,400987975,2017-11-28
339,2,"0:57",57,57,"Deon Lyle missed Layup.",91,85,6,0.997466679743763,"Tulsa","UTSA",6,2,0,0,10,400987975,2017-11-28
340,2,"0:57",57,57,"DaQuan Jeffries Defensive Rebound.",91,85,6,0.997466679743763,"Tulsa","UTSA",6,2,0,0,10,400987975,2017-11-28
341,2,"0:51",51,51,"Foul on Jhivvan Jackson.",91,85,6,0.997891449890651,"Tulsa","UTSA",6,2,0,0,10,400987975,2017-11-28
342,2,"0:51",51,51,"Sterling Taplin made Free Throw.",92,85,7,0.999139242965443,"Tulsa","UTSA",6,2,0,0,10,400987975,2017-11-28
343,2,"0:51",51,51,"Sterling Taplin made Free Throw.",93,85,8,0.999648879661859,"Tulsa","UTSA",6,2,0,0,10,400987975,2017-11-28
344,2,"0:47",47,47,"Keaton Wallace made Three Point Jumper. Assisted by Giovanni De Nicolao.",93,88,5,0.99542535436866,"Tulsa","UTSA",6,2,0,0,10,400987975,2017-11-28
345,2,"0:46",46,46,"UT San Antonio  Timeout",93,88,5,0.99542535436866,"Tulsa","UTSA",6,1,0,1,10,400987975,2017-11-28
346,2,"0:40",40,40,"Foul on Jhivvan Jackson.",93,88,5,0.992530605518102,"Tulsa","UTSA",6,1,0,1,10,400987975,2017-11-28
347,2,"0:40",40,40,"Curran Scott made Free Throw.",94,88,6,0.997241447082057,"Tulsa","UTSA",6,1,0,1,10,400987975,2017-11-28
348,2,"0:40",40,40,"Curran Scott made Free Throw.",95,88,7,0.998984267944454,"Tulsa","UTSA",6,1,0,1,10,400987975,2017-11-28
349,2,"0:37",37,37,"Foul on Elijah Joiner.",95,88,7,0.998665609745836,"Tulsa","UTSA",6,1,0,1,10,400987975,2017-11-28
350,2,"0:37",37,37,"Giovanni De Nicolao made Free Throw.",95,89,6,0.996600257175606,"Tulsa","UTSA",6,1,0,1,10,400987975,2017-11-28
351,2,"0:37",37,37,"Giovanni De Nicolao made Free Throw.",95,90,5,0.99136581570053,"Tulsa","UTSA",6,1,0,1,10,400987975,2017-11-28
352,2,"0:37",37,37,"Tulsa  Timeout",95,90,5,0.99136581570053,"Tulsa","UTSA",6,0,0,1,10,400987975,2017-11-28
353,2,"0:29",29,29,"Foul on Byron Frohnen.",95,90,5,0.994503258482056,"Tulsa","UTSA",6,0,0,1,10,400987975,2017-11-28
354,2,"0:29",29,29,"Curran Scott made Free Throw.",96,90,6,0.997991653065217,"Tulsa","UTSA",6,0,0,1,10,400987975,2017-11-28
355,2,"0:29",29,29,"Curran Scott made Free Throw.",97,90,7,0.999267839216392,"Tulsa","UTSA",6,0,0,1,10,400987975,2017-11-28
356,2,"0:24",24,24,"Deon Lyle missed Three Point Jumper.",97,90,7,0.998725319303419,"Tulsa","UTSA",6,0,0,1,10,400987975,2017-11-28
357,2,"0:24",24,24,"DaQuan Jeffries Defensive Rebound.",97,90,7,0.998725319303419,"Tulsa","UTSA",6,0,0,1,10,400987975,2017-11-28
358,2,"0:17",17,17,"Foul on Byron Frohnen.",97,90,7,0.99964343246784,"Tulsa","UTSA",6,0,0,1,10,400987975,2017-11-28
359,2,"0:17",17,17,"Jaleel Wheeler missed Free Throw.",97,90,7,0.99964343246784,"Tulsa","UTSA",6,0,0,1,10,400987975,2017-11-28
360,2,"0:17",17,17,"Tulsa Deadball Team Rebound.",97,90,7,0.99964343246784,"Tulsa","UTSA",6,0,0,1,10,400987975,2017-11-28
361,2,"0:17",17,17,"Jaleel Wheeler made Free Throw.",98,90,8,0.99988261470492,"Tulsa","UTSA",6,0,0,1,10,400987975,2017-11-28
362,2,"0:13",13,13,"Foul on DaQuan Jeffries.",98,90,8,0.999996571348576,"Tulsa","UTSA",6,0,0,1,10,400987975,2017-11-28
363,2,"0:13",13,13,"Jhivvan Jackson made Free Throw.",98,91,7,0.999985717580389,"Tulsa","UTSA",6,0,0,1,10,400987975,2017-11-28
364,2,"0:13",13,13,"Jhivvan Jackson made Free Throw.",98,92,6,0.999940507075182,"Tulsa","UTSA",6,0,0,1,10,400987975,2017-11-28
365,2,"0:13",13,13,"Jhivvan Jackson made Free Throw.",98,93,5,0.999752219740619,"Tulsa","UTSA",6,0,0,1,10,400987975,2017-11-28
366,2,"0:06",6,6,"Curran Scott made Layup. Assisted by Sterling Taplin.",100,93,7,0.99999253642977,"Tulsa","UTSA",6,0,0,1,10,400987975,2017-11-28
367,2,"0:03",3,3,"George Willborn III made Three Point Jumper. Assisted by Byron Frohnen.",100,96,4,0.999410465112693,"Tulsa","UTSA",6,0,0,1,10,400987975,2017-11-28
368,2,"0:00",0,0,"End of Game",100,96,4,1,"Tulsa","UTSA",6,0,0,1,10,400987975,2017-11-28
