"play_id","half","time_remaining_half","secs_remaining","secs_remaining_absolute","description","home_score","away_score","score_diff","win_prob","home","away","home_time_out_remaining","away_time_out_remaining","home_timeout_ind","away_timeout_ind","home_favored_by","game_id","date"
1,1,"20:00",2400,2400,"PLAY",0,0,0,0.5,"Radford","Erskine",4,4,0,0,NA,400992381,2017-12-09
2,1,"19:44",2384,2384,"Randy Phillips missed Layup.",0,0,0,0.511793930844357,"Radford","Erskine",4,4,0,0,NA,400992381,2017-12-09
3,1,"19:44",2384,2384,"Ed Polite Jr. Offensive Rebound.",0,0,0,0.511793930844357,"Radford","Erskine",4,4,0,0,NA,400992381,2017-12-09
4,1,"19:39",2379,2379,"Christian Bradford missed Three Point Jumper.",0,0,0,0.524279741327167,"Radford","Erskine",4,4,0,0,NA,400992381,2017-12-09
5,1,"19:39",2379,2379,"Donald Hicks Offensive Rebound.",0,0,0,0.524279741327167,"Radford","Erskine",4,4,0,0,NA,400992381,2017-12-09
6,1,"19:35",2375,2375,"Donald Hicks missed Layup.",0,0,0,0.524279741327167,"Radford","Erskine",4,4,0,0,NA,400992381,2017-12-09
7,1,"19:35",2375,2375,"Austin Venable Block.",0,0,0,0.524279741327167,"Radford","Erskine",4,4,0,0,NA,400992381,2017-12-09
8,1,"19:33",2373,2373,"Randy Phillips Offensive Rebound.",0,0,0,0.524279741327167,"Radford","Erskine",4,4,0,0,NA,400992381,2017-12-09
9,1,"19:08",2348,2348,"Donald Hicks made Three Point Jumper. Assisted by Justin Cousin.",3,0,3,0.57862387543917,"Radford","Erskine",4,4,0,0,NA,400992381,2017-12-09
10,1,"18:45",2325,2325,"Austin Venable made Layup. Assisted by Trent Smoot.",3,2,1,0.557864839876409,"Radford","Erskine",4,4,0,0,NA,400992381,2017-12-09
11,1,"18:30",2310,2310,"Justin Cousin missed Three Point Jumper.",3,2,1,0.531357067359631,"Radford","Erskine",4,4,0,0,NA,400992381,2017-12-09
12,1,"18:30",2310,2310,"Randy Phillips Offensive Rebound.",3,2,1,0.531357067359631,"Radford","Erskine",4,4,0,0,NA,400992381,2017-12-09
13,1,"18:25",2305,2305,"Randy Phillips Turnover.",3,2,1,0.53386704006008,"Radford","Erskine",4,4,0,0,NA,400992381,2017-12-09
14,1,"18:25",2305,2305,"Jaywaun Washington Steal.",3,2,1,0.53386704006008,"Radford","Erskine",4,4,0,0,NA,400992381,2017-12-09
15,1,"17:56",2276,2276,"Austin Venable missed Jumper.",3,2,1,0.546557030718172,"Radford","Erskine",4,4,0,0,NA,400992381,2017-12-09
16,1,"17:56",2276,2276,"Donald Hicks Defensive Rebound.",3,2,1,0.546557030718172,"Radford","Erskine",4,4,0,0,NA,400992381,2017-12-09
17,1,"17:45",2265,2265,"Randy Phillips made Layup. Assisted by Justin Cousin.",5,2,3,0.610484912586829,"Radford","Erskine",4,4,0,0,NA,400992381,2017-12-09
18,1,"17:15",2235,2235,"Blake Maness missed Three Point Jumper.",5,2,3,0.600191162945471,"Radford","Erskine",4,4,0,0,NA,400992381,2017-12-09
19,1,"17:15",2235,2235,"Christian Bradford Defensive Rebound.",5,2,3,0.600191162945471,"Radford","Erskine",4,4,0,0,NA,400992381,2017-12-09
20,1,"17:01",2221,2221,"Donald Hicks made Three Point Jumper. Assisted by Randy Phillips.",8,2,6,0.665778986399775,"Radford","Erskine",4,4,0,0,NA,400992381,2017-12-09
21,1,"17:00",2220,2220,"Foul on Trent Smoot.",8,2,6,0.665778986399775,"Radford","Erskine",4,4,0,0,NA,400992381,2017-12-09
22,1,"17:00",2220,2220,"Donald Hicks made Free Throw.",9,2,7,0.688142127794234,"Radford","Erskine",4,4,0,0,NA,400992381,2017-12-09
23,1,"16:29",2189,2189,"Trent Smoot missed Three Point Jumper.",9,2,7,0.696700624254145,"Radford","Erskine",4,4,0,0,NA,400992381,2017-12-09
24,1,"16:29",2189,2189,"Christian Bradford Defensive Rebound.",9,2,7,0.696700624254145,"Radford","Erskine",4,4,0,0,NA,400992381,2017-12-09
25,1,"16:07",2167,2167,"Foul on Blake Maness.",9,2,7,0.697580583435735,"Radford","Erskine",4,4,0,0,NA,400992381,2017-12-09
26,1,"16:02",2162,2162,"Christian Bradford missed Three Point Jumper.",9,2,7,0.697580583435735,"Radford","Erskine",4,4,0,0,NA,400992381,2017-12-09
27,1,"16:02",2162,2162,"Donald Hicks Offensive Rebound.",9,2,7,0.697580583435735,"Radford","Erskine",4,4,0,0,NA,400992381,2017-12-09
28,1,"15:54",2154,2154,"Justin Cousin made Three Point Jumper. Assisted by Christian Bradford.",12,2,10,0.770759203528342,"Radford","Erskine",4,4,0,0,NA,400992381,2017-12-09
29,1,"15:34",2134,2134,"Austin Venable made Layup.",12,4,8,0.734528906589978,"Radford","Erskine",4,4,0,0,NA,400992381,2017-12-09
30,1,"15:29",2129,2129,"Justin Cousin missed Three Point Jumper.",12,4,8,0.72105403572029,"Radford","Erskine",4,4,0,0,NA,400992381,2017-12-09
31,1,"15:29",2129,2129,"Trent Smoot Defensive Rebound.",12,4,8,0.72105403572029,"Radford","Erskine",4,4,0,0,NA,400992381,2017-12-09
32,1,"15:22",2122,2122,"Trent Smoot Turnover.",12,4,8,0.72105403572029,"Radford","Erskine",4,4,0,0,NA,400992381,2017-12-09
33,1,"15:22",2122,2122,"Official TV Timeout",12,4,8,0.72105403572029,"Radford","Erskine",4,4,0,0,NA,400992381,2017-12-09
34,1,"14:57",2097,2097,"Donald Hicks missed Three Point Jumper.",12,4,8,0.739476981295054,"Radford","Erskine",4,4,0,0,NA,400992381,2017-12-09
35,1,"14:57",2097,2097,"Jordan Watson Defensive Rebound.",12,4,8,0.739476981295054,"Radford","Erskine",4,4,0,0,NA,400992381,2017-12-09
36,1,"14:28",2068,2068,"Zezmon Steeple missed Three Point Jumper.",12,4,8,0.727186560628376,"Radford","Erskine",4,4,0,0,NA,400992381,2017-12-09
37,1,"14:28",2068,2068,"Ed Polite Jr. Block.",12,4,8,0.727186560628376,"Radford","Erskine",4,4,0,0,NA,400992381,2017-12-09
38,1,"14:26",2066,2066,"Devonnte Holland Defensive Rebound.",12,4,8,0.727186560628376,"Radford","Erskine",4,4,0,0,NA,400992381,2017-12-09
39,1,"14:23",2063,2063,"Ed Polite Jr. made Dunk. Assisted by Devonnte Holland.",14,4,10,0.772281785636801,"Radford","Erskine",4,4,0,0,NA,400992381,2017-12-09
40,1,"13:53",2033,2033,"Jordan Watson missed Jumper.",14,4,10,0.767390902776416,"Radford","Erskine",4,4,0,0,NA,400992381,2017-12-09
41,1,"13:53",2033,2033,"Devonnte Holland Defensive Rebound.",14,4,10,0.767390902776416,"Radford","Erskine",4,4,0,0,NA,400992381,2017-12-09
42,1,"13:32",2012,2012,"Carlik Jones missed Three Point Jumper.",14,4,10,0.774489361068996,"Radford","Erskine",4,4,0,0,NA,400992381,2017-12-09
43,1,"13:32",2012,2012,"Jordan Watson Defensive Rebound.",14,4,10,0.774489361068996,"Radford","Erskine",4,4,0,0,NA,400992381,2017-12-09
44,1,"13:21",2001,2001,"Parker Helgerson made Three Point Jumper. Assisted by Jordan Watson.",14,7,7,0.691480705619467,"Radford","Erskine",4,4,0,0,NA,400992381,2017-12-09
45,1,"13:10",1990,1990,"Donald Hicks Turnover.",14,7,7,0.722572264700233,"Radford","Erskine",4,4,0,0,NA,400992381,2017-12-09
46,1,"12:55",1975,1975,"Austin Venable made Jumper. Assisted by Zezmon Steeple.",14,9,5,0.665801456053264,"Radford","Erskine",4,4,0,0,NA,400992381,2017-12-09
47,1,"12:41",1961,1961,"Travis Fields Jr missed Three Point Jumper.",14,9,5,0.639902542912318,"Radford","Erskine",4,4,0,0,NA,400992381,2017-12-09
48,1,"12:41",1961,1961,"Ed Polite Jr. Offensive Rebound.",14,9,5,0.639902542912318,"Radford","Erskine",4,4,0,0,NA,400992381,2017-12-09
49,1,"12:37",1957,1957,"Foul on Justin Shelton.",14,9,5,0.672447313965185,"Radford","Erskine",4,4,0,0,NA,400992381,2017-12-09
50,1,"12:37",1957,1957,"Ed Polite Jr. missed Free Throw.",14,9,5,0.672447313965185,"Radford","Erskine",4,4,0,0,NA,400992381,2017-12-09
51,1,"12:37",1957,1957,"Radford Deadball Team Rebound.",14,9,5,0.672447313965185,"Radford","Erskine",4,4,0,0,NA,400992381,2017-12-09
52,1,"12:37",1957,1957,"Ed Polite Jr. missed Free Throw.",14,9,5,0.672447313965185,"Radford","Erskine",4,4,0,0,NA,400992381,2017-12-09
53,1,"12:37",1957,1957,"Jordan Watson Defensive Rebound.",14,9,5,0.672447313965185,"Radford","Erskine",4,4,0,0,NA,400992381,2017-12-09
54,1,"12:23",1943,1943,"Austin Venable made Layup. Assisted by Zezmon Steeple.",14,11,3,0.604222145359215,"Radford","Erskine",4,4,0,0,NA,400992381,2017-12-09
55,1,"12:09",1929,1929,"Devonnte Holland missed Layup.",14,11,3,0.592484424227419,"Radford","Erskine",4,4,0,0,NA,400992381,2017-12-09
56,1,"12:09",1929,1929,"Justin Shelton Block.",14,11,3,0.592484424227419,"Radford","Erskine",4,4,0,0,NA,400992381,2017-12-09
57,1,"12:07",1927,1927,"Devonnte Holland Offensive Rebound.",14,11,3,0.592484424227419,"Radford","Erskine",4,4,0,0,NA,400992381,2017-12-09
58,1,"12:04",1924,1924,"Devonnte Holland missed Layup.",14,11,3,0.592484424227419,"Radford","Erskine",4,4,0,0,NA,400992381,2017-12-09
59,1,"12:04",1924,1924,"Ed Polite Jr. Offensive Rebound.",14,11,3,0.592484424227419,"Radford","Erskine",4,4,0,0,NA,400992381,2017-12-09
60,1,"11:59",1919,1919,"Ed Polite Jr. made Dunk.",16,11,5,0.684271067308963,"Radford","Erskine",4,4,0,0,NA,400992381,2017-12-09
61,1,"11:37",1897,1897,"Jordan Watson missed Layup.",16,11,5,0.681597291658862,"Radford","Erskine",4,4,0,0,NA,400992381,2017-12-09
62,1,"11:37",1897,1897,"Carlik Jones Block.",16,11,5,0.681597291658862,"Radford","Erskine",4,4,0,0,NA,400992381,2017-12-09
63,1,"11:35",1895,1895,"Carlik Jones Defensive Rebound.",16,11,5,0.681597291658862,"Radford","Erskine",4,4,0,0,NA,400992381,2017-12-09
64,1,"11:32",1892,1892,"Travis Fields Jr made Layup. Assisted by Carlik Jones.",18,11,7,0.736895794184246,"Radford","Erskine",4,4,0,0,NA,400992381,2017-12-09
65,1,"11:25",1885,1885,"Zezmon Steeple missed Three Point Jumper.",18,11,7,0.706705744809318,"Radford","Erskine",4,4,0,0,NA,400992381,2017-12-09
66,1,"11:25",1885,1885,"Justin Shelton Offensive Rebound.",18,11,7,0.706705744809318,"Radford","Erskine",4,4,0,0,NA,400992381,2017-12-09
67,1,"11:24",1884,1884,"Foul on Ed Polite Jr..",18,11,7,0.706705744809318,"Radford","Erskine",4,4,0,0,NA,400992381,2017-12-09
68,1,"11:24",1884,1884,"Official TV Timeout",18,11,7,0.706705744809318,"Radford","Erskine",4,4,0,0,NA,400992381,2017-12-09
69,1,"10:59",1859,1859,"Trent Smoot missed Jumper.",18,11,7,0.726912234819176,"Radford","Erskine",4,4,0,0,NA,400992381,2017-12-09
70,1,"10:59",1859,1859,"Randy Phillips Defensive Rebound.",18,11,7,0.726912234819176,"Radford","Erskine",4,4,0,0,NA,400992381,2017-12-09
71,1,"10:49",1849,1849,"Caleb Tanner missed Three Point Jumper.",18,11,7,0.697966582614993,"Radford","Erskine",4,4,0,0,NA,400992381,2017-12-09
72,1,"10:49",1849,1849,"Ed Polite Jr. Offensive Rebound.",18,11,7,0.697966582614993,"Radford","Erskine",4,4,0,0,NA,400992381,2017-12-09
73,1,"10:45",1845,1845,"Ed Polite Jr. Turnover.",18,11,7,0.697966582614993,"Radford","Erskine",4,4,0,0,NA,400992381,2017-12-09
74,1,"10:18",1818,1818,"Jaywaun Washington missed Jumper.",18,11,7,0.740589856795776,"Radford","Erskine",4,4,0,0,NA,400992381,2017-12-09
75,1,"10:18",1818,1818,"Leroy Butts IV Defensive Rebound.",18,11,7,0.740589856795776,"Radford","Erskine",4,4,0,0,NA,400992381,2017-12-09
76,1,"10:01",1801,1801,"Caleb Tanner made Three Point Jumper. Assisted by Travis Fields Jr.",21,11,10,0.78834842757297,"Radford","Erskine",4,4,0,0,NA,400992381,2017-12-09
77,1,"9:39",1779,1779,"Jaywaun Washington Turnover.",21,11,10,0.770884528218075,"Radford","Erskine",4,4,0,0,NA,400992381,2017-12-09
78,1,"9:37",1777,1777,"Travis Fields Jr Steal.",21,11,10,0.770884528218075,"Radford","Erskine",4,4,0,0,NA,400992381,2017-12-09
79,1,"9:34",1774,1774,"Travis Fields Jr made Layup.",23,11,12,0.811246275537623,"Radford","Erskine",4,4,0,0,NA,400992381,2017-12-09
80,1,"9:17",1757,1757,"Austin Venable missed Layup.",23,11,12,0.833411499251282,"Radford","Erskine",4,4,0,0,NA,400992381,2017-12-09
81,1,"9:17",1757,1757,"Randy Phillips Block.",23,11,12,0.833411499251282,"Radford","Erskine",4,4,0,0,NA,400992381,2017-12-09
82,1,"9:16",1756,1756,"Radford Defensive Rebound.",23,11,12,0.833411499251282,"Radford","Erskine",4,4,0,0,NA,400992381,2017-12-09
83,1,"9:02",1742,1742,"Randy Phillips made Layup. Assisted by Travis Fields Jr.",25,11,14,0.867745207452398,"Radford","Erskine",4,4,0,0,NA,400992381,2017-12-09
84,1,"8:31",1711,1711,"Jordan Watson missed Three Point Jumper.",25,11,14,0.872419200242406,"Radford","Erskine",4,4,0,0,NA,400992381,2017-12-09
85,1,"8:31",1711,1711,"Radford Defensive Rebound.",25,11,14,0.872419200242406,"Radford","Erskine",4,4,0,0,NA,400992381,2017-12-09
86,1,"8:16",1696,1696,"Randy Phillips made Layup. Assisted by Travis Fields Jr.",27,11,16,0.915314554215326,"Radford","Erskine",4,4,0,0,NA,400992381,2017-12-09
87,1,"8:00",1680,1680,"Jordan Watson Turnover.",27,11,16,0.914492274888413,"Radford","Erskine",4,4,0,0,NA,400992381,2017-12-09
88,1,"7:58",1678,1678,"Randy Phillips Steal.",27,11,16,0.907059230938355,"Radford","Erskine",4,4,0,0,NA,400992381,2017-12-09
89,1,"7:57",1677,1677,"Travis Fields Jr made Layup. Assisted by Randy Phillips.",29,11,18,0.927933872300665,"Radford","Erskine",4,4,0,0,NA,400992381,2017-12-09
90,1,"7:40",1660,1660,"Austin Venable Turnover.",29,11,18,0.915030069391926,"Radford","Erskine",4,4,0,0,NA,400992381,2017-12-09
91,1,"7:40",1660,1660,"Randy Phillips Steal.",29,11,18,0.915030069391926,"Radford","Erskine",4,4,0,0,NA,400992381,2017-12-09
92,1,"7:40",1660,1660,"Randy Phillips Turnover.",29,11,18,0.915030069391926,"Radford","Erskine",4,4,0,0,NA,400992381,2017-12-09
93,1,"7:40",1660,1660,"Official TV Timeout",29,11,18,0.915030069391926,"Radford","Erskine",4,4,0,0,NA,400992381,2017-12-09
94,1,"7:23",1643,1643,"Miles Perdue missed Layup.",29,11,18,0.930059748252185,"Radford","Erskine",4,4,0,0,NA,400992381,2017-12-09
95,1,"7:23",1643,1643,"Leroy Butts IV Block.",29,11,18,0.930059748252185,"Radford","Erskine",4,4,0,0,NA,400992381,2017-12-09
96,1,"7:21",1641,1641,"Miles Perdue Offensive Rebound.",29,11,18,0.930059748252185,"Radford","Erskine",4,4,0,0,NA,400992381,2017-12-09
97,1,"7:18",1638,1638,"Thomas Nolan missed Three Point Jumper.",29,11,18,0.922138707405284,"Radford","Erskine",4,4,0,0,NA,400992381,2017-12-09
98,1,"7:18",1638,1638,"Caleb Shackleford Offensive Rebound.",29,11,18,0.922138707405284,"Radford","Erskine",4,4,0,0,NA,400992381,2017-12-09
99,1,"7:17",1637,1637,"Foul on Donald Hicks.",29,11,18,0.922138707405284,"Radford","Erskine",4,4,0,0,NA,400992381,2017-12-09
100,1,"6:55",1615,1615,"Caleb Shackleford missed Layup.",29,11,18,0.925853942408234,"Radford","Erskine",4,4,0,0,NA,400992381,2017-12-09
101,1,"6:55",1615,1615,"Devonnte Holland Defensive Rebound.",29,11,18,0.925853942408234,"Radford","Erskine",4,4,0,0,NA,400992381,2017-12-09
102,1,"6:38",1598,1598,"Justin Cousin missed Three Point Jumper.",29,11,18,0.927753046067956,"Radford","Erskine",4,4,0,0,NA,400992381,2017-12-09
103,1,"6:38",1598,1598,"Caleb Shackleford Defensive Rebound.",29,11,18,0.927753046067956,"Radford","Erskine",4,4,0,0,NA,400992381,2017-12-09
104,1,"6:17",1577,1577,"Austin Venable missed Layup.",29,11,18,0.945954370700398,"Radford","Erskine",4,4,0,0,NA,400992381,2017-12-09
105,1,"6:17",1577,1577,"Donald Hicks Defensive Rebound.",29,11,18,0.945954370700398,"Radford","Erskine",4,4,0,0,NA,400992381,2017-12-09
106,1,"6:01",1561,1561,"Justin Cousin missed Layup.",29,11,18,0.928163921010356,"Radford","Erskine",4,4,0,0,NA,400992381,2017-12-09
107,1,"6:01",1561,1561,"Devonnte Holland Offensive Rebound.",29,11,18,0.928163921010356,"Radford","Erskine",4,4,0,0,NA,400992381,2017-12-09
108,1,"6:00",1560,1560,"Foul on Miles Perdue.",29,11,18,0.928163921010356,"Radford","Erskine",4,4,0,0,NA,400992381,2017-12-09
109,1,"6:00",1560,1560,"Devonnte Holland missed Free Throw.",29,11,18,0.928163921010356,"Radford","Erskine",4,4,0,0,NA,400992381,2017-12-09
110,1,"6:00",1560,1560,"Radford Deadball Team Rebound.",29,11,18,0.928163921010356,"Radford","Erskine",4,4,0,0,NA,400992381,2017-12-09
111,1,"6:00",1560,1560,"Devonnte Holland missed Free Throw.",29,11,18,0.928163921010356,"Radford","Erskine",4,4,0,0,NA,400992381,2017-12-09
112,1,"6:00",1560,1560,"Caleb Shackleford Defensive Rebound.",29,11,18,0.928163921010356,"Radford","Erskine",4,4,0,0,NA,400992381,2017-12-09
113,1,"5:45",1545,1545,"Thomas Nolan made Three Point Jumper. Assisted by Austin Venable.",29,14,15,0.895148210813365,"Radford","Erskine",4,4,0,0,NA,400992381,2017-12-09
114,1,"5:30",1530,1530,"Devonnte Holland made Layup. Assisted by Justin Cousin.",31,14,17,0.91942303634792,"Radford","Erskine",4,4,0,0,NA,400992381,2017-12-09
115,1,"5:11",1511,1511,"Foul on Justin Cousin.",31,14,17,0.937814811892256,"Radford","Erskine",4,4,0,0,NA,400992381,2017-12-09
116,1,"4:58",1498,1498,"Zezmon Steeple missed Layup.",31,14,17,0.924757429858803,"Radford","Erskine",4,4,0,0,NA,400992381,2017-12-09
117,1,"4:58",1498,1498,"Ed Polite Jr. Defensive Rebound.",31,14,17,0.924757429858803,"Radford","Erskine",4,4,0,0,NA,400992381,2017-12-09
118,1,"4:51",1491,1491,"Carlik Jones missed Layup.",31,14,17,0.924757429858803,"Radford","Erskine",4,4,0,0,NA,400992381,2017-12-09
119,1,"4:51",1491,1491,"Austin Venable Block.",31,14,17,0.924757429858803,"Radford","Erskine",4,4,0,0,NA,400992381,2017-12-09
120,1,"4:48",1488,1488,"Carlik Jones Offensive Rebound.",31,14,17,0.928448910710497,"Radford","Erskine",4,4,0,0,NA,400992381,2017-12-09
121,1,"4:46",1486,1486,"Foul on Miles Perdue.",31,14,17,0.928448910710497,"Radford","Erskine",4,4,0,0,NA,400992381,2017-12-09
122,1,"4:46",1486,1486,"Randy Phillips missed Free Throw.",31,14,17,0.928448910710497,"Radford","Erskine",4,4,0,0,NA,400992381,2017-12-09
123,1,"4:46",1486,1486,"Radford Deadball Team Rebound.",31,14,17,0.928448910710497,"Radford","Erskine",4,4,0,0,NA,400992381,2017-12-09
124,1,"4:46",1486,1486,"Randy Phillips made Free Throw.",32,14,18,0.937803503283732,"Radford","Erskine",4,4,0,0,NA,400992381,2017-12-09
125,1,"4:28",1468,1468,"Thomas Nolan made Layup.",32,16,16,0.912788167272593,"Radford","Erskine",4,4,0,0,NA,400992381,2017-12-09
126,1,"4:04",1444,1444,"Ed Polite Jr. missed Three Point Jumper.",32,16,16,0.929943166019443,"Radford","Erskine",4,4,0,0,NA,400992381,2017-12-09
127,1,"4:04",1444,1444,"Carlik Jones Offensive Rebound.",32,16,16,0.929943166019443,"Radford","Erskine",4,4,0,0,NA,400992381,2017-12-09
128,1,"4:00",1440,1440,"Carlik Jones Turnover.",32,16,16,0.929943166019443,"Radford","Erskine",4,4,0,0,NA,400992381,2017-12-09
129,1,"3:59",1439,1439,"Thomas Nolan Steal.",32,16,16,0.923732867727157,"Radford","Erskine",4,4,0,0,NA,400992381,2017-12-09
130,1,"3:55",1435,1435,"Caleb Shackleford made Layup.",32,18,14,0.899887035813748,"Radford","Erskine",4,4,0,0,NA,400992381,2017-12-09
131,1,"3:34",1414,1414,"Ed Polite Jr. made Dunk. Assisted by Carlik Jones.",34,18,16,0.92579492698958,"Radford","Erskine",4,4,0,0,NA,400992381,2017-12-09
132,1,"3:07",1387,1387,"Zezmon Steeple missed Jumper.",34,18,16,0.923397445277656,"Radford","Erskine",4,4,0,0,NA,400992381,2017-12-09
133,1,"3:07",1387,1387,"Miles Perdue Offensive Rebound.",34,18,16,0.923397445277656,"Radford","Erskine",4,4,0,0,NA,400992381,2017-12-09
134,1,"3:05",1385,1385,"Miles Perdue missed Two Point Tip Shot.",34,18,16,0.923397445277656,"Radford","Erskine",4,4,0,0,NA,400992381,2017-12-09
135,1,"3:05",1385,1385,"Miles Perdue Offensive Rebound.",34,18,16,0.923397445277656,"Radford","Erskine",4,4,0,0,NA,400992381,2017-12-09
136,1,"3:05",1385,1385,"Foul on Christian Bradford.",34,18,16,0.923397445277656,"Radford","Erskine",4,4,0,0,NA,400992381,2017-12-09
137,1,"3:05",1385,1385,"Official TV Timeout",34,18,16,0.923397445277656,"Radford","Erskine",4,4,0,0,NA,400992381,2017-12-09
138,1,"2:42",1362,1362,"Jaywaun Washington missed Jumper.",34,18,16,0.925193038005772,"Radford","Erskine",4,4,0,0,NA,400992381,2017-12-09
139,1,"2:42",1362,1362,"Carlik Jones Defensive Rebound.",34,18,16,0.925193038005772,"Radford","Erskine",4,4,0,0,NA,400992381,2017-12-09
140,1,"2:12",1332,1332,"Carlik Jones missed Jumper.",34,18,16,0.923485906307216,"Radford","Erskine",4,4,0,0,NA,400992381,2017-12-09
141,1,"2:12",1332,1332,"Randy Phillips Offensive Rebound.",34,18,16,0.923485906307216,"Radford","Erskine",4,4,0,0,NA,400992381,2017-12-09
142,1,"2:08",1328,1328,"Foul on Jaywaun Washington.",34,18,16,0.928972414650906,"Radford","Erskine",4,4,0,0,NA,400992381,2017-12-09
143,1,"2:08",1328,1328,"Randy Phillips missed Free Throw.",34,18,16,0.928972414650906,"Radford","Erskine",4,4,0,0,NA,400992381,2017-12-09
144,1,"2:08",1328,1328,"Radford Deadball Team Rebound.",34,18,16,0.928972414650906,"Radford","Erskine",4,4,0,0,NA,400992381,2017-12-09
145,1,"2:08",1328,1328,"Randy Phillips made Free Throw.",35,18,17,0.938694238375063,"Radford","Erskine",4,4,0,0,NA,400992381,2017-12-09
146,1,"1:43",1303,1303,"Parker Helgerson missed Three Point Jumper.",35,18,17,0.92993536400745,"Radford","Erskine",4,4,0,0,NA,400992381,2017-12-09
147,1,"1:43",1303,1303,"Devonnte Holland Defensive Rebound.",35,18,17,0.92993536400745,"Radford","Erskine",4,4,0,0,NA,400992381,2017-12-09
148,1,"1:34",1294,1294,"Ed Polite Jr. Turnover.",35,18,17,0.952904978668994,"Radford","Erskine",4,4,0,0,NA,400992381,2017-12-09
149,1,"1:30",1290,1290,"Justin Shelton Steal.",35,18,17,0.952904978668994,"Radford","Erskine",4,4,0,0,NA,400992381,2017-12-09
150,1,"1:16",1276,1276,"Jaywaun Washington Turnover.",35,18,17,0.926330941586803,"Radford","Erskine",4,4,0,0,NA,400992381,2017-12-09
151,1,"1:16",1276,1276,"Foul on Jaywaun Washington.",35,18,17,0.926330941586803,"Radford","Erskine",4,4,0,0,NA,400992381,2017-12-09
152,1,"1:00",1260,1260,"Devonnte Holland missed Layup.",35,18,17,0.943088687024713,"Radford","Erskine",4,4,0,0,NA,400992381,2017-12-09
153,1,"1:00",1260,1260,"Jaywaun Washington Block.",35,18,17,0.943088687024713,"Radford","Erskine",4,4,0,0,NA,400992381,2017-12-09
154,1,"0:57",1257,1257,"Devonnte Holland Offensive Rebound.",35,18,17,0.932937289996159,"Radford","Erskine",4,4,0,0,NA,400992381,2017-12-09
155,1,"0:48",1248,1248,"Donald Hicks missed Three Point Jumper.",35,18,17,0.935890057820922,"Radford","Erskine",4,4,0,0,NA,400992381,2017-12-09
156,1,"0:48",1248,1248,"Parker Helgerson Defensive Rebound.",35,18,17,0.935890057820922,"Radford","Erskine",4,4,0,0,NA,400992381,2017-12-09
157,1,"0:46",1246,1246,"Foul on Ed Polite Jr..",35,18,17,0.935890057820922,"Radford","Erskine",4,4,0,0,NA,400992381,2017-12-09
158,1,"0:35",1235,1235,"Erskine  Turnover.",35,18,17,0.940846660396031,"Radford","Erskine",4,4,0,0,NA,400992381,2017-12-09
159,1,"0:09",1209,1209,"Donald Hicks Turnover.",35,18,17,0.940292831274259,"Radford","Erskine",4,4,0,0,NA,400992381,2017-12-09
160,1,"0:07",1207,1207,"Justin Shelton Steal.",35,18,17,0.940292831274259,"Radford","Erskine",4,4,0,0,NA,400992381,2017-12-09
161,1,"0:02",1202,1202,"Fineto Lungwana Turnover.",35,18,17,0.940292831274259,"Radford","Erskine",4,4,0,0,NA,400992381,2017-12-09
162,1,"0:01",1201,1201,"Devonnte Holland Steal.",35,18,17,0.940292831274259,"Radford","Erskine",4,4,0,0,NA,400992381,2017-12-09
163,1,"0:00",1200,1200,"End of 1st half",35,18,17,0.940292831274259,"Radford","Erskine",4,4,0,0,NA,400992381,2017-12-09
164,2,"20:00",1200,1200,"PLAY",35,18,17,0.940292831274259,"Radford","Erskine",4,4,0,0,NA,400992381,2017-12-09
165,2,"19:46",1186,1186,"Ed Polite Jr. Turnover.",35,18,17,0.945863588095943,"Radford","Erskine",4,4,0,0,NA,400992381,2017-12-09
166,2,"19:46",1186,1186,"Foul on Ed Polite Jr..",35,18,17,0.945863588095943,"Radford","Erskine",4,4,0,0,NA,400992381,2017-12-09
167,2,"19:21",1161,1161,"Thomas Nolan missed Jumper.",35,18,17,0.9409957464414,"Radford","Erskine",4,4,0,0,NA,400992381,2017-12-09
168,2,"19:21",1161,1161,"Austin Venable Offensive Rebound.",35,18,17,0.9409957464414,"Radford","Erskine",4,4,0,0,NA,400992381,2017-12-09
169,2,"19:17",1157,1157,"Austin Venable made Two Point Tip Shot.",35,20,15,0.924283628125756,"Radford","Erskine",4,4,0,0,NA,400992381,2017-12-09
170,2,"19:00",1140,1140,"Leroy Butts IV made Layup. Assisted by Randy Phillips.",37,20,17,0.952475097706,"Radford","Erskine",4,4,0,0,NA,400992381,2017-12-09
171,2,"18:33",1113,1113,"Jaywaun Washington Turnover.",37,20,17,0.953923019875217,"Radford","Erskine",4,4,0,0,NA,400992381,2017-12-09
172,2,"18:32",1112,1112,"Leroy Butts IV Steal.",37,20,17,0.953923019875217,"Radford","Erskine",4,4,0,0,NA,400992381,2017-12-09
173,2,"18:24",1104,1104,"Justin Cousin missed Three Point Jumper.",37,20,17,0.944396836740601,"Radford","Erskine",4,4,0,0,NA,400992381,2017-12-09
174,2,"18:24",1104,1104,"Radford Offensive Rebound.",37,20,17,0.944396836740601,"Radford","Erskine",4,4,0,0,NA,400992381,2017-12-09
175,2,"18:08",1088,1088,"Randy Phillips Turnover.",37,20,17,0.954386056788912,"Radford","Erskine",4,4,0,0,NA,400992381,2017-12-09
176,2,"18:07",1087,1087,"Jaywaun Washington Steal.",37,20,17,0.954386056788912,"Radford","Erskine",4,4,0,0,NA,400992381,2017-12-09
177,2,"17:47",1067,1067,"Trent Smoot Turnover.",37,20,17,0.955598622433986,"Radford","Erskine",4,4,0,0,NA,400992381,2017-12-09
178,2,"17:46",1066,1066,"Christian Bradford Steal.",37,20,17,0.955598622433986,"Radford","Erskine",4,4,0,0,NA,400992381,2017-12-09
179,2,"17:30",1050,1050,"Donald Hicks made Layup.",39,20,19,0.971117816484737,"Radford","Erskine",4,4,0,0,NA,400992381,2017-12-09
180,2,"16:59",1019,1019,"Thomas Nolan missed Three Point Jumper.",39,20,19,0.968571959644575,"Radford","Erskine",4,4,0,0,NA,400992381,2017-12-09
181,2,"16:59",1019,1019,"Randy Phillips Defensive Rebound.",39,20,19,0.968571959644575,"Radford","Erskine",4,4,0,0,NA,400992381,2017-12-09
182,2,"16:52",1012,1012,"Christian Bradford missed Layup.",39,20,19,0.968571959644575,"Radford","Erskine",4,4,0,0,NA,400992381,2017-12-09
183,2,"16:52",1012,1012,"Jaywaun Washington Block.",39,20,19,0.968571959644575,"Radford","Erskine",4,4,0,0,NA,400992381,2017-12-09
184,2,"16:51",1011,1011,"Radford Offensive Rebound.",39,20,19,0.968571959644575,"Radford","Erskine",4,4,0,0,NA,400992381,2017-12-09
185,2,"16:49",1009,1009,"Donald Hicks made Jumper. Assisted by Christian Bradford.",41,20,21,0.980321995746166,"Radford","Erskine",4,4,0,0,NA,400992381,2017-12-09
186,2,"16:23",983,983,"Austin Venable Turnover.",41,20,21,0.987004806160264,"Radford","Erskine",4,4,0,0,NA,400992381,2017-12-09
187,2,"16:22",982,982,"Christian Bradford Steal.",41,20,21,0.987004806160264,"Radford","Erskine",4,4,0,0,NA,400992381,2017-12-09
188,2,"16:18",978,978,"Donald Hicks made Layup. Assisted by Christian Bradford.",43,20,23,0.985680189570169,"Radford","Erskine",4,4,0,0,NA,400992381,2017-12-09
189,2,"15:53",953,953,"Austin Venable made Layup.",43,22,21,0.982190634309445,"Radford","Erskine",4,4,0,0,NA,400992381,2017-12-09
