"play_id","half","time_remaining_half","secs_remaining","secs_remaining_absolute","description","home_score","away_score","score_diff","win_prob","home","away","home_time_out_remaining","away_time_out_remaining","home_timeout_ind","away_timeout_ind","home_favored_by","game_id","date"
1,1,"20:00",2400,2400,"PLAY",0,0,0,0.167283986118799,"East Carolina","Houston",4,4,0,0,-8.5,400916576,2017-01-11
2,1,"19:34",2374,2374,"Andre Washington Turnover.",0,0,0,0.191627404514544,"East Carolina","Houston",4,4,0,0,-8.5,400916576,2017-01-11
3,1,"19:06",2346,2346,"Rob Gray Jr. made Three Point Jumper. Assisted by Galen Robinson Jr..",0,3,-3,0.149459067095364,"East Carolina","Houston",4,4,0,0,-8.5,400916576,2017-01-11
4,1,"18:40",2320,2320,"Kentrell Barkley missed Three Point Jumper.",0,3,-3,0.154934106093895,"East Carolina","Houston",4,4,0,0,-8.5,400916576,2017-01-11
5,1,"18:40",2320,2320,"East Carolina Offensive Rebound.",0,3,-3,0.154934106093895,"East Carolina","Houston",4,4,0,0,-8.5,400916576,2017-01-11
6,1,"18:18",2298,2298,"B.J. Tyson missed Layup.",0,3,-3,0.151114814586367,"East Carolina","Houston",4,4,0,0,-8.5,400916576,2017-01-11
7,1,"18:18",2298,2298,"Wes VanBeck Defensive Rebound.",0,3,-3,0.151114814586367,"East Carolina","Houston",4,4,0,0,-8.5,400916576,2017-01-11
8,1,"18:03",2283,2283,"Rob Gray Jr. made Three Point Jumper. Assisted by Wes VanBeck.",0,6,-6,0.10840307274246,"East Carolina","Houston",4,4,0,0,-8.5,400916576,2017-01-11
9,1,"17:30",2250,2250,"B.J. Tyson missed Three Point Jumper.",0,6,-6,0.124844364359356,"East Carolina","Houston",4,4,0,0,-8.5,400916576,2017-01-11
10,1,"17:30",2250,2250,"Damyean Dotson Defensive Rebound.",0,6,-6,0.124844364359356,"East Carolina","Houston",4,4,0,0,-8.5,400916576,2017-01-11
11,1,"17:21",2241,2241,"Damyean Dotson made Three Point Jumper. Assisted by Wes VanBeck.",0,9,-9,0.107214328510876,"East Carolina","Houston",4,4,0,0,-8.5,400916576,2017-01-11
12,1,"16:55",2215,2215,"Foul on Damyean Dotson.",0,9,-9,0.0759195168361374,"East Carolina","Houston",4,4,0,0,-8.5,400916576,2017-01-11
13,1,"16:55",2215,2215,"Kentrell Barkley missed Free Throw.",0,9,-9,0.0759195168361374,"East Carolina","Houston",4,4,0,0,-8.5,400916576,2017-01-11
14,1,"16:55",2215,2215,"East Carolina Deadball Team Rebound.",0,9,-9,0.0759195168361374,"East Carolina","Houston",4,4,0,0,-8.5,400916576,2017-01-11
15,1,"16:55",2215,2215,"Kentrell Barkley made Free Throw.",1,9,-8,0.0856258965938065,"East Carolina","Houston",4,4,0,0,-8.5,400916576,2017-01-11
16,1,"16:37",2197,2197,"Rob Gray Jr. made Layup.",1,11,-10,0.0724853678781716,"East Carolina","Houston",4,4,0,0,-8.5,400916576,2017-01-11
17,1,"16:17",2177,2177,"Foul on Wes VanBeck.",1,11,-10,0.0742177616739556,"East Carolina","Houston",4,4,0,0,-8.5,400916576,2017-01-11
18,1,"16:08",2168,2168,"Jeremy Sheppard made Three Point Jumper. Assisted by Andre Washington.",4,11,-7,0.102527851715224,"East Carolina","Houston",4,4,0,0,-8.5,400916576,2017-01-11
19,1,"15:45",2145,2145,"Wes VanBeck made Three Point Jumper. Assisted by Rob Gray Jr..",4,14,-10,0.083310889770757,"East Carolina","Houston",4,4,0,0,-8.5,400916576,2017-01-11
20,1,"15:19",2119,2119,"Andre Washington made Layup. Assisted by Elijah Hughes.",6,14,-8,0.0784345922440814,"East Carolina","Houston",4,4,0,0,-8.5,400916576,2017-01-11
21,1,"15:19",2119,2119,"Foul on Wes VanBeck.",6,14,-8,0.0784345922440814,"East Carolina","Houston",4,4,0,0,-8.5,400916576,2017-01-11
22,1,"15:19",2119,2119,"Official TV Timeout",6,14,-8,0.0784345922440814,"East Carolina","Houston",4,4,0,0,-8.5,400916576,2017-01-11
23,1,"15:19",2119,2119,"Andre Washington made Free Throw.",7,14,-7,0.0873851247915818,"East Carolina","Houston",4,4,0,0,-8.5,400916576,2017-01-11
24,1,"14:53",2093,2093,"Galen Robinson Jr. missed Jumper.",7,14,-7,0.0967594549071618,"East Carolina","Houston",4,4,0,0,-8.5,400916576,2017-01-11
25,1,"14:53",2093,2093,"Andre Washington Defensive Rebound.",7,14,-7,0.0967594549071618,"East Carolina","Houston",4,4,0,0,-8.5,400916576,2017-01-11
26,1,"14:51",2091,2091,"Foul on Danrad Knowles.",7,14,-7,0.0967594549071618,"East Carolina","Houston",4,4,0,0,-8.5,400916576,2017-01-11
27,1,"14:27",2067,2067,"Elijah Hughes made Layup. Assisted by Jeremy Sheppard.",9,14,-5,0.115203652695937,"East Carolina","Houston",4,4,0,0,-8.5,400916576,2017-01-11
28,1,"13:53",2033,2033,"Wes VanBeck Turnover.",9,14,-5,0.120278408400902,"East Carolina","Houston",4,4,0,0,-8.5,400916576,2017-01-11
29,1,"13:52",2032,2032,"Elijah Hughes Steal.",9,14,-5,0.120278408400902,"East Carolina","Houston",4,4,0,0,-8.5,400916576,2017-01-11
30,1,"13:50",2030,2030,"Jeremy Sheppard missed Layup.",9,14,-5,0.120278408400902,"East Carolina","Houston",4,4,0,0,-8.5,400916576,2017-01-11
31,1,"13:50",2030,2030,"Rob Gray Jr. Block.",9,14,-5,0.120278408400902,"East Carolina","Houston",4,4,0,0,-8.5,400916576,2017-01-11
32,1,"13:47",2027,2027,"Damyean Dotson Defensive Rebound.",9,14,-5,0.108465137380057,"East Carolina","Houston",4,4,0,0,-8.5,400916576,2017-01-11
33,1,"13:44",2024,2024,"Wes VanBeck made Three Point Jumper. Assisted by Damyean Dotson.",9,17,-8,0.0757082659317548,"East Carolina","Houston",4,4,0,0,-8.5,400916576,2017-01-11
34,1,"13:11",1991,1991,"Caleb White made Jumper.",11,17,-6,0.101212599394485,"East Carolina","Houston",4,4,0,0,-8.5,400916576,2017-01-11
35,1,"12:57",1977,1977,"Danrad Knowles made Jumper. Assisted by Galen Robinson Jr..",11,19,-8,0.079401083236364,"East Carolina","Houston",4,4,0,0,-8.5,400916576,2017-01-11
36,1,"12:40",1960,1960,"Elijah Hughes missed Three Point Jumper.",11,19,-8,0.0956162440790528,"East Carolina","Houston",4,4,0,0,-8.5,400916576,2017-01-11
37,1,"12:40",1960,1960,"Kentrell Barkley Offensive Rebound.",11,19,-8,0.0956162440790528,"East Carolina","Houston",4,4,0,0,-8.5,400916576,2017-01-11
38,1,"12:36",1956,1956,"Kentrell Barkley made Layup.",13,19,-6,0.115968391622445,"East Carolina","Houston",4,4,0,0,-8.5,400916576,2017-01-11
39,1,"12:29",1949,1949,"Galen Robinson Jr. made Layup.",13,21,-8,0.0844223513371737,"East Carolina","Houston",4,4,0,0,-8.5,400916576,2017-01-11
40,1,"12:15",1935,1935,"Caleb White missed Three Point Jumper.",13,21,-8,0.0818808996625403,"East Carolina","Houston",4,4,0,0,-8.5,400916576,2017-01-11
41,1,"12:15",1935,1935,"Wes VanBeck Defensive Rebound.",13,21,-8,0.0818808996625403,"East Carolina","Houston",4,4,0,0,-8.5,400916576,2017-01-11
42,1,"12:02",1922,1922,"Rob Gray Jr. made Layup. Assisted by Danrad Knowles.",13,23,-10,0.0591698243153537,"East Carolina","Houston",4,4,0,0,-8.5,400916576,2017-01-11
43,1,"11:34",1894,1894,"Kentrell Barkley missed Jumper.",13,23,-10,0.0683855474807791,"East Carolina","Houston",4,4,0,0,-8.5,400916576,2017-01-11
44,1,"11:34",1894,1894,"Damyean Dotson Defensive Rebound.",13,23,-10,0.0683855474807791,"East Carolina","Houston",4,4,0,0,-8.5,400916576,2017-01-11
45,1,"11:22",1882,1882,"Damyean Dotson made Three Point Jumper. Assisted by Galen Robinson Jr..",13,26,-13,0.0454643368508555,"East Carolina","Houston",4,4,0,0,-8.5,400916576,2017-01-11
46,1,"11:19",1879,1879,"East Carolina  Timeout",13,26,-13,0.0488530004905124,"East Carolina","Houston",3,4,1,0,-8.5,400916576,2017-01-11
47,1,"11:05",1865,1865,"Raquan Wilkins missed Three Point Jumper.",13,26,-13,0.0499985249032856,"East Carolina","Houston",3,4,1,0,-8.5,400916576,2017-01-11
48,1,"11:05",1865,1865,"Danrad Knowles Block.",13,26,-13,0.0499985249032856,"East Carolina","Houston",3,4,1,0,-8.5,400916576,2017-01-11
49,1,"11:02",1862,1862,"Galen Robinson Jr. Defensive Rebound.",13,26,-13,0.0499985249032856,"East Carolina","Houston",3,4,1,0,-8.5,400916576,2017-01-11
50,1,"11:01",1861,1861,"Foul on Jabari Craig.",13,26,-13,0.0499985249032856,"East Carolina","Houston",3,4,1,0,-8.5,400916576,2017-01-11
51,1,"10:49",1849,1849,"Rob Gray Jr. missed Layup.",13,26,-13,0.0444759705008651,"East Carolina","Houston",3,4,1,0,-8.5,400916576,2017-01-11
52,1,"10:49",1849,1849,"Danrad Knowles Offensive Rebound.",13,26,-13,0.0444759705008651,"East Carolina","Houston",3,4,1,0,-8.5,400916576,2017-01-11
53,1,"10:46",1846,1846,"Danrad Knowles missed Jumper.",13,26,-13,0.0444759705008651,"East Carolina","Houston",3,4,1,0,-8.5,400916576,2017-01-11
54,1,"10:46",1846,1846,"Jabari Craig Block.",13,26,-13,0.0444759705008651,"East Carolina","Houston",3,4,1,0,-8.5,400916576,2017-01-11
55,1,"10:45",1845,1845,"Kentrell Barkley Defensive Rebound.",13,26,-13,0.0444759705008651,"East Carolina","Houston",3,4,1,0,-8.5,400916576,2017-01-11
56,1,"10:40",1840,1840,"Foul on Danrad Knowles.",13,26,-13,0.0444759705008651,"East Carolina","Houston",3,4,1,0,-8.5,400916576,2017-01-11
57,1,"10:40",1840,1840,"Elijah Hughes made Free Throw.",14,26,-12,0.0500468136956923,"East Carolina","Houston",3,4,1,0,-8.5,400916576,2017-01-11
58,1,"10:40",1840,1840,"Elijah Hughes made Free Throw.",15,26,-11,0.0562743389008997,"East Carolina","Houston",3,4,1,0,-8.5,400916576,2017-01-11
59,1,"10:40",1840,1840,"Elijah Hughes made Free Throw.",16,26,-10,0.0632252045774293,"East Carolina","Houston",3,4,1,0,-8.5,400916576,2017-01-11
60,1,"10:26",1826,1826,"Damyean Dotson made Three Point Jumper. Assisted by Rob Gray Jr..",16,29,-13,0.0547515451338852,"East Carolina","Houston",3,4,1,0,-8.5,400916576,2017-01-11
61,1,"10:10",1810,1810,"Jeremy Sheppard Turnover.",16,29,-13,0.0427919755225523,"East Carolina","Houston",3,4,0,0,-8.5,400916576,2017-01-11
62,1,"9:59",1799,1799,"Rob Gray Jr. missed Three Point Jumper.",16,29,-13,0.0470459247422764,"East Carolina","Houston",3,4,0,0,-8.5,400916576,2017-01-11
63,1,"9:59",1799,1799,"East Carolina Defensive Rebound.",16,29,-13,0.0470459247422764,"East Carolina","Houston",3,4,0,0,-8.5,400916576,2017-01-11
64,1,"9:41",1781,1781,"B.J. Tyson Turnover.",16,29,-13,0.0419564160614594,"East Carolina","Houston",3,4,0,0,-8.5,400916576,2017-01-11
65,1,"9:16",1756,1756,"Damyean Dotson missed Three Point Jumper.",16,29,-13,0.0339123168802997,"East Carolina","Houston",3,4,0,0,-8.5,400916576,2017-01-11
66,1,"9:16",1756,1756,"B.J. Tyson Defensive Rebound.",16,29,-13,0.0339123168802997,"East Carolina","Houston",3,4,0,0,-8.5,400916576,2017-01-11
67,1,"9:00",1740,1740,"Elijah Hughes missed Three Point Jumper.",16,29,-13,0.0568223798338502,"East Carolina","Houston",3,4,0,0,-8.5,400916576,2017-01-11
68,1,"9:00",1740,1740,"B.J. Tyson Offensive Rebound.",16,29,-13,0.0568223798338502,"East Carolina","Houston",3,4,0,0,-8.5,400916576,2017-01-11
69,1,"8:46",1726,1726,"B.J. Tyson made Layup.",18,29,-11,0.0697259669029556,"East Carolina","Houston",3,4,0,0,-8.5,400916576,2017-01-11
70,1,"8:46",1726,1726,"Foul on Bertrand Nkali.",18,29,-11,0.0697259669029556,"East Carolina","Houston",3,4,0,0,-8.5,400916576,2017-01-11
71,1,"8:46",1726,1726,"B.J. Tyson made Free Throw.",19,29,-10,0.0790479537509157,"East Carolina","Houston",3,4,0,0,-8.5,400916576,2017-01-11
72,1,"8:37",1717,1717,"Armoni Brooks made Three Point Jumper. Assisted by Wes VanBeck.",19,32,-13,0.0434256457687164,"East Carolina","Houston",3,4,0,0,-8.5,400916576,2017-01-11
73,1,"8:18",1698,1698,"B.J. Tyson Turnover.",19,32,-13,0.0454488496711668,"East Carolina","Houston",3,4,0,0,-8.5,400916576,2017-01-11
74,1,"8:17",1697,1697,"Armoni Brooks Steal.",19,32,-13,0.0454488496711668,"East Carolina","Houston",3,4,0,0,-8.5,400916576,2017-01-11
75,1,"8:14",1694,1694,"Armoni Brooks missed Layup.",19,32,-13,0.0454488496711668,"East Carolina","Houston",3,4,0,0,-8.5,400916576,2017-01-11
76,1,"8:14",1694,1694,"B.J. Tyson Defensive Rebound.",19,32,-13,0.0454488496711668,"East Carolina","Houston",3,4,0,0,-8.5,400916576,2017-01-11
77,1,"8:12",1692,1692,"Foul on Wes VanBeck.",19,32,-13,0.0454488496711668,"East Carolina","Houston",3,4,0,0,-8.5,400916576,2017-01-11
78,1,"8:12",1692,1692,"B.J. Tyson made Free Throw.",20,32,-12,0.0520571842400787,"East Carolina","Houston",3,4,0,0,-8.5,400916576,2017-01-11
79,1,"8:12",1692,1692,"B.J. Tyson made Free Throw.",21,32,-11,0.0595664208470046,"East Carolina","Houston",3,4,0,0,-8.5,400916576,2017-01-11
80,1,"7:51",1671,1671,"Armoni Brooks made Three Point Jumper. Assisted by Galen Robinson Jr..",21,35,-14,0.0381549706803596,"East Carolina","Houston",3,4,0,0,-8.5,400916576,2017-01-11
81,1,"7:31",1651,1651,"Elijah Hughes Turnover.",21,35,-14,0.0449769823749656,"East Carolina","Houston",3,4,0,0,-8.5,400916576,2017-01-11
82,1,"7:31",1651,1651,"Official TV Timeout",21,35,-14,0.0449769823749656,"East Carolina","Houston",3,4,0,0,-8.5,400916576,2017-01-11
83,1,"7:09",1629,1629,"Rob Gray Jr. missed Three Point Jumper.",21,35,-14,0.0358644922819109,"East Carolina","Houston",3,4,0,0,-8.5,400916576,2017-01-11
84,1,"7:09",1629,1629,"B.J. Tyson Defensive Rebound.",21,35,-14,0.0358644922819109,"East Carolina","Houston",3,4,0,0,-8.5,400916576,2017-01-11
85,1,"7:00",1620,1620,"Jeremy Sheppard missed Three Point Jumper.",21,35,-14,0.0358644922819109,"East Carolina","Houston",3,4,0,0,-8.5,400916576,2017-01-11
86,1,"7:00",1620,1620,"Galen Robinson Jr. Defensive Rebound.",21,35,-14,0.0358644922819109,"East Carolina","Houston",3,4,0,0,-8.5,400916576,2017-01-11
87,1,"6:42",1602,1602,"Rob Gray Jr. missed Jumper.",21,35,-14,0.0393449226754183,"East Carolina","Houston",3,4,0,0,-8.5,400916576,2017-01-11
88,1,"6:42",1602,1602,"Caleb White Defensive Rebound.",21,35,-14,0.0393449226754183,"East Carolina","Houston",3,4,0,0,-8.5,400916576,2017-01-11
89,1,"6:39",1599,1599,"Foul on Rob Gray Jr..",21,35,-14,0.0471215607151655,"East Carolina","Houston",3,4,0,0,-8.5,400916576,2017-01-11
90,1,"6:39",1599,1599,"Caleb White missed Free Throw.",21,35,-14,0.0471215607151655,"East Carolina","Houston",3,4,0,0,-8.5,400916576,2017-01-11
91,1,"6:39",1599,1599,"Elijah Hughes Offensive Rebound.",21,35,-14,0.0471215607151655,"East Carolina","Houston",3,4,0,0,-8.5,400916576,2017-01-11
92,1,"6:37",1597,1597,"Elijah Hughes missed Jumper.",21,35,-14,0.0471215607151655,"East Carolina","Houston",3,4,0,0,-8.5,400916576,2017-01-11
93,1,"6:37",1597,1597,"Damyean Dotson Defensive Rebound.",21,35,-14,0.0471215607151655,"East Carolina","Houston",3,4,0,0,-8.5,400916576,2017-01-11
94,1,"6:12",1572,1572,"Foul on Elijah Hughes.",21,35,-14,0.0320088826804631,"East Carolina","Houston",3,4,0,0,-8.5,400916576,2017-01-11
95,1,"6:02",1562,1562,"Armoni Brooks made Jumper.",21,37,-16,0.0269752466613537,"East Carolina","Houston",3,4,0,0,-8.5,400916576,2017-01-11
96,1,"5:44",1544,1544,"B.J. Tyson made Layup. Assisted by Andre Washington.",23,37,-14,0.0389010400525575,"East Carolina","Houston",3,4,0,0,-8.5,400916576,2017-01-11
97,1,"5:20",1520,1520,"Rob Gray Jr. missed Jumper.",23,37,-14,0.0392815061434287,"East Carolina","Houston",3,4,0,0,-8.5,400916576,2017-01-11
98,1,"5:20",1520,1520,"Andre Washington Defensive Rebound.",23,37,-14,0.0392815061434287,"East Carolina","Houston",3,4,0,0,-8.5,400916576,2017-01-11
99,1,"4:56",1496,1496,"Jeremy Sheppard missed Three Point Jumper.",23,37,-14,0.0445475236937364,"East Carolina","Houston",3,4,0,0,-8.5,400916576,2017-01-11
100,1,"4:56",1496,1496,"Armoni Brooks Defensive Rebound.",23,37,-14,0.0445475236937364,"East Carolina","Houston",3,4,0,0,-8.5,400916576,2017-01-11
101,1,"4:45",1485,1485,"Armoni Brooks missed Three Point Jumper.",23,37,-14,0.0330119048696158,"East Carolina","Houston",3,4,0,0,-8.5,400916576,2017-01-11
102,1,"4:45",1485,1485,"Andre Washington Defensive Rebound.",23,37,-14,0.0330119048696158,"East Carolina","Houston",3,4,0,0,-8.5,400916576,2017-01-11
103,1,"4:24",1464,1464,"Jeremy Sheppard Turnover.",23,37,-14,0.0490688488077722,"East Carolina","Houston",3,4,0,0,-8.5,400916576,2017-01-11
104,1,"4:22",1462,1462,"Galen Robinson Jr. Steal.",23,37,-14,0.0490688488077722,"East Carolina","Houston",3,4,0,0,-8.5,400916576,2017-01-11
105,1,"4:19",1459,1459,"Rob Gray Jr. missed Layup.",23,37,-14,0.0338122237864726,"East Carolina","Houston",3,4,0,0,-8.5,400916576,2017-01-11
106,1,"4:19",1459,1459,"Armoni Brooks Offensive Rebound.",23,37,-14,0.0338122237864726,"East Carolina","Houston",3,4,0,0,-8.5,400916576,2017-01-11
107,1,"4:13",1453,1453,"Rob Gray Jr. missed Three Point Jumper.",23,37,-14,0.0338122237864726,"East Carolina","Houston",3,4,0,0,-8.5,400916576,2017-01-11
108,1,"4:13",1453,1453,"Andre Washington Defensive Rebound.",23,37,-14,0.0338122237864726,"East Carolina","Houston",3,4,0,0,-8.5,400916576,2017-01-11
109,1,"4:05",1445,1445,"Caleb White missed Three Point Jumper.",23,37,-14,0.0385179948408563,"East Carolina","Houston",3,4,0,0,-8.5,400916576,2017-01-11
110,1,"4:05",1445,1445,"Galen Robinson Jr. Defensive Rebound.",23,37,-14,0.0385179948408563,"East Carolina","Houston",3,4,0,0,-8.5,400916576,2017-01-11
111,1,"3:59",1439,1439,"Houston  Timeout",23,37,-14,0.040696437825724,"East Carolina","Houston",3,3,0,1,-8.5,400916576,2017-01-11
112,1,"3:36",1416,1416,"Morris Dunnigan missed Layup.",23,37,-14,0.0353328556256187,"East Carolina","Houston",3,3,0,1,-8.5,400916576,2017-01-11
113,1,"3:36",1416,1416,"Andre Washington Block.",23,37,-14,0.0353328556256187,"East Carolina","Houston",3,3,0,1,-8.5,400916576,2017-01-11
114,1,"3:35",1415,1415,"Galen Robinson Jr. Offensive Rebound.",23,37,-14,0.0353328556256187,"East Carolina","Houston",3,3,0,1,-8.5,400916576,2017-01-11
115,1,"3:31",1411,1411,"Houston  Turnover.",23,37,-14,0.0353328556256187,"East Carolina","Houston",3,3,0,1,-8.5,400916576,2017-01-11
116,1,"3:09",1389,1389,"B.J. Tyson missed Layup.",23,37,-14,0.0381065527344721,"East Carolina","Houston",3,3,0,1,-8.5,400916576,2017-01-11
117,1,"3:09",1389,1389,"Rob Gray Jr. Defensive Rebound.",23,37,-14,0.0381065527344721,"East Carolina","Houston",3,3,0,1,-8.5,400916576,2017-01-11
118,1,"3:04",1384,1384,"Foul on Kentrell Barkley.",23,37,-14,0.0381065527344721,"East Carolina","Houston",3,3,0,1,-8.5,400916576,2017-01-11
119,1,"2:48",1368,1368,"Rob Gray Jr. missed Jumper.",23,37,-14,0.0351745645657523,"East Carolina","Houston",3,3,0,0,-8.5,400916576,2017-01-11
120,1,"2:48",1368,1368,"Kyle Meyer Offensive Rebound.",23,37,-14,0.0351745645657523,"East Carolina","Houston",3,3,0,0,-8.5,400916576,2017-01-11
121,1,"2:45",1365,1365,"Kyle Meyer missed Two Point Tip Shot.",23,37,-14,0.0351745645657523,"East Carolina","Houston",3,3,0,0,-8.5,400916576,2017-01-11
122,1,"2:45",1365,1365,"Kentrell Barkley Defensive Rebound.",23,37,-14,0.0351745645657523,"East Carolina","Houston",3,3,0,0,-8.5,400916576,2017-01-11
123,1,"2:24",1344,1344,"Elijah Hughes missed Jumper.",23,37,-14,0.03436859870607,"East Carolina","Houston",3,3,0,0,-8.5,400916576,2017-01-11
124,1,"2:24",1344,1344,"Morris Dunnigan Defensive Rebound.",23,37,-14,0.03436859870607,"East Carolina","Houston",3,3,0,0,-8.5,400916576,2017-01-11
125,1,"2:11",1331,1331,"Armoni Brooks made Jumper.",23,39,-16,0.0245643186425356,"East Carolina","Houston",3,3,0,0,-8.5,400916576,2017-01-11
126,1,"1:39",1299,1299,"Kentrell Barkley missed Layup.",23,39,-16,0.0264113358412764,"East Carolina","Houston",3,3,0,0,-8.5,400916576,2017-01-11
127,1,"1:39",1299,1299,"Andre Washington Offensive Rebound.",23,39,-16,0.0264113358412764,"East Carolina","Houston",3,3,0,0,-8.5,400916576,2017-01-11
128,1,"1:37",1297,1297,"Foul on Armoni Brooks.",23,39,-16,0.0264113358412764,"East Carolina","Houston",3,3,0,0,-8.5,400916576,2017-01-11
129,1,"1:37",1297,1297,"Andre Washington missed Free Throw.",23,39,-16,0.0264113358412764,"East Carolina","Houston",3,3,0,0,-8.5,400916576,2017-01-11
130,1,"1:37",1297,1297,"East Carolina Deadball Team Rebound.",23,39,-16,0.0264113358412764,"East Carolina","Houston",3,3,0,0,-8.5,400916576,2017-01-11
131,1,"1:37",1297,1297,"Andre Washington missed Free Throw.",23,39,-16,0.0264113358412764,"East Carolina","Houston",3,3,0,0,-8.5,400916576,2017-01-11
132,1,"1:37",1297,1297,"Damyean Dotson Defensive Rebound.",23,39,-16,0.0264113358412764,"East Carolina","Houston",3,3,0,0,-8.5,400916576,2017-01-11
133,1,"1:17",1277,1277,"Armoni Brooks made Jumper. Assisted by Kyle Meyer.",23,41,-18,0.0193370565963548,"East Carolina","Houston",3,3,0,0,-8.5,400916576,2017-01-11
134,1,"0:54",1254,1254,"Foul on Kyle Meyer.",23,41,-18,0.0222570439247086,"East Carolina","Houston",3,3,0,0,-8.5,400916576,2017-01-11
135,1,"0:54",1254,1254,"Andre Washington made Free Throw.",24,41,-17,0.0258043624927702,"East Carolina","Houston",3,3,0,0,-8.5,400916576,2017-01-11
136,1,"0:54",1254,1254,"Andre Washington made Free Throw.",25,41,-16,0.0298997620036697,"East Carolina","Houston",3,3,0,0,-8.5,400916576,2017-01-11
137,1,"0:28",1228,1228,"Damyean Dotson made Three Point Jumper. Assisted by Rob Gray Jr..",25,44,-19,0.0135720703808753,"East Carolina","Houston",3,3,0,0,-8.5,400916576,2017-01-11
138,1,"0:08",1208,1208,"Jeremy Sheppard missed Three Point Jumper.",25,44,-19,0.0154729447370636,"East Carolina","Houston",3,3,0,0,-8.5,400916576,2017-01-11
139,1,"0:08",1208,1208,"Armoni Brooks Defensive Rebound.",25,44,-19,0.0154729447370636,"East Carolina","Houston",3,3,0,0,-8.5,400916576,2017-01-11
140,1,"0:00",1200,1200,"Rob Gray Jr. made Three Point Jumper. Assisted by Armoni Brooks.",25,47,-22,0.00965268022782356,"East Carolina","Houston",3,3,0,0,-8.5,400916576,2017-01-11
141,1,"0:00",1200,1200,"End of 1st half",25,47,-22,0.00965268022782356,"East Carolina","Houston",3,3,0,0,-8.5,400916576,2017-01-11
142,2,"20:00",1200,1200,"PLAY",25,47,-22,0.00965268022782356,"East Carolina","Houston",4,4,0,0,-8.5,400916576,2017-01-11
143,2,"19:48",1188,1188,"Andre Washington made Layup.",27,47,-20,0.0115475992737783,"East Carolina","Houston",4,4,0,0,-8.5,400916576,2017-01-11
144,2,"19:31",1171,1171,"Foul on Caleb White.",27,47,-20,0.0130086122132112,"East Carolina","Houston",4,4,0,0,-8.5,400916576,2017-01-11
145,2,"19:23",1163,1163,"Wes VanBeck made Three Point Jumper. Assisted by Danrad Knowles.",27,50,-23,0.00638138183768746,"East Carolina","Houston",4,4,0,0,-8.5,400916576,2017-01-11
146,2,"19:03",1143,1143,"Andre Washington Turnover.",27,50,-23,0.00698205652830391,"East Carolina","Houston",4,4,0,0,-8.5,400916576,2017-01-11
147,2,"19:00",1140,1140,"Damyean Dotson Steal.",27,50,-23,0.00698205652830391,"East Carolina","Houston",4,4,0,0,-8.5,400916576,2017-01-11
148,2,"18:56",1136,1136,"Rob Gray Jr. Turnover.",27,50,-23,0.00782630287278055,"East Carolina","Houston",4,4,0,0,-8.5,400916576,2017-01-11
149,2,"18:37",1117,1117,"Kentrell Barkley missed Three Point Jumper.",27,50,-23,0.00703825898189524,"East Carolina","Houston",4,4,0,0,-8.5,400916576,2017-01-11
150,2,"18:37",1117,1117,"Danrad Knowles Block.",27,50,-23,0.00703825898189524,"East Carolina","Houston",4,4,0,0,-8.5,400916576,2017-01-11
151,2,"18:34",1114,1114,"Andre Washington Offensive Rebound.",27,50,-23,0.00703825898189524,"East Carolina","Houston",4,4,0,0,-8.5,400916576,2017-01-11
152,2,"18:32",1112,1112,"Andre Washington made Layup.",29,50,-21,0.00991836331755362,"East Carolina","Houston",4,4,0,0,-8.5,400916576,2017-01-11
153,2,"18:09",1089,1089,"Danrad Knowles missed Layup.",29,50,-21,0.00753534259999499,"East Carolina","Houston",4,4,0,0,-8.5,400916576,2017-01-11
154,2,"18:09",1089,1089,"Danrad Knowles Offensive Rebound.",29,50,-21,0.00753534259999499,"East Carolina","Houston",4,4,0,0,-8.5,400916576,2017-01-11
155,2,"18:05",1085,1085,"Danrad Knowles missed Jumper.",29,50,-21,0.00753534259999499,"East Carolina","Houston",4,4,0,0,-8.5,400916576,2017-01-11
156,2,"18:05",1085,1085,"Damyean Dotson Offensive Rebound.",29,50,-21,0.00753534259999499,"East Carolina","Houston",4,4,0,0,-8.5,400916576,2017-01-11
157,2,"18:00",1080,1080,"Rob Gray Jr. made Jumper.",29,52,-23,0.0053002642895308,"East Carolina","Houston",4,4,0,0,-8.5,400916576,2017-01-11
158,2,"17:40",1060,1060,"Caleb White missed Three Point Jumper.",29,52,-23,0.00770584994260526,"East Carolina","Houston",4,4,0,0,-8.5,400916576,2017-01-11
159,2,"17:40",1060,1060,"Caleb White Offensive Rebound.",29,52,-23,0.00770584994260526,"East Carolina","Houston",4,4,0,0,-8.5,400916576,2017-01-11
160,2,"17:36",1056,1056,"Foul on Galen Robinson Jr..",29,52,-23,0.00579395267676003,"East Carolina","Houston",4,4,0,0,-8.5,400916576,2017-01-11
161,2,"17:25",1045,1045,"Deng Riak missed Jumper.",29,52,-23,0.00662601921432296,"East Carolina","Houston",4,4,0,0,-8.5,400916576,2017-01-11
162,2,"17:25",1045,1045,"Andre Washington Offensive Rebound.",29,52,-23,0.00662601921432296,"East Carolina","Houston",4,4,0,0,-8.5,400916576,2017-01-11
163,2,"17:25",1045,1045,"Foul on Wes VanBeck.",29,52,-23,0.00662601921432296,"East Carolina","Houston",4,4,0,0,-8.5,400916576,2017-01-11
164,2,"17:13",1033,1033,"Caleb White made Jumper.",31,52,-21,0.0090203534874268,"East Carolina","Houston",4,4,0,0,-8.5,400916576,2017-01-11
165,2,"17:05",1025,1025,"Houston  Timeout",31,52,-21,0.00853690116507102,"East Carolina","Houston",4,3,0,1,-8.5,400916576,2017-01-11
166,2,"16:56",1016,1016,"Danrad Knowles made Jumper.",31,54,-23,0.00494492559521735,"East Carolina","Houston",4,3,0,1,-8.5,400916576,2017-01-11
167,2,"16:28",988,988,"Foul on Kyle Meyer.",31,54,-23,0.004339902651874,"East Carolina","Houston",4,3,0,1,-8.5,400916576,2017-01-11
168,2,"16:28",988,988,"Kentrell Barkley made Free Throw.",32,54,-22,0.00529465406270864,"East Carolina","Houston",4,3,0,1,-8.5,400916576,2017-01-11
169,2,"16:28",988,988,"Kentrell Barkley made Free Throw.",33,54,-21,0.00645808244227749,"East Carolina","Houston",4,3,0,1,-8.5,400916576,2017-01-11
170,2,"16:17",977,977,"Danrad Knowles missed Jumper.",33,54,-21,0.00843012383751419,"East Carolina","Houston",4,3,0,1,-8.5,400916576,2017-01-11
171,2,"16:17",977,977,"Kyle Meyer Offensive Rebound.",33,54,-21,0.00843012383751419,"East Carolina","Houston",4,3,0,1,-8.5,400916576,2017-01-11
172,2,"16:15",975,975,"Kyle Meyer missed Two Point Tip Shot.",33,54,-21,0.00843012383751419,"East Carolina","Houston",4,3,0,1,-8.5,400916576,2017-01-11
173,2,"16:15",975,975,"Kentrell Barkley Defensive Rebound.",33,54,-21,0.00843012383751419,"East Carolina","Houston",4,3,0,1,-8.5,400916576,2017-01-11
174,2,"15:56",956,956,"Foul on Danrad Knowles.",33,54,-21,0.0056230686774789,"East Carolina","Houston",4,3,0,0,-8.5,400916576,2017-01-11
175,2,"15:56",956,956,"Official TV Timeout",33,54,-21,0.0056230686774789,"East Carolina","Houston",4,3,0,0,-8.5,400916576,2017-01-11
