"play_id","half","time_remaining_half","secs_remaining","secs_remaining_absolute","description","home_score","away_score","score_diff","win_prob","home","away","home_time_out_remaining","away_time_out_remaining","home_timeout_ind","away_timeout_ind","home_favored_by","game_id","date"
1,1,"20:00",2400,2400,"PLAY",0,0,0,0.735069594872722,"La Salle","Saint Joseph's",4,4,0,0,4.5,400989970,2018-02-03
2,1,"19:40",2380,2380,"James Demery missed Jumper.",0,0,0,0.73187726689758,"La Salle","Saint Joseph's",4,4,0,0,4.5,400989970,2018-02-03
3,1,"19:40",2380,2380,"Pookie Powell Defensive Rebound.",0,0,0,0.73187726689758,"La Salle","Saint Joseph's",4,4,0,0,4.5,400989970,2018-02-03
4,1,"19:23",2363,2363,"Pookie Powell missed Three Point Jumper.",0,0,0,0.718456005559136,"La Salle","Saint Joseph's",4,4,0,0,4.5,400989970,2018-02-03
5,1,"19:23",2363,2363,"Saint Joseph's Defensive Rebound.",0,0,0,0.718456005559136,"La Salle","Saint Joseph's",4,4,0,0,4.5,400989970,2018-02-03
6,1,"19:11",2351,2351,"Pierfrancesco Oliva Turnover.",0,0,0,0.739225757503418,"La Salle","Saint Joseph's",4,4,0,0,4.5,400989970,2018-02-03
7,1,"19:09",2349,2349,"Saul Phiri Steal.",0,0,0,0.721347677835724,"La Salle","Saint Joseph's",4,4,0,0,4.5,400989970,2018-02-03
8,1,"18:58",2338,2338,"B.J. Johnson missed Jumper.",0,0,0,0.727460782359575,"La Salle","Saint Joseph's",4,4,0,0,4.5,400989970,2018-02-03
9,1,"18:58",2338,2338,"Saul Phiri Offensive Rebound.",0,0,0,0.727460782359575,"La Salle","Saint Joseph's",4,4,0,0,4.5,400989970,2018-02-03
10,1,"18:45",2325,2325,"Amar Stukes missed Three Point Jumper.",0,0,0,0.734166973989882,"La Salle","Saint Joseph's",4,4,0,0,4.5,400989970,2018-02-03
11,1,"18:45",2325,2325,"Taylor Funk Defensive Rebound.",0,0,0,0.734166973989882,"La Salle","Saint Joseph's",4,4,0,0,4.5,400989970,2018-02-03
12,1,"18:15",2295,2295,"Taylor Funk missed Three Point Jumper.",0,0,0,0.728638890179073,"La Salle","Saint Joseph's",4,4,0,0,4.5,400989970,2018-02-03
13,1,"18:15",2295,2295,"Tony Washington Defensive Rebound.",0,0,0,0.728638890179073,"La Salle","Saint Joseph's",4,4,0,0,4.5,400989970,2018-02-03
14,1,"17:56",2276,2276,"B.J. Johnson missed Three Point Jumper.",0,0,0,0.727162755995404,"La Salle","Saint Joseph's",4,4,0,0,4.5,400989970,2018-02-03
15,1,"17:56",2276,2276,"James Demery Defensive Rebound.",0,0,0,0.727162755995404,"La Salle","Saint Joseph's",4,4,0,0,4.5,400989970,2018-02-03
16,1,"17:43",2263,2263,"Chris Clover Turnover.",0,0,0,0.731002812435569,"La Salle","Saint Joseph's",4,4,0,0,4.5,400989970,2018-02-03
17,1,"17:41",2261,2261,"Pookie Powell Steal.",0,0,0,0.731002812435569,"La Salle","Saint Joseph's",4,4,0,0,4.5,400989970,2018-02-03
18,1,"17:36",2256,2256,"Amar Stukes made Three Point Jumper. Assisted by Pookie Powell.",3,0,3,0.775665344895044,"La Salle","Saint Joseph's",4,4,0,0,4.5,400989970,2018-02-03
19,1,"17:22",2242,2242,"Pierfrancesco Oliva made Jumper. Assisted by Shavar Newkirk.",3,2,1,0.737977051163657,"La Salle","Saint Joseph's",4,4,0,0,4.5,400989970,2018-02-03
20,1,"17:08",2228,2228,"B.J. Johnson missed Jumper.",3,2,1,0.745291528385358,"La Salle","Saint Joseph's",4,4,0,0,4.5,400989970,2018-02-03
21,1,"17:08",2228,2228,"Chris Clover Defensive Rebound.",3,2,1,0.745291528385358,"La Salle","Saint Joseph's",4,4,0,0,4.5,400989970,2018-02-03
22,1,"16:58",2218,2218,"Chris Clover missed Jumper.",3,2,1,0.749116110857706,"La Salle","Saint Joseph's",4,4,0,0,4.5,400989970,2018-02-03
23,1,"16:58",2218,2218,"Tony Washington Defensive Rebound.",3,2,1,0.749116110857706,"La Salle","Saint Joseph's",4,4,0,0,4.5,400989970,2018-02-03
24,1,"16:43",2203,2203,"Amar Stukes missed Layup.",3,2,1,0.744247054284218,"La Salle","Saint Joseph's",4,4,0,0,4.5,400989970,2018-02-03
25,1,"16:43",2203,2203,"Shavar Newkirk Block.",3,2,1,0.744247054284218,"La Salle","Saint Joseph's",4,4,0,0,4.5,400989970,2018-02-03
26,1,"16:41",2201,2201,"James Demery Defensive Rebound.",3,2,1,0.744247054284218,"La Salle","Saint Joseph's",4,4,0,0,4.5,400989970,2018-02-03
27,1,"16:39",2199,2199,"James Demery missed Layup.",3,2,1,0.754749776139685,"La Salle","Saint Joseph's",4,4,0,0,4.5,400989970,2018-02-03
28,1,"16:39",2199,2199,"Tony Washington Defensive Rebound.",3,2,1,0.754749776139685,"La Salle","Saint Joseph's",4,4,0,0,4.5,400989970,2018-02-03
29,1,"16:32",2192,2192,"Amar Stukes missed Three Point Jumper.",3,2,1,0.754749776139685,"La Salle","Saint Joseph's",4,4,0,0,4.5,400989970,2018-02-03
30,1,"16:32",2192,2192,"B.J. Johnson Offensive Rebound.",3,2,1,0.754749776139685,"La Salle","Saint Joseph's",4,4,0,0,4.5,400989970,2018-02-03
31,1,"16:16",2176,2176,"Pookie Powell missed Three Point Jumper.",3,2,1,0.736949924531028,"La Salle","Saint Joseph's",4,4,0,0,4.5,400989970,2018-02-03
32,1,"16:16",2176,2176,"Pierfrancesco Oliva Defensive Rebound.",3,2,1,0.736949924531028,"La Salle","Saint Joseph's",4,4,0,0,4.5,400989970,2018-02-03
33,1,"15:52",2152,2152,"James Demery missed Three Point Jumper.",3,2,1,0.735691632497201,"La Salle","Saint Joseph's",4,4,0,0,4.5,400989970,2018-02-03
34,1,"15:52",2152,2152,"B.J. Johnson Defensive Rebound.",3,2,1,0.735691632497201,"La Salle","Saint Joseph's",4,4,0,0,4.5,400989970,2018-02-03
35,1,"15:45",2145,2145,"Pookie Powell missed Jumper.",3,2,1,0.745469078351428,"La Salle","Saint Joseph's",4,4,0,0,4.5,400989970,2018-02-03
36,1,"15:45",2145,2145,"Tony Washington Offensive Rebound.",3,2,1,0.745469078351428,"La Salle","Saint Joseph's",4,4,0,0,4.5,400989970,2018-02-03
37,1,"15:30",2130,2130,"Pookie Powell made Two Point Tip Shot.",5,2,3,0.785088550393594,"La Salle","Saint Joseph's",4,4,0,0,4.5,400989970,2018-02-03
38,1,"15:27",2127,2127,"Shavar Newkirk made Three Point Jumper.",5,5,0,0.713083419556303,"La Salle","Saint Joseph's",4,4,0,0,4.5,400989970,2018-02-03
39,1,"15:04",2104,2104,"Tony Washington Turnover.",5,5,0,0.712368240755858,"La Salle","Saint Joseph's",4,4,0,0,4.5,400989970,2018-02-03
40,1,"15:02",2102,2102,"Pierfrancesco Oliva Steal.",5,5,0,0.712368240755858,"La Salle","Saint Joseph's",4,4,0,0,4.5,400989970,2018-02-03
41,1,"15:00",2100,2100,"Pierfrancesco Oliva Turnover.",5,5,0,0.712368240755858,"La Salle","Saint Joseph's",4,4,0,0,4.5,400989970,2018-02-03
42,1,"15:00",2100,2100,"Official TV Timeout",5,5,0,0.712368240755858,"La Salle","Saint Joseph's",4,4,0,0,4.5,400989970,2018-02-03
43,1,"14:47",2087,2087,"Saul Phiri missed Three Point Jumper.",5,5,0,0.716960776299735,"La Salle","Saint Joseph's",4,4,0,0,4.5,400989970,2018-02-03
44,1,"14:47",2087,2087,"Shavar Newkirk Defensive Rebound.",5,5,0,0.716960776299735,"La Salle","Saint Joseph's",4,4,0,0,4.5,400989970,2018-02-03
45,1,"14:39",2079,2079,"James Demery missed Layup.",5,5,0,0.714777739054349,"La Salle","Saint Joseph's",4,4,0,0,4.5,400989970,2018-02-03
46,1,"14:39",2079,2079,"James Demery Offensive Rebound.",5,5,0,0.714777739054349,"La Salle","Saint Joseph's",4,4,0,0,4.5,400989970,2018-02-03
47,1,"14:37",2077,2077,"James Demery made Layup.",5,7,-2,0.669171229799691,"La Salle","Saint Joseph's",4,4,0,0,4.5,400989970,2018-02-03
48,1,"14:20",2060,2060,"Isiah Deas missed Three Point Jumper.",5,7,-2,0.655118264364096,"La Salle","Saint Joseph's",4,4,0,0,4.5,400989970,2018-02-03
49,1,"14:20",2060,2060,"Shavar Newkirk Defensive Rebound.",5,7,-2,0.655118264364096,"La Salle","Saint Joseph's",4,4,0,0,4.5,400989970,2018-02-03
50,1,"13:57",2037,2037,"Foul on Isiah Deas.",5,7,-2,0.682116586782574,"La Salle","Saint Joseph's",4,4,0,0,4.5,400989970,2018-02-03
51,1,"13:57",2037,2037,"Pierfrancesco Oliva missed Free Throw.",5,7,-2,0.682116586782574,"La Salle","Saint Joseph's",4,4,0,0,4.5,400989970,2018-02-03
52,1,"13:57",2037,2037,"Saint Joseph's Deadball Team Rebound.",5,7,-2,0.682116586782574,"La Salle","Saint Joseph's",4,4,0,0,4.5,400989970,2018-02-03
53,1,"13:57",2037,2037,"Pierfrancesco Oliva made Free Throw.",5,8,-3,0.65755354725838,"La Salle","Saint Joseph's",4,4,0,0,4.5,400989970,2018-02-03
54,1,"13:41",2021,2021,"B.J. Johnson missed Three Point Jumper.",5,8,-3,0.622768098717468,"La Salle","Saint Joseph's",4,4,0,0,4.5,400989970,2018-02-03
55,1,"13:41",2021,2021,"James Demery Defensive Rebound.",5,8,-3,0.622768098717468,"La Salle","Saint Joseph's",4,4,0,0,4.5,400989970,2018-02-03
56,1,"13:32",2012,2012,"Taylor Funk missed Three Point Jumper.",5,8,-3,0.642411879075326,"La Salle","Saint Joseph's",4,4,0,0,4.5,400989970,2018-02-03
57,1,"13:32",2012,2012,"Saul Phiri Block.",5,8,-3,0.642411879075326,"La Salle","Saint Joseph's",4,4,0,0,4.5,400989970,2018-02-03
58,1,"13:30",2010,2010,"Pookie Powell Defensive Rebound.",5,8,-3,0.642411879075326,"La Salle","Saint Joseph's",4,4,0,0,4.5,400989970,2018-02-03
59,1,"13:27",2007,2007,"Pookie Powell missed Layup.",5,8,-3,0.635511133847836,"La Salle","Saint Joseph's",4,4,0,0,4.5,400989970,2018-02-03
60,1,"13:26",2006,2006,"James Demery Defensive Rebound.",5,8,-3,0.635511133847836,"La Salle","Saint Joseph's",4,4,0,0,4.5,400989970,2018-02-03
61,1,"13:24",2004,2004,"Foul on Pookie Powell.",5,8,-3,0.635511133847836,"La Salle","Saint Joseph's",4,4,0,0,4.5,400989970,2018-02-03
62,1,"13:02",1982,1982,"Chris Clover missed Jumper.",5,8,-3,0.613494451224767,"La Salle","Saint Joseph's",4,4,0,0,4.5,400989970,2018-02-03
63,1,"13:02",1982,1982,"Saul Phiri Defensive Rebound.",5,8,-3,0.613494451224767,"La Salle","Saint Joseph's",4,4,0,0,4.5,400989970,2018-02-03
64,1,"12:50",1970,1970,"B.J. Johnson made Jumper.",7,8,-1,0.692207416484586,"La Salle","Saint Joseph's",4,4,0,0,4.5,400989970,2018-02-03
65,1,"12:40",1960,1960,"Shavar Newkirk made Layup.",7,10,-3,0.642659482818931,"La Salle","Saint Joseph's",4,4,0,0,4.5,400989970,2018-02-03
66,1,"12:26",1946,1946,"Foul on Chris Clover.",7,10,-3,0.624584603263054,"La Salle","Saint Joseph's",4,4,0,0,4.5,400989970,2018-02-03
67,1,"12:18",1938,1938,"Amar Stukes made Jumper. Assisted by Isiah Deas.",9,10,-1,0.67193259262342,"La Salle","Saint Joseph's",4,4,0,0,4.5,400989970,2018-02-03
68,1,"11:56",1916,1916,"Lorenzo Edwards made Three Point Jumper. Assisted by Pierfrancesco Oliva.",9,13,-4,0.609777556031659,"La Salle","Saint Joseph's",4,4,0,0,4.5,400989970,2018-02-03
69,1,"11:45",1905,1905,"B.J. Johnson missed Three Point Jumper.",9,13,-4,0.605104627994248,"La Salle","Saint Joseph's",4,4,0,0,4.5,400989970,2018-02-03
70,1,"11:45",1905,1905,"James Demery Defensive Rebound.",9,13,-4,0.605104627994248,"La Salle","Saint Joseph's",4,4,0,0,4.5,400989970,2018-02-03
71,1,"11:38",1898,1898,"Foul on Amar Stukes.",9,13,-4,0.588953324487655,"La Salle","Saint Joseph's",4,4,0,0,4.5,400989970,2018-02-03
72,1,"11:38",1898,1898,"Official TV Timeout",9,13,-4,0.588953324487655,"La Salle","Saint Joseph's",4,4,0,0,4.5,400989970,2018-02-03
73,1,"11:38",1898,1898,"James Demery missed Free Throw.",9,13,-4,0.588953324487655,"La Salle","Saint Joseph's",4,4,0,0,4.5,400989970,2018-02-03
74,1,"11:38",1898,1898,"Saint Joseph's Deadball Team Rebound.",9,13,-4,0.588953324487655,"La Salle","Saint Joseph's",4,4,0,0,4.5,400989970,2018-02-03
75,1,"11:38",1898,1898,"James Demery missed Free Throw.",9,13,-4,0.588953324487655,"La Salle","Saint Joseph's",4,4,0,0,4.5,400989970,2018-02-03
76,1,"11:38",1898,1898,"Amar Stukes Defensive Rebound.",9,13,-4,0.588953324487655,"La Salle","Saint Joseph's",4,4,0,0,4.5,400989970,2018-02-03
77,1,"11:28",1888,1888,"Jamir Moultrie missed Three Point Jumper.",9,13,-4,0.594270238569228,"La Salle","Saint Joseph's",4,4,0,0,4.5,400989970,2018-02-03
78,1,"11:28",1888,1888,"Anthony Longpré Defensive Rebound.",9,13,-4,0.594270238569228,"La Salle","Saint Joseph's",4,4,0,0,4.5,400989970,2018-02-03
79,1,"11:11",1871,1871,"James Demery missed Layup.",9,13,-4,0.593096764379501,"La Salle","Saint Joseph's",4,4,0,0,4.5,400989970,2018-02-03
80,1,"11:11",1871,1871,"Isiah Deas Defensive Rebound.",9,13,-4,0.593096764379501,"La Salle","Saint Joseph's",4,4,0,0,4.5,400989970,2018-02-03
81,1,"11:07",1867,1867,"Foul on James Demery.",9,13,-4,0.591933746872071,"La Salle","Saint Joseph's",4,4,0,0,4.5,400989970,2018-02-03
82,1,"10:59",1859,1859,"Jamir Moultrie made Three Point Jumper. Assisted by Amar Stukes.",12,13,-1,0.683008528576952,"La Salle","Saint Joseph's",4,4,0,0,4.5,400989970,2018-02-03
83,1,"10:29",1829,1829,"Shavar Newkirk missed Jumper.",12,13,-1,0.700733088606008,"La Salle","Saint Joseph's",4,4,0,0,4.5,400989970,2018-02-03
84,1,"10:29",1829,1829,"Anthony Longpré Offensive Rebound.",12,13,-1,0.700733088606008,"La Salle","Saint Joseph's",4,4,0,0,4.5,400989970,2018-02-03
85,1,"10:26",1826,1826,"Taylor Funk missed Three Point Jumper.",12,13,-1,0.700733088606008,"La Salle","Saint Joseph's",4,4,0,0,4.5,400989970,2018-02-03
86,1,"10:26",1826,1826,"Lorenzo Edwards Offensive Rebound.",12,13,-1,0.700733088606008,"La Salle","Saint Joseph's",4,4,0,0,4.5,400989970,2018-02-03
87,1,"10:06",1806,1806,"James Demery Turnover.",12,13,-1,0.675379790828852,"La Salle","Saint Joseph's",4,4,0,0,4.5,400989970,2018-02-03
88,1,"9:57",1797,1797,"Foul on Anthony Longpré.",12,13,-1,0.666481396292973,"La Salle","Saint Joseph's",4,4,0,0,4.5,400989970,2018-02-03
89,1,"9:43",1783,1783,"Jamir Moultrie missed Jumper.",12,13,-1,0.651930977513604,"La Salle","Saint Joseph's",4,4,0,0,4.5,400989970,2018-02-03
90,1,"9:43",1783,1783,"Shavar Newkirk Defensive Rebound.",12,13,-1,0.651930977513604,"La Salle","Saint Joseph's",4,4,0,0,4.5,400989970,2018-02-03
91,1,"9:34",1774,1774,"James Demery made Three Point Jumper. Assisted by Taylor Funk.",12,16,-4,0.578761713320767,"La Salle","Saint Joseph's",4,4,0,0,4.5,400989970,2018-02-03
92,1,"9:15",1755,1755,"Pookie Powell missed Jumper.",12,16,-4,0.558499707082345,"La Salle","Saint Joseph's",4,4,0,0,4.5,400989970,2018-02-03
93,1,"9:15",1755,1755,"B.J. Johnson Offensive Rebound.",12,16,-4,0.558499707082345,"La Salle","Saint Joseph's",4,4,0,0,4.5,400989970,2018-02-03
94,1,"9:11",1751,1751,"Jamir Moultrie missed Three Point Jumper.",12,16,-4,0.558499707082345,"La Salle","Saint Joseph's",4,4,0,0,4.5,400989970,2018-02-03
95,1,"9:11",1751,1751,"Taylor Funk Defensive Rebound.",12,16,-4,0.558499707082345,"La Salle","Saint Joseph's",4,4,0,0,4.5,400989970,2018-02-03
96,1,"8:59",1739,1739,"James Demery made Three Point Jumper. Assisted by Shavar Newkirk.",12,19,-7,0.475634870834471,"La Salle","Saint Joseph's",4,4,0,0,4.5,400989970,2018-02-03
97,1,"8:39",1719,1719,"Amar Stukes missed Layup.",12,19,-7,0.489871857004509,"La Salle","Saint Joseph's",4,4,0,0,4.5,400989970,2018-02-03
98,1,"8:39",1719,1719,"Taylor Funk Block.",12,19,-7,0.489871857004509,"La Salle","Saint Joseph's",4,4,0,0,4.5,400989970,2018-02-03
99,1,"8:37",1717,1717,"James Demery Defensive Rebound.",12,19,-7,0.489871857004509,"La Salle","Saint Joseph's",4,4,0,0,4.5,400989970,2018-02-03
100,1,"8:25",1705,1705,"Lorenzo Edwards made Three Point Jumper. Assisted by Shavar Newkirk.",12,22,-10,0.385954525271421,"La Salle","Saint Joseph's",4,4,0,0,4.5,400989970,2018-02-03
101,1,"8:16",1696,1696,"La Salle  Timeout",12,22,-10,0.362648217872503,"La Salle","Saint Joseph's",3,4,1,0,4.5,400989970,2018-02-03
102,1,"8:04",1684,1684,"B.J. Johnson made Jumper.",14,22,-8,0.430178118120807,"La Salle","Saint Joseph's",3,4,1,0,4.5,400989970,2018-02-03
103,1,"7:42",1662,1662,"Shavar Newkirk made Three Point Jumper. Assisted by Anthony Longpré.",14,25,-11,0.359246023872492,"La Salle","Saint Joseph's",3,4,1,0,4.5,400989970,2018-02-03
104,1,"7:21",1641,1641,"B.J. Johnson missed Jumper.",14,25,-11,0.340460817096317,"La Salle","Saint Joseph's",3,4,1,0,4.5,400989970,2018-02-03
105,1,"7:21",1641,1641,"Lorenzo Edwards Block.",14,25,-11,0.340460817096317,"La Salle","Saint Joseph's",3,4,1,0,4.5,400989970,2018-02-03
106,1,"7:20",1640,1640,"B.J. Johnson Offensive Rebound.",14,25,-11,0.340460817096317,"La Salle","Saint Joseph's",3,4,1,0,4.5,400989970,2018-02-03
107,1,"7:14",1634,1634,"Pookie Powell made Layup. Assisted by B.J. Johnson.",16,25,-9,0.422508948694125,"La Salle","Saint Joseph's",3,4,0,0,4.5,400989970,2018-02-03
108,1,"7:06",1626,1626,"Shavar Newkirk made Layup.",16,27,-11,0.323836168731967,"La Salle","Saint Joseph's",3,4,0,0,4.5,400989970,2018-02-03
109,1,"6:43",1603,1603,"Pookie Powell missed Jumper.",16,27,-11,0.350492378945012,"La Salle","Saint Joseph's",3,4,0,0,4.5,400989970,2018-02-03
110,1,"6:43",1603,1603,"Shavar Newkirk Defensive Rebound.",16,27,-11,0.350492378945012,"La Salle","Saint Joseph's",3,4,0,0,4.5,400989970,2018-02-03
111,1,"6:37",1597,1597,"James Demery made Layup. Assisted by Shavar Newkirk.",16,29,-13,0.289741376594123,"La Salle","Saint Joseph's",3,4,0,0,4.5,400989970,2018-02-03
112,1,"6:21",1581,1581,"Jamir Moultrie made Three Point Jumper. Assisted by Pookie Powell.",19,29,-10,0.362361380422429,"La Salle","Saint Joseph's",3,4,0,0,4.5,400989970,2018-02-03
113,1,"6:04",1564,1564,"Taylor Funk missed Three Point Jumper.",19,29,-10,0.342847586869648,"La Salle","Saint Joseph's",3,4,0,0,4.5,400989970,2018-02-03
114,1,"6:04",1564,1564,"James Demery Offensive Rebound.",19,29,-10,0.342847586869648,"La Salle","Saint Joseph's",3,4,0,0,4.5,400989970,2018-02-03
115,1,"6:01",1561,1561,"James Demery made Jumper.",19,31,-12,0.281842117513785,"La Salle","Saint Joseph's",3,4,0,0,4.5,400989970,2018-02-03
116,1,"6:01",1561,1561,"Foul on Isiah Deas.",19,31,-12,0.281842117513785,"La Salle","Saint Joseph's",3,4,0,0,4.5,400989970,2018-02-03
117,1,"6:01",1561,1561,"James Demery made Free Throw.",19,32,-13,0.2539417832568,"La Salle","Saint Joseph's",3,4,0,0,4.5,400989970,2018-02-03
118,1,"5:50",1550,1550,"Saul Phiri missed Three Point Jumper.",19,32,-13,0.250753591271601,"La Salle","Saint Joseph's",3,4,0,0,4.5,400989970,2018-02-03
119,1,"5:50",1550,1550,"Saint Joseph's Defensive Rebound.",19,32,-13,0.250753591271601,"La Salle","Saint Joseph's",3,4,0,0,4.5,400989970,2018-02-03
120,1,"5:35",1535,1535,"Pierfrancesco Oliva missed Three Point Jumper.",19,32,-13,0.27504390464891,"La Salle","Saint Joseph's",3,4,0,0,4.5,400989970,2018-02-03
121,1,"5:35",1535,1535,"Tony Washington Block.",19,32,-13,0.27504390464891,"La Salle","Saint Joseph's",3,4,0,0,4.5,400989970,2018-02-03
122,1,"5:34",1534,1534,"Saint Joseph's Offensive Rebound.",19,32,-13,0.27504390464891,"La Salle","Saint Joseph's",3,4,0,0,4.5,400989970,2018-02-03
123,1,"5:19",1519,1519,"Pierfrancesco Oliva Turnover.",19,32,-13,0.246377254536298,"La Salle","Saint Joseph's",3,4,0,0,4.5,400989970,2018-02-03
124,1,"5:18",1518,1518,"Pookie Powell Steal.",19,32,-13,0.246377254536298,"La Salle","Saint Joseph's",3,4,0,0,4.5,400989970,2018-02-03
125,1,"5:11",1511,1511,"Foul on Lorenzo Edwards.",19,32,-13,0.246377254536298,"La Salle","Saint Joseph's",3,4,0,0,4.5,400989970,2018-02-03
126,1,"5:11",1511,1511,"Amar Stukes made Free Throw.",20,32,-12,0.275766298285048,"La Salle","Saint Joseph's",3,4,0,0,4.5,400989970,2018-02-03
127,1,"5:11",1511,1511,"Amar Stukes made Free Throw.",21,32,-11,0.3072318406164,"La Salle","Saint Joseph's",3,4,0,0,4.5,400989970,2018-02-03
128,1,"4:46",1486,1486,"James Demery missed Three Point Jumper.",21,32,-11,0.294215852955194,"La Salle","Saint Joseph's",3,4,0,0,4.5,400989970,2018-02-03
129,1,"4:46",1486,1486,"Tony Washington Defensive Rebound.",21,32,-11,0.294215852955194,"La Salle","Saint Joseph's",3,4,0,0,4.5,400989970,2018-02-03
130,1,"4:33",1473,1473,"Pookie Powell made Three Point Jumper. Assisted by Amar Stukes.",24,32,-8,0.41025768574117,"La Salle","Saint Joseph's",3,4,0,0,4.5,400989970,2018-02-03
131,1,"4:18",1458,1458,"Pierfrancesco Oliva made Three Point Jumper. Assisted by Taylor Funk.",24,35,-11,0.298347865598111,"La Salle","Saint Joseph's",3,4,0,0,4.5,400989970,2018-02-03
132,1,"3:58",1438,1438,"Official TV Timeout",24,35,-11,0.303973914396143,"La Salle","Saint Joseph's",3,4,0,0,4.5,400989970,2018-02-03
133,1,"3:49",1429,1429,"Amar Stukes made Layup.",26,35,-9,0.362732487923638,"La Salle","Saint Joseph's",3,4,0,0,4.5,400989970,2018-02-03
134,1,"3:28",1408,1408,"Pierfrancesco Oliva made Three Point Jumper. Assisted by James Demery.",26,38,-12,0.269604881127389,"La Salle","Saint Joseph's",3,4,0,0,4.5,400989970,2018-02-03
135,1,"3:14",1394,1394,"B.J. Johnson made Layup. Assisted by Amar Stukes.",28,38,-10,0.322015309047415,"La Salle","Saint Joseph's",3,4,0,0,4.5,400989970,2018-02-03
136,1,"3:02",1382,1382,"James Demery made Layup. Assisted by Pierfrancesco Oliva.",28,40,-12,0.276858775090064,"La Salle","Saint Joseph's",3,4,0,0,4.5,400989970,2018-02-03
137,1,"3:02",1382,1382,"Foul on Tony Washington.",28,40,-12,0.276858775090064,"La Salle","Saint Joseph's",3,4,0,0,4.5,400989970,2018-02-03
138,1,"3:02",1382,1382,"James Demery made Free Throw.",28,41,-13,0.247955689014029,"La Salle","Saint Joseph's",3,4,0,0,4.5,400989970,2018-02-03
139,1,"2:37",1357,1357,"B.J. Johnson made Three Point Jumper. Assisted by Pookie Powell.",31,41,-10,0.329711777539446,"La Salle","Saint Joseph's",3,4,0,0,4.5,400989970,2018-02-03
140,1,"2:02",1322,1322,"James Demery Turnover.",31,41,-10,0.309193002463065,"La Salle","Saint Joseph's",3,4,0,0,4.5,400989970,2018-02-03
141,1,"1:45",1305,1305,"B.J. Johnson made Three Point Jumper. Assisted by Saul Phiri.",34,41,-7,0.430709795883567,"La Salle","Saint Joseph's",3,4,0,0,4.5,400989970,2018-02-03
142,1,"1:25",1285,1285,"James Demery missed Jumper.",34,41,-7,0.436503684794721,"La Salle","Saint Joseph's",3,4,0,0,4.5,400989970,2018-02-03
143,1,"1:25",1285,1285,"B.J. Johnson Defensive Rebound.",34,41,-7,0.436503684794721,"La Salle","Saint Joseph's",3,4,0,0,4.5,400989970,2018-02-03
144,1,"1:19",1279,1279,"Amar Stukes made Layup.",36,41,-5,0.489428651815834,"La Salle","Saint Joseph's",3,4,0,0,4.5,400989970,2018-02-03
145,1,"1:03",1263,1263,"Shavar Newkirk missed Jumper.",36,41,-5,0.513355991407228,"La Salle","Saint Joseph's",3,4,0,0,4.5,400989970,2018-02-03
146,1,"1:02",1262,1262,"Saul Phiri Defensive Rebound.",36,41,-5,0.513355991407228,"La Salle","Saint Joseph's",3,4,0,0,4.5,400989970,2018-02-03
147,1,"0:56",1256,1256,"Foul on Lorenzo Edwards.",36,41,-5,0.490358024425033,"La Salle","Saint Joseph's",3,4,0,0,4.5,400989970,2018-02-03
148,1,"0:56",1256,1256,"Pookie Powell made Free Throw.",37,41,-4,0.528206772419136,"La Salle","Saint Joseph's",3,4,0,0,4.5,400989970,2018-02-03
149,1,"0:56",1256,1256,"Pookie Powell made Free Throw.",38,41,-3,0.565733987396231,"La Salle","Saint Joseph's",3,4,0,0,4.5,400989970,2018-02-03
150,1,"0:31",1231,1231,"Chris Clover made Jumper.",38,43,-5,0.475718429143832,"La Salle","Saint Joseph's",3,4,0,0,4.5,400989970,2018-02-03
151,1,"0:07",1207,1207,"Foul on Shavar Newkirk.",38,43,-5,0.488473789286571,"La Salle","Saint Joseph's",3,4,0,0,4.5,400989970,2018-02-03
152,1,"0:03",1203,1203,"Foul on Pierfrancesco Oliva.",38,43,-5,0.488473789286571,"La Salle","Saint Joseph's",3,4,0,0,4.5,400989970,2018-02-03
153,1,"0:03",1203,1203,"B.J. Johnson missed Free Throw.",38,43,-5,0.488473789286571,"La Salle","Saint Joseph's",3,4,0,0,4.5,400989970,2018-02-03
154,1,"0:03",1203,1203,"Pierfrancesco Oliva Defensive Rebound.",38,43,-5,0.488473789286571,"La Salle","Saint Joseph's",3,4,0,0,4.5,400989970,2018-02-03
155,1,"0:00",1200,1200,"End of 1st half",38,43,-5,0.488473789286571,"La Salle","Saint Joseph's",3,4,0,0,4.5,400989970,2018-02-03
156,2,"20:00",1200,1200,"PLAY",38,43,-5,0.488473789286571,"La Salle","Saint Joseph's",4,4,0,0,4.5,400989970,2018-02-03
157,2,"19:44",1184,1184,"Shavar Newkirk missed Layup.",38,43,-5,0.481056126837165,"La Salle","Saint Joseph's",4,4,0,0,4.5,400989970,2018-02-03
158,2,"19:44",1184,1184,"Isiah Deas Defensive Rebound.",38,43,-5,0.481056126837165,"La Salle","Saint Joseph's",4,4,0,0,4.5,400989970,2018-02-03
159,2,"19:25",1165,1165,"Foul on Taylor Funk.",38,43,-5,0.467667532101845,"La Salle","Saint Joseph's",4,4,0,0,4.5,400989970,2018-02-03
160,2,"19:17",1157,1157,"Amar Stukes made Jumper. Assisted by Isiah Deas.",40,43,-3,0.56081476525881,"La Salle","Saint Joseph's",4,4,0,0,4.5,400989970,2018-02-03
161,2,"18:58",1138,1138,"Shavar Newkirk missed Jumper.",40,43,-3,0.570478132130165,"La Salle","Saint Joseph's",4,4,0,0,4.5,400989970,2018-02-03
162,2,"18:58",1138,1138,"Isiah Deas Defensive Rebound.",40,43,-3,0.570478132130165,"La Salle","Saint Joseph's",4,4,0,0,4.5,400989970,2018-02-03
163,2,"18:43",1123,1123,"Saul Phiri missed Three Point Jumper.",40,43,-3,0.538063480981092,"La Salle","Saint Joseph's",4,4,0,0,4.5,400989970,2018-02-03
164,2,"18:43",1123,1123,"Pierfrancesco Oliva Defensive Rebound.",40,43,-3,0.538063480981092,"La Salle","Saint Joseph's",4,4,0,0,4.5,400989970,2018-02-03
165,2,"18:29",1109,1109,"Foul on B.J. Johnson.",40,43,-3,0.563881083570178,"La Salle","Saint Joseph's",4,4,0,0,4.5,400989970,2018-02-03
166,2,"18:25",1105,1105,"Chris Clover missed Jumper.",40,43,-3,0.563881083570178,"La Salle","Saint Joseph's",4,4,0,0,4.5,400989970,2018-02-03
167,2,"18:25",1105,1105,"Pierfrancesco Oliva Offensive Rebound.",40,43,-3,0.563881083570178,"La Salle","Saint Joseph's",4,4,0,0,4.5,400989970,2018-02-03
168,2,"18:20",1100,1100,"Foul on B.J. Johnson.",40,43,-3,0.563881083570178,"La Salle","Saint Joseph's",4,4,0,0,4.5,400989970,2018-02-03
169,2,"18:20",1100,1100,"Pierfrancesco Oliva missed Free Throw.",40,43,-3,0.563881083570178,"La Salle","Saint Joseph's",4,4,0,0,4.5,400989970,2018-02-03
170,2,"18:20",1100,1100,"Saint Joseph's Deadball Team Rebound.",40,43,-3,0.563881083570178,"La Salle","Saint Joseph's",4,4,0,0,4.5,400989970,2018-02-03
171,2,"18:20",1100,1100,"Pierfrancesco Oliva missed Free Throw.",40,43,-3,0.563881083570178,"La Salle","Saint Joseph's",4,4,0,0,4.5,400989970,2018-02-03
172,2,"18:20",1100,1100,"Isiah Deas Defensive Rebound.",40,43,-3,0.563881083570178,"La Salle","Saint Joseph's",4,4,0,0,4.5,400989970,2018-02-03
173,2,"17:58",1078,1078,"Pookie Powell missed Three Point Jumper.",40,43,-3,0.55714795357542,"La Salle","Saint Joseph's",4,4,0,0,4.5,400989970,2018-02-03
174,2,"17:58",1078,1078,"Pierfrancesco Oliva Defensive Rebound.",40,43,-3,0.55714795357542,"La Salle","Saint Joseph's",4,4,0,0,4.5,400989970,2018-02-03
175,2,"17:49",1069,1069,"Foul on Pookie Powell.",40,43,-3,0.558264171763225,"La Salle","Saint Joseph's",4,4,0,0,4.5,400989970,2018-02-03
176,2,"17:49",1069,1069,"Chris Clover made Free Throw.",40,44,-4,0.515420208595133,"La Salle","Saint Joseph's",4,4,0,0,4.5,400989970,2018-02-03
