"play_id","half","time_remaining_half","secs_remaining","secs_remaining_absolute","description","home_score","away_score","score_diff","win_prob","home","away","home_time_out_remaining","away_time_out_remaining","home_timeout_ind","away_timeout_ind","home_favored_by","game_id","date"
1,1,"20:00",2400,2400,"PLAY",0,0,0,0.91337581818079,"Duke","NC State",4,4,0,0,16.5,400915396,2017-01-23
2,1,"20:00",2400,2400,"Jump Ball won by NC State",0,0,0,0.91337581818079,"Duke","NC State",4,4,0,0,16.5,400915396,2017-01-23
3,1,"19:32",2372,2372,"Abdul-Malik Abu missed Jumper.",0,0,0,0.90540430702,"Duke","NC State",4,4,0,0,16.5,400915396,2017-01-23
4,1,"19:32",2372,2372,"Jayson Tatum Defensive Rebound.",0,0,0,0.90540430702,"Duke","NC State",4,4,0,0,16.5,400915396,2017-01-23
5,1,"19:23",2363,2363,"Matt Jones missed Three Point Jumper.",0,0,0,0.896707465746504,"Duke","NC State",4,4,0,0,16.5,400915396,2017-01-23
6,1,"19:23",2363,2363,"Marques Bolden Offensive Rebound.",0,0,0,0.896707465746504,"Duke","NC State",4,4,0,0,16.5,400915396,2017-01-23
7,1,"19:23",2363,2363,"Marques Bolden missed Two Point Tip Shot.",0,0,0,0.896707465746504,"Duke","NC State",4,4,0,0,16.5,400915396,2017-01-23
8,1,"19:23",2363,2363,"Omer Yurtseven Defensive Rebound.",0,0,0,0.896707465746504,"Duke","NC State",4,4,0,0,16.5,400915396,2017-01-23
9,1,"19:15",2355,2355,"Maverick Rowan missed Three Point Jumper.",0,0,0,0.908841984385377,"Duke","NC State",4,4,0,0,16.5,400915396,2017-01-23
10,1,"19:15",2355,2355,"Terry Henderson Offensive Rebound.",0,0,0,0.908841984385377,"Duke","NC State",4,4,0,0,16.5,400915396,2017-01-23
11,1,"19:15",2355,2355,"Terry Henderson made Two Point Tip Shot.",0,2,-2,0.893178157388324,"Duke","NC State",4,4,0,0,16.5,400915396,2017-01-23
12,1,"18:59",2339,2339,"Jayson Tatum missed Three Point Jumper.",0,2,-2,0.884881980985894,"Duke","NC State",4,4,0,0,16.5,400915396,2017-01-23
13,1,"18:59",2339,2339,"Maverick Rowan Defensive Rebound.",0,2,-2,0.884881980985894,"Duke","NC State",4,4,0,0,16.5,400915396,2017-01-23
14,1,"18:38",2318,2318,"Dennis Smith Jr. made Layup.",0,4,-4,0.847360547352463,"Duke","NC State",4,4,0,0,16.5,400915396,2017-01-23
15,1,"18:19",2299,2299,"Frank Jackson made Three Point Jumper. Assisted by Jayson Tatum.",3,4,-1,0.892963612762822,"Duke","NC State",4,4,0,0,16.5,400915396,2017-01-23
16,1,"17:43",2263,2263,"NC State  Turnover.",3,4,-1,0.893863470945274,"Duke","NC State",4,4,0,0,16.5,400915396,2017-01-23
17,1,"17:32",2252,2252,"Marques Bolden missed Dunk.",3,4,-1,0.884313196068949,"Duke","NC State",4,4,0,0,16.5,400915396,2017-01-23
18,1,"17:32",2252,2252,"Matt Jones Offensive Rebound.",3,4,-1,0.884313196068949,"Duke","NC State",4,4,0,0,16.5,400915396,2017-01-23
19,1,"17:28",2248,2248,"Matt Jones made Layup.",5,4,1,0.896726161631388,"Duke","NC State",4,4,0,0,16.5,400915396,2017-01-23
20,1,"17:15",2235,2235,"Foul on Jayson Tatum.",5,4,1,0.907991712296059,"Duke","NC State",4,4,0,0,16.5,400915396,2017-01-23
21,1,"17:15",2235,2235,"Terry Henderson made Free Throw.",5,5,0,0.898203919664251,"Duke","NC State",4,4,0,0,16.5,400915396,2017-01-23
22,1,"17:15",2235,2235,"Terry Henderson made Free Throw.",5,6,-1,0.887503909363408,"Duke","NC State",4,4,0,0,16.5,400915396,2017-01-23
23,1,"17:15",2235,2235,"Terry Henderson missed Free Throw.",5,6,-1,0.887503909363408,"Duke","NC State",4,4,0,0,16.5,400915396,2017-01-23
24,1,"17:15",2235,2235,"Amile Jefferson Defensive Rebound.",5,6,-1,0.887503909363408,"Duke","NC State",4,4,0,0,16.5,400915396,2017-01-23
25,1,"17:01",2221,2221,"Amile Jefferson made Layup. Assisted by Jayson Tatum.",7,6,1,0.908416495756542,"Duke","NC State",4,4,0,0,16.5,400915396,2017-01-23
26,1,"16:42",2202,2202,"Omer Yurtseven missed Jumper.",7,6,1,0.905688213504208,"Duke","NC State",4,4,0,0,16.5,400915396,2017-01-23
27,1,"16:42",2202,2202,"Frank Jackson Defensive Rebound.",7,6,1,0.905688213504208,"Duke","NC State",4,4,0,0,16.5,400915396,2017-01-23
28,1,"16:31",2191,2191,"Jayson Tatum made Layup.",9,6,3,0.92913670497979,"Duke","NC State",4,4,0,0,16.5,400915396,2017-01-23
29,1,"16:05",2165,2165,"Abdul-Malik Abu made Jumper.",9,8,1,0.902224713535932,"Duke","NC State",4,4,0,0,16.5,400915396,2017-01-23
30,1,"15:44",2144,2144,"Official TV Timeout",9,8,1,0.906681766371799,"Duke","NC State",4,4,0,0,16.5,400915396,2017-01-23
31,1,"15:44",2144,2144,"Harry Giles missed Layup.",9,8,1,0.906681766371799,"Duke","NC State",4,4,0,0,16.5,400915396,2017-01-23
32,1,"15:44",2144,2144,"Ted Kapita Defensive Rebound.",9,8,1,0.906681766371799,"Duke","NC State",4,4,0,0,16.5,400915396,2017-01-23
33,1,"15:44",2144,2144,"Dennis Smith Jr. missed Layup.",9,8,1,0.906681766371799,"Duke","NC State",4,4,0,0,16.5,400915396,2017-01-23
34,1,"15:44",2144,2144,"Amile Jefferson Block.",9,8,1,0.906681766371799,"Duke","NC State",4,4,0,0,16.5,400915396,2017-01-23
35,1,"15:44",2144,2144,"Harry Giles Defensive Rebound.",9,8,1,0.906681766371799,"Duke","NC State",4,4,0,0,16.5,400915396,2017-01-23
36,1,"15:04",2104,2104,"Harry Giles made Layup. Assisted by Luke Kennard.",11,8,3,0.918301810084456,"Duke","NC State",4,4,0,0,16.5,400915396,2017-01-23
37,1,"15:04",2104,2104,"Foul on Abdul-Malik Abu.",11,8,3,0.918301810084456,"Duke","NC State",4,4,0,0,16.5,400915396,2017-01-23
38,1,"15:04",2104,2104,"Harry Giles missed Free Throw.",11,8,3,0.918301810084456,"Duke","NC State",4,4,0,0,16.5,400915396,2017-01-23
39,1,"15:04",2104,2104,"Abdul-Malik Abu Defensive Rebound.",11,8,3,0.918301810084456,"Duke","NC State",4,4,0,0,16.5,400915396,2017-01-23
40,1,"15:00",2100,2100,"Maverick Rowan missed Three Point Jumper.",11,8,3,0.918301810084456,"Duke","NC State",4,4,0,0,16.5,400915396,2017-01-23
41,1,"15:00",2100,2100,"Luke Kennard Defensive Rebound.",11,8,3,0.918301810084456,"Duke","NC State",4,4,0,0,16.5,400915396,2017-01-23
42,1,"14:54",2094,2094,"Grayson Allen missed Three Point Jumper.",11,8,3,0.917993580715389,"Duke","NC State",4,4,0,0,16.5,400915396,2017-01-23
43,1,"14:54",2094,2094,"Amile Jefferson Offensive Rebound.",11,8,3,0.917993580715389,"Duke","NC State",4,4,0,0,16.5,400915396,2017-01-23
44,1,"14:54",2094,2094,"Amile Jefferson missed Two Point Tip Shot.",11,8,3,0.917993580715389,"Duke","NC State",4,4,0,0,16.5,400915396,2017-01-23
45,1,"14:54",2094,2094,"Ted Kapita Defensive Rebound.",11,8,3,0.917993580715389,"Duke","NC State",4,4,0,0,16.5,400915396,2017-01-23
46,1,"14:25",2065,2065,"Dennis Smith Jr. made Three Point Jumper. Assisted by Maverick Rowan.",11,11,0,0.887122156437012,"Duke","NC State",4,4,0,0,16.5,400915396,2017-01-23
47,1,"14:08",2048,2048,"Luke Kennard made Three Point Jumper. Assisted by Grayson Allen.",14,11,3,0.913443678081093,"Duke","NC State",4,4,0,0,16.5,400915396,2017-01-23
48,1,"13:37",2017,2017,"Dennis Smith Jr. missed Three Point Jumper.",14,11,3,0.920144280980643,"Duke","NC State",4,4,0,0,16.5,400915396,2017-01-23
49,1,"13:37",2017,2017,"Jayson Tatum Defensive Rebound.",14,11,3,0.920144280980643,"Duke","NC State",4,4,0,0,16.5,400915396,2017-01-23
50,1,"13:29",2009,2009,"Foul on Dennis Smith Jr..",14,11,3,0.915248191852829,"Duke","NC State",4,4,0,0,16.5,400915396,2017-01-23
51,1,"13:27",2007,2007,"Harry Giles made Dunk. Assisted by Frank Jackson.",16,11,5,0.930872531742262,"Duke","NC State",4,4,0,0,16.5,400915396,2017-01-23
52,1,"13:20",2000,2000,"NC State  Timeout",16,11,5,0.930872531742262,"Duke","NC State",3,4,1,0,16.5,400915396,2017-01-23
53,1,"12:59",1979,1979,"Ted Kapita made Layup. Assisted by Abdul-Malik Abu.",16,13,3,0.925856339924102,"Duke","NC State",3,4,1,0,16.5,400915396,2017-01-23
54,1,"12:46",1966,1966,"Grayson Allen made Jumper.",18,13,5,0.931267370496845,"Duke","NC State",3,4,1,0,16.5,400915396,2017-01-23
55,1,"12:31",1951,1951,"Abdul-Malik Abu made Jumper.",18,15,3,0.917080601062557,"Duke","NC State",3,4,1,0,16.5,400915396,2017-01-23
56,1,"12:19",1939,1939,"Harry Giles made Jumper. Assisted by Frank Jackson.",20,15,5,0.93250515293069,"Duke","NC State",3,4,0,0,16.5,400915396,2017-01-23
57,1,"12:00",1920,1920,"Torin Dorn made Jumper.",20,17,3,0.92337267219883,"Duke","NC State",3,4,0,0,16.5,400915396,2017-01-23
58,1,"11:47",1907,1907,"Grayson Allen Turnover.",20,17,3,0.918056667884795,"Duke","NC State",3,4,0,0,16.5,400915396,2017-01-23
59,1,"11:47",1907,1907,"Official TV Timeout",20,17,3,0.918056667884795,"Duke","NC State",3,4,0,0,16.5,400915396,2017-01-23
60,1,"11:28",1888,1888,"Terry Henderson missed Three Point Jumper.",20,17,3,0.918606193527315,"Duke","NC State",3,4,0,0,16.5,400915396,2017-01-23
61,1,"11:28",1888,1888,"Duke Defensive Rebound.",20,17,3,0.918606193527315,"Duke","NC State",3,4,0,0,16.5,400915396,2017-01-23
62,1,"11:08",1868,1868,"Luke Kennard Turnover.",20,17,3,0.915622605515101,"Duke","NC State",3,4,0,0,16.5,400915396,2017-01-23
63,1,"11:08",1868,1868,"Torin Dorn Steal.",20,17,3,0.915622605515101,"Duke","NC State",3,4,0,0,16.5,400915396,2017-01-23
64,1,"11:08",1868,1868,"Foul on Luke Kennard.",20,17,3,0.915622605515101,"Duke","NC State",3,4,0,0,16.5,400915396,2017-01-23
65,1,"10:52",1852,1852,"Ted Kapita made Jumper. Assisted by Abdul-Malik Abu.",20,19,1,0.893853289477529,"Duke","NC State",3,4,0,0,16.5,400915396,2017-01-23
66,1,"10:33",1833,1833,"Foul on Ted Kapita.",20,19,1,0.889906254270947,"Duke","NC State",3,4,0,0,16.5,400915396,2017-01-23
67,1,"10:33",1833,1833,"Foul on Ted Kapita.",20,19,1,0.889906254270947,"Duke","NC State",3,4,0,0,16.5,400915396,2017-01-23
68,1,"10:13",1813,1813,"Amile Jefferson made Layup. Assisted by Jayson Tatum.",22,19,3,0.917895443489104,"Duke","NC State",3,4,0,0,16.5,400915396,2017-01-23
69,1,"9:58",1798,1798,"Abdul-Malik Abu Turnover.",22,19,3,0.908939133556087,"Duke","NC State",3,4,0,0,16.5,400915396,2017-01-23
70,1,"9:58",1798,1798,"Marques Bolden Steal.",22,19,3,0.908939133556087,"Duke","NC State",3,4,0,0,16.5,400915396,2017-01-23
71,1,"9:52",1792,1792,"Matt Jones missed Three Point Jumper.",22,19,3,0.908939133556087,"Duke","NC State",3,4,0,0,16.5,400915396,2017-01-23
72,1,"9:52",1792,1792,"Torin Dorn Defensive Rebound.",22,19,3,0.908939133556087,"Duke","NC State",3,4,0,0,16.5,400915396,2017-01-23
73,1,"9:35",1775,1775,"Markell Johnson Turnover.",22,19,3,0.907982055588608,"Duke","NC State",3,4,0,0,16.5,400915396,2017-01-23
74,1,"9:35",1775,1775,"Jayson Tatum Steal.",22,19,3,0.907982055588608,"Duke","NC State",3,4,0,0,16.5,400915396,2017-01-23
75,1,"9:30",1770,1770,"Jayson Tatum made Three Point Jumper. Assisted by Matt Jones.",25,19,6,0.934408349259338,"Duke","NC State",3,4,0,0,16.5,400915396,2017-01-23
76,1,"9:08",1748,1748,"Torin Dorn missed Three Point Jumper.",25,19,6,0.935316136429965,"Duke","NC State",3,4,0,0,16.5,400915396,2017-01-23
77,1,"9:08",1748,1748,"Frank Jackson Defensive Rebound.",25,19,6,0.935316136429965,"Duke","NC State",3,4,0,0,16.5,400915396,2017-01-23
78,1,"9:00",1740,1740,"Frank Jackson Turnover.",25,19,6,0.935316136429965,"Duke","NC State",3,4,0,0,16.5,400915396,2017-01-23
79,1,"9:00",1740,1740,"Markell Johnson Steal.",25,19,6,0.935316136429965,"Duke","NC State",3,4,0,0,16.5,400915396,2017-01-23
80,1,"8:55",1735,1735,"Markell Johnson made Dunk.",25,21,4,0.925026576157056,"Duke","NC State",3,4,0,0,16.5,400915396,2017-01-23
81,1,"8:27",1707,1707,"Jayson Tatum Turnover.",25,21,4,0.918521376019242,"Duke","NC State",3,4,0,0,16.5,400915396,2017-01-23
82,1,"8:09",1689,1689,"Maverick Rowan missed Layup.",25,21,4,0.931151967483117,"Duke","NC State",3,4,0,0,16.5,400915396,2017-01-23
83,1,"8:09",1689,1689,"Jayson Tatum Block.",25,21,4,0.931151967483117,"Duke","NC State",3,4,0,0,16.5,400915396,2017-01-23
84,1,"8:09",1689,1689,"Amile Jefferson Defensive Rebound.",25,21,4,0.931151967483117,"Duke","NC State",3,4,0,0,16.5,400915396,2017-01-23
85,1,"7:50",1670,1670,"Grayson Allen made Three Point Jumper. Assisted by Amile Jefferson.",28,21,7,0.94921397951837,"Duke","NC State",3,4,0,0,16.5,400915396,2017-01-23
86,1,"7:34",1654,1654,"Foul on Matt Jones.",28,21,7,0.943517405924241,"Duke","NC State",3,4,0,0,16.5,400915396,2017-01-23
87,1,"7:34",1654,1654,"Official TV Timeout",28,21,7,0.943517405924241,"Duke","NC State",3,4,0,0,16.5,400915396,2017-01-23
88,1,"7:34",1654,1654,"Dennis Smith Jr. made Free Throw.",28,22,6,0.93602298979479,"Duke","NC State",3,4,0,0,16.5,400915396,2017-01-23
89,1,"7:34",1654,1654,"Dennis Smith Jr. made Free Throw.",28,23,5,0.927610467366976,"Duke","NC State",3,4,0,0,16.5,400915396,2017-01-23
90,1,"7:16",1636,1636,"Grayson Allen missed Three Point Jumper.",28,23,5,0.929333399656315,"Duke","NC State",3,4,0,0,16.5,400915396,2017-01-23
91,1,"7:16",1636,1636,"Maverick Rowan Defensive Rebound.",28,23,5,0.929333399656315,"Duke","NC State",3,4,0,0,16.5,400915396,2017-01-23
92,1,"7:12",1632,1632,"Foul on Jayson Tatum.",28,23,5,0.929333399656315,"Duke","NC State",3,4,0,0,16.5,400915396,2017-01-23
93,1,"7:08",1628,1628,"Dennis Smith Jr. made Layup.",28,25,3,0.911181359541007,"Duke","NC State",3,4,0,0,16.5,400915396,2017-01-23
94,1,"6:51",1611,1611,"Foul on Omer Yurtseven.",28,25,3,0.901384495370082,"Duke","NC State",3,4,0,0,16.5,400915396,2017-01-23
95,1,"6:51",1611,1611,"Amile Jefferson missed Free Throw.",28,25,3,0.901384495370082,"Duke","NC State",3,4,0,0,16.5,400915396,2017-01-23
96,1,"6:51",1611,1611,"Duke Deadball Team Rebound.",28,25,3,0.901384495370082,"Duke","NC State",3,4,0,0,16.5,400915396,2017-01-23
97,1,"6:51",1611,1611,"Amile Jefferson made Free Throw.",29,25,4,0.913207642995914,"Duke","NC State",3,4,0,0,16.5,400915396,2017-01-23
98,1,"6:40",1600,1600,"Dennis Smith Jr. missed Layup.",29,25,4,0.921604014410196,"Duke","NC State",3,4,0,0,16.5,400915396,2017-01-23
99,1,"6:40",1600,1600,"Luke Kennard Defensive Rebound.",29,25,4,0.921604014410196,"Duke","NC State",3,4,0,0,16.5,400915396,2017-01-23
100,1,"6:33",1593,1593,"Foul on Maverick Rowan.",29,25,4,0.917090714011456,"Duke","NC State",3,4,0,0,16.5,400915396,2017-01-23
101,1,"6:29",1589,1589,"Luke Kennard missed Layup.",29,25,4,0.91860602510639,"Duke","NC State",3,4,0,0,16.5,400915396,2017-01-23
102,1,"6:29",1589,1589,"Terry Henderson Block.",29,25,4,0.91860602510639,"Duke","NC State",3,4,0,0,16.5,400915396,2017-01-23
103,1,"6:29",1589,1589,"Luke Kennard Offensive Rebound.",29,25,4,0.91860602510639,"Duke","NC State",3,4,0,0,16.5,400915396,2017-01-23
104,1,"6:22",1582,1582,"Grayson Allen missed Three Point Jumper.",29,25,4,0.91860602510639,"Duke","NC State",3,4,0,0,16.5,400915396,2017-01-23
105,1,"6:22",1582,1582,"Frank Jackson Offensive Rebound.",29,25,4,0.91860602510639,"Duke","NC State",3,4,0,0,16.5,400915396,2017-01-23
106,1,"6:18",1578,1578,"Matt Jones made Three Point Jumper. Assisted by Luke Kennard.",32,25,7,0.952332758693539,"Duke","NC State",3,4,0,0,16.5,400915396,2017-01-23
107,1,"5:59",1559,1559,"Terry Henderson missed Jumper.",32,25,7,0.9427837851369,"Duke","NC State",3,4,0,0,16.5,400915396,2017-01-23
108,1,"5:59",1559,1559,"Harry Giles Defensive Rebound.",32,25,7,0.9427837851369,"Duke","NC State",3,4,0,0,16.5,400915396,2017-01-23
109,1,"5:51",1551,1551,"Grayson Allen made Layup. Assisted by Luke Kennard.",34,25,9,0.956442880475132,"Duke","NC State",3,4,0,0,16.5,400915396,2017-01-23
110,1,"5:45",1545,1545,"NC State  Timeout",34,25,9,0.959728278695815,"Duke","NC State",2,4,1,0,16.5,400915396,2017-01-23
111,1,"5:20",1520,1520,"Foul on Frank Jackson.",34,25,9,0.957414812543745,"Duke","NC State",2,4,1,0,16.5,400915396,2017-01-23
112,1,"5:03",1503,1503,"Dennis Smith Jr. made Three Point Jumper.",34,28,6,0.937445649368629,"Duke","NC State",2,4,1,0,16.5,400915396,2017-01-23
113,1,"4:29",1469,1469,"Foul on Maverick Rowan.",34,28,6,0.927123483999131,"Duke","NC State",2,4,0,0,16.5,400915396,2017-01-23
114,1,"4:29",1469,1469,"Grayson Allen missed Free Throw.",34,28,6,0.927123483999131,"Duke","NC State",2,4,0,0,16.5,400915396,2017-01-23
115,1,"4:29",1469,1469,"Duke Deadball Team Rebound.",34,28,6,0.927123483999131,"Duke","NC State",2,4,0,0,16.5,400915396,2017-01-23
116,1,"4:29",1469,1469,"Grayson Allen made Free Throw.",35,28,7,0.936000322531094,"Duke","NC State",2,4,0,0,16.5,400915396,2017-01-23
117,1,"4:29",1469,1469,"Grayson Allen made Free Throw.",36,28,8,0.943861375439444,"Duke","NC State",2,4,0,0,16.5,400915396,2017-01-23
118,1,"4:13",1453,1453,"Omer Yurtseven missed Jumper.",36,28,8,0.952170025442659,"Duke","NC State",2,4,0,0,16.5,400915396,2017-01-23
119,1,"4:13",1453,1453,"Luke Kennard Defensive Rebound.",36,28,8,0.952170025442659,"Duke","NC State",2,4,0,0,16.5,400915396,2017-01-23
120,1,"4:08",1448,1448,"Foul on Omer Yurtseven.",36,28,8,0.957303293302048,"Duke","NC State",2,4,0,0,16.5,400915396,2017-01-23
121,1,"4:08",1448,1448,"Luke Kennard missed Free Throw.",36,28,8,0.957303293302048,"Duke","NC State",2,4,0,0,16.5,400915396,2017-01-23
122,1,"4:08",1448,1448,"Ted Kapita Defensive Rebound.",36,28,8,0.957303293302048,"Duke","NC State",2,4,0,0,16.5,400915396,2017-01-23
123,1,"3:46",1426,1426,"Foul on Marques Bolden.",36,28,8,0.946459792792137,"Duke","NC State",2,4,0,0,16.5,400915396,2017-01-23
124,1,"3:46",1426,1426,"Official TV Timeout",36,28,8,0.946459792792137,"Duke","NC State",2,4,0,0,16.5,400915396,2017-01-23
125,1,"3:46",1426,1426,"Abdul-Malik Abu made Free Throw.",36,29,7,0.938633018043649,"Duke","NC State",2,4,0,0,16.5,400915396,2017-01-23
126,1,"3:46",1426,1426,"Abdul-Malik Abu made Free Throw.",36,30,6,0.929747013774227,"Duke","NC State",2,4,0,0,16.5,400915396,2017-01-23
127,1,"3:27",1407,1407,"Grayson Allen missed Three Point Jumper.",36,30,6,0.943622455433072,"Duke","NC State",2,4,0,0,16.5,400915396,2017-01-23
128,1,"3:27",1407,1407,"Abdul-Malik Abu Defensive Rebound.",36,30,6,0.943622455433072,"Duke","NC State",2,4,0,0,16.5,400915396,2017-01-23
129,1,"3:07",1387,1387,"Foul on Marques Bolden.",36,30,6,0.938858679119194,"Duke","NC State",2,4,0,0,16.5,400915396,2017-01-23
130,1,"3:07",1387,1387,"Terry Henderson made Free Throw.",36,31,5,0.929695993308373,"Duke","NC State",2,4,0,0,16.5,400915396,2017-01-23
131,1,"3:07",1387,1387,"Terry Henderson made Free Throw.",36,32,4,0.919278239851801,"Duke","NC State",2,4,0,0,16.5,400915396,2017-01-23
132,1,"2:53",1373,1373,"Luke Kennard made Jumper.",38,32,6,0.932723684140884,"Duke","NC State",2,4,0,0,16.5,400915396,2017-01-23
133,1,"2:32",1352,1352,"Abdul-Malik Abu missed Jumper.",38,32,6,0.939655265635478,"Duke","NC State",2,4,0,0,16.5,400915396,2017-01-23
134,1,"2:32",1352,1352,"Harry Giles Defensive Rebound.",38,32,6,0.939655265635478,"Duke","NC State",2,4,0,0,16.5,400915396,2017-01-23
135,1,"2:17",1337,1337,"Luke Kennard missed Three Point Jumper.",38,32,6,0.931783948689594,"Duke","NC State",2,4,0,0,16.5,400915396,2017-01-23
136,1,"2:17",1337,1337,"Harry Giles Offensive Rebound.",38,32,6,0.931783948689594,"Duke","NC State",2,4,0,0,16.5,400915396,2017-01-23
137,1,"2:12",1332,1332,"Harry Giles made Jumper.",40,32,8,0.949095924983027,"Duke","NC State",2,4,0,0,16.5,400915396,2017-01-23
138,1,"1:51",1311,1311,"Dennis Smith Jr. missed Layup.",40,32,8,0.954234137907169,"Duke","NC State",2,4,0,0,16.5,400915396,2017-01-23
139,1,"1:51",1311,1311,"Harry Giles Defensive Rebound.",40,32,8,0.954234137907169,"Duke","NC State",2,4,0,0,16.5,400915396,2017-01-23
140,1,"1:46",1306,1306,"Matt Jones made Three Point Jumper. Assisted by Grayson Allen.",43,32,11,0.963623721922045,"Duke","NC State",2,4,0,0,16.5,400915396,2017-01-23
141,1,"1:11",1271,1271,"Dennis Smith Jr. Turnover.",43,32,11,0.965762427643666,"Duke","NC State",2,4,0,0,16.5,400915396,2017-01-23
142,1,"1:11",1271,1271,"Matt Jones Steal.",43,32,11,0.965762427643666,"Duke","NC State",2,4,0,0,16.5,400915396,2017-01-23
143,1,"1:02",1262,1262,"Foul on Grayson Allen.",43,32,11,0.972714927969662,"Duke","NC State",2,4,0,0,16.5,400915396,2017-01-23
144,1,"1:02",1262,1262,"Grayson Allen Turnover.",43,32,11,0.972714927969662,"Duke","NC State",2,4,0,0,16.5,400915396,2017-01-23
145,1,"0:53",1253,1253,"Markell Johnson missed Layup.",43,32,11,0.964013333326582,"Duke","NC State",2,4,0,0,16.5,400915396,2017-01-23
146,1,"0:53",1253,1253,"Harry Giles Block.",43,32,11,0.964013333326582,"Duke","NC State",2,4,0,0,16.5,400915396,2017-01-23
147,1,"0:53",1253,1253,"Harry Giles Defensive Rebound.",43,32,11,0.964013333326582,"Duke","NC State",2,4,0,0,16.5,400915396,2017-01-23
148,1,"0:36",1236,1236,"Foul on Markell Johnson.",43,32,11,0.967802894974398,"Duke","NC State",2,4,0,0,16.5,400915396,2017-01-23
149,1,"0:36",1236,1236,"Luke Kennard made Free Throw.",44,32,12,0.972459192723481,"Duke","NC State",2,4,0,0,16.5,400915396,2017-01-23
150,1,"0:36",1236,1236,"Luke Kennard missed Free Throw.",44,32,12,0.972459192723481,"Duke","NC State",2,4,0,0,16.5,400915396,2017-01-23
151,1,"0:36",1236,1236,"Ted Kapita Defensive Rebound.",44,32,12,0.972459192723481,"Duke","NC State",2,4,0,0,16.5,400915396,2017-01-23
152,1,"0:27",1227,1227,"Dennis Smith Jr. made Layup.",44,34,10,0.967689001299659,"Duke","NC State",2,4,0,0,16.5,400915396,2017-01-23
153,1,"0:27",1227,1227,"Foul on Matt Jones.",44,34,10,0.967689001299659,"Duke","NC State",2,4,0,0,16.5,400915396,2017-01-23
154,1,"0:27",1227,1227,"Dennis Smith Jr. made Free Throw.",44,35,9,0.961974591197037,"Duke","NC State",2,4,0,0,16.5,400915396,2017-01-23
155,1,"0:22",1222,1222,"Duke  Timeout",44,35,9,0.961974591197037,"Duke","NC State",2,3,0,1,16.5,400915396,2017-01-23
156,1,"0:06",1206,1206,"Matt Jones Turnover.",44,35,9,0.958436477736448,"Duke","NC State",2,3,0,1,16.5,400915396,2017-01-23
157,1,"0:02",1202,1202,"Dennis Smith Jr. made Three Point Jumper.",44,38,6,0.934644745641867,"Duke","NC State",2,3,0,1,16.5,400915396,2017-01-23
158,1,"0:00",1200,1200,"End of 1st half",44,38,6,0.934644745641867,"Duke","NC State",2,3,0,1,16.5,400915396,2017-01-23
159,2,"20:00",1200,1200,"PLAY",44,38,6,0.934644745641867,"Duke","NC State",3,4,0,0,16.5,400915396,2017-01-23
160,2,"20:00",1200,1200,"Jump Ball won by Duke",44,38,6,0.934644745641867,"Duke","NC State",3,4,0,0,16.5,400915396,2017-01-23
161,2,"19:46",1186,1186,"Jayson Tatum made Layup. Assisted by Amile Jefferson.",46,38,8,0.954247973768778,"Duke","NC State",3,4,0,0,16.5,400915396,2017-01-23
162,2,"19:29",1169,1169,"Abdul-Malik Abu made Dunk. Assisted by Dennis Smith Jr..",46,40,6,0.935597128817334,"Duke","NC State",3,4,0,0,16.5,400915396,2017-01-23
163,2,"19:00",1140,1140,"Marques Bolden missed Layup.",46,40,6,0.931122346639696,"Duke","NC State",3,4,0,0,16.5,400915396,2017-01-23
164,2,"19:00",1140,1140,"Marques Bolden Offensive Rebound.",46,40,6,0.931122346639696,"Duke","NC State",3,4,0,0,16.5,400915396,2017-01-23
165,2,"18:55",1135,1135,"Marques Bolden made Layup.",48,40,8,0.953717253961638,"Duke","NC State",3,4,0,0,16.5,400915396,2017-01-23
166,2,"18:42",1122,1122,"Dennis Smith Jr. Turnover.",48,40,8,0.958132872466626,"Duke","NC State",3,4,0,0,16.5,400915396,2017-01-23
167,2,"18:42",1122,1122,"Amile Jefferson Steal.",48,40,8,0.958132872466626,"Duke","NC State",3,4,0,0,16.5,400915396,2017-01-23
168,2,"18:33",1113,1113,"Frank Jackson missed Three Point Jumper.",48,40,8,0.951014185787166,"Duke","NC State",3,4,0,0,16.5,400915396,2017-01-23
169,2,"18:33",1113,1113,"Terry Henderson Defensive Rebound.",48,40,8,0.951014185787166,"Duke","NC State",3,4,0,0,16.5,400915396,2017-01-23
170,2,"18:08",1088,1088,"Terry Henderson missed Three Point Jumper.",48,40,8,0.957969020554056,"Duke","NC State",3,4,0,0,16.5,400915396,2017-01-23
171,2,"18:08",1088,1088,"Jayson Tatum Defensive Rebound.",48,40,8,0.957969020554056,"Duke","NC State",3,4,0,0,16.5,400915396,2017-01-23
172,2,"17:59",1079,1079,"Jayson Tatum missed Three Point Jumper.",48,40,8,0.949371575259524,"Duke","NC State",3,4,0,0,16.5,400915396,2017-01-23
173,2,"17:59",1079,1079,"Ted Kapita Defensive Rebound.",48,40,8,0.949371575259524,"Duke","NC State",3,4,0,0,16.5,400915396,2017-01-23
174,2,"17:52",1072,1072,"Foul on Marques Bolden.",48,40,8,0.949371575259524,"Duke","NC State",3,4,0,0,16.5,400915396,2017-01-23
175,2,"17:36",1056,1056,"Ted Kapita made Jumper.",48,42,6,0.937875819197551,"Duke","NC State",3,4,0,0,16.5,400915396,2017-01-23
176,2,"17:20",1040,1040,"Matt Jones missed Layup.",48,42,6,0.938948475768637,"Duke","NC State",3,4,0,0,16.5,400915396,2017-01-23
177,2,"17:20",1040,1040,"Maverick Rowan Defensive Rebound.",48,42,6,0.938948475768637,"Duke","NC State",3,4,0,0,16.5,400915396,2017-01-23
178,2,"17:14",1034,1034,"Abdul-Malik Abu made Dunk. Assisted by Dennis Smith Jr..",48,44,4,0.908668711269337,"Duke","NC State",3,4,0,0,16.5,400915396,2017-01-23
179,2,"17:04",1024,1024,"Foul on Harry Giles.",48,44,4,0.911519277580775,"Duke","NC State",3,4,0,0,16.5,400915396,2017-01-23
180,2,"17:04",1024,1024,"Foul on Ted Kapita.",48,44,4,0.911519277580775,"Duke","NC State",3,4,0,0,16.5,400915396,2017-01-23
181,2,"17:03",1023,1023,"Foul on Harry Giles.",48,44,4,0.911519277580775,"Duke","NC State",3,4,0,0,16.5,400915396,2017-01-23
182,2,"17:03",1023,1023,"Harry Giles Turnover.",48,44,4,0.911519277580775,"Duke","NC State",3,4,0,0,16.5,400915396,2017-01-23
183,2,"16:51",1011,1011,"Dennis Smith Jr. missed Three Point Jumper.",48,44,4,0.898506448361829,"Duke","NC State",3,4,0,0,16.5,400915396,2017-01-23
184,2,"16:51",1011,1011,"Abdul-Malik Abu Offensive Rebound.",48,44,4,0.898506448361829,"Duke","NC State",3,4,0,0,16.5,400915396,2017-01-23
185,2,"16:51",1011,1011,"Abdul-Malik Abu missed Two Point Tip Shot.",48,44,4,0.898506448361829,"Duke","NC State",3,4,0,0,16.5,400915396,2017-01-23
186,2,"16:51",1011,1011,"Ted Kapita Offensive Rebound.",48,44,4,0.898506448361829,"Duke","NC State",3,4,0,0,16.5,400915396,2017-01-23
187,2,"16:42",1002,1002,"Ted Kapita made Dunk.",48,46,2,0.864580810525374,"Duke","NC State",3,4,0,0,16.5,400915396,2017-01-23
188,2,"16:42",1002,1002,"Technical Foul on Ted Kapita.",48,46,2,0.864580810525374,"Duke","NC State",3,4,0,0,16.5,400915396,2017-01-23
189,2,"16:42",1002,1002,"Jayson Tatum missed Free Throw.",48,46,2,0.864580810525374,"Duke","NC State",3,4,0,0,16.5,400915396,2017-01-23
190,2,"16:42",1002,1002,"Duke Deadball Team Rebound.",48,46,2,0.864580810525374,"Duke","NC State",3,4,0,0,16.5,400915396,2017-01-23
191,2,"16:35",995,995,"Frank Jackson Turnover.",48,46,2,0.868362825541931,"Duke","NC State",3,4,0,0,16.5,400915396,2017-01-23
