"play_id","half","time_remaining_half","secs_remaining","secs_remaining_absolute","description","home_score","away_score","score_diff","win_prob","home","away","home_time_out_remaining","away_time_out_remaining","home_timeout_ind","away_timeout_ind","home_favored_by","game_id","date"
1,1,"20:00",2400,2400,"PLAY",0,0,0,0.866754527626063,"Tulsa","UTSA",6,6,0,0,10,400987975,2017-11-28
2,1,"19:47",2387,2387,"Jaleel Wheeler missed Jumper.",0,0,0,0.862518127669407,"Tulsa","UTSA",6,6,0,0,10,400987975,2017-11-28
3,1,"19:47",2387,2387,"Jaleel Wheeler Offensive Rebound.",0,0,0,0.862518127669407,"Tulsa","UTSA",6,6,0,0,10,400987975,2017-11-28
4,1,"19:44",2384,2384,"Jaleel Wheeler missed Jumper.",0,0,0,0.862518127669407,"Tulsa","UTSA",6,6,0,0,10,400987975,2017-11-28
5,1,"19:44",2384,2384,"Junior Etou Offensive Rebound.",0,0,0,0.862518127669407,"Tulsa","UTSA",6,6,0,0,10,400987975,2017-11-28
6,1,"19:29",2369,2369,"Junior Etou made Jumper.",2,0,2,0.856344942492303,"Tulsa","UTSA",6,6,0,0,10,400987975,2017-11-28
7,1,"19:07",2347,2347,"Keaton Wallace missed Three Point Jumper.",2,0,2,0.871726496102311,"Tulsa","UTSA",6,6,0,0,10,400987975,2017-11-28
8,1,"19:07",2347,2347,"Sterling Taplin Defensive Rebound.",2,0,2,0.871726496102311,"Tulsa","UTSA",6,6,0,0,10,400987975,2017-11-28
9,1,"18:51",2331,2331,"Curran Scott missed Jumper.",2,0,2,0.877009915998431,"Tulsa","UTSA",6,6,0,0,10,400987975,2017-11-28
10,1,"18:51",2331,2331,"Nick Allen Defensive Rebound.",2,0,2,0.877009915998431,"Tulsa","UTSA",6,6,0,0,10,400987975,2017-11-28
11,1,"18:41",2321,2321,"Keaton Wallace made Three Point Jumper. Assisted by Giovanni De Nicolao.",2,3,-1,0.843302401196798,"Tulsa","UTSA",6,6,0,0,10,400987975,2017-11-28
12,1,"18:19",2299,2299,"Curran Scott made Jumper.",4,3,1,0.866569565092636,"Tulsa","UTSA",6,6,0,0,10,400987975,2017-11-28
13,1,"18:03",2283,2283,"Austin Karrer missed Three Point Jumper.",4,3,1,0.861707747431714,"Tulsa","UTSA",6,6,0,0,10,400987975,2017-11-28
14,1,"18:03",2283,2283,"Curran Scott Defensive Rebound.",4,3,1,0.861707747431714,"Tulsa","UTSA",6,6,0,0,10,400987975,2017-11-28
15,1,"17:50",2270,2270,"Sterling Taplin missed Three Point Jumper.",4,3,1,0.865736685726599,"Tulsa","UTSA",6,6,0,0,10,400987975,2017-11-28
16,1,"17:50",2270,2270,"DaQuan Jeffries Offensive Rebound.",4,3,1,0.865736685726599,"Tulsa","UTSA",6,6,0,0,10,400987975,2017-11-28
17,1,"17:35",2255,2255,"Sterling Taplin made Layup.",6,3,3,0.880090133913859,"Tulsa","UTSA",6,6,0,0,10,400987975,2017-11-28
18,1,"17:21",2241,2241,"Giovanni De Nicolao missed Three Point Jumper.",6,3,3,0.874595275632483,"Tulsa","UTSA",6,6,0,0,10,400987975,2017-11-28
19,1,"17:21",2241,2241,"DaQuan Jeffries Defensive Rebound.",6,3,3,0.874595275632483,"Tulsa","UTSA",6,6,0,0,10,400987975,2017-11-28
20,1,"16:55",2215,2215,"Jaleel Wheeler missed Three Point Jumper.",6,3,3,0.890609622857241,"Tulsa","UTSA",6,6,0,0,10,400987975,2017-11-28
21,1,"16:55",2215,2215,"Nick Allen Defensive Rebound.",6,3,3,0.890609622857241,"Tulsa","UTSA",6,6,0,0,10,400987975,2017-11-28
22,1,"16:28",2188,2188,"Giovanni De Nicolao missed Layup.",6,3,3,0.884982190132289,"Tulsa","UTSA",6,6,0,0,10,400987975,2017-11-28
23,1,"16:28",2188,2188,"Jaleel Wheeler Defensive Rebound.",6,3,3,0.884982190132289,"Tulsa","UTSA",6,6,0,0,10,400987975,2017-11-28
24,1,"16:27",2187,2187,"Foul on Giovanni De Nicolao.",6,3,3,0.884982190132289,"Tulsa","UTSA",6,6,0,0,10,400987975,2017-11-28
25,1,"16:11",2171,2171,"Junior Etou made Three Point Jumper. Assisted by Elijah Joiner.",9,3,6,0.912045387090128,"Tulsa","UTSA",6,6,0,0,10,400987975,2017-11-28
26,1,"15:55",2155,2155,"Jhivvan Jackson made Layup.",9,5,4,0.895944443671156,"Tulsa","UTSA",6,6,0,0,10,400987975,2017-11-28
27,1,"15:55",2155,2155,"Foul on Corey Henderson Jr..",9,5,4,0.895944443671156,"Tulsa","UTSA",6,6,0,0,10,400987975,2017-11-28
28,1,"15:55",2155,2155,"Official TV Timeout",9,5,4,0.895944443671156,"Tulsa","UTSA",6,6,0,0,10,400987975,2017-11-28
29,1,"15:55",2155,2155,"Jhivvan Jackson made Free Throw.",9,6,3,0.884267093606694,"Tulsa","UTSA",6,6,0,0,10,400987975,2017-11-28
30,1,"15:33",2133,2133,"Elijah Joiner missed Layup.",9,6,3,0.887309131645304,"Tulsa","UTSA",6,6,0,0,10,400987975,2017-11-28
31,1,"15:33",2133,2133,"Martins Igbanu Offensive Rebound.",9,6,3,0.887309131645304,"Tulsa","UTSA",6,6,0,0,10,400987975,2017-11-28
32,1,"15:31",2131,2131,"Martins Igbanu made Layup.",11,6,5,0.909344635596138,"Tulsa","UTSA",6,6,0,0,10,400987975,2017-11-28
33,1,"15:10",2110,2110,"Deon Lyle made Layup. Assisted by Keaton Wallace.",11,8,3,0.89132208795355,"Tulsa","UTSA",6,6,0,0,10,400987975,2017-11-28
34,1,"15:00",2100,2100,"Corey Henderson Jr. missed Three Point Jumper.",11,8,3,0.880156808678721,"Tulsa","UTSA",6,6,0,0,10,400987975,2017-11-28
35,1,"15:00",2100,2100,"Nick Allen Defensive Rebound.",11,8,3,0.880156808678721,"Tulsa","UTSA",6,6,0,0,10,400987975,2017-11-28
36,1,"14:35",2075,2075,"Jhivvan Jackson missed Three Point Jumper.",11,8,3,0.882731810457498,"Tulsa","UTSA",6,6,0,0,10,400987975,2017-11-28
37,1,"14:35",2075,2075,"Martins Igbanu Defensive Rebound.",11,8,3,0.882731810457498,"Tulsa","UTSA",6,6,0,0,10,400987975,2017-11-28
38,1,"14:27",2067,2067,"Elijah Joiner made Three Point Jumper. Assisted by Corey Henderson Jr..",14,8,6,0.913535870667912,"Tulsa","UTSA",6,6,0,0,10,400987975,2017-11-28
39,1,"14:10",2050,2050,"Keaton Wallace made Layup.",14,10,4,0.900320067700564,"Tulsa","UTSA",6,6,0,0,10,400987975,2017-11-28
40,1,"14:10",2050,2050,"Foul on Martins Igbanu.",14,10,4,0.900320067700564,"Tulsa","UTSA",6,6,0,0,10,400987975,2017-11-28
41,1,"14:10",2050,2050,"Keaton Wallace made Free Throw.",14,11,3,0.889301759131744,"Tulsa","UTSA",6,6,0,0,10,400987975,2017-11-28
42,1,"13:54",2034,2034,"Elijah Joiner made Three Point Jumper. Assisted by Corey Henderson Jr..",17,11,6,0.919659424052395,"Tulsa","UTSA",6,6,0,0,10,400987975,2017-11-28
43,1,"13:43",2023,2023,"Jhivvan Jackson missed Three Point Jumper.",17,11,6,0.920482658808718,"Tulsa","UTSA",6,6,0,0,10,400987975,2017-11-28
44,1,"13:43",2023,2023,"Elijah Joiner Defensive Rebound.",17,11,6,0.920482658808718,"Tulsa","UTSA",6,6,0,0,10,400987975,2017-11-28
45,1,"13:38",2018,2018,"Foul on Elijah Joiner.",17,11,6,0.914488342203825,"Tulsa","UTSA",6,6,0,0,10,400987975,2017-11-28
46,1,"13:38",2018,2018,"Elijah Joiner Turnover.",17,11,6,0.914488342203825,"Tulsa","UTSA",6,6,0,0,10,400987975,2017-11-28
47,1,"13:27",2007,2007,"Giovanni De Nicolao missed Layup.",17,11,6,0.908073512398128,"Tulsa","UTSA",6,6,0,0,10,400987975,2017-11-28
48,1,"13:27",2007,2007,"Martins Igbanu Defensive Rebound.",17,11,6,0.908073512398128,"Tulsa","UTSA",6,6,0,0,10,400987975,2017-11-28
49,1,"13:21",2001,2001,"Corey Henderson Jr. missed Jumper.",17,11,6,0.908073512398128,"Tulsa","UTSA",6,6,0,0,10,400987975,2017-11-28
50,1,"13:21",2001,2001,"Kendell Ramlal Defensive Rebound.",17,11,6,0.908073512398128,"Tulsa","UTSA",6,6,0,0,10,400987975,2017-11-28
51,1,"13:11",1991,1991,"Deon Lyle made Three Point Jumper. Assisted by Jhivvan Jackson.",17,14,3,0.886611336241383,"Tulsa","UTSA",6,6,0,0,10,400987975,2017-11-28
52,1,"12:50",1970,1970,"Lawson Korita made Three Point Jumper. Assisted by Martins Igbanu.",20,14,6,0.922037025315678,"Tulsa","UTSA",6,6,0,0,10,400987975,2017-11-28
53,1,"12:30",1950,1950,"Giovanni De Nicolao made Layup. Assisted by Deon Lyle.",20,16,4,0.893291313896098,"Tulsa","UTSA",6,6,0,0,10,400987975,2017-11-28
54,1,"12:12",1932,1932,"Elijah Joiner missed Three Point Jumper.",20,16,4,0.889578363930837,"Tulsa","UTSA",6,6,0,0,10,400987975,2017-11-28
55,1,"12:12",1932,1932,"Martins Igbanu Offensive Rebound.",20,16,4,0.889578363930837,"Tulsa","UTSA",6,6,0,0,10,400987975,2017-11-28
56,1,"12:08",1928,1928,"Martins Igbanu made Layup.",22,16,6,0.918760480491518,"Tulsa","UTSA",6,6,0,0,10,400987975,2017-11-28
57,1,"12:00",1920,1920,"Jhivvan Jackson missed Layup.",22,16,6,0.918760480491518,"Tulsa","UTSA",6,6,0,0,10,400987975,2017-11-28
58,1,"12:00",1920,1920,"Kendell Ramlal Offensive Rebound.",22,16,6,0.918760480491518,"Tulsa","UTSA",6,6,0,0,10,400987975,2017-11-28
59,1,"11:57",1917,1917,"Kendell Ramlal missed Jumper.",22,16,6,0.92132705704905,"Tulsa","UTSA",6,6,0,0,10,400987975,2017-11-28
60,1,"11:57",1917,1917,"Martins Igbanu Block.",22,16,6,0.92132705704905,"Tulsa","UTSA",6,6,0,0,10,400987975,2017-11-28
61,1,"11:57",1917,1917,"Martins Igbanu Defensive Rebound.",22,16,6,0.92132705704905,"Tulsa","UTSA",6,6,0,0,10,400987975,2017-11-28
62,1,"11:49",1909,1909,"DaQuan Jeffries missed Layup.",22,16,6,0.912435268817748,"Tulsa","UTSA",6,6,0,0,10,400987975,2017-11-28
63,1,"11:49",1909,1909,"Kendell Ramlal Block.",22,16,6,0.912435268817748,"Tulsa","UTSA",6,6,0,0,10,400987975,2017-11-28
64,1,"11:48",1908,1908,"Giovanni De Nicolao Defensive Rebound.",22,16,6,0.912435268817748,"Tulsa","UTSA",6,6,0,0,10,400987975,2017-11-28
65,1,"11:40",1900,1900,"Deon Lyle made Three Point Jumper. Assisted by Jhivvan Jackson.",22,19,3,0.880035069391791,"Tulsa","UTSA",6,6,0,0,10,400987975,2017-11-28
66,1,"11:12",1872,1872,"Elijah Joiner missed Three Point Jumper.",22,19,3,0.877498576606763,"Tulsa","UTSA",6,6,0,0,10,400987975,2017-11-28
67,1,"11:12",1872,1872,"George Willborn III Defensive Rebound.",22,19,3,0.877498576606763,"Tulsa","UTSA",6,6,0,0,10,400987975,2017-11-28
68,1,"11:10",1870,1870,"Foul on Lawson Korita.",22,19,3,0.877498576606763,"Tulsa","UTSA",6,6,0,0,10,400987975,2017-11-28
69,1,"11:10",1870,1870,"Official TV Timeout",22,19,3,0.877498576606763,"Tulsa","UTSA",6,6,0,0,10,400987975,2017-11-28
70,1,"10:56",1856,1856,"Keaton Wallace made Jumper.",22,21,1,0.849436198388891,"Tulsa","UTSA",6,6,0,0,10,400987975,2017-11-28
71,1,"10:34",1834,1834,"Junior Etou missed Jumper.",22,21,1,0.845018942551759,"Tulsa","UTSA",6,6,0,0,10,400987975,2017-11-28
72,1,"10:34",1834,1834,"Kendell Ramlal Block.",22,21,1,0.845018942551759,"Tulsa","UTSA",6,6,0,0,10,400987975,2017-11-28
73,1,"10:34",1834,1834,"Junior Etou Offensive Rebound.",22,21,1,0.845018942551759,"Tulsa","UTSA",6,6,0,0,10,400987975,2017-11-28
74,1,"10:34",1834,1834,"Foul on Giovanni De Nicolao.",22,21,1,0.845018942551759,"Tulsa","UTSA",6,6,0,0,10,400987975,2017-11-28
75,1,"10:34",1834,1834,"Junior Etou missed Free Throw.",22,21,1,0.845018942551759,"Tulsa","UTSA",6,6,0,0,10,400987975,2017-11-28
76,1,"10:34",1834,1834,"Tulsa Deadball Team Rebound.",22,21,1,0.845018942551759,"Tulsa","UTSA",6,6,0,0,10,400987975,2017-11-28
77,1,"10:34",1834,1834,"Junior Etou made Free Throw.",23,21,2,0.860936181058975,"Tulsa","UTSA",6,6,0,0,10,400987975,2017-11-28
78,1,"10:24",1824,1824,"Keaton Wallace made Three Point Jumper. Assisted by Nick Allen.",23,24,-1,0.829583578743047,"Tulsa","UTSA",6,6,0,0,10,400987975,2017-11-28
79,1,"10:08",1808,1808,"Curran Scott missed Jumper.",23,24,-1,0.810932142860432,"Tulsa","UTSA",6,6,0,0,10,400987975,2017-11-28
80,1,"10:08",1808,1808,"Jaleel Wheeler Offensive Rebound.",23,24,-1,0.810932142860432,"Tulsa","UTSA",6,6,0,0,10,400987975,2017-11-28
81,1,"10:02",1802,1802,"Jaleel Wheeler made Dunk.",25,24,1,0.847254458660575,"Tulsa","UTSA",6,6,0,0,10,400987975,2017-11-28
82,1,"9:52",1792,1792,"Jhivvan Jackson missed Three Point Jumper.",25,24,1,0.838476368004365,"Tulsa","UTSA",6,6,0,0,10,400987975,2017-11-28
83,1,"9:52",1792,1792,"Curran Scott Defensive Rebound.",25,24,1,0.838476368004365,"Tulsa","UTSA",6,6,0,0,10,400987975,2017-11-28
84,1,"9:43",1783,1783,"DaQuan Jeffries made Three Point Jumper. Assisted by Curran Scott.",28,24,4,0.880725604535843,"Tulsa","UTSA",6,6,0,0,10,400987975,2017-11-28
85,1,"9:18",1758,1758,"Jhivvan Jackson made Three Point Jumper. Assisted by Keaton Wallace.",28,27,1,0.844189339722319,"Tulsa","UTSA",6,6,0,0,10,400987975,2017-11-28
86,1,"8:49",1729,1729,"Curran Scott Turnover.",28,27,1,0.833267160532553,"Tulsa","UTSA",6,6,0,0,10,400987975,2017-11-28
87,1,"8:48",1728,1728,"Nick Allen Steal.",28,27,1,0.833267160532553,"Tulsa","UTSA",6,6,0,0,10,400987975,2017-11-28
88,1,"8:41",1721,1721,"Keaton Wallace missed Three Point Jumper.",28,27,1,0.833267160532553,"Tulsa","UTSA",6,6,0,0,10,400987975,2017-11-28
89,1,"8:41",1721,1721,"Sterling Taplin Defensive Rebound.",28,27,1,0.833267160532553,"Tulsa","UTSA",6,6,0,0,10,400987975,2017-11-28
90,1,"8:30",1710,1710,"DaQuan Jeffries missed Three Point Jumper.",28,27,1,0.852936231202955,"Tulsa","UTSA",6,6,0,0,10,400987975,2017-11-28
91,1,"8:30",1710,1710,"UT San Antonio Defensive Rebound.",28,27,1,0.852936231202955,"Tulsa","UTSA",6,6,0,0,10,400987975,2017-11-28
92,1,"8:05",1685,1685,"Byron Frohnen Turnover.",28,27,1,0.852648202618206,"Tulsa","UTSA",6,6,0,0,10,400987975,2017-11-28
93,1,"8:03",1683,1683,"Junior Etou Steal.",28,27,1,0.852648202618206,"Tulsa","UTSA",6,6,0,0,10,400987975,2017-11-28
94,1,"8:01",1681,1681,"Junior Etou made Layup.",30,27,3,0.885566850059205,"Tulsa","UTSA",6,6,0,0,10,400987975,2017-11-28
95,1,"8:01",1681,1681,"Foul on Jhivvan Jackson.",30,27,3,0.885566850059205,"Tulsa","UTSA",6,6,0,0,10,400987975,2017-11-28
96,1,"8:01",1681,1681,"Junior Etou made Free Throw.",31,27,4,0.899492073228354,"Tulsa","UTSA",6,6,0,0,10,400987975,2017-11-28
97,1,"7:48",1668,1668,"Nick Allen missed Jumper.",31,27,4,0.886684673016484,"Tulsa","UTSA",6,6,0,0,10,400987975,2017-11-28
98,1,"7:48",1668,1668,"Geno Artison Defensive Rebound.",31,27,4,0.886684673016484,"Tulsa","UTSA",6,6,0,0,10,400987975,2017-11-28
99,1,"7:36",1656,1656,"Corey Henderson Jr. made Three Point Jumper. Assisted by Sterling Taplin.",34,27,7,0.919765497533813,"Tulsa","UTSA",6,6,0,0,10,400987975,2017-11-28
100,1,"7:21",1641,1641,"Jhivvan Jackson made Jumper.",34,29,5,0.904957773359639,"Tulsa","UTSA",6,6,0,0,10,400987975,2017-11-28
101,1,"6:53",1613,1613,"Martins Igbanu missed Jumper.",34,29,5,0.89271644703953,"Tulsa","UTSA",6,6,0,0,10,400987975,2017-11-28
102,1,"6:53",1613,1613,"Byron Frohnen Defensive Rebound.",34,29,5,0.89271644703953,"Tulsa","UTSA",6,6,0,0,10,400987975,2017-11-28
103,1,"6:42",1602,1602,"Keaton Wallace made Three Point Jumper.",34,32,2,0.85812137097164,"Tulsa","UTSA",6,6,0,0,10,400987975,2017-11-28
104,1,"6:19",1579,1579,"Martins Igbanu made Dunk. Assisted by Corey Henderson Jr..",36,32,4,0.895256231850796,"Tulsa","UTSA",6,6,0,0,10,400987975,2017-11-28
105,1,"6:03",1563,1563,"Jhivvan Jackson made Layup.",36,34,2,0.849784370697527,"Tulsa","UTSA",6,6,0,0,10,400987975,2017-11-28
106,1,"5:51",1551,1551,"Corey Henderson Jr. missed Three Point Jumper.",36,34,2,0.847258664697167,"Tulsa","UTSA",6,6,0,0,10,400987975,2017-11-28
107,1,"5:51",1551,1551,"Byron Frohnen Defensive Rebound.",36,34,2,0.847258664697167,"Tulsa","UTSA",6,6,0,0,10,400987975,2017-11-28
108,1,"5:40",1540,1540,"Nick Allen missed Three Point Jumper.",36,34,2,0.859402187609509,"Tulsa","UTSA",6,6,0,0,10,400987975,2017-11-28
109,1,"5:40",1540,1540,"Corey Henderson Jr. Defensive Rebound.",36,34,2,0.859402187609509,"Tulsa","UTSA",6,6,0,0,10,400987975,2017-11-28
110,1,"5:37",1537,1537,"Foul on Austin Karrer.",36,34,2,0.858645538699675,"Tulsa","UTSA",6,6,0,0,10,400987975,2017-11-28
111,1,"5:37",1537,1537,"Official TV Timeout",36,34,2,0.858645538699675,"Tulsa","UTSA",6,6,0,0,10,400987975,2017-11-28
112,1,"5:15",1515,1515,"Foul on George Willborn III.",36,34,2,0.859931748530941,"Tulsa","UTSA",6,6,0,0,10,400987975,2017-11-28
113,1,"5:15",1515,1515,"Junior Etou made Free Throw.",37,34,3,0.877309060179414,"Tulsa","UTSA",6,6,0,0,10,400987975,2017-11-28
114,1,"5:15",1515,1515,"Junior Etou made Free Throw.",38,34,4,0.892799244137569,"Tulsa","UTSA",6,6,0,0,10,400987975,2017-11-28
115,1,"5:01",1501,1501,"George Willborn III made Layup.",38,36,2,0.853274672722713,"Tulsa","UTSA",6,6,0,0,10,400987975,2017-11-28
116,1,"5:01",1501,1501,"Foul on Elijah Joiner.",38,36,2,0.853274672722713,"Tulsa","UTSA",6,6,0,0,10,400987975,2017-11-28
117,1,"5:01",1501,1501,"George Willborn III made Free Throw.",38,37,1,0.834524872952809,"Tulsa","UTSA",6,6,0,0,10,400987975,2017-11-28
118,1,"4:40",1480,1480,"Junior Etou made Layup.",40,37,3,0.869080503075082,"Tulsa","UTSA",6,6,0,0,10,400987975,2017-11-28
119,1,"4:32",1472,1472,"Keaton Wallace missed Three Point Jumper.",40,37,3,0.884923493124696,"Tulsa","UTSA",6,6,0,0,10,400987975,2017-11-28
120,1,"4:32",1472,1472,"Geno Artison Defensive Rebound.",40,37,3,0.884923493124696,"Tulsa","UTSA",6,6,0,0,10,400987975,2017-11-28
121,1,"4:17",1457,1457,"Junior Etou missed Jumper.",40,37,3,0.867133970736258,"Tulsa","UTSA",6,6,0,0,10,400987975,2017-11-28
122,1,"4:17",1457,1457,"George Willborn III Defensive Rebound.",40,37,3,0.867133970736258,"Tulsa","UTSA",6,6,0,0,10,400987975,2017-11-28
123,1,"4:04",1444,1444,"George Willborn III made Jumper.",40,39,1,0.843094322899063,"Tulsa","UTSA",6,6,0,0,10,400987975,2017-11-28
124,1,"3:33",1413,1413,"Corey Henderson Jr. missed Layup.",40,39,1,0.818991335684008,"Tulsa","UTSA",6,6,0,0,10,400987975,2017-11-28
125,1,"3:33",1413,1413,"Geno Artison Offensive Rebound.",40,39,1,0.818991335684008,"Tulsa","UTSA",6,6,0,0,10,400987975,2017-11-28
126,1,"3:31",1411,1411,"Geno Artison made Layup.",42,39,3,0.860527928234625,"Tulsa","UTSA",6,6,0,0,10,400987975,2017-11-28
127,1,"3:17",1397,1397,"Keaton Wallace Turnover.",42,39,3,0.876546557239656,"Tulsa","UTSA",6,6,0,0,10,400987975,2017-11-28
128,1,"3:17",1397,1397,"Official TV Timeout",42,39,3,0.876546557239656,"Tulsa","UTSA",6,6,0,0,10,400987975,2017-11-28
129,1,"2:53",1373,1373,"Sterling Taplin missed Jumper.",42,39,3,0.861395145846842,"Tulsa","UTSA",6,6,0,0,10,400987975,2017-11-28
130,1,"2:53",1373,1373,"Jaleel Wheeler Offensive Rebound.",42,39,3,0.861395145846842,"Tulsa","UTSA",6,6,0,0,10,400987975,2017-11-28
131,1,"2:49",1369,1369,"Jaleel Wheeler made Dunk.",44,39,5,0.898754154639395,"Tulsa","UTSA",6,6,0,0,10,400987975,2017-11-28
132,1,"2:33",1353,1353,"Keaton Wallace missed Jumper.",44,39,5,0.90336895277436,"Tulsa","UTSA",6,6,0,0,10,400987975,2017-11-28
133,1,"2:33",1353,1353,"Geno Artison Block.",44,39,5,0.90336895277436,"Tulsa","UTSA",6,6,0,0,10,400987975,2017-11-28
134,1,"2:32",1352,1352,"George Willborn III Offensive Rebound.",44,39,5,0.90336895277436,"Tulsa","UTSA",6,6,0,0,10,400987975,2017-11-28
135,1,"2:30",1350,1350,"George Willborn III missed Jumper.",44,39,5,0.90336895277436,"Tulsa","UTSA",6,6,0,0,10,400987975,2017-11-28
136,1,"2:30",1350,1350,"Corey Henderson Jr. Defensive Rebound.",44,39,5,0.90336895277436,"Tulsa","UTSA",6,6,0,0,10,400987975,2017-11-28
137,1,"2:30",1350,1350,"Foul on Keaton Wallace.",44,39,5,0.90336895277436,"Tulsa","UTSA",6,6,0,0,10,400987975,2017-11-28
138,1,"2:18",1338,1338,"DaQuan Jeffries made Jumper.",46,39,7,0.918307614401737,"Tulsa","UTSA",6,6,0,0,10,400987975,2017-11-28
139,1,"1:58",1318,1318,"Keaton Wallace missed Three Point Jumper.",46,39,7,0.926663237568044,"Tulsa","UTSA",6,6,0,0,10,400987975,2017-11-28
140,1,"1:58",1318,1318,"Corey Henderson Jr. Defensive Rebound.",46,39,7,0.926663237568044,"Tulsa","UTSA",6,6,0,0,10,400987975,2017-11-28
141,1,"1:48",1308,1308,"Corey Henderson Jr. made Three Point Jumper.",49,39,10,0.942745849374154,"Tulsa","UTSA",6,6,0,0,10,400987975,2017-11-28
142,1,"1:29",1289,1289,"Keaton Wallace missed Jumper.",49,39,10,0.949861861192171,"Tulsa","UTSA",6,6,0,0,10,400987975,2017-11-28
143,1,"1:29",1289,1289,"DaQuan Jeffries Block.",49,39,10,0.949861861192171,"Tulsa","UTSA",6,6,0,0,10,400987975,2017-11-28
144,1,"1:28",1288,1288,"UT San Antonio Offensive Rebound.",49,39,10,0.949861861192171,"Tulsa","UTSA",6,6,0,1,10,400987975,2017-11-28
145,1,"1:28",1288,1288,"UT San Antonio  Timeout",49,39,10,0.949861861192171,"Tulsa","UTSA",6,5,0,1,10,400987975,2017-11-28
146,1,"1:21",1281,1281,"Jhivvan Jackson made Three Point Jumper.",49,42,7,0.923591016266795,"Tulsa","UTSA",6,5,0,1,10,400987975,2017-11-28
147,1,"1:21",1281,1281,"Foul on Geno Artison.",49,42,7,0.923591016266795,"Tulsa","UTSA",6,5,0,1,10,400987975,2017-11-28
148,1,"1:21",1281,1281,"Jhivvan Jackson made Free Throw.",49,43,6,0.91232668585287,"Tulsa","UTSA",6,5,0,1,10,400987975,2017-11-28
149,1,"1:06",1266,1266,"Corey Henderson Jr. missed Jumper.",49,43,6,0.918706516610342,"Tulsa","UTSA",6,5,0,1,10,400987975,2017-11-28
150,1,"1:06",1266,1266,"Geno Artison Offensive Rebound.",49,43,6,0.918706516610342,"Tulsa","UTSA",6,5,0,1,10,400987975,2017-11-28
151,1,"1:02",1262,1262,"Geno Artison made Layup.",51,43,8,0.939419354557715,"Tulsa","UTSA",6,5,0,1,10,400987975,2017-11-28
152,1,"0:45",1245,1245,"Foul on Jaleel Wheeler.",51,43,8,0.933406124953946,"Tulsa","UTSA",6,5,0,1,10,400987975,2017-11-28
153,1,"0:45",1245,1245,"Jhivvan Jackson made Free Throw.",51,44,7,0.923110886789715,"Tulsa","UTSA",6,5,0,1,10,400987975,2017-11-28
154,1,"0:45",1245,1245,"Jhivvan Jackson made Free Throw.",51,45,6,0.911375152340934,"Tulsa","UTSA",6,5,0,1,10,400987975,2017-11-28
155,1,"0:33",1233,1233,"Geno Artison made Jumper. Assisted by Jaleel Wheeler.",53,45,8,0.929939267833331,"Tulsa","UTSA",6,5,0,1,10,400987975,2017-11-28
156,1,"0:04",1204,1204,"Foul on Keaton Wallace.",53,45,8,0.932983015679055,"Tulsa","UTSA",6,5,0,1,10,400987975,2017-11-28
157,1,"0:04",1204,1204,"Keaton Wallace Turnover.",53,45,8,0.932983015679055,"Tulsa","UTSA",6,5,0,1,10,400987975,2017-11-28
158,1,"0:04",1204,1204,"Tulsa  Timeout",53,45,8,0.932983015679055,"Tulsa","UTSA",6,4,0,1,10,400987975,2017-11-28
159,1,"0:01",1201,1201,"Sterling Taplin missed Layup.",53,45,8,0.932983015679055,"Tulsa","UTSA",6,4,0,1,10,400987975,2017-11-28
160,1,"0:01",1201,1201,"Byron Frohnen Defensive Rebound.",53,45,8,0.932983015679055,"Tulsa","UTSA",6,4,0,1,10,400987975,2017-11-28
161,1,"0:00",1200,1200,"End of 1st half",53,45,8,0.932983015679055,"Tulsa","UTSA",6,4,0,1,10,400987975,2017-11-28
162,2,"20:00",1200,1200,"PLAY",53,45,8,0.932983015679055,"Tulsa","UTSA",6,4,0,0,10,400987975,2017-11-28
163,2,"19:44",1184,1184,"Byron Frohnen made Layup. Assisted by Giovanni De Nicolao.",53,47,6,0.913629206269553,"Tulsa","UTSA",6,4,0,0,10,400987975,2017-11-28
164,2,"19:28",1168,1168,"Foul on Nick Allen.",53,47,6,0.910284454351298,"Tulsa","UTSA",6,4,0,0,10,400987975,2017-11-28
165,2,"19:24",1164,1164,"Foul on Nick Allen.",53,47,6,0.910284454351298,"Tulsa","UTSA",6,4,0,0,10,400987975,2017-11-28
166,2,"19:24",1164,1164,"Junior Etou missed Free Throw.",53,47,6,0.910284454351298,"Tulsa","UTSA",6,4,0,0,10,400987975,2017-11-28
167,2,"19:24",1164,1164,"Tulsa Deadball Team Rebound.",53,47,6,0.910284454351298,"Tulsa","UTSA",6,4,0,0,10,400987975,2017-11-28
168,2,"19:24",1164,1164,"Junior Etou made Free Throw.",54,47,7,0.922868416629918,"Tulsa","UTSA",6,4,0,0,10,400987975,2017-11-28
169,2,"19:07",1147,1147,"Keaton Wallace missed Three Point Jumper.",54,47,7,0.92151956024553,"Tulsa","UTSA",6,4,0,0,10,400987975,2017-11-28
170,2,"19:07",1147,1147,"Junior Etou Defensive Rebound.",54,47,7,0.92151956024553,"Tulsa","UTSA",6,4,0,0,10,400987975,2017-11-28
171,2,"18:58",1138,1138,"DaQuan Jeffries missed Layup.",54,47,7,0.925443102205039,"Tulsa","UTSA",6,4,0,0,10,400987975,2017-11-28
172,2,"18:58",1138,1138,"Nick Allen Defensive Rebound.",54,47,7,0.925443102205039,"Tulsa","UTSA",6,4,0,0,10,400987975,2017-11-28
173,2,"18:45",1125,1125,"Foul on Sterling Taplin.",54,47,7,0.93138194911225,"Tulsa","UTSA",6,4,0,0,10,400987975,2017-11-28
174,2,"18:30",1110,1110,"Giovanni De Nicolao made Three Point Jumper. Assisted by Byron Frohnen.",54,50,4,0.876829160762058,"Tulsa","UTSA",6,4,0,0,10,400987975,2017-11-28
175,2,"18:17",1097,1097,"DaQuan Jeffries made Jumper.",56,50,6,0.916665385245985,"Tulsa","UTSA",6,4,0,0,10,400987975,2017-11-28
176,2,"18:09",1089,1089,"Giovanni De Nicolao missed Three Point Jumper.",56,50,6,0.91848877215888,"Tulsa","UTSA",6,4,0,0,10,400987975,2017-11-28
177,2,"18:09",1089,1089,"Sterling Taplin Defensive Rebound.",56,50,6,0.91848877215888,"Tulsa","UTSA",6,4,0,0,10,400987975,2017-11-28
178,2,"17:51",1071,1071,"Curran Scott made Three Point Jumper.",59,50,9,0.94226955496928,"Tulsa","UTSA",6,4,0,0,10,400987975,2017-11-28
179,2,"17:32",1052,1052,"Foul on Jaleel Wheeler.",59,50,9,0.949470590343697,"Tulsa","UTSA",6,4,0,0,10,400987975,2017-11-28
180,2,"17:32",1052,1052,"Byron Frohnen made Free Throw.",59,51,8,0.940095517249801,"Tulsa","UTSA",6,4,0,0,10,400987975,2017-11-28
181,2,"17:32",1052,1052,"Byron Frohnen made Free Throw.",59,52,7,0.929110889873479,"Tulsa","UTSA",6,4,0,0,10,400987975,2017-11-28
182,2,"17:18",1038,1038,"Curran Scott made Layup.",61,52,9,0.944007033576782,"Tulsa","UTSA",6,4,0,0,10,400987975,2017-11-28
183,2,"17:11",1031,1031,"Foul on Nick Allen.",61,52,9,0.944007033576782,"Tulsa","UTSA",6,4,0,0,10,400987975,2017-11-28
184,2,"17:11",1031,1031,"Nick Allen Turnover.",61,52,9,0.944007033576782,"Tulsa","UTSA",6,4,0,0,10,400987975,2017-11-28
185,2,"17:01",1021,1021,"Foul on George Willborn III.",61,52,9,0.948413455570147,"Tulsa","UTSA",6,4,0,0,10,400987975,2017-11-28
186,2,"17:01",1021,1021,"Jaleel Wheeler missed Free Throw.",61,52,9,0.948413455570147,"Tulsa","UTSA",6,4,0,0,10,400987975,2017-11-28
187,2,"17:01",1021,1021,"Tulsa Deadball Team Rebound.",61,52,9,0.948413455570147,"Tulsa","UTSA",6,4,0,0,10,400987975,2017-11-28
188,2,"17:01",1021,1021,"Jaleel Wheeler made Free Throw.",62,52,10,0.95651466418515,"Tulsa","UTSA",6,4,0,0,10,400987975,2017-11-28
189,2,"16:51",1011,1011,"Byron Frohnen missed Jumper.",62,52,10,0.950980418905876,"Tulsa","UTSA",6,4,0,0,10,400987975,2017-11-28
190,2,"16:51",1011,1011,"Byron Frohnen Offensive Rebound.",62,52,10,0.950980418905876,"Tulsa","UTSA",6,4,0,0,10,400987975,2017-11-28
191,2,"16:50",1010,1010,"Byron Frohnen made Jumper.",62,54,8,0.93085906799252,"Tulsa","UTSA",6,4,0,0,10,400987975,2017-11-28
192,2,"16:50",1010,1010,"Foul on DaQuan Jeffries.",62,54,8,0.93085906799252,"Tulsa","UTSA",6,4,0,0,10,400987975,2017-11-28
193,2,"16:50",1010,1010,"Byron Frohnen missed Free Throw.",62,54,8,0.93085906799252,"Tulsa","UTSA",6,4,0,0,10,400987975,2017-11-28
194,2,"16:50",1010,1010,"Junior Etou Defensive Rebound.",62,54,8,0.93085906799252,"Tulsa","UTSA",6,4,0,0,10,400987975,2017-11-28
195,2,"16:32",992,992,"Sterling Taplin made Layup. Assisted by Junior Etou.",64,54,10,0.952352467604032,"Tulsa","UTSA",6,4,0,0,10,400987975,2017-11-28
