"play_id","half","time_remaining_half","secs_remaining","secs_remaining_absolute","description","home_score","away_score","score_diff","win_prob","home","away","home_time_out_remaining","away_time_out_remaining","home_timeout_ind","away_timeout_ind","home_favored_by","game_id","date"
1,1,"20:00",2400,2400,"PLAY",0,0,0,0.924468255404939,"Purdue","Lipscomb",4,4,0,0,21.5,400986478,2017-12-30
2,1,"20:00",2400,2400,"Jump Ball won by Purdue",0,0,0,0.924468255404939,"Purdue","Lipscomb",4,4,0,0,21.5,400986478,2017-12-30
3,1,"19:48",2388,2388,"Isaac Haas made Layup. Assisted by Dakota Mathias.",2,0,2,0.925428639527018,"Purdue","Lipscomb",4,4,0,0,21.5,400986478,2017-12-30
4,1,"19:20",2360,2360,"Garrison Mathews missed Jumper.",2,0,2,0.91411435351744,"Purdue","Lipscomb",4,4,0,0,21.5,400986478,2017-12-30
5,1,"19:20",2360,2360,"Vincent Edwards Defensive Rebound.",2,0,2,0.91411435351744,"Purdue","Lipscomb",4,4,0,0,21.5,400986478,2017-12-30
6,1,"19:15",2355,2355,"Dakota Mathias Turnover.",2,0,2,0.931882890817829,"Purdue","Lipscomb",4,4,0,0,21.5,400986478,2017-12-30
7,1,"19:11",2351,2351,"Foul on Dakota Mathias.",2,0,2,0.931882890817829,"Purdue","Lipscomb",4,4,0,0,21.5,400986478,2017-12-30
8,1,"19:04",2344,2344,"Garrison Mathews made Jumper.",2,2,0,0.910481399957632,"Purdue","Lipscomb",4,4,0,0,21.5,400986478,2017-12-30
9,1,"18:48",2328,2328,"Dakota Mathias made Jumper. Assisted by Isaac Haas.",4,2,2,0.929689619948689,"Purdue","Lipscomb",4,4,0,0,21.5,400986478,2017-12-30
10,1,"18:28",2308,2308,"Kenny Cooper missed Jumper.",4,2,2,0.921301761182704,"Purdue","Lipscomb",4,4,0,0,21.5,400986478,2017-12-30
11,1,"18:28",2308,2308,"Vincent Edwards Defensive Rebound.",4,2,2,0.921301761182704,"Purdue","Lipscomb",4,4,0,0,21.5,400986478,2017-12-30
12,1,"18:24",2304,2304,"Carsen Edwards made Three Point Jumper. Assisted by Vincent Edwards.",7,2,5,0.94040364199702,"Purdue","Lipscomb",4,4,0,0,21.5,400986478,2017-12-30
13,1,"17:53",2273,2273,"Kenny Cooper missed Jumper.",7,2,5,0.945646454442425,"Purdue","Lipscomb",4,4,0,0,21.5,400986478,2017-12-30
14,1,"17:53",2273,2273,"Isaac Haas Defensive Rebound.",7,2,5,0.945646454442425,"Purdue","Lipscomb",4,4,0,0,21.5,400986478,2017-12-30
15,1,"17:39",2259,2259,"Carsen Edwards made Three Point Jumper.",10,2,8,0.954096529376833,"Purdue","Lipscomb",4,4,0,0,21.5,400986478,2017-12-30
16,1,"17:14",2234,2234,"Rob Marberry missed Jumper.",10,2,8,0.961155814420939,"Purdue","Lipscomb",4,4,0,0,21.5,400986478,2017-12-30
17,1,"17:14",2234,2234,"Isaac Haas Defensive Rebound.",10,2,8,0.961155814420939,"Purdue","Lipscomb",4,4,0,0,21.5,400986478,2017-12-30
18,1,"17:08",2228,2228,"Carsen Edwards missed Three Point Jumper.",10,2,8,0.958783840718397,"Purdue","Lipscomb",4,4,0,0,21.5,400986478,2017-12-30
19,1,"17:08",2228,2228,"Garrison Mathews Defensive Rebound.",10,2,8,0.958783840718397,"Purdue","Lipscomb",4,4,0,0,21.5,400986478,2017-12-30
20,1,"16:58",2218,2218,"Garrison Mathews made Jumper.",10,4,6,0.954329655928863,"Purdue","Lipscomb",4,4,0,0,21.5,400986478,2017-12-30
21,1,"16:36",2196,2196,"P.J. Thompson missed Three Point Jumper.",10,4,6,0.955156456944291,"Purdue","Lipscomb",4,4,0,0,21.5,400986478,2017-12-30
22,1,"16:36",2196,2196,"Michael Buckland Defensive Rebound.",10,4,6,0.955156456944291,"Purdue","Lipscomb",4,4,0,0,21.5,400986478,2017-12-30
23,1,"16:22",2182,2182,"Garrison Mathews made Three Point Jumper. Assisted by Michael Buckland.",10,7,3,0.931335746251664,"Purdue","Lipscomb",4,4,0,0,21.5,400986478,2017-12-30
24,1,"16:03",2163,2163,"Vincent Edwards missed Three Point Jumper.",10,7,3,0.929259040858275,"Purdue","Lipscomb",4,4,0,0,21.5,400986478,2017-12-30
25,1,"16:03",2163,2163,"Isaac Haas Offensive Rebound.",10,7,3,0.929259040858275,"Purdue","Lipscomb",4,4,0,0,21.5,400986478,2017-12-30
26,1,"15:57",2157,2157,"Isaac Haas made Layup.",12,7,5,0.945021484146812,"Purdue","Lipscomb",4,4,0,0,21.5,400986478,2017-12-30
27,1,"15:38",2138,2138,"Rob Marberry made Jumper. Assisted by Eli Pepper.",12,9,3,0.932972071301948,"Purdue","Lipscomb",4,4,0,0,21.5,400986478,2017-12-30
28,1,"15:19",2119,2119,"Vincent Edwards made Layup.",14,9,5,0.949536094795518,"Purdue","Lipscomb",4,4,0,0,21.5,400986478,2017-12-30
29,1,"15:19",2119,2119,"Foul on Eli Pepper.",14,9,5,0.949536094795518,"Purdue","Lipscomb",4,4,0,0,21.5,400986478,2017-12-30
30,1,"15:19",2119,2119,"Official TV Timeout",14,9,5,0.949536094795518,"Purdue","Lipscomb",4,4,0,0,21.5,400986478,2017-12-30
31,1,"15:19",2119,2119,"Vincent Edwards made Free Throw.",15,9,6,0.954891844107336,"Purdue","Lipscomb",4,4,0,0,21.5,400986478,2017-12-30
32,1,"15:01",2101,2101,"Rob Marberry made Jumper.",15,11,4,0.934804435085291,"Purdue","Lipscomb",4,4,0,0,21.5,400986478,2017-12-30
33,1,"14:38",2078,2078,"Vincent Edwards missed Jumper.",15,11,4,0.937214537455479,"Purdue","Lipscomb",4,4,0,0,21.5,400986478,2017-12-30
34,1,"14:38",2078,2078,"Garrison Mathews Defensive Rebound.",15,11,4,0.937214537455479,"Purdue","Lipscomb",4,4,0,0,21.5,400986478,2017-12-30
35,1,"14:22",2062,2062,"Matt Rose made Three Point Jumper. Assisted by Rob Marberry.",15,14,1,0.910012800593453,"Purdue","Lipscomb",4,4,0,0,21.5,400986478,2017-12-30
36,1,"14:01",2041,2041,"Carsen Edwards made Three Point Jumper. Assisted by Ryan Cline.",18,14,4,0.930672043458536,"Purdue","Lipscomb",4,4,0,0,21.5,400986478,2017-12-30
37,1,"13:44",2024,2024,"Garrison Mathews made Three Point Jumper. Assisted by Matt Rose.",18,17,1,0.913243617705341,"Purdue","Lipscomb",4,4,0,0,21.5,400986478,2017-12-30
38,1,"13:26",2006,2006,"Foul on Matt Rose.",18,17,1,0.907917751096579,"Purdue","Lipscomb",4,4,0,0,21.5,400986478,2017-12-30
39,1,"13:24",2004,2004,"Carsen Edwards missed Three Point Jumper.",18,17,1,0.907917751096579,"Purdue","Lipscomb",4,4,0,0,21.5,400986478,2017-12-30
40,1,"13:24",2004,2004,"Vincent Edwards Offensive Rebound.",18,17,1,0.907917751096579,"Purdue","Lipscomb",4,4,0,0,21.5,400986478,2017-12-30
41,1,"13:14",1994,1994,"Carsen Edwards made Jumper.",20,17,3,0.931823223365759,"Purdue","Lipscomb",4,4,0,0,21.5,400986478,2017-12-30
42,1,"12:50",1970,1970,"Greg Jones made Three Point Jumper. Assisted by Kenny Cooper.",20,20,0,0.907006541462623,"Purdue","Lipscomb",4,4,0,0,21.5,400986478,2017-12-30
43,1,"12:25",1945,1945,"Foul on Aaron Korn.",20,20,0,0.897176052989198,"Purdue","Lipscomb",4,4,0,0,21.5,400986478,2017-12-30
44,1,"12:25",1945,1945,"Matt Haarms made Free Throw.",21,20,1,0.908258285881443,"Purdue","Lipscomb",4,4,0,0,21.5,400986478,2017-12-30
45,1,"12:25",1945,1945,"Matt Haarms made Free Throw.",22,20,2,0.9182549188497,"Purdue","Lipscomb",4,4,0,0,21.5,400986478,2017-12-30
46,1,"12:15",1935,1935,"George Brammeier missed Layup.",22,20,2,0.914114252695685,"Purdue","Lipscomb",4,4,0,0,21.5,400986478,2017-12-30
47,1,"12:15",1935,1935,"Matt Haarms Block.",22,20,2,0.914114252695685,"Purdue","Lipscomb",4,4,0,0,21.5,400986478,2017-12-30
48,1,"12:15",1935,1935,"Matt Haarms Defensive Rebound.",22,20,2,0.914114252695685,"Purdue","Lipscomb",4,4,0,0,21.5,400986478,2017-12-30
49,1,"11:57",1917,1917,"Carsen Edwards missed Layup.",22,20,2,0.922897084352989,"Purdue","Lipscomb",4,4,0,0,21.5,400986478,2017-12-30
50,1,"11:57",1917,1917,"Matt Haarms Offensive Rebound.",22,20,2,0.922897084352989,"Purdue","Lipscomb",4,4,0,0,21.5,400986478,2017-12-30
51,1,"11:49",1909,1909,"Matt Haarms made Layup.",24,20,4,0.934865142343389,"Purdue","Lipscomb",4,4,0,0,21.5,400986478,2017-12-30
52,1,"11:38",1898,1898,"Aaron Korn made Three Point Jumper. Assisted by Matt Rose.",24,23,1,0.905121413012246,"Purdue","Lipscomb",4,4,0,0,21.5,400986478,2017-12-30
53,1,"11:16",1876,1876,"Matt Haarms missed Jumper.",24,23,1,0.905266367736078,"Purdue","Lipscomb",4,4,0,0,21.5,400986478,2017-12-30
54,1,"11:16",1876,1876,"Aaron Korn Defensive Rebound.",24,23,1,0.905266367736078,"Purdue","Lipscomb",4,4,0,0,21.5,400986478,2017-12-30
55,1,"10:53",1853,1853,"Aaron Korn missed Jumper.",24,23,1,0.905025845500869,"Purdue","Lipscomb",4,4,0,0,21.5,400986478,2017-12-30
56,1,"10:53",1853,1853,"Vincent Edwards Block.",24,23,1,0.905025845500869,"Purdue","Lipscomb",4,4,0,0,21.5,400986478,2017-12-30
57,1,"10:53",1853,1853,"Aaron Korn Offensive Rebound.",24,23,1,0.905025845500869,"Purdue","Lipscomb",4,4,0,0,21.5,400986478,2017-12-30
58,1,"10:43",1843,1843,"George Brammeier missed Jumper.",24,23,1,0.90311225179171,"Purdue","Lipscomb",4,4,0,0,21.5,400986478,2017-12-30
59,1,"10:43",1843,1843,"Ryan Cline Defensive Rebound.",24,23,1,0.90311225179171,"Purdue","Lipscomb",4,4,0,0,21.5,400986478,2017-12-30
60,1,"10:26",1826,1826,"Foul on Kenny Cooper.",24,23,1,0.914223939660926,"Purdue","Lipscomb",4,4,0,0,21.5,400986478,2017-12-30
61,1,"10:26",1826,1826,"Official TV Timeout",24,23,1,0.914223939660926,"Purdue","Lipscomb",4,4,0,0,21.5,400986478,2017-12-30
62,1,"10:15",1815,1815,"Dakota Mathias made Three Point Jumper. Assisted by Vincent Edwards.",27,23,4,0.935681481580994,"Purdue","Lipscomb",4,4,0,0,21.5,400986478,2017-12-30
63,1,"9:55",1795,1795,"Garrison Mathews missed Jumper.",27,23,4,0.927730638627514,"Purdue","Lipscomb",4,4,0,0,21.5,400986478,2017-12-30
64,1,"9:55",1795,1795,"Vincent Edwards Defensive Rebound.",27,23,4,0.927730638627514,"Purdue","Lipscomb",4,4,0,0,21.5,400986478,2017-12-30
65,1,"9:44",1784,1784,"Vincent Edwards Turnover.",27,23,4,0.924422535283586,"Purdue","Lipscomb",4,4,0,0,21.5,400986478,2017-12-30
66,1,"9:20",1760,1760,"Garrison Mathews made Layup.",27,25,2,0.921115283590403,"Purdue","Lipscomb",4,4,0,0,21.5,400986478,2017-12-30
67,1,"9:01",1741,1741,"Foul on Michael Buckland.",27,25,2,0.907384453571871,"Purdue","Lipscomb",4,4,0,0,21.5,400986478,2017-12-30
68,1,"8:56",1736,1736,"P.J. Thompson Turnover.",27,25,2,0.913917953164076,"Purdue","Lipscomb",4,4,0,0,21.5,400986478,2017-12-30
69,1,"8:44",1724,1724,"Michael Buckland made Layup. Assisted by Kenny Cooper.",27,27,0,0.874476729150276,"Purdue","Lipscomb",4,4,0,0,21.5,400986478,2017-12-30
70,1,"8:32",1712,1712,"Foul on Eli Pepper.",27,27,0,0.897178286981805,"Purdue","Lipscomb",4,4,0,0,21.5,400986478,2017-12-30
71,1,"8:28",1708,1708,"Ryan Cline made Three Point Jumper. Assisted by Dakota Mathias.",30,27,3,0.91814909668484,"Purdue","Lipscomb",4,4,0,0,21.5,400986478,2017-12-30
72,1,"8:17",1697,1697,"Matt Rose made Three Point Jumper. Assisted by Kenny Cooper.",30,30,0,0.883240595916691,"Purdue","Lipscomb",4,4,0,0,21.5,400986478,2017-12-30
73,1,"7:59",1679,1679,"Foul on Garrison Mathews.",30,30,0,0.888966412924362,"Purdue","Lipscomb",4,4,0,0,21.5,400986478,2017-12-30
74,1,"7:59",1679,1679,"Official TV Timeout",30,30,0,0.888966412924362,"Purdue","Lipscomb",4,4,0,0,21.5,400986478,2017-12-30
75,1,"7:59",1679,1679,"Isaac Haas made Free Throw.",31,30,1,0.901924409685547,"Purdue","Lipscomb",4,4,0,0,21.5,400986478,2017-12-30
76,1,"7:59",1679,1679,"Isaac Haas made Free Throw.",32,30,2,0.913517282050441,"Purdue","Lipscomb",4,4,0,0,21.5,400986478,2017-12-30
77,1,"7:45",1665,1665,"Garrison Mathews made Jumper. Assisted by Matt Rose.",32,32,0,0.886417336878941,"Purdue","Lipscomb",4,4,0,0,21.5,400986478,2017-12-30
78,1,"7:28",1648,1648,"Dakota Mathias missed Three Point Jumper.",32,32,0,0.887622681337332,"Purdue","Lipscomb",4,4,0,0,21.5,400986478,2017-12-30
79,1,"7:28",1648,1648,"Matt Haarms Offensive Rebound.",32,32,0,0.887622681337332,"Purdue","Lipscomb",4,4,0,0,21.5,400986478,2017-12-30
80,1,"7:21",1641,1641,"Isaac Haas missed Layup.",32,32,0,0.887622681337332,"Purdue","Lipscomb",4,4,0,0,21.5,400986478,2017-12-30
81,1,"7:21",1641,1641,"Matt Rose Defensive Rebound.",32,32,0,0.887622681337332,"Purdue","Lipscomb",4,4,0,0,21.5,400986478,2017-12-30
82,1,"7:05",1625,1625,"Matt Rose missed Three Point Jumper.",32,32,0,0.883365201868207,"Purdue","Lipscomb",4,4,0,0,21.5,400986478,2017-12-30
83,1,"7:05",1625,1625,"Dakota Mathias Defensive Rebound.",32,32,0,0.883365201868207,"Purdue","Lipscomb",4,4,0,0,21.5,400986478,2017-12-30
84,1,"6:58",1618,1618,"P.J. Thompson made Three Point Jumper. Assisted by Carsen Edwards.",35,32,3,0.911216680117535,"Purdue","Lipscomb",4,4,0,0,21.5,400986478,2017-12-30
85,1,"6:46",1606,1606,"Garrison Mathews missed Three Point Jumper.",35,32,3,0.921073016043415,"Purdue","Lipscomb",4,4,0,0,21.5,400986478,2017-12-30
86,1,"6:46",1606,1606,"Isaac Haas Defensive Rebound.",35,32,3,0.921073016043415,"Purdue","Lipscomb",4,4,0,0,21.5,400986478,2017-12-30
87,1,"6:36",1596,1596,"Carsen Edwards missed Three Point Jumper.",35,32,3,0.915333972733428,"Purdue","Lipscomb",4,4,0,0,21.5,400986478,2017-12-30
88,1,"6:36",1596,1596,"Aaron Korn Defensive Rebound.",35,32,3,0.915333972733428,"Purdue","Lipscomb",4,4,0,0,21.5,400986478,2017-12-30
89,1,"6:25",1585,1585,"Matt Rose made Layup.",35,34,1,0.894603545665136,"Purdue","Lipscomb",4,4,0,0,21.5,400986478,2017-12-30
90,1,"6:16",1576,1576,"Purdue  Timeout",35,34,1,0.898647332762638,"Purdue","Lipscomb",3,4,1,0,21.5,400986478,2017-12-30
91,1,"6:05",1565,1565,"Isaac Haas missed Jumper.",35,34,1,0.890074275381298,"Purdue","Lipscomb",3,4,1,0,21.5,400986478,2017-12-30
92,1,"6:05",1565,1565,"Vincent Edwards Offensive Rebound.",35,34,1,0.890074275381298,"Purdue","Lipscomb",3,4,1,0,21.5,400986478,2017-12-30
93,1,"6:01",1561,1561,"Vincent Edwards missed Jumper.",35,34,1,0.890074275381298,"Purdue","Lipscomb",3,4,1,0,21.5,400986478,2017-12-30
94,1,"6:01",1561,1561,"Vincent Edwards Offensive Rebound.",35,34,1,0.890074275381298,"Purdue","Lipscomb",3,4,1,0,21.5,400986478,2017-12-30
95,1,"5:58",1558,1558,"Vincent Edwards made Layup.",37,34,3,0.912311062622902,"Purdue","Lipscomb",3,4,1,0,21.5,400986478,2017-12-30
96,1,"5:26",1526,1526,"Garrison Mathews missed Layup.",37,34,3,0.914782797860618,"Purdue","Lipscomb",3,4,1,0,21.5,400986478,2017-12-30
97,1,"5:26",1526,1526,"George Brammeier Offensive Rebound.",37,34,3,0.914782797860618,"Purdue","Lipscomb",3,4,1,0,21.5,400986478,2017-12-30
98,1,"5:25",1525,1525,"Dakota Mathias Block.",37,34,3,0.914782797860618,"Purdue","Lipscomb",3,4,1,0,21.5,400986478,2017-12-30
99,1,"5:17",1517,1517,"George Brammeier missed Jumper.",37,34,3,0.920285307796572,"Purdue","Lipscomb",3,4,1,0,21.5,400986478,2017-12-30
100,1,"5:17",1517,1517,"Vincent Edwards Block.",37,34,3,0.920285307796572,"Purdue","Lipscomb",3,4,1,0,21.5,400986478,2017-12-30
101,1,"5:10",1510,1510,"Vincent Edwards Defensive Rebound.",37,34,3,0.920285307796572,"Purdue","Lipscomb",3,4,0,0,21.5,400986478,2017-12-30
102,1,"5:07",1507,1507,"Foul on Vincent Edwards.",37,34,3,0.916519525295329,"Purdue","Lipscomb",3,4,0,0,21.5,400986478,2017-12-30
103,1,"5:07",1507,1507,"Vincent Edwards Turnover.",37,34,3,0.916519525295329,"Purdue","Lipscomb",3,4,0,0,21.5,400986478,2017-12-30
104,1,"4:56",1496,1496,"Greg Jones missed Three Point Jumper.",37,34,3,0.918862760847593,"Purdue","Lipscomb",3,4,0,0,21.5,400986478,2017-12-30
105,1,"4:56",1496,1496,"Andrew Fleming Offensive Rebound.",37,34,3,0.918862760847593,"Purdue","Lipscomb",3,4,0,0,21.5,400986478,2017-12-30
106,1,"4:49",1489,1489,"Andrew Fleming missed Jumper.",37,34,3,0.915819899670018,"Purdue","Lipscomb",3,4,0,0,21.5,400986478,2017-12-30
107,1,"4:49",1489,1489,"Vincent Edwards Defensive Rebound.",37,34,3,0.915819899670018,"Purdue","Lipscomb",3,4,0,0,21.5,400986478,2017-12-30
108,1,"4:34",1474,1474,"Foul on Greg Jones.",37,34,3,0.929246055208042,"Purdue","Lipscomb",3,4,0,0,21.5,400986478,2017-12-30
109,1,"4:34",1474,1474,"Dakota Mathias made Free Throw.",38,34,4,0.938659297214445,"Purdue","Lipscomb",3,4,0,0,21.5,400986478,2017-12-30
110,1,"4:34",1474,1474,"Dakota Mathias made Free Throw.",39,34,5,0.946891757862158,"Purdue","Lipscomb",3,4,0,0,21.5,400986478,2017-12-30
111,1,"4:08",1448,1448,"Rob Marberry missed Layup.",39,34,5,0.940791520766339,"Purdue","Lipscomb",3,4,0,0,21.5,400986478,2017-12-30
112,1,"4:08",1448,1448,"Matt Haarms Block.",39,34,5,0.940791520766339,"Purdue","Lipscomb",3,4,0,0,21.5,400986478,2017-12-30
113,1,"4:08",1448,1448,"Andrew Fleming Offensive Rebound.",39,34,5,0.940791520766339,"Purdue","Lipscomb",3,4,0,0,21.5,400986478,2017-12-30
114,1,"4:01",1441,1441,"Garrison Mathews missed Three Point Jumper.",39,34,5,0.940791520766339,"Purdue","Lipscomb",3,4,0,0,21.5,400986478,2017-12-30
115,1,"4:01",1441,1441,"Vincent Edwards Defensive Rebound.",39,34,5,0.940791520766339,"Purdue","Lipscomb",3,4,0,0,21.5,400986478,2017-12-30
116,1,"3:59",1439,1439,"Foul on Andrew Fleming.",39,34,5,0.932290644678578,"Purdue","Lipscomb",3,4,0,0,21.5,400986478,2017-12-30
117,1,"3:59",1439,1439,"Official TV Timeout",39,34,5,0.932290644678578,"Purdue","Lipscomb",3,4,0,0,21.5,400986478,2017-12-30
118,1,"3:59",1439,1439,"Vincent Edwards made Free Throw.",40,34,6,0.941117588239938,"Purdue","Lipscomb",3,4,0,0,21.5,400986478,2017-12-30
119,1,"3:59",1439,1439,"Vincent Edwards missed Free Throw.",40,34,6,0.941117588239938,"Purdue","Lipscomb",3,4,0,0,21.5,400986478,2017-12-30
120,1,"3:59",1439,1439,"Andrew Fleming Defensive Rebound.",40,34,6,0.941117588239938,"Purdue","Lipscomb",3,4,0,0,21.5,400986478,2017-12-30
121,1,"3:39",1419,1419,"Andrew Fleming made Jumper.",40,36,4,0.918894421406437,"Purdue","Lipscomb",3,4,0,0,21.5,400986478,2017-12-30
122,1,"3:13",1393,1393,"Dakota Mathias Turnover.",40,36,4,0.93287243630693,"Purdue","Lipscomb",3,4,0,0,21.5,400986478,2017-12-30
123,1,"2:56",1376,1376,"Andrew Fleming missed Jumper.",40,36,4,0.9208965180992,"Purdue","Lipscomb",3,4,0,0,21.5,400986478,2017-12-30
124,1,"2:56",1376,1376,"Vincent Edwards Defensive Rebound.",40,36,4,0.9208965180992,"Purdue","Lipscomb",3,4,0,0,21.5,400986478,2017-12-30
125,1,"2:47",1367,1367,"P.J. Thompson missed Three Point Jumper.",40,36,4,0.924025740810661,"Purdue","Lipscomb",3,4,0,0,21.5,400986478,2017-12-30
126,1,"2:47",1367,1367,"Vincent Edwards Offensive Rebound.",40,36,4,0.924025740810661,"Purdue","Lipscomb",3,4,0,0,21.5,400986478,2017-12-30
127,1,"2:36",1356,1356,"Vincent Edwards missed Jumper.",40,36,4,0.927323928975038,"Purdue","Lipscomb",3,4,0,0,21.5,400986478,2017-12-30
128,1,"2:36",1356,1356,"Kenny Cooper Defensive Rebound.",40,36,4,0.927323928975038,"Purdue","Lipscomb",3,4,0,0,21.5,400986478,2017-12-30
129,1,"2:26",1346,1346,"Kenny Cooper missed Jumper.",40,36,4,0.917400634576892,"Purdue","Lipscomb",3,4,0,0,21.5,400986478,2017-12-30
130,1,"2:26",1346,1346,"Dakota Mathias Defensive Rebound.",40,36,4,0.917400634576892,"Purdue","Lipscomb",3,4,0,0,21.5,400986478,2017-12-30
131,1,"2:09",1329,1329,"Foul on Rob Marberry.",40,36,4,0.923963820507199,"Purdue","Lipscomb",3,4,0,0,21.5,400986478,2017-12-30
132,1,"2:09",1329,1329,"Matt Haarms made Free Throw.",41,36,5,0.934322722820495,"Purdue","Lipscomb",3,4,0,0,21.5,400986478,2017-12-30
133,1,"2:09",1329,1329,"Matt Haarms missed Free Throw.",41,36,5,0.934322722820495,"Purdue","Lipscomb",3,4,0,0,21.5,400986478,2017-12-30
134,1,"2:09",1329,1329,"Garrison Mathews Defensive Rebound.",41,36,5,0.934322722820495,"Purdue","Lipscomb",3,4,0,0,21.5,400986478,2017-12-30
135,1,"2:02",1322,1322,"Garrison Mathews made Layup.",41,38,3,0.912124735134259,"Purdue","Lipscomb",3,4,0,0,21.5,400986478,2017-12-30
136,1,"1:46",1306,1306,"P.J. Thompson missed Jumper.",41,38,3,0.900358793363239,"Purdue","Lipscomb",3,4,0,0,21.5,400986478,2017-12-30
137,1,"1:46",1306,1306,"Aaron Korn Defensive Rebound.",41,38,3,0.900358793363239,"Purdue","Lipscomb",3,4,0,0,21.5,400986478,2017-12-30
138,1,"1:27",1287,1287,"Rob Marberry missed Jumper.",41,38,3,0.914946338026597,"Purdue","Lipscomb",3,4,0,0,21.5,400986478,2017-12-30
139,1,"1:27",1287,1287,"Ryan Cline Defensive Rebound.",41,38,3,0.914946338026597,"Purdue","Lipscomb",3,4,0,0,21.5,400986478,2017-12-30
140,1,"1:20",1280,1280,"Ryan Cline missed Three Point Jumper.",41,38,3,0.914946338026597,"Purdue","Lipscomb",3,4,0,0,21.5,400986478,2017-12-30
141,1,"1:20",1280,1280,"Matt Haarms Offensive Rebound.",41,38,3,0.914946338026597,"Purdue","Lipscomb",3,4,0,0,21.5,400986478,2017-12-30
142,1,"1:15",1275,1275,"Matt Haarms made Layup.",43,38,5,0.927607321134897,"Purdue","Lipscomb",3,4,0,0,21.5,400986478,2017-12-30
143,1,"1:08",1268,1268,"Foul on Ryan Cline.",43,38,5,0.93906454252067,"Purdue","Lipscomb",3,4,0,0,21.5,400986478,2017-12-30
144,1,"0:56",1256,1256,"Michael Buckland Turnover.",43,38,5,0.922698948817794,"Purdue","Lipscomb",3,4,0,0,21.5,400986478,2017-12-30
145,1,"0:43",1243,1243,"Dakota Mathias missed Three Point Jumper.",43,38,5,0.933548950726738,"Purdue","Lipscomb",3,4,0,0,21.5,400986478,2017-12-30
146,1,"0:43",1243,1243,"Vincent Edwards Offensive Rebound.",43,38,5,0.933548950726738,"Purdue","Lipscomb",3,4,0,0,21.5,400986478,2017-12-30
147,1,"0:14",1214,1214,"Vincent Edwards missed Three Point Jumper.",43,38,5,0.928465966543599,"Purdue","Lipscomb",3,4,0,0,21.5,400986478,2017-12-30
148,1,"0:14",1214,1214,"Garrison Mathews Defensive Rebound.",43,38,5,0.928465966543599,"Purdue","Lipscomb",3,4,0,0,21.5,400986478,2017-12-30
149,1,"0:08",1208,1208,"Foul on P.J. Thompson.",43,38,5,0.931355173999095,"Purdue","Lipscomb",3,4,0,0,21.5,400986478,2017-12-30
150,1,"0:04",1204,1204,"Rob Marberry missed Jumper.",43,38,5,0.931355173999095,"Purdue","Lipscomb",3,4,0,0,21.5,400986478,2017-12-30
151,1,"0:04",1204,1204,"Carsen Edwards Defensive Rebound.",43,38,5,0.931355173999095,"Purdue","Lipscomb",3,4,0,0,21.5,400986478,2017-12-30
152,1,"0:00",1200,1200,"End of 1st half",43,38,5,0.931355173999095,"Purdue","Lipscomb",3,4,0,0,21.5,400986478,2017-12-30
153,2,"20:00",1200,1200,"PLAY",43,38,5,0.931355173999095,"Purdue","Lipscomb",4,4,0,0,21.5,400986478,2017-12-30
154,2,"20:00",1200,1200,"Jump Ball won by Lipscomb",43,38,5,0.931355173999095,"Purdue","Lipscomb",4,4,0,0,21.5,400986478,2017-12-30
155,2,"19:44",1184,1184,"Michael Buckland Turnover.",43,38,5,0.933913487318819,"Purdue","Lipscomb",4,4,0,0,21.5,400986478,2017-12-30
156,2,"19:29",1169,1169,"Isaac Haas made Dunk. Assisted by Dakota Mathias.",45,38,7,0.950342794901401,"Purdue","Lipscomb",4,4,0,0,21.5,400986478,2017-12-30
157,2,"19:07",1147,1147,"Michael Buckland missed Three Point Jumper.",45,38,7,0.946491357405633,"Purdue","Lipscomb",4,4,0,0,21.5,400986478,2017-12-30
158,2,"19:07",1147,1147,"Eli Pepper Offensive Rebound.",45,38,7,0.946491357405633,"Purdue","Lipscomb",4,4,0,0,21.5,400986478,2017-12-30
159,2,"18:49",1129,1129,"Kenny Cooper Turnover.",45,38,7,0.954694942001732,"Purdue","Lipscomb",4,4,0,0,21.5,400986478,2017-12-30
160,2,"18:39",1119,1119,"Isaac Haas made Dunk. Assisted by Carsen Edwards.",47,38,9,0.962133538413105,"Purdue","Lipscomb",4,4,0,0,21.5,400986478,2017-12-30
161,2,"18:39",1119,1119,"Foul on Rob Marberry.",47,38,9,0.962133538413105,"Purdue","Lipscomb",4,4,0,0,21.5,400986478,2017-12-30
162,2,"18:39",1119,1119,"Isaac Haas missed Free Throw.",47,38,9,0.962133538413105,"Purdue","Lipscomb",4,4,0,0,21.5,400986478,2017-12-30
163,2,"18:39",1119,1119,"Michael Buckland Defensive Rebound.",47,38,9,0.962133538413105,"Purdue","Lipscomb",4,4,0,0,21.5,400986478,2017-12-30
164,2,"18:26",1106,1106,"Garrison Mathews missed Three Point Jumper.",47,38,9,0.963820455168888,"Purdue","Lipscomb",4,4,0,0,21.5,400986478,2017-12-30
165,2,"18:26",1106,1106,"Dakota Mathias Defensive Rebound.",47,38,9,0.963820455168888,"Purdue","Lipscomb",4,4,0,0,21.5,400986478,2017-12-30
166,2,"18:18",1098,1098,"P.J. Thompson missed Layup.",47,38,9,0.96624089339879,"Purdue","Lipscomb",4,4,0,0,21.5,400986478,2017-12-30
167,2,"18:18",1098,1098,"Garrison Mathews Block.",47,38,9,0.96624089339879,"Purdue","Lipscomb",4,4,0,0,21.5,400986478,2017-12-30
168,2,"18:18",1098,1098,"Rob Marberry Defensive Rebound.",47,38,9,0.96624089339879,"Purdue","Lipscomb",4,4,0,0,21.5,400986478,2017-12-30
169,2,"18:11",1091,1091,"Garrison Mathews made Three Point Jumper. Assisted by Kenny Cooper.",47,41,6,0.94478839509855,"Purdue","Lipscomb",4,4,0,0,21.5,400986478,2017-12-30
170,2,"17:56",1076,1076,"Dakota Mathias made Three Point Jumper.",50,41,9,0.960627921020602,"Purdue","Lipscomb",4,4,0,0,21.5,400986478,2017-12-30
171,2,"17:39",1059,1059,"Foul on P.J. Thompson.",50,41,9,0.966238135234811,"Purdue","Lipscomb",4,4,0,0,21.5,400986478,2017-12-30
172,2,"17:39",1059,1059,"Eli Pepper missed Free Throw.",50,41,9,0.966238135234811,"Purdue","Lipscomb",4,4,0,0,21.5,400986478,2017-12-30
173,2,"17:39",1059,1059,"Lipscomb Deadball Team Rebound.",50,41,9,0.966238135234811,"Purdue","Lipscomb",4,4,0,0,21.5,400986478,2017-12-30
174,2,"17:39",1059,1059,"Eli Pepper missed Free Throw.",50,41,9,0.966238135234811,"Purdue","Lipscomb",4,4,0,0,21.5,400986478,2017-12-30
175,2,"17:39",1059,1059,"Vincent Edwards Defensive Rebound.",50,41,9,0.966238135234811,"Purdue","Lipscomb",4,4,0,0,21.5,400986478,2017-12-30
176,2,"17:22",1042,1042,"Foul on Rob Marberry.",50,41,9,0.966393359291685,"Purdue","Lipscomb",4,4,0,0,21.5,400986478,2017-12-30
177,2,"17:22",1042,1042,"Isaac Haas made Free Throw.",51,41,10,0.971640853324429,"Purdue","Lipscomb",4,4,0,0,21.5,400986478,2017-12-30
178,2,"17:22",1042,1042,"Isaac Haas made Free Throw.",52,41,11,0.976089252724763,"Purdue","Lipscomb",4,4,0,0,21.5,400986478,2017-12-30
179,2,"17:19",1039,1039,"Matt Rose Turnover.",52,41,11,0.973408561271327,"Purdue","Lipscomb",4,4,0,0,21.5,400986478,2017-12-30
180,2,"17:19",1039,1039,"P.J. Thompson Steal.",52,41,11,0.973408561271327,"Purdue","Lipscomb",4,4,0,0,21.5,400986478,2017-12-30
181,2,"17:16",1036,1036,"Vincent Edwards made Three Point Jumper. Assisted by P.J. Thompson.",55,41,14,0.983933669761463,"Purdue","Lipscomb",4,4,0,0,21.5,400986478,2017-12-30
182,2,"17:08",1028,1028,"Lipscomb  Timeout",55,41,14,0.98556794582695,"Purdue","Lipscomb",4,3,0,1,21.5,400986478,2017-12-30
183,2,"17:06",1026,1026,"Eli Pepper made Dunk. Assisted by Michael Buckland.",55,43,12,0.979469127722832,"Purdue","Lipscomb",4,3,0,1,21.5,400986478,2017-12-30
184,2,"16:46",1006,1006,"Foul on Eli Pepper.",55,43,12,0.978360533020364,"Purdue","Lipscomb",4,3,0,1,21.5,400986478,2017-12-30
185,2,"16:38",998,998,"Foul on Eli Pepper.",55,43,12,0.977470275004777,"Purdue","Lipscomb",4,3,0,1,21.5,400986478,2017-12-30
186,2,"16:36",996,996,"Isaac Haas made Dunk. Assisted by Vincent Edwards.",57,43,14,0.984126853146998,"Purdue","Lipscomb",4,3,0,1,21.5,400986478,2017-12-30
