"play_id","half","time_remaining_half","secs_remaining","secs_remaining_absolute","description","home_score","away_score","score_diff","win_prob","home","away","home_time_out_remaining","away_time_out_remaining","home_timeout_ind","away_timeout_ind","home_favored_by","game_id","date"
1,1,"20:00",2400,2400,"PLAY",0,0,0,0.785623304600368,"Central Michigan","Bowling Green",4,4,0,0,6,400917139,2017-01-24
2,1,"20:00",2400,2400,"Jump Ball won by Central Michigan",0,0,0,0.785623304600368,"Central Michigan","Bowling Green",4,4,0,0,6,400917139,2017-01-24
3,1,"19:56",2396,2396,"Marcus Keene missed Three Point Jumper.",0,0,0,0.785623304600368,"Central Michigan","Bowling Green",4,4,0,0,6,400917139,2017-01-24
4,1,"19:56",2396,2396,"Demajeo Wiggins Defensive Rebound.",0,0,0,0.785623304600368,"Central Michigan","Bowling Green",4,4,0,0,6,400917139,2017-01-24
5,1,"19:39",2379,2379,"Demajeo Wiggins made Layup. Assisted by Wes Alcegaire.",0,2,-2,0.746814667950827,"Central Michigan","Bowling Green",4,4,0,0,6,400917139,2017-01-24
6,1,"19:16",2356,2356,"Braylon Rayson missed Three Point Jumper.",0,2,-2,0.755488090070929,"Central Michigan","Bowling Green",4,4,0,0,6,400917139,2017-01-24
7,1,"19:16",2356,2356,"Wes Alcegaire Defensive Rebound.",0,2,-2,0.755488090070929,"Central Michigan","Bowling Green",4,4,0,0,6,400917139,2017-01-24
8,1,"19:07",2347,2347,"Zack Denny missed Three Point Jumper.",0,2,-2,0.736551785220727,"Central Michigan","Bowling Green",4,4,0,0,6,400917139,2017-01-24
9,1,"19:07",2347,2347,"Demajeo Wiggins Offensive Rebound.",0,2,-2,0.736551785220727,"Central Michigan","Bowling Green",4,4,0,0,6,400917139,2017-01-24
10,1,"19:00",2340,2340,"Wes Alcegaire made Layup. Assisted by Demajeo Wiggins.",0,4,-4,0.700263608125389,"Central Michigan","Bowling Green",4,4,0,0,6,400917139,2017-01-24
11,1,"19:00",2340,2340,"Foul on Josh Kozinski.",0,4,-4,0.700263608125389,"Central Michigan","Bowling Green",4,4,0,0,6,400917139,2017-01-24
12,1,"19:00",2340,2340,"Wes Alcegaire missed Free Throw.",0,4,-4,0.700263608125389,"Central Michigan","Bowling Green",4,4,0,0,6,400917139,2017-01-24
13,1,"19:00",2340,2340,"Luke Meyer Defensive Rebound.",0,4,-4,0.700263608125389,"Central Michigan","Bowling Green",4,4,0,0,6,400917139,2017-01-24
14,1,"18:49",2329,2329,"Braylon Rayson made Layup.",2,4,-2,0.741358819190071,"Central Michigan","Bowling Green",4,4,0,0,6,400917139,2017-01-24
15,1,"18:27",2307,2307,"Demajeo Wiggins missed Jumper.",2,4,-2,0.725749399071761,"Central Michigan","Bowling Green",4,4,0,0,6,400917139,2017-01-24
16,1,"18:27",2307,2307,"Central Michigan Defensive Rebound.",2,4,-2,0.725749399071761,"Central Michigan","Bowling Green",4,4,0,0,6,400917139,2017-01-24
17,1,"18:17",2297,2297,"Luke Meyer made Jumper. Assisted by Braylon Rayson.",4,4,0,0.776313913047701,"Central Michigan","Bowling Green",4,4,0,0,6,400917139,2017-01-24
18,1,"17:56",2276,2276,"Demajeo Wiggins missed Layup.",4,4,0,0.774691426858747,"Central Michigan","Bowling Green",4,4,0,0,6,400917139,2017-01-24
19,1,"17:56",2276,2276,"Luke Meyer Defensive Rebound.",4,4,0,0.774691426858747,"Central Michigan","Bowling Green",4,4,0,0,6,400917139,2017-01-24
20,1,"17:46",2266,2266,"Josh Kozinski made Three Point Jumper. Assisted by Braylon Rayson.",7,4,3,0.836384860921504,"Central Michigan","Bowling Green",4,4,0,0,6,400917139,2017-01-24
21,1,"17:28",2248,2248,"Wes Alcegaire missed Jumper.",7,4,3,0.811273062999757,"Central Michigan","Bowling Green",4,4,0,0,6,400917139,2017-01-24
22,1,"17:28",2248,2248,"Dylan Frye Offensive Rebound.",7,4,3,0.811273062999757,"Central Michigan","Bowling Green",4,4,0,0,6,400917139,2017-01-24
23,1,"17:23",2243,2243,"Dylan Frye made Three Point Jumper.",7,7,0,0.764235283665187,"Central Michigan","Bowling Green",4,4,0,0,6,400917139,2017-01-24
24,1,"17:13",2233,2233,"Josh Kozinski missed Three Point Jumper.",7,7,0,0.771276512812066,"Central Michigan","Bowling Green",4,4,0,0,6,400917139,2017-01-24
25,1,"17:13",2233,2233,"Demajeo Wiggins Defensive Rebound.",7,7,0,0.771276512812066,"Central Michigan","Bowling Green",4,4,0,0,6,400917139,2017-01-24
26,1,"17:07",2227,2227,"Wes Alcegaire missed Three Point Jumper.",7,7,0,0.773081184668549,"Central Michigan","Bowling Green",4,4,0,0,6,400917139,2017-01-24
27,1,"17:07",2227,2227,"Braylon Rayson Defensive Rebound.",7,7,0,0.773081184668549,"Central Michigan","Bowling Green",4,4,0,0,6,400917139,2017-01-24
28,1,"16:57",2217,2217,"Foul on Demajeo Wiggins.",7,7,0,0.769433497394165,"Central Michigan","Bowling Green",4,4,0,0,6,400917139,2017-01-24
29,1,"16:57",2217,2217,"Braylon Rayson missed Free Throw.",7,7,0,0.769433497394165,"Central Michigan","Bowling Green",4,4,0,0,6,400917139,2017-01-24
30,1,"16:57",2217,2217,"Central Michigan Deadball Team Rebound.",7,7,0,0.769433497394165,"Central Michigan","Bowling Green",4,4,0,0,6,400917139,2017-01-24
31,1,"16:57",2217,2217,"Braylon Rayson made Free Throw.",8,7,1,0.791829485621821,"Central Michigan","Bowling Green",4,4,0,0,6,400917139,2017-01-24
32,1,"16:52",2212,2212,"Zack Denny missed Three Point Jumper.",8,7,1,0.791829485621821,"Central Michigan","Bowling Green",4,4,0,0,6,400917139,2017-01-24
33,1,"16:52",2212,2212,"Demajeo Wiggins Offensive Rebound.",8,7,1,0.791829485621821,"Central Michigan","Bowling Green",4,4,0,0,6,400917139,2017-01-24
34,1,"16:46",2206,2206,"Zack Denny made Layup. Assisted by Demajeo Wiggins.",8,9,-1,0.748509123355737,"Central Michigan","Bowling Green",4,4,0,0,6,400917139,2017-01-24
35,1,"16:36",2196,2196,"Braylon Rayson missed Three Point Jumper.",8,9,-1,0.75855083626225,"Central Michigan","Bowling Green",4,4,0,0,6,400917139,2017-01-24
36,1,"16:36",2196,2196,"Dylan Frye Defensive Rebound.",8,9,-1,0.75855083626225,"Central Michigan","Bowling Green",4,4,0,0,6,400917139,2017-01-24
37,1,"16:29",2189,2189,"Zack Denny made Layup. Assisted by Dylan Frye.",8,11,-3,0.705715706627795,"Central Michigan","Bowling Green",4,4,0,0,6,400917139,2017-01-24
38,1,"16:11",2171,2171,"Marcus Keene missed Three Point Jumper.",8,11,-3,0.699648989437961,"Central Michigan","Bowling Green",4,4,0,0,6,400917139,2017-01-24
39,1,"16:11",2171,2171,"Demajeo Wiggins Defensive Rebound.",8,11,-3,0.699648989437961,"Central Michigan","Bowling Green",4,4,0,0,6,400917139,2017-01-24
40,1,"16:02",2162,2162,"Zack Denny missed Three Point Jumper.",8,11,-3,0.699325396024294,"Central Michigan","Bowling Green",4,4,0,0,6,400917139,2017-01-24
41,1,"16:02",2162,2162,"Marcus Keene Defensive Rebound.",8,11,-3,0.699325396024294,"Central Michigan","Bowling Green",4,4,0,0,6,400917139,2017-01-24
42,1,"15:44",2144,2144,"Braylon Rayson made Jumper.",10,11,-1,0.754336819841318,"Central Michigan","Bowling Green",4,4,0,0,6,400917139,2017-01-24
43,1,"15:28",2128,2128,"Wes Alcegaire missed Layup.",10,11,-1,0.739815968187777,"Central Michigan","Bowling Green",4,4,0,0,6,400917139,2017-01-24
44,1,"15:28",2128,2128,"Cecil Williams Defensive Rebound.",10,11,-1,0.739815968187777,"Central Michigan","Bowling Green",4,4,0,0,6,400917139,2017-01-24
45,1,"15:20",2120,2120,"Luke Meyer missed Three Point Jumper.",10,11,-1,0.739815968187777,"Central Michigan","Bowling Green",4,4,0,0,6,400917139,2017-01-24
46,1,"15:20",2120,2120,"DaRohn Scott Offensive Rebound.",10,11,-1,0.739815968187777,"Central Michigan","Bowling Green",4,4,0,0,6,400917139,2017-01-24
47,1,"15:14",2114,2114,"Official TV Timeout",10,11,-1,0.748968656193253,"Central Michigan","Bowling Green",4,4,0,0,6,400917139,2017-01-24
48,1,"15:11",2111,2111,"Foul on Wes Alcegaire.",10,11,-1,0.748968656193253,"Central Michigan","Bowling Green",4,4,0,0,6,400917139,2017-01-24
49,1,"15:11",2111,2111,"David DiLeo made Free Throw.",11,11,0,0.770465074700322,"Central Michigan","Bowling Green",4,4,0,0,6,400917139,2017-01-24
50,1,"15:11",2111,2111,"David DiLeo made Free Throw.",12,11,1,0.79063527273897,"Central Michigan","Bowling Green",4,4,0,0,6,400917139,2017-01-24
51,1,"14:46",2086,2086,"Ismail Ali missed Three Point Jumper.",12,11,1,0.782035618015805,"Central Michigan","Bowling Green",4,4,0,0,6,400917139,2017-01-24
52,1,"14:46",2086,2086,"Marcus Keene Defensive Rebound.",12,11,1,0.782035618015805,"Central Michigan","Bowling Green",4,4,0,0,6,400917139,2017-01-24
53,1,"14:32",2072,2072,"David DiLeo Turnover.",12,11,1,0.78245716074759,"Central Michigan","Bowling Green",4,4,0,0,6,400917139,2017-01-24
54,1,"14:15",2055,2055,"Rodrick Caldwell missed Three Point Jumper.",12,11,1,0.787250974113134,"Central Michigan","Bowling Green",4,4,0,0,6,400917139,2017-01-24
55,1,"14:15",2055,2055,"DaRohn Scott Defensive Rebound.",12,11,1,0.787250974113134,"Central Michigan","Bowling Green",4,4,0,0,6,400917139,2017-01-24
56,1,"14:06",2046,2046,"Braylon Rayson made Layup. Assisted by Marcus Keene.",14,11,3,0.807186337963248,"Central Michigan","Bowling Green",4,4,0,0,6,400917139,2017-01-24
57,1,"13:57",2037,2037,"Foul on DaRohn Scott.",14,11,3,0.8285672704197,"Central Michigan","Bowling Green",4,4,0,0,6,400917139,2017-01-24
58,1,"13:51",2031,2031,"Dylan Frye missed Three Point Jumper.",14,11,3,0.8285672704197,"Central Michigan","Bowling Green",4,4,0,0,6,400917139,2017-01-24
59,1,"13:51",2031,2031,"Luke Meyer Defensive Rebound.",14,11,3,0.8285672704197,"Central Michigan","Bowling Green",4,4,0,0,6,400917139,2017-01-24
60,1,"13:40",2020,2020,"Marcus Keene made Layup.",16,11,5,0.858724205732266,"Central Michigan","Bowling Green",4,4,0,0,6,400917139,2017-01-24
61,1,"13:40",2020,2020,"Foul on Dylan Frye.",16,11,5,0.858724205732266,"Central Michigan","Bowling Green",4,4,0,0,6,400917139,2017-01-24
62,1,"13:40",2020,2020,"Marcus Keene made Free Throw.",17,11,6,0.873979103500013,"Central Michigan","Bowling Green",4,4,0,0,6,400917139,2017-01-24
63,1,"13:21",2001,2001,"Rasheed Worrell made Layup. Assisted by Antwon Lillard.",17,13,4,0.827847211888299,"Central Michigan","Bowling Green",4,4,0,0,6,400917139,2017-01-24
64,1,"13:12",1992,1992,"Braylon Rayson missed Three Point Jumper.",17,13,4,0.842825719157479,"Central Michigan","Bowling Green",4,4,0,0,6,400917139,2017-01-24
65,1,"13:12",1992,1992,"Rasheed Worrell Defensive Rebound.",17,13,4,0.842825719157479,"Central Michigan","Bowling Green",4,4,0,0,6,400917139,2017-01-24
66,1,"13:05",1985,1985,"Antwon Lillard missed Layup.",17,13,4,0.827496164305982,"Central Michigan","Bowling Green",4,4,0,0,6,400917139,2017-01-24
67,1,"13:05",1985,1985,"Luke Meyer Defensive Rebound.",17,13,4,0.827496164305982,"Central Michigan","Bowling Green",4,4,0,0,6,400917139,2017-01-24
68,1,"12:57",1977,1977,"Marcus Keene made Jumper.",19,13,6,0.875697066690993,"Central Michigan","Bowling Green",4,4,0,0,6,400917139,2017-01-24
69,1,"12:32",1952,1952,"Rasheed Worrell made Layup. Assisted by Antwon Lillard.",19,15,4,0.838264923315173,"Central Michigan","Bowling Green",4,4,0,0,6,400917139,2017-01-24
70,1,"12:32",1952,1952,"Foul on Luke Meyer.",19,15,4,0.838264923315173,"Central Michigan","Bowling Green",4,4,0,0,6,400917139,2017-01-24
71,1,"12:32",1952,1952,"Rasheed Worrell missed Free Throw.",19,15,4,0.838264923315173,"Central Michigan","Bowling Green",4,4,0,0,6,400917139,2017-01-24
72,1,"12:32",1952,1952,"Luke Meyer Defensive Rebound.",19,15,4,0.838264923315173,"Central Michigan","Bowling Green",4,4,0,0,6,400917139,2017-01-24
73,1,"12:20",1940,1940,"Braylon Rayson made Layup. Assisted by Josh Kozinski.",21,15,6,0.868247262525073,"Central Michigan","Bowling Green",4,4,0,0,6,400917139,2017-01-24
74,1,"11:59",1919,1919,"Rasheed Worrell Turnover.",21,15,6,0.877874893175555,"Central Michigan","Bowling Green",4,4,0,0,6,400917139,2017-01-24
75,1,"11:59",1919,1919,"Official TV Timeout",21,15,6,0.877874893175555,"Central Michigan","Bowling Green",4,4,0,0,6,400917139,2017-01-24
76,1,"11:41",1901,1901,"Marcus Keene Turnover.",21,15,6,0.863025526313583,"Central Michigan","Bowling Green",4,4,0,0,6,400917139,2017-01-24
77,1,"11:27",1887,1887,"Rasheed Worrell missed Layup.",21,15,6,0.865743953856129,"Central Michigan","Bowling Green",4,4,0,0,6,400917139,2017-01-24
78,1,"11:27",1887,1887,"Luke Meyer Defensive Rebound.",21,15,6,0.865743953856129,"Central Michigan","Bowling Green",4,4,0,0,6,400917139,2017-01-24
79,1,"11:18",1878,1878,"Braylon Rayson Turnover.",21,15,6,0.864637461898983,"Central Michigan","Bowling Green",4,4,0,0,6,400917139,2017-01-24
80,1,"11:18",1878,1878,"Zack Denny Steal.",21,15,6,0.864637461898983,"Central Michigan","Bowling Green",4,4,0,0,6,400917139,2017-01-24
81,1,"11:00",1860,1860,"Rodrick Caldwell made Layup.",21,17,4,0.841716269988912,"Central Michigan","Bowling Green",4,4,0,0,6,400917139,2017-01-24
82,1,"10:45",1845,1845,"Marcus Keene missed Layup.",21,17,4,0.826006985586939,"Central Michigan","Bowling Green",4,4,0,0,6,400917139,2017-01-24
83,1,"10:45",1845,1845,"Bowling Green Defensive Rebound.",21,17,4,0.826006985586939,"Central Michigan","Bowling Green",4,4,0,0,6,400917139,2017-01-24
84,1,"10:32",1832,1832,"Rodrick Caldwell missed Jumper.",21,17,4,0.833327215296252,"Central Michigan","Bowling Green",4,4,0,0,6,400917139,2017-01-24
85,1,"10:32",1832,1832,"David DiLeo Defensive Rebound.",21,17,4,0.833327215296252,"Central Michigan","Bowling Green",4,4,0,0,6,400917139,2017-01-24
86,1,"10:14",1814,1814,"Marcus Keene made Three Point Jumper. Assisted by David DiLeo.",24,17,7,0.890330156846424,"Central Michigan","Bowling Green",4,4,0,0,6,400917139,2017-01-24
87,1,"9:56",1796,1796,"Antwon Lillard missed Three Point Jumper.",24,17,7,0.876494059506394,"Central Michigan","Bowling Green",4,4,0,0,6,400917139,2017-01-24
88,1,"9:56",1796,1796,"Cecil Williams Defensive Rebound.",24,17,7,0.876494059506394,"Central Michigan","Bowling Green",4,4,0,0,6,400917139,2017-01-24
89,1,"9:47",1787,1787,"David DiLeo missed Three Point Jumper.",24,17,7,0.876103956529756,"Central Michigan","Bowling Green",4,4,0,0,6,400917139,2017-01-24
90,1,"9:47",1787,1787,"Luke Meyer Offensive Rebound.",24,17,7,0.876103956529756,"Central Michigan","Bowling Green",4,4,0,0,6,400917139,2017-01-24
91,1,"9:40",1780,1780,"Marcus Keene missed Three Point Jumper.",24,17,7,0.876103956529756,"Central Michigan","Bowling Green",4,4,0,0,6,400917139,2017-01-24
92,1,"9:40",1780,1780,"Bowling Green Defensive Rebound.",24,17,7,0.876103956529756,"Central Michigan","Bowling Green",4,4,0,0,6,400917139,2017-01-24
93,1,"9:24",1764,1764,"Zack Denny missed Jumper.",24,17,7,0.886738711386633,"Central Michigan","Bowling Green",4,4,0,0,6,400917139,2017-01-24
94,1,"9:24",1764,1764,"David DiLeo Defensive Rebound.",24,17,7,0.886738711386633,"Central Michigan","Bowling Green",4,4,0,0,6,400917139,2017-01-24
95,1,"9:14",1754,1754,"David DiLeo made Layup.",26,17,9,0.909120849902877,"Central Michigan","Bowling Green",4,4,0,0,6,400917139,2017-01-24
96,1,"9:04",1744,1744,"Ismail Ali missed Layup.",26,17,9,0.902756353054123,"Central Michigan","Bowling Green",4,4,0,0,6,400917139,2017-01-24
97,1,"9:04",1744,1744,"Demajeo Wiggins Offensive Rebound.",26,17,9,0.902756353054123,"Central Michigan","Bowling Green",4,4,0,0,6,400917139,2017-01-24
98,1,"9:02",1742,1742,"Demajeo Wiggins missed Jumper.",26,17,9,0.902756353054123,"Central Michigan","Bowling Green",4,4,0,0,6,400917139,2017-01-24
99,1,"9:02",1742,1742,"Central Michigan Defensive Rebound.",26,17,9,0.902756353054123,"Central Michigan","Bowling Green",4,4,0,0,6,400917139,2017-01-24
100,1,"9:01",1741,1741,"Foul on Zack Denny.",26,17,9,0.902756353054123,"Central Michigan","Bowling Green",4,4,0,0,6,400917139,2017-01-24
101,1,"8:52",1732,1732,"Luke Meyer missed Three Point Jumper.",26,17,9,0.910688549390981,"Central Michigan","Bowling Green",4,4,0,0,6,400917139,2017-01-24
102,1,"8:52",1732,1732,"Demajeo Wiggins Defensive Rebound.",26,17,9,0.910688549390981,"Central Michigan","Bowling Green",4,4,0,0,6,400917139,2017-01-24
103,1,"8:41",1721,1721,"Dylan Frye missed Layup.",26,17,9,0.906258784775671,"Central Michigan","Bowling Green",4,4,0,0,6,400917139,2017-01-24
104,1,"8:41",1721,1721,"Cecil Williams Defensive Rebound.",26,17,9,0.906258784775671,"Central Michigan","Bowling Green",4,4,0,0,6,400917139,2017-01-24
105,1,"8:24",1704,1704,"Braylon Rayson made Three Point Jumper. Assisted by Matty Smith.",29,17,12,0.929172693009176,"Central Michigan","Bowling Green",4,4,0,0,6,400917139,2017-01-24
106,1,"8:13",1693,1693,"Foul on Matty Smith.",29,17,12,0.942301798874054,"Central Michigan","Bowling Green",4,4,0,0,6,400917139,2017-01-24
107,1,"8:01",1681,1681,"Foul on Matty Smith.",29,17,12,0.946031750594738,"Central Michigan","Bowling Green",4,4,0,0,6,400917139,2017-01-24
108,1,"7:58",1678,1678,"Zack Denny missed Jumper.",29,17,12,0.940187543317412,"Central Michigan","Bowling Green",4,4,0,0,6,400917139,2017-01-24
109,1,"7:58",1678,1678,"Ismail Ali Offensive Rebound.",29,17,12,0.940187543317412,"Central Michigan","Bowling Green",4,4,0,0,6,400917139,2017-01-24
110,1,"7:54",1674,1674,"Ismail Ali made Layup.",29,19,10,0.922566106206393,"Central Michigan","Bowling Green",4,4,0,0,6,400917139,2017-01-24
111,1,"7:54",1674,1674,"Foul on Cecil Williams.",29,19,10,0.922566106206393,"Central Michigan","Bowling Green",4,4,0,0,6,400917139,2017-01-24
112,1,"7:54",1674,1674,"Official TV Timeout",29,19,10,0.922566106206393,"Central Michigan","Bowling Green",4,4,0,0,6,400917139,2017-01-24
113,1,"7:54",1674,1674,"Ismail Ali missed Free Throw.",29,19,10,0.922566106206393,"Central Michigan","Bowling Green",4,4,0,0,6,400917139,2017-01-24
114,1,"7:54",1674,1674,"David DiLeo Defensive Rebound.",29,19,10,0.922566106206393,"Central Michigan","Bowling Green",4,4,0,0,6,400917139,2017-01-24
115,1,"7:39",1659,1659,"David DiLeo missed Three Point Jumper.",29,19,10,0.916027241066904,"Central Michigan","Bowling Green",4,4,0,0,6,400917139,2017-01-24
116,1,"7:39",1659,1659,"DaRohn Scott Offensive Rebound.",29,19,10,0.916027241066904,"Central Michigan","Bowling Green",4,4,0,0,6,400917139,2017-01-24
117,1,"7:24",1644,1644,"Marcus Keene made Three Point Jumper. Assisted by Braylon Rayson.",32,19,13,0.948102612107177,"Central Michigan","Bowling Green",4,4,0,0,6,400917139,2017-01-24
118,1,"7:06",1626,1626,"Wes Alcegaire made Three Point Jumper. Assisted by Ismail Ali.",32,22,10,0.92135083084918,"Central Michigan","Bowling Green",4,4,0,0,6,400917139,2017-01-24
119,1,"6:56",1616,1616,"Braylon Rayson made Jumper.",34,22,12,0.934502935211302,"Central Michigan","Bowling Green",4,4,0,0,6,400917139,2017-01-24
120,1,"6:38",1598,1598,"Zack Denny missed Three Point Jumper.",34,22,12,0.936363089345786,"Central Michigan","Bowling Green",4,4,0,0,6,400917139,2017-01-24
121,1,"6:38",1598,1598,"DaRohn Scott Defensive Rebound.",34,22,12,0.936363089345786,"Central Michigan","Bowling Green",4,4,0,0,6,400917139,2017-01-24
122,1,"6:23",1583,1583,"Braylon Rayson missed Three Point Jumper.",34,22,12,0.933685647426285,"Central Michigan","Bowling Green",4,4,0,0,6,400917139,2017-01-24
123,1,"6:23",1583,1583,"Central Michigan Offensive Rebound.",34,22,12,0.933685647426285,"Central Michigan","Bowling Green",4,4,0,0,6,400917139,2017-01-24
124,1,"6:10",1570,1570,"Braylon Rayson missed Jumper.",34,22,12,0.949351989299047,"Central Michigan","Bowling Green",4,4,0,0,6,400917139,2017-01-24
125,1,"6:10",1570,1570,"Bowling Green Defensive Rebound.",34,22,12,0.949351989299047,"Central Michigan","Bowling Green",4,4,0,0,6,400917139,2017-01-24
126,1,"6:10",1570,1570,"Jump Ball won by Bowling Green",34,22,12,0.949351989299047,"Central Michigan","Bowling Green",4,4,0,0,6,400917139,2017-01-24
127,1,"5:49",1549,1549,"Demajeo Wiggins missed Jumper.",34,22,12,0.939265121596028,"Central Michigan","Bowling Green",4,4,0,0,6,400917139,2017-01-24
128,1,"5:49",1549,1549,"Braylon Rayson Defensive Rebound.",34,22,12,0.939265121596028,"Central Michigan","Bowling Green",4,4,0,0,6,400917139,2017-01-24
129,1,"5:42",1542,1542,"Marcus Keene missed Three Point Jumper.",34,22,12,0.939265121596028,"Central Michigan","Bowling Green",4,4,0,0,6,400917139,2017-01-24
130,1,"5:42",1542,1542,"Demajeo Wiggins Defensive Rebound.",34,22,12,0.939265121596028,"Central Michigan","Bowling Green",4,4,0,0,6,400917139,2017-01-24
131,1,"5:37",1537,1537,"Foul on DaRohn Scott.",34,22,12,0.939419549120754,"Central Michigan","Bowling Green",4,4,0,0,6,400917139,2017-01-24
132,1,"5:37",1537,1537,"Demajeo Wiggins made Free Throw.",34,23,11,0.930974565954607,"Central Michigan","Bowling Green",4,4,0,0,6,400917139,2017-01-24
133,1,"5:37",1537,1537,"Demajeo Wiggins made Free Throw.",34,24,10,0.921450777119974,"Central Michigan","Bowling Green",4,4,0,0,6,400917139,2017-01-24
134,1,"5:26",1526,1526,"Josh Kozinski missed Three Point Jumper.",34,24,10,0.920156036167268,"Central Michigan","Bowling Green",4,4,0,0,6,400917139,2017-01-24
135,1,"5:26",1526,1526,"Antwon Lillard Defensive Rebound.",34,24,10,0.920156036167268,"Central Michigan","Bowling Green",4,4,0,0,6,400917139,2017-01-24
136,1,"5:14",1514,1514,"Demajeo Wiggins made Layup. Assisted by Ismail Ali.",34,26,8,0.908433784037767,"Central Michigan","Bowling Green",4,4,0,0,6,400917139,2017-01-24
137,1,"4:58",1498,1498,"Foul on Ismail Ali.",34,26,8,0.901027843636387,"Central Michigan","Bowling Green",4,4,0,0,6,400917139,2017-01-24
138,1,"4:44",1484,1484,"Foul on Marcus Keene.",34,26,8,0.899807341095125,"Central Michigan","Bowling Green",4,4,0,0,6,400917139,2017-01-24
139,1,"4:44",1484,1484,"Marcus Keene Turnover.",34,26,8,0.899807341095125,"Central Michigan","Bowling Green",4,4,0,0,6,400917139,2017-01-24
140,1,"4:27",1467,1467,"Antwon Lillard Turnover.",34,26,8,0.890569884609165,"Central Michigan","Bowling Green",4,4,0,0,6,400917139,2017-01-24
141,1,"4:14",1454,1454,"Cecil Williams Turnover.",34,26,8,0.896959015082036,"Central Michigan","Bowling Green",4,4,0,0,6,400917139,2017-01-24
142,1,"4:07",1447,1447,"Demajeo Wiggins missed Layup.",34,26,8,0.910105959883001,"Central Michigan","Bowling Green",4,4,0,0,6,400917139,2017-01-24
143,1,"4:07",1447,1447,"Luke Meyer Block.",34,26,8,0.910105959883001,"Central Michigan","Bowling Green",4,4,0,0,6,400917139,2017-01-24
144,1,"4:07",1447,1447,"Luke Meyer Defensive Rebound.",34,26,8,0.910105959883001,"Central Michigan","Bowling Green",4,4,0,0,6,400917139,2017-01-24
145,1,"3:46",1426,1426,"Marcus Keene missed Three Point Jumper.",34,26,8,0.890936923817829,"Central Michigan","Bowling Green",4,4,0,0,6,400917139,2017-01-24
146,1,"3:46",1426,1426,"Demajeo Wiggins Defensive Rebound.",34,26,8,0.890936923817829,"Central Michigan","Bowling Green",4,4,0,0,6,400917139,2017-01-24
147,1,"3:31",1411,1411,"Wes Alcegaire made Layup.",34,28,6,0.866919004006797,"Central Michigan","Bowling Green",4,4,0,0,6,400917139,2017-01-24
148,1,"3:22",1402,1402,"Marcus Keene made Layup.",36,28,8,0.910258536717912,"Central Michigan","Bowling Green",4,4,0,0,6,400917139,2017-01-24
149,1,"2:59",1379,1379,"Dylan Frye missed Three Point Jumper.",36,28,8,0.891867158725323,"Central Michigan","Bowling Green",4,4,0,0,6,400917139,2017-01-24
150,1,"2:59",1379,1379,"Luke Meyer Defensive Rebound.",36,28,8,0.891867158725323,"Central Michigan","Bowling Green",4,4,0,0,6,400917139,2017-01-24
151,1,"2:39",1359,1359,"Central Michigan  Timeout",36,28,8,0.906874293480381,"Central Michigan","Bowling Green",3,4,1,0,6,400917139,2017-01-24
152,1,"2:28",1348,1348,"Luke Meyer missed Three Point Jumper.",36,28,8,0.899187893258338,"Central Michigan","Bowling Green",3,4,1,0,6,400917139,2017-01-24
153,1,"2:28",1348,1348,"Dylan Frye Defensive Rebound.",36,28,8,0.899187893258338,"Central Michigan","Bowling Green",3,4,1,0,6,400917139,2017-01-24
154,1,"2:00",1320,1320,"Foul on Rasheed Worrell.",36,28,8,0.903633358156139,"Central Michigan","Bowling Green",3,4,1,0,6,400917139,2017-01-24
155,1,"2:00",1320,1320,"Rasheed Worrell Turnover.",36,28,8,0.903633358156139,"Central Michigan","Bowling Green",3,4,1,0,6,400917139,2017-01-24
156,1,"1:47",1307,1307,"Marcus Keene made Jumper.",38,28,10,0.917676275484638,"Central Michigan","Bowling Green",3,4,1,0,6,400917139,2017-01-24
157,1,"1:47",1307,1307,"Foul on Rodrick Caldwell.",38,28,10,0.917676275484638,"Central Michigan","Bowling Green",3,4,1,0,6,400917139,2017-01-24
158,1,"1:47",1307,1307,"Marcus Keene made Free Throw.",39,28,11,0.928129249441651,"Central Michigan","Bowling Green",3,4,1,0,6,400917139,2017-01-24
159,1,"1:32",1292,1292,"Wes Alcegaire missed Three Point Jumper.",39,28,11,0.94456473863776,"Central Michigan","Bowling Green",3,4,0,0,6,400917139,2017-01-24
160,1,"1:32",1292,1292,"Braylon Rayson Defensive Rebound.",39,28,11,0.94456473863776,"Central Michigan","Bowling Green",3,4,0,0,6,400917139,2017-01-24
161,1,"1:17",1277,1277,"Luke Meyer made Three Point Jumper. Assisted by Braylon Rayson.",42,28,14,0.953015847804045,"Central Michigan","Bowling Green",3,4,0,0,6,400917139,2017-01-24
162,1,"0:53",1253,1253,"Rasheed Worrell missed Layup.",42,28,14,0.953837861401333,"Central Michigan","Bowling Green",3,4,0,0,6,400917139,2017-01-24
163,1,"0:53",1253,1253,"Luke Meyer Block.",42,28,14,0.953837861401333,"Central Michigan","Bowling Green",3,4,0,0,6,400917139,2017-01-24
164,1,"0:53",1253,1253,"Bowling Green Offensive Rebound.",42,28,14,0.953837861401333,"Central Michigan","Bowling Green",3,4,0,0,6,400917139,2017-01-24
165,1,"0:46",1246,1246,"Antwon Lillard made Layup.",42,30,12,0.94458075551684,"Central Michigan","Bowling Green",3,4,0,0,6,400917139,2017-01-24
166,1,"0:24",1224,1224,"Josh Kozinski missed Three Point Jumper.",42,30,12,0.952221914963227,"Central Michigan","Bowling Green",3,4,0,0,6,400917139,2017-01-24
167,1,"0:24",1224,1224,"Bowling Green Defensive Rebound.",42,30,12,0.952221914963227,"Central Michigan","Bowling Green",3,4,0,0,6,400917139,2017-01-24
168,1,"0:05",1205,1205,"Ismail Ali missed Layup.",42,30,12,0.945839168243763,"Central Michigan","Bowling Green",3,4,0,0,6,400917139,2017-01-24
169,1,"0:05",1205,1205,"Cecil Williams Defensive Rebound.",42,30,12,0.945839168243763,"Central Michigan","Bowling Green",3,4,0,0,6,400917139,2017-01-24
170,1,"0:00",1200,1200,"End of 1st half",42,30,12,0.945839168243763,"Central Michigan","Bowling Green",3,4,0,0,6,400917139,2017-01-24
171,2,"20:00",1200,1200,"PLAY",42,30,12,0.945839168243763,"Central Michigan","Bowling Green",4,4,0,0,6,400917139,2017-01-24
