"play_id","half","time_remaining_half","secs_remaining","secs_remaining_absolute","description","home_score","away_score","score_diff","win_prob","home","away","home_time_out_remaining","away_time_out_remaining","home_timeout_ind","away_timeout_ind","home_favored_by","game_id","date"
1,1,"20:00",2400,2400,"PLAY",0,0,0,0.323705852220043,"Air Force","Missouri State",6,6,0,0,-3.5,400918176,2016-12-03
2,1,"19:38",2378,2378,"Ronnie Rousseau III made Three Point Jumper. Assisted by Dequon Miller.",0,3,-3,0.286153357116408,"Air Force","Missouri State",6,6,0,0,-3.5,400918176,2016-12-03
3,1,"19:13",2353,2353,"Frank Toohey made Jumper. Assisted by Jacob Van.",2,3,-1,0.331505003263796,"Air Force","Missouri State",6,6,0,0,-3.5,400918176,2016-12-03
4,1,"19:13",2353,2353,"Foul on Alize Johnson.",2,3,-1,0.331505003263796,"Air Force","Missouri State",6,6,0,0,-3.5,400918176,2016-12-03
5,1,"19:13",2353,2353,"Frank Toohey missed Free Throw.",2,3,-1,0.331505003263796,"Air Force","Missouri State",6,6,0,0,-3.5,400918176,2016-12-03
6,1,"19:13",2353,2353,"Chris Kendrix Defensive Rebound.",2,3,-1,0.331505003263796,"Air Force","Missouri State",6,6,0,0,-3.5,400918176,2016-12-03
7,1,"18:58",2338,2338,"Foul on Alize Johnson.",2,3,-1,0.320503623356014,"Air Force","Missouri State",6,6,0,0,-3.5,400918176,2016-12-03
8,1,"18:58",2338,2338,"Alize Johnson Turnover.",2,3,-1,0.320503623356014,"Air Force","Missouri State",6,6,0,0,-3.5,400918176,2016-12-03
9,1,"18:41",2321,2321,"Frank Toohey made Layup. Assisted by CJ Siples.",4,3,1,0.383494658903497,"Air Force","Missouri State",6,6,0,0,-3.5,400918176,2016-12-03
10,1,"18:20",2300,2300,"Ryan Kreklow missed Three Point Jumper.",4,3,1,0.362076032746011,"Air Force","Missouri State",6,6,0,0,-3.5,400918176,2016-12-03
11,1,"18:20",2300,2300,"Frank Toohey Defensive Rebound.",4,3,1,0.362076032746011,"Air Force","Missouri State",6,6,0,0,-3.5,400918176,2016-12-03
12,1,"18:01",2281,2281,"Zach Kocur made Layup. Assisted by Frank Toohey.",6,3,3,0.409996632926385,"Air Force","Missouri State",6,6,0,0,-3.5,400918176,2016-12-03
13,1,"17:42",2262,2262,"Dequon Miller missed Three Point Jumper.",6,3,3,0.430151789047781,"Air Force","Missouri State",6,6,0,0,-3.5,400918176,2016-12-03
14,1,"17:42",2262,2262,"Zach Kocur Defensive Rebound.",6,3,3,0.430151789047781,"Air Force","Missouri State",6,6,0,0,-3.5,400918176,2016-12-03
15,1,"17:23",2243,2243,"Frank Toohey made Three Point Jumper.",9,3,6,0.505991357009266,"Air Force","Missouri State",6,6,0,0,-3.5,400918176,2016-12-03
16,1,"17:11",2231,2231,"Ronnie Rousseau III made Jumper.",9,5,4,0.452783983338378,"Air Force","Missouri State",6,6,0,0,-3.5,400918176,2016-12-03
17,1,"17:11",2231,2231,"Foul on CJ Siples.",9,5,4,0.452783983338378,"Air Force","Missouri State",6,6,0,0,-3.5,400918176,2016-12-03
18,1,"17:11",2231,2231,"Ronnie Rousseau III made Free Throw.",9,6,3,0.425225163095792,"Air Force","Missouri State",6,6,0,0,-3.5,400918176,2016-12-03
19,1,"16:57",2217,2217,"CJ Siples missed Layup.",9,6,3,0.456791074696546,"Air Force","Missouri State",6,6,0,0,-3.5,400918176,2016-12-03
20,1,"16:57",2217,2217,"Jordan Martin Defensive Rebound.",9,6,3,0.456791074696546,"Air Force","Missouri State",6,6,0,0,-3.5,400918176,2016-12-03
21,1,"16:40",2200,2200,"Ronnie Rousseau III missed Three Point Jumper.",9,6,3,0.431180330623871,"Air Force","Missouri State",6,6,0,0,-3.5,400918176,2016-12-03
22,1,"16:40",2200,2200,"Frank Toohey Defensive Rebound.",9,6,3,0.431180330623871,"Air Force","Missouri State",6,6,0,0,-3.5,400918176,2016-12-03
23,1,"16:27",2187,2187,"Hayden Graham missed Three Point Jumper.",9,6,3,0.425616818904829,"Air Force","Missouri State",6,6,0,0,-3.5,400918176,2016-12-03
24,1,"16:27",2187,2187,"Jordan Martin Defensive Rebound.",9,6,3,0.425616818904829,"Air Force","Missouri State",6,6,0,0,-3.5,400918176,2016-12-03
25,1,"16:13",2173,2173,"Chris Kendrix missed Three Point Jumper.",9,6,3,0.417906847741929,"Air Force","Missouri State",6,6,0,0,-3.5,400918176,2016-12-03
26,1,"16:13",2173,2173,"Zach Kocur Defensive Rebound.",9,6,3,0.417906847741929,"Air Force","Missouri State",6,6,0,0,-3.5,400918176,2016-12-03
27,1,"16:00",2160,2160,"Foul on Jordan Martin.",9,6,3,0.426798736722781,"Air Force","Missouri State",6,6,0,0,-3.5,400918176,2016-12-03
28,1,"15:46",2146,2146,"Frank Toohey made Jumper. Assisted by CJ Siples.",11,6,5,0.475379163132437,"Air Force","Missouri State",6,6,0,0,-3.5,400918176,2016-12-03
29,1,"15:12",2112,2112,"Dequon Miller missed Three Point Jumper.",11,6,5,0.471222330173914,"Air Force","Missouri State",6,6,0,0,-3.5,400918176,2016-12-03
30,1,"15:12",2112,2112,"Frank Toohey Defensive Rebound.",11,6,5,0.471222330173914,"Air Force","Missouri State",6,6,0,0,-3.5,400918176,2016-12-03
31,1,"15:11",2111,2111,"Foul on Jarrid Rhodes.",11,6,5,0.471222330173914,"Air Force","Missouri State",6,6,0,0,-3.5,400918176,2016-12-03
32,1,"15:11",2111,2111,"Official TV Timeout",11,6,5,0.471222330173914,"Air Force","Missouri State",6,6,0,0,-3.5,400918176,2016-12-03
33,1,"14:44",2084,2084,"CJ Siples missed Jumper.",11,6,5,0.493682058966192,"Air Force","Missouri State",6,6,0,0,-3.5,400918176,2016-12-03
34,1,"14:44",2084,2084,"Air Force Offensive Rebound.",11,6,5,0.493682058966192,"Air Force","Missouri State",6,6,0,0,-3.5,400918176,2016-12-03
35,1,"14:21",2061,2061,"Jacob Van made Three Point Jumper. Assisted by Hayden Graham.",14,6,8,0.572900407462005,"Air Force","Missouri State",6,6,0,0,-3.5,400918176,2016-12-03
36,1,"14:05",2045,2045,"Foul on Zach Kocur.",14,6,8,0.550311744280282,"Air Force","Missouri State",6,6,0,0,-3.5,400918176,2016-12-03
37,1,"13:46",2026,2026,"Austin Ruder missed Three Point Jumper.",14,6,8,0.594597603720651,"Air Force","Missouri State",6,6,0,0,-3.5,400918176,2016-12-03
38,1,"13:46",2026,2026,"CJ Siples Defensive Rebound.",14,6,8,0.594597603720651,"Air Force","Missouri State",6,6,0,0,-3.5,400918176,2016-12-03
39,1,"13:35",2015,2015,"Zach Kocur made Three Point Jumper. Assisted by Jacob Van.",17,6,11,0.661754364615896,"Air Force","Missouri State",6,6,0,0,-3.5,400918176,2016-12-03
40,1,"13:22",2002,2002,"Jarred Dixon made Jumper.",17,8,9,0.586959760062275,"Air Force","Missouri State",6,6,0,0,-3.5,400918176,2016-12-03
41,1,"13:22",2002,2002,"Foul on Robin Thompson.",17,8,9,0.586959760062275,"Air Force","Missouri State",6,6,0,0,-3.5,400918176,2016-12-03
42,1,"13:15",1995,1995,"Frank Toohey made Jumper.",19,8,11,0.687725720660654,"Air Force","Missouri State",6,6,0,0,-3.5,400918176,2016-12-03
43,1,"13:10",1990,1990,"Jarred Dixon made Three Point Jumper.",19,11,8,0.598727086625345,"Air Force","Missouri State",6,6,0,0,-3.5,400918176,2016-12-03
44,1,"12:38",1958,1958,"Foul on Austin Ruder.",19,11,8,0.60940774281739,"Air Force","Missouri State",6,6,0,0,-3.5,400918176,2016-12-03
45,1,"12:32",1952,1952,"Jacob Van made Jumper.",21,11,10,0.66705802355724,"Air Force","Missouri State",6,6,0,0,-3.5,400918176,2016-12-03
46,1,"12:25",1945,1945,"Dequon Miller made Layup.",21,13,8,0.595101938318943,"Air Force","Missouri State",6,6,0,0,-3.5,400918176,2016-12-03
47,1,"12:04",1924,1924,"Jarrid Rhodes Defensive Rebound.",21,13,8,0.57289075771695,"Air Force","Missouri State",6,6,0,0,-3.5,400918176,2016-12-03
48,1,"11:54",1914,1914,"Jarrid Rhodes missed Three Point Jumper.",21,13,8,0.622232600846092,"Air Force","Missouri State",6,6,0,0,-3.5,400918176,2016-12-03
49,1,"11:54",1914,1914,"Trevor Lyons Defensive Rebound.",21,13,8,0.622232600846092,"Air Force","Missouri State",6,6,0,0,-3.5,400918176,2016-12-03
50,1,"11:47",1907,1907,"Ryan Manning made Layup. Assisted by Trevor Lyons.",23,13,10,0.628080145561336,"Air Force","Missouri State",6,6,0,0,-3.5,400918176,2016-12-03
51,1,"11:24",1884,1884,"Austin Ruder made Three Point Jumper. Assisted by Jarrid Rhodes.",23,16,7,0.548509767227819,"Air Force","Missouri State",6,6,0,0,-3.5,400918176,2016-12-03
52,1,"10:52",1852,1852,"Hayden Graham missed Jumper.",23,16,7,0.58280587708196,"Air Force","Missouri State",6,6,0,0,-3.5,400918176,2016-12-03
53,1,"10:52",1852,1852,"Tyler McCullough Block.",23,16,7,0.58280587708196,"Air Force","Missouri State",6,6,0,0,-3.5,400918176,2016-12-03
54,1,"10:50",1850,1850,"Dequon Miller Defensive Rebound.",23,16,7,0.58280587708196,"Air Force","Missouri State",6,6,0,0,-3.5,400918176,2016-12-03
55,1,"10:47",1847,1847,"Jarred Dixon made Layup. Assisted by Dequon Miller.",23,18,5,0.478858665436772,"Air Force","Missouri State",6,6,0,0,-3.5,400918176,2016-12-03
56,1,"10:27",1827,1827,"Trevor Lyons missed Jumper.",23,18,5,0.515862951152239,"Air Force","Missouri State",6,6,0,0,-3.5,400918176,2016-12-03
57,1,"10:27",1827,1827,"Jarred Dixon Defensive Rebound.",23,18,5,0.515862951152239,"Air Force","Missouri State",6,6,0,0,-3.5,400918176,2016-12-03
58,1,"10:06",1806,1806,"Dequon Miller missed Three Point Jumper.",23,18,5,0.503002775912836,"Air Force","Missouri State",6,6,0,0,-3.5,400918176,2016-12-03
59,1,"10:06",1806,1806,"Jacob Van Defensive Rebound.",23,18,5,0.503002775912836,"Air Force","Missouri State",6,6,0,0,-3.5,400918176,2016-12-03
60,1,"9:59",1799,1799,"Trevor Lyons missed Layup.",23,18,5,0.51010266443665,"Air Force","Missouri State",6,6,0,0,-3.5,400918176,2016-12-03
61,1,"9:59",1799,1799,"Missouri St Defensive Rebound.",23,18,5,0.51010266443665,"Air Force","Missouri State",6,6,0,0,-3.5,400918176,2016-12-03
62,1,"9:58",1798,1798,"Foul on Hayden Graham.",23,18,5,0.51010266443665,"Air Force","Missouri State",6,6,0,0,-3.5,400918176,2016-12-03
63,1,"9:58",1798,1798,"Official TV Timeout",23,18,5,0.51010266443665,"Air Force","Missouri State",6,6,0,0,-3.5,400918176,2016-12-03
64,1,"9:43",1783,1783,"Jordan Martin made Layup. Assisted by Ryan Kreklow.",23,20,3,0.444635844946615,"Air Force","Missouri State",6,6,0,0,-3.5,400918176,2016-12-03
65,1,"9:22",1762,1762,"Ryan Manning made Three Point Jumper. Assisted by Trevor Lyons.",26,20,6,0.539250216945816,"Air Force","Missouri State",6,6,0,0,-3.5,400918176,2016-12-03
66,1,"9:01",1741,1741,"Ronnie Rousseau III missed Jumper.",26,20,6,0.566091910533404,"Air Force","Missouri State",6,6,0,0,-3.5,400918176,2016-12-03
67,1,"9:01",1741,1741,"Trevor Lyons Defensive Rebound.",26,20,6,0.566091910533404,"Air Force","Missouri State",6,6,0,0,-3.5,400918176,2016-12-03
68,1,"8:45",1725,1725,"Ryan Manning missed Jumper.",26,20,6,0.588054421372431,"Air Force","Missouri State",6,6,0,0,-3.5,400918176,2016-12-03
69,1,"8:45",1725,1725,"Ronnie Rousseau III Defensive Rebound.",26,20,6,0.588054421372431,"Air Force","Missouri State",6,6,0,0,-3.5,400918176,2016-12-03
70,1,"8:31",1711,1711,"Jarred Dixon missed Three Point Jumper.",26,20,6,0.546897911309079,"Air Force","Missouri State",6,6,0,0,-3.5,400918176,2016-12-03
71,1,"8:31",1711,1711,"CJ Siples Defensive Rebound.",26,20,6,0.546897911309079,"Air Force","Missouri State",6,6,0,0,-3.5,400918176,2016-12-03
72,1,"8:04",1684,1684,"Ryan Manning missed Three Point Jumper.",26,20,6,0.562555040692726,"Air Force","Missouri State",6,6,0,0,-3.5,400918176,2016-12-03
73,1,"8:04",1684,1684,"Jordan Martin Defensive Rebound.",26,20,6,0.562555040692726,"Air Force","Missouri State",6,6,0,0,-3.5,400918176,2016-12-03
74,1,"7:45",1665,1665,"Chris Kendrix missed Three Point Jumper.",26,20,6,0.547313768489264,"Air Force","Missouri State",6,6,0,0,-3.5,400918176,2016-12-03
75,1,"7:45",1665,1665,"Air Force Defensive Rebound.",26,20,6,0.547313768489264,"Air Force","Missouri State",6,6,0,0,-3.5,400918176,2016-12-03
76,1,"7:43",1663,1663,"Official TV Timeout",26,20,6,0.547313768489264,"Air Force","Missouri State",6,6,0,0,-3.5,400918176,2016-12-03
77,1,"7:17",1637,1637,"Hayden Graham missed Jumper.",26,20,6,0.570329384404644,"Air Force","Missouri State",6,6,0,0,-3.5,400918176,2016-12-03
78,1,"7:17",1637,1637,"Ryan Kreklow Defensive Rebound.",26,20,6,0.570329384404644,"Air Force","Missouri State",6,6,0,0,-3.5,400918176,2016-12-03
79,1,"6:48",1608,1608,"Ronnie Rousseau III made Three Point Jumper. Assisted by Ryan Kreklow.",26,23,3,0.440360354552395,"Air Force","Missouri State",6,6,0,0,-3.5,400918176,2016-12-03
80,1,"6:31",1591,1591,"Hayden Graham missed Layup.",26,23,3,0.485538508989576,"Air Force","Missouri State",6,6,0,0,-3.5,400918176,2016-12-03
81,1,"6:31",1591,1591,"Chris Kendrix Defensive Rebound.",26,23,3,0.485538508989576,"Air Force","Missouri State",6,6,0,0,-3.5,400918176,2016-12-03
82,1,"6:23",1583,1583,"Ryan Kreklow missed Three Point Jumper.",26,23,3,0.440692193816637,"Air Force","Missouri State",6,6,0,0,-3.5,400918176,2016-12-03
83,1,"6:23",1583,1583,"Ryan Kreklow Offensive Rebound.",26,23,3,0.440692193816637,"Air Force","Missouri State",6,6,0,0,-3.5,400918176,2016-12-03
84,1,"6:17",1577,1577,"Ronnie Rousseau III missed Three Point Jumper.",26,23,3,0.479450691162196,"Air Force","Missouri State",6,6,0,0,-3.5,400918176,2016-12-03
85,1,"6:17",1577,1577,"Zach Kocur Defensive Rebound.",26,23,3,0.479450691162196,"Air Force","Missouri State",6,6,0,0,-3.5,400918176,2016-12-03
86,1,"5:58",1558,1558,"Frank Toohey missed Jumper.",26,23,3,0.463385406156473,"Air Force","Missouri State",6,6,0,0,-3.5,400918176,2016-12-03
87,1,"5:58",1558,1558,"Chris Kendrix Defensive Rebound.",26,23,3,0.463385406156473,"Air Force","Missouri State",6,6,0,0,-3.5,400918176,2016-12-03
88,1,"5:27",1527,1527,"Ronnie Rousseau III missed Three Point Jumper.",26,23,3,0.471895271426801,"Air Force","Missouri State",6,6,0,0,-3.5,400918176,2016-12-03
89,1,"5:27",1527,1527,"Zach Kocur Defensive Rebound.",26,23,3,0.471895271426801,"Air Force","Missouri State",6,6,0,0,-3.5,400918176,2016-12-03
90,1,"5:17",1517,1517,"Zach Kocur made Three Point Jumper. Assisted by CJ Siples.",29,23,6,0.609948203323472,"Air Force","Missouri State",6,6,0,0,-3.5,400918176,2016-12-03
91,1,"5:16",1516,1516,"Missouri St  Timeout",29,23,6,0.609948203323472,"Air Force","Missouri State",6,5,0,1,-3.5,400918176,2016-12-03
92,1,"4:53",1493,1493,"Jarrid Rhodes made Jumper.",29,25,4,0.526179658525331,"Air Force","Missouri State",6,5,0,1,-3.5,400918176,2016-12-03
93,1,"4:28",1468,1468,"Hayden Graham made Three Point Jumper.",32,25,7,0.636366936801634,"Air Force","Missouri State",6,5,0,1,-3.5,400918176,2016-12-03
94,1,"3:56",1436,1436,"Jordan Martin missed Layup.",32,25,7,0.644340569329177,"Air Force","Missouri State",6,5,0,0,-3.5,400918176,2016-12-03
95,1,"3:56",1436,1436,"CJ Siples Block.",32,25,7,0.644340569329177,"Air Force","Missouri State",6,5,0,0,-3.5,400918176,2016-12-03
96,1,"3:54",1434,1434,"Jacob Van Defensive Rebound.",32,25,7,0.644340569329177,"Air Force","Missouri State",6,5,0,0,-3.5,400918176,2016-12-03
97,1,"3:51",1431,1431,"Official TV Timeout",32,25,7,0.644340569329177,"Air Force","Missouri State",6,5,0,0,-3.5,400918176,2016-12-03
98,1,"3:37",1417,1417,"Hayden Graham made Layup. Assisted by Frank Toohey.",34,25,9,0.707139289692887,"Air Force","Missouri State",6,5,0,0,-3.5,400918176,2016-12-03
99,1,"3:12",1392,1392,"Tyler McCullough missed Layup.",34,25,9,0.679616411037943,"Air Force","Missouri State",6,5,0,0,-3.5,400918176,2016-12-03
100,1,"3:12",1392,1392,"Jacob Van Defensive Rebound.",34,25,9,0.679616411037943,"Air Force","Missouri State",6,5,0,0,-3.5,400918176,2016-12-03
101,1,"3:00",1380,1380,"Frank Toohey Turnover.",34,25,9,0.702677099049092,"Air Force","Missouri State",6,5,0,0,-3.5,400918176,2016-12-03
102,1,"2:35",1355,1355,"Austin Ruder missed Jumper.",34,25,9,0.717354647280925,"Air Force","Missouri State",6,5,0,0,-3.5,400918176,2016-12-03
103,1,"2:35",1355,1355,"CJ Siples Defensive Rebound.",34,25,9,0.717354647280925,"Air Force","Missouri State",6,5,0,0,-3.5,400918176,2016-12-03
104,1,"2:28",1348,1348,"Frank Toohey made Layup. Assisted by CJ Siples.",36,25,11,0.773030886129323,"Air Force","Missouri State",6,5,0,0,-3.5,400918176,2016-12-03
105,1,"2:13",1333,1333,"Foul on Frank Toohey.",36,25,11,0.759285526966646,"Air Force","Missouri State",6,5,0,0,-3.5,400918176,2016-12-03
106,1,"2:10",1330,1330,"Jarrid Rhodes missed Three Point Jumper.",36,25,11,0.759285526966646,"Air Force","Missouri State",6,5,0,0,-3.5,400918176,2016-12-03
107,1,"2:10",1330,1330,"CJ Siples Defensive Rebound.",36,25,11,0.759285526966646,"Air Force","Missouri State",6,5,0,0,-3.5,400918176,2016-12-03
108,1,"2:00",1320,1320,"Hayden Graham made Three Point Jumper. Assisted by Jacob Van.",39,25,14,0.843203671180685,"Air Force","Missouri State",6,5,0,0,-3.5,400918176,2016-12-03
109,1,"1:38",1298,1298,"Foul on Jacob Van.",39,25,14,0.879789171609439,"Air Force","Missouri State",6,5,0,0,-3.5,400918176,2016-12-03
110,1,"1:38",1298,1298,"Dequon Miller made Free Throw.",39,26,13,0.860926157626879,"Air Force","Missouri State",6,5,0,0,-3.5,400918176,2016-12-03
111,1,"1:38",1298,1298,"Dequon Miller made Free Throw.",39,27,12,0.839642729609736,"Air Force","Missouri State",6,5,0,0,-3.5,400918176,2016-12-03
112,1,"1:22",1282,1282,"CJ Siples Turnover.",39,27,12,0.777134421896995,"Air Force","Missouri State",6,5,0,0,-3.5,400918176,2016-12-03
113,1,"1:21",1281,1281,"Jarred Dixon Steal.",39,27,12,0.777134421896995,"Air Force","Missouri State",6,5,0,0,-3.5,400918176,2016-12-03
114,1,"1:19",1279,1279,"Jarred Dixon made Layup.",39,29,10,0.71289535373027,"Air Force","Missouri State",6,5,0,1,-3.5,400918176,2016-12-03
115,1,"1:19",1279,1279,"Foul on Ryan Manning.",39,29,10,0.71289535373027,"Air Force","Missouri State",6,5,0,1,-3.5,400918176,2016-12-03
116,1,"1:19",1279,1279,"Air Force  Timeout",39,29,10,0.71289535373027,"Air Force","Missouri State",6,4,0,1,-3.5,400918176,2016-12-03
117,1,"1:19",1279,1279,"Jarred Dixon made Free Throw.",39,30,9,0.681277519801009,"Air Force","Missouri State",6,4,0,1,-3.5,400918176,2016-12-03
118,1,"0:59",1259,1259,"Foul on Chris Kendrix.",39,30,9,0.709953976504936,"Air Force","Missouri State",6,4,0,1,-3.5,400918176,2016-12-03
119,1,"0:59",1259,1259,"Hayden Graham made Free Throw.",40,30,10,0.740136902302035,"Air Force","Missouri State",6,4,0,1,-3.5,400918176,2016-12-03
120,1,"0:59",1259,1259,"Hayden Graham made Free Throw.",41,30,11,0.768204404559437,"Air Force","Missouri State",6,4,0,1,-3.5,400918176,2016-12-03
121,1,"0:44",1244,1244,"Jarred Dixon Turnover.",41,30,11,0.764527459005185,"Air Force","Missouri State",6,4,0,1,-3.5,400918176,2016-12-03
122,1,"0:13",1213,1213,"Jacob Van missed Three Point Jumper.",41,30,11,0.787569471953121,"Air Force","Missouri State",6,4,0,0,-3.5,400918176,2016-12-03
123,1,"0:13",1213,1213,"Jarrid Rhodes Defensive Rebound.",41,30,11,0.787569471953121,"Air Force","Missouri State",6,4,0,0,-3.5,400918176,2016-12-03
124,1,"0:03",1203,1203,"Ronnie Rousseau III made Jumper.",41,32,9,0.716423000474026,"Air Force","Missouri State",6,4,0,0,-3.5,400918176,2016-12-03
125,1,"0:00",1200,1200,"End of 1st half",41,32,9,0.716423000474026,"Air Force","Missouri State",6,4,0,0,-3.5,400918176,2016-12-03
126,2,"20:00",1200,1200,"PLAY",41,32,9,0.716423000474026,"Air Force","Missouri State",6,4,0,0,-3.5,400918176,2016-12-03
127,2,"19:50",1190,1190,"Chris Kendrix missed Three Point Jumper.",41,32,9,0.750138302094322,"Air Force","Missouri State",6,4,0,0,-3.5,400918176,2016-12-03
128,2,"19:50",1190,1190,"Zach Kocur Defensive Rebound.",41,32,9,0.750138302094322,"Air Force","Missouri State",6,4,0,0,-3.5,400918176,2016-12-03
129,2,"19:28",1168,1168,"Jacob Van made Layup.",43,32,11,0.768959824454742,"Air Force","Missouri State",6,4,0,0,-3.5,400918176,2016-12-03
130,2,"19:12",1152,1152,"Dequon Miller made Three Point Jumper. Assisted by Ronnie Rousseau III.",43,35,8,0.700732320338093,"Air Force","Missouri State",6,4,0,0,-3.5,400918176,2016-12-03
131,2,"18:48",1128,1128,"Frank Toohey missed Jumper.",43,35,8,0.726833210605144,"Air Force","Missouri State",6,4,0,0,-3.5,400918176,2016-12-03
132,2,"18:48",1128,1128,"Alize Johnson Defensive Rebound.",43,35,8,0.726833210605144,"Air Force","Missouri State",6,4,0,0,-3.5,400918176,2016-12-03
133,2,"18:35",1115,1115,"Ronnie Rousseau III missed Three Point Jumper.",43,35,8,0.72558698308804,"Air Force","Missouri State",6,4,0,0,-3.5,400918176,2016-12-03
134,2,"18:35",1115,1115,"Air Force Defensive Rebound.",43,35,8,0.72558698308804,"Air Force","Missouri State",6,4,0,0,-3.5,400918176,2016-12-03
135,2,"18:10",1090,1090,"Jacob Van Turnover.",43,35,8,0.714342588575682,"Air Force","Missouri State",6,4,0,0,-3.5,400918176,2016-12-03
136,2,"17:59",1079,1079,"Foul on Zach Kocur.",43,35,8,0.724025012417238,"Air Force","Missouri State",6,4,0,0,-3.5,400918176,2016-12-03
137,2,"17:51",1071,1071,"Alize Johnson missed Three Point Jumper.",43,35,8,0.724025012417238,"Air Force","Missouri State",6,4,0,0,-3.5,400918176,2016-12-03
138,2,"17:51",1071,1071,"Zach Kocur Defensive Rebound.",43,35,8,0.724025012417238,"Air Force","Missouri State",6,4,0,0,-3.5,400918176,2016-12-03
139,2,"17:39",1059,1059,"Zach Kocur made Three Point Jumper. Assisted by Jacob Van.",46,35,11,0.82589266083284,"Air Force","Missouri State",6,4,0,0,-3.5,400918176,2016-12-03
140,2,"17:25",1045,1045,"Ryan Kreklow missed Three Point Jumper.",46,35,11,0.82200967149348,"Air Force","Missouri State",6,4,0,0,-3.5,400918176,2016-12-03
141,2,"17:25",1045,1045,"Hayden Graham Defensive Rebound.",46,35,11,0.82200967149348,"Air Force","Missouri State",6,4,0,0,-3.5,400918176,2016-12-03
142,2,"17:10",1030,1030,"Zach Kocur missed Layup.",46,35,11,0.79958845626708,"Air Force","Missouri State",6,4,0,0,-3.5,400918176,2016-12-03
143,2,"17:10",1030,1030,"Chris Kendrix Block.",46,35,11,0.79958845626708,"Air Force","Missouri State",6,4,0,0,-3.5,400918176,2016-12-03
144,2,"17:08",1028,1028,"Air Force Offensive Rebound.",46,35,11,0.825622061339242,"Air Force","Missouri State",6,4,0,0,-3.5,400918176,2016-12-03
145,2,"17:08",1028,1028,"CJ Siples Turnover.",46,35,11,0.825622061339242,"Air Force","Missouri State",6,4,0,0,-3.5,400918176,2016-12-03
146,2,"17:08",1028,1028,"Jarred Dixon Steal.",46,35,11,0.825622061339242,"Air Force","Missouri State",6,4,0,0,-3.5,400918176,2016-12-03
147,2,"17:08",1028,1028,"Ronnie Rousseau III made Layup. Assisted by Jarred Dixon.",46,37,9,0.767852864842527,"Air Force","Missouri State",6,4,0,0,-3.5,400918176,2016-12-03
148,2,"16:34",994,994,"Frank Toohey made Layup. Assisted by Jacob Van.",48,37,11,0.809680074491298,"Air Force","Missouri State",6,4,0,0,-3.5,400918176,2016-12-03
149,2,"16:16",976,976,"Jarred Dixon made Jumper.",48,39,9,0.768654644776249,"Air Force","Missouri State",6,4,0,0,-3.5,400918176,2016-12-03
150,2,"15:53",953,953,"Zach Kocur Turnover.",48,39,9,0.763199226913032,"Air Force","Missouri State",6,4,0,0,-3.5,400918176,2016-12-03
151,2,"15:52",952,952,"Official TV Timeout",48,39,9,0.763199226913032,"Air Force","Missouri State",6,4,0,0,-3.5,400918176,2016-12-03
152,2,"15:38",938,938,"Jarred Dixon missed Three Point Jumper.",48,39,9,0.784162244708159,"Air Force","Missouri State",6,4,0,0,-3.5,400918176,2016-12-03
153,2,"15:38",938,938,"Alize Johnson Offensive Rebound.",48,39,9,0.784162244708159,"Air Force","Missouri State",6,4,0,0,-3.5,400918176,2016-12-03
154,2,"15:34",934,934,"Alize Johnson made Jumper.",48,41,7,0.712451128253804,"Air Force","Missouri State",6,4,0,0,-3.5,400918176,2016-12-03
155,2,"15:01",901,901,"Zach Kocur missed Three Point Jumper.",48,41,7,0.715185191036693,"Air Force","Missouri State",6,4,0,0,-3.5,400918176,2016-12-03
156,2,"15:01",901,901,"Frank Toohey Offensive Rebound.",48,41,7,0.715185191036693,"Air Force","Missouri State",6,4,0,0,-3.5,400918176,2016-12-03
157,2,"14:59",899,899,"Foul on Alize Johnson.",48,41,7,0.728609114350286,"Air Force","Missouri State",6,4,0,0,-3.5,400918176,2016-12-03
158,2,"14:41",881,881,"Frank Toohey missed Jumper.",48,41,7,0.683734402140681,"Air Force","Missouri State",6,4,0,0,-3.5,400918176,2016-12-03
159,2,"14:41",881,881,"Alize Johnson Defensive Rebound.",48,41,7,0.683734402140681,"Air Force","Missouri State",6,4,0,0,-3.5,400918176,2016-12-03
160,2,"14:25",865,865,"Austin Ruder missed Three Point Jumper.",48,41,7,0.700531280463731,"Air Force","Missouri State",6,4,0,0,-3.5,400918176,2016-12-03
161,2,"14:25",865,865,"Hayden Graham Defensive Rebound.",48,41,7,0.700531280463731,"Air Force","Missouri State",6,4,0,0,-3.5,400918176,2016-12-03
162,2,"14:13",853,853,"Jacob Van made Three Point Jumper. Assisted by CJ Siples.",51,41,10,0.846575322493888,"Air Force","Missouri State",6,4,0,0,-3.5,400918176,2016-12-03
163,2,"13:48",828,828,"Jordan Martin made Layup. Assisted by Austin Ruder.",51,43,8,0.741636341667413,"Air Force","Missouri State",6,4,0,0,-3.5,400918176,2016-12-03
164,2,"13:20",800,800,"Frank Toohey Turnover.",51,43,8,0.777918526795286,"Air Force","Missouri State",6,4,0,0,-3.5,400918176,2016-12-03
165,2,"13:01",781,781,"Dequon Miller missed Three Point Jumper.",51,43,8,0.772042464626383,"Air Force","Missouri State",6,4,0,0,-3.5,400918176,2016-12-03
166,2,"13:01",781,781,"Hayden Graham Defensive Rebound.",51,43,8,0.772042464626383,"Air Force","Missouri State",6,4,0,0,-3.5,400918176,2016-12-03
167,2,"12:33",753,753,"Jacob Van missed Jumper.",51,43,8,0.784933908354686,"Air Force","Missouri State",6,4,0,0,-3.5,400918176,2016-12-03
168,2,"12:33",753,753,"Ryan Manning Offensive Rebound.",51,43,8,0.784933908354686,"Air Force","Missouri State",6,4,0,0,-3.5,400918176,2016-12-03
169,2,"12:31",751,751,"Foul on Jarred Dixon.",51,43,8,0.784933908354686,"Air Force","Missouri State",6,4,0,0,-3.5,400918176,2016-12-03
170,2,"12:31",751,751,"Ryan Manning made Free Throw.",52,43,9,0.81933966351517,"Air Force","Missouri State",6,4,0,0,-3.5,400918176,2016-12-03
171,2,"12:31",751,751,"Ryan Manning made Free Throw.",53,43,10,0.849298028191015,"Air Force","Missouri State",6,4,0,0,-3.5,400918176,2016-12-03
172,2,"12:05",725,725,"Ronnie Rousseau III missed Three Point Jumper.",53,43,10,0.871635537718718,"Air Force","Missouri State",6,4,0,0,-3.5,400918176,2016-12-03
173,2,"12:05",725,725,"Trevor Lyons Defensive Rebound.",53,43,10,0.871635537718718,"Air Force","Missouri State",6,4,0,0,-3.5,400918176,2016-12-03
174,2,"11:43",703,703,"Ryan Manning Turnover.",53,43,10,0.863033638161203,"Air Force","Missouri State",6,4,0,0,-3.5,400918176,2016-12-03
175,2,"11:41",701,701,"Jordan Martin Steal.",53,43,10,0.863033638161203,"Air Force","Missouri State",6,4,0,0,-3.5,400918176,2016-12-03
