"play_id","half","time_remaining_half","secs_remaining","secs_remaining_absolute","description","home_score","away_score","score_diff","win_prob","home","away","home_time_out_remaining","away_time_out_remaining","home_timeout_ind","away_timeout_ind","home_favored_by","game_id","date"
1,1,"20:00",2400,2400,"PLAY",0,0,0,0.925223133914857,"Syracuse","Colgate",4,4,0,0,22.1,400915212,2016-11-11
2,1,"20:00",2400,2400,"Jump Ball won by Syracuse",0,0,0,0.925223133914857,"Syracuse","Colgate",4,4,0,0,22.1,400915212,2016-11-11
3,1,"19:43",2383,2383,"Tyler Roberson made Dunk. Assisted by Frank Howard.",2,0,2,0.926157368280831,"Syracuse","Colgate",4,4,0,0,22.1,400915212,2016-11-11
4,1,"19:15",2355,2355,"Jordan Swopshire Turnover.",2,0,2,0.932529444498908,"Syracuse","Colgate",4,4,0,0,22.1,400915212,2016-11-11
5,1,"19:15",2355,2355,"DaJuan Coleman Steal.",2,0,2,0.932529444498908,"Syracuse","Colgate",4,4,0,0,22.1,400915212,2016-11-11
6,1,"19:03",2343,2343,"Andrew White III missed Three Point Jumper.",2,0,2,0.92477797708827,"Syracuse","Colgate",4,4,0,0,22.1,400915212,2016-11-11
7,1,"19:03",2343,2343,"Malcolm Regisford Defensive Rebound.",2,0,2,0.92477797708827,"Syracuse","Colgate",4,4,0,0,22.1,400915212,2016-11-11
8,1,"18:49",2329,2329,"Jordan Swopshire missed Three Point Jumper.",2,0,2,0.930332695420046,"Syracuse","Colgate",4,4,0,0,22.1,400915212,2016-11-11
9,1,"18:49",2329,2329,"Syracuse Defensive Rebound.",2,0,2,0.930332695420046,"Syracuse","Colgate",4,4,0,0,22.1,400915212,2016-11-11
10,1,"18:31",2311,2311,"Andrew White III Turnover.",2,0,2,0.920346862032071,"Syracuse","Colgate",4,4,0,0,22.1,400915212,2016-11-11
11,1,"18:13",2293,2293,"Jordan Robertson made Three Point Jumper. Assisted by Jordan Swopshire.",2,3,-1,0.90626698336633,"Syracuse","Colgate",4,4,0,0,22.1,400915212,2016-11-11
12,1,"17:47",2267,2267,"Tyler Roberson missed Jumper.",2,3,-1,0.907302981482344,"Syracuse","Colgate",4,4,0,0,22.1,400915212,2016-11-11
13,1,"17:47",2267,2267,"Colgate Defensive Rebound.",2,3,-1,0.907302981482344,"Syracuse","Colgate",4,4,0,0,22.1,400915212,2016-11-11
14,1,"17:26",2246,2246,"Jordan Robertson missed Three Point Jumper.",2,3,-1,0.891686686388023,"Syracuse","Colgate",4,4,0,0,22.1,400915212,2016-11-11
15,1,"17:26",2246,2246,"Frank Howard Defensive Rebound.",2,3,-1,0.891686686388023,"Syracuse","Colgate",4,4,0,0,22.1,400915212,2016-11-11
16,1,"17:19",2239,2239,"Tyler Roberson made Dunk. Assisted by Frank Howard.",4,3,1,0.919453567712215,"Syracuse","Colgate",4,4,0,0,22.1,400915212,2016-11-11
17,1,"17:05",2225,2225,"Sean O'Brien missed Three Point Jumper.",4,3,1,0.919880040792438,"Syracuse","Colgate",4,4,0,0,22.1,400915212,2016-11-11
18,1,"17:05",2225,2225,"Jordan Robertson Offensive Rebound.",4,3,1,0.919880040792438,"Syracuse","Colgate",4,4,0,0,22.1,400915212,2016-11-11
19,1,"16:59",2219,2219,"Jordan Swopshire missed Jumper.",4,3,1,0.916417852373751,"Syracuse","Colgate",4,4,0,0,22.1,400915212,2016-11-11
20,1,"16:59",2219,2219,"Andrew White III Defensive Rebound.",4,3,1,0.916417852373751,"Syracuse","Colgate",4,4,0,0,22.1,400915212,2016-11-11
21,1,"16:41",2201,2201,"Foul on Tom Rivard.",4,3,1,0.917218132378836,"Syracuse","Colgate",4,4,0,0,22.1,400915212,2016-11-11
22,1,"16:34",2194,2194,"Tyler Lydon missed Three Point Jumper.",4,3,1,0.923180409892674,"Syracuse","Colgate",4,4,0,0,22.1,400915212,2016-11-11
23,1,"16:34",2194,2194,"DaJuan Coleman Offensive Rebound.",4,3,1,0.923180409892674,"Syracuse","Colgate",4,4,0,0,22.1,400915212,2016-11-11
24,1,"16:24",2184,2184,"DaJuan Coleman missed Layup.",4,3,1,0.916832878392842,"Syracuse","Colgate",4,4,0,0,22.1,400915212,2016-11-11
25,1,"16:24",2184,2184,"Malcolm Regisford Defensive Rebound.",4,3,1,0.916832878392842,"Syracuse","Colgate",4,4,0,0,22.1,400915212,2016-11-11
26,1,"16:08",2168,2168,"Jump Ball won by Colgate",4,3,1,0.914027512175908,"Syracuse","Colgate",4,4,0,0,22.1,400915212,2016-11-11
27,1,"16:05",2165,2165,"Tom Rivard made Layup. Assisted by Sean O'Brien.",4,5,-1,0.894983407653239,"Syracuse","Colgate",4,4,0,0,22.1,400915212,2016-11-11
28,1,"15:47",2147,2147,"Andrew White III made Three Point Jumper. Assisted by Frank Howard.",7,5,2,0.92544739371576,"Syracuse","Colgate",4,4,0,0,22.1,400915212,2016-11-11
29,1,"15:24",2124,2124,"Jordan Swopshire made Three Point Jumper. Assisted by Tom Rivard.",7,8,-1,0.894245777920947,"Syracuse","Colgate",4,4,0,0,22.1,400915212,2016-11-11
30,1,"15:11",2111,2111,"Andrew White III missed Three Point Jumper.",7,8,-1,0.903611747338417,"Syracuse","Colgate",4,4,0,0,22.1,400915212,2016-11-11
31,1,"15:11",2111,2111,"Jordan Robertson Defensive Rebound.",7,8,-1,0.903611747338417,"Syracuse","Colgate",4,4,0,0,22.1,400915212,2016-11-11
32,1,"15:06",2106,2106,"Jordan Robertson Turnover.",7,8,-1,0.892074475973545,"Syracuse","Colgate",4,4,0,0,22.1,400915212,2016-11-11
33,1,"15:06",2106,2106,"Tyler Lydon Steal.",7,8,-1,0.892074475973545,"Syracuse","Colgate",4,4,0,0,22.1,400915212,2016-11-11
34,1,"15:01",2101,2101,"Tyler Roberson made Layup. Assisted by Frank Howard.",9,8,1,0.911836773541071,"Syracuse","Colgate",4,4,0,0,22.1,400915212,2016-11-11
35,1,"14:44",2084,2084,"Sean O'Brien made Three Point Jumper. Assisted by Tom Rivard.",9,11,-2,0.879682690642641,"Syracuse","Colgate",4,4,0,0,22.1,400915212,2016-11-11
36,1,"14:24",2064,2064,"Tyler Lydon missed Three Point Jumper.",9,11,-2,0.876761724446396,"Syracuse","Colgate",4,4,0,0,22.1,400915212,2016-11-11
37,1,"14:24",2064,2064,"DaJuan Coleman Offensive Rebound.",9,11,-2,0.876761724446396,"Syracuse","Colgate",4,4,0,0,22.1,400915212,2016-11-11
38,1,"14:19",2059,2059,"DaJuan Coleman made Layup.",11,11,0,0.911992637664716,"Syracuse","Colgate",4,4,0,0,22.1,400915212,2016-11-11
39,1,"13:57",2037,2037,"Jordan Robertson missed Three Point Jumper.",11,11,0,0.914019925001705,"Syracuse","Colgate",4,4,0,0,22.1,400915212,2016-11-11
40,1,"13:57",2037,2037,"Jordan Swopshire Offensive Rebound.",11,11,0,0.914019925001705,"Syracuse","Colgate",4,4,0,0,22.1,400915212,2016-11-11
41,1,"13:52",2032,2032,"Jordan Robertson missed Jumper.",11,11,0,0.914019925001705,"Syracuse","Colgate",4,4,0,0,22.1,400915212,2016-11-11
42,1,"13:52",2032,2032,"Frank Howard Defensive Rebound.",11,11,0,0.914019925001705,"Syracuse","Colgate",4,4,0,0,22.1,400915212,2016-11-11
43,1,"13:37",2017,2017,"DaJuan Coleman made Jumper. Assisted by Frank Howard.",13,11,2,0.921886832653301,"Syracuse","Colgate",4,4,0,0,22.1,400915212,2016-11-11
44,1,"13:37",2017,2017,"Malcolm Regisford missed Jumper.",13,11,2,0.921886832653301,"Syracuse","Colgate",4,4,0,0,22.1,400915212,2016-11-11
45,1,"13:37",2017,2017,"DaJuan Coleman Block.",13,11,2,0.921886832653301,"Syracuse","Colgate",4,4,0,0,22.1,400915212,2016-11-11
46,1,"13:37",2017,2017,"Tyler Lydon Defensive Rebound.",13,11,2,0.921886832653301,"Syracuse","Colgate",4,4,0,0,22.1,400915212,2016-11-11
47,1,"13:09",1989,1989,"Frank Howard made Three Point Jumper. Assisted by Tyler Lydon.",16,11,5,0.937720881294093,"Syracuse","Colgate",4,4,0,0,22.1,400915212,2016-11-11
48,1,"12:46",1966,1966,"Jordan Swopshire missed Three Point Jumper.",16,11,5,0.93972610024694,"Syracuse","Colgate",4,4,0,0,22.1,400915212,2016-11-11
49,1,"12:46",1966,1966,"Tyler Lydon Defensive Rebound.",16,11,5,0.93972610024694,"Syracuse","Colgate",4,4,0,0,22.1,400915212,2016-11-11
50,1,"12:46",1966,1966,"Foul on Tom Rivard.",16,11,5,0.93972610024694,"Syracuse","Colgate",4,4,0,0,22.1,400915212,2016-11-11
51,1,"12:46",1966,1966,"Official TV Timeout",16,11,5,0.93972610024694,"Syracuse","Colgate",4,4,0,0,22.1,400915212,2016-11-11
52,1,"12:25",1945,1945,"Tyler Roberson Turnover.",16,11,5,0.943062394844186,"Syracuse","Colgate",4,4,0,0,22.1,400915212,2016-11-11
53,1,"12:25",1945,1945,"Sean O'Brien Steal.",16,11,5,0.943062394844186,"Syracuse","Colgate",4,4,0,0,22.1,400915212,2016-11-11
54,1,"12:07",1927,1927,"Sean O'Brien made Three Point Jumper. Assisted by Jordan Robertson.",16,14,2,0.924789637002144,"Syracuse","Colgate",4,4,0,0,22.1,400915212,2016-11-11
55,1,"11:51",1911,1911,"Tyler Roberson made Layup. Assisted by Frank Howard.",18,14,4,0.9398850227832,"Syracuse","Colgate",4,4,0,0,22.1,400915212,2016-11-11
56,1,"11:30",1890,1890,"Foul on Tyler Lydon.",18,14,4,0.935086811433902,"Syracuse","Colgate",4,4,0,0,22.1,400915212,2016-11-11
57,1,"11:30",1890,1890,"Official TV Timeout",18,14,4,0.935086811433902,"Syracuse","Colgate",4,4,0,0,22.1,400915212,2016-11-11
58,1,"11:30",1890,1890,"Malcolm Regisford made Free Throw.",18,15,3,0.926436833279327,"Syracuse","Colgate",4,4,0,0,22.1,400915212,2016-11-11
59,1,"11:30",1890,1890,"Malcolm Regisford missed Free Throw.",18,15,3,0.926436833279327,"Syracuse","Colgate",4,4,0,0,22.1,400915212,2016-11-11
60,1,"11:30",1890,1890,"Colgate Offensive Rebound.",18,15,3,0.926436833279327,"Syracuse","Colgate",4,4,0,0,22.1,400915212,2016-11-11
61,1,"11:13",1873,1873,"Will Rayman missed Three Point Jumper.",18,15,3,0.925163235081334,"Syracuse","Colgate",4,4,0,0,22.1,400915212,2016-11-11
62,1,"11:13",1873,1873,"John Gillon Defensive Rebound.",18,15,3,0.925163235081334,"Syracuse","Colgate",4,4,0,0,22.1,400915212,2016-11-11
63,1,"11:04",1864,1864,"Tyler Lydon made Jumper. Assisted by John Gillon.",20,15,5,0.941672787818142,"Syracuse","Colgate",4,4,0,0,22.1,400915212,2016-11-11
64,1,"10:45",1845,1845,"Jordan Swopshire missed Three Point Jumper.",20,15,5,0.939183208689194,"Syracuse","Colgate",4,4,0,0,22.1,400915212,2016-11-11
65,1,"10:45",1845,1845,"Tyler Roberson Defensive Rebound.",20,15,5,0.939183208689194,"Syracuse","Colgate",4,4,0,0,22.1,400915212,2016-11-11
66,1,"10:36",1836,1836,"Taurean Thompson made Jumper. Assisted by John Gillon.",22,15,7,0.951770963340886,"Syracuse","Colgate",4,4,0,0,22.1,400915212,2016-11-11
67,1,"10:22",1822,1822,"Jordan Swopshire missed Three Point Jumper.",22,15,7,0.956801294174007,"Syracuse","Colgate",4,4,0,0,22.1,400915212,2016-11-11
68,1,"10:22",1822,1822,"Dana Batt Offensive Rebound.",22,15,7,0.956801294174007,"Syracuse","Colgate",4,4,0,0,22.1,400915212,2016-11-11
69,1,"10:16",1816,1816,"Will Rayman Turnover.",22,15,7,0.957094319897854,"Syracuse","Colgate",4,4,0,0,22.1,400915212,2016-11-11
70,1,"10:00",1800,1800,"Tyler Roberson missed Jumper.",22,15,7,0.953937281028933,"Syracuse","Colgate",4,4,0,0,22.1,400915212,2016-11-11
71,1,"10:00",1800,1800,"Dana Batt Defensive Rebound.",22,15,7,0.953937281028933,"Syracuse","Colgate",4,4,0,0,22.1,400915212,2016-11-11
72,1,"9:40",1780,1780,"Will Rayman missed Three Point Jumper.",22,15,7,0.949192216596003,"Syracuse","Colgate",4,4,0,0,22.1,400915212,2016-11-11
73,1,"9:40",1780,1780,"Taurean Thompson Defensive Rebound.",22,15,7,0.949192216596003,"Syracuse","Colgate",4,4,0,0,22.1,400915212,2016-11-11
74,1,"9:31",1771,1771,"Foul on Will Rayman.",22,15,7,0.948457347071845,"Syracuse","Colgate",4,4,0,0,22.1,400915212,2016-11-11
75,1,"9:25",1765,1765,"Tyus Battle missed Layup.",22,15,7,0.957560559647517,"Syracuse","Colgate",4,4,0,0,22.1,400915212,2016-11-11
76,1,"9:25",1765,1765,"Dana Batt Defensive Rebound.",22,15,7,0.957560559647517,"Syracuse","Colgate",4,4,0,0,22.1,400915212,2016-11-11
77,1,"9:15",1755,1755,"Will Rayman missed Three Point Jumper.",22,15,7,0.956871243958156,"Syracuse","Colgate",4,4,0,0,22.1,400915212,2016-11-11
78,1,"9:15",1755,1755,"Taurean Thompson Defensive Rebound.",22,15,7,0.956871243958156,"Syracuse","Colgate",4,4,0,0,22.1,400915212,2016-11-11
79,1,"9:09",1749,1749,"Foul on Sean O'Brien.",22,15,7,0.948928624559895,"Syracuse","Colgate",4,4,0,0,22.1,400915212,2016-11-11
80,1,"8:50",1730,1730,"Taurean Thompson missed Jumper.",22,15,7,0.955023021934221,"Syracuse","Colgate",4,4,0,0,22.1,400915212,2016-11-11
81,1,"8:50",1730,1730,"Dana Batt Defensive Rebound.",22,15,7,0.955023021934221,"Syracuse","Colgate",4,4,0,0,22.1,400915212,2016-11-11
82,1,"8:35",1715,1715,"Francisco Amiel missed Three Point Jumper.",22,15,7,0.957300391705756,"Syracuse","Colgate",4,4,0,0,22.1,400915212,2016-11-11
83,1,"8:35",1715,1715,"John Gillon Defensive Rebound.",22,15,7,0.957300391705756,"Syracuse","Colgate",4,4,0,0,22.1,400915212,2016-11-11
84,1,"8:27",1707,1707,"John Gillon made Layup.",24,15,9,0.960554403496333,"Syracuse","Colgate",4,4,0,0,22.1,400915212,2016-11-11
85,1,"8:14",1694,1694,"Will Rayman missed Three Point Jumper.",24,15,9,0.964983594761108,"Syracuse","Colgate",4,4,0,0,22.1,400915212,2016-11-11
86,1,"8:14",1694,1694,"Sean O'Brien Offensive Rebound.",24,15,9,0.964983594761108,"Syracuse","Colgate",4,4,0,0,22.1,400915212,2016-11-11
87,1,"8:00",1680,1680,"Francisco Amiel missed Three Point Jumper.",24,15,9,0.969764991579388,"Syracuse","Colgate",4,4,0,0,22.1,400915212,2016-11-11
88,1,"8:00",1680,1680,"Tom Rivard Offensive Rebound.",24,15,9,0.969764991579388,"Syracuse","Colgate",4,4,0,0,22.1,400915212,2016-11-11
89,1,"7:55",1675,1675,"Tom Rivard missed Jumper.",24,15,9,0.965650532867597,"Syracuse","Colgate",4,4,0,0,22.1,400915212,2016-11-11
90,1,"7:55",1675,1675,"Taurean Thompson Defensive Rebound.",24,15,9,0.965650532867597,"Syracuse","Colgate",4,4,0,0,22.1,400915212,2016-11-11
91,1,"7:50",1670,1670,"Tyler Roberson made Dunk. Assisted by John Gillon.",26,15,11,0.973746366731546,"Syracuse","Colgate",4,4,0,0,22.1,400915212,2016-11-11
92,1,"7:46",1666,1666,"Colgate  Timeout",26,15,11,0.970325671722955,"Syracuse","Colgate",3,4,1,0,22.1,400915212,2016-11-11
93,1,"7:35",1655,1655,"Will Rayman Turnover.",26,15,11,0.969840699072386,"Syracuse","Colgate",3,4,1,0,22.1,400915212,2016-11-11
94,1,"7:35",1655,1655,"Tyler Roberson Steal.",26,15,11,0.969840699072386,"Syracuse","Colgate",3,4,1,0,22.1,400915212,2016-11-11
95,1,"7:28",1648,1648,"Syracuse  Turnover.",26,15,11,0.973590798100217,"Syracuse","Colgate",3,4,1,0,22.1,400915212,2016-11-11
96,1,"7:20",1640,1640,"Sean O'Brien missed Three Point Jumper.",26,15,11,0.973590798100217,"Syracuse","Colgate",3,4,1,0,22.1,400915212,2016-11-11
97,1,"7:20",1640,1640,"Paschal Chukwu Defensive Rebound.",26,15,11,0.973590798100217,"Syracuse","Colgate",3,4,1,0,22.1,400915212,2016-11-11
98,1,"7:05",1625,1625,"Tyler Roberson made Layup. Assisted by Tyler Lydon.",28,15,13,0.979624432726742,"Syracuse","Colgate",3,4,1,0,22.1,400915212,2016-11-11
99,1,"6:56",1616,1616,"Will Rayman missed Jumper.",28,15,13,0.976897387816589,"Syracuse","Colgate",3,4,1,0,22.1,400915212,2016-11-11
100,1,"6:56",1616,1616,"Tyler Lydon Defensive Rebound.",28,15,13,0.976897387816589,"Syracuse","Colgate",3,4,1,0,22.1,400915212,2016-11-11
101,1,"6:47",1607,1607,"Tyler Lydon missed Jumper.",28,15,13,0.977680606209631,"Syracuse","Colgate",3,4,1,0,22.1,400915212,2016-11-11
102,1,"6:47",1607,1607,"Tyler Lydon Offensive Rebound.",28,15,13,0.977680606209631,"Syracuse","Colgate",3,4,1,0,22.1,400915212,2016-11-11
103,1,"6:40",1600,1600,"Foul on Will Rayman.",28,15,13,0.977680606209631,"Syracuse","Colgate",3,4,0,0,22.1,400915212,2016-11-11
104,1,"6:40",1600,1600,"Tyler Roberson made Layup. Assisted by John Gillon.",30,15,15,0.982748635698119,"Syracuse","Colgate",3,4,0,0,22.1,400915212,2016-11-11
105,1,"6:22",1582,1582,"Jordan Robertson made Three Point Jumper. Assisted by Francisco Amiel.",30,18,12,0.974389244259397,"Syracuse","Colgate",3,4,0,0,22.1,400915212,2016-11-11
106,1,"6:02",1562,1562,"Foul on Sean O'Brien.",30,18,12,0.975059984300594,"Syracuse","Colgate",3,4,0,0,22.1,400915212,2016-11-11
107,1,"5:50",1550,1550,"John Gillon missed Jumper.",30,18,12,0.974486219568244,"Syracuse","Colgate",3,4,0,0,22.1,400915212,2016-11-11
108,1,"5:50",1550,1550,"Paschal Chukwu Offensive Rebound.",30,18,12,0.974486219568244,"Syracuse","Colgate",3,4,0,0,22.1,400915212,2016-11-11
109,1,"5:47",1547,1547,"Paschal Chukwu made Layup.",32,18,14,0.98191123276392,"Syracuse","Colgate",3,4,0,0,22.1,400915212,2016-11-11
110,1,"5:21",1521,1521,"Nathan Harries missed Three Point Jumper.",32,18,14,0.981048513582524,"Syracuse","Colgate",3,4,0,0,22.1,400915212,2016-11-11
111,1,"5:21",1521,1521,"Andrew White III Defensive Rebound.",32,18,14,0.981048513582524,"Syracuse","Colgate",3,4,0,0,22.1,400915212,2016-11-11
112,1,"5:05",1505,1505,"Tyus Battle missed Three Point Jumper.",32,18,14,0.981506941625663,"Syracuse","Colgate",3,4,0,0,22.1,400915212,2016-11-11
113,1,"5:05",1505,1505,"Tom Rivard Defensive Rebound.",32,18,14,0.981506941625663,"Syracuse","Colgate",3,4,0,0,22.1,400915212,2016-11-11
114,1,"4:54",1494,1494,"Foul on Andrew White III.",32,18,14,0.981472542032025,"Syracuse","Colgate",3,4,0,0,22.1,400915212,2016-11-11
115,1,"4:54",1494,1494,"Jordan Robertson made Free Throw.",32,19,13,0.97875781087239,"Syracuse","Colgate",3,4,0,0,22.1,400915212,2016-11-11
116,1,"4:54",1494,1494,"Jordan Robertson made Free Throw.",32,20,12,0.975655170980767,"Syracuse","Colgate",3,4,0,0,22.1,400915212,2016-11-11
117,1,"4:45",1485,1485,"Tyler Lydon missed Jumper.",32,20,12,0.976946007190231,"Syracuse","Colgate",3,4,0,0,22.1,400915212,2016-11-11
118,1,"4:45",1485,1485,"Jordan Robertson Defensive Rebound.",32,20,12,0.976946007190231,"Syracuse","Colgate",3,4,0,0,22.1,400915212,2016-11-11
119,1,"4:20",1460,1460,"Malcolm Regisford made Layup. Assisted by Francisco Amiel.",32,22,10,0.961239120666589,"Syracuse","Colgate",3,4,0,0,22.1,400915212,2016-11-11
120,1,"4:08",1448,1448,"Foul on Jordan Robertson.",32,22,10,0.971658517983151,"Syracuse","Colgate",3,4,0,0,22.1,400915212,2016-11-11
121,1,"4:08",1448,1448,"Andrew White III missed Free Throw.",32,22,10,0.971658517983151,"Syracuse","Colgate",3,4,0,0,22.1,400915212,2016-11-11
122,1,"4:08",1448,1448,"Syracuse Deadball Team Rebound.",32,22,10,0.971658517983151,"Syracuse","Colgate",3,4,0,0,22.1,400915212,2016-11-11
123,1,"4:08",1448,1448,"Andrew White III made Free Throw.",33,22,11,0.97556136964356,"Syracuse","Colgate",3,4,0,0,22.1,400915212,2016-11-11
124,1,"4:08",1448,1448,"Foul on Frank Howard.",33,22,11,0.97556136964356,"Syracuse","Colgate",3,4,0,0,22.1,400915212,2016-11-11
125,1,"4:01",1441,1441,"Jordan Robertson missed Three Point Jumper.",33,22,11,0.97556136964356,"Syracuse","Colgate",3,4,0,0,22.1,400915212,2016-11-11
126,1,"4:01",1441,1441,"Taurean Thompson Defensive Rebound.",33,22,11,0.97556136964356,"Syracuse","Colgate",3,4,0,0,22.1,400915212,2016-11-11
127,1,"3:52",1432,1432,"Foul on Nathan Harries.",33,22,11,0.97138654219214,"Syracuse","Colgate",3,4,0,0,22.1,400915212,2016-11-11
128,1,"3:52",1432,1432,"Official TV Timeout",33,22,11,0.97138654219214,"Syracuse","Colgate",3,4,0,0,22.1,400915212,2016-11-11
129,1,"3:52",1432,1432,"Tyus Battle made Free Throw.",34,22,12,0.975252036074548,"Syracuse","Colgate",3,4,0,0,22.1,400915212,2016-11-11
130,1,"3:52",1432,1432,"Tyus Battle made Free Throw.",35,22,13,0.978606827286461,"Syracuse","Colgate",3,4,0,0,22.1,400915212,2016-11-11
131,1,"3:50",1430,1430,"Jordan Robertson Turnover.",35,22,13,0.978606827286461,"Syracuse","Colgate",3,4,0,0,22.1,400915212,2016-11-11
132,1,"3:50",1430,1430,"Frank Howard Steal.",35,22,13,0.978606827286461,"Syracuse","Colgate",3,4,0,0,22.1,400915212,2016-11-11
133,1,"3:32",1412,1412,"Taurean Thompson missed Jumper.",35,22,13,0.978770093932666,"Syracuse","Colgate",3,4,0,0,22.1,400915212,2016-11-11
134,1,"3:32",1412,1412,"Syracuse Deadball Team Rebound.",35,22,13,0.978770093932666,"Syracuse","Colgate",3,4,0,0,22.1,400915212,2016-11-11
135,1,"3:32",1412,1412,"Jump Ball won by Syracuse",35,22,13,0.978770093932666,"Syracuse","Colgate",3,4,0,0,22.1,400915212,2016-11-11
136,1,"3:32",1412,1412,"Andrew White III missed Three Point Jumper.",35,22,13,0.978770093932666,"Syracuse","Colgate",3,4,0,0,22.1,400915212,2016-11-11
137,1,"3:32",1412,1412,"Tyler Lydon Offensive Rebound.",35,22,13,0.978770093932666,"Syracuse","Colgate",3,4,0,0,22.1,400915212,2016-11-11
138,1,"3:30",1410,1410,"Taurean Thompson missed Jumper.",35,22,13,0.978770093932666,"Syracuse","Colgate",3,4,0,0,22.1,400915212,2016-11-11
139,1,"3:30",1410,1410,"Jordan Swopshire Defensive Rebound.",35,22,13,0.978770093932666,"Syracuse","Colgate",3,4,0,0,22.1,400915212,2016-11-11
140,1,"3:00",1380,1380,"Foul on Tyler Lydon.",35,22,13,0.980113110414721,"Syracuse","Colgate",3,4,0,0,22.1,400915212,2016-11-11
141,1,"3:00",1380,1380,"Malcolm Regisford missed Free Throw.",35,22,13,0.980113110414721,"Syracuse","Colgate",3,4,0,0,22.1,400915212,2016-11-11
142,1,"3:00",1380,1380,"Colgate Deadball Team Rebound.",35,22,13,0.980113110414721,"Syracuse","Colgate",3,4,0,0,22.1,400915212,2016-11-11
143,1,"3:00",1380,1380,"Malcolm Regisford made Free Throw.",35,23,12,0.976981266443191,"Syracuse","Colgate",3,4,0,0,22.1,400915212,2016-11-11
144,1,"2:49",1369,1369,"Andrew White III made Layup.",37,23,14,0.982742380033912,"Syracuse","Colgate",3,4,0,0,22.1,400915212,2016-11-11
145,1,"2:28",1348,1348,"Jordan Swopshire made Jumper. Assisted by Nathan Harries.",37,25,12,0.975366419483136,"Syracuse","Colgate",3,4,0,0,22.1,400915212,2016-11-11
146,1,"2:13",1333,1333,"Frank Howard made Three Point Jumper. Assisted by John Gillon.",40,25,15,0.984181455287423,"Syracuse","Colgate",3,4,0,0,22.1,400915212,2016-11-11
147,1,"2:00",1320,1320,"Foul on Frank Howard.",40,25,15,0.985784901211545,"Syracuse","Colgate",3,4,0,0,22.1,400915212,2016-11-11
148,1,"1:51",1311,1311,"Francisco Amiel missed Three Point Jumper.",40,25,15,0.986000081778093,"Syracuse","Colgate",3,4,0,0,22.1,400915212,2016-11-11
149,1,"1:51",1311,1311,"DaJuan Coleman Defensive Rebound.",40,25,15,0.986000081778093,"Syracuse","Colgate",3,4,0,0,22.1,400915212,2016-11-11
150,1,"1:43",1303,1303,"John Gillon made Three Point Jumper. Assisted by Frank Howard.",43,25,18,0.98805405213555,"Syracuse","Colgate",3,4,0,0,22.1,400915212,2016-11-11
151,1,"1:31",1291,1291,"Jordan Robertson missed Three Point Jumper.",43,25,18,0.99194157262821,"Syracuse","Colgate",3,4,0,0,22.1,400915212,2016-11-11
152,1,"1:31",1291,1291,"Syracuse Defensive Rebound.",43,25,18,0.99194157262821,"Syracuse","Colgate",3,4,0,0,22.1,400915212,2016-11-11
153,1,"1:05",1265,1265,"Tyler Roberson made Layup.",45,25,20,0.994035861640339,"Syracuse","Colgate",3,4,0,0,22.1,400915212,2016-11-11
154,1,"0:48",1248,1248,"Jordan Swopshire Turnover.",45,25,20,0.993126533932465,"Syracuse","Colgate",3,4,0,0,22.1,400915212,2016-11-11
155,1,"0:41",1241,1241,"John Gillon made Jumper.",47,25,22,0.994947842918642,"Syracuse","Colgate",3,4,0,0,22.1,400915212,2016-11-11
156,1,"0:28",1228,1228,"Francisco Amiel Turnover.",47,25,22,0.996078964936987,"Syracuse","Colgate",3,4,0,0,22.1,400915212,2016-11-11
157,1,"0:28",1228,1228,"John Gillon Steal.",47,25,22,0.996078964936987,"Syracuse","Colgate",3,4,0,0,22.1,400915212,2016-11-11
158,1,"0:25",1225,1225,"John Gillon made Layup.",49,25,24,0.997199101261216,"Syracuse","Colgate",3,4,0,0,22.1,400915212,2016-11-11
159,1,"0:17",1217,1217,"Foul on DaJuan Coleman.",49,25,24,0.996678349156252,"Syracuse","Colgate",3,4,0,0,22.1,400915212,2016-11-11
160,1,"0:17",1217,1217,"Will Rayman missed Free Throw.",49,25,24,0.996678349156252,"Syracuse","Colgate",3,4,0,0,22.1,400915212,2016-11-11
161,1,"0:17",1217,1217,"Will Rayman Offensive Rebound.",49,25,24,0.996678349156252,"Syracuse","Colgate",3,4,0,0,22.1,400915212,2016-11-11
162,1,"0:05",1205,1205,"Foul on DaJuan Coleman.",49,25,24,0.996464018240537,"Syracuse","Colgate",3,4,0,0,22.1,400915212,2016-11-11
163,1,"0:05",1205,1205,"Foul on Taurean Thompson.",49,25,24,0.996464018240537,"Syracuse","Colgate",3,4,0,0,22.1,400915212,2016-11-11
164,1,"0:05",1205,1205,"Will Rayman missed Free Throw.",49,25,24,0.996464018240537,"Syracuse","Colgate",3,4,0,0,22.1,400915212,2016-11-11
165,1,"0:05",1205,1205,"DaJuan Coleman Defensive Rebound.",49,25,24,0.996464018240537,"Syracuse","Colgate",3,4,0,0,22.1,400915212,2016-11-11
166,1,"0:00",1200,1200,"End of 1st half",49,25,24,0.996464018240537,"Syracuse","Colgate",3,4,0,0,22.1,400915212,2016-11-11
167,2,"20:00",1200,1200,"PLAY",49,25,24,0.996464018240537,"Syracuse","Colgate",4,4,0,0,22.1,400915212,2016-11-11
168,2,"20:00",1200,1200,"Jump Ball won by Colgate",49,25,24,0.996464018240537,"Syracuse","Colgate",4,4,0,0,22.1,400915212,2016-11-11
169,2,"19:39",1179,1179,"Jordan Swopshire missed Jumper.",49,25,24,0.996559842263433,"Syracuse","Colgate",4,4,0,0,22.1,400915212,2016-11-11
170,2,"19:39",1179,1179,"DaJuan Coleman Defensive Rebound.",49,25,24,0.996559842263433,"Syracuse","Colgate",4,4,0,0,22.1,400915212,2016-11-11
171,2,"19:39",1179,1179,"Foul on Malcolm Regisford.",49,25,24,0.996559842263433,"Syracuse","Colgate",4,4,0,0,22.1,400915212,2016-11-11
172,2,"19:25",1165,1165,"Andrew White III made Three Point Jumper. Assisted by DaJuan Coleman.",52,25,27,0.998086612131234,"Syracuse","Colgate",4,4,0,0,22.1,400915212,2016-11-11
173,2,"19:16",1156,1156,"Jordan Swopshire missed Three Point Jumper.",52,25,27,0.99775106410101,"Syracuse","Colgate",4,4,0,0,22.1,400915212,2016-11-11
174,2,"19:16",1156,1156,"Frank Howard Defensive Rebound.",52,25,27,0.99775106410101,"Syracuse","Colgate",4,4,0,0,22.1,400915212,2016-11-11
175,2,"19:06",1146,1146,"Frank Howard made Jumper.",54,25,29,0.998731447406923,"Syracuse","Colgate",4,4,0,0,22.1,400915212,2016-11-11
176,2,"18:55",1135,1135,"Colgate  Timeout",54,25,29,0.998583452880985,"Syracuse","Colgate",3,4,1,0,22.1,400915212,2016-11-11
177,2,"18:50",1130,1130,"Jordan Robertson Turnover.",54,25,29,0.998583452880985,"Syracuse","Colgate",3,4,1,0,22.1,400915212,2016-11-11
178,2,"18:50",1130,1130,"Frank Howard Steal.",54,25,29,0.998583452880985,"Syracuse","Colgate",3,4,1,0,22.1,400915212,2016-11-11
179,2,"18:43",1123,1123,"Tyler Roberson missed Layup.",54,25,29,0.999218365775752,"Syracuse","Colgate",3,4,1,0,22.1,400915212,2016-11-11
180,2,"18:43",1123,1123,"DaJuan Coleman Offensive Rebound.",54,25,29,0.999218365775752,"Syracuse","Colgate",3,4,1,0,22.1,400915212,2016-11-11
181,2,"18:40",1120,1120,"Foul on Tom Rivard.",54,25,29,0.999218365775752,"Syracuse","Colgate",3,4,1,0,22.1,400915212,2016-11-11
182,2,"18:38",1118,1118,"Frank Howard Turnover.",54,25,29,0.998772328456586,"Syracuse","Colgate",3,4,1,0,22.1,400915212,2016-11-11
183,2,"18:38",1118,1118,"Tom Rivard Steal.",54,25,29,0.998772328456586,"Syracuse","Colgate",3,4,1,0,22.1,400915212,2016-11-11
