"play_id","half","time_remaining_half","secs_remaining","secs_remaining_absolute","description","home_score","away_score","score_diff","win_prob","home","away","home_time_out_remaining","away_time_out_remaining","home_timeout_ind","away_timeout_ind","home_favored_by","game_id","date"
1,1,"20:00",2400,2400,"PLAY",0,0,0,0.150219768484353,"Marist","Rider",4,4,0,0,-9.5,400991185,2018-02-10
2,1,"19:35",2375,2375,"Ryan Funk made Three Point Jumper. Assisted by David Knudsen.",3,0,3,0.218657413430583,"Marist","Rider",4,4,0,0,-9.5,400991185,2018-02-10
3,1,"19:12",2352,2352,"Dimencio Vaughn missed Jumper.",3,0,3,0.216227715755421,"Marist","Rider",4,4,0,0,-9.5,400991185,2018-02-10
4,1,"19:12",2352,2352,"Brian Parker Defensive Rebound.",3,0,3,0.216227715755421,"Marist","Rider",4,4,0,0,-9.5,400991185,2018-02-10
5,1,"19:03",2343,2343,"Ryan Funk missed Three Point Jumper.",3,0,3,0.211143985584161,"Marist","Rider",4,4,0,0,-9.5,400991185,2018-02-10
6,1,"19:03",2343,2343,"Jordan Allen Defensive Rebound.",3,0,3,0.211143985584161,"Marist","Rider",4,4,0,0,-9.5,400991185,2018-02-10
7,1,"18:53",2333,2333,"Stevie Jordan Turnover.",3,0,3,0.213293329912208,"Marist","Rider",4,4,0,0,-9.5,400991185,2018-02-10
8,1,"18:52",2332,2332,"David Knudsen Steal.",3,0,3,0.213293329912208,"Marist","Rider",4,4,0,0,-9.5,400991185,2018-02-10
9,1,"18:41",2321,2321,"Brian Parker missed Three Point Jumper.",3,0,3,0.23777362257062,"Marist","Rider",4,4,0,0,-9.5,400991185,2018-02-10
10,1,"18:41",2321,2321,"Rider Deadball Team Rebound.",3,0,3,0.23777362257062,"Marist","Rider",4,4,0,0,-9.5,400991185,2018-02-10
11,1,"18:23",2303,2303,"Tyere Marshall made Jumper.",3,2,1,0.187578239319941,"Marist","Rider",4,4,0,0,-9.5,400991185,2018-02-10
12,1,"18:03",2283,2283,"Brian Parker Turnover.",3,2,1,0.183764014203924,"Marist","Rider",4,4,0,0,-9.5,400991185,2018-02-10
13,1,"18:02",2282,2282,"Stevie Jordan Steal.",3,2,1,0.183764014203924,"Marist","Rider",4,4,0,0,-9.5,400991185,2018-02-10
14,1,"18:00",2280,2280,"Stevie Jordan made Layup.",3,4,-1,0.154369713865601,"Marist","Rider",4,4,0,0,-9.5,400991185,2018-02-10
15,1,"17:33",2253,2253,"David Knudsen made Three Point Jumper. Assisted by Ryan Funk.",6,4,2,0.216154094283526,"Marist","Rider",4,4,0,0,-9.5,400991185,2018-02-10
16,1,"17:15",2235,2235,"Tyere Marshall missed Jumper.",6,4,2,0.210835092057868,"Marist","Rider",4,4,0,0,-9.5,400991185,2018-02-10
17,1,"17:15",2235,2235,"Brian Parker Defensive Rebound.",6,4,2,0.210835092057868,"Marist","Rider",4,4,0,0,-9.5,400991185,2018-02-10
18,1,"17:05",2225,2225,"Ryan Funk missed Three Point Jumper.",6,4,2,0.207221644617268,"Marist","Rider",4,4,0,0,-9.5,400991185,2018-02-10
19,1,"17:05",2225,2225,"Tobias Sjoberg Offensive Rebound.",6,4,2,0.207221644617268,"Marist","Rider",4,4,0,0,-9.5,400991185,2018-02-10
20,1,"17:04",2224,2224,"Tobias Sjoberg missed Two Point Tip Shot.",6,4,2,0.207221644617268,"Marist","Rider",4,4,0,0,-9.5,400991185,2018-02-10
21,1,"17:00",2220,2220,"Tobias Sjoberg Offensive Rebound.",6,4,2,0.207221644617268,"Marist","Rider",4,4,0,0,-9.5,400991185,2018-02-10
22,1,"16:58",2218,2218,"Foul on Isaiah Lamb.",6,4,2,0.23671432323294,"Marist","Rider",4,4,0,0,-9.5,400991185,2018-02-10
23,1,"16:58",2218,2218,"Isaiah Lamb Turnover.",6,4,2,0.23671432323294,"Marist","Rider",4,4,0,0,-9.5,400991185,2018-02-10
24,1,"16:44",2204,2204,"Foul on Tobias Sjoberg.",6,4,2,0.217384491475363,"Marist","Rider",4,4,0,0,-9.5,400991185,2018-02-10
25,1,"16:42",2202,2202,"Jordan Allen missed Jumper.",6,4,2,0.217384491475363,"Marist","Rider",4,4,0,0,-9.5,400991185,2018-02-10
26,1,"16:42",2202,2202,"Stevie Jordan Offensive Rebound.",6,4,2,0.217384491475363,"Marist","Rider",4,4,0,0,-9.5,400991185,2018-02-10
27,1,"16:40",2200,2200,"Stevie Jordan made Layup.",6,6,0,0.181341177057451,"Marist","Rider",4,4,0,0,-9.5,400991185,2018-02-10
28,1,"16:08",2168,2168,"Brian Parker missed Layup.",6,6,0,0.18113592856495,"Marist","Rider",4,4,0,0,-9.5,400991185,2018-02-10
29,1,"16:08",2168,2168,"Tobias Sjoberg Offensive Rebound.",6,6,0,0.18113592856495,"Marist","Rider",4,4,0,0,-9.5,400991185,2018-02-10
30,1,"16:04",2164,2164,"David Knudsen missed Three Point Jumper.",6,6,0,0.18113592856495,"Marist","Rider",4,4,0,0,-9.5,400991185,2018-02-10
31,1,"16:04",2164,2164,"Tyere Marshall Defensive Rebound.",6,6,0,0.18113592856495,"Marist","Rider",4,4,0,0,-9.5,400991185,2018-02-10
32,1,"15:45",2145,2145,"Jordan Allen missed Jumper.",6,6,0,0.182446269525064,"Marist","Rider",4,4,0,0,-9.5,400991185,2018-02-10
33,1,"15:45",2145,2145,"Isaiah Lamb Defensive Rebound.",6,6,0,0.182446269525064,"Marist","Rider",4,4,0,0,-9.5,400991185,2018-02-10
34,1,"15:33",2133,2133,"David Knudsen made Three Point Jumper. Assisted by Isaiah Lamb.",9,6,3,0.233961508406195,"Marist","Rider",4,4,0,0,-9.5,400991185,2018-02-10
35,1,"15:30",2130,2130,"Rider  Timeout",9,6,3,0.233961508406195,"Marist","Rider",3,4,1,0,-9.5,400991185,2018-02-10
36,1,"15:20",2120,2120,"Frederick Scott missed Three Point Jumper.",9,6,3,0.229364735810546,"Marist","Rider",3,4,1,0,-9.5,400991185,2018-02-10
37,1,"15:20",2120,2120,"Connor McClenaghan Defensive Rebound.",9,6,3,0.229364735810546,"Marist","Rider",3,4,1,0,-9.5,400991185,2018-02-10
38,1,"14:55",2095,2095,"Lasse Gummerus made Three Point Jumper. Assisted by David Knudsen.",12,6,6,0.324917674313944,"Marist","Rider",3,4,1,0,-9.5,400991185,2018-02-10
39,1,"14:32",2072,2072,"Tyere Marshall missed Jumper.",12,6,6,0.278074695608562,"Marist","Rider",3,4,1,0,-9.5,400991185,2018-02-10
40,1,"14:32",2072,2072,"Dimencio Vaughn Offensive Rebound.",12,6,6,0.278074695608562,"Marist","Rider",3,4,1,0,-9.5,400991185,2018-02-10
41,1,"14:28",2068,2068,"Dimencio Vaughn missed Layup.",12,6,6,0.304289250744645,"Marist","Rider",3,4,0,0,-9.5,400991185,2018-02-10
42,1,"14:28",2068,2068,"Connor McClenaghan Block.",12,6,6,0.304289250744645,"Marist","Rider",3,4,0,0,-9.5,400991185,2018-02-10
43,1,"14:26",2066,2066,"Austin Williams Defensive Rebound.",12,6,6,0.304289250744645,"Marist","Rider",3,4,0,0,-9.5,400991185,2018-02-10
44,1,"14:25",2065,2065,"Austin Williams Turnover.",12,6,6,0.304289250744645,"Marist","Rider",3,4,0,0,-9.5,400991185,2018-02-10
45,1,"14:24",2064,2064,"Frederick Scott Steal.",12,6,6,0.304289250744645,"Marist","Rider",3,4,0,0,-9.5,400991185,2018-02-10
46,1,"14:20",2060,2060,"Frederick Scott made Layup. Assisted by Tyere Marshall.",12,8,4,0.255821515620824,"Marist","Rider",3,4,0,0,-9.5,400991185,2018-02-10
47,1,"13:55",2035,2035,"Connor McClenaghan made Three Point Jumper. Assisted by Austin Williams.",15,8,7,0.315526822292672,"Marist","Rider",3,4,0,0,-9.5,400991185,2018-02-10
48,1,"13:46",2026,2026,"Dimencio Vaughn missed Jumper.",15,8,7,0.345656067856362,"Marist","Rider",3,4,0,0,-9.5,400991185,2018-02-10
49,1,"13:46",2026,2026,"Connor McClenaghan Defensive Rebound.",15,8,7,0.345656067856362,"Marist","Rider",3,4,0,0,-9.5,400991185,2018-02-10
50,1,"13:19",1999,1999,"Connor McClenaghan made Three Point Jumper. Assisted by Lasse Gummerus.",18,8,10,0.44514657349602,"Marist","Rider",3,4,0,0,-9.5,400991185,2018-02-10
51,1,"12:55",1975,1975,"Foul on Isaiah Lamb.",18,8,10,0.431494452544626,"Marist","Rider",3,4,0,0,-9.5,400991185,2018-02-10
52,1,"12:51",1971,1971,"Jordan Allen Turnover.",18,8,10,0.431494452544626,"Marist","Rider",3,4,0,0,-9.5,400991185,2018-02-10
53,1,"12:31",1951,1951,"Connor McClenaghan made Jumper.",20,8,12,0.528157447459915,"Marist","Rider",3,4,0,0,-9.5,400991185,2018-02-10
54,1,"12:17",1937,1937,"Stevie Jordan made Layup.",20,10,10,0.450019178829377,"Marist","Rider",3,4,0,0,-9.5,400991185,2018-02-10
55,1,"11:49",1909,1909,"Austin Williams Turnover.",20,10,10,0.413548421053485,"Marist","Rider",3,4,0,0,-9.5,400991185,2018-02-10
56,1,"11:49",1909,1909,"Stevie Jordan Steal.",20,10,10,0.413548421053485,"Marist","Rider",3,4,0,0,-9.5,400991185,2018-02-10
57,1,"11:46",1906,1906,"Dimencio Vaughn made Layup. Assisted by Jordan Allen.",20,12,8,0.358173651034736,"Marist","Rider",3,4,0,0,-9.5,400991185,2018-02-10
58,1,"11:34",1894,1894,"Brian Parker missed Jumper.",20,12,8,0.425987260236251,"Marist","Rider",3,4,0,0,-9.5,400991185,2018-02-10
59,1,"11:34",1894,1894,"Dimencio Vaughn Block.",20,12,8,0.425987260236251,"Marist","Rider",3,4,0,0,-9.5,400991185,2018-02-10
60,1,"11:31",1891,1891,"Marist Offensive Rebound.",20,12,8,0.425987260236251,"Marist","Rider",3,4,0,0,-9.5,400991185,2018-02-10
61,1,"11:31",1891,1891,"Official TV Timeout",20,12,8,0.425987260236251,"Marist","Rider",3,4,0,0,-9.5,400991185,2018-02-10
62,1,"11:15",1875,1875,"Connor McClenaghan missed Three Point Jumper.",20,12,8,0.384517287744179,"Marist","Rider",3,4,0,0,-9.5,400991185,2018-02-10
63,1,"11:15",1875,1875,"Devine Eke Block.",20,12,8,0.384517287744179,"Marist","Rider",3,4,0,0,-9.5,400991185,2018-02-10
64,1,"11:11",1871,1871,"Dimencio Vaughn Defensive Rebound.",20,12,8,0.384517287744179,"Marist","Rider",3,4,0,0,-9.5,400991185,2018-02-10
65,1,"11:07",1867,1867,"Jordan Allen missed Three Point Jumper.",20,12,8,0.444522274148414,"Marist","Rider",3,4,0,0,-9.5,400991185,2018-02-10
66,1,"11:07",1867,1867,"Marist Defensive Rebound.",20,12,8,0.444522274148414,"Marist","Rider",3,4,0,0,-9.5,400991185,2018-02-10
67,1,"10:50",1850,1850,"Brian Parker missed Layup.",20,12,8,0.410060514865315,"Marist","Rider",3,4,0,0,-9.5,400991185,2018-02-10
68,1,"10:50",1850,1850,"Dimencio Vaughn Block.",20,12,8,0.410060514865315,"Marist","Rider",3,4,0,0,-9.5,400991185,2018-02-10
69,1,"10:48",1848,1848,"Frederick Scott Defensive Rebound.",20,12,8,0.359562525442738,"Marist","Rider",3,4,0,0,-9.5,400991185,2018-02-10
70,1,"10:45",1845,1845,"Foul on Connor McClenaghan.",20,12,8,0.359562525442738,"Marist","Rider",3,4,0,0,-9.5,400991185,2018-02-10
71,1,"10:45",1845,1845,"Frederick Scott made Free Throw.",20,13,7,0.331563866591045,"Marist","Rider",3,4,0,0,-9.5,400991185,2018-02-10
72,1,"10:45",1845,1845,"Frederick Scott missed Free Throw.",20,13,7,0.331563866591045,"Marist","Rider",3,4,0,0,-9.5,400991185,2018-02-10
73,1,"10:45",1845,1845,"Lasse Gummerus Defensive Rebound.",20,13,7,0.331563866591045,"Marist","Rider",3,4,0,0,-9.5,400991185,2018-02-10
74,1,"10:28",1828,1828,"Connor McClenaghan Turnover.",20,13,7,0.365536064994395,"Marist","Rider",3,4,0,0,-9.5,400991185,2018-02-10
75,1,"10:17",1817,1817,"Devine Eke made Layup. Assisted by Stevie Jordan.",20,15,5,0.3311010860376,"Marist","Rider",3,4,0,0,-9.5,400991185,2018-02-10
76,1,"10:00",1800,1800,"Lasse Gummerus missed Three Point Jumper.",20,15,5,0.302856735380229,"Marist","Rider",3,4,0,0,-9.5,400991185,2018-02-10
77,1,"10:00",1800,1800,"Dimencio Vaughn Defensive Rebound.",20,15,5,0.302856735380229,"Marist","Rider",3,4,0,0,-9.5,400991185,2018-02-10
78,1,"9:53",1793,1793,"Dimencio Vaughn missed Jumper.",20,15,5,0.316164187172117,"Marist","Rider",3,4,0,0,-9.5,400991185,2018-02-10
79,1,"9:53",1793,1793,"Frederick Scott Offensive Rebound.",20,15,5,0.316164187172117,"Marist","Rider",3,4,0,0,-9.5,400991185,2018-02-10
80,1,"9:47",1787,1787,"Stevie Jordan missed Jumper.",20,15,5,0.322765927367351,"Marist","Rider",3,4,0,0,-9.5,400991185,2018-02-10
81,1,"9:47",1787,1787,"David Knudsen Block.",20,15,5,0.322765927367351,"Marist","Rider",3,4,0,0,-9.5,400991185,2018-02-10
82,1,"9:44",1784,1784,"Brian Parker Defensive Rebound.",20,15,5,0.322765927367351,"Marist","Rider",3,4,0,0,-9.5,400991185,2018-02-10
83,1,"9:40",1780,1780,"Foul on Frederick Scott.",20,15,5,0.322765927367351,"Marist","Rider",3,4,0,0,-9.5,400991185,2018-02-10
84,1,"9:28",1768,1768,"Ryan Funk made Three Point Jumper. Assisted by David Knudsen.",23,15,8,0.389492533891556,"Marist","Rider",3,4,0,0,-9.5,400991185,2018-02-10
85,1,"9:14",1754,1754,"Jordan Allen missed Three Point Jumper.",23,15,8,0.372854542229365,"Marist","Rider",3,4,0,0,-9.5,400991185,2018-02-10
86,1,"9:14",1754,1754,"Tobias Sjoberg Defensive Rebound.",23,15,8,0.372854542229365,"Marist","Rider",3,4,0,0,-9.5,400991185,2018-02-10
87,1,"9:04",1744,1744,"Foul on Devine Eke.",23,15,8,0.436278723960364,"Marist","Rider",3,4,0,0,-9.5,400991185,2018-02-10
88,1,"8:53",1733,1733,"Brian Parker missed Layup.",23,15,8,0.419666863174139,"Marist","Rider",3,4,0,0,-9.5,400991185,2018-02-10
89,1,"8:53",1733,1733,"Tyere Marshall Block.",23,15,8,0.419666863174139,"Marist","Rider",3,4,0,0,-9.5,400991185,2018-02-10
90,1,"8:52",1732,1732,"Stevie Jordan Defensive Rebound.",23,15,8,0.419666863174139,"Marist","Rider",3,4,0,0,-9.5,400991185,2018-02-10
91,1,"8:27",1707,1707,"Tyere Marshall missed Layup.",23,15,8,0.393574533127151,"Marist","Rider",3,4,0,0,-9.5,400991185,2018-02-10
92,1,"8:27",1707,1707,"Brian Parker Defensive Rebound.",23,15,8,0.393574533127151,"Marist","Rider",3,4,0,0,-9.5,400991185,2018-02-10
93,1,"8:20",1700,1700,"Ryan Funk missed Layup.",23,15,8,0.393574533127151,"Marist","Rider",3,4,0,0,-9.5,400991185,2018-02-10
94,1,"8:20",1700,1700,"Devine Eke Block.",23,15,8,0.393574533127151,"Marist","Rider",3,4,0,0,-9.5,400991185,2018-02-10
95,1,"8:19",1699,1699,"Anthony Durham Defensive Rebound.",23,15,8,0.463096728818162,"Marist","Rider",3,4,0,0,-9.5,400991185,2018-02-10
96,1,"8:04",1684,1684,"Stevie Jordan missed Jumper.",23,15,8,0.423282175947501,"Marist","Rider",3,4,0,0,-9.5,400991185,2018-02-10
97,1,"8:04",1684,1684,"Brian Parker Defensive Rebound.",23,15,8,0.423282175947501,"Marist","Rider",3,4,0,0,-9.5,400991185,2018-02-10
98,1,"8:01",1681,1681,"Isaiah Lamb made Dunk. Assisted by Brian Parker.",25,15,10,0.495349869044853,"Marist","Rider",3,4,0,0,-9.5,400991185,2018-02-10
99,1,"7:38",1658,1658,"Anthony Durham missed Jumper.",25,15,10,0.506578523447205,"Marist","Rider",3,4,0,0,-9.5,400991185,2018-02-10
100,1,"7:38",1658,1658,"Tobias Sjoberg Defensive Rebound.",25,15,10,0.506578523447205,"Marist","Rider",3,4,0,0,-9.5,400991185,2018-02-10
101,1,"7:25",1645,1645,"Tobias Sjoberg made Layup. Assisted by Brian Parker.",27,15,12,0.579997976438955,"Marist","Rider",3,4,0,0,-9.5,400991185,2018-02-10
102,1,"7:25",1645,1645,"Foul on Anthony Durham.",27,15,12,0.579997976438955,"Marist","Rider",3,4,0,0,-9.5,400991185,2018-02-10
103,1,"7:25",1645,1645,"Official TV Timeout",27,15,12,0.579997976438955,"Marist","Rider",3,4,0,0,-9.5,400991185,2018-02-10
104,1,"7:25",1645,1645,"Tobias Sjoberg made Free Throw.",28,15,13,0.61349407127686,"Marist","Rider",3,4,0,0,-9.5,400991185,2018-02-10
105,1,"7:09",1629,1629,"Dimencio Vaughn made Jumper.",28,17,11,0.535415302284437,"Marist","Rider",3,4,0,0,-9.5,400991185,2018-02-10
106,1,"6:42",1602,1602,"Lasse Gummerus made Three Point Jumper. Assisted by Brian Parker.",31,17,14,0.593065999957938,"Marist","Rider",3,4,0,0,-9.5,400991185,2018-02-10
107,1,"6:09",1569,1569,"Dimencio Vaughn missed Three Point Jumper.",31,17,14,0.641953199664178,"Marist","Rider",3,4,0,0,-9.5,400991185,2018-02-10
108,1,"6:09",1569,1569,"Connor McClenaghan Defensive Rebound.",31,17,14,0.641953199664178,"Marist","Rider",3,4,0,0,-9.5,400991185,2018-02-10
109,1,"5:46",1546,1546,"Brian Parker made Jumper.",33,17,16,0.70228925310065,"Marist","Rider",3,4,0,0,-9.5,400991185,2018-02-10
110,1,"5:26",1526,1526,"Frederick Scott missed Jumper.",33,17,16,0.725712731658052,"Marist","Rider",3,4,0,0,-9.5,400991185,2018-02-10
111,1,"5:26",1526,1526,"Lasse Gummerus Defensive Rebound.",33,17,16,0.725712731658052,"Marist","Rider",3,4,0,0,-9.5,400991185,2018-02-10
112,1,"5:12",1512,1512,"Brian Parker Turnover.",33,17,16,0.771515362788811,"Marist","Rider",3,4,0,0,-9.5,400991185,2018-02-10
113,1,"5:09",1509,1509,"Kealen Washington-Ives missed Layup.",33,17,16,0.719773713136927,"Marist","Rider",3,4,0,0,-9.5,400991185,2018-02-10
114,1,"5:09",1509,1509,"Stevie Jordan Offensive Rebound.",33,17,16,0.719773713136927,"Marist","Rider",3,4,0,0,-9.5,400991185,2018-02-10
115,1,"5:07",1507,1507,"Stevie Jordan missed Two Point Tip Shot.",33,17,16,0.719773713136927,"Marist","Rider",3,4,0,0,-9.5,400991185,2018-02-10
116,1,"5:07",1507,1507,"Brian Parker Defensive Rebound.",33,17,16,0.719773713136927,"Marist","Rider",3,4,0,0,-9.5,400991185,2018-02-10
117,1,"4:50",1490,1490,"Foul on Dimencio Vaughn.",33,17,16,0.735442226134482,"Marist","Rider",3,4,0,0,-9.5,400991185,2018-02-10
118,1,"4:38",1478,1478,"David Knudsen missed Three Point Jumper.",33,17,16,0.725877169119985,"Marist","Rider",3,4,0,0,-9.5,400991185,2018-02-10
119,1,"4:38",1478,1478,"Tyere Marshall Defensive Rebound.",33,17,16,0.725877169119985,"Marist","Rider",3,4,0,0,-9.5,400991185,2018-02-10
120,1,"4:23",1463,1463,"Stevie Jordan made Three Point Jumper.",33,20,13,0.670899706123969,"Marist","Rider",3,4,0,0,-9.5,400991185,2018-02-10
121,1,"3:54",1434,1434,"Lasse Gummerus missed Three Point Jumper.",33,20,13,0.684385754178213,"Marist","Rider",3,4,0,0,-9.5,400991185,2018-02-10
122,1,"3:54",1434,1434,"Kealen Washington-Ives Defensive Rebound.",33,20,13,0.684385754178213,"Marist","Rider",3,4,0,0,-9.5,400991185,2018-02-10
123,1,"3:41",1421,1421,"Foul on Lasse Gummerus.",33,20,13,0.647859355688674,"Marist","Rider",3,4,0,0,-9.5,400991185,2018-02-10
124,1,"3:41",1421,1421,"Official TV Timeout",33,20,13,0.647859355688674,"Marist","Rider",3,4,0,0,-9.5,400991185,2018-02-10
125,1,"3:41",1421,1421,"Frederick Scott made Free Throw.",33,21,12,0.614175955508021,"Marist","Rider",3,4,0,0,-9.5,400991185,2018-02-10
126,1,"3:41",1421,1421,"Frederick Scott missed Free Throw.",33,21,12,0.614175955508021,"Marist","Rider",3,4,0,0,-9.5,400991185,2018-02-10
127,1,"3:41",1421,1421,"Lasse Gummerus Defensive Rebound.",33,21,12,0.614175955508021,"Marist","Rider",3,4,0,0,-9.5,400991185,2018-02-10
128,1,"3:15",1395,1395,"Ryan Funk made Three Point Jumper. Assisted by David Knudsen.",36,21,15,0.703432472769948,"Marist","Rider",3,4,0,0,-9.5,400991185,2018-02-10
129,1,"2:53",1373,1373,"Dimencio Vaughn missed Three Point Jumper.",36,21,15,0.690498306761164,"Marist","Rider",3,4,0,0,-9.5,400991185,2018-02-10
130,1,"2:53",1373,1373,"Tobias Sjoberg Defensive Rebound.",36,21,15,0.690498306761164,"Marist","Rider",3,4,0,0,-9.5,400991185,2018-02-10
131,1,"2:27",1347,1347,"Foul on Stevie Jordan.",36,21,15,0.760292720882202,"Marist","Rider",3,4,0,0,-9.5,400991185,2018-02-10
132,1,"2:19",1339,1339,"Brian Parker missed Three Point Jumper.",36,21,15,0.740466464099114,"Marist","Rider",3,4,0,0,-9.5,400991185,2018-02-10
133,1,"2:19",1339,1339,"Frederick Scott Defensive Rebound.",36,21,15,0.740466464099114,"Marist","Rider",3,4,0,0,-9.5,400991185,2018-02-10
134,1,"2:04",1324,1324,"Frederick Scott missed Three Point Jumper.",36,21,15,0.751204032072286,"Marist","Rider",3,4,0,0,-9.5,400991185,2018-02-10
135,1,"2:04",1324,1324,"Stevie Jordan Offensive Rebound.",36,21,15,0.751204032072286,"Marist","Rider",3,4,0,0,-9.5,400991185,2018-02-10
136,1,"2:02",1322,1322,"Foul on Brian Parker.",36,21,15,0.751204032072286,"Marist","Rider",3,4,0,0,-9.5,400991185,2018-02-10
137,1,"2:02",1322,1322,"Frederick Scott made Free Throw.",36,22,14,0.720599825661193,"Marist","Rider",3,4,0,0,-9.5,400991185,2018-02-10
138,1,"2:02",1322,1322,"Frederick Scott missed Free Throw.",36,22,14,0.720599825661193,"Marist","Rider",3,4,0,0,-9.5,400991185,2018-02-10
139,1,"2:02",1322,1322,"Lasse Gummerus Defensive Rebound.",36,22,14,0.720599825661193,"Marist","Rider",3,4,0,0,-9.5,400991185,2018-02-10
140,1,"1:42",1302,1302,"Ryan Funk missed Three Point Jumper.",36,22,14,0.718817675950975,"Marist","Rider",3,4,0,0,-9.5,400991185,2018-02-10
141,1,"1:42",1302,1302,"David Knudsen Offensive Rebound.",36,22,14,0.718817675950975,"Marist","Rider",3,4,0,0,-9.5,400991185,2018-02-10
142,1,"1:35",1295,1295,"David Knudsen Turnover.",36,22,14,0.791023083377401,"Marist","Rider",3,4,0,0,-9.5,400991185,2018-02-10
143,1,"1:34",1294,1294,"Frederick Scott Steal.",36,22,14,0.791023083377401,"Marist","Rider",3,4,0,0,-9.5,400991185,2018-02-10
144,1,"1:20",1280,1280,"Foul on David Knudsen.",36,22,14,0.687439846985546,"Marist","Rider",3,4,0,0,-9.5,400991185,2018-02-10
145,1,"1:20",1280,1280,"Stevie Jordan missed Free Throw.",36,22,14,0.687439846985546,"Marist","Rider",3,4,0,0,-9.5,400991185,2018-02-10
146,1,"1:20",1280,1280,"Lasse Gummerus Defensive Rebound.",36,22,14,0.687439846985546,"Marist","Rider",3,4,0,0,-9.5,400991185,2018-02-10
147,1,"1:07",1267,1267,"Lasse Gummerus made Three Point Jumper. Assisted by Brian Parker.",39,22,17,0.816609921068592,"Marist","Rider",3,4,0,0,-9.5,400991185,2018-02-10
148,1,"0:50",1250,1250,"Tyere Marshall made Layup. Assisted by Anthony Durham.",39,24,15,0.756049911302246,"Marist","Rider",3,4,0,0,-9.5,400991185,2018-02-10
149,1,"0:20",1220,1220,"Brian Parker Turnover.",39,24,15,0.796079150385136,"Marist","Rider",3,4,0,0,-9.5,400991185,2018-02-10
150,1,"0:02",1202,1202,"Anthony Durham made Three Point Jumper. Assisted by Stevie Jordan.",39,27,12,0.666468485556041,"Marist","Rider",3,4,0,0,-9.5,400991185,2018-02-10
151,1,"0:00",1200,1200,"End of 1st half",39,27,12,0.666468485556041,"Marist","Rider",3,4,0,0,-9.5,400991185,2018-02-10
152,2,"20:00",1200,1200,"PLAY",39,27,12,0.666468485556041,"Marist","Rider",4,4,0,0,-9.5,400991185,2018-02-10
153,2,"19:49",1189,1189,"Tobias Sjoberg made Layup. Assisted by Brian Parker.",41,27,14,0.747777150315398,"Marist","Rider",4,4,0,0,-9.5,400991185,2018-02-10
154,2,"19:49",1189,1189,"Foul on Stevie Jordan.",41,27,14,0.747777150315398,"Marist","Rider",4,4,0,0,-9.5,400991185,2018-02-10
155,2,"19:49",1189,1189,"Tobias Sjoberg missed Free Throw.",41,27,14,0.747777150315398,"Marist","Rider",4,4,0,0,-9.5,400991185,2018-02-10
156,2,"19:49",1189,1189,"Jordan Allen Defensive Rebound.",41,27,14,0.747777150315398,"Marist","Rider",4,4,0,0,-9.5,400991185,2018-02-10
157,2,"19:32",1172,1172,"Tyere Marshall missed Jumper.",41,27,14,0.765019605516601,"Marist","Rider",4,4,0,0,-9.5,400991185,2018-02-10
158,2,"19:32",1172,1172,"Tobias Sjoberg Defensive Rebound.",41,27,14,0.765019605516601,"Marist","Rider",4,4,0,0,-9.5,400991185,2018-02-10
159,2,"19:22",1162,1162,"Ryan Funk made Three Point Jumper. Assisted by Brian Parker.",44,27,17,0.810219433955014,"Marist","Rider",4,4,0,0,-9.5,400991185,2018-02-10
160,2,"19:03",1143,1143,"Tyere Marshall missed Layup.",44,27,17,0.863910493962091,"Marist","Rider",4,4,0,0,-9.5,400991185,2018-02-10
161,2,"19:03",1143,1143,"Dimencio Vaughn Offensive Rebound.",44,27,17,0.863910493962091,"Marist","Rider",4,4,0,0,-9.5,400991185,2018-02-10
162,2,"18:53",1133,1133,"Stevie Jordan made Layup.",44,29,15,0.777725040792163,"Marist","Rider",4,4,0,0,-9.5,400991185,2018-02-10
163,2,"18:29",1109,1109,"Ryan Funk missed Three Point Jumper.",44,29,15,0.775176396728198,"Marist","Rider",4,4,0,0,-9.5,400991185,2018-02-10
164,2,"18:29",1109,1109,"Tobias Sjoberg Offensive Rebound.",44,29,15,0.775176396728198,"Marist","Rider",4,4,0,0,-9.5,400991185,2018-02-10
165,2,"18:25",1105,1105,"Foul on Tyere Marshall.",44,29,15,0.775176396728198,"Marist","Rider",4,4,0,0,-9.5,400991185,2018-02-10
166,2,"18:25",1105,1105,"Tobias Sjoberg missed Free Throw.",44,29,15,0.775176396728198,"Marist","Rider",4,4,0,0,-9.5,400991185,2018-02-10
167,2,"18:25",1105,1105,"Marist Deadball Team Rebound.",44,29,15,0.775176396728198,"Marist","Rider",4,4,0,0,-9.5,400991185,2018-02-10
168,2,"18:25",1105,1105,"Tobias Sjoberg made Free Throw.",45,29,16,0.80242851524323,"Marist","Rider",4,4,0,0,-9.5,400991185,2018-02-10
169,2,"18:18",1098,1098,"Anthony Durham missed Three Point Jumper.",45,29,16,0.830878112527656,"Marist","Rider",4,4,0,0,-9.5,400991185,2018-02-10
170,2,"18:18",1098,1098,"Tobias Sjoberg Defensive Rebound.",45,29,16,0.830878112527656,"Marist","Rider",4,4,0,0,-9.5,400991185,2018-02-10
171,2,"18:01",1081,1081,"Foul on Tobias Sjoberg.",45,29,16,0.828844468122921,"Marist","Rider",4,4,0,0,-9.5,400991185,2018-02-10
172,2,"18:01",1081,1081,"Tobias Sjoberg Turnover.",45,29,16,0.828844468122921,"Marist","Rider",4,4,0,0,-9.5,400991185,2018-02-10
173,2,"17:47",1067,1067,"Anthony Durham missed Layup.",45,29,16,0.856469644212405,"Marist","Rider",4,4,0,0,-9.5,400991185,2018-02-10
174,2,"17:47",1067,1067,"Tobias Sjoberg Defensive Rebound.",45,29,16,0.856469644212405,"Marist","Rider",4,4,0,0,-9.5,400991185,2018-02-10
175,2,"17:39",1059,1059,"Tobias Sjoberg made Layup. Assisted by Brian Parker.",47,29,18,0.896100433802878,"Marist","Rider",4,4,0,0,-9.5,400991185,2018-02-10
176,2,"17:39",1059,1059,"Foul on Anthony Durham.",47,29,18,0.896100433802878,"Marist","Rider",4,4,0,0,-9.5,400991185,2018-02-10
177,2,"17:39",1059,1059,"Tobias Sjoberg made Free Throw.",48,29,19,0.911714148943465,"Marist","Rider",4,4,0,0,-9.5,400991185,2018-02-10
178,2,"17:30",1050,1050,"Stevie Jordan missed Layup.",48,29,19,0.911714148943465,"Marist","Rider",4,4,0,0,-9.5,400991185,2018-02-10
179,2,"17:30",1050,1050,"Ryan Funk Defensive Rebound.",48,29,19,0.911714148943465,"Marist","Rider",4,4,0,0,-9.5,400991185,2018-02-10
180,2,"17:23",1043,1043,"Brian Parker made Layup.",50,29,21,0.931646287477515,"Marist","Rider",4,4,0,0,-9.5,400991185,2018-02-10
181,2,"17:22",1042,1042,"Rider  Timeout",50,29,21,0.931646287477515,"Marist","Rider",3,4,1,0,-9.5,400991185,2018-02-10
182,2,"17:14",1034,1034,"Frederick Scott made Layup. Assisted by Stevie Jordan.",50,31,19,0.888441698936615,"Marist","Rider",3,4,1,0,-9.5,400991185,2018-02-10
183,2,"16:48",1008,1008,"Isaiah Lamb made Dunk. Assisted by Tobias Sjoberg.",52,31,21,0.941145349688479,"Marist","Rider",3,4,1,0,-9.5,400991185,2018-02-10
184,2,"16:31",991,991,"Jordan Allen missed Jumper.",52,31,21,0.929179332944792,"Marist","Rider",3,4,1,0,-9.5,400991185,2018-02-10
185,2,"16:31",991,991,"Jordan Allen Offensive Rebound.",52,31,21,0.929179332944792,"Marist","Rider",3,4,1,0,-9.5,400991185,2018-02-10
186,2,"16:29",989,989,"Jordan Allen made Layup.",52,33,19,0.94687687625565,"Marist","Rider",3,4,1,0,-9.5,400991185,2018-02-10
187,2,"16:15",975,975,"Isaiah Lamb missed Layup.",52,33,19,0.912251379745388,"Marist","Rider",3,4,0,0,-9.5,400991185,2018-02-10
188,2,"16:15",975,975,"Frederick Scott Defensive Rebound.",52,33,19,0.912251379745388,"Marist","Rider",3,4,0,0,-9.5,400991185,2018-02-10
189,2,"16:08",968,968,"Jordan Allen Turnover.",52,33,19,0.922920357754179,"Marist","Rider",3,4,0,0,-9.5,400991185,2018-02-10
190,2,"15:59",959,959,"Isaiah Lamb Turnover.",52,33,19,0.915628227654722,"Marist","Rider",3,4,0,0,-9.5,400991185,2018-02-10
