"play_id","half","time_remaining_half","secs_remaining","secs_remaining_absolute","description","home_score","away_score","score_diff","win_prob","home","away","home_time_out_remaining","away_time_out_remaining","home_timeout_ind","away_timeout_ind","home_favored_by","game_id","date"
1,1,"20:00",2400,2400,"PLAY",0,0,0,0.823906478244314,"TCU","Richmond",4,4,0,0,7.5,400947326,2017-03-21
2,1,"20:00",2400,2400,"Jump Ball won by TCU",0,0,0,0.823906478244314,"TCU","Richmond",4,4,0,0,7.5,400947326,2017-03-21
3,1,"19:30",2370,2370,"JD Miller missed Three Point Jumper.",0,0,0,0.817583537350607,"TCU","Richmond",4,4,0,0,7.5,400947326,2017-03-21
4,1,"19:30",2370,2370,"T.J. Cline Defensive Rebound.",0,0,0,0.817583537350607,"TCU","Richmond",4,4,0,0,7.5,400947326,2017-03-21
5,1,"19:06",2346,2346,"Khwan Fore missed Layup.",0,0,0,0.80735751333022,"TCU","Richmond",4,4,0,0,7.5,400947326,2017-03-21
6,1,"19:06",2346,2346,"Kenrich Williams Defensive Rebound.",0,0,0,0.80735751333022,"TCU","Richmond",4,4,0,0,7.5,400947326,2017-03-21
7,1,"18:56",2336,2336,"Vladimir Brodziansky missed Jumper.",0,0,0,0.81294386371391,"TCU","Richmond",4,4,0,0,7.5,400947326,2017-03-21
8,1,"18:56",2336,2336,"Richmond Defensive Rebound.",0,0,0,0.81294386371391,"TCU","Richmond",4,4,0,0,7.5,400947326,2017-03-21
9,1,"18:43",2323,2323,"T.J. Cline missed Three Point Jumper.",0,0,0,0.816260984675626,"TCU","Richmond",4,4,0,0,7.5,400947326,2017-03-21
10,1,"18:43",2323,2323,"Kenrich Williams Defensive Rebound.",0,0,0,0.816260984675626,"TCU","Richmond",4,4,0,0,7.5,400947326,2017-03-21
11,1,"18:30",2310,2310,"Vladimir Brodziansky made Layup. Assisted by Desmond Bane.",2,0,2,0.828275086621345,"TCU","Richmond",4,4,0,0,7.5,400947326,2017-03-21
12,1,"18:13",2293,2293,"De'Monte Buckingham made Three Point Jumper. Assisted by T.J. Cline.",2,3,-1,0.797719117504122,"TCU","Richmond",4,4,0,0,7.5,400947326,2017-03-21
13,1,"17:47",2267,2267,"Foul on De'Monte Buckingham.",2,3,-1,0.796942139228115,"TCU","Richmond",4,4,0,0,7.5,400947326,2017-03-21
14,1,"17:45",2265,2265,"Vladimir Brodziansky missed Layup.",2,3,-1,0.796942139228115,"TCU","Richmond",4,4,0,0,7.5,400947326,2017-03-21
15,1,"17:45",2265,2265,"Kenrich Williams Offensive Rebound.",2,3,-1,0.796942139228115,"TCU","Richmond",4,4,0,0,7.5,400947326,2017-03-21
16,1,"17:41",2261,2261,"Kenrich Williams made Layup.",4,3,1,0.833995914751458,"TCU","Richmond",4,4,0,0,7.5,400947326,2017-03-21
17,1,"17:18",2238,2238,"Foul on JD Miller.",4,3,1,0.824887478923114,"TCU","Richmond",4,4,0,0,7.5,400947326,2017-03-21
18,1,"17:16",2236,2236,"T.J. Cline made Layup. Assisted by De'Monte Buckingham.",4,5,-1,0.790170940184608,"TCU","Richmond",4,4,0,0,7.5,400947326,2017-03-21
19,1,"16:59",2219,2219,"Desmond Bane missed Three Point Jumper.",4,5,-1,0.783603795228517,"TCU","Richmond",4,4,0,0,7.5,400947326,2017-03-21
20,1,"16:59",2219,2219,"Vladimir Brodziansky Offensive Rebound.",4,5,-1,0.783603795228517,"TCU","Richmond",4,4,0,0,7.5,400947326,2017-03-21
21,1,"16:55",2215,2215,"Foul on Khwan Fore.",4,5,-1,0.783603795228517,"TCU","Richmond",4,4,0,0,7.5,400947326,2017-03-21
22,1,"16:55",2215,2215,"Vladimir Brodziansky made Free Throw.",5,5,0,0.80497223886888,"TCU","Richmond",4,4,0,0,7.5,400947326,2017-03-21
23,1,"16:55",2215,2215,"Vladimir Brodziansky made Free Throw.",6,5,1,0.824702651827355,"TCU","Richmond",4,4,0,0,7.5,400947326,2017-03-21
24,1,"16:45",2205,2205,"Khwan Fore missed Layup.",6,5,1,0.82280406383151,"TCU","Richmond",4,4,0,0,7.5,400947326,2017-03-21
25,1,"16:45",2205,2205,"Chris Washburn Block.",6,5,1,0.82280406383151,"TCU","Richmond",4,4,0,0,7.5,400947326,2017-03-21
26,1,"16:45",2205,2205,"Desmond Bane Defensive Rebound.",6,5,1,0.82280406383151,"TCU","Richmond",4,4,0,0,7.5,400947326,2017-03-21
27,1,"16:32",2192,2192,"Chris Washburn made Jumper. Assisted by Alex Robinson.",8,5,3,0.862134844259105,"TCU","Richmond",4,4,0,0,7.5,400947326,2017-03-21
28,1,"16:14",2174,2174,"De'Monte Buckingham missed Three Point Jumper.",8,5,3,0.847731023463773,"TCU","Richmond",4,4,0,0,7.5,400947326,2017-03-21
29,1,"16:14",2174,2174,"Alex Robinson Defensive Rebound.",8,5,3,0.847731023463773,"TCU","Richmond",4,4,0,0,7.5,400947326,2017-03-21
30,1,"16:04",2164,2164,"Desmond Bane missed Three Point Jumper.",8,5,3,0.848624344299331,"TCU","Richmond",4,4,0,0,7.5,400947326,2017-03-21
31,1,"16:04",2164,2164,"Kenrich Williams Offensive Rebound.",8,5,3,0.848624344299331,"TCU","Richmond",4,4,0,0,7.5,400947326,2017-03-21
32,1,"16:01",2161,2161,"Foul on Nick Sherod.",8,5,3,0.848624344299331,"TCU","Richmond",4,4,0,0,7.5,400947326,2017-03-21
33,1,"15:50",2150,2150,"Alex Robinson made Jumper.",10,5,5,0.878075588013352,"TCU","Richmond",4,4,0,0,7.5,400947326,2017-03-21
34,1,"15:28",2128,2128,"T.J. Cline missed Three Point Jumper.",10,5,5,0.875610757390264,"TCU","Richmond",4,4,0,0,7.5,400947326,2017-03-21
35,1,"15:28",2128,2128,"Kenrich Williams Defensive Rebound.",10,5,5,0.875610757390264,"TCU","Richmond",4,4,0,0,7.5,400947326,2017-03-21
36,1,"15:17",2117,2117,"Alex Robinson Turnover.",10,5,5,0.883901231289978,"TCU","Richmond",4,4,0,0,7.5,400947326,2017-03-21
37,1,"15:17",2117,2117,"De'Monte Buckingham Steal.",10,5,5,0.883901231289978,"TCU","Richmond",4,4,0,0,7.5,400947326,2017-03-21
38,1,"15:11",2111,2111,"ShawnDre' Jones missed Three Point Jumper.",10,5,5,0.883901231289978,"TCU","Richmond",4,4,0,0,7.5,400947326,2017-03-21
39,1,"15:11",2111,2111,"Desmond Bane Defensive Rebound.",10,5,5,0.883901231289978,"TCU","Richmond",4,4,0,0,7.5,400947326,2017-03-21
40,1,"14:44",2084,2084,"Alex Robinson Turnover.",10,5,5,0.872855197780645,"TCU","Richmond",4,4,0,0,7.5,400947326,2017-03-21
41,1,"14:44",2084,2084,"Official TV Timeout",10,5,5,0.872855197780645,"TCU","Richmond",4,4,0,0,7.5,400947326,2017-03-21
42,1,"14:33",2073,2073,"T.J. Cline missed Layup.",10,5,5,0.873444810289554,"TCU","Richmond",4,4,0,0,7.5,400947326,2017-03-21
43,1,"14:33",2073,2073,"T.J. Cline Offensive Rebound.",10,5,5,0.873444810289554,"TCU","Richmond",4,4,0,0,7.5,400947326,2017-03-21
44,1,"14:28",2068,2068,"T.J. Cline missed Layup.",10,5,5,0.875022616756839,"TCU","Richmond",4,4,0,0,7.5,400947326,2017-03-21
45,1,"14:28",2068,2068,"Alex Robinson Defensive Rebound.",10,5,5,0.875022616756839,"TCU","Richmond",4,4,0,0,7.5,400947326,2017-03-21
46,1,"14:03",2043,2043,"Chris Washburn missed Layup.",10,5,5,0.86598813568598,"TCU","Richmond",4,4,0,0,7.5,400947326,2017-03-21
47,1,"14:03",2043,2043,"T.J. Cline Defensive Rebound.",10,5,5,0.86598813568598,"TCU","Richmond",4,4,0,0,7.5,400947326,2017-03-21
48,1,"13:44",2024,2024,"T.J. Cline made Layup.",10,7,3,0.85309660670747,"TCU","Richmond",4,4,0,0,7.5,400947326,2017-03-21
49,1,"13:17",1997,1997,"Foul on Alex Robinson.",10,7,3,0.853891957489994,"TCU","Richmond",4,4,0,0,7.5,400947326,2017-03-21
50,1,"13:17",1997,1997,"Alex Robinson Turnover.",10,7,3,0.853891957489994,"TCU","Richmond",4,4,0,0,7.5,400947326,2017-03-21
51,1,"13:06",1986,1986,"ShawnDre' Jones made Jumper. Assisted by T.J. Cline.",10,9,1,0.801945352112216,"TCU","Richmond",4,4,0,0,7.5,400947326,2017-03-21
52,1,"12:40",1960,1960,"Desmond Bane made Layup. Assisted by Kenrich Williams.",12,9,3,0.843083325533046,"TCU","Richmond",4,4,0,0,7.5,400947326,2017-03-21
53,1,"12:28",1948,1948,"Foul on T.J. Cline.",12,9,3,0.847741595436774,"TCU","Richmond",4,4,0,0,7.5,400947326,2017-03-21
54,1,"12:28",1948,1948,"T.J. Cline Turnover.",12,9,3,0.847741595436774,"TCU","Richmond",4,4,0,0,7.5,400947326,2017-03-21
55,1,"12:06",1926,1926,"Michael Williams missed Jumper.",12,9,3,0.851545711817583,"TCU","Richmond",4,4,0,0,7.5,400947326,2017-03-21
56,1,"12:06",1926,1926,"Vladimir Brodziansky Offensive Rebound.",12,9,3,0.851545711817583,"TCU","Richmond",4,4,0,0,7.5,400947326,2017-03-21
57,1,"12:02",1922,1922,"Vladimir Brodziansky made Layup.",14,9,5,0.880654912804058,"TCU","Richmond",4,4,0,0,7.5,400947326,2017-03-21
58,1,"11:47",1907,1907,"De'Monte Buckingham missed Jumper.",14,9,5,0.874115041141802,"TCU","Richmond",4,4,0,0,7.5,400947326,2017-03-21
59,1,"11:47",1907,1907,"Brandon Parrish Defensive Rebound.",14,9,5,0.874115041141802,"TCU","Richmond",4,4,0,0,7.5,400947326,2017-03-21
60,1,"11:38",1898,1898,"Kenrich Williams made Three Point Jumper. Assisted by Michael Williams.",17,9,8,0.917070477819653,"TCU","Richmond",4,4,0,0,7.5,400947326,2017-03-21
61,1,"11:19",1879,1879,"Nick Sherod Turnover.",17,9,8,0.909700432597033,"TCU","Richmond",4,4,0,0,7.5,400947326,2017-03-21
62,1,"11:19",1879,1879,"Official TV Timeout",17,9,8,0.909700432597033,"TCU","Richmond",4,4,0,0,7.5,400947326,2017-03-21
63,1,"10:56",1856,1856,"Vladimir Brodziansky made Jumper.",19,9,10,0.931427438845213,"TCU","Richmond",4,4,0,0,7.5,400947326,2017-03-21
64,1,"10:40",1840,1840,"Marshall Wood missed Three Point Jumper.",19,9,10,0.925026492791002,"TCU","Richmond",4,4,0,0,7.5,400947326,2017-03-21
65,1,"10:40",1840,1840,"Michael Williams Defensive Rebound.",19,9,10,0.925026492791002,"TCU","Richmond",4,4,0,0,7.5,400947326,2017-03-21
66,1,"10:30",1830,1830,"Vladimir Brodziansky made Layup. Assisted by Kenrich Williams.",21,9,12,0.944000681277229,"TCU","Richmond",4,4,0,0,7.5,400947326,2017-03-21
67,1,"10:07",1807,1807,"T.J. Cline made Layup. Assisted by De'Monte Buckingham.",21,11,10,0.930255088826856,"TCU","Richmond",4,4,0,0,7.5,400947326,2017-03-21
68,1,"9:41",1781,1781,"Vladimir Brodziansky made Layup. Assisted by Kenrich Williams.",23,11,12,0.944933005980966,"TCU","Richmond",4,4,0,0,7.5,400947326,2017-03-21
69,1,"9:41",1781,1781,"Foul on Marshall Wood.",23,11,12,0.944933005980966,"TCU","Richmond",4,4,0,0,7.5,400947326,2017-03-21
70,1,"9:41",1781,1781,"Vladimir Brodziansky missed Free Throw.",23,11,12,0.944933005980966,"TCU","Richmond",4,4,0,0,7.5,400947326,2017-03-21
71,1,"9:41",1781,1781,"De'Monte Buckingham Defensive Rebound.",23,11,12,0.944933005980966,"TCU","Richmond",4,4,0,0,7.5,400947326,2017-03-21
72,1,"9:22",1762,1762,"T.J. Cline missed Layup.",23,11,12,0.948808325102163,"TCU","Richmond",4,4,0,0,7.5,400947326,2017-03-21
73,1,"9:22",1762,1762,"Kenrich Williams Defensive Rebound.",23,11,12,0.948808325102163,"TCU","Richmond",4,4,0,0,7.5,400947326,2017-03-21
74,1,"8:52",1732,1732,"Vladimir Brodziansky missed Jumper.",23,11,12,0.949539168522966,"TCU","Richmond",4,4,0,0,7.5,400947326,2017-03-21
75,1,"8:52",1732,1732,"TCU Deadball Team Rebound.",23,11,12,0.949539168522966,"TCU","Richmond",4,4,0,0,7.5,400947326,2017-03-21
76,1,"8:50",1730,1730,"TCU  Turnover.",23,11,12,0.949539168522966,"TCU","Richmond",4,4,0,0,7.5,400947326,2017-03-21
77,1,"8:39",1719,1719,"T.J. Cline missed Three Point Jumper.",23,11,12,0.9499595810588,"TCU","Richmond",4,4,0,0,7.5,400947326,2017-03-21
78,1,"8:39",1719,1719,"Karviar Shepherd Defensive Rebound.",23,11,12,0.9499595810588,"TCU","Richmond",4,4,0,0,7.5,400947326,2017-03-21
79,1,"8:28",1708,1708,"Michael Williams missed Three Point Jumper.",23,11,12,0.941318228389365,"TCU","Richmond",4,4,0,0,7.5,400947326,2017-03-21
80,1,"8:28",1708,1708,"Kenrich Williams Offensive Rebound.",23,11,12,0.941318228389365,"TCU","Richmond",4,4,0,0,7.5,400947326,2017-03-21
81,1,"8:24",1704,1704,"Kenrich Williams made Dunk.",25,11,14,0.953935256806753,"TCU","Richmond",4,4,0,0,7.5,400947326,2017-03-21
82,1,"8:20",1700,1700,"Richmond  Timeout",25,11,14,0.953935256806753,"TCU","Richmond",3,4,1,0,7.5,400947326,2017-03-21
83,1,"8:20",1700,1700,"Official TV Timeout",25,11,14,0.953935256806753,"TCU","Richmond",3,4,1,0,7.5,400947326,2017-03-21
84,1,"8:02",1682,1682,"De'Monte Buckingham missed Three Point Jumper.",25,11,14,0.966542438603641,"TCU","Richmond",3,4,1,0,7.5,400947326,2017-03-21
85,1,"8:02",1682,1682,"Kenrich Williams Defensive Rebound.",25,11,14,0.966542438603641,"TCU","Richmond",3,4,1,0,7.5,400947326,2017-03-21
86,1,"7:38",1658,1658,"JD Miller Turnover.",25,11,14,0.957313827932703,"TCU","Richmond",3,4,1,0,7.5,400947326,2017-03-21
87,1,"7:38",1658,1658,"Nick Sherod Steal.",25,11,14,0.957313827932703,"TCU","Richmond",3,4,1,0,7.5,400947326,2017-03-21
88,1,"7:15",1635,1635,"T.J. Cline made Layup.",25,13,12,0.945853366726588,"TCU","Richmond",3,4,0,0,7.5,400947326,2017-03-21
89,1,"7:01",1621,1621,"TCU  Timeout",25,13,12,0.949888202145126,"TCU","Richmond",3,3,0,1,7.5,400947326,2017-03-21
90,1,"6:41",1601,1601,"Karviar Shepherd missed Jumper.",25,13,12,0.944763238617698,"TCU","Richmond",3,3,0,1,7.5,400947326,2017-03-21
91,1,"6:41",1601,1601,"Khwan Fore Defensive Rebound.",25,13,12,0.944763238617698,"TCU","Richmond",3,3,0,1,7.5,400947326,2017-03-21
92,1,"6:28",1588,1588,"Foul on De'Monte Buckingham.",25,13,12,0.945024142370517,"TCU","Richmond",3,3,0,1,7.5,400947326,2017-03-21
93,1,"6:28",1588,1588,"De'Monte Buckingham Turnover.",25,13,12,0.945024142370517,"TCU","Richmond",3,3,0,1,7.5,400947326,2017-03-21
94,1,"6:08",1568,1568,"Brandon Parrish made Three Point Jumper. Assisted by Desmond Bane.",28,13,15,0.965189124424587,"TCU","Richmond",3,3,0,1,7.5,400947326,2017-03-21
95,1,"5:58",1558,1558,"T.J. Cline made Layup. Assisted by Julius Johnson.",28,15,13,0.954329560701848,"TCU","Richmond",3,3,0,0,7.5,400947326,2017-03-21
96,1,"5:32",1532,1532,"Alex Robinson missed Three Point Jumper.",28,15,13,0.95588620072604,"TCU","Richmond",3,3,0,0,7.5,400947326,2017-03-21
97,1,"5:32",1532,1532,"Vladimir Brodziansky Offensive Rebound.",28,15,13,0.95588620072604,"TCU","Richmond",3,3,0,0,7.5,400947326,2017-03-21
98,1,"5:27",1527,1527,"Foul on Nick Sherod.",28,15,13,0.955153699463284,"TCU","Richmond",3,3,0,0,7.5,400947326,2017-03-21
99,1,"5:27",1527,1527,"Vladimir Brodziansky made Free Throw.",29,15,14,0.960868027552416,"TCU","Richmond",3,3,0,0,7.5,400947326,2017-03-21
100,1,"5:27",1527,1527,"Vladimir Brodziansky made Free Throw.",30,15,15,0.965880244128623,"TCU","Richmond",3,3,0,0,7.5,400947326,2017-03-21
101,1,"5:16",1516,1516,"Julius Johnson missed Three Point Jumper.",30,15,15,0.971997921586979,"TCU","Richmond",3,3,0,0,7.5,400947326,2017-03-21
102,1,"5:16",1516,1516,"Kenrich Williams Defensive Rebound.",30,15,15,0.971997921586979,"TCU","Richmond",3,3,0,0,7.5,400947326,2017-03-21
103,1,"5:06",1506,1506,"Brandon Parrish missed Three Point Jumper.",30,15,15,0.966292147862026,"TCU","Richmond",3,3,0,0,7.5,400947326,2017-03-21
104,1,"5:06",1506,1506,"Kenrich Williams Offensive Rebound.",30,15,15,0.966292147862026,"TCU","Richmond",3,3,0,0,7.5,400947326,2017-03-21
105,1,"4:59",1499,1499,"Brandon Parrish missed Layup.",30,15,15,0.966778240362629,"TCU","Richmond",3,3,0,0,7.5,400947326,2017-03-21
106,1,"4:59",1499,1499,"T.J. Cline Defensive Rebound.",30,15,15,0.966778240362629,"TCU","Richmond",3,3,0,0,7.5,400947326,2017-03-21
107,1,"4:51",1491,1491,"ShawnDre' Jones missed Three Point Jumper.",30,15,15,0.966778240362629,"TCU","Richmond",3,3,0,0,7.5,400947326,2017-03-21
108,1,"4:51",1491,1491,"Desmond Bane Defensive Rebound.",30,15,15,0.966778240362629,"TCU","Richmond",3,3,0,0,7.5,400947326,2017-03-21
109,1,"4:40",1480,1480,"Foul on Khwan Fore.",30,15,15,0.968840476724011,"TCU","Richmond",3,3,0,0,7.5,400947326,2017-03-21
110,1,"4:40",1480,1480,"Kenrich Williams made Layup. Assisted by Alex Robinson.",32,15,17,0.976734796418133,"TCU","Richmond",3,3,0,0,7.5,400947326,2017-03-21
111,1,"4:24",1464,1464,"Khwan Fore made Jumper. Assisted by ShawnDre' Jones.",32,17,15,0.962320266453388,"TCU","Richmond",3,3,0,0,7.5,400947326,2017-03-21
112,1,"4:06",1446,1446,"Desmond Bane Turnover.",32,17,15,0.972452530495517,"TCU","Richmond",3,3,0,0,7.5,400947326,2017-03-21
113,1,"3:56",1436,1436,"ShawnDre' Jones missed Jumper.",32,17,15,0.968425508526027,"TCU","Richmond",3,3,0,0,7.5,400947326,2017-03-21
114,1,"3:56",1436,1436,"Kwesi Abakah Offensive Rebound.",32,17,15,0.968425508526027,"TCU","Richmond",3,3,0,0,7.5,400947326,2017-03-21
115,1,"3:39",1419,1419,"Khwan Fore made Three Point Jumper. Assisted by De'Monte Buckingham.",32,20,12,0.951634497369235,"TCU","Richmond",3,3,0,0,7.5,400947326,2017-03-21
116,1,"3:28",1408,1408,"Desmond Bane made Three Point Jumper. Assisted by Brandon Parrish.",35,20,15,0.973122331557709,"TCU","Richmond",3,3,0,0,7.5,400947326,2017-03-21
117,1,"2:58",1378,1378,"Julius Johnson missed Layup.",35,20,15,0.964676214419505,"TCU","Richmond",3,3,0,0,7.5,400947326,2017-03-21
118,1,"2:58",1378,1378,"Brandon Parrish Block.",35,20,15,0.964676214419505,"TCU","Richmond",3,3,0,0,7.5,400947326,2017-03-21
119,1,"2:58",1378,1378,"Karviar Shepherd Defensive Rebound.",35,20,15,0.964676214419505,"TCU","Richmond",3,3,0,0,7.5,400947326,2017-03-21
120,1,"2:48",1368,1368,"Brandon Parrish made Layup. Assisted by Alex Robinson.",37,20,17,0.977732013622166,"TCU","Richmond",3,3,0,0,7.5,400947326,2017-03-21
121,1,"2:48",1368,1368,"Official TV Timeout",37,20,17,0.977732013622166,"TCU","Richmond",3,3,0,0,7.5,400947326,2017-03-21
122,1,"2:37",1357,1357,"Khwan Fore made Layup. Assisted by T.J. Cline.",37,22,15,0.971731437052388,"TCU","Richmond",3,3,0,0,7.5,400947326,2017-03-21
123,1,"2:07",1327,1327,"Alex Robinson made Jumper.",39,22,17,0.978895378129091,"TCU","Richmond",3,3,0,0,7.5,400947326,2017-03-21
124,1,"1:44",1304,1304,"Foul on Karviar Shepherd.",39,22,17,0.973585842921711,"TCU","Richmond",3,3,0,0,7.5,400947326,2017-03-21
125,1,"1:44",1304,1304,"Julius Johnson missed Free Throw.",39,22,17,0.973585842921711,"TCU","Richmond",3,3,0,0,7.5,400947326,2017-03-21
126,1,"1:44",1304,1304,"Richmond Deadball Team Rebound.",39,22,17,0.973585842921711,"TCU","Richmond",3,3,0,0,7.5,400947326,2017-03-21
127,1,"1:44",1304,1304,"Julius Johnson made Free Throw.",39,23,16,0.969527068834119,"TCU","Richmond",3,3,0,0,7.5,400947326,2017-03-21
128,1,"1:19",1279,1279,"Michael Williams missed Three Point Jumper.",39,23,16,0.970391610585338,"TCU","Richmond",3,3,0,0,7.5,400947326,2017-03-21
129,1,"1:19",1279,1279,"Vladimir Brodziansky Offensive Rebound.",39,23,16,0.970391610585338,"TCU","Richmond",3,3,0,0,7.5,400947326,2017-03-21
130,1,"1:14",1274,1274,"Foul on De'Monte Buckingham.",39,23,16,0.970391610585338,"TCU","Richmond",3,3,0,0,7.5,400947326,2017-03-21
131,1,"1:14",1274,1274,"Vladimir Brodziansky made Free Throw.",40,23,17,0.974406267955698,"TCU","Richmond",3,3,0,0,7.5,400947326,2017-03-21
132,1,"1:14",1274,1274,"Vladimir Brodziansky made Free Throw.",41,23,18,0.977888973854823,"TCU","Richmond",3,3,0,0,7.5,400947326,2017-03-21
133,1,"1:03",1263,1263,"Foul on Chris Washburn.",41,23,18,0.983358170430247,"TCU","Richmond",3,3,0,0,7.5,400947326,2017-03-21
134,1,"0:53",1253,1253,"ShawnDre' Jones made Three Point Jumper. Assisted by T.J. Cline.",41,26,15,0.965938944172372,"TCU","Richmond",3,3,0,0,7.5,400947326,2017-03-21
135,1,"0:30",1230,1230,"Desmond Bane missed Three Point Jumper.",41,26,15,0.970248984776243,"TCU","Richmond",3,3,0,0,7.5,400947326,2017-03-21
136,1,"0:30",1230,1230,"Alex Robinson Offensive Rebound.",41,26,15,0.970248984776243,"TCU","Richmond",3,3,0,0,7.5,400947326,2017-03-21
137,1,"0:04",1204,1204,"Kenrich Williams missed Three Point Jumper.",41,26,15,0.971043041778678,"TCU","Richmond",3,3,0,0,7.5,400947326,2017-03-21
138,1,"0:04",1204,1204,"Richmond Defensive Rebound.",41,26,15,0.971043041778678,"TCU","Richmond",3,3,0,0,7.5,400947326,2017-03-21
139,1,"0:00",1200,1200,"End of 1st half",41,26,15,0.971043041778678,"TCU","Richmond",3,3,0,0,7.5,400947326,2017-03-21
140,2,"20:00",1200,1200,"PLAY",41,26,15,0.971043041778678,"TCU","Richmond",4,4,0,0,7.5,400947326,2017-03-21
141,2,"20:00",1200,1200,"Jump Ball won by Richmond",41,26,15,0.971043041778678,"TCU","Richmond",4,4,0,0,7.5,400947326,2017-03-21
142,2,"19:51",1191,1191,"De'Monte Buckingham made Layup.",41,28,13,0.962107518852883,"TCU","Richmond",4,4,0,0,7.5,400947326,2017-03-21
143,2,"19:20",1160,1160,"Alex Robinson missed Jumper.",41,28,13,0.961811228728729,"TCU","Richmond",4,4,0,0,7.5,400947326,2017-03-21
144,2,"19:20",1160,1160,"ShawnDre' Jones Defensive Rebound.",41,28,13,0.961811228728729,"TCU","Richmond",4,4,0,0,7.5,400947326,2017-03-21
145,2,"19:11",1151,1151,"T.J. Cline made Layup. Assisted by ShawnDre' Jones.",41,30,11,0.945722319845102,"TCU","Richmond",4,4,0,0,7.5,400947326,2017-03-21
146,2,"18:52",1132,1132,"Kenrich Williams missed Three Point Jumper.",41,30,11,0.949554999587178,"TCU","Richmond",4,4,0,0,7.5,400947326,2017-03-21
147,2,"18:52",1132,1132,"T.J. Cline Defensive Rebound.",41,30,11,0.949554999587178,"TCU","Richmond",4,4,0,0,7.5,400947326,2017-03-21
148,2,"18:41",1121,1121,"Foul on Alex Robinson.",41,30,11,0.95786659986463,"TCU","Richmond",4,4,0,0,7.5,400947326,2017-03-21
149,2,"18:18",1098,1098,"ShawnDre' Jones made Jumper. Assisted by T.J. Cline.",41,32,9,0.935949061420745,"TCU","Richmond",4,4,0,0,7.5,400947326,2017-03-21
150,2,"17:47",1067,1067,"JD Miller missed Jumper.",41,32,9,0.932787044915552,"TCU","Richmond",4,4,0,0,7.5,400947326,2017-03-21
151,2,"17:47",1067,1067,"Kenrich Williams Offensive Rebound.",41,32,9,0.932787044915552,"TCU","Richmond",4,4,0,0,7.5,400947326,2017-03-21
152,2,"17:43",1063,1063,"Kenrich Williams made Layup.",43,32,11,0.951438804548335,"TCU","Richmond",4,4,0,0,7.5,400947326,2017-03-21
153,2,"17:32",1052,1052,"T.J. Cline missed Three Point Jumper.",43,32,11,0.955818283870973,"TCU","Richmond",4,4,0,0,7.5,400947326,2017-03-21
154,2,"17:32",1052,1052,"Kenrich Williams Defensive Rebound.",43,32,11,0.955818283870973,"TCU","Richmond",4,4,0,0,7.5,400947326,2017-03-21
155,2,"17:23",1043,1043,"Desmond Bane made Three Point Jumper. Assisted by Kenrich Williams.",46,32,14,0.973098495959706,"TCU","Richmond",4,4,0,0,7.5,400947326,2017-03-21
156,2,"17:04",1024,1024,"T.J. Cline missed Jumper.",46,32,14,0.973185372483367,"TCU","Richmond",4,4,0,0,7.5,400947326,2017-03-21
157,2,"17:04",1024,1024,"Alex Robinson Defensive Rebound.",46,32,14,0.973185372483367,"TCU","Richmond",4,4,0,0,7.5,400947326,2017-03-21
158,2,"16:57",1017,1017,"JD Miller made Three Point Jumper. Assisted by Kenrich Williams.",49,32,17,0.982560420778865,"TCU","Richmond",4,4,0,0,7.5,400947326,2017-03-21
159,2,"16:30",990,990,"Foul on JD Miller.",49,32,17,0.98247862759005,"TCU","Richmond",4,4,0,0,7.5,400947326,2017-03-21
160,2,"16:30",990,990,"T.J. Cline made Free Throw.",49,33,16,0.979126089301507,"TCU","Richmond",4,4,0,0,7.5,400947326,2017-03-21
161,2,"16:30",990,990,"T.J. Cline missed Free Throw.",49,33,16,0.979126089301507,"TCU","Richmond",4,4,0,0,7.5,400947326,2017-03-21
162,2,"16:30",990,990,"Kenrich Williams Defensive Rebound.",49,33,16,0.979126089301507,"TCU","Richmond",4,4,0,0,7.5,400947326,2017-03-21
163,2,"16:12",972,972,"Alex Robinson made Jumper. Assisted by Vladimir Brodziansky.",51,33,18,0.986931615276143,"TCU","Richmond",4,4,0,0,7.5,400947326,2017-03-21
164,2,"15:55",955,955,"Khwan Fore missed Layup.",51,33,18,0.988898401582083,"TCU","Richmond",4,4,0,0,7.5,400947326,2017-03-21
165,2,"15:55",955,955,"Alex Robinson Block.",51,33,18,0.988898401582083,"TCU","Richmond",4,4,0,0,7.5,400947326,2017-03-21
166,2,"15:55",955,955,"Kenrich Williams Defensive Rebound.",51,33,18,0.988898401582083,"TCU","Richmond",4,4,0,0,7.5,400947326,2017-03-21
167,2,"15:44",944,944,"Brandon Parrish made Three Point Jumper. Assisted by Alex Robinson.",54,33,21,0.994181171736758,"TCU","Richmond",4,4,0,0,7.5,400947326,2017-03-21
168,2,"15:42",942,942,"Richmond  Timeout",54,33,21,0.994181171736758,"TCU","Richmond",3,4,1,0,7.5,400947326,2017-03-21
169,2,"15:42",942,942,"Official TV Timeout",54,33,21,0.994181171736758,"TCU","Richmond",3,4,1,0,7.5,400947326,2017-03-21
170,2,"15:26",926,926,"Nick Sherod made Jumper. Assisted by T.J. Cline.",54,35,19,0.989770608188335,"TCU","Richmond",3,4,1,0,7.5,400947326,2017-03-21
171,2,"14:48",888,888,"TCU  Turnover.",54,35,19,0.985994170413602,"TCU","Richmond",3,4,1,0,7.5,400947326,2017-03-21
172,2,"14:48",888,888,"Official TV Timeout",54,35,19,0.985994170413602,"TCU","Richmond",3,4,1,0,7.5,400947326,2017-03-21
173,2,"14:37",877,877,"T.J. Cline made Layup. Assisted by De'Monte Buckingham.",54,37,17,0.986458687285841,"TCU","Richmond",3,4,0,0,7.5,400947326,2017-03-21
174,2,"14:13",853,853,"Brandon Parrish missed Three Point Jumper.",54,37,17,0.989137009280678,"TCU","Richmond",3,4,0,0,7.5,400947326,2017-03-21
175,2,"14:13",853,853,"ShawnDre' Jones Defensive Rebound.",54,37,17,0.989137009280678,"TCU","Richmond",3,4,0,0,7.5,400947326,2017-03-21
176,2,"14:03",843,843,"T.J. Cline Turnover.",54,37,17,0.989576034752734,"TCU","Richmond",3,4,0,0,7.5,400947326,2017-03-21
177,2,"13:54",834,834,"Foul on Julius Johnson.",54,37,17,0.989799429171374,"TCU","Richmond",3,4,0,0,7.5,400947326,2017-03-21
178,2,"13:54",834,834,"Karviar Shepherd made Free Throw.",55,37,18,0.991684718104585,"TCU","Richmond",3,4,0,0,7.5,400947326,2017-03-21
179,2,"13:54",834,834,"Karviar Shepherd made Free Throw.",56,37,19,0.99322394974319,"TCU","Richmond",3,4,0,0,7.5,400947326,2017-03-21
180,2,"13:43",823,823,"T.J. Cline missed Layup.",56,37,19,0.989900301088674,"TCU","Richmond",3,4,0,0,7.5,400947326,2017-03-21
181,2,"13:43",823,823,"Karviar Shepherd Defensive Rebound.",56,37,19,0.989900301088674,"TCU","Richmond",3,4,0,0,7.5,400947326,2017-03-21
182,2,"13:40",820,820,"Foul on T.J. Cline.",56,37,19,0.989900301088674,"TCU","Richmond",3,4,0,0,7.5,400947326,2017-03-21
183,2,"13:24",804,804,"Karviar Shepherd made Jumper. Assisted by Michael Williams.",58,37,21,0.995175672525061,"TCU","Richmond",3,4,0,0,7.5,400947326,2017-03-21
184,2,"13:15",795,795,"T.J. Cline made Layup. Assisted by ShawnDre' Jones.",58,39,19,0.994062470469998,"TCU","Richmond",3,4,0,0,7.5,400947326,2017-03-21
185,2,"12:47",767,767,"Alex Robinson Turnover.",58,39,19,0.994396667240174,"TCU","Richmond",3,4,0,0,7.5,400947326,2017-03-21
186,2,"12:43",763,763,"ShawnDre' Jones missed Jumper.",58,39,19,0.994396667240174,"TCU","Richmond",3,4,0,0,7.5,400947326,2017-03-21
187,2,"12:43",763,763,"JD Miller Defensive Rebound.",58,39,19,0.994396667240174,"TCU","Richmond",3,4,0,0,7.5,400947326,2017-03-21
188,2,"12:35",755,755,"Alex Robinson made Jumper.",60,39,21,0.996084098418161,"TCU","Richmond",3,4,0,0,7.5,400947326,2017-03-21
189,2,"12:23",743,743,"T.J. Cline made Layup. Assisted by ShawnDre' Jones.",60,41,19,0.994269402203399,"TCU","Richmond",3,4,0,0,7.5,400947326,2017-03-21
