"play_id","half","time_remaining_half","secs_remaining","secs_remaining_absolute","description","home_score","away_score","score_diff","win_prob","home","away","home_time_out_remaining","away_time_out_remaining","home_timeout_ind","away_timeout_ind","home_favored_by","game_id","date"
357,2,"3:08",188,188,"Deionte Simmons made Free Throw.",99,73,26,0.999998613178679,"Oakland","Chicago State",3,4,0,0,22.6,400917473,2016-11-19
358,2,"3:08",188,188,"Deionte Simmons missed Free Throw.",99,73,26,0.999998613178679,"Oakland","Chicago State",3,4,0,0,22.6,400917473,2016-11-19
359,2,"3:08",188,188,"Isaiah Brock Defensive Rebound.",99,73,26,0.999998613178679,"Oakland","Chicago State",3,4,0,0,22.6,400917473,2016-11-19
360,2,"2:47",167,167,"Jaevin Cumberland made Jumper.",101,73,28,0.999999841790913,"Oakland","Chicago State",3,4,0,0,22.6,400917473,2016-11-19
361,2,"2:37",157,157,"Fred Sims Jr. missed Three Point Jumper.",101,73,28,0.999999884952875,"Oakland","Chicago State",3,4,0,0,22.6,400917473,2016-11-19
362,2,"2:37",157,157,"Nick Daniels Defensive Rebound.",101,73,28,0.999999884952875,"Oakland","Chicago State",3,4,0,0,22.6,400917473,2016-11-19
363,2,"2:29",149,149,"Jaevin Cumberland missed Three Point Jumper.",101,73,28,0.999999823464116,"Oakland","Chicago State",3,4,0,0,22.6,400917473,2016-11-19
364,2,"2:29",149,149,"Brian Greene Jr. Defensive Rebound.",101,73,28,0.999999823464116,"Oakland","Chicago State",3,4,0,0,22.6,400917473,2016-11-19
365,2,"2:20",140,140,"Clemmye Owens V missed Three Point Jumper.",101,73,28,0.999999823464116,"Oakland","Chicago State",3,4,0,0,22.6,400917473,2016-11-19
366,2,"2:20",140,140,"Chris Palombizio Defensive Rebound.",101,73,28,0.999999823464116,"Oakland","Chicago State",3,4,0,0,22.6,400917473,2016-11-19
367,2,"1:53",113,113,"Foul on Clemmye Owens V.",101,73,28,0.999999979325243,"Oakland","Chicago State",3,4,0,0,22.6,400917473,2016-11-19
368,2,"1:53",113,113,"Chris Palombizio made Free Throw.",102,73,29,0.999999988662947,"Oakland","Chicago State",3,4,0,0,22.6,400917473,2016-11-19
369,2,"1:53",113,113,"Chris Palombizio made Free Throw.",103,73,30,0.9999999937833,"Oakland","Chicago State",3,4,0,0,22.6,400917473,2016-11-19
370,2,"1:42",102,102,"Deionte Simmons made Jumper. Assisted by Clemmye Owens V.",103,75,28,0.999999985654392,"Oakland","Chicago State",3,4,0,0,22.6,400917473,2016-11-19
371,2,"1:42",102,102,"Foul on Isaiah Brock.",103,75,28,0.999999985654392,"Oakland","Chicago State",3,4,0,0,22.6,400917473,2016-11-19
372,2,"1:42",102,102,"Deionte Simmons missed Free Throw.",103,75,28,0.999999985654392,"Oakland","Chicago State",3,4,0,0,22.6,400917473,2016-11-19
373,2,"1:42",102,102,"Jaevin Cumberland Defensive Rebound.",103,75,28,0.999999985654392,"Oakland","Chicago State",3,4,0,0,22.6,400917473,2016-11-19
374,2,"1:23",83,83,"Foul on Brian Greene Jr..",103,75,28,0.999999999221657,"Oakland","Chicago State",3,4,0,0,22.6,400917473,2016-11-19
375,2,"1:23",83,83,"Jaevin Cumberland made Free Throw.",104,75,29,0.999999999619798,"Oakland","Chicago State",3,4,0,0,22.6,400917473,2016-11-19
376,2,"1:23",83,83,"Jaevin Cumberland made Free Throw.",105,75,30,0.999999999814281,"Oakland","Chicago State",3,4,0,0,22.6,400917473,2016-11-19
377,2,"1:04",64,64,"Trayvon Palmer missed Three Point Jumper.",105,75,30,0.999999999847125,"Oakland","Chicago State",3,4,0,0,22.6,400917473,2016-11-19
378,2,"1:04",64,64,"Isaiah Brock Defensive Rebound.",105,75,30,0.999999999847125,"Oakland","Chicago State",3,4,0,0,22.6,400917473,2016-11-19
379,2,"0:52",52,52,"Foul on Trayvon Palmer.",105,75,30,0.999999999986883,"Oakland","Chicago State",3,4,0,0,22.6,400917473,2016-11-19
380,2,"0:52",52,52,"Nick Daniels made Free Throw.",106,75,31,0.999999999994118,"Oakland","Chicago State",3,4,0,0,22.6,400917473,2016-11-19
381,2,"0:52",52,52,"Nick Daniels made Free Throw.",107,75,32,0.999999999997363,"Oakland","Chicago State",3,4,0,0,22.6,400917473,2016-11-19
382,2,"0:42",42,42,"Foul on Isaiah Brock.",107,75,32,0.999999999999708,"Oakland","Chicago State",3,4,0,0,22.6,400917473,2016-11-19
383,2,"0:42",42,42,"Deionte Simmons missed Free Throw.",107,75,32,0.999999999999708,"Oakland","Chicago State",3,4,0,0,22.6,400917473,2016-11-19
384,2,"0:42",42,42,"Chicago St Deadball Team Rebound.",107,75,32,0.999999999999708,"Oakland","Chicago State",3,4,0,0,22.6,400917473,2016-11-19
385,2,"0:42",42,42,"Deionte Simmons made Free Throw.",107,76,31,0.999999999999279,"Oakland","Chicago State",3,4,0,0,22.6,400917473,2016-11-19
386,2,"0:34",34,34,"Nick Daniels missed Three Point Jumper.",107,76,31,0.999999999990553,"Oakland","Chicago State",3,4,0,0,22.6,400917473,2016-11-19
387,2,"0:34",34,34,"Deionte Simmons Defensive Rebound.",107,76,31,0.999999999990553,"Oakland","Chicago State",3,4,0,0,22.6,400917473,2016-11-19
388,2,"0:27",27,27,"Clemmye Owens V made Three Point Jumper. Assisted by Delundre Dixon.",107,79,28,0.999999999999999,"Oakland","Chicago State",3,4,0,0,22.6,400917473,2016-11-19
389,2,"0:00",0,0,"End of Game",107,79,28,1,"Oakland","Chicago State",3,4,0,0,22.6,400917473,2016-11-19
