"play_id","half","time_remaining_half","secs_remaining","secs_remaining_absolute","description","home_score","away_score","score_diff","win_prob","home","away","home_time_out_remaining","away_time_out_remaining","home_timeout_ind","away_timeout_ind","home_favored_by","game_id","date"
1,1,"20:00",2400,2400,"PLAY",0,0,0,0.872953414970328,"SMU","Temple",4,4,0,0,10.5,400988059,2018-01-10
2,1,"19:35",2375,2375,"Quinton Rose missed Jumper.",0,0,0,0.865167992723255,"SMU","Temple",4,4,0,0,10.5,400988059,2018-01-10
3,1,"19:35",2375,2375,"SMU Defensive Rebound.",0,0,0,0.865167992723255,"SMU","Temple",4,4,0,0,10.5,400988059,2018-01-10
4,1,"19:03",2343,2343,"Ethan Chargois missed Jumper.",0,0,0,0.856587877973556,"SMU","Temple",4,4,0,0,10.5,400988059,2018-01-10
5,1,"19:03",2343,2343,"Jarrey Foster Offensive Rebound.",0,0,0,0.856587877973556,"SMU","Temple",4,4,0,0,10.5,400988059,2018-01-10
6,1,"18:59",2339,2339,"Jarrey Foster made Two Point Tip Shot.",2,0,2,0.882415402009018,"SMU","Temple",4,4,0,0,10.5,400988059,2018-01-10
7,1,"18:33",2313,2313,"Obi Enechionyia made Layup.",2,2,0,0.848415593989336,"SMU","Temple",4,4,0,0,10.5,400988059,2018-01-10
8,1,"18:07",2287,2287,"Shake Milton made Three Point Jumper. Assisted by Jimmy Whitt.",5,2,3,0.889894761031163,"SMU","Temple",4,4,0,0,10.5,400988059,2018-01-10
9,1,"17:52",2272,2272,"Josh Brown made Layup.",5,4,1,0.871458124875375,"SMU","Temple",4,4,0,0,10.5,400988059,2018-01-10
10,1,"17:32",2252,2252,"Jimmy Whitt missed Three Point Jumper.",5,4,1,0.863967741737778,"SMU","Temple",4,4,0,0,10.5,400988059,2018-01-10
11,1,"17:32",2252,2252,"Ben Emelogu II Offensive Rebound.",5,4,1,0.863967741737778,"SMU","Temple",4,4,0,0,10.5,400988059,2018-01-10
12,1,"17:28",2248,2248,"Jarrey Foster made Three Point Jumper. Assisted by Ben Emelogu II.",8,4,4,0.8891893225439,"SMU","Temple",4,4,0,0,10.5,400988059,2018-01-10
13,1,"17:14",2234,2234,"Ernest Aflakpui Turnover.",8,4,4,0.903381789496414,"SMU","Temple",4,4,0,0,10.5,400988059,2018-01-10
14,1,"17:12",2232,2232,"Ethan Chargois Steal.",8,4,4,0.903381789496414,"SMU","Temple",4,4,0,0,10.5,400988059,2018-01-10
15,1,"17:10",2230,2230,"Shake Milton missed Three Point Jumper.",8,4,4,0.903381789496414,"SMU","Temple",4,4,0,0,10.5,400988059,2018-01-10
16,1,"17:10",2230,2230,"Jimmy Whitt Offensive Rebound.",8,4,4,0.903381789496414,"SMU","Temple",4,4,0,0,10.5,400988059,2018-01-10
17,1,"17:06",2226,2226,"Jimmy Whitt missed Two Point Tip Shot.",8,4,4,0.901121154129991,"SMU","Temple",4,4,0,0,10.5,400988059,2018-01-10
18,1,"17:06",2226,2226,"Jarrey Foster Offensive Rebound.",8,4,4,0.901121154129991,"SMU","Temple",4,4,0,0,10.5,400988059,2018-01-10
19,1,"17:02",2222,2222,"Ethan Chargois missed Three Point Jumper.",8,4,4,0.901121154129991,"SMU","Temple",4,4,0,0,10.5,400988059,2018-01-10
20,1,"17:02",2222,2222,"Quinton Rose Defensive Rebound.",8,4,4,0.901121154129991,"SMU","Temple",4,4,0,0,10.5,400988059,2018-01-10
21,1,"16:51",2211,2211,"Quinton Rose made Layup.",8,6,2,0.882234066884244,"SMU","Temple",4,4,0,0,10.5,400988059,2018-01-10
22,1,"16:31",2191,2191,"Foul on Josh Brown.",8,6,2,0.887639084313505,"SMU","Temple",4,4,0,0,10.5,400988059,2018-01-10
23,1,"16:31",2191,2191,"Shake Milton made Free Throw.",9,6,3,0.89873928118917,"SMU","Temple",4,4,0,0,10.5,400988059,2018-01-10
24,1,"16:31",2191,2191,"Shake Milton missed Free Throw.",9,6,3,0.89873928118917,"SMU","Temple",4,4,0,0,10.5,400988059,2018-01-10
25,1,"16:31",2191,2191,"Ernest Aflakpui Defensive Rebound.",9,6,3,0.89873928118917,"SMU","Temple",4,4,0,0,10.5,400988059,2018-01-10
26,1,"16:06",2166,2166,"Quinton Rose missed Jumper.",9,6,3,0.887368103221083,"SMU","Temple",4,4,0,0,10.5,400988059,2018-01-10
27,1,"16:06",2166,2166,"Obi Enechionyia Offensive Rebound.",9,6,3,0.887368103221083,"SMU","Temple",4,4,0,0,10.5,400988059,2018-01-10
28,1,"16:03",2163,2163,"Foul on Ethan Chargois.",9,6,3,0.887368103221083,"SMU","Temple",4,4,0,0,10.5,400988059,2018-01-10
29,1,"16:03",2163,2163,"Obi Enechionyia made Free Throw.",9,7,2,0.875834488272709,"SMU","Temple",4,4,0,0,10.5,400988059,2018-01-10
30,1,"16:03",2163,2163,"Obi Enechionyia missed Free Throw.",9,7,2,0.875834488272709,"SMU","Temple",4,4,0,0,10.5,400988059,2018-01-10
31,1,"16:03",2163,2163,"Jimmy Whitt Defensive Rebound.",9,7,2,0.875834488272709,"SMU","Temple",4,4,0,0,10.5,400988059,2018-01-10
32,1,"15:35",2135,2135,"Ben Emelogu II missed Three Point Jumper.",9,7,2,0.879938601679439,"SMU","Temple",4,4,0,0,10.5,400988059,2018-01-10
33,1,"15:35",2135,2135,"Ernest Aflakpui Defensive Rebound.",9,7,2,0.879938601679439,"SMU","Temple",4,4,0,0,10.5,400988059,2018-01-10
34,1,"15:25",2125,2125,"Quinton Rose Turnover.",9,7,2,0.875649812367476,"SMU","Temple",4,4,0,0,10.5,400988059,2018-01-10
35,1,"15:25",2125,2125,"Jimmy Whitt Steal.",9,7,2,0.875649812367476,"SMU","Temple",4,4,0,0,10.5,400988059,2018-01-10
36,1,"15:11",2111,2111,"Jimmy Whitt made Jumper. Assisted by Akoy Agau.",11,7,4,0.906672556939909,"SMU","Temple",4,4,0,0,10.5,400988059,2018-01-10
37,1,"14:51",2091,2091,"Quinton Rose made Three Point Jumper. Assisted by Josh Brown.",11,10,1,0.857994941393829,"SMU","Temple",4,4,0,0,10.5,400988059,2018-01-10
38,1,"14:20",2060,2060,"Jarrey Foster Turnover.",11,10,1,0.858617099884234,"SMU","Temple",4,4,0,0,10.5,400988059,2018-01-10
39,1,"14:20",2060,2060,"Foul on Jarrey Foster.",11,10,1,0.858617099884234,"SMU","Temple",4,4,0,0,10.5,400988059,2018-01-10
40,1,"14:20",2060,2060,"Official TV Timeout",11,10,1,0.858617099884234,"SMU","Temple",4,4,0,0,10.5,400988059,2018-01-10
41,1,"13:56",2036,2036,"Shizz Alston Jr. missed Three Point Jumper.",11,10,1,0.873546053728793,"SMU","Temple",4,4,0,0,10.5,400988059,2018-01-10
42,1,"13:56",2036,2036,"Jarrey Foster Defensive Rebound.",11,10,1,0.873546053728793,"SMU","Temple",4,4,0,0,10.5,400988059,2018-01-10
43,1,"13:41",2021,2021,"Akoy Agau missed Jumper.",11,10,1,0.862764589086598,"SMU","Temple",4,4,0,0,10.5,400988059,2018-01-10
44,1,"13:41",2021,2021,"Ernest Aflakpui Block.",11,10,1,0.862764589086598,"SMU","Temple",4,4,0,0,10.5,400988059,2018-01-10
45,1,"13:39",2019,2019,"Jimmy Whitt Offensive Rebound.",11,10,1,0.862885443508027,"SMU","Temple",4,4,0,0,10.5,400988059,2018-01-10
46,1,"13:35",2015,2015,"Akoy Agau missed Three Point Jumper.",11,10,1,0.862885443508027,"SMU","Temple",4,4,0,0,10.5,400988059,2018-01-10
47,1,"13:35",2015,2015,"Josh Brown Defensive Rebound.",11,10,1,0.862885443508027,"SMU","Temple",4,4,0,0,10.5,400988059,2018-01-10
48,1,"13:23",2003,2003,"Shizz Alston Jr. missed Three Point Jumper.",11,10,1,0.856463687013423,"SMU","Temple",4,4,0,0,10.5,400988059,2018-01-10
49,1,"13:23",2003,2003,"Akoy Agau Defensive Rebound.",11,10,1,0.856463687013423,"SMU","Temple",4,4,0,0,10.5,400988059,2018-01-10
50,1,"13:13",1993,1993,"Foul on Quinton Rose.",11,10,1,0.863586954571712,"SMU","Temple",4,4,0,0,10.5,400988059,2018-01-10
51,1,"12:53",1973,1973,"Jarrey Foster missed Three Point Jumper.",11,10,1,0.868027063568859,"SMU","Temple",4,4,0,0,10.5,400988059,2018-01-10
52,1,"12:53",1973,1973,"Akoy Agau Offensive Rebound.",11,10,1,0.868027063568859,"SMU","Temple",4,4,0,0,10.5,400988059,2018-01-10
53,1,"12:49",1969,1969,"Foul on Damion Moore.",11,10,1,0.858951817677788,"SMU","Temple",4,4,0,0,10.5,400988059,2018-01-10
54,1,"12:27",1947,1947,"Jarrey Foster missed Jumper.",11,10,1,0.857578865409453,"SMU","Temple",4,4,0,0,10.5,400988059,2018-01-10
55,1,"12:27",1947,1947,"Nate Pierre-Louis Defensive Rebound.",11,10,1,0.857578865409453,"SMU","Temple",4,4,0,0,10.5,400988059,2018-01-10
56,1,"11:57",1917,1917,"Josh Brown missed Jumper.",11,10,1,0.865574711572003,"SMU","Temple",4,4,0,0,10.5,400988059,2018-01-10
57,1,"11:57",1917,1917,"Jahmal McMurray Defensive Rebound.",11,10,1,0.865574711572003,"SMU","Temple",4,4,0,0,10.5,400988059,2018-01-10
58,1,"11:50",1910,1910,"Shake Milton made Three Point Jumper.",14,10,4,0.904582523778275,"SMU","Temple",4,4,0,0,10.5,400988059,2018-01-10
59,1,"11:34",1894,1894,"Foul on Jahmal McMurray.",14,10,4,0.898670643825134,"SMU","Temple",4,4,0,0,10.5,400988059,2018-01-10
60,1,"11:34",1894,1894,"Official TV Timeout",14,10,4,0.898670643825134,"SMU","Temple",4,4,0,0,10.5,400988059,2018-01-10
61,1,"11:22",1882,1882,"Obi Enechionyia made Jumper. Assisted by Josh Brown.",14,12,2,0.872433957518744,"SMU","Temple",4,4,0,0,10.5,400988059,2018-01-10
62,1,"11:00",1860,1860,"Foul on Nate Pierre-Louis.",14,12,2,0.870603278189423,"SMU","Temple",4,4,0,0,10.5,400988059,2018-01-10
63,1,"10:44",1844,1844,"Jahmal McMurray made Layup.",16,12,4,0.891190380575776,"SMU","Temple",4,4,0,0,10.5,400988059,2018-01-10
64,1,"10:15",1815,1815,"Josh Brown Turnover.",16,12,4,0.900054884845956,"SMU","Temple",4,4,0,0,10.5,400988059,2018-01-10
65,1,"10:15",1815,1815,"Foul on Josh Brown.",16,12,4,0.900054884845956,"SMU","Temple",4,4,0,0,10.5,400988059,2018-01-10
66,1,"9:58",1798,1798,"Jahmal McMurray Turnover.",16,12,4,0.889119139228913,"SMU","Temple",4,4,0,0,10.5,400988059,2018-01-10
67,1,"9:58",1798,1798,"Foul on Jahmal McMurray.",16,12,4,0.889119139228913,"SMU","Temple",4,4,0,0,10.5,400988059,2018-01-10
68,1,"9:39",1779,1779,"Obi Enechionyia missed Three Point Jumper.",16,12,4,0.886361031620105,"SMU","Temple",4,4,0,0,10.5,400988059,2018-01-10
69,1,"9:39",1779,1779,"Nate Pierre-Louis Offensive Rebound.",16,12,4,0.886361031620105,"SMU","Temple",4,4,0,0,10.5,400988059,2018-01-10
70,1,"9:33",1773,1773,"Alani Moore II missed Three Point Jumper.",16,12,4,0.886361031620105,"SMU","Temple",4,4,0,0,10.5,400988059,2018-01-10
71,1,"9:33",1773,1773,"Jimmy Whitt Defensive Rebound.",16,12,4,0.886361031620105,"SMU","Temple",4,4,0,0,10.5,400988059,2018-01-10
72,1,"9:23",1763,1763,"Jarrey Foster missed Three Point Jumper.",16,12,4,0.901596326137102,"SMU","Temple",4,4,0,0,10.5,400988059,2018-01-10
73,1,"9:23",1763,1763,"Nate Pierre-Louis Defensive Rebound.",16,12,4,0.901596326137102,"SMU","Temple",4,4,0,0,10.5,400988059,2018-01-10
74,1,"9:15",1755,1755,"Nate Pierre-Louis missed Layup.",16,12,4,0.896467687842275,"SMU","Temple",4,4,0,0,10.5,400988059,2018-01-10
75,1,"9:15",1755,1755,"Ben Emelogu II Defensive Rebound.",16,12,4,0.896467687842275,"SMU","Temple",4,4,0,0,10.5,400988059,2018-01-10
76,1,"9:12",1752,1752,"Ben Emelogu II Turnover.",16,12,4,0.896467687842275,"SMU","Temple",4,4,0,0,10.5,400988059,2018-01-10
77,1,"9:11",1751,1751,"Alani Moore II Steal.",16,12,4,0.896467687842275,"SMU","Temple",4,4,0,0,10.5,400988059,2018-01-10
78,1,"9:09",1749,1749,"Shizz Alston Jr. made Three Point Jumper. Assisted by Alani Moore II.",16,15,1,0.846408619918569,"SMU","Temple",4,4,0,0,10.5,400988059,2018-01-10
79,1,"8:47",1727,1727,"Ethan Chargois missed Three Point Jumper.",16,15,1,0.838821503137634,"SMU","Temple",4,4,0,0,10.5,400988059,2018-01-10
80,1,"8:47",1727,1727,"Shizz Alston Jr. Defensive Rebound.",16,15,1,0.838821503137634,"SMU","Temple",4,4,0,0,10.5,400988059,2018-01-10
81,1,"8:35",1715,1715,"Nate Pierre-Louis made Three Point Jumper. Assisted by Obi Enechionyia.",16,18,-2,0.802870305622471,"SMU","Temple",4,4,0,0,10.5,400988059,2018-01-10
82,1,"8:11",1691,1691,"Foul on De'Vondre Perry.",16,18,-2,0.783589038190805,"SMU","Temple",4,4,0,0,10.5,400988059,2018-01-10
83,1,"8:10",1690,1690,"Jarrey Foster missed Jumper.",16,18,-2,0.783589038190805,"SMU","Temple",4,4,0,0,10.5,400988059,2018-01-10
84,1,"8:10",1690,1690,"Nate Pierre-Louis Defensive Rebound.",16,18,-2,0.783589038190805,"SMU","Temple",4,4,0,0,10.5,400988059,2018-01-10
85,1,"7:53",1673,1673,"De'Vondre Perry missed Three Point Jumper.",16,18,-2,0.790843758936942,"SMU","Temple",4,4,0,0,10.5,400988059,2018-01-10
86,1,"7:53",1673,1673,"Shake Milton Defensive Rebound.",16,18,-2,0.790843758936942,"SMU","Temple",4,4,0,0,10.5,400988059,2018-01-10
87,1,"7:44",1664,1664,"Ben Emelogu II made Three Point Jumper. Assisted by Jimmy Whitt.",19,18,1,0.847305629252603,"SMU","Temple",4,4,0,0,10.5,400988059,2018-01-10
88,1,"7:15",1635,1635,"De'Vondre Perry made Three Point Jumper. Assisted by Alani Moore II.",19,21,-2,0.789123385986545,"SMU","Temple",4,4,0,0,10.5,400988059,2018-01-10
89,1,"6:49",1609,1609,"Shake Milton made Jumper.",21,21,0,0.829572497598379,"SMU","Temple",4,4,0,0,10.5,400988059,2018-01-10
90,1,"6:34",1594,1594,"Shizz Alston Jr. missed Jumper.",21,21,0,0.823628556329345,"SMU","Temple",4,4,0,0,10.5,400988059,2018-01-10
91,1,"6:34",1594,1594,"Jimmy Whitt Defensive Rebound.",21,21,0,0.823628556329345,"SMU","Temple",4,4,0,0,10.5,400988059,2018-01-10
92,1,"6:24",1584,1584,"Ethan Chargois made Layup. Assisted by Shake Milton.",23,21,2,0.858460260032467,"SMU","Temple",4,4,0,0,10.5,400988059,2018-01-10
93,1,"6:24",1584,1584,"Foul on Obi Enechionyia.",23,21,2,0.858460260032467,"SMU","Temple",4,4,0,0,10.5,400988059,2018-01-10
94,1,"6:24",1584,1584,"Official TV Timeout",23,21,2,0.858460260032467,"SMU","Temple",4,4,0,0,10.5,400988059,2018-01-10
95,1,"6:24",1584,1584,"Ethan Chargois missed Free Throw.",23,21,2,0.858460260032467,"SMU","Temple",4,4,0,0,10.5,400988059,2018-01-10
96,1,"6:24",1584,1584,"Nate Pierre-Louis Defensive Rebound.",23,21,2,0.858460260032467,"SMU","Temple",4,4,0,0,10.5,400988059,2018-01-10
97,1,"6:08",1568,1568,"De'Vondre Perry missed Three Point Jumper.",23,21,2,0.855240991317872,"SMU","Temple",4,4,0,0,10.5,400988059,2018-01-10
98,1,"6:08",1568,1568,"Jimmy Whitt Defensive Rebound.",23,21,2,0.855240991317872,"SMU","Temple",4,4,0,0,10.5,400988059,2018-01-10
99,1,"6:00",1560,1560,"Jimmy Whitt Turnover.",23,21,2,0.855240991317872,"SMU","Temple",4,4,0,0,10.5,400988059,2018-01-10
100,1,"5:58",1558,1558,"Ernest Aflakpui Steal.",23,21,2,0.852621442380767,"SMU","Temple",4,4,0,0,10.5,400988059,2018-01-10
101,1,"5:45",1545,1545,"Shizz Alston Jr. Turnover.",23,21,2,0.864636001191276,"SMU","Temple",4,4,0,0,10.5,400988059,2018-01-10
102,1,"5:16",1516,1516,"Elijah Landrum made Jumper.",25,21,4,0.89670727876564,"SMU","Temple",4,4,0,0,10.5,400988059,2018-01-10
103,1,"4:52",1492,1492,"Obi Enechionyia missed Three Point Jumper.",25,21,4,0.893599584261986,"SMU","Temple",4,4,0,0,10.5,400988059,2018-01-10
104,1,"4:52",1492,1492,"Obi Enechionyia Offensive Rebound.",25,21,4,0.893599584261986,"SMU","Temple",4,4,0,0,10.5,400988059,2018-01-10
105,1,"4:46",1486,1486,"Nate Pierre-Louis made Layup. Assisted by Obi Enechionyia.",25,23,2,0.856376651043908,"SMU","Temple",4,4,0,0,10.5,400988059,2018-01-10
106,1,"4:23",1463,1463,"Ethan Chargois missed Jumper.",25,23,2,0.84443915597399,"SMU","Temple",4,4,0,0,10.5,400988059,2018-01-10
107,1,"4:23",1463,1463,"Ethan Chargois Offensive Rebound.",25,23,2,0.84443915597399,"SMU","Temple",4,4,0,0,10.5,400988059,2018-01-10
108,1,"4:20",1460,1460,"Ethan Chargois missed Two Point Tip Shot.",25,23,2,0.84443915597399,"SMU","Temple",4,4,0,0,10.5,400988059,2018-01-10
109,1,"4:20",1460,1460,"Shizz Alston Jr. Defensive Rebound.",25,23,2,0.84443915597399,"SMU","Temple",4,4,0,0,10.5,400988059,2018-01-10
110,1,"4:15",1455,1455,"Alani Moore II made Three Point Jumper. Assisted by J.P. Moorman II.",25,26,-1,0.79067146097864,"SMU","Temple",4,4,0,0,10.5,400988059,2018-01-10
111,1,"3:46",1426,1426,"Elijah Landrum Turnover.",25,26,-1,0.778475658153333,"SMU","Temple",4,4,0,0,10.5,400988059,2018-01-10
112,1,"3:46",1426,1426,"Official TV Timeout",25,26,-1,0.778475658153333,"SMU","Temple",4,4,0,0,10.5,400988059,2018-01-10
113,1,"3:22",1402,1402,"J.P. Moorman II missed Jumper.",25,26,-1,0.802834889588521,"SMU","Temple",4,4,0,0,10.5,400988059,2018-01-10
114,1,"3:22",1402,1402,"Obi Enechionyia Offensive Rebound.",25,26,-1,0.802834889588521,"SMU","Temple",4,4,0,0,10.5,400988059,2018-01-10
115,1,"3:20",1400,1400,"Obi Enechionyia missed Two Point Tip Shot.",25,26,-1,0.802834889588521,"SMU","Temple",4,4,0,0,10.5,400988059,2018-01-10
116,1,"3:20",1400,1400,"Obi Enechionyia Offensive Rebound.",25,26,-1,0.802834889588521,"SMU","Temple",4,4,0,0,10.5,400988059,2018-01-10
117,1,"3:18",1398,1398,"Obi Enechionyia missed Layup.",25,26,-1,0.800146612145006,"SMU","Temple",4,4,0,0,10.5,400988059,2018-01-10
118,1,"3:18",1398,1398,"Ben Emelogu II Block.",25,26,-1,0.800146612145006,"SMU","Temple",4,4,0,0,10.5,400988059,2018-01-10
119,1,"3:16",1396,1396,"Shake Milton Defensive Rebound.",25,26,-1,0.800146612145006,"SMU","Temple",4,4,0,0,10.5,400988059,2018-01-10
120,1,"2:54",1374,1374,"Foul on Alani Moore II.",25,26,-1,0.784380552300545,"SMU","Temple",4,4,0,0,10.5,400988059,2018-01-10
121,1,"2:54",1374,1374,"Jimmy Whitt missed Free Throw.",25,26,-1,0.784380552300545,"SMU","Temple",4,4,0,0,10.5,400988059,2018-01-10
122,1,"2:54",1374,1374,"Nate Pierre-Louis Defensive Rebound.",25,26,-1,0.784380552300545,"SMU","Temple",4,4,0,0,10.5,400988059,2018-01-10
123,1,"2:49",1369,1369,"Nate Pierre-Louis missed Jumper.",25,26,-1,0.786276573309611,"SMU","Temple",4,4,0,0,10.5,400988059,2018-01-10
124,1,"2:49",1369,1369,"Jimmy Whitt Defensive Rebound.",25,26,-1,0.786276573309611,"SMU","Temple",4,4,0,0,10.5,400988059,2018-01-10
125,1,"2:30",1350,1350,"Ben Emelogu II made Three Point Jumper. Assisted by Jarrey Foster.",28,26,2,0.859619001951968,"SMU","Temple",4,4,0,0,10.5,400988059,2018-01-10
126,1,"2:12",1332,1332,"Obi Enechionyia made Three Point Jumper. Assisted by Alani Moore II.",28,29,-1,0.771133216005044,"SMU","Temple",4,4,0,0,10.5,400988059,2018-01-10
127,1,"1:46",1306,1306,"Ben Emelogu II missed Three Point Jumper.",28,29,-1,0.772107537710451,"SMU","Temple",4,4,0,0,10.5,400988059,2018-01-10
128,1,"1:46",1306,1306,"J.P. Moorman II Defensive Rebound.",28,29,-1,0.772107537710451,"SMU","Temple",4,4,0,0,10.5,400988059,2018-01-10
129,1,"1:34",1294,1294,"Foul on Jarrey Foster.",28,29,-1,0.775982484626535,"SMU","Temple",4,4,1,0,10.5,400988059,2018-01-10
130,1,"1:34",1294,1294,"Obi Enechionyia missed Free Throw.",28,29,-1,0.775982484626535,"SMU","Temple",4,4,1,0,10.5,400988059,2018-01-10
131,1,"1:34",1294,1294,"Temple Deadball Team Rebound.",28,29,-1,0.775982484626535,"SMU","Temple",4,4,1,0,10.5,400988059,2018-01-10
132,1,"1:34",1294,1294,"SMU  Timeout",28,29,-1,0.775982484626535,"SMU","Temple",3,4,1,0,10.5,400988059,2018-01-10
133,1,"1:34",1294,1294,"Obi Enechionyia made Free Throw.",28,30,-2,0.745541722439478,"SMU","Temple",3,4,1,0,10.5,400988059,2018-01-10
134,1,"1:06",1266,1266,"William Douglas missed Jumper.",28,30,-2,0.768513613927088,"SMU","Temple",3,4,1,0,10.5,400988059,2018-01-10
135,1,"1:06",1266,1266,"Ernest Aflakpui Defensive Rebound.",28,30,-2,0.768513613927088,"SMU","Temple",3,4,1,0,10.5,400988059,2018-01-10
136,1,"0:54",1254,1254,"Quinton Rose made Jumper.",28,32,-4,0.673875256257023,"SMU","Temple",3,4,1,0,10.5,400988059,2018-01-10
137,1,"0:27",1227,1227,"Shake Milton missed Three Point Jumper.",28,32,-4,0.675884186761721,"SMU","Temple",3,4,0,0,10.5,400988059,2018-01-10
138,1,"0:27",1227,1227,"Shizz Alston Jr. Defensive Rebound.",28,32,-4,0.675884186761721,"SMU","Temple",3,4,0,0,10.5,400988059,2018-01-10
139,1,"0:18",1218,1218,"Temple  Timeout",28,32,-4,0.663708678969268,"SMU","Temple",3,3,0,1,10.5,400988059,2018-01-10
140,1,"0:03",1203,1203,"Shizz Alston Jr. made Jumper. Assisted by Quinton Rose.",28,34,-6,0.608996232935772,"SMU","Temple",3,3,0,1,10.5,400988059,2018-01-10
141,1,"0:00",1200,1200,"End of 1st half",28,34,-6,0.608996232935772,"SMU","Temple",3,3,0,1,10.5,400988059,2018-01-10
142,2,"20:00",1200,1200,"PLAY",28,34,-6,0.608996232935772,"SMU","Temple",4,4,0,0,10.5,400988059,2018-01-10
143,2,"19:42",1182,1182,"Ernest Aflakpui missed Layup.",28,34,-6,0.601487885867163,"SMU","Temple",4,4,0,0,10.5,400988059,2018-01-10
144,2,"19:42",1182,1182,"Jimmy Whitt Defensive Rebound.",28,34,-6,0.601487885867163,"SMU","Temple",4,4,0,0,10.5,400988059,2018-01-10
145,2,"19:40",1180,1180,"Foul on Ernest Aflakpui.",28,34,-6,0.601487885867163,"SMU","Temple",4,4,0,0,10.5,400988059,2018-01-10
146,2,"19:20",1160,1160,"Jimmy Whitt missed Jumper.",28,34,-6,0.593747569649559,"SMU","Temple",4,4,0,0,10.5,400988059,2018-01-10
147,2,"19:20",1160,1160,"Temple Defensive Rebound.",28,34,-6,0.593747569649559,"SMU","Temple",4,4,0,0,10.5,400988059,2018-01-10
148,2,"18:56",1136,1136,"Obi Enechionyia missed Three Point Jumper.",28,34,-6,0.608610090271377,"SMU","Temple",4,4,0,0,10.5,400988059,2018-01-10
149,2,"18:56",1136,1136,"Jimmy Whitt Defensive Rebound.",28,34,-6,0.608610090271377,"SMU","Temple",4,4,0,0,10.5,400988059,2018-01-10
150,2,"18:40",1120,1120,"Shake Milton made Three Point Jumper. Assisted by Jarrey Foster.",31,34,-3,0.686451613517129,"SMU","Temple",4,4,0,0,10.5,400988059,2018-01-10
151,2,"18:20",1100,1100,"Obi Enechionyia Turnover.",31,34,-3,0.711925800815594,"SMU","Temple",4,4,0,0,10.5,400988059,2018-01-10
152,2,"18:18",1098,1098,"Shake Milton Steal.",31,34,-3,0.70951717083213,"SMU","Temple",4,4,0,0,10.5,400988059,2018-01-10
153,2,"18:17",1097,1097,"Shake Milton Turnover.",31,34,-3,0.70951717083213,"SMU","Temple",4,4,0,0,10.5,400988059,2018-01-10
154,2,"18:16",1096,1096,"Quinton Rose Steal.",31,34,-3,0.70951717083213,"SMU","Temple",4,4,0,0,10.5,400988059,2018-01-10
155,2,"18:13",1093,1093,"Obi Enechionyia missed Three Point Jumper.",31,34,-3,0.70951717083213,"SMU","Temple",4,4,0,0,10.5,400988059,2018-01-10
156,2,"18:13",1093,1093,"Shizz Alston Jr. Offensive Rebound.",31,34,-3,0.70951717083213,"SMU","Temple",4,4,0,0,10.5,400988059,2018-01-10
157,2,"17:59",1079,1079,"Shizz Alston Jr. missed Three Point Jumper.",31,34,-3,0.691330714949797,"SMU","Temple",4,4,0,0,10.5,400988059,2018-01-10
158,2,"17:59",1079,1079,"Ernest Aflakpui Offensive Rebound.",31,34,-3,0.691330714949797,"SMU","Temple",4,4,0,0,10.5,400988059,2018-01-10
159,2,"17:55",1075,1075,"Foul on Shake Milton.",31,34,-3,0.691330714949797,"SMU","Temple",4,4,0,0,10.5,400988059,2018-01-10
160,2,"17:52",1072,1072,"Quinton Rose made Layup.",31,36,-5,0.615269233506306,"SMU","Temple",4,4,0,0,10.5,400988059,2018-01-10
161,2,"17:29",1049,1049,"Jimmy Whitt missed Jumper.",31,36,-5,0.626693445951951,"SMU","Temple",4,4,0,0,10.5,400988059,2018-01-10
162,2,"17:29",1049,1049,"Ernest Aflakpui Defensive Rebound.",31,36,-5,0.626693445951951,"SMU","Temple",4,4,0,0,10.5,400988059,2018-01-10
163,2,"17:28",1048,1048,"Foul on Ethan Chargois.",31,36,-5,0.626693445951951,"SMU","Temple",4,4,0,0,10.5,400988059,2018-01-10
164,2,"17:10",1030,1030,"Quinton Rose made Layup.",31,38,-7,0.529397560884748,"SMU","Temple",4,4,0,0,10.5,400988059,2018-01-10
165,2,"17:10",1030,1030,"Foul on Jimmy Whitt.",31,38,-7,0.529397560884748,"SMU","Temple",4,4,0,0,10.5,400988059,2018-01-10
166,2,"17:10",1030,1030,"Quinton Rose made Free Throw.",31,39,-8,0.486549908755374,"SMU","Temple",4,4,0,0,10.5,400988059,2018-01-10
167,2,"16:52",1012,1012,"Ethan Chargois made Jumper. Assisted by Shake Milton.",33,39,-6,0.519510280411822,"SMU","Temple",4,4,0,0,10.5,400988059,2018-01-10
168,2,"16:47",1007,1007,"Quinton Rose made Three Point Jumper. Assisted by Josh Brown.",33,42,-9,0.384931215453604,"SMU","Temple",4,4,0,0,10.5,400988059,2018-01-10
169,2,"16:31",991,991,"Ethan Chargois missed Three Point Jumper.",33,42,-9,0.410931287912784,"SMU","Temple",4,4,0,0,10.5,400988059,2018-01-10
170,2,"16:31",991,991,"Obi Enechionyia Defensive Rebound.",33,42,-9,0.410931287912784,"SMU","Temple",4,4,0,0,10.5,400988059,2018-01-10
171,2,"16:22",982,982,"Shizz Alston Jr. missed Three Point Jumper.",33,42,-9,0.366522438773041,"SMU","Temple",4,4,0,0,10.5,400988059,2018-01-10
172,2,"16:22",982,982,"Shake Milton Defensive Rebound.",33,42,-9,0.366522438773041,"SMU","Temple",4,4,0,0,10.5,400988059,2018-01-10
173,2,"16:04",964,964,"Foul on Ernest Aflakpui.",33,42,-9,0.380214448600564,"SMU","Temple",4,4,0,0,10.5,400988059,2018-01-10
174,2,"15:58",958,958,"Ben Emelogu II missed Three Point Jumper.",33,42,-9,0.400263237687206,"SMU","Temple",4,4,0,0,10.5,400988059,2018-01-10
175,2,"15:58",958,958,"Shake Milton Offensive Rebound.",33,42,-9,0.400263237687206,"SMU","Temple",4,4,0,0,10.5,400988059,2018-01-10
176,2,"15:54",954,954,"Jahmal McMurray made Three Point Jumper. Assisted by Shake Milton.",36,42,-6,0.542230610963826,"SMU","Temple",4,4,0,0,10.5,400988059,2018-01-10
177,2,"15:19",919,919,"Shizz Alston Jr. missed Jumper.",36,42,-6,0.539172752857829,"SMU","Temple",4,4,0,0,10.5,400988059,2018-01-10
178,2,"15:19",919,919,"Shizz Alston Jr. Offensive Rebound.",36,42,-6,0.539172752857829,"SMU","Temple",4,4,0,0,10.5,400988059,2018-01-10
179,2,"15:17",917,917,"Shizz Alston Jr. missed Two Point Tip Shot.",36,42,-6,0.539172752857829,"SMU","Temple",4,4,0,0,10.5,400988059,2018-01-10
180,2,"15:17",917,917,"Josh Brown Offensive Rebound.",36,42,-6,0.539172752857829,"SMU","Temple",4,4,0,0,10.5,400988059,2018-01-10
181,2,"15:00",900,900,"Ernest Aflakpui Turnover.",36,42,-6,0.514964226617531,"SMU","Temple",4,4,0,0,10.5,400988059,2018-01-10
182,2,"15:00",900,900,"Foul on Ernest Aflakpui.",36,42,-6,0.514964226617531,"SMU","Temple",4,4,0,0,10.5,400988059,2018-01-10
183,2,"15:00",900,900,"Official TV Timeout",36,42,-6,0.514964226617531,"SMU","Temple",4,4,0,0,10.5,400988059,2018-01-10
184,2,"14:39",879,879,"Jarrey Foster missed Three Point Jumper.",36,42,-6,0.524600519907606,"SMU","Temple",4,4,0,0,10.5,400988059,2018-01-10
185,2,"14:39",879,879,"Obi Enechionyia Defensive Rebound.",36,42,-6,0.524600519907606,"SMU","Temple",4,4,0,0,10.5,400988059,2018-01-10
186,2,"14:31",871,871,"Quinton Rose made Layup.",36,44,-8,0.42879632803716,"SMU","Temple",4,4,0,0,10.5,400988059,2018-01-10
187,2,"14:31",871,871,"Foul on Akoy Agau.",36,44,-8,0.42879632803716,"SMU","Temple",4,4,0,0,10.5,400988059,2018-01-10
188,2,"14:31",871,871,"Quinton Rose made Free Throw.",36,45,-9,0.382397007546987,"SMU","Temple",4,4,0,0,10.5,400988059,2018-01-10
189,2,"14:22",862,862,"Foul on Josh Brown.",36,45,-9,0.373764682814439,"SMU","Temple",4,4,0,0,10.5,400988059,2018-01-10
190,2,"14:16",856,856,"Jahmal McMurray missed Three Point Jumper.",36,45,-9,0.35636988736641,"SMU","Temple",4,4,0,0,10.5,400988059,2018-01-10
191,2,"14:16",856,856,"Nate Pierre-Louis Defensive Rebound.",36,45,-9,0.35636988736641,"SMU","Temple",4,4,0,0,10.5,400988059,2018-01-10
192,2,"14:10",850,850,"Nate Pierre-Louis missed Layup.",36,45,-9,0.35636988736641,"SMU","Temple",4,4,0,0,10.5,400988059,2018-01-10
