"play_id","half","time_remaining_half","secs_remaining","secs_remaining_absolute","description","home_score","away_score","score_diff","win_prob","home","away","home_time_out_remaining","away_time_out_remaining","home_timeout_ind","away_timeout_ind","home_favored_by","game_id","date"
1,1,"20:00",2400,2400,"PLAY",0,0,0,0.823906478244314,"Iowa","Penn State",4,4,0,0,7.5,400915017,2017-03-05
2,1,"19:44",2384,2384,"Shep Garner missed Three Point Jumper.",0,0,0,0.819731139796127,"Iowa","Penn State",4,4,0,0,7.5,400915017,2017-03-05
3,1,"19:44",2384,2384,"Tyler Cook Defensive Rebound.",0,0,0,0.819731139796127,"Iowa","Penn State",4,4,0,0,7.5,400915017,2017-03-05
4,1,"19:31",2371,2371,"Peter Jok Turnover.",0,0,0,0.817583537350607,"Iowa","Penn State",4,4,0,0,7.5,400915017,2017-03-05
5,1,"19:30",2370,2370,"Shep Garner Steal.",0,0,0,0.817583537350607,"Iowa","Penn State",4,4,0,0,7.5,400915017,2017-03-05
6,1,"19:24",2364,2364,"Mike Watkins made Dunk. Assisted by Josh Reaves.",0,2,-2,0.793963007117498,"Iowa","Penn State",4,4,0,0,7.5,400915017,2017-03-05
7,1,"19:11",2351,2351,"Peter Jok missed Three Point Jumper.",0,2,-2,0.795471603128685,"Iowa","Penn State",4,4,0,0,7.5,400915017,2017-03-05
8,1,"19:11",2351,2351,"Josh Reaves Block.",0,2,-2,0.795471603128685,"Iowa","Penn State",4,4,0,0,7.5,400915017,2017-03-05
9,1,"19:10",2350,2350,"Dale Jones Offensive Rebound.",0,2,-2,0.795471603128685,"Iowa","Penn State",4,4,0,0,7.5,400915017,2017-03-05
10,1,"19:06",2346,2346,"Dale Jones made Three Point Jumper.",3,2,1,0.820937952555716,"Iowa","Penn State",4,4,0,0,7.5,400915017,2017-03-05
11,1,"18:48",2328,2328,"Josh Reaves made Layup. Assisted by Tony Carr.",3,4,-1,0.799512120415584,"Iowa","Penn State",4,4,0,0,7.5,400915017,2017-03-05
12,1,"18:41",2321,2321,"Isaiah Moss made Layup. Assisted by Jordan Bohannon.",5,4,1,0.83190481966905,"Iowa","Penn State",4,4,0,0,7.5,400915017,2017-03-05
13,1,"18:28",2308,2308,"Foul on Tyler Cook.",5,4,1,0.816424864162911,"Iowa","Penn State",4,4,0,0,7.5,400915017,2017-03-05
14,1,"18:13",2293,2293,"Lamar Stevens missed Layup.",5,4,1,0.827368636710207,"Iowa","Penn State",4,4,0,0,7.5,400915017,2017-03-05
15,1,"18:13",2293,2293,"Tyler Cook Defensive Rebound.",5,4,1,0.827368636710207,"Iowa","Penn State",4,4,0,0,7.5,400915017,2017-03-05
16,1,"18:03",2283,2283,"Dale Jones missed Three Point Jumper.",5,4,1,0.82142902442751,"Iowa","Penn State",4,4,0,0,7.5,400915017,2017-03-05
17,1,"18:03",2283,2283,"Shep Garner Defensive Rebound.",5,4,1,0.82142902442751,"Iowa","Penn State",4,4,0,0,7.5,400915017,2017-03-05
18,1,"18:01",2281,2281,"Foul on Peter Jok.",5,4,1,0.82142902442751,"Iowa","Penn State",4,4,0,0,7.5,400915017,2017-03-05
19,1,"17:42",2262,2262,"Lamar Stevens missed Jumper.",5,4,1,0.833995914751458,"Iowa","Penn State",4,4,0,0,7.5,400915017,2017-03-05
20,1,"17:42",2262,2262,"Jordan Bohannon Defensive Rebound.",5,4,1,0.833995914751458,"Iowa","Penn State",4,4,0,0,7.5,400915017,2017-03-05
21,1,"17:27",2247,2247,"Foul on Josh Reaves.",5,4,1,0.813990357841287,"Iowa","Penn State",4,4,0,0,7.5,400915017,2017-03-05
22,1,"17:27",2247,2247,"Jordan Bohannon made Free Throw.",6,4,2,0.827817447366709,"Iowa","Penn State",4,4,0,0,7.5,400915017,2017-03-05
23,1,"17:27",2247,2247,"Jordan Bohannon made Free Throw.",7,4,3,0.840817698096799,"Iowa","Penn State",4,4,0,0,7.5,400915017,2017-03-05
24,1,"17:27",2247,2247,"Jordan Bohannon made Free Throw.",8,4,4,0.85301068176988,"Iowa","Penn State",4,4,0,0,7.5,400915017,2017-03-05
25,1,"17:11",2231,2231,"Foul on Dale Jones.",8,4,4,0.868254340849815,"Iowa","Penn State",4,4,0,0,7.5,400915017,2017-03-05
26,1,"17:11",2231,2231,"Tony Carr made Free Throw.",8,5,3,0.85491476570067,"Iowa","Penn State",4,4,0,0,7.5,400915017,2017-03-05
27,1,"17:11",2231,2231,"Tony Carr made Free Throw.",8,6,2,0.840472687719457,"Iowa","Penn State",4,4,0,0,7.5,400915017,2017-03-05
28,1,"17:05",2225,2225,"Tyler Cook made Layup. Assisted by Jordan Bohannon.",10,6,4,0.865104577576043,"Iowa","Penn State",4,4,0,0,7.5,400915017,2017-03-05
29,1,"16:48",2208,2208,"Mike Watkins made Layup. Assisted by Tony Carr.",10,8,2,0.83870426967599,"Iowa","Penn State",4,4,0,0,7.5,400915017,2017-03-05
30,1,"16:48",2208,2208,"Foul on Dale Jones.",10,8,2,0.83870426967599,"Iowa","Penn State",4,4,0,0,7.5,400915017,2017-03-05
31,1,"16:48",2208,2208,"Mike Watkins made Free Throw.",10,9,1,0.82280406383151,"Iowa","Penn State",4,4,0,0,7.5,400915017,2017-03-05
32,1,"16:34",2194,2194,"Jordan Bohannon missed Three Point Jumper.",10,9,1,0.832052613900486,"Iowa","Penn State",4,4,0,0,7.5,400915017,2017-03-05
33,1,"16:34",2194,2194,"Peter Jok Offensive Rebound.",10,9,1,0.832052613900486,"Iowa","Penn State",4,4,0,0,7.5,400915017,2017-03-05
34,1,"16:23",2183,2183,"Tyler Cook made Dunk. Assisted by Peter Jok.",12,9,3,0.85131408241843,"Iowa","Penn State",4,4,0,0,7.5,400915017,2017-03-05
35,1,"16:23",2183,2183,"Foul on Mike Watkins.",12,9,3,0.85131408241843,"Iowa","Penn State",4,4,0,0,7.5,400915017,2017-03-05
36,1,"16:23",2183,2183,"Tyler Cook made Free Throw.",13,9,4,0.864534505843442,"Iowa","Penn State",4,4,0,0,7.5,400915017,2017-03-05
37,1,"16:05",2165,2165,"Tony Carr missed Jumper.",13,9,4,0.862288067817586,"Iowa","Penn State",4,4,0,0,7.5,400915017,2017-03-05
38,1,"16:05",2165,2165,"Mike Watkins Offensive Rebound.",13,9,4,0.862288067817586,"Iowa","Penn State",4,4,0,0,7.5,400915017,2017-03-05
39,1,"16:01",2161,2161,"Josh Reaves made Three Point Jumper. Assisted by Mike Watkins.",13,12,1,0.817977655665585,"Iowa","Penn State",4,4,0,0,7.5,400915017,2017-03-05
40,1,"15:51",2151,2151,"Ahmad Wagner missed Jumper.",13,12,1,0.817039057881397,"Iowa","Penn State",4,4,0,0,7.5,400915017,2017-03-05
41,1,"15:51",2151,2151,"Mike Watkins Block.",13,12,1,0.817039057881397,"Iowa","Penn State",4,4,0,0,7.5,400915017,2017-03-05
42,1,"15:49",2149,2149,"Josh Reaves Defensive Rebound.",13,12,1,0.82403816543172,"Iowa","Penn State",4,4,0,0,7.5,400915017,2017-03-05
43,1,"15:46",2146,2146,"Payton Banks made Three Point Jumper. Assisted by Josh Reaves.",13,15,-2,0.775562688138763,"Iowa","Penn State",4,4,0,0,7.5,400915017,2017-03-05
44,1,"15:40",2140,2140,"Jordan Bohannon Turnover.",13,15,-2,0.775562688138763,"Iowa","Penn State",4,4,0,0,7.5,400915017,2017-03-05
45,1,"15:40",2140,2140,"Official TV Timeout",13,15,-2,0.775562688138763,"Iowa","Penn State",4,4,0,0,7.5,400915017,2017-03-05
46,1,"15:35",2135,2135,"Shep Garner missed Three Point Jumper.",13,15,-2,0.761561491159742,"Iowa","Penn State",4,4,0,0,7.5,400915017,2017-03-05
47,1,"15:35",2135,2135,"Mike Watkins Offensive Rebound.",13,15,-2,0.761561491159742,"Iowa","Penn State",4,4,0,0,7.5,400915017,2017-03-05
48,1,"15:27",2127,2127,"Lamar Stevens missed Three Point Jumper.",13,15,-2,0.759367177355753,"Iowa","Penn State",4,4,0,0,7.5,400915017,2017-03-05
49,1,"15:27",2127,2127,"Payton Banks Offensive Rebound.",13,15,-2,0.759367177355753,"Iowa","Penn State",4,4,0,0,7.5,400915017,2017-03-05
50,1,"15:25",2125,2125,"Foul on Peter Jok.",13,15,-2,0.759367177355753,"Iowa","Penn State",4,4,0,0,7.5,400915017,2017-03-05
51,1,"15:21",2121,2121,"Payton Banks missed Three Point Jumper.",13,15,-2,0.759367177355753,"Iowa","Penn State",4,4,0,0,7.5,400915017,2017-03-05
52,1,"15:21",2121,2121,"Shep Garner Offensive Rebound.",13,15,-2,0.759367177355753,"Iowa","Penn State",4,4,0,0,7.5,400915017,2017-03-05
53,1,"15:12",2112,2112,"Payton Banks Turnover.",13,15,-2,0.769442412763595,"Iowa","Penn State",4,4,0,0,7.5,400915017,2017-03-05
54,1,"15:12",2112,2112,"Nicholas Baer Steal.",13,15,-2,0.769442412763595,"Iowa","Penn State",4,4,0,0,7.5,400915017,2017-03-05
55,1,"14:45",2085,2085,"Tyler Cook made Layup. Assisted by Nicholas Baer.",15,15,0,0.798472367454515,"Iowa","Penn State",4,4,0,0,7.5,400915017,2017-03-05
56,1,"14:20",2060,2060,"Julian Moore missed Jumper.",15,15,0,0.793147431054544,"Iowa","Penn State",4,4,0,0,7.5,400915017,2017-03-05
57,1,"14:20",2060,2060,"Tyler Cook Block.",15,15,0,0.793147431054544,"Iowa","Penn State",4,4,0,0,7.5,400915017,2017-03-05
58,1,"14:19",2059,2059,"Iowa Defensive Rebound.",15,15,0,0.805581583209301,"Iowa","Penn State",4,4,0,0,7.5,400915017,2017-03-05
59,1,"13:58",2038,2038,"Brady Ellingson missed Layup.",15,15,0,0.812657253173542,"Iowa","Penn State",4,4,0,0,7.5,400915017,2017-03-05
60,1,"13:58",2038,2038,"Tyler Cook Offensive Rebound.",15,15,0,0.812657253173542,"Iowa","Penn State",4,4,0,0,7.5,400915017,2017-03-05
61,1,"13:56",2036,2036,"Tyler Cook made Dunk.",17,15,2,0.844168869602053,"Iowa","Penn State",4,4,0,0,7.5,400915017,2017-03-05
62,1,"13:46",2026,2026,"Shep Garner missed Three Point Jumper.",17,15,2,0.835788824597137,"Iowa","Penn State",4,4,0,0,7.5,400915017,2017-03-05
63,1,"13:46",2026,2026,"Tyler Cook Defensive Rebound.",17,15,2,0.835788824597137,"Iowa","Penn State",4,4,0,0,7.5,400915017,2017-03-05
64,1,"13:26",2006,2006,"Tyler Cook missed Jumper.",17,15,2,0.826678746562726,"Iowa","Penn State",4,4,0,0,7.5,400915017,2017-03-05
65,1,"13:26",2006,2006,"Mike Watkins Defensive Rebound.",17,15,2,0.826678746562726,"Iowa","Penn State",4,4,0,0,7.5,400915017,2017-03-05
66,1,"13:26",2006,2006,"Foul on Nicholas Baer.",17,15,2,0.826678746562726,"Iowa","Penn State",4,4,0,0,7.5,400915017,2017-03-05
67,1,"13:06",1986,1986,"Lamar Stevens Turnover.",17,15,2,0.821009074391651,"Iowa","Penn State",4,4,0,0,7.5,400915017,2017-03-05
68,1,"13:06",1986,1986,"Foul on Lamar Stevens.",17,15,2,0.821009074391651,"Iowa","Penn State",4,4,0,0,7.5,400915017,2017-03-05
69,1,"12:41",1961,1961,"Nicholas Baer missed Jumper.",17,15,2,0.82854790967649,"Iowa","Penn State",4,4,0,0,7.5,400915017,2017-03-05
70,1,"12:41",1961,1961,"Nicholas Baer Offensive Rebound.",17,15,2,0.82854790967649,"Iowa","Penn State",4,4,0,0,7.5,400915017,2017-03-05
71,1,"12:31",1951,1951,"Jordan Bohannon missed Layup.",17,15,2,0.831935186739671,"Iowa","Penn State",4,4,0,0,7.5,400915017,2017-03-05
72,1,"12:31",1951,1951,"Mike Watkins Defensive Rebound.",17,15,2,0.831935186739671,"Iowa","Penn State",4,4,0,0,7.5,400915017,2017-03-05
73,1,"12:19",1939,1939,"Mike Watkins made Layup. Assisted by Tony Carr.",17,17,0,0.784130278002603,"Iowa","Penn State",4,4,0,0,7.5,400915017,2017-03-05
74,1,"12:09",1929,1929,"Jordan Bohannon Turnover.",17,17,0,0.797213730557286,"Iowa","Penn State",4,4,0,0,7.5,400915017,2017-03-05
75,1,"12:08",1928,1928,"Josh Reaves Steal.",17,17,0,0.797213730557286,"Iowa","Penn State",4,4,0,0,7.5,400915017,2017-03-05
76,1,"12:02",1922,1922,"Tony Carr missed Layup.",17,17,0,0.797213730557286,"Iowa","Penn State",4,4,0,0,7.5,400915017,2017-03-05
77,1,"12:02",1922,1922,"Nicholas Baer Defensive Rebound.",17,17,0,0.797213730557286,"Iowa","Penn State",4,4,0,0,7.5,400915017,2017-03-05
78,1,"11:56",1916,1916,"Ahmad Wagner made Layup. Assisted by Jordan Bohannon.",19,17,2,0.840837900849681,"Iowa","Penn State",4,4,0,0,7.5,400915017,2017-03-05
79,1,"11:56",1916,1916,"Foul on Mike Watkins.",19,17,2,0.840837900849681,"Iowa","Penn State",4,4,0,0,7.5,400915017,2017-03-05
80,1,"11:56",1916,1916,"Official TV Timeout",19,17,2,0.840837900849681,"Iowa","Penn State",4,4,0,0,7.5,400915017,2017-03-05
81,1,"11:56",1916,1916,"Ahmad Wagner made Free Throw.",20,17,3,0.857345815196467,"Iowa","Penn State",4,4,0,0,7.5,400915017,2017-03-05
82,1,"11:33",1893,1893,"Julian Moore made Dunk. Assisted by Josh Reaves.",20,19,1,0.811912187257035,"Iowa","Penn State",4,4,0,0,7.5,400915017,2017-03-05
83,1,"11:14",1874,1874,"Ahmad Wagner missed Jumper.",20,19,1,0.808608311835132,"Iowa","Penn State",4,4,0,0,7.5,400915017,2017-03-05
84,1,"11:14",1874,1874,"Julian Moore Defensive Rebound.",20,19,1,0.808608311835132,"Iowa","Penn State",4,4,0,0,7.5,400915017,2017-03-05
85,1,"11:06",1866,1866,"Josh Reaves made Three Point Jumper. Assisted by Shep Garner.",20,22,-2,0.742709543911866,"Iowa","Penn State",4,4,0,0,7.5,400915017,2017-03-05
86,1,"10:45",1845,1845,"Foul on Shep Garner.",20,22,-2,0.736218074409108,"Iowa","Penn State",4,4,0,0,7.5,400915017,2017-03-05
87,1,"10:33",1833,1833,"Cordell Pemsl made Layup. Assisted by Christian Williams.",22,22,0,0.785904318166525,"Iowa","Penn State",4,4,0,0,7.5,400915017,2017-03-05
88,1,"10:15",1815,1815,"Shep Garner missed Three Point Jumper.",22,22,0,0.789294399658751,"Iowa","Penn State",4,4,0,0,7.5,400915017,2017-03-05
89,1,"10:15",1815,1815,"Brady Ellingson Defensive Rebound.",22,22,0,0.789294399658751,"Iowa","Penn State",4,4,0,0,7.5,400915017,2017-03-05
90,1,"10:08",1808,1808,"Cordell Pemsl made Layup. Assisted by Brady Ellingson.",24,22,2,0.826642632622954,"Iowa","Penn State",4,4,0,0,7.5,400915017,2017-03-05
91,1,"9:49",1789,1789,"Shep Garner made Three Point Jumper. Assisted by Lamar Stevens.",24,25,-1,0.739766238617612,"Iowa","Penn State",4,4,0,0,7.5,400915017,2017-03-05
92,1,"9:18",1758,1758,"Cordell Pemsl Turnover.",24,25,-1,0.753594441595022,"Iowa","Penn State",4,4,0,0,7.5,400915017,2017-03-05
93,1,"9:18",1758,1758,"Julian Moore Steal.",24,25,-1,0.753594441595022,"Iowa","Penn State",4,4,0,0,7.5,400915017,2017-03-05
94,1,"9:15",1755,1755,"Foul on Brady Ellingson.",24,25,-1,0.753594441595022,"Iowa","Penn State",4,4,0,0,7.5,400915017,2017-03-05
95,1,"9:15",1755,1755,"Tony Carr missed Free Throw.",24,25,-1,0.753594441595022,"Iowa","Penn State",4,4,0,0,7.5,400915017,2017-03-05
96,1,"9:15",1755,1755,"Penn State Deadball Team Rebound.",24,25,-1,0.753594441595022,"Iowa","Penn State",4,4,0,0,7.5,400915017,2017-03-05
97,1,"9:15",1755,1755,"Tony Carr missed Free Throw.",24,25,-1,0.753594441595022,"Iowa","Penn State",4,4,0,0,7.5,400915017,2017-03-05
98,1,"9:15",1755,1755,"Ahmad Wagner Defensive Rebound.",24,25,-1,0.753594441595022,"Iowa","Penn State",4,4,0,0,7.5,400915017,2017-03-05
99,1,"8:55",1735,1735,"Brady Ellingson made Three Point Jumper. Assisted by Christian Williams.",27,25,2,0.82727971046829,"Iowa","Penn State",4,4,0,0,7.5,400915017,2017-03-05
100,1,"8:30",1710,1710,"Shep Garner missed Three Point Jumper.",27,25,2,0.833243445703707,"Iowa","Penn State",4,4,0,0,7.5,400915017,2017-03-05
101,1,"8:30",1710,1710,"Brady Ellingson Defensive Rebound.",27,25,2,0.833243445703707,"Iowa","Penn State",4,4,0,0,7.5,400915017,2017-03-05
102,1,"8:09",1689,1689,"Brady Ellingson missed Jumper.",27,25,2,0.834680541049188,"Iowa","Penn State",4,4,0,0,7.5,400915017,2017-03-05
103,1,"8:09",1689,1689,"Cordell Pemsl Offensive Rebound.",27,25,2,0.834680541049188,"Iowa","Penn State",4,4,0,0,7.5,400915017,2017-03-05
104,1,"8:07",1687,1687,"Cordell Pemsl made Two Point Tip Shot.",29,25,4,0.871005930687339,"Iowa","Penn State",4,4,0,0,7.5,400915017,2017-03-05
105,1,"7:44",1664,1664,"Payton Banks Turnover.",29,25,4,0.856778533134417,"Iowa","Penn State",4,4,0,0,7.5,400915017,2017-03-05
106,1,"7:44",1664,1664,"Foul on Payton Banks.",29,25,4,0.856778533134417,"Iowa","Penn State",4,4,0,0,7.5,400915017,2017-03-05
107,1,"7:44",1664,1664,"Official TV Timeout",29,25,4,0.856778533134417,"Iowa","Penn State",4,4,0,0,7.5,400915017,2017-03-05
108,1,"7:15",1635,1635,"Jordan Bohannon missed Layup.",29,25,4,0.859092649282348,"Iowa","Penn State",4,4,0,0,7.5,400915017,2017-03-05
109,1,"7:15",1635,1635,"Julian Moore Defensive Rebound.",29,25,4,0.859092649282348,"Iowa","Penn State",4,4,0,0,7.5,400915017,2017-03-05
110,1,"6:50",1610,1610,"Tony Carr missed Three Point Jumper.",29,25,4,0.848379636194657,"Iowa","Penn State",4,4,0,0,7.5,400915017,2017-03-05
111,1,"6:50",1610,1610,"Tyler Cook Defensive Rebound.",29,25,4,0.848379636194657,"Iowa","Penn State",4,4,0,0,7.5,400915017,2017-03-05
112,1,"6:32",1592,1592,"Nicholas Baer made Three Point Jumper. Assisted by Cordell Pemsl.",32,25,7,0.900012199081825,"Iowa","Penn State",4,4,0,0,7.5,400915017,2017-03-05
113,1,"6:14",1574,1574,"Isaiah Washington missed Three Point Jumper.",32,25,7,0.912874797859101,"Iowa","Penn State",4,4,0,0,7.5,400915017,2017-03-05
114,1,"6:14",1574,1574,"Nicholas Baer Defensive Rebound.",32,25,7,0.912874797859101,"Iowa","Penn State",4,4,0,0,7.5,400915017,2017-03-05
115,1,"6:11",1571,1571,"Foul on Josh Reaves.",32,25,7,0.912874797859101,"Iowa","Penn State",4,4,0,0,7.5,400915017,2017-03-05
116,1,"6:11",1571,1571,"Nicholas Baer missed Free Throw.",32,25,7,0.912874797859101,"Iowa","Penn State",4,4,0,0,7.5,400915017,2017-03-05
117,1,"6:11",1571,1571,"Tony Carr Defensive Rebound.",32,25,7,0.912874797859101,"Iowa","Penn State",4,4,0,0,7.5,400915017,2017-03-05
118,1,"6:06",1566,1566,"Tony Carr missed Layup.",32,25,7,0.898762044700784,"Iowa","Penn State",4,4,0,0,7.5,400915017,2017-03-05
119,1,"6:06",1566,1566,"Tyler Cook Defensive Rebound.",32,25,7,0.898762044700784,"Iowa","Penn State",4,4,0,0,7.5,400915017,2017-03-05
120,1,"5:57",1557,1557,"Foul on Payton Banks.",32,25,7,0.898266763350643,"Iowa","Penn State",4,4,0,0,7.5,400915017,2017-03-05
121,1,"5:57",1557,1557,"Nicholas Baer made Free Throw.",33,25,8,0.91065730405856,"Iowa","Penn State",4,4,0,0,7.5,400915017,2017-03-05
122,1,"5:57",1557,1557,"Nicholas Baer made Free Throw.",34,25,9,0.921670340778219,"Iowa","Penn State",4,4,0,0,7.5,400915017,2017-03-05
123,1,"5:38",1538,1538,"Lamar Stevens Turnover.",34,25,9,0.925375735015048,"Iowa","Penn State",4,4,0,0,7.5,400915017,2017-03-05
124,1,"5:37",1537,1537,"Nicholas Baer Steal.",34,25,9,0.925375735015048,"Iowa","Penn State",4,4,0,0,7.5,400915017,2017-03-05
125,1,"5:31",1531,1531,"Tyler Cook missed Layup.",34,25,9,0.925375735015048,"Iowa","Penn State",4,4,0,0,7.5,400915017,2017-03-05
126,1,"5:31",1531,1531,"Mike Watkins Defensive Rebound.",34,25,9,0.925375735015048,"Iowa","Penn State",4,4,0,0,7.5,400915017,2017-03-05
127,1,"5:14",1514,1514,"Tony Carr missed Layup.",34,25,9,0.932909717764192,"Iowa","Penn State",4,4,0,0,7.5,400915017,2017-03-05
128,1,"5:14",1514,1514,"Tony Carr Offensive Rebound.",34,25,9,0.932909717764192,"Iowa","Penn State",4,4,0,0,7.5,400915017,2017-03-05
129,1,"5:09",1509,1509,"Shep Garner missed Jumper.",34,25,9,0.924202802879004,"Iowa","Penn State",4,4,0,0,7.5,400915017,2017-03-05
130,1,"5:09",1509,1509,"Nicholas Baer Defensive Rebound.",34,25,9,0.924202802879004,"Iowa","Penn State",4,4,0,0,7.5,400915017,2017-03-05
131,1,"5:02",1502,1502,"Jordan Bohannon missed Three Point Jumper.",34,25,9,0.924202802879004,"Iowa","Penn State",4,4,0,0,7.5,400915017,2017-03-05
132,1,"5:02",1502,1502,"Nicholas Baer Offensive Rebound.",34,25,9,0.924202802879004,"Iowa","Penn State",4,4,0,0,7.5,400915017,2017-03-05
133,1,"4:57",1497,1497,"Nicholas Baer missed Jumper.",34,25,9,0.926473035751788,"Iowa","Penn State",4,4,0,0,7.5,400915017,2017-03-05
134,1,"4:57",1497,1497,"Lamar Stevens Block.",34,25,9,0.926473035751788,"Iowa","Penn State",4,4,0,0,7.5,400915017,2017-03-05
135,1,"4:55",1495,1495,"Tony Carr Defensive Rebound.",34,25,9,0.926473035751788,"Iowa","Penn State",4,4,0,0,7.5,400915017,2017-03-05
136,1,"4:27",1467,1467,"Shep Garner missed Three Point Jumper.",34,25,9,0.917110546047588,"Iowa","Penn State",4,4,0,0,7.5,400915017,2017-03-05
137,1,"4:27",1467,1467,"Nicholas Baer Defensive Rebound.",34,25,9,0.917110546047588,"Iowa","Penn State",4,4,0,0,7.5,400915017,2017-03-05
138,1,"4:24",1464,1464,"Penn State  Timeout",34,25,9,0.917110546047588,"Iowa","Penn State",3,4,1,0,7.5,400915017,2017-03-05
139,1,"4:06",1446,1446,"Nicholas Baer made Layup. Assisted by Brady Ellingson.",36,25,11,0.950510103761941,"Iowa","Penn State",3,4,1,0,7.5,400915017,2017-03-05
140,1,"3:46",1426,1426,"Lamar Stevens missed Jumper.",36,25,11,0.937790684637043,"Iowa","Penn State",3,4,1,0,7.5,400915017,2017-03-05
141,1,"3:46",1426,1426,"Nicholas Baer Defensive Rebound.",36,25,11,0.937790684637043,"Iowa","Penn State",3,4,1,0,7.5,400915017,2017-03-05
142,1,"3:37",1417,1417,"Cordell Pemsl made Layup. Assisted by Jordan Bohannon.",38,25,13,0.958292447356729,"Iowa","Penn State",3,4,1,0,7.5,400915017,2017-03-05
143,1,"3:23",1403,1403,"Payton Banks missed Three Point Jumper.",38,25,13,0.963709015958466,"Iowa","Penn State",3,4,0,0,7.5,400915017,2017-03-05
144,1,"3:23",1403,1403,"Mike Watkins Offensive Rebound.",38,25,13,0.963709015958466,"Iowa","Penn State",3,4,0,0,7.5,400915017,2017-03-05
145,1,"3:18",1398,1398,"Tony Carr missed Three Point Jumper.",38,25,13,0.962124614000673,"Iowa","Penn State",3,4,0,0,7.5,400915017,2017-03-05
146,1,"3:18",1398,1398,"Mike Watkins Offensive Rebound.",38,25,13,0.962124614000673,"Iowa","Penn State",3,4,0,0,7.5,400915017,2017-03-05
147,1,"3:10",1390,1390,"Lamar Stevens missed Jumper.",38,25,13,0.962124614000673,"Iowa","Penn State",3,4,0,0,7.5,400915017,2017-03-05
148,1,"3:10",1390,1390,"Cordell Pemsl Block.",38,25,13,0.962124614000673,"Iowa","Penn State",3,4,0,0,7.5,400915017,2017-03-05
149,1,"3:10",1390,1390,"Lamar Stevens Offensive Rebound.",38,25,13,0.962124614000673,"Iowa","Penn State",3,4,0,0,7.5,400915017,2017-03-05
150,1,"2:57",1377,1377,"Mike Watkins made Jumper. Assisted by Shep Garner.",38,27,11,0.938763197428272,"Iowa","Penn State",3,4,0,0,7.5,400915017,2017-03-05
151,1,"2:35",1355,1355,"Foul on Shep Garner.",38,27,11,0.948797843304306,"Iowa","Penn State",3,4,0,0,7.5,400915017,2017-03-05
152,1,"2:35",1355,1355,"Cordell Pemsl made Free Throw.",39,27,12,0.955802913265463,"Iowa","Penn State",3,4,0,0,7.5,400915017,2017-03-05
153,1,"2:35",1355,1355,"Cordell Pemsl made Free Throw.",40,27,13,0.961888102234143,"Iowa","Penn State",3,4,0,0,7.5,400915017,2017-03-05
154,1,"2:11",1331,1331,"Tony Carr made Layup.",40,29,11,0.94282665476318,"Iowa","Penn State",3,4,0,0,7.5,400915017,2017-03-05
155,1,"1:59",1319,1319,"Tyler Cook Turnover.",40,29,11,0.949454426049675,"Iowa","Penn State",3,4,0,0,7.5,400915017,2017-03-05
156,1,"1:59",1319,1319,"Foul on Tyler Cook.",40,29,11,0.949454426049675,"Iowa","Penn State",3,4,0,0,7.5,400915017,2017-03-05
157,1,"1:48",1308,1308,"Josh Reaves made Dunk. Assisted by Tony Carr.",40,31,9,0.919098110495972,"Iowa","Penn State",3,4,0,0,7.5,400915017,2017-03-05
158,1,"1:38",1298,1298,"Nicholas Baer made Three Point Jumper. Assisted by Ryan Kriener.",43,31,12,0.95948199141314,"Iowa","Penn State",3,4,0,0,7.5,400915017,2017-03-05
159,1,"1:15",1275,1275,"Tony Carr made Jumper.",43,33,10,0.930254717476228,"Iowa","Penn State",3,4,0,0,7.5,400915017,2017-03-05
160,1,"1:06",1266,1266,"Jordan Bohannon missed Three Point Jumper.",43,33,10,0.943401603810976,"Iowa","Penn State",3,4,0,0,7.5,400915017,2017-03-05
161,1,"1:06",1266,1266,"Cordell Pemsl Offensive Rebound.",43,33,10,0.943401603810976,"Iowa","Penn State",3,4,0,0,7.5,400915017,2017-03-05
162,1,"1:02",1262,1262,"Technical Foul on Penn State.",43,33,10,0.943401603810976,"Iowa","Penn State",3,4,0,0,7.5,400915017,2017-03-05
163,1,"1:02",1262,1262,"Peter Jok missed Free Throw.",43,33,10,0.943401603810976,"Iowa","Penn State",3,4,0,0,7.5,400915017,2017-03-05
164,1,"1:02",1262,1262,"Iowa Deadball Team Rebound.",43,33,10,0.943401603810976,"Iowa","Penn State",3,4,0,0,7.5,400915017,2017-03-05
165,1,"1:02",1262,1262,"Peter Jok made Free Throw.",44,33,11,0.9512793245601,"Iowa","Penn State",3,4,0,0,7.5,400915017,2017-03-05
166,1,"0:48",1248,1248,"Jordan Bohannon made Three Point Jumper. Assisted by Nicholas Baer.",47,33,14,0.965307473758999,"Iowa","Penn State",3,4,0,0,7.5,400915017,2017-03-05
167,1,"0:31",1231,1231,"Payton Banks made Three Point Jumper. Assisted by Tony Carr.",47,36,11,0.944833865533111,"Iowa","Penn State",3,4,0,0,7.5,400915017,2017-03-05
168,1,"0:01",1201,1201,"Ryan Kriener missed Jumper.",47,36,11,0.94662487030315,"Iowa","Penn State",3,4,0,0,7.5,400915017,2017-03-05
169,1,"0:01",1201,1201,"Julian Moore Defensive Rebound.",47,36,11,0.94662487030315,"Iowa","Penn State",3,4,0,0,7.5,400915017,2017-03-05
170,1,"0:00",1200,1200,"End of 1st half",47,36,11,0.94662487030315,"Iowa","Penn State",3,4,0,0,7.5,400915017,2017-03-05
171,2,"20:00",1200,1200,"PLAY",47,36,11,0.94662487030315,"Iowa","Penn State",4,4,0,0,7.5,400915017,2017-03-05
172,2,"19:51",1191,1191,"Foul on Ahmad Wagner.",47,38,9,0.933235943786602,"Iowa","Penn State",4,4,0,0,7.5,400915017,2017-03-05
173,2,"19:51",1191,1191,"Josh Reaves made Layup.",47,38,9,0.933235943786602,"Iowa","Penn State",4,4,0,0,7.5,400915017,2017-03-05
174,2,"19:51",1191,1191,"Josh Reaves made Free Throw.",47,39,8,0.923315622546147,"Iowa","Penn State",4,4,0,0,7.5,400915017,2017-03-05
175,2,"19:40",1180,1180,"Peter Jok made Three Point Jumper. Assisted by Isaiah Moss.",50,39,11,0.950226036196837,"Iowa","Penn State",4,4,0,0,7.5,400915017,2017-03-05
176,2,"19:19",1159,1159,"Tony Carr Turnover.",50,39,11,0.945722319845102,"Iowa","Penn State",4,4,0,0,7.5,400915017,2017-03-05
177,2,"19:19",1159,1159,"Ahmad Wagner Steal.",50,39,11,0.945722319845102,"Iowa","Penn State",4,4,0,0,7.5,400915017,2017-03-05
178,2,"19:18",1158,1158,"Foul on Josh Reaves.",50,39,11,0.945722319845102,"Iowa","Penn State",4,4,0,0,7.5,400915017,2017-03-05
179,2,"19:03",1143,1143,"Peter Jok made Layup. Assisted by Tyler Cook.",52,39,13,0.963835395717056,"Iowa","Penn State",4,4,0,0,7.5,400915017,2017-03-05
180,2,"18:49",1129,1129,"Shep Garner made Jumper. Assisted by Lamar Stevens.",52,41,11,0.95786659986463,"Iowa","Penn State",4,4,0,0,7.5,400915017,2017-03-05
181,2,"18:26",1106,1106,"Tyler Cook missed Jumper.",52,41,11,0.948970596359241,"Iowa","Penn State",4,4,0,0,7.5,400915017,2017-03-05
182,2,"18:26",1106,1106,"Tony Carr Defensive Rebound.",52,41,11,0.948970596359241,"Iowa","Penn State",4,4,0,0,7.5,400915017,2017-03-05
183,2,"18:14",1094,1094,"Lamar Stevens Turnover.",52,41,11,0.953681978411732,"Iowa","Penn State",4,4,0,0,7.5,400915017,2017-03-05
184,2,"18:14",1094,1094,"Foul on Lamar Stevens.",52,41,11,0.953681978411732,"Iowa","Penn State",4,4,0,0,7.5,400915017,2017-03-05
185,2,"18:01",1081,1081,"Peter Jok made Three Point Jumper. Assisted by Jordan Bohannon.",55,41,14,0.973386871676442,"Iowa","Penn State",4,4,0,0,7.5,400915017,2017-03-05
186,2,"17:48",1068,1068,"Shep Garner made Three Point Jumper. Assisted by Tony Carr.",55,44,11,0.951438804548335,"Iowa","Penn State",4,4,0,0,7.5,400915017,2017-03-05
187,2,"17:24",1044,1044,"Peter Jok missed Layup.",55,44,11,0.955329160290664,"Iowa","Penn State",4,4,0,0,7.5,400915017,2017-03-05
188,2,"17:24",1044,1044,"Lamar Stevens Block.",55,44,11,0.955329160290664,"Iowa","Penn State",4,4,0,0,7.5,400915017,2017-03-05
