"play_id","half","time_remaining_half","secs_remaining","secs_remaining_absolute","description","home_score","away_score","score_diff","win_prob","home","away","home_time_out_remaining","away_time_out_remaining","home_timeout_ind","away_timeout_ind","home_favored_by","game_id","date"
1,1,"20:00",2400,2400,"PLAY",0,0,0,0.834331373184416,"Villanova","Xavier",4,4,0,0,8,400919675,2017-01-10
2,1,"20:00",2400,2400,"Jump Ball won by Xavier",0,0,0,0.834331373184416,"Villanova","Xavier",4,4,0,0,8,400919675,2017-01-10
3,1,"19:48",2388,2388,"J.P. Macura made Layup.",0,2,-2,0.820779431985664,"Villanova","Xavier",4,4,0,0,8,400919675,2017-01-10
4,1,"19:24",2364,2364,"Kris Jenkins missed Jumper.",0,2,-2,0.804785465090862,"Villanova","Xavier",4,4,0,0,8,400919675,2017-01-10
5,1,"19:24",2364,2364,"Trevon Bluiett Defensive Rebound.",0,2,-2,0.804785465090862,"Villanova","Xavier",4,4,0,0,8,400919675,2017-01-10
6,1,"19:13",2353,2353,"J.P. Macura made Three Point Jumper. Assisted by Malcolm Bernard.",0,5,-5,0.761991437564174,"Villanova","Xavier",4,4,0,0,8,400919675,2017-01-10
7,1,"18:36",2316,2316,"Foul on J.P. Macura.",0,5,-5,0.721521606668901,"Villanova","Xavier",4,4,0,0,8,400919675,2017-01-10
8,1,"18:36",2316,2316,"Josh Hart made Free Throw.",1,5,-4,0.740821516627818,"Villanova","Xavier",4,4,0,0,8,400919675,2017-01-10
9,1,"18:36",2316,2316,"Josh Hart missed Free Throw.",1,5,-4,0.740821516627818,"Villanova","Xavier",4,4,0,0,8,400919675,2017-01-10
10,1,"18:36",2316,2316,"Villanova Deadball Team Rebound.",1,5,-4,0.740821516627818,"Villanova","Xavier",4,4,0,0,8,400919675,2017-01-10
11,1,"18:36",2316,2316,"Josh Hart made Free Throw.",2,5,-3,0.759230194855879,"Villanova","Xavier",4,4,0,0,8,400919675,2017-01-10
12,1,"18:27",2307,2307,"RaShid Gaston made Layup. Assisted by Edmond Sumner.",2,7,-5,0.723456996014103,"Villanova","Xavier",4,4,0,0,8,400919675,2017-01-10
13,1,"18:06",2286,2286,"Foul on Malcolm Bernard.",2,7,-5,0.724082221211375,"Villanova","Xavier",4,4,0,0,8,400919675,2017-01-10
14,1,"17:56",2276,2276,"Josh Hart missed Three Point Jumper.",2,7,-5,0.73274816685449,"Villanova","Xavier",4,4,0,0,8,400919675,2017-01-10
15,1,"17:56",2276,2276,"Trevon Bluiett Defensive Rebound.",2,7,-5,0.73274816685449,"Villanova","Xavier",4,4,0,0,8,400919675,2017-01-10
16,1,"17:40",2260,2260,"Foul on J.P. Macura.",2,7,-5,0.719625104568976,"Villanova","Xavier",4,4,0,0,8,400919675,2017-01-10
17,1,"17:40",2260,2260,"J.P. Macura Turnover.",2,7,-5,0.719625104568976,"Villanova","Xavier",4,4,0,0,8,400919675,2017-01-10
18,1,"17:27",2247,2247,"Kris Jenkins Turnover.",2,7,-5,0.725855009725695,"Villanova","Xavier",4,4,0,0,8,400919675,2017-01-10
19,1,"17:17",2237,2237,"Edmond Sumner missed Three Point Jumper.",2,7,-5,0.720152821317698,"Villanova","Xavier",4,4,0,0,8,400919675,2017-01-10
20,1,"17:17",2237,2237,"RaShid Gaston Offensive Rebound.",2,7,-5,0.720152821317698,"Villanova","Xavier",4,4,0,0,8,400919675,2017-01-10
21,1,"17:15",2235,2235,"Trevon Bluiett missed Three Point Jumper.",2,7,-5,0.720152821317698,"Villanova","Xavier",4,4,0,0,8,400919675,2017-01-10
22,1,"17:15",2235,2235,"Donte DiVincenzo Defensive Rebound.",2,7,-5,0.720152821317698,"Villanova","Xavier",4,4,0,0,8,400919675,2017-01-10
23,1,"17:05",2225,2225,"Jalen Brunson missed Jumper.",2,7,-5,0.732043828133463,"Villanova","Xavier",4,4,0,0,8,400919675,2017-01-10
24,1,"17:05",2225,2225,"Edmond Sumner Defensive Rebound.",2,7,-5,0.732043828133463,"Villanova","Xavier",4,4,0,0,8,400919675,2017-01-10
25,1,"16:58",2218,2218,"Trevon Bluiett missed Three Point Jumper.",2,7,-5,0.695790843544747,"Villanova","Xavier",4,4,0,0,8,400919675,2017-01-10
26,1,"16:58",2218,2218,"Kris Jenkins Defensive Rebound.",2,7,-5,0.695790843544747,"Villanova","Xavier",4,4,0,0,8,400919675,2017-01-10
27,1,"16:48",2208,2208,"Foul on Quentin Goodin.",2,7,-5,0.715518752963885,"Villanova","Xavier",4,4,0,0,8,400919675,2017-01-10
28,1,"16:45",2205,2205,"Josh Hart missed Jumper.",2,7,-5,0.715518752963885,"Villanova","Xavier",4,4,0,0,8,400919675,2017-01-10
29,1,"16:45",2205,2205,"RaShid Gaston Defensive Rebound.",2,7,-5,0.715518752963885,"Villanova","Xavier",4,4,0,0,8,400919675,2017-01-10
30,1,"16:30",2190,2190,"Edmond Sumner Turnover.",2,7,-5,0.724847525094199,"Villanova","Xavier",4,4,0,0,8,400919675,2017-01-10
31,1,"16:30",2190,2190,"Donte DiVincenzo Steal.",2,7,-5,0.724847525094199,"Villanova","Xavier",4,4,0,0,8,400919675,2017-01-10
32,1,"16:24",2184,2184,"Donte DiVincenzo made Layup. Assisted by Eric Paschall.",4,7,-3,0.761292355583231,"Villanova","Xavier",4,4,0,0,8,400919675,2017-01-10
33,1,"16:01",2161,2161,"Malcolm Bernard made Layup.",4,9,-5,0.711860583142668,"Villanova","Xavier",4,4,0,0,8,400919675,2017-01-10
34,1,"15:38",2138,2138,"Donte DiVincenzo made Three Point Jumper. Assisted by Jalen Brunson.",7,9,-2,0.773397410153406,"Villanova","Xavier",4,4,0,0,8,400919675,2017-01-10
35,1,"15:11",2111,2111,"Trevon Bluiett made Three Point Jumper.",7,12,-5,0.715237078806654,"Villanova","Xavier",4,4,0,0,8,400919675,2017-01-10
36,1,"14:47",2087,2087,"Foul on Kaiser Gates.",7,12,-5,0.708913155428755,"Villanova","Xavier",4,4,0,0,8,400919675,2017-01-10
37,1,"14:47",2087,2087,"Official TV Timeout",7,12,-5,0.708913155428755,"Villanova","Xavier",4,4,0,0,8,400919675,2017-01-10
38,1,"14:47",2087,2087,"Kris Jenkins made Free Throw.",8,12,-4,0.731067468171541,"Villanova","Xavier",4,4,0,0,8,400919675,2017-01-10
39,1,"14:47",2087,2087,"Kris Jenkins made Free Throw.",9,12,-3,0.752125206738553,"Villanova","Xavier",4,4,0,0,8,400919675,2017-01-10
40,1,"14:35",2075,2075,"Trevon Bluiett made Three Point Jumper. Assisted by Edmond Sumner.",9,15,-6,0.694354492264387,"Villanova","Xavier",4,4,0,0,8,400919675,2017-01-10
41,1,"14:02",2042,2042,"Kris Jenkins missed Three Point Jumper.",9,15,-6,0.672220002890212,"Villanova","Xavier",4,4,0,0,8,400919675,2017-01-10
42,1,"14:02",2042,2042,"Quentin Goodin Defensive Rebound.",9,15,-6,0.672220002890212,"Villanova","Xavier",4,4,0,0,8,400919675,2017-01-10
43,1,"13:55",2035,2035,"Kaiser Gates missed Three Point Jumper.",9,15,-6,0.704449765114536,"Villanova","Xavier",4,4,0,0,8,400919675,2017-01-10
44,1,"13:55",2035,2035,"Villanova Deadball Team Rebound.",9,15,-6,0.704449765114536,"Villanova","Xavier",4,4,0,0,8,400919675,2017-01-10
45,1,"13:40",2020,2020,"Donte DiVincenzo missed Three Point Jumper.",9,15,-6,0.654286300541572,"Villanova","Xavier",4,4,0,0,8,400919675,2017-01-10
46,1,"13:40",2020,2020,"Mikal Bridges Offensive Rebound.",9,15,-6,0.654286300541572,"Villanova","Xavier",4,4,0,0,8,400919675,2017-01-10
47,1,"13:24",2004,2004,"Darryl Reynolds missed Layup.",9,15,-6,0.677758156885217,"Villanova","Xavier",4,4,0,0,8,400919675,2017-01-10
48,1,"13:24",2004,2004,"Darryl Reynolds Offensive Rebound.",9,15,-6,0.677758156885217,"Villanova","Xavier",4,4,0,0,8,400919675,2017-01-10
49,1,"13:20",2000,2000,"Darryl Reynolds made Layup.",11,15,-4,0.723959965156401,"Villanova","Xavier",4,4,0,0,8,400919675,2017-01-10
50,1,"12:58",1978,1978,"Trevon Bluiett Turnover.",11,15,-4,0.724514084086896,"Villanova","Xavier",4,4,0,0,8,400919675,2017-01-10
51,1,"12:58",1978,1978,"Mikal Bridges Steal.",11,15,-4,0.724514084086896,"Villanova","Xavier",4,4,0,0,8,400919675,2017-01-10
52,1,"12:52",1972,1972,"Josh Hart made Layup. Assisted by Donte DiVincenzo.",13,15,-2,0.772315474428178,"Villanova","Xavier",4,4,0,0,8,400919675,2017-01-10
53,1,"12:23",1943,1943,"Edmond Sumner made Three Point Jumper. Assisted by Trevon Bluiett.",13,18,-5,0.683486554284538,"Villanova","Xavier",4,4,0,0,8,400919675,2017-01-10
54,1,"11:54",1914,1914,"Kris Jenkins made Three Point Jumper. Assisted by Josh Hart.",16,18,-2,0.770529962508066,"Villanova","Xavier",4,4,0,0,8,400919675,2017-01-10
55,1,"11:36",1896,1896,"Edmond Sumner missed Three Point Jumper.",16,18,-2,0.753991371247737,"Villanova","Xavier",4,4,0,0,8,400919675,2017-01-10
56,1,"11:36",1896,1896,"Mikal Bridges Defensive Rebound.",16,18,-2,0.753991371247737,"Villanova","Xavier",4,4,0,0,8,400919675,2017-01-10
57,1,"11:25",1885,1885,"Josh Hart missed Three Point Jumper.",16,18,-2,0.760268667555021,"Villanova","Xavier",4,4,0,0,8,400919675,2017-01-10
58,1,"11:25",1885,1885,"Kaiser Gates Defensive Rebound.",16,18,-2,0.760268667555021,"Villanova","Xavier",4,4,0,0,8,400919675,2017-01-10
59,1,"11:14",1874,1874,"Kaiser Gates made Three Point Jumper. Assisted by Trevon Bluiett.",16,21,-5,0.681051983395954,"Villanova","Xavier",4,4,0,0,8,400919675,2017-01-10
60,1,"10:51",1851,1851,"Mikal Bridges missed Three Point Jumper.",16,21,-5,0.679185613261942,"Villanova","Xavier",4,4,0,0,8,400919675,2017-01-10
61,1,"10:51",1851,1851,"Xavier Defensive Rebound.",16,21,-5,0.679185613261942,"Villanova","Xavier",4,4,0,0,8,400919675,2017-01-10
62,1,"10:47",1847,1847,"Foul on Darryl Reynolds.",16,21,-5,0.672318151068167,"Villanova","Xavier",4,4,0,0,8,400919675,2017-01-10
63,1,"10:47",1847,1847,"Official TV Timeout",16,21,-5,0.672318151068167,"Villanova","Xavier",4,4,0,0,8,400919675,2017-01-10
64,1,"10:18",1818,1818,"Edmond Sumner missed Three Point Jumper.",16,21,-5,0.664720586123383,"Villanova","Xavier",4,4,0,0,8,400919675,2017-01-10
65,1,"10:18",1818,1818,"Villanova Defensive Rebound.",16,21,-5,0.664720586123383,"Villanova","Xavier",4,4,0,0,8,400919675,2017-01-10
66,1,"9:51",1791,1791,"Jalen Brunson missed Layup.",16,21,-5,0.658796941078815,"Villanova","Xavier",4,4,0,0,8,400919675,2017-01-10
67,1,"9:51",1791,1791,"Xavier Defensive Rebound.",16,21,-5,0.658796941078815,"Villanova","Xavier",4,4,0,0,8,400919675,2017-01-10
68,1,"9:35",1775,1775,"Kaiser Gates missed Three Point Jumper.",16,21,-5,0.666639037783019,"Villanova","Xavier",4,4,0,0,8,400919675,2017-01-10
69,1,"9:35",1775,1775,"Kris Jenkins Defensive Rebound.",16,21,-5,0.666639037783019,"Villanova","Xavier",4,4,0,0,8,400919675,2017-01-10
70,1,"9:23",1763,1763,"Foul on Mikal Bridges.",16,21,-5,0.684849634797679,"Villanova","Xavier",4,4,0,0,8,400919675,2017-01-10
71,1,"9:23",1763,1763,"Mikal Bridges Turnover.",16,21,-5,0.684849634797679,"Villanova","Xavier",4,4,0,0,8,400919675,2017-01-10
72,1,"9:08",1748,1748,"J.P. Macura missed Three Point Jumper.",16,21,-5,0.669775624490634,"Villanova","Xavier",4,4,0,0,8,400919675,2017-01-10
73,1,"9:08",1748,1748,"Josh Hart Defensive Rebound.",16,21,-5,0.669775624490634,"Villanova","Xavier",4,4,0,0,8,400919675,2017-01-10
74,1,"8:59",1739,1739,"Kris Jenkins missed Three Point Jumper.",16,21,-5,0.661407582567277,"Villanova","Xavier",4,4,0,0,8,400919675,2017-01-10
75,1,"8:59",1739,1739,"Edmond Sumner Defensive Rebound.",16,21,-5,0.661407582567277,"Villanova","Xavier",4,4,0,0,8,400919675,2017-01-10
76,1,"8:52",1732,1732,"J.P. Macura missed Three Point Jumper.",16,21,-5,0.661407582567277,"Villanova","Xavier",4,4,0,0,8,400919675,2017-01-10
77,1,"8:52",1732,1732,"Kris Jenkins Defensive Rebound.",16,21,-5,0.661407582567277,"Villanova","Xavier",4,4,0,0,8,400919675,2017-01-10
78,1,"8:22",1702,1702,"Josh Hart missed Three Point Jumper.",16,21,-5,0.660354219021656,"Villanova","Xavier",4,4,0,0,8,400919675,2017-01-10
79,1,"8:22",1702,1702,"Edmond Sumner Defensive Rebound.",16,21,-5,0.660354219021656,"Villanova","Xavier",4,4,0,0,8,400919675,2017-01-10
80,1,"8:11",1691,1691,"Foul on Josh Hart.",16,21,-5,0.64923947639833,"Villanova","Xavier",4,4,0,0,8,400919675,2017-01-10
81,1,"8:11",1691,1691,"Edmond Sumner made Free Throw.",16,22,-6,0.616092521726252,"Villanova","Xavier",4,4,0,0,8,400919675,2017-01-10
82,1,"8:11",1691,1691,"Edmond Sumner missed Free Throw.",16,22,-6,0.616092521726252,"Villanova","Xavier",4,4,0,0,8,400919675,2017-01-10
83,1,"8:11",1691,1691,"Darryl Reynolds Defensive Rebound.",16,22,-6,0.616092521726252,"Villanova","Xavier",4,4,0,0,8,400919675,2017-01-10
84,1,"7:52",1672,1672,"Josh Hart Turnover.",16,22,-6,0.627422759476772,"Villanova","Xavier",4,4,0,0,8,400919675,2017-01-10
85,1,"7:51",1671,1671,"Official TV Timeout",16,22,-6,0.627422759476772,"Villanova","Xavier",4,4,0,0,8,400919675,2017-01-10
86,1,"7:25",1645,1645,"Foul on Jalen Brunson.",16,22,-6,0.626090099297372,"Villanova","Xavier",4,4,0,0,8,400919675,2017-01-10
87,1,"7:25",1645,1645,"Trevon Bluiett made Free Throw.",16,23,-7,0.592961360833396,"Villanova","Xavier",4,4,0,0,8,400919675,2017-01-10
88,1,"7:25",1645,1645,"Trevon Bluiett made Free Throw.",16,24,-8,0.558965047101503,"Villanova","Xavier",4,4,0,0,8,400919675,2017-01-10
89,1,"6:58",1618,1618,"Jalen Brunson missed Three Point Jumper.",16,24,-8,0.522548237936551,"Villanova","Xavier",4,4,0,0,8,400919675,2017-01-10
90,1,"6:58",1618,1618,"RaShid Gaston Defensive Rebound.",16,24,-8,0.522548237936551,"Villanova","Xavier",4,4,0,0,8,400919675,2017-01-10
91,1,"6:41",1601,1601,"Trevon Bluiett missed Three Point Jumper.",16,24,-8,0.567874743329672,"Villanova","Xavier",4,4,0,0,8,400919675,2017-01-10
92,1,"6:41",1601,1601,"Josh Hart Defensive Rebound.",16,24,-8,0.567874743329672,"Villanova","Xavier",4,4,0,0,8,400919675,2017-01-10
93,1,"6:30",1590,1590,"Jalen Brunson made Layup. Assisted by Josh Hart.",18,24,-6,0.621785914167151,"Villanova","Xavier",4,4,0,0,8,400919675,2017-01-10
94,1,"6:09",1569,1569,"Trevon Bluiett missed Three Point Jumper.",18,24,-6,0.596581596666655,"Villanova","Xavier",4,4,0,0,8,400919675,2017-01-10
95,1,"6:09",1569,1569,"Donte DiVincenzo Defensive Rebound.",18,24,-6,0.596581596666655,"Villanova","Xavier",4,4,0,0,8,400919675,2017-01-10
96,1,"5:46",1546,1546,"Josh Hart missed Three Point Jumper.",18,24,-6,0.620861861712687,"Villanova","Xavier",4,4,0,0,8,400919675,2017-01-10
97,1,"5:46",1546,1546,"Edmond Sumner Defensive Rebound.",18,24,-6,0.620861861712687,"Villanova","Xavier",4,4,0,0,8,400919675,2017-01-10
98,1,"5:43",1543,1543,"Foul on Mikal Bridges.",18,24,-6,0.620861861712687,"Villanova","Xavier",4,4,0,0,8,400919675,2017-01-10
99,1,"5:28",1528,1528,"Foul on RaShid Gaston.",18,24,-6,0.601572774876022,"Villanova","Xavier",4,4,0,0,8,400919675,2017-01-10
100,1,"5:28",1528,1528,"RaShid Gaston Turnover.",18,24,-6,0.601572774876022,"Villanova","Xavier",4,4,0,0,8,400919675,2017-01-10
101,1,"5:16",1516,1516,"Kris Jenkins made Three Point Jumper. Assisted by Eric Paschall.",21,24,-3,0.702333577086953,"Villanova","Xavier",4,4,0,0,8,400919675,2017-01-10
102,1,"4:57",1497,1497,"Foul on RaShid Gaston.",21,24,-3,0.714137409620172,"Villanova","Xavier",4,4,0,0,8,400919675,2017-01-10
103,1,"4:57",1497,1497,"RaShid Gaston Turnover.",21,24,-3,0.714137409620172,"Villanova","Xavier",4,4,0,0,8,400919675,2017-01-10
104,1,"4:43",1483,1483,"Kris Jenkins made Jumper. Assisted by Josh Hart.",23,24,-1,0.748812680968414,"Villanova","Xavier",4,4,0,0,8,400919675,2017-01-10
105,1,"4:09",1449,1449,"Edmond Sumner missed Jumper.",23,24,-1,0.765766599014289,"Villanova","Xavier",4,4,0,0,8,400919675,2017-01-10
106,1,"4:09",1449,1449,"Villanova Deadball Team Rebound.",23,24,-1,0.765766599014289,"Villanova","Xavier",4,4,0,0,8,400919675,2017-01-10
107,1,"3:53",1433,1433,"Kris Jenkins Turnover.",23,24,-1,0.748467844702198,"Villanova","Xavier",4,4,0,0,8,400919675,2017-01-10
108,1,"3:53",1433,1433,"Official TV Timeout",23,24,-1,0.748467844702198,"Villanova","Xavier",4,4,0,0,8,400919675,2017-01-10
109,1,"3:29",1409,1409,"Edmond Sumner missed Layup.",23,24,-1,0.762372619199367,"Villanova","Xavier",4,4,0,0,8,400919675,2017-01-10
110,1,"3:29",1409,1409,"Xavier Offensive Rebound.",23,24,-1,0.762372619199367,"Villanova","Xavier",4,4,0,0,8,400919675,2017-01-10
111,1,"3:27",1407,1407,"Kaiser Gates missed Three Point Jumper.",23,24,-1,0.762372619199367,"Villanova","Xavier",4,4,0,0,8,400919675,2017-01-10
112,1,"3:27",1407,1407,"Eric Paschall Defensive Rebound.",23,24,-1,0.762372619199367,"Villanova","Xavier",4,4,0,0,8,400919675,2017-01-10
113,1,"3:25",1405,1405,"Foul on Sean O'Mara.",23,24,-1,0.762372619199367,"Villanova","Xavier",4,4,0,0,8,400919675,2017-01-10
114,1,"3:25",1405,1405,"Eric Paschall made Free Throw.",24,24,0,0.789302901221028,"Villanova","Xavier",4,4,0,0,8,400919675,2017-01-10
115,1,"3:25",1405,1405,"Eric Paschall missed Free Throw.",24,24,0,0.789302901221028,"Villanova","Xavier",4,4,0,0,8,400919675,2017-01-10
116,1,"3:25",1405,1405,"Sean O'Mara Defensive Rebound.",24,24,0,0.789302901221028,"Villanova","Xavier",4,4,0,0,8,400919675,2017-01-10
117,1,"3:00",1380,1380,"Edmond Sumner missed Jumper.",24,24,0,0.7825314061751,"Villanova","Xavier",4,4,0,0,8,400919675,2017-01-10
118,1,"3:00",1380,1380,"Villanova Defensive Rebound.",24,24,0,0.7825314061751,"Villanova","Xavier",4,4,0,0,8,400919675,2017-01-10
119,1,"2:58",1378,1378,"Foul on Kaiser Gates.",24,24,0,0.768201104071094,"Villanova","Xavier",4,4,0,0,8,400919675,2017-01-10
120,1,"2:58",1378,1378,"Jalen Brunson made Free Throw.",25,24,1,0.792906783272151,"Villanova","Xavier",4,4,0,0,8,400919675,2017-01-10
121,1,"2:58",1378,1378,"Jalen Brunson made Free Throw.",26,24,2,0.815611307927904,"Villanova","Xavier",4,4,0,0,8,400919675,2017-01-10
122,1,"2:52",1372,1372,"Malcolm Bernard Turnover.",26,24,2,0.815611307927904,"Villanova","Xavier",4,4,0,0,8,400919675,2017-01-10
123,1,"2:52",1372,1372,"Mikal Bridges Steal.",26,24,2,0.815611307927904,"Villanova","Xavier",4,4,0,0,8,400919675,2017-01-10
124,1,"2:48",1368,1368,"Josh Hart made Layup. Assisted by Mikal Bridges.",28,24,4,0.862974968380134,"Villanova","Xavier",4,4,0,0,8,400919675,2017-01-10
125,1,"2:29",1349,1349,"Foul on Mikal Bridges.",28,24,4,0.855800101274299,"Villanova","Xavier",4,4,0,0,8,400919675,2017-01-10
126,1,"2:22",1342,1342,"Trevon Bluiett missed Jumper.",28,24,4,0.855800101274299,"Villanova","Xavier",4,4,0,0,8,400919675,2017-01-10
127,1,"2:22",1342,1342,"Sean O'Mara Offensive Rebound.",28,24,4,0.855800101274299,"Villanova","Xavier",4,4,0,0,8,400919675,2017-01-10
128,1,"2:18",1338,1338,"Sean O'Mara made Layup.",28,26,2,0.810925493059655,"Villanova","Xavier",4,4,0,0,8,400919675,2017-01-10
129,1,"1:57",1317,1317,"Josh Hart made Three Point Jumper. Assisted by Jalen Brunson.",31,26,5,0.884870184183199,"Villanova","Xavier",4,4,0,0,8,400919675,2017-01-10
130,1,"1:29",1289,1289,"Trevon Bluiett missed Three Point Jumper.",31,26,5,0.880504165183079,"Villanova","Xavier",4,4,0,0,8,400919675,2017-01-10
131,1,"1:29",1289,1289,"Xavier Offensive Rebound.",31,26,5,0.880504165183079,"Villanova","Xavier",4,4,0,0,8,400919675,2017-01-10
132,1,"1:27",1287,1287,"Foul on Jalen Brunson.",31,26,5,0.880504165183079,"Villanova","Xavier",4,4,0,0,8,400919675,2017-01-10
133,1,"1:27",1287,1287,"J.P. Macura missed Free Throw.",31,26,5,0.880504165183079,"Villanova","Xavier",4,4,0,0,8,400919675,2017-01-10
134,1,"1:27",1287,1287,"Kris Jenkins Defensive Rebound.",31,26,5,0.880504165183079,"Villanova","Xavier",4,4,0,0,8,400919675,2017-01-10
135,1,"1:08",1268,1268,"Kris Jenkins missed Three Point Jumper.",31,26,5,0.88865555193549,"Villanova","Xavier",4,4,0,0,8,400919675,2017-01-10
136,1,"1:08",1268,1268,"Trevon Bluiett Defensive Rebound.",31,26,5,0.88865555193549,"Villanova","Xavier",4,4,0,0,8,400919675,2017-01-10
137,1,"0:57",1257,1257,"Myles Davis missed Three Point Jumper.",31,26,5,0.867552072312784,"Villanova","Xavier",4,4,0,0,8,400919675,2017-01-10
138,1,"0:57",1257,1257,"Xavier Offensive Rebound.",31,26,5,0.867552072312784,"Villanova","Xavier",4,4,0,0,8,400919675,2017-01-10
139,1,"0:52",1252,1252,"Foul on Eric Paschall.",31,26,5,0.867552072312784,"Villanova","Xavier",4,4,0,0,8,400919675,2017-01-10
140,1,"0:52",1252,1252,"Malcolm Bernard made Free Throw.",31,27,4,0.849152099381616,"Villanova","Xavier",4,4,0,0,8,400919675,2017-01-10
141,1,"0:52",1252,1252,"Malcolm Bernard made Free Throw.",31,28,3,0.828700678167329,"Villanova","Xavier",4,4,0,0,8,400919675,2017-01-10
142,1,"0:48",1248,1248,"Jalen Brunson made Layup.",33,28,5,0.879392869226936,"Villanova","Xavier",4,4,0,0,8,400919675,2017-01-10
143,1,"0:48",1248,1248,"Foul on Edmond Sumner.",33,28,5,0.879392869226936,"Villanova","Xavier",4,4,0,0,8,400919675,2017-01-10
144,1,"0:48",1248,1248,"Jalen Brunson made Free Throw.",34,28,6,0.894875200576943,"Villanova","Xavier",4,4,0,0,8,400919675,2017-01-10
145,1,"0:39",1239,1239,"Myles Davis missed Three Point Jumper.",34,28,6,0.889591357065728,"Villanova","Xavier",4,4,0,0,8,400919675,2017-01-10
146,1,"0:39",1239,1239,"Villanova Defensive Rebound.",34,28,6,0.889591357065728,"Villanova","Xavier",4,4,0,0,8,400919675,2017-01-10
147,1,"0:34",1234,1234,"Villanova  Timeout",34,28,6,0.889591357065728,"Villanova","Xavier",3,4,1,0,8,400919675,2017-01-10
148,1,"0:09",1209,1209,"Josh Hart missed Three Point Jumper.",34,28,6,0.893968536001306,"Villanova","Xavier",3,4,1,0,8,400919675,2017-01-10
149,1,"0:09",1209,1209,"Sean O'Mara Defensive Rebound.",34,28,6,0.893968536001306,"Villanova","Xavier",3,4,1,0,8,400919675,2017-01-10
150,1,"0:02",1202,1202,"Edmond Sumner Turnover.",34,28,6,0.893968536001306,"Villanova","Xavier",3,4,1,0,8,400919675,2017-01-10
151,1,"0:02",1202,1202,"Josh Hart Steal.",34,28,6,0.893968536001306,"Villanova","Xavier",3,4,1,0,8,400919675,2017-01-10
152,1,"0:00",1200,1200,"End of 1st half",34,28,6,0.893968536001306,"Villanova","Xavier",3,4,1,0,8,400919675,2017-01-10
153,2,"20:00",1200,1200,"PLAY",34,28,6,0.893968536001306,"Villanova","Xavier",4,4,0,0,8,400919675,2017-01-10
154,2,"20:00",1200,1200,"Jump Ball won by Villanova",34,28,6,0.893968536001306,"Villanova","Xavier",4,4,0,0,8,400919675,2017-01-10
155,2,"19:49",1189,1189,"Kris Jenkins made Three Point Jumper. Assisted by Jalen Brunson.",37,28,9,0.935300678410376,"Villanova","Xavier",4,4,0,0,8,400919675,2017-01-10
156,2,"19:26",1166,1166,"RaShid Gaston missed Layup.",37,28,9,0.932234053826524,"Villanova","Xavier",4,4,0,0,8,400919675,2017-01-10
157,2,"19:26",1166,1166,"Kris Jenkins Defensive Rebound.",37,28,9,0.932234053826524,"Villanova","Xavier",4,4,0,0,8,400919675,2017-01-10
158,2,"18:57",1137,1137,"Darryl Reynolds made Dunk. Assisted by Jalen Brunson.",39,28,11,0.952008171509199,"Villanova","Xavier",4,4,0,0,8,400919675,2017-01-10
159,2,"18:43",1123,1123,"Foul on Kris Jenkins.",39,28,11,0.959885765157458,"Villanova","Xavier",4,4,0,0,8,400919675,2017-01-10
160,2,"18:43",1123,1123,"Trevon Bluiett made Free Throw.",39,29,10,0.952066437997929,"Villanova","Xavier",4,4,0,0,8,400919675,2017-01-10
161,2,"18:43",1123,1123,"Trevon Bluiett made Free Throw.",39,30,9,0.942813722388539,"Villanova","Xavier",4,4,0,0,8,400919675,2017-01-10
162,2,"18:30",1110,1110,"Darryl Reynolds made Dunk. Assisted by Josh Hart.",41,30,11,0.952957013426754,"Villanova","Xavier",4,4,0,0,8,400919675,2017-01-10
163,2,"18:01",1081,1081,"Edmond Sumner missed Jumper.",41,30,11,0.957775492342872,"Villanova","Xavier",4,4,0,0,8,400919675,2017-01-10
164,2,"18:01",1081,1081,"RaShid Gaston Offensive Rebound.",41,30,11,0.957775492342872,"Villanova","Xavier",4,4,0,0,8,400919675,2017-01-10
165,2,"17:59",1079,1079,"Foul on Kris Jenkins.",41,30,11,0.951040806687978,"Villanova","Xavier",4,4,0,0,8,400919675,2017-01-10
166,2,"17:54",1074,1074,"J.P. Macura made Jumper. Assisted by Trevon Bluiett.",41,32,9,0.932751122813643,"Villanova","Xavier",4,4,0,0,8,400919675,2017-01-10
167,2,"17:27",1047,1047,"Donte DiVincenzo Turnover.",41,32,9,0.940578355936841,"Villanova","Xavier",4,4,0,0,8,400919675,2017-01-10
168,2,"17:04",1024,1024,"Edmond Sumner Turnover.",41,32,9,0.939533578330202,"Villanova","Xavier",4,4,0,0,8,400919675,2017-01-10
169,2,"16:40",1000,1000,"Josh Hart missed Layup.",41,32,9,0.936063498280534,"Villanova","Xavier",4,4,0,0,8,400919675,2017-01-10
170,2,"16:40",1000,1000,"Malcolm Bernard Block.",41,32,9,0.936063498280534,"Villanova","Xavier",4,4,0,0,8,400919675,2017-01-10
171,2,"16:40",1000,1000,"Villanova Offensive Rebound.",41,32,9,0.936063498280534,"Villanova","Xavier",4,4,0,0,8,400919675,2017-01-10
172,2,"16:35",995,995,"Josh Hart missed Layup.",41,32,9,0.933847877869014,"Villanova","Xavier",4,4,0,0,8,400919675,2017-01-10
173,2,"16:35",995,995,"Edmond Sumner Block.",41,32,9,0.933847877869014,"Villanova","Xavier",4,4,0,0,8,400919675,2017-01-10
174,2,"16:35",995,995,"Trevon Bluiett Defensive Rebound.",41,32,9,0.933847877869014,"Villanova","Xavier",4,4,0,0,8,400919675,2017-01-10
175,2,"16:29",989,989,"J.P. Macura Turnover.",41,32,9,0.946109387324993,"Villanova","Xavier",4,4,0,0,8,400919675,2017-01-10
176,2,"16:09",969,969,"Foul on Trevon Bluiett.",41,32,9,0.934756625900423,"Villanova","Xavier",4,4,0,0,8,400919675,2017-01-10
177,2,"16:09",969,969,"Kris Jenkins made Free Throw.",42,32,10,0.945199227417278,"Villanova","Xavier",4,4,0,0,8,400919675,2017-01-10
178,2,"16:09",969,969,"Kris Jenkins made Free Throw.",43,32,11,0.954052583425769,"Villanova","Xavier",4,4,0,0,8,400919675,2017-01-10
179,2,"15:41",941,941,"Foul on Eric Paschall.",43,32,11,0.963435986835026,"Villanova","Xavier",4,4,0,0,8,400919675,2017-01-10
180,2,"15:41",941,941,"Official TV Timeout",43,32,11,0.963435986835026,"Villanova","Xavier",4,4,0,0,8,400919675,2017-01-10
181,2,"15:41",941,941,"Edmond Sumner made Free Throw.",43,33,10,0.956046279975957,"Villanova","Xavier",4,4,0,0,8,400919675,2017-01-10
182,2,"15:41",941,941,"Edmond Sumner missed Free Throw.",43,33,10,0.956046279975957,"Villanova","Xavier",4,4,0,0,8,400919675,2017-01-10
183,2,"15:41",941,941,"Kris Jenkins Defensive Rebound.",43,33,10,0.956046279975957,"Villanova","Xavier",4,4,0,0,8,400919675,2017-01-10
184,2,"15:25",925,925,"Jalen Brunson made Layup.",45,33,12,0.963157253356888,"Villanova","Xavier",4,4,0,0,8,400919675,2017-01-10
185,2,"15:10",910,910,"Edmond Sumner missed Layup.",45,33,12,0.969798294785374,"Villanova","Xavier",4,4,0,0,8,400919675,2017-01-10
186,2,"15:10",910,910,"RaShid Gaston Offensive Rebound.",45,33,12,0.969798294785374,"Villanova","Xavier",4,4,0,0,8,400919675,2017-01-10
187,2,"15:07",907,907,"RaShid Gaston missed Layup.",45,33,12,0.964905513620623,"Villanova","Xavier",4,4,0,0,8,400919675,2017-01-10
188,2,"15:07",907,907,"Eric Paschall Block.",45,33,12,0.964905513620623,"Villanova","Xavier",4,4,0,0,8,400919675,2017-01-10
189,2,"15:07",907,907,"Jalen Brunson Defensive Rebound.",45,33,12,0.964905513620623,"Villanova","Xavier",4,4,0,0,8,400919675,2017-01-10
190,2,"15:03",903,903,"Foul on J.P. Macura.",45,33,12,0.964905513620623,"Villanova","Xavier",4,4,0,0,8,400919675,2017-01-10
