"play_id","half","time_remaining_half","secs_remaining","secs_remaining_absolute","description","home_score","away_score","score_diff","win_prob","home","away","home_time_out_remaining","away_time_out_remaining","home_timeout_ind","away_timeout_ind","home_favored_by","game_id","date"
1,1,"20:00",2400,2400,"PLAY",0,0,0,0.342408516792185,"Memphis","Iowa",4,4,0,0,-3.1,400927016,2016-11-26
2,1,"19:43",2383,2383,"Markel Crawford missed Three Point Jumper.",0,0,0,0.347534065136641,"Memphis","Iowa",4,4,0,0,-3.1,400927016,2016-11-26
3,1,"19:43",2383,2383,"Nicholas Baer Defensive Rebound.",0,0,0,0.347534065136641,"Memphis","Iowa",4,4,0,0,-3.1,400927016,2016-11-26
4,1,"19:25",2365,2365,"Nicholas Baer missed Three Point Jumper.",0,0,0,0.354914010865024,"Memphis","Iowa",4,4,0,0,-3.1,400927016,2016-11-26
5,1,"19:25",2365,2365,"Chad Rykhoek Defensive Rebound.",0,0,0,0.354914010865024,"Memphis","Iowa",4,4,0,0,-3.1,400927016,2016-11-26
6,1,"19:11",2351,2351,"K.J. Lawson missed Jumper.",0,0,0,0.369565609048898,"Memphis","Iowa",4,4,0,0,-3.1,400927016,2016-11-26
7,1,"19:11",2351,2351,"Dom Uhl Defensive Rebound.",0,0,0,0.369565609048898,"Memphis","Iowa",4,4,0,0,-3.1,400927016,2016-11-26
8,1,"18:52",2332,2332,"Peter Jok missed Jumper.",0,0,0,0.359158325377746,"Memphis","Iowa",4,4,0,0,-3.1,400927016,2016-11-26
9,1,"18:52",2332,2332,"Jeremiah Martin Defensive Rebound.",0,0,0,0.359158325377746,"Memphis","Iowa",4,4,0,0,-3.1,400927016,2016-11-26
10,1,"18:43",2323,2323,"Chad Rykhoek made Layup. Assisted by Dedric Lawson.",2,0,2,0.427963780286105,"Memphis","Iowa",4,4,0,0,-3.1,400927016,2016-11-26
11,1,"18:28",2308,2308,"Peter Jok made Three Point Jumper. Assisted by Dom Uhl.",2,3,-1,0.33417711510662,"Memphis","Iowa",4,4,0,0,-3.1,400927016,2016-11-26
12,1,"17:54",2274,2274,"Jeremiah Martin made Three Point Jumper. Assisted by K.J. Lawson.",5,3,2,0.414745429551263,"Memphis","Iowa",4,4,0,0,-3.1,400927016,2016-11-26
13,1,"17:42",2262,2262,"Nicholas Baer made Layup. Assisted by Christian Williams.",5,5,0,0.360663968361742,"Memphis","Iowa",4,4,0,0,-3.1,400927016,2016-11-26
14,1,"17:29",2249,2249,"Markel Crawford made Jumper.",7,5,2,0.430119310629483,"Memphis","Iowa",4,4,0,0,-3.1,400927016,2016-11-26
15,1,"17:23",2243,2243,"Tyler Cook made Dunk. Assisted by Christian Williams.",7,7,0,0.384725327173472,"Memphis","Iowa",4,4,0,0,-3.1,400927016,2016-11-26
16,1,"17:19",2239,2239,"Foul on Nicholas Baer.",7,7,0,0.363430838297772,"Memphis","Iowa",4,4,0,0,-3.1,400927016,2016-11-26
17,1,"16:52",2212,2212,"Markel Crawford made Three Point Jumper. Assisted by Jeremiah Martin.",10,7,3,0.475021177216023,"Memphis","Iowa",4,4,0,0,-3.1,400927016,2016-11-26
18,1,"16:45",2205,2205,"Christian Williams missed Jumper.",10,7,3,0.449738691722818,"Memphis","Iowa",4,4,0,0,-3.1,400927016,2016-11-26
19,1,"16:45",2205,2205,"Markel Crawford Defensive Rebound.",10,7,3,0.449738691722818,"Memphis","Iowa",4,4,0,0,-3.1,400927016,2016-11-26
20,1,"16:28",2188,2188,"Dedric Lawson missed Layup.",10,7,3,0.444176398167161,"Memphis","Iowa",4,4,0,0,-3.1,400927016,2016-11-26
21,1,"16:28",2188,2188,"K.J. Lawson Offensive Rebound.",10,7,3,0.444176398167161,"Memphis","Iowa",4,4,0,0,-3.1,400927016,2016-11-26
22,1,"16:24",2184,2184,"K.J. Lawson made Layup.",12,7,5,0.49820734497733,"Memphis","Iowa",4,4,0,0,-3.1,400927016,2016-11-26
23,1,"16:13",2173,2173,"Tyler Cook made Jumper.",12,9,3,0.43641821907634,"Memphis","Iowa",4,4,0,0,-3.1,400927016,2016-11-26
24,1,"15:58",2158,2158,"Dedric Lawson made Layup. Assisted by Jeremiah Martin.",14,9,5,0.497015300961052,"Memphis","Iowa",4,4,0,0,-3.1,400927016,2016-11-26
25,1,"15:42",2142,2142,"Peter Jok Turnover.",14,9,5,0.494270011432159,"Memphis","Iowa",4,4,0,0,-3.1,400927016,2016-11-26
26,1,"15:41",2141,2141,"Jeremiah Martin Steal.",14,9,5,0.494270011432159,"Memphis","Iowa",4,4,0,0,-3.1,400927016,2016-11-26
27,1,"15:37",2137,2137,"Jeremiah Martin missed Layup.",14,9,5,0.507430136429963,"Memphis","Iowa",4,4,0,0,-3.1,400927016,2016-11-26
28,1,"15:37",2137,2137,"Dedric Lawson Offensive Rebound.",14,9,5,0.507430136429963,"Memphis","Iowa",4,4,0,0,-3.1,400927016,2016-11-26
29,1,"15:34",2134,2134,"Dedric Lawson made Layup.",16,9,7,0.56754376551077,"Memphis","Iowa",4,4,0,0,-3.1,400927016,2016-11-26
30,1,"15:22",2122,2122,"Dom Uhl missed Three Point Jumper.",16,9,7,0.553335103899674,"Memphis","Iowa",4,4,0,0,-3.1,400927016,2016-11-26
31,1,"15:22",2122,2122,"K.J. Lawson Defensive Rebound.",16,9,7,0.553335103899674,"Memphis","Iowa",4,4,0,0,-3.1,400927016,2016-11-26
32,1,"15:12",2112,2112,"Chad Rykhoek missed Layup.",16,9,7,0.549744821939845,"Memphis","Iowa",4,4,0,0,-3.1,400927016,2016-11-26
33,1,"15:12",2112,2112,"K.J. Lawson Offensive Rebound.",16,9,7,0.549744821939845,"Memphis","Iowa",4,4,0,0,-3.1,400927016,2016-11-26
34,1,"15:08",2108,2108,"Tyler Cook Block.",16,9,7,0.554119248075349,"Memphis","Iowa",4,4,0,0,-3.1,400927016,2016-11-26
35,1,"15:01",2101,2101,"Foul on Nicholas Baer.",16,9,7,0.554119248075349,"Memphis","Iowa",4,4,0,0,-3.1,400927016,2016-11-26
36,1,"15:01",2101,2101,"Dedric Lawson made Free Throw.",17,9,8,0.581615761218164,"Memphis","Iowa",4,4,0,0,-3.1,400927016,2016-11-26
37,1,"15:01",2101,2101,"Dedric Lawson made Free Throw.",18,9,9,0.608614296116177,"Memphis","Iowa",4,4,0,0,-3.1,400927016,2016-11-26
38,1,"14:53",2093,2093,"Tyler Cook missed Jumper.",18,9,9,0.638911327560287,"Memphis","Iowa",4,4,0,0,-3.1,400927016,2016-11-26
39,1,"14:53",2093,2093,"Dedric Lawson Defensive Rebound.",18,9,9,0.638911327560287,"Memphis","Iowa",4,4,0,0,-3.1,400927016,2016-11-26
40,1,"14:48",2088,2088,"Dedric Lawson made Layup. Assisted by Jeremiah Martin.",20,9,11,0.669610349155307,"Memphis","Iowa",4,4,0,0,-3.1,400927016,2016-11-26
41,1,"14:48",2088,2088,"Foul on Tyler Cook.",20,9,11,0.669610349155307,"Memphis","Iowa",4,4,0,0,-3.1,400927016,2016-11-26
42,1,"14:48",2088,2088,"Dedric Lawson made Free Throw.",21,9,12,0.693462506479542,"Memphis","Iowa",4,4,0,0,-3.1,400927016,2016-11-26
43,1,"14:41",2081,2081,"Peter Jok made Three Point Jumper. Assisted by Jordan Bohannon.",21,12,9,0.619294678518559,"Memphis","Iowa",4,4,0,0,-3.1,400927016,2016-11-26
44,1,"14:31",2071,2071,"Jeremiah Martin made Layup.",23,12,11,0.638441289587843,"Memphis","Iowa",4,4,0,0,-3.1,400927016,2016-11-26
45,1,"14:24",2064,2064,"Tyler Cook made Dunk. Assisted by Jordan Bohannon.",23,14,9,0.619753020552783,"Memphis","Iowa",4,4,0,0,-3.1,400927016,2016-11-26
46,1,"14:14",2054,2054,"K.J. Lawson Turnover.",23,14,9,0.600220709158642,"Memphis","Iowa",4,4,0,0,-3.1,400927016,2016-11-26
47,1,"14:12",2052,2052,"Jordan Bohannon Steal.",23,14,9,0.600220709158642,"Memphis","Iowa",4,4,0,0,-3.1,400927016,2016-11-26
48,1,"14:04",2044,2044,"Foul on Chad Rykhoek.",23,14,9,0.595270533915647,"Memphis","Iowa",4,4,0,0,-3.1,400927016,2016-11-26
49,1,"14:04",2044,2044,"Ahmad Wagner made Free Throw.",23,15,8,0.568468914766796,"Memphis","Iowa",4,4,0,0,-3.1,400927016,2016-11-26
50,1,"14:04",2044,2044,"Ahmad Wagner made Free Throw.",23,16,7,0.541260221634264,"Memphis","Iowa",4,4,0,0,-3.1,400927016,2016-11-26
51,1,"13:55",2035,2035,"Dedric Lawson missed Jumper.",23,16,7,0.555109475939944,"Memphis","Iowa",4,4,0,0,-3.1,400927016,2016-11-26
52,1,"13:55",2035,2035,"Cordell Pemsl Defensive Rebound.",23,16,7,0.555109475939944,"Memphis","Iowa",4,4,0,0,-3.1,400927016,2016-11-26
53,1,"13:47",2027,2027,"Jordan Bohannon missed Jumper.",23,16,7,0.58086292827746,"Memphis","Iowa",4,4,0,0,-3.1,400927016,2016-11-26
54,1,"13:47",2027,2027,"Craig Randall II Defensive Rebound.",23,16,7,0.58086292827746,"Memphis","Iowa",4,4,0,0,-3.1,400927016,2016-11-26
55,1,"13:39",2019,2019,"Foul on Ahmad Wagner.",23,16,7,0.570079078754491,"Memphis","Iowa",4,4,0,0,-3.1,400927016,2016-11-26
56,1,"13:39",2019,2019,"Dedric Lawson made Layup. Assisted by K.J. Lawson.",25,16,9,0.625599747151769,"Memphis","Iowa",4,4,0,0,-3.1,400927016,2016-11-26
57,1,"13:21",2001,2001,"Peter Jok made Three Point Jumper.",25,19,6,0.523387617796459,"Memphis","Iowa",4,4,0,0,-3.1,400927016,2016-11-26
58,1,"13:10",1990,1990,"K.J. Lawson missed Layup.",25,19,6,0.553544590628976,"Memphis","Iowa",4,4,0,0,-3.1,400927016,2016-11-26
59,1,"13:10",1990,1990,"Cordell Pemsl Block.",25,19,6,0.553544590628976,"Memphis","Iowa",4,4,0,0,-3.1,400927016,2016-11-26
60,1,"13:10",1990,1990,"Cordell Pemsl Defensive Rebound.",25,19,6,0.553544590628976,"Memphis","Iowa",4,4,0,0,-3.1,400927016,2016-11-26
61,1,"13:00",1980,1980,"Peter Jok made Three Point Jumper. Assisted by Ahmad Wagner.",25,22,3,0.452374251260174,"Memphis","Iowa",4,4,0,0,-3.1,400927016,2016-11-26
62,1,"12:48",1968,1968,"Craig Randall II missed Three Point Jumper.",25,22,3,0.438966200616266,"Memphis","Iowa",4,4,0,0,-3.1,400927016,2016-11-26
63,1,"12:48",1968,1968,"Ahmad Wagner Defensive Rebound.",25,22,3,0.438966200616266,"Memphis","Iowa",4,4,0,0,-3.1,400927016,2016-11-26
64,1,"12:39",1959,1959,"Jordan Bohannon missed Three Point Jumper.",25,22,3,0.47252059471264,"Memphis","Iowa",4,4,0,0,-3.1,400927016,2016-11-26
65,1,"12:39",1959,1959,"K.J. Lawson Defensive Rebound.",25,22,3,0.47252059471264,"Memphis","Iowa",4,4,0,0,-3.1,400927016,2016-11-26
66,1,"12:33",1953,1953,"Foul on Jeremiah Martin.",25,22,3,0.47252059471264,"Memphis","Iowa",4,4,0,0,-3.1,400927016,2016-11-26
67,1,"12:09",1929,1929,"Isaiah Moss made Jumper. Assisted by Tyler Cook.",25,24,1,0.374969326085342,"Memphis","Iowa",4,4,0,0,-3.1,400927016,2016-11-26
68,1,"11:53",1913,1913,"Chad Rykhoek Turnover.",25,24,1,0.417770329275826,"Memphis","Iowa",4,4,0,0,-3.1,400927016,2016-11-26
69,1,"11:51",1911,1911,"Tyler Cook Steal.",25,24,1,0.417770329275826,"Memphis","Iowa",4,4,0,0,-3.1,400927016,2016-11-26
70,1,"11:26",1886,1886,"Isaiah Moss missed Three Point Jumper.",25,24,1,0.38380172733346,"Memphis","Iowa",4,4,0,0,-3.1,400927016,2016-11-26
71,1,"11:26",1886,1886,"Tyler Cook Offensive Rebound.",25,24,1,0.38380172733346,"Memphis","Iowa",4,4,0,0,-3.1,400927016,2016-11-26
72,1,"11:11",1871,1871,"Foul on Chad Rykhoek.",25,24,1,0.395914748852176,"Memphis","Iowa",4,4,0,0,-3.1,400927016,2016-11-26
73,1,"11:11",1871,1871,"Tyler Cook missed Free Throw.",25,24,1,0.395914748852176,"Memphis","Iowa",4,4,0,0,-3.1,400927016,2016-11-26
74,1,"11:11",1871,1871,"Iowa Deadball Team Rebound.",25,24,1,0.395914748852176,"Memphis","Iowa",4,4,0,0,-3.1,400927016,2016-11-26
75,1,"11:11",1871,1871,"Tyler Cook made Free Throw.",25,25,0,0.366640156410163,"Memphis","Iowa",4,4,0,0,-3.1,400927016,2016-11-26
76,1,"10:55",1855,1855,"Dedric Lawson made Jumper. Assisted by K.J. Lawson.",27,25,2,0.441320301453045,"Memphis","Iowa",4,4,0,0,-3.1,400927016,2016-11-26
77,1,"10:35",1835,1835,"Cordell Pemsl missed Layup.",27,25,2,0.441442023510584,"Memphis","Iowa",4,4,0,0,-3.1,400927016,2016-11-26
78,1,"10:35",1835,1835,"K.J. Lawson Defensive Rebound.",27,25,2,0.441442023510584,"Memphis","Iowa",4,4,0,0,-3.1,400927016,2016-11-26
79,1,"10:24",1824,1824,"Dedric Lawson made Layup.",29,25,4,0.503863797392984,"Memphis","Iowa",4,4,0,0,-3.1,400927016,2016-11-26
80,1,"10:15",1815,1815,"Cordell Pemsl made Layup. Assisted by Jordan Bohannon.",29,27,2,0.4441699834682,"Memphis","Iowa",4,4,0,0,-3.1,400927016,2016-11-26
81,1,"10:04",1804,1804,"Foul on Jeremiah Martin.",29,27,2,0.425017357888176,"Memphis","Iowa",4,4,0,0,-3.1,400927016,2016-11-26
82,1,"9:50",1790,1790,"Christian Williams Turnover.",29,27,2,0.430172568070625,"Memphis","Iowa",4,4,0,0,-3.1,400927016,2016-11-26
83,1,"9:24",1764,1764,"Markel Crawford missed Three Point Jumper.",29,27,2,0.428289798734874,"Memphis","Iowa",4,4,0,0,-3.1,400927016,2016-11-26
84,1,"9:24",1764,1764,"Cordell Pemsl Defensive Rebound.",29,27,2,0.428289798734874,"Memphis","Iowa",4,4,0,0,-3.1,400927016,2016-11-26
85,1,"9:18",1758,1758,"Peter Jok made Three Point Jumper.",29,30,-1,0.30467714436488,"Memphis","Iowa",4,4,0,0,-3.1,400927016,2016-11-26
86,1,"9:09",1749,1749,"Dedric Lawson made Layup.",31,30,1,0.425527829064091,"Memphis","Iowa",4,4,0,0,-3.1,400927016,2016-11-26
87,1,"9:01",1741,1741,"Tyler Cook Turnover.",31,30,1,0.425527829064091,"Memphis","Iowa",4,4,0,0,-3.1,400927016,2016-11-26
88,1,"9:00",1740,1740,"Markel Crawford Steal.",31,30,1,0.425527829064091,"Memphis","Iowa",4,4,0,0,-3.1,400927016,2016-11-26
89,1,"8:56",1736,1736,"Markel Crawford made Dunk.",33,30,3,0.471507432866936,"Memphis","Iowa",4,4,0,0,-3.1,400927016,2016-11-26
90,1,"8:32",1712,1712,"Foul on Markel Crawford.",33,30,3,0.465033169392799,"Memphis","Iowa",4,4,0,0,-3.1,400927016,2016-11-26
91,1,"8:16",1696,1696,"Peter Jok missed Three Point Jumper.",33,30,3,0.495800634404224,"Memphis","Iowa",4,4,0,0,-3.1,400927016,2016-11-26
92,1,"8:16",1696,1696,"Dedric Lawson Defensive Rebound.",33,30,3,0.495800634404224,"Memphis","Iowa",4,4,0,0,-3.1,400927016,2016-11-26
93,1,"7:57",1677,1677,"Dedric Lawson missed Three Point Jumper.",33,30,3,0.477225835446593,"Memphis","Iowa",4,4,0,0,-3.1,400927016,2016-11-26
94,1,"7:57",1677,1677,"Dom Uhl Defensive Rebound.",33,30,3,0.477225835446593,"Memphis","Iowa",4,4,0,0,-3.1,400927016,2016-11-26
95,1,"7:45",1665,1665,"Peter Jok made Jumper.",33,32,1,0.404017751450134,"Memphis","Iowa",4,4,0,0,-3.1,400927016,2016-11-26
96,1,"7:37",1657,1657,"Craig Randall II Turnover.",33,32,1,0.419541966765994,"Memphis","Iowa",4,4,0,0,-3.1,400927016,2016-11-26
97,1,"7:36",1656,1656,"Christian Williams Steal.",33,32,1,0.419541966765994,"Memphis","Iowa",4,4,0,0,-3.1,400927016,2016-11-26
98,1,"7:14",1634,1634,"Cordell Pemsl made Layup. Assisted by Tyler Cook.",33,34,-1,0.36081947444637,"Memphis","Iowa",4,4,0,0,-3.1,400927016,2016-11-26
99,1,"6:46",1606,1606,"K.J. Lawson made Jumper. Assisted by Markel Crawford.",35,34,1,0.393559637891829,"Memphis","Iowa",4,4,0,0,-3.1,400927016,2016-11-26
100,1,"6:39",1599,1599,"Cordell Pemsl made Layup.",35,36,-1,0.369422982192787,"Memphis","Iowa",4,4,0,0,-3.1,400927016,2016-11-26
101,1,"6:22",1582,1582,"Craig Randall II made Three Point Jumper. Assisted by Markel Crawford.",38,36,2,0.42430523407793,"Memphis","Iowa",4,4,0,0,-3.1,400927016,2016-11-26
102,1,"6:11",1571,1571,"Christian Williams Turnover.",38,36,2,0.457481346157106,"Memphis","Iowa",4,4,0,0,-3.1,400927016,2016-11-26
103,1,"6:08",1568,1568,"Craig Randall II Steal.",38,36,2,0.433329566646204,"Memphis","Iowa",4,4,0,0,-3.1,400927016,2016-11-26
104,1,"6:07",1567,1567,"Craig Randall II made Layup.",40,36,4,0.504108178525956,"Memphis","Iowa",4,4,0,0,-3.1,400927016,2016-11-26
105,1,"6:00",1560,1560,"Foul on Christian Williams.",40,36,4,0.504108178525956,"Memphis","Iowa",4,4,0,0,-3.1,400927016,2016-11-26
106,1,"5:37",1537,1537,"Craig Randall II missed Three Point Jumper.",40,36,4,0.516776508578157,"Memphis","Iowa",4,4,0,0,-3.1,400927016,2016-11-26
107,1,"5:37",1537,1537,"Cordell Pemsl Defensive Rebound.",40,36,4,0.516776508578157,"Memphis","Iowa",4,4,0,0,-3.1,400927016,2016-11-26
108,1,"5:11",1511,1511,"Jordan Bohannon Turnover.",40,36,4,0.55131380754928,"Memphis","Iowa",4,4,0,0,-3.1,400927016,2016-11-26
109,1,"4:50",1490,1490,"Christian Kessee missed Layup.",40,36,4,0.542092482575362,"Memphis","Iowa",4,4,0,0,-3.1,400927016,2016-11-26
110,1,"4:50",1490,1490,"Tyler Cook Defensive Rebound.",40,36,4,0.542092482575362,"Memphis","Iowa",4,4,0,0,-3.1,400927016,2016-11-26
111,1,"4:45",1485,1485,"Foul on Christian Kessee.",40,36,4,0.517371660556759,"Memphis","Iowa",4,4,0,0,-3.1,400927016,2016-11-26
112,1,"4:26",1466,1466,"Peter Jok made Layup.",40,38,2,0.480100719113864,"Memphis","Iowa",4,4,0,0,-3.1,400927016,2016-11-26
113,1,"4:17",1457,1457,"K.J. Lawson made Layup. Assisted by Christian Kessee.",42,38,4,0.511694484388355,"Memphis","Iowa",4,4,0,0,-3.1,400927016,2016-11-26
114,1,"4:04",1444,1444,"Foul on Markel Crawford.",42,38,4,0.55927845318505,"Memphis","Iowa",4,4,0,0,-3.1,400927016,2016-11-26
115,1,"4:04",1444,1444,"Dom Uhl made Free Throw.",42,39,3,0.521502762223959,"Memphis","Iowa",4,4,0,0,-3.1,400927016,2016-11-26
116,1,"4:04",1444,1444,"Dom Uhl made Free Throw.",42,40,2,0.483479528825795,"Memphis","Iowa",4,4,0,0,-3.1,400927016,2016-11-26
117,1,"3:45",1425,1425,"Dedric Lawson made Jumper.",44,40,4,0.523994242036028,"Memphis","Iowa",4,4,0,0,-3.1,400927016,2016-11-26
118,1,"3:37",1417,1417,"Dom Uhl Turnover.",44,40,4,0.541517873894983,"Memphis","Iowa",4,4,0,0,-3.1,400927016,2016-11-26
119,1,"3:36",1416,1416,"Christian Kessee Steal.",44,40,4,0.541517873894983,"Memphis","Iowa",4,4,0,0,-3.1,400927016,2016-11-26
120,1,"3:32",1412,1412,"K.J. Lawson made Dunk. Assisted by Dedric Lawson.",46,40,6,0.6169465494103,"Memphis","Iowa",4,4,0,0,-3.1,400927016,2016-11-26
121,1,"3:14",1394,1394,"Foul on Dedric Lawson.",46,40,6,0.588463057152817,"Memphis","Iowa",4,4,0,0,-3.1,400927016,2016-11-26
122,1,"3:14",1394,1394,"Peter Jok made Free Throw.",46,41,5,0.550622416914742,"Memphis","Iowa",4,4,0,0,-3.1,400927016,2016-11-26
123,1,"3:14",1394,1394,"Peter Jok made Free Throw.",46,42,4,0.512186660873039,"Memphis","Iowa",4,4,0,0,-3.1,400927016,2016-11-26
124,1,"2:58",1378,1378,"Dedric Lawson Turnover.",46,42,4,0.510134718157721,"Memphis","Iowa",4,4,0,0,-3.1,400927016,2016-11-26
125,1,"2:57",1377,1377,"Jordan Bohannon Steal.",46,42,4,0.510134718157721,"Memphis","Iowa",4,4,0,0,-3.1,400927016,2016-11-26
126,1,"2:53",1373,1373,"Dom Uhl made Layup. Assisted by Jordan Bohannon.",46,44,2,0.438274934362503,"Memphis","Iowa",4,4,0,0,-3.1,400927016,2016-11-26
127,1,"2:33",1353,1353,"Dedric Lawson missed Three Point Jumper.",46,44,2,0.47802632292754,"Memphis","Iowa",4,4,0,0,-3.1,400927016,2016-11-26
128,1,"2:33",1353,1353,"K.J. Lawson Offensive Rebound.",46,44,2,0.47802632292754,"Memphis","Iowa",4,4,0,0,-3.1,400927016,2016-11-26
129,1,"2:29",1349,1349,"K.J. Lawson made Layup.",48,44,4,0.544724738089446,"Memphis","Iowa",4,4,0,0,-3.1,400927016,2016-11-26
130,1,"2:11",1331,1331,"Peter Jok made Three Point Jumper.",48,47,1,0.414385395108693,"Memphis","Iowa",4,4,0,0,-3.1,400927016,2016-11-26
131,1,"1:43",1303,1303,"K.J. Lawson missed Layup.",48,47,1,0.440417858084747,"Memphis","Iowa",4,4,0,0,-3.1,400927016,2016-11-26
132,1,"1:43",1303,1303,"K.J. Lawson Offensive Rebound.",48,47,1,0.440417858084747,"Memphis","Iowa",4,4,0,0,-3.1,400927016,2016-11-26
133,1,"1:41",1301,1301,"K.J. Lawson made Layup.",50,47,3,0.513688121475484,"Memphis","Iowa",4,4,0,0,-3.1,400927016,2016-11-26
134,1,"1:30",1290,1290,"Foul on Jake McDowell.",50,47,3,0.550930655983693,"Memphis","Iowa",4,4,0,0,-3.1,400927016,2016-11-26
135,1,"1:30",1290,1290,"Tyler Cook made Free Throw.",50,48,2,0.509248980288579,"Memphis","Iowa",4,4,0,0,-3.1,400927016,2016-11-26
136,1,"1:30",1290,1290,"Tyler Cook made Free Throw.",50,49,1,0.467438312007233,"Memphis","Iowa",4,4,0,0,-3.1,400927016,2016-11-26
137,1,"1:07",1267,1267,"Craig Randall II made Jumper.",52,49,3,0.519814951348888,"Memphis","Iowa",4,4,0,0,-3.1,400927016,2016-11-26
138,1,"0:56",1256,1256,"Jordan Bohannon missed Three Point Jumper.",52,49,3,0.510736397829485,"Memphis","Iowa",4,4,0,0,-3.1,400927016,2016-11-26
139,1,"0:56",1256,1256,"Ahmad Wagner Offensive Rebound.",52,49,3,0.510736397829485,"Memphis","Iowa",4,4,0,0,-3.1,400927016,2016-11-26
140,1,"0:54",1254,1254,"Ahmad Wagner made Layup.",52,51,1,0.435342274418988,"Memphis","Iowa",4,4,0,0,-3.1,400927016,2016-11-26
141,1,"0:33",1233,1233,"Dedric Lawson made Layup.",54,51,3,0.508155888622756,"Memphis","Iowa",4,4,0,0,-3.1,400927016,2016-11-26
142,1,"0:05",1205,1205,"Peter Jok missed Three Point Jumper.",54,51,3,0.507875164532897,"Memphis","Iowa",4,4,0,0,-3.1,400927016,2016-11-26
143,1,"0:05",1205,1205,"Iowa Offensive Rebound.",54,51,3,0.507875164532897,"Memphis","Iowa",4,4,0,0,-3.1,400927016,2016-11-26
144,1,"0:04",1204,1204,"Jordan Bohannon Turnover.",54,51,3,0.507875164532897,"Memphis","Iowa",4,4,0,0,-3.1,400927016,2016-11-26
145,1,"0:00",1200,1200,"Dedric Lawson missed Layup.",54,51,3,0.507875164532897,"Memphis","Iowa",4,4,0,0,-3.1,400927016,2016-11-26
146,1,"0:00",1200,1200,"Cordell Pemsl Block.",54,51,3,0.507875164532897,"Memphis","Iowa",4,4,0,0,-3.1,400927016,2016-11-26
147,1,"0:00",1200,1200,"Dom Uhl Defensive Rebound.",54,51,3,0.507875164532897,"Memphis","Iowa",4,4,0,0,-3.1,400927016,2016-11-26
148,1,"0:00",1200,1200,"End of 1st half",54,51,3,0.507875164532897,"Memphis","Iowa",4,4,0,0,-3.1,400927016,2016-11-26
149,2,"20:00",1200,1200,"PLAY",54,51,3,0.507875164532897,"Memphis","Iowa",4,4,0,0,-3.1,400927016,2016-11-26
150,2,"19:42",1182,1182,"Tyler Cook made Layup.",54,53,1,0.428651738770139,"Memphis","Iowa",4,4,0,0,-3.1,400927016,2016-11-26
151,2,"19:24",1164,1164,"Jeremiah Martin Turnover.",54,53,1,0.405263085047394,"Memphis","Iowa",4,4,0,0,-3.1,400927016,2016-11-26
152,2,"19:23",1163,1163,"Christian Williams Steal.",54,53,1,0.405263085047394,"Memphis","Iowa",4,4,0,0,-3.1,400927016,2016-11-26
153,2,"19:21",1161,1161,"Christian Williams made Layup.",54,55,-1,0.328869145022032,"Memphis","Iowa",4,4,0,0,-3.1,400927016,2016-11-26
154,2,"19:02",1142,1142,"K.J. Lawson made Layup.",56,55,1,0.448446242120181,"Memphis","Iowa",4,4,0,0,-3.1,400927016,2016-11-26
155,2,"18:48",1128,1128,"Peter Jok made Three Point Jumper.",56,58,-2,0.304613188831869,"Memphis","Iowa",4,4,0,0,-3.1,400927016,2016-11-26
156,2,"18:30",1110,1110,"Dedric Lawson missed Layup.",56,58,-2,0.33114302923754,"Memphis","Iowa",4,4,0,0,-3.1,400927016,2016-11-26
157,2,"18:30",1110,1110,"Tyler Cook Defensive Rebound.",56,58,-2,0.33114302923754,"Memphis","Iowa",4,4,0,0,-3.1,400927016,2016-11-26
158,2,"18:22",1102,1102,"Foul on Chad Rykhoek.",56,58,-2,0.315500570138106,"Memphis","Iowa",4,4,0,0,-3.1,400927016,2016-11-26
159,2,"18:22",1102,1102,"Tyler Cook made Free Throw.",56,59,-3,0.281244847722606,"Memphis","Iowa",4,4,0,0,-3.1,400927016,2016-11-26
160,2,"18:22",1102,1102,"Tyler Cook made Free Throw.",56,60,-4,0.249353563060187,"Memphis","Iowa",4,4,0,0,-3.1,400927016,2016-11-26
161,2,"18:22",1102,1102,"Markel Crawford made Layup.",58,60,-2,0.315500570138106,"Memphis","Iowa",4,4,0,0,-3.1,400927016,2016-11-26
162,2,"18:21",1101,1101,"Foul on Craig Randall II.",58,60,-2,0.315500570138106,"Memphis","Iowa",4,4,0,0,-3.1,400927016,2016-11-26
163,2,"17:57",1077,1077,"Peter Jok Turnover.",58,60,-2,0.339374636937606,"Memphis","Iowa",4,4,0,0,-3.1,400927016,2016-11-26
164,2,"17:34",1054,1054,"Markel Crawford missed Jumper.",58,60,-2,0.32548010400603,"Memphis","Iowa",4,4,0,0,-3.1,400927016,2016-11-26
165,2,"17:34",1054,1054,"Jeremiah Martin Offensive Rebound.",58,60,-2,0.32548010400603,"Memphis","Iowa",4,4,0,0,-3.1,400927016,2016-11-26
166,2,"17:30",1050,1050,"K.J. Lawson missed Three Point Jumper.",58,60,-2,0.32548010400603,"Memphis","Iowa",4,4,0,0,-3.1,400927016,2016-11-26
167,2,"17:30",1050,1050,"Tyler Cook Defensive Rebound.",58,60,-2,0.32548010400603,"Memphis","Iowa",4,4,0,0,-3.1,400927016,2016-11-26
168,2,"17:12",1032,1032,"Dom Uhl missed Three Point Jumper.",58,60,-2,0.312447243365959,"Memphis","Iowa",4,4,0,0,-3.1,400927016,2016-11-26
169,2,"17:12",1032,1032,"K.J. Lawson Defensive Rebound.",58,60,-2,0.312447243365959,"Memphis","Iowa",4,4,0,0,-3.1,400927016,2016-11-26
170,2,"16:46",1006,1006,"K.J. Lawson missed Layup.",58,60,-2,0.306123236798142,"Memphis","Iowa",4,4,0,0,-3.1,400927016,2016-11-26
171,2,"16:46",1006,1006,"Peter Jok Defensive Rebound.",58,60,-2,0.306123236798142,"Memphis","Iowa",4,4,0,0,-3.1,400927016,2016-11-26
172,2,"16:35",995,995,"Peter Jok missed Layup.",58,60,-2,0.306436458233631,"Memphis","Iowa",4,4,0,0,-3.1,400927016,2016-11-26
173,2,"16:35",995,995,"Iowa Offensive Rebound.",58,60,-2,0.306436458233631,"Memphis","Iowa",4,4,0,0,-3.1,400927016,2016-11-26
174,2,"16:33",993,993,"Nicholas Baer made Three Point Jumper. Assisted by Christian Williams.",58,63,-5,0.205490859026292,"Memphis","Iowa",4,4,0,0,-3.1,400927016,2016-11-26
175,2,"16:26",986,986,"Dedric Lawson made Layup.",60,63,-3,0.294085276501539,"Memphis","Iowa",4,4,0,0,-3.1,400927016,2016-11-26
176,2,"15:55",955,955,"Tyler Cook Turnover.",60,63,-3,0.256270271572623,"Memphis","Iowa",4,4,0,0,-3.1,400927016,2016-11-26
177,2,"15:45",945,945,"Markel Crawford missed Three Point Jumper.",60,63,-3,0.288234316195405,"Memphis","Iowa",4,4,0,0,-3.1,400927016,2016-11-26
178,2,"15:45",945,945,"Dedric Lawson Offensive Rebound.",60,63,-3,0.288234316195405,"Memphis","Iowa",4,4,0,0,-3.1,400927016,2016-11-26
179,2,"15:40",940,940,"Dedric Lawson made Layup.",62,63,-1,0.372751677416899,"Memphis","Iowa",4,4,0,0,-3.1,400927016,2016-11-26
180,2,"15:32",932,932,"Christian Williams missed Three Point Jumper.",62,63,-1,0.360999359347979,"Memphis","Iowa",4,4,0,0,-3.1,400927016,2016-11-26
181,2,"15:32",932,932,"Dedric Lawson Defensive Rebound.",62,63,-1,0.360999359347979,"Memphis","Iowa",4,4,0,0,-3.1,400927016,2016-11-26
182,2,"15:24",924,924,"Jeremiah Martin made Three Point Jumper. Assisted by Craig Randall II.",65,63,2,0.480162031890832,"Memphis","Iowa",4,4,0,0,-3.1,400927016,2016-11-26
183,2,"15:05",905,905,"Christian Williams missed Layup.",65,63,2,0.503876811309226,"Memphis","Iowa",4,4,0,0,-3.1,400927016,2016-11-26
184,2,"15:05",905,905,"Dedric Lawson Block.",65,63,2,0.503876811309226,"Memphis","Iowa",4,4,0,0,-3.1,400927016,2016-11-26
185,2,"15:05",905,905,"Jeremiah Martin Defensive Rebound.",65,63,2,0.503876811309226,"Memphis","Iowa",4,4,0,0,-3.1,400927016,2016-11-26
186,2,"14:55",895,895,"Jeremiah Martin missed Three Point Jumper.",65,63,2,0.5168812041494,"Memphis","Iowa",4,4,0,0,-3.1,400927016,2016-11-26
187,2,"14:55",895,895,"Markel Crawford Offensive Rebound.",65,63,2,0.5168812041494,"Memphis","Iowa",4,4,0,0,-3.1,400927016,2016-11-26
188,2,"14:35",875,875,"Jeremiah Martin made Three Point Jumper.",68,63,5,0.646393165759471,"Memphis","Iowa",4,4,0,0,-3.1,400927016,2016-11-26
189,2,"14:24",864,864,"Tyler Cook missed Layup.",68,63,5,0.627234189397651,"Memphis","Iowa",4,4,0,0,-3.1,400927016,2016-11-26
190,2,"14:24",864,864,"Tyler Cook Offensive Rebound.",68,63,5,0.627234189397651,"Memphis","Iowa",4,4,0,0,-3.1,400927016,2016-11-26
191,2,"14:21",861,861,"Tyler Cook made Layup.",68,65,3,0.534243249464232,"Memphis","Iowa",4,4,0,0,-3.1,400927016,2016-11-26
192,2,"14:11",851,851,"K.J. Lawson made Layup.",70,65,5,0.675441618358571,"Memphis","Iowa",4,4,0,0,-3.1,400927016,2016-11-26
