"play_id","half","time_remaining_half","secs_remaining","secs_remaining_absolute","description","home_score","away_score","score_diff","win_prob","home","away","home_time_out_remaining","away_time_out_remaining","home_timeout_ind","away_timeout_ind","home_favored_by","game_id","date"
1,1,"20:00",2400,2400,"PLAY",0,0,0,0.735069594872722,"Oregon","UCLA",4,4,0,0,4.5,400988329,2018-01-20
2,1,"20:00",2400,2400,"Jump Ball won by UCLA",0,0,0,0.735069594872722,"Oregon","UCLA",4,4,0,0,4.5,400988329,2018-01-20
3,1,"19:39",2379,2379,"Aaron Holiday missed Three Point Jumper.",0,0,0,0.733436331367588,"Oregon","UCLA",4,4,0,0,4.5,400988329,2018-01-20
4,1,"19:39",2379,2379,"Kenny Wooten Defensive Rebound.",0,0,0,0.733436331367588,"Oregon","UCLA",4,4,0,0,4.5,400988329,2018-01-20
5,1,"19:28",2368,2368,"Elijah Brown missed Three Point Jumper.",0,0,0,0.718456005559136,"Oregon","UCLA",4,4,0,0,4.5,400988329,2018-01-20
6,1,"19:28",2368,2368,"Aaron Holiday Defensive Rebound.",0,0,0,0.718456005559136,"Oregon","UCLA",4,4,0,0,4.5,400988329,2018-01-20
7,1,"19:20",2360,2360,"Kris Wilkes made Layup.",0,2,-2,0.704698575531818,"Oregon","UCLA",4,4,0,0,4.5,400988329,2018-01-20
8,1,"19:07",2347,2347,"Elijah Brown made Layup. Assisted by Troy Brown.",2,2,0,0.721347677835724,"Oregon","UCLA",4,4,0,0,4.5,400988329,2018-01-20
9,1,"18:44",2324,2324,"Thomas Welsh made Layup. Assisted by Aaron Holiday.",2,4,-2,0.689959149954375,"Oregon","UCLA",4,4,0,0,4.5,400988329,2018-01-20
10,1,"18:22",2302,2302,"Troy Brown missed Jumper.",2,4,-2,0.673027333659475,"Oregon","UCLA",4,4,0,0,4.5,400988329,2018-01-20
11,1,"18:22",2302,2302,"Gyorgy Goloman Defensive Rebound.",2,4,-2,0.673027333659475,"Oregon","UCLA",4,4,0,0,4.5,400988329,2018-01-20
12,1,"18:11",2291,2291,"Aaron Holiday Turnover.",2,4,-2,0.688418341189427,"Oregon","UCLA",4,4,0,0,4.5,400988329,2018-01-20
13,1,"18:02",2282,2282,"Kenny Wooten missed Layup.",2,4,-2,0.674866157754254,"Oregon","UCLA",4,4,0,0,4.5,400988329,2018-01-20
14,1,"18:02",2282,2282,"Thomas Welsh Defensive Rebound.",2,4,-2,0.674866157754254,"Oregon","UCLA",4,4,0,0,4.5,400988329,2018-01-20
15,1,"17:52",2272,2272,"Gyorgy Goloman missed Layup.",2,4,-2,0.684237256161079,"Oregon","UCLA",4,4,0,0,4.5,400988329,2018-01-20
16,1,"17:52",2272,2272,"Payton Pritchard Defensive Rebound.",2,4,-2,0.684237256161079,"Oregon","UCLA",4,4,0,0,4.5,400988329,2018-01-20
17,1,"17:44",2264,2264,"Payton Pritchard missed Layup.",2,4,-2,0.67978662415626,"Oregon","UCLA",4,4,0,0,4.5,400988329,2018-01-20
18,1,"17:44",2264,2264,"Gyorgy Goloman Block.",2,4,-2,0.67978662415626,"Oregon","UCLA",4,4,0,0,4.5,400988329,2018-01-20
19,1,"17:44",2264,2264,"Oregon Offensive Rebound.",2,4,-2,0.67978662415626,"Oregon","UCLA",4,4,0,0,4.5,400988329,2018-01-20
20,1,"17:21",2241,2241,"MiKyle McIntosh made Three Point Jumper. Assisted by Elijah Brown.",5,4,1,0.737977051163657,"Oregon","UCLA",4,4,0,0,4.5,400988329,2018-01-20
21,1,"17:12",2232,2232,"Thomas Welsh missed Layup.",5,4,1,0.745397460625821,"Oregon","UCLA",4,4,0,0,4.5,400988329,2018-01-20
22,1,"17:12",2232,2232,"MiKyle McIntosh Defensive Rebound.",5,4,1,0.745397460625821,"Oregon","UCLA",4,4,0,0,4.5,400988329,2018-01-20
23,1,"16:58",2218,2218,"Elijah Brown missed Three Point Jumper.",5,4,1,0.749116110857706,"Oregon","UCLA",4,4,0,0,4.5,400988329,2018-01-20
24,1,"16:58",2218,2218,"Thomas Welsh Defensive Rebound.",5,4,1,0.749116110857706,"Oregon","UCLA",4,4,0,0,4.5,400988329,2018-01-20
25,1,"16:40",2200,2200,"Kris Wilkes missed Three Point Jumper.",5,4,1,0.744247054284218,"Oregon","UCLA",4,4,0,0,4.5,400988329,2018-01-20
26,1,"16:40",2200,2200,"Kenny Wooten Defensive Rebound.",5,4,1,0.744247054284218,"Oregon","UCLA",4,4,0,0,4.5,400988329,2018-01-20
27,1,"16:29",2189,2189,"Elijah Brown missed Three Point Jumper.",5,4,1,0.742544436822428,"Oregon","UCLA",4,4,0,0,4.5,400988329,2018-01-20
28,1,"16:29",2189,2189,"Troy Brown Offensive Rebound.",5,4,1,0.742544436822428,"Oregon","UCLA",4,4,0,0,4.5,400988329,2018-01-20
29,1,"16:24",2184,2184,"Payton Pritchard made Three Point Jumper. Assisted by Troy Brown.",8,4,4,0.799764544230158,"Oregon","UCLA",4,4,0,0,4.5,400988329,2018-01-20
30,1,"16:13",2173,2173,"Prince Ali made Three Point Jumper. Assisted by Aaron Holiday.",8,7,1,0.736949924531028,"Oregon","UCLA",4,4,0,0,4.5,400988329,2018-01-20
31,1,"15:46",2146,2146,"Foul on Gyorgy Goloman.",8,7,1,0.745469078351428,"Oregon","UCLA",4,4,0,0,4.5,400988329,2018-01-20
32,1,"15:46",2146,2146,"Official TV Timeout",8,7,1,0.745469078351428,"Oregon","UCLA",4,4,0,0,4.5,400988329,2018-01-20
33,1,"15:29",2129,2129,"MiKyle McIntosh made Layup.",10,7,3,0.77803410972747,"Oregon","UCLA",4,4,0,0,4.5,400988329,2018-01-20
34,1,"15:20",2120,2120,"Prince Ali missed Three Point Jumper.",10,7,3,0.77803410972747,"Oregon","UCLA",4,4,0,0,4.5,400988329,2018-01-20
35,1,"15:20",2120,2120,"Paul White Defensive Rebound.",10,7,3,0.77803410972747,"Oregon","UCLA",4,4,0,0,4.5,400988329,2018-01-20
36,1,"15:11",2111,2111,"Troy Brown made Layup. Assisted by Paul White.",12,7,5,0.823207582577593,"Oregon","UCLA",4,4,0,0,4.5,400988329,2018-01-20
37,1,"15:00",2100,2100,"Aaron Holiday Turnover.",12,7,5,0.812649849050415,"Oregon","UCLA",4,4,0,0,4.5,400988329,2018-01-20
38,1,"15:00",2100,2100,"Foul on Aaron Holiday.",12,7,5,0.812649849050415,"Oregon","UCLA",4,4,0,0,4.5,400988329,2018-01-20
39,1,"15:00",2100,2100,"Foul on Elijah Brown.",12,7,5,0.812649849050415,"Oregon","UCLA",4,4,0,0,4.5,400988329,2018-01-20
40,1,"15:00",2100,2100,"Technical Foul on Elijah Brown.",12,7,5,0.812649849050415,"Oregon","UCLA",4,4,0,0,4.5,400988329,2018-01-20
41,1,"14:58",2098,2098,"Technical Foul on Aaron Holiday.",12,7,5,0.819716800034524,"Oregon","UCLA",4,4,0,0,4.5,400988329,2018-01-20
42,1,"14:58",2098,2098,"Foul on Aaron Holiday.",12,7,5,0.819716800034524,"Oregon","UCLA",4,4,0,0,4.5,400988329,2018-01-20
43,1,"14:52",2092,2092,"Foul on Alex Olesinski.",12,7,5,0.819716800034524,"Oregon","UCLA",4,4,0,0,4.5,400988329,2018-01-20
44,1,"14:50",2090,2090,"MiKyle McIntosh made Layup. Assisted by Payton Pritchard.",14,7,7,0.853524482753634,"Oregon","UCLA",4,4,0,0,4.5,400988329,2018-01-20
45,1,"14:30",2070,2070,"Foul on Payton Pritchard.",14,7,7,0.841392597897777,"Oregon","UCLA",4,4,0,0,4.5,400988329,2018-01-20
46,1,"14:12",2052,2052,"Prince Ali made Three Point Jumper.",14,10,4,0.801808106399562,"Oregon","UCLA",4,4,0,0,4.5,400988329,2018-01-20
47,1,"13:49",2029,2029,"Victor Bailey Jr. made Three Point Jumper. Assisted by Payton Pritchard.",17,10,7,0.860573685116865,"Oregon","UCLA",4,4,0,0,4.5,400988329,2018-01-20
48,1,"13:23",2003,2003,"Jaylen Hands Turnover.",17,10,7,0.840163293306892,"Oregon","UCLA",4,4,0,0,4.5,400988329,2018-01-20
49,1,"13:23",2003,2003,"Troy Brown Steal.",17,10,7,0.840163293306892,"Oregon","UCLA",4,4,0,0,4.5,400988329,2018-01-20
50,1,"13:18",1998,1998,"Payton Pritchard made Layup. Assisted by Troy Brown.",19,10,9,0.889189279387788,"Oregon","UCLA",4,4,0,0,4.5,400988329,2018-01-20
51,1,"13:11",1991,1991,"UCLA  Timeout",19,10,9,0.889189279387788,"Oregon","UCLA",3,4,1,0,4.5,400988329,2018-01-20
52,1,"12:48",1968,1968,"Aaron Holiday missed Jumper.",19,10,9,0.865143807941767,"Oregon","UCLA",3,4,1,0,4.5,400988329,2018-01-20
53,1,"12:48",1968,1968,"Thomas Welsh Offensive Rebound.",19,10,9,0.865143807941767,"Oregon","UCLA",3,4,1,0,4.5,400988329,2018-01-20
54,1,"12:48",1968,1968,"Thomas Welsh made Two Point Tip Shot.",19,12,7,0.838448153379946,"Oregon","UCLA",3,4,1,0,4.5,400988329,2018-01-20
55,1,"12:22",1942,1942,"Victor Bailey Jr. missed Three Point Jumper.",19,12,7,0.85473495806267,"Oregon","UCLA",3,4,1,0,4.5,400988329,2018-01-20
56,1,"12:22",1942,1942,"Alex Olesinski Defensive Rebound.",19,12,7,0.85473495806267,"Oregon","UCLA",3,4,1,0,4.5,400988329,2018-01-20
57,1,"12:17",1937,1937,"Foul on Troy Brown.",19,12,7,0.851991287141872,"Oregon","UCLA",3,4,1,0,4.5,400988329,2018-01-20
58,1,"12:10",1930,1930,"Jaylen Hands missed Jumper.",19,12,7,0.851991287141872,"Oregon","UCLA",3,4,0,0,4.5,400988329,2018-01-20
59,1,"12:10",1930,1930,"Kenny Wooten Defensive Rebound.",19,12,7,0.851991287141872,"Oregon","UCLA",3,4,0,0,4.5,400988329,2018-01-20
60,1,"12:03",1923,1923,"Paul White missed Three Point Jumper.",19,12,7,0.85484709358207,"Oregon","UCLA",3,4,0,0,4.5,400988329,2018-01-20
61,1,"12:03",1923,1923,"Kris Wilkes Defensive Rebound.",19,12,7,0.85484709358207,"Oregon","UCLA",3,4,0,0,4.5,400988329,2018-01-20
62,1,"11:48",1908,1908,"Foul on Victor Bailey Jr..",19,12,7,0.847314864207389,"Oregon","UCLA",3,4,0,0,4.5,400988329,2018-01-20
63,1,"11:48",1908,1908,"Official TV Timeout",19,12,7,0.847314864207389,"Oregon","UCLA",3,4,0,0,4.5,400988329,2018-01-20
64,1,"11:48",1908,1908,"Kris Wilkes made Free Throw.",19,13,6,0.831556984419281,"Oregon","UCLA",3,4,0,0,4.5,400988329,2018-01-20
65,1,"11:48",1908,1908,"Kris Wilkes made Free Throw.",19,14,5,0.814528795575362,"Oregon","UCLA",3,4,0,0,4.5,400988329,2018-01-20
66,1,"11:23",1883,1883,"Kenny Wooten made Layup. Assisted by Paul White.",21,14,7,0.851001029887237,"Oregon","UCLA",3,4,0,0,4.5,400988329,2018-01-20
67,1,"11:01",1861,1861,"Foul on Abu Kigab.",21,14,7,0.864281843685971,"Oregon","UCLA",3,4,0,0,4.5,400988329,2018-01-20
68,1,"11:01",1861,1861,"Jaylen Hands made Free Throw.",21,15,6,0.847720314262898,"Oregon","UCLA",3,4,0,0,4.5,400988329,2018-01-20
69,1,"11:01",1861,1861,"Jaylen Hands made Free Throw.",21,16,5,0.829536402326229,"Oregon","UCLA",3,4,0,0,4.5,400988329,2018-01-20
70,1,"10:40",1840,1840,"Kenny Wooten made Layup. Assisted by Victor Bailey Jr..",23,16,7,0.84392801305364,"Oregon","UCLA",3,4,0,0,4.5,400988329,2018-01-20
71,1,"10:27",1827,1827,"Jaylen Hands missed Three Point Jumper.",23,16,7,0.859798674570504,"Oregon","UCLA",3,4,0,0,4.5,400988329,2018-01-20
72,1,"10:27",1827,1827,"Kenny Wooten Defensive Rebound.",23,16,7,0.859798674570504,"Oregon","UCLA",3,4,0,0,4.5,400988329,2018-01-20
73,1,"10:05",1805,1805,"Payton Pritchard made Three Point Jumper. Assisted by Abu Kigab.",26,16,10,0.895382508301411,"Oregon","UCLA",3,4,0,0,4.5,400988329,2018-01-20
74,1,"9:51",1791,1791,"Foul on Paul White.",26,16,10,0.89312401746562,"Oregon","UCLA",3,4,0,0,4.5,400988329,2018-01-20
75,1,"9:51",1791,1791,"Chris Smith missed Free Throw.",26,16,10,0.89312401746562,"Oregon","UCLA",3,4,0,0,4.5,400988329,2018-01-20
76,1,"9:51",1791,1791,"UCLA Deadball Team Rebound.",26,16,10,0.89312401746562,"Oregon","UCLA",3,4,0,0,4.5,400988329,2018-01-20
77,1,"9:51",1791,1791,"Chris Smith made Free Throw.",26,17,9,0.880058979944859,"Oregon","UCLA",3,4,0,0,4.5,400988329,2018-01-20
78,1,"9:42",1782,1782,"Paul White missed Three Point Jumper.",26,17,9,0.881891812616067,"Oregon","UCLA",3,4,0,0,4.5,400988329,2018-01-20
79,1,"9:42",1782,1782,"Paul White Offensive Rebound.",26,17,9,0.881891812616067,"Oregon","UCLA",3,4,0,0,4.5,400988329,2018-01-20
80,1,"9:18",1758,1758,"Victor Bailey Jr. made Layup.",28,17,11,0.911892891381873,"Oregon","UCLA",3,4,0,0,4.5,400988329,2018-01-20
81,1,"9:03",1743,1743,"Chris Smith Turnover.",28,17,11,0.905886813155129,"Oregon","UCLA",3,4,0,0,4.5,400988329,2018-01-20
82,1,"9:03",1743,1743,"Payton Pritchard Steal.",28,17,11,0.905886813155129,"Oregon","UCLA",3,4,0,0,4.5,400988329,2018-01-20
83,1,"9:00",1740,1740,"Payton Pritchard made Layup.",30,17,13,0.925327579844401,"Oregon","UCLA",3,4,0,0,4.5,400988329,2018-01-20
84,1,"8:43",1723,1723,"Foul on Abu Kigab.",30,17,13,0.931189828368599,"Oregon","UCLA",3,4,0,0,4.5,400988329,2018-01-20
85,1,"8:43",1723,1723,"Aaron Holiday made Free Throw.",30,18,12,0.921980009916464,"Oregon","UCLA",3,4,0,0,4.5,400988329,2018-01-20
86,1,"8:43",1723,1723,"Aaron Holiday missed Free Throw.",30,18,12,0.921980009916464,"Oregon","UCLA",3,4,0,0,4.5,400988329,2018-01-20
87,1,"8:43",1723,1723,"Elijah Brown Defensive Rebound.",30,18,12,0.921980009916464,"Oregon","UCLA",3,4,0,0,4.5,400988329,2018-01-20
88,1,"8:24",1704,1704,"Foul on Aaron Holiday.",30,18,12,0.912536342631306,"Oregon","UCLA",3,4,0,0,4.5,400988329,2018-01-20
89,1,"8:14",1694,1694,"Troy Brown made Layup.",32,18,14,0.945882868995693,"Oregon","UCLA",3,4,0,0,4.5,400988329,2018-01-20
90,1,"7:53",1673,1673,"Foul on Elijah Brown.",32,18,14,0.94289156791612,"Oregon","UCLA",3,4,0,0,4.5,400988329,2018-01-20
91,1,"7:53",1673,1673,"Official TV Timeout",32,18,14,0.94289156791612,"Oregon","UCLA",3,4,0,0,4.5,400988329,2018-01-20
92,1,"7:53",1673,1673,"Gyorgy Goloman made Free Throw.",32,19,13,0.934955909761713,"Oregon","UCLA",3,4,0,0,4.5,400988329,2018-01-20
93,1,"7:53",1673,1673,"Gyorgy Goloman made Free Throw.",32,20,12,0.926004069530189,"Oregon","UCLA",3,4,0,0,4.5,400988329,2018-01-20
94,1,"7:42",1662,1662,"Foul on Gyorgy Goloman.",32,20,12,0.91671179416058,"Oregon","UCLA",3,4,0,0,4.5,400988329,2018-01-20
95,1,"7:42",1662,1662,"Victor Bailey Jr. made Free Throw.",33,20,13,0.926076520185744,"Oregon","UCLA",3,4,0,0,4.5,400988329,2018-01-20
96,1,"7:42",1662,1662,"Victor Bailey Jr. made Free Throw.",34,20,14,0.934463574893168,"Oregon","UCLA",3,4,0,0,4.5,400988329,2018-01-20
97,1,"7:42",1662,1662,"Victor Bailey Jr. made Free Throw.",35,20,15,0.941958707291691,"Oregon","UCLA",3,4,0,0,4.5,400988329,2018-01-20
98,1,"7:26",1646,1646,"Thomas Welsh missed Layup.",35,20,15,0.95070938161582,"Oregon","UCLA",3,4,0,0,4.5,400988329,2018-01-20
99,1,"7:26",1646,1646,"Thomas Welsh Offensive Rebound.",35,20,15,0.95070938161582,"Oregon","UCLA",3,4,0,0,4.5,400988329,2018-01-20
100,1,"7:24",1644,1644,"Foul on MiKyle McIntosh.",35,20,15,0.95070938161582,"Oregon","UCLA",3,4,0,0,4.5,400988329,2018-01-20
101,1,"7:24",1644,1644,"Thomas Welsh missed Free Throw.",35,20,15,0.95070938161582,"Oregon","UCLA",3,4,0,0,4.5,400988329,2018-01-20
102,1,"7:24",1644,1644,"UCLA Deadball Team Rebound.",35,20,15,0.95070938161582,"Oregon","UCLA",3,4,0,0,4.5,400988329,2018-01-20
103,1,"7:24",1644,1644,"Thomas Welsh made Free Throw.",35,21,14,0.943758550999137,"Oregon","UCLA",3,4,0,0,4.5,400988329,2018-01-20
104,1,"7:10",1630,1630,"MiKyle McIntosh made Jumper. Assisted by Elijah Brown.",37,21,16,0.951521763169834,"Oregon","UCLA",3,4,0,0,4.5,400988329,2018-01-20
105,1,"6:50",1610,1610,"Thomas Welsh made Layup. Assisted by Gyorgy Goloman.",37,23,14,0.93838413922918,"Oregon","UCLA",3,4,0,0,4.5,400988329,2018-01-20
106,1,"6:31",1591,1591,"Troy Brown made Three Point Jumper. Assisted by Victor Bailey Jr..",40,23,17,0.95909442257408,"Oregon","UCLA",3,4,0,0,4.5,400988329,2018-01-20
107,1,"6:15",1575,1575,"Gyorgy Goloman missed Layup.",40,23,17,0.970273603727406,"Oregon","UCLA",3,4,0,0,4.5,400988329,2018-01-20
108,1,"6:15",1575,1575,"Gyorgy Goloman Offensive Rebound.",40,23,17,0.970273603727406,"Oregon","UCLA",3,4,0,0,4.5,400988329,2018-01-20
109,1,"6:14",1574,1574,"Foul on Kenny Wooten.",40,23,17,0.970273603727406,"Oregon","UCLA",3,4,0,0,4.5,400988329,2018-01-20
110,1,"6:14",1574,1574,"Gyorgy Goloman made Free Throw.",40,24,16,0.965457320066373,"Oregon","UCLA",3,4,0,0,4.5,400988329,2018-01-20
111,1,"6:14",1574,1574,"Gyorgy Goloman made Free Throw.",40,25,15,0.959892955865691,"Oregon","UCLA",3,4,0,0,4.5,400988329,2018-01-20
112,1,"5:56",1556,1556,"MiKyle McIntosh missed Three Point Jumper.",40,25,15,0.949091655217509,"Oregon","UCLA",3,4,0,0,4.5,400988329,2018-01-20
113,1,"5:56",1556,1556,"Kris Wilkes Defensive Rebound.",40,25,15,0.949091655217509,"Oregon","UCLA",3,4,0,0,4.5,400988329,2018-01-20
114,1,"5:48",1548,1548,"Kris Wilkes missed Three Point Jumper.",40,25,15,0.949396060051402,"Oregon","UCLA",3,4,0,0,4.5,400988329,2018-01-20
115,1,"5:26",1526,1526,"Thomas Welsh Offensive Rebound.",40,25,15,0.949903101096437,"Oregon","UCLA",3,4,0,0,4.5,400988329,2018-01-20
116,1,"5:23",1523,1523,"Chris Smith made Layup. Assisted by Jaylen Hands.",40,27,13,0.934494323774122,"Oregon","UCLA",3,4,0,0,4.5,400988329,2018-01-20
117,1,"5:16",1516,1516,"Victor Bailey Jr. made Three Point Jumper. Assisted by Troy Brown.",43,27,16,0.964549812350623,"Oregon","UCLA",3,4,0,0,4.5,400988329,2018-01-20
118,1,"5:09",1509,1509,"Foul on Paul White.",43,27,16,0.956506816868734,"Oregon","UCLA",3,4,0,0,4.5,400988329,2018-01-20
119,1,"5:09",1509,1509,"Thomas Welsh made Free Throw.",43,28,15,0.950178638410105,"Oregon","UCLA",3,4,0,0,4.5,400988329,2018-01-20
120,1,"5:09",1509,1509,"Thomas Welsh made Free Throw.",43,29,14,0.942984604892031,"Oregon","UCLA",3,4,0,0,4.5,400988329,2018-01-20
121,1,"4:55",1495,1495,"Troy Brown missed Jumper.",43,29,14,0.944507694092318,"Oregon","UCLA",3,4,0,0,4.5,400988329,2018-01-20
122,1,"4:55",1495,1495,"Jaylen Hands Defensive Rebound.",43,29,14,0.944507694092318,"Oregon","UCLA",3,4,0,0,4.5,400988329,2018-01-20
123,1,"4:48",1488,1488,"Jaylen Hands Turnover.",43,29,14,0.946771195850178,"Oregon","UCLA",3,4,0,0,4.5,400988329,2018-01-20
124,1,"4:48",1488,1488,"Payton Pritchard Steal.",43,29,14,0.946771195850178,"Oregon","UCLA",3,4,0,0,4.5,400988329,2018-01-20
125,1,"4:42",1482,1482,"Foul on Jaylen Hands.",43,29,14,0.946771195850178,"Oregon","UCLA",3,4,0,0,4.5,400988329,2018-01-20
126,1,"4:42",1482,1482,"Troy Brown made Free Throw.",44,29,15,0.953849403486083,"Oregon","UCLA",3,4,0,0,4.5,400988329,2018-01-20
127,1,"4:42",1482,1482,"Troy Brown missed Free Throw.",44,29,15,0.953849403486083,"Oregon","UCLA",3,4,0,0,4.5,400988329,2018-01-20
128,1,"4:42",1482,1482,"Jaylen Hands Turnover.",44,29,15,0.953849403486083,"Oregon","UCLA",3,4,0,0,4.5,400988329,2018-01-20
129,1,"4:42",1482,1482,"Oregon Deadball Team Rebound.",44,29,15,0.953849403486083,"Oregon","UCLA",3,4,0,0,4.5,400988329,2018-01-20
130,1,"4:28",1468,1468,"Payton Pritchard missed Three Point Jumper.",44,29,15,0.946922520022548,"Oregon","UCLA",3,4,0,0,4.5,400988329,2018-01-20
131,1,"4:28",1468,1468,"Thomas Welsh Defensive Rebound.",44,29,15,0.946922520022548,"Oregon","UCLA",3,4,0,0,4.5,400988329,2018-01-20
132,1,"4:12",1452,1452,"Foul on Jaylen Hands.",44,29,15,0.951576757421213,"Oregon","UCLA",3,4,0,0,4.5,400988329,2018-01-20
133,1,"4:12",1452,1452,"Jaylen Hands Turnover.",44,29,15,0.951576757421213,"Oregon","UCLA",3,4,0,0,4.5,400988329,2018-01-20
134,1,"4:07",1447,1447,"MiKyle McIntosh made Jumper.",46,29,17,0.969971845213598,"Oregon","UCLA",3,4,0,0,4.5,400988329,2018-01-20
135,1,"3:55",1435,1435,"Kris Wilkes missed Jumper.",46,29,17,0.965990232407143,"Oregon","UCLA",3,4,0,0,4.5,400988329,2018-01-20
136,1,"3:55",1435,1435,"Troy Brown Defensive Rebound.",46,29,17,0.965990232407143,"Oregon","UCLA",3,4,0,0,4.5,400988329,2018-01-20
137,1,"3:46",1426,1426,"Troy Brown missed Three Point Jumper.",46,29,17,0.960826467349013,"Oregon","UCLA",3,4,0,0,4.5,400988329,2018-01-20
138,1,"3:46",1426,1426,"UCLA Deadball Team Rebound.",46,29,17,0.960826467349013,"Oregon","UCLA",3,4,0,0,4.5,400988329,2018-01-20
139,1,"3:37",1417,1417,"Foul on Roman Sorkin.",46,29,17,0.967091850808096,"Oregon","UCLA",3,4,0,0,4.5,400988329,2018-01-20
140,1,"3:37",1417,1417,"Official TV Timeout",46,29,17,0.967091850808096,"Oregon","UCLA",3,4,0,0,4.5,400988329,2018-01-20
141,1,"3:37",1417,1417,"Thomas Welsh made Free Throw.",46,30,16,0.961782566245477,"Oregon","UCLA",3,4,0,0,4.5,400988329,2018-01-20
142,1,"3:37",1417,1417,"Thomas Welsh made Free Throw.",46,31,15,0.955655977246674,"Oregon","UCLA",3,4,0,0,4.5,400988329,2018-01-20
143,1,"3:17",1397,1397,"Troy Brown missed Jumper.",46,31,15,0.957556567506475,"Oregon","UCLA",3,4,0,0,4.5,400988329,2018-01-20
144,1,"3:17",1397,1397,"Jaylen Hands Defensive Rebound.",46,31,15,0.957556567506475,"Oregon","UCLA",3,4,0,0,4.5,400988329,2018-01-20
145,1,"3:05",1385,1385,"Jaylen Hands Turnover.",46,31,15,0.955849837974207,"Oregon","UCLA",3,4,0,0,4.5,400988329,2018-01-20
146,1,"2:58",1378,1378,"Foul on Kris Wilkes.",46,31,15,0.948225579396253,"Oregon","UCLA",3,4,0,0,4.5,400988329,2018-01-20
147,1,"2:58",1378,1378,"Roman Sorkin made Free Throw.",47,31,16,0.954871012006801,"Oregon","UCLA",3,4,0,0,4.5,400988329,2018-01-20
148,1,"2:58",1378,1378,"Roman Sorkin missed Free Throw.",47,31,16,0.954871012006801,"Oregon","UCLA",3,4,0,0,4.5,400988329,2018-01-20
149,1,"2:58",1378,1378,"Jaylen Hands Defensive Rebound.",47,31,16,0.954871012006801,"Oregon","UCLA",3,4,0,0,4.5,400988329,2018-01-20
150,1,"2:47",1367,1367,"Prince Ali made Jumper. Assisted by Kris Wilkes.",47,33,14,0.94950727035498,"Oregon","UCLA",3,4,0,0,4.5,400988329,2018-01-20
151,1,"2:15",1335,1335,"Payton Pritchard missed Layup.",47,33,14,0.9473701272666,"Oregon","UCLA",3,4,0,0,4.5,400988329,2018-01-20
152,1,"2:10",1330,1330,"UCLA Deadball Team Rebound.",47,33,14,0.9473701272666,"Oregon","UCLA",3,4,0,0,4.5,400988329,2018-01-20
153,1,"1:59",1319,1319,"Foul on Troy Brown.",47,33,14,0.954117105194316,"Oregon","UCLA",3,4,0,0,4.5,400988329,2018-01-20
154,1,"1:59",1319,1319,"Kris Wilkes made Free Throw.",47,34,13,0.946699688127327,"Oregon","UCLA",3,4,0,0,4.5,400988329,2018-01-20
155,1,"1:59",1319,1319,"Kris Wilkes missed Free Throw.",47,34,13,0.946699688127327,"Oregon","UCLA",3,4,0,0,4.5,400988329,2018-01-20
156,1,"1:59",1319,1319,"MiKyle McIntosh Defensive Rebound.",47,34,13,0.946699688127327,"Oregon","UCLA",3,4,0,0,4.5,400988329,2018-01-20
157,1,"1:39",1299,1299,"Victor Bailey Jr. made Jumper.",49,34,15,0.965144193802171,"Oregon","UCLA",3,4,0,0,4.5,400988329,2018-01-20
158,1,"1:20",1280,1280,"Prince Ali Turnover.",49,34,15,0.954348095763629,"Oregon","UCLA",3,4,0,0,4.5,400988329,2018-01-20
159,1,"1:20",1280,1280,"MiKyle McIntosh Steal.",49,34,15,0.954348095763629,"Oregon","UCLA",3,4,0,0,4.5,400988329,2018-01-20
160,1,"1:10",1270,1270,"Victor Bailey Jr. made Dunk. Assisted by Payton Pritchard.",51,34,17,0.962822444254688,"Oregon","UCLA",3,4,0,0,4.5,400988329,2018-01-20
161,1,"0:50",1250,1250,"Jaylen Hands made Three Point Jumper.",51,37,14,0.944815183634158,"Oregon","UCLA",3,4,0,0,4.5,400988329,2018-01-20
162,1,"0:39",1239,1239,"Payton Pritchard missed Three Point Jumper.",51,37,14,0.950824685580967,"Oregon","UCLA",3,4,0,0,4.5,400988329,2018-01-20
163,1,"0:39",1239,1239,"Chris Smith Defensive Rebound.",51,37,14,0.950824685580967,"Oregon","UCLA",3,4,0,0,4.5,400988329,2018-01-20
164,1,"0:13",1213,1213,"Foul on MiKyle McIntosh.",51,37,14,0.953501395757136,"Oregon","UCLA",3,4,0,0,4.5,400988329,2018-01-20
165,1,"0:13",1213,1213,"Jaylen Hands made Free Throw.",51,38,13,0.945618695538427,"Oregon","UCLA",3,4,0,0,4.5,400988329,2018-01-20
166,1,"0:13",1213,1213,"Jaylen Hands missed Free Throw.",51,38,13,0.945618695538427,"Oregon","UCLA",3,4,0,0,4.5,400988329,2018-01-20
167,1,"0:13",1213,1213,"Payton Pritchard Defensive Rebound.",51,38,13,0.945618695538427,"Oregon","UCLA",3,4,0,0,4.5,400988329,2018-01-20
168,1,"0:04",1204,1204,"Foul on Kris Wilkes.",51,38,13,0.943768151387812,"Oregon","UCLA",3,4,0,0,4.5,400988329,2018-01-20
169,1,"0:04",1204,1204,"MiKyle McIntosh missed Free Throw.",51,38,13,0.943768151387812,"Oregon","UCLA",3,4,0,0,4.5,400988329,2018-01-20
170,1,"0:04",1204,1204,"Oregon Deadball Team Rebound.",51,38,13,0.943768151387812,"Oregon","UCLA",3,4,0,0,4.5,400988329,2018-01-20
171,1,"0:04",1204,1204,"MiKyle McIntosh made Free Throw.",52,38,14,0.951646167359123,"Oregon","UCLA",3,4,0,0,4.5,400988329,2018-01-20
172,1,"0:00",1200,1200,"End of 1st half",52,38,14,0.951646167359123,"Oregon","UCLA",3,4,0,0,4.5,400988329,2018-01-20
173,2,"20:00",1200,1200,"PLAY",52,38,14,0.951646167359123,"Oregon","UCLA",4,4,0,0,4.5,400988329,2018-01-20
174,2,"20:00",1200,1200,"Jump Ball won by Oregon",52,38,14,0.951646167359123,"Oregon","UCLA",4,4,0,0,4.5,400988329,2018-01-20
175,2,"19:46",1186,1186,"Kenny Wooten made Jumper. Assisted by MiKyle McIntosh.",54,38,16,0.967724564760528,"Oregon","UCLA",4,4,0,0,4.5,400988329,2018-01-20
176,2,"19:27",1167,1167,"Prince Ali missed Three Point Jumper.",54,38,16,0.965529245822552,"Oregon","UCLA",4,4,0,0,4.5,400988329,2018-01-20
177,2,"19:27",1167,1167,"Elijah Brown Defensive Rebound.",54,38,16,0.965529245822552,"Oregon","UCLA",4,4,0,0,4.5,400988329,2018-01-20
178,2,"19:19",1159,1159,"Elijah Brown Turnover.",54,38,16,0.965034916964699,"Oregon","UCLA",4,4,0,0,4.5,400988329,2018-01-20
179,2,"19:19",1159,1159,"Gyorgy Goloman Steal.",54,38,16,0.965034916964699,"Oregon","UCLA",4,4,0,0,4.5,400988329,2018-01-20
180,2,"19:17",1157,1157,"Kris Wilkes made Layup. Assisted by Jaylen Hands.",54,40,14,0.952316152224776,"Oregon","UCLA",4,4,0,0,4.5,400988329,2018-01-20
181,2,"19:07",1147,1147,"MiKyle McIntosh Turnover.",54,40,14,0.957561169021727,"Oregon","UCLA",4,4,0,0,4.5,400988329,2018-01-20
182,2,"19:07",1147,1147,"Aaron Holiday Steal.",54,40,14,0.957561169021727,"Oregon","UCLA",4,4,0,0,4.5,400988329,2018-01-20
183,2,"18:59",1139,1139,"Foul on Payton Pritchard.",54,40,14,0.954834693793339,"Oregon","UCLA",4,4,0,0,4.5,400988329,2018-01-20
184,2,"18:53",1133,1133,"Kris Wilkes made Three Point Jumper. Assisted by Prince Ali.",54,43,11,0.928431601042344,"Oregon","UCLA",4,4,0,0,4.5,400988329,2018-01-20
185,2,"18:23",1103,1103,"Elijah Brown missed Three Point Jumper.",54,43,11,0.927551858224458,"Oregon","UCLA",4,4,0,0,4.5,400988329,2018-01-20
186,2,"18:23",1103,1103,"Troy Brown Offensive Rebound.",54,43,11,0.927551858224458,"Oregon","UCLA",4,4,0,0,4.5,400988329,2018-01-20
187,2,"18:19",1099,1099,"Troy Brown made Layup.",56,43,13,0.952682454413954,"Oregon","UCLA",4,4,0,0,4.5,400988329,2018-01-20
188,2,"18:19",1099,1099,"Foul on Prince Ali.",56,43,13,0.952682454413954,"Oregon","UCLA",4,4,0,0,4.5,400988329,2018-01-20
189,2,"18:19",1099,1099,"Troy Brown made Free Throw.",57,43,14,0.959838601793736,"Oregon","UCLA",4,4,0,0,4.5,400988329,2018-01-20
190,2,"18:04",1084,1084,"Aaron Holiday Turnover.",57,43,14,0.961593964451983,"Oregon","UCLA",4,4,0,0,4.5,400988329,2018-01-20
191,2,"18:04",1084,1084,"Troy Brown Steal.",57,43,14,0.961593964451983,"Oregon","UCLA",4,4,0,0,4.5,400988329,2018-01-20
192,2,"17:56",1076,1076,"Elijah Brown Turnover.",57,43,14,0.956589154192655,"Oregon","UCLA",4,4,0,0,4.5,400988329,2018-01-20
193,2,"17:56",1076,1076,"Gyorgy Goloman Steal.",57,43,14,0.956589154192655,"Oregon","UCLA",4,4,0,0,4.5,400988329,2018-01-20
194,2,"17:51",1071,1071,"Prince Ali made Dunk. Assisted by Gyorgy Goloman.",57,45,12,0.940241929683358,"Oregon","UCLA",4,4,0,0,4.5,400988329,2018-01-20
