"play_id","half","time_remaining_half","secs_remaining","secs_remaining_absolute","description","home_score","away_score","score_diff","win_prob","home","away","home_time_out_remaining","away_time_out_remaining","home_timeout_ind","away_timeout_ind","home_favored_by","game_id","date"
204,2,"17:54",1074,1074,"Utah  Timeout",49,33,16,0.962081816268154,"UNLV","Utah",4,3,0,1,3,401001884,2017-11-23
205,2,"17:45",1065,1065,"Donnie Tillman made Layup.",49,35,14,0.951315648394888,"UNLV","Utah",4,3,0,1,3,401001884,2017-11-23
206,2,"17:27",1047,1047,"Brandon McCoy made Layup. Assisted by Kris Clyburn.",51,35,16,0.967085757115966,"UNLV","Utah",4,3,0,1,3,401001884,2017-11-23
207,2,"16:59",1019,1019,"Sedrick Barefield missed Three Point Jumper.",51,35,16,0.964884302336964,"UNLV","Utah",4,3,0,1,3,401001884,2017-11-23
208,2,"16:59",1019,1019,"Brandon McCoy Defensive Rebound.",51,35,16,0.964884302336964,"UNLV","Utah",4,3,0,1,3,401001884,2017-11-23
209,2,"16:41",1001,1001,"Brandon McCoy Turnover.",51,35,16,0.967951205587397,"UNLV","Utah",4,3,0,0,3,401001884,2017-11-23
210,2,"16:13",973,973,"Utah  Turnover.",51,35,16,0.968215287504672,"UNLV","Utah",4,3,0,0,3,401001884,2017-11-23
211,2,"15:53",953,953,"Foul on Justin Bibbins.",51,35,16,0.971388405157321,"UNLV","Utah",4,3,0,0,3,401001884,2017-11-23
212,2,"15:53",953,953,"Official TV Timeout",51,35,16,0.971388405157321,"UNLV","Utah",4,3,0,0,3,401001884,2017-11-23
213,2,"15:36",936,936,"Jordan Johnson Turnover.",51,35,16,0.971733036081561,"UNLV","Utah",4,3,0,0,3,401001884,2017-11-23
214,2,"15:26",926,926,"Donnie Tillman missed Jumper.",51,35,16,0.970009851435756,"UNLV","Utah",4,3,0,0,3,401001884,2017-11-23
215,2,"15:26",926,926,"Donnie Tillman Offensive Rebound.",51,35,16,0.970009851435756,"UNLV","Utah",4,3,0,0,3,401001884,2017-11-23
216,2,"15:21",921,921,"Donnie Tillman missed Jumper.",51,35,16,0.970009851435756,"UNLV","Utah",4,3,0,0,3,401001884,2017-11-23
217,2,"15:21",921,921,"Kris Clyburn Defensive Rebound.",51,35,16,0.970009851435756,"UNLV","Utah",4,3,0,0,3,401001884,2017-11-23
218,2,"15:12",912,912,"Kris Clyburn made Three Point Jumper. Assisted by Jordan Johnson.",54,35,19,0.985494069807468,"UNLV","Utah",4,3,0,0,3,401001884,2017-11-23
219,2,"15:00",900,900,"Foul on Sedrick Barefield.",54,35,19,0.983719105130424,"UNLV","Utah",4,3,0,0,3,401001884,2017-11-23
220,2,"15:00",900,900,"Sedrick Barefield Turnover.",54,35,19,0.983719105130424,"UNLV","Utah",4,3,0,0,3,401001884,2017-11-23
221,2,"14:54",894,894,"Jovan Mooring made Jumper.",56,35,21,0.989978741811427,"UNLV","Utah",4,3,0,0,3,401001884,2017-11-23
222,2,"14:33",873,873,"Christian Popoola missed Layup.",56,35,21,0.989432024857145,"UNLV","Utah",4,3,0,0,3,401001884,2017-11-23
223,2,"14:33",873,873,"David Collette Offensive Rebound.",56,35,21,0.989432024857145,"UNLV","Utah",4,3,0,0,3,401001884,2017-11-23
224,2,"14:33",873,873,"David Collette made Two Point Tip Shot.",56,37,19,0.984542115224068,"UNLV","Utah",4,3,0,0,3,401001884,2017-11-23
225,2,"14:06",846,846,"Jovan Mooring made Three Point Jumper. Assisted by Shakur Juiston.",59,37,22,0.994067900062473,"UNLV","Utah",4,3,0,0,3,401001884,2017-11-23
226,2,"13:57",837,837,"Sedrick Barefield missed Three Point Jumper.",59,37,22,0.993558435389228,"UNLV","Utah",4,3,0,0,3,401001884,2017-11-23
227,2,"13:57",837,837,"Kris Clyburn Defensive Rebound.",59,37,22,0.993558435389228,"UNLV","Utah",4,3,0,0,3,401001884,2017-11-23
228,2,"13:52",832,832,"Jovan Mooring made Jumper. Assisted by Jordan Johnson.",61,37,24,0.995726436625767,"UNLV","Utah",4,3,0,0,3,401001884,2017-11-23
229,2,"13:52",832,832,"Foul on Christian Popoola.",61,37,24,0.995726436625767,"UNLV","Utah",4,3,0,0,3,401001884,2017-11-23
230,2,"13:52",832,832,"Jovan Mooring missed Free Throw.",61,37,24,0.995726436625767,"UNLV","Utah",4,3,0,0,3,401001884,2017-11-23
231,2,"13:52",832,832,"Donnie Tillman Defensive Rebound.",61,37,24,0.995726436625767,"UNLV","Utah",4,3,0,0,3,401001884,2017-11-23
232,2,"13:28",808,808,"Christian Popoola missed Jumper.",61,37,24,0.99557877216035,"UNLV","Utah",4,3,0,0,3,401001884,2017-11-23
233,2,"13:28",808,808,"Brandon McCoy Block.",61,37,24,0.99557877216035,"UNLV","Utah",4,3,0,0,3,401001884,2017-11-23
234,2,"13:28",808,808,"Shakur Juiston Defensive Rebound.",61,37,24,0.99557877216035,"UNLV","Utah",4,3,0,0,3,401001884,2017-11-23
235,2,"13:22",802,802,"Jordan Johnson Turnover.",61,37,24,0.99557877216035,"UNLV","Utah",4,3,0,0,3,401001884,2017-11-23
236,2,"13:11",791,791,"Donnie Tillman made Layup.",61,39,22,0.994899632210687,"UNLV","Utah",4,3,0,0,3,401001884,2017-11-23
237,2,"12:50",770,770,"Jovan Mooring made Jumper.",63,39,24,0.995965432790754,"UNLV","Utah",4,3,0,0,3,401001884,2017-11-23
238,2,"12:37",757,757,"Foul on Jovan Mooring.",63,39,24,0.996574746793593,"UNLV","Utah",4,3,0,0,3,401001884,2017-11-23
239,2,"12:28",748,748,"Donnie Tillman missed Jumper.",63,39,24,0.99688261598292,"UNLV","Utah",4,3,0,0,3,401001884,2017-11-23
240,2,"12:28",748,748,"Justin Bibbins Offensive Rebound.",63,39,24,0.99688261598292,"UNLV","Utah",4,3,0,0,3,401001884,2017-11-23
241,2,"12:21",741,741,"Christian Popoola missed Three Point Jumper.",63,39,24,0.99688261598292,"UNLV","Utah",4,3,0,0,3,401001884,2017-11-23
242,2,"12:21",741,741,"Jordan Johnson Defensive Rebound.",63,39,24,0.99688261598292,"UNLV","Utah",4,3,0,0,3,401001884,2017-11-23
243,2,"12:09",729,729,"Foul on Christian Popoola.",63,39,24,0.996988860301581,"UNLV","Utah",4,3,0,0,3,401001884,2017-11-23
244,2,"12:09",729,729,"Jordan Johnson made Free Throw.",64,39,25,0.997582261596864,"UNLV","Utah",4,3,0,0,3,401001884,2017-11-23
245,2,"12:09",729,729,"Jordan Johnson made Free Throw.",65,39,26,0.998058949761694,"UNLV","Utah",4,3,0,0,3,401001884,2017-11-23
246,2,"11:55",715,715,"Jayce Johnson made Jumper. Assisted by Justin Bibbins.",65,41,24,0.996414714842165,"UNLV","Utah",4,3,0,0,3,401001884,2017-11-23
247,2,"11:41",701,701,"Jovan Mooring missed Jumper.",65,41,24,0.996228522808984,"UNLV","Utah",4,3,0,0,3,401001884,2017-11-23
248,2,"11:41",701,701,"Jayce Johnson Defensive Rebound.",65,41,24,0.996228522808984,"UNLV","Utah",4,3,0,0,3,401001884,2017-11-23
249,2,"11:32",692,692,"Justin Bibbins missed Three Point Jumper.",65,41,24,0.997950574408192,"UNLV","Utah",4,3,0,0,3,401001884,2017-11-23
250,2,"11:32",692,692,"Jordan Johnson Defensive Rebound.",65,41,24,0.997950574408192,"UNLV","Utah",4,3,0,0,3,401001884,2017-11-23
251,2,"11:22",682,682,"Cheickna Dembele missed Jumper.",65,41,24,0.996917575424233,"UNLV","Utah",4,3,0,0,3,401001884,2017-11-23
252,2,"11:22",682,682,"Donnie Tillman Defensive Rebound.",65,41,24,0.996917575424233,"UNLV","Utah",4,3,0,0,3,401001884,2017-11-23
253,2,"11:03",663,663,"Justin Bibbins missed Jumper.",65,41,24,0.997331671544233,"UNLV","Utah",4,3,0,0,3,401001884,2017-11-23
254,2,"11:03",663,663,"Kris Clyburn Defensive Rebound.",65,41,24,0.997331671544233,"UNLV","Utah",4,3,0,0,3,401001884,2017-11-23
255,2,"10:56",656,656,"Foul on Justin Bibbins.",65,41,24,0.997953668832948,"UNLV","Utah",4,3,0,0,3,401001884,2017-11-23
256,2,"10:56",656,656,"Official TV Timeout",65,41,24,0.997953668832948,"UNLV","Utah",4,3,0,0,3,401001884,2017-11-23
257,2,"10:49",649,649,"Brandon McCoy missed Jumper.",65,41,24,0.997983400137135,"UNLV","Utah",4,3,0,0,3,401001884,2017-11-23
258,2,"10:49",649,649,"Jayce Johnson Block.",65,41,24,0.997983400137135,"UNLV","Utah",4,3,0,0,3,401001884,2017-11-23
259,2,"10:49",649,649,"Donnie Tillman Defensive Rebound.",65,41,24,0.997983400137135,"UNLV","Utah",4,3,0,0,3,401001884,2017-11-23
260,2,"10:35",635,635,"Jayce Johnson missed Jumper.",65,41,24,0.997654563053242,"UNLV","Utah",4,3,0,0,3,401001884,2017-11-23
261,2,"10:35",635,635,"Jovan Mooring Defensive Rebound.",65,41,24,0.997654563053242,"UNLV","Utah",4,3,0,0,3,401001884,2017-11-23
262,2,"10:26",626,626,"Brandon McCoy Turnover.",65,41,24,0.998485789758903,"UNLV","Utah",4,3,0,0,3,401001884,2017-11-23
263,2,"10:26",626,626,"Justin Bibbins Steal.",65,41,24,0.998485789758903,"UNLV","Utah",4,3,0,0,3,401001884,2017-11-23
264,2,"10:22",622,622,"Foul on Jovan Mooring.",65,41,24,0.998485789758903,"UNLV","Utah",4,3,0,0,3,401001884,2017-11-23
265,2,"10:12",612,612,"Kolbe Caldwell made Jumper.",65,43,22,0.997247504023218,"UNLV","Utah",4,3,0,0,3,401001884,2017-11-23
266,2,"9:48",588,588,"Jordan Johnson missed Three Point Jumper.",65,43,22,0.996698024018317,"UNLV","Utah",4,3,0,0,3,401001884,2017-11-23
267,2,"9:48",588,588,"Brandon McCoy Offensive Rebound.",65,43,22,0.996698024018317,"UNLV","Utah",4,3,0,0,3,401001884,2017-11-23
268,2,"9:43",583,583,"Brandon McCoy made Jumper.",67,43,24,0.997962493221438,"UNLV","Utah",4,3,0,0,3,401001884,2017-11-23
269,2,"9:43",583,583,"Foul on Jayce Johnson.",67,43,24,0.997962493221438,"UNLV","Utah",4,3,0,0,3,401001884,2017-11-23
270,2,"9:43",583,583,"Brandon McCoy made Free Throw.",68,43,25,0.998399791438495,"UNLV","Utah",4,3,0,0,3,401001884,2017-11-23
271,2,"9:27",567,567,"Donnie Tillman missed Layup.",68,43,25,0.999031112315756,"UNLV","Utah",4,3,0,0,3,401001884,2017-11-23
272,2,"9:27",567,567,"Brandon McCoy Defensive Rebound.",68,43,25,0.999031112315756,"UNLV","Utah",4,3,0,0,3,401001884,2017-11-23
273,2,"9:08",548,548,"Jordan Johnson missed Jumper.",68,43,25,0.9991216336852,"UNLV","Utah",4,3,0,0,3,401001884,2017-11-23
274,2,"9:08",548,548,"Jayce Johnson Block.",68,43,25,0.9991216336852,"UNLV","Utah",4,3,0,0,3,401001884,2017-11-23
275,2,"9:08",548,548,"UNLV Offensive Rebound.",68,43,25,0.9991216336852,"UNLV","Utah",4,3,0,0,3,401001884,2017-11-23
276,2,"8:55",535,535,"Amauri Hardy missed Jumper.",68,43,25,0.999474668172859,"UNLV","Utah",4,3,0,0,3,401001884,2017-11-23
277,2,"8:55",535,535,"Jayce Johnson Defensive Rebound.",68,43,25,0.999474668172859,"UNLV","Utah",4,3,0,0,3,401001884,2017-11-23
278,2,"8:44",524,524,"Jayce Johnson made Dunk. Assisted by Justin Bibbins.",68,45,23,0.998749522420737,"UNLV","Utah",4,3,0,0,3,401001884,2017-11-23
279,2,"8:13",493,493,"Brandon McCoy made Layup. Assisted by Jordan Johnson.",70,45,25,0.9993120231887,"UNLV","Utah",4,3,0,0,3,401001884,2017-11-23
280,2,"8:13",493,493,"Foul on Jayce Johnson.",70,45,25,0.9993120231887,"UNLV","Utah",4,3,0,0,3,401001884,2017-11-23
281,2,"8:13",493,493,"Brandon McCoy made Free Throw.",71,45,26,0.999475796015563,"UNLV","Utah",4,3,0,0,3,401001884,2017-11-23
282,2,"7:58",478,478,"Sedrick Barefield missed Three Point Jumper.",71,45,26,0.99965215003641,"UNLV","Utah",4,3,0,0,3,401001884,2017-11-23
283,2,"7:58",478,478,"Brandon McCoy Defensive Rebound.",71,45,26,0.99965215003641,"UNLV","Utah",4,3,0,0,3,401001884,2017-11-23
284,2,"7:50",470,470,"Tervell Beck missed Three Point Jumper.",71,45,26,0.99965215003641,"UNLV","Utah",4,3,0,0,3,401001884,2017-11-23
285,2,"7:50",470,470,"Justin Bibbins Defensive Rebound.",71,45,26,0.99965215003641,"UNLV","Utah",4,3,0,0,3,401001884,2017-11-23
286,2,"7:38",458,458,"Justin Bibbins missed Layup.",71,45,26,0.999812536547668,"UNLV","Utah",4,3,0,0,3,401001884,2017-11-23
287,2,"7:38",458,458,"Shakur Juiston Block.",71,45,26,0.999812536547668,"UNLV","Utah",4,3,0,0,3,401001884,2017-11-23
288,2,"7:38",458,458,"Utah Offensive Rebound.",71,45,26,0.999812536547668,"UNLV","Utah",4,3,0,0,3,401001884,2017-11-23
289,2,"7:38",458,458,"Official TV Timeout",71,45,26,0.999812536547668,"UNLV","Utah",4,3,0,0,3,401001884,2017-11-23
290,2,"7:33",453,453,"Kolbe Caldwell missed Three Point Jumper.",71,45,26,0.999812536547668,"UNLV","Utah",4,3,0,0,3,401001884,2017-11-23
291,2,"7:33",453,453,"Brandon McCoy Defensive Rebound.",71,45,26,0.999812536547668,"UNLV","Utah",4,3,0,0,3,401001884,2017-11-23
292,2,"7:10",430,430,"Jovan Mooring Turnover.",71,45,26,0.999783598970566,"UNLV","Utah",4,3,0,0,3,401001884,2017-11-23
293,2,"7:00",420,420,"David Collette made Dunk.",71,47,24,0.999419481795618,"UNLV","Utah",4,3,0,0,3,401001884,2017-11-23
294,2,"6:42",402,402,"Foul on Shakur Juiston.",71,47,24,0.999736010067968,"UNLV","Utah",4,3,0,0,3,401001884,2017-11-23
295,2,"6:42",402,402,"Shakur Juiston Turnover.",71,47,24,0.999736010067968,"UNLV","Utah",4,3,0,0,3,401001884,2017-11-23
296,2,"6:24",384,384,"Sedrick Barefield made Jumper.",71,49,22,0.999036226818763,"UNLV","Utah",4,3,0,0,3,401001884,2017-11-23
297,2,"6:00",360,360,"Brandon McCoy missed Layup.",71,49,22,0.999420651129224,"UNLV","Utah",4,3,0,0,3,401001884,2017-11-23
298,2,"6:00",360,360,"Brandon McCoy Offensive Rebound.",71,49,22,0.999420651129224,"UNLV","Utah",4,3,0,0,3,401001884,2017-11-23
299,2,"6:00",360,360,"Brandon McCoy made Two Point Tip Shot.",73,49,24,0.999696156675399,"UNLV","Utah",4,3,0,0,3,401001884,2017-11-23
300,2,"5:41",341,341,"Justin Bibbins Turnover.",73,49,24,0.999740448370136,"UNLV","Utah",4,3,0,0,3,401001884,2017-11-23
301,2,"5:41",341,341,"Kris Clyburn Steal.",73,49,24,0.999740448370136,"UNLV","Utah",4,3,0,0,3,401001884,2017-11-23
302,2,"5:35",335,335,"Foul on Jake Connor.",73,49,24,0.999864782365537,"UNLV","Utah",4,3,0,0,3,401001884,2017-11-23
303,2,"5:35",335,335,"Shakur Juiston missed Free Throw.",73,49,24,0.999864782365537,"UNLV","Utah",4,3,0,0,3,401001884,2017-11-23
304,2,"5:35",335,335,"UNLV Deadball Team Rebound.",73,49,24,0.999864782365537,"UNLV","Utah",4,3,0,0,3,401001884,2017-11-23
305,2,"5:35",335,335,"Shakur Juiston missed Free Throw.",73,49,24,0.999864782365537,"UNLV","Utah",4,3,0,0,3,401001884,2017-11-23
306,2,"5:35",335,335,"David Collette Defensive Rebound.",73,49,24,0.999864782365537,"UNLV","Utah",4,3,0,0,3,401001884,2017-11-23
307,2,"5:16",316,316,"David Collette made Dunk.",73,51,22,0.999778519376377,"UNLV","Utah",4,3,0,0,3,401001884,2017-11-23
308,2,"5:16",316,316,"Foul on Shakur Juiston.",73,51,22,0.999778519376377,"UNLV","Utah",4,3,0,0,3,401001884,2017-11-23
309,2,"5:16",316,316,"David Collette made Free Throw.",73,52,21,0.999680468614922,"UNLV","Utah",4,3,0,0,3,401001884,2017-11-23
310,2,"5:06",306,306,"Foul on David Collette.",73,52,21,0.999416758158876,"UNLV","Utah",4,3,1,0,3,401001884,2017-11-23
311,2,"5:06",306,306,"Brandon McCoy made Free Throw.",74,52,22,0.999584232571589,"UNLV","Utah",4,3,1,0,3,401001884,2017-11-23
312,2,"5:06",306,306,"Brandon McCoy made Free Throw.",75,52,23,0.999703631966959,"UNLV","Utah",4,3,1,0,3,401001884,2017-11-23
313,2,"5:06",306,306,"UNLV  Timeout",75,52,23,0.999703631966959,"UNLV","Utah",3,3,1,0,3,401001884,2017-11-23
314,2,"4:53",293,293,"Foul on Tervell Beck.",75,52,23,0.999735513190128,"UNLV","Utah",3,3,1,0,3,401001884,2017-11-23
315,2,"4:50",290,290,"Donnie Tillman made Layup. Assisted by Sedrick Barefield.",75,54,21,0.99947498349268,"UNLV","Utah",3,3,1,0,3,401001884,2017-11-23
316,2,"4:25",265,265,"Tervell Beck missed Jumper.",75,54,21,0.99972103407359,"UNLV","Utah",3,3,1,0,3,401001884,2017-11-23
317,2,"4:25",265,265,"Donnie Tillman Defensive Rebound.",75,54,21,0.99972103407359,"UNLV","Utah",3,3,1,0,3,401001884,2017-11-23
318,2,"4:16",256,256,"Jake Connor missed Three Point Jumper.",75,54,21,0.999899102904537,"UNLV","Utah",3,3,1,0,3,401001884,2017-11-23
319,2,"4:16",256,256,"UNLV Defensive Rebound.",75,54,21,0.999899102904537,"UNLV","Utah",3,3,1,0,3,401001884,2017-11-23
320,2,"3:53",233,233,"Amauri Hardy missed Three Point Jumper.",75,54,21,0.999857650785986,"UNLV","Utah",3,3,0,0,3,401001884,2017-11-23
321,2,"3:53",233,233,"Jayce Johnson Defensive Rebound.",75,54,21,0.999857650785986,"UNLV","Utah",3,3,0,0,3,401001884,2017-11-23
322,2,"3:42",222,222,"Sedrick Barefield missed Three Point Jumper.",75,54,21,0.999907780495982,"UNLV","Utah",3,3,0,0,3,401001884,2017-11-23
323,2,"3:42",222,222,"Shakur Juiston Defensive Rebound.",75,54,21,0.999907780495982,"UNLV","Utah",3,3,0,0,3,401001884,2017-11-23
324,2,"3:35",215,215,"Official TV Timeout",75,54,21,0.999924880631245,"UNLV","Utah",3,3,0,0,3,401001884,2017-11-23
325,2,"3:16",196,196,"Jordan Johnson made Jumper.",77,54,23,0.999983133582321,"UNLV","Utah",3,3,0,0,3,401001884,2017-11-23
326,2,"2:52",172,172,"Jake Connor missed Jumper.",77,54,23,0.999991591945903,"UNLV","Utah",3,3,0,0,3,401001884,2017-11-23
327,2,"2:52",172,172,"Jovan Mooring Defensive Rebound.",77,54,23,0.999991591945903,"UNLV","Utah",3,3,0,0,3,401001884,2017-11-23
328,2,"2:30",150,150,"Foul on Christian Popoola.",77,54,23,0.999997057175933,"UNLV","Utah",3,3,0,0,3,401001884,2017-11-23
329,2,"2:30",150,150,"Amauri Hardy made Free Throw.",78,54,24,0.9999982859142,"UNLV","Utah",3,3,0,0,3,401001884,2017-11-23
330,2,"2:30",150,150,"Amauri Hardy made Free Throw.",79,54,25,0.999999001609149,"UNLV","Utah",3,3,0,0,3,401001884,2017-11-23
331,2,"2:16",136,136,"Jayce Johnson missed Jumper.",79,54,25,0.999999250156969,"UNLV","Utah",3,3,0,0,3,401001884,2017-11-23
332,2,"2:16",136,136,"Brandon McCoy Defensive Rebound.",79,54,25,0.999999250156969,"UNLV","Utah",3,3,0,0,3,401001884,2017-11-23
333,2,"2:01",121,121,"Brandon McCoy made Layup. Assisted by Amauri Hardy.",81,54,27,0.999999809609147,"UNLV","Utah",3,3,0,0,3,401001884,2017-11-23
334,2,"1:46",106,106,"Sedrick Barefield Turnover.",81,54,27,0.999999951300829,"UNLV","Utah",3,3,0,0,3,401001884,2017-11-23
335,2,"1:31",91,91,"Shakur Juiston missed Layup.",81,54,27,0.999999965495855,"UNLV","Utah",3,3,0,0,3,401001884,2017-11-23
336,2,"1:31",91,91,"Tervell Beck Offensive Rebound.",81,54,27,0.999999965495855,"UNLV","Utah",3,3,0,0,3,401001884,2017-11-23
337,2,"1:25",85,85,"Tervell Beck made Jumper.",83,54,29,0.999999999349767,"UNLV","Utah",3,3,0,0,3,401001884,2017-11-23
338,2,"1:09",69,69,"Foul on Jay Green.",83,54,29,0.999999999562354,"UNLV","Utah",3,3,0,0,3,401001884,2017-11-23
339,2,"1:09",69,69,"Jayce Johnson made Free Throw.",83,55,28,0.99999999908066,"UNLV","Utah",3,3,0,0,3,401001884,2017-11-23
340,2,"1:09",69,69,"Jayce Johnson made Free Throw.",83,56,27,0.999999998068791,"UNLV","Utah",3,3,0,0,3,401001884,2017-11-23
341,2,"1:00",60,60,"Tervell Beck missed Three Point Jumper.",83,56,27,0.999999998068791,"UNLV","Utah",3,3,0,0,3,401001884,2017-11-23
342,2,"1:00",60,60,"Amauri Hardy Offensive Rebound.",83,56,27,0.999999998068791,"UNLV","Utah",3,3,0,0,3,401001884,2017-11-23
343,2,"0:52",52,52,"Jay Green made Layup. Assisted by Amauri Hardy.",85,56,29,0.999999999939459,"UNLV","Utah",3,3,0,0,3,401001884,2017-11-23
344,2,"0:22",22,22,"Christian Popoola made Jumper.",85,58,27,1,"UNLV","Utah",3,3,0,0,3,401001884,2017-11-23
345,2,"0:00",0,0,"End of Game",85,58,27,1,"UNLV","Utah",3,3,0,0,3,401001884,2017-11-23
