"play_id","half","time_remaining_half","secs_remaining","secs_remaining_absolute","description","home_score","away_score","score_diff","win_prob","home","away","home_time_out_remaining","away_time_out_remaining","home_timeout_ind","away_timeout_ind","home_favored_by","game_id","date"
190,2,"15:29",929,929,"Donald Hicks Turnover.",43,22,21,0.982481652742359,"Radford","Erskine",4,4,0,0,NA,400992381,2017-12-09
191,2,"15:27",927,927,"Trent Smoot Steal.",43,22,21,0.982481652742359,"Radford","Erskine",4,4,0,0,NA,400992381,2017-12-09
192,2,"15:12",912,912,"Blake Maness Turnover.",43,22,21,0.984452961481552,"Radford","Erskine",4,4,0,0,NA,400992381,2017-12-09
193,2,"15:11",911,911,"Leroy Butts IV Steal.",43,22,21,0.984452961481552,"Radford","Erskine",4,4,0,0,NA,400992381,2017-12-09
194,2,"15:09",909,909,"Leroy Butts IV Turnover.",43,22,21,0.983272001402402,"Radford","Erskine",4,4,0,0,NA,400992381,2017-12-09
195,2,"15:08",908,908,"Thomas Nolan Steal.",43,22,21,0.983272001402402,"Radford","Erskine",4,4,0,0,NA,400992381,2017-12-09
196,2,"15:06",906,906,"Austin Venable made Dunk. Assisted by Thomas Nolan.",43,24,19,0.975663972428496,"Radford","Erskine",4,4,0,0,NA,400992381,2017-12-09
197,2,"14:43",883,883,"Christian Bradford missed Three Point Jumper.",43,24,19,0.965564242253929,"Radford","Erskine",4,4,0,0,NA,400992381,2017-12-09
198,2,"14:43",883,883,"Erskine Defensive Rebound.",43,24,19,0.965564242253929,"Radford","Erskine",4,4,0,0,NA,400992381,2017-12-09
199,2,"14:39",879,879,"Official TV Timeout",43,24,19,0.976653083265684,"Radford","Erskine",4,4,0,0,NA,400992381,2017-12-09
200,2,"14:16",856,856,"Jordan Watson made Jumper.",43,26,17,0.973666388972757,"Radford","Erskine",4,4,0,0,NA,400992381,2017-12-09
201,2,"14:08",848,848,"Carlik Jones made Three Point Jumper. Assisted by Devonnte Holland.",46,26,20,0.986577621905993,"Radford","Erskine",4,4,0,0,NA,400992381,2017-12-09
202,2,"13:41",821,821,"Miles Perdue missed Layup.",46,26,20,0.978364339369827,"Radford","Erskine",4,4,0,0,NA,400992381,2017-12-09
203,2,"13:41",821,821,"Travis Fields Jr Defensive Rebound.",46,26,20,0.978364339369827,"Radford","Erskine",4,4,0,0,NA,400992381,2017-12-09
204,2,"13:26",806,806,"Devonnte Holland missed Layup.",46,26,20,0.984953320095195,"Radford","Erskine",4,4,0,0,NA,400992381,2017-12-09
205,2,"13:26",806,806,"Justin Shelton Block.",46,26,20,0.984953320095195,"Radford","Erskine",4,4,0,0,NA,400992381,2017-12-09
206,2,"13:24",804,804,"Leroy Butts IV Offensive Rebound.",46,26,20,0.984953320095195,"Radford","Erskine",4,4,0,0,NA,400992381,2017-12-09
207,2,"13:23",803,803,"Leroy Butts IV made Layup.",48,26,22,0.989928744509969,"Radford","Erskine",4,4,0,0,NA,400992381,2017-12-09
208,2,"13:23",803,803,"Foul on Jordan Watson.",48,26,22,0.989928744509969,"Radford","Erskine",4,4,0,0,NA,400992381,2017-12-09
209,2,"13:23",803,803,"Leroy Butts IV missed Free Throw.",48,26,22,0.989928744509969,"Radford","Erskine",4,4,0,0,NA,400992381,2017-12-09
210,2,"13:23",803,803,"Leroy Butts IV Offensive Rebound.",48,26,22,0.989928744509969,"Radford","Erskine",4,4,0,0,NA,400992381,2017-12-09
211,2,"13:11",791,791,"Devonnte Holland missed Layup.",48,26,22,0.992336014674188,"Radford","Erskine",4,4,0,0,NA,400992381,2017-12-09
212,2,"13:11",791,791,"Miles Perdue Block.",48,26,22,0.992336014674188,"Radford","Erskine",4,4,0,0,NA,400992381,2017-12-09
213,2,"13:10",790,790,"Zezmon Steeple Defensive Rebound.",48,26,22,0.992336014674188,"Radford","Erskine",4,4,0,0,NA,400992381,2017-12-09
214,2,"13:00",780,780,"Zezmon Steeple missed Layup.",48,26,22,0.98984777229558,"Radford","Erskine",4,4,0,0,NA,400992381,2017-12-09
215,2,"13:00",780,780,"Leroy Butts IV Defensive Rebound.",48,26,22,0.98984777229558,"Radford","Erskine",4,4,0,0,NA,400992381,2017-12-09
216,2,"12:51",771,771,"Caleb Tanner made Three Point Jumper. Assisted by Carlik Jones.",51,26,25,0.995096990090497,"Radford","Erskine",4,4,0,0,NA,400992381,2017-12-09
217,2,"12:23",743,743,"Foul on Carlik Jones.",51,26,25,0.996254042433428,"Radford","Erskine",4,4,0,0,NA,400992381,2017-12-09
218,2,"12:23",743,743,"Jordan Watson made Free Throw.",51,27,24,0.995322784648011,"Radford","Erskine",4,4,0,0,NA,400992381,2017-12-09
219,2,"12:23",743,743,"Jordan Watson made Free Throw.",51,28,23,0.994161369817631,"Radford","Erskine",4,4,0,0,NA,400992381,2017-12-09
220,2,"12:11",731,731,"Caleb Tanner Turnover.",51,28,23,0.993239896515254,"Radford","Erskine",4,4,0,0,NA,400992381,2017-12-09
221,2,"12:11",731,731,"Justin Shelton Steal.",51,28,23,0.993239896515254,"Radford","Erskine",4,4,0,0,NA,400992381,2017-12-09
222,2,"11:46",706,706,"Miles Perdue missed Layup.",51,28,23,0.993388853677462,"Radford","Erskine",4,4,0,0,NA,400992381,2017-12-09
223,2,"11:46",706,706,"Justin Shelton Offensive Rebound.",51,28,23,0.993388853677462,"Radford","Erskine",4,4,0,0,NA,400992381,2017-12-09
224,2,"11:40",700,700,"Parker Helgerson missed Three Point Jumper.",51,28,23,0.993388853677462,"Radford","Erskine",4,4,0,0,NA,400992381,2017-12-09
225,2,"11:40",700,700,"Carlik Jones Defensive Rebound.",51,28,23,0.993388853677462,"Radford","Erskine",4,4,0,0,NA,400992381,2017-12-09
226,2,"11:26",686,686,"Travis Fields Jr missed Three Point Jumper.",51,28,23,0.994300119205241,"Radford","Erskine",4,4,0,0,NA,400992381,2017-12-09
227,2,"11:26",686,686,"Randy Phillips Offensive Rebound.",51,28,23,0.994300119205241,"Radford","Erskine",4,4,0,0,NA,400992381,2017-12-09
228,2,"11:23",683,683,"Randy Phillips missed Layup.",51,28,23,0.994300119205241,"Radford","Erskine",4,4,0,0,NA,400992381,2017-12-09
229,2,"11:23",683,683,"Miles Perdue Defensive Rebound.",51,28,23,0.994300119205241,"Radford","Erskine",4,4,0,0,NA,400992381,2017-12-09
230,2,"11:13",673,673,"Zezmon Steeple made Layup.",51,30,21,0.992612418555493,"Radford","Erskine",4,4,0,0,NA,400992381,2017-12-09
231,2,"11:02",662,662,"Caleb Tanner missed Three Point Jumper.",51,30,21,0.992560511887138,"Radford","Erskine",4,4,0,0,NA,400992381,2017-12-09
232,2,"11:02",662,662,"Randy Phillips Offensive Rebound.",51,30,21,0.992560511887138,"Radford","Erskine",4,4,0,0,NA,400992381,2017-12-09
233,2,"10:57",657,657,"Randy Phillips made Layup.",53,30,23,0.996285108454558,"Radford","Erskine",4,4,0,0,NA,400992381,2017-12-09
234,2,"10:31",631,631,"Zezmon Steeple missed Jumper.",53,30,23,0.995887093669165,"Radford","Erskine",4,4,0,0,NA,400992381,2017-12-09
235,2,"10:31",631,631,"Miles Perdue Offensive Rebound.",53,30,23,0.995887093669165,"Radford","Erskine",4,4,0,0,NA,400992381,2017-12-09
236,2,"10:04",604,604,"Zezmon Steeple missed Three Point Jumper.",53,30,23,0.996653709300928,"Radford","Erskine",4,4,0,0,NA,400992381,2017-12-09
237,2,"10:04",604,604,"Randy Phillips Defensive Rebound.",53,30,23,0.996653709300928,"Radford","Erskine",4,4,0,0,NA,400992381,2017-12-09
238,2,"10:02",602,602,"Randy Phillips Turnover.",53,30,23,0.996653709300928,"Radford","Erskine",4,4,0,0,NA,400992381,2017-12-09
239,2,"10:02",602,602,"Official TV Timeout",53,30,23,0.996653709300928,"Radford","Erskine",4,4,0,0,NA,400992381,2017-12-09
240,2,"9:46",586,586,"Trent Smoot made Layup.",53,32,21,0.994112137944282,"Radford","Erskine",4,4,0,0,NA,400992381,2017-12-09
241,2,"9:31",571,571,"Carlik Jones made Layup. Assisted by Donald Hicks.",55,32,23,0.997517432229631,"Radford","Erskine",4,4,0,0,NA,400992381,2017-12-09
242,2,"9:11",551,551,"Blake Maness Turnover.",55,32,23,0.997543348991253,"Radford","Erskine",4,4,0,0,NA,400992381,2017-12-09
243,2,"8:53",533,533,"Donald Hicks made Three Point Jumper. Assisted by Tristan Owens.",58,32,26,0.999437350757316,"Radford","Erskine",4,4,0,0,NA,400992381,2017-12-09
244,2,"8:26",506,506,"Austin Venable missed Layup.",58,32,26,0.999252998441626,"Radford","Erskine",4,4,0,0,NA,400992381,2017-12-09
245,2,"8:26",506,506,"Darius Bolstad Defensive Rebound.",58,32,26,0.999252998441626,"Radford","Erskine",4,4,0,0,NA,400992381,2017-12-09
246,2,"8:12",492,492,"Caleb Tanner missed Three Point Jumper.",58,32,26,0.999288751325901,"Radford","Erskine",4,4,0,0,NA,400992381,2017-12-09
247,2,"8:12",492,492,"Trent Smoot Defensive Rebound.",58,32,26,0.999288751325901,"Radford","Erskine",4,4,0,0,NA,400992381,2017-12-09
248,2,"7:50",470,470,"Foul on Caleb Tanner.",58,32,26,0.999507432604433,"Radford","Erskine",4,4,0,0,NA,400992381,2017-12-09
249,2,"7:50",470,470,"Official TV Timeout",58,32,26,0.999507432604433,"Radford","Erskine",4,4,0,0,NA,400992381,2017-12-09
250,2,"7:50",470,470,"Jordan Watson missed Free Throw.",58,32,26,0.999507432604433,"Radford","Erskine",4,4,0,0,NA,400992381,2017-12-09
251,2,"7:50",470,470,"Erskine Deadball Team Rebound.",58,32,26,0.999507432604433,"Radford","Erskine",4,4,0,0,NA,400992381,2017-12-09
252,2,"7:50",470,470,"Jordan Watson missed Free Throw.",58,32,26,0.999507432604433,"Radford","Erskine",4,4,0,0,NA,400992381,2017-12-09
253,2,"7:50",470,470,"Tristan Owens Defensive Rebound.",58,32,26,0.999507432604433,"Radford","Erskine",4,4,0,0,NA,400992381,2017-12-09
254,2,"7:27",447,447,"Tristan Owens missed Jumper.",58,32,26,0.999303339608891,"Radford","Erskine",4,4,0,0,NA,400992381,2017-12-09
255,2,"7:27",447,447,"Darius Bolstad Offensive Rebound.",58,32,26,0.999303339608891,"Radford","Erskine",4,4,0,0,NA,400992381,2017-12-09
256,2,"7:12",432,432,"Carlik Jones Turnover.",58,32,26,0.999697371115546,"Radford","Erskine",4,4,0,0,NA,400992381,2017-12-09
257,2,"7:11",431,431,"Austin Venable Steal.",58,32,26,0.999697371115546,"Radford","Erskine",4,4,0,0,NA,400992381,2017-12-09
258,2,"7:06",426,426,"Trent Smoot missed Three Point Jumper.",58,32,26,0.999564127290423,"Radford","Erskine",4,4,0,0,NA,400992381,2017-12-09
259,2,"7:06",426,426,"Darius Bolstad Defensive Rebound.",58,32,26,0.999564127290423,"Radford","Erskine",4,4,0,0,NA,400992381,2017-12-09
260,2,"6:54",414,414,"Darius Bolstad made Jumper. Assisted by Tristan Owens.",60,32,28,0.999790741843408,"Radford","Erskine",4,4,0,0,NA,400992381,2017-12-09
261,2,"6:33",393,393,"Jordan Watson made Three Point Jumper.",60,35,25,0.999638056373353,"Radford","Erskine",4,4,0,0,NA,400992381,2017-12-09
262,2,"6:14",374,374,"Leroy Butts IV missed Jumper.",60,35,25,0.999565125234839,"Radford","Erskine",4,4,0,0,NA,400992381,2017-12-09
263,2,"6:14",374,374,"Darius Bolstad Offensive Rebound.",60,35,25,0.999565125234839,"Radford","Erskine",4,4,0,0,NA,400992381,2017-12-09
264,2,"6:11",371,371,"Darius Bolstad Turnover.",60,35,25,0.999565125234839,"Radford","Erskine",4,4,0,0,NA,400992381,2017-12-09
265,2,"6:09",369,369,"Jordan Watson Steal.",60,35,25,0.999708392268323,"Radford","Erskine",4,4,0,0,NA,400992381,2017-12-09
266,2,"6:02",362,362,"Zezmon Steeple missed Layup.",60,35,25,0.999708392268323,"Radford","Erskine",4,4,0,0,NA,400992381,2017-12-09
267,2,"6:02",362,362,"Tristan Owens Defensive Rebound.",60,35,25,0.999708392268323,"Radford","Erskine",4,4,0,0,NA,400992381,2017-12-09
268,2,"5:35",335,335,"Justin Cousin missed Three Point Jumper.",60,35,25,0.999873847720304,"Radford","Erskine",4,4,0,0,NA,400992381,2017-12-09
269,2,"5:35",335,335,"Carlik Jones Offensive Rebound.",60,35,25,0.999873847720304,"Radford","Erskine",4,4,0,0,NA,400992381,2017-12-09
270,2,"5:30",330,330,"Carlik Jones missed Layup.",60,35,25,0.999873847720304,"Radford","Erskine",4,4,0,0,NA,400992381,2017-12-09
271,2,"5:30",330,330,"Austin Venable Block.",60,35,25,0.999873847720304,"Radford","Erskine",4,4,0,0,NA,400992381,2017-12-09
272,2,"5:28",328,328,"Jaywaun Washington Defensive Rebound.",60,35,25,0.999603393111002,"Radford","Erskine",4,4,0,0,NA,400992381,2017-12-09
273,2,"5:17",317,317,"Jaywaun Washington missed Three Point Jumper.",60,35,25,0.99990443105293,"Radford","Erskine",4,4,0,0,NA,400992381,2017-12-09
274,2,"5:17",317,317,"Tristan Owens Defensive Rebound.",60,35,25,0.99990443105293,"Radford","Erskine",4,4,0,0,NA,400992381,2017-12-09
275,2,"5:03",303,303,"Justin Cousin made Three Point Jumper. Assisted by Leroy Butts IV.",63,35,28,0.999929668993284,"Radford","Erskine",4,4,0,0,NA,400992381,2017-12-09
276,2,"4:40",280,280,"Austin Venable made Layup.",63,37,26,0.999896739744184,"Radford","Erskine",4,4,0,0,NA,400992381,2017-12-09
277,2,"4:38",278,278,"Erskine  Timeout",63,37,26,0.999957370326347,"Radford","Erskine",4,3,0,1,NA,400992381,2017-12-09
278,2,"4:38",278,278,"Official TV Timeout",63,37,26,0.999957370326347,"Radford","Erskine",4,3,0,1,NA,400992381,2017-12-09
279,2,"4:25",265,265,"Leroy Butts IV Turnover.",63,37,26,0.999943240932258,"Radford","Erskine",4,3,0,1,NA,400992381,2017-12-09
280,2,"4:05",245,245,"Monta Houston missed Layup.",63,37,26,0.999973895714316,"Radford","Erskine",4,3,0,1,NA,400992381,2017-12-09
281,2,"4:05",245,245,"Randy Phillips Defensive Rebound.",63,37,26,0.999973895714316,"Radford","Erskine",4,3,0,1,NA,400992381,2017-12-09
282,2,"3:53",233,233,"Caleb Tanner made Three Point Jumper. Assisted by Justin Cousin.",66,37,29,0.999993026073886,"Radford","Erskine",4,3,0,1,NA,400992381,2017-12-09
283,2,"3:34",214,214,"Jt Thompson made Three Point Jumper. Assisted by Monta Houston.",66,40,26,0.999989082746265,"Radford","Erskine",4,3,0,0,NA,400992381,2017-12-09
284,2,"3:08",188,188,"Foul on Caleb Shackleford.",66,40,26,0.999996639721993,"Radford","Erskine",4,3,0,0,NA,400992381,2017-12-09
285,2,"3:08",188,188,"Randy Phillips made Free Throw.",67,40,27,0.999997932536797,"Radford","Erskine",4,3,0,0,NA,400992381,2017-12-09
286,2,"3:08",188,188,"Randy Phillips made Free Throw.",68,40,28,0.999998727961806,"Radford","Erskine",4,3,0,0,NA,400992381,2017-12-09
287,2,"2:55",175,175,"Jordan Smith Turnover.",68,40,28,0.999999103946755,"Radford","Erskine",4,3,0,0,NA,400992381,2017-12-09
288,2,"2:31",151,151,"Tristan Owens made Three Point Jumper. Assisted by Christian Bradford.",71,40,31,0.999999952378327,"Radford","Erskine",4,3,0,0,NA,400992381,2017-12-09
289,2,"2:10",130,130,"Jordan Smith made Three Point Jumper. Assisted by Andrew Weir.",71,43,28,0.999999827976069,"Radford","Erskine",4,3,0,0,NA,400992381,2017-12-09
290,2,"2:07",127,127,"Erskine  Timeout",71,43,28,0.999999864717371,"Radford","Erskine",4,2,0,1,NA,400992381,2017-12-09
291,2,"1:52",112,112,"Anias Saunders Turnover.",71,43,28,0.999999957240039,"Radford","Erskine",4,2,0,1,NA,400992381,2017-12-09
292,2,"1:33",93,93,"Andy Zagorac made Three Point Jumper. Assisted by Fineto Lungwana.",71,46,25,0.999999858321915,"Radford","Erskine",4,2,0,1,NA,400992381,2017-12-09
293,2,"1:07",67,67,"Anias Saunders made Three Point Jumper. Assisted by Tristan Owens.",74,46,28,0.999999998968782,"Radford","Erskine",4,2,0,1,NA,400992381,2017-12-09
294,2,"0:54",54,54,"Fineto Lungwana made Three Point Jumper.",74,49,25,0.999999994415307,"Radford","Erskine",4,2,0,0,NA,400992381,2017-12-09
295,2,"0:24",24,24,"Caleb Tanner missed Three Point Jumper.",74,49,25,0.999999999888569,"Radford","Erskine",4,2,0,0,NA,400992381,2017-12-09
296,2,"0:24",24,24,"Anias Saunders Offensive Rebound.",74,49,25,0.999999999888569,"Radford","Erskine",4,2,0,0,NA,400992381,2017-12-09
297,2,"0:19",19,19,"Darius Bolstad made Layup. Assisted by Anias Saunders.",76,49,27,0.999999999999999,"Radford","Erskine",4,2,0,0,NA,400992381,2017-12-09
298,2,"0:07",7,7,"Fineto Lungwana missed Three Point Jumper.",76,49,27,1,"Radford","Erskine",4,2,0,0,NA,400992381,2017-12-09
299,2,"0:07",7,7,"Tristan Owens Defensive Rebound.",76,49,27,1,"Radford","Erskine",4,2,0,0,NA,400992381,2017-12-09
300,2,"0:00",0,0,"End of Game",76,49,27,1,"Radford","Erskine",4,2,0,0,NA,400992381,2017-12-09
