"play_id","half","time_remaining_half","secs_remaining","secs_remaining_absolute","description","home_score","away_score","score_diff","win_prob","home","away","home_time_out_remaining","away_time_out_remaining","home_timeout_ind","away_timeout_ind","home_favored_by","game_id","date"
190,2,"12:58",778,778,"Matthew Temple made Jumper. Assisted by Niem Stevenson.",61,31,30,0.999617217412054,"Texas Tech","UTSA",4,3,0,0,23,400916167,2016-12-07
191,2,"12:58",778,778,"Foul on Giovanni De Nicolao.",61,31,30,0.999617217412054,"Texas Tech","UTSA",4,3,0,0,23,400916167,2016-12-07
192,2,"12:58",778,778,"Matthew Temple made Free Throw.",62,31,31,0.999689745759761,"Texas Tech","UTSA",4,3,0,0,23,400916167,2016-12-07
193,2,"12:48",768,768,"George Willborn III made Jumper.",62,33,29,0.999652397068874,"Texas Tech","UTSA",4,3,0,0,23,400916167,2016-12-07
194,2,"12:35",755,755,"Giovanni McLean missed Three Point Jumper.",62,33,29,0.99962616387207,"Texas Tech","UTSA",4,3,0,0,23,400916167,2016-12-07
195,2,"12:35",755,755,"Devon Thomas Offensive Rebound.",62,33,29,0.99962616387207,"Texas Tech","UTSA",4,3,0,0,23,400916167,2016-12-07
196,2,"12:30",750,750,"Giovanni McLean made Three Point Jumper. Assisted by Devon Thomas.",65,33,32,0.999805132700321,"Texas Tech","UTSA",4,3,0,0,23,400916167,2016-12-07
197,2,"12:07",727,727,"Technical Foul on UT San Antonio.",65,33,32,0.999810962341338,"Texas Tech","UTSA",4,3,0,0,23,400916167,2016-12-07
198,2,"12:07",727,727,"Giovanni McLean made Free Throw.",66,33,33,0.999848300363536,"Texas Tech","UTSA",4,3,0,0,23,400916167,2016-12-07
199,2,"12:07",727,727,"Giovanni McLean made Free Throw.",67,33,34,0.999878264415043,"Texas Tech","UTSA",4,3,0,0,23,400916167,2016-12-07
200,2,"12:07",727,727,"Foul on UT San Antonio.",67,33,34,0.999878264415043,"Texas Tech","UTSA",4,3,0,0,23,400916167,2016-12-07
201,2,"12:00",720,720,"Nick Billingsley missed Jumper.",67,33,34,0.999878264415043,"Texas Tech","UTSA",4,3,0,0,23,400916167,2016-12-07
202,2,"12:00",720,720,"UT San Antonio Deadball Team Rebound.",67,33,34,0.999878264415043,"Texas Tech","UTSA",4,3,0,0,23,400916167,2016-12-07
203,2,"11:58",718,718,"Foul on Anthony Livingston.",67,33,34,0.999871266727364,"Texas Tech","UTSA",4,3,0,0,23,400916167,2016-12-07
204,2,"11:58",718,718,"Official TV Timeout",67,33,34,0.999871266727364,"Texas Tech","UTSA",4,3,0,0,23,400916167,2016-12-07
205,2,"11:56",716,716,"Giovanni De Nicolao made Layup. Assisted by Gino Littles.",67,35,32,0.999800542618002,"Texas Tech","UTSA",4,3,0,0,23,400916167,2016-12-07
206,2,"11:32",692,692,"Niem Stevenson missed Three Point Jumper.",67,35,32,0.999905662335987,"Texas Tech","UTSA",4,3,0,0,23,400916167,2016-12-07
207,2,"11:32",692,692,"Nick Billingsley Defensive Rebound.",67,35,32,0.999905662335987,"Texas Tech","UTSA",4,3,0,0,23,400916167,2016-12-07
208,2,"11:23",683,683,"James Ringholt missed Three Point Jumper.",67,35,32,0.999821800616176,"Texas Tech","UTSA",4,3,0,0,23,400916167,2016-12-07
209,2,"11:23",683,683,"Mitar Stanojevic Offensive Rebound.",67,35,32,0.999821800616176,"Texas Tech","UTSA",4,3,0,0,23,400916167,2016-12-07
210,2,"11:11",671,671,"Foul on Giovanni McLean.",67,35,32,0.999866773924664,"Texas Tech","UTSA",4,3,0,0,23,400916167,2016-12-07
211,2,"11:04",664,664,"Giovanni De Nicolao Turnover.",67,35,32,0.99983075555707,"Texas Tech","UTSA",4,3,0,0,23,400916167,2016-12-07
212,2,"11:02",662,662,"Keenan Evans Steal.",67,35,32,0.99983075555707,"Texas Tech","UTSA",4,3,0,0,23,400916167,2016-12-07
213,2,"10:42",642,642,"Niem Stevenson missed Layup.",67,35,32,0.999887905940347,"Texas Tech","UTSA",4,3,0,0,23,400916167,2016-12-07
214,2,"10:42",642,642,"Mitar Stanojevic Defensive Rebound.",67,35,32,0.999887905940347,"Texas Tech","UTSA",4,3,0,0,23,400916167,2016-12-07
215,2,"10:34",634,634,"Nick Billingsley made Three Point Jumper. Assisted by Gino Littles.",67,38,29,0.999702352854617,"Texas Tech","UTSA",4,3,0,0,23,400916167,2016-12-07
216,2,"10:20",620,620,"Foul on James Ringholt.",67,38,29,0.999857817308236,"Texas Tech","UTSA",4,3,0,0,23,400916167,2016-12-07
217,2,"10:20",620,620,"Justin Gray made Free Throw.",68,38,30,0.99988942474203,"Texas Tech","UTSA",4,3,0,0,23,400916167,2016-12-07
218,2,"10:20",620,620,"Justin Gray made Free Throw.",69,38,31,0.999914006398381,"Texas Tech","UTSA",4,3,0,0,23,400916167,2016-12-07
219,2,"9:57",597,597,"Mitar Stanojevic made Layup.",69,40,29,0.999759472235378,"Texas Tech","UTSA",4,3,0,0,23,400916167,2016-12-07
220,2,"9:44",584,584,"Anthony Livingston missed Jumper.",69,40,29,0.999756662025856,"Texas Tech","UTSA",4,3,0,0,23,400916167,2016-12-07
221,2,"9:44",584,584,"Nick Billingsley Defensive Rebound.",69,40,29,0.999756662025856,"Texas Tech","UTSA",4,3,0,0,23,400916167,2016-12-07
222,2,"9:32",572,572,"Bola Alade made Jumper. Assisted by Giovanni De Nicolao.",69,42,27,0.999754160008243,"Texas Tech","UTSA",4,3,0,0,23,400916167,2016-12-07
223,2,"9:25",565,565,"Texas Tech  Timeout",69,42,27,0.999800427104047,"Texas Tech","UTSA",4,2,0,1,23,400916167,2016-12-07
224,2,"9:14",554,554,"Foul on Keenan Evans.",69,42,27,0.999771149074569,"Texas Tech","UTSA",4,2,0,1,23,400916167,2016-12-07
225,2,"9:14",554,554,"Keenan Evans Turnover.",69,42,27,0.999771149074569,"Texas Tech","UTSA",4,2,0,1,23,400916167,2016-12-07
226,2,"8:51",531,531,"James Ringholt missed Three Point Jumper.",69,42,27,0.999883829804548,"Texas Tech","UTSA",4,2,0,1,23,400916167,2016-12-07
227,2,"8:51",531,531,"Justin Gray Defensive Rebound.",69,42,27,0.999883829804548,"Texas Tech","UTSA",4,2,0,1,23,400916167,2016-12-07
228,2,"8:34",514,514,"Justin Gray made Layup. Assisted by Shadell Millinghaus.",71,42,29,0.999883076845026,"Texas Tech","UTSA",4,2,0,1,23,400916167,2016-12-07
229,2,"8:19",499,499,"Mitar Stanojevic made Three Point Jumper. Assisted by Giovanni De Nicolao.",71,45,26,0.999770385026686,"Texas Tech","UTSA",4,2,0,0,23,400916167,2016-12-07
230,2,"8:01",481,481,"Anthony Livingston missed Layup.",71,45,26,0.999776429678312,"Texas Tech","UTSA",4,2,0,0,23,400916167,2016-12-07
231,2,"8:01",481,481,"Nick Billingsley Block.",71,45,26,0.999776429678312,"Texas Tech","UTSA",4,2,0,0,23,400916167,2016-12-07
232,2,"8:01",481,481,"Texas Tech Offensive Rebound.",71,45,26,0.999776429678312,"Texas Tech","UTSA",4,2,0,0,23,400916167,2016-12-07
233,2,"7:58",478,478,"Keenan Evans made Layup. Assisted by Matthew Temple.",73,45,28,0.999924150221661,"Texas Tech","UTSA",4,2,0,0,23,400916167,2016-12-07
234,2,"7:34",454,454,"Bola Alade missed Three Point Jumper.",73,45,28,0.999955904082369,"Texas Tech","UTSA",4,2,0,0,23,400916167,2016-12-07
235,2,"7:34",454,454,"Justin Gray Defensive Rebound.",73,45,28,0.999955904082369,"Texas Tech","UTSA",4,2,0,0,23,400916167,2016-12-07
236,2,"7:13",433,433,"Devon Thomas made Layup.",75,45,30,0.999974476069819,"Texas Tech","UTSA",4,2,0,0,23,400916167,2016-12-07
237,2,"6:58",418,418,"Austin Karrer missed Three Point Jumper.",75,45,30,0.999966843090215,"Texas Tech","UTSA",4,2,0,0,23,400916167,2016-12-07
238,2,"6:58",418,418,"Justin Gray Defensive Rebound.",75,45,30,0.999966843090215,"Texas Tech","UTSA",4,2,0,0,23,400916167,2016-12-07
239,2,"6:47",407,407,"Foul on Gino Littles.",75,45,30,0.999984339206622,"Texas Tech","UTSA",4,2,0,0,23,400916167,2016-12-07
240,2,"6:47",407,407,"Official TV Timeout",75,45,30,0.999984339206622,"Texas Tech","UTSA",4,2,0,0,23,400916167,2016-12-07
241,2,"6:47",407,407,"Shadell Millinghaus made Free Throw.",76,45,31,0.99998873871353,"Texas Tech","UTSA",4,2,0,0,23,400916167,2016-12-07
242,2,"6:47",407,407,"Shadell Millinghaus made Free Throw.",77,45,32,0.999991902299382,"Texas Tech","UTSA",4,2,0,0,23,400916167,2016-12-07
243,2,"6:18",378,378,"Jeff Beverly missed Jumper.",77,45,32,0.999984909506969,"Texas Tech","UTSA",4,2,0,0,23,400916167,2016-12-07
244,2,"6:18",378,378,"Texas Tech Defensive Rebound.",77,45,32,0.999984909506969,"Texas Tech","UTSA",4,2,0,0,23,400916167,2016-12-07
245,2,"6:00",360,360,"Shadell Millinghaus missed Three Point Jumper.",77,45,32,0.999989278914703,"Texas Tech","UTSA",4,2,0,0,23,400916167,2016-12-07
246,2,"6:00",360,360,"Austin Karrer Defensive Rebound.",77,45,32,0.999989278914703,"Texas Tech","UTSA",4,2,0,0,23,400916167,2016-12-07
247,2,"5:48",348,348,"Foul on Giovanni McLean.",77,45,32,0.999992213366742,"Texas Tech","UTSA",4,2,0,0,23,400916167,2016-12-07
248,2,"5:48",348,348,"Jeff Beverly missed Free Throw.",77,45,32,0.999992213366742,"Texas Tech","UTSA",4,2,0,0,23,400916167,2016-12-07
249,2,"5:48",348,348,"Niem Stevenson Defensive Rebound.",77,45,32,0.999992213366742,"Texas Tech","UTSA",4,2,0,0,23,400916167,2016-12-07
250,2,"5:24",324,324,"Keenan Evans made Jumper.",79,45,34,0.999993365149961,"Texas Tech","UTSA",4,2,0,0,23,400916167,2016-12-07
251,2,"5:08",308,308,"Byron Frohnen made Jumper.",79,47,32,0.999992932403835,"Texas Tech","UTSA",4,2,0,0,23,400916167,2016-12-07
252,2,"4:47",287,287,"Matthew Temple Turnover.",79,47,32,0.999995842657875,"Texas Tech","UTSA",4,2,0,0,23,400916167,2016-12-07
253,2,"4:33",273,273,"Mitar Stanojevic missed Three Point Jumper.",79,47,32,0.999998634229425,"Texas Tech","UTSA",4,2,0,0,23,400916167,2016-12-07
254,2,"4:33",273,273,"Byron Frohnen Offensive Rebound.",79,47,32,0.999998634229425,"Texas Tech","UTSA",4,2,0,0,23,400916167,2016-12-07
255,2,"4:14",254,254,"Nick Allen made Jumper.",79,49,30,0.999998793272567,"Texas Tech","UTSA",4,2,0,0,23,400916167,2016-12-07
256,2,"3:56",236,236,"Foul on Jeff Beverly.",79,49,30,0.99999801883451,"Texas Tech","UTSA",4,2,0,0,23,400916167,2016-12-07
257,2,"3:56",236,236,"Official TV Timeout",79,49,30,0.99999801883451,"Texas Tech","UTSA",4,2,0,0,23,400916167,2016-12-07
258,2,"3:56",236,236,"Niem Stevenson made Free Throw.",80,49,31,0.9999986796671,"Texas Tech","UTSA",4,2,0,0,23,400916167,2016-12-07
259,2,"3:56",236,236,"Niem Stevenson made Free Throw.",81,49,32,0.999999120074223,"Texas Tech","UTSA",4,2,0,0,23,400916167,2016-12-07
260,2,"3:38",218,218,"Jeff Beverly missed Jumper.",81,49,32,0.999999709778652,"Texas Tech","UTSA",4,2,0,0,23,400916167,2016-12-07
261,2,"3:38",218,218,"Niem Stevenson Defensive Rebound.",81,49,32,0.999999709778652,"Texas Tech","UTSA",4,2,0,0,23,400916167,2016-12-07
262,2,"3:20",200,200,"Giovanni McLean missed Three Point Jumper.",81,49,32,0.999999840007477,"Texas Tech","UTSA",4,2,0,0,23,400916167,2016-12-07
263,2,"3:20",200,200,"Gino Littles Defensive Rebound.",81,49,32,0.999999840007477,"Texas Tech","UTSA",4,2,0,0,23,400916167,2016-12-07
264,2,"3:12",192,192,"George Willborn III missed Layup.",81,49,32,0.999999849978653,"Texas Tech","UTSA",4,2,0,0,23,400916167,2016-12-07
265,2,"3:12",192,192,"Byron Frohnen Offensive Rebound.",81,49,32,0.999999849978653,"Texas Tech","UTSA",4,2,0,0,23,400916167,2016-12-07
266,2,"3:09",189,189,"Byron Frohnen missed Layup.",81,49,32,0.99999992493294,"Texas Tech","UTSA",4,2,0,0,23,400916167,2016-12-07
267,2,"3:09",189,189,"Thomas Brandsma Defensive Rebound.",81,49,32,0.99999992493294,"Texas Tech","UTSA",4,2,0,0,23,400916167,2016-12-07
268,2,"3:08",188,188,"Foul on George Willborn III.",81,49,32,0.99999992493294,"Texas Tech","UTSA",4,2,0,0,23,400916167,2016-12-07
269,2,"3:08",188,188,"Thomas Brandsma made Free Throw.",82,49,33,0.999999953813884,"Texas Tech","UTSA",4,2,0,0,23,400916167,2016-12-07
270,2,"3:08",188,188,"Thomas Brandsma made Free Throw.",83,49,34,0.999999971583312,"Texas Tech","UTSA",4,2,0,0,23,400916167,2016-12-07
271,2,"2:52",172,172,"Foul on Shadell Millinghaus.",83,49,34,0.999999979424707,"Texas Tech","UTSA",4,2,0,0,23,400916167,2016-12-07
272,2,"2:52",172,172,"Bola Alade made Free Throw.",83,50,33,0.999999966343216,"Texas Tech","UTSA",4,2,0,0,23,400916167,2016-12-07
273,2,"2:52",172,172,"Bola Alade missed Free Throw.",83,50,33,0.999999966343216,"Texas Tech","UTSA",4,2,0,0,23,400916167,2016-12-07
274,2,"2:52",172,172,"Matthew Temple Defensive Rebound.",83,50,33,0.999999966343216,"Texas Tech","UTSA",4,2,0,0,23,400916167,2016-12-07
275,2,"2:32",152,152,"Niem Stevenson missed Three Point Jumper.",83,50,33,0.999999992301149,"Texas Tech","UTSA",4,2,0,0,23,400916167,2016-12-07
276,2,"2:32",152,152,"George Willborn III Defensive Rebound.",83,50,33,0.999999992301149,"Texas Tech","UTSA",4,2,0,0,23,400916167,2016-12-07
277,2,"2:26",146,146,"Foul on George Willborn III.",83,50,33,0.999999986802538,"Texas Tech","UTSA",4,2,0,0,23,400916167,2016-12-07
278,2,"2:26",146,146,"George Willborn III Turnover.",83,50,33,0.999999986802538,"Texas Tech","UTSA",4,2,0,0,23,400916167,2016-12-07
279,2,"1:59",119,119,"Matthew Temple made Layup. Assisted by Giovanni McLean.",85,50,35,0.999999999692331,"Texas Tech","UTSA",4,2,0,0,23,400916167,2016-12-07
280,2,"1:42",102,102,"Foul on Giovanni McLean.",85,50,35,0.999999999812136,"Texas Tech","UTSA",4,2,0,0,23,400916167,2016-12-07
281,2,"1:42",102,102,"Kyle Massie missed Free Throw.",85,50,35,0.999999999812136,"Texas Tech","UTSA",4,2,0,0,23,400916167,2016-12-07
282,2,"1:42",102,102,"Matthew Temple Defensive Rebound.",85,50,35,0.999999999812136,"Texas Tech","UTSA",4,2,0,0,23,400916167,2016-12-07
283,2,"1:22",82,82,"Shadell Millinghaus made Layup. Assisted by Niem Stevenson.",87,50,37,0.99999999999877,"Texas Tech","UTSA",4,2,0,0,23,400916167,2016-12-07
284,2,"1:08",68,68,"George Willborn III missed Jumper.",87,50,37,0.999999999999154,"Texas Tech","UTSA",4,2,0,0,23,400916167,2016-12-07
285,2,"1:08",68,68,"Niem Stevenson Defensive Rebound.",87,50,37,0.999999999999154,"Texas Tech","UTSA",4,2,0,0,23,400916167,2016-12-07
286,2,"0:50",50,50,"Thomas Brandsma missed Jumper.",87,50,37,0.999999999999999,"Texas Tech","UTSA",4,2,0,0,23,400916167,2016-12-07
287,2,"0:50",50,50,"Bola Alade Defensive Rebound.",87,50,37,0.999999999999999,"Texas Tech","UTSA",4,2,0,0,23,400916167,2016-12-07
288,2,"0:35",35,35,"Bola Alade missed Three Point Jumper.",87,50,37,0.999999999999934,"Texas Tech","UTSA",4,2,0,0,23,400916167,2016-12-07
289,2,"0:35",35,35,"Matthew Temple Defensive Rebound.",87,50,37,0.999999999999934,"Texas Tech","UTSA",4,2,0,0,23,400916167,2016-12-07
290,2,"0:01",1,1,"Texas Tech  Turnover.",87,50,37,1,"Texas Tech","UTSA",4,2,0,0,23,400916167,2016-12-07
291,2,"0:00",0,0,"End of Game",87,50,37,NA,"Texas Tech","UTSA",4,2,0,0,23,400916167,2016-12-07
