"play_id","half","time_remaining_half","secs_remaining","secs_remaining_absolute","description","home_score","away_score","score_diff","win_prob","home","away","home_time_out_remaining","away_time_out_remaining","home_timeout_ind","away_timeout_ind","home_favored_by","game_id","date"
1,1,"20:00",2400,2400,"PLAY",0,0,0,0.347223913531332,"Pittsburgh","Clemson",4,4,0,0,-3,400915404,2017-01-28
2,1,"19:36",2376,2376,"Jaron Blossomgame made Three Point Jumper. Assisted by Shelton Mitchell.",0,3,-3,0.306698156812272,"Pittsburgh","Clemson",4,4,0,0,-3,400915404,2017-01-28
3,1,"19:19",2359,2359,"Cameron Johnson made Jumper. Assisted by Chris Jones.",2,3,-1,0.353891122740035,"Pittsburgh","Clemson",4,4,0,0,-3,400915404,2017-01-28
4,1,"18:52",2332,2332,"Shelton Mitchell missed Three Point Jumper.",2,3,-1,0.342311153111094,"Pittsburgh","Clemson",4,4,0,0,-3,400915404,2017-01-28
5,1,"18:52",2332,2332,"Donte Grantham Offensive Rebound.",2,3,-1,0.342311153111094,"Pittsburgh","Clemson",4,4,0,0,-3,400915404,2017-01-28
6,1,"18:47",2327,2327,"Jaron Blossomgame made Three Point Jumper. Assisted by Donte Grantham.",2,6,-4,0.285244650421566,"Pittsburgh","Clemson",4,4,0,0,-3,400915404,2017-01-28
7,1,"18:21",2301,2301,"Sheldon Jeter missed Three Point Jumper.",2,6,-4,0.275149054468193,"Pittsburgh","Clemson",4,4,0,0,-3,400915404,2017-01-28
8,1,"18:21",2301,2301,"Avry Holmes Defensive Rebound.",2,6,-4,0.275149054468193,"Pittsburgh","Clemson",4,4,0,0,-3,400915404,2017-01-28
9,1,"18:10",2290,2290,"Elijah Thomas Turnover.",2,6,-4,0.283850214994346,"Pittsburgh","Clemson",4,4,0,0,-3,400915404,2017-01-28
10,1,"17:47",2267,2267,"Jamel Artis missed Three Point Jumper.",2,6,-4,0.25993554047802,"Pittsburgh","Clemson",4,4,0,0,-3,400915404,2017-01-28
11,1,"17:47",2267,2267,"Elijah Thomas Defensive Rebound.",2,6,-4,0.25993554047802,"Pittsburgh","Clemson",4,4,0,0,-3,400915404,2017-01-28
12,1,"17:22",2242,2242,"Elijah Thomas made Jumper. Assisted by Jaron Blossomgame.",2,8,-6,0.265790089862741,"Pittsburgh","Clemson",4,4,0,0,-3,400915404,2017-01-28
13,1,"16:59",2219,2219,"Michael Young made Jumper.",4,8,-4,0.269420042591656,"Pittsburgh","Clemson",4,4,0,0,-3,400915404,2017-01-28
14,1,"16:41",2201,2201,"Jaron Blossomgame made Layup. Assisted by Donte Grantham.",4,10,-6,0.231284068001682,"Pittsburgh","Clemson",4,4,0,0,-3,400915404,2017-01-28
15,1,"16:32",2192,2192,"Michael Young made Jumper. Assisted by Jamel Artis.",6,10,-4,0.276239576000077,"Pittsburgh","Clemson",4,4,0,0,-3,400915404,2017-01-28
16,1,"16:06",2166,2166,"Jaron Blossomgame Turnover.",6,10,-4,0.27378710370225,"Pittsburgh","Clemson",4,4,0,0,-3,400915404,2017-01-28
17,1,"15:44",2144,2144,"Jamel Artis made Three Point Jumper. Assisted by Chris Jones.",9,10,-1,0.35167376762341,"Pittsburgh","Clemson",4,4,0,0,-3,400915404,2017-01-28
18,1,"15:23",2123,2123,"Elijah Thomas Turnover.",9,10,-1,0.335445068172631,"Pittsburgh","Clemson",4,4,0,0,-3,400915404,2017-01-28
19,1,"15:23",2123,2123,"Official TV Timeout",9,10,-1,0.335445068172631,"Pittsburgh","Clemson",4,4,0,0,-3,400915404,2017-01-28
20,1,"15:11",2111,2111,"Chris Jones missed Jumper.",9,10,-1,0.326762863466671,"Pittsburgh","Clemson",4,4,0,0,-3,400915404,2017-01-28
21,1,"15:11",2111,2111,"Chris Jones Offensive Rebound.",9,10,-1,0.326762863466671,"Pittsburgh","Clemson",4,4,0,0,-3,400915404,2017-01-28
22,1,"14:49",2089,2089,"Jamel Artis missed Jumper.",9,10,-1,0.355594880547407,"Pittsburgh","Clemson",4,4,0,0,-3,400915404,2017-01-28
23,1,"14:49",2089,2089,"Avry Holmes Defensive Rebound.",9,10,-1,0.355594880547407,"Pittsburgh","Clemson",4,4,0,0,-3,400915404,2017-01-28
24,1,"14:25",2065,2065,"Donte Grantham missed Three Point Jumper.",9,10,-1,0.332499575203334,"Pittsburgh","Clemson",4,4,0,0,-3,400915404,2017-01-28
25,1,"14:25",2065,2065,"Elijah Thomas Offensive Rebound.",9,10,-1,0.332499575203334,"Pittsburgh","Clemson",4,4,0,0,-3,400915404,2017-01-28
26,1,"14:23",2063,2063,"Foul on Cameron Johnson.",9,10,-1,0.332499575203334,"Pittsburgh","Clemson",4,4,0,0,-3,400915404,2017-01-28
27,1,"14:10",2050,2050,"Avry Holmes missed Jumper.",9,10,-1,0.321890665053745,"Pittsburgh","Clemson",4,4,0,0,-3,400915404,2017-01-28
28,1,"14:10",2050,2050,"Donte Grantham Offensive Rebound.",9,10,-1,0.321890665053745,"Pittsburgh","Clemson",4,4,0,0,-3,400915404,2017-01-28
29,1,"14:07",2047,2047,"Donte Grantham made Two Point Tip Shot.",9,12,-3,0.285399191957575,"Pittsburgh","Clemson",4,4,0,0,-3,400915404,2017-01-28
30,1,"13:52",2032,2032,"Jamel Artis Turnover.",9,12,-3,0.295240524923335,"Pittsburgh","Clemson",4,4,0,0,-3,400915404,2017-01-28
31,1,"13:51",2031,2031,"Donte Grantham Steal.",9,12,-3,0.295240524923335,"Pittsburgh","Clemson",4,4,0,0,-3,400915404,2017-01-28
32,1,"13:47",2027,2027,"Marcquise Reed missed Jumper.",9,12,-3,0.274202986488319,"Pittsburgh","Clemson",4,4,0,0,-3,400915404,2017-01-28
33,1,"13:47",2027,2027,"Donte Grantham Offensive Rebound.",9,12,-3,0.274202986488319,"Pittsburgh","Clemson",4,4,0,0,-3,400915404,2017-01-28
34,1,"13:37",2017,2017,"Marcquise Reed missed Jumper.",9,12,-3,0.298324964808939,"Pittsburgh","Clemson",4,4,0,0,-3,400915404,2017-01-28
35,1,"13:37",2017,2017,"Sheldon Jeter Defensive Rebound.",9,12,-3,0.298324964808939,"Pittsburgh","Clemson",4,4,0,0,-3,400915404,2017-01-28
36,1,"13:16",1996,1996,"Foul on Donte Grantham.",9,12,-3,0.282073818163446,"Pittsburgh","Clemson",4,4,0,0,-3,400915404,2017-01-28
37,1,"13:16",1996,1996,"Cameron Johnson made Free Throw.",10,12,-2,0.309081561983372,"Pittsburgh","Clemson",4,4,0,0,-3,400915404,2017-01-28
38,1,"13:16",1996,1996,"Cameron Johnson made Free Throw.",11,12,-1,0.337459715512237,"Pittsburgh","Clemson",4,4,0,0,-3,400915404,2017-01-28
39,1,"13:16",1996,1996,"Cameron Johnson missed Free Throw.",11,12,-1,0.337459715512237,"Pittsburgh","Clemson",4,4,0,0,-3,400915404,2017-01-28
40,1,"13:16",1996,1996,"Jaron Blossomgame Defensive Rebound.",11,12,-1,0.337459715512237,"Pittsburgh","Clemson",4,4,0,0,-3,400915404,2017-01-28
41,1,"12:57",1977,1977,"Jaron Blossomgame missed Jumper.",11,12,-1,0.336088450944498,"Pittsburgh","Clemson",4,4,0,0,-3,400915404,2017-01-28
42,1,"12:57",1977,1977,"Rozelle Nix Defensive Rebound.",11,12,-1,0.336088450944498,"Pittsburgh","Clemson",4,4,0,0,-3,400915404,2017-01-28
43,1,"12:34",1954,1954,"Rozelle Nix Turnover.",11,12,-1,0.356086601966588,"Pittsburgh","Clemson",4,4,0,0,-3,400915404,2017-01-28
44,1,"12:34",1954,1954,"Foul on Rozelle Nix.",11,12,-1,0.356086601966588,"Pittsburgh","Clemson",4,4,0,0,-3,400915404,2017-01-28
45,1,"12:12",1932,1932,"Jaron Blossomgame missed Three Point Jumper.",11,12,-1,0.334949394883521,"Pittsburgh","Clemson",4,4,0,0,-3,400915404,2017-01-28
46,1,"12:12",1932,1932,"Cameron Johnson Defensive Rebound.",11,12,-1,0.334949394883521,"Pittsburgh","Clemson",4,4,0,0,-3,400915404,2017-01-28
47,1,"11:56",1916,1916,"Foul on Marcquise Reed.",11,12,-1,0.360847357943299,"Pittsburgh","Clemson",4,4,0,0,-3,400915404,2017-01-28
48,1,"11:55",1915,1915,"Official TV Timeout",11,12,-1,0.360847357943299,"Pittsburgh","Clemson",4,4,0,0,-3,400915404,2017-01-28
49,1,"11:55",1915,1915,"Chris Jones made Free Throw.",12,12,0,0.391086836879136,"Pittsburgh","Clemson",4,4,0,0,-3,400915404,2017-01-28
50,1,"11:55",1915,1915,"Chris Jones missed Free Throw.",12,12,0,0.391086836879136,"Pittsburgh","Clemson",4,4,0,0,-3,400915404,2017-01-28
51,1,"11:55",1915,1915,"Legend Robertin Defensive Rebound.",12,12,0,0.391086836879136,"Pittsburgh","Clemson",4,4,0,0,-3,400915404,2017-01-28
52,1,"11:39",1899,1899,"Jaron Blossomgame made Layup. Assisted by Marcquise Reed.",12,14,-2,0.324386596020101,"Pittsburgh","Clemson",4,4,0,0,-3,400915404,2017-01-28
53,1,"11:06",1866,1866,"Sheldon Jeter made Three Point Jumper. Assisted by Cameron Johnson.",15,14,1,0.430313982812497,"Pittsburgh","Clemson",4,4,0,0,-3,400915404,2017-01-28
54,1,"10:35",1835,1835,"Jaron Blossomgame missed Jumper.",15,14,1,0.414603249930641,"Pittsburgh","Clemson",4,4,0,0,-3,400915404,2017-01-28
55,1,"10:35",1835,1835,"Rozelle Nix Defensive Rebound.",15,14,1,0.414603249930641,"Pittsburgh","Clemson",4,4,0,0,-3,400915404,2017-01-28
56,1,"10:34",1834,1834,"Foul on Legend Robertin.",15,14,1,0.414603249930641,"Pittsburgh","Clemson",4,4,0,0,-3,400915404,2017-01-28
57,1,"10:06",1806,1806,"Michael Young missed Jumper.",15,14,1,0.398268103638236,"Pittsburgh","Clemson",4,4,0,0,-3,400915404,2017-01-28
58,1,"10:06",1806,1806,"Clemson Defensive Rebound.",15,14,1,0.398268103638236,"Pittsburgh","Clemson",4,4,0,0,-3,400915404,2017-01-28
59,1,"10:05",1805,1805,"Foul on Rozelle Nix.",15,14,1,0.398268103638236,"Pittsburgh","Clemson",4,4,0,0,-3,400915404,2017-01-28
60,1,"9:52",1792,1792,"Shelton Mitchell missed Layup.",15,14,1,0.402792875170294,"Pittsburgh","Clemson",4,4,0,0,-3,400915404,2017-01-28
61,1,"9:52",1792,1792,"Marcquise Reed Offensive Rebound.",15,14,1,0.402792875170294,"Pittsburgh","Clemson",4,4,0,0,-3,400915404,2017-01-28
62,1,"9:46",1786,1786,"Elijah Thomas missed Layup.",15,14,1,0.397786392513436,"Pittsburgh","Clemson",4,4,0,0,-3,400915404,2017-01-28
63,1,"9:46",1786,1786,"Jonathan Milligan Block.",15,14,1,0.397786392513436,"Pittsburgh","Clemson",4,4,0,0,-3,400915404,2017-01-28
64,1,"9:42",1782,1782,"Jonathan Milligan Defensive Rebound.",15,14,1,0.397786392513436,"Pittsburgh","Clemson",4,4,0,0,-3,400915404,2017-01-28
65,1,"9:36",1776,1776,"Damon Wilson missed Layup.",15,14,1,0.389509069441131,"Pittsburgh","Clemson",4,4,0,0,-3,400915404,2017-01-28
66,1,"9:36",1776,1776,"Jaron Blossomgame Defensive Rebound.",15,14,1,0.389509069441131,"Pittsburgh","Clemson",4,4,0,0,-3,400915404,2017-01-28
67,1,"9:29",1769,1769,"Marcquise Reed made Layup. Assisted by Shelton Mitchell.",15,16,-1,0.340773318969336,"Pittsburgh","Clemson",4,4,0,0,-3,400915404,2017-01-28
68,1,"9:10",1750,1750,"Foul on Marcquise Reed.",15,16,-1,0.308687826448779,"Pittsburgh","Clemson",4,4,0,0,-3,400915404,2017-01-28
69,1,"9:04",1744,1744,"Jonathan Milligan made Three Point Jumper. Assisted by Damon Wilson.",18,16,2,0.46077312887466,"Pittsburgh","Clemson",4,4,0,0,-3,400915404,2017-01-28
70,1,"8:40",1720,1720,"Elijah Thomas missed Jumper.",18,16,2,0.472976834732862,"Pittsburgh","Clemson",4,4,0,0,-3,400915404,2017-01-28
71,1,"8:40",1720,1720,"Michael Young Defensive Rebound.",18,16,2,0.472976834732862,"Pittsburgh","Clemson",4,4,0,0,-3,400915404,2017-01-28
72,1,"8:30",1710,1710,"Michael Young missed Jumper.",18,16,2,0.436518984902162,"Pittsburgh","Clemson",4,4,0,0,-3,400915404,2017-01-28
73,1,"8:30",1710,1710,"Donte Grantham Block.",18,16,2,0.436518984902162,"Pittsburgh","Clemson",4,4,0,0,-3,400915404,2017-01-28
74,1,"8:28",1708,1708,"Pittsburgh Offensive Rebound.",18,16,2,0.427594541098709,"Pittsburgh","Clemson",4,4,0,0,-3,400915404,2017-01-28
75,1,"8:26",1706,1706,"Jonathan Milligan Turnover.",18,16,2,0.427594541098709,"Pittsburgh","Clemson",4,4,0,0,-3,400915404,2017-01-28
76,1,"8:10",1690,1690,"Gabe DeVoe missed Three Point Jumper.",18,16,2,0.464351653162577,"Pittsburgh","Clemson",4,4,0,0,-3,400915404,2017-01-28
77,1,"8:10",1690,1690,"Jamel Artis Defensive Rebound.",18,16,2,0.464351653162577,"Pittsburgh","Clemson",4,4,0,0,-3,400915404,2017-01-28
78,1,"8:00",1680,1680,"Jonathan Milligan made Three Point Jumper. Assisted by Michael Young.",21,16,5,0.548942575652366,"Pittsburgh","Clemson",4,4,0,0,-3,400915404,2017-01-28
79,1,"7:41",1661,1661,"Donte Grantham made Dunk. Assisted by Shelton Mitchell.",21,18,3,0.471904131749736,"Pittsburgh","Clemson",4,4,0,0,-3,400915404,2017-01-28
80,1,"7:21",1641,1641,"Michael Young missed Three Point Jumper.",21,18,3,0.489308269171292,"Pittsburgh","Clemson",4,4,0,0,-3,400915404,2017-01-28
81,1,"7:21",1641,1641,"Avry Holmes Defensive Rebound.",21,18,3,0.489308269171292,"Pittsburgh","Clemson",4,4,0,0,-3,400915404,2017-01-28
82,1,"7:13",1633,1633,"Shelton Mitchell made Layup.",21,20,1,0.427528852828307,"Pittsburgh","Clemson",4,4,0,0,-3,400915404,2017-01-28
83,1,"6:47",1607,1607,"Michael Young Turnover.",21,20,1,0.39779986405201,"Pittsburgh","Clemson",4,4,0,0,-3,400915404,2017-01-28
84,1,"6:47",1607,1607,"Foul on Michael Young.",21,20,1,0.39779986405201,"Pittsburgh","Clemson",4,4,0,0,-3,400915404,2017-01-28
85,1,"6:46",1606,1606,"Official TV Timeout",21,20,1,0.39779986405201,"Pittsburgh","Clemson",4,4,0,0,-3,400915404,2017-01-28
86,1,"6:37",1597,1597,"Foul on Rozelle Nix.",21,20,1,0.438176108062756,"Pittsburgh","Clemson",4,4,0,0,-3,400915404,2017-01-28
87,1,"6:37",1597,1597,"Jaron Blossomgame made Free Throw.",21,21,0,0.405255784171429,"Pittsburgh","Clemson",4,4,0,0,-3,400915404,2017-01-28
88,1,"6:37",1597,1597,"Jaron Blossomgame missed Free Throw.",21,21,0,0.405255784171429,"Pittsburgh","Clemson",4,4,0,0,-3,400915404,2017-01-28
89,1,"6:37",1597,1597,"Michael Young Defensive Rebound.",21,21,0,0.405255784171429,"Pittsburgh","Clemson",4,4,0,0,-3,400915404,2017-01-28
90,1,"6:09",1569,1569,"Cameron Johnson missed Jumper.",21,21,0,0.369095421225327,"Pittsburgh","Clemson",4,4,0,0,-3,400915404,2017-01-28
91,1,"6:09",1569,1569,"Jamel Artis Offensive Rebound.",21,21,0,0.369095421225327,"Pittsburgh","Clemson",4,4,0,0,-3,400915404,2017-01-28
92,1,"6:06",1566,1566,"Jamel Artis made Layup.",23,21,2,0.437482137140104,"Pittsburgh","Clemson",4,4,0,0,-3,400915404,2017-01-28
93,1,"5:57",1557,1557,"Gabe DeVoe made Three Point Jumper.",23,24,-1,0.345249027665755,"Pittsburgh","Clemson",4,4,0,0,-3,400915404,2017-01-28
94,1,"5:35",1535,1535,"Jamel Artis made Layup. Assisted by Sheldon Jeter.",25,24,1,0.41715818228899,"Pittsburgh","Clemson",4,4,0,0,-3,400915404,2017-01-28
95,1,"5:15",1515,1515,"Shelton Mitchell made Jumper.",25,26,-1,0.36814011657253,"Pittsburgh","Clemson",4,4,0,0,-3,400915404,2017-01-28
96,1,"5:07",1507,1507,"Cameron Johnson made Layup. Assisted by Jamel Artis.",27,26,1,0.417102268833662,"Pittsburgh","Clemson",4,4,0,0,-3,400915404,2017-01-28
97,1,"4:59",1499,1499,"Clemson  Timeout",27,26,1,0.441874282613063,"Pittsburgh","Clemson",3,4,1,0,-3,400915404,2017-01-28
98,1,"4:41",1481,1481,"Jaron Blossomgame made Jumper.",27,28,-1,0.33972550287793,"Pittsburgh","Clemson",3,4,1,0,-3,400915404,2017-01-28
99,1,"4:14",1454,1454,"Michael Young made Three Point Jumper. Assisted by Sheldon Jeter.",30,28,2,0.442406701902247,"Pittsburgh","Clemson",3,4,1,0,-3,400915404,2017-01-28
100,1,"3:55",1435,1435,"Donte Grantham Turnover.",30,28,2,0.481124992579404,"Pittsburgh","Clemson",3,4,0,0,-3,400915404,2017-01-28
101,1,"3:55",1435,1435,"Official TV Timeout",30,28,2,0.481124992579404,"Pittsburgh","Clemson",3,4,0,0,-3,400915404,2017-01-28
102,1,"3:36",1416,1416,"Cameron Johnson made Three Point Jumper. Assisted by Sheldon Jeter.",33,28,5,0.58341188746319,"Pittsburgh","Clemson",3,4,0,0,-3,400915404,2017-01-28
103,1,"3:13",1393,1393,"Gabe DeVoe Turnover.",33,28,5,0.554933236821016,"Pittsburgh","Clemson",3,4,0,0,-3,400915404,2017-01-28
104,1,"3:12",1392,1392,"Michael Young Steal.",33,28,5,0.554933236821016,"Pittsburgh","Clemson",3,4,0,0,-3,400915404,2017-01-28
105,1,"2:52",1372,1372,"Sheldon Jeter missed Three Point Jumper.",33,28,5,0.550130331039806,"Pittsburgh","Clemson",3,4,0,0,-3,400915404,2017-01-28
106,1,"2:52",1372,1372,"Elijah Thomas Defensive Rebound.",33,28,5,0.550130331039806,"Pittsburgh","Clemson",3,4,0,0,-3,400915404,2017-01-28
107,1,"2:31",1351,1351,"Gabe DeVoe Turnover.",33,28,5,0.596567516199636,"Pittsburgh","Clemson",3,4,0,0,-3,400915404,2017-01-28
108,1,"2:08",1328,1328,"Michael Young missed Three Point Jumper.",33,28,5,0.584594423623928,"Pittsburgh","Clemson",3,4,0,0,-3,400915404,2017-01-28
109,1,"2:08",1328,1328,"Donte Grantham Defensive Rebound.",33,28,5,0.584594423623928,"Pittsburgh","Clemson",3,4,0,0,-3,400915404,2017-01-28
110,1,"1:50",1310,1310,"Avry Holmes missed Three Point Jumper.",33,28,5,0.608779604074141,"Pittsburgh","Clemson",3,4,0,0,-3,400915404,2017-01-28
111,1,"1:50",1310,1310,"Sheldon Jeter Defensive Rebound.",33,28,5,0.608779604074141,"Pittsburgh","Clemson",3,4,0,0,-3,400915404,2017-01-28
112,1,"1:42",1302,1302,"Michael Young missed Layup.",33,28,5,0.589884940579769,"Pittsburgh","Clemson",3,4,0,0,-3,400915404,2017-01-28
113,1,"1:42",1302,1302,"Michael Young Offensive Rebound.",33,28,5,0.589884940579769,"Pittsburgh","Clemson",3,4,0,0,-3,400915404,2017-01-28
114,1,"1:21",1281,1281,"Chris Jones Turnover.",33,28,5,0.569813168942526,"Pittsburgh","Clemson",3,4,0,0,-3,400915404,2017-01-28
115,1,"1:19",1279,1279,"Donte Grantham Steal.",33,28,5,0.559247551515642,"Pittsburgh","Clemson",3,4,0,0,-3,400915404,2017-01-28
116,1,"1:17",1277,1277,"Foul on Justice Kithcart.",33,28,5,0.559247551515642,"Pittsburgh","Clemson",3,4,0,0,-3,400915404,2017-01-28
117,1,"1:17",1277,1277,"Avry Holmes made Free Throw.",33,29,4,0.522053172891681,"Pittsburgh","Clemson",3,4,0,0,-3,400915404,2017-01-28
118,1,"1:17",1277,1277,"Avry Holmes missed Free Throw.",33,29,4,0.522053172891681,"Pittsburgh","Clemson",3,4,0,0,-3,400915404,2017-01-28
119,1,"1:17",1277,1277,"Michael Young Defensive Rebound.",33,29,4,0.522053172891681,"Pittsburgh","Clemson",3,4,0,0,-3,400915404,2017-01-28
120,1,"0:59",1259,1259,"Michael Young missed Three Point Jumper.",33,29,4,0.552030013975479,"Pittsburgh","Clemson",3,4,0,0,-3,400915404,2017-01-28
121,1,"0:59",1259,1259,"Donte Grantham Defensive Rebound.",33,29,4,0.552030013975479,"Pittsburgh","Clemson",3,4,0,0,-3,400915404,2017-01-28
122,1,"0:49",1249,1249,"Foul on Cameron Johnson.",33,29,4,0.542820053299768,"Pittsburgh","Clemson",3,4,0,1,-3,400915404,2017-01-28
123,1,"0:49",1249,1249,"Shelton Mitchell made Free Throw.",33,30,3,0.504214420709619,"Pittsburgh","Clemson",3,4,0,1,-3,400915404,2017-01-28
124,1,"0:49",1249,1249,"Pittsburgh  Timeout",33,30,3,0.504214420709619,"Pittsburgh","Clemson",3,3,0,1,-3,400915404,2017-01-28
125,1,"0:49",1249,1249,"Shelton Mitchell made Free Throw.",33,31,2,0.4655584698422,"Pittsburgh","Clemson",3,3,0,1,-3,400915404,2017-01-28
126,1,"0:37",1237,1237,"Michael Young missed Three Point Jumper.",33,31,2,0.47162425551244,"Pittsburgh","Clemson",3,3,0,1,-3,400915404,2017-01-28
127,1,"0:37",1237,1237,"Sheldon Jeter Offensive Rebound.",33,31,2,0.47162425551244,"Pittsburgh","Clemson",3,3,0,1,-3,400915404,2017-01-28
128,1,"0:04",1204,1204,"Jamel Artis made Three Point Jumper.",36,31,5,0.590309850211896,"Pittsburgh","Clemson",3,3,0,1,-3,400915404,2017-01-28
129,1,"0:00",1200,1200,"End of 1st half",36,31,5,0.590309850211896,"Pittsburgh","Clemson",3,3,0,1,-3,400915404,2017-01-28
130,2,"20:00",1200,1200,"PLAY",36,31,5,0.590309850211896,"Pittsburgh","Clemson",4,4,0,0,-3,400915404,2017-01-28
131,2,"19:38",1178,1178,"Sheldon Jeter missed Three Point Jumper.",36,31,5,0.607425846903355,"Pittsburgh","Clemson",4,4,0,0,-3,400915404,2017-01-28
132,2,"19:38",1178,1178,"Elijah Thomas Defensive Rebound.",36,31,5,0.607425846903355,"Pittsburgh","Clemson",4,4,0,0,-3,400915404,2017-01-28
133,2,"19:16",1156,1156,"Jaron Blossomgame made Three Point Jumper. Assisted by Shelton Mitchell.",36,34,2,0.4876768892704,"Pittsburgh","Clemson",4,4,0,0,-3,400915404,2017-01-28
134,2,"18:57",1137,1137,"Foul on Avry Holmes.",36,34,2,0.480262574134992,"Pittsburgh","Clemson",4,4,0,0,-3,400915404,2017-01-28
135,2,"18:41",1121,1121,"Jamel Artis missed Three Point Jumper.",36,34,2,0.483621727385538,"Pittsburgh","Clemson",4,4,0,0,-3,400915404,2017-01-28
136,2,"18:41",1121,1121,"Donte Grantham Defensive Rebound.",36,34,2,0.483621727385538,"Pittsburgh","Clemson",4,4,0,0,-3,400915404,2017-01-28
137,2,"18:31",1111,1111,"Shelton Mitchell made Layup.",36,36,0,0.414996882612034,"Pittsburgh","Clemson",4,4,0,0,-3,400915404,2017-01-28
138,2,"18:31",1111,1111,"Foul on Michael Young.",36,36,0,0.414996882612034,"Pittsburgh","Clemson",4,4,0,0,-3,400915404,2017-01-28
139,2,"18:31",1111,1111,"Shelton Mitchell missed Free Throw.",36,36,0,0.414996882612034,"Pittsburgh","Clemson",4,4,0,0,-3,400915404,2017-01-28
140,2,"18:31",1111,1111,"Michael Young Defensive Rebound.",36,36,0,0.414996882612034,"Pittsburgh","Clemson",4,4,0,0,-3,400915404,2017-01-28
141,2,"18:09",1089,1089,"Sheldon Jeter Turnover.",36,36,0,0.387859165529185,"Pittsburgh","Clemson",4,4,0,0,-3,400915404,2017-01-28
142,2,"18:08",1088,1088,"Donte Grantham Steal.",36,36,0,0.387859165529185,"Pittsburgh","Clemson",4,4,0,0,-3,400915404,2017-01-28
143,2,"18:06",1086,1086,"Donte Grantham made Layup.",36,38,-2,0.307801598065827,"Pittsburgh","Clemson",4,4,0,0,-3,400915404,2017-01-28
144,2,"17:45",1065,1065,"Michael Young missed Jumper.",36,38,-2,0.348057218964847,"Pittsburgh","Clemson",4,4,0,0,-3,400915404,2017-01-28
145,2,"17:45",1065,1065,"Jaron Blossomgame Defensive Rebound.",36,38,-2,0.348057218964847,"Pittsburgh","Clemson",4,4,0,0,-3,400915404,2017-01-28
146,2,"17:20",1040,1040,"Marcquise Reed made Three Point Jumper. Assisted by Jaron Blossomgame.",36,41,-5,0.231108781930354,"Pittsburgh","Clemson",4,4,0,0,-3,400915404,2017-01-28
147,2,"17:18",1038,1038,"Pittsburgh  Timeout",36,41,-5,0.21606515094265,"Pittsburgh","Clemson",4,3,0,1,-3,400915404,2017-01-28
148,2,"17:08",1028,1028,"Chris Jones Turnover.",36,41,-5,0.223532187265435,"Pittsburgh","Clemson",4,3,0,1,-3,400915404,2017-01-28
149,2,"17:06",1026,1026,"Avry Holmes Steal.",36,41,-5,0.223532187265435,"Pittsburgh","Clemson",4,3,0,1,-3,400915404,2017-01-28
150,2,"16:53",1013,1013,"Elijah Thomas missed Layup.",36,41,-5,0.199593589480457,"Pittsburgh","Clemson",4,3,0,1,-3,400915404,2017-01-28
151,2,"16:53",1013,1013,"Jaron Blossomgame Offensive Rebound.",36,41,-5,0.199593589480457,"Pittsburgh","Clemson",4,3,0,1,-3,400915404,2017-01-28
152,2,"16:50",1010,1010,"Jaron Blossomgame made Layup.",36,43,-7,0.147524647804579,"Pittsburgh","Clemson",4,3,0,1,-3,400915404,2017-01-28
153,2,"16:20",980,980,"Jamel Artis made Jumper. Assisted by Sheldon Jeter.",38,43,-5,0.220523810622252,"Pittsburgh","Clemson",4,3,0,1,-3,400915404,2017-01-28
154,2,"15:59",959,959,"Elijah Thomas made Dunk. Assisted by Marcquise Reed.",38,45,-7,0.139983225302054,"Pittsburgh","Clemson",4,3,0,0,-3,400915404,2017-01-28
155,2,"15:49",949,949,"Foul on Elijah Thomas.",38,45,-7,0.160156577529746,"Pittsburgh","Clemson",4,3,0,0,-3,400915404,2017-01-28
156,2,"15:49",949,949,"Official TV Timeout",38,45,-7,0.160156577529746,"Pittsburgh","Clemson",4,3,0,0,-3,400915404,2017-01-28
157,2,"15:49",949,949,"Cameron Johnson made Free Throw.",39,45,-6,0.187659406839723,"Pittsburgh","Clemson",4,3,0,0,-3,400915404,2017-01-28
158,2,"15:49",949,949,"Cameron Johnson made Free Throw.",40,45,-5,0.218655526042062,"Pittsburgh","Clemson",4,3,0,0,-3,400915404,2017-01-28
159,2,"15:36",936,936,"Elijah Thomas missed Layup.",40,45,-5,0.210282600928937,"Pittsburgh","Clemson",4,3,0,0,-3,400915404,2017-01-28
160,2,"15:36",936,936,"Rozelle Nix Defensive Rebound.",40,45,-5,0.210282600928937,"Pittsburgh","Clemson",4,3,0,0,-3,400915404,2017-01-28
161,2,"15:15",915,915,"Rozelle Nix missed Jumper.",40,45,-5,0.196736038651115,"Pittsburgh","Clemson",4,3,0,0,-3,400915404,2017-01-28
162,2,"15:15",915,915,"Shelton Mitchell Defensive Rebound.",40,45,-5,0.196736038651115,"Pittsburgh","Clemson",4,3,0,0,-3,400915404,2017-01-28
163,2,"15:08",908,908,"Jaron Blossomgame made Three Point Jumper. Assisted by Shelton Mitchell.",40,48,-8,0.131851312368199,"Pittsburgh","Clemson",4,3,0,0,-3,400915404,2017-01-28
164,2,"14:33",873,873,"Corey Manigault missed Three Point Jumper.",40,48,-8,0.1315255452476,"Pittsburgh","Clemson",4,3,0,0,-3,400915404,2017-01-28
165,2,"14:33",873,873,"Shelton Mitchell Defensive Rebound.",40,48,-8,0.1315255452476,"Pittsburgh","Clemson",4,3,0,0,-3,400915404,2017-01-28
166,2,"14:22",862,862,"Marcquise Reed made Jumper.",40,50,-10,0.0878721893696754,"Pittsburgh","Clemson",4,3,0,0,-3,400915404,2017-01-28
167,2,"14:01",841,841,"Foul on Marcquise Reed.",40,50,-10,0.0777645513878659,"Pittsburgh","Clemson",4,3,0,0,-3,400915404,2017-01-28
168,2,"13:43",823,823,"Sheldon Jeter missed Layup.",40,50,-10,0.0939003271616569,"Pittsburgh","Clemson",4,3,0,0,-3,400915404,2017-01-28
169,2,"13:43",823,823,"Gabe DeVoe Block.",40,50,-10,0.0939003271616569,"Pittsburgh","Clemson",4,3,0,0,-3,400915404,2017-01-28
170,2,"13:43",823,823,"Pittsburgh Offensive Rebound.",40,50,-10,0.0939003271616569,"Pittsburgh","Clemson",4,3,0,0,-3,400915404,2017-01-28
171,2,"13:32",812,812,"Sheldon Jeter missed Three Point Jumper.",40,50,-10,0.0805013755122481,"Pittsburgh","Clemson",4,3,0,0,-3,400915404,2017-01-28
172,2,"13:32",812,812,"Jamel Artis Offensive Rebound.",40,50,-10,0.0805013755122481,"Pittsburgh","Clemson",4,3,0,0,-3,400915404,2017-01-28
173,2,"13:29",809,809,"Jamel Artis missed Jumper.",40,50,-10,0.0879703905789268,"Pittsburgh","Clemson",4,3,0,0,-3,400915404,2017-01-28
174,2,"13:29",809,809,"Jaron Blossomgame Defensive Rebound.",40,50,-10,0.0879703905789268,"Pittsburgh","Clemson",4,3,0,0,-3,400915404,2017-01-28
175,2,"13:07",787,787,"Avry Holmes missed Three Point Jumper.",40,50,-10,0.0811228288804803,"Pittsburgh","Clemson",4,3,0,0,-3,400915404,2017-01-28
176,2,"13:07",787,787,"Chris Jones Defensive Rebound.",40,50,-10,0.0811228288804803,"Pittsburgh","Clemson",4,3,0,0,-3,400915404,2017-01-28
177,2,"13:06",786,786,"Foul on Legend Robertin.",40,50,-10,0.0811228288804803,"Pittsburgh","Clemson",4,3,0,0,-3,400915404,2017-01-28
178,2,"12:46",766,766,"Jamel Artis missed Layup.",40,50,-10,0.0785373896096648,"Pittsburgh","Clemson",4,3,0,0,-3,400915404,2017-01-28
179,2,"12:46",766,766,"Cameron Johnson Offensive Rebound.",40,50,-10,0.0785373896096648,"Pittsburgh","Clemson",4,3,0,0,-3,400915404,2017-01-28
180,2,"12:45",765,765,"Foul on Shelton Mitchell.",40,50,-10,0.0785373896096648,"Pittsburgh","Clemson",4,3,0,0,-3,400915404,2017-01-28
181,2,"12:45",765,765,"Cameron Johnson made Free Throw.",41,50,-9,0.095653407225641,"Pittsburgh","Clemson",4,3,0,0,-3,400915404,2017-01-28
182,2,"12:45",765,765,"Cameron Johnson made Free Throw.",42,50,-8,0.116029897286501,"Pittsburgh","Clemson",4,3,0,0,-3,400915404,2017-01-28
183,2,"12:18",738,738,"Shelton Mitchell missed Layup.",42,50,-8,0.123823324999049,"Pittsburgh","Clemson",4,3,0,0,-3,400915404,2017-01-28
184,2,"12:18",738,738,"Sheldon Jeter Defensive Rebound.",42,50,-8,0.123823324999049,"Pittsburgh","Clemson",4,3,0,0,-3,400915404,2017-01-28
