"play_id","half","time_remaining_half","secs_remaining","secs_remaining_absolute","description","home_score","away_score","score_diff","win_prob","home","away","home_time_out_remaining","away_time_out_remaining","home_timeout_ind","away_timeout_ind","home_favored_by","game_id","date"
196,2,"16:52",1012,1012,"Tyrique Jones made Layup.",38,38,0,0.323843323387476,"DePaul","Xavier",4,4,0,0,-5,400919744,2017-03-04
197,2,"16:33",993,993,"Foul on Kaiser Gates.",38,38,0,0.328920677963657,"DePaul","Xavier",4,4,0,0,-5,400919744,2017-03-04
198,2,"16:33",993,993,"Eli Cain made Free Throw.",39,38,1,0.36945073403194,"DePaul","Xavier",4,4,0,0,-5,400919744,2017-03-04
199,2,"16:33",993,993,"Eli Cain made Free Throw.",40,38,2,0.411909530399575,"DePaul","Xavier",4,4,0,0,-5,400919744,2017-03-04
200,2,"16:15",975,975,"Tyrique Jones made Dunk.",40,40,0,0.350925455499398,"DePaul","Xavier",4,4,0,0,-5,400919744,2017-03-04
201,2,"15:47",947,947,"Brandon Cyrus missed Three Point Jumper.",40,40,0,0.358890821929796,"DePaul","Xavier",4,4,0,0,-5,400919744,2017-03-04
202,2,"15:47",947,947,"Malcolm Bernard Defensive Rebound.",40,40,0,0.358890821929796,"DePaul","Xavier",4,4,0,0,-5,400919744,2017-03-04
203,2,"15:41",941,941,"Trevon Bluiett missed Layup.",40,40,0,0.358890821929796,"DePaul","Xavier",4,4,0,0,-5,400919744,2017-03-04
204,2,"15:41",941,941,"Kaiser Gates Offensive Rebound.",40,40,0,0.358890821929796,"DePaul","Xavier",4,4,0,0,-5,400919744,2017-03-04
205,2,"15:39",939,939,"Kaiser Gates made Layup.",40,42,-2,0.268511106266936,"DePaul","Xavier",4,4,0,0,-5,400919744,2017-03-04
206,2,"15:10",910,910,"Tre'Darius McCallum missed Three Point Jumper.",40,42,-2,0.250267033066886,"DePaul","Xavier",4,4,0,0,-5,400919744,2017-03-04
207,2,"15:10",910,910,"Brandon Cyrus Offensive Rebound.",40,42,-2,0.250267033066886,"DePaul","Xavier",4,4,0,0,-5,400919744,2017-03-04
208,2,"15:07",907,907,"Foul on Trevon Bluiett.",40,42,-2,0.272192717530309,"DePaul","Xavier",4,4,0,0,-5,400919744,2017-03-04
209,2,"15:07",907,907,"Official TV Timeout",40,42,-2,0.272192717530309,"DePaul","Xavier",4,4,0,0,-5,400919744,2017-03-04
210,2,"15:07",907,907,"Brandon Cyrus missed Free Throw.",40,42,-2,0.272192717530309,"DePaul","Xavier",4,4,0,0,-5,400919744,2017-03-04
211,2,"15:07",907,907,"DePaul Deadball Team Rebound.",40,42,-2,0.272192717530309,"DePaul","Xavier",4,4,0,0,-5,400919744,2017-03-04
212,2,"15:07",907,907,"Brandon Cyrus made Free Throw.",41,42,-1,0.311695369649729,"DePaul","Xavier",4,4,0,0,-5,400919744,2017-03-04
213,2,"14:55",895,895,"Foul on Chris Harrison-Docks.",41,42,-1,0.320993283933099,"DePaul","Xavier",4,4,0,0,-5,400919744,2017-03-04
214,2,"14:45",885,885,"Foul on Brandon Cyrus.",41,42,-1,0.309412216367141,"DePaul","Xavier",4,4,0,0,-5,400919744,2017-03-04
215,2,"14:42",882,882,"Malcolm Bernard made Jumper.",41,44,-3,0.240383632522829,"DePaul","Xavier",4,4,0,0,-5,400919744,2017-03-04
216,2,"14:42",882,882,"Foul on Levi Cook.",41,44,-3,0.240383632522829,"DePaul","Xavier",4,4,0,0,-5,400919744,2017-03-04
217,2,"14:42",882,882,"Malcolm Bernard missed Free Throw.",41,44,-3,0.240383632522829,"DePaul","Xavier",4,4,0,0,-5,400919744,2017-03-04
218,2,"14:42",882,882,"Billy Garrett Jr. Defensive Rebound.",41,44,-3,0.240383632522829,"DePaul","Xavier",4,4,0,0,-5,400919744,2017-03-04
219,2,"14:25",865,865,"Billy Garrett Jr. Turnover.",41,44,-3,0.221555127195743,"DePaul","Xavier",4,4,0,0,-5,400919744,2017-03-04
220,2,"13:58",838,838,"Trevon Bluiett missed Three Point Jumper.",41,44,-3,0.211989220187432,"DePaul","Xavier",4,4,0,0,-5,400919744,2017-03-04
221,2,"13:58",838,838,"Eli Cain Defensive Rebound.",41,44,-3,0.211989220187432,"DePaul","Xavier",4,4,0,0,-5,400919744,2017-03-04
222,2,"13:52",832,832,"Foul on Malcolm Bernard.",41,44,-3,0.211989220187432,"DePaul","Xavier",4,4,0,0,-5,400919744,2017-03-04
223,2,"13:52",832,832,"Billy Garrett Jr. made Free Throw.",42,44,-2,0.248481996798248,"DePaul","Xavier",4,4,0,0,-5,400919744,2017-03-04
224,2,"13:52",832,832,"Billy Garrett Jr. made Free Throw.",43,44,-1,0.288953265331439,"DePaul","Xavier",4,4,0,0,-5,400919744,2017-03-04
225,2,"13:32",812,812,"Kaiser Gates missed Three Point Jumper.",43,44,-1,0.280758955408355,"DePaul","Xavier",4,4,0,0,-5,400919744,2017-03-04
226,2,"13:32",812,812,"Malcolm Bernard Offensive Rebound.",43,44,-1,0.280758955408355,"DePaul","Xavier",4,4,0,0,-5,400919744,2017-03-04
227,2,"13:24",804,804,"J.P. Macura missed Jumper.",43,44,-1,0.317884181740453,"DePaul","Xavier",4,4,0,0,-5,400919744,2017-03-04
228,2,"13:24",804,804,"Billy Garrett Jr. Defensive Rebound.",43,44,-1,0.317884181740453,"DePaul","Xavier",4,4,0,0,-5,400919744,2017-03-04
229,2,"13:17",797,797,"Foul on Malcolm Bernard.",43,44,-1,0.299977325470429,"DePaul","Xavier",4,4,0,0,-5,400919744,2017-03-04
230,2,"13:17",797,797,"Eli Cain made Free Throw.",44,44,0,0.348045781385337,"DePaul","Xavier",4,4,0,0,-5,400919744,2017-03-04
231,2,"13:17",797,797,"Eli Cain made Free Throw.",45,44,1,0.399421814773688,"DePaul","Xavier",4,4,0,0,-5,400919744,2017-03-04
232,2,"12:47",767,767,"Kaiser Gates missed Layup.",45,44,1,0.414849172481573,"DePaul","Xavier",4,4,0,0,-5,400919744,2017-03-04
233,2,"12:40",760,760,"Kaiser Gates Offensive Rebound.",45,44,1,0.414849172481573,"DePaul","Xavier",4,4,0,0,-5,400919744,2017-03-04
234,2,"12:39",759,759,"Kaiser Gates made Layup.",45,46,-1,0.300178676656435,"DePaul","Xavier",4,4,0,0,-5,400919744,2017-03-04
235,2,"12:26",746,746,"Eli Cain missed Three Point Jumper.",45,46,-1,0.29609947736703,"DePaul","Xavier",4,4,0,0,-5,400919744,2017-03-04
236,2,"12:26",746,746,"Edmond Sumner Defensive Rebound.",45,46,-1,0.29609947736703,"DePaul","Xavier",4,4,0,0,-5,400919744,2017-03-04
237,2,"12:21",741,741,"Foul on Tre'Darius McCallum.",45,46,-1,0.29609947736703,"DePaul","Xavier",4,4,0,0,-5,400919744,2017-03-04
238,2,"12:03",723,723,"Kaiser Gates missed Jumper.",45,46,-1,0.33817148986897,"DePaul","Xavier",4,4,0,0,-5,400919744,2017-03-04
239,2,"12:03",723,723,"Tre'Darius McCallum Defensive Rebound.",45,46,-1,0.33817148986897,"DePaul","Xavier",4,4,0,0,-5,400919744,2017-03-04
240,2,"12:03",723,723,"Billy Garrett Jr. Turnover.",45,46,-1,0.33817148986897,"DePaul","Xavier",4,4,0,0,-5,400919744,2017-03-04
241,2,"12:03",723,723,"J.P. Macura Steal.",45,46,-1,0.33817148986897,"DePaul","Xavier",4,4,0,0,-5,400919744,2017-03-04
242,2,"11:46",706,706,"Foul on Joe Hanel.",45,46,-1,0.341835157233631,"DePaul","Xavier",4,4,0,0,-5,400919744,2017-03-04
243,2,"11:46",706,706,"Official TV Timeout",45,46,-1,0.341835157233631,"DePaul","Xavier",4,4,0,0,-5,400919744,2017-03-04
244,2,"11:46",706,706,"Trevon Bluiett made Free Throw.",45,47,-2,0.295708342939861,"DePaul","Xavier",4,4,0,0,-5,400919744,2017-03-04
245,2,"11:46",706,706,"Trevon Bluiett made Free Throw.",45,48,-3,0.253409320367383,"DePaul","Xavier",4,4,0,0,-5,400919744,2017-03-04
246,2,"11:22",682,682,"Joe Hanel made Layup. Assisted by Tre'Darius McCallum.",47,48,-1,0.302722727198233,"DePaul","Xavier",4,4,0,0,-5,400919744,2017-03-04
247,2,"11:03",663,663,"RaShid Gaston made Layup. Assisted by Trevon Bluiett.",47,50,-3,0.250026977024028,"DePaul","Xavier",4,4,0,0,-5,400919744,2017-03-04
248,2,"10:56",656,656,"Billy Garrett Jr. made Layup.",49,50,-1,0.332943722484324,"DePaul","Xavier",4,4,0,0,-5,400919744,2017-03-04
249,2,"10:38",638,638,"Quentin Goodin Turnover.",49,50,-1,0.330285624872744,"DePaul","Xavier",4,4,0,0,-5,400919744,2017-03-04
250,2,"10:23",623,623,"Tre'Darius McCallum missed Layup.",49,50,-1,0.296862473878887,"DePaul","Xavier",4,4,0,0,-5,400919744,2017-03-04
251,2,"10:23",623,623,"RaShid Gaston Defensive Rebound.",49,50,-1,0.296862473878887,"DePaul","Xavier",4,4,0,0,-5,400919744,2017-03-04
252,2,"10:05",605,605,"Trevon Bluiett made Jumper.",49,52,-3,0.219454662142894,"DePaul","Xavier",4,4,0,0,-5,400919744,2017-03-04
253,2,"9:39",579,579,"Eli Cain missed Three Point Jumper.",49,52,-3,0.240335940784497,"DePaul","Xavier",4,4,0,0,-5,400919744,2017-03-04
254,2,"9:39",579,579,"RaShid Gaston Defensive Rebound.",49,52,-3,0.240335940784497,"DePaul","Xavier",4,4,0,0,-5,400919744,2017-03-04
255,2,"9:32",572,572,"J.P. Macura made Layup. Assisted by RaShid Gaston.",49,54,-5,0.160124122979839,"DePaul","Xavier",4,4,0,0,-5,400919744,2017-03-04
256,2,"9:10",550,550,"Tre'Darius McCallum missed Jumper.",49,54,-5,0.134797894287288,"DePaul","Xavier",4,4,0,0,-5,400919744,2017-03-04
257,2,"9:10",550,550,"Billy Garrett Jr. Offensive Rebound.",49,54,-5,0.134797894287288,"DePaul","Xavier",4,4,0,0,-5,400919744,2017-03-04
258,2,"9:02",542,542,"Eli Cain missed Layup.",49,54,-5,0.13070945856151,"DePaul","Xavier",4,4,0,0,-5,400919744,2017-03-04
259,2,"9:02",542,542,"Quentin Goodin Defensive Rebound.",49,54,-5,0.13070945856151,"DePaul","Xavier",4,4,0,0,-5,400919744,2017-03-04
260,2,"8:55",535,535,"Trevon Bluiett made Three Point Jumper. Assisted by J.P. Macura.",49,57,-8,0.0663209080273621,"DePaul","Xavier",4,4,0,0,-5,400919744,2017-03-04
261,2,"8:54",534,534,"DePaul  Timeout",49,57,-8,0.0663209080273621,"DePaul","Xavier",3,4,1,0,-5,400919744,2017-03-04
262,2,"8:32",512,512,"Foul on Quentin Goodin.",49,57,-8,0.0689341051670406,"DePaul","Xavier",3,4,1,0,-5,400919744,2017-03-04
263,2,"8:32",512,512,"Tre'Darius McCallum missed Free Throw.",49,57,-8,0.0689341051670406,"DePaul","Xavier",3,4,1,0,-5,400919744,2017-03-04
264,2,"8:32",512,512,"DePaul Deadball Team Rebound.",49,57,-8,0.0689341051670406,"DePaul","Xavier",3,4,1,0,-5,400919744,2017-03-04
265,2,"8:32",512,512,"Tre'Darius McCallum made Free Throw.",50,57,-7,0.0884557565207777,"DePaul","Xavier",3,4,1,0,-5,400919744,2017-03-04
266,2,"8:18",498,498,"Trevon Bluiett missed Jumper.",50,57,-7,0.0981023317149865,"DePaul","Xavier",3,4,1,0,-5,400919744,2017-03-04
267,2,"8:18",498,498,"Xavier Deadball Team Rebound.",50,57,-7,0.0981023317149865,"DePaul","Xavier",3,4,1,0,-5,400919744,2017-03-04
268,2,"8:17",497,497,"Foul on Levi Cook.",50,57,-7,0.0981023317149865,"DePaul","Xavier",3,4,1,0,-5,400919744,2017-03-04
269,2,"8:17",497,497,"Tyrique Jones missed Free Throw.",50,57,-7,0.0981023317149865,"DePaul","Xavier",3,4,1,0,-5,400919744,2017-03-04
270,2,"8:17",497,497,"Tre'Darius McCallum Defensive Rebound.",50,57,-7,0.0981023317149865,"DePaul","Xavier",3,4,1,0,-5,400919744,2017-03-04
271,2,"8:03",483,483,"Foul on Tyrique Jones.",50,57,-7,0.0849848936513174,"DePaul","Xavier",3,4,1,0,-5,400919744,2017-03-04
272,2,"8:03",483,483,"Joe Hanel missed Free Throw.",50,57,-7,0.0849848936513174,"DePaul","Xavier",3,4,1,0,-5,400919744,2017-03-04
273,2,"8:03",483,483,"DePaul Deadball Team Rebound.",50,57,-7,0.0849848936513174,"DePaul","Xavier",3,4,1,0,-5,400919744,2017-03-04
274,2,"8:03",483,483,"Joe Hanel made Free Throw.",51,57,-6,0.108798414871658,"DePaul","Xavier",3,4,1,0,-5,400919744,2017-03-04
275,2,"7:42",462,462,"J.P. Macura missed Layup.",51,57,-6,0.0994618022023016,"DePaul","Xavier",3,4,0,0,-5,400919744,2017-03-04
276,2,"7:42",462,462,"J.P. Macura Offensive Rebound.",51,57,-6,0.0994618022023016,"DePaul","Xavier",3,4,0,0,-5,400919744,2017-03-04
277,2,"7:41",461,461,"Official TV Timeout",51,57,-6,0.0994618022023016,"DePaul","Xavier",3,4,0,0,-5,400919744,2017-03-04
278,2,"7:36",456,456,"Trevon Bluiett made Jumper.",51,59,-8,0.0483442835551025,"DePaul","Xavier",3,4,0,0,-5,400919744,2017-03-04
279,2,"7:36",456,456,"Foul on Brandon Cyrus.",51,59,-8,0.0483442835551025,"DePaul","Xavier",3,4,0,0,-5,400919744,2017-03-04
280,2,"7:36",456,456,"Trevon Bluiett missed Free Throw.",51,59,-8,0.0483442835551025,"DePaul","Xavier",3,4,0,0,-5,400919744,2017-03-04
281,2,"7:36",456,456,"Billy Garrett Jr. Defensive Rebound.",51,59,-8,0.0483442835551025,"DePaul","Xavier",3,4,0,0,-5,400919744,2017-03-04
282,2,"7:04",424,424,"Chris Harrison-Docks made Three Point Jumper.",54,59,-5,0.122294056020752,"DePaul","Xavier",3,4,0,0,-5,400919744,2017-03-04
283,2,"6:42",402,402,"Trevon Bluiett made Three Point Jumper. Assisted by J.P. Macura.",54,62,-8,0.0419632778712081,"DePaul","Xavier",3,4,0,0,-5,400919744,2017-03-04
284,2,"6:15",375,375,"Chris Harrison-Docks missed Three Point Jumper.",54,62,-8,0.0476511082605418,"DePaul","Xavier",3,4,0,0,-5,400919744,2017-03-04
285,2,"6:15",375,375,"Joe Hanel Offensive Rebound.",54,62,-8,0.0476511082605418,"DePaul","Xavier",3,4,0,0,-5,400919744,2017-03-04
286,2,"6:14",374,374,"Foul on RaShid Gaston.",54,62,-8,0.0476511082605418,"DePaul","Xavier",3,4,0,0,-5,400919744,2017-03-04
287,2,"6:14",374,374,"Joe Hanel made Free Throw.",55,62,-7,0.0638427424250937,"DePaul","Xavier",3,4,0,0,-5,400919744,2017-03-04
288,2,"6:14",374,374,"Joe Hanel missed Free Throw.",55,62,-7,0.0638427424250937,"DePaul","Xavier",3,4,0,0,-5,400919744,2017-03-04
289,2,"6:14",374,374,"Trevon Bluiett Defensive Rebound.",55,62,-7,0.0638427424250937,"DePaul","Xavier",3,4,0,0,-5,400919744,2017-03-04
290,2,"5:58",358,358,"Trevon Bluiett missed Three Point Jumper.",55,62,-7,0.0462039306086701,"DePaul","Xavier",3,4,0,0,-5,400919744,2017-03-04
291,2,"5:58",358,358,"Malcolm Bernard Offensive Rebound.",55,62,-7,0.0462039306086701,"DePaul","Xavier",3,4,0,0,-5,400919744,2017-03-04
292,2,"5:40",340,340,"Malcolm Bernard made Three Point Jumper. Assisted by Quentin Goodin.",55,65,-10,0.0194826303180395,"DePaul","Xavier",3,4,0,0,-5,400919744,2017-03-04
293,2,"5:28",328,328,"Chris Harrison-Docks made Three Point Jumper.",58,65,-7,0.0595076433246099,"DePaul","Xavier",3,4,0,0,-5,400919744,2017-03-04
294,2,"5:28",328,328,"Foul on RaShid Gaston.",58,65,-7,0.0595076433246099,"DePaul","Xavier",3,4,0,0,-5,400919744,2017-03-04
295,2,"5:28",328,328,"Chris Harrison-Docks made Free Throw.",59,65,-6,0.0797032917779501,"DePaul","Xavier",3,4,0,0,-5,400919744,2017-03-04
296,2,"5:06",306,306,"Foul on Eli Cain.",59,65,-6,0.0863202496503107,"DePaul","Xavier",3,4,0,0,-5,400919744,2017-03-04
297,2,"5:06",306,306,"Trevon Bluiett made Free Throw.",59,66,-7,0.0630879661230099,"DePaul","Xavier",3,4,0,0,-5,400919744,2017-03-04
298,2,"5:06",306,306,"Trevon Bluiett made Free Throw.",59,67,-8,0.0457950357651828,"DePaul","Xavier",3,4,0,0,-5,400919744,2017-03-04
299,2,"4:47",287,287,"Billy Garrett Jr. made Jumper.",61,67,-6,0.0701088394806579,"DePaul","Xavier",3,4,0,0,-5,400919744,2017-03-04
300,2,"4:29",269,269,"J.P. Macura missed Three Point Jumper.",61,67,-6,0.0687590380215967,"DePaul","Xavier",3,4,0,0,-5,400919744,2017-03-04
301,2,"4:29",269,269,"Eli Cain Defensive Rebound.",61,67,-6,0.0687590380215967,"DePaul","Xavier",3,4,0,0,-5,400919744,2017-03-04
302,2,"4:00",240,240,"Chris Harrison-Docks missed Three Point Jumper.",61,67,-6,0.0572666650816054,"DePaul","Xavier",3,4,0,0,-5,400919744,2017-03-04
303,2,"4:00",240,240,"Xavier Defensive Rebound.",61,67,-6,0.0572666650816054,"DePaul","Xavier",3,4,0,0,-5,400919744,2017-03-04
304,2,"3:58",238,238,"Official TV Timeout",61,67,-6,0.0630682210891202,"DePaul","Xavier",3,4,0,0,-5,400919744,2017-03-04
305,2,"3:41",221,221,"Foul on Tre'Darius McCallum.",61,67,-6,0.0500230854066595,"DePaul","Xavier",3,4,0,0,-5,400919744,2017-03-04
306,2,"3:41",221,221,"Quentin Goodin made Free Throw.",61,68,-7,0.0333294370140512,"DePaul","Xavier",3,4,0,0,-5,400919744,2017-03-04
307,2,"3:41",221,221,"Quentin Goodin missed Free Throw.",61,68,-7,0.0333294370140512,"DePaul","Xavier",3,4,0,0,-5,400919744,2017-03-04
308,2,"3:41",221,221,"DePaul Defensive Rebound.",61,68,-7,0.0333294370140512,"DePaul","Xavier",3,4,0,0,-5,400919744,2017-03-04
309,2,"3:30",210,210,"Billy Garrett Jr. Turnover.",61,68,-7,0.0293003631918135,"DePaul","Xavier",3,4,0,0,-5,400919744,2017-03-04
310,2,"3:30",210,210,"Malcolm Bernard Steal.",61,68,-7,0.0293003631918135,"DePaul","Xavier",3,4,0,0,-5,400919744,2017-03-04
311,2,"3:11",191,191,"Tyrique Jones Turnover.",61,68,-7,0.0282008774905413,"DePaul","Xavier",3,4,0,0,-5,400919744,2017-03-04
312,2,"3:10",190,190,"Billy Garrett Jr. Steal.",61,68,-7,0.0282008774905413,"DePaul","Xavier",3,4,0,0,-5,400919744,2017-03-04
313,2,"2:58",178,178,"Joe Hanel Turnover.",61,68,-7,0.0252321623087543,"DePaul","Xavier",3,4,0,0,-5,400919744,2017-03-04
314,2,"2:57",177,177,"Malcolm Bernard Steal.",61,68,-7,0.0252321623087543,"DePaul","Xavier",3,4,0,0,-5,400919744,2017-03-04
315,2,"2:40",160,160,"Foul on Joe Hanel.",61,68,-7,0.0179052083560109,"DePaul","Xavier",3,4,0,0,-5,400919744,2017-03-04
316,2,"2:40",160,160,"Tyrique Jones missed Free Throw.",61,68,-7,0.0179052083560109,"DePaul","Xavier",3,4,0,0,-5,400919744,2017-03-04
317,2,"2:40",160,160,"Xavier Deadball Team Rebound.",61,68,-7,0.0179052083560109,"DePaul","Xavier",3,4,0,0,-5,400919744,2017-03-04
318,2,"2:40",160,160,"Tyrique Jones made Free Throw.",61,69,-8,0.0107887705441255,"DePaul","Xavier",3,4,0,0,-5,400919744,2017-03-04
319,2,"2:30",150,150,"Tre'Darius McCallum missed Layup.",61,69,-8,0.0105645429282647,"DePaul","Xavier",3,4,0,0,-5,400919744,2017-03-04
320,2,"2:30",150,150,"J.P. Macura Defensive Rebound.",61,69,-8,0.0105645429282647,"DePaul","Xavier",3,4,0,0,-5,400919744,2017-03-04
321,2,"2:05",125,125,"Xavier  Timeout",61,69,-8,0.0071144607140811,"DePaul","Xavier",3,3,0,1,-5,400919744,2017-03-04
322,2,"2:02",122,122,"Trevon Bluiett made Three Point Jumper. Assisted by Malcolm Bernard.",61,72,-11,0.00130791075406408,"DePaul","Xavier",3,3,0,1,-5,400919744,2017-03-04
323,2,"1:44",104,104,"Eli Cain missed Jumper.",61,72,-11,0.000696331751626075,"DePaul","Xavier",3,3,0,1,-5,400919744,2017-03-04
324,2,"1:44",104,104,"RaShid Gaston Defensive Rebound.",61,72,-11,0.000696331751626075,"DePaul","Xavier",3,3,0,1,-5,400919744,2017-03-04
325,2,"1:22",82,82,"J.P. Macura made Layup. Assisted by Quentin Goodin.",61,74,-13,7.82273123866615e-05,"DePaul","Xavier",3,3,0,1,-5,400919744,2017-03-04
326,2,"1:09",69,69,"Chris Harrison-Docks missed Three Point Jumper.",61,74,-13,4.90084164796613e-05,"DePaul","Xavier",3,3,0,1,-5,400919744,2017-03-04
327,2,"1:09",69,69,"Trevon Bluiett Defensive Rebound.",61,74,-13,4.90084164796613e-05,"DePaul","Xavier",3,3,0,1,-5,400919744,2017-03-04
328,2,"0:47",47,47,"Malcolm Bernard made Three Point Jumper. Assisted by Trevon Bluiett.",61,77,-16,4.60432568295023e-08,"DePaul","Xavier",3,3,0,0,-5,400919744,2017-03-04
329,2,"0:41",41,41,"Billy Garrett Jr. made Jumper.",63,77,-14,6.37508815169505e-07,"DePaul","Xavier",3,3,0,0,-5,400919744,2017-03-04
330,2,"0:36",36,36,"Foul on Chris Harrison-Docks.",63,77,-14,2.42848600871241e-06,"DePaul","Xavier",3,3,0,0,-5,400919744,2017-03-04
331,2,"0:36",36,36,"Malcolm Bernard made Free Throw.",63,78,-15,9.51204602712631e-07,"DePaul","Xavier",3,3,0,0,-5,400919744,2017-03-04
332,2,"0:36",36,36,"Malcolm Bernard made Free Throw.",63,79,-16,3.72573438712106e-07,"DePaul","Xavier",3,3,0,0,-5,400919744,2017-03-04
333,2,"0:23",23,23,"Eli Cain made Jumper.",65,79,-14,9.61943307061261e-08,"DePaul","Xavier",3,3,0,1,-5,400919744,2017-03-04
334,2,"0:23",23,23,"Xavier  Timeout",65,79,-14,9.61943307061261e-08,"DePaul","Xavier",3,2,0,1,-5,400919744,2017-03-04
335,2,"0:00",0,0,"End of 2nd half",65,79,-14,2.22056916465249e-118,"DePaul","Xavier",3,2,0,1,-5,400919744,2017-03-04
336,2,"0:00",0,0,"End of Game",65,79,-14,2.22056916465249e-118,"DePaul","Xavier",3,2,0,1,-5,400919744,2017-03-04
