"play_id","half","time_remaining_half","secs_remaining","secs_remaining_absolute","description","home_score","away_score","score_diff","win_prob","home","away","home_time_out_remaining","away_time_out_remaining","home_timeout_ind","away_timeout_ind","home_favored_by","game_id","date"
190,2,"12:06",726,726,"Foul on De'Monte Buckingham.",60,41,19,0.994312045949691,"TCU","Richmond",3,4,0,0,7.5,400947326,2017-03-21
191,2,"11:50",710,710,"Foul on Nick Sherod.",60,41,19,0.99365524757902,"TCU","Richmond",3,4,0,0,7.5,400947326,2017-03-21
192,2,"11:50",710,710,"Official TV Timeout",60,41,19,0.99365524757902,"TCU","Richmond",3,4,0,0,7.5,400947326,2017-03-21
193,2,"11:50",710,710,"Vladimir Brodziansky made Free Throw.",61,41,20,0.994896573404707,"TCU","Richmond",3,4,0,0,7.5,400947326,2017-03-21
194,2,"11:50",710,710,"Vladimir Brodziansky made Free Throw.",62,41,21,0.995896041774421,"TCU","Richmond",3,4,0,0,7.5,400947326,2017-03-21
195,2,"11:30",690,690,"Foul on Desmond Bane.",62,41,21,0.997561301549127,"TCU","Richmond",3,4,0,0,7.5,400947326,2017-03-21
196,2,"11:30",690,690,"ShawnDre' Jones made Free Throw.",62,42,20,0.996909009899094,"TCU","Richmond",3,4,0,0,7.5,400947326,2017-03-21
197,2,"11:30",690,690,"ShawnDre' Jones made Free Throw.",62,43,19,0.99608293142003,"TCU","Richmond",3,4,0,0,7.5,400947326,2017-03-21
198,2,"11:15",675,675,"Alex Robinson missed Three Point Jumper.",62,43,19,0.995132096134205,"TCU","Richmond",3,4,0,0,7.5,400947326,2017-03-21
199,2,"11:15",675,675,"Alex Robinson Offensive Rebound.",62,43,19,0.995132096134205,"TCU","Richmond",3,4,0,0,7.5,400947326,2017-03-21
200,2,"11:10",670,670,"Alex Robinson made Jumper.",64,43,21,0.996936553633734,"TCU","Richmond",3,4,0,0,7.5,400947326,2017-03-21
201,2,"11:01",661,661,"T.J. Cline made Layup. Assisted by Khwan Fore.",64,45,19,0.994659343448802,"TCU","Richmond",3,4,0,0,7.5,400947326,2017-03-21
202,2,"10:45",645,645,"Chris Washburn made Dunk.",66,45,21,0.997347121641663,"TCU","Richmond",3,4,0,0,7.5,400947326,2017-03-21
203,2,"10:28",628,628,"Foul on Alex Robinson.",66,45,21,0.998061873915733,"TCU","Richmond",3,4,0,0,7.5,400947326,2017-03-21
204,2,"10:19",619,619,"T.J. Cline made Layup.",66,47,19,0.996277766898712,"TCU","Richmond",3,4,0,0,7.5,400947326,2017-03-21
205,2,"9:45",585,585,"Kenrich Williams missed Layup.",66,47,19,0.995515932271084,"TCU","Richmond",3,4,0,0,7.5,400947326,2017-03-21
206,2,"9:45",585,585,"Khwan Fore Block.",66,47,19,0.995515932271084,"TCU","Richmond",3,4,0,0,7.5,400947326,2017-03-21
207,2,"9:45",585,585,"Khwan Fore Defensive Rebound.",66,47,19,0.995515932271084,"TCU","Richmond",3,4,0,0,7.5,400947326,2017-03-21
208,2,"9:40",580,580,"Foul on Chris Washburn.",66,47,19,0.995515932271084,"TCU","Richmond",3,4,0,0,7.5,400947326,2017-03-21
209,2,"9:32",572,572,"De'Monte Buckingham made Three Point Jumper. Assisted by ShawnDre' Jones.",66,50,16,0.993366601796116,"TCU","Richmond",3,4,0,0,7.5,400947326,2017-03-21
210,2,"9:13",553,553,"TCU  Timeout",66,50,16,0.993238567864541,"TCU","Richmond",3,3,0,1,7.5,400947326,2017-03-21
211,2,"9:07",547,547,"Michael Williams made Three Point Jumper. Assisted by Vladimir Brodziansky.",69,50,19,0.997133077122072,"TCU","Richmond",3,3,0,1,7.5,400947326,2017-03-21
212,2,"8:44",524,524,"Khwan Fore missed Three Point Jumper.",69,50,19,0.997412038049193,"TCU","Richmond",3,3,0,1,7.5,400947326,2017-03-21
213,2,"8:44",524,524,"Michael Williams Defensive Rebound.",69,50,19,0.997412038049193,"TCU","Richmond",3,3,0,1,7.5,400947326,2017-03-21
214,2,"8:25",505,505,"Michael Williams made Layup. Assisted by Kenrich Williams.",71,50,21,0.998593630791629,"TCU","Richmond",3,3,0,1,7.5,400947326,2017-03-21
215,2,"8:12",492,492,"Foul on Vladimir Brodziansky.",71,50,21,0.998600545523818,"TCU","Richmond",3,3,0,0,7.5,400947326,2017-03-21
216,2,"8:08",488,488,"De'Monte Buckingham Turnover.",71,50,21,0.998573989006779,"TCU","Richmond",3,3,0,0,7.5,400947326,2017-03-21
217,2,"8:08",488,488,"Michael Williams Steal.",71,50,21,0.998573989006779,"TCU","Richmond",3,3,0,0,7.5,400947326,2017-03-21
218,2,"7:41",461,461,"Kenrich Williams missed Jumper.",71,50,21,0.998792080758186,"TCU","Richmond",3,3,0,0,7.5,400947326,2017-03-21
219,2,"7:41",461,461,"ShawnDre' Jones Defensive Rebound.",71,50,21,0.998792080758186,"TCU","Richmond",3,3,0,0,7.5,400947326,2017-03-21
220,2,"7:33",453,453,"ShawnDre' Jones missed Jumper.",71,50,21,0.999369397725617,"TCU","Richmond",3,3,0,0,7.5,400947326,2017-03-21
221,2,"7:33",453,453,"T.J. Cline Offensive Rebound.",71,50,21,0.999369397725617,"TCU","Richmond",3,3,0,0,7.5,400947326,2017-03-21
222,2,"7:27",447,447,"T.J. Cline made Layup.",71,52,19,0.997396711696378,"TCU","Richmond",3,3,0,0,7.5,400947326,2017-03-21
223,2,"7:07",427,427,"Official TV Timeout",71,52,19,0.998247720641228,"TCU","Richmond",3,3,0,0,7.5,400947326,2017-03-21
224,2,"7:03",423,423,"Foul on Vladimir Brodziansky.",71,52,19,0.998247720641228,"TCU","Richmond",3,3,0,0,7.5,400947326,2017-03-21
225,2,"7:03",423,423,"Vladimir Brodziansky Turnover.",71,52,19,0.998247720641228,"TCU","Richmond",3,3,0,0,7.5,400947326,2017-03-21
226,2,"6:48",408,408,"ShawnDre' Jones Turnover.",71,52,19,0.999067841651662,"TCU","Richmond",3,3,0,0,7.5,400947326,2017-03-21
227,2,"6:35",395,395,"Desmond Bane missed Layup.",71,52,19,0.998791657467532,"TCU","Richmond",3,3,0,0,7.5,400947326,2017-03-21
228,2,"6:35",395,395,"Vladimir Brodziansky Offensive Rebound.",71,52,19,0.998791657467532,"TCU","Richmond",3,3,0,0,7.5,400947326,2017-03-21
229,2,"6:32",392,392,"Vladimir Brodziansky missed Layup.",71,52,19,0.998791657467532,"TCU","Richmond",3,3,0,0,7.5,400947326,2017-03-21
230,2,"6:32",392,392,"Vladimir Brodziansky Offensive Rebound.",71,52,19,0.998791657467532,"TCU","Richmond",3,3,0,0,7.5,400947326,2017-03-21
231,2,"6:32",392,392,"Foul on Khwan Fore.",71,52,19,0.998791657467532,"TCU","Richmond",3,3,0,0,7.5,400947326,2017-03-21
232,2,"6:32",392,392,"Vladimir Brodziansky made Free Throw.",72,52,20,0.999115353184825,"TCU","Richmond",3,3,0,0,7.5,400947326,2017-03-21
233,2,"6:32",392,392,"Vladimir Brodziansky made Free Throw.",73,52,21,0.999352392199367,"TCU","Richmond",3,3,0,0,7.5,400947326,2017-03-21
234,2,"6:24",384,384,"Foul on Brandon Parrish.",73,52,21,0.999150210127428,"TCU","Richmond",3,3,0,0,7.5,400947326,2017-03-21
235,2,"6:24",384,384,"Khwan Fore missed Free Throw.",73,52,21,0.999150210127428,"TCU","Richmond",3,3,0,0,7.5,400947326,2017-03-21
236,2,"6:24",384,384,"Richmond Deadball Team Rebound.",73,52,21,0.999150210127428,"TCU","Richmond",3,3,0,0,7.5,400947326,2017-03-21
237,2,"6:24",384,384,"Khwan Fore made Free Throw.",73,53,20,0.998856167924153,"TCU","Richmond",3,3,0,0,7.5,400947326,2017-03-21
238,2,"6:12",372,372,"Karviar Shepherd made Jumper. Assisted by Kenrich Williams.",75,53,22,0.999464367367166,"TCU","Richmond",3,3,0,0,7.5,400947326,2017-03-21
239,2,"6:02",362,362,"T.J. Cline made Layup.",75,55,20,0.999220078278407,"TCU","Richmond",3,3,0,0,7.5,400947326,2017-03-21
240,2,"5:43",343,343,"Alex Robinson missed Jumper.",75,55,20,0.999323005690884,"TCU","Richmond",3,3,0,0,7.5,400947326,2017-03-21
241,2,"5:43",343,343,"Julius Johnson Defensive Rebound.",75,55,20,0.999323005690884,"TCU","Richmond",3,3,0,0,7.5,400947326,2017-03-21
242,2,"5:35",335,335,"ShawnDre' Jones missed Three Point Jumper.",75,55,20,0.999607604237774,"TCU","Richmond",3,3,0,0,7.5,400947326,2017-03-21
243,2,"5:35",335,335,"Karviar Shepherd Defensive Rebound.",75,55,20,0.999607604237774,"TCU","Richmond",3,3,0,0,7.5,400947326,2017-03-21
244,2,"5:20",320,320,"Karviar Shepherd made Jumper. Assisted by Kenrich Williams.",77,55,22,0.999526270268381,"TCU","Richmond",3,3,0,0,7.5,400947326,2017-03-21
245,2,"5:02",302,302,"T.J. Cline made Layup.",77,57,20,0.999402611944851,"TCU","Richmond",3,3,0,0,7.5,400947326,2017-03-21
246,2,"4:44",284,284,"Brandon Parrish missed Three Point Jumper.",77,57,20,0.999557531834177,"TCU","Richmond",3,3,0,0,7.5,400947326,2017-03-21
247,2,"4:44",284,284,"T.J. Cline Defensive Rebound.",77,57,20,0.999557531834177,"TCU","Richmond",3,3,0,0,7.5,400947326,2017-03-21
248,2,"4:34",274,274,"Khwan Fore made Layup.",77,59,18,0.999512555357394,"TCU","Richmond",3,3,0,0,7.5,400947326,2017-03-21
249,2,"4:30",270,270,"Richmond  Timeout",77,59,18,0.999512555357394,"TCU","Richmond",2,3,1,0,7.5,400947326,2017-03-21
250,2,"4:30",270,270,"Official TV Timeout",77,59,18,0.999512555357394,"TCU","Richmond",2,3,1,0,7.5,400947326,2017-03-21
251,2,"4:26",266,266,"Foul on Khwan Fore.",77,59,18,0.999390787825133,"TCU","Richmond",2,3,1,0,7.5,400947326,2017-03-21
252,2,"4:03",243,243,"Alex Robinson made Layup. Assisted by Kenrich Williams.",79,59,20,0.999833557124075,"TCU","Richmond",2,3,1,0,7.5,400947326,2017-03-21
253,2,"3:45",225,225,"ShawnDre' Jones missed Three Point Jumper.",79,59,20,0.99990376574023,"TCU","Richmond",2,3,1,0,7.5,400947326,2017-03-21
254,2,"3:45",225,225,"Nick Sherod Offensive Rebound.",79,59,20,0.99990376574023,"TCU","Richmond",2,3,1,0,7.5,400947326,2017-03-21
255,2,"3:40",220,220,"Joe Kirby missed Three Point Jumper.",79,59,20,0.99990376574023,"TCU","Richmond",2,3,1,0,7.5,400947326,2017-03-21
256,2,"3:40",220,220,"Vladimir Brodziansky Defensive Rebound.",79,59,20,0.99990376574023,"TCU","Richmond",2,3,1,0,7.5,400947326,2017-03-21
257,2,"3:26",206,206,"JD Miller made Dunk. Assisted by Vladimir Brodziansky.",81,59,22,0.999977507510256,"TCU","Richmond",2,3,0,0,7.5,400947326,2017-03-21
258,2,"3:12",192,192,"De'Monte Buckingham made Three Point Jumper. Assisted by Nick Sherod.",81,62,19,0.999913192015539,"TCU","Richmond",2,3,0,0,7.5,400947326,2017-03-21
259,2,"2:37",157,157,"Desmond Bane made Three Point Jumper. Assisted by Alex Robinson.",84,62,22,0.999996054526457,"TCU","Richmond",2,3,0,0,7.5,400947326,2017-03-21
260,2,"2:24",144,144,"Foul on Desmond Bane.",84,62,22,0.999993814472527,"TCU","Richmond",2,3,0,0,7.5,400947326,2017-03-21
261,2,"2:24",144,144,"T.J. Cline made Free Throw.",84,63,21,0.999989615113659,"TCU","Richmond",2,3,0,0,7.5,400947326,2017-03-21
262,2,"2:24",144,144,"T.J. Cline made Free Throw.",84,64,20,0.999982564856866,"TCU","Richmond",2,3,0,0,7.5,400947326,2017-03-21
263,2,"2:07",127,127,"Desmond Bane made Layup. Assisted by Kenrich Williams.",86,64,22,0.999997550111056,"TCU","Richmond",2,3,0,0,7.5,400947326,2017-03-21
264,2,"1:54",114,114,"T.J. Cline made Jumper. Assisted by Khwan Fore.",86,66,20,0.999996630164521,"TCU","Richmond",2,3,0,0,7.5,400947326,2017-03-21
265,2,"1:31",91,91,"Vladimir Brodziansky missed Jumper.",86,66,20,0.999997674403644,"TCU","Richmond",2,3,0,0,7.5,400947326,2017-03-21
266,2,"1:31",91,91,"Khwan Fore Defensive Rebound.",86,66,20,0.999997674403644,"TCU","Richmond",2,3,0,0,7.5,400947326,2017-03-21
267,2,"1:22",82,82,"Julius Johnson missed Three Point Jumper.",86,66,20,0.999999678911884,"TCU","Richmond",2,3,0,0,7.5,400947326,2017-03-21
268,2,"1:22",82,82,"Alex Robinson Defensive Rebound.",86,66,20,0.999999678911884,"TCU","Richmond",2,3,0,0,7.5,400947326,2017-03-21
269,2,"1:12",72,72,"Foul on Khwan Fore.",86,66,20,0.999999716618522,"TCU","Richmond",2,3,0,0,7.5,400947326,2017-03-21
270,2,"1:01",61,61,"Brandon Parrish missed Three Point Jumper.",86,66,20,0.999999697544355,"TCU","Richmond",2,3,0,0,7.5,400947326,2017-03-21
271,2,"1:01",61,61,"Richmond Defensive Rebound.",86,66,20,0.999999697544355,"TCU","Richmond",2,3,0,0,7.5,400947326,2017-03-21
272,2,"0:51",51,51,"De'Monte Buckingham missed Three Point Jumper.",86,66,20,0.999999991655824,"TCU","Richmond",2,3,0,0,7.5,400947326,2017-03-21
273,2,"0:51",51,51,"Alex Robinson Defensive Rebound.",86,66,20,0.999999991655824,"TCU","Richmond",2,3,0,0,7.5,400947326,2017-03-21
274,2,"0:37",37,37,"TCU  Timeout",86,66,20,0.99999999328092,"TCU","Richmond",2,2,0,1,7.5,400947326,2017-03-21
275,2,"0:29",29,29,"JD Miller missed Three Point Jumper.",86,66,20,0.999999998417048,"TCU","Richmond",2,2,0,1,7.5,400947326,2017-03-21
276,2,"0:29",29,29,"De'Monte Buckingham Defensive Rebound.",86,66,20,0.999999998417048,"TCU","Richmond",2,2,0,1,7.5,400947326,2017-03-21
277,2,"0:22",22,22,"De'Monte Buckingham Turnover.",86,66,20,0.999999999997337,"TCU","Richmond",2,2,0,1,7.5,400947326,2017-03-21
278,2,"0:22",22,22,"JD Miller Steal.",86,66,20,0.999999999997337,"TCU","Richmond",2,2,0,1,7.5,400947326,2017-03-21
279,2,"0:17",17,17,"Dalton Dry missed Dunk.",86,66,20,0.999999999818879,"TCU","Richmond",2,2,0,1,7.5,400947326,2017-03-21
280,2,"0:17",17,17,"Joe Kirby Defensive Rebound.",86,66,20,0.999999999818879,"TCU","Richmond",2,2,0,1,7.5,400947326,2017-03-21
281,2,"0:08",8,8,"Joe Kirby made Jumper. Assisted by De'Monte Buckingham.",86,68,18,0.999999999999864,"TCU","Richmond",2,2,0,1,7.5,400947326,2017-03-21
282,2,"0:00",0,0,"End of Game",86,68,18,1,"TCU","Richmond",2,2,0,1,7.5,400947326,2017-03-21
