"play_id","half","time_remaining_half","secs_remaining","secs_remaining_absolute","description","home_score","away_score","score_diff","win_prob","home","away","home_time_out_remaining","away_time_out_remaining","home_timeout_ind","away_timeout_ind","home_favored_by","game_id","date"
1,1,"20:00",2400,2400,"PLAY",0,0,0,0.150219768484353,"UMass","Rhode Island",4,4,0,0,-9.5,400990096,2018-01-30
2,1,"20:00",2400,2400,"Jump Ball won by UMass",0,0,0,0.150219768484353,"UMass","Rhode Island",4,4,0,0,-9.5,400990096,2018-01-30
3,1,"19:42",2382,2382,"Carl Pierre made Three Point Jumper. Assisted by Unique McLean.",3,0,3,0.169687271547642,"UMass","Rhode Island",4,4,0,0,-9.5,400990096,2018-01-30
4,1,"19:26",2366,2366,"Jared Terrell made Layup. Assisted by Stanford Robinson.",3,2,1,0.174409422115422,"UMass","Rhode Island",4,4,0,0,-9.5,400990096,2018-01-30
5,1,"19:04",2344,2344,"Carl Pierre made Layup. Assisted by Unique McLean.",5,2,3,0.211143985584161,"UMass","Rhode Island",4,4,0,0,-9.5,400990096,2018-01-30
6,1,"18:40",2320,2320,"Andre Berry made Layup. Assisted by E.C. Matthews.",5,4,1,0.200870224043068,"UMass","Rhode Island",4,4,0,0,-9.5,400990096,2018-01-30
7,1,"18:30",2310,2310,"Luwane Pipkins made Jumper.",7,4,3,0.219051210989624,"UMass","Rhode Island",4,4,0,0,-9.5,400990096,2018-01-30
8,1,"18:12",2292,2292,"Andre Berry made Jumper. Assisted by E.C. Matthews.",7,6,1,0.189413871726458,"UMass","Rhode Island",4,4,0,0,-9.5,400990096,2018-01-30
9,1,"17:48",2268,2268,"Luwane Pipkins missed Jumper.",7,6,1,0.187828248104652,"UMass","Rhode Island",4,4,0,0,-9.5,400990096,2018-01-30
10,1,"17:48",2268,2268,"Malik Hines Offensive Rebound.",7,6,1,0.187828248104652,"UMass","Rhode Island",4,4,0,0,-9.5,400990096,2018-01-30
11,1,"17:48",2268,2268,"Malik Hines made Two Point Tip Shot.",9,6,3,0.228419198486466,"UMass","Rhode Island",4,4,0,0,-9.5,400990096,2018-01-30
12,1,"17:18",2238,2238,"Stanford Robinson missed Three Point Jumper.",9,6,3,0.230060793692366,"UMass","Rhode Island",4,4,0,0,-9.5,400990096,2018-01-30
13,1,"17:18",2238,2238,"C.J. Anderson Defensive Rebound.",9,6,3,0.230060793692366,"UMass","Rhode Island",4,4,0,0,-9.5,400990096,2018-01-30
14,1,"17:11",2231,2231,"Malik Hines made Dunk. Assisted by C.J. Anderson.",11,6,5,0.272077858296276,"UMass","Rhode Island",4,4,0,0,-9.5,400990096,2018-01-30
15,1,"16:51",2211,2211,"Andre Berry Turnover.",11,6,5,0.314716955549362,"UMass","Rhode Island",4,4,0,0,-9.5,400990096,2018-01-30
16,1,"16:29",2189,2189,"Foul on Jeff Dowtin.",11,6,5,0.273675801106134,"UMass","Rhode Island",4,4,0,0,-9.5,400990096,2018-01-30
17,1,"16:29",2189,2189,"Luwane Pipkins made Free Throw.",12,6,6,0.295769976452525,"UMass","Rhode Island",4,4,0,0,-9.5,400990096,2018-01-30
18,1,"16:29",2189,2189,"Luwane Pipkins made Free Throw.",13,6,7,0.318864780698358,"UMass","Rhode Island",4,4,0,0,-9.5,400990096,2018-01-30
19,1,"16:16",2176,2176,"E.C. Matthews missed Three Point Jumper.",13,6,7,0.311791357192768,"UMass","Rhode Island",4,4,0,0,-9.5,400990096,2018-01-30
20,1,"16:16",2176,2176,"Luwane Pipkins Defensive Rebound.",13,6,7,0.311791357192768,"UMass","Rhode Island",4,4,0,0,-9.5,400990096,2018-01-30
21,1,"16:05",2165,2165,"Foul on Luwane Pipkins.",13,6,7,0.3241734919215,"UMass","Rhode Island",4,4,0,0,-9.5,400990096,2018-01-30
22,1,"16:05",2165,2165,"Luwane Pipkins Turnover.",13,6,7,0.3241734919215,"UMass","Rhode Island",4,4,0,0,-9.5,400990096,2018-01-30
23,1,"15:42",2142,2142,"Jared Terrell missed Three Point Jumper.",13,6,7,0.312034032320554,"UMass","Rhode Island",4,4,0,0,-9.5,400990096,2018-01-30
24,1,"15:37",2137,2137,"Andre Berry Offensive Rebound.",13,6,7,0.331402673209262,"UMass","Rhode Island",4,4,0,0,-9.5,400990096,2018-01-30
25,1,"15:37",2137,2137,"Foul on Malik Hines.",13,6,7,0.331402673209262,"UMass","Rhode Island",4,4,0,0,-9.5,400990096,2018-01-30
26,1,"15:36",2136,2136,"Official TV Timeout",13,6,7,0.331402673209262,"UMass","Rhode Island",4,4,0,0,-9.5,400990096,2018-01-30
27,1,"15:36",2136,2136,"Andre Berry made Free Throw.",13,8,5,0.28010077101349,"UMass","Rhode Island",4,4,0,0,-9.5,400990096,2018-01-30
28,1,"15:36",2136,2136,"Andre Berry made Free Throw.",13,7,6,0.305147398347296,"UMass","Rhode Island",4,4,0,0,-9.5,400990096,2018-01-30
29,1,"15:19",2119,2119,"Carl Pierre made Three Point Jumper. Assisted by Luwane Pipkins.",16,8,8,0.332030546272717,"UMass","Rhode Island",4,4,0,0,-9.5,400990096,2018-01-30
30,1,"15:00",2100,2100,"Jared Terrell made Layup.",16,10,6,0.300144673059022,"UMass","Rhode Island",4,4,0,0,-9.5,400990096,2018-01-30
31,1,"14:34",2074,2074,"C.J. Anderson made Three Point Jumper. Assisted by Unique McLean.",19,10,9,0.346913044486684,"UMass","Rhode Island",4,4,0,0,-9.5,400990096,2018-01-30
32,1,"14:08",2048,2048,"Jared Terrell missed Jumper.",19,10,9,0.363701266764251,"UMass","Rhode Island",4,4,0,0,-9.5,400990096,2018-01-30
33,1,"14:08",2048,2048,"Unique McLean Defensive Rebound.",19,10,9,0.363701266764251,"UMass","Rhode Island",4,4,0,0,-9.5,400990096,2018-01-30
34,1,"13:59",2039,2039,"Foul on Cyril Langevine.",19,10,9,0.365355126202623,"UMass","Rhode Island",4,4,0,0,-9.5,400990096,2018-01-30
35,1,"13:59",2039,2039,"C.J. Anderson made Free Throw.",20,10,10,0.391481094482274,"UMass","Rhode Island",4,4,0,0,-9.5,400990096,2018-01-30
36,1,"13:59",2039,2039,"C.J. Anderson made Free Throw.",21,10,11,0.418244089467451,"UMass","Rhode Island",4,4,0,0,-9.5,400990096,2018-01-30
37,1,"13:34",2014,2014,"Jarvis Garrett missed Jumper.",21,10,11,0.450674501485878,"UMass","Rhode Island",4,4,0,0,-9.5,400990096,2018-01-30
38,1,"13:34",2014,2014,"Luwane Pipkins Defensive Rebound.",21,10,11,0.450674501485878,"UMass","Rhode Island",4,4,0,0,-9.5,400990096,2018-01-30
39,1,"13:33",2013,2013,"Foul on Cyril Langevine.",21,10,11,0.450674501485878,"UMass","Rhode Island",4,4,0,0,-9.5,400990096,2018-01-30
40,1,"13:19",1999,1999,"Luwane Pipkins made Jumper.",23,10,13,0.542160579451204,"UMass","Rhode Island",4,4,0,0,-9.5,400990096,2018-01-30
41,1,"13:10",1990,1990,"Foul on Khalea Turner-Morris.",23,10,13,0.542160579451204,"UMass","Rhode Island",4,4,0,0,-9.5,400990096,2018-01-30
42,1,"13:10",1990,1990,"Jeff Dowtin made Free Throw.",23,11,12,0.509814327470186,"UMass","Rhode Island",4,4,0,0,-9.5,400990096,2018-01-30
43,1,"13:10",1990,1990,"Jeff Dowtin made Free Throw.",23,12,11,0.47738568622799,"UMass","Rhode Island",4,4,0,0,-9.5,400990096,2018-01-30
44,1,"12:50",1970,1970,"Khalea Turner-Morris made Jumper. Assisted by Rayshawn Miller.",25,12,13,0.526461426474562,"UMass","Rhode Island",4,4,0,0,-9.5,400990096,2018-01-30
45,1,"12:36",1956,1956,"Stanford Robinson made Jumper. Assisted by Jarvis Garrett.",25,14,11,0.496926630387165,"UMass","Rhode Island",4,4,0,0,-9.5,400990096,2018-01-30
46,1,"12:18",1938,1938,"Carl Pierre missed Three Point Jumper.",25,14,11,0.482151979745103,"UMass","Rhode Island",4,4,0,0,-9.5,400990096,2018-01-30
47,1,"12:18",1938,1938,"Fatts Russell Defensive Rebound.",25,14,11,0.482151979745103,"UMass","Rhode Island",4,4,0,0,-9.5,400990096,2018-01-30
48,1,"12:05",1925,1925,"Andre Berry made Jumper. Assisted by Jeff Dowtin.",25,16,9,0.379797653696421,"UMass","Rhode Island",4,4,0,0,-9.5,400990096,2018-01-30
49,1,"11:51",1911,1911,"Rayshawn Miller Turnover.",25,16,9,0.445409866185172,"UMass","Rhode Island",4,4,0,0,-9.5,400990096,2018-01-30
50,1,"11:50",1910,1910,"Official TV Timeout",25,16,9,0.445409866185172,"UMass","Rhode Island",4,4,0,0,-9.5,400990096,2018-01-30
51,1,"11:41",1901,1901,"Andre Berry missed Jumper.",25,16,9,0.385490538629997,"UMass","Rhode Island",4,4,0,0,-9.5,400990096,2018-01-30
52,1,"11:41",1901,1901,"Unique McLean Defensive Rebound.",25,16,9,0.385490538629997,"UMass","Rhode Island",4,4,0,0,-9.5,400990096,2018-01-30
53,1,"11:33",1893,1893,"Luwane Pipkins Turnover.",25,16,9,0.459127652479691,"UMass","Rhode Island",4,4,0,0,-9.5,400990096,2018-01-30
54,1,"11:33",1893,1893,"Fatts Russell Steal.",25,16,9,0.459127652479691,"UMass","Rhode Island",4,4,0,0,-9.5,400990096,2018-01-30
55,1,"11:25",1885,1885,"Foul on Unique McLean.",25,16,9,0.392866667285998,"UMass","Rhode Island",4,4,0,0,-9.5,400990096,2018-01-30
56,1,"11:25",1885,1885,"Jeff Dowtin missed Free Throw.",25,16,9,0.392866667285998,"UMass","Rhode Island",4,4,0,0,-9.5,400990096,2018-01-30
57,1,"11:25",1885,1885,"Rhode Island Deadball Team Rebound.",25,16,9,0.392866667285998,"UMass","Rhode Island",4,4,0,0,-9.5,400990096,2018-01-30
58,1,"11:25",1885,1885,"Jeff Dowtin made Free Throw.",25,17,8,0.363781256926233,"UMass","Rhode Island",4,4,0,0,-9.5,400990096,2018-01-30
59,1,"11:08",1868,1868,"Unique McLean missed Jumper.",25,17,8,0.444522274148414,"UMass","Rhode Island",4,4,0,0,-9.5,400990096,2018-01-30
60,1,"11:08",1868,1868,"Jarvis Garrett Defensive Rebound.",25,17,8,0.444522274148414,"UMass","Rhode Island",4,4,0,0,-9.5,400990096,2018-01-30
61,1,"10:58",1858,1858,"Jarvis Garrett made Jumper. Assisted by Jeff Dowtin.",25,19,6,0.349851486431888,"UMass","Rhode Island",4,4,0,0,-9.5,400990096,2018-01-30
62,1,"10:48",1848,1848,"Malik Hines missed Jumper.",25,19,6,0.30470811927443,"UMass","Rhode Island",4,4,0,0,-9.5,400990096,2018-01-30
63,1,"10:48",1848,1848,"Unique McLean Offensive Rebound.",25,19,6,0.30470811927443,"UMass","Rhode Island",4,4,0,0,-9.5,400990096,2018-01-30
64,1,"10:37",1837,1837,"Carl Pierre missed Three Point Jumper.",25,19,6,0.35256006265397,"UMass","Rhode Island",4,4,0,0,-9.5,400990096,2018-01-30
65,1,"10:37",1837,1837,"Rhode Island Defensive Rebound.",25,19,6,0.35256006265397,"UMass","Rhode Island",4,4,0,0,-9.5,400990096,2018-01-30
66,1,"10:16",1816,1816,"Jared Terrell made Three Point Jumper. Assisted by Jarvis Garrett.",25,22,3,0.272460485179873,"UMass","Rhode Island",4,4,0,0,-9.5,400990096,2018-01-30
67,1,"9:53",1793,1793,"Luwane Pipkins missed Jumper.",25,22,3,0.262775726210278,"UMass","Rhode Island",4,4,0,0,-9.5,400990096,2018-01-30
68,1,"9:53",1793,1793,"Malik Hines Offensive Rebound.",25,22,3,0.262775726210278,"UMass","Rhode Island",4,4,0,0,-9.5,400990096,2018-01-30
69,1,"9:44",1784,1784,"Foul on Jarvis Garrett.",25,22,3,0.265480398065975,"UMass","Rhode Island",4,4,0,0,-9.5,400990096,2018-01-30
70,1,"9:44",1784,1784,"Luwane Pipkins made Free Throw.",26,22,4,0.293305729414336,"UMass","Rhode Island",4,4,0,0,-9.5,400990096,2018-01-30
71,1,"9:44",1784,1784,"Luwane Pipkins made Free Throw.",27,22,5,0.322765927367351,"UMass","Rhode Island",4,4,0,0,-9.5,400990096,2018-01-30
72,1,"9:25",1765,1765,"Andre Berry made Layup. Assisted by Fatts Russell.",27,24,3,0.249981407171438,"UMass","Rhode Island",4,4,0,0,-9.5,400990096,2018-01-30
73,1,"9:10",1750,1750,"Luwane Pipkins missed Three Point Jumper.",27,24,3,0.227827108721139,"UMass","Rhode Island",4,4,0,0,-9.5,400990096,2018-01-30
74,1,"9:10",1750,1750,"Jared Terrell Defensive Rebound.",27,24,3,0.227827108721139,"UMass","Rhode Island",4,4,0,0,-9.5,400990096,2018-01-30
75,1,"9:00",1740,1740,"Jared Terrell made Jumper. Assisted by Jeff Dowtin.",27,26,1,0.24223748571935,"UMass","Rhode Island",4,4,0,0,-9.5,400990096,2018-01-30
76,1,"8:32",1712,1712,"Rayshawn Miller Turnover.",27,26,1,0.208626297330137,"UMass","Rhode Island",4,4,0,0,-9.5,400990096,2018-01-30
77,1,"8:10",1690,1690,"E.C. Matthews made Three Point Jumper.",27,29,-2,0.171518195691789,"UMass","Rhode Island",4,4,0,0,-9.5,400990096,2018-01-30
78,1,"7:22",1642,1642,"Official TV Timeout",27,29,-2,0.164262169210074,"UMass","Rhode Island",4,4,0,0,-9.5,400990096,2018-01-30
79,1,"7:20",1640,1640,"Malik Hines missed Jumper.",27,29,-2,0.164262169210074,"UMass","Rhode Island",4,4,0,0,-9.5,400990096,2018-01-30
80,1,"7:20",1640,1640,"Stanford Robinson Defensive Rebound.",27,29,-2,0.164262169210074,"UMass","Rhode Island",4,4,0,0,-9.5,400990096,2018-01-30
81,1,"7:10",1630,1630,"Jeff Dowtin missed Three Point Jumper.",27,29,-2,0.175013578917509,"UMass","Rhode Island",4,4,0,0,-9.5,400990096,2018-01-30
82,1,"7:10",1630,1630,"Jared Terrell Offensive Rebound.",27,29,-2,0.175013578917509,"UMass","Rhode Island",4,4,0,0,-9.5,400990096,2018-01-30
83,1,"7:10",1630,1630,"Jared Terrell made Two Point Tip Shot.",27,31,-4,0.140196633813725,"UMass","Rhode Island",4,4,0,0,-9.5,400990096,2018-01-30
84,1,"6:52",1612,1612,"Luwane Pipkins Turnover.",27,31,-4,0.124550124620525,"UMass","Rhode Island",4,4,0,0,-9.5,400990096,2018-01-30
85,1,"6:52",1612,1612,"E.C. Matthews Steal.",27,31,-4,0.124550124620525,"UMass","Rhode Island",4,4,0,0,-9.5,400990096,2018-01-30
86,1,"6:50",1610,1610,"E.C. Matthews made Layup. Assisted by Jeff Dowtin.",27,33,-6,0.0969561525728656,"UMass","Rhode Island",4,4,1,0,-9.5,400990096,2018-01-30
87,1,"6:50",1610,1610,"UMass  Timeout",27,33,-6,0.0969561525728656,"UMass","Rhode Island",3,4,1,0,-9.5,400990096,2018-01-30
88,1,"6:37",1597,1597,"Carl Pierre missed Three Point Jumper.",27,33,-6,0.116851266952949,"UMass","Rhode Island",3,4,1,0,-9.5,400990096,2018-01-30
89,1,"6:37",1597,1597,"Stanford Robinson Defensive Rebound.",27,33,-6,0.116851266952949,"UMass","Rhode Island",3,4,1,0,-9.5,400990096,2018-01-30
90,1,"6:19",1579,1579,"E.C. Matthews missed Jumper.",27,33,-6,0.0936639944439919,"UMass","Rhode Island",3,4,1,0,-9.5,400990096,2018-01-30
91,1,"6:19",1579,1579,"Rhode Island Offensive Rebound.",27,33,-6,0.0936639944439919,"UMass","Rhode Island",3,4,1,0,-9.5,400990096,2018-01-30
92,1,"6:11",1571,1571,"E.C. Matthews missed Three Point Jumper.",27,33,-6,0.0936639944439919,"UMass","Rhode Island",3,4,1,0,-9.5,400990096,2018-01-30
93,1,"6:11",1571,1571,"E.C. Matthews Offensive Rebound.",27,33,-6,0.0936639944439919,"UMass","Rhode Island",3,4,1,0,-9.5,400990096,2018-01-30
94,1,"5:58",1558,1558,"Jared Terrell missed Jumper.",27,33,-6,0.0994171225724131,"UMass","Rhode Island",3,4,1,0,-9.5,400990096,2018-01-30
95,1,"5:58",1558,1558,"Stanford Robinson Offensive Rebound.",27,33,-6,0.0994171225724131,"UMass","Rhode Island",3,4,1,0,-9.5,400990096,2018-01-30
96,1,"5:58",1558,1558,"Foul on C.J. Anderson.",27,33,-6,0.0994171225724131,"UMass","Rhode Island",3,4,1,0,-9.5,400990096,2018-01-30
97,1,"5:48",1548,1548,"E.C. Matthews Turnover.",27,33,-6,0.0998998324920968,"UMass","Rhode Island",3,4,0,0,-9.5,400990096,2018-01-30
98,1,"5:48",1548,1548,"Malik Hines Steal.",27,33,-6,0.0998998324920968,"UMass","Rhode Island",3,4,0,0,-9.5,400990096,2018-01-30
99,1,"5:45",1545,1545,"Luwane Pipkins made Layup. Assisted by Malik Hines.",29,33,-4,0.127809291450462,"UMass","Rhode Island",3,4,0,0,-9.5,400990096,2018-01-30
100,1,"5:31",1531,1531,"Foul on Stanford Robinson.",29,33,-4,0.128798850951855,"UMass","Rhode Island",3,4,0,0,-9.5,400990096,2018-01-30
101,1,"5:31",1531,1531,"Stanford Robinson Turnover.",29,33,-4,0.128798850951855,"UMass","Rhode Island",3,4,0,0,-9.5,400990096,2018-01-30
102,1,"5:11",1511,1511,"Luwane Pipkins made Jumper. Assisted by Malik Hines.",31,33,-2,0.17835543514112,"UMass","Rhode Island",3,4,0,0,-9.5,400990096,2018-01-30
103,1,"4:40",1480,1480,"Jared Terrell missed Jumper.",31,33,-2,0.157678801300009,"UMass","Rhode Island",3,4,0,0,-9.5,400990096,2018-01-30
104,1,"4:40",1480,1480,"Stanford Robinson Offensive Rebound.",31,33,-2,0.157678801300009,"UMass","Rhode Island",3,4,0,0,-9.5,400990096,2018-01-30
105,1,"4:32",1472,1472,"Stanford Robinson made Jumper.",31,35,-4,0.110753321973263,"UMass","Rhode Island",3,4,0,0,-9.5,400990096,2018-01-30
106,1,"4:13",1453,1453,"Foul on Jarvis Garrett.",31,35,-4,0.121502631484156,"UMass","Rhode Island",3,4,0,0,-9.5,400990096,2018-01-30
107,1,"3:58",1438,1438,"Luwane Pipkins made Jumper.",33,35,-2,0.188073037536728,"UMass","Rhode Island",3,4,0,0,-9.5,400990096,2018-01-30
108,1,"3:49",1429,1429,"Jeff Dowtin missed Jumper.",33,35,-2,0.17343135466332,"UMass","Rhode Island",3,4,0,0,-9.5,400990096,2018-01-30
109,1,"3:49",1429,1429,"Carl Pierre Defensive Rebound.",33,35,-2,0.17343135466332,"UMass","Rhode Island",3,4,0,0,-9.5,400990096,2018-01-30
110,1,"3:32",1412,1412,"Foul on Andre Berry.",33,35,-2,0.176880402960901,"UMass","Rhode Island",3,4,0,0,-9.5,400990096,2018-01-30
111,1,"3:31",1411,1411,"Official TV Timeout",33,35,-2,0.176880402960901,"UMass","Rhode Island",3,4,0,0,-9.5,400990096,2018-01-30
112,1,"3:31",1411,1411,"Luwane Pipkins made Free Throw.",34,35,-1,0.200599586322358,"UMass","Rhode Island",3,4,0,0,-9.5,400990096,2018-01-30
113,1,"3:31",1411,1411,"Luwane Pipkins missed Free Throw.",34,35,-1,0.200599586322358,"UMass","Rhode Island",3,4,0,0,-9.5,400990096,2018-01-30
114,1,"3:31",1411,1411,"Jeff Dowtin Defensive Rebound.",34,35,-1,0.200599586322358,"UMass","Rhode Island",3,4,0,0,-9.5,400990096,2018-01-30
115,1,"3:31",1411,1411,"Jeff Dowtin made Three Point Jumper. Assisted by Fatts Russell.",34,38,-4,0.136133669406615,"UMass","Rhode Island",3,4,0,0,-9.5,400990096,2018-01-30
116,1,"3:31",1411,1411,"Unique McLean missed Layup.",34,38,-4,0.136133669406615,"UMass","Rhode Island",3,4,0,0,-9.5,400990096,2018-01-30
117,1,"3:31",1411,1411,"Andre Berry Defensive Rebound.",34,38,-4,0.136133669406615,"UMass","Rhode Island",3,4,0,0,-9.5,400990096,2018-01-30
118,1,"3:31",1411,1411,"Jeff Dowtin made Three Point Jumper. Assisted by Fatts Russell.",34,41,-7,0.0900511611653435,"UMass","Rhode Island",3,4,0,0,-9.5,400990096,2018-01-30
119,1,"2:16",1336,1336,"Luwane Pipkins Turnover.",34,41,-7,0.0851606080743174,"UMass","Rhode Island",3,4,0,1,-9.5,400990096,2018-01-30
120,1,"2:16",1336,1336,"Stanford Robinson Steal.",34,41,-7,0.0851606080743174,"UMass","Rhode Island",3,4,0,1,-9.5,400990096,2018-01-30
121,1,"2:16",1336,1336,"Rhode Island  Timeout",34,41,-7,0.0851606080743174,"UMass","Rhode Island",3,3,0,1,-9.5,400990096,2018-01-30
122,1,"1:48",1308,1308,"Jeff Dowtin missed Jumper.",34,41,-7,0.104253007166705,"UMass","Rhode Island",3,3,0,1,-9.5,400990096,2018-01-30
123,1,"1:48",1308,1308,"Rhode Island Offensive Rebound.",34,41,-7,0.104253007166705,"UMass","Rhode Island",3,3,0,1,-9.5,400990096,2018-01-30
124,1,"1:43",1303,1303,"E.C. Matthews missed Three Point Jumper.",34,41,-7,0.104253007166705,"UMass","Rhode Island",3,3,0,1,-9.5,400990096,2018-01-30
125,1,"1:43",1303,1303,"Unique McLean Defensive Rebound.",34,41,-7,0.104253007166705,"UMass","Rhode Island",3,3,0,1,-9.5,400990096,2018-01-30
126,1,"1:42",1302,1302,"Foul on Stanford Robinson.",34,41,-7,0.104253007166705,"UMass","Rhode Island",3,3,0,1,-9.5,400990096,2018-01-30
127,1,"1:33",1293,1293,"Malik Hines made Free Throw.",35,41,-6,0.117375000565574,"UMass","Rhode Island",3,3,0,1,-9.5,400990096,2018-01-30
128,1,"1:32",1292,1292,"Malik Hines made Free Throw.",36,41,-5,0.135861744790048,"UMass","Rhode Island",3,3,0,1,-9.5,400990096,2018-01-30
129,1,"1:14",1274,1274,"Foul on Malik Hines.",36,41,-5,0.11178900728623,"UMass","Rhode Island",3,3,0,0,-9.5,400990096,2018-01-30
130,1,"1:14",1274,1274,"Andre Berry missed Free Throw.",36,41,-5,0.11178900728623,"UMass","Rhode Island",3,3,0,0,-9.5,400990096,2018-01-30
131,1,"1:14",1274,1274,"Rhode Island Deadball Team Rebound.",36,41,-5,0.11178900728623,"UMass","Rhode Island",3,3,0,0,-9.5,400990096,2018-01-30
132,1,"1:14",1274,1274,"Andre Berry made Free Throw.",36,42,-6,0.0977538340255405,"UMass","Rhode Island",3,3,0,0,-9.5,400990096,2018-01-30
133,1,"1:01",1261,1261,"Foul on E.C. Matthews.",36,42,-6,0.104809797350619,"UMass","Rhode Island",3,3,0,0,-9.5,400990096,2018-01-30
134,1,"1:01",1261,1261,"Khalea Turner-Morris made Free Throw.",37,42,-5,0.120606834460733,"UMass","Rhode Island",3,3,0,0,-9.5,400990096,2018-01-30
135,1,"1:01",1261,1261,"Khalea Turner-Morris made Free Throw.",38,42,-4,0.138416668728373,"UMass","Rhode Island",3,3,0,0,-9.5,400990096,2018-01-30
136,1,"0:32",1232,1232,"Jeff Dowtin missed Layup.",38,42,-4,0.13678072359683,"UMass","Rhode Island",3,3,0,0,-9.5,400990096,2018-01-30
137,1,"0:32",1232,1232,"Andre Berry Offensive Rebound.",38,42,-4,0.13678072359683,"UMass","Rhode Island",3,3,0,0,-9.5,400990096,2018-01-30
138,1,"0:32",1232,1232,"Andre Berry missed Two Point Tip Shot.",38,42,-4,0.13678072359683,"UMass","Rhode Island",3,3,0,0,-9.5,400990096,2018-01-30
139,1,"0:32",1232,1232,"Andre Berry Offensive Rebound.",38,42,-4,0.13678072359683,"UMass","Rhode Island",3,3,0,0,-9.5,400990096,2018-01-30
140,1,"0:32",1232,1232,"Andre Berry made Two Point Tip Shot.",38,44,-6,0.103002070105575,"UMass","Rhode Island",3,3,0,0,-9.5,400990096,2018-01-30
141,1,"0:08",1208,1208,"Luwane Pipkins made Three Point Jumper.",41,44,-3,0.154922539931007,"UMass","Rhode Island",3,3,0,0,-9.5,400990096,2018-01-30
142,1,"0:00",1200,1200,"End of 1st half",41,44,-3,0.154922539931007,"UMass","Rhode Island",3,3,0,0,-9.5,400990096,2018-01-30
143,2,"20:00",1200,1200,"PLAY",41,44,-3,0.154922539931007,"UMass","Rhode Island",4,4,0,0,-9.5,400990096,2018-01-30
144,2,"20:00",1200,1200,"Jump Ball won by Rhode Island",41,44,-3,0.154922539931007,"UMass","Rhode Island",4,4,0,0,-9.5,400990096,2018-01-30
145,2,"19:51",1191,1191,"Jeff Dowtin made Jumper. Assisted by Jared Terrell.",41,46,-5,0.159525454410666,"UMass","Rhode Island",4,4,0,0,-9.5,400990096,2018-01-30
146,2,"19:27",1167,1167,"Foul on E.C. Matthews.",41,46,-5,0.101972287265012,"UMass","Rhode Island",4,4,0,0,-9.5,400990096,2018-01-30
147,2,"19:27",1167,1167,"Malik Hines made Free Throw.",42,46,-4,0.118090402802899,"UMass","Rhode Island",4,4,0,0,-9.5,400990096,2018-01-30
148,2,"19:27",1167,1167,"Malik Hines made Free Throw.",43,46,-3,0.13636932970763,"UMass","Rhode Island",4,4,0,0,-9.5,400990096,2018-01-30
149,2,"19:01",1141,1141,"Andre Berry made Layup. Assisted by Jeff Dowtin.",43,48,-5,0.125593575069902,"UMass","Rhode Island",4,4,0,0,-9.5,400990096,2018-01-30
150,2,"18:46",1126,1126,"Foul on Jared Terrell.",43,48,-5,0.105650328738191,"UMass","Rhode Island",4,4,0,0,-9.5,400990096,2018-01-30
151,2,"18:28",1108,1108,"Unique McLean missed Jumper.",43,48,-5,0.11531322144712,"UMass","Rhode Island",4,4,0,0,-9.5,400990096,2018-01-30
152,2,"18:28",1108,1108,"Unique McLean Offensive Rebound.",43,48,-5,0.11531322144712,"UMass","Rhode Island",4,4,0,0,-9.5,400990096,2018-01-30
153,2,"18:22",1102,1102,"Foul on Unique McLean.",43,48,-5,0.11531322144712,"UMass","Rhode Island",4,4,0,0,-9.5,400990096,2018-01-30
154,2,"18:22",1102,1102,"Unique McLean Turnover.",43,48,-5,0.11531322144712,"UMass","Rhode Island",4,4,0,0,-9.5,400990096,2018-01-30
155,2,"18:09",1089,1089,"E.C. Matthews made Three Point Jumper. Assisted by Jeff Dowtin.",43,51,-8,0.0646637260379489,"UMass","Rhode Island",4,4,0,0,-9.5,400990096,2018-01-30
156,2,"17:46",1066,1066,"Malik Hines made Dunk. Assisted by Luwane Pipkins.",45,51,-6,0.118473654219373,"UMass","Rhode Island",4,4,0,0,-9.5,400990096,2018-01-30
157,2,"17:11",1031,1031,"Foul on Unique McLean.",45,51,-6,0.0985391595009988,"UMass","Rhode Island",4,4,0,0,-9.5,400990096,2018-01-30
158,2,"17:05",1025,1025,"Stanford Robinson missed Three Point Jumper.",45,51,-6,0.104452144777392,"UMass","Rhode Island",4,4,0,0,-9.5,400990096,2018-01-30
159,2,"17:05",1025,1025,"UMass Defensive Rebound.",45,51,-6,0.104452144777392,"UMass","Rhode Island",4,4,0,0,-9.5,400990096,2018-01-30
160,2,"16:58",1018,1018,"C.J. Anderson Turnover.",45,51,-6,0.0926478986023237,"UMass","Rhode Island",4,4,0,0,-9.5,400990096,2018-01-30
161,2,"16:58",1018,1018,"Stanford Robinson Steal.",45,51,-6,0.0926478986023237,"UMass","Rhode Island",4,4,0,0,-9.5,400990096,2018-01-30
162,2,"16:54",1014,1014,"Jeff Dowtin made Three Point Jumper. Assisted by Stanford Robinson.",45,54,-9,0.0557405381184505,"UMass","Rhode Island",4,4,0,0,-9.5,400990096,2018-01-30
163,2,"16:26",986,986,"Foul on Jeff Dowtin.",45,54,-9,0.0621530993531861,"UMass","Rhode Island",4,4,0,0,-9.5,400990096,2018-01-30
164,2,"16:11",971,971,"Foul on Andre Berry.",45,54,-9,0.0633341711754734,"UMass","Rhode Island",4,4,0,0,-9.5,400990096,2018-01-30
165,2,"16:07",967,967,"Luwane Pipkins missed Jumper.",45,54,-9,0.0622614543738221,"UMass","Rhode Island",4,4,0,0,-9.5,400990096,2018-01-30
166,2,"16:07",967,967,"Stanford Robinson Defensive Rebound.",45,54,-9,0.0622614543738221,"UMass","Rhode Island",4,4,0,0,-9.5,400990096,2018-01-30
167,2,"16:03",963,963,"Stanford Robinson Turnover.",45,54,-9,0.0622614543738221,"UMass","Rhode Island",4,4,0,0,-9.5,400990096,2018-01-30
168,2,"16:03",963,963,"C.J. Anderson Steal.",45,54,-9,0.0622614543738221,"UMass","Rhode Island",4,4,0,0,-9.5,400990096,2018-01-30
169,2,"15:44",944,944,"Carl Pierre missed Jumper.",45,54,-9,0.0592877290294307,"UMass","Rhode Island",4,4,0,0,-9.5,400990096,2018-01-30
170,2,"15:44",944,944,"Malik Hines Offensive Rebound.",45,54,-9,0.0592877290294307,"UMass","Rhode Island",4,4,0,0,-9.5,400990096,2018-01-30
171,2,"15:44",944,944,"Malik Hines missed Two Point Tip Shot.",45,54,-9,0.0592877290294307,"UMass","Rhode Island",4,4,0,0,-9.5,400990096,2018-01-30
172,2,"15:44",944,944,"Jared Terrell Defensive Rebound.",45,54,-9,0.0592877290294307,"UMass","Rhode Island",4,4,0,0,-9.5,400990096,2018-01-30
173,2,"15:30",930,930,"Jared Terrell Turnover.",45,54,-9,0.058492180871351,"UMass","Rhode Island",4,4,0,0,-9.5,400990096,2018-01-30
174,2,"15:30",930,930,"Carl Pierre Steal.",45,54,-9,0.058492180871351,"UMass","Rhode Island",4,4,0,0,-9.5,400990096,2018-01-30
175,2,"15:26",926,926,"C.J. Anderson made Layup. Assisted by Carl Pierre.",47,54,-7,0.0764869588675548,"UMass","Rhode Island",4,4,0,0,-9.5,400990096,2018-01-30
176,2,"14:58",898,898,"Stanford Robinson made Jumper. Assisted by Jared Terrell.",47,56,-9,0.0612534661665099,"UMass","Rhode Island",4,4,0,0,-9.5,400990096,2018-01-30
177,2,"14:29",869,869,"Carl Pierre missed Jumper.",47,56,-9,0.0546265600511558,"UMass","Rhode Island",4,4,0,0,-9.5,400990096,2018-01-30
178,2,"14:29",869,869,"Malik Hines Offensive Rebound.",47,56,-9,0.0546265600511558,"UMass","Rhode Island",4,4,0,0,-9.5,400990096,2018-01-30
179,2,"14:20",860,860,"Malik Hines made Layup.",49,56,-7,0.0781409596049612,"UMass","Rhode Island",4,4,0,0,-9.5,400990096,2018-01-30
180,2,"13:58",838,838,"E.C. Matthews missed Jumper.",49,56,-7,0.0681915890453789,"UMass","Rhode Island",4,4,0,0,-9.5,400990096,2018-01-30
181,2,"13:58",838,838,"Malik Hines Defensive Rebound.",49,56,-7,0.0681915890453789,"UMass","Rhode Island",4,4,0,0,-9.5,400990096,2018-01-30
