"play_id","half","time_remaining_half","secs_remaining","secs_remaining_absolute","description","home_score","away_score","score_diff","win_prob","home","away","home_time_out_remaining","away_time_out_remaining","home_timeout_ind","away_timeout_ind","home_favored_by","game_id","date"
1,1,"20:00",2400,2400,"PLAY",0,0,0,0.785623304600368,"Creighton","Butler",4,4,0,0,6,400988567,2018-01-09
2,1,"20:00",2400,2400,"Jump Ball won by Butler",0,0,0,0.785623304600368,"Creighton","Butler",4,4,0,0,6,400988567,2018-01-09
3,1,"19:38",2378,2378,"Marcus Foster made Three Point Jumper. Assisted by Toby Hegner.",3,0,3,0.825967603187804,"Creighton","Butler",4,4,0,0,6,400988567,2018-01-09
4,1,"19:10",2350,2350,"Kamar Baldwin missed Layup.",3,0,3,0.827495867032946,"Creighton","Butler",4,4,0,0,6,400988567,2018-01-09
5,1,"19:10",2350,2350,"Martin Krampelj Defensive Rebound.",3,0,3,0.827495867032946,"Creighton","Butler",4,4,0,0,6,400988567,2018-01-09
6,1,"18:53",2333,2333,"Martin Krampelj made Layup. Assisted by Davion Mintz.",5,0,5,0.84693167632816,"Creighton","Butler",4,4,0,0,6,400988567,2018-01-09
7,1,"18:32",2312,2312,"Aaron Thompson missed Jumper.",5,0,5,0.838708730447042,"Creighton","Butler",4,4,0,0,6,400988567,2018-01-09
8,1,"18:32",2312,2312,"Kelan Martin Offensive Rebound.",5,0,5,0.838708730447042,"Creighton","Butler",4,4,0,0,6,400988567,2018-01-09
9,1,"18:26",2306,2306,"Kelan Martin made Layup.",5,2,3,0.813170181793012,"Creighton","Butler",4,4,0,0,6,400988567,2018-01-09
10,1,"18:12",2292,2292,"Khyri Thomas missed Three Point Jumper.",5,2,3,0.822999368880434,"Creighton","Butler",4,4,0,0,6,400988567,2018-01-09
11,1,"18:12",2292,2292,"Martin Krampelj Offensive Rebound.",5,2,3,0.822999368880434,"Creighton","Butler",4,4,0,0,6,400988567,2018-01-09
12,1,"18:04",2284,2284,"Foul on Aaron Thompson.",5,2,3,0.819171069714249,"Creighton","Butler",4,4,0,0,6,400988567,2018-01-09
13,1,"18:03",2283,2283,"Toby Hegner made Jumper. Assisted by Khyri Thomas.",7,2,5,0.848183206195172,"Creighton","Butler",4,4,0,0,6,400988567,2018-01-09
14,1,"17:37",2257,2257,"Paul Jorgensen missed Jumper.",7,2,5,0.842824982632661,"Creighton","Butler",4,4,0,0,6,400988567,2018-01-09
15,1,"17:37",2257,2257,"Martin Krampelj Defensive Rebound.",7,2,5,0.842824982632661,"Creighton","Butler",4,4,0,0,6,400988567,2018-01-09
16,1,"17:29",2249,2249,"Khyri Thomas missed Three Point Jumper.",7,2,5,0.838414509706901,"Creighton","Butler",4,4,0,0,6,400988567,2018-01-09
17,1,"17:29",2249,2249,"Paul Jorgensen Defensive Rebound.",7,2,5,0.838414509706901,"Creighton","Butler",4,4,0,0,6,400988567,2018-01-09
18,1,"17:20",2240,2240,"Kamar Baldwin made Three Point Jumper. Assisted by Kelan Martin.",7,5,2,0.796444073801475,"Creighton","Butler",4,4,0,0,6,400988567,2018-01-09
19,1,"17:06",2226,2226,"Toby Hegner missed Jumper.",7,5,2,0.806960036891069,"Creighton","Butler",4,4,0,0,6,400988567,2018-01-09
20,1,"17:06",2226,2226,"Kelan Martin Defensive Rebound.",7,5,2,0.806960036891069,"Creighton","Butler",4,4,0,0,6,400988567,2018-01-09
21,1,"16:54",2214,2214,"Paul Jorgensen made Layup.",7,7,0,0.769433497394165,"Creighton","Butler",4,4,0,0,6,400988567,2018-01-09
22,1,"16:30",2190,2190,"Toby Hegner made Three Point Jumper. Assisted by Khyri Thomas.",10,7,3,0.833485269431917,"Creighton","Butler",4,4,0,0,6,400988567,2018-01-09
23,1,"16:30",2190,2190,"Foul on Sean McDermott.",10,7,3,0.833485269431917,"Creighton","Butler",4,4,0,0,6,400988567,2018-01-09
24,1,"16:15",2175,2175,"Toby Hegner missed Three Point Jumper.",10,7,3,0.817190500349911,"Creighton","Butler",4,4,0,0,6,400988567,2018-01-09
25,1,"16:15",2175,2175,"Paul Jorgensen Defensive Rebound.",10,7,3,0.817190500349911,"Creighton","Butler",4,4,0,0,6,400988567,2018-01-09
26,1,"16:02",2162,2162,"Kamar Baldwin made Jumper.",10,9,1,0.783533930288859,"Creighton","Butler",4,4,0,0,6,400988567,2018-01-09
27,1,"15:47",2147,2147,"Foul on Paul Jorgensen.",10,9,1,0.789932036125967,"Creighton","Butler",4,4,0,0,6,400988567,2018-01-09
28,1,"15:47",2147,2147,"Official TV Timeout",10,9,1,0.789932036125967,"Creighton","Butler",4,4,0,0,6,400988567,2018-01-09
29,1,"15:47",2147,2147,"Davion Mintz made Free Throw.",11,9,2,0.806251516785908,"Creighton","Butler",4,4,0,0,6,400988567,2018-01-09
30,1,"15:47",2147,2147,"Davion Mintz made Free Throw.",12,9,3,0.821589532271681,"Creighton","Butler",4,4,0,0,6,400988567,2018-01-09
31,1,"15:26",2126,2126,"Nate Fowler made Layup.",12,11,1,0.781467491038215,"Creighton","Butler",4,4,0,0,6,400988567,2018-01-09
32,1,"15:06",2106,2106,"Khyri Thomas made Layup.",14,11,3,0.815826087337444,"Creighton","Butler",4,4,0,0,6,400988567,2018-01-09
33,1,"14:51",2091,2091,"Foul on Martin Krampelj.",14,11,3,0.818440840463689,"Creighton","Butler",4,4,0,0,6,400988567,2018-01-09
34,1,"14:47",2087,2087,"Kelan Martin missed Three Point Jumper.",14,11,3,0.817191798947417,"Creighton","Butler",4,4,0,0,6,400988567,2018-01-09
35,1,"14:47",2087,2087,"Toby Hegner Defensive Rebound.",14,11,3,0.817191798947417,"Creighton","Butler",4,4,0,0,6,400988567,2018-01-09
36,1,"14:35",2075,2075,"Davion Mintz missed Layup.",14,11,3,0.816723885226059,"Creighton","Butler",4,4,0,0,6,400988567,2018-01-09
37,1,"14:35",2075,2075,"Kamar Baldwin Defensive Rebound.",14,11,3,0.816723885226059,"Creighton","Butler",4,4,0,0,6,400988567,2018-01-09
38,1,"14:27",2067,2067,"Kamar Baldwin missed Jumper.",14,11,3,0.816001897779019,"Creighton","Butler",4,4,0,0,6,400988567,2018-01-09
39,1,"14:27",2067,2067,"Davion Mintz Defensive Rebound.",14,11,3,0.816001897779019,"Creighton","Butler",4,4,0,0,6,400988567,2018-01-09
40,1,"14:11",2051,2051,"Marcus Foster made Three Point Jumper.",17,11,6,0.869235984202101,"Creighton","Butler",4,4,0,0,6,400988567,2018-01-09
41,1,"13:54",2034,2034,"Nate Fowler missed Jumper.",17,11,6,0.870886758539349,"Creighton","Butler",4,4,0,0,6,400988567,2018-01-09
42,1,"13:54",2034,2034,"Creighton Defensive Rebound.",17,11,6,0.870886758539349,"Creighton","Butler",4,4,0,0,6,400988567,2018-01-09
43,1,"13:34",2014,2014,"Marcus Foster missed Jumper.",17,11,6,0.866349900848065,"Creighton","Butler",4,4,0,0,6,400988567,2018-01-09
44,1,"13:34",2014,2014,"Kelan Martin Defensive Rebound.",17,11,6,0.866349900848065,"Creighton","Butler",4,4,0,0,6,400988567,2018-01-09
45,1,"13:15",1995,1995,"Henry Baddley made Layup. Assisted by Kelan Martin.",17,13,4,0.842825719157479,"Creighton","Butler",4,4,0,0,6,400988567,2018-01-09
46,1,"12:59",1979,1979,"Khyri Thomas missed Layup.",17,13,4,0.845251266784831,"Creighton","Butler",4,4,0,0,6,400988567,2018-01-09
47,1,"12:59",1979,1979,"Kelan Martin Defensive Rebound.",17,13,4,0.845251266784831,"Creighton","Butler",4,4,0,0,6,400988567,2018-01-09
48,1,"12:49",1969,1969,"Kelan Martin missed Jumper.",17,13,4,0.82820413081049,"Creighton","Butler",4,4,0,0,6,400988567,2018-01-09
49,1,"12:49",1969,1969,"Ronnie Harrell Jr. Defensive Rebound.",17,13,4,0.82820413081049,"Creighton","Butler",4,4,0,0,6,400988567,2018-01-09
50,1,"12:42",1962,1962,"Marcus Foster missed Three Point Jumper.",17,13,4,0.82820413081049,"Creighton","Butler",4,4,0,0,6,400988567,2018-01-09
51,1,"12:42",1962,1962,"Nate Fowler Defensive Rebound.",17,13,4,0.82820413081049,"Creighton","Butler",4,4,0,0,6,400988567,2018-01-09
52,1,"12:17",1937,1937,"Foul on Ronnie Harrell Jr..",17,13,4,0.831892952654189,"Creighton","Butler",4,4,0,0,6,400988567,2018-01-09
53,1,"12:17",1937,1937,"Nate Fowler made Free Throw.",17,14,3,0.813047054441147,"Creighton","Butler",4,4,0,0,6,400988567,2018-01-09
54,1,"12:17",1937,1937,"Nate Fowler made Free Throw.",17,15,2,0.79261510080159,"Creighton","Butler",4,4,0,0,6,400988567,2018-01-09
55,1,"12:01",1921,1921,"Mitch Ballock made Layup. Assisted by Martin Krampelj.",19,15,4,0.838826992772378,"Creighton","Butler",4,4,0,0,6,400988567,2018-01-09
56,1,"11:50",1910,1910,"Sean McDermott made Three Point Jumper. Assisted by Kamar Baldwin.",19,18,1,0.790467718536485,"Creighton","Butler",4,4,0,0,6,400988567,2018-01-09
57,1,"11:39",1899,1899,"Ronnie Harrell Jr. missed Three Point Jumper.",19,18,1,0.779202658151701,"Creighton","Butler",4,4,0,0,6,400988567,2018-01-09
58,1,"11:39",1899,1899,"Martin Krampelj Offensive Rebound.",19,18,1,0.779202658151701,"Creighton","Butler",4,4,0,0,6,400988567,2018-01-09
59,1,"11:38",1898,1898,"Foul on Tyler Wideman.",19,18,1,0.779202658151701,"Creighton","Butler",4,4,0,0,6,400988567,2018-01-09
60,1,"11:38",1898,1898,"Official TV Timeout",19,18,1,0.779202658151701,"Creighton","Butler",4,4,0,0,6,400988567,2018-01-09
61,1,"11:34",1894,1894,"Mitch Ballock missed Three Point Jumper.",19,18,1,0.779202658151701,"Creighton","Butler",4,4,0,0,6,400988567,2018-01-09
62,1,"11:34",1894,1894,"Henry Baddley Defensive Rebound.",19,18,1,0.779202658151701,"Creighton","Butler",4,4,0,0,6,400988567,2018-01-09
63,1,"11:25",1885,1885,"Kamar Baldwin missed Jumper.",19,18,1,0.776482198008825,"Creighton","Butler",4,4,0,0,6,400988567,2018-01-09
64,1,"11:25",1885,1885,"Martin Krampelj Defensive Rebound.",19,18,1,0.776482198008825,"Creighton","Butler",4,4,0,0,6,400988567,2018-01-09
65,1,"11:17",1877,1877,"Marcus Foster missed Three Point Jumper.",19,18,1,0.774456149639719,"Creighton","Butler",4,4,0,0,6,400988567,2018-01-09
66,1,"11:17",1877,1877,"Sean McDermott Defensive Rebound.",19,18,1,0.774456149639719,"Creighton","Butler",4,4,0,0,6,400988567,2018-01-09
67,1,"11:09",1869,1869,"Kamar Baldwin Turnover.",19,18,1,0.780330565447426,"Creighton","Butler",4,4,0,0,6,400988567,2018-01-09
68,1,"11:09",1869,1869,"Martin Krampelj Steal.",19,18,1,0.780330565447426,"Creighton","Butler",4,4,0,0,6,400988567,2018-01-09
69,1,"11:05",1865,1865,"Foul on Kamar Baldwin.",19,18,1,0.780330565447426,"Creighton","Butler",4,4,0,0,6,400988567,2018-01-09
70,1,"11:05",1865,1865,"Martin Krampelj made Free Throw.",20,18,2,0.802513818338054,"Creighton","Butler",4,4,0,0,6,400988567,2018-01-09
71,1,"11:05",1865,1865,"Martin Krampelj made Free Throw.",21,18,3,0.822965132840252,"Creighton","Butler",4,4,0,0,6,400988567,2018-01-09
72,1,"10:36",1836,1836,"Henry Baddley missed Three Point Jumper.",21,18,3,0.814929170048127,"Creighton","Butler",4,4,0,0,6,400988567,2018-01-09
73,1,"10:36",1836,1836,"Martin Krampelj Defensive Rebound.",21,18,3,0.814929170048127,"Creighton","Butler",4,4,0,0,6,400988567,2018-01-09
74,1,"10:24",1824,1824,"Khyri Thomas made Jumper. Assisted by Martin Krampelj.",23,18,5,0.859592844287965,"Creighton","Butler",4,4,0,0,6,400988567,2018-01-09
75,1,"9:56",1796,1796,"Aaron Thompson missed Jumper.",23,18,5,0.845470155746339,"Creighton","Butler",4,4,0,0,6,400988567,2018-01-09
76,1,"9:56",1796,1796,"Martin Krampelj Defensive Rebound.",23,18,5,0.845470155746339,"Creighton","Butler",4,4,0,0,6,400988567,2018-01-09
77,1,"9:49",1789,1789,"Marcus Foster made Layup.",25,18,7,0.876103956529756,"Creighton","Butler",4,4,0,0,6,400988567,2018-01-09
78,1,"9:47",1787,1787,"Butler  Timeout",25,18,7,0.876103956529756,"Creighton","Butler",3,4,1,0,6,400988567,2018-01-09
79,1,"9:28",1768,1768,"Kelan Martin Turnover.",25,18,7,0.886738711386633,"Creighton","Butler",3,4,1,0,6,400988567,2018-01-09
80,1,"9:28",1768,1768,"Ronnie Harrell Jr. Steal.",25,18,7,0.886738711386633,"Creighton","Butler",3,4,1,0,6,400988567,2018-01-09
81,1,"9:24",1764,1764,"Ty-Shon Alexander missed Jumper.",25,18,7,0.886738711386633,"Creighton","Butler",3,4,1,0,6,400988567,2018-01-09
82,1,"9:24",1764,1764,"Ronnie Harrell Jr. Offensive Rebound.",25,18,7,0.886738711386633,"Creighton","Butler",3,4,1,0,6,400988567,2018-01-09
83,1,"9:11",1751,1751,"Martin Krampelj made Layup. Assisted by Marcus Foster.",27,18,9,0.909120849902877,"Creighton","Butler",3,4,1,0,6,400988567,2018-01-09
84,1,"8:47",1727,1727,"Foul on Martin Krampelj.",27,18,9,0.906258784775671,"Creighton","Butler",3,4,1,0,6,400988567,2018-01-09
85,1,"8:47",1727,1727,"Aaron Thompson made Free Throw.",27,19,8,0.894091616204117,"Creighton","Butler",3,4,1,0,6,400988567,2018-01-09
86,1,"8:47",1727,1727,"Aaron Thompson made Free Throw.",27,20,7,0.880553353435691,"Creighton","Butler",3,4,1,0,6,400988567,2018-01-09
87,1,"8:34",1714,1714,"Marcus Foster made Jumper. Assisted by Davion Mintz.",29,20,9,0.911630249745528,"Creighton","Butler",3,4,0,0,6,400988567,2018-01-09
88,1,"8:16",1696,1696,"Paul Jorgensen made Jumper.",29,22,7,0.888903338236207,"Creighton","Butler",3,4,0,0,6,400988567,2018-01-09
89,1,"7:46",1666,1666,"Marcus Foster made Three Point Jumper. Assisted by Khyri Thomas.",32,22,10,0.91422493543182,"Creighton","Butler",3,4,0,0,6,400988567,2018-01-09
90,1,"7:28",1648,1648,"Nate Fowler made Layup. Assisted by Sean McDermott.",32,24,8,0.901046135974792,"Creighton","Butler",3,4,0,0,6,400988567,2018-01-09
91,1,"7:09",1629,1629,"Ronnie Harrell Jr. made Layup.",34,24,10,0.92135083084918,"Creighton","Butler",3,4,0,0,6,400988567,2018-01-09
92,1,"6:49",1609,1609,"Aaron Thompson missed Layup.",34,24,10,0.91477061785878,"Creighton","Butler",3,4,0,0,6,400988567,2018-01-09
93,1,"6:49",1609,1609,"Ronnie Harrell Jr. Defensive Rebound.",34,24,10,0.91477061785878,"Creighton","Butler",3,4,0,0,6,400988567,2018-01-09
94,1,"6:39",1599,1599,"Khyri Thomas made Dunk. Assisted by Ronnie Harrell Jr..",36,24,12,0.936363089345786,"Creighton","Butler",3,4,0,0,6,400988567,2018-01-09
95,1,"6:29",1589,1589,"Butler  Timeout",36,24,12,0.933685647426285,"Creighton","Butler",2,4,1,0,6,400988567,2018-01-09
96,1,"6:18",1578,1578,"Foul on Kelan Martin.",36,24,12,0.949351989299047,"Creighton","Butler",2,4,1,0,6,400988567,2018-01-09
97,1,"6:18",1578,1578,"Kelan Martin Turnover.",36,24,12,0.949351989299047,"Creighton","Butler",2,4,1,0,6,400988567,2018-01-09
98,1,"5:55",1555,1555,"Davion Mintz made Three Point Jumper. Assisted by Marcus Foster.",39,24,15,0.958478055891844,"Creighton","Butler",2,4,1,0,6,400988567,2018-01-09
99,1,"5:24",1524,1524,"Kelan Martin Turnover.",39,24,15,0.959136622365739,"Creighton","Butler",2,4,0,0,6,400988567,2018-01-09
100,1,"5:24",1524,1524,"Khyri Thomas Steal.",39,24,15,0.959136622365739,"Creighton","Butler",2,4,0,0,6,400988567,2018-01-09
101,1,"5:19",1519,1519,"Marcus Foster made Dunk. Assisted by Ronnie Harrell Jr..",41,24,17,0.97508047028268,"Creighton","Butler",2,4,0,0,6,400988567,2018-01-09
102,1,"5:03",1503,1503,"Kamar Baldwin made Layup.",41,26,15,0.959503786262354,"Creighton","Butler",2,4,0,0,6,400988567,2018-01-09
103,1,"4:40",1480,1480,"Khyri Thomas missed Jumper.",41,26,15,0.962531014183631,"Creighton","Butler",2,4,0,0,6,400988567,2018-01-09
104,1,"4:40",1480,1480,"Kelan Martin Defensive Rebound.",41,26,15,0.962531014183631,"Creighton","Butler",2,4,0,0,6,400988567,2018-01-09
105,1,"4:34",1474,1474,"Kelan Martin Turnover.",41,26,15,0.967331207461265,"Creighton","Butler",2,4,0,0,6,400988567,2018-01-09
106,1,"4:34",1474,1474,"Khyri Thomas Steal.",41,26,15,0.967331207461265,"Creighton","Butler",2,4,0,0,6,400988567,2018-01-09
107,1,"4:29",1469,1469,"Marcus Foster made Layup. Assisted by Davion Mintz.",43,26,17,0.96614844591633,"Creighton","Butler",2,4,0,0,6,400988567,2018-01-09
108,1,"4:13",1453,1453,"Paul Jorgensen made Jumper.",43,28,15,0.960680847735013,"Creighton","Butler",2,4,0,0,6,400988567,2018-01-09
109,1,"3:44",1424,1424,"Davion Mintz missed Three Point Jumper.",43,28,15,0.957448132443653,"Creighton","Butler",2,4,0,0,6,400988567,2018-01-09
110,1,"3:44",1424,1424,"Butler Defensive Rebound.",43,28,15,0.957448132443653,"Creighton","Butler",2,4,0,0,6,400988567,2018-01-09
111,1,"3:42",1422,1422,"Official TV Timeout",43,28,15,0.957448132443653,"Creighton","Butler",2,4,0,0,6,400988567,2018-01-09
112,1,"3:36",1416,1416,"Christian David missed Three Point Jumper.",43,28,15,0.96337375904497,"Creighton","Butler",2,4,0,0,6,400988567,2018-01-09
113,1,"3:36",1416,1416,"Davion Mintz Defensive Rebound.",43,28,15,0.96337375904497,"Creighton","Butler",2,4,0,0,6,400988567,2018-01-09
114,1,"3:10",1390,1390,"Marcus Foster missed Three Point Jumper.",43,28,15,0.965902617621312,"Creighton","Butler",2,4,0,0,6,400988567,2018-01-09
115,1,"3:10",1390,1390,"Kamar Baldwin Defensive Rebound.",43,28,15,0.965902617621312,"Creighton","Butler",2,4,0,0,6,400988567,2018-01-09
116,1,"3:02",1382,1382,"Kamar Baldwin made Layup.",43,30,13,0.951884247513865,"Creighton","Butler",2,4,0,0,6,400988567,2018-01-09
117,1,"2:40",1360,1360,"Marcus Foster made Dunk. Assisted by Ronnie Harrell Jr..",45,30,15,0.964218724623919,"Creighton","Butler",2,4,0,0,6,400988567,2018-01-09
118,1,"2:24",1344,1344,"Kamar Baldwin Turnover.",45,30,15,0.964215233419057,"Creighton","Butler",2,4,0,0,6,400988567,2018-01-09
119,1,"2:24",1344,1344,"Mitch Ballock Steal.",45,30,15,0.964215233419057,"Creighton","Butler",2,4,0,0,6,400988567,2018-01-09
120,1,"2:19",1339,1339,"Ronnie Harrell Jr. Turnover.",45,30,15,0.962595648879279,"Creighton","Butler",2,4,0,0,6,400988567,2018-01-09
121,1,"2:19",1339,1339,"Paul Jorgensen Steal.",45,30,15,0.962595648879279,"Creighton","Butler",2,4,0,0,6,400988567,2018-01-09
122,1,"2:12",1332,1332,"Paul Jorgensen missed Layup.",45,30,15,0.962595648879279,"Creighton","Butler",2,4,0,0,6,400988567,2018-01-09
123,1,"2:12",1332,1332,"Toby Hegner Defensive Rebound.",45,30,15,0.962595648879279,"Creighton","Butler",2,4,0,0,6,400988567,2018-01-09
124,1,"1:45",1305,1305,"Ronnie Harrell Jr. missed Three Point Jumper.",45,30,15,0.958781132321914,"Creighton","Butler",2,4,0,0,6,400988567,2018-01-09
125,1,"1:45",1305,1305,"Kelan Martin Defensive Rebound.",45,30,15,0.958781132321914,"Creighton","Butler",2,4,0,0,6,400988567,2018-01-09
126,1,"1:27",1287,1287,"Aaron Thompson made Jumper.",45,32,13,0.950396940191327,"Creighton","Butler",2,4,0,0,6,400988567,2018-01-09
127,1,"1:17",1277,1277,"Marcus Foster made Jumper.",47,32,15,0.959287672221042,"Creighton","Butler",2,4,0,0,6,400988567,2018-01-09
128,1,"1:08",1268,1268,"Kelan Martin missed Jumper.",47,32,15,0.968429742891949,"Creighton","Butler",2,4,0,0,6,400988567,2018-01-09
129,1,"1:08",1268,1268,"Toby Hegner Defensive Rebound.",47,32,15,0.968429742891949,"Creighton","Butler",2,4,0,0,6,400988567,2018-01-09
130,1,"0:50",1250,1250,"Foul on Aaron Thompson.",47,32,15,0.960069047921212,"Creighton","Butler",2,4,0,0,6,400988567,2018-01-09
131,1,"0:50",1250,1250,"Toby Hegner made Free Throw.",48,32,16,0.965489551125724,"Creighton","Butler",2,4,0,0,6,400988567,2018-01-09
132,1,"0:50",1250,1250,"Toby Hegner made Free Throw.",49,32,17,0.970197079357901,"Creighton","Butler",2,4,0,0,6,400988567,2018-01-09
133,1,"0:41",1241,1241,"Paul Jorgensen missed Three Point Jumper.",49,32,17,0.97366139523489,"Creighton","Butler",2,4,0,0,6,400988567,2018-01-09
134,1,"0:41",1241,1241,"Henry Baddley Offensive Rebound.",49,32,17,0.97366139523489,"Creighton","Butler",2,4,0,0,6,400988567,2018-01-09
135,1,"0:34",1234,1234,"Henry Baddley Turnover.",49,32,17,0.974358871848345,"Creighton","Butler",2,4,0,0,6,400988567,2018-01-09
136,1,"0:34",1234,1234,"Khyri Thomas Steal.",49,32,17,0.974358871848345,"Creighton","Butler",2,4,0,0,6,400988567,2018-01-09
137,1,"0:33",1233,1233,"Creighton  Timeout",49,32,17,0.974358871848345,"Creighton","Butler",2,3,0,1,6,400988567,2018-01-09
138,1,"0:11",1211,1211,"Marcus Foster missed Layup.",49,32,17,0.97605841168335,"Creighton","Butler",2,3,0,1,6,400988567,2018-01-09
139,1,"0:11",1211,1211,"Kelan Martin Defensive Rebound.",49,32,17,0.97605841168335,"Creighton","Butler",2,3,0,1,6,400988567,2018-01-09
140,1,"0:04",1204,1204,"Kelan Martin missed Layup.",49,32,17,0.974824039781285,"Creighton","Butler",2,3,0,1,6,400988567,2018-01-09
141,1,"0:04",1204,1204,"Kamar Baldwin Offensive Rebound.",49,32,17,0.974824039781285,"Creighton","Butler",2,3,0,1,6,400988567,2018-01-09
142,1,"0:00",1200,1200,"End of 1st half",49,32,17,0.974824039781285,"Creighton","Butler",2,3,0,1,6,400988567,2018-01-09
143,2,"20:00",1200,1200,"PLAY",49,32,17,0.974824039781285,"Creighton","Butler",3,4,0,0,6,400988567,2018-01-09
144,2,"20:00",1200,1200,"Jump Ball won by Butler",49,32,17,0.974824039781285,"Creighton","Butler",3,4,0,0,6,400988567,2018-01-09
145,2,"19:45",1185,1185,"Aaron Thompson made Layup. Assisted by Kelan Martin.",49,34,15,0.968794705720359,"Creighton","Butler",3,4,0,0,6,400988567,2018-01-09
146,2,"19:45",1185,1185,"Foul on Toby Hegner.",49,34,15,0.968794705720359,"Creighton","Butler",3,4,0,0,6,400988567,2018-01-09
147,2,"19:45",1185,1185,"Aaron Thompson missed Free Throw.",49,34,15,0.968794705720359,"Creighton","Butler",3,4,0,0,6,400988567,2018-01-09
148,2,"19:45",1185,1185,"Martin Krampelj Defensive Rebound.",49,34,15,0.968794705720359,"Creighton","Butler",3,4,0,0,6,400988567,2018-01-09
149,2,"19:10",1150,1150,"Davion Mintz missed Jumper.",49,34,15,0.965834855685629,"Creighton","Butler",3,4,0,0,6,400988567,2018-01-09
150,2,"19:10",1150,1150,"Kelan Martin Defensive Rebound.",49,34,15,0.965834855685629,"Creighton","Butler",3,4,0,0,6,400988567,2018-01-09
151,2,"18:50",1130,1130,"Tyler Wideman missed Jumper.",49,34,15,0.968084346495792,"Creighton","Butler",3,4,0,0,6,400988567,2018-01-09
152,2,"18:50",1130,1130,"Martin Krampelj Defensive Rebound.",49,34,15,0.968084346495792,"Creighton","Butler",3,4,0,0,6,400988567,2018-01-09
153,2,"18:43",1123,1123,"Toby Hegner made Three Point Jumper. Assisted by Davion Mintz.",52,34,18,0.986042976624982,"Creighton","Butler",3,4,0,0,6,400988567,2018-01-09
154,2,"18:24",1104,1104,"Paul Jorgensen made Layup. Assisted by Aaron Thompson.",52,36,16,0.972542939797486,"Creighton","Butler",3,4,0,0,6,400988567,2018-01-09
155,2,"17:59",1079,1079,"Marcus Foster Turnover.",52,36,16,0.973569811626471,"Creighton","Butler",3,4,0,0,6,400988567,2018-01-09
156,2,"17:35",1055,1055,"Kamar Baldwin missed Three Point Jumper.",52,36,16,0.978379274291158,"Creighton","Butler",3,4,0,0,6,400988567,2018-01-09
157,2,"17:35",1055,1055,"Davion Mintz Defensive Rebound.",52,36,16,0.978379274291158,"Creighton","Butler",3,4,0,0,6,400988567,2018-01-09
158,2,"17:26",1046,1046,"Marcus Foster missed Three Point Jumper.",52,36,16,0.977564983077527,"Creighton","Butler",3,4,0,0,6,400988567,2018-01-09
159,2,"17:26",1046,1046,"Aaron Thompson Defensive Rebound.",52,36,16,0.977564983077527,"Creighton","Butler",3,4,0,0,6,400988567,2018-01-09
160,2,"17:19",1039,1039,"Tyler Wideman made Layup. Assisted by Aaron Thompson.",52,38,14,0.964092103753681,"Creighton","Butler",3,4,0,0,6,400988567,2018-01-09
161,2,"17:19",1039,1039,"Foul on Khyri Thomas.",52,38,14,0.964092103753681,"Creighton","Butler",3,4,0,0,6,400988567,2018-01-09
162,2,"17:19",1039,1039,"Tyler Wideman made Free Throw.",52,39,13,0.957657149304584,"Creighton","Butler",3,4,0,0,6,400988567,2018-01-09
163,2,"17:00",1020,1020,"Toby Hegner Turnover.",52,39,13,0.962733804446368,"Creighton","Butler",3,4,0,0,6,400988567,2018-01-09
164,2,"17:00",1020,1020,"Aaron Thompson Steal.",52,39,13,0.962733804446368,"Creighton","Butler",3,4,0,0,6,400988567,2018-01-09
165,2,"16:31",991,991,"Kamar Baldwin missed Jumper.",52,39,13,0.958952252816371,"Creighton","Butler",3,4,0,0,6,400988567,2018-01-09
166,2,"16:31",991,991,"Tyler Wideman Offensive Rebound.",52,39,13,0.958952252816371,"Creighton","Butler",3,4,0,0,6,400988567,2018-01-09
167,2,"16:24",984,984,"Paul Jorgensen missed Three Point Jumper.",52,39,13,0.970009589828544,"Creighton","Butler",3,4,0,0,6,400988567,2018-01-09
168,2,"16:24",984,984,"Martin Krampelj Defensive Rebound.",52,39,13,0.970009589828544,"Creighton","Butler",3,4,0,0,6,400988567,2018-01-09
169,2,"16:14",974,974,"Khyri Thomas missed Three Point Jumper.",52,39,13,0.963171085323435,"Creighton","Butler",3,4,0,0,6,400988567,2018-01-09
170,2,"16:14",974,974,"Toby Hegner Offensive Rebound.",52,39,13,0.963171085323435,"Creighton","Butler",3,4,0,0,6,400988567,2018-01-09
171,2,"15:50",950,950,"Marcus Foster Turnover.",52,39,13,0.966498724951902,"Creighton","Butler",3,4,0,0,6,400988567,2018-01-09
172,2,"15:50",950,950,"Official TV Timeout",52,39,13,0.966498724951902,"Creighton","Butler",3,4,0,0,6,400988567,2018-01-09
173,2,"15:35",935,935,"Nate Fowler missed Layup.",52,39,13,0.965452881123692,"Creighton","Butler",3,4,0,0,6,400988567,2018-01-09
174,2,"15:35",935,935,"Ronnie Harrell Jr. Block.",52,39,13,0.965452881123692,"Creighton","Butler",3,4,0,0,6,400988567,2018-01-09
175,2,"15:35",935,935,"Martin Krampelj Defensive Rebound.",52,39,13,0.965452881123692,"Creighton","Butler",3,4,0,0,6,400988567,2018-01-09
176,2,"15:16",916,916,"Khyri Thomas made Jumper.",54,39,15,0.978921393754602,"Creighton","Butler",3,4,0,0,6,400988567,2018-01-09
177,2,"14:48",888,888,"Kelan Martin missed Three Point Jumper.",54,39,15,0.967986747113324,"Creighton","Butler",3,4,0,0,6,400988567,2018-01-09
178,2,"14:48",888,888,"Marcus Foster Defensive Rebound.",54,39,15,0.967986747113324,"Creighton","Butler",3,4,0,0,6,400988567,2018-01-09
179,2,"14:37",877,877,"Khyri Thomas Turnover.",54,39,15,0.977029051638441,"Creighton","Butler",3,4,0,0,6,400988567,2018-01-09
180,2,"14:37",877,877,"Kamar Baldwin Steal.",54,39,15,0.977029051638441,"Creighton","Butler",3,4,0,0,6,400988567,2018-01-09
181,2,"14:31",871,871,"Kamar Baldwin made Layup.",54,41,13,0.966593924651896,"Creighton","Butler",3,4,0,0,6,400988567,2018-01-09
182,2,"14:09",849,849,"Martin Krampelj made Three Point Jumper. Assisted by Ronnie Harrell Jr..",57,41,16,0.985161755787625,"Creighton","Butler",3,4,0,0,6,400988567,2018-01-09
183,2,"13:53",833,833,"Foul on Davion Mintz.",57,41,16,0.985251764974223,"Creighton","Butler",3,4,0,0,6,400988567,2018-01-09
184,2,"13:45",825,825,"Kamar Baldwin made Layup.",57,43,14,0.970324716657656,"Creighton","Butler",3,4,0,0,6,400988567,2018-01-09
185,2,"13:30",810,810,"Martin Krampelj made Dunk. Assisted by Marcus Foster.",59,43,16,0.981178028177993,"Creighton","Butler",3,4,0,0,6,400988567,2018-01-09
186,2,"13:13",793,793,"Kamar Baldwin missed Layup.",59,43,16,0.986773476792291,"Creighton","Butler",3,4,0,0,6,400988567,2018-01-09
187,2,"13:13",793,793,"Martin Krampelj Block.",59,43,16,0.986773476792291,"Creighton","Butler",3,4,0,0,6,400988567,2018-01-09
188,2,"13:13",793,793,"Butler Offensive Rebound.",59,43,16,0.986773476792291,"Creighton","Butler",3,4,0,0,6,400988567,2018-01-09
189,2,"13:09",789,789,"Kelan Martin made Layup.",59,45,14,0.975788513030511,"Creighton","Butler",3,4,0,0,6,400988567,2018-01-09
