"play_id","half","time_remaining_half","secs_remaining","secs_remaining_absolute","description","home_score","away_score","score_diff","win_prob","home","away","home_time_out_remaining","away_time_out_remaining","home_timeout_ind","away_timeout_ind","home_favored_by","game_id","date"
1,1,"20:00",2400,2400,"PLAY",0,0,0,0.852225761633161,"Creighton","Providence",4,4,0,0,9,400988556,2017-12-31
2,1,"20:00",2400,2400,"Jump Ball won by Providence",0,0,0,0.852225761633161,"Creighton","Providence",4,4,0,0,9,400988556,2017-12-31
3,1,"19:47",2387,2387,"Nate Watson missed Jumper.",0,0,0,0.84797092826269,"Creighton","Providence",4,4,0,0,9,400988556,2017-12-31
4,1,"19:47",2387,2387,"Toby Hegner Defensive Rebound.",0,0,0,0.84797092826269,"Creighton","Providence",4,4,0,0,9,400988556,2017-12-31
5,1,"19:30",2370,2370,"Marcus Foster missed Jumper.",0,0,0,0.844924266968732,"Creighton","Providence",4,4,0,0,9,400988556,2017-12-31
6,1,"19:30",2370,2370,"Alpha Diallo Defensive Rebound.",0,0,0,0.844924266968732,"Creighton","Providence",4,4,0,0,9,400988556,2017-12-31
7,1,"19:22",2362,2362,"Kyron Cartwright Turnover.",0,0,0,0.833106279835543,"Creighton","Providence",4,4,0,0,9,400988556,2017-12-31
8,1,"19:13",2353,2353,"Toby Hegner made Three Point Jumper. Assisted by Marcus Foster.",3,0,3,0.880282155372914,"Creighton","Providence",4,4,0,0,9,400988556,2017-12-31
9,1,"18:55",2335,2335,"Alpha Diallo missed Three Point Jumper.",3,0,3,0.875007069485222,"Creighton","Providence",4,4,0,0,9,400988556,2017-12-31
10,1,"18:55",2335,2335,"Nate Watson Offensive Rebound.",3,0,3,0.875007069485222,"Creighton","Providence",4,4,0,0,9,400988556,2017-12-31
11,1,"18:44",2324,2324,"Jalen Lindsey missed Three Point Jumper.",3,0,3,0.881359130621946,"Creighton","Providence",4,4,0,0,9,400988556,2017-12-31
12,1,"18:44",2324,2324,"Toby Hegner Defensive Rebound.",3,0,3,0.881359130621946,"Creighton","Providence",4,4,0,0,9,400988556,2017-12-31
13,1,"18:25",2305,2305,"Martin Krampelj missed Layup.",3,0,3,0.86763183896168,"Creighton","Providence",4,4,0,0,9,400988556,2017-12-31
14,1,"18:25",2305,2305,"Rodney Bullock Defensive Rebound.",3,0,3,0.86763183896168,"Creighton","Providence",4,4,0,0,9,400988556,2017-12-31
15,1,"18:13",2293,2293,"Jalen Lindsey missed Three Point Jumper.",3,0,3,0.875983183777207,"Creighton","Providence",4,4,0,0,9,400988556,2017-12-31
16,1,"18:13",2293,2293,"Martin Krampelj Defensive Rebound.",3,0,3,0.875983183777207,"Creighton","Providence",4,4,0,0,9,400988556,2017-12-31
17,1,"18:03",2283,2283,"Martin Krampelj made Dunk. Assisted by Davion Mintz.",5,0,5,0.894544271295118,"Creighton","Providence",4,4,0,0,9,400988556,2017-12-31
18,1,"17:30",2250,2250,"Nate Watson made Dunk. Assisted by Alpha Diallo.",5,2,3,0.868404757188755,"Creighton","Providence",4,4,0,0,9,400988556,2017-12-31
19,1,"17:30",2250,2250,"Foul on Davion Mintz.",5,2,3,0.868404757188755,"Creighton","Providence",4,4,0,0,9,400988556,2017-12-31
20,1,"17:30",2250,2250,"Nate Watson made Free Throw.",5,3,2,0.856978413538711,"Creighton","Providence",4,4,0,0,9,400988556,2017-12-31
21,1,"17:18",2238,2238,"Martin Krampelj made Dunk. Assisted by Ty-Shon Alexander.",7,3,4,0.888543584834329,"Creighton","Providence",4,4,0,0,9,400988556,2017-12-31
22,1,"16:59",2219,2219,"Alpha Diallo made Layup. Assisted by Kyron Cartwright.",7,5,2,0.865455320030289,"Creighton","Providence",4,4,0,0,9,400988556,2017-12-31
23,1,"16:52",2212,2212,"Khyri Thomas made Layup.",9,5,4,0.893128770887229,"Creighton","Providence",4,4,0,0,9,400988556,2017-12-31
24,1,"16:52",2212,2212,"Foul on Kyron Cartwright.",9,5,4,0.893128770887229,"Creighton","Providence",4,4,0,0,9,400988556,2017-12-31
25,1,"16:52",2212,2212,"Khyri Thomas made Free Throw.",10,5,5,0.904993244933605,"Creighton","Providence",4,4,0,0,9,400988556,2017-12-31
26,1,"16:34",2194,2194,"Foul on Khyri Thomas.",10,5,5,0.905216464190923,"Creighton","Providence",4,4,0,0,9,400988556,2017-12-31
27,1,"16:34",2194,2194,"Alpha Diallo made Free Throw.",10,6,4,0.894743140119591,"Creighton","Providence",4,4,0,0,9,400988556,2017-12-31
28,1,"16:34",2194,2194,"Alpha Diallo made Free Throw.",10,7,3,0.883261786060843,"Creighton","Providence",4,4,0,0,9,400988556,2017-12-31
29,1,"16:14",2174,2174,"Khyri Thomas missed Jumper.",10,7,3,0.870433768621333,"Creighton","Providence",4,4,0,0,9,400988556,2017-12-31
30,1,"16:14",2174,2174,"Alpha Diallo Defensive Rebound.",10,7,3,0.870433768621333,"Creighton","Providence",4,4,0,0,9,400988556,2017-12-31
31,1,"16:09",2169,2169,"Kyron Cartwright made Layup.",10,9,1,0.843945587438898,"Creighton","Providence",4,4,0,0,9,400988556,2017-12-31
32,1,"15:56",2156,2156,"Ty-Shon Alexander made Three Point Jumper.",13,9,4,0.885343628190671,"Creighton","Providence",4,4,0,0,9,400988556,2017-12-31
33,1,"15:34",2134,2134,"Alpha Diallo made Jumper.",13,11,2,0.862234349818954,"Creighton","Providence",4,4,0,0,9,400988556,2017-12-31
34,1,"15:08",2108,2108,"Jump Ball won by Creighton",13,11,2,0.855171564145321,"Creighton","Providence",4,4,0,0,9,400988556,2017-12-31
35,1,"15:08",2108,2108,"Official TV Timeout",13,11,2,0.855171564145321,"Creighton","Providence",4,4,0,0,9,400988556,2017-12-31
36,1,"15:03",2103,2103,"Toby Hegner missed Three Point Jumper.",13,11,2,0.855171564145321,"Creighton","Providence",4,4,0,0,9,400988556,2017-12-31
37,1,"15:03",2103,2103,"Jalen Lindsey Defensive Rebound.",13,11,2,0.855171564145321,"Creighton","Providence",4,4,0,0,9,400988556,2017-12-31
38,1,"14:44",2084,2084,"Kyron Cartwright missed Jumper.",13,11,2,0.855161122505675,"Creighton","Providence",4,4,0,0,9,400988556,2017-12-31
39,1,"14:44",2084,2084,"Ty-Shon Alexander Defensive Rebound.",13,11,2,0.855161122505675,"Creighton","Providence",4,4,0,0,9,400988556,2017-12-31
40,1,"14:32",2072,2072,"Marcus Foster made Three Point Jumper. Assisted by Khyri Thomas.",16,11,5,0.893101961288147,"Creighton","Providence",4,4,0,0,9,400988556,2017-12-31
41,1,"14:32",2072,2072,"Kyron Cartwright missed Three Point Jumper.",16,11,5,0.893101961288147,"Creighton","Providence",4,4,0,0,9,400988556,2017-12-31
42,1,"14:25",2065,2065,"Martin Krampelj Defensive Rebound.",16,11,5,0.893863602561371,"Creighton","Providence",4,4,0,0,9,400988556,2017-12-31
43,1,"14:25",2065,2065,"Foul on Kalif Young.",16,11,5,0.893863602561371,"Creighton","Providence",4,4,0,0,9,400988556,2017-12-31
44,1,"14:15",2055,2055,"Martin Krampelj missed Three Point Jumper.",16,11,5,0.900649093365304,"Creighton","Providence",4,4,0,0,9,400988556,2017-12-31
45,1,"14:15",2055,2055,"Rodney Bullock Defensive Rebound.",16,11,5,0.900649093365304,"Creighton","Providence",4,4,0,0,9,400988556,2017-12-31
46,1,"13:55",2035,2035,"Kyron Cartwright Turnover.",16,11,5,0.901646132571799,"Creighton","Providence",4,4,0,0,9,400988556,2017-12-31
47,1,"13:35",2015,2015,"Foul on Isaiah Jackson.",16,11,5,0.895581083499349,"Creighton","Providence",4,4,0,0,9,400988556,2017-12-31
48,1,"13:18",1998,1998,"Ronnie Harrell Jr. missed Three Point Jumper.",16,11,5,0.901124242322827,"Creighton","Providence",4,4,0,0,9,400988556,2017-12-31
49,1,"13:18",1998,1998,"Alpha Diallo Defensive Rebound.",16,11,5,0.901124242322827,"Creighton","Providence",4,4,0,0,9,400988556,2017-12-31
50,1,"13:04",1984,1984,"Rodney Bullock made Three Point Jumper. Assisted by Kyron Cartwright.",16,14,2,0.845319725710122,"Creighton","Providence",4,4,0,0,9,400988556,2017-12-31
51,1,"12:55",1975,1975,"Marcus Foster missed Three Point Jumper.",16,14,2,0.864446204065667,"Creighton","Providence",4,4,0,0,9,400988556,2017-12-31
52,1,"12:55",1975,1975,"Martin Krampelj Offensive Rebound.",16,14,2,0.864446204065667,"Creighton","Providence",4,4,0,0,9,400988556,2017-12-31
53,1,"12:47",1967,1967,"Ronnie Harrell Jr. made Three Point Jumper. Assisted by Ty-Shon Alexander.",19,14,5,0.888629931708703,"Creighton","Providence",4,4,0,0,9,400988556,2017-12-31
54,1,"12:32",1952,1952,"Kalif Young missed Jumper.",19,14,5,0.895599546147855,"Creighton","Providence",4,4,0,0,9,400988556,2017-12-31
55,1,"12:32",1952,1952,"Rodney Bullock Offensive Rebound.",19,14,5,0.895599546147855,"Creighton","Providence",4,4,0,0,9,400988556,2017-12-31
56,1,"12:32",1952,1952,"Rodney Bullock missed Layup.",19,14,5,0.895599546147855,"Creighton","Providence",4,4,0,0,9,400988556,2017-12-31
57,1,"12:32",1952,1952,"Martin Krampelj Block.",19,14,5,0.895599546147855,"Creighton","Providence",4,4,0,0,9,400988556,2017-12-31
58,1,"12:32",1952,1952,"Rodney Bullock Offensive Rebound.",19,14,5,0.895599546147855,"Creighton","Providence",4,4,0,0,9,400988556,2017-12-31
59,1,"12:20",1940,1940,"Alpha Diallo missed Three Point Jumper.",19,14,5,0.895644345571738,"Creighton","Providence",4,4,0,0,9,400988556,2017-12-31
60,1,"12:20",1940,1940,"Kalif Young Offensive Rebound.",19,14,5,0.895644345571738,"Creighton","Providence",4,4,0,0,9,400988556,2017-12-31
61,1,"12:16",1936,1936,"Foul on Marcus Foster.",19,14,5,0.892194988111122,"Creighton","Providence",4,4,0,0,9,400988556,2017-12-31
62,1,"12:01",1921,1921,"Alpha Diallo missed Layup.",19,14,5,0.899320461944079,"Creighton","Providence",4,4,0,0,9,400988556,2017-12-31
63,1,"12:01",1921,1921,"Alpha Diallo Offensive Rebound.",19,14,5,0.899320461944079,"Creighton","Providence",4,4,0,0,9,400988556,2017-12-31
64,1,"11:51",1911,1911,"Kalif Young Turnover.",19,14,5,0.902838660949364,"Creighton","Providence",4,4,0,0,9,400988556,2017-12-31
65,1,"11:51",1911,1911,"Official TV Timeout",19,14,5,0.902838660949364,"Creighton","Providence",4,4,0,0,9,400988556,2017-12-31
66,1,"11:30",1890,1890,"Toby Hegner missed Layup.",19,14,5,0.897751075180722,"Creighton","Providence",4,4,0,0,9,400988556,2017-12-31
67,1,"11:30",1890,1890,"Isaiah Jackson Defensive Rebound.",19,14,5,0.897751075180722,"Creighton","Providence",4,4,0,0,9,400988556,2017-12-31
68,1,"11:10",1870,1870,"Isaiah Jackson missed Layup.",19,14,5,0.89235737658683,"Creighton","Providence",4,4,0,0,9,400988556,2017-12-31
69,1,"11:10",1870,1870,"Ronnie Harrell Jr. Defensive Rebound.",19,14,5,0.89235737658683,"Creighton","Providence",4,4,0,0,9,400988556,2017-12-31
70,1,"10:54",1854,1854,"Foul on Kalif Young.",19,14,5,0.894947063834812,"Creighton","Providence",4,4,0,0,9,400988556,2017-12-31
71,1,"10:54",1854,1854,"Ronnie Harrell Jr. made Free Throw.",20,14,6,0.9063862803952,"Creighton","Providence",4,4,0,0,9,400988556,2017-12-31
72,1,"10:54",1854,1854,"Ronnie Harrell Jr. made Free Throw.",21,14,7,0.916695825879055,"Creighton","Providence",4,4,0,0,9,400988556,2017-12-31
73,1,"10:49",1849,1849,"Rodney Bullock missed Three Point Jumper.",21,14,7,0.910727939961013,"Creighton","Providence",4,4,0,0,9,400988556,2017-12-31
74,1,"10:49",1849,1849,"Mitch Ballock Defensive Rebound.",21,14,7,0.910727939961013,"Creighton","Providence",4,4,0,0,9,400988556,2017-12-31
75,1,"10:37",1837,1837,"Khyri Thomas made Layup.",23,14,9,0.931767567359874,"Creighton","Providence",4,4,0,0,9,400988556,2017-12-31
76,1,"10:04",1804,1804,"Jump Ball won by Providence",23,14,9,0.933367078525226,"Creighton","Providence",4,4,0,0,9,400988556,2017-12-31
77,1,"10:02",1802,1802,"Isaiah Jackson missed Three Point Jumper.",23,14,9,0.933367078525226,"Creighton","Providence",4,4,0,0,9,400988556,2017-12-31
78,1,"10:02",1802,1802,"Ronnie Harrell Jr. Defensive Rebound.",23,14,9,0.933367078525226,"Creighton","Providence",4,4,0,0,9,400988556,2017-12-31
79,1,"9:34",1774,1774,"Ty-Shon Alexander Turnover.",23,14,9,0.925524424353313,"Creighton","Providence",4,4,0,0,9,400988556,2017-12-31
80,1,"9:34",1774,1774,"Jalen Lindsey Steal.",23,14,9,0.925524424353313,"Creighton","Providence",4,4,0,0,9,400988556,2017-12-31
81,1,"9:26",1766,1766,"Makai Ashton-Langford missed Layup.",23,14,9,0.937730078690383,"Creighton","Providence",4,4,0,0,9,400988556,2017-12-31
82,1,"9:26",1766,1766,"Ronnie Harrell Jr. Defensive Rebound.",23,14,9,0.937730078690383,"Creighton","Providence",4,4,0,0,9,400988556,2017-12-31
83,1,"9:21",1761,1761,"Ty-Shon Alexander Turnover.",23,14,9,0.937730078690383,"Creighton","Providence",4,4,0,0,9,400988556,2017-12-31
84,1,"9:21",1761,1761,"Jalen Lindsey Steal.",23,14,9,0.937730078690383,"Creighton","Providence",4,4,0,0,9,400988556,2017-12-31
85,1,"9:07",1747,1747,"Kyron Cartwright missed Three Point Jumper.",23,14,9,0.929624554464817,"Creighton","Providence",4,4,0,0,9,400988556,2017-12-31
86,1,"9:07",1747,1747,"Ronnie Harrell Jr. Defensive Rebound.",23,14,9,0.929624554464817,"Creighton","Providence",4,4,0,0,9,400988556,2017-12-31
87,1,"8:57",1737,1737,"Toby Hegner missed Layup.",23,14,9,0.936872208301302,"Creighton","Providence",4,4,0,0,9,400988556,2017-12-31
88,1,"8:57",1737,1737,"Jalen Lindsey Block.",23,14,9,0.936872208301302,"Creighton","Providence",4,4,0,0,9,400988556,2017-12-31
89,1,"8:57",1737,1737,"Toby Hegner Offensive Rebound.",23,14,9,0.936872208301302,"Creighton","Providence",4,4,0,0,9,400988556,2017-12-31
90,1,"8:57",1737,1737,"Jump Ball won by Creighton",23,14,9,0.936872208301302,"Creighton","Providence",4,4,0,0,9,400988556,2017-12-31
91,1,"8:44",1724,1724,"Martin Krampelj missed Layup.",23,14,9,0.931137707306266,"Creighton","Providence",4,4,0,0,9,400988556,2017-12-31
92,1,"8:44",1724,1724,"Rodney Bullock Block.",23,14,9,0.931137707306266,"Creighton","Providence",4,4,0,0,9,400988556,2017-12-31
93,1,"8:44",1724,1724,"Rodney Bullock Defensive Rebound.",23,14,9,0.931137707306266,"Creighton","Providence",4,4,0,0,9,400988556,2017-12-31
94,1,"8:23",1703,1703,"Rodney Bullock missed Jumper.",23,14,9,0.92852204626016,"Creighton","Providence",4,4,0,0,9,400988556,2017-12-31
95,1,"8:23",1703,1703,"Ronnie Harrell Jr. Defensive Rebound.",23,14,9,0.92852204626016,"Creighton","Providence",4,4,0,0,9,400988556,2017-12-31
96,1,"8:09",1689,1689,"Khyri Thomas missed Three Point Jumper.",23,14,9,0.943504887082349,"Creighton","Providence",4,4,0,0,9,400988556,2017-12-31
97,1,"8:09",1689,1689,"Providence Defensive Rebound.",23,14,9,0.943504887082349,"Creighton","Providence",4,4,0,0,9,400988556,2017-12-31
98,1,"7:55",1675,1675,"Isaiah Jackson Turnover.",23,14,9,0.937655610414018,"Creighton","Providence",4,4,0,0,9,400988556,2017-12-31
99,1,"7:55",1675,1675,"Ronnie Harrell Jr. Steal.",23,14,9,0.937655610414018,"Creighton","Providence",4,4,0,0,9,400988556,2017-12-31
100,1,"7:48",1668,1668,"Khyri Thomas made Jumper. Assisted by Ronnie Harrell Jr..",25,14,11,0.946103397880254,"Creighton","Providence",4,4,0,0,9,400988556,2017-12-31
101,1,"7:43",1663,1663,"Providence  Timeout",25,14,11,0.946103397880254,"Creighton","Providence",4,3,0,1,9,400988556,2017-12-31
102,1,"7:43",1663,1663,"Official TV Timeout",25,14,11,0.946103397880254,"Creighton","Providence",4,3,0,1,9,400988556,2017-12-31
103,1,"7:32",1652,1652,"Nate Watson missed Jumper.",25,14,11,0.946625799232463,"Creighton","Providence",4,3,0,1,9,400988556,2017-12-31
104,1,"7:32",1652,1652,"Martin Krampelj Defensive Rebound.",25,14,11,0.946625799232463,"Creighton","Providence",4,3,0,1,9,400988556,2017-12-31
105,1,"7:26",1646,1646,"Foul on Nate Watson.",25,14,11,0.952215472203066,"Creighton","Providence",4,3,0,1,9,400988556,2017-12-31
106,1,"7:09",1629,1629,"Foul on Jalen Lindsey.",25,14,11,0.951215310986219,"Creighton","Providence",4,3,0,1,9,400988556,2017-12-31
107,1,"6:59",1619,1619,"Foul on Martin Krampelj.",25,14,11,0.946326532478397,"Creighton","Providence",4,3,0,1,9,400988556,2017-12-31
108,1,"6:59",1619,1619,"Martin Krampelj Turnover.",25,14,11,0.946326532478397,"Creighton","Providence",4,3,0,1,9,400988556,2017-12-31
109,1,"6:57",1617,1617,"Nate Watson made Layup. Assisted by Kyron Cartwright.",25,16,9,0.930097387525248,"Creighton","Providence",4,3,0,1,9,400988556,2017-12-31
110,1,"6:38",1598,1598,"Mitch Ballock Turnover.",25,16,9,0.932438678576855,"Creighton","Providence",4,3,0,0,9,400988556,2017-12-31
111,1,"6:38",1598,1598,"Nate Watson Steal.",25,16,9,0.932438678576855,"Creighton","Providence",4,3,0,0,9,400988556,2017-12-31
112,1,"6:31",1591,1591,"Jalen Lindsey made Three Point Jumper. Assisted by Kyron Cartwright.",25,19,6,0.901998615861313,"Creighton","Providence",4,3,0,0,9,400988556,2017-12-31
113,1,"6:09",1569,1569,"Davion Mintz made Layup. Assisted by Ronnie Harrell Jr..",27,19,8,0.923553160890825,"Creighton","Providence",4,3,0,0,9,400988556,2017-12-31
114,1,"5:42",1542,1542,"Nate Watson made Dunk. Assisted by Alpha Diallo.",27,21,6,0.906304533643393,"Creighton","Providence",4,3,0,0,9,400988556,2017-12-31
115,1,"5:27",1527,1527,"Marcus Foster made Layup. Assisted by Davion Mintz.",29,21,8,0.924678987588334,"Creighton","Providence",4,3,0,0,9,400988556,2017-12-31
116,1,"5:27",1527,1527,"Foul on Drew Edwards.",29,21,8,0.924678987588334,"Creighton","Providence",4,3,0,0,9,400988556,2017-12-31
117,1,"5:27",1527,1527,"Marcus Foster made Free Throw.",30,21,9,0.934008127587622,"Creighton","Providence",4,3,0,0,9,400988556,2017-12-31
118,1,"5:11",1511,1511,"Kyron Cartwright Turnover.",30,21,9,0.942174124417722,"Creighton","Providence",4,3,0,0,9,400988556,2017-12-31
119,1,"5:11",1511,1511,"Ronnie Harrell Jr. Steal.",30,21,9,0.942174124417722,"Creighton","Providence",4,3,0,0,9,400988556,2017-12-31
120,1,"4:58",1498,1498,"Mitch Ballock missed Three Point Jumper.",30,21,9,0.936585564142841,"Creighton","Providence",4,3,0,0,9,400988556,2017-12-31
121,1,"4:58",1498,1498,"Drew Edwards Defensive Rebound.",30,21,9,0.936585564142841,"Creighton","Providence",4,3,0,0,9,400988556,2017-12-31
122,1,"4:47",1487,1487,"Nate Watson Turnover.",30,21,9,0.937002332026499,"Creighton","Providence",4,3,0,0,9,400988556,2017-12-31
123,1,"4:42",1482,1482,"Marcus Foster missed Three Point Jumper.",30,21,9,0.937002332026499,"Creighton","Providence",4,3,0,0,9,400988556,2017-12-31
124,1,"4:42",1482,1482,"Jalen Lindsey Defensive Rebound.",30,21,9,0.937002332026499,"Creighton","Providence",4,3,0,0,9,400988556,2017-12-31
125,1,"4:34",1474,1474,"Foul on Ronnie Harrell Jr..",30,21,9,0.945577319972301,"Creighton","Providence",4,3,0,0,9,400988556,2017-12-31
126,1,"4:22",1462,1462,"Nate Watson made Jumper. Assisted by Alpha Diallo.",30,23,7,0.906231219255143,"Creighton","Providence",4,3,0,0,9,400988556,2017-12-31
127,1,"4:08",1448,1448,"Toby Hegner made Layup. Assisted by Ronnie Harrell Jr..",32,23,9,0.943118288903834,"Creighton","Providence",4,3,0,0,9,400988556,2017-12-31
128,1,"3:42",1422,1422,"Nate Watson made Layup.",32,25,7,0.90777814707481,"Creighton","Providence",4,3,0,0,9,400988556,2017-12-31
129,1,"3:42",1422,1422,"Foul on Toby Hegner.",32,25,7,0.90777814707481,"Creighton","Providence",4,3,0,0,9,400988556,2017-12-31
130,1,"3:42",1422,1422,"Official TV Timeout",32,25,7,0.90777814707481,"Creighton","Providence",4,3,0,0,9,400988556,2017-12-31
131,1,"3:42",1422,1422,"Nate Watson missed Free Throw.",32,25,7,0.90777814707481,"Creighton","Providence",4,3,0,0,9,400988556,2017-12-31
132,1,"3:40",1420,1420,"Ronnie Harrell Jr. Defensive Rebound.",32,25,7,0.90777814707481,"Creighton","Providence",4,3,0,0,9,400988556,2017-12-31
133,1,"3:25",1405,1405,"Ronnie Harrell Jr. made Three Point Jumper. Assisted by Marcus Foster.",35,25,10,0.951417068252096,"Creighton","Providence",4,3,0,0,9,400988556,2017-12-31
134,1,"3:02",1382,1382,"Drew Edwards missed Three Point Jumper.",35,25,10,0.946678794654641,"Creighton","Providence",4,3,0,0,9,400988556,2017-12-31
135,1,"3:02",1382,1382,"Khyri Thomas Defensive Rebound.",35,25,10,0.946678794654641,"Creighton","Providence",4,3,0,0,9,400988556,2017-12-31
136,1,"2:51",1371,1371,"Ty-Shon Alexander missed Three Point Jumper.",35,25,10,0.939650591198744,"Creighton","Providence",4,3,0,0,9,400988556,2017-12-31
137,1,"2:51",1371,1371,"Rodney Bullock Defensive Rebound.",35,25,10,0.939650591198744,"Creighton","Providence",4,3,0,0,9,400988556,2017-12-31
138,1,"2:35",1355,1355,"Nate Watson made Layup. Assisted by Alpha Diallo.",35,27,8,0.931502134188294,"Creighton","Providence",4,3,0,0,9,400988556,2017-12-31
139,1,"2:24",1344,1344,"Marcus Foster made Dunk. Assisted by Ty-Shon Alexander.",37,27,10,0.94396443619787,"Creighton","Providence",4,3,0,0,9,400988556,2017-12-31
140,1,"2:11",1331,1331,"Foul on Drew Edwards.",37,27,10,0.942618621415603,"Creighton","Providence",4,3,0,0,9,400988556,2017-12-31
141,1,"2:11",1331,1331,"Drew Edwards Turnover.",37,27,10,0.942618621415603,"Creighton","Providence",4,3,0,0,9,400988556,2017-12-31
142,1,"2:01",1321,1321,"Marcus Foster missed Three Point Jumper.",37,27,10,0.947248472384639,"Creighton","Providence",4,3,0,0,9,400988556,2017-12-31
143,1,"2:01",1321,1321,"Providence Defensive Rebound.",37,27,10,0.947248472384639,"Creighton","Providence",4,3,0,0,9,400988556,2017-12-31
144,1,"1:42",1302,1302,"Kyron Cartwright missed Three Point Jumper.",37,27,10,0.938164332925486,"Creighton","Providence",4,3,0,0,9,400988556,2017-12-31
145,1,"1:42",1302,1302,"Creighton Defensive Rebound.",37,27,10,0.938164332925486,"Creighton","Providence",4,3,0,0,9,400988556,2017-12-31
146,1,"1:32",1292,1292,"Martin Krampelj Turnover.",37,27,10,0.951117027386704,"Creighton","Providence",4,3,0,0,9,400988556,2017-12-31
147,1,"1:32",1292,1292,"Alpha Diallo Steal.",37,27,10,0.951117027386704,"Creighton","Providence",4,3,0,0,9,400988556,2017-12-31
148,1,"1:18",1278,1278,"Rodney Bullock made Jumper.",37,29,8,0.920205043505581,"Creighton","Providence",4,3,0,0,9,400988556,2017-12-31
149,1,"1:07",1267,1267,"Foul on Nate Watson.",37,29,8,0.934138926125055,"Creighton","Providence",4,3,0,0,9,400988556,2017-12-31
150,1,"1:07",1267,1267,"Martin Krampelj missed Free Throw.",37,29,8,0.934138926125055,"Creighton","Providence",4,3,0,0,9,400988556,2017-12-31
151,1,"1:07",1267,1267,"Isaiah Jackson Defensive Rebound.",37,29,8,0.934138926125055,"Creighton","Providence",4,3,0,0,9,400988556,2017-12-31
152,1,"0:55",1255,1255,"Kyron Cartwright Turnover.",37,29,8,0.918760952378178,"Creighton","Providence",4,3,0,0,9,400988556,2017-12-31
153,1,"0:36",1236,1236,"Khyri Thomas made Jumper.",39,29,10,0.943981458830157,"Creighton","Providence",4,3,0,0,9,400988556,2017-12-31
154,1,"0:09",1209,1209,"Alpha Diallo Turnover.",39,29,10,0.946132143846826,"Creighton","Providence",4,3,0,0,9,400988556,2017-12-31
155,1,"0:05",1205,1205,"Martin Krampelj missed Three Point Jumper.",39,29,10,0.946132143846826,"Creighton","Providence",4,3,0,0,9,400988556,2017-12-31
156,1,"0:05",1205,1205,"Alpha Diallo Defensive Rebound.",39,29,10,0.946132143846826,"Creighton","Providence",4,3,0,0,9,400988556,2017-12-31
157,1,"0:00",1200,1200,"End of 1st half",39,29,10,0.946132143846826,"Creighton","Providence",4,3,0,0,9,400988556,2017-12-31
158,2,"20:00",1200,1200,"PLAY",39,29,10,0.946132143846826,"Creighton","Providence",4,4,0,0,9,400988556,2017-12-31
159,2,"20:00",1200,1200,"Jump Ball won by Providence",39,29,10,0.946132143846826,"Creighton","Providence",4,4,0,0,9,400988556,2017-12-31
160,2,"19:43",1183,1183,"Rodney Bullock missed Jumper.",39,29,10,0.949514115192877,"Creighton","Providence",4,4,0,0,9,400988556,2017-12-31
161,2,"19:43",1183,1183,"Khyri Thomas Defensive Rebound.",39,29,10,0.949514115192877,"Creighton","Providence",4,4,0,0,9,400988556,2017-12-31
162,2,"19:29",1169,1169,"Toby Hegner made Three Point Jumper. Assisted by Davion Mintz.",42,29,13,0.967126845367981,"Creighton","Providence",4,4,0,0,9,400988556,2017-12-31
163,2,"19:03",1143,1143,"Foul on Nate Watson.",42,29,13,0.968274620578722,"Creighton","Providence",4,4,0,0,9,400988556,2017-12-31
164,2,"19:03",1143,1143,"Nate Watson Turnover.",42,29,13,0.968274620578722,"Creighton","Providence",4,4,0,0,9,400988556,2017-12-31
165,2,"18:56",1136,1136,"Martin Krampelj made Dunk. Assisted by Khyri Thomas.",44,29,15,0.976689090236309,"Creighton","Providence",4,4,0,0,9,400988556,2017-12-31
166,2,"18:56",1136,1136,"Foul on Kyron Cartwright.",44,29,15,0.976689090236309,"Creighton","Providence",4,4,0,0,9,400988556,2017-12-31
167,2,"18:56",1136,1136,"Martin Krampelj made Free Throw.",45,29,16,0.980121455764326,"Creighton","Providence",4,4,0,0,9,400988556,2017-12-31
168,2,"18:45",1125,1125,"Alpha Diallo missed Three Point Jumper.",45,29,16,0.985236311167918,"Creighton","Providence",4,4,0,0,9,400988556,2017-12-31
169,2,"18:45",1125,1125,"Davion Mintz Defensive Rebound.",45,29,16,0.985236311167918,"Creighton","Providence",4,4,0,0,9,400988556,2017-12-31
170,2,"18:37",1117,1117,"Khyri Thomas missed Three Point Jumper.",45,29,16,0.981306529633323,"Creighton","Providence",4,4,0,0,9,400988556,2017-12-31
171,2,"18:37",1117,1117,"Martin Krampelj Offensive Rebound.",45,29,16,0.981306529633323,"Creighton","Providence",4,4,0,0,9,400988556,2017-12-31
172,2,"18:32",1112,1112,"Martin Krampelj missed Jumper.",45,29,16,0.981306529633323,"Creighton","Providence",4,4,0,0,9,400988556,2017-12-31
173,2,"18:32",1112,1112,"Rodney Bullock Defensive Rebound.",45,29,16,0.981306529633323,"Creighton","Providence",4,4,0,0,9,400988556,2017-12-31
174,2,"18:26",1106,1106,"Rodney Bullock missed Three Point Jumper.",45,29,16,0.979988037178047,"Creighton","Providence",4,4,0,0,9,400988556,2017-12-31
175,2,"18:26",1106,1106,"Davion Mintz Defensive Rebound.",45,29,16,0.979988037178047,"Creighton","Providence",4,4,0,0,9,400988556,2017-12-31
176,2,"18:16",1096,1096,"Jump Ball won by Creighton",45,29,16,0.982506742126757,"Creighton","Providence",4,4,0,0,9,400988556,2017-12-31
177,2,"17:55",1075,1075,"Martin Krampelj missed Three Point Jumper.",45,29,16,0.980059180598197,"Creighton","Providence",4,4,0,0,9,400988556,2017-12-31
178,2,"17:55",1075,1075,"Providence Deadball Team Rebound.",45,29,16,0.980059180598197,"Creighton","Providence",4,4,0,0,9,400988556,2017-12-31
179,2,"17:47",1067,1067,"Jalen Lindsey made Three Point Jumper. Assisted by Alpha Diallo.",45,32,13,0.969258504366021,"Creighton","Providence",4,4,0,0,9,400988556,2017-12-31
180,2,"17:39",1059,1059,"Marcus Foster made Layup.",47,32,15,0.980808800916843,"Creighton","Providence",4,4,0,0,9,400988556,2017-12-31
181,2,"17:07",1027,1027,"Foul on Martin Krampelj.",47,32,15,0.98032317633626,"Creighton","Providence",4,4,0,0,9,400988556,2017-12-31
182,2,"17:05",1025,1025,"Alpha Diallo missed Three Point Jumper.",47,32,15,0.98032317633626,"Creighton","Providence",4,4,0,0,9,400988556,2017-12-31
183,2,"17:05",1025,1025,"Toby Hegner Defensive Rebound.",47,32,15,0.98032317633626,"Creighton","Providence",4,4,0,0,9,400988556,2017-12-31
