"play_id","half","time_remaining_half","secs_remaining","secs_remaining_absolute","description","home_score","away_score","score_diff","win_prob","home","away","home_time_out_remaining","away_time_out_remaining","home_timeout_ind","away_timeout_ind","home_favored_by","game_id","date"
1,1,"20:00",2400,2700,"PLAY",0,0,0,0.56693295069293,"Brown","Columbia",4,4,0,0,1,400991603,2018-02-10
2,1,"19:36",2376,2676,"Brandon Anderson missed Three Point Jumper.",0,0,0,0.577063569877332,"Brown","Columbia",4,4,0,0,1,400991603,2018-02-10
3,1,"19:36",2376,2676,"Desmond Cambridge Offensive Rebound.",0,0,0,0.577063569877332,"Brown","Columbia",4,4,0,0,1,400991603,2018-02-10
4,1,"19:28",2368,2668,"Matt DeWolf missed Layup.",0,0,0,0.561674669113406,"Brown","Columbia",4,4,0,0,1,400991603,2018-02-10
5,1,"19:28",2368,2668,"Brown Offensive Rebound.",0,0,0,0.561674669113406,"Brown","Columbia",4,4,0,0,1,400991603,2018-02-10
6,1,"19:26",2366,2666,"Desmond Cambridge made Jumper. Assisted by Brandon Anderson.",2,0,2,0.578106112777429,"Brown","Columbia",4,4,0,0,1,400991603,2018-02-10
7,1,"19:11",2351,2651,"Lukas Meisner made Three Point Jumper. Assisted by Mike Smith.",2,3,-1,0.561288559873202,"Brown","Columbia",4,4,0,0,1,400991603,2018-02-10
8,1,"18:55",2335,2635,"Desmond Cambridge made Jumper. Assisted by Zach Hunsaker.",4,3,1,0.592646125288663,"Brown","Columbia",4,4,0,0,1,400991603,2018-02-10
9,1,"18:36",2316,2616,"Quinton Adlesh made Three Point Jumper. Assisted by Nate Hickman.",4,6,-2,0.509089859563608,"Brown","Columbia",4,4,0,0,1,400991603,2018-02-10
10,1,"18:21",2301,2601,"Zach Hunsaker made Three Point Jumper. Assisted by Obi Okolie.",7,6,1,0.584718552743345,"Brown","Columbia",4,4,0,0,1,400991603,2018-02-10
11,1,"18:08",2288,2588,"Lukas Meisner made Three Point Jumper. Assisted by Mike Smith.",7,9,-2,0.509616689766646,"Brown","Columbia",4,4,0,0,1,400991603,2018-02-10
12,1,"17:48",2268,2568,"Zach Hunsaker missed Three Point Jumper.",7,9,-2,0.511730872932311,"Brown","Columbia",4,4,0,0,1,400991603,2018-02-10
13,1,"17:48",2268,2568,"Quinton Adlesh Defensive Rebound.",7,9,-2,0.511730872932311,"Brown","Columbia",4,4,0,0,1,400991603,2018-02-10
14,1,"17:18",2238,2538,"Mike Smith made Jumper.",7,11,-4,0.457821447406148,"Brown","Columbia",4,4,0,0,1,400991603,2018-02-10
15,1,"17:07",2227,2527,"Obi Okolie missed Layup.",7,11,-4,0.468874673499978,"Brown","Columbia",4,4,0,0,1,400991603,2018-02-10
16,1,"17:07",2227,2527,"Lukas Meisner Defensive Rebound.",7,11,-4,0.468874673499978,"Brown","Columbia",4,4,0,0,1,400991603,2018-02-10
17,1,"16:59",2219,2519,"Mike Smith missed Three Point Jumper.",7,11,-4,0.446704403111328,"Brown","Columbia",4,4,0,0,1,400991603,2018-02-10
18,1,"16:59",2219,2519,"Matt DeWolf Defensive Rebound.",7,11,-4,0.446704403111328,"Brown","Columbia",4,4,0,0,1,400991603,2018-02-10
19,1,"16:51",2211,2511,"Brandon Anderson missed Jumper.",7,11,-4,0.446704403111328,"Brown","Columbia",4,4,0,0,1,400991603,2018-02-10
20,1,"16:51",2211,2511,"Quinton Adlesh Defensive Rebound.",7,11,-4,0.446704403111328,"Brown","Columbia",4,4,0,0,1,400991603,2018-02-10
21,1,"16:43",2203,2503,"Lukas Meisner made Layup. Assisted by Quinton Adlesh.",7,13,-6,0.402352128897732,"Brown","Columbia",4,4,0,0,1,400991603,2018-02-10
22,1,"16:29",2189,2489,"Zach Hunsaker Turnover.",7,13,-6,0.407538970270897,"Brown","Columbia",4,4,0,0,1,400991603,2018-02-10
23,1,"16:01",2161,2461,"Mike Smith made Jumper.",7,15,-8,0.349713316370422,"Brown","Columbia",4,4,0,0,1,400991603,2018-02-10
24,1,"15:46",2146,2446,"Zach Hunsaker missed Three Point Jumper.",7,15,-8,0.374730193879783,"Brown","Columbia",4,4,0,0,1,400991603,2018-02-10
25,1,"15:46",2146,2446,"Quinton Adlesh Defensive Rebound.",7,15,-8,0.374730193879783,"Brown","Columbia",4,4,0,0,1,400991603,2018-02-10
26,1,"15:34",2134,2434,"Mike Smith made Layup.",7,17,-10,0.277842406717181,"Brown","Columbia",4,4,0,0,1,400991603,2018-02-10
27,1,"15:16",2116,2416,"Desmond Cambridge missed Jumper.",7,17,-10,0.281742117975608,"Brown","Columbia",4,4,0,0,1,400991603,2018-02-10
28,1,"15:16",2116,2416,"Lukas Meisner Defensive Rebound.",7,17,-10,0.281742117975608,"Brown","Columbia",4,4,0,0,1,400991603,2018-02-10
29,1,"14:53",2093,2393,"Lukas Meisner Turnover.",7,17,-10,0.270378485860733,"Brown","Columbia",4,4,0,0,1,400991603,2018-02-10
30,1,"14:53",2093,2393,"Official TV Timeout",7,17,-10,0.270378485860733,"Brown","Columbia",4,4,0,0,1,400991603,2018-02-10
31,1,"14:40",2080,2380,"Brandon Anderson made Layup.",9,17,-8,0.35592901465052,"Brown","Columbia",4,4,0,0,1,400991603,2018-02-10
32,1,"14:26",2066,2366,"Mike Smith missed Three Point Jumper.",9,17,-8,0.322046139979461,"Brown","Columbia",4,4,0,0,1,400991603,2018-02-10
33,1,"14:26",2066,2366,"Lukas Meisner Offensive Rebound.",9,17,-8,0.322046139979461,"Brown","Columbia",4,4,0,0,1,400991603,2018-02-10
34,1,"14:13",2053,2353,"Lukas Meisner missed Three Point Jumper.",9,17,-8,0.328211784397476,"Brown","Columbia",4,4,0,0,1,400991603,2018-02-10
35,1,"14:13",2053,2353,"Brandon Anderson Defensive Rebound.",9,17,-8,0.328211784397476,"Brown","Columbia",4,4,0,0,1,400991603,2018-02-10
36,1,"14:04",2044,2344,"Tamenang Choh missed Dunk.",9,17,-8,0.336070073566919,"Brown","Columbia",4,4,0,0,1,400991603,2018-02-10
37,1,"14:04",2044,2344,"Quinton Adlesh Defensive Rebound.",9,17,-8,0.336070073566919,"Brown","Columbia",4,4,0,0,1,400991603,2018-02-10
38,1,"13:59",2039,2339,"Quinton Adlesh missed Jumper.",9,17,-8,0.355380685262053,"Brown","Columbia",4,4,0,0,1,400991603,2018-02-10
39,1,"13:59",2039,2339,"Jason Massey Defensive Rebound.",9,17,-8,0.355380685262053,"Brown","Columbia",4,4,0,0,1,400991603,2018-02-10
40,1,"13:40",2020,2320,"Jason Massey missed Layup.",9,17,-8,0.303920685691832,"Brown","Columbia",4,4,0,0,1,400991603,2018-02-10
41,1,"13:40",2020,2320,"Tamenang Choh Offensive Rebound.",9,17,-8,0.303920685691832,"Brown","Columbia",4,4,0,0,1,400991603,2018-02-10
42,1,"13:37",2017,2317,"Foul on Lukas Meisner.",9,17,-8,0.343542660009573,"Brown","Columbia",4,4,0,0,1,400991603,2018-02-10
43,1,"13:37",2017,2317,"Tamenang Choh made Free Throw.",10,17,-7,0.370064380494492,"Brown","Columbia",4,4,0,0,1,400991603,2018-02-10
44,1,"13:37",2017,2317,"Tamenang Choh missed Free Throw.",10,17,-7,0.370064380494492,"Brown","Columbia",4,4,0,0,1,400991603,2018-02-10
45,1,"13:37",2017,2317,"Nate Hickman Defensive Rebound.",10,17,-7,0.370064380494492,"Brown","Columbia",4,4,0,0,1,400991603,2018-02-10
46,1,"13:20",2000,2300,"Quinton Adlesh Turnover.",10,17,-7,0.368437927537102,"Brown","Columbia",4,4,0,0,1,400991603,2018-02-10
47,1,"13:19",1999,2299,"Brandon Anderson Steal.",10,17,-7,0.341268827621474,"Brown","Columbia",4,4,0,0,1,400991603,2018-02-10
48,1,"13:14",1994,2294,"Travis Fuller missed Layup.",10,17,-7,0.341268827621474,"Brown","Columbia",4,4,0,0,1,400991603,2018-02-10
49,1,"13:14",1994,2294,"Jaron Faulds Block.",10,17,-7,0.341268827621474,"Brown","Columbia",4,4,0,0,1,400991603,2018-02-10
50,1,"13:12",1992,2292,"Brown Offensive Rebound.",10,17,-7,0.341268827621474,"Brown","Columbia",4,4,0,0,1,400991603,2018-02-10
51,1,"12:55",1975,2275,"Travis Fuller missed Layup.",10,17,-7,0.347263203454433,"Brown","Columbia",4,4,0,0,1,400991603,2018-02-10
52,1,"12:55",1975,2275,"Jaron Faulds Defensive Rebound.",10,17,-7,0.347263203454433,"Brown","Columbia",4,4,0,0,1,400991603,2018-02-10
53,1,"12:45",1965,2265,"Nate Hickman Turnover.",10,17,-7,0.378446806673277,"Brown","Columbia",4,4,0,0,1,400991603,2018-02-10
54,1,"12:32",1952,2252,"Desmond Cambridge made Layup. Assisted by Travis Fuller.",12,17,-5,0.4157888373063,"Brown","Columbia",4,4,0,0,1,400991603,2018-02-10
55,1,"12:32",1952,2252,"Foul on Rodney Hunter.",12,17,-5,0.4157888373063,"Brown","Columbia",4,4,0,0,1,400991603,2018-02-10
56,1,"12:32",1952,2252,"Desmond Cambridge made Free Throw.",13,17,-4,0.446445654265819,"Brown","Columbia",4,4,0,0,1,400991603,2018-02-10
57,1,"12:14",1934,2234,"Gabe Stefanini made Three Point Jumper. Assisted by Jaron Faulds.",13,20,-7,0.332693384304824,"Brown","Columbia",4,4,0,0,1,400991603,2018-02-10
58,1,"12:04",1924,2224,"Brandon Anderson missed Layup.",13,20,-7,0.337112272521594,"Brown","Columbia",4,4,0,0,1,400991603,2018-02-10
59,1,"12:04",1924,2224,"Quinton Adlesh Defensive Rebound.",13,20,-7,0.337112272521594,"Brown","Columbia",4,4,0,0,1,400991603,2018-02-10
60,1,"11:54",1914,2214,"Nate Hickman Turnover.",13,20,-7,0.359086052531731,"Brown","Columbia",4,4,0,0,1,400991603,2018-02-10
61,1,"11:54",1914,2214,"Foul on Nate Hickman.",13,20,-7,0.359086052531731,"Brown","Columbia",4,4,0,0,1,400991603,2018-02-10
62,1,"11:54",1914,2214,"Official TV Timeout",13,20,-7,0.359086052531731,"Brown","Columbia",4,4,0,0,1,400991603,2018-02-10
63,1,"11:36",1896,2196,"Brandon Anderson made Three Point Jumper. Assisted by Travis Fuller.",16,20,-4,0.435416973567853,"Brown","Columbia",4,4,0,0,1,400991603,2018-02-10
64,1,"11:10",1870,2170,"Foul on Desmond Cambridge.",16,20,-4,0.435179930408442,"Brown","Columbia",4,4,0,0,1,400991603,2018-02-10
65,1,"10:56",1856,2156,"Gabe Stefanini missed Three Point Jumper.",16,20,-4,0.440477285391408,"Brown","Columbia",4,4,0,0,1,400991603,2018-02-10
66,1,"10:56",1856,2156,"Jason Massey Defensive Rebound.",16,20,-4,0.440477285391408,"Brown","Columbia",4,4,0,0,1,400991603,2018-02-10
67,1,"10:44",1844,2144,"Chris Sullivan made Jumper.",18,20,-2,0.480342244450397,"Brown","Columbia",4,4,0,0,1,400991603,2018-02-10
68,1,"10:28",1828,2128,"Jaron Faulds Turnover.",18,20,-2,0.521295097729227,"Brown","Columbia",4,4,0,0,1,400991603,2018-02-10
69,1,"10:24",1824,2124,"Obi Okolie Steal.",18,20,-2,0.521295097729227,"Brown","Columbia",4,4,0,0,1,400991603,2018-02-10
70,1,"10:22",1822,2122,"Obi Okolie made Dunk.",20,20,0,0.580770911809173,"Brown","Columbia",4,4,0,0,1,400991603,2018-02-10
71,1,"10:05",1805,2105,"Foul on Chris Sullivan.",20,20,0,0.555623424928777,"Brown","Columbia",4,4,0,0,1,400991603,2018-02-10
72,1,"9:46",1786,2086,"Rodney Hunter Turnover.",20,20,0,0.541426961325745,"Brown","Columbia",4,4,0,0,1,400991603,2018-02-10
73,1,"9:44",1784,2084,"Brandon Anderson Steal.",20,20,0,0.541426961325745,"Brown","Columbia",4,4,0,0,1,400991603,2018-02-10
74,1,"9:35",1775,2075,"Obi Okolie missed Layup.",20,20,0,0.544920010114542,"Brown","Columbia",4,4,0,0,1,400991603,2018-02-10
75,1,"9:35",1775,2075,"Lukas Meisner Defensive Rebound.",20,20,0,0.544920010114542,"Brown","Columbia",4,4,0,0,1,400991603,2018-02-10
76,1,"9:17",1757,2057,"Mike Smith missed Jumper.",20,20,0,0.532667418288969,"Brown","Columbia",4,4,0,0,1,400991603,2018-02-10
77,1,"9:17",1757,2057,"Joshua Howard Defensive Rebound.",20,20,0,0.532667418288969,"Brown","Columbia",4,4,0,0,1,400991603,2018-02-10
78,1,"9:08",1748,2048,"Joshua Howard missed Three Point Jumper.",20,20,0,0.572169094822466,"Brown","Columbia",4,4,0,0,1,400991603,2018-02-10
79,1,"9:08",1748,2048,"Mike Smith Defensive Rebound.",20,20,0,0.572169094822466,"Brown","Columbia",4,4,0,0,1,400991603,2018-02-10
80,1,"9:01",1741,2041,"Nate Hickman missed Three Point Jumper.",20,20,0,0.572169094822466,"Brown","Columbia",4,4,0,0,1,400991603,2018-02-10
81,1,"9:01",1741,2041,"Columbia Offensive Rebound.",20,20,0,0.572169094822466,"Brown","Columbia",4,4,0,0,1,400991603,2018-02-10
82,1,"8:59",1739,2039,"Foul on Tamenang Choh.",20,20,0,0.559350332670999,"Brown","Columbia",4,4,0,0,1,400991603,2018-02-10
83,1,"8:50",1730,2030,"Mike Smith missed Three Point Jumper.",20,20,0,0.559350332670999,"Brown","Columbia",4,4,0,0,1,400991603,2018-02-10
84,1,"8:50",1730,2030,"Lukas Meisner Offensive Rebound.",20,20,0,0.559350332670999,"Brown","Columbia",4,4,0,0,1,400991603,2018-02-10
85,1,"8:47",1727,2027,"Lukas Meisner missed Layup.",20,20,0,0.571287549272368,"Brown","Columbia",4,4,0,0,1,400991603,2018-02-10
86,1,"8:47",1727,2027,"Lukas Meisner Offensive Rebound.",20,20,0,0.571287549272368,"Brown","Columbia",4,4,0,0,1,400991603,2018-02-10
87,1,"8:44",1724,2024,"Lukas Meisner missed Layup.",20,20,0,0.571287549272368,"Brown","Columbia",4,4,0,0,1,400991603,2018-02-10
88,1,"8:44",1724,2024,"Lukas Meisner Offensive Rebound.",20,20,0,0.571287549272368,"Brown","Columbia",4,4,0,0,1,400991603,2018-02-10
89,1,"8:43",1723,2023,"Foul on Zach Hunsaker.",20,20,0,0.571287549272368,"Brown","Columbia",4,4,0,0,1,400991603,2018-02-10
90,1,"8:36",1716,2016,"Lukas Meisner missed Three Point Jumper.",20,20,0,0.562141777236771,"Brown","Columbia",4,4,0,0,1,400991603,2018-02-10
91,1,"8:36",1716,2016,"Desmond Cambridge Defensive Rebound.",20,20,0,0.562141777236771,"Brown","Columbia",4,4,0,0,1,400991603,2018-02-10
92,1,"8:21",1701,2001,"Foul on Kyle Castlin.",20,20,0,0.548422362120716,"Brown","Columbia",4,4,0,0,1,400991603,2018-02-10
93,1,"8:21",1701,2001,"Joshua Howard missed Free Throw.",20,20,0,0.548422362120716,"Brown","Columbia",4,4,0,0,1,400991603,2018-02-10
94,1,"8:21",1701,2001,"Brown Deadball Team Rebound.",20,20,0,0.548422362120716,"Brown","Columbia",4,4,0,0,1,400991603,2018-02-10
95,1,"8:21",1701,2001,"Joshua Howard made Free Throw.",21,20,1,0.579810693147652,"Brown","Columbia",4,4,0,0,1,400991603,2018-02-10
96,1,"8:06",1686,1986,"Kyle Castlin made Layup. Assisted by Lukas Meisner.",21,22,-1,0.523533735700316,"Brown","Columbia",4,4,0,0,1,400991603,2018-02-10
97,1,"7:57",1677,1977,"Foul on Kyle Castlin.",21,22,-1,0.527476439857033,"Brown","Columbia",4,4,0,0,1,400991603,2018-02-10
98,1,"7:57",1677,1977,"Official TV Timeout",21,22,-1,0.527476439857033,"Brown","Columbia",4,4,0,0,1,400991603,2018-02-10
99,1,"7:55",1675,1975,"Desmond Cambridge made Jumper. Assisted by Obi Okolie.",23,22,1,0.595595847287037,"Brown","Columbia",4,4,0,0,1,400991603,2018-02-10
100,1,"7:31",1651,1951,"Nate Hickman missed Layup.",23,22,1,0.59724909481046,"Brown","Columbia",4,4,0,0,1,400991603,2018-02-10
101,1,"7:31",1651,1951,"Joshua Howard Block.",23,22,1,0.59724909481046,"Brown","Columbia",4,4,0,0,1,400991603,2018-02-10
102,1,"7:28",1648,1948,"Obi Okolie Defensive Rebound.",23,22,1,0.599770766081692,"Brown","Columbia",4,4,0,0,1,400991603,2018-02-10
103,1,"7:21",1641,1941,"Joshua Howard missed Layup.",23,22,1,0.599770766081692,"Brown","Columbia",4,4,0,0,1,400991603,2018-02-10
104,1,"7:21",1641,1941,"Brown Offensive Rebound.",23,22,1,0.599770766081692,"Brown","Columbia",4,4,0,0,1,400991603,2018-02-10
105,1,"7:09",1629,1929,"Tamenang Choh Turnover.",23,22,1,0.587106827098911,"Brown","Columbia",4,4,0,0,1,400991603,2018-02-10
106,1,"6:53",1613,1913,"Mike Smith missed Layup.",23,22,1,0.576838667434317,"Brown","Columbia",4,4,0,0,1,400991603,2018-02-10
107,1,"6:53",1613,1913,"Desmond Cambridge Defensive Rebound.",23,22,1,0.576838667434317,"Brown","Columbia",4,4,0,0,1,400991603,2018-02-10
108,1,"6:40",1600,1900,"Tamenang Choh made Layup.",25,22,3,0.645050881303745,"Brown","Columbia",4,4,0,0,1,400991603,2018-02-10
109,1,"6:24",1584,1884,"Lukas Meisner Turnover.",25,22,3,0.641901111990083,"Brown","Columbia",4,4,0,0,1,400991603,2018-02-10
110,1,"6:10",1570,1870,"Joshua Howard missed Layup.",25,22,3,0.671939173117125,"Brown","Columbia",4,4,0,0,1,400991603,2018-02-10
111,1,"6:10",1570,1870,"Lukas Meisner Block.",25,22,3,0.671939173117125,"Brown","Columbia",4,4,0,0,1,400991603,2018-02-10
112,1,"6:08",1568,1868,"Lukas Meisner Defensive Rebound.",25,22,3,0.646733185200531,"Brown","Columbia",4,4,0,0,1,400991603,2018-02-10
113,1,"5:56",1556,1856,"Nate Hickman made Three Point Jumper. Assisted by Quinton Adlesh.",25,25,0,0.548622711341738,"Brown","Columbia",4,4,0,0,1,400991603,2018-02-10
114,1,"5:48",1548,1848,"Brandon Anderson Turnover.",25,25,0,0.560744134183064,"Brown","Columbia",4,4,0,0,1,400991603,2018-02-10
115,1,"5:26",1526,1826,"Lukas Meisner missed Three Point Jumper.",25,25,0,0.557820052305208,"Brown","Columbia",4,4,0,0,1,400991603,2018-02-10
116,1,"5:26",1526,1826,"Obi Okolie Defensive Rebound.",25,25,0,0.557820052305208,"Brown","Columbia",4,4,0,0,1,400991603,2018-02-10
117,1,"5:15",1515,1815,"Desmond Cambridge made Jumper. Assisted by Brandon Anderson.",27,25,2,0.645594047330441,"Brown","Columbia",4,4,0,0,1,400991603,2018-02-10
118,1,"4:58",1498,1798,"Peter Barba missed Three Point Jumper.",27,25,2,0.643343487588739,"Brown","Columbia",4,4,0,0,1,400991603,2018-02-10
119,1,"4:58",1498,1798,"Joshua Howard Defensive Rebound.",27,25,2,0.643343487588739,"Brown","Columbia",4,4,0,0,1,400991603,2018-02-10
120,1,"4:39",1479,1779,"Zach Hunsaker made Three Point Jumper. Assisted by Desmond Cambridge.",30,25,5,0.72869240862353,"Brown","Columbia",4,4,0,0,1,400991603,2018-02-10
121,1,"4:29",1469,1769,"Mike Smith made Layup.",30,27,3,0.666576593135019,"Brown","Columbia",4,4,0,0,1,400991603,2018-02-10
122,1,"4:12",1452,1752,"Foul on Peter Barba.",30,27,3,0.650439237619794,"Brown","Columbia",4,4,0,0,1,400991603,2018-02-10
123,1,"4:12",1452,1752,"Obi Okolie missed Free Throw.",30,27,3,0.650439237619794,"Brown","Columbia",4,4,0,0,1,400991603,2018-02-10
124,1,"4:12",1452,1752,"Brown Deadball Team Rebound.",30,27,3,0.650439237619794,"Brown","Columbia",4,4,0,0,1,400991603,2018-02-10
125,1,"4:12",1452,1752,"Obi Okolie made Free Throw.",31,27,4,0.683175933779457,"Brown","Columbia",4,4,0,0,1,400991603,2018-02-10
126,1,"3:52",1432,1732,"Nate Hickman missed Three Point Jumper.",31,27,4,0.704545861506909,"Brown","Columbia",4,4,0,0,1,400991603,2018-02-10
127,1,"3:52",1432,1732,"Zach Hunsaker Defensive Rebound.",31,27,4,0.704545861506909,"Brown","Columbia",4,4,0,0,1,400991603,2018-02-10
128,1,"3:44",1424,1724,"Foul on Mike Smith.",31,27,4,0.683404982652601,"Brown","Columbia",4,4,0,0,1,400991603,2018-02-10
129,1,"3:44",1424,1724,"Official TV Timeout",31,27,4,0.683404982652601,"Brown","Columbia",4,4,0,0,1,400991603,2018-02-10
130,1,"3:44",1424,1724,"Brandon Anderson missed Free Throw.",31,27,4,0.683404982652601,"Brown","Columbia",4,4,0,0,1,400991603,2018-02-10
131,1,"3:44",1424,1724,"Quinton Adlesh Defensive Rebound.",31,27,4,0.683404982652601,"Brown","Columbia",4,4,0,0,1,400991603,2018-02-10
132,1,"3:29",1409,1709,"Quinton Adlesh missed Three Point Jumper.",31,27,4,0.712386150198774,"Brown","Columbia",4,4,0,0,1,400991603,2018-02-10
133,1,"3:29",1409,1709,"Jason Massey Defensive Rebound.",31,27,4,0.712386150198774,"Brown","Columbia",4,4,0,0,1,400991603,2018-02-10
134,1,"3:22",1402,1702,"Desmond Cambridge missed Three Point Jumper.",31,27,4,0.712386150198774,"Brown","Columbia",4,4,0,0,1,400991603,2018-02-10
135,1,"3:22",1402,1702,"Mike Smith Defensive Rebound.",31,27,4,0.712386150198774,"Brown","Columbia",4,4,0,0,1,400991603,2018-02-10
136,1,"3:05",1385,1685,"Foul on Jason Massey.",31,27,4,0.70424550284094,"Brown","Columbia",4,4,0,0,1,400991603,2018-02-10
137,1,"3:05",1385,1685,"Quinton Adlesh missed Free Throw.",31,27,4,0.70424550284094,"Brown","Columbia",4,4,0,0,1,400991603,2018-02-10
138,1,"3:05",1385,1685,"Columbia Deadball Team Rebound.",31,27,4,0.70424550284094,"Brown","Columbia",4,4,0,0,1,400991603,2018-02-10
139,1,"3:05",1385,1685,"Quinton Adlesh made Free Throw.",31,28,3,0.672199310257568,"Brown","Columbia",4,4,0,0,1,400991603,2018-02-10
140,1,"2:53",1373,1673,"Desmond Cambridge missed Three Point Jumper.",31,28,3,0.645907950727502,"Brown","Columbia",4,4,0,0,1,400991603,2018-02-10
141,1,"2:53",1373,1673,"Jason Massey Offensive Rebound.",31,28,3,0.645907950727502,"Brown","Columbia",4,4,0,0,1,400991603,2018-02-10
142,1,"2:45",1365,1665,"Zach Hunsaker made Three Point Jumper. Assisted by Jason Massey.",34,28,6,0.759304602113599,"Brown","Columbia",4,4,0,0,1,400991603,2018-02-10
143,1,"2:31",1351,1651,"Rodney Hunter Turnover.",34,28,6,0.770114142961949,"Brown","Columbia",4,4,0,0,1,400991603,2018-02-10
144,1,"2:30",1350,1650,"Desmond Cambridge Steal.",34,28,6,0.770114142961949,"Brown","Columbia",4,4,0,0,1,400991603,2018-02-10
145,1,"2:28",1348,1648,"Foul on Rodney Hunter.",34,28,6,0.758758462950811,"Brown","Columbia",4,4,1,0,1,400991603,2018-02-10
146,1,"2:28",1348,1648,"Desmond Cambridge made Free Throw.",35,28,7,0.786477481755123,"Brown","Columbia",4,4,1,0,1,400991603,2018-02-10
147,1,"2:28",1348,1648,"Columbia  Timeout",35,28,7,0.786477481755123,"Brown","Columbia",3,4,1,0,1,400991603,2018-02-10
148,1,"2:28",1348,1648,"Desmond Cambridge made Free Throw.",36,28,8,0.811801523365125,"Brown","Columbia",3,4,1,0,1,400991603,2018-02-10
149,1,"2:10",1330,1630,"Lukas Meisner Turnover.",36,28,8,0.804082284672214,"Brown","Columbia",3,4,1,0,1,400991603,2018-02-10
150,1,"1:54",1314,1614,"Tamenang Choh Turnover.",36,28,8,0.825642915628313,"Brown","Columbia",3,4,1,0,1,400991603,2018-02-10
151,1,"1:32",1292,1592,"Mike Smith Turnover.",36,28,8,0.839138801764993,"Brown","Columbia",3,4,1,0,1,400991603,2018-02-10
152,1,"1:07",1267,1567,"Desmond Cambridge missed Three Point Jumper.",36,28,8,0.825400526259546,"Brown","Columbia",3,4,0,0,1,400991603,2018-02-10
153,1,"1:07",1267,1567,"Obi Okolie Offensive Rebound.",36,28,8,0.825400526259546,"Brown","Columbia",3,4,0,0,1,400991603,2018-02-10
154,1,"1:01",1261,1561,"Brandon Anderson missed Three Point Jumper.",36,28,8,0.825400526259546,"Brown","Columbia",3,4,0,0,1,400991603,2018-02-10
155,1,"1:01",1261,1561,"Nate Hickman Defensive Rebound.",36,28,8,0.825400526259546,"Brown","Columbia",3,4,0,0,1,400991603,2018-02-10
156,1,"0:52",1252,1552,"Nate Hickman missed Layup.",36,28,8,0.805897673495085,"Brown","Columbia",3,4,0,0,1,400991603,2018-02-10
157,1,"0:52",1252,1552,"Tamenang Choh Defensive Rebound.",36,28,8,0.805897673495085,"Brown","Columbia",3,4,0,0,1,400991603,2018-02-10
158,1,"0:46",1246,1546,"Brandon Anderson Turnover.",36,28,8,0.810951238296196,"Brown","Columbia",3,4,0,0,1,400991603,2018-02-10
159,1,"0:45",1245,1545,"Mike Smith Steal.",36,28,8,0.810951238296196,"Brown","Columbia",3,4,0,0,1,400991603,2018-02-10
160,1,"0:42",1242,1542,"Mike Smith missed Jumper.",36,28,8,0.810951238296196,"Brown","Columbia",3,4,0,0,1,400991603,2018-02-10
161,1,"0:42",1242,1542,"Brown Defensive Rebound.",36,28,8,0.810951238296196,"Brown","Columbia",3,4,0,0,1,400991603,2018-02-10
162,1,"0:15",1215,1515,"Zach Hunsaker missed Three Point Jumper.",36,28,8,0.819310089877943,"Brown","Columbia",3,4,0,0,1,400991603,2018-02-10
163,1,"0:15",1215,1515,"Nate Hickman Defensive Rebound.",36,28,8,0.819310089877943,"Brown","Columbia",3,4,0,0,1,400991603,2018-02-10
164,1,"0:08",1208,1508,"Foul on Zach Hunsaker.",36,28,8,0.815629146968252,"Brown","Columbia",3,4,0,1,1,400991603,2018-02-10
165,1,"0:08",1208,1508,"Lukas Meisner made Free Throw.",36,29,7,0.790469866285311,"Brown","Columbia",3,4,0,1,1,400991603,2018-02-10
166,1,"0:08",1208,1508,"Brown  Timeout",36,29,7,0.790469866285311,"Brown","Columbia",3,3,0,1,1,400991603,2018-02-10
167,1,"0:08",1208,1508,"Lukas Meisner missed Free Throw.",36,29,7,0.790469866285311,"Brown","Columbia",3,3,0,1,1,400991603,2018-02-10
168,1,"0:08",1208,1508,"Zach Hunsaker Defensive Rebound.",36,29,7,0.790469866285311,"Brown","Columbia",3,3,0,1,1,400991603,2018-02-10
169,1,"0:03",1203,1503,"Brandon Anderson missed Three Point Jumper.",36,29,7,0.790469866285311,"Brown","Columbia",3,3,0,1,1,400991603,2018-02-10
170,1,"0:03",1203,1503,"Nate Hickman Defensive Rebound.",36,29,7,0.790469866285311,"Brown","Columbia",3,3,0,1,1,400991603,2018-02-10
171,1,"0:00",1200,1500,"End of 1st half",36,29,7,0.790469866285311,"Brown","Columbia",3,3,0,1,1,400991603,2018-02-10
172,2,"20:00",1200,1500,"PLAY",36,29,7,0.790469866285311,"Brown","Columbia",4,4,0,0,1,400991603,2018-02-10
173,2,"19:45",1185,1485,"Mike Smith missed Layup.",36,29,7,0.797350384162875,"Brown","Columbia",4,4,0,0,1,400991603,2018-02-10
174,2,"19:45",1185,1485,"Desmond Cambridge Block.",36,29,7,0.797350384162875,"Brown","Columbia",4,4,0,0,1,400991603,2018-02-10
175,2,"19:42",1182,1482,"Tamenang Choh Defensive Rebound.",36,29,7,0.797350384162875,"Brown","Columbia",4,4,0,0,1,400991603,2018-02-10
176,2,"19:31",1171,1471,"Zach Hunsaker made Three Point Jumper. Assisted by Obi Okolie.",39,29,10,0.865523147858825,"Brown","Columbia",4,4,0,0,1,400991603,2018-02-10
177,2,"19:07",1147,1447,"Foul on Tamenang Choh.",39,29,10,0.874414466370347,"Brown","Columbia",4,4,0,0,1,400991603,2018-02-10
178,2,"18:54",1134,1434,"Nate Hickman made Layup. Assisted by Lukas Meisner.",39,31,8,0.823370050470515,"Brown","Columbia",4,4,0,0,1,400991603,2018-02-10
179,2,"18:29",1109,1409,"Desmond Cambridge made Dunk. Assisted by Obi Okolie.",41,31,10,0.864044770357541,"Brown","Columbia",4,4,0,0,1,400991603,2018-02-10
180,2,"18:13",1093,1393,"Quinton Adlesh made Three Point Jumper. Assisted by Kyle Castlin.",41,34,7,0.809769668226313,"Brown","Columbia",4,4,0,0,1,400991603,2018-02-10
181,2,"17:58",1078,1378,"Desmond Cambridge missed Jumper.",41,34,7,0.807836851577397,"Brown","Columbia",4,4,0,0,1,400991603,2018-02-10
182,2,"17:58",1078,1378,"Lukas Meisner Defensive Rebound.",41,34,7,0.807836851577397,"Brown","Columbia",4,4,0,0,1,400991603,2018-02-10
183,2,"17:50",1070,1370,"Foul on Obi Okolie.",41,34,7,0.807836851577397,"Brown","Columbia",4,4,0,0,1,400991603,2018-02-10
184,2,"17:49",1069,1369,"Mike Smith made Three Point Jumper. Assisted by Nate Hickman.",41,37,4,0.725275320040683,"Brown","Columbia",4,4,0,0,1,400991603,2018-02-10
185,2,"17:47",1067,1367,"Foul on Brandon Anderson.",41,37,4,0.725275320040683,"Brown","Columbia",4,4,0,0,1,400991603,2018-02-10
186,2,"17:47",1067,1367,"Mike Smith made Free Throw.",41,38,3,0.689624000153862,"Brown","Columbia",4,4,0,0,1,400991603,2018-02-10
187,2,"17:30",1050,1350,"Foul on Mike Smith.",41,38,3,0.686871191523842,"Brown","Columbia",4,4,0,0,1,400991603,2018-02-10
188,2,"17:18",1038,1338,"Brandon Anderson made Layup.",43,38,5,0.739328536154313,"Brown","Columbia",4,4,0,0,1,400991603,2018-02-10
189,2,"16:51",1011,1311,"Foul on Brandon Anderson.",43,38,5,0.734654816942128,"Brown","Columbia",4,4,0,0,1,400991603,2018-02-10
190,2,"16:46",1006,1306,"Mike Smith missed Three Point Jumper.",43,38,5,0.745691970196579,"Brown","Columbia",4,4,0,0,1,400991603,2018-02-10
191,2,"16:46",1006,1306,"Desmond Cambridge Defensive Rebound.",43,38,5,0.745691970196579,"Brown","Columbia",4,4,0,0,1,400991603,2018-02-10
192,2,"16:27",987,1287,"Foul on Nate Hickman.",43,38,5,0.780501640396752,"Brown","Columbia",4,4,0,0,1,400991603,2018-02-10
