"play_id","half","time_remaining_half","secs_remaining","secs_remaining_absolute","description","home_score","away_score","score_diff","win_prob","home","away","home_time_out_remaining","away_time_out_remaining","home_timeout_ind","away_timeout_ind","home_favored_by","game_id","date"
1,1,"20:00",2400,2400,"PLAY",0,0,0,0.753398478938886,"North Texas","Southern Miss",4,4,0,0,5,400919468,2017-02-25
2,1,"19:36",2376,2376,"Shane Temara missed Three Point Jumper.",0,0,0,0.75064780749467,"North Texas","Southern Miss",4,4,0,0,5,400919468,2017-02-25
3,1,"19:36",2376,2376,"A.J. Lawson Offensive Rebound.",0,0,0,0.75064780749467,"North Texas","Southern Miss",4,4,0,0,5,400919468,2017-02-25
4,1,"19:29",2369,2369,"Derail Green made Three Point Jumper. Assisted by J-Mychal Reese.",3,0,3,0.755046924884435,"North Texas","Southern Miss",4,4,0,0,5,400919468,2017-02-25
5,1,"19:03",2343,2343,"Raheem Watts missed Jumper.",3,0,3,0.787398939266299,"North Texas","Southern Miss",4,4,0,0,5,400919468,2017-02-25
6,1,"19:03",2343,2343,"A.J. Lawson Defensive Rebound.",3,0,3,0.787398939266299,"North Texas","Southern Miss",4,4,0,0,5,400919468,2017-02-25
7,1,"18:43",2323,2323,"Foul on Raheem Watts.",3,0,3,0.80649600485792,"North Texas","Southern Miss",4,4,0,0,5,400919468,2017-02-25
8,1,"18:41",2321,2321,"A.J. Lawson missed Jumper.",3,0,3,0.80649600485792,"North Texas","Southern Miss",4,4,0,0,5,400919468,2017-02-25
9,1,"18:41",2321,2321,"Quinton Campbell Defensive Rebound.",3,0,3,0.80649600485792,"North Texas","Southern Miss",4,4,0,0,5,400919468,2017-02-25
10,1,"18:23",2303,2303,"Quinton Campbell missed Jumper.",3,0,3,0.78692148129315,"North Texas","Southern Miss",4,4,0,0,5,400919468,2017-02-25
11,1,"18:23",2303,2303,"J-Mychal Reese Defensive Rebound.",3,0,3,0.78692148129315,"North Texas","Southern Miss",4,4,0,0,5,400919468,2017-02-25
12,1,"18:16",2296,2296,"Shane Temara made Layup. Assisted by J-Mychal Reese.",5,0,5,0.826931409493503,"North Texas","Southern Miss",4,4,0,0,5,400919468,2017-02-25
13,1,"18:05",2285,2285,"Quinton Campbell made Layup.",5,2,3,0.793014347153117,"North Texas","Southern Miss",4,4,0,0,5,400919468,2017-02-25
14,1,"17:47",2267,2267,"J-Mychal Reese made Jumper.",7,2,5,0.846517412820788,"North Texas","Southern Miss",4,4,0,0,5,400919468,2017-02-25
15,1,"17:19",2239,2239,"Cortez Edwards missed Three Point Jumper.",7,2,5,0.83335697918382,"North Texas","Southern Miss",4,4,0,0,5,400919468,2017-02-25
16,1,"17:19",2239,2239,"Quinton Campbell Offensive Rebound.",7,2,5,0.83335697918382,"North Texas","Southern Miss",4,4,0,0,5,400919468,2017-02-25
17,1,"17:14",2234,2234,"Quinton Campbell made Jumper.",7,4,3,0.799912253057703,"North Texas","Southern Miss",4,4,0,0,5,400919468,2017-02-25
18,1,"16:53",2213,2213,"Derail Green missed Jumper.",7,4,3,0.808370267856171,"North Texas","Southern Miss",4,4,0,0,5,400919468,2017-02-25
19,1,"16:53",2213,2213,"Kevin Holland Defensive Rebound.",7,4,3,0.808370267856171,"North Texas","Southern Miss",4,4,0,0,5,400919468,2017-02-25
20,1,"16:42",2202,2202,"Quinton Campbell made Jumper. Assisted by Cortez Edwards.",7,6,1,0.760295541380116,"North Texas","Southern Miss",4,4,0,0,5,400919468,2017-02-25
21,1,"16:26",2186,2186,"J-Mychal Reese missed Layup.",7,6,1,0.758710677756733,"North Texas","Southern Miss",4,4,0,0,5,400919468,2017-02-25
22,1,"16:26",2186,2186,"Quinton Campbell Defensive Rebound.",7,6,1,0.758710677756733,"North Texas","Southern Miss",4,4,0,0,5,400919468,2017-02-25
23,1,"16:17",2177,2177,"Michael Ramey missed Three Point Jumper.",7,6,1,0.753378909499061,"North Texas","Southern Miss",4,4,0,0,5,400919468,2017-02-25
24,1,"16:17",2177,2177,"Quinton Campbell Offensive Rebound.",7,6,1,0.753378909499061,"North Texas","Southern Miss",4,4,0,0,5,400919468,2017-02-25
25,1,"16:15",2175,2175,"Foul on A.J. Lawson.",7,6,1,0.753378909499061,"North Texas","Southern Miss",4,4,0,0,5,400919468,2017-02-25
26,1,"16:15",2175,2175,"Quinton Campbell made Free Throw.",7,7,0,0.732644575553917,"North Texas","Southern Miss",4,4,0,0,5,400919468,2017-02-25
27,1,"16:15",2175,2175,"Quinton Campbell made Free Throw.",7,8,-1,0.710836114449289,"North Texas","Southern Miss",4,4,0,0,5,400919468,2017-02-25
28,1,"15:59",2159,2159,"A.J. Lawson made Jumper.",9,8,1,0.752284338434362,"North Texas","Southern Miss",4,4,0,0,5,400919468,2017-02-25
29,1,"15:28",2128,2128,"Quinton Campbell made Three Point Jumper. Assisted by Cortez Edwards.",9,11,-2,0.682970034844914,"North Texas","Southern Miss",4,4,0,0,5,400919468,2017-02-25
30,1,"15:11",2111,2111,"J-Mychal Reese missed Jumper.",9,11,-2,0.690856232578425,"North Texas","Southern Miss",4,4,0,0,5,400919468,2017-02-25
31,1,"15:11",2111,2111,"Southern Miss Defensive Rebound.",9,11,-2,0.690856232578425,"North Texas","Southern Miss",4,4,0,0,5,400919468,2017-02-25
32,1,"15:06",2106,2106,"Official TV Timeout",9,11,-2,0.683006098378025,"North Texas","Southern Miss",4,4,0,0,5,400919468,2017-02-25
33,1,"14:54",2094,2094,"Michael Ramey missed Jumper.",9,11,-2,0.674592495504036,"North Texas","Southern Miss",4,4,0,0,5,400919468,2017-02-25
34,1,"14:54",2094,2094,"Eddie Davis III Offensive Rebound.",9,11,-2,0.674592495504036,"North Texas","Southern Miss",4,4,0,0,5,400919468,2017-02-25
35,1,"14:50",2090,2090,"Eddie Davis III missed Jumper.",9,11,-2,0.674592495504036,"North Texas","Southern Miss",4,4,0,0,5,400919468,2017-02-25
36,1,"14:50",2090,2090,"Shane Temara Block.",9,11,-2,0.674592495504036,"North Texas","Southern Miss",4,4,0,0,5,400919468,2017-02-25
37,1,"14:47",2087,2087,"Michael Ramey Offensive Rebound.",9,11,-2,0.688266515803636,"North Texas","Southern Miss",4,4,0,0,5,400919468,2017-02-25
38,1,"14:39",2079,2079,"Eddie Davis III made Layup. Assisted by Quinton Campbell.",9,13,-4,0.640647800591913,"North Texas","Southern Miss",4,4,0,0,5,400919468,2017-02-25
39,1,"14:12",2052,2052,"Shane Temara missed Three Point Jumper.",9,13,-4,0.634406634753481,"North Texas","Southern Miss",4,4,0,0,5,400919468,2017-02-25
40,1,"14:12",2052,2052,"Quinton Campbell Defensive Rebound.",9,13,-4,0.634406634753481,"North Texas","Southern Miss",4,4,0,0,5,400919468,2017-02-25
41,1,"13:44",2024,2024,"Quinton Campbell missed Jumper.",9,13,-4,0.611931207329084,"North Texas","Southern Miss",4,4,0,0,5,400919468,2017-02-25
42,1,"13:44",2024,2024,"Ryan Woolridge Defensive Rebound.",9,13,-4,0.611931207329084,"North Texas","Southern Miss",4,4,0,0,5,400919468,2017-02-25
43,1,"13:40",2020,2020,"Ryan Woolridge Turnover.",9,13,-4,0.611931207329084,"North Texas","Southern Miss",4,4,0,0,5,400919468,2017-02-25
44,1,"13:26",2006,2006,"Michael Ramey made Three Point Jumper. Assisted by Kevin Holland.",9,16,-7,0.549419184675929,"North Texas","Southern Miss",4,4,0,0,5,400919468,2017-02-25
45,1,"13:12",1992,1992,"Derail Green made Jumper.",11,16,-5,0.58677447607811,"North Texas","Southern Miss",4,4,0,0,5,400919468,2017-02-25
46,1,"12:59",1979,1979,"Kevin Holland missed Jumper.",11,16,-5,0.595918184185999,"North Texas","Southern Miss",4,4,0,0,5,400919468,2017-02-25
47,1,"12:59",1979,1979,"Ryan Woolridge Defensive Rebound.",11,16,-5,0.595918184185999,"North Texas","Southern Miss",4,4,0,0,5,400919468,2017-02-25
48,1,"12:29",1949,1949,"Ryan Woolridge missed Three Point Jumper.",11,16,-5,0.584038702991332,"North Texas","Southern Miss",4,4,0,0,5,400919468,2017-02-25
49,1,"12:29",1949,1949,"Quinton Campbell Defensive Rebound.",11,16,-5,0.584038702991332,"North Texas","Southern Miss",4,4,0,0,5,400919468,2017-02-25
50,1,"11:57",1917,1917,"Foul on Ryan Woolridge.",11,16,-5,0.598534205135927,"North Texas","Southern Miss",4,4,0,0,5,400919468,2017-02-25
51,1,"11:57",1917,1917,"Official TV Timeout",11,16,-5,0.598534205135927,"North Texas","Southern Miss",4,4,0,0,5,400919468,2017-02-25
52,1,"11:57",1917,1917,"Cortez Edwards missed Free Throw.",11,16,-5,0.598534205135927,"North Texas","Southern Miss",4,4,0,0,5,400919468,2017-02-25
53,1,"11:57",1917,1917,"Southern Miss Deadball Team Rebound.",11,16,-5,0.598534205135927,"North Texas","Southern Miss",4,4,0,0,5,400919468,2017-02-25
54,1,"11:57",1917,1917,"Cortez Edwards made Free Throw.",11,17,-6,0.567195794818763,"North Texas","Southern Miss",4,4,0,0,5,400919468,2017-02-25
55,1,"11:33",1893,1893,"Allante Holston made Jumper.",13,17,-4,0.60803764139546,"North Texas","Southern Miss",4,4,0,0,5,400919468,2017-02-25
56,1,"11:21",1881,1881,"Eddie Davis III made Layup. Assisted by Quinton Campbell.",13,19,-6,0.554548188231531,"North Texas","Southern Miss",4,4,0,0,5,400919468,2017-02-25
57,1,"11:09",1869,1869,"Rickey Brice Jr. missed Jumper.",13,19,-6,0.544942714267436,"North Texas","Southern Miss",4,4,0,0,5,400919468,2017-02-25
58,1,"11:09",1869,1869,"Eddie Davis III Defensive Rebound.",13,19,-6,0.544942714267436,"North Texas","Southern Miss",4,4,0,0,5,400919468,2017-02-25
59,1,"10:48",1848,1848,"Quinton Campbell missed Three Point Jumper.",13,19,-6,0.540207933565221,"North Texas","Southern Miss",4,4,0,0,5,400919468,2017-02-25
60,1,"10:48",1848,1848,"Ryan Woolridge Defensive Rebound.",13,19,-6,0.540207933565221,"North Texas","Southern Miss",4,4,0,0,5,400919468,2017-02-25
61,1,"10:36",1836,1836,"Ja'Michael Brown made Layup.",15,19,-4,0.609413519506553,"North Texas","Southern Miss",4,4,0,0,5,400919468,2017-02-25
62,1,"10:12",1812,1812,"Cortez Edwards made Jumper.",15,21,-6,0.532384556599963,"North Texas","Southern Miss",4,4,0,0,5,400919468,2017-02-25
63,1,"9:50",1790,1790,"Rickey Brice Jr. missed Jumper.",15,21,-6,0.530084830822278,"North Texas","Southern Miss",4,4,0,0,5,400919468,2017-02-25
64,1,"9:50",1790,1790,"Quinton Campbell Defensive Rebound.",15,21,-6,0.530084830822278,"North Texas","Southern Miss",4,4,0,0,5,400919468,2017-02-25
65,1,"9:18",1758,1758,"Eddie Davis III made Jumper. Assisted by D'Angelo Richardson.",15,23,-8,0.440239596665937,"North Texas","Southern Miss",4,4,0,0,5,400919468,2017-02-25
66,1,"8:59",1739,1739,"Allante Holston missed Jumper.",15,23,-8,0.461417061261392,"North Texas","Southern Miss",4,4,0,0,5,400919468,2017-02-25
67,1,"8:59",1739,1739,"Eddie Davis III Block.",15,23,-8,0.461417061261392,"North Texas","Southern Miss",4,4,0,0,5,400919468,2017-02-25
68,1,"8:59",1739,1739,"Southern Miss Defensive Rebound.",15,23,-8,0.461417061261392,"North Texas","Southern Miss",4,4,0,0,5,400919468,2017-02-25
69,1,"8:56",1736,1736,"Michael Ramey made Three Point Jumper. Assisted by D'Angelo Richardson.",15,26,-11,0.362360808425374,"North Texas","Southern Miss",4,4,0,0,5,400919468,2017-02-25
70,1,"8:34",1714,1714,"Foul on Bilal Abdur-Rahim.",15,26,-11,0.37945616121962,"North Texas","Southern Miss",4,4,0,0,5,400919468,2017-02-25
71,1,"8:15",1695,1695,"Ja'Michael Brown Turnover.",15,26,-11,0.347219386850043,"North Texas","Southern Miss",4,4,0,0,5,400919468,2017-02-25
72,1,"8:14",1694,1694,"Michael Ramey Steal.",15,26,-11,0.347219386850043,"North Texas","Southern Miss",4,4,0,0,5,400919468,2017-02-25
73,1,"8:03",1683,1683,"D'Angelo Richardson missed Three Point Jumper.",15,26,-11,0.346412365672352,"North Texas","Southern Miss",4,4,0,0,5,400919468,2017-02-25
74,1,"8:03",1683,1683,"Derail Green Defensive Rebound.",15,26,-11,0.346412365672352,"North Texas","Southern Miss",4,4,0,0,5,400919468,2017-02-25
75,1,"7:50",1670,1670,"A.J. Lawson Turnover.",15,26,-11,0.358654226064866,"North Texas","Southern Miss",4,4,0,0,5,400919468,2017-02-25
76,1,"7:49",1669,1669,"Official TV Timeout",15,26,-11,0.377506689844325,"North Texas","Southern Miss",4,4,0,0,5,400919468,2017-02-25
77,1,"7:18",1638,1638,"Southern Miss  Turnover.",15,26,-11,0.377515905635717,"North Texas","Southern Miss",4,4,0,0,5,400919468,2017-02-25
78,1,"6:53",1613,1613,"Derail Green missed Three Point Jumper.",15,26,-11,0.327298153840981,"North Texas","Southern Miss",4,4,0,0,5,400919468,2017-02-25
79,1,"6:53",1613,1613,"Kevin Holland Defensive Rebound.",15,26,-11,0.327298153840981,"North Texas","Southern Miss",4,4,0,0,5,400919468,2017-02-25
80,1,"6:38",1598,1598,"Eddie Davis III made Layup. Assisted by Kevin Holland.",15,28,-13,0.304877005206249,"North Texas","Southern Miss",4,4,0,0,5,400919468,2017-02-25
81,1,"6:26",1586,1586,"Ryan Woolridge missed Jumper.",15,28,-13,0.290460402022083,"North Texas","Southern Miss",4,4,0,0,5,400919468,2017-02-25
82,1,"6:26",1586,1586,"Cortez Edwards Defensive Rebound.",15,28,-13,0.290460402022083,"North Texas","Southern Miss",4,4,0,0,5,400919468,2017-02-25
83,1,"6:10",1570,1570,"Bilal Abdur-Rahim missed Jumper.",15,28,-13,0.251234619000896,"North Texas","Southern Miss",4,4,0,0,5,400919468,2017-02-25
84,1,"6:10",1570,1570,"Eddie Davis III Offensive Rebound.",15,28,-13,0.251234619000896,"North Texas","Southern Miss",4,4,0,0,5,400919468,2017-02-25
85,1,"6:06",1566,1566,"Cortez Edwards made Layup. Assisted by Eddie Davis III.",15,30,-15,0.216517925004583,"North Texas","Southern Miss",4,4,0,0,5,400919468,2017-02-25
86,1,"6:02",1562,1562,"North Texas  Timeout",15,30,-15,0.216517925004583,"North Texas","Southern Miss",3,4,1,0,5,400919468,2017-02-25
87,1,"5:40",1540,1540,"Shane Temara missed Jumper.",15,30,-15,0.238878113809715,"North Texas","Southern Miss",3,4,1,0,5,400919468,2017-02-25
88,1,"5:40",1540,1540,"Shane Temara Offensive Rebound.",15,30,-15,0.238878113809715,"North Texas","Southern Miss",3,4,1,0,5,400919468,2017-02-25
89,1,"5:36",1536,1536,"Shane Temara missed Layup.",15,30,-15,0.236612038202386,"North Texas","Southern Miss",3,4,1,0,5,400919468,2017-02-25
90,1,"5:36",1536,1536,"Bilal Abdur-Rahim Defensive Rebound.",15,30,-15,0.236612038202386,"North Texas","Southern Miss",3,4,1,0,5,400919468,2017-02-25
91,1,"5:18",1518,1518,"Bilal Abdur-Rahim made Layup. Assisted by D'Angelo Richardson.",15,32,-17,0.160447734414502,"North Texas","Southern Miss",3,4,1,0,5,400919468,2017-02-25
92,1,"5:12",1512,1512,"Foul on Quinton Campbell.",15,32,-17,0.160447734414502,"North Texas","Southern Miss",3,4,1,0,5,400919468,2017-02-25
93,1,"5:02",1502,1502,"Derail Green made Three Point Jumper. Assisted by Ryan Woolridge.",18,32,-14,0.248146755447911,"North Texas","Southern Miss",3,4,1,0,5,400919468,2017-02-25
94,1,"4:33",1473,1473,"Kevin Holland missed Three Point Jumper.",18,32,-14,0.231760504282768,"North Texas","Southern Miss",3,4,0,0,5,400919468,2017-02-25
95,1,"4:33",1473,1473,"Allante Holston Defensive Rebound.",18,32,-14,0.231760504282768,"North Texas","Southern Miss",3,4,0,0,5,400919468,2017-02-25
96,1,"4:25",1465,1465,"J-Mychal Reese missed Layup.",18,32,-14,0.250582110599192,"North Texas","Southern Miss",3,4,0,0,5,400919468,2017-02-25
97,1,"4:25",1465,1465,"A.J. Lawson Offensive Rebound.",18,32,-14,0.250582110599192,"North Texas","Southern Miss",3,4,0,0,5,400919468,2017-02-25
98,1,"4:21",1461,1461,"A.J. Lawson made Layup.",20,32,-12,0.306469881280901,"North Texas","Southern Miss",3,4,0,1,5,400919468,2017-02-25
99,1,"4:21",1461,1461,"Southern Miss  Timeout",20,32,-12,0.306469881280901,"North Texas","Southern Miss",3,3,0,1,5,400919468,2017-02-25
100,1,"4:09",1449,1449,"Kevin Holland missed Three Point Jumper.",20,32,-12,0.29622579955331,"North Texas","Southern Miss",3,3,0,1,5,400919468,2017-02-25
101,1,"4:09",1449,1449,"J-Mychal Reese Defensive Rebound.",20,32,-12,0.29622579955331,"North Texas","Southern Miss",3,3,0,1,5,400919468,2017-02-25
102,1,"4:03",1443,1443,"Allante Holston made Jumper. Assisted by Ryan Woolridge.",22,32,-10,0.363317173378333,"North Texas","Southern Miss",3,3,0,1,5,400919468,2017-02-25
103,1,"3:46",1426,1426,"Michael Ramey made Three Point Jumper. Assisted by Kevin Holland.",22,35,-13,0.254996746425422,"North Texas","Southern Miss",3,3,0,1,5,400919468,2017-02-25
104,1,"3:12",1392,1392,"Allante Holston missed Jumper.",22,35,-13,0.244343197997924,"North Texas","Southern Miss",3,3,0,0,5,400919468,2017-02-25
105,1,"3:12",1392,1392,"Quinton Campbell Defensive Rebound.",22,35,-13,0.244343197997924,"North Texas","Southern Miss",3,3,0,0,5,400919468,2017-02-25
106,1,"3:08",1388,1388,"Cortez Edwards missed Jumper.",22,35,-13,0.261673497149205,"North Texas","Southern Miss",3,3,0,0,5,400919468,2017-02-25
107,1,"3:08",1388,1388,"A.J. Lawson Defensive Rebound.",22,35,-13,0.261673497149205,"North Texas","Southern Miss",3,3,0,0,5,400919468,2017-02-25
108,1,"3:05",1385,1385,"Foul on Cortez Edwards.",22,35,-13,0.261673497149205,"North Texas","Southern Miss",3,3,0,0,5,400919468,2017-02-25
109,1,"3:05",1385,1385,"Ryan Woolridge missed Jumper.",22,35,-13,0.261673497149205,"North Texas","Southern Miss",3,3,0,0,5,400919468,2017-02-25
110,1,"3:05",1385,1385,"Michael Ramey Defensive Rebound.",22,35,-13,0.261673497149205,"North Texas","Southern Miss",3,3,0,0,5,400919468,2017-02-25
111,1,"2:43",1363,1363,"Cortez Edwards missed Jumper.",22,35,-13,0.242157400788785,"North Texas","Southern Miss",3,3,0,0,5,400919468,2017-02-25
112,1,"2:43",1363,1363,"Derail Green Defensive Rebound.",22,35,-13,0.242157400788785,"North Texas","Southern Miss",3,3,0,0,5,400919468,2017-02-25
113,1,"2:31",1351,1351,"Derail Green made Three Point Jumper. Assisted by A.J. Lawson.",25,35,-10,0.345574791952652,"North Texas","Southern Miss",3,3,0,0,5,400919468,2017-02-25
114,1,"2:03",1323,1323,"Quinton Campbell made Three Point Jumper. Assisted by Cortez Edwards.",25,38,-13,0.230471192762516,"North Texas","Southern Miss",3,3,0,0,5,400919468,2017-02-25
115,1,"1:56",1316,1316,"Derail Green missed Three Point Jumper.",25,38,-13,0.239844518203737,"North Texas","Southern Miss",3,3,0,0,5,400919468,2017-02-25
116,1,"1:56",1316,1316,"Kevin Holland Defensive Rebound.",25,38,-13,0.239844518203737,"North Texas","Southern Miss",3,3,0,0,5,400919468,2017-02-25
117,1,"1:36",1296,1296,"Michael Ramey made Three Point Jumper. Assisted by Kevin Holland.",25,41,-16,0.141175550764946,"North Texas","Southern Miss",3,3,0,0,5,400919468,2017-02-25
118,1,"1:03",1263,1263,"A.J. Lawson made Layup.",27,41,-14,0.214345495217727,"North Texas","Southern Miss",3,3,0,0,5,400919468,2017-02-25
119,1,"1:03",1263,1263,"Foul on Cortez Edwards.",27,41,-14,0.214345495217727,"North Texas","Southern Miss",3,3,0,0,5,400919468,2017-02-25
120,1,"1:03",1263,1263,"A.J. Lawson missed Free Throw.",27,41,-14,0.214345495217727,"North Texas","Southern Miss",3,3,0,0,5,400919468,2017-02-25
121,1,"1:03",1263,1263,"Quinton Campbell Defensive Rebound.",27,41,-14,0.214345495217727,"North Texas","Southern Miss",3,3,0,0,5,400919468,2017-02-25
122,1,"0:51",1251,1251,"Michael Ramey made Three Point Jumper. Assisted by Cortez Edwards.",27,44,-17,0.14286244676444,"North Texas","Southern Miss",3,3,0,0,5,400919468,2017-02-25
123,1,"0:38",1238,1238,"Derail Green made Three Point Jumper. Assisted by A.J. Lawson.",30,44,-14,0.185489702770296,"North Texas","Southern Miss",3,3,0,0,5,400919468,2017-02-25
124,1,"0:10",1210,1210,"Michael Ramey made Three Point Jumper.",30,47,-17,0.116651004561517,"North Texas","Southern Miss",3,3,0,0,5,400919468,2017-02-25
125,1,"0:02",1202,1202,"Ja'Michael Brown missed Jumper.",30,47,-17,0.131445124053388,"North Texas","Southern Miss",3,3,0,0,5,400919468,2017-02-25
126,1,"0:02",1202,1202,"Michael Ramey Defensive Rebound.",30,47,-17,0.131445124053388,"North Texas","Southern Miss",3,3,0,0,5,400919468,2017-02-25
127,1,"0:00",1200,1200,"End of 1st half",30,47,-17,0.131445124053388,"North Texas","Southern Miss",3,3,0,0,5,400919468,2017-02-25
128,2,"20:00",1200,1200,"PLAY",30,47,-17,0.131445124053388,"North Texas","Southern Miss",4,4,0,0,5,400919468,2017-02-25
129,2,"19:35",1175,1175,"Cortez Edwards made Jumper.",30,49,-19,0.0876079615920243,"North Texas","Southern Miss",4,4,0,0,5,400919468,2017-02-25
130,2,"19:09",1149,1149,"Allante Holston missed Jumper.",30,49,-19,0.0755634671409991,"North Texas","Southern Miss",4,4,0,0,5,400919468,2017-02-25
131,2,"19:09",1149,1149,"Michael Ramey Defensive Rebound.",30,49,-19,0.0755634671409991,"North Texas","Southern Miss",4,4,0,0,5,400919468,2017-02-25
132,2,"19:04",1144,1144,"Michael Ramey Turnover.",30,49,-19,0.0755634671409991,"North Texas","Southern Miss",4,4,0,0,5,400919468,2017-02-25
133,2,"19:02",1142,1142,"Ryan Woolridge Steal.",30,49,-19,0.0755634671409991,"North Texas","Southern Miss",4,4,0,0,5,400919468,2017-02-25
134,2,"18:59",1139,1139,"Ryan Woolridge made Layup.",32,49,-17,0.127125459081189,"North Texas","Southern Miss",4,4,0,0,5,400919468,2017-02-25
135,2,"18:38",1118,1118,"Quinton Campbell made Jumper.",32,51,-19,0.0756687956397763,"North Texas","Southern Miss",4,4,0,0,5,400919468,2017-02-25
136,2,"18:14",1094,1094,"J-Mychal Reese missed Layup.",32,51,-19,0.081890940444994,"North Texas","Southern Miss",4,4,0,0,5,400919468,2017-02-25
137,2,"18:14",1094,1094,"Quinton Campbell Defensive Rebound.",32,51,-19,0.081890940444994,"North Texas","Southern Miss",4,4,0,0,5,400919468,2017-02-25
138,2,"18:04",1084,1084,"Michael Ramey missed Three Point Jumper.",32,51,-19,0.0722679254965663,"North Texas","Southern Miss",4,4,0,0,5,400919468,2017-02-25
139,2,"18:04",1084,1084,"Quinton Campbell Offensive Rebound.",32,51,-19,0.0722679254965663,"North Texas","Southern Miss",4,4,0,0,5,400919468,2017-02-25
140,2,"17:31",1051,1051,"Foul on Ryan Woolridge.",32,51,-19,0.0683062124477682,"North Texas","Southern Miss",4,4,0,0,5,400919468,2017-02-25
141,2,"17:31",1051,1051,"Michael Ramey made Free Throw.",32,52,-20,0.0576969640534273,"North Texas","Southern Miss",4,4,0,0,5,400919468,2017-02-25
142,2,"17:31",1051,1051,"Michael Ramey missed Free Throw.",32,52,-20,0.0576969640534273,"North Texas","Southern Miss",4,4,0,0,5,400919468,2017-02-25
143,2,"17:31",1051,1051,"Allante Holston Defensive Rebound.",32,52,-20,0.0576969640534273,"North Texas","Southern Miss",4,4,0,0,5,400919468,2017-02-25
144,2,"17:07",1027,1027,"Derail Green missed Three Point Jumper.",32,52,-20,0.058074061285733,"North Texas","Southern Miss",4,4,0,0,5,400919468,2017-02-25
145,2,"17:07",1027,1027,"A.J. Lawson Offensive Rebound.",32,52,-20,0.058074061285733,"North Texas","Southern Miss",4,4,0,0,5,400919468,2017-02-25
146,2,"16:55",1015,1015,"Derail Green made Layup. Assisted by A.J. Lawson.",34,52,-18,0.06683562723372,"North Texas","Southern Miss",4,4,0,0,5,400919468,2017-02-25
147,2,"16:55",1015,1015,"Foul on Quinton Campbell.",34,52,-18,0.06683562723372,"North Texas","Southern Miss",4,4,0,0,5,400919468,2017-02-25
148,2,"16:55",1015,1015,"Derail Green made Free Throw.",35,52,-17,0.0791692162374919,"North Texas","Southern Miss",4,4,0,0,5,400919468,2017-02-25
149,2,"16:37",997,997,"Raheem Watts missed Jumper.",35,52,-17,0.0891456152847794,"North Texas","Southern Miss",4,4,0,0,5,400919468,2017-02-25
150,2,"16:37",997,997,"J-Mychal Reese Defensive Rebound.",35,52,-17,0.0891456152847794,"North Texas","Southern Miss",4,4,0,0,5,400919468,2017-02-25
151,2,"16:25",985,985,"J-Mychal Reese missed Three Point Jumper.",35,52,-17,0.0675201432499352,"North Texas","Southern Miss",4,4,0,0,5,400919468,2017-02-25
152,2,"16:25",985,985,"Southern Miss Defensive Rebound.",35,52,-17,0.0675201432499352,"North Texas","Southern Miss",4,4,0,0,5,400919468,2017-02-25
153,2,"16:04",964,964,"Michael Ramey missed Three Point Jumper.",35,52,-17,0.0783311526199167,"North Texas","Southern Miss",4,4,0,0,5,400919468,2017-02-25
154,2,"16:04",964,964,"A.J. Lawson Defensive Rebound.",35,52,-17,0.0783311526199167,"North Texas","Southern Miss",4,4,0,0,5,400919468,2017-02-25
155,2,"15:58",958,958,"A.J. Lawson made Jumper.",37,52,-15,0.107176953751139,"North Texas","Southern Miss",4,4,0,0,5,400919468,2017-02-25
156,2,"15:58",958,958,"Foul on Kevin Holland.",37,52,-15,0.107176953751139,"North Texas","Southern Miss",4,4,0,0,5,400919468,2017-02-25
157,2,"15:58",958,958,"Official TV Timeout",37,52,-15,0.107176953751139,"North Texas","Southern Miss",4,4,0,0,5,400919468,2017-02-25
158,2,"15:58",958,958,"A.J. Lawson missed Free Throw.",37,52,-15,0.107176953751139,"North Texas","Southern Miss",4,4,0,0,5,400919468,2017-02-25
159,2,"15:58",958,958,"Kevin Holland Defensive Rebound.",37,52,-15,0.107176953751139,"North Texas","Southern Miss",4,4,0,0,5,400919468,2017-02-25
160,2,"15:33",933,933,"Cortez Edwards missed Jumper.",37,52,-15,0.105040520244749,"North Texas","Southern Miss",4,4,0,0,5,400919468,2017-02-25
161,2,"15:33",933,933,"Ja'Michael Brown Defensive Rebound.",37,52,-15,0.105040520244749,"North Texas","Southern Miss",4,4,0,0,5,400919468,2017-02-25
162,2,"15:24",924,924,"Foul on Kevin Holland.",37,52,-15,0.0936014423999039,"North Texas","Southern Miss",4,4,0,0,5,400919468,2017-02-25
163,2,"15:24",924,924,"Allante Holston missed Free Throw.",37,52,-15,0.0936014423999039,"North Texas","Southern Miss",4,4,0,0,5,400919468,2017-02-25
164,2,"15:24",924,924,"North Texas Deadball Team Rebound.",37,52,-15,0.0936014423999039,"North Texas","Southern Miss",4,4,0,0,5,400919468,2017-02-25
165,2,"15:24",924,924,"Allante Holston made Free Throw.",38,52,-14,0.11135658215193,"North Texas","Southern Miss",4,4,0,0,5,400919468,2017-02-25
166,2,"15:17",917,917,"Quinton Campbell Turnover.",38,52,-14,0.122660359077075,"North Texas","Southern Miss",4,4,0,0,5,400919468,2017-02-25
167,2,"15:17",917,917,"Derail Green Steal.",38,52,-14,0.122660359077075,"North Texas","Southern Miss",4,4,0,0,5,400919468,2017-02-25
168,2,"15:04",904,904,"Ja'Michael Brown missed Three Point Jumper.",38,52,-14,0.122875757001102,"North Texas","Southern Miss",4,4,0,0,5,400919468,2017-02-25
169,2,"15:04",904,904,"North Texas Offensive Rebound.",38,52,-14,0.122875757001102,"North Texas","Southern Miss",4,4,0,0,5,400919468,2017-02-25
170,2,"14:49",889,889,"Ryan Woolridge missed Jumper.",38,52,-14,0.148782958236042,"North Texas","Southern Miss",4,4,0,0,5,400919468,2017-02-25
171,2,"14:49",889,889,"Cortez Edwards Defensive Rebound.",38,52,-14,0.148782958236042,"North Texas","Southern Miss",4,4,0,0,5,400919468,2017-02-25
172,2,"14:32",872,872,"Eddie Davis III Turnover.",38,52,-14,0.124597966822544,"North Texas","Southern Miss",4,4,0,0,5,400919468,2017-02-25
173,2,"14:22",862,862,"Foul on Cortez Edwards.",38,52,-14,0.120140255682913,"North Texas","Southern Miss",4,4,0,0,5,400919468,2017-02-25
174,2,"14:22",862,862,"Allante Holston made Free Throw.",39,52,-13,0.141910512274222,"North Texas","Southern Miss",4,4,0,0,5,400919468,2017-02-25
