"play_id","half","time_remaining_half","secs_remaining","secs_remaining_absolute","description","home_score","away_score","score_diff","win_prob","home","away","home_time_out_remaining","away_time_out_remaining","home_timeout_ind","away_timeout_ind","home_favored_by","game_id","date"
1,1,"20:00",2400,2400,"PLAY",0,0,0,0.693838407515773,"USC","SMU",4,4,0,0,3.5,400915525,2016-11-25
2,1,"19:39",2379,2379,"Shaqquan Aaron missed Jumper.",0,0,0,0.694906670230839,"USC","SMU",4,4,0,0,3.5,400915525,2016-11-25
3,1,"19:39",2379,2379,"Shake Milton Defensive Rebound.",0,0,0,0.694906670230839,"USC","SMU",4,4,0,0,3.5,400915525,2016-11-25
4,1,"19:13",2353,2353,"Semi Ojeleye missed Layup.",0,0,0,0.700842941407229,"USC","SMU",4,4,0,0,3.5,400915525,2016-11-25
5,1,"19:13",2353,2353,"Chimezie Metu Block.",0,0,0,0.700842941407229,"USC","SMU",4,4,0,0,3.5,400915525,2016-11-25
6,1,"19:10",2350,2350,"Jordan McLaughlin Defensive Rebound.",0,0,0,0.700842941407229,"USC","SMU",4,4,0,0,3.5,400915525,2016-11-25
7,1,"19:07",2347,2347,"Shaqquan Aaron missed Jumper.",0,0,0,0.68234592930309,"USC","SMU",4,4,0,0,3.5,400915525,2016-11-25
8,1,"19:07",2347,2347,"Semi Ojeleye Defensive Rebound.",0,0,0,0.68234592930309,"USC","SMU",4,4,0,0,3.5,400915525,2016-11-25
9,1,"18:53",2333,2333,"Jarrey Foster Turnover.",0,0,0,0.688472303991838,"USC","SMU",4,4,0,0,3.5,400915525,2016-11-25
10,1,"18:37",2317,2317,"Chimezie Metu made Dunk. Assisted by Bennie Boatwright.",2,0,2,0.715497018324756,"USC","SMU",4,4,0,0,3.5,400915525,2016-11-25
11,1,"18:21",2301,2301,"Shake Milton made Three Point Jumper. Assisted by Semi Ojeleye.",2,3,-1,0.654456090625149,"USC","SMU",4,4,0,0,3.5,400915525,2016-11-25
12,1,"17:52",2272,2272,"Bennie Boatwright made Three Point Jumper. Assisted by Jordan McLaughlin.",5,3,2,0.731446673662179,"USC","SMU",4,4,0,0,3.5,400915525,2016-11-25
13,1,"17:30",2250,2250,"Sterling Brown missed Jumper.",5,3,2,0.724181669139869,"USC","SMU",4,4,0,0,3.5,400915525,2016-11-25
14,1,"17:30",2250,2250,"Elijah Stewart Block.",5,3,2,0.724181669139869,"USC","SMU",4,4,0,0,3.5,400915525,2016-11-25
15,1,"17:28",2248,2248,"Chimezie Metu Defensive Rebound.",5,3,2,0.722902427542131,"USC","SMU",4,4,0,0,3.5,400915525,2016-11-25
16,1,"17:23",2243,2243,"Foul on Ben Moore.",5,3,2,0.722902427542131,"USC","SMU",4,4,0,0,3.5,400915525,2016-11-25
17,1,"17:18",2238,2238,"Bennie Boatwright missed Three Point Jumper.",5,3,2,0.731442162528789,"USC","SMU",4,4,0,0,3.5,400915525,2016-11-25
18,1,"17:18",2238,2238,"Elijah Stewart Offensive Rebound.",5,3,2,0.731442162528789,"USC","SMU",4,4,0,0,3.5,400915525,2016-11-25
19,1,"17:14",2234,2234,"Elijah Stewart missed Two Point Tip Shot.",5,3,2,0.731442162528789,"USC","SMU",4,4,0,0,3.5,400915525,2016-11-25
20,1,"17:14",2234,2234,"Sterling Brown Defensive Rebound.",5,3,2,0.731442162528789,"USC","SMU",4,4,0,0,3.5,400915525,2016-11-25
21,1,"17:03",2223,2223,"Semi Ojeleye Turnover.",5,3,2,0.729265319865012,"USC","SMU",4,4,0,0,3.5,400915525,2016-11-25
22,1,"16:51",2211,2211,"Elijah Stewart missed Three Point Jumper.",5,3,2,0.740526113876275,"USC","SMU",4,4,0,0,3.5,400915525,2016-11-25
23,1,"16:51",2211,2211,"SMU Defensive Rebound.",5,3,2,0.740526113876275,"USC","SMU",4,4,0,0,3.5,400915525,2016-11-25
24,1,"16:36",2196,2196,"Jarrey Foster made Layup. Assisted by Sterling Brown.",5,5,0,0.69492838017646,"USC","SMU",4,4,0,0,3.5,400915525,2016-11-25
25,1,"16:21",2181,2181,"Elijah Stewart Turnover.",5,5,0,0.683349136532918,"USC","SMU",4,4,0,0,3.5,400915525,2016-11-25
26,1,"16:21",2181,2181,"Foul on Elijah Stewart.",5,5,0,0.683349136532918,"USC","SMU",4,4,0,0,3.5,400915525,2016-11-25
27,1,"15:52",2152,2152,"Semi Ojeleye Turnover.",5,5,0,0.672857854673756,"USC","SMU",4,4,0,0,3.5,400915525,2016-11-25
28,1,"15:52",2152,2152,"Foul on Semi Ojeleye.",5,5,0,0.672857854673756,"USC","SMU",4,4,0,0,3.5,400915525,2016-11-25
29,1,"15:52",2152,2152,"Official TV Timeout",5,5,0,0.672857854673756,"USC","SMU",4,4,0,0,3.5,400915525,2016-11-25
30,1,"15:38",2138,2138,"De'Anthony Melton made Three Point Jumper. Assisted by Jordan McLaughlin.",8,5,3,0.752719721712955,"USC","SMU",4,4,0,0,3.5,400915525,2016-11-25
31,1,"15:23",2123,2123,"Foul on Elijah Stewart.",8,5,3,0.745164320828363,"USC","SMU",4,4,0,0,3.5,400915525,2016-11-25
32,1,"15:19",2119,2119,"Semi Ojeleye Turnover.",8,5,3,0.75253469336439,"USC","SMU",4,4,0,0,3.5,400915525,2016-11-25
33,1,"15:07",2107,2107,"Jordan McLaughlin Turnover.",8,5,3,0.743615796717685,"USC","SMU",4,4,0,0,3.5,400915525,2016-11-25
34,1,"15:05",2105,2105,"Shake Milton Steal.",8,5,3,0.743615796717685,"USC","SMU",4,4,0,0,3.5,400915525,2016-11-25
35,1,"14:59",2099,2099,"Sterling Brown missed Layup.",8,5,3,0.748790025336461,"USC","SMU",4,4,0,0,3.5,400915525,2016-11-25
36,1,"14:59",2099,2099,"Chimezie Metu Block.",8,5,3,0.748790025336461,"USC","SMU",4,4,0,0,3.5,400915525,2016-11-25
37,1,"14:57",2097,2097,"Chimezie Metu Defensive Rebound.",8,5,3,0.748790025336461,"USC","SMU",4,4,0,0,3.5,400915525,2016-11-25
38,1,"14:48",2088,2088,"Bennie Boatwright missed Three Point Jumper.",8,5,3,0.747626048642511,"USC","SMU",4,4,0,0,3.5,400915525,2016-11-25
39,1,"14:48",2088,2088,"SMU Defensive Rebound.",8,5,3,0.747626048642511,"USC","SMU",4,4,0,0,3.5,400915525,2016-11-25
40,1,"14:26",2066,2066,"Harry Froling made Three Point Jumper. Assisted by Jarrey Foster.",8,8,0,0.669010356313669,"USC","SMU",4,4,0,0,3.5,400915525,2016-11-25
41,1,"13:53",2033,2033,"Charles Buggs made Jumper.",10,8,2,0.735245956456195,"USC","SMU",4,4,0,0,3.5,400915525,2016-11-25
42,1,"13:37",2017,2017,"Foul on Chimezie Metu.",10,8,2,0.728556391242258,"USC","SMU",4,4,0,0,3.5,400915525,2016-11-25
43,1,"13:37",2017,2017,"Ben Moore made Free Throw.",10,9,1,0.705100314051698,"USC","SMU",4,4,0,0,3.5,400915525,2016-11-25
44,1,"13:37",2017,2017,"Ben Moore made Free Throw.",10,10,0,0.680506196322162,"USC","SMU",4,4,0,0,3.5,400915525,2016-11-25
45,1,"13:23",2003,2003,"Chimezie Metu missed Jumper.",10,10,0,0.670607839909753,"USC","SMU",4,4,0,0,3.5,400915525,2016-11-25
46,1,"13:23",2003,2003,"Jarrey Foster Defensive Rebound.",10,10,0,0.670607839909753,"USC","SMU",4,4,0,0,3.5,400915525,2016-11-25
47,1,"13:02",1982,1982,"Harry Froling made Layup. Assisted by Ben Emelogu II.",10,12,-2,0.602819316516826,"USC","SMU",4,4,0,0,3.5,400915525,2016-11-25
48,1,"12:47",1967,1967,"Chimezie Metu made Jumper. Assisted by Jonah Mathews.",12,12,0,0.674208079590702,"USC","SMU",4,4,0,0,3.5,400915525,2016-11-25
49,1,"12:17",1937,1937,"Shake Milton missed Three Point Jumper.",12,12,0,0.662451365874517,"USC","SMU",4,4,0,0,3.5,400915525,2016-11-25
50,1,"12:17",1937,1937,"Jarrey Foster Offensive Rebound.",12,12,0,0.662451365874517,"USC","SMU",4,4,0,0,3.5,400915525,2016-11-25
51,1,"12:10",1930,1930,"Jarrey Foster missed Jumper.",12,12,0,0.662451365874517,"USC","SMU",4,4,0,0,3.5,400915525,2016-11-25
52,1,"12:10",1930,1930,"Jonah Mathews Defensive Rebound.",12,12,0,0.662451365874517,"USC","SMU",4,4,0,0,3.5,400915525,2016-11-25
53,1,"12:06",1926,1926,"Charles Buggs made Three Point Jumper. Assisted by De'Anthony Melton.",15,12,3,0.747346895264062,"USC","SMU",4,4,0,0,3.5,400915525,2016-11-25
54,1,"11:50",1910,1910,"Harry Froling missed Jumper.",15,12,3,0.764380430359024,"USC","SMU",4,4,0,0,3.5,400915525,2016-11-25
55,1,"11:49",1909,1909,"Ben Emelogu II Offensive Rebound.",15,12,3,0.744273265895606,"USC","SMU",4,4,0,0,3.5,400915525,2016-11-25
56,1,"11:49",1909,1909,"Ben Emelogu II made Two Point Tip Shot.",15,14,1,0.697266428843656,"USC","SMU",4,4,0,0,3.5,400915525,2016-11-25
57,1,"11:49",1909,1909,"Official TV Timeout",15,14,1,0.697266428843656,"USC","SMU",4,4,0,0,3.5,400915525,2016-11-25
58,1,"11:43",1903,1903,"Jonah Mathews missed Three Point Jumper.",15,14,1,0.697266428843656,"USC","SMU",4,4,0,0,3.5,400915525,2016-11-25
59,1,"11:43",1903,1903,"Semi Ojeleye Defensive Rebound.",15,14,1,0.697266428843656,"USC","SMU",4,4,0,0,3.5,400915525,2016-11-25
60,1,"11:25",1885,1885,"Foul on Nick Rakocevic.",15,14,1,0.694651237709712,"USC","SMU",4,4,0,0,3.5,400915525,2016-11-25
61,1,"11:17",1877,1877,"Ben Emelogu II missed Three Point Jumper.",15,14,1,0.695450969493393,"USC","SMU",4,4,0,0,3.5,400915525,2016-11-25
62,1,"11:17",1877,1877,"Charles Buggs Defensive Rebound.",15,14,1,0.695450969493393,"USC","SMU",4,4,0,0,3.5,400915525,2016-11-25
63,1,"10:57",1857,1857,"Jonah Mathews Turnover.",15,14,1,0.701780719685181,"USC","SMU",4,4,0,0,3.5,400915525,2016-11-25
64,1,"10:35",1835,1835,"Harry Froling Turnover.",15,14,1,0.697731727589307,"USC","SMU",4,4,0,0,3.5,400915525,2016-11-25
65,1,"10:19",1819,1819,"Foul on Ben Emelogu II.",15,14,1,0.702237222468489,"USC","SMU",4,4,0,0,3.5,400915525,2016-11-25
66,1,"10:19",1819,1819,"Jonah Mathews made Free Throw.",16,14,2,0.73055828052709,"USC","SMU",4,4,0,0,3.5,400915525,2016-11-25
67,1,"10:19",1819,1819,"Jonah Mathews missed Free Throw.",16,14,2,0.73055828052709,"USC","SMU",4,4,0,0,3.5,400915525,2016-11-25
68,1,"10:19",1819,1819,"Semi Ojeleye Defensive Rebound.",16,14,2,0.73055828052709,"USC","SMU",4,4,0,0,3.5,400915525,2016-11-25
69,1,"9:49",1789,1789,"Shake Milton missed Three Point Jumper.",16,14,2,0.706995562667192,"USC","SMU",4,4,0,0,3.5,400915525,2016-11-25
70,1,"9:49",1789,1789,"Nick Rakocevic Defensive Rebound.",16,14,2,0.706995562667192,"USC","SMU",4,4,0,0,3.5,400915525,2016-11-25
71,1,"9:39",1779,1779,"Shaqquan Aaron made Three Point Jumper. Assisted by De'Anthony Melton.",19,14,5,0.777368711920365,"USC","SMU",4,4,0,0,3.5,400915525,2016-11-25
72,1,"9:20",1760,1760,"Sterling Brown made Layup. Assisted by Semi Ojeleye.",19,16,3,0.754055630406753,"USC","SMU",4,4,0,0,3.5,400915525,2016-11-25
73,1,"9:03",1743,1743,"Foul on Sterling Brown.",19,16,3,0.749606418446475,"USC","SMU",4,4,0,0,3.5,400915525,2016-11-25
74,1,"9:03",1743,1743,"Nick Rakocevic missed Free Throw.",19,16,3,0.749606418446475,"USC","SMU",4,4,0,0,3.5,400915525,2016-11-25
75,1,"9:03",1743,1743,"USC Deadball Team Rebound.",19,16,3,0.749606418446475,"USC","SMU",4,4,0,0,3.5,400915525,2016-11-25
76,1,"9:03",1743,1743,"Nick Rakocevic missed Free Throw.",19,16,3,0.749606418446475,"USC","SMU",4,4,0,0,3.5,400915525,2016-11-25
77,1,"9:03",1743,1743,"Ben Moore Defensive Rebound.",19,16,3,0.749606418446475,"USC","SMU",4,4,0,0,3.5,400915525,2016-11-25
78,1,"8:40",1720,1720,"Semi Ojeleye missed Layup.",19,16,3,0.750229160351908,"USC","SMU",4,4,0,0,3.5,400915525,2016-11-25
79,1,"8:40",1720,1720,"Nick Rakocevic Defensive Rebound.",19,16,3,0.750229160351908,"USC","SMU",4,4,0,0,3.5,400915525,2016-11-25
80,1,"8:18",1698,1698,"De'Anthony Melton missed Three Point Jumper.",19,16,3,0.756396589821834,"USC","SMU",4,4,0,0,3.5,400915525,2016-11-25
81,1,"8:18",1698,1698,"SMU Defensive Rebound.",19,16,3,0.756396589821834,"USC","SMU",4,4,0,0,3.5,400915525,2016-11-25
82,1,"7:55",1675,1675,"Foul on Nick Rakocevic.",19,16,3,0.752865376215285,"USC","SMU",4,4,0,0,3.5,400915525,2016-11-25
83,1,"7:55",1675,1675,"Official TV Timeout",19,16,3,0.752865376215285,"USC","SMU",4,4,0,0,3.5,400915525,2016-11-25
84,1,"7:51",1671,1671,"Ben Moore made Jumper.",19,18,1,0.697795517943375,"USC","SMU",4,4,0,0,3.5,400915525,2016-11-25
85,1,"7:35",1655,1655,"Foul on Semi Ojeleye.",19,18,1,0.694619207821828,"USC","SMU",4,4,0,0,3.5,400915525,2016-11-25
86,1,"7:35",1655,1655,"Bennie Boatwright made Free Throw.",20,18,2,0.721993241437202,"USC","SMU",4,4,0,0,3.5,400915525,2016-11-25
87,1,"7:35",1655,1655,"Bennie Boatwright made Free Throw.",21,18,3,0.747804388808452,"USC","SMU",4,4,0,0,3.5,400915525,2016-11-25
88,1,"7:14",1634,1634,"Sterling Brown missed Jumper.",21,18,3,0.7517101440992,"USC","SMU",4,4,0,0,3.5,400915525,2016-11-25
89,1,"7:14",1634,1634,"Bennie Boatwright Defensive Rebound.",21,18,3,0.7517101440992,"USC","SMU",4,4,0,0,3.5,400915525,2016-11-25
90,1,"7:06",1626,1626,"Jordan McLaughlin Turnover.",21,18,3,0.74656464124803,"USC","SMU",4,4,0,0,3.5,400915525,2016-11-25
91,1,"7:04",1624,1624,"Ben Moore Steal.",21,18,3,0.74656464124803,"USC","SMU",4,4,0,0,3.5,400915525,2016-11-25
92,1,"7:00",1620,1620,"Sterling Brown Turnover.",21,18,3,0.74656464124803,"USC","SMU",4,4,0,0,3.5,400915525,2016-11-25
93,1,"6:56",1616,1616,"Chimezie Metu Steal.",21,18,3,0.734544246878337,"USC","SMU",4,4,0,0,3.5,400915525,2016-11-25
94,1,"6:55",1615,1615,"Bennie Boatwright missed Layup.",21,18,3,0.734544246878337,"USC","SMU",4,4,0,0,3.5,400915525,2016-11-25
95,1,"6:55",1615,1615,"Shake Milton Defensive Rebound.",21,18,3,0.734544246878337,"USC","SMU",4,4,0,0,3.5,400915525,2016-11-25
96,1,"6:36",1596,1596,"Harry Froling made Jumper. Assisted by Shake Milton.",21,20,1,0.698835443603346,"USC","SMU",4,4,0,0,3.5,400915525,2016-11-25
97,1,"6:04",1564,1564,"Elijah Stewart missed Three Point Jumper.",21,20,1,0.680247030938757,"USC","SMU",4,4,0,0,3.5,400915525,2016-11-25
98,1,"6:04",1564,1564,"Ben Moore Defensive Rebound.",21,20,1,0.680247030938757,"USC","SMU",4,4,0,0,3.5,400915525,2016-11-25
99,1,"5:52",1552,1552,"Sterling Brown made Dunk.",21,22,-1,0.616070882249088,"USC","SMU",4,4,0,0,3.5,400915525,2016-11-25
100,1,"5:49",1549,1549,"USC  Timeout",21,22,-1,0.633259261197336,"USC","SMU",3,4,1,0,3.5,400915525,2016-11-25
101,1,"5:28",1528,1528,"Bennie Boatwright made Three Point Jumper. Assisted by Chimezie Metu.",24,22,2,0.718641690363027,"USC","SMU",3,4,1,0,3.5,400915525,2016-11-25
102,1,"5:12",1512,1512,"Shake Milton missed Layup.",24,22,2,0.734118309148215,"USC","SMU",3,4,1,0,3.5,400915525,2016-11-25
103,1,"5:12",1512,1512,"Harry Froling Offensive Rebound.",24,22,2,0.734118309148215,"USC","SMU",3,4,1,0,3.5,400915525,2016-11-25
104,1,"5:10",1510,1510,"Harry Froling missed Layup.",24,22,2,0.734118309148215,"USC","SMU",3,4,1,0,3.5,400915525,2016-11-25
105,1,"5:10",1510,1510,"Elijah Stewart Defensive Rebound.",24,22,2,0.734118309148215,"USC","SMU",3,4,1,0,3.5,400915525,2016-11-25
106,1,"5:00",1500,1500,"De'Anthony Melton Turnover.",24,22,2,0.718729734244608,"USC","SMU",3,4,1,0,3.5,400915525,2016-11-25
107,1,"4:59",1499,1499,"Ben Moore Steal.",24,22,2,0.732367550359219,"USC","SMU",3,4,1,0,3.5,400915525,2016-11-25
108,1,"4:43",1483,1483,"Jarrey Foster made Layup.",24,24,0,0.64984633927422,"USC","SMU",3,4,0,0,3.5,400915525,2016-11-25
109,1,"4:34",1474,1474,"Foul on Ben Moore.",24,24,0,0.665629120265922,"USC","SMU",3,4,0,0,3.5,400915525,2016-11-25
110,1,"4:34",1474,1474,"Jonah Mathews missed Free Throw.",24,24,0,0.665629120265922,"USC","SMU",3,4,0,0,3.5,400915525,2016-11-25
111,1,"4:34",1474,1474,"USC Deadball Team Rebound.",24,24,0,0.665629120265922,"USC","SMU",3,4,0,0,3.5,400915525,2016-11-25
112,1,"4:34",1474,1474,"Jonah Mathews made Free Throw.",25,24,1,0.69874431513898,"USC","SMU",3,4,0,0,3.5,400915525,2016-11-25
113,1,"4:18",1458,1458,"Ben Emelogu II missed Three Point Jumper.",25,24,1,0.680407204293609,"USC","SMU",3,4,0,0,3.5,400915525,2016-11-25
114,1,"4:18",1458,1458,"USC Deadball Team Rebound.",25,24,1,0.680407204293609,"USC","SMU",3,4,0,0,3.5,400915525,2016-11-25
115,1,"4:18",1458,1458,"Foul on Harry Froling.",25,24,1,0.680407204293609,"USC","SMU",3,4,0,0,3.5,400915525,2016-11-25
116,1,"4:18",1458,1458,"Chimezie Metu missed Free Throw.",25,24,1,0.680407204293609,"USC","SMU",3,4,0,0,3.5,400915525,2016-11-25
117,1,"4:18",1458,1458,"Sterling Brown Defensive Rebound.",25,24,1,0.680407204293609,"USC","SMU",3,4,0,0,3.5,400915525,2016-11-25
118,1,"4:06",1446,1446,"Foul on De'Anthony Melton.",25,24,1,0.708510776975173,"USC","SMU",3,4,0,0,3.5,400915525,2016-11-25
119,1,"4:00",1440,1440,"Jarrey Foster missed Three Point Jumper.",25,24,1,0.708510776975173,"USC","SMU",3,4,0,0,3.5,400915525,2016-11-25
120,1,"4:00",1440,1440,"Charles Buggs Defensive Rebound.",25,24,1,0.708510776975173,"USC","SMU",3,4,0,0,3.5,400915525,2016-11-25
121,1,"3:50",1430,1430,"Jordan McLaughlin missed Three Point Jumper.",25,24,1,0.693296928743719,"USC","SMU",3,4,0,0,3.5,400915525,2016-11-25
122,1,"3:50",1430,1430,"Nick Rakocevic Offensive Rebound.",25,24,1,0.693296928743719,"USC","SMU",3,4,0,0,3.5,400915525,2016-11-25
123,1,"3:46",1426,1426,"Nick Rakocevic made Layup.",27,24,3,0.736056276148669,"USC","SMU",3,4,0,0,3.5,400915525,2016-11-25
124,1,"3:26",1406,1406,"Sterling Brown missed Layup.",27,24,3,0.763696949423321,"USC","SMU",3,4,0,0,3.5,400915525,2016-11-25
125,1,"3:26",1406,1406,"Charles Buggs Block.",27,24,3,0.763696949423321,"USC","SMU",3,4,0,0,3.5,400915525,2016-11-25
126,1,"3:24",1404,1404,"De'Anthony Melton Defensive Rebound.",27,24,3,0.763696949423321,"USC","SMU",3,4,0,0,3.5,400915525,2016-11-25
127,1,"3:22",1402,1402,"De'Anthony Melton Turnover.",27,24,3,0.763696949423321,"USC","SMU",3,4,0,0,3.5,400915525,2016-11-25
128,1,"3:22",1402,1402,"Sterling Brown Steal.",27,24,3,0.763696949423321,"USC","SMU",3,4,0,0,3.5,400915525,2016-11-25
129,1,"3:21",1401,1401,"USC  Timeout",27,24,3,0.763696949423321,"USC","SMU",2,4,1,0,3.5,400915525,2016-11-25
130,1,"3:21",1401,1401,"Official TV Timeout",27,24,3,0.763696949423321,"USC","SMU",2,4,1,0,3.5,400915525,2016-11-25
131,1,"3:12",1392,1392,"Foul on Jonah Mathews.",27,24,3,0.749791264544347,"USC","SMU",2,4,1,0,3.5,400915525,2016-11-25
132,1,"3:12",1392,1392,"Shake Milton made Free Throw.",27,25,2,0.71971932814483,"USC","SMU",2,4,1,0,3.5,400915525,2016-11-25
133,1,"3:12",1392,1392,"Shake Milton missed Free Throw.",27,25,2,0.71971932814483,"USC","SMU",2,4,1,0,3.5,400915525,2016-11-25
134,1,"3:12",1392,1392,"Charles Buggs Defensive Rebound.",27,25,2,0.71971932814483,"USC","SMU",2,4,1,0,3.5,400915525,2016-11-25
135,1,"2:53",1373,1373,"Shaqquan Aaron missed Three Point Jumper.",27,25,2,0.706063844038333,"USC","SMU",2,4,1,0,3.5,400915525,2016-11-25
136,1,"2:53",1373,1373,"Nick Rakocevic Offensive Rebound.",27,25,2,0.706063844038333,"USC","SMU",2,4,1,0,3.5,400915525,2016-11-25
137,1,"2:48",1368,1368,"Nick Rakocevic missed Layup.",27,25,2,0.719361242113924,"USC","SMU",2,4,1,0,3.5,400915525,2016-11-25
138,1,"2:48",1368,1368,"Sterling Brown Block.",27,25,2,0.719361242113924,"USC","SMU",2,4,1,0,3.5,400915525,2016-11-25
139,1,"2:46",1366,1366,"Sterling Brown Defensive Rebound.",27,25,2,0.719361242113924,"USC","SMU",2,4,1,0,3.5,400915525,2016-11-25
140,1,"2:31",1351,1351,"Harry Froling missed Three Point Jumper.",27,25,2,0.730115942054305,"USC","SMU",2,4,1,0,3.5,400915525,2016-11-25
141,1,"2:31",1351,1351,"Jarrey Foster Offensive Rebound.",27,25,2,0.730115942054305,"USC","SMU",2,4,1,0,3.5,400915525,2016-11-25
142,1,"2:27",1347,1347,"Jarrey Foster missed Layup.",27,25,2,0.711242465317637,"USC","SMU",2,4,1,0,3.5,400915525,2016-11-25
143,1,"2:27",1347,1347,"Charles Buggs Block.",27,25,2,0.711242465317637,"USC","SMU",2,4,1,0,3.5,400915525,2016-11-25
144,1,"2:26",1346,1346,"SMU Offensive Rebound.",27,25,2,0.711242465317637,"USC","SMU",2,4,1,0,3.5,400915525,2016-11-25
145,1,"2:12",1332,1332,"Harry Froling missed Jumper.",27,25,2,0.706139886141245,"USC","SMU",2,4,0,0,3.5,400915525,2016-11-25
146,1,"2:12",1332,1332,"Shake Milton Offensive Rebound.",27,25,2,0.706139886141245,"USC","SMU",2,4,0,0,3.5,400915525,2016-11-25
147,1,"2:08",1328,1328,"Shake Milton missed Jumper.",27,25,2,0.718710958660441,"USC","SMU",2,4,0,0,3.5,400915525,2016-11-25
148,1,"2:08",1328,1328,"Shaqquan Aaron Defensive Rebound.",27,25,2,0.718710958660441,"USC","SMU",2,4,0,0,3.5,400915525,2016-11-25
149,1,"1:49",1309,1309,"Chimezie Metu Turnover.",27,25,2,0.712489991896372,"USC","SMU",2,4,0,0,3.5,400915525,2016-11-25
150,1,"1:49",1309,1309,"Foul on Chimezie Metu.",27,25,2,0.712489991896372,"USC","SMU",2,4,0,0,3.5,400915525,2016-11-25
151,1,"1:26",1286,1286,"Ben Emelogu II made Layup.",27,27,0,0.654450085990516,"USC","SMU",2,4,0,0,3.5,400915525,2016-11-25
152,1,"1:02",1262,1262,"Bennie Boatwright missed Jumper.",27,27,0,0.666956550998294,"USC","SMU",2,4,0,0,3.5,400915525,2016-11-25
153,1,"1:02",1262,1262,"Shake Milton Defensive Rebound.",27,27,0,0.666956550998294,"USC","SMU",2,4,0,0,3.5,400915525,2016-11-25
154,1,"0:54",1254,1254,"SMU  Timeout",27,27,0,0.64158883092507,"USC","SMU",2,3,0,1,3.5,400915525,2016-11-25
155,1,"0:37",1237,1237,"Ben Emelogu II missed Three Point Jumper.",27,27,0,0.638240877093418,"USC","SMU",2,3,0,1,3.5,400915525,2016-11-25
156,1,"0:37",1237,1237,"De'Anthony Melton Defensive Rebound.",27,27,0,0.638240877093418,"USC","SMU",2,3,0,1,3.5,400915525,2016-11-25
157,1,"0:10",1210,1210,"Bennie Boatwright Turnover.",27,27,0,0.639253238607054,"USC","SMU",2,3,0,1,3.5,400915525,2016-11-25
158,1,"0:09",1209,1209,"Shake Milton Steal.",27,27,0,0.646896978995879,"USC","SMU",2,3,0,1,3.5,400915525,2016-11-25
159,1,"0:04",1204,1204,"Shake Milton Turnover.",27,27,0,0.646896978995879,"USC","SMU",2,3,0,1,3.5,400915525,2016-11-25
160,1,"0:03",1203,1203,"Foul on Jarrey Foster.",27,27,0,0.646896978995879,"USC","SMU",2,3,0,1,3.5,400915525,2016-11-25
161,1,"0:03",1203,1203,"Jordan McLaughlin made Free Throw.",28,27,1,0.682368464275351,"USC","SMU",2,3,0,1,3.5,400915525,2016-11-25
162,1,"0:03",1203,1203,"Jordan McLaughlin missed Free Throw.",28,27,1,0.682368464275351,"USC","SMU",2,3,0,1,3.5,400915525,2016-11-25
163,1,"0:03",1203,1203,"Sterling Brown Defensive Rebound.",28,27,1,0.682368464275351,"USC","SMU",2,3,0,1,3.5,400915525,2016-11-25
164,1,"0:02",1202,1202,"Jordan McLaughlin Steal.",27,27,0,0.646896978995879,"USC","SMU",2,3,0,1,3.5,400915525,2016-11-25
165,1,"0:00",1200,1200,"End of 1st half",28,27,1,0.682368464275351,"USC","SMU",2,3,0,1,3.5,400915525,2016-11-25
166,2,"20:00",1200,1200,"PLAY",28,27,1,0.682368464275351,"USC","SMU",3,4,0,0,3.5,400915525,2016-11-25
167,2,"19:43",1183,1183,"Chimezie Metu missed Layup.",28,27,1,0.683894704624394,"USC","SMU",3,4,0,0,3.5,400915525,2016-11-25
168,2,"19:43",1183,1183,"Shaqquan Aaron Offensive Rebound.",28,27,1,0.683894704624394,"USC","SMU",3,4,0,0,3.5,400915525,2016-11-25
169,2,"19:40",1180,1180,"Shaqquan Aaron made Layup.",30,27,3,0.750787992749762,"USC","SMU",3,4,0,0,3.5,400915525,2016-11-25
170,2,"19:28",1168,1168,"Semi Ojeleye made Three Point Jumper. Assisted by Shake Milton.",30,30,0,0.632838589954993,"USC","SMU",3,4,0,0,3.5,400915525,2016-11-25
171,2,"19:08",1148,1148,"Chimezie Metu Turnover.",30,30,0,0.639728074130708,"USC","SMU",3,4,0,0,3.5,400915525,2016-11-25
172,2,"19:07",1147,1147,"Shake Milton Steal.",30,30,0,0.639728074130708,"USC","SMU",3,4,0,0,3.5,400915525,2016-11-25
173,2,"19:02",1142,1142,"Foul on Chimezie Metu.",30,30,0,0.639728074130708,"USC","SMU",3,4,0,0,3.5,400915525,2016-11-25
174,2,"18:55",1135,1135,"Ben Moore missed Layup.",30,30,0,0.652034871883564,"USC","SMU",3,4,0,0,3.5,400915525,2016-11-25
175,2,"18:55",1135,1135,"Shaqquan Aaron Defensive Rebound.",30,30,0,0.652034871883564,"USC","SMU",3,4,0,0,3.5,400915525,2016-11-25
176,2,"18:45",1125,1125,"Chimezie Metu Turnover.",30,30,0,0.638882595231957,"USC","SMU",3,4,0,0,3.5,400915525,2016-11-25
177,2,"18:44",1124,1124,"Sterling Brown Steal.",30,30,0,0.638882595231957,"USC","SMU",3,4,0,0,3.5,400915525,2016-11-25
178,2,"18:41",1121,1121,"Jarrey Foster missed Layup.",30,30,0,0.638882595231957,"USC","SMU",3,4,0,0,3.5,400915525,2016-11-25
179,2,"18:41",1121,1121,"Elijah Stewart Block.",30,30,0,0.638882595231957,"USC","SMU",3,4,0,0,3.5,400915525,2016-11-25
180,2,"18:39",1119,1119,"Chimezie Metu Defensive Rebound.",30,30,0,0.643612621362102,"USC","SMU",3,4,0,0,3.5,400915525,2016-11-25
181,2,"18:36",1116,1116,"Shaqquan Aaron made Dunk. Assisted by Jordan McLaughlin.",32,30,2,0.71849540939646,"USC","SMU",3,4,0,0,3.5,400915525,2016-11-25
182,2,"18:25",1105,1105,"Foul on Jordan McLaughlin.",32,30,2,0.717317802974503,"USC","SMU",3,4,0,0,3.5,400915525,2016-11-25
183,2,"18:04",1084,1084,"Sterling Brown made Layup.",32,32,0,0.6444927727214,"USC","SMU",3,4,0,0,3.5,400915525,2016-11-25
184,2,"17:41",1061,1061,"Chimezie Metu missed Layup.",32,32,0,0.651282055703738,"USC","SMU",3,4,0,0,3.5,400915525,2016-11-25
185,2,"17:41",1061,1061,"Sterling Brown Block.",32,32,0,0.651282055703738,"USC","SMU",3,4,0,0,3.5,400915525,2016-11-25
186,2,"17:39",1059,1059,"Sterling Brown Defensive Rebound.",32,32,0,0.648041921764807,"USC","SMU",3,4,0,0,3.5,400915525,2016-11-25
187,2,"17:31",1051,1051,"Semi Ojeleye made Jumper. Assisted by Ben Moore.",32,34,-2,0.562227096933043,"USC","SMU",3,4,0,0,3.5,400915525,2016-11-25
188,2,"17:12",1032,1032,"Foul on Jarrey Foster.",32,34,-2,0.554027449408705,"USC","SMU",3,4,0,0,3.5,400915525,2016-11-25
189,2,"17:12",1032,1032,"Shaqquan Aaron missed Free Throw.",32,34,-2,0.554027449408705,"USC","SMU",3,4,0,0,3.5,400915525,2016-11-25
190,2,"17:12",1032,1032,"USC Deadball Team Rebound.",32,34,-2,0.554027449408705,"USC","SMU",3,4,0,0,3.5,400915525,2016-11-25
191,2,"17:12",1032,1032,"Shaqquan Aaron missed Free Throw.",32,34,-2,0.554027449408705,"USC","SMU",3,4,0,0,3.5,400915525,2016-11-25
192,2,"17:12",1032,1032,"Semi Ojeleye Defensive Rebound.",32,34,-2,0.554027449408705,"USC","SMU",3,4,0,0,3.5,400915525,2016-11-25
193,2,"16:54",1014,1014,"Shake Milton made Three Point Jumper. Assisted by Jarrey Foster.",32,37,-5,0.388318279073507,"USC","SMU",3,4,0,0,3.5,400915525,2016-11-25
194,2,"16:39",999,999,"Elijah Stewart made Three Point Jumper. Assisted by Jordan McLaughlin.",35,37,-2,0.538871981309209,"USC","SMU",3,4,0,0,3.5,400915525,2016-11-25
195,2,"16:17",977,977,"Semi Ojeleye missed Dunk.",35,37,-2,0.561963637685578,"USC","SMU",3,4,0,0,3.5,400915525,2016-11-25
196,2,"16:17",977,977,"Elijah Stewart Defensive Rebound.",35,37,-2,0.561963637685578,"USC","SMU",3,4,0,0,3.5,400915525,2016-11-25
197,2,"16:11",971,971,"Jordan McLaughlin made Layup. Assisted by Elijah Stewart.",37,37,0,0.647667573093483,"USC","SMU",3,4,0,0,3.5,400915525,2016-11-25
198,2,"15:54",954,954,"Jarrey Foster made Dunk. Assisted by Shake Milton.",37,39,-2,0.539100567822392,"USC","SMU",3,4,0,0,3.5,400915525,2016-11-25
199,2,"15:35",935,935,"Foul on Shake Milton.",37,39,-2,0.539550858349242,"USC","SMU",3,4,0,0,3.5,400915525,2016-11-25
200,2,"15:35",935,935,"Official TV Timeout",37,39,-2,0.539550858349242,"USC","SMU",3,4,0,0,3.5,400915525,2016-11-25
201,2,"15:18",918,918,"Elijah Stewart missed Three Point Jumper.",37,39,-2,0.544299655525824,"USC","SMU",3,4,0,0,3.5,400915525,2016-11-25
