"play_id","half","time_remaining_half","secs_remaining","secs_remaining_absolute","description","home_score","away_score","score_diff","win_prob","home","away","home_time_out_remaining","away_time_out_remaining","home_timeout_ind","away_timeout_ind","home_favored_by","game_id","date"
202,2,"15:18",918,918,"Shake Milton Defensive Rebound.",37,39,-2,0.544299655525824,"USC","SMU",3,4,0,0,3.5,400915525,2016-11-25
203,2,"15:10",910,910,"Semi Ojeleye made Jumper.",37,41,-4,0.446679161345037,"USC","SMU",3,4,0,0,3.5,400915525,2016-11-25
204,2,"15:10",910,910,"Foul on Nick Rakocevic.",37,41,-4,0.446679161345037,"USC","SMU",3,4,0,0,3.5,400915525,2016-11-25
205,2,"15:10",910,910,"Semi Ojeleye missed Free Throw.",37,41,-4,0.446679161345037,"USC","SMU",3,4,0,0,3.5,400915525,2016-11-25
206,2,"15:10",910,910,"Bennie Boatwright Defensive Rebound.",37,41,-4,0.446679161345037,"USC","SMU",3,4,0,0,3.5,400915525,2016-11-25
207,2,"15:00",900,900,"Foul on Shake Milton.",37,41,-4,0.441615408469737,"USC","SMU",3,4,0,0,3.5,400915525,2016-11-25
208,2,"14:49",889,889,"Foul on Sterling Brown.",37,41,-4,0.452975443382545,"USC","SMU",3,4,0,0,3.5,400915525,2016-11-25
209,2,"14:40",880,880,"Jordan McLaughlin Turnover.",37,41,-4,0.452975443382545,"USC","SMU",3,4,0,0,3.5,400915525,2016-11-25
210,2,"14:40",880,880,"Foul on Jordan McLaughlin.",37,41,-4,0.452975443382545,"USC","SMU",3,4,0,0,3.5,400915525,2016-11-25
211,2,"14:22",862,862,"Sterling Brown missed Jumper.",37,41,-4,0.433953241667514,"USC","SMU",3,4,0,0,3.5,400915525,2016-11-25
212,2,"14:22",862,862,"De'Anthony Melton Defensive Rebound.",37,41,-4,0.433953241667514,"USC","SMU",3,4,0,0,3.5,400915525,2016-11-25
213,2,"14:07",847,847,"De'Anthony Melton made Three Point Jumper. Assisted by Jordan McLaughlin.",40,41,-1,0.574361426764616,"USC","SMU",3,4,0,0,3.5,400915525,2016-11-25
214,2,"13:46",826,826,"Sterling Brown Turnover.",40,41,-1,0.587946276463534,"USC","SMU",3,4,0,0,3.5,400915525,2016-11-25
215,2,"13:45",825,825,"De'Anthony Melton Steal.",40,41,-1,0.587946276463534,"USC","SMU",3,4,0,0,3.5,400915525,2016-11-25
216,2,"13:42",822,822,"De'Anthony Melton made Layup.",42,41,1,0.675251395544434,"USC","SMU",3,4,0,0,3.5,400915525,2016-11-25
217,2,"13:23",803,803,"Semi Ojeleye missed Jumper.",42,41,1,0.691764266991311,"USC","SMU",3,4,0,0,3.5,400915525,2016-11-25
218,2,"13:23",803,803,"SMU Deadball Team Rebound.",42,41,1,0.691764266991311,"USC","SMU",3,4,0,0,3.5,400915525,2016-11-25
219,2,"13:23",803,803,"Foul on Nick Rakocevic.",42,41,1,0.691764266991311,"USC","SMU",3,4,0,0,3.5,400915525,2016-11-25
220,2,"13:13",793,793,"Semi Ojeleye missed Three Point Jumper.",42,41,1,0.673182244010565,"USC","SMU",3,4,0,0,3.5,400915525,2016-11-25
221,2,"13:13",793,793,"De'Anthony Melton Defensive Rebound.",42,41,1,0.673182244010565,"USC","SMU",3,4,0,0,3.5,400915525,2016-11-25
222,2,"12:51",771,771,"Elijah Stewart made Three Point Jumper.",45,41,4,0.797318676486616,"USC","SMU",3,4,0,0,3.5,400915525,2016-11-25
223,2,"12:30",750,750,"Ben Moore Turnover.",45,41,4,0.801288677558417,"USC","SMU",3,4,0,0,3.5,400915525,2016-11-25
224,2,"12:17",737,737,"Charles Buggs missed Layup.",45,41,4,0.79593751860984,"USC","SMU",3,4,0,0,3.5,400915525,2016-11-25
225,2,"12:17",737,737,"Ben Moore Defensive Rebound.",45,41,4,0.79593751860984,"USC","SMU",3,4,0,0,3.5,400915525,2016-11-25
226,2,"12:05",725,725,"Ben Moore Turnover.",45,41,4,0.811451209908926,"USC","SMU",3,4,0,0,3.5,400915525,2016-11-25
227,2,"12:04",724,724,"Jonah Mathews Steal.",45,41,4,0.811451209908926,"USC","SMU",3,4,0,0,3.5,400915525,2016-11-25
228,2,"12:02",722,722,"Foul on Ben Moore.",45,41,4,0.811451209908926,"USC","SMU",3,4,0,0,3.5,400915525,2016-11-25
229,2,"12:02",722,722,"De'Anthony Melton made Free Throw.",46,41,5,0.842844743349892,"USC","SMU",3,4,0,0,3.5,400915525,2016-11-25
230,2,"12:02",722,722,"De'Anthony Melton missed Free Throw.",46,41,5,0.842844743349892,"USC","SMU",3,4,0,0,3.5,400915525,2016-11-25
231,2,"12:02",722,722,"Semi Ojeleye Defensive Rebound.",46,41,5,0.842844743349892,"USC","SMU",3,4,0,0,3.5,400915525,2016-11-25
232,2,"11:50",710,710,"Harry Froling Turnover.",46,41,5,0.822480099324226,"USC","SMU",3,4,0,0,3.5,400915525,2016-11-25
233,2,"11:50",710,710,"Foul on Harry Froling.",46,41,5,0.822480099324226,"USC","SMU",3,4,0,0,3.5,400915525,2016-11-25
234,2,"11:50",710,710,"Official TV Timeout",46,41,5,0.822480099324226,"USC","SMU",3,4,0,0,3.5,400915525,2016-11-25
235,2,"11:23",683,683,"Bennie Boatwright missed Jumper.",46,41,5,0.831081721753783,"USC","SMU",3,4,0,0,3.5,400915525,2016-11-25
236,2,"11:23",683,683,"Jonah Mathews Offensive Rebound.",46,41,5,0.831081721753783,"USC","SMU",3,4,0,0,3.5,400915525,2016-11-25
237,2,"11:21",681,681,"Jonah Mathews made Layup.",48,41,7,0.884975719247911,"USC","SMU",3,4,0,0,3.5,400915525,2016-11-25
238,2,"11:03",663,663,"Shake Milton missed Three Point Jumper.",48,41,7,0.894100573781064,"USC","SMU",3,4,0,0,3.5,400915525,2016-11-25
239,2,"11:03",663,663,"Elijah Stewart Defensive Rebound.",48,41,7,0.894100573781064,"USC","SMU",3,4,0,0,3.5,400915525,2016-11-25
240,2,"10:56",656,656,"De'Anthony Melton made Three Point Jumper. Assisted by Jonah Mathews.",51,41,10,0.948603566396028,"USC","SMU",3,4,0,0,3.5,400915525,2016-11-25
241,2,"10:39",639,639,"SMU  Timeout",51,41,10,0.942421867006116,"USC","SMU",3,3,0,1,3.5,400915525,2016-11-25
242,2,"10:39",639,639,"Official TV Timeout",51,41,10,0.942421867006116,"USC","SMU",3,3,0,1,3.5,400915525,2016-11-25
243,2,"10:25",625,625,"Foul on Elijah Stewart.",51,41,10,0.95415289478719,"USC","SMU",3,3,0,1,3.5,400915525,2016-11-25
244,2,"10:25",625,625,"Ben Emelogu II made Free Throw.",51,42,9,0.941808563071055,"USC","SMU",3,3,0,1,3.5,400915525,2016-11-25
245,2,"10:25",625,625,"Ben Emelogu II made Free Throw.",51,43,8,0.926396910547104,"USC","SMU",3,3,0,1,3.5,400915525,2016-11-25
246,2,"10:15",615,615,"Foul on Ben Moore.",51,43,8,0.919611197908922,"USC","SMU",3,3,0,1,3.5,400915525,2016-11-25
247,2,"10:15",615,615,"Bennie Boatwright missed Free Throw.",51,43,8,0.919611197908922,"USC","SMU",3,3,0,1,3.5,400915525,2016-11-25
248,2,"10:15",615,615,"Harry Froling Defensive Rebound.",51,43,8,0.919611197908922,"USC","SMU",3,3,0,1,3.5,400915525,2016-11-25
249,2,"9:55",595,595,"Sterling Brown missed Layup.",51,43,8,0.91638581774487,"USC","SMU",3,3,0,1,3.5,400915525,2016-11-25
250,2,"9:55",595,595,"Bennie Boatwright Defensive Rebound.",51,43,8,0.91638581774487,"USC","SMU",3,3,0,1,3.5,400915525,2016-11-25
251,2,"9:47",587,587,"Elijah Stewart missed Jumper.",51,43,8,0.914879446151121,"USC","SMU",3,3,0,1,3.5,400915525,2016-11-25
252,2,"9:47",587,587,"De'Anthony Melton Offensive Rebound.",51,43,8,0.914879446151121,"USC","SMU",3,3,0,1,3.5,400915525,2016-11-25
253,2,"9:42",582,582,"De'Anthony Melton missed Two Point Tip Shot.",51,43,8,0.914879446151121,"USC","SMU",3,3,0,1,3.5,400915525,2016-11-25
254,2,"9:42",582,582,"Semi Ojeleye Defensive Rebound.",51,43,8,0.914879446151121,"USC","SMU",3,3,0,1,3.5,400915525,2016-11-25
255,2,"9:38",578,578,"Harry Froling missed Layup.",51,43,8,0.931120940517448,"USC","SMU",3,3,0,0,3.5,400915525,2016-11-25
256,2,"9:38",578,578,"Elijah Stewart Defensive Rebound.",51,43,8,0.931120940517448,"USC","SMU",3,3,0,0,3.5,400915525,2016-11-25
257,2,"9:31",571,571,"De'Anthony Melton missed Layup.",51,43,8,0.931120940517448,"USC","SMU",3,3,0,0,3.5,400915525,2016-11-25
258,2,"9:31",571,571,"Bennie Boatwright Offensive Rebound.",51,43,8,0.931120940517448,"USC","SMU",3,3,0,0,3.5,400915525,2016-11-25
259,2,"9:29",569,569,"Foul on Bennie Boatwright.",51,43,8,0.931817749334428,"USC","SMU",3,3,0,0,3.5,400915525,2016-11-25
260,2,"9:29",569,569,"Bennie Boatwright Turnover.",51,43,8,0.931817749334428,"USC","SMU",3,3,0,0,3.5,400915525,2016-11-25
261,2,"9:17",557,557,"Sterling Brown made Layup.",51,45,6,0.880584856688586,"USC","SMU",3,3,0,0,3.5,400915525,2016-11-25
262,2,"9:03",543,543,"Jonah Mathews made Three Point Jumper. Assisted by De'Anthony Melton.",54,45,9,0.942788291495389,"USC","SMU",3,3,0,0,3.5,400915525,2016-11-25
263,2,"8:44",524,524,"Sterling Brown missed Jumper.",54,45,9,0.948634727703736,"USC","SMU",3,3,0,0,3.5,400915525,2016-11-25
264,2,"8:44",524,524,"Bennie Boatwright Defensive Rebound.",54,45,9,0.948634727703736,"USC","SMU",3,3,0,0,3.5,400915525,2016-11-25
265,2,"8:32",512,512,"Jonah Mathews made Layup.",56,45,11,0.967497336432806,"USC","SMU",3,3,0,0,3.5,400915525,2016-11-25
266,2,"8:13",493,493,"Foul on De'Anthony Melton.",56,45,11,0.971265078670571,"USC","SMU",3,3,0,0,3.5,400915525,2016-11-25
267,2,"8:13",493,493,"Shake Milton made Free Throw.",56,46,10,0.962617309390201,"USC","SMU",3,3,0,0,3.5,400915525,2016-11-25
268,2,"8:13",493,493,"Shake Milton missed Free Throw.",56,46,10,0.962617309390201,"USC","SMU",3,3,0,0,3.5,400915525,2016-11-25
269,2,"8:11",491,491,"Semi Ojeleye Offensive Rebound.",56,46,10,0.962617309390201,"USC","SMU",3,3,0,0,3.5,400915525,2016-11-25
270,2,"8:09",489,489,"Semi Ojeleye made Layup.",56,48,8,0.933359455512892,"USC","SMU",3,3,0,0,3.5,400915525,2016-11-25
271,2,"7:51",471,471,"Bennie Boatwright made Three Point Jumper. Assisted by De'Anthony Melton.",59,48,11,0.974724522088753,"USC","SMU",3,3,0,0,3.5,400915525,2016-11-25
272,2,"7:30",450,450,"Sterling Brown made Jumper.",59,50,9,0.962287903931062,"USC","SMU",3,3,0,0,3.5,400915525,2016-11-25
273,2,"7:09",429,429,"Chimezie Metu made Layup.",61,50,11,0.974288215155207,"USC","SMU",3,3,0,0,3.5,400915525,2016-11-25
274,2,"6:56",416,416,"Semi Ojeleye made Three Point Jumper. Assisted by Shake Milton.",61,53,8,0.944389693114848,"USC","SMU",3,3,0,0,3.5,400915525,2016-11-25
275,2,"6:33",393,393,"Bennie Boatwright missed Jumper.",61,53,8,0.950835386029911,"USC","SMU",3,3,0,0,3.5,400915525,2016-11-25
276,2,"6:33",393,393,"Sterling Brown Defensive Rebound.",61,53,8,0.950835386029911,"USC","SMU",3,3,0,0,3.5,400915525,2016-11-25
277,2,"6:27",387,387,"Sterling Brown made Jumper.",61,55,6,0.903643796141121,"USC","SMU",3,3,0,0,3.5,400915525,2016-11-25
278,2,"6:24",384,384,"USC  Timeout",61,55,6,0.903643796141121,"USC","SMU",2,3,1,0,3.5,400915525,2016-11-25
279,2,"6:24",384,384,"Official TV Timeout",61,55,6,0.903643796141121,"USC","SMU",2,3,1,0,3.5,400915525,2016-11-25
280,2,"6:11",371,371,"Bennie Boatwright made Layup.",63,55,8,0.945244392883996,"USC","SMU",2,3,1,0,3.5,400915525,2016-11-25
281,2,"6:11",371,371,"Foul on Harry Froling.",63,55,8,0.945244392883996,"USC","SMU",2,3,1,0,3.5,400915525,2016-11-25
282,2,"6:11",371,371,"Bennie Boatwright made Free Throw.",64,55,9,0.959231735243722,"USC","SMU",2,3,1,0,3.5,400915525,2016-11-25
283,2,"5:43",343,343,"Dashawn McDowell missed Three Point Jumper.",64,55,9,0.963926789946294,"USC","SMU",2,3,1,0,3.5,400915525,2016-11-25
284,2,"5:43",343,343,"SMU Deadball Team Rebound.",64,55,9,0.963926789946294,"USC","SMU",2,3,1,0,3.5,400915525,2016-11-25
285,2,"5:41",341,341,"SMU  Turnover.",64,55,9,0.963926789946294,"USC","SMU",2,3,1,0,3.5,400915525,2016-11-25
286,2,"5:22",322,322,"Elijah Stewart missed Three Point Jumper.",64,55,9,0.961018162861006,"USC","SMU",2,3,0,0,3.5,400915525,2016-11-25
287,2,"5:22",322,322,"Jarrey Foster Defensive Rebound.",64,55,9,0.961018162861006,"USC","SMU",2,3,0,0,3.5,400915525,2016-11-25
288,2,"5:11",311,311,"Jarrey Foster made Three Point Jumper. Assisted by Ben Moore.",64,58,6,0.930200487867702,"USC","SMU",2,3,0,0,3.5,400915525,2016-11-25
289,2,"4:55",295,295,"Bennie Boatwright made Three Point Jumper. Assisted by De'Anthony Melton.",67,58,9,0.970359191070986,"USC","SMU",2,3,0,0,3.5,400915525,2016-11-25
290,2,"4:26",266,266,"Ben Moore missed Layup.",67,58,9,0.976980052442204,"USC","SMU",2,3,0,0,3.5,400915525,2016-11-25
291,2,"4:26",266,266,"De'Anthony Melton Defensive Rebound.",67,58,9,0.976980052442204,"USC","SMU",2,3,0,0,3.5,400915525,2016-11-25
292,2,"4:17",257,257,"Jordan McLaughlin made Layup.",69,58,11,0.993467422897974,"USC","SMU",2,3,0,0,3.5,400915525,2016-11-25
293,2,"4:17",257,257,"Foul on Sterling Brown.",69,58,11,0.993467422897974,"USC","SMU",2,3,0,0,3.5,400915525,2016-11-25
294,2,"4:17",257,257,"Jordan McLaughlin made Free Throw.",70,58,12,0.995704026736605,"USC","SMU",2,3,0,0,3.5,400915525,2016-11-25
295,2,"3:49",229,229,"Foul on Elijah Stewart.",70,58,12,0.996043651126129,"USC","SMU",2,3,0,0,3.5,400915525,2016-11-25
296,2,"3:49",229,229,"Official TV Timeout",70,58,12,0.996043651126129,"USC","SMU",2,3,0,0,3.5,400915525,2016-11-25
297,2,"3:49",229,229,"Sterling Brown missed Free Throw.",70,58,12,0.996043651126129,"USC","SMU",2,3,0,0,3.5,400915525,2016-11-25
298,2,"3:49",229,229,"Jordan McLaughlin Defensive Rebound.",70,58,12,0.996043651126129,"USC","SMU",2,3,0,0,3.5,400915525,2016-11-25
299,2,"3:26",206,206,"De'Anthony Melton missed Three Point Jumper.",70,58,12,0.997183384521921,"USC","SMU",2,3,0,0,3.5,400915525,2016-11-25
300,2,"3:26",206,206,"Semi Ojeleye Defensive Rebound.",70,58,12,0.997183384521921,"USC","SMU",2,3,0,0,3.5,400915525,2016-11-25
301,2,"3:10",190,190,"Ben Moore made Layup.",70,60,10,0.99287072717205,"USC","SMU",2,3,0,0,3.5,400915525,2016-11-25
302,2,"3:10",190,190,"Foul on Chimezie Metu.",70,60,10,0.99287072717205,"USC","SMU",2,3,0,0,3.5,400915525,2016-11-25
303,2,"3:10",190,190,"Ben Moore made Free Throw.",70,61,9,0.988664713479113,"USC","SMU",2,3,0,0,3.5,400915525,2016-11-25
304,2,"2:52",172,172,"Chimezie Metu Turnover.",70,61,9,0.992087704586871,"USC","SMU",2,3,0,0,3.5,400915525,2016-11-25
305,2,"2:46",166,166,"Shake Milton missed Jumper.",70,61,9,0.993889430511719,"USC","SMU",2,3,0,0,3.5,400915525,2016-11-25
306,2,"2:46",166,166,"Chimezie Metu Defensive Rebound.",70,61,9,0.993889430511719,"USC","SMU",2,3,0,0,3.5,400915525,2016-11-25
307,2,"2:36",156,156,"Foul on Jarrey Foster.",70,61,9,0.994517452665545,"USC","SMU",2,3,0,0,3.5,400915525,2016-11-25
308,2,"2:36",156,156,"Technical Foul on Chimezie Metu.",70,61,9,0.994517452665545,"USC","SMU",2,3,0,0,3.5,400915525,2016-11-25
309,2,"2:36",156,156,"Foul on Chimezie Metu.",70,61,9,0.994517452665545,"USC","SMU",2,3,0,0,3.5,400915525,2016-11-25
310,2,"2:36",156,156,"Technical Foul on Jarrey Foster.",70,61,9,0.994517452665545,"USC","SMU",2,3,0,0,3.5,400915525,2016-11-25
311,2,"2:36",156,156,"Foul on Jarrey Foster.",70,61,9,0.994517452665545,"USC","SMU",2,3,0,0,3.5,400915525,2016-11-25
312,2,"2:36",156,156,"Jonah Mathews made Free Throw.",71,61,10,0.996799296621382,"USC","SMU",2,3,0,0,3.5,400915525,2016-11-25
313,2,"2:36",156,156,"Jonah Mathews made Free Throw.",72,61,11,0.998133216565336,"USC","SMU",2,3,0,0,3.5,400915525,2016-11-25
314,2,"2:24",144,144,"Foul on Bennie Boatwright.",72,61,11,0.997434086587295,"USC","SMU",2,3,0,0,3.5,400915525,2016-11-25
315,2,"2:24",144,144,"Semi Ojeleye missed Free Throw.",72,61,11,0.997434086587295,"USC","SMU",2,3,0,0,3.5,400915525,2016-11-25
316,2,"2:24",144,144,"SMU Deadball Team Rebound.",72,61,11,0.997434086587295,"USC","SMU",2,3,0,0,3.5,400915525,2016-11-25
317,2,"2:24",144,144,"Semi Ojeleye made Free Throw.",72,62,10,0.995699559557655,"USC","SMU",2,3,0,0,3.5,400915525,2016-11-25
318,2,"2:12",132,132,"Bennie Boatwright missed Three Point Jumper.",72,62,10,0.997305072087516,"USC","SMU",2,3,0,0,3.5,400915525,2016-11-25
319,2,"2:12",132,132,"Semi Ojeleye Defensive Rebound.",72,62,10,0.997305072087516,"USC","SMU",2,3,0,0,3.5,400915525,2016-11-25
320,2,"2:02",122,122,"Ben Moore made Layup. Assisted by Semi Ojeleye.",72,64,8,0.99138676243057,"USC","SMU",2,3,0,0,3.5,400915525,2016-11-25
321,2,"1:36",96,96,"De'Anthony Melton made Layup.",74,64,10,0.998522686942531,"USC","SMU",2,3,0,0,3.5,400915525,2016-11-25
322,2,"1:24",84,84,"Ben Moore missed Layup.",74,64,10,0.999485657526132,"USC","SMU",2,3,0,0,3.5,400915525,2016-11-25
323,2,"1:24",84,84,"De'Anthony Melton Block.",74,64,10,0.999485657526132,"USC","SMU",2,3,0,0,3.5,400915525,2016-11-25
324,2,"1:23",83,83,"Ben Moore Offensive Rebound.",74,64,10,0.999485657526132,"USC","SMU",2,3,0,1,3.5,400915525,2016-11-25
325,2,"1:23",83,83,"Foul on Elijah Stewart.",74,64,10,0.999485657526132,"USC","SMU",2,3,0,1,3.5,400915525,2016-11-25
326,2,"1:23",83,83,"Ben Moore made Free Throw.",74,65,9,0.9989476125017,"USC","SMU",2,3,0,1,3.5,400915525,2016-11-25
327,2,"1:23",83,83,"SMU  Timeout",74,65,9,0.9989476125017,"USC","SMU",2,2,0,1,3.5,400915525,2016-11-25
328,2,"1:23",83,83,"Ben Moore made Free Throw.",74,66,8,0.997847939501499,"USC","SMU",2,2,0,1,3.5,400915525,2016-11-25
329,2,"1:16",76,76,"Shaqquan Aaron Turnover.",74,66,8,0.997623327689079,"USC","SMU",2,2,0,1,3.5,400915525,2016-11-25
330,2,"1:15",75,75,"Shake Milton Steal.",74,66,8,0.997623327689079,"USC","SMU",2,2,0,1,3.5,400915525,2016-11-25
331,2,"1:15",75,75,"Shake Milton made Layup.",74,68,6,0.989744919837317,"USC","SMU",2,2,0,1,3.5,400915525,2016-11-25
332,2,"1:00",60,60,"Foul on Jarrey Foster.",74,68,6,0.988969477962376,"USC","SMU",2,2,0,1,3.5,400915525,2016-11-25
333,2,"1:00",60,60,"Jonah Mathews made Free Throw.",75,68,7,0.994718464739691,"USC","SMU",2,2,0,1,3.5,400915525,2016-11-25
334,2,"1:00",60,60,"Jonah Mathews made Free Throw.",76,68,8,0.997478781440312,"USC","SMU",2,2,0,1,3.5,400915525,2016-11-25
335,2,"0:42",42,42,"Ben Moore missed Jumper.",76,68,8,0.999217901500839,"USC","SMU",2,2,0,1,3.5,400915525,2016-11-25
336,2,"0:42",42,42,"Charles Buggs Block.",76,68,8,0.999217901500839,"USC","SMU",2,2,0,1,3.5,400915525,2016-11-25
337,2,"0:42",42,42,"USC Defensive Rebound.",76,68,8,0.999217901500839,"USC","SMU",2,2,0,1,3.5,400915525,2016-11-25
338,2,"0:35",35,35,"Foul on Shake Milton.",76,68,8,0.998539828432845,"USC","SMU",2,2,0,1,3.5,400915525,2016-11-25
339,2,"0:35",35,35,"De'Anthony Melton made Free Throw.",77,68,9,0.999361278505703,"USC","SMU",2,2,0,1,3.5,400915525,2016-11-25
340,2,"0:35",35,35,"De'Anthony Melton missed Free Throw.",77,68,9,0.999361278505703,"USC","SMU",2,2,0,1,3.5,400915525,2016-11-25
341,2,"0:35",35,35,"Ben Moore Defensive Rebound.",77,68,9,0.999361278505703,"USC","SMU",2,2,0,1,3.5,400915525,2016-11-25
342,2,"0:21",21,21,"Shake Milton missed Layup.",77,68,9,0.999999603659814,"USC","SMU",2,2,0,0,3.5,400915525,2016-11-25
343,2,"0:21",21,21,"Semi Ojeleye Offensive Rebound.",77,68,9,0.999999603659814,"USC","SMU",2,2,0,0,3.5,400915525,2016-11-25
344,2,"0:19",19,19,"Semi Ojeleye missed Two Point Tip Shot.",77,68,9,0.999990915288747,"USC","SMU",2,2,0,0,3.5,400915525,2016-11-25
345,2,"0:19",19,19,"Ben Moore Offensive Rebound.",77,68,9,0.999990915288747,"USC","SMU",2,2,0,0,3.5,400915525,2016-11-25
346,2,"0:18",18,18,"Ben Moore made Layup.",77,70,7,0.999503039909455,"USC","SMU",2,2,0,0,3.5,400915525,2016-11-25
347,2,"0:18",18,18,"Foul on Jordan McLaughlin.",77,70,7,0.999503039909455,"USC","SMU",2,2,0,0,3.5,400915525,2016-11-25
348,2,"0:18",18,18,"Ben Moore made Free Throw.",77,71,6,0.998559703377157,"USC","SMU",2,2,0,0,3.5,400915525,2016-11-25
349,2,"0:13",13,13,"Foul on Sterling Brown.",77,71,6,0.999833696371773,"USC","SMU",2,2,0,0,3.5,400915525,2016-11-25
350,2,"0:13",13,13,"Jonah Mathews missed Free Throw.",77,71,6,0.999833696371773,"USC","SMU",2,2,0,0,3.5,400915525,2016-11-25
351,2,"0:13",13,13,"USC Deadball Team Rebound.",77,71,6,0.999833696371773,"USC","SMU",2,2,0,0,3.5,400915525,2016-11-25
352,2,"0:13",13,13,"Jonah Mathews made Free Throw.",78,71,7,0.999960072377866,"USC","SMU",2,2,0,0,3.5,400915525,2016-11-25
353,2,"0:06",6,6,"Sterling Brown missed Three Point Jumper.",78,71,7,0.999993232001024,"USC","SMU",2,2,0,0,3.5,400915525,2016-11-25
354,2,"0:06",6,6,"SMU Offensive Rebound.",78,71,7,0.999993232001024,"USC","SMU",2,2,0,0,3.5,400915525,2016-11-25
355,2,"0:01",1,1,"Foul on Charles Buggs.",78,71,7,0.999992858035431,"USC","SMU",2,2,0,0,3.5,400915525,2016-11-25
356,2,"0:01",1,1,"Shake Milton made Free Throw.",78,72,6,0.999960002357033,"USC","SMU",2,2,0,0,3.5,400915525,2016-11-25
357,2,"0:01",1,1,"Shake Milton made Free Throw.",78,73,5,0.999776032259246,"USC","SMU",2,2,0,0,3.5,400915525,2016-11-25
358,2,"0:00",0,0,"End of Game",78,73,5,1,"USC","SMU",2,2,0,0,3.5,400915525,2016-11-25
