"play_id","half","time_remaining_half","secs_remaining","secs_remaining_absolute","description","home_score","away_score","score_diff","win_prob","home","away","home_time_out_remaining","away_time_out_remaining","home_timeout_ind","away_timeout_ind","home_favored_by","game_id","date"
1,1,"20:00",2400,2400,"PLAY",0,0,0,0.878535193324199,"Wake Forest","LSU",4,4,0,0,11,400910711,2016-12-22
2,1,"20:00",2400,2400,"Jump Ball won by LSU",0,0,0,0.878535193324199,"Wake Forest","LSU",4,4,0,0,11,400910711,2016-12-22
3,1,"19:46",2386,2386,"Craig Victor II missed Jumper.",0,0,0,0.874347687975003,"Wake Forest","LSU",4,4,0,0,11,400910711,2016-12-22
4,1,"19:46",2386,2386,"John Collins Defensive Rebound.",0,0,0,0.874347687975003,"Wake Forest","LSU",4,4,0,0,11,400910711,2016-12-22
5,1,"19:26",2366,2366,"John Collins missed Jumper.",0,0,0,0.860023858338586,"Wake Forest","LSU",4,4,0,0,11,400910711,2016-12-22
6,1,"19:26",2366,2366,"Duop Reath Defensive Rebound.",0,0,0,0.860023858338586,"Wake Forest","LSU",4,4,0,0,11,400910711,2016-12-22
7,1,"19:14",2354,2354,"Duop Reath missed Jumper.",0,0,0,0.874846159764329,"Wake Forest","LSU",4,4,0,0,11,400910711,2016-12-22
8,1,"19:14",2354,2354,"Konstantinos Mitoglou Defensive Rebound.",0,0,0,0.874846159764329,"Wake Forest","LSU",4,4,0,0,11,400910711,2016-12-22
9,1,"18:56",2336,2336,"Bryant Crawford missed Three Point Jumper.",0,0,0,0.867106108773323,"Wake Forest","LSU",4,4,0,0,11,400910711,2016-12-22
10,1,"18:56",2336,2336,"Craig Victor II Defensive Rebound.",0,0,0,0.867106108773323,"Wake Forest","LSU",4,4,0,0,11,400910711,2016-12-22
11,1,"18:45",2325,2325,"Antonio Blakeney missed Jumper.",0,0,0,0.868466409148729,"Wake Forest","LSU",4,4,0,0,11,400910711,2016-12-22
12,1,"18:45",2325,2325,"Bryant Crawford Defensive Rebound.",0,0,0,0.868466409148729,"Wake Forest","LSU",4,4,0,0,11,400910711,2016-12-22
13,1,"18:26",2306,2306,"Konstantinos Mitoglou made Three Point Jumper. Assisted by Bryant Crawford.",3,0,3,0.889404949743733,"Wake Forest","LSU",4,4,0,0,11,400910711,2016-12-22
14,1,"18:12",2292,2292,"Duop Reath Turnover.",3,0,3,0.896948237559198,"Wake Forest","LSU",4,4,0,0,11,400910711,2016-12-22
15,1,"18:12",2292,2292,"Bryant Crawford Steal.",3,0,3,0.896948237559198,"Wake Forest","LSU",4,4,0,0,11,400910711,2016-12-22
16,1,"18:04",2284,2284,"Bryant Crawford made Layup.",5,0,5,0.91266337246627,"Wake Forest","LSU",4,4,0,0,11,400910711,2016-12-22
17,1,"18:03",2283,2283,"LSU  Timeout",5,0,5,0.91266337246627,"Wake Forest","LSU",3,4,1,0,11,400910711,2016-12-22
18,1,"17:49",2269,2269,"Brandon Sampson missed Three Point Jumper.",5,0,5,0.925352105875483,"Wake Forest","LSU",3,4,1,0,11,400910711,2016-12-22
19,1,"17:49",2269,2269,"Konstantinos Mitoglou Defensive Rebound.",5,0,5,0.925352105875483,"Wake Forest","LSU",3,4,1,0,11,400910711,2016-12-22
20,1,"17:34",2254,2254,"Konstantinos Mitoglou made Three Point Jumper. Assisted by Keyshawn Woods.",8,0,8,0.928874847944081,"Wake Forest","LSU",3,4,1,0,11,400910711,2016-12-22
21,1,"17:12",2232,2232,"Foul on Austin Arians.",8,0,8,0.938762160079088,"Wake Forest","LSU",3,4,1,0,11,400910711,2016-12-22
22,1,"17:08",2228,2228,"Skylar Mays Turnover.",8,0,8,0.934979773994299,"Wake Forest","LSU",3,4,1,0,11,400910711,2016-12-22
23,1,"17:08",2228,2228,"Konstantinos Mitoglou Steal.",8,0,8,0.934979773994299,"Wake Forest","LSU",3,4,1,0,11,400910711,2016-12-22
24,1,"17:03",2223,2223,"Foul on Craig Victor II.",8,0,8,0.934979773994299,"Wake Forest","LSU",3,4,1,0,11,400910711,2016-12-22
25,1,"17:03",2223,2223,"John Collins made Free Throw.",9,0,9,0.940928528169847,"Wake Forest","LSU",3,4,1,0,11,400910711,2016-12-22
26,1,"17:03",2223,2223,"John Collins made Free Throw.",10,0,10,0.946364247554433,"Wake Forest","LSU",3,4,1,0,11,400910711,2016-12-22
27,1,"16:48",2208,2208,"Foul on John Collins.",10,0,10,0.949951164218132,"Wake Forest","LSU",3,4,0,0,11,400910711,2016-12-22
28,1,"16:48",2208,2208,"Brandon Sampson made Free Throw.",10,1,9,0.944289001339058,"Wake Forest","LSU",3,4,0,0,11,400910711,2016-12-22
29,1,"16:48",2208,2208,"Brandon Sampson made Free Throw.",10,2,8,0.938028051604315,"Wake Forest","LSU",3,4,0,0,11,400910711,2016-12-22
30,1,"16:35",2195,2195,"Bryant Crawford Turnover.",10,2,8,0.943335177885872,"Wake Forest","LSU",3,4,0,0,11,400910711,2016-12-22
31,1,"16:35",2195,2195,"Duop Reath Steal.",10,2,8,0.943335177885872,"Wake Forest","LSU",3,4,0,0,11,400910711,2016-12-22
32,1,"16:28",2188,2188,"Brandon Sampson missed Three Point Jumper.",10,2,8,0.935731329977273,"Wake Forest","LSU",3,4,0,0,11,400910711,2016-12-22
33,1,"16:28",2188,2188,"Konstantinos Mitoglou Defensive Rebound.",10,2,8,0.935731329977273,"Wake Forest","LSU",3,4,0,0,11,400910711,2016-12-22
34,1,"16:25",2185,2185,"Foul on Duop Reath.",10,2,8,0.935731329977273,"Wake Forest","LSU",3,4,0,0,11,400910711,2016-12-22
35,1,"16:16",2176,2176,"Konstantinos Mitoglou missed Jumper.",10,2,8,0.934099178108203,"Wake Forest","LSU",3,4,0,0,11,400910711,2016-12-22
36,1,"16:16",2176,2176,"Craig Victor II Defensive Rebound.",10,2,8,0.934099178108203,"Wake Forest","LSU",3,4,0,0,11,400910711,2016-12-22
37,1,"16:00",2160,2160,"Craig Victor II missed Jumper.",10,2,8,0.93477296748475,"Wake Forest","LSU",3,4,0,0,11,400910711,2016-12-22
38,1,"16:00",2160,2160,"Duop Reath Offensive Rebound.",10,2,8,0.93477296748475,"Wake Forest","LSU",3,4,0,0,11,400910711,2016-12-22
39,1,"15:53",2153,2153,"Duop Reath made Layup.",10,4,6,0.923286874065491,"Wake Forest","LSU",3,4,0,0,11,400910711,2016-12-22
40,1,"15:46",2146,2146,"Konstantinos Mitoglou missed Three Point Jumper.",10,4,6,0.919959718083962,"Wake Forest","LSU",3,4,0,0,11,400910711,2016-12-22
41,1,"15:46",2146,2146,"Skylar Mays Defensive Rebound.",10,4,6,0.919959718083962,"Wake Forest","LSU",3,4,0,0,11,400910711,2016-12-22
42,1,"15:37",2137,2137,"Antonio Blakeney Turnover.",10,4,6,0.925691579168312,"Wake Forest","LSU",3,4,0,0,11,400910711,2016-12-22
43,1,"15:37",2137,2137,"Konstantinos Mitoglou Steal.",10,4,6,0.925691579168312,"Wake Forest","LSU",3,4,0,0,11,400910711,2016-12-22
44,1,"15:28",2128,2128,"Foul on Duop Reath.",10,4,6,0.921018665739496,"Wake Forest","LSU",3,4,0,0,11,400910711,2016-12-22
45,1,"15:28",2128,2128,"Official TV Timeout",10,4,6,0.921018665739496,"Wake Forest","LSU",3,4,0,0,11,400910711,2016-12-22
46,1,"15:28",2128,2128,"Bryant Crawford made Free Throw.",11,4,7,0.928963921199849,"Wake Forest","LSU",3,4,0,0,11,400910711,2016-12-22
47,1,"15:28",2128,2128,"Bryant Crawford made Free Throw.",12,4,8,0.936165306949828,"Wake Forest","LSU",3,4,0,0,11,400910711,2016-12-22
48,1,"15:21",2121,2121,"Antonio Blakeney missed Jumper.",12,4,8,0.936165306949828,"Wake Forest","LSU",3,4,0,0,11,400910711,2016-12-22
49,1,"15:21",2121,2121,"Bryant Crawford Defensive Rebound.",12,4,8,0.936165306949828,"Wake Forest","LSU",3,4,0,0,11,400910711,2016-12-22
50,1,"15:01",2101,2101,"Doral Moore missed Layup.",12,4,8,0.93387406491853,"Wake Forest","LSU",3,4,0,0,11,400910711,2016-12-22
51,1,"15:01",2101,2101,"Antonio Blakeney Defensive Rebound.",12,4,8,0.93387406491853,"Wake Forest","LSU",3,4,0,0,11,400910711,2016-12-22
52,1,"14:44",2084,2084,"Skylar Mays made Jumper.",12,6,6,0.917531881918776,"Wake Forest","LSU",3,4,0,0,11,400910711,2016-12-22
53,1,"14:30",2070,2070,"Doral Moore missed Jumper.",12,6,6,0.919595195228614,"Wake Forest","LSU",3,4,0,0,11,400910711,2016-12-22
54,1,"14:30",2070,2070,"Craig Victor II Defensive Rebound.",12,6,6,0.919595195228614,"Wake Forest","LSU",3,4,0,0,11,400910711,2016-12-22
55,1,"14:21",2061,2061,"Craig Victor II made Jumper. Assisted by Skylar Mays.",12,8,4,0.90118256063063,"Wake Forest","LSU",3,4,0,0,11,400910711,2016-12-22
56,1,"13:53",2033,2033,"Bryant Crawford missed Three Point Jumper.",12,8,4,0.909971351145331,"Wake Forest","LSU",3,4,0,0,11,400910711,2016-12-22
57,1,"13:53",2033,2033,"Doral Moore Offensive Rebound.",12,8,4,0.909971351145331,"Wake Forest","LSU",3,4,0,0,11,400910711,2016-12-22
58,1,"13:53",2033,2033,"Foul on Elbert Robinson III.",12,8,4,0.909971351145331,"Wake Forest","LSU",3,4,0,0,11,400910711,2016-12-22
59,1,"13:51",2031,2031,"Keyshawn Woods made Jumper. Assisted by Brandon Childress.",14,8,6,0.926593004257545,"Wake Forest","LSU",3,4,0,0,11,400910711,2016-12-22
60,1,"13:29",2009,2009,"Craig Victor II made Jumper. Assisted by Elbert Robinson III.",14,10,4,0.896776240340851,"Wake Forest","LSU",3,4,0,0,11,400910711,2016-12-22
61,1,"13:04",1984,1984,"Doral Moore Turnover.",14,10,4,0.89448908557614,"Wake Forest","LSU",3,4,0,0,11,400910711,2016-12-22
62,1,"12:47",1967,1967,"Foul on Mitchell Wilbekin.",14,10,4,0.897483515688049,"Wake Forest","LSU",3,4,0,0,11,400910711,2016-12-22
63,1,"12:47",1967,1967,"Elbert Robinson III made Free Throw.",14,11,3,0.887313733594773,"Wake Forest","LSU",3,4,0,0,11,400910711,2016-12-22
64,1,"12:47",1967,1967,"Elbert Robinson III made Free Throw.",14,12,2,0.876274174162514,"Wake Forest","LSU",3,4,0,0,11,400910711,2016-12-22
65,1,"12:38",1958,1958,"Foul on Elbert Robinson III.",14,12,2,0.876894697708842,"Wake Forest","LSU",3,4,0,0,11,400910711,2016-12-22
66,1,"12:36",1956,1956,"Greg McClinton Turnover.",14,12,2,0.876894697708842,"Wake Forest","LSU",3,4,0,0,11,400910711,2016-12-22
67,1,"12:36",1956,1956,"Skylar Mays Steal.",14,12,2,0.876894697708842,"Wake Forest","LSU",3,4,0,0,11,400910711,2016-12-22
68,1,"12:32",1952,1952,"Foul on Brandon Childress.",14,12,2,0.876894697708842,"Wake Forest","LSU",3,4,0,0,11,400910711,2016-12-22
69,1,"12:32",1952,1952,"Foul on Greg McClinton.",14,12,2,0.876894697708842,"Wake Forest","LSU",3,4,0,0,11,400910711,2016-12-22
70,1,"12:20",1940,1940,"Skylar Mays missed Layup.",14,12,2,0.877162167192813,"Wake Forest","LSU",3,4,0,0,11,400910711,2016-12-22
71,1,"12:20",1940,1940,"Brandon Childress Defensive Rebound.",14,12,2,0.877162167192813,"Wake Forest","LSU",3,4,0,0,11,400910711,2016-12-22
72,1,"12:06",1926,1926,"Brandon Childress missed Layup.",14,12,2,0.882755221212123,"Wake Forest","LSU",3,4,0,0,11,400910711,2016-12-22
73,1,"12:06",1926,1926,"Brandon Childress Offensive Rebound.",14,12,2,0.882755221212123,"Wake Forest","LSU",3,4,0,0,11,400910711,2016-12-22
74,1,"12:05",1925,1925,"Brandon Childress missed Layup.",14,12,2,0.882755221212123,"Wake Forest","LSU",3,4,0,0,11,400910711,2016-12-22
75,1,"12:04",1924,1924,"Skylar Mays Block.",14,12,2,0.882755221212123,"Wake Forest","LSU",3,4,0,0,11,400910711,2016-12-22
76,1,"12:04",1924,1924,"Wake Forest Offensive Rebound.",14,12,2,0.882755221212123,"Wake Forest","LSU",3,4,0,0,11,400910711,2016-12-22
77,1,"11:52",1912,1912,"Bryant Crawford made Layup.",16,12,4,0.908282907705654,"Wake Forest","LSU",3,4,0,0,11,400910711,2016-12-22
78,1,"11:42",1902,1902,"Craig Victor II missed Layup.",16,12,4,0.900496082612408,"Wake Forest","LSU",3,4,0,0,11,400910711,2016-12-22
79,1,"11:42",1902,1902,"John Collins Block.",16,12,4,0.900496082612408,"Wake Forest","LSU",3,4,0,0,11,400910711,2016-12-22
80,1,"11:42",1902,1902,"LSU Offensive Rebound.",16,12,4,0.900496082612408,"Wake Forest","LSU",3,4,0,0,11,400910711,2016-12-22
81,1,"11:41",1901,1901,"Official TV Timeout",16,12,4,0.900496082612408,"Wake Forest","LSU",3,4,0,0,11,400910711,2016-12-22
82,1,"11:39",1899,1899,"Kieran Hayward missed Jumper.",16,12,4,0.902458667525254,"Wake Forest","LSU",3,4,0,0,11,400910711,2016-12-22
83,1,"11:39",1899,1899,"Craig Victor II Offensive Rebound.",16,12,4,0.902458667525254,"Wake Forest","LSU",3,4,0,0,11,400910711,2016-12-22
84,1,"11:22",1882,1882,"Craig Victor II missed Jumper.",16,12,4,0.901611837913703,"Wake Forest","LSU",3,4,0,0,11,400910711,2016-12-22
85,1,"11:22",1882,1882,"LSU Offensive Rebound.",16,12,4,0.901611837913703,"Wake Forest","LSU",3,4,0,0,11,400910711,2016-12-22
86,1,"11:03",1863,1863,"Craig Victor II missed Jumper.",16,12,4,0.901715228569491,"Wake Forest","LSU",3,4,0,0,11,400910711,2016-12-22
87,1,"11:03",1863,1863,"Sam Japhet-Mathias Block.",16,12,4,0.901715228569491,"Wake Forest","LSU",3,4,0,0,11,400910711,2016-12-22
88,1,"11:03",1863,1863,"Brandon Childress Defensive Rebound.",16,12,4,0.901715228569491,"Wake Forest","LSU",3,4,0,0,11,400910711,2016-12-22
89,1,"10:57",1857,1857,"Brandon Childress made Layup.",18,12,6,0.921150739035495,"Wake Forest","LSU",3,4,0,0,11,400910711,2016-12-22
90,1,"10:44",1844,1844,"Craig Victor II Turnover.",18,12,6,0.916459290588078,"Wake Forest","LSU",3,4,0,0,11,400910711,2016-12-22
91,1,"10:26",1826,1826,"Brandon Childress missed Layup.",18,12,6,0.925273984067451,"Wake Forest","LSU",3,4,0,0,11,400910711,2016-12-22
92,1,"10:26",1826,1826,"Antonio Blakeney Defensive Rebound.",18,12,6,0.925273984067451,"Wake Forest","LSU",3,4,0,0,11,400910711,2016-12-22
93,1,"10:14",1814,1814,"Antonio Blakeney made Layup.",18,14,4,0.903823746881229,"Wake Forest","LSU",3,4,0,0,11,400910711,2016-12-22
94,1,"9:47",1787,1787,"Foul on Skylar Mays.",18,14,4,0.889339110248788,"Wake Forest","LSU",3,4,0,0,11,400910711,2016-12-22
95,1,"9:47",1787,1787,"Keyshawn Woods made Free Throw.",19,14,5,0.902234365129962,"Wake Forest","LSU",3,4,0,0,11,400910711,2016-12-22
96,1,"9:47",1787,1787,"Keyshawn Woods made Free Throw.",20,14,6,0.913772637374967,"Wake Forest","LSU",3,4,0,0,11,400910711,2016-12-22
97,1,"9:47",1787,1787,"Keyshawn Woods missed Free Throw.",20,14,6,0.913772637374967,"Wake Forest","LSU",3,4,0,0,11,400910711,2016-12-22
98,1,"9:47",1787,1787,"Wayde Sims Defensive Rebound.",20,14,6,0.913772637374967,"Wake Forest","LSU",3,4,0,0,11,400910711,2016-12-22
99,1,"9:36",1776,1776,"Antonio Blakeney made Jumper.",20,16,4,0.890604667329873,"Wake Forest","LSU",3,4,0,0,11,400910711,2016-12-22
100,1,"9:24",1764,1764,"Konstantinos Mitoglou made Jumper. Assisted by Keyshawn Woods.",22,16,6,0.925492247760086,"Wake Forest","LSU",3,4,0,0,11,400910711,2016-12-22
101,1,"9:10",1750,1750,"Antonio Blakeney made Three Point Jumper.",22,19,3,0.887339869855141,"Wake Forest","LSU",3,4,0,0,11,400910711,2016-12-22
102,1,"8:54",1734,1734,"John Collins made Dunk. Assisted by Bryant Crawford.",24,19,5,0.911936763891555,"Wake Forest","LSU",3,4,0,0,11,400910711,2016-12-22
103,1,"8:38",1718,1718,"Wayde Sims missed Jumper.",24,19,5,0.915496462750299,"Wake Forest","LSU",3,4,0,0,11,400910711,2016-12-22
104,1,"8:38",1718,1718,"Wayde Sims Offensive Rebound.",24,19,5,0.915496462750299,"Wake Forest","LSU",3,4,0,0,11,400910711,2016-12-22
105,1,"8:17",1697,1697,"Antonio Blakeney missed Jumper.",24,19,5,0.910985810753755,"Wake Forest","LSU",3,4,0,0,11,400910711,2016-12-22
106,1,"8:17",1697,1697,"Antonio Blakeney Offensive Rebound.",24,19,5,0.910985810753755,"Wake Forest","LSU",3,4,0,0,11,400910711,2016-12-22
107,1,"8:07",1687,1687,"Antonio Blakeney missed Three Point Jumper.",24,19,5,0.918910071787755,"Wake Forest","LSU",3,4,0,0,11,400910711,2016-12-22
108,1,"8:07",1687,1687,"Keyshawn Woods Defensive Rebound.",24,19,5,0.918910071787755,"Wake Forest","LSU",3,4,0,0,11,400910711,2016-12-22
109,1,"7:50",1670,1670,"John Collins made Dunk. Assisted by Keyshawn Woods.",26,19,7,0.932083703079133,"Wake Forest","LSU",3,4,0,0,11,400910711,2016-12-22
110,1,"7:36",1656,1656,"Kieran Hayward missed Three Point Jumper.",26,19,7,0.925659377039471,"Wake Forest","LSU",3,4,0,0,11,400910711,2016-12-22
111,1,"7:36",1656,1656,"John Collins Defensive Rebound.",26,19,7,0.925659377039471,"Wake Forest","LSU",3,4,0,0,11,400910711,2016-12-22
112,1,"7:28",1648,1648,"Mitchell Wilbekin made Three Point Jumper. Assisted by Bryant Crawford.",29,19,10,0.954145325459391,"Wake Forest","LSU",3,4,0,0,11,400910711,2016-12-22
113,1,"7:21",1641,1641,"LSU  Timeout",29,19,10,0.954145325459391,"Wake Forest","LSU",2,4,1,0,11,400910711,2016-12-22
114,1,"7:09",1629,1629,"Brandon Sampson Turnover.",29,19,10,0.953141650767849,"Wake Forest","LSU",2,4,1,0,11,400910711,2016-12-22
115,1,"6:59",1619,1619,"John Collins missed Jumper.",29,19,10,0.948089943438856,"Wake Forest","LSU",2,4,1,0,11,400910711,2016-12-22
116,1,"6:59",1619,1619,"Jalyn Patterson Defensive Rebound.",29,19,10,0.948089943438856,"Wake Forest","LSU",2,4,1,0,11,400910711,2016-12-22
117,1,"6:48",1608,1608,"Craig Victor II made Jumper.",29,21,8,0.935608902398629,"Wake Forest","LSU",2,4,1,0,11,400910711,2016-12-22
118,1,"6:32",1592,1592,"Austin Arians missed Three Point Jumper.",29,21,8,0.934629830070678,"Wake Forest","LSU",2,4,1,0,11,400910711,2016-12-22
119,1,"6:32",1592,1592,"Keyshawn Woods Offensive Rebound.",29,21,8,0.934629830070678,"Wake Forest","LSU",2,4,1,0,11,400910711,2016-12-22
120,1,"6:27",1587,1587,"Foul on Wayde Sims.",29,21,8,0.934495909229244,"Wake Forest","LSU",2,4,1,0,11,400910711,2016-12-22
121,1,"6:27",1587,1587,"John Collins missed Free Throw.",29,21,8,0.934495909229244,"Wake Forest","LSU",2,4,1,0,11,400910711,2016-12-22
122,1,"6:27",1587,1587,"Craig Victor II Defensive Rebound.",29,21,8,0.934495909229244,"Wake Forest","LSU",2,4,1,0,11,400910711,2016-12-22
123,1,"6:27",1587,1587,"Jalyn Patterson made Three Point Jumper. Assisted by Kieran Hayward.",29,24,5,0.904752577223972,"Wake Forest","LSU",2,4,1,0,11,400910711,2016-12-22
124,1,"6:18",1578,1578,"Keyshawn Woods missed Three Point Jumper.",29,24,5,0.915675015359894,"Wake Forest","LSU",2,4,0,0,11,400910711,2016-12-22
125,1,"6:18",1578,1578,"John Collins Offensive Rebound.",29,24,5,0.915675015359894,"Wake Forest","LSU",2,4,0,0,11,400910711,2016-12-22
126,1,"6:04",1564,1564,"John Collins Turnover.",29,24,5,0.904135154926548,"Wake Forest","LSU",2,4,0,0,11,400910711,2016-12-22
127,1,"6:04",1564,1564,"Jalyn Patterson Steal.",29,24,5,0.904135154926548,"Wake Forest","LSU",2,4,0,0,11,400910711,2016-12-22
128,1,"5:50",1550,1550,"Foul on John Collins.",29,24,5,0.902509636954715,"Wake Forest","LSU",2,4,0,0,11,400910711,2016-12-22
129,1,"5:42",1542,1542,"Wayde Sims missed Layup.",29,24,5,0.909896358185737,"Wake Forest","LSU",2,4,0,0,11,400910711,2016-12-22
130,1,"5:30",1530,1530,"Brandon Sampson Offensive Rebound.",29,24,5,0.909485386802819,"Wake Forest","LSU",2,4,0,0,11,400910711,2016-12-22
131,1,"5:26",1526,1526,"Brandon Sampson made Dunk.",29,26,3,0.877615829029249,"Wake Forest","LSU",2,4,0,0,11,400910711,2016-12-22
132,1,"5:10",1510,1510,"Bryant Crawford made Jumper.",31,26,5,0.913133542792121,"Wake Forest","LSU",2,4,0,0,11,400910711,2016-12-22
133,1,"5:03",1503,1503,"Craig Victor II made Jumper. Assisted by Jalyn Patterson.",31,28,3,0.879289506756702,"Wake Forest","LSU",2,4,0,0,11,400910711,2016-12-22
134,1,"4:55",1495,1495,"Bryant Crawford missed Jumper.",31,28,3,0.88365476719856,"Wake Forest","LSU",2,4,0,0,11,400910711,2016-12-22
135,1,"4:55",1495,1495,"Doral Moore Offensive Rebound.",31,28,3,0.88365476719856,"Wake Forest","LSU",2,4,0,0,11,400910711,2016-12-22
136,1,"4:48",1488,1488,"Doral Moore missed Layup.",31,28,3,0.878227284550013,"Wake Forest","LSU",2,4,0,0,11,400910711,2016-12-22
137,1,"4:48",1488,1488,"Bryant Crawford Offensive Rebound.",31,28,3,0.878227284550013,"Wake Forest","LSU",2,4,0,0,11,400910711,2016-12-22
138,1,"4:41",1481,1481,"Foul on Jalyn Patterson.",31,28,3,0.878227284550013,"Wake Forest","LSU",2,4,0,0,11,400910711,2016-12-22
139,1,"4:41",1481,1481,"Doral Moore missed Free Throw.",31,28,3,0.878227284550013,"Wake Forest","LSU",2,4,0,0,11,400910711,2016-12-22
140,1,"4:41",1481,1481,"Wake Forest Deadball Team Rebound.",31,28,3,0.878227284550013,"Wake Forest","LSU",2,4,0,0,11,400910711,2016-12-22
141,1,"4:41",1481,1481,"Doral Moore missed Free Throw.",31,28,3,0.878227284550013,"Wake Forest","LSU",2,4,0,0,11,400910711,2016-12-22
142,1,"4:41",1481,1481,"Jalyn Patterson Defensive Rebound.",31,28,3,0.878227284550013,"Wake Forest","LSU",2,4,0,0,11,400910711,2016-12-22
143,1,"4:41",1481,1481,"Foul on Doral Moore.",31,28,3,0.878227284550013,"Wake Forest","LSU",2,4,0,0,11,400910711,2016-12-22
144,1,"4:41",1481,1481,"Brian Bridgewater made Free Throw.",31,29,2,0.861238037331592,"Wake Forest","LSU",2,4,0,0,11,400910711,2016-12-22
145,1,"4:41",1481,1481,"Brian Bridgewater made Free Throw.",31,30,1,0.842304127455435,"Wake Forest","LSU",2,4,0,0,11,400910711,2016-12-22
146,1,"4:20",1460,1460,"Brandon Childress Turnover.",31,30,1,0.830255789858356,"Wake Forest","LSU",2,4,0,0,11,400910711,2016-12-22
147,1,"4:20",1460,1460,"Brandon Sampson Steal.",31,30,1,0.830255789858356,"Wake Forest","LSU",2,4,0,0,11,400910711,2016-12-22
148,1,"4:14",1454,1454,"Foul on Brandon Sampson.",31,30,1,0.840774832528646,"Wake Forest","LSU",2,4,0,0,11,400910711,2016-12-22
149,1,"4:14",1454,1454,"Brandon Sampson Turnover.",31,30,1,0.840774832528646,"Wake Forest","LSU",2,4,0,0,11,400910711,2016-12-22
150,1,"4:00",1440,1440,"Konstantinos Mitoglou made Layup. Assisted by Keyshawn Woods.",33,30,3,0.887511605818093,"Wake Forest","LSU",2,4,0,0,11,400910711,2016-12-22
151,1,"3:44",1424,1424,"Brian Bridgewater missed Layup.",33,30,3,0.866833976371248,"Wake Forest","LSU",2,4,0,0,11,400910711,2016-12-22
152,1,"3:44",1424,1424,"Doral Moore Block.",33,30,3,0.866833976371248,"Wake Forest","LSU",2,4,0,0,11,400910711,2016-12-22
153,1,"3:44",1424,1424,"Doral Moore Defensive Rebound.",33,30,3,0.866833976371248,"Wake Forest","LSU",2,4,0,0,11,400910711,2016-12-22
154,1,"3:24",1404,1404,"Konstantinos Mitoglou made Three Point Jumper. Assisted by Bryant Crawford.",36,30,6,0.926112284677286,"Wake Forest","LSU",2,4,0,0,11,400910711,2016-12-22
155,1,"3:03",1383,1383,"Antonio Blakeney missed Three Point Jumper.",36,30,6,0.920467559369743,"Wake Forest","LSU",2,4,0,0,11,400910711,2016-12-22
156,1,"3:03",1383,1383,"Wake Forest Defensive Rebound.",36,30,6,0.920467559369743,"Wake Forest","LSU",2,4,0,0,11,400910711,2016-12-22
157,1,"2:58",1378,1378,"Official TV Timeout",36,30,6,0.912223619064523,"Wake Forest","LSU",2,4,0,0,11,400910711,2016-12-22
158,1,"2:42",1362,1362,"Doral Moore missed Jumper.",36,30,6,0.918011899808934,"Wake Forest","LSU",2,4,0,0,11,400910711,2016-12-22
159,1,"2:42",1362,1362,"Bryant Crawford Offensive Rebound.",36,30,6,0.918011899808934,"Wake Forest","LSU",2,4,0,0,11,400910711,2016-12-22
160,1,"2:36",1356,1356,"Bryant Crawford made Jumper.",38,30,8,0.941408412325216,"Wake Forest","LSU",2,4,0,0,11,400910711,2016-12-22
161,1,"2:26",1346,1346,"Antonio Blakeney missed Three Point Jumper.",38,30,8,0.935114918701328,"Wake Forest","LSU",2,4,0,0,11,400910711,2016-12-22
162,1,"2:26",1346,1346,"Bryant Crawford Defensive Rebound.",38,30,8,0.935114918701328,"Wake Forest","LSU",2,4,0,0,11,400910711,2016-12-22
163,1,"2:18",1338,1338,"Mitchell Wilbekin missed Three Point Jumper.",38,30,8,0.934140166093175,"Wake Forest","LSU",2,4,0,0,11,400910711,2016-12-22
164,1,"2:18",1338,1338,"Brandon Sampson Defensive Rebound.",38,30,8,0.934140166093175,"Wake Forest","LSU",2,4,0,0,11,400910711,2016-12-22
165,1,"2:05",1325,1325,"Craig Victor II missed Jumper.",38,30,8,0.93933607287543,"Wake Forest","LSU",2,4,0,0,11,400910711,2016-12-22
166,1,"2:05",1325,1325,"Keyshawn Woods Defensive Rebound.",38,30,8,0.93933607287543,"Wake Forest","LSU",2,4,0,0,11,400910711,2016-12-22
167,1,"1:56",1316,1316,"Bryant Crawford made Layup.",40,30,10,0.956263714169453,"Wake Forest","LSU",2,4,0,0,11,400910711,2016-12-22
168,1,"1:29",1289,1289,"Jalyn Patterson made Three Point Jumper. Assisted by Antonio Blakeney.",40,33,7,0.929113135078914,"Wake Forest","LSU",2,4,0,0,11,400910711,2016-12-22
169,1,"1:07",1267,1267,"Konstantinos Mitoglou made Three Point Jumper. Assisted by Bryant Crawford.",43,33,10,0.958364079277554,"Wake Forest","LSU",2,4,0,0,11,400910711,2016-12-22
170,1,"0:46",1246,1246,"Foul on Konstantinos Mitoglou.",43,33,10,0.953834100128529,"Wake Forest","LSU",2,4,0,0,11,400910711,2016-12-22
171,1,"0:46",1246,1246,"Brandon Sampson made Free Throw.",43,34,9,0.946516014117841,"Wake Forest","LSU",2,4,0,0,11,400910711,2016-12-22
172,1,"0:46",1246,1246,"Brandon Sampson made Free Throw.",43,35,8,0.938113152174827,"Wake Forest","LSU",2,4,0,0,11,400910711,2016-12-22
173,1,"0:28",1228,1228,"Bryant Crawford Turnover.",43,35,8,0.942476244882593,"Wake Forest","LSU",2,4,0,0,11,400910711,2016-12-22
174,1,"0:28",1228,1228,"Craig Victor II Steal.",43,35,8,0.942476244882593,"Wake Forest","LSU",2,4,0,0,11,400910711,2016-12-22
175,1,"0:25",1225,1225,"Antonio Blakeney made Layup.",43,37,6,0.921200676025271,"Wake Forest","LSU",2,4,0,1,11,400910711,2016-12-22
176,1,"0:25",1225,1225,"Foul on Keyshawn Woods.",43,37,6,0.921200676025271,"Wake Forest","LSU",2,4,0,1,11,400910711,2016-12-22
177,1,"0:25",1225,1225,"Antonio Blakeney made Free Throw.",43,38,5,0.9080457728856,"Wake Forest","LSU",2,4,0,1,11,400910711,2016-12-22
178,1,"0:25",1225,1225,"Wake Forest  Timeout",43,38,5,0.9080457728856,"Wake Forest","LSU",2,3,0,1,11,400910711,2016-12-22
179,1,"0:09",1209,1209,"Konstantinos Mitoglou missed Three Point Jumper.",43,38,5,0.903046017614003,"Wake Forest","LSU",2,3,0,1,11,400910711,2016-12-22
180,1,"0:09",1209,1209,"Brandon Sampson Defensive Rebound.",43,38,5,0.903046017614003,"Wake Forest","LSU",2,3,0,1,11,400910711,2016-12-22
181,1,"0:00",1200,1200,"End of 1st half",43,38,5,0.903046017614003,"Wake Forest","LSU",2,3,0,1,11,400910711,2016-12-22
182,2,"20:00",1200,1200,"PLAY",43,38,5,0.903046017614003,"Wake Forest","LSU",3,4,0,0,11,400910711,2016-12-22
183,2,"20:00",1200,1200,"Jump Ball won by Wake Forest",43,38,5,0.903046017614003,"Wake Forest","LSU",3,4,0,0,11,400910711,2016-12-22
184,2,"19:53",1193,1193,"John Collins made Layup.",45,38,7,0.932951291550913,"Wake Forest","LSU",3,4,0,0,11,400910711,2016-12-22
185,2,"19:36",1176,1176,"Craig Victor II missed Jumper.",45,38,7,0.92498032580919,"Wake Forest","LSU",3,4,0,0,11,400910711,2016-12-22
186,2,"19:36",1176,1176,"John Collins Defensive Rebound.",45,38,7,0.92498032580919,"Wake Forest","LSU",3,4,0,0,11,400910711,2016-12-22
187,2,"19:11",1151,1151,"Bryant Crawford made Three Point Jumper. Assisted by John Collins.",48,38,10,0.951975854906697,"Wake Forest","LSU",3,4,0,0,11,400910711,2016-12-22
188,2,"18:52",1132,1132,"Brandon Sampson missed Three Point Jumper.",48,38,10,0.956170982482611,"Wake Forest","LSU",3,4,0,0,11,400910711,2016-12-22
189,2,"18:52",1132,1132,"Konstantinos Mitoglou Defensive Rebound.",48,38,10,0.956170982482611,"Wake Forest","LSU",3,4,0,0,11,400910711,2016-12-22
