"play_id","half","time_remaining_half","secs_remaining","secs_remaining_absolute","description","home_score","away_score","score_diff","win_prob","home","away","home_time_out_remaining","away_time_out_remaining","home_timeout_ind","away_timeout_ind","home_favored_by","game_id","date"
362,2,"4:36",276,276,"Austin Dasent missed Jumper.",100,74,26,0.999986148255481,"Iowa","Savannah State",4,3,0,0,25.6,400914993,2016-11-13
363,2,"4:36",276,276,"Isaiah Moss Block.",100,74,26,0.999986148255481,"Iowa","Savannah State",4,3,0,0,25.6,400914993,2016-11-13
364,2,"4:35",275,275,"Savannah St Offensive Rebound.",100,74,26,0.999986148255481,"Iowa","Savannah State",4,3,0,0,25.6,400914993,2016-11-13
365,2,"4:34",274,274,"Joshua Floyd Turnover.",100,74,26,0.999986148255481,"Iowa","Savannah State",4,3,0,0,25.6,400914993,2016-11-13
366,2,"4:33",273,273,"Maishe Dailey Steal.",100,74,26,0.999986148255481,"Iowa","Savannah State",4,3,0,0,25.6,400914993,2016-11-13
367,2,"4:30",270,270,"Ryan Kriener made Jumper. Assisted by Ahmad Wagner.",102,74,28,0.999993629995477,"Iowa","Savannah State",4,3,0,0,25.6,400914993,2016-11-13
368,2,"4:20",260,260,"Jahir Cabeza missed Three Point Jumper.",102,74,28,0.99999036292225,"Iowa","Savannah State",4,3,0,0,25.6,400914993,2016-11-13
369,2,"4:20",260,260,"Maishe Dailey Defensive Rebound.",102,74,28,0.99999036292225,"Iowa","Savannah State",4,3,0,0,25.6,400914993,2016-11-13
370,2,"4:17",257,257,"Isaiah Moss Turnover.",102,74,28,0.999997227076939,"Iowa","Savannah State",4,3,0,0,25.6,400914993,2016-11-13
371,2,"4:13",253,253,"Austin Dasent Steal.",102,74,28,0.999997227076939,"Iowa","Savannah State",4,3,0,0,25.6,400914993,2016-11-13
372,2,"4:12",252,252,"Joshua Floyd made Three Point Jumper. Assisted by Austin Dasent.",102,77,25,0.999990184021854,"Iowa","Savannah State",4,3,0,0,25.6,400914993,2016-11-13
373,2,"3:45",225,225,"Maishe Dailey missed Three Point Jumper.",102,77,25,0.999992736509181,"Iowa","Savannah State",4,3,0,0,25.6,400914993,2016-11-13
374,2,"3:45",225,225,"Robert Kelly Jr. Defensive Rebound.",102,77,25,0.999992736509181,"Iowa","Savannah State",4,3,0,0,25.6,400914993,2016-11-13
375,2,"3:44",224,224,"Foul on Isaiah Moss.",102,77,25,0.999992736509181,"Iowa","Savannah State",4,3,0,0,25.6,400914993,2016-11-13
376,2,"3:44",224,224,"Official TV Timeout",102,77,25,0.999992736509181,"Iowa","Savannah State",4,3,0,0,25.6,400914993,2016-11-13
377,2,"3:37",217,217,"Foul on Ahmad Wagner.",102,77,25,0.999993792924964,"Iowa","Savannah State",4,3,0,0,25.6,400914993,2016-11-13
378,2,"3:37",217,217,"Robert Kelly Jr. missed Free Throw.",102,77,25,0.999993792924964,"Iowa","Savannah State",4,3,0,0,25.6,400914993,2016-11-13
379,2,"3:37",217,217,"Maishe Dailey Defensive Rebound.",102,77,25,0.999993792924964,"Iowa","Savannah State",4,3,0,0,25.6,400914993,2016-11-13
380,2,"3:20",200,200,"Ryan Kriener missed Jumper.",102,77,25,0.999996262863089,"Iowa","Savannah State",4,3,0,0,25.6,400914993,2016-11-13
381,2,"3:20",200,200,"Troyce Manassa Defensive Rebound.",102,77,25,0.999996262863089,"Iowa","Savannah State",4,3,0,0,25.6,400914993,2016-11-13
382,2,"3:11",191,191,"Jordan Gaines missed Jumper.",102,77,25,0.999996064446156,"Iowa","Savannah State",4,3,0,0,25.6,400914993,2016-11-13
383,2,"3:11",191,191,"Ahmad Wagner Defensive Rebound.",102,77,25,0.999996064446156,"Iowa","Savannah State",4,3,0,0,25.6,400914993,2016-11-13
384,2,"3:03",183,183,"Maishe Dailey made Three Point Jumper. Assisted by Jordan Bohannon.",105,77,28,0.999999481880559,"Iowa","Savannah State",4,3,0,0,25.6,400914993,2016-11-13
385,2,"2:53",173,173,"Joshua Floyd missed Three Point Jumper.",105,77,28,0.999999609798214,"Iowa","Savannah State",4,3,0,0,25.6,400914993,2016-11-13
386,2,"2:53",173,173,"Ahmad Wagner Defensive Rebound.",105,77,28,0.999999609798214,"Iowa","Savannah State",4,3,0,0,25.6,400914993,2016-11-13
387,2,"2:38",158,158,"Ahmad Wagner made Layup. Assisted by Jordan Bohannon.",107,77,30,0.999999961395637,"Iowa","Savannah State",4,3,0,0,25.6,400914993,2016-11-13
388,2,"2:31",151,151,"Jordan Gaines made Layup. Assisted by Troyce Manassa.",107,79,28,0.999999886210835,"Iowa","Savannah State",4,3,0,0,25.6,400914993,2016-11-13
389,2,"2:17",137,137,"Isaiah Moss made Three Point Jumper. Assisted by Jordan Bohannon.",110,79,31,0.999999982491735,"Iowa","Savannah State",4,3,0,0,25.6,400914993,2016-11-13
390,2,"2:07",127,127,"Robert Kelly Jr. missed Three Point Jumper.",110,79,31,0.999999989358555,"Iowa","Savannah State",4,3,0,0,25.6,400914993,2016-11-13
391,2,"2:07",127,127,"Ryan Kriener Defensive Rebound.",110,79,31,0.999999989358555,"Iowa","Savannah State",4,3,0,0,25.6,400914993,2016-11-13
392,2,"1:55",115,115,"Foul on Troyce Manassa.",110,79,31,0.999999996627694,"Iowa","Savannah State",4,3,0,0,25.6,400914993,2016-11-13
393,2,"1:55",115,115,"Ryan Kriener made Free Throw.",111,79,32,0.999999998150788,"Iowa","Savannah State",4,3,0,0,25.6,400914993,2016-11-13
394,2,"1:55",115,115,"Ryan Kriener made Free Throw.",112,79,33,0.99999999898598,"Iowa","Savannah State",4,3,0,0,25.6,400914993,2016-11-13
395,2,"1:37",97,97,"Casey Wells missed Three Point Jumper.",112,79,33,0.999999999481971,"Iowa","Savannah State",4,3,0,0,25.6,400914993,2016-11-13
396,2,"1:37",97,97,"Jordan Bohannon Defensive Rebound.",112,79,33,0.999999999481971,"Iowa","Savannah State",4,3,0,0,25.6,400914993,2016-11-13
397,2,"1:22",82,82,"Cordell Pemsl Turnover.",112,79,33,0.999999999978589,"Iowa","Savannah State",4,3,0,0,25.6,400914993,2016-11-13
398,2,"1:21",81,81,"Jordan Gaines Steal.",112,79,33,0.999999999978589,"Iowa","Savannah State",4,3,0,0,25.6,400914993,2016-11-13
399,2,"1:17",77,77,"Dexter McClanahan missed Three Point Jumper.",112,79,33,0.999999999985191,"Iowa","Savannah State",4,3,0,0,25.6,400914993,2016-11-13
400,2,"1:17",77,77,"Maishe Dailey Block.",112,79,33,0.999999999985191,"Iowa","Savannah State",4,3,0,0,25.6,400914993,2016-11-13
401,2,"1:17",77,77,"Savannah St Offensive Rebound.",112,79,33,0.999999999985191,"Iowa","Savannah State",4,3,0,0,25.6,400914993,2016-11-13
402,2,"1:11",71,71,"Foul on Cordell Pemsl.",112,79,33,0.999999999985191,"Iowa","Savannah State",4,3,0,0,25.6,400914993,2016-11-13
403,2,"1:11",71,71,"Casey Wells missed Free Throw.",112,79,33,0.999999999985191,"Iowa","Savannah State",4,3,0,0,25.6,400914993,2016-11-13
404,2,"1:11",71,71,"Ryan Kriener Defensive Rebound.",112,79,33,0.999999999985191,"Iowa","Savannah State",4,3,0,0,25.6,400914993,2016-11-13
405,2,"1:00",60,60,"Charlie Rose missed Layup.",112,79,33,0.999999999983612,"Iowa","Savannah State",4,3,0,0,25.6,400914993,2016-11-13
406,2,"1:00",60,60,"Dexter McClanahan Defensive Rebound.",112,79,33,0.999999999983612,"Iowa","Savannah State",4,3,0,0,25.6,400914993,2016-11-13
407,2,"0:57",57,57,"Dexter McClanahan Turnover.",112,79,33,0.999999999999881,"Iowa","Savannah State",4,3,0,0,25.6,400914993,2016-11-13
408,2,"0:56",56,56,"Maishe Dailey Steal.",112,79,33,0.999999999999881,"Iowa","Savannah State",4,3,0,0,25.6,400914993,2016-11-13
409,2,"0:52",52,52,"Charlie Rose made Layup. Assisted by Jordan Bohannon.",114,79,35,0.999999999999766,"Iowa","Savannah State",4,3,0,0,25.6,400914993,2016-11-13
410,2,"0:39",39,39,"Dexter McClanahan made Three Point Jumper. Assisted by Zach Sellers.",114,82,32,0.999999999999967,"Iowa","Savannah State",4,3,0,0,25.6,400914993,2016-11-13
411,2,"0:12",12,12,"Ryan Kriener made Layup. Assisted by Cordell Pemsl.",116,82,34,1,"Iowa","Savannah State",4,3,0,0,25.6,400914993,2016-11-13
412,2,"0:02",2,2,"Troyce Manassa missed Layup.",116,82,34,1,"Iowa","Savannah State",4,3,0,0,25.6,400914993,2016-11-13
413,2,"0:02",2,2,"Maricus Glenn Offensive Rebound.",116,82,34,1,"Iowa","Savannah State",4,3,0,0,25.6,400914993,2016-11-13
414,2,"0:01",1,1,"Maricus Glenn made Two Point Tip Shot.",116,84,32,1,"Iowa","Savannah State",4,3,0,0,25.6,400914993,2016-11-13
415,2,"0:00",0,0,"End of Game",116,84,32,1,"Iowa","Savannah State",4,3,0,0,25.6,400914993,2016-11-13
