"play_id","half","time_remaining_half","secs_remaining","secs_remaining_absolute","description","home_score","away_score","score_diff","win_prob","home","away","home_time_out_remaining","away_time_out_remaining","home_timeout_ind","away_timeout_ind","home_favored_by","game_id","date"
1,1,"20:00",2400,2400,"PLAY",0,0,0,0.812374559801713,"Wake Forest","NC State",4,4,0,0,7,400915432,2017-02-11
2,1,"19:51",2391,2391,"Jr Dennis Smith missed Jumper.",0,0,0,0.812374559801713,"Wake Forest","NC State",4,4,0,0,7,400915432,2017-02-11
3,1,"19:51",2391,2391,"Austin Arians Defensive Rebound.",0,0,0,0.812374559801713,"Wake Forest","NC State",4,4,0,0,7,400915432,2017-02-11
4,1,"19:45",2385,2385,"John Collins made Dunk. Assisted by Keyshawn Woods.",2,0,2,0.818107789275949,"Wake Forest","NC State",4,4,0,0,7,400915432,2017-02-11
5,1,"19:30",2370,2370,"Abdul-Malik Abu made Jumper.",2,2,0,0.806537687201043,"Wake Forest","NC State",4,4,0,0,7,400915432,2017-02-11
6,1,"19:30",2370,2370,"Foul on Konstantinos Mitoglou.",2,2,0,0.806537687201043,"Wake Forest","NC State",4,4,0,0,7,400915432,2017-02-11
7,1,"19:30",2370,2370,"Abdul-Malik Abu missed Free Throw.",2,2,0,0.806537687201043,"Wake Forest","NC State",4,4,0,0,7,400915432,2017-02-11
8,1,"19:30",2370,2370,"John Collins Defensive Rebound.",2,2,0,0.806537687201043,"Wake Forest","NC State",4,4,0,0,7,400915432,2017-02-11
9,1,"19:12",2352,2352,"Austin Arians Turnover.",2,2,0,0.81170859980726,"Wake Forest","NC State",4,4,0,0,7,400915432,2017-02-11
10,1,"18:56",2336,2336,"Terry Henderson missed Three Point Jumper.",2,2,0,0.801696002615684,"Wake Forest","NC State",4,4,0,0,7,400915432,2017-02-11
11,1,"18:56",2336,2336,"Austin Arians Defensive Rebound.",2,2,0,0.801696002615684,"Wake Forest","NC State",4,4,0,0,7,400915432,2017-02-11
12,1,"18:46",2326,2326,"John Collins made Layup. Assisted by Keyshawn Woods.",4,2,2,0.837076083826609,"Wake Forest","NC State",4,4,0,0,7,400915432,2017-02-11
13,1,"18:30",2310,2310,"Maverick Rowan missed Three Point Jumper.",4,2,2,0.818141347397264,"Wake Forest","NC State",4,4,0,0,7,400915432,2017-02-11
14,1,"18:30",2310,2310,"Bryant Crawford Defensive Rebound.",4,2,2,0.818141347397264,"Wake Forest","NC State",4,4,0,0,7,400915432,2017-02-11
15,1,"18:25",2305,2305,"Foul on Omer Yurtseven.",4,2,2,0.820806269439835,"Wake Forest","NC State",4,4,0,0,7,400915432,2017-02-11
16,1,"18:16",2296,2296,"John Collins made Dunk. Assisted by Konstantinos Mitoglou.",6,2,4,0.856692668684796,"Wake Forest","NC State",4,4,0,0,7,400915432,2017-02-11
17,1,"17:49",2269,2269,"Omer Yurtseven missed Jumper.",6,2,4,0.871215645124816,"Wake Forest","NC State",4,4,0,0,7,400915432,2017-02-11
18,1,"17:49",2269,2269,"Austin Arians Defensive Rebound.",6,2,4,0.871215645124816,"Wake Forest","NC State",4,4,0,0,7,400915432,2017-02-11
19,1,"17:39",2259,2259,"Konstantinos Mitoglou missed Jumper.",6,2,4,0.849439632629278,"Wake Forest","NC State",4,4,0,0,7,400915432,2017-02-11
20,1,"17:39",2259,2259,"Maverick Rowan Defensive Rebound.",6,2,4,0.849439632629278,"Wake Forest","NC State",4,4,0,0,7,400915432,2017-02-11
21,1,"17:26",2246,2246,"Abdul-Malik Abu made Jumper.",6,4,2,0.818297745312592,"Wake Forest","NC State",4,4,0,0,7,400915432,2017-02-11
22,1,"17:09",2229,2229,"Bryant Crawford missed Three Point Jumper.",6,4,2,0.829611081868349,"Wake Forest","NC State",4,4,0,0,7,400915432,2017-02-11
23,1,"17:09",2229,2229,"Omer Yurtseven Defensive Rebound.",6,4,2,0.829611081868349,"Wake Forest","NC State",4,4,0,0,7,400915432,2017-02-11
24,1,"17:00",2220,2220,"Foul on Bryant Crawford.",6,4,2,0.829611081868349,"Wake Forest","NC State",4,4,0,0,7,400915432,2017-02-11
25,1,"16:52",2212,2212,"Foul on Abdul-Malik Abu.",6,4,2,0.833683326043226,"Wake Forest","NC State",4,4,0,0,7,400915432,2017-02-11
26,1,"16:52",2212,2212,"Abdul-Malik Abu Turnover.",6,4,2,0.833683326043226,"Wake Forest","NC State",4,4,0,0,7,400915432,2017-02-11
27,1,"16:33",2193,2193,"Foul on Maverick Rowan.",6,4,2,0.838356137124984,"Wake Forest","NC State",4,4,0,0,7,400915432,2017-02-11
28,1,"16:33",2193,2193,"Mitchell Wilbekin made Free Throw.",7,4,3,0.853521591268288,"Wake Forest","NC State",4,4,0,0,7,400915432,2017-02-11
29,1,"16:33",2193,2193,"Mitchell Wilbekin made Free Throw.",8,4,4,0.867489112302993,"Wake Forest","NC State",4,4,0,0,7,400915432,2017-02-11
30,1,"16:24",2184,2184,"Jr Dennis Smith Turnover.",8,4,4,0.856182970916972,"Wake Forest","NC State",4,4,0,0,7,400915432,2017-02-11
31,1,"16:03",2163,2163,"Mitchell Wilbekin missed Three Point Jumper.",8,4,4,0.853931458241058,"Wake Forest","NC State",4,4,0,0,7,400915432,2017-02-11
32,1,"16:03",2163,2163,"Omer Yurtseven Defensive Rebound.",8,4,4,0.853931458241058,"Wake Forest","NC State",4,4,0,0,7,400915432,2017-02-11
33,1,"15:56",2156,2156,"Terry Henderson missed Jumper.",8,4,4,0.856278270615571,"Wake Forest","NC State",4,4,0,0,7,400915432,2017-02-11
34,1,"15:56",2156,2156,"Mitchell Wilbekin Defensive Rebound.",8,4,4,0.856278270615571,"Wake Forest","NC State",4,4,0,0,7,400915432,2017-02-11
35,1,"15:38",2138,2138,"John Collins missed Jumper.",8,4,4,0.860292893596982,"Wake Forest","NC State",4,4,0,0,7,400915432,2017-02-11
36,1,"15:38",2138,2138,"Maverick Rowan Defensive Rebound.",8,4,4,0.860292893596982,"Wake Forest","NC State",4,4,0,0,7,400915432,2017-02-11
37,1,"15:17",2117,2117,"Jr Dennis Smith made Layup. Assisted by Omer Yurtseven.",8,6,2,0.832506581881884,"Wake Forest","NC State",4,4,0,0,7,400915432,2017-02-11
38,1,"15:11",2111,2111,"Bryant Crawford made Layup.",10,6,4,0.862846571116926,"Wake Forest","NC State",4,4,0,0,7,400915432,2017-02-11
39,1,"14:54",2094,2094,"Abdul-Malik Abu made Jumper.",10,8,2,0.82131918749313,"Wake Forest","NC State",4,4,0,0,7,400915432,2017-02-11
40,1,"14:33",2073,2073,"Keyshawn Woods missed Jumper.",10,8,2,0.823397842724209,"Wake Forest","NC State",4,4,0,0,7,400915432,2017-02-11
41,1,"14:33",2073,2073,"John Collins Offensive Rebound.",10,8,2,0.823397842724209,"Wake Forest","NC State",4,4,0,0,7,400915432,2017-02-11
42,1,"14:29",2069,2069,"John Collins made Layup.",12,8,4,0.852860725257062,"Wake Forest","NC State",4,4,0,0,7,400915432,2017-02-11
43,1,"14:04",2044,2044,"Jr Dennis Smith Turnover.",12,8,4,0.843951105673533,"Wake Forest","NC State",4,4,0,0,7,400915432,2017-02-11
44,1,"14:03",2043,2043,"Mitchell Wilbekin Steal.",12,8,4,0.843951105673533,"Wake Forest","NC State",4,4,0,0,7,400915432,2017-02-11
45,1,"14:00",2040,2040,"Foul on Terry Henderson.",12,8,4,0.843951105673533,"Wake Forest","NC State",4,4,0,0,7,400915432,2017-02-11
46,1,"13:59",2039,2039,"Official TV Timeout",12,8,4,0.862987720941947,"Wake Forest","NC State",4,4,0,0,7,400915432,2017-02-11
47,1,"13:47",2027,2027,"Mitchell Wilbekin made Jumper.",14,8,6,0.889486269843903,"Wake Forest","NC State",4,4,0,0,7,400915432,2017-02-11
48,1,"13:30",2010,2010,"Abdul-Malik Abu missed Jumper.",14,8,6,0.882318235950431,"Wake Forest","NC State",4,4,0,0,7,400915432,2017-02-11
49,1,"13:30",2010,2010,"Mitchell Wilbekin Defensive Rebound.",14,8,6,0.882318235950431,"Wake Forest","NC State",4,4,0,0,7,400915432,2017-02-11
50,1,"13:22",2002,2002,"Foul on Markell Johnson.",14,8,6,0.873937255037261,"Wake Forest","NC State",4,4,0,0,7,400915432,2017-02-11
51,1,"13:11",1991,1991,"Keyshawn Woods missed Layup.",14,8,6,0.889565209712959,"Wake Forest","NC State",4,4,0,0,7,400915432,2017-02-11
52,1,"13:11",1991,1991,"Markell Johnson Defensive Rebound.",14,8,6,0.889565209712959,"Wake Forest","NC State",4,4,0,0,7,400915432,2017-02-11
53,1,"12:56",1976,1976,"Terry Henderson missed Jumper.",14,8,6,0.891181036242309,"Wake Forest","NC State",4,4,0,0,7,400915432,2017-02-11
54,1,"12:56",1976,1976,"Ted Kapita Offensive Rebound.",14,8,6,0.891181036242309,"Wake Forest","NC State",4,4,0,0,7,400915432,2017-02-11
55,1,"12:53",1973,1973,"Ted Kapita Turnover.",14,8,6,0.891181036242309,"Wake Forest","NC State",4,4,0,0,7,400915432,2017-02-11
56,1,"12:25",1945,1945,"Keyshawn Woods missed Three Point Jumper.",14,8,6,0.883826893177782,"Wake Forest","NC State",4,4,0,0,7,400915432,2017-02-11
57,1,"12:25",1945,1945,"Austin Arians Offensive Rebound.",14,8,6,0.883826893177782,"Wake Forest","NC State",4,4,0,0,7,400915432,2017-02-11
58,1,"12:24",1944,1944,"Wake Forest  Turnover.",14,8,6,0.883826893177782,"Wake Forest","NC State",4,4,0,0,7,400915432,2017-02-11
59,1,"12:01",1921,1921,"Abdul-Malik Abu missed Layup.",14,8,6,0.886326437137802,"Wake Forest","NC State",4,4,0,0,7,400915432,2017-02-11
60,1,"12:01",1921,1921,"Doral Moore Block.",14,8,6,0.886326437137802,"Wake Forest","NC State",4,4,0,0,7,400915432,2017-02-11
61,1,"12:00",1920,1920,"Mitchell Wilbekin Defensive Rebound.",14,8,6,0.886326437137802,"Wake Forest","NC State",4,4,0,0,7,400915432,2017-02-11
62,1,"11:55",1915,1915,"Foul on Torin Dorn.",14,8,6,0.892285688374439,"Wake Forest","NC State",4,4,0,0,7,400915432,2017-02-11
63,1,"11:55",1915,1915,"Official TV Timeout",14,8,6,0.892285688374439,"Wake Forest","NC State",4,4,0,0,7,400915432,2017-02-11
64,1,"11:45",1905,1905,"Brandon Childress missed Jumper.",14,8,6,0.8794109817396,"Wake Forest","NC State",4,4,0,0,7,400915432,2017-02-11
65,1,"11:45",1905,1905,"Torin Dorn Defensive Rebound.",14,8,6,0.8794109817396,"Wake Forest","NC State",4,4,0,0,7,400915432,2017-02-11
66,1,"11:23",1883,1883,"Ted Kapita made Jumper. Assisted by Jr Dennis Smith.",14,10,4,0.853623661531651,"Wake Forest","NC State",4,4,0,0,7,400915432,2017-02-11
67,1,"11:10",1870,1870,"Bryant Crawford made Three Point Jumper.",17,10,7,0.892835783531281,"Wake Forest","NC State",4,4,0,0,7,400915432,2017-02-11
68,1,"10:43",1843,1843,"Torin Dorn missed Layup.",17,10,7,0.888335655165459,"Wake Forest","NC State",4,4,0,0,7,400915432,2017-02-11
69,1,"10:43",1843,1843,"Mitchell Wilbekin Defensive Rebound.",17,10,7,0.888335655165459,"Wake Forest","NC State",4,4,0,0,7,400915432,2017-02-11
70,1,"10:32",1832,1832,"John Collins made Layup. Assisted by Bryant Crawford.",19,10,9,0.915327863129389,"Wake Forest","NC State",4,4,0,0,7,400915432,2017-02-11
71,1,"9:56",1796,1796,"Ted Kapita Turnover.",19,10,9,0.913386601870279,"Wake Forest","NC State",4,4,0,0,7,400915432,2017-02-11
72,1,"9:38",1778,1778,"John Collins Turnover.",19,10,9,0.907253719490853,"Wake Forest","NC State",4,4,0,0,7,400915432,2017-02-11
73,1,"9:19",1759,1759,"Omer Yurtseven missed Jumper.",19,10,9,0.920600228529051,"Wake Forest","NC State",4,4,0,0,7,400915432,2017-02-11
74,1,"9:19",1759,1759,"Bryant Crawford Defensive Rebound.",19,10,9,0.920600228529051,"Wake Forest","NC State",4,4,0,0,7,400915432,2017-02-11
75,1,"9:11",1751,1751,"Brandon Childress missed Three Point Jumper.",19,10,9,0.920600228529051,"Wake Forest","NC State",4,4,0,0,7,400915432,2017-02-11
76,1,"9:11",1751,1751,"NC State Defensive Rebound.",19,10,9,0.920600228529051,"Wake Forest","NC State",4,4,0,0,7,400915432,2017-02-11
77,1,"8:51",1731,1731,"Ted Kapita missed Jumper.",19,10,9,0.921297909974252,"Wake Forest","NC State",4,4,0,0,7,400915432,2017-02-11
78,1,"8:51",1731,1731,"Mitchell Wilbekin Defensive Rebound.",19,10,9,0.921297909974252,"Wake Forest","NC State",4,4,0,0,7,400915432,2017-02-11
79,1,"8:39",1719,1719,"Foul on Ted Kapita.",19,10,9,0.922490909715919,"Wake Forest","NC State",4,4,0,0,7,400915432,2017-02-11
80,1,"8:39",1719,1719,"Konstantinos Mitoglou missed Free Throw.",19,10,9,0.922490909715919,"Wake Forest","NC State",4,4,0,0,7,400915432,2017-02-11
81,1,"8:39",1719,1719,"Omer Yurtseven Defensive Rebound.",19,10,9,0.922490909715919,"Wake Forest","NC State",4,4,0,0,7,400915432,2017-02-11
82,1,"8:30",1710,1710,"Jr Dennis Smith missed Three Point Jumper.",19,10,9,0.922490909715919,"Wake Forest","NC State",4,4,0,0,7,400915432,2017-02-11
83,1,"8:30",1710,1710,"John Collins Defensive Rebound.",19,10,9,0.922490909715919,"Wake Forest","NC State",4,4,0,0,7,400915432,2017-02-11
84,1,"8:19",1699,1699,"Brandon Childress made Layup.",21,10,11,0.941628428345048,"Wake Forest","NC State",4,4,0,0,7,400915432,2017-02-11
85,1,"8:01",1681,1681,"Torin Dorn missed Jumper.",21,10,11,0.945889543866879,"Wake Forest","NC State",4,4,0,0,7,400915432,2017-02-11
86,1,"8:01",1681,1681,"Keyshawn Woods Defensive Rebound.",21,10,11,0.945889543866879,"Wake Forest","NC State",4,4,0,0,7,400915432,2017-02-11
87,1,"7:54",1674,1674,"Keyshawn Woods missed Layup.",21,10,11,0.940079973037899,"Wake Forest","NC State",4,4,0,0,7,400915432,2017-02-11
88,1,"7:54",1674,1674,"Torin Dorn Defensive Rebound.",21,10,11,0.940079973037899,"Wake Forest","NC State",4,4,0,0,7,400915432,2017-02-11
89,1,"7:47",1667,1667,"Maverick Rowan missed Layup.",21,10,11,0.932873509783969,"Wake Forest","NC State",4,4,0,0,7,400915432,2017-02-11
90,1,"7:47",1667,1667,"John Collins Block.",21,10,11,0.932873509783969,"Wake Forest","NC State",4,4,0,0,7,400915432,2017-02-11
91,1,"7:46",1666,1666,"Brandon Childress Defensive Rebound.",21,10,11,0.932873509783969,"Wake Forest","NC State",4,4,0,0,7,400915432,2017-02-11
92,1,"7:41",1661,1661,"Foul on Jr Dennis Smith.",21,10,11,0.932873509783969,"Wake Forest","NC State",4,4,0,0,7,400915432,2017-02-11
93,1,"7:41",1661,1661,"Official TV Timeout",21,10,11,0.932873509783969,"Wake Forest","NC State",4,4,0,0,7,400915432,2017-02-11
94,1,"7:41",1661,1661,"Bryant Crawford missed Free Throw.",21,10,11,0.932873509783969,"Wake Forest","NC State",4,4,0,0,7,400915432,2017-02-11
95,1,"7:41",1661,1661,"Wake Forest Deadball Team Rebound.",21,10,11,0.932873509783969,"Wake Forest","NC State",4,4,0,0,7,400915432,2017-02-11
96,1,"7:41",1661,1661,"Bryant Crawford made Free Throw.",22,10,12,0.940538920120784,"Wake Forest","NC State",4,4,0,0,7,400915432,2017-02-11
97,1,"7:15",1635,1635,"Omer Yurtseven made Jumper.",22,12,10,0.926657502212717,"Wake Forest","NC State",4,4,0,0,7,400915432,2017-02-11
98,1,"6:47",1607,1607,"Bryant Crawford made Three Point Jumper. Assisted by Brandon Childress.",25,12,13,0.948150807986433,"Wake Forest","NC State",4,4,0,0,7,400915432,2017-02-11
99,1,"6:25",1585,1585,"Torin Dorn made Layup.",25,14,11,0.933727442019846,"Wake Forest","NC State",4,4,0,0,7,400915432,2017-02-11
100,1,"6:25",1585,1585,"Foul on John Collins.",25,14,11,0.933727442019846,"Wake Forest","NC State",4,4,0,0,7,400915432,2017-02-11
101,1,"6:25",1585,1585,"Torin Dorn made Free Throw.",25,15,10,0.924828650257749,"Wake Forest","NC State",4,4,0,0,7,400915432,2017-02-11
102,1,"6:11",1571,1571,"Konstantinos Mitoglou made Layup. Assisted by Bryant Crawford.",27,15,12,0.955355470516281,"Wake Forest","NC State",4,4,0,0,7,400915432,2017-02-11
103,1,"6:10",1570,1570,"Foul on Jr Dennis Smith.",27,15,12,0.955355470516281,"Wake Forest","NC State",4,4,0,0,7,400915432,2017-02-11
104,1,"6:10",1570,1570,"Konstantinos Mitoglou made Free Throw.",28,15,13,0.961524122174943,"Wake Forest","NC State",4,4,0,0,7,400915432,2017-02-11
105,1,"5:45",1545,1545,"Omer Yurtseven Turnover.",28,15,13,0.953092089371843,"Wake Forest","NC State",4,4,0,0,7,400915432,2017-02-11
106,1,"5:34",1534,1534,"Bryant Crawford made Three Point Jumper.",31,15,16,0.968707026479547,"Wake Forest","NC State",4,4,0,0,7,400915432,2017-02-11
107,1,"5:19",1519,1519,"Abdul-Malik Abu made Layup. Assisted by Jr Dennis Smith.",31,17,14,0.965638500554105,"Wake Forest","NC State",4,4,0,0,7,400915432,2017-02-11
108,1,"5:19",1519,1519,"Foul on Bryant Crawford.",31,17,14,0.965638500554105,"Wake Forest","NC State",4,4,0,0,7,400915432,2017-02-11
109,1,"5:18",1518,1518,"Abdul-Malik Abu made Free Throw.",31,18,13,0.960204222800793,"Wake Forest","NC State",4,4,0,0,7,400915432,2017-02-11
110,1,"5:10",1510,1510,"Mitchell Wilbekin missed Three Point Jumper.",31,18,13,0.960204222800793,"Wake Forest","NC State",4,4,0,0,7,400915432,2017-02-11
111,1,"5:10",1510,1510,"Abdul-Malik Abu Defensive Rebound.",31,18,13,0.960204222800793,"Wake Forest","NC State",4,4,0,0,7,400915432,2017-02-11
112,1,"5:02",1502,1502,"Terry Henderson missed Dunk.",31,18,13,0.95303803134816,"Wake Forest","NC State",4,4,0,0,7,400915432,2017-02-11
113,1,"5:02",1502,1502,"Keyshawn Woods Defensive Rebound.",31,18,13,0.95303803134816,"Wake Forest","NC State",4,4,0,0,7,400915432,2017-02-11
114,1,"4:55",1495,1495,"Austin Arians missed Three Point Jumper.",31,18,13,0.95403745079875,"Wake Forest","NC State",4,4,0,0,7,400915432,2017-02-11
115,1,"4:55",1495,1495,"Omer Yurtseven Defensive Rebound.",31,18,13,0.95403745079875,"Wake Forest","NC State",4,4,0,0,7,400915432,2017-02-11
116,1,"4:38",1478,1478,"Omer Yurtseven Turnover.",31,18,13,0.96171478777922,"Wake Forest","NC State",4,4,0,0,7,400915432,2017-02-11
117,1,"4:37",1477,1477,"Mitchell Wilbekin Steal.",31,18,13,0.96171478777922,"Wake Forest","NC State",4,4,0,0,7,400915432,2017-02-11
118,1,"4:32",1472,1472,"Foul on Abdul-Malik Abu.",31,18,13,0.96171478777922,"Wake Forest","NC State",4,4,0,0,7,400915432,2017-02-11
119,1,"4:32",1472,1472,"John Collins made Free Throw.",32,18,14,0.966961907875705,"Wake Forest","NC State",4,4,0,0,7,400915432,2017-02-11
120,1,"4:32",1472,1472,"John Collins made Free Throw.",33,18,15,0.971511195012422,"Wake Forest","NC State",4,4,0,0,7,400915432,2017-02-11
121,1,"4:22",1462,1462,"Foul on Austin Arians.",33,18,15,0.960342006941242,"Wake Forest","NC State",4,4,0,0,7,400915432,2017-02-11
122,1,"4:14",1454,1454,"Jr Dennis Smith missed Jumper.",33,18,15,0.965325710532727,"Wake Forest","NC State",4,4,0,0,7,400915432,2017-02-11
123,1,"4:14",1454,1454,"Brandon Childress Defensive Rebound.",33,18,15,0.965325710532727,"Wake Forest","NC State",4,4,0,0,7,400915432,2017-02-11
124,1,"4:08",1448,1448,"Mitchell Wilbekin missed Three Point Jumper.",33,18,15,0.970846260255545,"Wake Forest","NC State",4,4,0,0,7,400915432,2017-02-11
125,1,"4:08",1448,1448,"Torin Dorn Defensive Rebound.",33,18,15,0.970846260255545,"Wake Forest","NC State",4,4,0,0,7,400915432,2017-02-11
126,1,"3:59",1439,1439,"Jr Dennis Smith missed Layup.",33,18,15,0.966679063685489,"Wake Forest","NC State",4,4,0,0,7,400915432,2017-02-11
127,1,"3:59",1439,1439,"Torin Dorn Offensive Rebound.",33,18,15,0.966679063685489,"Wake Forest","NC State",4,4,0,0,7,400915432,2017-02-11
128,1,"3:56",1436,1436,"Torin Dorn made Layup.",33,20,13,0.955615691186559,"Wake Forest","NC State",4,4,0,0,7,400915432,2017-02-11
129,1,"3:39",1419,1419,"Keyshawn Woods made Jumper.",35,20,15,0.967362286543772,"Wake Forest","NC State",4,4,0,0,7,400915432,2017-02-11
130,1,"3:27",1407,1407,"Terry Henderson missed Three Point Jumper.",35,20,15,0.971521955494978,"Wake Forest","NC State",4,4,0,0,7,400915432,2017-02-11
131,1,"3:27",1407,1407,"Wake Forest Defensive Rebound.",35,20,15,0.971521955494978,"Wake Forest","NC State",4,4,0,0,7,400915432,2017-02-11
132,1,"3:23",1403,1403,"Official TV Timeout",35,20,15,0.971521955494978,"Wake Forest","NC State",4,4,0,0,7,400915432,2017-02-11
133,1,"3:10",1390,1390,"Mitchell Wilbekin Turnover.",35,20,15,0.970121338691184,"Wake Forest","NC State",4,4,0,0,7,400915432,2017-02-11
134,1,"2:47",1367,1367,"BeeJay Anya made Layup.",35,22,13,0.957317631705767,"Wake Forest","NC State",4,4,0,0,7,400915432,2017-02-11
135,1,"2:33",1353,1353,"Foul on Maverick Rowan.",35,22,13,0.959738800453531,"Wake Forest","NC State",4,4,0,0,7,400915432,2017-02-11
136,1,"2:33",1353,1353,"Doral Moore missed Free Throw.",35,22,13,0.959738800453531,"Wake Forest","NC State",4,4,0,0,7,400915432,2017-02-11
137,1,"2:33",1353,1353,"Wake Forest Deadball Team Rebound.",35,22,13,0.959738800453531,"Wake Forest","NC State",4,4,0,0,7,400915432,2017-02-11
138,1,"2:33",1353,1353,"Doral Moore made Free Throw.",36,22,14,0.96530175715493,"Wake Forest","NC State",4,4,0,0,7,400915432,2017-02-11
139,1,"2:20",1340,1340,"Jr Dennis Smith made Dunk.",36,24,12,0.949677821224984,"Wake Forest","NC State",4,4,0,0,7,400915432,2017-02-11
140,1,"2:06",1326,1326,"Keyshawn Woods made Three Point Jumper. Assisted by Konstantinos Mitoglou.",39,24,15,0.969661487998586,"Wake Forest","NC State",4,4,0,0,7,400915432,2017-02-11
141,1,"1:48",1308,1308,"Jr Dennis Smith Turnover.",39,24,15,0.963035988998617,"Wake Forest","NC State",4,4,0,0,7,400915432,2017-02-11
142,1,"1:40",1300,1300,"Brandon Childress missed Jumper.",39,24,15,0.963035988998617,"Wake Forest","NC State",4,4,0,0,7,400915432,2017-02-11
143,1,"1:40",1300,1300,"Maverick Rowan Defensive Rebound.",39,24,15,0.963035988998617,"Wake Forest","NC State",4,4,0,0,7,400915432,2017-02-11
144,1,"1:33",1293,1293,"Maverick Rowan Turnover.",39,24,15,0.97380452698774,"Wake Forest","NC State",4,4,0,0,7,400915432,2017-02-11
145,1,"1:31",1291,1291,"Keyshawn Woods Steal.",39,24,15,0.97380452698774,"Wake Forest","NC State",4,4,0,0,7,400915432,2017-02-11
146,1,"1:27",1287,1287,"Keyshawn Woods made Three Point Jumper.",42,24,18,0.978732708425097,"Wake Forest","NC State",4,4,0,0,7,400915432,2017-02-11
147,1,"1:08",1268,1268,"Torin Dorn missed Three Point Jumper.",42,24,18,0.98239151797559,"Wake Forest","NC State",4,4,0,0,7,400915432,2017-02-11
148,1,"1:08",1268,1268,"Keyshawn Woods Defensive Rebound.",42,24,18,0.98239151797559,"Wake Forest","NC State",4,4,0,0,7,400915432,2017-02-11
149,1,"0:54",1254,1254,"John Collins made Jumper.",44,24,20,0.982878534561693,"Wake Forest","NC State",4,4,0,0,7,400915432,2017-02-11
150,1,"0:48",1248,1248,"NC State  Timeout",44,24,20,0.985192771718242,"Wake Forest","NC State",3,4,1,0,7,400915432,2017-02-11
151,1,"0:26",1226,1226,"Foul on John Collins.",44,24,20,0.988568916454827,"Wake Forest","NC State",3,4,1,0,7,400915432,2017-02-11
152,1,"0:01",1201,1201,"Markell Johnson Turnover.",44,24,20,0.985983083245596,"Wake Forest","NC State",3,4,1,0,7,400915432,2017-02-11
153,1,"0:01",1201,1201,"Keyshawn Woods Steal.",44,24,20,0.985983083245596,"Wake Forest","NC State",3,4,1,0,7,400915432,2017-02-11
154,1,"0:00",1200,1200,"End of 1st half",44,24,20,0.985983083245596,"Wake Forest","NC State",3,4,1,0,7,400915432,2017-02-11
155,2,"20:00",1200,1200,"PLAY",44,24,20,0.985983083245596,"Wake Forest","NC State",4,4,0,0,7,400915432,2017-02-11
156,2,"19:51",1191,1191,"Konstantinos Mitoglou missed Layup.",44,24,20,0.98560830949724,"Wake Forest","NC State",4,4,0,0,7,400915432,2017-02-11
157,2,"19:51",1191,1191,"Abdul-Malik Abu Defensive Rebound.",44,24,20,0.98560830949724,"Wake Forest","NC State",4,4,0,0,7,400915432,2017-02-11
158,2,"19:42",1182,1182,"Jr Dennis Smith made Layup.",44,26,18,0.982912890643271,"Wake Forest","NC State",4,4,0,0,7,400915432,2017-02-11
159,2,"19:20",1160,1160,"John Collins missed Jumper.",44,26,18,0.981889211704583,"Wake Forest","NC State",4,4,0,0,7,400915432,2017-02-11
160,2,"19:20",1160,1160,"Omer Yurtseven Block.",44,26,18,0.981889211704583,"Wake Forest","NC State",4,4,0,0,7,400915432,2017-02-11
161,2,"19:19",1159,1159,"John Collins Offensive Rebound.",44,26,18,0.980892298818555,"Wake Forest","NC State",4,4,0,0,7,400915432,2017-02-11
162,2,"19:18",1158,1158,"John Collins missed Jumper.",44,26,18,0.980892298818555,"Wake Forest","NC State",4,4,0,0,7,400915432,2017-02-11
163,2,"19:18",1158,1158,"NC State Defensive Rebound.",44,26,18,0.980892298818555,"Wake Forest","NC State",4,4,0,0,7,400915432,2017-02-11
164,2,"19:03",1143,1143,"Abdul-Malik Abu missed Jumper.",44,26,18,0.983595211773834,"Wake Forest","NC State",4,4,0,0,7,400915432,2017-02-11
165,2,"19:03",1143,1143,"Konstantinos Mitoglou Defensive Rebound.",44,26,18,0.983595211773834,"Wake Forest","NC State",4,4,0,0,7,400915432,2017-02-11
166,2,"18:36",1116,1116,"John Collins made Dunk. Assisted by Keyshawn Woods.",46,26,20,0.98865725257167,"Wake Forest","NC State",4,4,0,0,7,400915432,2017-02-11
167,2,"18:13",1093,1093,"Jr Dennis Smith Turnover.",46,26,20,0.989161189826326,"Wake Forest","NC State",4,4,0,0,7,400915432,2017-02-11
168,2,"18:01",1081,1081,"Foul on Omer Yurtseven.",46,26,20,0.990101631118914,"Wake Forest","NC State",4,4,0,0,7,400915432,2017-02-11
169,2,"17:55",1075,1075,"Austin Arians made Three Point Jumper. Assisted by Keyshawn Woods.",49,26,23,0.992545402143688,"Wake Forest","NC State",4,4,0,0,7,400915432,2017-02-11
170,2,"17:40",1060,1060,"Terry Henderson Turnover.",49,26,23,0.993278170049077,"Wake Forest","NC State",4,4,0,0,7,400915432,2017-02-11
171,2,"17:40",1060,1060,"Foul on Terry Henderson.",49,26,23,0.993278170049077,"Wake Forest","NC State",4,4,0,0,7,400915432,2017-02-11
172,2,"17:28",1048,1048,"Foul on Omer Yurtseven.",49,26,23,0.994017320376351,"Wake Forest","NC State",4,4,0,0,7,400915432,2017-02-11
173,2,"17:28",1048,1048,"John Collins missed Free Throw.",49,26,23,0.994017320376351,"Wake Forest","NC State",4,4,0,0,7,400915432,2017-02-11
174,2,"17:28",1048,1048,"Wake Forest Deadball Team Rebound.",49,26,23,0.994017320376351,"Wake Forest","NC State",4,4,0,0,7,400915432,2017-02-11
175,2,"17:28",1048,1048,"John Collins made Free Throw.",50,26,24,0.994973916300515,"Wake Forest","NC State",4,4,0,0,7,400915432,2017-02-11
176,2,"17:02",1022,1022,"Torin Dorn missed Layup.",50,26,24,0.995198861708127,"Wake Forest","NC State",4,4,0,0,7,400915432,2017-02-11
177,2,"17:02",1022,1022,"John Collins Block.",50,26,24,0.995198861708127,"Wake Forest","NC State",4,4,0,0,7,400915432,2017-02-11
178,2,"17:01",1021,1021,"Bryant Crawford Defensive Rebound.",50,26,24,0.995198861708127,"Wake Forest","NC State",4,4,0,0,7,400915432,2017-02-11
179,2,"16:56",1016,1016,"Mitchell Wilbekin missed Three Point Jumper.",50,26,24,0.994831701986341,"Wake Forest","NC State",4,4,0,0,7,400915432,2017-02-11
180,2,"16:56",1016,1016,"Torin Dorn Defensive Rebound.",50,26,24,0.994831701986341,"Wake Forest","NC State",4,4,0,0,7,400915432,2017-02-11
181,2,"16:48",1008,1008,"Foul on Mitchell Wilbekin.",50,26,24,0.995412862197701,"Wake Forest","NC State",4,4,0,0,7,400915432,2017-02-11
182,2,"16:48",1008,1008,"Torin Dorn made Free Throw.",50,27,23,0.994479249266803,"Wake Forest","NC State",4,4,0,0,7,400915432,2017-02-11
183,2,"16:48",1008,1008,"Torin Dorn made Free Throw.",50,28,22,0.993356887686556,"Wake Forest","NC State",4,4,0,0,7,400915432,2017-02-11
184,2,"16:33",993,993,"Bryant Crawford made Layup.",52,28,24,0.994647702896227,"Wake Forest","NC State",4,4,0,0,7,400915432,2017-02-11
185,2,"16:04",964,964,"Foul on Konstantinos Mitoglou.",52,28,24,0.995289789619553,"Wake Forest","NC State",4,4,0,0,7,400915432,2017-02-11
