"play_id","half","time_remaining_half","secs_remaining","secs_remaining_absolute","description","home_score","away_score","score_diff","win_prob","home","away","home_time_out_remaining","away_time_out_remaining","home_timeout_ind","away_timeout_ind","home_favored_by","game_id","date"
186,2,"16:04",964,964,"Omer Yurtseven made Free Throw.",52,29,23,0.994335024565029,"Wake Forest","NC State",4,4,0,0,7,400915432,2017-02-11
187,2,"16:04",964,964,"Omer Yurtseven made Free Throw.",52,30,22,0.993188052105971,"Wake Forest","NC State",4,4,0,0,7,400915432,2017-02-11
188,2,"15:54",954,954,"Bryant Crawford missed Three Point Jumper.",52,30,22,0.99451415181481,"Wake Forest","NC State",4,4,0,0,7,400915432,2017-02-11
189,2,"15:54",954,954,"Konstantinos Mitoglou Offensive Rebound.",52,30,22,0.99451415181481,"Wake Forest","NC State",4,4,0,0,7,400915432,2017-02-11
190,2,"15:49",949,949,"Konstantinos Mitoglou made Layup.",54,30,24,0.996547545983252,"Wake Forest","NC State",4,4,0,0,7,400915432,2017-02-11
191,2,"15:29",929,929,"Abdul-Malik Abu missed Jumper.",54,30,24,0.995895141469813,"Wake Forest","NC State",4,4,0,0,7,400915432,2017-02-11
192,2,"15:29",929,929,"Konstantinos Mitoglou Defensive Rebound.",54,30,24,0.995895141469813,"Wake Forest","NC State",4,4,0,0,7,400915432,2017-02-11
193,2,"15:17",917,917,"John Collins made Layup.",56,30,26,0.997779019113254,"Wake Forest","NC State",4,4,0,0,7,400915432,2017-02-11
194,2,"15:02",902,902,"Foul on Konstantinos Mitoglou.",56,30,26,0.997268637605231,"Wake Forest","NC State",4,4,0,0,7,400915432,2017-02-11
195,2,"15:02",902,902,"Official TV Timeout",56,30,26,0.997268637605231,"Wake Forest","NC State",4,4,0,0,7,400915432,2017-02-11
196,2,"15:00",900,900,"Jr Dennis Smith missed Jumper.",56,30,26,0.997268637605231,"Wake Forest","NC State",4,4,0,0,7,400915432,2017-02-11
197,2,"15:00",900,900,"Doral Moore Defensive Rebound.",56,30,26,0.997268637605231,"Wake Forest","NC State",4,4,0,0,7,400915432,2017-02-11
198,2,"14:42",882,882,"Austin Arians made Three Point Jumper. Assisted by Bryant Crawford.",59,30,29,0.997388501889373,"Wake Forest","NC State",4,4,0,0,7,400915432,2017-02-11
199,2,"14:18",858,858,"Maverick Rowan made Three Point Jumper. Assisted by Jr Dennis Smith.",59,33,26,0.998187176002612,"Wake Forest","NC State",4,4,0,0,7,400915432,2017-02-11
200,2,"13:54",834,834,"John Collins made Jumper. Assisted by Austin Arians.",61,33,28,0.998877213396974,"Wake Forest","NC State",4,4,0,0,7,400915432,2017-02-11
201,2,"13:38",818,818,"Jr Dennis Smith made Three Point Jumper. Assisted by Abdul-Malik Abu.",61,36,25,0.997071364538589,"Wake Forest","NC State",4,4,0,0,7,400915432,2017-02-11
202,2,"13:18",798,798,"Doral Moore made Jumper. Assisted by Austin Arians.",63,36,27,0.998921761834699,"Wake Forest","NC State",4,4,0,0,7,400915432,2017-02-11
203,2,"12:59",779,779,"Foul on Doral Moore.",63,36,27,0.99863352960535,"Wake Forest","NC State",4,4,0,0,7,400915432,2017-02-11
204,2,"12:59",779,779,"Abdul-Malik Abu missed Free Throw.",63,36,27,0.99863352960535,"Wake Forest","NC State",4,4,0,0,7,400915432,2017-02-11
205,2,"12:59",779,779,"NC State Deadball Team Rebound.",63,36,27,0.99863352960535,"Wake Forest","NC State",4,4,0,0,7,400915432,2017-02-11
206,2,"12:59",779,779,"Abdul-Malik Abu missed Free Throw.",63,36,27,0.99863352960535,"Wake Forest","NC State",4,4,0,0,7,400915432,2017-02-11
207,2,"12:59",779,779,"Terry Henderson Offensive Rebound.",63,36,27,0.99863352960535,"Wake Forest","NC State",4,4,0,0,7,400915432,2017-02-11
208,2,"12:56",776,776,"Maverick Rowan missed Three Point Jumper.",63,36,27,0.99863352960535,"Wake Forest","NC State",4,4,0,0,7,400915432,2017-02-11
209,2,"12:56",776,776,"Keyshawn Woods Defensive Rebound.",63,36,27,0.99863352960535,"Wake Forest","NC State",4,4,0,0,7,400915432,2017-02-11
210,2,"12:49",769,769,"Keyshawn Woods made Layup.",65,36,29,0.999317205110733,"Wake Forest","NC State",4,4,0,0,7,400915432,2017-02-11
211,2,"12:31",751,751,"Jr Dennis Smith missed Layup.",65,36,29,0.99927477155087,"Wake Forest","NC State",4,4,0,0,7,400915432,2017-02-11
212,2,"12:31",751,751,"Konstantinos Mitoglou Block.",65,36,29,0.99927477155087,"Wake Forest","NC State",4,4,0,0,7,400915432,2017-02-11
213,2,"12:30",750,750,"Doral Moore Defensive Rebound.",65,36,29,0.99927477155087,"Wake Forest","NC State",4,4,0,0,7,400915432,2017-02-11
214,2,"12:10",730,730,"Doral Moore missed Jumper.",65,36,29,0.9991060898354,"Wake Forest","NC State",4,4,0,0,7,400915432,2017-02-11
215,2,"12:10",730,730,"Abdul-Malik Abu Defensive Rebound.",65,36,29,0.9991060898354,"Wake Forest","NC State",4,4,0,0,7,400915432,2017-02-11
216,2,"11:47",707,707,"Abdul-Malik Abu missed Layup.",65,36,29,0.999119185718316,"Wake Forest","NC State",4,4,0,0,7,400915432,2017-02-11
217,2,"11:47",707,707,"Jr Dennis Smith Offensive Rebound.",65,36,29,0.999119185718316,"Wake Forest","NC State",4,4,0,0,7,400915432,2017-02-11
218,2,"11:46",706,706,"Foul on Mitchell Wilbekin.",65,36,29,0.999119185718316,"Wake Forest","NC State",4,4,0,0,7,400915432,2017-02-11
219,2,"11:46",706,706,"Official TV Timeout",65,36,29,0.999119185718316,"Wake Forest","NC State",4,4,0,0,7,400915432,2017-02-11
220,2,"11:44",704,704,"Maverick Rowan missed Three Point Jumper.",65,36,29,0.999119185718316,"Wake Forest","NC State",4,4,0,0,7,400915432,2017-02-11
221,2,"11:44",704,704,"Torin Dorn Offensive Rebound.",65,36,29,0.999119185718316,"Wake Forest","NC State",4,4,0,0,7,400915432,2017-02-11
222,2,"11:39",699,699,"Foul on Doral Moore.",65,36,29,0.999616198738038,"Wake Forest","NC State",4,4,0,0,7,400915432,2017-02-11
223,2,"11:39",699,699,"Torin Dorn missed Free Throw.",65,36,29,0.999616198738038,"Wake Forest","NC State",4,4,0,0,7,400915432,2017-02-11
224,2,"11:39",699,699,"NC State Deadball Team Rebound.",65,36,29,0.999616198738038,"Wake Forest","NC State",4,4,0,0,7,400915432,2017-02-11
225,2,"11:39",699,699,"Torin Dorn made Free Throw.",65,37,28,0.999513273196704,"Wake Forest","NC State",4,4,0,0,7,400915432,2017-02-11
226,2,"11:22",682,682,"Keyshawn Woods made Three Point Jumper.",68,37,31,0.99958428093239,"Wake Forest","NC State",4,4,0,0,7,400915432,2017-02-11
227,2,"11:02",662,662,"Torin Dorn made Jumper.",68,39,29,0.999418057944945,"Wake Forest","NC State",4,4,0,0,7,400915432,2017-02-11
228,2,"10:49",649,649,"Keyshawn Woods missed Jumper.",68,39,29,0.999593148968213,"Wake Forest","NC State",4,4,0,0,7,400915432,2017-02-11
229,2,"10:49",649,649,"Torin Dorn Defensive Rebound.",68,39,29,0.999593148968213,"Wake Forest","NC State",4,4,0,0,7,400915432,2017-02-11
230,2,"10:40",640,640,"Torin Dorn made Layup.",68,41,27,0.999342874400639,"Wake Forest","NC State",4,4,0,0,7,400915432,2017-02-11
231,2,"10:26",626,626,"Keyshawn Woods made Three Point Jumper. Assisted by Brandon Childress.",71,41,30,0.999788227348924,"Wake Forest","NC State",4,4,0,0,7,400915432,2017-02-11
232,2,"9:56",596,596,"Omer Yurtseven missed Layup.",71,41,30,0.999667769379748,"Wake Forest","NC State",4,4,0,0,7,400915432,2017-02-11
233,2,"9:56",596,596,"Konstantinos Mitoglou Defensive Rebound.",71,41,30,0.999667769379748,"Wake Forest","NC State",4,4,0,0,7,400915432,2017-02-11
234,2,"9:51",591,591,"Keyshawn Woods made Three Point Jumper. Assisted by Brandon Childress.",74,41,33,0.999838100141194,"Wake Forest","NC State",4,4,0,0,7,400915432,2017-02-11
235,2,"9:39",579,579,"NC State  Timeout",74,41,33,0.99990612041435,"Wake Forest","NC State",3,4,1,0,7,400915432,2017-02-11
236,2,"9:29",569,569,"Maverick Rowan made Jumper. Assisted by Terry Henderson.",74,43,31,0.999867302743917,"Wake Forest","NC State",3,4,1,0,7,400915432,2017-02-11
237,2,"9:11",551,551,"Foul on BeeJay Anya.",74,43,31,0.999857048567914,"Wake Forest","NC State",3,4,1,0,7,400915432,2017-02-11
238,2,"9:06",546,546,"Austin Arians made Layup.",76,43,33,0.999929819216322,"Wake Forest","NC State",3,4,1,0,7,400915432,2017-02-11
239,2,"8:36",516,516,"Foul on Brandon Childress.",76,43,33,0.99993521450306,"Wake Forest","NC State",3,4,0,0,7,400915432,2017-02-11
240,2,"8:36",516,516,"Jr Dennis Smith made Free Throw.",76,44,32,0.99991508905428,"Wake Forest","NC State",3,4,0,0,7,400915432,2017-02-11
241,2,"8:36",516,516,"Jr Dennis Smith made Free Throw.",76,45,31,0.999888712382162,"Wake Forest","NC State",3,4,0,0,7,400915432,2017-02-11
242,2,"8:16",496,496,"Bryant Crawford Turnover.",76,45,31,0.999904417425594,"Wake Forest","NC State",3,4,0,0,7,400915432,2017-02-11
243,2,"8:00",480,480,"Maverick Rowan missed Jumper.",76,45,31,0.999903619170664,"Wake Forest","NC State",3,4,0,0,7,400915432,2017-02-11
244,2,"8:00",480,480,"Brandon Childress Block.",76,45,31,0.999903619170664,"Wake Forest","NC State",3,4,0,0,7,400915432,2017-02-11
245,2,"7:58",478,478,"Brandon Childress Defensive Rebound.",76,45,31,0.999945025279134,"Wake Forest","NC State",3,4,0,0,7,400915432,2017-02-11
246,2,"7:54",474,474,"Keyshawn Woods missed Three Point Jumper.",76,45,31,0.999945025279134,"Wake Forest","NC State",3,4,0,0,7,400915432,2017-02-11
247,2,"7:54",474,474,"Torin Dorn Defensive Rebound.",76,45,31,0.999945025279134,"Wake Forest","NC State",3,4,0,0,7,400915432,2017-02-11
248,2,"7:38",458,458,"Terry Henderson missed Jumper.",76,45,31,0.999972570964065,"Wake Forest","NC State",3,4,0,0,7,400915432,2017-02-11
249,2,"7:38",458,458,"BeeJay Anya Offensive Rebound.",76,45,31,0.999972570964065,"Wake Forest","NC State",3,4,0,0,7,400915432,2017-02-11
250,2,"7:34",454,454,"Foul on Doral Moore.",76,45,31,0.999972570964065,"Wake Forest","NC State",3,4,0,0,7,400915432,2017-02-11
251,2,"7:34",454,454,"Official TV Timeout",76,45,31,0.999972570964065,"Wake Forest","NC State",3,4,0,0,7,400915432,2017-02-11
252,2,"7:34",454,454,"BeeJay Anya made Free Throw.",76,46,30,0.999962338844062,"Wake Forest","NC State",3,4,0,0,7,400915432,2017-02-11
253,2,"7:34",454,454,"BeeJay Anya missed Free Throw.",76,46,30,0.999962338844062,"Wake Forest","NC State",3,4,0,0,7,400915432,2017-02-11
254,2,"7:34",454,454,"Austin Arians Defensive Rebound.",76,46,30,0.999962338844062,"Wake Forest","NC State",3,4,0,0,7,400915432,2017-02-11
255,2,"7:20",440,440,"Keyshawn Woods missed Layup.",76,46,30,0.999870527795345,"Wake Forest","NC State",3,4,0,0,7,400915432,2017-02-11
256,2,"7:20",440,440,"Jr Dennis Smith Defensive Rebound.",76,46,30,0.999870527795345,"Wake Forest","NC State",3,4,0,0,7,400915432,2017-02-11
257,2,"7:14",434,434,"Terry Henderson missed Three Point Jumper.",76,46,30,0.999956577801696,"Wake Forest","NC State",3,4,0,0,7,400915432,2017-02-11
258,2,"7:14",434,434,"Keyshawn Woods Defensive Rebound.",76,46,30,0.999956577801696,"Wake Forest","NC State",3,4,0,0,7,400915432,2017-02-11
259,2,"7:03",423,423,"Brandon Childress Turnover.",76,46,30,0.999930880856465,"Wake Forest","NC State",3,4,0,0,7,400915432,2017-02-11
260,2,"7:02",422,422,"Terry Henderson Steal.",76,46,30,0.999930880856465,"Wake Forest","NC State",3,4,0,0,7,400915432,2017-02-11
261,2,"6:59",419,419,"Jr Dennis Smith made Layup. Assisted by Terry Henderson.",76,48,28,0.999897076202363,"Wake Forest","NC State",3,4,0,0,7,400915432,2017-02-11
262,2,"6:55",415,415,"Wake Forest  Timeout",76,48,28,0.999897076202363,"Wake Forest","NC State",3,3,0,1,7,400915432,2017-02-11
263,2,"6:27",387,387,"Foul on BeeJay Anya.",76,48,28,0.999889706326233,"Wake Forest","NC State",3,3,0,1,7,400915432,2017-02-11
264,2,"6:27",387,387,"John Collins made Free Throw.",77,48,29,0.999918081049696,"Wake Forest","NC State",3,3,0,1,7,400915432,2017-02-11
265,2,"6:27",387,387,"John Collins missed Free Throw.",77,48,29,0.999918081049696,"Wake Forest","NC State",3,3,0,1,7,400915432,2017-02-11
266,2,"6:27",387,387,"BeeJay Anya Defensive Rebound.",77,48,29,0.999918081049696,"Wake Forest","NC State",3,3,0,1,7,400915432,2017-02-11
267,2,"6:03",363,363,"Torin Dorn made Jumper.",77,50,27,0.999915853808581,"Wake Forest","NC State",3,3,0,1,7,400915432,2017-02-11
268,2,"5:36",336,336,"Keyshawn Woods Turnover.",77,50,27,0.999966078816859,"Wake Forest","NC State",3,3,0,0,7,400915432,2017-02-11
269,2,"5:35",335,335,"Maverick Rowan Steal.",77,50,27,0.999966078816859,"Wake Forest","NC State",3,3,0,0,7,400915432,2017-02-11
270,2,"5:33",333,333,"Foul on Austin Arians.",77,50,27,0.999966078816859,"Wake Forest","NC State",3,3,0,0,7,400915432,2017-02-11
271,2,"5:33",333,333,"Maverick Rowan made Free Throw.",77,51,26,0.999951647255859,"Wake Forest","NC State",3,3,0,0,7,400915432,2017-02-11
272,2,"5:33",333,333,"Maverick Rowan made Free Throw.",77,52,25,0.999931076298224,"Wake Forest","NC State",3,3,0,0,7,400915432,2017-02-11
273,2,"5:20",320,320,"Foul on BeeJay Anya.",77,52,25,0.999807787465615,"Wake Forest","NC State",3,3,0,0,7,400915432,2017-02-11
274,2,"5:20",320,320,"John Collins missed Free Throw.",77,52,25,0.999807787465615,"Wake Forest","NC State",3,3,0,0,7,400915432,2017-02-11
275,2,"5:20",320,320,"Wake Forest Deadball Team Rebound.",77,52,25,0.999807787465615,"Wake Forest","NC State",3,3,0,0,7,400915432,2017-02-11
276,2,"5:20",320,320,"John Collins made Free Throw.",78,52,26,0.999859565669885,"Wake Forest","NC State",3,3,0,0,7,400915432,2017-02-11
277,2,"5:07",307,307,"Maverick Rowan missed Three Point Jumper.",78,52,26,0.999919311239202,"Wake Forest","NC State",3,3,0,0,7,400915432,2017-02-11
278,2,"5:07",307,307,"BeeJay Anya Offensive Rebound.",78,52,26,0.999919311239202,"Wake Forest","NC State",3,3,0,0,7,400915432,2017-02-11
279,2,"4:53",293,293,"Terry Henderson missed Three Point Jumper.",78,52,26,0.999934919566539,"Wake Forest","NC State",3,3,0,0,7,400915432,2017-02-11
280,2,"4:53",293,293,"John Collins Defensive Rebound.",78,52,26,0.999934919566539,"Wake Forest","NC State",3,3,0,0,7,400915432,2017-02-11
281,2,"4:32",272,272,"Austin Arians made Layup. Assisted by John Collins.",80,52,28,0.999989617244091,"Wake Forest","NC State",3,3,0,0,7,400915432,2017-02-11
282,2,"4:12",252,252,"Torin Dorn missed Three Point Jumper.",80,52,28,0.999995936912786,"Wake Forest","NC State",3,3,0,0,7,400915432,2017-02-11
283,2,"4:12",252,252,"Jr Dennis Smith Offensive Rebound.",80,52,28,0.999995936912786,"Wake Forest","NC State",3,3,0,0,7,400915432,2017-02-11
284,2,"4:09",249,249,"Jr Dennis Smith made Layup.",80,54,26,0.999984856291777,"Wake Forest","NC State",3,3,0,0,7,400915432,2017-02-11
285,2,"3:53",233,233,"Bryant Crawford made Layup.",82,54,28,0.999993576993595,"Wake Forest","NC State",3,3,0,0,7,400915432,2017-02-11
286,2,"3:52",232,232,"Foul on BeeJay Anya.",82,54,28,0.999993576993595,"Wake Forest","NC State",3,3,0,0,7,400915432,2017-02-11
287,2,"3:52",232,232,"Official TV Timeout",82,54,28,0.999993576993595,"Wake Forest","NC State",3,3,0,0,7,400915432,2017-02-11
288,2,"3:52",232,232,"Bryant Crawford made Free Throw.",83,54,29,0.999995719429153,"Wake Forest","NC State",3,3,0,0,7,400915432,2017-02-11
289,2,"3:39",219,219,"Maverick Rowan missed Jumper.",83,54,29,0.999998343329812,"Wake Forest","NC State",3,3,0,0,7,400915432,2017-02-11
290,2,"3:39",219,219,"John Collins Defensive Rebound.",83,54,29,0.999998343329812,"Wake Forest","NC State",3,3,0,0,7,400915432,2017-02-11
291,2,"3:16",196,196,"John Collins missed Jumper.",83,54,29,0.999999176336201,"Wake Forest","NC State",3,3,0,0,7,400915432,2017-02-11
292,2,"3:16",196,196,"Torin Dorn Defensive Rebound.",83,54,29,0.999999176336201,"Wake Forest","NC State",3,3,0,0,7,400915432,2017-02-11
293,2,"3:02",182,182,"Markell Johnson missed Three Point Jumper.",83,54,29,0.999999529009674,"Wake Forest","NC State",3,3,0,0,7,400915432,2017-02-11
294,2,"3:02",182,182,"John Collins Defensive Rebound.",83,54,29,0.999999529009674,"Wake Forest","NC State",3,3,0,0,7,400915432,2017-02-11
295,2,"2:50",170,170,"Brandon Childress made Three Point Jumper. Assisted by Mitchell Wilbekin.",86,54,32,0.999999921785231,"Wake Forest","NC State",3,3,0,0,7,400915432,2017-02-11
296,2,"2:38",158,158,"Jr Dennis Smith made Layup.",86,56,30,0.999999946510455,"Wake Forest","NC State",3,3,0,0,7,400915432,2017-02-11
297,2,"2:15",135,135,"Sam Japhet-Mathias missed Jumper.",86,56,30,0.99999995998333,"Wake Forest","NC State",3,3,0,0,7,400915432,2017-02-11
298,2,"2:15",135,135,"Torin Dorn Defensive Rebound.",86,56,30,0.99999995998333,"Wake Forest","NC State",3,3,0,0,7,400915432,2017-02-11
299,2,"2:07",127,127,"Torin Dorn missed Jumper.",86,56,30,0.999999972950761,"Wake Forest","NC State",3,3,0,0,7,400915432,2017-02-11
300,2,"2:07",127,127,"Brandon Childress Defensive Rebound.",86,56,30,0.999999972950761,"Wake Forest","NC State",3,3,0,0,7,400915432,2017-02-11
301,2,"1:46",106,106,"Sam Japhet-Mathias Turnover.",86,56,30,0.999999994083572,"Wake Forest","NC State",3,3,0,0,7,400915432,2017-02-11
302,2,"1:45",105,105,"BeeJay Anya Steal.",86,56,30,0.999999994083572,"Wake Forest","NC State",3,3,0,0,7,400915432,2017-02-11
303,2,"1:42",102,102,"Markell Johnson missed Layup.",86,56,30,0.999999994083572,"Wake Forest","NC State",3,3,0,0,7,400915432,2017-02-11
304,2,"1:42",102,102,"Markell Johnson Offensive Rebound.",86,56,30,0.999999994083572,"Wake Forest","NC State",3,3,0,0,7,400915432,2017-02-11
305,2,"1:38",98,98,"Markell Johnson missed Layup.",86,56,30,0.999999995602233,"Wake Forest","NC State",3,3,0,0,7,400915432,2017-02-11
306,2,"1:38",98,98,"Sam Japhet-Mathias Defensive Rebound.",86,56,30,0.999999995602233,"Wake Forest","NC State",3,3,0,0,7,400915432,2017-02-11
307,2,"1:33",93,93,"Rich Washington missed Layup.",86,56,30,0.999999995602233,"Wake Forest","NC State",3,3,0,0,7,400915432,2017-02-11
308,2,"1:33",93,93,"Sam Japhet-Mathias Offensive Rebound.",86,56,30,0.999999995602233,"Wake Forest","NC State",3,3,0,0,7,400915432,2017-02-11
309,2,"1:26",86,86,"Rich Washington missed Three Point Jumper.",86,56,30,0.999999999745886,"Wake Forest","NC State",3,3,0,0,7,400915432,2017-02-11
310,2,"1:26",86,86,"Maverick Rowan Defensive Rebound.",86,56,30,0.999999999745886,"Wake Forest","NC State",3,3,0,0,7,400915432,2017-02-11
311,2,"1:18",78,78,"Terry Henderson made Jumper. Assisted by Maverick Rowan.",86,58,28,0.999999999189433,"Wake Forest","NC State",3,3,0,0,7,400915432,2017-02-11
312,2,"1:07",67,67,"Rich Washington missed Three Point Jumper.",86,58,28,0.999999999191666,"Wake Forest","NC State",3,3,0,0,7,400915432,2017-02-11
313,2,"1:07",67,67,"Torin Dorn Defensive Rebound.",86,58,28,0.999999999191666,"Wake Forest","NC State",3,3,0,0,7,400915432,2017-02-11
314,2,"1:01",61,61,"Torin Dorn Turnover.",86,58,28,0.999999999191666,"Wake Forest","NC State",3,3,0,0,7,400915432,2017-02-11
315,2,"0:47",47,47,"Donovan Mitchell made Layup.",88,58,30,0.999999999999982,"Wake Forest","NC State",3,3,0,0,7,400915432,2017-02-11
316,2,"0:29",29,29,"Terry Henderson missed Three Point Jumper.",88,58,30,0.999999999999934,"Wake Forest","NC State",3,3,0,0,7,400915432,2017-02-11
317,2,"0:29",29,29,"Sam Japhet-Mathias Defensive Rebound.",88,58,30,0.999999999999934,"Wake Forest","NC State",3,3,0,0,7,400915432,2017-02-11
318,2,"0:00",0,0,"End of Game",88,58,30,1,"Wake Forest","NC State",3,3,0,0,7,400915432,2017-02-11
