"play_id","half","time_remaining_half","secs_remaining","secs_remaining_absolute","description","home_score","away_score","score_diff","win_prob","home","away","home_time_out_remaining","away_time_out_remaining","home_timeout_ind","away_timeout_ind","home_favored_by","game_id","date"
1,1,"20:00",2400,2400,"PLAY",0,0,0,0.859870113896359,"Duke","Rhode Island",4,4,0,0,9.5,401025870,2018-03-17
2,1,"20:00",2400,2400,"Jump Ball won by Duke",0,0,0,0.859870113896359,"Duke","Rhode Island",4,4,0,0,9.5,401025870,2018-03-17
3,1,"19:49",2389,2389,"Wendell Carter Jr Turnover.",0,0,0,0.855619502380578,"Duke","Rhode Island",4,4,0,0,9.5,401025870,2018-03-17
4,1,"19:49",2389,2389,"Stanford Robinson Steal.",0,0,0,0.855619502380578,"Duke","Rhode Island",4,4,0,0,9.5,401025870,2018-03-17
5,1,"19:15",2355,2355,"E.C. Matthews made Three Point Jumper. Assisted by Jeff Dowtin.",0,3,-3,0.821375143037804,"Duke","Rhode Island",4,4,0,0,9.5,401025870,2018-03-17
6,1,"18:55",2335,2335,"Wendell Carter Jr made Dunk. Assisted by Gary Trent Jr..",2,3,-1,0.835943139083828,"Duke","Rhode Island",4,4,0,0,9.5,401025870,2018-03-17
7,1,"18:40",2320,2320,"Stanford Robinson missed Layup.",2,3,-1,0.836159597946211,"Duke","Rhode Island",4,4,0,0,9.5,401025870,2018-03-17
8,1,"18:40",2320,2320,"Andre Berry Offensive Rebound.",2,3,-1,0.836159597946211,"Duke","Rhode Island",4,4,0,0,9.5,401025870,2018-03-17
9,1,"18:39",2319,2319,"Andre Berry Turnover.",2,3,-1,0.820890184384135,"Duke","Rhode Island",4,4,0,0,9.5,401025870,2018-03-17
10,1,"18:30",2310,2310,"Trevon Duval Turnover.",2,3,-1,0.820890184384135,"Duke","Rhode Island",4,4,0,0,9.5,401025870,2018-03-17
11,1,"18:07",2287,2287,"Andre Berry made Layup. Assisted by Jeff Dowtin.",2,5,-3,0.795181216247488,"Duke","Rhode Island",4,4,0,0,9.5,401025870,2018-03-17
12,1,"17:54",2274,2274,"Gary Trent Jr. missed Three Point Jumper.",2,5,-3,0.801618015118339,"Duke","Rhode Island",4,4,0,0,9.5,401025870,2018-03-17
13,1,"17:54",2274,2274,"Andre Berry Defensive Rebound.",2,5,-3,0.801618015118339,"Duke","Rhode Island",4,4,0,0,9.5,401025870,2018-03-17
14,1,"17:47",2267,2267,"E.C. Matthews made Layup. Assisted by Andre Berry.",2,7,-5,0.755517802213771,"Duke","Rhode Island",4,4,0,0,9.5,401025870,2018-03-17
15,1,"17:30",2250,2250,"Trevon Duval missed Layup.",2,7,-5,0.763083248825073,"Duke","Rhode Island",4,4,0,0,9.5,401025870,2018-03-17
16,1,"17:30",2250,2250,"E.C. Matthews Defensive Rebound.",2,7,-5,0.763083248825073,"Duke","Rhode Island",4,4,0,0,9.5,401025870,2018-03-17
17,1,"17:21",2241,2241,"Andre Berry missed Jumper.",2,7,-5,0.757736086077297,"Duke","Rhode Island",4,4,0,0,9.5,401025870,2018-03-17
18,1,"17:21",2241,2241,"Marvin Bagley III Defensive Rebound.",2,7,-5,0.757736086077297,"Duke","Rhode Island",4,4,0,0,9.5,401025870,2018-03-17
19,1,"17:04",2224,2224,"Gary Trent Jr. made Three Point Jumper. Assisted by Trevon Duval.",5,7,-2,0.816461349537644,"Duke","Rhode Island",4,4,0,0,9.5,401025870,2018-03-17
20,1,"16:41",2201,2201,"Jared Terrell missed Jumper.",5,7,-2,0.80822132445331,"Duke","Rhode Island",4,4,0,0,9.5,401025870,2018-03-17
21,1,"16:41",2201,2201,"Wendell Carter Jr Defensive Rebound.",5,7,-2,0.80822132445331,"Duke","Rhode Island",4,4,0,0,9.5,401025870,2018-03-17
22,1,"16:23",2183,2183,"Trevon Duval missed Three Point Jumper.",5,7,-2,0.809305084752472,"Duke","Rhode Island",4,4,0,0,9.5,401025870,2018-03-17
23,1,"16:23",2183,2183,"Andre Berry Defensive Rebound.",5,7,-2,0.809305084752472,"Duke","Rhode Island",4,4,0,0,9.5,401025870,2018-03-17
24,1,"16:03",2163,2163,"Jeff Dowtin made Jumper. Assisted by Andre Berry.",5,9,-4,0.766733568934061,"Duke","Rhode Island",4,4,0,0,9.5,401025870,2018-03-17
25,1,"15:48",2148,2148,"Foul on Wendell Carter Jr.",5,9,-4,0.782606991875536,"Duke","Rhode Island",4,4,0,0,9.5,401025870,2018-03-17
26,1,"15:48",2148,2148,"Wendell Carter Jr Turnover.",5,9,-4,0.782606991875536,"Duke","Rhode Island",4,4,0,0,9.5,401025870,2018-03-17
27,1,"15:48",2148,2148,"Official TV Timeout",5,9,-4,0.782606991875536,"Duke","Rhode Island",4,4,0,0,9.5,401025870,2018-03-17
28,1,"15:28",2128,2128,"E.C. Matthews missed Three Point Jumper.",5,9,-4,0.761853543541422,"Duke","Rhode Island",4,4,0,0,9.5,401025870,2018-03-17
29,1,"15:28",2128,2128,"Javin DeLaurier Defensive Rebound.",5,9,-4,0.761853543541422,"Duke","Rhode Island",4,4,0,0,9.5,401025870,2018-03-17
30,1,"15:20",2120,2120,"Wendell Carter Jr made Dunk. Assisted by Marvin Bagley III.",7,9,-2,0.800926485133309,"Duke","Rhode Island",4,4,0,0,9.5,401025870,2018-03-17
31,1,"14:59",2099,2099,"Andre Berry missed Jumper.",7,9,-2,0.790716697107141,"Duke","Rhode Island",4,4,0,0,9.5,401025870,2018-03-17
32,1,"14:59",2099,2099,"Javin DeLaurier Defensive Rebound.",7,9,-2,0.790716697107141,"Duke","Rhode Island",4,4,0,0,9.5,401025870,2018-03-17
33,1,"14:50",2090,2090,"Foul on Marvin Bagley III.",7,9,-2,0.790716697107141,"Duke","Rhode Island",4,4,0,0,9.5,401025870,2018-03-17
34,1,"14:50",2090,2090,"Marvin Bagley III Turnover.",7,9,-2,0.790716697107141,"Duke","Rhode Island",4,4,0,0,9.5,401025870,2018-03-17
35,1,"14:28",2068,2068,"Andre Berry missed Layup.",7,9,-2,0.792928853597783,"Duke","Rhode Island",4,4,0,0,9.5,401025870,2018-03-17
36,1,"14:28",2068,2068,"Gary Trent Jr. Defensive Rebound.",7,9,-2,0.792928853597783,"Duke","Rhode Island",4,4,0,0,9.5,401025870,2018-03-17
37,1,"14:11",2051,2051,"Wendell Carter Jr made Layup.",9,9,0,0.842527476884457,"Duke","Rhode Island",4,4,0,0,9.5,401025870,2018-03-17
38,1,"14:11",2051,2051,"Foul on Andre Berry.",9,9,0,0.842527476884457,"Duke","Rhode Island",4,4,0,0,9.5,401025870,2018-03-17
39,1,"14:11",2051,2051,"Wendell Carter Jr made Free Throw.",10,9,1,0.857455197698837,"Duke","Rhode Island",4,4,0,0,9.5,401025870,2018-03-17
40,1,"13:40",2020,2020,"Jeff Dowtin missed Jumper.",10,9,1,0.850363121443524,"Duke","Rhode Island",4,4,0,0,9.5,401025870,2018-03-17
41,1,"13:40",2020,2020,"Gary Trent Jr. Defensive Rebound.",10,9,1,0.850363121443524,"Duke","Rhode Island",4,4,0,0,9.5,401025870,2018-03-17
42,1,"13:28",2008,2008,"Foul on Jared Terrell.",10,9,1,0.843937158686413,"Duke","Rhode Island",4,4,0,0,9.5,401025870,2018-03-17
43,1,"13:27",2007,2007,"Grayson Allen missed Three Point Jumper.",10,9,1,0.843937158686413,"Duke","Rhode Island",4,4,0,0,9.5,401025870,2018-03-17
44,1,"13:27",2007,2007,"Marques Bolden Offensive Rebound.",10,9,1,0.843937158686413,"Duke","Rhode Island",4,4,0,0,9.5,401025870,2018-03-17
45,1,"13:04",1984,1984,"Foul on Javin DeLaurier.",10,9,1,0.835568839001598,"Duke","Rhode Island",4,4,0,0,9.5,401025870,2018-03-17
46,1,"13:04",1984,1984,"Javin DeLaurier Turnover.",10,9,1,0.835568839001598,"Duke","Rhode Island",4,4,0,0,9.5,401025870,2018-03-17
47,1,"12:42",1962,1962,"Foul on Marques Bolden.",10,9,1,0.846492073985908,"Duke","Rhode Island",4,4,0,0,9.5,401025870,2018-03-17
48,1,"12:42",1962,1962,"Cyril Langevine missed Free Throw.",10,9,1,0.846492073985908,"Duke","Rhode Island",4,4,0,0,9.5,401025870,2018-03-17
49,1,"12:42",1962,1962,"Rhode Island Deadball Team Rebound.",10,9,1,0.846492073985908,"Duke","Rhode Island",4,4,0,0,9.5,401025870,2018-03-17
50,1,"12:42",1962,1962,"Cyril Langevine missed Free Throw.",10,9,1,0.846492073985908,"Duke","Rhode Island",4,4,0,0,9.5,401025870,2018-03-17
51,1,"12:42",1962,1962,"Wendell Carter Jr Defensive Rebound.",10,9,1,0.846492073985908,"Duke","Rhode Island",4,4,0,0,9.5,401025870,2018-03-17
52,1,"12:28",1948,1948,"Foul on Fatts Russell.",10,9,1,0.845260772034665,"Duke","Rhode Island",4,4,0,0,9.5,401025870,2018-03-17
53,1,"12:25",1945,1945,"Gary Trent Jr. missed Three Point Jumper.",10,9,1,0.845260772034665,"Duke","Rhode Island",4,4,0,0,9.5,401025870,2018-03-17
54,1,"12:25",1945,1945,"Stanford Robinson Defensive Rebound.",10,9,1,0.845260772034665,"Duke","Rhode Island",4,4,0,0,9.5,401025870,2018-03-17
55,1,"12:16",1936,1936,"E.C. Matthews made Jumper.",10,11,-1,0.80075673431883,"Duke","Rhode Island",4,4,0,0,9.5,401025870,2018-03-17
56,1,"12:00",1920,1920,"Official TV Timeout",10,11,-1,0.81619360632507,"Duke","Rhode Island",4,4,0,0,9.5,401025870,2018-03-17
57,1,"11:56",1916,1916,"Trevon Duval missed Three Point Jumper.",10,11,-1,0.818807675349572,"Duke","Rhode Island",4,4,0,0,9.5,401025870,2018-03-17
58,1,"11:56",1916,1916,"Cyril Langevine Defensive Rebound.",10,11,-1,0.818807675349572,"Duke","Rhode Island",4,4,0,0,9.5,401025870,2018-03-17
59,1,"11:44",1904,1904,"Fatts Russell missed Three Point Jumper.",10,11,-1,0.81360926026894,"Duke","Rhode Island",4,4,0,0,9.5,401025870,2018-03-17
60,1,"11:44",1904,1904,"Wendell Carter Jr Defensive Rebound.",10,11,-1,0.81360926026894,"Duke","Rhode Island",4,4,0,0,9.5,401025870,2018-03-17
61,1,"11:33",1893,1893,"Wendell Carter Jr made Jumper. Assisted by Trevon Duval.",12,11,1,0.843710464059664,"Duke","Rhode Island",4,4,0,0,9.5,401025870,2018-03-17
62,1,"11:03",1863,1863,"Jarvis Garrett Turnover.",12,11,1,0.843047427076701,"Duke","Rhode Island",4,4,0,0,9.5,401025870,2018-03-17
63,1,"10:49",1849,1849,"Gary Trent Jr. made Three Point Jumper. Assisted by Grayson Allen.",15,11,4,0.881301857749322,"Duke","Rhode Island",4,4,0,0,9.5,401025870,2018-03-17
64,1,"10:28",1828,1828,"Jared Terrell missed Three Point Jumper.",15,11,4,0.894194895957391,"Duke","Rhode Island",4,4,0,0,9.5,401025870,2018-03-17
65,1,"10:28",1828,1828,"Wendell Carter Jr Defensive Rebound.",15,11,4,0.894194895957391,"Duke","Rhode Island",4,4,0,0,9.5,401025870,2018-03-17
66,1,"10:20",1820,1820,"Grayson Allen made Three Point Jumper. Assisted by Gary Trent Jr..",18,11,7,0.923817682549707,"Duke","Rhode Island",4,4,0,0,9.5,401025870,2018-03-17
67,1,"10:20",1820,1820,"Foul on Fatts Russell.",18,11,7,0.923817682549707,"Duke","Rhode Island",4,4,0,0,9.5,401025870,2018-03-17
68,1,"10:20",1820,1820,"Grayson Allen made Free Throw.",19,11,8,0.931867659564814,"Duke","Rhode Island",4,4,0,0,9.5,401025870,2018-03-17
69,1,"10:06",1806,1806,"E.C. Matthews made Three Point Jumper. Assisted by Jeff Dowtin.",19,14,5,0.898254811463446,"Duke","Rhode Island",4,4,0,0,9.5,401025870,2018-03-17
70,1,"9:35",1775,1775,"Trevon Duval made Jumper.",21,14,7,0.911078672198927,"Duke","Rhode Island",4,4,0,0,9.5,401025870,2018-03-17
71,1,"9:05",1745,1745,"Cyril Langevine missed Layup.",21,14,7,0.91502381408749,"Duke","Rhode Island",4,4,0,0,9.5,401025870,2018-03-17
72,1,"9:05",1745,1745,"Wendell Carter Jr Block.",21,14,7,0.91502381408749,"Duke","Rhode Island",4,4,0,0,9.5,401025870,2018-03-17
73,1,"9:05",1745,1745,"Gary Trent Jr. Defensive Rebound.",21,14,7,0.91502381408749,"Duke","Rhode Island",4,4,0,0,9.5,401025870,2018-03-17
74,1,"8:51",1731,1731,"Gary Trent Jr. made Three Point Jumper. Assisted by Trevon Duval.",24,14,10,0.947128699607876,"Duke","Rhode Island",4,4,0,0,9.5,401025870,2018-03-17
75,1,"8:31",1711,1711,"Foul on Stanford Robinson.",24,14,10,0.948294954938896,"Duke","Rhode Island",4,4,0,0,9.5,401025870,2018-03-17
76,1,"8:31",1711,1711,"Stanford Robinson Turnover.",24,14,10,0.948294954938896,"Duke","Rhode Island",4,4,0,0,9.5,401025870,2018-03-17
77,1,"8:22",1702,1702,"Marvin Bagley III made Layup.",26,14,12,0.952500600196162,"Duke","Rhode Island",4,4,0,0,9.5,401025870,2018-03-17
78,1,"8:13",1693,1693,"Rhode Island  Timeout",26,14,12,0.960687318557083,"Duke","Rhode Island",3,4,1,0,9.5,401025870,2018-03-17
79,1,"8:10",1690,1690,"Jeff Dowtin missed Jumper.",26,14,12,0.960687318557083,"Duke","Rhode Island",3,4,1,0,9.5,401025870,2018-03-17
80,1,"8:10",1690,1690,"Marvin Bagley III Defensive Rebound.",26,14,12,0.960687318557083,"Duke","Rhode Island",3,4,1,0,9.5,401025870,2018-03-17
81,1,"7:55",1675,1675,"Foul on Stanford Robinson.",26,14,12,0.959968989760089,"Duke","Rhode Island",3,4,1,0,9.5,401025870,2018-03-17
82,1,"7:55",1675,1675,"Official TV Timeout",26,14,12,0.959968989760089,"Duke","Rhode Island",3,4,1,0,9.5,401025870,2018-03-17
83,1,"7:55",1675,1675,"Marvin Bagley III made Free Throw.",27,14,13,0.964967291830149,"Duke","Rhode Island",3,4,1,0,9.5,401025870,2018-03-17
84,1,"7:55",1675,1675,"Marvin Bagley III made Free Throw.",28,14,14,0.969361420789901,"Duke","Rhode Island",3,4,1,0,9.5,401025870,2018-03-17
85,1,"7:44",1664,1664,"Jared Terrell missed Layup.",28,14,14,0.964571464013285,"Duke","Rhode Island",3,4,1,0,9.5,401025870,2018-03-17
86,1,"7:44",1664,1664,"Andre Berry Offensive Rebound.",28,14,14,0.964571464013285,"Duke","Rhode Island",3,4,1,0,9.5,401025870,2018-03-17
87,1,"7:44",1664,1664,"Andre Berry made Two Point Tip Shot.",28,16,12,0.954578570824382,"Duke","Rhode Island",3,4,1,0,9.5,401025870,2018-03-17
88,1,"7:26",1646,1646,"Grayson Allen made Three Point Jumper.",31,16,15,0.973380347363113,"Duke","Rhode Island",3,4,1,0,9.5,401025870,2018-03-17
89,1,"7:04",1624,1624,"Cyril Langevine Turnover.",31,16,15,0.973054571824883,"Duke","Rhode Island",3,4,0,0,9.5,401025870,2018-03-17
90,1,"6:52",1612,1612,"Marvin Bagley III made Layup.",33,16,17,0.9772980042627,"Duke","Rhode Island",3,4,0,0,9.5,401025870,2018-03-17
91,1,"6:30",1590,1590,"Foul on Wendell Carter Jr.",33,16,17,0.977063144782231,"Duke","Rhode Island",3,4,0,0,9.5,401025870,2018-03-17
92,1,"6:30",1590,1590,"Andre Berry made Free Throw.",33,17,16,0.973833511129577,"Duke","Rhode Island",3,4,0,0,9.5,401025870,2018-03-17
93,1,"6:30",1590,1590,"Andre Berry made Free Throw.",33,18,15,0.97016301442604,"Duke","Rhode Island",3,4,0,0,9.5,401025870,2018-03-17
94,1,"6:16",1576,1576,"Trevon Duval missed Jumper.",33,18,15,0.978241317756925,"Duke","Rhode Island",3,4,0,0,9.5,401025870,2018-03-17
95,1,"6:16",1576,1576,"Cyril Langevine Defensive Rebound.",33,18,15,0.978241317756925,"Duke","Rhode Island",3,4,0,0,9.5,401025870,2018-03-17
96,1,"5:58",1558,1558,"Andre Berry Turnover.",33,18,15,0.971665179403407,"Duke","Rhode Island",3,4,0,0,9.5,401025870,2018-03-17
97,1,"5:41",1541,1541,"Trevon Duval missed Layup.",33,18,15,0.972604388207227,"Duke","Rhode Island",3,4,0,0,9.5,401025870,2018-03-17
98,1,"5:41",1541,1541,"Andre Berry Defensive Rebound.",33,18,15,0.972604388207227,"Duke","Rhode Island",3,4,0,0,9.5,401025870,2018-03-17
99,1,"5:37",1537,1537,"Andre Berry Turnover.",33,18,15,0.972653212354888,"Duke","Rhode Island",3,4,0,0,9.5,401025870,2018-03-17
100,1,"5:32",1532,1532,"Gary Trent Jr. missed Jumper.",33,18,15,0.972653212354888,"Duke","Rhode Island",3,4,0,0,9.5,401025870,2018-03-17
101,1,"5:32",1532,1532,"Marques Bolden Offensive Rebound.",33,18,15,0.972653212354888,"Duke","Rhode Island",3,4,0,0,9.5,401025870,2018-03-17
102,1,"5:27",1527,1527,"Gary Trent Jr. made Layup. Assisted by Marques Bolden.",35,18,17,0.978869229547961,"Duke","Rhode Island",3,4,0,0,9.5,401025870,2018-03-17
103,1,"5:08",1508,1508,"E.C. Matthews made Three Point Jumper. Assisted by Jeff Dowtin.",35,21,14,0.968468894235551,"Duke","Rhode Island",3,4,0,0,9.5,401025870,2018-03-17
104,1,"4:41",1481,1481,"Grayson Allen missed Jumper.",35,21,14,0.970652737391211,"Duke","Rhode Island",3,4,0,0,9.5,401025870,2018-03-17
105,1,"4:41",1481,1481,"Marvin Bagley III Offensive Rebound.",35,21,14,0.970652737391211,"Duke","Rhode Island",3,4,0,0,9.5,401025870,2018-03-17
106,1,"4:39",1479,1479,"Foul on Jared Terrell.",35,21,14,0.975199377440826,"Duke","Rhode Island",3,4,0,0,9.5,401025870,2018-03-17
107,1,"4:39",1479,1479,"Marvin Bagley III made Free Throw.",36,21,15,0.978639436313857,"Duke","Rhode Island",3,4,0,0,9.5,401025870,2018-03-17
108,1,"4:39",1479,1479,"Marvin Bagley III made Free Throw.",37,21,16,0.981611327131034,"Duke","Rhode Island",3,4,0,0,9.5,401025870,2018-03-17
109,1,"4:30",1470,1470,"Cyril Langevine made Layup. Assisted by Fatts Russell.",37,23,14,0.975199377440826,"Duke","Rhode Island",3,4,0,0,9.5,401025870,2018-03-17
110,1,"4:30",1470,1470,"Foul on Marques Bolden.",37,23,14,0.975199377440826,"Duke","Rhode Island",3,4,0,0,9.5,401025870,2018-03-17
111,1,"4:30",1470,1470,"Cyril Langevine missed Free Throw.",37,23,14,0.975199377440826,"Duke","Rhode Island",3,4,0,0,9.5,401025870,2018-03-17
112,1,"4:30",1470,1470,"E.C. Matthews Offensive Rebound.",37,23,14,0.975199377440826,"Duke","Rhode Island",3,4,0,0,9.5,401025870,2018-03-17
113,1,"4:25",1465,1465,"Jared Terrell missed Three Point Jumper.",37,23,14,0.963979549339074,"Duke","Rhode Island",3,4,0,0,9.5,401025870,2018-03-17
114,1,"4:25",1465,1465,"Gary Trent Jr. Defensive Rebound.",37,23,14,0.963979549339074,"Duke","Rhode Island",3,4,0,0,9.5,401025870,2018-03-17
115,1,"4:10",1450,1450,"Gary Trent Jr. Turnover.",37,23,14,0.969289760676349,"Duke","Rhode Island",3,4,0,0,9.5,401025870,2018-03-17
116,1,"4:10",1450,1450,"Jeff Dowtin Steal.",37,23,14,0.969289760676349,"Duke","Rhode Island",3,4,0,0,9.5,401025870,2018-03-17
117,1,"4:06",1446,1446,"Jeff Dowtin made Dunk.",37,25,12,0.964818047010051,"Duke","Rhode Island",3,4,0,0,9.5,401025870,2018-03-17
118,1,"3:45",1425,1425,"Foul on Fatts Russell.",37,25,12,0.95503391746752,"Duke","Rhode Island",3,4,0,0,9.5,401025870,2018-03-17
119,1,"3:45",1425,1425,"Official TV Timeout",37,25,12,0.95503391746752,"Duke","Rhode Island",3,4,0,0,9.5,401025870,2018-03-17
120,1,"3:45",1425,1425,"Trevon Duval made Free Throw.",38,25,13,0.960856147057017,"Duke","Rhode Island",3,4,0,0,9.5,401025870,2018-03-17
121,1,"3:45",1425,1425,"Trevon Duval made Free Throw.",39,25,14,0.965951388204309,"Duke","Rhode Island",3,4,0,0,9.5,401025870,2018-03-17
122,1,"3:45",1425,1425,"Trevon Duval made Free Throw.",40,25,15,0.970403825487738,"Duke","Rhode Island",3,4,0,0,9.5,401025870,2018-03-17
123,1,"3:15",1395,1395,"E.C. Matthews missed Three Point Jumper.",40,25,15,0.977368996622902,"Duke","Rhode Island",3,4,0,0,9.5,401025870,2018-03-17
124,1,"3:15",1395,1395,"Rhode Island Deadball Team Rebound.",40,25,15,0.977368996622902,"Duke","Rhode Island",3,4,0,0,9.5,401025870,2018-03-17
125,1,"3:15",1395,1395,"Rhode Island  Turnover.",40,25,15,0.977368996622902,"Duke","Rhode Island",3,4,0,0,9.5,401025870,2018-03-17
126,1,"3:11",1391,1391,"Foul on Javin DeLaurier.",40,25,15,0.977368996622902,"Duke","Rhode Island",3,4,0,0,9.5,401025870,2018-03-17
127,1,"3:11",1391,1391,"Javin DeLaurier Turnover.",40,25,15,0.977368996622902,"Duke","Rhode Island",3,4,0,0,9.5,401025870,2018-03-17
128,1,"2:51",1371,1371,"E.C. Matthews missed Jumper.",40,25,15,0.971099606555499,"Duke","Rhode Island",3,4,0,0,9.5,401025870,2018-03-17
129,1,"2:51",1371,1371,"Jarvis Garrett Offensive Rebound.",40,25,15,0.971099606555499,"Duke","Rhode Island",3,4,0,0,9.5,401025870,2018-03-17
130,1,"2:43",1363,1363,"Jarvis Garrett missed Jumper.",40,25,15,0.975299285867315,"Duke","Rhode Island",3,4,0,0,9.5,401025870,2018-03-17
131,1,"2:43",1363,1363,"Javin DeLaurier Defensive Rebound.",40,25,15,0.975299285867315,"Duke","Rhode Island",3,4,0,0,9.5,401025870,2018-03-17
132,1,"2:14",1334,1334,"Grayson Allen missed Jumper.",40,25,15,0.973962143421807,"Duke","Rhode Island",3,4,0,0,9.5,401025870,2018-03-17
133,1,"2:14",1334,1334,"Jarvis Garrett Defensive Rebound.",40,25,15,0.973962143421807,"Duke","Rhode Island",3,4,0,0,9.5,401025870,2018-03-17
134,1,"2:00",1320,1320,"Jeff Dowtin made Jumper.",40,27,13,0.967908807897205,"Duke","Rhode Island",3,4,0,0,9.5,401025870,2018-03-17
135,1,"1:43",1303,1303,"Marvin Bagley III missed Three Point Jumper.",40,27,13,0.96094609452757,"Duke","Rhode Island",3,4,0,0,9.5,401025870,2018-03-17
136,1,"1:43",1303,1303,"Jared Terrell Defensive Rebound.",40,27,13,0.96094609452757,"Duke","Rhode Island",3,4,0,0,9.5,401025870,2018-03-17
137,1,"1:37",1297,1297,"Jared Terrell missed Jumper.",40,27,13,0.971015240560073,"Duke","Rhode Island",3,4,0,0,9.5,401025870,2018-03-17
138,1,"1:37",1297,1297,"Marvin Bagley III Defensive Rebound.",40,27,13,0.971015240560073,"Duke","Rhode Island",3,4,0,0,9.5,401025870,2018-03-17
139,1,"1:29",1289,1289,"Duke  Timeout",40,27,13,0.965985205634659,"Duke","Rhode Island",3,3,0,1,9.5,401025870,2018-03-17
140,1,"1:20",1280,1280,"Foul on Cyril Langevine.",40,27,13,0.965985205634659,"Duke","Rhode Island",3,3,0,1,9.5,401025870,2018-03-17
141,1,"1:20",1280,1280,"Marvin Bagley III missed Free Throw.",40,27,13,0.965985205634659,"Duke","Rhode Island",3,3,0,1,9.5,401025870,2018-03-17
142,1,"1:20",1280,1280,"Marvin Bagley III Offensive Rebound.",40,27,13,0.965985205634659,"Duke","Rhode Island",3,3,0,1,9.5,401025870,2018-03-17
143,1,"1:14",1274,1274,"Gary Trent Jr. missed Three Point Jumper.",40,27,13,0.962315099039698,"Duke","Rhode Island",3,3,0,1,9.5,401025870,2018-03-17
144,1,"1:14",1274,1274,"Jared Terrell Defensive Rebound.",40,27,13,0.962315099039698,"Duke","Rhode Island",3,3,0,1,9.5,401025870,2018-03-17
145,1,"0:57",1257,1257,"E.C. Matthews missed Three Point Jumper.",40,27,13,0.961770109364485,"Duke","Rhode Island",3,3,0,1,9.5,401025870,2018-03-17
146,1,"0:57",1257,1257,"Trevon Duval Defensive Rebound.",40,27,13,0.961770109364485,"Duke","Rhode Island",3,3,0,1,9.5,401025870,2018-03-17
147,1,"0:47",1247,1247,"Trevon Duval made Jumper.",42,27,15,0.975422340262703,"Duke","Rhode Island",3,3,0,1,9.5,401025870,2018-03-17
148,1,"0:35",1235,1235,"Foul on Trevon Duval.",42,27,15,0.97521486163192,"Duke","Rhode Island",3,3,0,1,9.5,401025870,2018-03-17
149,1,"0:35",1235,1235,"Jared Terrell missed Free Throw.",42,27,15,0.97521486163192,"Duke","Rhode Island",3,3,0,1,9.5,401025870,2018-03-17
150,1,"0:35",1235,1235,"Rhode Island Deadball Team Rebound.",42,27,15,0.97521486163192,"Duke","Rhode Island",3,3,0,1,9.5,401025870,2018-03-17
151,1,"0:35",1235,1235,"Jared Terrell made Free Throw.",42,28,14,0.971010573541778,"Duke","Rhode Island",3,3,0,1,9.5,401025870,2018-03-17
152,1,"0:18",1218,1218,"Trevon Duval made Three Point Jumper.",45,28,17,0.983118372948578,"Duke","Rhode Island",3,3,0,0,9.5,401025870,2018-03-17
153,1,"0:01",1201,1201,"E.C. Matthews missed Jumper.",45,28,17,0.982449563208607,"Duke","Rhode Island",3,3,0,0,9.5,401025870,2018-03-17
154,1,"0:01",1201,1201,"Rhode Island Deadball Team Rebound.",45,28,17,0.982449563208607,"Duke","Rhode Island",3,3,0,0,9.5,401025870,2018-03-17
155,1,"0:00",1200,1200,"End of 1st half",45,28,17,0.982449563208607,"Duke","Rhode Island",3,3,0,0,9.5,401025870,2018-03-17
156,2,"20:00",1200,1200,"PLAY",45,28,17,0.982449563208607,"Duke","Rhode Island",4,4,0,0,9.5,401025870,2018-03-17
157,2,"20:00",1200,1200,"Jump Ball won by Rhode Island",45,28,17,0.982449563208607,"Duke","Rhode Island",4,4,0,0,9.5,401025870,2018-03-17
158,2,"19:45",1185,1185,"Jared Terrell made Jumper. Assisted by Jeff Dowtin.",45,30,15,0.978260898420599,"Duke","Rhode Island",4,4,0,0,9.5,401025870,2018-03-17
159,2,"19:28",1168,1168,"Gary Trent Jr. missed Three Point Jumper.",45,30,15,0.977190400595861,"Duke","Rhode Island",4,4,0,0,9.5,401025870,2018-03-17
160,2,"19:28",1168,1168,"Wendell Carter Jr Offensive Rebound.",45,30,15,0.977190400595861,"Duke","Rhode Island",4,4,0,0,9.5,401025870,2018-03-17
161,2,"19:20",1160,1160,"Wendell Carter Jr made Layup. Assisted by Trevon Duval.",47,30,17,0.98349130426245,"Duke","Rhode Island",4,4,0,0,9.5,401025870,2018-03-17
162,2,"18:59",1139,1139,"Andre Berry missed Jumper.",47,30,17,0.983777911659345,"Duke","Rhode Island",4,4,0,0,9.5,401025870,2018-03-17
163,2,"18:59",1139,1139,"Marvin Bagley III Defensive Rebound.",47,30,17,0.983777911659345,"Duke","Rhode Island",4,4,0,0,9.5,401025870,2018-03-17
164,2,"18:51",1131,1131,"Trevon Duval missed Layup.",47,30,17,0.983777911659345,"Duke","Rhode Island",4,4,0,0,9.5,401025870,2018-03-17
165,2,"18:51",1131,1131,"Stanford Robinson Defensive Rebound.",47,30,17,0.983777911659345,"Duke","Rhode Island",4,4,0,0,9.5,401025870,2018-03-17
166,2,"18:45",1125,1125,"Foul on Marvin Bagley III.",47,30,17,0.988227545747626,"Duke","Rhode Island",4,4,0,0,9.5,401025870,2018-03-17
167,2,"18:45",1125,1125,"Stanford Robinson made Free Throw.",47,31,16,0.985851350827178,"Duke","Rhode Island",4,4,0,0,9.5,401025870,2018-03-17
168,2,"18:45",1125,1125,"Stanford Robinson missed Free Throw.",47,31,16,0.985851350827178,"Duke","Rhode Island",4,4,0,0,9.5,401025870,2018-03-17
169,2,"18:45",1125,1125,"Marvin Bagley III Defensive Rebound.",47,31,16,0.985851350827178,"Duke","Rhode Island",4,4,0,0,9.5,401025870,2018-03-17
170,2,"18:28",1108,1108,"Foul on Stanford Robinson.",47,31,16,0.980839064793033,"Duke","Rhode Island",4,4,0,0,9.5,401025870,2018-03-17
171,2,"18:25",1105,1105,"Marvin Bagley III made Layup. Assisted by Gary Trent Jr..",49,31,18,0.98611645895875,"Duke","Rhode Island",4,4,0,0,9.5,401025870,2018-03-17
172,2,"18:11",1091,1091,"Jared Terrell missed Three Point Jumper.",49,31,18,0.988045078245942,"Duke","Rhode Island",4,4,0,0,9.5,401025870,2018-03-17
173,2,"18:11",1091,1091,"Stanford Robinson Offensive Rebound.",49,31,18,0.988045078245942,"Duke","Rhode Island",4,4,0,0,9.5,401025870,2018-03-17
174,2,"18:05",1085,1085,"Stanford Robinson Turnover.",49,31,18,0.989059140845275,"Duke","Rhode Island",4,4,0,0,9.5,401025870,2018-03-17
175,2,"18:05",1085,1085,"Gary Trent Jr. Steal.",49,31,18,0.989059140845275,"Duke","Rhode Island",4,4,0,0,9.5,401025870,2018-03-17
176,2,"18:00",1080,1080,"Marvin Bagley III made Dunk. Assisted by Trevon Duval.",51,31,20,0.992296498075995,"Duke","Rhode Island",4,4,0,0,9.5,401025870,2018-03-17
177,2,"17:57",1077,1077,"Rhode Island  Timeout",51,31,20,0.990126411581782,"Duke","Rhode Island",3,4,1,0,9.5,401025870,2018-03-17
178,2,"17:48",1068,1068,"Jeff Dowtin missed Jumper.",51,31,20,0.990957198573665,"Duke","Rhode Island",3,4,1,0,9.5,401025870,2018-03-17
179,2,"17:48",1068,1068,"Andre Berry Offensive Rebound.",51,31,20,0.990957198573665,"Duke","Rhode Island",3,4,1,0,9.5,401025870,2018-03-17
180,2,"17:43",1063,1063,"Andre Berry missed Jumper.",51,31,20,0.990957198573665,"Duke","Rhode Island",3,4,1,0,9.5,401025870,2018-03-17
181,2,"17:43",1063,1063,"Rhode Island Offensive Rebound.",51,31,20,0.990957198573665,"Duke","Rhode Island",3,4,1,0,9.5,401025870,2018-03-17
182,2,"17:34",1054,1054,"E.C. Matthews missed Jumper.",51,31,20,0.992428907337155,"Duke","Rhode Island",3,4,1,0,9.5,401025870,2018-03-17
183,2,"17:34",1054,1054,"Stanford Robinson Offensive Rebound.",51,31,20,0.992428907337155,"Duke","Rhode Island",3,4,1,0,9.5,401025870,2018-03-17
184,2,"17:20",1040,1040,"Jared Terrell Turnover.",51,31,20,0.992011599706383,"Duke","Rhode Island",3,4,1,0,9.5,401025870,2018-03-17
