"play_id","half","time_remaining_half","secs_remaining","secs_remaining_absolute","description","home_score","away_score","score_diff","win_prob","home","away","home_time_out_remaining","away_time_out_remaining","home_timeout_ind","away_timeout_ind","home_favored_by","game_id","date"
185,2,"17:20",1040,1040,"Gary Trent Jr. Steal.",51,31,20,0.992011599706383,"Duke","Rhode Island",3,4,1,0,9.5,401025870,2018-03-17
186,2,"17:16",1036,1036,"Marvin Bagley III made Dunk. Assisted by Grayson Allen.",53,31,22,0.993406261342506,"Duke","Rhode Island",3,4,1,0,9.5,401025870,2018-03-17
187,2,"17:02",1022,1022,"Jeff Dowtin made Jumper.",53,33,20,0.992201083923042,"Duke","Rhode Island",3,4,1,0,9.5,401025870,2018-03-17
188,2,"16:55",1015,1015,"Foul on Jeff Dowtin.",53,33,20,0.991458300382452,"Duke","Rhode Island",3,4,0,0,9.5,401025870,2018-03-17
189,2,"16:41",1001,1001,"Marvin Bagley III missed Layup.",53,33,20,0.992297947221407,"Duke","Rhode Island",3,4,0,0,9.5,401025870,2018-03-17
190,2,"16:41",1001,1001,"Cyril Langevine Block.",53,33,20,0.992297947221407,"Duke","Rhode Island",3,4,0,0,9.5,401025870,2018-03-17
191,2,"16:41",1001,1001,"Marvin Bagley III Offensive Rebound.",53,33,20,0.992297947221407,"Duke","Rhode Island",3,4,0,0,9.5,401025870,2018-03-17
192,2,"16:39",999,999,"Foul on Cyril Langevine.",53,33,20,0.991349781258114,"Duke","Rhode Island",3,4,0,0,9.5,401025870,2018-03-17
193,2,"16:39",999,999,"Marvin Bagley III made Free Throw.",54,33,21,0.992753614041641,"Duke","Rhode Island",3,4,0,0,9.5,401025870,2018-03-17
194,2,"16:39",999,999,"Marvin Bagley III missed Free Throw.",54,33,21,0.992753614041641,"Duke","Rhode Island",3,4,0,0,9.5,401025870,2018-03-17
195,2,"16:39",999,999,"E.C. Matthews Defensive Rebound.",54,33,21,0.992753614041641,"Duke","Rhode Island",3,4,0,0,9.5,401025870,2018-03-17
196,2,"16:23",983,983,"Andre Berry Turnover.",54,33,21,0.995413420858217,"Duke","Rhode Island",3,4,0,0,9.5,401025870,2018-03-17
197,2,"16:04",964,964,"Wendell Carter Jr made Jumper. Assisted by Trevon Duval.",56,33,23,0.995411474202865,"Duke","Rhode Island",3,4,0,0,9.5,401025870,2018-03-17
198,2,"15:40",940,940,"Official TV Timeout",56,33,23,0.996673462017321,"Duke","Rhode Island",3,4,0,0,9.5,401025870,2018-03-17
199,2,"15:37",937,937,"Jared Terrell made Jumper. Assisted by Jeff Dowtin.",56,35,21,0.994426479848479,"Duke","Rhode Island",3,4,0,0,9.5,401025870,2018-03-17
200,2,"15:11",911,911,"Trevon Duval missed Three Point Jumper.",56,35,21,0.995358201144592,"Duke","Rhode Island",3,4,0,0,9.5,401025870,2018-03-17
201,2,"15:11",911,911,"E.C. Matthews Defensive Rebound.",56,35,21,0.995358201144592,"Duke","Rhode Island",3,4,0,0,9.5,401025870,2018-03-17
202,2,"15:02",902,902,"E.C. Matthews missed Layup.",56,35,21,0.994271076277259,"Duke","Rhode Island",3,4,0,0,9.5,401025870,2018-03-17
203,2,"15:02",902,902,"Cyril Langevine Offensive Rebound.",56,35,21,0.994271076277259,"Duke","Rhode Island",3,4,0,0,9.5,401025870,2018-03-17
204,2,"14:34",874,874,"Foul on Wendell Carter Jr.",56,35,21,0.994667155094383,"Duke","Rhode Island",3,4,0,0,9.5,401025870,2018-03-17
205,2,"14:25",865,865,"Foul on Grayson Allen.",56,35,21,0.994288054703863,"Duke","Rhode Island",3,4,0,0,9.5,401025870,2018-03-17
206,2,"14:18",858,858,"E.C. Matthews missed Layup.",56,35,21,0.995908021347156,"Duke","Rhode Island",3,4,0,0,9.5,401025870,2018-03-17
207,2,"14:18",858,858,"Javin DeLaurier Defensive Rebound.",56,35,21,0.995908021347156,"Duke","Rhode Island",3,4,0,0,9.5,401025870,2018-03-17
208,2,"14:08",848,848,"Grayson Allen made Three Point Jumper. Assisted by Trevon Duval.",59,35,24,0.99797654578933,"Duke","Rhode Island",3,4,0,0,9.5,401025870,2018-03-17
209,2,"13:47",827,827,"Jared Terrell missed Three Point Jumper.",59,35,24,0.996665471320405,"Duke","Rhode Island",3,4,0,0,9.5,401025870,2018-03-17
210,2,"13:47",827,827,"Javin DeLaurier Defensive Rebound.",59,35,24,0.996665471320405,"Duke","Rhode Island",3,4,0,0,9.5,401025870,2018-03-17
211,2,"13:15",795,795,"Marques Bolden Turnover.",59,35,24,0.998315694926761,"Duke","Rhode Island",3,4,0,0,9.5,401025870,2018-03-17
212,2,"13:15",795,795,"Jarvis Garrett Steal.",59,35,24,0.998315694926761,"Duke","Rhode Island",3,4,0,0,9.5,401025870,2018-03-17
213,2,"13:09",789,789,"Foul on Grayson Allen.",59,35,24,0.997699057039893,"Duke","Rhode Island",3,4,0,0,9.5,401025870,2018-03-17
214,2,"13:09",789,789,"E.C. Matthews missed Free Throw.",59,35,24,0.997699057039893,"Duke","Rhode Island",3,4,0,0,9.5,401025870,2018-03-17
215,2,"13:09",789,789,"Rhode Island Deadball Team Rebound.",59,35,24,0.997699057039893,"Duke","Rhode Island",3,4,0,0,9.5,401025870,2018-03-17
216,2,"13:09",789,789,"E.C. Matthews missed Free Throw.",59,35,24,0.997699057039893,"Duke","Rhode Island",3,4,0,0,9.5,401025870,2018-03-17
217,2,"13:09",789,789,"Javin DeLaurier Defensive Rebound.",59,35,24,0.997699057039893,"Duke","Rhode Island",3,4,0,0,9.5,401025870,2018-03-17
218,2,"12:54",774,774,"Gary Trent Jr. missed Jumper.",59,35,24,0.997922253873406,"Duke","Rhode Island",3,4,0,0,9.5,401025870,2018-03-17
219,2,"12:54",774,774,"Javin DeLaurier Offensive Rebound.",59,35,24,0.997922253873406,"Duke","Rhode Island",3,4,0,0,9.5,401025870,2018-03-17
220,2,"12:49",769,769,"Marvin Bagley III made Three Point Jumper. Assisted by Gary Trent Jr..",62,35,27,0.999157350303611,"Duke","Rhode Island",3,4,0,0,9.5,401025870,2018-03-17
221,2,"12:28",748,748,"Cyril Langevine made Jumper. Assisted by Fatts Russell.",62,37,25,0.998718339656663,"Duke","Rhode Island",3,4,0,0,9.5,401025870,2018-03-17
222,2,"12:03",723,723,"Grayson Allen Turnover.",62,37,25,0.998688070816997,"Duke","Rhode Island",3,4,0,0,9.5,401025870,2018-03-17
223,2,"11:56",716,716,"Jarvis Garrett missed Three Point Jumper.",62,37,25,0.998554362125262,"Duke","Rhode Island",3,4,0,0,9.5,401025870,2018-03-17
224,2,"11:56",716,716,"Gary Trent Jr. Defensive Rebound.",62,37,25,0.998554362125262,"Duke","Rhode Island",3,4,0,0,9.5,401025870,2018-03-17
225,2,"11:45",705,705,"Foul on Fatts Russell.",62,37,25,0.998282900232635,"Duke","Rhode Island",3,4,0,0,9.5,401025870,2018-03-17
226,2,"11:45",705,705,"Official TV Timeout",62,37,25,0.998282900232635,"Duke","Rhode Island",3,4,0,0,9.5,401025870,2018-03-17
227,2,"11:41",701,701,"Foul on E.C. Matthews.",62,37,25,0.998282900232635,"Duke","Rhode Island",3,4,0,0,9.5,401025870,2018-03-17
228,2,"11:41",701,701,"Javin DeLaurier made Free Throw.",63,37,26,0.998611431154984,"Duke","Rhode Island",3,4,0,0,9.5,401025870,2018-03-17
229,2,"11:41",701,701,"Javin DeLaurier made Free Throw.",64,37,27,0.998877175295118,"Duke","Rhode Island",3,4,0,0,9.5,401025870,2018-03-17
230,2,"11:14",674,674,"Fatts Russell Turnover.",64,37,27,0.999351121779372,"Duke","Rhode Island",3,4,0,0,9.5,401025870,2018-03-17
231,2,"11:14",674,674,"Gary Trent Jr. Steal.",64,37,27,0.999351121779372,"Duke","Rhode Island",3,4,0,0,9.5,401025870,2018-03-17
232,2,"11:08",668,668,"Marvin Bagley III Turnover.",64,37,27,0.999237822292506,"Duke","Rhode Island",3,4,0,0,9.5,401025870,2018-03-17
233,2,"11:08",668,668,"Cyril Langevine Steal.",64,37,27,0.999237822292506,"Duke","Rhode Island",3,4,0,0,9.5,401025870,2018-03-17
234,2,"10:57",657,657,"Jared Terrell made Layup. Assisted by Jeff Dowtin.",64,39,25,0.999105081774978,"Duke","Rhode Island",3,4,0,0,9.5,401025870,2018-03-17
235,2,"10:37",637,637,"Gary Trent Jr. missed Jumper.",64,39,25,0.998915469489915,"Duke","Rhode Island",3,4,0,0,9.5,401025870,2018-03-17
236,2,"10:37",637,637,"Marvin Bagley III Offensive Rebound.",64,39,25,0.998915469489915,"Duke","Rhode Island",3,4,0,0,9.5,401025870,2018-03-17
237,2,"10:37",637,637,"Marvin Bagley III made Two Point Tip Shot.",66,39,27,0.999323726373226,"Duke","Rhode Island",3,4,0,0,9.5,401025870,2018-03-17
238,2,"10:28",628,628,"Jeff Dowtin Turnover.",66,39,27,0.999636135708855,"Duke","Rhode Island",3,4,0,0,9.5,401025870,2018-03-17
239,2,"10:28",628,628,"Grayson Allen Steal.",66,39,27,0.999636135708855,"Duke","Rhode Island",3,4,0,0,9.5,401025870,2018-03-17
240,2,"10:24",624,624,"Gary Trent Jr. missed Three Point Jumper.",66,39,27,0.999636135708855,"Duke","Rhode Island",3,4,0,0,9.5,401025870,2018-03-17
241,2,"10:24",624,624,"E.C. Matthews Defensive Rebound.",66,39,27,0.999636135708855,"Duke","Rhode Island",3,4,0,0,9.5,401025870,2018-03-17
242,2,"10:16",616,616,"E.C. Matthews made Layup.",66,41,25,0.999284639230362,"Duke","Rhode Island",3,4,0,0,9.5,401025870,2018-03-17
243,2,"9:54",594,594,"Foul on E.C. Matthews.",66,41,25,0.999084705503991,"Duke","Rhode Island",3,4,0,0,9.5,401025870,2018-03-17
244,2,"9:54",594,594,"Trevon Duval missed Free Throw.",66,41,25,0.999084705503991,"Duke","Rhode Island",3,4,0,0,9.5,401025870,2018-03-17
245,2,"9:54",594,594,"Duke Deadball Team Rebound.",66,41,25,0.999084705503991,"Duke","Rhode Island",3,4,0,0,9.5,401025870,2018-03-17
246,2,"9:54",594,594,"Trevon Duval made Free Throw.",67,41,26,0.999279628513453,"Duke","Rhode Island",3,4,0,0,9.5,401025870,2018-03-17
247,2,"9:40",580,580,"Foul on Javin DeLaurier.",67,41,26,0.99927869897454,"Duke","Rhode Island",3,4,0,0,9.5,401025870,2018-03-17
248,2,"9:25",565,565,"Fatts Russell made Three Point Jumper. Assisted by Jeff Dowtin.",67,44,23,0.999148763240136,"Duke","Rhode Island",3,4,0,0,9.5,401025870,2018-03-17
249,2,"8:59",539,539,"Gary Trent Jr. made Three Point Jumper. Assisted by Wendell Carter Jr.",70,44,26,0.999776567221987,"Duke","Rhode Island",3,4,0,0,9.5,401025870,2018-03-17
250,2,"8:48",528,528,"Jeff Dowtin made Jumper. Assisted by E.C. Matthews.",70,46,24,0.999409388710813,"Duke","Rhode Island",3,4,0,0,9.5,401025870,2018-03-17
251,2,"8:19",499,499,"Javin DeLaurier made Layup. Assisted by Wendell Carter Jr.",72,46,26,0.999682172428222,"Duke","Rhode Island",3,4,0,0,9.5,401025870,2018-03-17
252,2,"8:05",485,485,"Jared Terrell missed Jumper.",72,46,26,0.999681725362501,"Duke","Rhode Island",3,4,0,0,9.5,401025870,2018-03-17
253,2,"8:05",485,485,"Grayson Allen Defensive Rebound.",72,46,26,0.999681725362501,"Duke","Rhode Island",3,4,0,0,9.5,401025870,2018-03-17
254,2,"7:49",469,469,"Javin DeLaurier made Layup. Assisted by Wendell Carter Jr.",74,46,28,0.999853547807717,"Duke","Rhode Island",3,4,0,0,9.5,401025870,2018-03-17
255,2,"7:31",451,451,"Fatts Russell made Three Point Jumper. Assisted by Jeff Dowtin.",74,49,25,0.999842780616728,"Duke","Rhode Island",3,4,0,0,9.5,401025870,2018-03-17
256,2,"7:02",422,422,"Wendell Carter Jr Turnover.",74,49,25,0.999739586156541,"Duke","Rhode Island",3,4,0,0,9.5,401025870,2018-03-17
257,2,"7:02",422,422,"Foul on Wendell Carter Jr.",74,49,25,0.999739586156541,"Duke","Rhode Island",3,4,0,0,9.5,401025870,2018-03-17
258,2,"7:02",422,422,"Official TV Timeout",74,49,25,0.999739586156541,"Duke","Rhode Island",3,4,0,0,9.5,401025870,2018-03-17
259,2,"6:49",409,409,"Jeff Dowtin missed Jumper.",74,49,25,0.999886331769752,"Duke","Rhode Island",3,4,0,0,9.5,401025870,2018-03-17
260,2,"6:49",409,409,"Wendell Carter Jr Defensive Rebound.",74,49,25,0.999886331769752,"Duke","Rhode Island",3,4,0,0,9.5,401025870,2018-03-17
261,2,"6:30",390,390,"Marvin Bagley III made Dunk. Assisted by Grayson Allen.",76,49,27,0.999911702957259,"Duke","Rhode Island",3,4,0,0,9.5,401025870,2018-03-17
262,2,"6:19",379,379,"Fatts Russell missed Three Point Jumper.",76,49,27,0.999899965749495,"Duke","Rhode Island",3,4,0,0,9.5,401025870,2018-03-17
263,2,"6:19",379,379,"Andre Berry Offensive Rebound.",76,49,27,0.999899965749495,"Duke","Rhode Island",3,4,0,0,9.5,401025870,2018-03-17
264,2,"6:14",374,374,"Andre Berry Turnover.",76,49,27,0.999899965749495,"Duke","Rhode Island",3,4,0,0,9.5,401025870,2018-03-17
265,2,"6:14",374,374,"Grayson Allen Steal.",76,49,27,0.999899965749495,"Duke","Rhode Island",3,4,0,0,9.5,401025870,2018-03-17
266,2,"5:52",352,352,"Foul on Andre Berry.",76,49,27,0.99995252465224,"Duke","Rhode Island",3,4,0,0,9.5,401025870,2018-03-17
267,2,"5:52",352,352,"Javin DeLaurier missed Free Throw.",76,49,27,0.99995252465224,"Duke","Rhode Island",3,4,0,0,9.5,401025870,2018-03-17
268,2,"5:52",352,352,"Duke Deadball Team Rebound.",76,49,27,0.99995252465224,"Duke","Rhode Island",3,4,0,0,9.5,401025870,2018-03-17
269,2,"5:52",352,352,"Javin DeLaurier missed Free Throw.",76,49,27,0.99995252465224,"Duke","Rhode Island",3,4,0,0,9.5,401025870,2018-03-17
270,2,"5:52",352,352,"E.C. Matthews Defensive Rebound.",76,49,27,0.99995252465224,"Duke","Rhode Island",3,4,0,0,9.5,401025870,2018-03-17
271,2,"5:38",338,338,"E.C. Matthews made Layup.",76,51,25,0.999940554434041,"Duke","Rhode Island",3,4,0,0,9.5,401025870,2018-03-17
272,2,"5:20",320,320,"Foul on Fatts Russell.",76,51,25,0.999839014088988,"Duke","Rhode Island",3,4,0,0,9.5,401025870,2018-03-17
273,2,"5:20",320,320,"Gary Trent Jr. made Free Throw.",77,51,26,0.99988238145637,"Duke","Rhode Island",3,4,0,0,9.5,401025870,2018-03-17
274,2,"5:20",320,320,"Gary Trent Jr. made Free Throw.",78,51,27,0.999914067261685,"Duke","Rhode Island",3,4,0,0,9.5,401025870,2018-03-17
275,2,"5:11",311,311,"E.C. Matthews missed Three Point Jumper.",78,51,27,0.999976840160353,"Duke","Rhode Island",3,4,0,0,9.5,401025870,2018-03-17
276,2,"5:11",311,311,"Marques Bolden Defensive Rebound.",78,51,27,0.999976840160353,"Duke","Rhode Island",3,4,0,0,9.5,401025870,2018-03-17
277,2,"5:06",306,306,"Foul on Jared Terrell.",78,51,27,0.999949606569246,"Duke","Rhode Island",3,4,0,0,9.5,401025870,2018-03-17
278,2,"5:06",306,306,"Marques Bolden made Free Throw.",79,51,28,0.999964082240814,"Duke","Rhode Island",3,4,0,0,9.5,401025870,2018-03-17
279,2,"5:06",306,306,"Marques Bolden made Free Throw.",80,51,29,0.999974399836626,"Duke","Rhode Island",3,4,0,0,9.5,401025870,2018-03-17
280,2,"4:48",288,288,"Jared Terrell made Three Point Jumper. Assisted by Stanford Robinson.",80,54,26,0.999952694618971,"Duke","Rhode Island",3,4,0,0,9.5,401025870,2018-03-17
281,2,"4:23",263,263,"Foul on Jarvis Garrett.",80,54,26,0.999972443373967,"Duke","Rhode Island",3,4,0,0,9.5,401025870,2018-03-17
282,2,"4:23",263,263,"Gary Trent Jr. made Free Throw.",81,54,27,0.999981027342225,"Duke","Rhode Island",3,4,0,0,9.5,401025870,2018-03-17
283,2,"4:23",263,263,"Gary Trent Jr. made Free Throw.",82,54,28,0.999986937414614,"Duke","Rhode Island",3,4,0,0,9.5,401025870,2018-03-17
284,2,"4:07",247,247,"Jarvis Garrett missed Three Point Jumper.",82,54,28,0.999994097442238,"Duke","Rhode Island",3,4,0,0,9.5,401025870,2018-03-17
285,2,"4:07",247,247,"E.C. Matthews Offensive Rebound.",82,54,28,0.999994097442238,"Duke","Rhode Island",3,4,0,0,9.5,401025870,2018-03-17
286,2,"4:01",241,241,"E.C. Matthews made Three Point Jumper.",82,57,25,0.999980138261937,"Duke","Rhode Island",3,4,0,0,9.5,401025870,2018-03-17
287,2,"4:00",240,240,"Rhode Island  Timeout",82,57,25,0.999980138261937,"Duke","Rhode Island",2,4,1,0,9.5,401025870,2018-03-17
288,2,"4:00",240,240,"Official TV Timeout",82,57,25,0.999980138261937,"Duke","Rhode Island",2,4,1,0,9.5,401025870,2018-03-17
289,2,"3:40",220,220,"Jack White made Layup.",84,57,27,0.999995614640094,"Duke","Rhode Island",2,4,1,0,9.5,401025870,2018-03-17
290,2,"3:19",199,199,"Jared Terrell missed Jumper.",84,57,27,0.9999980960634,"Duke","Rhode Island",2,4,1,0,9.5,401025870,2018-03-17
291,2,"3:19",199,199,"Cyril Langevine Offensive Rebound.",84,57,27,0.9999980960634,"Duke","Rhode Island",2,4,1,0,9.5,401025870,2018-03-17
292,2,"3:16",196,196,"Andre Berry missed Jumper.",84,57,27,0.9999980960634,"Duke","Rhode Island",2,4,1,0,9.5,401025870,2018-03-17
293,2,"3:16",196,196,"Marques Bolden Defensive Rebound.",84,57,27,0.9999980960634,"Duke","Rhode Island",2,4,1,0,9.5,401025870,2018-03-17
294,2,"2:41",161,161,"Duke  Turnover.",84,57,27,0.999999630265547,"Duke","Rhode Island",2,4,0,0,9.5,401025870,2018-03-17
295,2,"2:34",154,154,"E.C. Matthews missed Jumper.",84,57,27,0.999999756010915,"Duke","Rhode Island",2,4,0,0,9.5,401025870,2018-03-17
296,2,"2:34",154,154,"Jack White Defensive Rebound.",84,57,27,0.999999756010915,"Duke","Rhode Island",2,4,0,0,9.5,401025870,2018-03-17
297,2,"2:12",132,132,"Marques Bolden Turnover.",84,57,27,0.999999810606269,"Duke","Rhode Island",2,4,0,0,9.5,401025870,2018-03-17
298,2,"2:00",120,120,"Jarvis Garrett missed Jumper.",84,57,27,0.99999986829952,"Duke","Rhode Island",2,4,0,0,9.5,401025870,2018-03-17
299,2,"2:00",120,120,"Andre Berry Offensive Rebound.",84,57,27,0.99999986829952,"Duke","Rhode Island",2,4,0,0,9.5,401025870,2018-03-17
300,2,"2:00",120,120,"Andre Berry made Two Point Tip Shot.",84,59,25,0.99999959106768,"Duke","Rhode Island",2,4,0,0,9.5,401025870,2018-03-17
301,2,"1:33",93,93,"Justin Robinson Turnover.",84,59,25,0.999999905837475,"Duke","Rhode Island",2,4,0,0,9.5,401025870,2018-03-17
302,2,"1:33",93,93,"E.C. Matthews Steal.",84,59,25,0.999999905837475,"Duke","Rhode Island",2,4,0,0,9.5,401025870,2018-03-17
303,2,"1:20",80,80,"Foul on Marques Bolden.",84,59,25,0.999999991759656,"Duke","Rhode Island",2,4,0,0,9.5,401025870,2018-03-17
304,2,"1:20",80,80,"E.C. Matthews missed Free Throw.",84,59,25,0.999999991759656,"Duke","Rhode Island",2,4,0,0,9.5,401025870,2018-03-17
305,2,"1:20",80,80,"Rhode Island Deadball Team Rebound.",84,59,25,0.999999991759656,"Duke","Rhode Island",2,4,0,0,9.5,401025870,2018-03-17
306,2,"1:20",80,80,"E.C. Matthews made Free Throw.",84,60,24,0.99999998313049,"Duke","Rhode Island",2,4,0,0,9.5,401025870,2018-03-17
307,2,"0:58",58,58,"Marques Bolden missed Layup.",84,60,24,0.999999999652888,"Duke","Rhode Island",2,4,0,0,9.5,401025870,2018-03-17
308,2,"0:58",58,58,"Jared Terrell Block.",84,60,24,0.999999999652888,"Duke","Rhode Island",2,4,0,0,9.5,401025870,2018-03-17
309,2,"0:58",58,58,"Marques Bolden Offensive Rebound.",84,60,24,0.999999999652888,"Duke","Rhode Island",2,4,0,0,9.5,401025870,2018-03-17
310,2,"0:57",57,57,"Jump Ball won by Duke",84,60,24,0.999999999599382,"Duke","Rhode Island",2,4,0,0,9.5,401025870,2018-03-17
311,2,"0:52",52,52,"Jordan Goldwire made Three Point Jumper. Assisted by Jack White.",87,60,27,0.99999999980655,"Duke","Rhode Island",2,4,0,0,9.5,401025870,2018-03-17
312,2,"0:40",40,40,"E.C. Matthews made Jumper.",87,62,25,0.999999999984705,"Duke","Rhode Island",2,4,0,0,9.5,401025870,2018-03-17
313,2,"0:25",25,25,"Justin Robinson missed Three Point Jumper.",87,62,25,0.999999999999991,"Duke","Rhode Island",2,4,0,0,9.5,401025870,2018-03-17
314,2,"0:25",25,25,"Eric Dadika Defensive Rebound.",87,62,25,0.999999999999991,"Duke","Rhode Island",2,4,0,0,9.5,401025870,2018-03-17
315,2,"0:15",15,15,"Jeff Dowtin missed Jumper.",87,62,25,1,"Duke","Rhode Island",2,4,0,0,9.5,401025870,2018-03-17
316,2,"0:15",15,15,"Marques Bolden Defensive Rebound.",87,62,25,1,"Duke","Rhode Island",2,4,0,0,9.5,401025870,2018-03-17
317,2,"0:00",0,0,"End of Game",87,62,25,1,"Duke","Rhode Island",2,4,0,0,9.5,401025870,2018-03-17
