"play_id","half","time_remaining_half","secs_remaining","secs_remaining_absolute","description","home_score","away_score","score_diff","win_prob","home","away","home_time_out_remaining","away_time_out_remaining","home_timeout_ind","away_timeout_ind","home_favored_by","game_id","date"
1,1,"20:00",2400,2400,"PLAY",0,0,0,0.770231956908983,"Arizona State","St. John's",4,4,0,0,5.5,400988254,2017-12-08
2,1,"20:00",2400,2400,"Jump Ball won by Arizona State",0,0,0,0.770231956908983,"Arizona State","St. John's",4,4,0,0,5.5,400988254,2017-12-08
3,1,"19:49",2389,2389,"Vitaliy Shibel made Three Point Jumper. Assisted by Shannon Evans II.",3,0,3,0.783476299776428,"Arizona State","St. John's",4,4,0,0,5.5,400988254,2017-12-08
4,1,"19:27",2367,2367,"Shamorie Ponds made Three Point Jumper. Assisted by Justin Simon.",3,3,0,0.752176566830857,"Arizona State","St. John's",4,4,0,0,5.5,400988254,2017-12-08
5,1,"19:05",2345,2345,"Romello White made Jumper. Assisted by Vitaliy Shibel.",5,3,2,0.786690941700624,"Arizona State","St. John's",4,4,0,0,5.5,400988254,2017-12-08
6,1,"18:44",2324,2324,"Bashir Ahmed missed Jumper.",5,3,2,0.802794176596314,"Arizona State","St. John's",4,4,0,0,5.5,400988254,2017-12-08
7,1,"18:44",2324,2324,"Kodi Justice Defensive Rebound.",5,3,2,0.802794176596314,"Arizona State","St. John's",4,4,0,0,5.5,400988254,2017-12-08
8,1,"18:17",2297,2297,"Vitaliy Shibel made Three Point Jumper. Assisted by Kodi Justice.",8,3,5,0.838838445665457,"Arizona State","St. John's",4,4,0,0,5.5,400988254,2017-12-08
9,1,"17:54",2274,2274,"Tariq Owens made Jumper. Assisted by Justin Simon.",8,5,3,0.812120781403329,"Arizona State","St. John's",4,4,0,0,5.5,400988254,2017-12-08
10,1,"17:40",2260,2260,"Kodi Justice missed Jumper.",8,5,3,0.824599251597342,"Arizona State","St. John's",4,4,0,0,5.5,400988254,2017-12-08
11,1,"17:40",2260,2260,"Bashir Ahmed Defensive Rebound.",8,5,3,0.824599251597342,"Arizona State","St. John's",4,4,0,0,5.5,400988254,2017-12-08
12,1,"17:32",2252,2252,"Justin Simon made Layup. Assisted by Marvin Clark II.",8,7,1,0.771117389475834,"Arizona State","St. John's",4,4,0,0,5.5,400988254,2017-12-08
13,1,"17:32",2252,2252,"Foul on Romello White.",8,7,1,0.771117389475834,"Arizona State","St. John's",4,4,0,0,5.5,400988254,2017-12-08
14,1,"17:32",2252,2252,"Justin Simon missed Free Throw.",8,7,1,0.771117389475834,"Arizona State","St. John's",4,4,0,0,5.5,400988254,2017-12-08
15,1,"17:32",2252,2252,"Romello White Defensive Rebound.",8,7,1,0.771117389475834,"Arizona State","St. John's",4,4,0,0,5.5,400988254,2017-12-08
16,1,"17:13",2233,2233,"Tra Holder Turnover.",8,7,1,0.77666714745712,"Arizona State","St. John's",4,4,0,0,5.5,400988254,2017-12-08
17,1,"17:13",2233,2233,"Justin Simon Steal.",8,7,1,0.77666714745712,"Arizona State","St. John's",4,4,0,0,5.5,400988254,2017-12-08
18,1,"17:00",2220,2220,"Bashir Ahmed missed Three Point Jumper.",8,7,1,0.776709247279373,"Arizona State","St. John's",4,4,0,0,5.5,400988254,2017-12-08
19,1,"17:00",2220,2220,"Tra Holder Defensive Rebound.",8,7,1,0.776709247279373,"Arizona State","St. John's",4,4,0,0,5.5,400988254,2017-12-08
20,1,"16:49",2209,2209,"Romello White made Layup. Assisted by Tra Holder.",10,7,3,0.812083258121067,"Arizona State","St. John's",4,4,0,0,5.5,400988254,2017-12-08
21,1,"16:31",2191,2191,"Tariq Owens missed Jumper.",10,7,3,0.821907630045665,"Arizona State","St. John's",4,4,0,0,5.5,400988254,2017-12-08
22,1,"16:31",2191,2191,"Kodi Justice Defensive Rebound.",10,7,3,0.821907630045665,"Arizona State","St. John's",4,4,0,0,5.5,400988254,2017-12-08
23,1,"16:16",2176,2176,"Foul on Tariq Owens.",10,7,3,0.804923869074486,"Arizona State","St. John's",4,4,0,0,5.5,400988254,2017-12-08
24,1,"15:58",2158,2158,"Foul on Tariq Owens.",10,7,3,0.807483974060606,"Arizona State","St. John's",4,4,0,0,5.5,400988254,2017-12-08
25,1,"15:58",2158,2158,"Official TV Timeout",10,7,3,0.807483974060606,"Arizona State","St. John's",4,4,0,0,5.5,400988254,2017-12-08
26,1,"15:58",2158,2158,"Shannon Evans II made Free Throw.",11,7,4,0.825378761208607,"Arizona State","St. John's",4,4,0,0,5.5,400988254,2017-12-08
27,1,"15:58",2158,2158,"Shannon Evans II made Free Throw.",12,7,5,0.841935789682982,"Arizona State","St. John's",4,4,0,0,5.5,400988254,2017-12-08
28,1,"15:42",2142,2142,"Marvin Clark II made Jumper. Assisted by Shamorie Ponds.",12,9,3,0.809552284712686,"Arizona State","St. John's",4,4,0,0,5.5,400988254,2017-12-08
29,1,"15:30",2130,2130,"Remy Martin made Jumper.",14,9,5,0.846595305599883,"Arizona State","St. John's",4,4,0,0,5.5,400988254,2017-12-08
30,1,"15:07",2107,2107,"Shamorie Ponds missed Three Point Jumper.",14,9,5,0.83671118112921,"Arizona State","St. John's",4,4,0,0,5.5,400988254,2017-12-08
31,1,"15:07",2107,2107,"Arizona State Defensive Rebound.",14,9,5,0.83671118112921,"Arizona State","St. John's",4,4,0,0,5.5,400988254,2017-12-08
32,1,"14:52",2092,2092,"Foul on De'Quon Lake.",14,9,5,0.84253366571967,"Arizona State","St. John's",4,4,0,0,5.5,400988254,2017-12-08
33,1,"14:52",2092,2092,"De'Quon Lake Turnover.",14,9,5,0.84253366571967,"Arizona State","St. John's",4,4,0,0,5.5,400988254,2017-12-08
34,1,"14:40",2080,2080,"Bashir Ahmed missed Three Point Jumper.",14,9,5,0.837672216963879,"Arizona State","St. John's",4,4,0,0,5.5,400988254,2017-12-08
35,1,"14:40",2080,2080,"Remy Martin Defensive Rebound.",14,9,5,0.837672216963879,"Arizona State","St. John's",4,4,0,0,5.5,400988254,2017-12-08
36,1,"14:30",2070,2070,"Tra Holder missed Three Point Jumper.",14,9,5,0.835778643725334,"Arizona State","St. John's",4,4,0,0,5.5,400988254,2017-12-08
37,1,"14:30",2070,2070,"Shamorie Ponds Defensive Rebound.",14,9,5,0.835778643725334,"Arizona State","St. John's",4,4,0,0,5.5,400988254,2017-12-08
38,1,"14:22",2062,2062,"Shamorie Ponds missed Three Point Jumper.",14,9,5,0.839109807659178,"Arizona State","St. John's",4,4,0,0,5.5,400988254,2017-12-08
39,1,"14:22",2062,2062,"De'Quon Lake Defensive Rebound.",14,9,5,0.839109807659178,"Arizona State","St. John's",4,4,0,0,5.5,400988254,2017-12-08
40,1,"14:07",2047,2047,"De'Quon Lake made Dunk. Assisted by Shannon Evans II.",16,9,7,0.857492768331957,"Arizona State","St. John's",4,4,0,0,5.5,400988254,2017-12-08
41,1,"13:37",2017,2017,"Foul on De'Quon Lake.",16,9,7,0.870671903386993,"Arizona State","St. John's",4,4,0,0,5.5,400988254,2017-12-08
42,1,"13:37",2017,2017,"Bashir Ahmed made Free Throw.",16,10,6,0.857087428215368,"Arizona State","St. John's",4,4,0,0,5.5,400988254,2017-12-08
43,1,"13:37",2017,2017,"Bashir Ahmed made Free Throw.",16,11,5,0.842334444991364,"Arizona State","St. John's",4,4,0,0,5.5,400988254,2017-12-08
44,1,"13:22",2002,2002,"Foul on Kodi Justice.",16,11,5,0.832474530059666,"Arizona State","St. John's",4,4,0,0,5.5,400988254,2017-12-08
45,1,"13:22",2002,2002,"Kodi Justice Turnover.",16,11,5,0.832474530059666,"Arizona State","St. John's",4,4,0,0,5.5,400988254,2017-12-08
46,1,"13:02",1982,1982,"Marvin Clark II made Jumper.",16,13,3,0.7971600545382,"Arizona State","St. John's",4,4,0,0,5.5,400988254,2017-12-08
47,1,"12:52",1972,1972,"Foul on Kassoum Yakwe.",16,13,3,0.816098921989677,"Arizona State","St. John's",4,4,0,0,5.5,400988254,2017-12-08
48,1,"12:41",1961,1961,"Romello White missed Jumper.",16,13,3,0.800395262736508,"Arizona State","St. John's",4,4,0,0,5.5,400988254,2017-12-08
49,1,"12:41",1961,1961,"Kassoum Yakwe Defensive Rebound.",16,13,3,0.800395262736508,"Arizona State","St. John's",4,4,0,0,5.5,400988254,2017-12-08
50,1,"12:30",1950,1950,"Marvin Clark II made Three Point Jumper. Assisted by Shamorie Ponds.",16,16,0,0.744737891392796,"Arizona State","St. John's",4,4,0,0,5.5,400988254,2017-12-08
51,1,"12:05",1925,1925,"Remy Martin missed Layup.",16,16,0,0.743524031488786,"Arizona State","St. John's",4,4,0,0,5.5,400988254,2017-12-08
52,1,"12:05",1925,1925,"Romello White Offensive Rebound.",16,16,0,0.743524031488786,"Arizona State","St. John's",4,4,0,0,5.5,400988254,2017-12-08
53,1,"12:05",1925,1925,"Romello White made Two Point Tip Shot.",18,16,2,0.78855490720677,"Arizona State","St. John's",4,4,0,0,5.5,400988254,2017-12-08
54,1,"11:47",1907,1907,"Kassoum Yakwe made Layup.",18,18,0,0.74279768252363,"Arizona State","St. John's",4,4,0,0,5.5,400988254,2017-12-08
55,1,"11:47",1907,1907,"Foul on Vitaliy Shibel.",18,18,0,0.74279768252363,"Arizona State","St. John's",4,4,0,0,5.5,400988254,2017-12-08
56,1,"11:47",1907,1907,"Official TV Timeout",18,18,0,0.74279768252363,"Arizona State","St. John's",4,4,0,0,5.5,400988254,2017-12-08
57,1,"11:47",1907,1907,"Kassoum Yakwe made Free Throw.",18,19,-1,0.719819919514907,"Arizona State","St. John's",4,4,0,0,5.5,400988254,2017-12-08
58,1,"11:29",1889,1889,"Kodi Justice missed Three Point Jumper.",18,19,-1,0.714911986140004,"Arizona State","St. John's",4,4,0,0,5.5,400988254,2017-12-08
59,1,"11:29",1889,1889,"Marvin Clark II Defensive Rebound.",18,19,-1,0.714911986140004,"Arizona State","St. John's",4,4,0,0,5.5,400988254,2017-12-08
60,1,"11:14",1874,1874,"Foul on Kassoum Yakwe.",18,19,-1,0.71294344982736,"Arizona State","St. John's",4,4,0,0,5.5,400988254,2017-12-08
61,1,"11:14",1874,1874,"Kassoum Yakwe Turnover.",18,19,-1,0.71294344982736,"Arizona State","St. John's",4,4,0,0,5.5,400988254,2017-12-08
62,1,"10:57",1857,1857,"Romello White made Layup. Assisted by Kodi Justice.",20,19,1,0.765026970232858,"Arizona State","St. John's",4,4,0,0,5.5,400988254,2017-12-08
63,1,"10:57",1857,1857,"Foul on Bryan Trimble Jr..",20,19,1,0.765026970232858,"Arizona State","St. John's",4,4,0,0,5.5,400988254,2017-12-08
64,1,"10:57",1857,1857,"Romello White missed Free Throw.",20,19,1,0.765026970232858,"Arizona State","St. John's",4,4,0,0,5.5,400988254,2017-12-08
65,1,"10:57",1857,1857,"Marvin Clark II Defensive Rebound.",20,19,1,0.765026970232858,"Arizona State","St. John's",4,4,0,0,5.5,400988254,2017-12-08
66,1,"10:38",1838,1838,"Amar Alibegovic missed Three Point Jumper.",20,19,1,0.760541722775222,"Arizona State","St. John's",4,4,0,0,5.5,400988254,2017-12-08
67,1,"10:38",1838,1838,"Shannon Evans II Defensive Rebound.",20,19,1,0.760541722775222,"Arizona State","St. John's",4,4,0,0,5.5,400988254,2017-12-08
68,1,"10:29",1829,1829,"Shannon Evans II made Layup.",22,19,3,0.816775793539934,"Arizona State","St. John's",4,4,0,0,5.5,400988254,2017-12-08
69,1,"10:14",1814,1814,"Shamorie Ponds missed Three Point Jumper.",22,19,3,0.811861913841701,"Arizona State","St. John's",4,4,0,0,5.5,400988254,2017-12-08
70,1,"10:14",1814,1814,"Shannon Evans II Defensive Rebound.",22,19,3,0.811861913841701,"Arizona State","St. John's",4,4,0,0,5.5,400988254,2017-12-08
71,1,"9:51",1791,1791,"Foul on Bryan Trimble Jr..",22,19,3,0.796851506385858,"Arizona State","St. John's",4,4,0,0,5.5,400988254,2017-12-08
72,1,"9:51",1791,1791,"Romello White made Free Throw.",23,19,4,0.817096522336666,"Arizona State","St. John's",4,4,0,0,5.5,400988254,2017-12-08
73,1,"9:51",1791,1791,"Romello White made Free Throw.",24,19,5,0.83573988496198,"Arizona State","St. John's",4,4,0,0,5.5,400988254,2017-12-08
74,1,"9:28",1768,1768,"Foul on Amar Alibegovic.",24,19,5,0.848208898478999,"Arizona State","St. John's",4,4,0,0,5.5,400988254,2017-12-08
75,1,"9:28",1768,1768,"Amar Alibegovic Turnover.",24,19,5,0.848208898478999,"Arizona State","St. John's",4,4,0,0,5.5,400988254,2017-12-08
76,1,"9:12",1752,1752,"Tra Holder missed Jumper.",24,19,5,0.840717341746721,"Arizona State","St. John's",4,4,0,0,5.5,400988254,2017-12-08
77,1,"9:12",1752,1752,"Justin Simon Block.",24,19,5,0.840717341746721,"Arizona State","St. John's",4,4,0,0,5.5,400988254,2017-12-08
78,1,"9:12",1752,1752,"Arizona State Offensive Rebound.",24,19,5,0.840717341746721,"Arizona State","St. John's",4,4,0,0,5.5,400988254,2017-12-08
79,1,"8:58",1738,1738,"Tra Holder missed Layup.",24,19,5,0.845662476412652,"Arizona State","St. John's",4,4,0,0,5.5,400988254,2017-12-08
80,1,"8:58",1738,1738,"Arizona State Deadball Team Rebound.",24,19,5,0.845662476412652,"Arizona State","St. John's",4,4,0,0,5.5,400988254,2017-12-08
81,1,"8:58",1738,1738,"Arizona State  Turnover.",24,19,5,0.845662476412652,"Arizona State","St. John's",4,4,0,0,5.5,400988254,2017-12-08
82,1,"8:43",1723,1723,"Marvin Clark II made Three Point Jumper. Assisted by Shamorie Ponds.",24,22,2,0.777986273099914,"Arizona State","St. John's",4,4,0,0,5.5,400988254,2017-12-08
83,1,"8:29",1709,1709,"Shannon Evans II made Three Point Jumper. Assisted by Remy Martin.",27,22,5,0.832966883276234,"Arizona State","St. John's",4,4,0,0,5.5,400988254,2017-12-08
84,1,"8:04",1684,1684,"Foul on Bashir Ahmed.",27,22,5,0.854481781129949,"Arizona State","St. John's",4,4,0,0,5.5,400988254,2017-12-08
85,1,"8:04",1684,1684,"Bashir Ahmed Turnover.",27,22,5,0.854481781129949,"Arizona State","St. John's",4,4,0,0,5.5,400988254,2017-12-08
86,1,"7:50",1670,1670,"Foul on Amar Alibegovic.",27,22,5,0.847079969364204,"Arizona State","St. John's",4,4,0,0,5.5,400988254,2017-12-08
87,1,"7:50",1670,1670,"Official TV Timeout",27,22,5,0.847079969364204,"Arizona State","St. John's",4,4,0,0,5.5,400988254,2017-12-08
88,1,"7:50",1670,1670,"Shannon Evans II made Free Throw.",28,22,6,0.864179399672627,"Arizona State","St. John's",4,4,0,0,5.5,400988254,2017-12-08
89,1,"7:50",1670,1670,"Shannon Evans II made Free Throw.",29,22,7,0.87963846431399,"Arizona State","St. John's",4,4,0,0,5.5,400988254,2017-12-08
90,1,"7:32",1652,1652,"Justin Simon missed Three Point Jumper.",29,22,7,0.872403913905739,"Arizona State","St. John's",4,4,0,0,5.5,400988254,2017-12-08
91,1,"7:32",1652,1652,"Amar Alibegovic Offensive Rebound.",29,22,7,0.872403913905739,"Arizona State","St. John's",4,4,0,0,5.5,400988254,2017-12-08
92,1,"7:32",1652,1652,"Amar Alibegovic missed Two Point Tip Shot.",29,22,7,0.872403913905739,"Arizona State","St. John's",4,4,0,0,5.5,400988254,2017-12-08
93,1,"7:32",1652,1652,"Amar Alibegovic Offensive Rebound.",29,22,7,0.872403913905739,"Arizona State","St. John's",4,4,0,0,5.5,400988254,2017-12-08
94,1,"7:21",1641,1641,"Shamorie Ponds missed Jumper.",29,22,7,0.880568208757466,"Arizona State","St. John's",4,4,0,0,5.5,400988254,2017-12-08
95,1,"7:21",1641,1641,"Tra Holder Defensive Rebound.",29,22,7,0.880568208757466,"Arizona State","St. John's",4,4,0,0,5.5,400988254,2017-12-08
96,1,"7:07",1627,1627,"Tra Holder missed Layup.",29,22,7,0.876970996019907,"Arizona State","St. John's",4,4,0,0,5.5,400988254,2017-12-08
97,1,"7:07",1627,1627,"Bashir Ahmed Defensive Rebound.",29,22,7,0.876970996019907,"Arizona State","St. John's",4,4,0,0,5.5,400988254,2017-12-08
98,1,"7:00",1620,1620,"Bashir Ahmed missed Jumper.",29,22,7,0.876970996019907,"Arizona State","St. John's",4,4,0,0,5.5,400988254,2017-12-08
99,1,"7:00",1620,1620,"Tra Holder Defensive Rebound.",29,22,7,0.876970996019907,"Arizona State","St. John's",4,4,0,0,5.5,400988254,2017-12-08
100,1,"6:55",1615,1615,"Vitaliy Shibel made Three Point Jumper. Assisted by Shannon Evans II.",32,22,10,0.909476667174956,"Arizona State","St. John's",4,4,0,0,5.5,400988254,2017-12-08
101,1,"6:52",1612,1612,"St. John's  Timeout",32,22,10,0.909476667174956,"Arizona State","St. John's",4,3,0,1,5.5,400988254,2017-12-08
102,1,"6:37",1597,1597,"Marvin Clark II missed Three Point Jumper.",32,22,10,0.913067346198538,"Arizona State","St. John's",4,3,0,1,5.5,400988254,2017-12-08
103,1,"6:37",1597,1597,"Bashir Ahmed Offensive Rebound.",32,22,10,0.913067346198538,"Arizona State","St. John's",4,3,0,1,5.5,400988254,2017-12-08
104,1,"6:35",1595,1595,"Foul on Romello White.",32,22,10,0.913067346198538,"Arizona State","St. John's",4,3,0,1,5.5,400988254,2017-12-08
105,1,"6:29",1589,1589,"Foul on Vitaliy Shibel.",32,22,10,0.908941957941111,"Arizona State","St. John's",4,3,0,1,5.5,400988254,2017-12-08
106,1,"6:29",1589,1589,"Shamorie Ponds missed Free Throw.",32,22,10,0.908941957941111,"Arizona State","St. John's",4,3,0,1,5.5,400988254,2017-12-08
107,1,"6:29",1589,1589,"Remy Martin Defensive Rebound.",32,22,10,0.908941957941111,"Arizona State","St. John's",4,3,0,1,5.5,400988254,2017-12-08
108,1,"6:14",1574,1574,"Remy Martin missed Jumper.",32,22,10,0.927561066719867,"Arizona State","St. John's",4,3,0,1,5.5,400988254,2017-12-08
109,1,"6:14",1574,1574,"Bashir Ahmed Block.",32,22,10,0.927561066719867,"Arizona State","St. John's",4,3,0,1,5.5,400988254,2017-12-08
110,1,"6:14",1574,1574,"Arizona State Offensive Rebound.",32,22,10,0.927561066719867,"Arizona State","St. John's",4,3,0,1,5.5,400988254,2017-12-08
111,1,"6:06",1566,1566,"Kodi Justice made Three Point Jumper. Assisted by Shannon Evans II.",35,22,13,0.941223812791668,"Arizona State","St. John's",4,3,0,1,5.5,400988254,2017-12-08
112,1,"5:46",1546,1546,"Shamorie Ponds missed Jumper.",35,22,13,0.942993806011541,"Arizona State","St. John's",4,3,0,0,5.5,400988254,2017-12-08
113,1,"5:46",1546,1546,"Shannon Evans II Defensive Rebound.",35,22,13,0.942993806011541,"Arizona State","St. John's",4,3,0,0,5.5,400988254,2017-12-08
114,1,"5:31",1531,1531,"Kodi Justice made Jumper. Assisted by Tra Holder.",37,22,15,0.956425736439721,"Arizona State","St. John's",4,3,0,0,5.5,400988254,2017-12-08
115,1,"4:53",1493,1493,"Justin Simon missed Jumper.",37,22,15,0.957610973791538,"Arizona State","St. John's",4,3,0,0,5.5,400988254,2017-12-08
116,1,"4:53",1493,1493,"Tariq Owens Offensive Rebound.",37,22,15,0.957610973791538,"Arizona State","St. John's",4,3,0,0,5.5,400988254,2017-12-08
117,1,"4:53",1493,1493,"Tariq Owens made Two Point Tip Shot.",37,24,13,0.944723355341545,"Arizona State","St. John's",4,3,0,0,5.5,400988254,2017-12-08
118,1,"4:37",1477,1477,"Foul on Bashir Ahmed.",37,24,13,0.952887832862503,"Arizona State","St. John's",4,3,0,0,5.5,400988254,2017-12-08
119,1,"4:37",1477,1477,"Tra Holder made Free Throw.",38,24,14,0.959293511822053,"Arizona State","St. John's",4,3,0,0,5.5,400988254,2017-12-08
120,1,"4:37",1477,1477,"Tra Holder missed Free Throw.",38,24,14,0.959293511822053,"Arizona State","St. John's",4,3,0,0,5.5,400988254,2017-12-08
121,1,"4:37",1477,1477,"Marvin Clark II Defensive Rebound.",38,24,14,0.959293511822053,"Arizona State","St. John's",4,3,0,0,5.5,400988254,2017-12-08
122,1,"4:21",1461,1461,"Shamorie Ponds missed Jumper.",38,24,14,0.946439370454049,"Arizona State","St. John's",4,3,0,0,5.5,400988254,2017-12-08
123,1,"4:21",1461,1461,"Tra Holder Defensive Rebound.",38,24,14,0.946439370454049,"Arizona State","St. John's",4,3,0,0,5.5,400988254,2017-12-08
124,1,"3:58",1438,1438,"Foul on Bryan Trimble Jr..",38,24,14,0.954127110515994,"Arizona State","St. John's",4,3,0,0,5.5,400988254,2017-12-08
125,1,"3:58",1438,1438,"Official TV Timeout",38,24,14,0.954127110515994,"Arizona State","St. John's",4,3,0,0,5.5,400988254,2017-12-08
126,1,"3:58",1438,1438,"Kodi Justice made Free Throw.",39,24,15,0.960228778830883,"Arizona State","St. John's",4,3,0,0,5.5,400988254,2017-12-08
127,1,"3:58",1438,1438,"Kodi Justice made Free Throw.",40,24,16,0.96554815428859,"Arizona State","St. John's",4,3,0,0,5.5,400988254,2017-12-08
128,1,"3:47",1427,1427,"Shamorie Ponds made Jumper.",40,26,14,0.948029386934555,"Arizona State","St. John's",4,3,0,0,5.5,400988254,2017-12-08
129,1,"3:25",1405,1405,"Kodi Justice made Three Point Jumper. Assisted by Vitaliy Shibel.",43,26,17,0.974503576046852,"Arizona State","St. John's",4,3,0,0,5.5,400988254,2017-12-08
130,1,"3:10",1390,1390,"Shamorie Ponds missed Three Point Jumper.",43,26,17,0.972874795488659,"Arizona State","St. John's",4,3,0,0,5.5,400988254,2017-12-08
131,1,"3:10",1390,1390,"Arizona State Defensive Rebound.",43,26,17,0.972874795488659,"Arizona State","St. John's",4,3,0,0,5.5,400988254,2017-12-08
132,1,"3:08",1388,1388,"Foul on Tariq Owens.",43,26,17,0.971133215316417,"Arizona State","St. John's",4,3,0,0,5.5,400988254,2017-12-08
133,1,"3:08",1388,1388,"De'Quon Lake missed Free Throw.",43,26,17,0.971133215316417,"Arizona State","St. John's",4,3,0,0,5.5,400988254,2017-12-08
134,1,"3:08",1388,1388,"Arizona State Deadball Team Rebound.",43,26,17,0.971133215316417,"Arizona State","St. John's",4,3,0,0,5.5,400988254,2017-12-08
135,1,"3:08",1388,1388,"De'Quon Lake made Free Throw.",44,26,18,0.975040396175559,"Arizona State","St. John's",4,3,0,0,5.5,400988254,2017-12-08
136,1,"2:56",1376,1376,"Foul on Kassoum Yakwe.",44,26,18,0.970268529511769,"Arizona State","St. John's",4,3,0,0,5.5,400988254,2017-12-08
137,1,"2:56",1376,1376,"Kassoum Yakwe Turnover.",44,26,18,0.970268529511769,"Arizona State","St. John's",4,3,0,0,5.5,400988254,2017-12-08
138,1,"2:48",1368,1368,"Tra Holder missed Jumper.",44,26,18,0.975602022847323,"Arizona State","St. John's",4,3,0,0,5.5,400988254,2017-12-08
139,1,"2:48",1368,1368,"Justin Simon Defensive Rebound.",44,26,18,0.975602022847323,"Arizona State","St. John's",4,3,0,0,5.5,400988254,2017-12-08
140,1,"2:31",1351,1351,"Marvin Clark II made Three Point Jumper. Assisted by Shamorie Ponds.",44,29,15,0.964145315840852,"Arizona State","St. John's",4,3,0,0,5.5,400988254,2017-12-08
141,1,"2:15",1335,1335,"Shannon Evans II missed Three Point Jumper.",44,29,15,0.960196709903778,"Arizona State","St. John's",4,3,0,0,5.5,400988254,2017-12-08
142,1,"2:15",1335,1335,"Marvin Clark II Defensive Rebound.",44,29,15,0.960196709903778,"Arizona State","St. John's",4,3,0,0,5.5,400988254,2017-12-08
143,1,"1:58",1318,1318,"Shamorie Ponds missed Jumper.",44,29,15,0.965334356584804,"Arizona State","St. John's",4,3,0,0,5.5,400988254,2017-12-08
144,1,"1:58",1318,1318,"Kodi Justice Defensive Rebound.",44,29,15,0.965334356584804,"Arizona State","St. John's",4,3,0,0,5.5,400988254,2017-12-08
145,1,"1:36",1296,1296,"Kodi Justice missed Three Point Jumper.",44,29,15,0.969118898206159,"Arizona State","St. John's",4,3,0,0,5.5,400988254,2017-12-08
146,1,"1:36",1296,1296,"Shamorie Ponds Defensive Rebound.",44,29,15,0.969118898206159,"Arizona State","St. John's",4,3,0,0,5.5,400988254,2017-12-08
147,1,"1:32",1292,1292,"Shamorie Ponds missed Layup.",44,29,15,0.969118898206159,"Arizona State","St. John's",4,3,0,0,5.5,400988254,2017-12-08
148,1,"1:32",1292,1292,"Shannon Evans II Defensive Rebound.",44,29,15,0.969118898206159,"Arizona State","St. John's",4,3,0,0,5.5,400988254,2017-12-08
149,1,"1:25",1285,1285,"Tra Holder missed Three Point Jumper.",44,29,15,0.960241689959451,"Arizona State","St. John's",4,3,0,0,5.5,400988254,2017-12-08
150,1,"1:25",1285,1285,"Justin Simon Defensive Rebound.",44,29,15,0.960241689959451,"Arizona State","St. John's",4,3,0,0,5.5,400988254,2017-12-08
151,1,"1:10",1270,1270,"Foul on Marvin Clark II.",44,29,15,0.956642214568208,"Arizona State","St. John's",4,3,0,0,5.5,400988254,2017-12-08
152,1,"1:10",1270,1270,"Marvin Clark II Turnover.",44,29,15,0.956642214568208,"Arizona State","St. John's",4,3,0,0,5.5,400988254,2017-12-08
153,1,"0:59",1259,1259,"Foul on Justin Simon.",44,29,15,0.957695120381095,"Arizona State","St. John's",4,3,0,0,5.5,400988254,2017-12-08
154,1,"0:59",1259,1259,"Tra Holder made Free Throw.",45,29,16,0.963425600473388,"Arizona State","St. John's",4,3,0,0,5.5,400988254,2017-12-08
155,1,"0:59",1259,1259,"Tra Holder made Free Throw.",46,29,17,0.96840545658874,"Arizona State","St. John's",4,3,0,0,5.5,400988254,2017-12-08
156,1,"0:48",1248,1248,"Foul on Tra Holder.",46,29,17,0.97191981044989,"Arizona State","St. John's",4,3,0,0,5.5,400988254,2017-12-08
157,1,"0:48",1248,1248,"Justin Simon made Free Throw.",46,30,16,0.967370546521531,"Arizona State","St. John's",4,3,0,0,5.5,400988254,2017-12-08
158,1,"0:48",1248,1248,"Justin Simon made Free Throw.",46,31,15,0.962112988004056,"Arizona State","St. John's",4,3,0,0,5.5,400988254,2017-12-08
159,1,"0:35",1235,1235,"Kodi Justice missed Three Point Jumper.",46,31,15,0.962811955442175,"Arizona State","St. John's",4,3,0,0,5.5,400988254,2017-12-08
160,1,"0:35",1235,1235,"Justin Simon Defensive Rebound.",46,31,15,0.962811955442175,"Arizona State","St. John's",4,3,0,0,5.5,400988254,2017-12-08
161,1,"0:08",1208,1208,"Shamorie Ponds made Layup.",46,33,13,0.950529189687673,"Arizona State","St. John's",4,3,0,0,5.5,400988254,2017-12-08
162,1,"0:08",1208,1208,"Foul on Tra Holder.",46,33,13,0.950529189687673,"Arizona State","St. John's",4,3,0,0,5.5,400988254,2017-12-08
163,1,"0:08",1208,1208,"Shamorie Ponds made Free Throw.",46,34,12,0.942480190359118,"Arizona State","St. John's",4,3,0,0,5.5,400988254,2017-12-08
164,1,"0:03",1203,1203,"Shannon Evans II missed Jumper.",46,34,12,0.942480190359118,"Arizona State","St. John's",4,3,0,0,5.5,400988254,2017-12-08
165,1,"0:03",1203,1203,"Shamorie Ponds Defensive Rebound.",46,34,12,0.942480190359118,"Arizona State","St. John's",4,3,0,0,5.5,400988254,2017-12-08
166,1,"0:00",1200,1200,"End of 1st half",46,34,12,0.942480190359118,"Arizona State","St. John's",4,3,0,0,5.5,400988254,2017-12-08
167,2,"20:00",1200,1200,"PLAY",46,34,12,0.942480190359118,"Arizona State","St. John's",4,4,0,0,5.5,400988254,2017-12-08
168,2,"20:00",1200,1200,"Jump Ball won by St. John's",46,34,12,0.942480190359118,"Arizona State","St. John's",4,4,0,0,5.5,400988254,2017-12-08
169,2,"19:42",1182,1182,"Marvin Clark II made Three Point Jumper. Assisted by Justin Simon.",46,37,9,0.915135385370967,"Arizona State","St. John's",4,4,0,0,5.5,400988254,2017-12-08
170,2,"19:22",1162,1162,"Tra Holder Turnover.",46,37,9,0.91044450191627,"Arizona State","St. John's",4,4,0,0,5.5,400988254,2017-12-08
171,2,"19:22",1162,1162,"Justin Simon Steal.",46,37,9,0.91044450191627,"Arizona State","St. John's",4,4,0,0,5.5,400988254,2017-12-08
172,2,"19:12",1152,1152,"Tariq Owens made Layup. Assisted by Shamorie Ponds.",46,39,7,0.879558797136454,"Arizona State","St. John's",4,4,0,0,5.5,400988254,2017-12-08
173,2,"18:40",1120,1120,"Foul on Romello White.",46,39,7,0.89536890991385,"Arizona State","St. John's",4,4,0,0,5.5,400988254,2017-12-08
174,2,"18:40",1120,1120,"Romello White Turnover.",46,39,7,0.89536890991385,"Arizona State","St. John's",4,4,0,0,5.5,400988254,2017-12-08
175,2,"18:29",1109,1109,"Marvin Clark II missed Jumper.",46,39,7,0.883881690822366,"Arizona State","St. John's",4,4,0,0,5.5,400988254,2017-12-08
176,2,"18:29",1109,1109,"Bashir Ahmed Offensive Rebound.",46,39,7,0.883881690822366,"Arizona State","St. John's",4,4,0,0,5.5,400988254,2017-12-08
