"play_id","half","time_remaining_half","secs_remaining","secs_remaining_absolute","description","home_score","away_score","score_diff","win_prob","home","away","home_time_out_remaining","away_time_out_remaining","home_timeout_ind","away_timeout_ind","home_favored_by","game_id","date"
1,1,"20:00",2400,2400,"PLAY",0,0,0,0.911558296837893,"Tennessee","Furman",4,4,0,0,16,400987260,2017-12-20
2,1,"19:40",2380,2380,"Jordan Bone missed Three Point Jumper.",0,0,0,0.907700949963712,"Tennessee","Furman",4,4,0,0,16,400987260,2017-12-20
3,1,"19:40",2380,2380,"Furman Defensive Rebound.",0,0,0,0.907700949963712,"Tennessee","Furman",4,4,0,0,16,400987260,2017-12-20
4,1,"19:19",2359,2359,"Daniel Fowler missed Jumper.",0,0,0,0.907050377554714,"Tennessee","Furman",4,4,0,0,16,400987260,2017-12-20
5,1,"19:19",2359,2359,"Admiral Schofield Defensive Rebound.",0,0,0,0.907050377554714,"Tennessee","Furman",4,4,0,0,16,400987260,2017-12-20
6,1,"19:06",2346,2346,"Jordan Bowden made Three Point Jumper. Assisted by Admiral Schofield.",3,0,3,0.919118913055031,"Tennessee","Furman",4,4,0,0,16,400987260,2017-12-20
7,1,"18:39",2319,2319,"Andrew Brown Turnover.",3,0,3,0.915378649205223,"Tennessee","Furman",4,4,0,0,16,400987260,2017-12-20
8,1,"18:19",2299,2299,"Jordan Bowden missed Jumper.",3,0,3,0.923464455929899,"Tennessee","Furman",4,4,0,0,16,400987260,2017-12-20
9,1,"18:19",2299,2299,"Devin Sibley Block.",3,0,3,0.923464455929899,"Tennessee","Furman",4,4,0,0,16,400987260,2017-12-20
10,1,"18:17",2297,2297,"Jordan Bowden Offensive Rebound.",3,0,3,0.923464455929899,"Tennessee","Furman",4,4,0,0,16,400987260,2017-12-20
11,1,"18:11",2291,2291,"Grant Williams Turnover.",3,0,3,0.923464455929899,"Tennessee","Furman",4,4,0,0,16,400987260,2017-12-20
12,1,"18:10",2290,2290,"Andrew Brown Steal.",3,0,3,0.923464455929899,"Tennessee","Furman",4,4,0,0,16,400987260,2017-12-20
13,1,"17:52",2272,2272,"Matt Rafferty made Three Point Jumper. Assisted by Devin Sibley.",3,3,0,0.898587912665904,"Tennessee","Furman",4,4,0,0,16,400987260,2017-12-20
14,1,"17:22",2242,2242,"Grant Williams missed Jumper.",3,3,0,0.885754296557476,"Tennessee","Furman",4,4,0,0,16,400987260,2017-12-20
15,1,"17:22",2242,2242,"Daniel Fowler Defensive Rebound.",3,3,0,0.885754296557476,"Tennessee","Furman",4,4,0,0,16,400987260,2017-12-20
16,1,"17:13",2233,2233,"John Davis III missed Layup.",3,3,0,0.896294438885278,"Tennessee","Furman",4,4,0,0,16,400987260,2017-12-20
17,1,"17:13",2233,2233,"Admiral Schofield Defensive Rebound.",3,3,0,0.896294438885278,"Tennessee","Furman",4,4,0,0,16,400987260,2017-12-20
18,1,"17:04",2224,2224,"Admiral Schofield made Three Point Jumper. Assisted by Grant Williams.",6,3,3,0.92260137919959,"Tennessee","Furman",4,4,0,0,16,400987260,2017-12-20
19,1,"16:47",2207,2207,"Andrew Brown missed Three Point Jumper.",6,3,3,0.921871546037223,"Tennessee","Furman",4,4,0,0,16,400987260,2017-12-20
20,1,"16:47",2207,2207,"Kyle Alexander Defensive Rebound.",6,3,3,0.921871546037223,"Tennessee","Furman",4,4,0,0,16,400987260,2017-12-20
21,1,"16:31",2191,2191,"Jordan Bowden missed Three Point Jumper.",6,3,3,0.927759235558935,"Tennessee","Furman",4,4,0,0,16,400987260,2017-12-20
22,1,"16:31",2191,2191,"Kyle Alexander Offensive Rebound.",6,3,3,0.927759235558935,"Tennessee","Furman",4,4,0,0,16,400987260,2017-12-20
23,1,"16:08",2168,2168,"Foul on Devin Sibley.",6,3,3,0.918578469551907,"Tennessee","Furman",4,4,0,0,16,400987260,2017-12-20
24,1,"15:58",2158,2158,"Lamonte Turner missed Jumper.",6,3,3,0.920549672594378,"Tennessee","Furman",4,4,0,0,16,400987260,2017-12-20
25,1,"15:58",2158,2158,"Grant Williams Offensive Rebound.",6,3,3,0.920549672594378,"Tennessee","Furman",4,4,0,0,16,400987260,2017-12-20
26,1,"15:29",2129,2129,"Chris Darrington missed Jumper.",6,3,3,0.919061390603368,"Tennessee","Furman",4,4,0,0,16,400987260,2017-12-20
27,1,"15:29",2129,2129,"Geoff Beans Defensive Rebound.",6,3,3,0.919061390603368,"Tennessee","Furman",4,4,0,0,16,400987260,2017-12-20
28,1,"14:58",2098,2098,"Devin Sibley missed Three Point Jumper.",6,3,3,0.916507018984253,"Tennessee","Furman",4,4,0,0,16,400987260,2017-12-20
29,1,"14:58",2098,2098,"Kyle Alexander Defensive Rebound.",6,3,3,0.916507018984253,"Tennessee","Furman",4,4,0,0,16,400987260,2017-12-20
30,1,"14:43",2083,2083,"Grant Williams missed Layup.",6,3,3,0.915497009479227,"Tennessee","Furman",4,4,0,0,16,400987260,2017-12-20
31,1,"14:43",2083,2083,"Furman Defensive Rebound.",6,3,3,0.915497009479227,"Tennessee","Furman",4,4,0,0,16,400987260,2017-12-20
32,1,"14:42",2082,2082,"Official TV Timeout",6,3,3,0.915497009479227,"Tennessee","Furman",4,4,0,0,16,400987260,2017-12-20
33,1,"14:19",2059,2059,"Jordan Lyons made Three Point Jumper. Assisted by Daniel Fowler.",6,6,0,0.897153153740463,"Tennessee","Furman",4,4,0,0,16,400987260,2017-12-20
34,1,"13:53",2033,2033,"Foul on Alex Hunter.",6,6,0,0.899828782355371,"Tennessee","Furman",4,4,0,0,16,400987260,2017-12-20
35,1,"13:53",2033,2033,"Derrick Walker missed Free Throw.",6,6,0,0.899828782355371,"Tennessee","Furman",4,4,0,0,16,400987260,2017-12-20
36,1,"13:53",2033,2033,"Tennessee Deadball Team Rebound.",6,6,0,0.899828782355371,"Tennessee","Furman",4,4,0,0,16,400987260,2017-12-20
37,1,"13:53",2033,2033,"Derrick Walker missed Free Throw.",6,6,0,0.899828782355371,"Tennessee","Furman",4,4,0,0,16,400987260,2017-12-20
38,1,"13:53",2033,2033,"Jordan Lyons Defensive Rebound.",6,6,0,0.899828782355371,"Tennessee","Furman",4,4,0,0,16,400987260,2017-12-20
39,1,"13:25",2005,2005,"Daniel Fowler missed Three Point Jumper.",6,6,0,0.883769241977802,"Tennessee","Furman",4,4,0,0,16,400987260,2017-12-20
40,1,"13:25",2005,2005,"Jalen Williams Offensive Rebound.",6,6,0,0.883769241977802,"Tennessee","Furman",4,4,0,0,16,400987260,2017-12-20
41,1,"13:23",2003,2003,"Foul on John Fulkerson.",6,6,0,0.883769241977802,"Tennessee","Furman",4,4,0,0,16,400987260,2017-12-20
42,1,"13:08",1988,1988,"Alex Hunter missed Three Point Jumper.",6,6,0,0.873832950528166,"Tennessee","Furman",4,4,0,0,16,400987260,2017-12-20
43,1,"13:08",1988,1988,"Chris Darrington Defensive Rebound.",6,6,0,0.873832950528166,"Tennessee","Furman",4,4,0,0,16,400987260,2017-12-20
44,1,"12:55",1975,1975,"John Fulkerson made Jumper. Assisted by Lamonte Turner.",8,6,2,0.915051561617481,"Tennessee","Furman",4,4,0,0,16,400987260,2017-12-20
45,1,"12:34",1954,1954,"Devin Sibley made Jumper.",8,8,0,0.881758054149248,"Tennessee","Furman",4,4,0,0,16,400987260,2017-12-20
46,1,"12:34",1954,1954,"Foul on James Daniel III.",8,8,0,0.881758054149248,"Tennessee","Furman",4,4,0,0,16,400987260,2017-12-20
47,1,"12:34",1954,1954,"Devin Sibley made Free Throw.",8,9,-1,0.868086169803864,"Tennessee","Furman",4,4,0,0,16,400987260,2017-12-20
48,1,"12:18",1938,1938,"Lamonte Turner missed Three Point Jumper.",8,9,-1,0.861936983145162,"Tennessee","Furman",4,4,0,0,16,400987260,2017-12-20
49,1,"12:18",1938,1938,"Furman Defensive Rebound.",8,9,-1,0.861936983145162,"Tennessee","Furman",4,4,0,0,16,400987260,2017-12-20
50,1,"11:57",1917,1917,"Devin Sibley missed Three Point Jumper.",8,9,-1,0.875379156773771,"Tennessee","Furman",4,4,0,0,16,400987260,2017-12-20
51,1,"11:57",1917,1917,"John Fulkerson Defensive Rebound.",8,9,-1,0.875379156773771,"Tennessee","Furman",4,4,0,0,16,400987260,2017-12-20
52,1,"11:44",1904,1904,"Official TV Timeout",8,9,-1,0.873062357872395,"Tennessee","Furman",4,4,0,0,16,400987260,2017-12-20
53,1,"11:32",1892,1892,"Foul on Matt Rafferty.",8,9,-1,0.863536657097811,"Tennessee","Furman",4,4,0,0,16,400987260,2017-12-20
54,1,"11:32",1892,1892,"John Fulkerson made Free Throw.",9,9,0,0.878613716555136,"Tennessee","Furman",4,4,0,0,16,400987260,2017-12-20
55,1,"11:32",1892,1892,"John Fulkerson made Free Throw.",10,9,1,0.892232882192105,"Tennessee","Furman",4,4,0,0,16,400987260,2017-12-20
56,1,"11:14",1874,1874,"John Davis III missed Three Point Jumper.",10,9,1,0.89199675192637,"Tennessee","Furman",4,4,0,0,16,400987260,2017-12-20
57,1,"11:14",1874,1874,"John Fulkerson Defensive Rebound.",10,9,1,0.89199675192637,"Tennessee","Furman",4,4,0,0,16,400987260,2017-12-20
58,1,"11:06",1866,1866,"Jordan Bowden made Layup. Assisted by Jordan Bone.",12,9,3,0.914201582568357,"Tennessee","Furman",4,4,0,0,16,400987260,2017-12-20
59,1,"10:44",1844,1844,"Foul on Grant Williams.",12,9,3,0.911404431609619,"Tennessee","Furman",4,4,0,0,16,400987260,2017-12-20
60,1,"10:44",1844,1844,"Matt Rafferty made Free Throw.",12,10,2,0.900880632572457,"Tennessee","Furman",4,4,0,0,16,400987260,2017-12-20
61,1,"10:44",1844,1844,"Matt Rafferty made Free Throw.",12,11,1,0.88925865799664,"Tennessee","Furman",4,4,0,0,16,400987260,2017-12-20
62,1,"10:21",1821,1821,"Admiral Schofield missed Jumper.",12,11,1,0.901918064324546,"Tennessee","Furman",4,4,0,0,16,400987260,2017-12-20
63,1,"10:21",1821,1821,"Grant Williams Offensive Rebound.",12,11,1,0.901918064324546,"Tennessee","Furman",4,4,0,0,16,400987260,2017-12-20
64,1,"10:10",1810,1810,"Grant Williams Turnover.",12,11,1,0.892469778956291,"Tennessee","Furman",4,4,0,0,16,400987260,2017-12-20
65,1,"10:09",1809,1809,"Andrew Brown Steal.",12,11,1,0.89129227955933,"Tennessee","Furman",4,4,0,0,16,400987260,2017-12-20
66,1,"10:06",1806,1806,"Andrew Brown made Three Point Jumper. Assisted by Daniel Fowler.",12,14,-2,0.847907890609515,"Tennessee","Furman",4,4,0,0,16,400987260,2017-12-20
67,1,"9:48",1788,1788,"Foul on Admiral Schofield.",12,14,-2,0.823033897126344,"Tennessee","Furman",4,4,0,0,16,400987260,2017-12-20
68,1,"9:48",1788,1788,"Admiral Schofield Turnover.",12,14,-2,0.823033897126344,"Tennessee","Furman",4,4,0,0,16,400987260,2017-12-20
69,1,"9:33",1773,1773,"John Davis III made Layup.",12,16,-4,0.80429923731884,"Tennessee","Furman",4,4,0,0,16,400987260,2017-12-20
70,1,"9:22",1762,1762,"Jordan Bone missed Layup.",12,16,-4,0.82185797955133,"Tennessee","Furman",4,4,0,0,16,400987260,2017-12-20
71,1,"9:22",1762,1762,"Devin Sibley Defensive Rebound.",12,16,-4,0.82185797955133,"Tennessee","Furman",4,4,0,0,16,400987260,2017-12-20
72,1,"9:14",1754,1754,"Devin Sibley missed Three Point Jumper.",12,16,-4,0.801611711435931,"Tennessee","Furman",4,4,0,0,16,400987260,2017-12-20
73,1,"9:14",1754,1754,"Tennessee Defensive Rebound.",12,16,-4,0.801611711435931,"Tennessee","Furman",4,4,0,0,16,400987260,2017-12-20
74,1,"8:53",1733,1733,"Admiral Schofield missed Jumper.",12,16,-4,0.802057615636812,"Tennessee","Furman",4,4,0,0,16,400987260,2017-12-20
75,1,"8:53",1733,1733,"Jordan Bowden Offensive Rebound.",12,16,-4,0.802057615636812,"Tennessee","Furman",4,4,0,0,16,400987260,2017-12-20
76,1,"8:48",1728,1728,"Foul on Geoff Beans.",12,16,-4,0.781043622423143,"Tennessee","Furman",4,4,0,0,16,400987260,2017-12-20
77,1,"8:48",1728,1728,"Jordan Bowden missed Free Throw.",12,16,-4,0.781043622423143,"Tennessee","Furman",4,4,0,0,16,400987260,2017-12-20
78,1,"8:48",1728,1728,"Tennessee Deadball Team Rebound.",12,16,-4,0.781043622423143,"Tennessee","Furman",4,4,0,0,16,400987260,2017-12-20
79,1,"8:48",1728,1728,"Jordan Bowden missed Free Throw.",12,16,-4,0.781043622423143,"Tennessee","Furman",4,4,0,0,16,400987260,2017-12-20
80,1,"8:48",1728,1728,"Matt Rafferty Defensive Rebound.",12,16,-4,0.781043622423143,"Tennessee","Furman",4,4,0,0,16,400987260,2017-12-20
81,1,"8:38",1718,1718,"Jordan Lyons missed Three Point Jumper.",12,16,-4,0.815327228419464,"Tennessee","Furman",4,4,0,0,16,400987260,2017-12-20
82,1,"8:38",1718,1718,"Lamonte Turner Defensive Rebound.",12,16,-4,0.815327228419464,"Tennessee","Furman",4,4,0,0,16,400987260,2017-12-20
83,1,"8:36",1716,1716,"Foul on Geoff Beans.",12,16,-4,0.815327228419464,"Tennessee","Furman",4,4,0,0,16,400987260,2017-12-20
84,1,"8:20",1700,1700,"James Daniel III missed Three Point Jumper.",12,16,-4,0.799329425877699,"Tennessee","Furman",4,4,0,0,16,400987260,2017-12-20
85,1,"8:20",1700,1700,"Devin Sibley Defensive Rebound.",12,16,-4,0.799329425877699,"Tennessee","Furman",4,4,0,0,16,400987260,2017-12-20
86,1,"8:09",1689,1689,"Geoff Beans made Three Point Jumper. Assisted by Matt Rafferty.",12,19,-7,0.728325721527413,"Tennessee","Furman",4,4,0,0,16,400987260,2017-12-20
87,1,"7:51",1671,1671,"Grant Williams made Jumper. Assisted by James Daniel III.",14,19,-5,0.776707336992697,"Tennessee","Furman",4,4,0,0,16,400987260,2017-12-20
88,1,"7:15",1635,1635,"Geoff Beans missed Three Point Jumper.",14,19,-5,0.776064581721036,"Tennessee","Furman",4,4,0,0,16,400987260,2017-12-20
89,1,"7:15",1635,1635,"Geoff Beans Offensive Rebound.",14,19,-5,0.776064581721036,"Tennessee","Furman",4,4,0,0,16,400987260,2017-12-20
90,1,"7:12",1632,1632,"Devin Sibley missed Jumper.",14,19,-5,0.776064581721036,"Tennessee","Furman",4,4,0,0,16,400987260,2017-12-20
91,1,"7:12",1632,1632,"Admiral Schofield Defensive Rebound.",14,19,-5,0.776064581721036,"Tennessee","Furman",4,4,0,0,16,400987260,2017-12-20
92,1,"7:03",1623,1623,"Jordan Bowden made Three Point Jumper. Assisted by Admiral Schofield.",17,19,-2,0.832331629876716,"Tennessee","Furman",4,4,0,0,16,400987260,2017-12-20
93,1,"6:35",1595,1595,"Matt Rafferty Turnover.",17,19,-2,0.82864688782251,"Tennessee","Furman",4,4,0,0,16,400987260,2017-12-20
94,1,"6:35",1595,1595,"Official TV Timeout",17,19,-2,0.82864688782251,"Tennessee","Furman",4,4,0,0,16,400987260,2017-12-20
95,1,"6:21",1581,1581,"Lamonte Turner Turnover.",17,19,-2,0.830833042556087,"Tennessee","Furman",4,4,0,0,16,400987260,2017-12-20
96,1,"6:20",1580,1580,"John Davis III Steal.",17,19,-2,0.830833042556087,"Tennessee","Furman",4,4,0,0,16,400987260,2017-12-20
97,1,"6:19",1579,1579,"John Davis III missed Layup.",17,19,-2,0.829256325486617,"Tennessee","Furman",4,4,0,0,16,400987260,2017-12-20
98,1,"6:19",1579,1579,"James Daniel III Defensive Rebound.",17,19,-2,0.829256325486617,"Tennessee","Furman",4,4,0,0,16,400987260,2017-12-20
99,1,"5:53",1553,1553,"John Fulkerson missed Jumper.",17,19,-2,0.81643211550962,"Tennessee","Furman",4,4,0,0,16,400987260,2017-12-20
100,1,"5:53",1553,1553,"Jalen Williams Defensive Rebound.",17,19,-2,0.81643211550962,"Tennessee","Furman",4,4,0,0,16,400987260,2017-12-20
101,1,"5:36",1536,1536,"Jalen Williams missed Layup.",17,19,-2,0.833883831270439,"Tennessee","Furman",4,4,0,0,16,400987260,2017-12-20
102,1,"5:36",1536,1536,"Kyle Alexander Defensive Rebound.",17,19,-2,0.833883831270439,"Tennessee","Furman",4,4,0,0,16,400987260,2017-12-20
103,1,"5:24",1524,1524,"James Daniel III made Jumper.",19,19,0,0.85995096566703,"Tennessee","Furman",4,4,0,0,16,400987260,2017-12-20
104,1,"5:04",1504,1504,"Jalen Williams Turnover.",19,19,0,0.862298136794386,"Tennessee","Furman",4,4,0,0,16,400987260,2017-12-20
105,1,"5:03",1503,1503,"John Fulkerson Steal.",19,19,0,0.862298136794386,"Tennessee","Furman",4,4,0,0,16,400987260,2017-12-20
106,1,"5:01",1501,1501,"Foul on Daniel Fowler.",19,19,0,0.862298136794386,"Tennessee","Furman",4,4,1,0,16,400987260,2017-12-20
107,1,"5:01",1501,1501,"Furman  Timeout",19,19,0,0.862298136794386,"Tennessee","Furman",3,4,1,0,16,400987260,2017-12-20
108,1,"5:01",1501,1501,"Jordan Bowden missed Free Throw.",19,19,0,0.862298136794386,"Tennessee","Furman",3,4,1,0,16,400987260,2017-12-20
109,1,"5:01",1501,1501,"Tennessee Deadball Team Rebound.",19,19,0,0.862298136794386,"Tennessee","Furman",3,4,1,0,16,400987260,2017-12-20
110,1,"5:01",1501,1501,"Jordan Bowden made Free Throw.",20,19,1,0.87835967978402,"Tennessee","Furman",3,4,1,0,16,400987260,2017-12-20
111,1,"4:48",1488,1488,"Foul on John Fulkerson.",20,19,1,0.875694590063809,"Tennessee","Furman",3,4,1,0,16,400987260,2017-12-20
112,1,"4:37",1477,1477,"Daniel Fowler made Three Point Jumper. Assisted by Matt Rafferty.",20,22,-2,0.84096450357808,"Tennessee","Furman",3,4,1,0,16,400987260,2017-12-20
113,1,"4:21",1461,1461,"Admiral Schofield missed Three Point Jumper.",20,22,-2,0.804137412193273,"Tennessee","Furman",3,4,1,0,16,400987260,2017-12-20
114,1,"4:21",1461,1461,"Tennessee Offensive Rebound.",20,22,-2,0.804137412193273,"Tennessee","Furman",3,4,1,0,16,400987260,2017-12-20
115,1,"4:05",1445,1445,"Jordan Bone missed Jumper.",20,22,-2,0.827951413282395,"Tennessee","Furman",3,4,1,0,16,400987260,2017-12-20
116,1,"4:05",1445,1445,"John Davis III Defensive Rebound.",20,22,-2,0.827951413282395,"Tennessee","Furman",3,4,1,0,16,400987260,2017-12-20
117,1,"3:57",1437,1437,"John Davis III missed Three Point Jumper.",20,22,-2,0.810819510871266,"Tennessee","Furman",3,4,0,0,16,400987260,2017-12-20
118,1,"3:57",1437,1437,"Admiral Schofield Defensive Rebound.",20,22,-2,0.810819510871266,"Tennessee","Furman",3,4,0,0,16,400987260,2017-12-20
119,1,"3:49",1429,1429,"Jordan Bone missed Layup.",20,22,-2,0.803488819884142,"Tennessee","Furman",3,4,0,0,16,400987260,2017-12-20
120,1,"3:49",1429,1429,"Admiral Schofield Offensive Rebound.",20,22,-2,0.803488819884142,"Tennessee","Furman",3,4,0,0,16,400987260,2017-12-20
121,1,"3:46",1426,1426,"Admiral Schofield made Jumper.",22,22,0,0.845238003909709,"Tennessee","Furman",3,4,0,0,16,400987260,2017-12-20
122,1,"3:15",1395,1395,"Daniel Fowler made Jumper.",22,24,-2,0.826998746792312,"Tennessee","Furman",3,4,0,0,16,400987260,2017-12-20
123,1,"3:04",1384,1384,"Admiral Schofield missed Jumper.",22,24,-2,0.820364751985643,"Tennessee","Furman",3,4,0,0,16,400987260,2017-12-20
124,1,"3:04",1384,1384,"Devin Sibley Defensive Rebound.",22,24,-2,0.820364751985643,"Tennessee","Furman",3,4,0,0,16,400987260,2017-12-20
125,1,"2:59",1379,1379,"Foul on James Daniel III.",22,24,-2,0.811082427890767,"Tennessee","Furman",3,4,0,0,16,400987260,2017-12-20
126,1,"2:59",1379,1379,"Official TV Timeout",22,24,-2,0.811082427890767,"Tennessee","Furman",3,4,0,0,16,400987260,2017-12-20
127,1,"2:54",1374,1374,"Daniel Fowler Turnover.",22,24,-2,0.811082427890767,"Tennessee","Furman",3,4,0,0,16,400987260,2017-12-20
128,1,"2:53",1373,1373,"Chris Darrington Steal.",22,24,-2,0.811082427890767,"Tennessee","Furman",3,4,0,0,16,400987260,2017-12-20
129,1,"2:51",1371,1371,"Lamonte Turner made Layup. Assisted by Jordan Bowden.",24,24,0,0.851418407829871,"Tennessee","Furman",3,4,0,0,16,400987260,2017-12-20
130,1,"2:30",1350,1350,"Daniel Fowler missed Three Point Jumper.",24,24,0,0.858368742906239,"Tennessee","Furman",3,4,0,0,16,400987260,2017-12-20
131,1,"2:30",1350,1350,"Admiral Schofield Defensive Rebound.",24,24,0,0.858368742906239,"Tennessee","Furman",3,4,0,0,16,400987260,2017-12-20
132,1,"2:18",1338,1338,"Jordan Bowden made Jumper. Assisted by Lamonte Turner.",26,24,2,0.878213427864841,"Tennessee","Furman",3,4,0,0,16,400987260,2017-12-20
133,1,"2:18",1338,1338,"Foul on Devin Sibley.",26,24,2,0.878213427864841,"Tennessee","Furman",3,4,0,0,16,400987260,2017-12-20
134,1,"2:18",1338,1338,"Jordan Bowden made Free Throw.",27,24,3,0.893898158610825,"Tennessee","Furman",3,4,0,0,16,400987260,2017-12-20
135,1,"2:02",1322,1322,"Foul on Jordan Bowden.",27,24,3,0.901417984133749,"Tennessee","Furman",3,4,0,0,16,400987260,2017-12-20
136,1,"2:02",1322,1322,"Jordan Lyons made Free Throw.",27,25,2,0.88649966469499,"Tennessee","Furman",3,4,0,0,16,400987260,2017-12-20
137,1,"2:02",1322,1322,"Jordan Lyons made Free Throw.",27,26,1,0.869650227795175,"Tennessee","Furman",3,4,0,0,16,400987260,2017-12-20
138,1,"1:44",1304,1304,"Lamonte Turner missed Three Point Jumper.",27,26,1,0.856945704565569,"Tennessee","Furman",3,4,0,0,16,400987260,2017-12-20
139,1,"1:44",1304,1304,"Jordan Bowden Offensive Rebound.",27,26,1,0.856945704565569,"Tennessee","Furman",3,4,0,0,16,400987260,2017-12-20
140,1,"1:38",1298,1298,"Jordan Bowden Turnover.",27,26,1,0.863617621555616,"Tennessee","Furman",3,4,0,0,16,400987260,2017-12-20
141,1,"1:38",1298,1298,"Andrew Brown Steal.",27,26,1,0.863617621555616,"Tennessee","Furman",3,4,0,0,16,400987260,2017-12-20
142,1,"1:07",1267,1267,"Furman  Turnover.",27,26,1,0.878143027266977,"Tennessee","Furman",3,4,0,0,16,400987260,2017-12-20
143,1,"0:53",1253,1253,"Grant Williams missed Layup.",27,26,1,0.852881385068236,"Tennessee","Furman",3,4,0,0,16,400987260,2017-12-20
144,1,"0:53",1253,1253,"Matt Rafferty Defensive Rebound.",27,26,1,0.852881385068236,"Tennessee","Furman",3,4,0,0,16,400987260,2017-12-20
145,1,"0:29",1229,1229,"Andrew Brown missed Three Point Jumper.",27,26,1,0.865825081276187,"Tennessee","Furman",3,4,0,0,16,400987260,2017-12-20
146,1,"0:29",1229,1229,"Lamonte Turner Defensive Rebound.",27,26,1,0.865825081276187,"Tennessee","Furman",3,4,0,0,16,400987260,2017-12-20
147,1,"0:19",1219,1219,"Lamonte Turner made Jumper. Assisted by Jordan Bowden.",29,26,3,0.89232123558687,"Tennessee","Furman",3,4,0,0,16,400987260,2017-12-20
148,1,"0:04",1204,1204,"John Davis III missed Jumper.",29,26,3,0.897182543746934,"Tennessee","Furman",3,4,0,0,16,400987260,2017-12-20
149,1,"0:04",1204,1204,"Lamonte Turner Defensive Rebound.",29,26,3,0.897182543746934,"Tennessee","Furman",3,4,0,0,16,400987260,2017-12-20
150,1,"0:00",1200,1200,"End of 1st half",29,26,3,0.897182543746934,"Tennessee","Furman",3,4,0,0,16,400987260,2017-12-20
151,2,"20:00",1200,1200,"PLAY",29,26,3,0.897182543746934,"Tennessee","Furman",4,4,0,0,16,400987260,2017-12-20
152,2,"19:48",1188,1188,"Admiral Schofield made Jumper. Assisted by Grant Williams.",31,26,5,0.925852871597449,"Tennessee","Furman",4,4,0,0,16,400987260,2017-12-20
153,2,"19:23",1163,1163,"John Davis III missed Jumper.",31,26,5,0.923738164218784,"Tennessee","Furman",4,4,0,0,16,400987260,2017-12-20
154,2,"19:23",1163,1163,"Admiral Schofield Defensive Rebound.",31,26,5,0.923738164218784,"Tennessee","Furman",4,4,0,0,16,400987260,2017-12-20
155,2,"19:14",1154,1154,"Admiral Schofield missed Three Point Jumper.",31,26,5,0.9179244788441,"Tennessee","Furman",4,4,0,0,16,400987260,2017-12-20
156,2,"19:14",1154,1154,"Jordan Bowden Offensive Rebound.",31,26,5,0.9179244788441,"Tennessee","Furman",4,4,0,0,16,400987260,2017-12-20
157,2,"19:07",1147,1147,"Jordan Bowden made Three Point Jumper.",34,26,8,0.949488883553917,"Tennessee","Furman",4,4,0,0,16,400987260,2017-12-20
158,2,"18:46",1126,1126,"Matt Rafferty Turnover.",34,26,8,0.957493015349528,"Tennessee","Furman",4,4,0,0,16,400987260,2017-12-20
159,2,"18:44",1124,1124,"Admiral Schofield Steal.",34,26,8,0.957493015349528,"Tennessee","Furman",4,4,0,0,16,400987260,2017-12-20
160,2,"18:42",1122,1122,"Admiral Schofield Turnover.",34,26,8,0.957493015349528,"Tennessee","Furman",4,4,0,0,16,400987260,2017-12-20
161,2,"18:41",1121,1121,"Devin Sibley Steal.",34,26,8,0.957493015349528,"Tennessee","Furman",4,4,0,0,16,400987260,2017-12-20
162,2,"18:39",1119,1119,"Devin Sibley missed Jumper.",34,26,8,0.95032617253713,"Tennessee","Furman",4,4,0,0,16,400987260,2017-12-20
163,2,"18:39",1119,1119,"Daniel Fowler Offensive Rebound.",34,26,8,0.95032617253713,"Tennessee","Furman",4,4,0,0,16,400987260,2017-12-20
164,2,"18:12",1092,1092,"Devin Sibley made Jumper.",34,28,6,0.938175841333764,"Tennessee","Furman",4,4,0,0,16,400987260,2017-12-20
165,2,"18:06",1086,1086,"Jordan Bowden missed Layup.",34,28,6,0.94024042351528,"Tennessee","Furman",4,4,0,0,16,400987260,2017-12-20
166,2,"18:06",1086,1086,"Matt Rafferty Defensive Rebound.",34,28,6,0.94024042351528,"Tennessee","Furman",4,4,0,0,16,400987260,2017-12-20
167,2,"17:59",1079,1079,"Devin Sibley Turnover.",34,28,6,0.929562093164028,"Tennessee","Furman",4,4,0,0,16,400987260,2017-12-20
168,2,"17:47",1067,1067,"Grant Williams made Layup. Assisted by Admiral Schofield.",36,28,8,0.950374334570467,"Tennessee","Furman",4,4,0,0,16,400987260,2017-12-20
169,2,"17:31",1051,1051,"Andrew Brown missed Three Point Jumper.",36,28,8,0.955194035504047,"Tennessee","Furman",4,4,0,0,16,400987260,2017-12-20
170,2,"17:31",1051,1051,"Grant Williams Defensive Rebound.",36,28,8,0.955194035504047,"Tennessee","Furman",4,4,0,0,16,400987260,2017-12-20
171,2,"17:21",1041,1041,"Foul on John Davis III.",36,28,8,0.955558496801095,"Tennessee","Furman",4,4,1,0,16,400987260,2017-12-20
172,2,"17:21",1041,1041,"Furman  Timeout",36,28,8,0.955558496801095,"Tennessee","Furman",3,4,1,0,16,400987260,2017-12-20
173,2,"17:21",1041,1041,"Official TV Timeout",36,28,8,0.955558496801095,"Tennessee","Furman",3,4,1,0,16,400987260,2017-12-20
174,2,"17:21",1041,1041,"Kyle Alexander made Free Throw.",37,28,9,0.962432027725144,"Tennessee","Furman",3,4,1,0,16,400987260,2017-12-20
175,2,"17:21",1041,1041,"Kyle Alexander made Free Throw.",38,28,10,0.96827775829086,"Tennessee","Furman",3,4,1,0,16,400987260,2017-12-20
176,2,"17:08",1028,1028,"Foul on Admiral Schofield.",38,28,10,0.967498409417447,"Tennessee","Furman",3,4,1,0,16,400987260,2017-12-20
177,2,"16:51",1011,1011,"Devin Sibley made Layup.",38,30,8,0.947682688685019,"Tennessee","Furman",3,4,1,0,16,400987260,2017-12-20
178,2,"16:42",1002,1002,"Lamonte Turner missed Three Point Jumper.",38,30,8,0.950568144644392,"Tennessee","Furman",3,4,1,0,16,400987260,2017-12-20
179,2,"16:42",1002,1002,"Devin Sibley Defensive Rebound.",38,30,8,0.950568144644392,"Tennessee","Furman",3,4,1,0,16,400987260,2017-12-20
180,2,"16:28",988,988,"Foul on Devin Sibley.",38,30,8,0.956460286194767,"Tennessee","Furman",3,4,1,0,16,400987260,2017-12-20
181,2,"16:28",988,988,"Devin Sibley Turnover.",38,30,8,0.956460286194767,"Tennessee","Furman",3,4,1,0,16,400987260,2017-12-20
182,2,"16:14",974,974,"John Fulkerson missed Jumper.",38,30,8,0.954673769398165,"Tennessee","Furman",3,4,0,0,16,400987260,2017-12-20
183,2,"16:14",974,974,"Grant Williams Offensive Rebound.",38,30,8,0.954673769398165,"Tennessee","Furman",3,4,0,0,16,400987260,2017-12-20
184,2,"16:01",961,961,"Grant Williams made Layup. Assisted by James Daniel III.",40,30,10,0.963832220558123,"Tennessee","Furman",3,4,0,0,16,400987260,2017-12-20
185,2,"15:38",938,938,"Devin Sibley made Layup.",40,32,8,0.953508396245637,"Tennessee","Furman",3,4,0,0,16,400987260,2017-12-20
186,2,"15:29",929,929,"Grant Williams made Layup. Assisted by James Daniel III.",42,32,10,0.965143611702348,"Tennessee","Furman",3,4,0,0,16,400987260,2017-12-20
187,2,"15:08",908,908,"Devin Sibley made Three Point Jumper. Assisted by Matt Rafferty.",42,35,7,0.942382058123277,"Tennessee","Furman",3,4,0,0,16,400987260,2017-12-20
188,2,"14:36",876,876,"James Daniel III missed Jumper.",42,35,7,0.945641668291011,"Tennessee","Furman",3,4,0,0,16,400987260,2017-12-20
