"play_id","half","time_remaining_half","secs_remaining","secs_remaining_absolute","description","home_score","away_score","score_diff","win_prob","home","away","home_time_out_remaining","away_time_out_remaining","home_timeout_ind","away_timeout_ind","home_favored_by","game_id","date"
1,1,"20:00",2400,2400,"PLAY",0,0,0,0.834331373184416,"Santa Clara","San José St",4,4,0,0,8,400987092,2017-12-21
2,1,"19:45",2385,2385,"Isaiah Nichols Turnover.",0,0,0,0.830110427792434,"Santa Clara","San José St",4,4,0,0,8,400987092,2017-12-21
3,1,"19:44",2384,2384,"Emmanuel Ndumanya Steal.",0,0,0,0.830110427792434,"Santa Clara","San José St",4,4,0,0,8,400987092,2017-12-21
4,1,"19:35",2375,2375,"Matt Hauser missed Three Point Jumper.",0,0,0,0.827610358429079,"Santa Clara","San José St",4,4,0,0,8,400987092,2017-12-21
5,1,"19:35",2375,2375,"Emmanuel Ndumanya Offensive Rebound.",0,0,0,0.827610358429079,"Santa Clara","San José St",4,4,0,0,8,400987092,2017-12-21
6,1,"19:11",2351,2351,"KJ Feagin missed Three Point Jumper.",0,0,0,0.832508605971762,"Santa Clara","San José St",4,4,0,0,8,400987092,2017-12-21
7,1,"19:11",2351,2351,"Ashtin Chastain Defensive Rebound.",0,0,0,0.832508605971762,"Santa Clara","San José St",4,4,0,0,8,400987092,2017-12-21
8,1,"18:57",2337,2337,"Keith Fisher III made Layup. Assisted by Noah Baumann.",0,2,-2,0.794155575829907,"Santa Clara","San José St",4,4,0,0,8,400987092,2017-12-21
9,1,"18:34",2314,2314,"Henry Caruso missed Three Point Jumper.",0,2,-2,0.776725428026003,"Santa Clara","San José St",4,4,0,0,8,400987092,2017-12-21
10,1,"18:34",2314,2314,"Noah Baumann Defensive Rebound.",0,2,-2,0.776725428026003,"Santa Clara","San José St",4,4,0,0,8,400987092,2017-12-21
11,1,"18:19",2299,2299,"Ryan Welage made Three Point Jumper. Assisted by Noah Baumann.",0,5,-5,0.740771891886501,"Santa Clara","San José St",4,4,0,0,8,400987092,2017-12-21
12,1,"17:52",2272,2272,"Jarvis Pugh missed Three Point Jumper.",0,5,-5,0.73274816685449,"Santa Clara","San José St",4,4,0,0,8,400987092,2017-12-21
13,1,"17:52",2272,2272,"San José State Defensive Rebound.",0,5,-5,0.73274816685449,"Santa Clara","San José St",4,4,0,0,8,400987092,2017-12-21
14,1,"17:35",2255,2255,"Noah Baumann Turnover.",0,5,-5,0.730099480899574,"Santa Clara","San José St",4,4,0,0,8,400987092,2017-12-21
15,1,"17:19",2239,2239,"Henry Caruso missed Jumper.",0,5,-5,0.720152821317698,"Santa Clara","San José St",4,4,0,0,8,400987092,2017-12-21
16,1,"17:19",2239,2239,"Ashtin Chastain Defensive Rebound.",0,5,-5,0.720152821317698,"Santa Clara","San José St",4,4,0,0,8,400987092,2017-12-21
17,1,"17:05",2225,2225,"Keith Fisher III made Layup. Assisted by Noah Baumann.",0,7,-7,0.69006683928787,"Santa Clara","San José St",4,4,0,0,8,400987092,2017-12-21
18,1,"16:50",2210,2210,"Matt Hauser missed Three Point Jumper.",0,7,-7,0.637744255177722,"Santa Clara","San José St",4,4,0,0,8,400987092,2017-12-21
19,1,"16:50",2210,2210,"Emmanuel Ndumanya Offensive Rebound.",0,7,-7,0.637744255177722,"Santa Clara","San José St",4,4,0,0,8,400987092,2017-12-21
20,1,"16:32",2192,2192,"Emmanuel Ndumanya Turnover.",0,7,-7,0.676064756160785,"Santa Clara","San José St",4,4,0,0,8,400987092,2017-12-21
21,1,"16:31",2191,2191,"Isaiah Nichols Steal.",0,7,-7,0.676064756160785,"Santa Clara","San José St",4,4,0,0,8,400987092,2017-12-21
22,1,"16:26",2186,2186,"Foul on KJ Feagin.",0,7,-7,0.673852341924986,"Santa Clara","San José St",4,4,0,0,8,400987092,2017-12-21
23,1,"16:26",2186,2186,"Ashtin Chastain missed Free Throw.",0,7,-7,0.673852341924986,"Santa Clara","San José St",4,4,0,0,8,400987092,2017-12-21
24,1,"16:26",2186,2186,"San José State Deadball Team Rebound.",0,7,-7,0.673852341924986,"Santa Clara","San José St",4,4,0,0,8,400987092,2017-12-21
25,1,"16:26",2186,2186,"Ashtin Chastain missed Free Throw.",0,7,-7,0.673852341924986,"Santa Clara","San José St",4,4,0,0,8,400987092,2017-12-21
26,1,"16:26",2186,2186,"KJ Feagin Defensive Rebound.",0,7,-7,0.673852341924986,"Santa Clara","San José St",4,4,0,0,8,400987092,2017-12-21
27,1,"16:03",2163,2163,"Henry Caruso missed Layup.",0,7,-7,0.66447284413123,"Santa Clara","San José St",4,4,0,0,8,400987092,2017-12-21
28,1,"16:03",2163,2163,"San José State Deadball Team Rebound.",0,7,-7,0.66447284413123,"Santa Clara","San José St",4,4,0,0,8,400987092,2017-12-21
29,1,"15:48",2148,2148,"Oumar Barry missed Jumper.",0,7,-7,0.689868593741097,"Santa Clara","San José St",4,4,0,0,8,400987092,2017-12-21
30,1,"15:48",2148,2148,"Keith Fisher III Offensive Rebound.",0,7,-7,0.689868593741097,"Santa Clara","San José St",4,4,0,0,8,400987092,2017-12-21
31,1,"15:45",2145,2145,"Ryan Welage made Three Point Jumper. Assisted by Keith Fisher III.",0,10,-10,0.621412453837913,"Santa Clara","San José St",4,4,0,0,8,400987092,2017-12-21
32,1,"15:35",2135,2135,"Santa Clara  Timeout",0,10,-10,0.564424686188337,"Santa Clara","San José St",3,4,1,0,8,400987092,2017-12-21
33,1,"15:35",2135,2135,"Official TV Timeout",0,10,-10,0.564424686188337,"Santa Clara","San José St",3,4,1,0,8,400987092,2017-12-21
34,1,"15:19",2119,2119,"Foul on Brandon Mitchell.",0,10,-10,0.582211409787608,"Santa Clara","San José St",3,4,1,0,8,400987092,2017-12-21
35,1,"15:07",2107,2107,"KJ Feagin missed Three Point Jumper.",0,10,-10,0.5772181429285,"Santa Clara","San José St",3,4,1,0,8,400987092,2017-12-21
36,1,"15:07",2107,2107,"Keith Fisher III Defensive Rebound.",0,10,-10,0.5772181429285,"Santa Clara","San José St",3,4,1,0,8,400987092,2017-12-21
37,1,"14:53",2093,2093,"Noah Baumann missed Jumper.",0,10,-10,0.541619709444229,"Santa Clara","San José St",3,4,1,0,8,400987092,2017-12-21
38,1,"14:53",2093,2093,"Kai Healy Defensive Rebound.",0,10,-10,0.541619709444229,"Santa Clara","San José St",3,4,1,0,8,400987092,2017-12-21
39,1,"14:32",2072,2072,"Foul on Noah Baumann.",0,10,-10,0.596771033660593,"Santa Clara","San José St",3,4,0,0,8,400987092,2017-12-21
40,1,"14:32",2072,2072,"Henry Caruso made Free Throw.",1,10,-9,0.622262115566198,"Santa Clara","San José St",3,4,0,0,8,400987092,2017-12-21
41,1,"14:32",2072,2072,"Henry Caruso made Free Throw.",2,10,-8,0.647094679210559,"Santa Clara","San José St",3,4,0,0,8,400987092,2017-12-21
42,1,"14:17",2057,2057,"Brandon Mitchell missed Jumper.",2,10,-8,0.634986152107608,"Santa Clara","San José St",3,4,0,0,8,400987092,2017-12-21
43,1,"14:17",2057,2057,"KJ Feagin Defensive Rebound.",2,10,-8,0.634986152107608,"Santa Clara","San José St",3,4,0,0,8,400987092,2017-12-21
44,1,"14:12",2052,2052,"KJ Feagin Turnover.",2,10,-8,0.634986152107608,"Santa Clara","San José St",3,4,0,0,8,400987092,2017-12-21
45,1,"14:11",2051,2051,"Keith Fisher III Steal.",2,10,-8,0.634986152107608,"Santa Clara","San José St",3,4,0,0,8,400987092,2017-12-21
46,1,"13:45",2025,2025,"Brandon Mitchell made Jumper.",2,12,-10,0.527580598129075,"Santa Clara","San José St",3,4,0,0,8,400987092,2017-12-21
47,1,"13:31",2011,2011,"Matt Hauser missed Three Point Jumper.",2,12,-10,0.57364346877472,"Santa Clara","San José St",3,4,0,0,8,400987092,2017-12-21
48,1,"13:31",2011,2011,"Ryan Welage Defensive Rebound.",2,12,-10,0.57364346877472,"Santa Clara","San José St",3,4,0,0,8,400987092,2017-12-21
49,1,"13:12",1992,1992,"Foul on Henrik Jadersten.",2,12,-10,0.535769908393935,"Santa Clara","San José St",3,4,0,0,8,400987092,2017-12-21
50,1,"12:56",1976,1976,"Ryan Welage missed Three Point Jumper.",2,12,-10,0.550715612777623,"Santa Clara","San José St",3,4,0,0,8,400987092,2017-12-21
51,1,"12:56",1976,1976,"Henry Caruso Defensive Rebound.",2,12,-10,0.550715612777623,"Santa Clara","San José St",3,4,0,0,8,400987092,2017-12-21
52,1,"12:48",1968,1968,"Foul on Oumar Barry.",2,12,-10,0.591022750365622,"Santa Clara","San José St",3,4,0,0,8,400987092,2017-12-21
53,1,"12:48",1968,1968,"Henry Caruso made Free Throw.",3,12,-9,0.616371459495856,"Santa Clara","San José St",3,4,0,0,8,400987092,2017-12-21
54,1,"12:48",1968,1968,"Henry Caruso made Free Throw.",4,12,-8,0.641103102282565,"Santa Clara","San José St",3,4,0,0,8,400987092,2017-12-21
55,1,"12:34",1954,1954,"Caleb Simmons missed Three Point Jumper.",4,12,-8,0.601200825668344,"Santa Clara","San José St",3,4,0,0,8,400987092,2017-12-21
56,1,"12:34",1954,1954,"Matt Hauser Defensive Rebound.",4,12,-8,0.601200825668344,"Santa Clara","San José St",3,4,0,0,8,400987092,2017-12-21
57,1,"12:08",1928,1928,"Matt Turner missed Three Point Jumper.",4,12,-8,0.605569495409524,"Santa Clara","San José St",3,4,0,0,8,400987092,2017-12-21
58,1,"12:08",1928,1928,"Caleb Simmons Defensive Rebound.",4,12,-8,0.605569495409524,"Santa Clara","San José St",3,4,0,0,8,400987092,2017-12-21
59,1,"11:43",1903,1903,"Ryan Welage missed Jumper.",4,12,-8,0.618095501840404,"Santa Clara","San José St",3,4,0,0,8,400987092,2017-12-21
60,1,"11:43",1903,1903,"Shaquille Walters Defensive Rebound.",4,12,-8,0.618095501840404,"Santa Clara","San José St",3,4,0,0,8,400987092,2017-12-21
61,1,"11:35",1895,1895,"Henry Caruso missed Layup.",4,12,-8,0.577786054794468,"Santa Clara","San José St",3,4,0,0,8,400987092,2017-12-21
62,1,"11:35",1895,1895,"Isaiah Nichols Defensive Rebound.",4,12,-8,0.577786054794468,"Santa Clara","San José St",3,4,0,0,8,400987092,2017-12-21
63,1,"11:31",1891,1891,"Foul on Henry Caruso.",4,12,-8,0.577786054794468,"Santa Clara","San José St",3,4,0,0,8,400987092,2017-12-21
64,1,"11:31",1891,1891,"Official TV Timeout",4,12,-8,0.577786054794468,"Santa Clara","San José St",3,4,0,0,8,400987092,2017-12-21
65,1,"11:10",1870,1870,"Ryan Welage made Jumper.",4,14,-10,0.534421290668471,"Santa Clara","San José St",3,4,0,0,8,400987092,2017-12-21
66,1,"10:42",1842,1842,"KJ Feagin missed Jumper.",4,14,-10,0.524830441982103,"Santa Clara","San José St",3,4,0,0,8,400987092,2017-12-21
67,1,"10:42",1842,1842,"Brandon Mitchell Defensive Rebound.",4,14,-10,0.524830441982103,"Santa Clara","San José St",3,4,0,0,8,400987092,2017-12-21
68,1,"10:19",1819,1819,"Oumar Barry missed Jumper.",4,14,-10,0.496747243221708,"Santa Clara","San José St",3,4,0,0,8,400987092,2017-12-21
69,1,"10:19",1819,1819,"Jarvis Pugh Defensive Rebound.",4,14,-10,0.496747243221708,"Santa Clara","San José St",3,4,0,0,8,400987092,2017-12-21
70,1,"10:05",1805,1805,"Matt Turner missed Three Point Jumper.",4,14,-10,0.520391768664362,"Santa Clara","San José St",3,4,0,0,8,400987092,2017-12-21
71,1,"10:05",1805,1805,"Oumar Barry Defensive Rebound.",4,14,-10,0.520391768664362,"Santa Clara","San José St",3,4,0,0,8,400987092,2017-12-21
72,1,"9:36",1776,1776,"Keith Fisher III missed Jumper.",4,14,-10,0.520234603867818,"Santa Clara","San José St",3,4,0,0,8,400987092,2017-12-21
73,1,"9:36",1776,1776,"Oumar Barry Offensive Rebound.",4,14,-10,0.520234603867818,"Santa Clara","San José St",3,4,0,0,8,400987092,2017-12-21
74,1,"9:31",1771,1771,"Oumar Barry missed Two Point Tip Shot.",4,14,-10,0.520234603867818,"Santa Clara","San José St",3,4,0,0,8,400987092,2017-12-21
75,1,"9:31",1771,1771,"Henry Caruso Defensive Rebound.",4,14,-10,0.520234603867818,"Santa Clara","San José St",3,4,0,0,8,400987092,2017-12-21
76,1,"9:23",1763,1763,"Matt Hauser missed Three Point Jumper.",4,14,-10,0.531678461174869,"Santa Clara","San José St",3,4,0,0,8,400987092,2017-12-21
77,1,"9:23",1763,1763,"Ashtin Chastain Defensive Rebound.",4,14,-10,0.531678461174869,"Santa Clara","San José St",3,4,0,0,8,400987092,2017-12-21
78,1,"9:13",1753,1753,"Isaiah Nichols Turnover.",4,14,-10,0.480477522080911,"Santa Clara","San José St",3,4,0,0,8,400987092,2017-12-21
79,1,"8:49",1729,1729,"Henrik Jadersten missed Jumper.",4,14,-10,0.482134483224685,"Santa Clara","San José St",3,4,0,0,8,400987092,2017-12-21
80,1,"8:49",1729,1729,"Jaycee Hillsman Defensive Rebound.",4,14,-10,0.482134483224685,"Santa Clara","San José St",3,4,0,0,8,400987092,2017-12-21
81,1,"8:47",1727,1727,"Foul on Henry Caruso.",4,14,-10,0.482134483224685,"Santa Clara","San José St",3,4,0,0,8,400987092,2017-12-21
82,1,"8:30",1710,1710,"Ryan Welage made Three Point Jumper. Assisted by Nai Carlisle.",4,17,-13,0.418165995719401,"Santa Clara","San José St",3,4,0,0,8,400987092,2017-12-21
83,1,"8:16",1696,1696,"Shaquille Walters missed Three Point Jumper.",4,17,-13,0.371468776483609,"Santa Clara","San José St",3,4,0,0,8,400987092,2017-12-21
84,1,"8:16",1696,1696,"Jaycee Hillsman Defensive Rebound.",4,17,-13,0.371468776483609,"Santa Clara","San José St",3,4,0,0,8,400987092,2017-12-21
85,1,"7:52",1672,1672,"Foul on KJ Feagin.",4,17,-13,0.389650339837798,"Santa Clara","San José St",3,4,0,0,8,400987092,2017-12-21
86,1,"7:52",1672,1672,"Official TV Timeout",4,17,-13,0.389650339837798,"Santa Clara","San José St",3,4,0,0,8,400987092,2017-12-21
87,1,"7:40",1660,1660,"Jaycee Hillsman made Layup. Assisted by Nai Carlisle.",4,19,-15,0.351922356493783,"Santa Clara","San José St",3,4,0,0,8,400987092,2017-12-21
88,1,"7:17",1637,1637,"KJ Feagin made Three Point Jumper. Assisted by Shaquille Walters.",7,19,-12,0.440348443215219,"Santa Clara","San José St",3,4,0,0,8,400987092,2017-12-21
89,1,"7:03",1623,1623,"Ashtin Chastain made Layup. Assisted by Jaycee Hillsman.",7,21,-14,0.336968200672609,"Santa Clara","San José St",3,4,0,0,8,400987092,2017-12-21
90,1,"6:48",1608,1608,"Foul on Nai Carlisle.",7,21,-14,0.374017489050899,"Santa Clara","San José St",3,4,0,0,8,400987092,2017-12-21
91,1,"6:40",1600,1600,"Henry Caruso missed Three Point Jumper.",7,21,-14,0.374017489050899,"Santa Clara","San José St",3,4,0,0,8,400987092,2017-12-21
92,1,"6:40",1600,1600,"San José State Defensive Rebound.",7,21,-14,0.374017489050899,"Santa Clara","San José St",3,4,0,0,8,400987092,2017-12-21
93,1,"6:24",1584,1584,"Keith Fisher III missed Layup.",7,21,-14,0.349693795694265,"Santa Clara","San José St",3,4,0,0,8,400987092,2017-12-21
94,1,"6:24",1584,1584,"Ashtin Chastain Offensive Rebound.",7,21,-14,0.349693795694265,"Santa Clara","San José St",3,4,0,0,8,400987092,2017-12-21
95,1,"6:22",1582,1582,"Ashtin Chastain made Layup.",7,23,-16,0.290794980717803,"Santa Clara","San José St",3,4,0,0,8,400987092,2017-12-21
96,1,"6:22",1582,1582,"Foul on Matt Hauser.",7,23,-16,0.290794980717803,"Santa Clara","San José St",3,4,0,0,8,400987092,2017-12-21
97,1,"6:22",1582,1582,"Ashtin Chastain missed Free Throw.",7,23,-16,0.290794980717803,"Santa Clara","San José St",3,4,0,0,8,400987092,2017-12-21
98,1,"6:22",1582,1582,"Emmanuel Ndumanya Defensive Rebound.",7,23,-16,0.290794980717803,"Santa Clara","San José St",3,4,0,0,8,400987092,2017-12-21
99,1,"6:09",1569,1569,"Henry Caruso made Layup. Assisted by KJ Feagin.",9,23,-14,0.321342759348234,"Santa Clara","San José St",3,4,0,0,8,400987092,2017-12-21
100,1,"6:09",1569,1569,"Foul on Nai Carlisle.",9,23,-14,0.321342759348234,"Santa Clara","San José St",3,4,0,0,8,400987092,2017-12-21
101,1,"6:09",1569,1569,"Henry Caruso missed Free Throw.",9,23,-14,0.321342759348234,"Santa Clara","San José St",3,4,0,0,8,400987092,2017-12-21
102,1,"6:09",1569,1569,"Ashtin Chastain Defensive Rebound.",9,23,-14,0.321342759348234,"Santa Clara","San José St",3,4,0,0,8,400987092,2017-12-21
103,1,"5:58",1558,1558,"Foul on Emmanuel Ndumanya.",9,23,-14,0.314226872397083,"Santa Clara","San José St",3,4,0,0,8,400987092,2017-12-21
104,1,"5:58",1558,1558,"Ashtin Chastain made Free Throw.",9,24,-15,0.284142401077435,"Santa Clara","San José St",3,4,0,0,8,400987092,2017-12-21
105,1,"5:58",1558,1558,"Ashtin Chastain made Free Throw.",9,25,-16,0.255863598390471,"Santa Clara","San José St",3,4,0,0,8,400987092,2017-12-21
106,1,"5:42",1542,1542,"KJ Feagin Turnover.",9,25,-16,0.289844799223959,"Santa Clara","San José St",3,4,0,0,8,400987092,2017-12-21
107,1,"5:41",1541,1541,"Keith Fisher III Steal.",9,25,-16,0.289844799223959,"Santa Clara","San José St",3,4,0,0,8,400987092,2017-12-21
108,1,"5:39",1539,1539,"Jalen James made Layup. Assisted by Keith Fisher III.",9,27,-18,0.23309847854373,"Santa Clara","San José St",3,4,0,0,8,400987092,2017-12-21
109,1,"5:31",1531,1531,"Foul on Jaycee Hillsman.",9,27,-18,0.23309847854373,"Santa Clara","San José St",3,4,0,0,8,400987092,2017-12-21
110,1,"5:14",1514,1514,"Matt Hauser missed Jumper.",9,27,-18,0.193320146980339,"Santa Clara","San José St",3,4,0,0,8,400987092,2017-12-21
111,1,"5:14",1514,1514,"Henrik Jadersten Offensive Rebound.",9,27,-18,0.193320146980339,"Santa Clara","San José St",3,4,0,0,8,400987092,2017-12-21
112,1,"5:10",1510,1510,"Henrik Jadersten made Two Point Tip Shot.",11,27,-16,0.245335978437822,"Santa Clara","San José St",3,4,0,0,8,400987092,2017-12-21
113,1,"5:03",1503,1503,"Isaiah Nichols made Three Point Jumper. Assisted by Jalen James.",11,30,-19,0.192927198762001,"Santa Clara","San José St",3,4,0,0,8,400987092,2017-12-21
114,1,"4:49",1489,1489,"Henrik Jadersten missed Three Point Jumper.",11,30,-19,0.166561315253214,"Santa Clara","San José St",3,4,0,0,8,400987092,2017-12-21
115,1,"4:49",1489,1489,"Isaiah Nichols Defensive Rebound.",11,30,-19,0.166561315253214,"Santa Clara","San José St",3,4,0,0,8,400987092,2017-12-21
116,1,"4:23",1463,1463,"Jaycee Hillsman made Layup.",11,32,-21,0.150808628048634,"Santa Clara","San José St",3,4,0,0,8,400987092,2017-12-21
117,1,"4:23",1463,1463,"Foul on Kai Healy.",11,32,-21,0.150808628048634,"Santa Clara","San José St",3,4,0,0,8,400987092,2017-12-21
118,1,"4:23",1463,1463,"Jaycee Hillsman made Free Throw.",11,33,-22,0.133809193383029,"Santa Clara","San José St",3,4,0,0,8,400987092,2017-12-21
119,1,"4:05",1445,1445,"KJ Feagin missed Three Point Jumper.",11,33,-22,0.118051537947427,"Santa Clara","San José St",3,4,0,0,8,400987092,2017-12-21
120,1,"4:05",1445,1445,"Isaiah Nichols Defensive Rebound.",11,33,-22,0.118051537947427,"Santa Clara","San José St",3,4,0,0,8,400987092,2017-12-21
121,1,"3:44",1424,1424,"Foul on Henrik Jadersten.",11,33,-22,0.118184588209196,"Santa Clara","San José St",3,4,0,0,8,400987092,2017-12-21
122,1,"3:44",1424,1424,"Official TV Timeout",11,33,-22,0.118184588209196,"Santa Clara","San José St",3,4,0,0,8,400987092,2017-12-21
123,1,"3:44",1424,1424,"Keith Fisher III made Free Throw.",11,34,-23,0.103913513648464,"Santa Clara","San José St",3,4,0,0,8,400987092,2017-12-21
124,1,"3:44",1424,1424,"Keith Fisher III made Free Throw.",11,35,-24,0.0911875048139759,"Santa Clara","San José St",3,4,0,0,8,400987092,2017-12-21
125,1,"3:15",1395,1395,"Foul on Isaiah Nichols.",11,35,-24,0.0817473590819617,"Santa Clara","San José St",3,4,0,0,8,400987092,2017-12-21
126,1,"3:15",1395,1395,"KJ Feagin made Free Throw.",12,35,-23,0.0941137552921004,"Santa Clara","San José St",3,4,0,0,8,400987092,2017-12-21
127,1,"3:15",1395,1395,"KJ Feagin made Free Throw.",13,35,-22,0.108130595705953,"Santa Clara","San José St",3,4,0,0,8,400987092,2017-12-21
128,1,"3:01",1381,1381,"Keith Fisher III made Layup. Assisted by Jaycee Hillsman.",13,37,-24,0.090604432436694,"Santa Clara","San José St",3,4,0,0,8,400987092,2017-12-21
129,1,"2:51",1371,1371,"KJ Feagin missed Layup.",13,37,-24,0.0939488741632299,"Santa Clara","San José St",3,4,0,0,8,400987092,2017-12-21
130,1,"2:51",1371,1371,"Oumar Barry Defensive Rebound.",13,37,-24,0.0939488741632299,"Santa Clara","San José St",3,4,0,0,8,400987092,2017-12-21
131,1,"2:51",1371,1371,"Foul on Henrik Jadersten.",13,37,-24,0.0939488741632299,"Santa Clara","San José St",3,4,0,0,8,400987092,2017-12-21
132,1,"2:51",1371,1371,"Oumar Barry made Free Throw.",13,38,-25,0.0823603791428923,"Santa Clara","San José St",3,4,0,0,8,400987092,2017-12-21
133,1,"2:51",1371,1371,"Oumar Barry made Free Throw.",13,39,-26,0.0720875840707819,"Santa Clara","San José St",3,4,0,0,8,400987092,2017-12-21
134,1,"2:34",1354,1354,"KJ Feagin missed Three Point Jumper.",13,39,-26,0.0605346701045142,"Santa Clara","San José St",3,4,0,0,8,400987092,2017-12-21
135,1,"2:34",1354,1354,"Keith Fisher III Defensive Rebound.",13,39,-26,0.0605346701045142,"Santa Clara","San José St",3,4,0,0,8,400987092,2017-12-21
136,1,"2:18",1338,1338,"Oumar Barry Turnover.",13,39,-26,0.0521532478438497,"Santa Clara","San José St",3,4,0,0,8,400987092,2017-12-21
137,1,"2:06",1326,1326,"Shaquille Walters made Layup.",15,39,-24,0.0710554924695829,"Santa Clara","San José St",3,4,0,0,8,400987092,2017-12-21
138,1,"1:52",1312,1312,"Isaiah Nichols Turnover.",15,39,-24,0.0736045905740792,"Santa Clara","San José St",3,4,0,0,8,400987092,2017-12-21
139,1,"1:49",1309,1309,"Henry Caruso Steal.",15,39,-24,0.0851266969766558,"Santa Clara","San José St",3,4,0,0,8,400987092,2017-12-21
140,1,"1:21",1281,1281,"Henry Caruso missed Jumper.",15,39,-24,0.0873321343114844,"Santa Clara","San José St",3,4,0,0,8,400987092,2017-12-21
141,1,"1:21",1281,1281,"Keith Fisher III Defensive Rebound.",15,39,-24,0.0873321343114844,"Santa Clara","San José St",3,4,0,0,8,400987092,2017-12-21
142,1,"1:04",1264,1264,"San José State  Timeout",15,39,-24,0.0751246099553057,"Santa Clara","San José St",3,3,0,1,8,400987092,2017-12-21
143,1,"0:52",1252,1252,"Jaycee Hillsman Turnover.",15,39,-24,0.0748420120176402,"Santa Clara","San José St",3,3,0,1,8,400987092,2017-12-21
144,1,"0:23",1223,1223,"Shaquille Walters made Three Point Jumper. Assisted by KJ Feagin.",18,39,-21,0.0868178247345588,"Santa Clara","San José St",3,3,0,1,8,400987092,2017-12-21
145,1,"0:01",1201,1201,"Ashtin Chastain missed Three Point Jumper.",18,39,-21,0.102676730506839,"Santa Clara","San José St",3,3,0,0,8,400987092,2017-12-21
146,1,"0:01",1201,1201,"Shaquille Walters Defensive Rebound.",18,39,-21,0.102676730506839,"Santa Clara","San José St",3,3,0,0,8,400987092,2017-12-21
147,1,"0:00",1200,1200,"End of 1st half",18,39,-21,0.102676730506839,"Santa Clara","San José St",3,3,0,0,8,400987092,2017-12-21
148,2,"20:00",1200,1200,"PLAY",18,39,-21,0.102676730506839,"Santa Clara","San José St",4,4,0,0,8,400987092,2017-12-21
149,2,"19:47",1187,1187,"KJ Feagin missed Three Point Jumper.",18,39,-21,0.0915176263402328,"Santa Clara","San José St",4,4,0,0,8,400987092,2017-12-21
150,2,"19:47",1187,1187,"Isaiah Nichols Defensive Rebound.",18,39,-21,0.0915176263402328,"Santa Clara","San José St",4,4,0,0,8,400987092,2017-12-21
151,2,"19:21",1161,1161,"Isaiah Nichols made Jumper.",18,41,-23,0.0657416802100414,"Santa Clara","San José St",4,4,0,0,8,400987092,2017-12-21
152,2,"19:01",1141,1141,"Foul on Ashtin Chastain.",18,41,-23,0.0537043252804666,"Santa Clara","San José St",4,4,0,0,8,400987092,2017-12-21
153,2,"19:01",1141,1141,"Emmanuel Ndumanya missed Free Throw.",18,41,-23,0.0537043252804666,"Santa Clara","San José St",4,4,0,0,8,400987092,2017-12-21
154,2,"19:01",1141,1141,"Santa Clara Deadball Team Rebound.",18,41,-23,0.0537043252804666,"Santa Clara","San José St",4,4,0,0,8,400987092,2017-12-21
155,2,"19:01",1141,1141,"Emmanuel Ndumanya missed Free Throw.",18,41,-23,0.0537043252804666,"Santa Clara","San José St",4,4,0,0,8,400987092,2017-12-21
156,2,"19:01",1141,1141,"Emmanuel Ndumanya Offensive Rebound.",18,41,-23,0.0537043252804666,"Santa Clara","San José St",4,4,0,0,8,400987092,2017-12-21
157,2,"18:59",1139,1139,"KJ Feagin made Three Point Jumper. Assisted by Matt Hauser.",21,41,-20,0.113155682082664,"Santa Clara","San José St",4,4,0,0,8,400987092,2017-12-21
158,2,"18:34",1114,1114,"Keith Fisher III Turnover.",21,41,-20,0.0867931144274694,"Santa Clara","San José St",4,4,0,0,8,400987092,2017-12-21
159,2,"18:28",1108,1108,"Matt Hauser made Three Point Jumper. Assisted by Jarvis Pugh.",24,41,-17,0.166596336658475,"Santa Clara","San José St",4,4,0,0,8,400987092,2017-12-21
160,2,"18:04",1084,1084,"Isaiah Nichols missed Three Point Jumper.",24,41,-17,0.137555038185983,"Santa Clara","San José St",4,4,0,0,8,400987092,2017-12-21
161,2,"18:04",1084,1084,"Ashtin Chastain Offensive Rebound.",24,41,-17,0.137555038185983,"Santa Clara","San José St",4,4,0,0,8,400987092,2017-12-21
162,2,"18:01",1081,1081,"Ashtin Chastain made Layup.",24,43,-19,0.100666184113204,"Santa Clara","San José St",4,4,0,0,8,400987092,2017-12-21
163,2,"17:47",1067,1067,"Henry Caruso missed Three Point Jumper.",24,43,-19,0.104203648107597,"Santa Clara","San José St",4,4,0,0,8,400987092,2017-12-21
164,2,"17:47",1067,1067,"Keith Fisher III Defensive Rebound.",24,43,-19,0.104203648107597,"Santa Clara","San José St",4,4,0,0,8,400987092,2017-12-21
165,2,"17:35",1055,1055,"Ryan Welage made Three Point Jumper. Assisted by Noah Baumann.",24,46,-22,0.0562169383947898,"Santa Clara","San José St",4,4,0,0,8,400987092,2017-12-21
166,2,"17:23",1043,1043,"Matt Hauser missed Three Point Jumper.",24,46,-22,0.0648255151135026,"Santa Clara","San José St",4,4,0,0,8,400987092,2017-12-21
167,2,"17:23",1043,1043,"Emmanuel Ndumanya Offensive Rebound.",24,46,-22,0.0648255151135026,"Santa Clara","San José St",4,4,0,0,8,400987092,2017-12-21
168,2,"17:19",1039,1039,"Matt Hauser missed Jumper.",24,46,-22,0.0648997069387234,"Santa Clara","San José St",4,4,0,0,8,400987092,2017-12-21
169,2,"17:19",1039,1039,"Henry Caruso Offensive Rebound.",24,46,-22,0.0648997069387234,"Santa Clara","San José St",4,4,0,0,8,400987092,2017-12-21
170,2,"17:13",1033,1033,"Henry Caruso made Layup.",26,46,-20,0.0890952804412044,"Santa Clara","San José St",4,4,0,0,8,400987092,2017-12-21
171,2,"17:01",1021,1021,"Ashtin Chastain Turnover.",26,46,-20,0.078881479572337,"Santa Clara","San José St",4,4,0,0,8,400987092,2017-12-21
172,2,"17:00",1020,1020,"Emmanuel Ndumanya Steal.",26,46,-20,0.078881479572337,"Santa Clara","San José St",4,4,0,0,8,400987092,2017-12-21
173,2,"16:45",1005,1005,"Jarvis Pugh Turnover.",26,46,-20,0.062042225808704,"Santa Clara","San José St",4,4,0,0,8,400987092,2017-12-21
174,2,"16:45",1005,1005,"Foul on Jarvis Pugh.",26,46,-20,0.062042225808704,"Santa Clara","San José St",4,4,0,0,8,400987092,2017-12-21
175,2,"16:26",986,986,"Noah Baumann missed Jumper.",26,46,-20,0.050741068331067,"Santa Clara","San José St",4,4,0,0,8,400987092,2017-12-21
176,2,"16:26",986,986,"KJ Feagin Defensive Rebound.",26,46,-20,0.050741068331067,"Santa Clara","San José St",4,4,0,0,8,400987092,2017-12-21
177,2,"16:20",980,980,"KJ Feagin made Jumper.",28,46,-18,0.0738270495087968,"Santa Clara","San José St",4,4,0,0,8,400987092,2017-12-21
