"play_id","half","time_remaining_half","secs_remaining","secs_remaining_absolute","description","home_score","away_score","score_diff","win_prob","home","away","home_time_out_remaining","away_time_out_remaining","home_timeout_ind","away_timeout_ind","home_favored_by","game_id","date"
1,1,"20:00",2400,2400,"PLAY",0,0,0,0.852225761633161,"Arizona","Oregon",4,4,0,0,9,400988314,2018-01-13
2,1,"20:00",2400,2400,"Jump Ball won by Arizona",0,0,0,0.852225761633161,"Arizona","Oregon",4,4,0,0,9,400988314,2018-01-13
3,1,"19:42",2382,2382,"Allonzo Trier Turnover.",0,0,0,0.84797092826269,"Arizona","Oregon",4,4,0,0,9,400988314,2018-01-13
4,1,"19:42",2382,2382,"Payton Pritchard Steal.",0,0,0,0.84797092826269,"Arizona","Oregon",4,4,0,0,9,400988314,2018-01-13
5,1,"19:34",2374,2374,"Payton Pritchard made Layup.",0,2,-2,0.818331793230206,"Arizona","Oregon",4,4,0,0,9,400988314,2018-01-13
6,1,"19:13",2353,2353,"Rawle Alkins Turnover.",0,2,-2,0.825666655623342,"Arizona","Oregon",4,4,0,0,9,400988314,2018-01-13
7,1,"19:05",2345,2345,"Troy Brown made Jumper. Assisted by Payton Pritchard.",0,4,-4,0.780160130153432,"Arizona","Oregon",4,4,0,0,9,400988314,2018-01-13
8,1,"18:38",2318,2318,"Dusan Ristic made Jumper.",2,4,-2,0.797126591442501,"Arizona","Oregon",4,4,0,0,9,400988314,2018-01-13
9,1,"18:10",2290,2290,"Elijah Brown made Three Point Jumper. Assisted by Payton Pritchard.",2,7,-5,0.76404029462422,"Arizona","Oregon",4,4,0,0,9,400988314,2018-01-13
10,1,"17:57",2277,2277,"Allonzo Trier made Three Point Jumper. Assisted by Rawle Alkins.",5,7,-2,0.808937124662745,"Arizona","Oregon",4,4,0,0,9,400988314,2018-01-13
11,1,"17:31",2251,2251,"Kenny Wooten missed Layup.",5,7,-2,0.802877628250175,"Arizona","Oregon",4,4,0,0,9,400988314,2018-01-13
12,1,"17:31",2251,2251,"Allonzo Trier Defensive Rebound.",5,7,-2,0.802877628250175,"Arizona","Oregon",4,4,0,0,9,400988314,2018-01-13
13,1,"17:18",2238,2238,"Parker Jackson-Cartwright made Three Point Jumper. Assisted by Deandre Ayton.",8,7,1,0.850706990127495,"Arizona","Oregon",4,4,0,0,9,400988314,2018-01-13
14,1,"16:51",2211,2211,"Kenny Wooten made Layup. Assisted by Troy Brown.",8,9,-1,0.812865696533925,"Arizona","Oregon",4,4,0,0,9,400988314,2018-01-13
15,1,"16:21",2181,2181,"Rawle Alkins made Three Point Jumper. Assisted by Parker Jackson-Cartwright.",11,9,2,0.861041998102963,"Arizona","Oregon",4,4,0,0,9,400988314,2018-01-13
16,1,"15:46",2146,2146,"Troy Brown missed Three Point Jumper.",11,9,2,0.862131541057005,"Arizona","Oregon",4,4,0,0,9,400988314,2018-01-13
17,1,"15:46",2146,2146,"Allonzo Trier Defensive Rebound.",11,9,2,0.862131541057005,"Arizona","Oregon",4,4,0,0,9,400988314,2018-01-13
18,1,"15:41",2141,2141,"Allonzo Trier made Layup.",13,9,4,0.884499394074683,"Arizona","Oregon",4,4,0,0,9,400988314,2018-01-13
19,1,"15:31",2131,2131,"Elijah Brown missed Three Point Jumper.",13,9,4,0.888557148609846,"Arizona","Oregon",4,4,0,0,9,400988314,2018-01-13
20,1,"15:31",2131,2131,"Deandre Ayton Defensive Rebound.",13,9,4,0.888557148609846,"Arizona","Oregon",4,4,0,0,9,400988314,2018-01-13
21,1,"15:13",2113,2113,"Dusan Ristic made Jumper.",15,9,6,0.912495487901663,"Arizona","Oregon",4,4,0,0,9,400988314,2018-01-13
22,1,"14:48",2088,2088,"Kenny Wooten missed Jumper.",15,9,6,0.901624232373627,"Arizona","Oregon",4,4,0,0,9,400988314,2018-01-13
23,1,"14:48",2088,2088,"Deandre Ayton Defensive Rebound.",15,9,6,0.901624232373627,"Arizona","Oregon",4,4,0,0,9,400988314,2018-01-13
24,1,"14:40",2080,2080,"Parker Jackson-Cartwright missed Three Point Jumper.",15,9,6,0.901624232373627,"Arizona","Oregon",4,4,0,0,9,400988314,2018-01-13
25,1,"14:40",2080,2080,"Arizona Offensive Rebound.",15,9,6,0.901624232373627,"Arizona","Oregon",4,4,0,0,9,400988314,2018-01-13
26,1,"14:35",2075,2075,"Official TV Timeout",15,9,6,0.902907607825779,"Arizona","Oregon",4,4,0,0,9,400988314,2018-01-13
27,1,"14:33",2073,2073,"Deandre Ayton made Dunk. Assisted by Allonzo Trier.",17,9,8,0.920137820045242,"Arizona","Oregon",4,4,0,0,9,400988314,2018-01-13
28,1,"14:13",2053,2053,"Foul on Ira Lee.",17,9,8,0.9279708545778,"Arizona","Oregon",4,4,0,0,9,400988314,2018-01-13
29,1,"14:02",2042,2042,"Victor Bailey Jr. missed Three Point Jumper.",17,9,8,0.915248444562581,"Arizona","Oregon",4,4,0,0,9,400988314,2018-01-13
30,1,"14:02",2042,2042,"Arizona Defensive Rebound.",17,9,8,0.915248444562581,"Arizona","Oregon",4,4,0,0,9,400988314,2018-01-13
31,1,"13:40",2020,2020,"Deandre Ayton missed Jumper.",17,9,8,0.93119426292814,"Arizona","Oregon",4,4,0,0,9,400988314,2018-01-13
32,1,"13:40",2020,2020,"Troy Brown Defensive Rebound.",17,9,8,0.93119426292814,"Arizona","Oregon",4,4,0,0,9,400988314,2018-01-13
33,1,"13:17",1997,1997,"Jump Ball won by Oregon",17,9,8,0.930805125493512,"Arizona","Oregon",4,4,0,0,9,400988314,2018-01-13
34,1,"13:09",1989,1989,"Payton Pritchard missed Three Point Jumper.",17,9,8,0.920309831228193,"Arizona","Oregon",4,4,0,0,9,400988314,2018-01-13
35,1,"13:09",1989,1989,"Brandon Randolph Defensive Rebound.",17,9,8,0.920309831228193,"Arizona","Oregon",4,4,0,0,9,400988314,2018-01-13
36,1,"12:59",1979,1979,"Dusan Ristic made Layup. Assisted by Brandon Randolph.",19,9,10,0.946373304822503,"Arizona","Oregon",4,4,0,0,9,400988314,2018-01-13
37,1,"12:38",1958,1958,"MiKyle McIntosh missed Layup.",19,9,10,0.941280699564197,"Arizona","Oregon",4,4,0,0,9,400988314,2018-01-13
38,1,"12:38",1958,1958,"MiKyle McIntosh Offensive Rebound.",19,9,10,0.941280699564197,"Arizona","Oregon",4,4,0,0,9,400988314,2018-01-13
39,1,"12:31",1951,1951,"Victor Bailey Jr. missed Layup.",19,9,10,0.941280699564197,"Arizona","Oregon",4,4,0,0,9,400988314,2018-01-13
40,1,"12:31",1951,1951,"Parker Jackson-Cartwright Defensive Rebound.",19,9,10,0.941280699564197,"Arizona","Oregon",4,4,0,0,9,400988314,2018-01-13
41,1,"12:20",1940,1940,"Dusan Ristic missed Jumper.",19,9,10,0.941658416749697,"Arizona","Oregon",4,4,0,0,9,400988314,2018-01-13
42,1,"12:20",1940,1940,"Oregon Deadball Team Rebound.",19,9,10,0.941658416749697,"Arizona","Oregon",4,4,0,0,9,400988314,2018-01-13
43,1,"12:18",1938,1938,"Foul on Dusan Ristic.",19,9,10,0.940431642653755,"Arizona","Oregon",4,4,0,0,9,400988314,2018-01-13
44,1,"12:10",1930,1930,"Troy Brown missed Three Point Jumper.",19,9,10,0.940431642653755,"Arizona","Oregon",4,4,0,0,9,400988314,2018-01-13
45,1,"12:10",1930,1930,"Brandon Randolph Defensive Rebound.",19,9,10,0.940431642653755,"Arizona","Oregon",4,4,0,0,9,400988314,2018-01-13
46,1,"11:58",1918,1918,"Dusan Ristic made Layup. Assisted by Brandon Randolph.",21,9,12,0.958184230088189,"Arizona","Oregon",4,4,0,0,9,400988314,2018-01-13
47,1,"11:43",1903,1903,"Victor Bailey Jr. made Layup.",21,11,10,0.937388633083944,"Arizona","Oregon",4,4,0,0,9,400988314,2018-01-13
48,1,"11:23",1883,1883,"Brandon Randolph missed Three Point Jumper.",21,11,10,0.940367044501742,"Arizona","Oregon",4,4,0,0,9,400988314,2018-01-13
49,1,"11:23",1883,1883,"Troy Brown Defensive Rebound.",21,11,10,0.940367044501742,"Arizona","Oregon",4,4,0,0,9,400988314,2018-01-13
50,1,"11:17",1877,1877,"MiKyle McIntosh made Dunk. Assisted by Troy Brown.",21,13,8,0.923259045466254,"Arizona","Oregon",4,4,0,0,9,400988314,2018-01-13
51,1,"10:47",1847,1847,"Foul on Paul White.",21,13,8,0.920298718396186,"Arizona","Oregon",4,4,0,0,9,400988314,2018-01-13
52,1,"10:47",1847,1847,"Official TV Timeout",21,13,8,0.920298718396186,"Arizona","Oregon",4,4,0,0,9,400988314,2018-01-13
53,1,"10:45",1845,1845,"Deandre Ayton missed Layup.",21,13,8,0.920298718396186,"Arizona","Oregon",4,4,0,0,9,400988314,2018-01-13
54,1,"10:45",1845,1845,"Kenny Wooten Defensive Rebound.",21,13,8,0.920298718396186,"Arizona","Oregon",4,4,0,0,9,400988314,2018-01-13
55,1,"10:28",1828,1828,"Foul on Dusan Ristic.",21,13,8,0.92840508284271,"Arizona","Oregon",4,4,0,0,9,400988314,2018-01-13
56,1,"10:28",1828,1828,"Kenny Wooten made Free Throw.",21,14,7,0.919981125286168,"Arizona","Oregon",4,4,0,0,9,400988314,2018-01-13
57,1,"10:28",1828,1828,"Kenny Wooten missed Free Throw.",21,14,7,0.919981125286168,"Arizona","Oregon",4,4,0,0,9,400988314,2018-01-13
58,1,"10:28",1828,1828,"Dusan Ristic Defensive Rebound.",21,14,7,0.919981125286168,"Arizona","Oregon",4,4,0,0,9,400988314,2018-01-13
59,1,"10:13",1813,1813,"Dusan Ristic Turnover.",21,14,7,0.922067516058442,"Arizona","Oregon",4,4,0,0,9,400988314,2018-01-13
60,1,"10:00",1800,1800,"Keith Smith Turnover.",21,14,7,0.915479241503178,"Arizona","Oregon",4,4,0,0,9,400988314,2018-01-13
61,1,"9:46",1786,1786,"Deandre Ayton Turnover.",21,14,7,0.910362548887235,"Arizona","Oregon",4,4,0,0,9,400988314,2018-01-13
62,1,"9:27",1767,1767,"Foul on Deandre Ayton.",21,14,7,0.920727832453338,"Arizona","Oregon",4,4,0,0,9,400988314,2018-01-13
63,1,"9:26",1766,1766,"Paul White made Free Throw.",21,15,6,0.910717257165622,"Arizona","Oregon",4,4,0,0,9,400988314,2018-01-13
64,1,"9:26",1766,1766,"Paul White made Free Throw.",21,16,5,0.899580410251954,"Arizona","Oregon",4,4,0,0,9,400988314,2018-01-13
65,1,"9:05",1745,1745,"Allonzo Trier Turnover.",21,16,5,0.888518298130683,"Arizona","Oregon",4,4,0,0,9,400988314,2018-01-13
66,1,"8:57",1737,1737,"Paul White Turnover.",21,16,5,0.895674551044621,"Arizona","Oregon",4,4,0,0,9,400988314,2018-01-13
67,1,"8:37",1717,1717,"Allonzo Trier made Layup. Assisted by Rawle Alkins.",23,16,7,0.920961079346804,"Arizona","Oregon",4,4,0,0,9,400988314,2018-01-13
68,1,"8:31",1711,1711,"Paul White missed Layup.",23,16,7,0.920961079346804,"Arizona","Oregon",4,4,0,0,9,400988314,2018-01-13
69,1,"8:31",1711,1711,"Keanu Pinder Block.",23,16,7,0.920961079346804,"Arizona","Oregon",4,4,0,0,9,400988314,2018-01-13
70,1,"8:31",1711,1711,"Parker Jackson-Cartwright Defensive Rebound.",23,16,7,0.920961079346804,"Arizona","Oregon",4,4,0,0,9,400988314,2018-01-13
71,1,"8:20",1700,1700,"Keanu Pinder made Dunk. Assisted by Parker Jackson-Cartwright.",25,16,9,0.92852204626016,"Arizona","Oregon",4,4,0,0,9,400988314,2018-01-13
72,1,"8:20",1700,1700,"Foul on Paul White.",25,16,9,0.92852204626016,"Arizona","Oregon",4,4,0,0,9,400988314,2018-01-13
73,1,"8:20",1700,1700,"Keanu Pinder missed Free Throw.",25,16,9,0.92852204626016,"Arizona","Oregon",4,4,0,0,9,400988314,2018-01-13
74,1,"8:20",1700,1700,"MiKyle McIntosh Defensive Rebound.",25,16,9,0.92852204626016,"Arizona","Oregon",4,4,0,0,9,400988314,2018-01-13
75,1,"8:01",1681,1681,"Troy Brown Turnover.",25,16,9,0.943504887082349,"Arizona","Oregon",4,4,0,0,9,400988314,2018-01-13
76,1,"7:48",1668,1668,"Deandre Ayton made Jumper. Assisted by Rawle Alkins.",27,16,11,0.946103397880254,"Arizona","Oregon",4,4,0,0,9,400988314,2018-01-13
77,1,"7:48",1668,1668,"Foul on Roman Sorkin.",27,16,11,0.946103397880254,"Arizona","Oregon",4,4,0,0,9,400988314,2018-01-13
78,1,"7:48",1668,1668,"Official TV Timeout",27,16,11,0.946103397880254,"Arizona","Oregon",4,4,0,0,9,400988314,2018-01-13
79,1,"7:48",1668,1668,"Deandre Ayton made Free Throw.",28,16,12,0.952335232710682,"Arizona","Oregon",4,4,0,0,9,400988314,2018-01-13
80,1,"7:22",1642,1642,"Foul on Emmanuel Akot.",28,16,12,0.958167447712327,"Arizona","Oregon",4,4,0,0,9,400988314,2018-01-13
81,1,"6:53",1613,1613,"Elijah Brown made Three Point Jumper. Assisted by MiKyle McIntosh.",28,19,9,0.930097387525248,"Arizona","Oregon",4,4,0,0,9,400988314,2018-01-13
82,1,"6:49",1609,1609,"Emmanuel Akot made Layup. Assisted by Parker Jackson-Cartwright.",30,19,11,0.946945296395151,"Arizona","Oregon",4,4,0,0,9,400988314,2018-01-13
83,1,"6:44",1604,1604,"MiKyle McIntosh Turnover.",30,19,11,0.946945296395151,"Arizona","Oregon",4,4,0,0,9,400988314,2018-01-13
84,1,"6:34",1594,1594,"Rawle Alkins Turnover.",30,19,11,0.947591695227955,"Arizona","Oregon",4,4,0,0,9,400988314,2018-01-13
85,1,"6:26",1586,1586,"Foul on Brandon Randolph.",30,19,11,0.946828333683317,"Arizona","Oregon",4,4,0,0,9,400988314,2018-01-13
86,1,"6:26",1586,1586,"Foul on Elijah Brown.",30,19,11,0.946828333683317,"Arizona","Oregon",4,4,0,0,9,400988314,2018-01-13
87,1,"6:26",1586,1586,"Technical Foul on Elijah Brown.",30,19,11,0.946828333683317,"Arizona","Oregon",4,4,0,0,9,400988314,2018-01-13
88,1,"6:26",1586,1586,"Allonzo Trier made Free Throw.",31,19,12,0.953254436632371,"Arizona","Oregon",4,4,0,0,9,400988314,2018-01-13
89,1,"6:26",1586,1586,"Elijah Brown made Free Throw.",32,20,12,0.953254436632371,"Arizona","Oregon",4,4,0,0,9,400988314,2018-01-13
90,1,"6:26",1586,1586,"Elijah Brown Turnover.",30,19,11,0.946828333683317,"Arizona","Oregon",4,4,0,0,9,400988314,2018-01-13
91,1,"6:26",1586,1586,"Allonzo Trier made Free Throw.",32,19,13,0.95893758918481,"Arizona","Oregon",4,4,0,0,9,400988314,2018-01-13
92,1,"6:26",1586,1586,"Elijah Brown made Free Throw.",32,21,11,0.946828333683317,"Arizona","Oregon",4,4,0,0,9,400988314,2018-01-13
93,1,"6:17",1577,1577,"Dylan Smith Turnover.",32,21,11,0.958350037731228,"Arizona","Oregon",4,4,0,0,9,400988314,2018-01-13
94,1,"6:17",1577,1577,"Payton Pritchard Steal.",32,21,11,0.958350037731228,"Arizona","Oregon",4,4,0,0,9,400988314,2018-01-13
95,1,"6:08",1568,1568,"Troy Brown made Layup. Assisted by Payton Pritchard.",32,23,9,0.933017275999289,"Arizona","Oregon",4,4,0,0,9,400988314,2018-01-13
96,1,"5:43",1543,1543,"Foul on Troy Brown.",32,23,9,0.936203190411785,"Arizona","Oregon",4,4,0,0,9,400988314,2018-01-13
97,1,"5:38",1538,1538,"Brandon Randolph Turnover.",32,23,9,0.936117426821097,"Arizona","Oregon",4,4,0,0,9,400988314,2018-01-13
98,1,"5:38",1538,1538,"MiKyle McIntosh Steal.",32,23,9,0.936117426821097,"Arizona","Oregon",4,4,0,0,9,400988314,2018-01-13
99,1,"5:33",1533,1533,"Victor Bailey Jr. Turnover.",32,23,9,0.936117426821097,"Arizona","Oregon",4,4,0,0,9,400988314,2018-01-13
100,1,"5:33",1533,1533,"Foul on Victor Bailey Jr..",32,23,9,0.936117426821097,"Arizona","Oregon",4,4,0,0,9,400988314,2018-01-13
101,1,"5:23",1523,1523,"Brandon Randolph Turnover.",32,23,9,0.934008127587622,"Arizona","Oregon",4,4,0,0,9,400988314,2018-01-13
102,1,"5:23",1523,1523,"Payton Pritchard Steal.",32,23,9,0.934008127587622,"Arizona","Oregon",4,4,0,0,9,400988314,2018-01-13
103,1,"5:16",1516,1516,"Victor Bailey Jr. made Jumper. Assisted by Payton Pritchard.",32,25,7,0.923141646084182,"Arizona","Oregon",4,4,0,0,9,400988314,2018-01-13
104,1,"4:54",1494,1494,"Rawle Alkins missed Jumper.",32,25,7,0.917853903946672,"Arizona","Oregon",4,4,0,0,9,400988314,2018-01-13
105,1,"4:54",1494,1494,"MiKyle McIntosh Defensive Rebound.",32,25,7,0.917853903946672,"Arizona","Oregon",4,4,0,0,9,400988314,2018-01-13
106,1,"4:54",1494,1494,"Foul on Ira Lee.",32,25,7,0.917853903946672,"Arizona","Oregon",4,4,0,0,9,400988314,2018-01-13
107,1,"4:54",1494,1494,"MiKyle McIntosh made Free Throw.",32,26,6,0.90670356670109,"Arizona","Oregon",4,4,0,0,9,400988314,2018-01-13
108,1,"4:54",1494,1494,"MiKyle McIntosh made Free Throw.",32,27,5,0.894214145084551,"Arizona","Oregon",4,4,0,0,9,400988314,2018-01-13
109,1,"4:42",1482,1482,"Allonzo Trier missed Three Point Jumper.",32,27,5,0.890809398828636,"Arizona","Oregon",4,4,0,0,9,400988314,2018-01-13
110,1,"4:42",1482,1482,"Deandre Ayton Offensive Rebound.",32,27,5,0.890809398828636,"Arizona","Oregon",4,4,0,0,9,400988314,2018-01-13
111,1,"4:37",1477,1477,"Deandre Ayton missed Layup.",32,27,5,0.904100514369543,"Arizona","Oregon",4,4,0,0,9,400988314,2018-01-13
112,1,"4:37",1477,1477,"Victor Bailey Jr. Defensive Rebound.",32,27,5,0.904100514369543,"Arizona","Oregon",4,4,0,0,9,400988314,2018-01-13
113,1,"4:37",1477,1477,"Victor Bailey Jr. Turnover.",32,27,5,0.904100514369543,"Arizona","Oregon",4,4,0,0,9,400988314,2018-01-13
114,1,"4:37",1477,1477,"Parker Jackson-Cartwright Steal.",32,27,5,0.904100514369543,"Arizona","Oregon",4,4,0,0,9,400988314,2018-01-13
115,1,"4:32",1472,1472,"Parker Jackson-Cartwright missed Layup.",32,27,5,0.904100514369543,"Arizona","Oregon",4,4,0,0,9,400988314,2018-01-13
116,1,"4:32",1472,1472,"MiKyle McIntosh Block.",32,27,5,0.904100514369543,"Arizona","Oregon",4,4,0,0,9,400988314,2018-01-13
117,1,"4:32",1472,1472,"Troy Brown Defensive Rebound.",32,27,5,0.904100514369543,"Arizona","Oregon",4,4,0,0,9,400988314,2018-01-13
118,1,"4:11",1451,1451,"Victor Bailey Jr. made Layup. Assisted by Troy Brown.",32,29,3,0.855896051346096,"Arizona","Oregon",4,4,0,0,9,400988314,2018-01-13
119,1,"4:05",1445,1445,"Foul on Allonzo Trier.",32,29,3,0.869346995552319,"Arizona","Oregon",4,4,0,0,9,400988314,2018-01-13
120,1,"4:05",1445,1445,"Allonzo Trier Turnover.",32,29,3,0.869346995552319,"Arizona","Oregon",4,4,0,0,9,400988314,2018-01-13
121,1,"3:59",1439,1439,"MiKyle McIntosh made Layup. Assisted by Troy Brown.",32,31,1,0.81546713556452,"Arizona","Oregon",4,4,0,0,9,400988314,2018-01-13
122,1,"3:40",1420,1420,"Allonzo Trier missed Three Point Jumper.",32,31,1,0.805078875663679,"Arizona","Oregon",4,4,0,0,9,400988314,2018-01-13
123,1,"3:40",1420,1420,"MiKyle McIntosh Defensive Rebound.",32,31,1,0.805078875663679,"Arizona","Oregon",4,4,0,0,9,400988314,2018-01-13
124,1,"3:30",1410,1410,"Elijah Brown missed Three Point Jumper.",32,31,1,0.805856796451306,"Arizona","Oregon",4,4,0,0,9,400988314,2018-01-13
125,1,"3:30",1410,1410,"Dusan Ristic Defensive Rebound.",32,31,1,0.805856796451306,"Arizona","Oregon",4,4,0,0,9,400988314,2018-01-13
126,1,"3:23",1403,1403,"Foul on Abu Kigab.",32,31,1,0.829163075220146,"Arizona","Oregon",4,4,0,0,9,400988314,2018-01-13
127,1,"3:23",1403,1403,"Official TV Timeout",32,31,1,0.829163075220146,"Arizona","Oregon",4,4,0,0,9,400988314,2018-01-13
128,1,"3:23",1403,1403,"Dusan Ristic made Free Throw.",33,31,2,0.850013174307734,"Arizona","Oregon",4,4,0,0,9,400988314,2018-01-13
129,1,"3:23",1403,1403,"Dusan Ristic made Free Throw.",34,31,3,0.868721477247194,"Arizona","Oregon",4,4,0,0,9,400988314,2018-01-13
130,1,"2:55",1375,1375,"MiKyle McIntosh Turnover.",34,31,3,0.85003429781861,"Arizona","Oregon",4,4,0,0,9,400988314,2018-01-13
131,1,"2:47",1367,1367,"Foul on Payton Pritchard.",34,31,3,0.856570227033163,"Arizona","Oregon",4,4,0,0,9,400988314,2018-01-13
132,1,"2:47",1367,1367,"Parker Jackson-Cartwright made Free Throw.",35,31,4,0.874424707278198,"Arizona","Oregon",4,4,0,0,9,400988314,2018-01-13
133,1,"2:47",1367,1367,"Parker Jackson-Cartwright made Free Throw.",36,31,5,0.890341154310022,"Arizona","Oregon",4,4,0,0,9,400988314,2018-01-13
134,1,"2:32",1352,1352,"MiKyle McIntosh missed Three Point Jumper.",36,31,5,0.895346848559709,"Arizona","Oregon",4,4,0,0,9,400988314,2018-01-13
135,1,"2:32",1352,1352,"Deandre Ayton Defensive Rebound.",36,31,5,0.895346848559709,"Arizona","Oregon",4,4,0,0,9,400988314,2018-01-13
136,1,"2:02",1322,1322,"Allonzo Trier missed Three Point Jumper.",36,31,5,0.89089758317736,"Arizona","Oregon",4,4,0,0,9,400988314,2018-01-13
137,1,"2:02",1322,1322,"Payton Pritchard Defensive Rebound.",36,31,5,0.89089758317736,"Arizona","Oregon",4,4,0,0,9,400988314,2018-01-13
138,1,"1:52",1312,1312,"Elijah Brown made Three Point Jumper. Assisted by Payton Pritchard.",36,34,2,0.840601665467697,"Arizona","Oregon",4,4,0,0,9,400988314,2018-01-13
139,1,"1:32",1292,1292,"Deandre Ayton made Layup. Assisted by Parker Jackson-Cartwright.",38,34,4,0.876924081694644,"Arizona","Oregon",4,4,0,0,9,400988314,2018-01-13
140,1,"1:32",1292,1292,"Foul on MiKyle McIntosh.",38,34,4,0.876924081694644,"Arizona","Oregon",4,4,0,0,9,400988314,2018-01-13
141,1,"1:32",1292,1292,"Deandre Ayton made Free Throw.",39,34,5,0.893884697163502,"Arizona","Oregon",4,4,0,0,9,400988314,2018-01-13
142,1,"1:24",1284,1284,"Elijah Brown made Layup.",39,36,3,0.85828279628188,"Arizona","Oregon",4,4,0,0,9,400988314,2018-01-13
143,1,"1:00",1260,1260,"Rawle Alkins missed Three Point Jumper.",39,36,3,0.865426677218428,"Arizona","Oregon",4,4,0,0,9,400988314,2018-01-13
144,1,"1:00",1260,1260,"Arizona Deadball Team Rebound.",39,36,3,0.865426677218428,"Arizona","Oregon",4,4,0,0,9,400988314,2018-01-13
145,1,"0:56",1256,1256,"Foul on Abu Kigab.",39,36,3,0.841313191432877,"Arizona","Oregon",4,4,0,0,9,400988314,2018-01-13
146,1,"0:56",1256,1256,"Deandre Ayton made Free Throw.",40,36,4,0.860512264101374,"Arizona","Oregon",4,4,0,0,9,400988314,2018-01-13
147,1,"0:56",1256,1256,"Deandre Ayton made Free Throw.",41,36,5,0.877726089548376,"Arizona","Oregon",4,4,0,0,9,400988314,2018-01-13
148,1,"0:46",1246,1246,"Payton Pritchard missed Three Point Jumper.",41,36,5,0.889611868921369,"Arizona","Oregon",4,4,0,0,9,400988314,2018-01-13
149,1,"0:46",1246,1246,"Rawle Alkins Defensive Rebound.",41,36,5,0.889611868921369,"Arizona","Oregon",4,4,0,0,9,400988314,2018-01-13
150,1,"0:37",1237,1237,"Rawle Alkins Turnover.",41,36,5,0.882817585381425,"Arizona","Oregon",4,4,0,0,9,400988314,2018-01-13
151,1,"0:37",1237,1237,"MiKyle McIntosh Steal.",41,36,5,0.882817585381425,"Arizona","Oregon",4,4,0,0,9,400988314,2018-01-13
152,1,"0:19",1219,1219,"Roman Sorkin made Layup. Assisted by Troy Brown.",41,38,3,0.847223220577758,"Arizona","Oregon",4,4,0,0,9,400988314,2018-01-13
153,1,"0:11",1211,1211,"Allonzo Trier missed Three Point Jumper.",41,38,3,0.847223220577758,"Arizona","Oregon",4,4,0,0,9,400988314,2018-01-13
154,1,"0:11",1211,1211,"Allonzo Trier Offensive Rebound.",41,38,3,0.847223220577758,"Arizona","Oregon",4,4,0,0,9,400988314,2018-01-13
155,1,"0:07",1207,1207,"Allonzo Trier missed Three Point Jumper.",41,38,3,0.852090774742728,"Arizona","Oregon",4,4,0,0,9,400988314,2018-01-13
156,1,"0:07",1207,1207,"Arizona Deadball Team Rebound.",41,38,3,0.852090774742728,"Arizona","Oregon",4,4,0,0,9,400988314,2018-01-13
157,1,"0:00",1200,1200,"End of 1st half",41,38,3,0.852090774742728,"Arizona","Oregon",4,4,0,0,9,400988314,2018-01-13
158,2,"20:00",1200,1200,"PLAY",41,38,3,0.852090774742728,"Arizona","Oregon",4,4,0,0,9,400988314,2018-01-13
159,2,"20:00",1200,1200,"Jump Ball won by Arizona",41,38,3,0.852090774742728,"Arizona","Oregon",4,4,0,0,9,400988314,2018-01-13
160,2,"19:45",1185,1185,"Rawle Alkins missed Jumper.",41,38,3,0.855132758835678,"Arizona","Oregon",4,4,0,0,9,400988314,2018-01-13
161,2,"19:45",1185,1185,"Kenny Wooten Block.",41,38,3,0.855132758835678,"Arizona","Oregon",4,4,0,0,9,400988314,2018-01-13
162,2,"19:45",1185,1185,"Elijah Brown Defensive Rebound.",41,38,3,0.855132758835678,"Arizona","Oregon",4,4,0,0,9,400988314,2018-01-13
163,2,"19:35",1175,1175,"Troy Brown Turnover.",41,38,3,0.845827882019248,"Arizona","Oregon",4,4,0,0,9,400988314,2018-01-13
164,2,"19:35",1175,1175,"Allonzo Trier Steal.",41,38,3,0.845827882019248,"Arizona","Oregon",4,4,0,0,9,400988314,2018-01-13
165,2,"19:29",1169,1169,"Allonzo Trier made Layup.",43,38,5,0.887233342837916,"Arizona","Oregon",4,4,0,0,9,400988314,2018-01-13
166,2,"18:58",1138,1138,"MiKyle McIntosh missed Jumper.",43,38,5,0.891616527466802,"Arizona","Oregon",4,4,0,0,9,400988314,2018-01-13
167,2,"18:58",1138,1138,"MiKyle McIntosh Offensive Rebound.",43,38,5,0.891616527466802,"Arizona","Oregon",4,4,0,0,9,400988314,2018-01-13
168,2,"18:54",1134,1134,"MiKyle McIntosh made Layup.",43,40,3,0.855916922211481,"Arizona","Oregon",4,4,0,0,9,400988314,2018-01-13
169,2,"18:33",1113,1113,"Foul on MiKyle McIntosh.",43,40,3,0.847115430819613,"Arizona","Oregon",4,4,0,0,9,400988314,2018-01-13
170,2,"18:33",1113,1113,"Deandre Ayton made Free Throw.",44,40,4,0.868198078535289,"Arizona","Oregon",4,4,0,0,9,400988314,2018-01-13
171,2,"18:33",1113,1113,"Deandre Ayton made Free Throw.",45,40,5,0.886762077328492,"Arizona","Oregon",4,4,0,0,9,400988314,2018-01-13
172,2,"18:17",1097,1097,"MiKyle McIntosh missed Layup.",45,40,5,0.894942292060482,"Arizona","Oregon",4,4,0,0,9,400988314,2018-01-13
173,2,"18:17",1097,1097,"Deandre Ayton Block.",45,40,5,0.894942292060482,"Arizona","Oregon",4,4,0,0,9,400988314,2018-01-13
174,2,"18:17",1097,1097,"Deandre Ayton Defensive Rebound.",45,40,5,0.894942292060482,"Arizona","Oregon",4,4,0,0,9,400988314,2018-01-13
175,2,"17:53",1073,1073,"Foul on MiKyle McIntosh.",45,40,5,0.885164177904537,"Arizona","Oregon",4,4,0,0,9,400988314,2018-01-13
176,2,"17:45",1065,1065,"Foul on Kenny Wooten.",45,40,5,0.888107995764222,"Arizona","Oregon",4,4,0,0,9,400988314,2018-01-13
177,2,"17:45",1065,1065,"Allonzo Trier made Free Throw.",46,40,6,0.904129912593821,"Arizona","Oregon",4,4,0,0,9,400988314,2018-01-13
178,2,"17:45",1065,1065,"Allonzo Trier made Free Throw.",47,40,7,0.918069283118271,"Arizona","Oregon",4,4,0,0,9,400988314,2018-01-13
179,2,"17:42",1062,1062,"Foul on Deandre Ayton.",47,40,7,0.918069283118271,"Arizona","Oregon",4,4,0,0,9,400988314,2018-01-13
180,2,"17:29",1049,1049,"Foul on Rawle Alkins.",47,40,7,0.924321769926191,"Arizona","Oregon",4,4,0,0,9,400988314,2018-01-13
181,2,"17:26",1046,1046,"Payton Pritchard missed Three Point Jumper.",47,40,7,0.924321769926191,"Arizona","Oregon",4,4,0,0,9,400988314,2018-01-13
182,2,"17:26",1046,1046,"Deandre Ayton Defensive Rebound.",47,40,7,0.924321769926191,"Arizona","Oregon",4,4,0,0,9,400988314,2018-01-13
183,2,"17:12",1032,1032,"Parker Jackson-Cartwright made Jumper.",49,40,9,0.939492971526152,"Arizona","Oregon",4,4,0,0,9,400988314,2018-01-13
184,2,"17:01",1021,1021,"Troy Brown missed Jumper.",49,40,9,0.944400952956328,"Arizona","Oregon",4,4,0,0,9,400988314,2018-01-13
185,2,"17:01",1021,1021,"Dusan Ristic Defensive Rebound.",49,40,9,0.944400952956328,"Arizona","Oregon",4,4,0,0,9,400988314,2018-01-13
186,2,"16:54",1014,1014,"Deandre Ayton made Dunk. Assisted by Rawle Alkins.",51,40,11,0.95565121798396,"Arizona","Oregon",4,4,0,0,9,400988314,2018-01-13
187,2,"16:43",1003,1003,"Oregon  Timeout",51,40,11,0.958632756611925,"Arizona","Oregon",3,4,1,0,9,400988314,2018-01-13
188,2,"16:32",992,992,"Elijah Brown Turnover.",51,40,11,0.956643659140123,"Arizona","Oregon",3,4,1,0,9,400988314,2018-01-13
189,2,"16:16",976,976,"Rawle Alkins Turnover.",51,40,11,0.960970860091328,"Arizona","Oregon",3,4,1,0,9,400988314,2018-01-13
190,2,"16:16",976,976,"Keith Smith Steal.",51,40,11,0.960970860091328,"Arizona","Oregon",3,4,1,0,9,400988314,2018-01-13
191,2,"16:12",972,972,"Payton Pritchard made Layup.",51,42,9,0.945006059142701,"Arizona","Oregon",3,4,1,0,9,400988314,2018-01-13
192,2,"15:46",946,946,"Foul on Paul White.",51,42,9,0.951520482382379,"Arizona","Oregon",3,4,1,0,9,400988314,2018-01-13
193,2,"15:46",946,946,"Official TV Timeout",51,42,9,0.951520482382379,"Arizona","Oregon",3,4,1,0,9,400988314,2018-01-13
