"play_id","half","time_remaining_half","secs_remaining","secs_remaining_absolute","description","home_score","away_score","score_diff","win_prob","home","away","home_time_out_remaining","away_time_out_remaining","home_timeout_ind","away_timeout_ind","home_favored_by","game_id","date"
1,1,"20:00",2400,2400,"PLAY",0,0,0,0.753398478938886,"LSU","Georgia",4,4,0,0,5,400987314,2018-01-16
2,1,"20:00",2400,2400,"Jump Ball won by Georgia",0,0,0,0.753398478938886,"LSU","Georgia",4,4,0,0,5,400987314,2018-01-16
3,1,"19:44",2384,2384,"Juwan Parker missed Three Point Jumper.",0,0,0,0.749931021039934,"LSU","Georgia",4,4,0,0,5,400987314,2018-01-16
4,1,"19:44",2384,2384,"Aaron Epps Defensive Rebound.",0,0,0,0.749931021039934,"LSU","Georgia",4,4,0,0,5,400987314,2018-01-16
5,1,"19:27",2367,2367,"Duop Reath missed Jumper.",0,0,0,0.73597452869928,"LSU","Georgia",4,4,0,0,5,400987314,2018-01-16
6,1,"19:27",2367,2367,"Derek Ogbeide Defensive Rebound.",0,0,0,0.73597452869928,"LSU","Georgia",4,4,0,0,5,400987314,2018-01-16
7,1,"19:15",2355,2355,"William Jackson II made Jumper.",0,2,-2,0.722466693724128,"LSU","Georgia",4,4,0,0,5,400987314,2018-01-16
8,1,"18:45",2325,2325,"Brandon Sampson made Three Point Jumper. Assisted by Tremont Waters.",3,2,1,0.770557357040779,"LSU","Georgia",4,4,0,0,5,400987314,2018-01-16
9,1,"18:27",2307,2307,"Juwan Parker missed Jumper.",3,2,1,0.751650761498293,"LSU","Georgia",4,4,0,0,5,400987314,2018-01-16
10,1,"18:27",2307,2307,"Skylar Mays Defensive Rebound.",3,2,1,0.751650761498293,"LSU","Georgia",4,4,0,0,5,400987314,2018-01-16
11,1,"18:12",2292,2292,"Skylar Mays missed Jumper.",3,2,1,0.76387604620684,"LSU","Georgia",4,4,0,0,5,400987314,2018-01-16
12,1,"18:12",2292,2292,"William Jackson II Defensive Rebound.",3,2,1,0.76387604620684,"LSU","Georgia",4,4,0,0,5,400987314,2018-01-16
13,1,"17:47",2267,2267,"Yante Maten missed Jumper.",3,2,1,0.770951847020731,"LSU","Georgia",4,4,0,0,5,400987314,2018-01-16
14,1,"17:47",2267,2267,"Skylar Mays Defensive Rebound.",3,2,1,0.770951847020731,"LSU","Georgia",4,4,0,0,5,400987314,2018-01-16
15,1,"17:38",2258,2258,"Foul on Juwan Parker.",3,2,1,0.756328053686255,"LSU","Georgia",4,4,0,0,5,400987314,2018-01-16
16,1,"17:38",2258,2258,"Skylar Mays made Free Throw.",4,2,2,0.773671917792232,"LSU","Georgia",4,4,0,0,5,400987314,2018-01-16
17,1,"17:38",2258,2258,"Skylar Mays made Free Throw.",5,2,3,0.790123857730536,"LSU","Georgia",4,4,0,0,5,400987314,2018-01-16
18,1,"17:14",2234,2234,"Foul on Brandon Sampson.",5,2,3,0.799912253057703,"LSU","Georgia",4,4,0,0,5,400987314,2018-01-16
19,1,"16:58",2218,2218,"Teshaun Hightower made Three Point Jumper. Assisted by William Jackson II.",5,5,0,0.740166689064169,"LSU","Georgia",4,4,0,0,5,400987314,2018-01-16
20,1,"16:48",2208,2208,"Tremont Waters Turnover.",5,5,0,0.739070648139586,"LSU","Georgia",4,4,0,0,5,400987314,2018-01-16
21,1,"16:39",2199,2199,"Derek Ogbeide made Jumper. Assisted by William Jackson II.",5,7,-2,0.703190957689527,"LSU","Georgia",4,4,0,0,5,400987314,2018-01-16
22,1,"16:14",2174,2174,"Duop Reath missed Jumper.",5,7,-2,0.688006268362147,"LSU","Georgia",4,4,0,0,5,400987314,2018-01-16
23,1,"16:14",2174,2174,"Yante Maten Block.",5,7,-2,0.688006268362147,"LSU","Georgia",4,4,0,0,5,400987314,2018-01-16
24,1,"16:14",2174,2174,"LSU Offensive Rebound.",5,7,-2,0.688006268362147,"LSU","Georgia",4,4,0,0,5,400987314,2018-01-16
25,1,"16:09",2169,2169,"Tremont Waters missed Jumper.",5,7,-2,0.688597377399812,"LSU","Georgia",4,4,0,0,5,400987314,2018-01-16
26,1,"16:09",2169,2169,"Yante Maten Defensive Rebound.",5,7,-2,0.688597377399812,"LSU","Georgia",4,4,0,0,5,400987314,2018-01-16
27,1,"16:00",2160,2160,"Teshaun Hightower missed Three Point Jumper.",5,7,-2,0.688597377399812,"LSU","Georgia",4,4,0,0,5,400987314,2018-01-16
28,1,"16:00",2160,2160,"Georgia Deadball Team Rebound.",5,7,-2,0.688597377399812,"LSU","Georgia",4,4,0,0,5,400987314,2018-01-16
29,1,"15:57",2157,2157,"Foul on Duop Reath.",5,7,-2,0.679700311565648,"LSU","Georgia",4,4,0,0,5,400987314,2018-01-16
30,1,"15:57",2157,2157,"Official TV Timeout",5,7,-2,0.679700311565648,"LSU","Georgia",4,4,0,0,5,400987314,2018-01-16
31,1,"15:40",2140,2140,"Yante Maten missed Jumper.",5,7,-2,0.702065412584283,"LSU","Georgia",4,4,0,0,5,400987314,2018-01-16
32,1,"15:40",2140,2140,"Wayde Sims Defensive Rebound.",5,7,-2,0.702065412584283,"LSU","Georgia",4,4,0,0,5,400987314,2018-01-16
33,1,"15:09",2109,2109,"Randy Onwuasor made Jumper.",7,7,0,0.729440167922728,"LSU","Georgia",4,4,0,0,5,400987314,2018-01-16
34,1,"14:39",2079,2079,"Teshaun Hightower made Jumper.",7,9,-2,0.688355165182192,"LSU","Georgia",4,4,0,0,5,400987314,2018-01-16
35,1,"14:10",2050,2050,"Skylar Mays missed Three Point Jumper.",7,9,-2,0.686860624379559,"LSU","Georgia",4,4,0,0,5,400987314,2018-01-16
36,1,"14:10",2050,2050,"Teshaun Hightower Defensive Rebound.",7,9,-2,0.686860624379559,"LSU","Georgia",4,4,0,0,5,400987314,2018-01-16
37,1,"13:53",2033,2033,"Rayshaun Hammonds missed Jumper.",7,9,-2,0.701049217056538,"LSU","Georgia",4,4,0,0,5,400987314,2018-01-16
38,1,"13:53",2033,2033,"Aaron Epps Defensive Rebound.",7,9,-2,0.701049217056538,"LSU","Georgia",4,4,0,0,5,400987314,2018-01-16
39,1,"13:44",2024,2024,"Tremont Waters made Layup.",9,9,0,0.72769055343205,"LSU","Georgia",4,4,0,0,5,400987314,2018-01-16
40,1,"13:14",1994,1994,"Jordan Harris missed Three Point Jumper.",9,9,0,0.730970853839371,"LSU","Georgia",4,4,0,0,5,400987314,2018-01-16
41,1,"13:14",1994,1994,"Tremont Waters Defensive Rebound.",9,9,0,0.730970853839371,"LSU","Georgia",4,4,0,0,5,400987314,2018-01-16
42,1,"13:06",1986,1986,"Daryl Edwards made Three Point Jumper. Assisted by Randy Onwuasor.",12,9,3,0.784301371478984,"LSU","Georgia",4,4,0,0,5,400987314,2018-01-16
43,1,"12:28",1948,1948,"Georgia  Turnover.",12,9,3,0.794116106223174,"LSU","Georgia",4,4,0,0,5,400987314,2018-01-16
44,1,"12:17",1937,1937,"Aaron Epps made Three Point Jumper. Assisted by Tremont Waters.",15,9,6,0.845918321514944,"LSU","Georgia",4,4,0,0,5,400987314,2018-01-16
45,1,"11:46",1906,1906,"Mike Edwards missed Jumper.",15,9,6,0.84305698956976,"LSU","Georgia",4,4,0,0,5,400987314,2018-01-16
46,1,"11:46",1906,1906,"Tremont Waters Defensive Rebound.",15,9,6,0.84305698956976,"LSU","Georgia",4,4,0,0,5,400987314,2018-01-16
47,1,"11:39",1899,1899,"Aaron Epps made Layup. Assisted by Tremont Waters.",17,9,8,0.886120959527885,"LSU","Georgia",4,4,0,0,5,400987314,2018-01-16
48,1,"11:19",1879,1879,"Derek Ogbeide made Jumper. Assisted by William Jackson II.",17,11,6,0.84552810423054,"LSU","Georgia",4,4,0,0,5,400987314,2018-01-16
49,1,"11:04",1864,1864,"Aaron Epps missed Three Point Jumper.",17,11,6,0.85742889990397,"LSU","Georgia",4,4,0,0,5,400987314,2018-01-16
50,1,"11:04",1864,1864,"Rayshaun Hammonds Defensive Rebound.",17,11,6,0.85742889990397,"LSU","Georgia",4,4,0,0,5,400987314,2018-01-16
51,1,"10:42",1842,1842,"Rayshaun Hammonds missed Three Point Jumper.",17,11,6,0.838547965444709,"LSU","Georgia",4,4,0,0,5,400987314,2018-01-16
52,1,"10:42",1842,1842,"Derek Ogbeide Offensive Rebound.",17,11,6,0.838547965444709,"LSU","Georgia",4,4,0,0,5,400987314,2018-01-16
53,1,"10:38",1838,1838,"Foul on Wayde Sims.",17,11,6,0.847504417900329,"LSU","Georgia",4,4,0,0,5,400987314,2018-01-16
54,1,"10:38",1838,1838,"Official TV Timeout",17,11,6,0.847504417900329,"LSU","Georgia",4,4,0,0,5,400987314,2018-01-16
55,1,"10:38",1838,1838,"Derek Ogbeide made Free Throw.",17,12,5,0.830352724501545,"LSU","Georgia",4,4,0,0,5,400987314,2018-01-16
56,1,"10:38",1838,1838,"Derek Ogbeide missed Free Throw.",17,12,5,0.830352724501545,"LSU","Georgia",4,4,0,0,5,400987314,2018-01-16
57,1,"10:38",1838,1838,"Brandon Rachal Defensive Rebound.",17,12,5,0.830352724501545,"LSU","Georgia",4,4,0,0,5,400987314,2018-01-16
58,1,"10:06",1806,1806,"Skylar Mays missed Three Point Jumper.",17,12,5,0.830031600173825,"LSU","Georgia",4,4,0,0,5,400987314,2018-01-16
59,1,"10:06",1806,1806,"Juwan Parker Defensive Rebound.",17,12,5,0.830031600173825,"LSU","Georgia",4,4,0,0,5,400987314,2018-01-16
60,1,"9:56",1796,1796,"Derek Ogbeide made Jumper. Assisted by Teshaun Hightower.",17,14,3,0.78433206020524,"LSU","Georgia",4,4,0,0,5,400987314,2018-01-16
61,1,"9:22",1762,1762,"Daryl Edwards made Layup.",19,14,5,0.837520771027473,"LSU","Georgia",4,4,0,0,5,400987314,2018-01-16
62,1,"8:52",1732,1732,"Foul on Brandon Rachal.",19,14,5,0.835368564327355,"LSU","Georgia",4,4,0,0,5,400987314,2018-01-16
63,1,"8:39",1719,1719,"Derek Ogbeide made Jumper.",19,16,3,0.798486123813486,"LSU","Georgia",4,4,0,0,5,400987314,2018-01-16
64,1,"8:16",1696,1696,"Duop Reath made Jumper. Assisted by Skylar Mays.",21,16,5,0.839154875034451,"LSU","Georgia",4,4,0,0,5,400987314,2018-01-16
65,1,"8:01",1681,1681,"Jordan Harris made Layup.",21,18,3,0.802206786384735,"LSU","Georgia",4,4,0,0,5,400987314,2018-01-16
66,1,"7:47",1667,1667,"Daryl Edwards missed Three Point Jumper.",21,18,3,0.787850647854816,"LSU","Georgia",4,4,0,0,5,400987314,2018-01-16
67,1,"7:47",1667,1667,"Skylar Mays Offensive Rebound.",21,18,3,0.787850647854816,"LSU","Georgia",4,4,0,0,5,400987314,2018-01-16
68,1,"7:33",1653,1653,"Skylar Mays made Layup.",23,18,5,0.829898723463332,"LSU","Georgia",4,4,0,0,5,400987314,2018-01-16
69,1,"7:33",1653,1653,"Yante Maten Turnover.",23,18,5,0.829898723463332,"LSU","Georgia",4,4,0,0,5,400987314,2018-01-16
70,1,"7:33",1653,1653,"Brandon Rachal Steal.",23,18,5,0.829898723463332,"LSU","Georgia",4,4,0,0,5,400987314,2018-01-16
71,1,"7:03",1623,1623,"Jump Ball won by LSU",23,18,5,0.832822459592859,"LSU","Georgia",4,4,0,0,5,400987314,2018-01-16
72,1,"6:47",1607,1607,"Brandon Sampson made Jumper.",25,18,7,0.861508408148169,"LSU","Georgia",4,4,0,0,5,400987314,2018-01-16
73,1,"6:25",1585,1585,"Yante Maten missed Jumper.",25,18,7,0.860357003202937,"LSU","Georgia",4,4,0,0,5,400987314,2018-01-16
74,1,"6:25",1585,1585,"Aaron Epps Block.",25,18,7,0.860357003202937,"LSU","Georgia",4,4,0,0,5,400987314,2018-01-16
75,1,"6:25",1585,1585,"Skylar Mays Defensive Rebound.",25,18,7,0.860357003202937,"LSU","Georgia",4,4,0,0,5,400987314,2018-01-16
76,1,"6:11",1571,1571,"Brandon Sampson missed Jumper.",25,18,7,0.881914947269715,"LSU","Georgia",4,4,0,0,5,400987314,2018-01-16
77,1,"6:11",1571,1571,"William Jackson II Defensive Rebound.",25,18,7,0.881914947269715,"LSU","Georgia",4,4,0,0,5,400987314,2018-01-16
78,1,"6:11",1571,1571,"Foul on Brandon Rachal.",25,18,7,0.881914947269715,"LSU","Georgia",4,4,0,0,5,400987314,2018-01-16
79,1,"5:51",1551,1551,"Tyree Crump missed Three Point Jumper.",25,18,7,0.864226318727724,"LSU","Georgia",4,4,0,0,5,400987314,2018-01-16
80,1,"5:51",1551,1551,"Nicolas Claxton Offensive Rebound.",25,18,7,0.864226318727724,"LSU","Georgia",4,4,0,0,5,400987314,2018-01-16
81,1,"5:51",1551,1551,"Nicolas Claxton made Two Point Tip Shot.",25,20,5,0.826883211818797,"LSU","Georgia",4,4,0,0,5,400987314,2018-01-16
82,1,"5:28",1528,1528,"Tremont Waters made Jumper.",27,20,7,0.867398081687655,"LSU","Georgia",4,4,0,0,5,400987314,2018-01-16
83,1,"5:05",1505,1505,"Tyree Crump missed Three Point Jumper.",27,20,7,0.868013468106216,"LSU","Georgia",4,4,0,0,5,400987314,2018-01-16
84,1,"5:05",1505,1505,"Brandon Sampson Defensive Rebound.",27,20,7,0.868013468106216,"LSU","Georgia",4,4,0,0,5,400987314,2018-01-16
85,1,"4:36",1476,1476,"Foul on Nicolas Claxton.",27,20,7,0.881980541489059,"LSU","Georgia",4,4,0,0,5,400987314,2018-01-16
86,1,"4:36",1476,1476,"Brandon Sampson made Free Throw.",28,20,8,0.896984966653155,"LSU","Georgia",4,4,0,0,5,400987314,2018-01-16
87,1,"4:36",1476,1476,"Brandon Sampson made Free Throw.",29,20,9,0.910275861235275,"LSU","Georgia",4,4,0,0,5,400987314,2018-01-16
88,1,"4:20",1460,1460,"Yante Maten missed Jumper.",29,20,9,0.891976545809195,"LSU","Georgia",4,4,0,0,5,400987314,2018-01-16
89,1,"4:20",1460,1460,"Wayde Sims Block.",29,20,9,0.891976545809195,"LSU","Georgia",4,4,0,0,5,400987314,2018-01-16
90,1,"4:20",1460,1460,"Georgia Offensive Rebound.",29,20,9,0.891976545809195,"LSU","Georgia",4,4,0,0,5,400987314,2018-01-16
91,1,"4:19",1459,1459,"Derek Ogbeide Turnover.",29,20,9,0.89742386307972,"LSU","Georgia",4,4,0,0,5,400987314,2018-01-16
92,1,"4:19",1459,1459,"Skylar Mays Steal.",29,20,9,0.89742386307972,"LSU","Georgia",4,4,0,0,5,400987314,2018-01-16
93,1,"4:10",1450,1450,"Skylar Mays made Three Point Jumper. Assisted by Tremont Waters.",32,20,12,0.931580764904086,"LSU","Georgia",4,4,0,0,5,400987314,2018-01-16
94,1,"3:50",1430,1430,"Teshaun Hightower Turnover.",32,20,12,0.935239639297996,"LSU","Georgia",4,4,0,0,5,400987314,2018-01-16
95,1,"3:50",1430,1430,"Wayde Sims Steal.",32,20,12,0.935239639297996,"LSU","Georgia",4,4,0,0,5,400987314,2018-01-16
96,1,"3:46",1426,1426,"Wayde Sims missed Jumper.",32,20,12,0.927333693685393,"LSU","Georgia",4,4,0,0,5,400987314,2018-01-16
97,1,"3:46",1426,1426,"Yante Maten Block.",32,20,12,0.927333693685393,"LSU","Georgia",4,4,0,0,5,400987314,2018-01-16
98,1,"3:46",1426,1426,"Teshaun Hightower Defensive Rebound.",32,20,12,0.927333693685393,"LSU","Georgia",4,4,0,0,5,400987314,2018-01-16
99,1,"3:30",1410,1410,"Foul on Tremont Waters.",32,20,12,0.935485090723305,"LSU","Georgia",4,4,0,0,5,400987314,2018-01-16
100,1,"3:30",1410,1410,"Official TV Timeout",32,20,12,0.935485090723305,"LSU","Georgia",4,4,0,0,5,400987314,2018-01-16
101,1,"3:22",1402,1402,"Georgia  Timeout",32,20,12,0.942524504831223,"LSU","Georgia",3,4,1,0,5,400987314,2018-01-16
102,1,"3:12",1392,1392,"Foul on Duop Reath.",32,20,12,0.938872894078136,"LSU","Georgia",3,4,1,0,5,400987314,2018-01-16
103,1,"3:12",1392,1392,"Derek Ogbeide missed Free Throw.",32,20,12,0.938872894078136,"LSU","Georgia",3,4,1,0,5,400987314,2018-01-16
104,1,"3:12",1392,1392,"Wayde Sims Defensive Rebound.",32,20,12,0.938872894078136,"LSU","Georgia",3,4,1,0,5,400987314,2018-01-16
105,1,"3:12",1392,1392,"Foul on Rayshaun Hammonds.",32,20,12,0.938872894078136,"LSU","Georgia",3,4,1,0,5,400987314,2018-01-16
106,1,"2:49",1369,1369,"Randy Onwuasor Turnover.",32,20,12,0.936929775053329,"LSU","Georgia",3,4,1,0,5,400987314,2018-01-16
107,1,"2:30",1350,1350,"Yante Maten made Jumper.",32,22,10,0.920636515942412,"LSU","Georgia",3,4,1,0,5,400987314,2018-01-16
108,1,"2:05",1325,1325,"Skylar Mays missed Jumper.",32,22,10,0.918284860480422,"LSU","Georgia",3,4,0,0,5,400987314,2018-01-16
109,1,"2:05",1325,1325,"William Jackson II Defensive Rebound.",32,22,10,0.918284860480422,"LSU","Georgia",3,4,0,0,5,400987314,2018-01-16
110,1,"1:47",1307,1307,"Juwan Parker missed Three Point Jumper.",32,22,10,0.907836963067114,"LSU","Georgia",3,4,0,0,5,400987314,2018-01-16
111,1,"1:47",1307,1307,"Yante Maten Offensive Rebound.",32,22,10,0.907836963067114,"LSU","Georgia",3,4,0,0,5,400987314,2018-01-16
112,1,"1:28",1288,1288,"Derek Ogbeide Turnover.",32,22,10,0.914085882846206,"LSU","Georgia",3,4,0,0,5,400987314,2018-01-16
113,1,"1:03",1263,1263,"Wayde Sims Turnover.",32,22,10,0.92398041656568,"LSU","Georgia",3,4,0,0,5,400987314,2018-01-16
114,1,"1:03",1263,1263,"Rayshaun Hammonds Steal.",32,22,10,0.92398041656568,"LSU","Georgia",3,4,0,0,5,400987314,2018-01-16
115,1,"0:57",1257,1257,"Yante Maten missed Three Point Jumper.",32,22,10,0.908820338146524,"LSU","Georgia",3,4,0,0,5,400987314,2018-01-16
116,1,"0:57",1257,1257,"Wayde Sims Defensive Rebound.",32,22,10,0.908820338146524,"LSU","Georgia",3,4,0,0,5,400987314,2018-01-16
117,1,"0:55",1255,1255,"Foul on Mike Edwards.",32,22,10,0.908820338146524,"LSU","Georgia",3,4,0,0,5,400987314,2018-01-16
118,1,"0:46",1246,1246,"Foul on William Jackson II.",32,22,10,0.916197837557419,"LSU","Georgia",3,4,0,0,5,400987314,2018-01-16
119,1,"0:38",1238,1238,"Brandon Sampson missed Layup.",32,22,10,0.915644641309197,"LSU","Georgia",3,4,0,0,5,400987314,2018-01-16
120,1,"0:38",1238,1238,"Yante Maten Defensive Rebound.",32,22,10,0.915644641309197,"LSU","Georgia",3,4,0,0,5,400987314,2018-01-16
121,1,"0:27",1227,1227,"Yante Maten missed Jumper.",32,22,10,0.925977433480245,"LSU","Georgia",3,4,0,0,5,400987314,2018-01-16
122,1,"0:27",1227,1227,"Yante Maten Offensive Rebound.",32,22,10,0.925977433480245,"LSU","Georgia",3,4,0,0,5,400987314,2018-01-16
123,1,"0:27",1227,1227,"Yante Maten made Two Point Tip Shot.",32,24,8,0.899251970278278,"LSU","Georgia",3,4,0,0,5,400987314,2018-01-16
124,1,"0:06",1206,1206,"Tremont Waters made Jumper.",34,24,10,0.917701860120396,"LSU","Georgia",3,4,0,0,5,400987314,2018-01-16
125,1,"0:00",1200,1200,"End of 1st half",34,24,10,0.917701860120396,"LSU","Georgia",3,4,0,0,5,400987314,2018-01-16
126,2,"20:00",1200,1200,"PLAY",34,24,10,0.917701860120396,"LSU","Georgia",4,4,0,0,5,400987314,2018-01-16
127,2,"20:00",1200,1200,"Jump Ball won by Georgia",34,24,10,0.917701860120396,"LSU","Georgia",4,4,0,0,5,400987314,2018-01-16
128,2,"19:42",1182,1182,"Yante Maten missed Jumper.",34,24,10,0.922494498495697,"LSU","Georgia",4,4,0,0,5,400987314,2018-01-16
129,2,"19:42",1182,1182,"Yante Maten Offensive Rebound.",34,24,10,0.922494498495697,"LSU","Georgia",4,4,0,0,5,400987314,2018-01-16
130,2,"19:34",1174,1174,"Yante Maten made Layup.",34,26,8,0.890893943509297,"LSU","Georgia",4,4,0,0,5,400987314,2018-01-16
131,2,"19:19",1159,1159,"Brandon Sampson missed Three Point Jumper.",34,26,8,0.889738165682663,"LSU","Georgia",4,4,0,0,5,400987314,2018-01-16
132,2,"19:19",1159,1159,"Juwan Parker Defensive Rebound.",34,26,8,0.889738165682663,"LSU","Georgia",4,4,0,0,5,400987314,2018-01-16
133,2,"18:49",1129,1129,"William Jackson II missed Jumper.",34,26,8,0.906232889962802,"LSU","Georgia",4,4,0,0,5,400987314,2018-01-16
134,2,"18:49",1129,1129,"Brandon Sampson Defensive Rebound.",34,26,8,0.906232889962802,"LSU","Georgia",4,4,0,0,5,400987314,2018-01-16
135,2,"18:35",1115,1115,"Skylar Mays missed Three Point Jumper.",34,26,8,0.897281273655461,"LSU","Georgia",4,4,0,0,5,400987314,2018-01-16
136,2,"18:35",1115,1115,"Teshaun Hightower Defensive Rebound.",34,26,8,0.897281273655461,"LSU","Georgia",4,4,0,0,5,400987314,2018-01-16
137,2,"18:25",1105,1105,"Juwan Parker made Jumper.",34,28,6,0.858106342092093,"LSU","Georgia",4,4,0,0,5,400987314,2018-01-16
138,2,"17:58",1078,1078,"Aaron Epps missed Jumper.",34,28,6,0.858950433446087,"LSU","Georgia",4,4,0,0,5,400987314,2018-01-16
139,2,"17:58",1078,1078,"Juwan Parker Defensive Rebound.",34,28,6,0.858950433446087,"LSU","Georgia",4,4,0,0,5,400987314,2018-01-16
140,2,"17:50",1070,1070,"Foul on Duop Reath.",34,28,6,0.858950433446087,"LSU","Georgia",4,4,0,0,5,400987314,2018-01-16
141,2,"17:50",1070,1070,"Teshaun Hightower missed Free Throw.",34,28,6,0.858950433446087,"LSU","Georgia",4,4,0,0,5,400987314,2018-01-16
142,2,"17:50",1070,1070,"Georgia Deadball Team Rebound.",34,28,6,0.858950433446087,"LSU","Georgia",4,4,0,0,5,400987314,2018-01-16
143,2,"17:50",1070,1070,"Teshaun Hightower missed Free Throw.",34,28,6,0.858950433446087,"LSU","Georgia",4,4,0,0,5,400987314,2018-01-16
144,2,"17:46",1066,1066,"Yante Maten Offensive Rebound.",34,28,6,0.863680809154427,"LSU","Georgia",4,4,0,0,5,400987314,2018-01-16
145,2,"17:32",1052,1052,"Yante Maten made Jumper.",34,30,4,0.82196690039196,"LSU","Georgia",4,4,0,0,5,400987314,2018-01-16
146,2,"17:12",1032,1032,"Aaron Epps missed Three Point Jumper.",34,30,4,0.810065923141871,"LSU","Georgia",4,4,0,0,5,400987314,2018-01-16
147,2,"17:12",1032,1032,"William Jackson II Defensive Rebound.",34,30,4,0.810065923141871,"LSU","Georgia",4,4,0,0,5,400987314,2018-01-16
148,2,"16:59",1019,1019,"Juwan Parker made Jumper.",34,32,2,0.734345215015385,"LSU","Georgia",4,4,0,0,5,400987314,2018-01-16
149,2,"16:36",996,996,"Brandon Sampson made Three Point Jumper. Assisted by Skylar Mays.",37,32,5,0.832411933172641,"LSU","Georgia",4,4,0,0,5,400987314,2018-01-16
150,2,"16:03",963,963,"Derek Ogbeide made Dunk. Assisted by William Jackson II.",37,34,3,0.776494573469451,"LSU","Georgia",4,4,0,0,5,400987314,2018-01-16
151,2,"15:37",937,937,"Brandon Sampson missed Layup.",37,34,3,0.786255755950895,"LSU","Georgia",4,4,0,0,5,400987314,2018-01-16
152,2,"15:37",937,937,"Yante Maten Defensive Rebound.",37,34,3,0.786255755950895,"LSU","Georgia",4,4,0,0,5,400987314,2018-01-16
153,2,"15:30",930,930,"Juwan Parker Turnover.",37,34,3,0.786255755950895,"LSU","Georgia",4,4,0,0,5,400987314,2018-01-16
154,2,"15:30",930,930,"Official TV Timeout",37,34,3,0.786255755950895,"LSU","Georgia",4,4,0,0,5,400987314,2018-01-16
155,2,"15:09",909,909,"Tremont Waters Turnover.",37,34,3,0.783635276637296,"LSU","Georgia",4,4,0,0,5,400987314,2018-01-16
156,2,"15:09",909,909,"Teshaun Hightower Steal.",37,34,3,0.783635276637296,"LSU","Georgia",4,4,0,0,5,400987314,2018-01-16
157,2,"14:59",899,899,"Yante Maten made Layup.",37,36,1,0.721922363515302,"LSU","Georgia",4,4,0,0,5,400987314,2018-01-16
158,2,"14:59",899,899,"Foul on Wayde Sims.",37,36,1,0.721922363515302,"LSU","Georgia",4,4,0,0,5,400987314,2018-01-16
159,2,"14:59",899,899,"Yante Maten made Free Throw.",37,37,0,0.681293872126054,"LSU","Georgia",4,4,0,0,5,400987314,2018-01-16
160,2,"14:31",871,871,"Tremont Waters missed Jumper.",37,37,0,0.678552315461846,"LSU","Georgia",4,4,0,0,5,400987314,2018-01-16
161,2,"14:31",871,871,"William Jackson II Defensive Rebound.",37,37,0,0.678552315461846,"LSU","Georgia",4,4,0,0,5,400987314,2018-01-16
162,2,"14:24",864,864,"Foul on Skylar Mays.",37,37,0,0.666227221058692,"LSU","Georgia",4,4,0,0,5,400987314,2018-01-16
163,2,"14:24",864,864,"Teshaun Hightower made Free Throw.",37,38,-1,0.622360483301818,"LSU","Georgia",4,4,0,0,5,400987314,2018-01-16
164,2,"14:24",864,864,"Teshaun Hightower missed Free Throw.",37,38,-1,0.622360483301818,"LSU","Georgia",4,4,0,0,5,400987314,2018-01-16
165,2,"14:24",864,864,"Georgia Offensive Rebound.",37,38,-1,0.622360483301818,"LSU","Georgia",4,4,0,0,5,400987314,2018-01-16
166,2,"14:09",849,849,"William Jackson II missed Jumper.",37,38,-1,0.617086789841538,"LSU","Georgia",4,4,0,0,5,400987314,2018-01-16
167,2,"14:09",849,849,"Duop Reath Defensive Rebound.",37,38,-1,0.617086789841538,"LSU","Georgia",4,4,0,0,5,400987314,2018-01-16
168,2,"13:58",838,838,"Duop Reath missed Jumper.",37,38,-1,0.639019810335405,"LSU","Georgia",4,4,0,0,5,400987314,2018-01-16
169,2,"13:58",838,838,"Duop Reath Offensive Rebound.",37,38,-1,0.639019810335405,"LSU","Georgia",4,4,0,0,5,400987314,2018-01-16
170,2,"13:53",833,833,"Duop Reath made Jumper.",39,38,1,0.727825026124748,"LSU","Georgia",4,4,0,0,5,400987314,2018-01-16
171,2,"13:40",820,820,"Yante Maten missed Jumper.",39,38,1,0.715706055184388,"LSU","Georgia",4,4,0,0,5,400987314,2018-01-16
172,2,"13:40",820,820,"Rayshaun Hammonds Offensive Rebound.",39,38,1,0.715706055184388,"LSU","Georgia",4,4,0,0,5,400987314,2018-01-16
173,2,"13:36",816,816,"Rayshaun Hammonds Turnover.",39,38,1,0.70895810193221,"LSU","Georgia",4,4,0,0,5,400987314,2018-01-16
174,2,"13:08",788,788,"Foul on Rayshaun Hammonds.",39,38,1,0.712026383748653,"LSU","Georgia",4,4,0,0,5,400987314,2018-01-16
175,2,"13:08",788,788,"Randy Onwuasor made Free Throw.",40,38,2,0.752395756604558,"LSU","Georgia",4,4,0,0,5,400987314,2018-01-16
176,2,"13:08",788,788,"Randy Onwuasor made Free Throw.",41,38,3,0.788784707104562,"LSU","Georgia",4,4,0,0,5,400987314,2018-01-16
177,2,"12:54",774,774,"William Jackson II made Three Point Jumper. Assisted by Rayshaun Hammonds.",41,41,0,0.670289686532044,"LSU","Georgia",4,4,0,0,5,400987314,2018-01-16
178,2,"12:33",753,753,"Tremont Waters missed Three Point Jumper.",41,41,0,0.670739706826793,"LSU","Georgia",4,4,0,0,5,400987314,2018-01-16
179,2,"12:33",753,753,"Rayshaun Hammonds Defensive Rebound.",41,41,0,0.670739706826793,"LSU","Georgia",4,4,0,0,5,400987314,2018-01-16
180,2,"12:19",739,739,"Jordan Harris made Three Point Jumper.",41,44,-3,0.507658542108942,"LSU","Georgia",4,4,0,0,5,400987314,2018-01-16
181,2,"11:47",707,707,"Duop Reath missed Jumper.",41,44,-3,0.511310843329047,"LSU","Georgia",4,4,0,0,5,400987314,2018-01-16
182,2,"11:47",707,707,"Yante Maten Block.",41,44,-3,0.511310843329047,"LSU","Georgia",4,4,0,0,5,400987314,2018-01-16
183,2,"11:47",707,707,"Aaron Epps Offensive Rebound.",41,44,-3,0.511310843329047,"LSU","Georgia",4,4,0,0,5,400987314,2018-01-16
184,2,"11:37",697,697,"Daryl Edwards missed Three Point Jumper.",41,44,-3,0.508247584260524,"LSU","Georgia",4,4,0,0,5,400987314,2018-01-16
185,2,"11:37",697,697,"Rayshaun Hammonds Defensive Rebound.",41,44,-3,0.508247584260524,"LSU","Georgia",4,4,0,0,5,400987314,2018-01-16
186,2,"11:32",692,692,"Yante Maten missed Layup.",41,44,-3,0.508247584260524,"LSU","Georgia",4,4,0,0,5,400987314,2018-01-16
187,2,"11:32",692,692,"Aaron Epps Block.",41,44,-3,0.508247584260524,"LSU","Georgia",4,4,0,0,5,400987314,2018-01-16
188,2,"11:32",692,692,"Yante Maten Offensive Rebound.",41,44,-3,0.508247584260524,"LSU","Georgia",4,4,0,0,5,400987314,2018-01-16
189,2,"11:32",692,692,"Foul on Aaron Epps.",41,44,-3,0.508247584260524,"LSU","Georgia",4,4,0,0,5,400987314,2018-01-16
190,2,"11:32",692,692,"Yante Maten made Free Throw.",41,45,-4,0.449005978533843,"LSU","Georgia",4,4,0,0,5,400987314,2018-01-16
191,2,"11:32",692,692,"Yante Maten made Free Throw.",41,46,-5,0.391176666739394,"LSU","Georgia",4,4,0,0,5,400987314,2018-01-16
192,2,"11:21",681,681,"Duop Reath made Jumper.",43,46,-3,0.494989347423622,"LSU","Georgia",4,4,0,0,5,400987314,2018-01-16
193,2,"10:56",656,656,"Rayshaun Hammonds missed Jumper.",43,46,-3,0.49565240850144,"LSU","Georgia",4,4,0,0,5,400987314,2018-01-16
194,2,"10:56",656,656,"Daryl Edwards Defensive Rebound.",43,46,-3,0.49565240850144,"LSU","Georgia",4,4,0,0,5,400987314,2018-01-16
195,2,"10:48",648,648,"Foul on Derek Ogbeide.",43,46,-3,0.486278159472331,"LSU","Georgia",4,4,0,0,5,400987314,2018-01-16
196,2,"10:33",633,633,"Skylar Mays made Layup.",45,46,-1,0.584380461028635,"LSU","Georgia",4,4,0,0,5,400987314,2018-01-16
197,2,"10:19",619,619,"Rayshaun Hammonds Turnover.",45,46,-1,0.584386739419532,"LSU","Georgia",4,4,0,0,5,400987314,2018-01-16
198,2,"10:19",619,619,"Randy Onwuasor Steal.",45,46,-1,0.584386739419532,"LSU","Georgia",4,4,0,0,5,400987314,2018-01-16
199,2,"10:11",611,611,"Daryl Edwards missed Three Point Jumper.",45,46,-1,0.584386739419532,"LSU","Georgia",4,4,0,0,5,400987314,2018-01-16
